scrp_date,scrp_time,genre_en,genre_jp,rank,media_jp,title,comment,link,date_original
2026-01-16,21:15,world,国際,1,ロイター,プーチン氏「世界はより危険に」、ベネズエラやイランには言及せず,151,https://news.yahoo.co.jp/articles/6b44edf5e000b8328fdbb089d8cb7fe93fe4e841,1/16(金) 3:25
2026-01-16,21:15,world,国際,2,TBS NEWS DIG Powered by JNN,中国「春節」の連休　日本への航空便が4割以上減る見通し,92,https://news.yahoo.co.jp/articles/b5793f5ae66e357abf7f0d8d5c0835dd140d560d,1/16(金) 6:19
2026-01-16,21:15,world,国際,3,KOREA WAVE,「反日感情が最高潮」…日本を背けた中国人観光客、ビザ免除で「韓国行き」へ,54,https://news.yahoo.co.jp/articles/d7c7f487f84451335b057a6cda5623d516220111,1/16(金) 5:24
2026-01-16,21:15,world,国際,4,TBS NEWS DIG Powered by JNN,中国外務省　日本とフィリピンの安全保障分野での協力強化に「地域の平和と安定を破壊すべきではない」と反発,37,https://news.yahoo.co.jp/articles/76641521e220de5f9419dc9efdcccdcef039dd63,1/16(金) 18:46
2026-01-16,21:15,world,国際,5,読売新聞オンライン,トランプ氏が中間選挙「行うべきでない」と発言し物議…報道官は「ただの冗談」と説明、食い下がる記者に「真に受けているのはあなたのような人だけ」,31,https://news.yahoo.co.jp/articles/58af9a1d47f03c4a873475c69d67d0065074a552,1/16(金) 16:24
2026-01-16,21:15,world,国際,6,共同通信,中国とカナダ、関税引き下げで合意,27,https://news.yahoo.co.jp/articles/7b76c43d2ce839fa543f4be5fcc3f291534e5d8e,1/16(金) 19:17
2026-01-16,21:15,world,国際,7,共同通信,中国、春節の日本行き便数4割減　2376便が欠航と報道,23,https://news.yahoo.co.jp/articles/36a9c9e5e097adafbbc6c6fa29cd6533c5396025,1/16(金) 18:33
2026-01-16,21:15,world,国際,8,BuzzFeed Japan,トランプ氏がホワイトハウスに新たな改装→庭園に設置されたまさかの看板に評価二分「上品」「安っぽい」,18,https://news.yahoo.co.jp/articles/e46a6fbc9e36730f88adbd504d4938e99bd1e398,1/16(金) 20:10
2026-01-16,21:15,world,国際,9,TBS NEWS DIG Powered by JNN,“実は建設ラッシュ”の北朝鮮に「中国のショベルカー」“制裁破り”で輸出か　中国業者は取材に「私たちに何の関係が？」,17,https://news.yahoo.co.jp/articles/5cdd3adc249fca663969cd5a8dced56f85eb7838,1/16(金) 16:54
2026-01-16,21:15,world,国際,10,日テレNEWS NNN,ベネズエラ野党指導者・マチャド氏「トランプ氏にノーベル平和賞メダルを贈った」　ホワイトハウスで初の会談,17,https://news.yahoo.co.jp/articles/b8c450c9d95265ab9bf92afa5a71d5f1659b5489,1/16(金) 12:04
2026-01-16,21:15,world,国際,11,ニューズウィーク日本版,上野公園「トイレ騒動」に見る、日本のトイレが「世界一危険」な理由,16,https://news.yahoo.co.jp/articles/f905ebe1d2184a08c99da465b020bfff4d9f5115,1/16(金) 18:30
2026-01-16,21:15,world,国際,12,共同通信,伊首相、高市氏と親密強調　Xにツーショット写真,15,https://news.yahoo.co.jp/articles/aa301aa7098c8c2a60e988af322736c67611f4b2,1/16(金) 19:27
2026-01-16,21:15,world,国際,13,共同通信,「アイスランド52番目の州に」冗談を謝罪,15,https://news.yahoo.co.jp/articles/778a6b6dc735e3fe91a10515a4c9da8b09bf8e79,1/16(金) 11:22
2026-01-16,21:15,world,国際,14,BBC News,ノーベル平和賞メダルをトランプ氏に「贈呈」、ヴェネズエラの野党指導者マチャド氏　ホワイトハウスでの会談で,15,https://news.yahoo.co.jp/articles/df21db6bc53452adf841be0d0dd2f75cb88e3afa,1/16(金) 15:26
2026-01-16,21:15,world,国際,15,FNNプライムオンライン（フジテレビ系）,「おにぎりも寿司も日本がオリジナル」フランス・パリ訪問の鈴木農水相　コメ輸出拡大へ販路拡大に努力行うと強調,15,https://news.yahoo.co.jp/articles/07fc662e78c95166aa9c5c15d1810f9f9a6675e8,1/16(金) 15:36
2026-01-16,21:15,world,国際,16,Wedge（ウェッジ）,ロシア経済の減速が鮮明なのに、戦争を続けられる２つの理由、「要塞経済」を固めるプーチンの戦略,15,https://news.yahoo.co.jp/articles/2b201be26b1f764ce17433e2665b75d1018a629f,1/16(金) 5:00
2026-01-16,21:15,world,国際,17,NEWSポストセブン,「問題がある者を叩け。ただし殺すな」拷問に人身売買、ロマンス詐欺も… “アジア最大の在カンボジア犯罪組織”トップの中国人が「都内15億超えの高級マンション」に拠点,14,https://news.yahoo.co.jp/articles/5f8c87022976d7d106730a5ea402de01cd957eba,1/16(金) 11:15
2026-01-16,21:15,world,国際,18,TBS NEWS DIG Powered by JNN,「トランプ大統領にノーベル平和賞のメダル贈った」ベネズエラ野党指導者マリア・コリナ・マチャド氏がトランプ氏と初会談,14,https://news.yahoo.co.jp/articles/af52bac307ff4b1d60bfa66eb1289419ea39511a,1/16(金) 6:17
2026-01-16,21:15,world,国際,19,時事通信,中国、カナダと関係改善加速　高関税引き下げを確認　トランプ政権念頭に首脳会談,14,https://news.yahoo.co.jp/articles/a5632ba242163a5e1e81063b163b910d677f3de7,1/16(金) 17:37
2026-01-16,21:15,world,国際,20,中央日報日本語版,「日産からテスラに乗り換えた」…韓国市場で苦戦する日本車,14,https://news.yahoo.co.jp/articles/242e9165170cb6cba4860f0b63b7a30cf5958b6a,1/16(金) 11:58
2026-01-16,21:15,world,国際,21,日テレNEWS NNN,贈り物は「ノーベル平和賞のメダル」“笑顔”のトランプ大統領,13,https://news.yahoo.co.jp/articles/5f24ef02f0557fd6fe4f36d5ff36b72fa4986724,1/16(金) 19:03
2026-01-16,21:15,world,国際,22,FNNプライムオンライン（フジテレビ系）,「すごくおいしい」ヨーロッパで「日本米」ブーム!おにぎり専門店が続々登場…鈴木農水相も現地で販売拡大アピール,12,https://news.yahoo.co.jp/articles/a5aedee5449311fab2006b1bfbdc08191faf5fff,1/16(金) 17:45
2026-01-16,21:15,world,国際,23,読売新聞オンライン,米、西半球の覇権確立へ強硬姿勢…グリーンランド領有主張はレアアース狙いか,12,https://news.yahoo.co.jp/articles/90b95a0aecd8d1bf22b441c123c26d7a7a14c58b,1/16(金) 7:26
2026-01-16,21:15,world,国際,24,テレビ朝日系（ANN）,「ノーベル平和賞のメダル贈った」　トランプ氏とベネズエラ野党指導者マチャド氏会談,10,https://news.yahoo.co.jp/articles/73ba57c6194ae769ab19c26cc75f2b24a97ed948,1/16(金) 8:04
2026-01-16,21:15,world,国際,25,時事通信,トランプ氏、軍動員を警告　ミネアポリスのデモ激化で,10,https://news.yahoo.co.jp/articles/08334f96645aa261471ef412643196827f27251f,1/16(金) 6:51
2026-01-16,21:15,world,国際,26,クーリエ・ジャポン,「大変チャーミングかつ非常に巧みな演出」─高市首相の「ドラム外交」を米政治学者が評価,10,https://news.yahoo.co.jp/articles/64194dcd25c9e550e5119ecb69fdee3c6a317444,1/16(金) 12:00
2026-01-16,21:15,world,国際,27,共同通信,中国とカナダの首相、北京で会談　関係改善で貿易拡大図る,10,https://news.yahoo.co.jp/articles/c6e610653c7fe64581ab3cafc5e417cafa729fa1,1/15(木) 21:12
2026-01-16,21:15,world,国際,28,AP通信,米移民関税局員が膝で顔を殴打　移民取り締まり続くミネソタ州,9,https://news.yahoo.co.jp/articles/15115958f3926878b20b25b06c0cb0fd121ceece,1/16(金) 14:53
2026-01-16,21:15,world,国際,29,中央日報日本語版,トランプ氏に「中指」立てさせたフォード従業員、停職処分,9,https://news.yahoo.co.jp/articles/c74ba282cc00316397b141264a8e4d9c7366d2d3,1/16(金) 8:24
2026-01-16,21:15,world,国際,30,中央日報日本語版,ノーベル賞にこだわるトランプ氏に正規メダル贈呈…マチャド氏、歓心を買う狙いか,9,https://news.yahoo.co.jp/articles/34cde093bc869f7bb1af5688e23b6057ec4084af,1/16(金) 15:18
2026-01-16,21:15,world,国際,31,BUSINESS INSIDER JAPAN,イーロン・マスクは中国が「AIコンピューティングにおいて世界を凌駕する」と見ている（海外）,9,https://news.yahoo.co.jp/articles/c7935308141d27310825dab27b3870e6cf253f5f,1/16(金) 7:10
2026-01-16,21:15,world,国際,32,ロイター,ベネズエラ野党指導者マチャド氏、ノーベル賞メダルをトランプ氏に贈呈　支持取り付けたい思惑か,9,https://news.yahoo.co.jp/articles/18861d066678768f8cca801586af6473396dc823,1/16(金) 14:52
2026-01-16,21:15,world,国際,33,共同通信,米政府、平和賞メダル贈与認める,9,https://news.yahoo.co.jp/articles/361fc705b7d4beaee33fed10f3b85bb88451512e,1/16(金) 7:35
2026-01-16,21:15,world,国際,34,時事通信,米軍準機関紙の編集に介入　トランプ政権、独立性に危機,8,https://news.yahoo.co.jp/articles/ada8008f671d17ef87022b2e8c5845b9e53fb86f,1/16(金) 20:32
2026-01-16,21:15,world,国際,35,時事通信,自民・麻生氏、韓国大統領と会談　戦略的連携強化で一致,8,https://news.yahoo.co.jp/articles/031cc12a41a3111c2d25589f21f4613f38c3d88b,1/16(金) 19:44
2026-01-16,21:15,world,国際,36,CNN.co.jp,トランプ氏が攻撃をちらつかせる国　石油産出量はベネズエラの3倍,8,https://news.yahoo.co.jp/articles/dac5f54e6894b7637f375f258465e47051002352,1/16(金) 18:00
2026-01-16,21:15,world,国際,37,TBS NEWS DIG Powered by JNN,イラン情勢めぐり国連安保理が緊急会合　米大使“虐殺止めるためならあらゆる手段排除しない”　イスラエル首相が「攻撃延期」要請と報道も,8,https://news.yahoo.co.jp/articles/3752898245b2217ae75cbe5c15895eb94e1e580c,1/16(金) 11:53
2026-01-16,21:15,world,国際,38,毎日新聞,グリーンランドへの欧部隊派遣「トランプ氏の意思決定に影響なし」,8,https://news.yahoo.co.jp/articles/6b73de79bc4d2ba65cf653e5e73e9dda32b854da,1/16(金) 7:10
2026-01-16,21:15,world,国際,39,テレビ朝日系（ANN）,野心を見せるアメリカ　あおるロシア…“グリーンランド領有”めぐり会談も…対立,8,https://news.yahoo.co.jp/articles/90670ad539c413ba433f29a557f9778889b7c88f,1/16(金) 2:12
2026-01-16,21:15,world,国際,40,産経新聞,対米摩擦の中国・カナダが首脳会談　習氏、関係強化呼びかけ「多国間主義の実践を」,8,https://news.yahoo.co.jp/articles/50ec47a18e6cf14a0826f47acf756d338ae6d6cf,1/16(金) 16:41
