scrp_date,scrp_time,genre_en,genre_jp,rank,media_jp,title,comment,link,date_original
2025-04-21,04:06,TTL,総合,1,読売新聞オンライン,名目ＧＤＰ１０００兆円可能、時給５３６６円の見込みも…１５年後の成長シナリオ公表へ,433,https://news.yahoo.co.jp/articles/cd52ab91b46c7f89a8a78cee7093209314596b60,4/20(日) 17:38
2025-04-21,04:06,TTL,総合,2,スポニチアネックス,石破首相「国民の負担が減るように」物価高対策で夏の電気代補助、ガソリン価格引き下げに意欲,309,https://news.yahoo.co.jp/articles/535e9a7b1ef7cb40dc21517041999a7305b158c9,4/20(日) 16:54
2025-04-21,04:06,TTL,総合,3,スポニチアネックス,SHELLY　オーストラリアへの移住を発表「環境が整い今おもいきって動くことに」仕事は継続へ,218,https://news.yahoo.co.jp/articles/008b5234000d669c114402de8fbd1c3be5f64a23,4/20(日) 18:10
2025-04-21,04:06,TTL,総合,4,共同通信,首相、電気・ガス代補助に意欲　自動車の非関税障壁、対応を検討,209,https://news.yahoo.co.jp/articles/7ffc0843fa4573ebeb149502f6f461bac1a2af16,4/20(日) 10:35
2025-04-21,04:06,TTL,総合,5,時事通信,コメ高騰であの手この手　ムギ入り弁当、外国産米販売も　小売り各社,185,https://news.yahoo.co.jp/articles/b80ea41f7f5037ace5d0851029cdc89fa1efed86,4/20(日) 19:02
2025-04-21,04:06,TTL,総合,6,スポニチアネックス,橋下徹氏　生放送で“挑発”「万博を批判してた人達、もっともっと批判してください。ちょっと静かですよ」,174,https://news.yahoo.co.jp/articles/0c6c046397a188750f3122b9b416e1fdc009e620,4/20(日) 11:22
2025-04-21,04:06,TTL,総合,7,産経新聞,「南京大虐殺記念館」のある中国へ修学旅行　維新西田氏「行かせられない」岩屋外相は反論,159,https://news.yahoo.co.jp/articles/1f7329b863f12cbc4383e8f27d2a24b31974846c,4/20(日) 7:00
2025-04-21,04:06,TTL,総合,8,テレビ朝日系（ANN）,深刻化する“ペイハラ”対策は　広末さん逮捕で関心高まる,144,https://news.yahoo.co.jp/articles/61de83242bb5a3025f522fe246dd02b43803d56c,4/20(日) 18:57
2025-04-21,04:06,TTL,総合,9,All About,まるで脅し？ PTA非会員家庭の子ども差別「登校班から外れてもらう」「記念品をあげない」圧力も,124,https://news.yahoo.co.jp/articles/d9f5783bc48f65fb453290cd11782436a57a30b0,4/20(日) 21:15
2025-04-21,04:06,TTL,総合,10,スポニチアネックス,阪神　藤川監督が激高　8回に坂本への頭部死球　一塁ベンチ飛び出して広島側に声を荒げる,123,https://news.yahoo.co.jp/articles/aab2f9eb566d2f89160fb2e4cf2bc6d1979f8721,4/20(日) 16:58
2025-04-21,04:06,TTL,総合,11,スポーツ報知,【広島】危険球で一触即発　新井貴浩監督「こちらは当ててしまった方。申し訳ない」藤井ヘッドコーチが状況説明,122,https://news.yahoo.co.jp/articles/6e231e91184973f0c1a3f9e2dcb57b7bf26e3741,4/20(日) 18:21
2025-04-21,04:06,TTL,総合,12,東洋経済オンライン,京都で”1泊2食付き”をやめる旅館が続出。「素泊まり」「飲食店の予約代行」にシフトの背景には外国人観光客の≪正直な本音≫があった,120,https://news.yahoo.co.jp/articles/746e3274371428c26e16b42b2d0a3d099edff80b,4/20(日) 5:02
2025-04-21,04:06,TTL,総合,13,TBS NEWS DIG Powered by JNN,石破総理「世界のモデルを目指したい」　日米関税交渉　トランプ大統領の交渉優先順位は「貿易赤字」との認識示す,119,https://news.yahoo.co.jp/articles/e8675401915b4246854f688316d86fddf562d895,4/20(日) 10:53
2025-04-21,04:06,TTL,総合,14,FNNプライムオンライン（フジテレビ系）,消費減税の是非「決める時は決める」立憲・野田代表　早期に結論出す考え　ダブル選巡り「衆院は常在戦場」,104,https://news.yahoo.co.jp/articles/4da5299bd52ae9542506c09daffd50889954b1f3,4/20(日) 15:28
2025-04-21,04:06,TTL,総合,15,SmartFLASH,和田アキ子、大谷翔平の「第1子誕生コメント」を“他人が作った”決めつけに視聴者激怒…真美子夫人の“正体”ポロリで大炎上の“因縁”も,99,https://news.yahoo.co.jp/articles/4a34f4e7a1b8d2d76997275c905e79afe80cf617,4/20(日) 19:17
2025-04-21,04:06,TTL,総合,16,日刊スポーツ,和田アキ子、大谷長女誕生報告コメへの見解めぐり”謝罪”「失礼いたしました」,98,https://news.yahoo.co.jp/articles/8dfca213b16d56716a3f8248cdeee9dbc00f6eff,4/20(日) 13:39
2025-04-21,04:06,TTL,総合,17,産経新聞,ロシア「ウクライナが攻撃継続」と主張　双方が違反を非難、「復活祭停戦」機能せず,96,https://news.yahoo.co.jp/articles/46438a9042fbdc1d45ed68bd204910322f5f402a,4/20(日) 22:28
2025-04-21,04:06,TTL,総合,18,東スポWEB,【Ｆ１】角田裕毅 いきなりクラッシュでリタイア…海外では批判報道も「ガスリーに衝突したことが原因」,94,https://news.yahoo.co.jp/articles/da222cb7484d2642a7d40959a5a9d064042d9405,4/21(月) 2:46
2025-04-21,04:06,TTL,総合,19,デイリースポーツ,甲子園で一触即発　阪神・藤川監督が激高　広島ベンチに「来い！」とファイティングポーズ、コーチらに止められる　坂本への頭部死球を巡り,94,https://news.yahoo.co.jp/articles/2a215ea27e33a8f0925cde11342beee84a52815c,4/20(日) 16:49
2025-04-21,04:06,TTL,総合,20,TBS NEWS DIG Powered by JNN,「え!マジですか」トランプ関税に揺れる“半導体”の製造現場　取材中に突然電話「発注減る可能性」に困惑隠せぬ日本企業【サンデーモーニング】,93,https://news.yahoo.co.jp/articles/0b22941400d2fef718477ed1cf0bb860812d93d1,4/20(日) 14:34
2025-04-21,04:06,TTL,総合,21,スポニチアネックス,有吉弘行、レジの人座らせてあげたら？論争で持論「全然座ってもらってかまわない」,91,https://news.yahoo.co.jp/articles/6e2156db1b0e60108db8d6c7f04d079701c41053,4/20(日) 21:07
2025-04-21,04:06,TTL,総合,22,ENCOUNT,「受け止める」が「受け入れない」…斎藤元彦知事の第三者委「拒絶」が招く「地方自治の危機」,88,https://news.yahoo.co.jp/articles/328e9b1377a9e05baf46b380be83b8d0185a0777,4/20(日) 19:01
2025-04-21,04:06,TTL,総合,23,Yahoo!ニュース オリジナル 特集,自分が「ひきこもり」とは思っていなかった――約40年間の自宅生活から就労した男性を変えた「縁」 ＃老いる社会,85,https://news.yahoo.co.jp/articles/46689b0201bb7e7622c0bc2c1d283510559663f9,4/20(日) 18:00
2025-04-21,04:06,TTL,総合,24,スポーツ報知,大谷翔平がパパに！　真美子夫人第１子の女児出産をインスタグラムで発表「Welcome to the Ohtani Family!」,81,https://news.yahoo.co.jp/articles/5becb173c23408a14478ce1f48e6b25f2283713f,4/20(日) 5:08
2025-04-21,04:06,TTL,総合,25,デイリー新潮,まさか、フジ取締役に「旧ジャニ社長」の名前　「ギャラの折り合いをどう付けるのか」,80,https://news.yahoo.co.jp/articles/281df8fa3ba54b504c3d0b365863cbf2e95e2562,4/20(日) 11:14
2025-04-21,04:06,TTL,総合,26,AERA DIGITAL,おみくじ箱を「おもちゃ」に、鳥居でダンス…インバウンド客の「不敬行為」に悩む神社の本音,78,https://news.yahoo.co.jp/articles/0e6d0f806eb3d5fac796509c5cb0dbe7536b67b9,4/20(日) 11:32
2025-04-21,04:06,TTL,総合,27,TBS NEWS DIG Powered by JNN,小泉進次郎氏「自民が何をやりたい政党か 総理主導で発信を」石破総理に注文,76,https://news.yahoo.co.jp/articles/1fe074777a38c6d95e8bfe7bca0b50d4645a3ed3,4/20(日) 11:28
2025-04-21,04:06,TTL,総合,28,TBS NEWS DIG Powered by JNN,【巨人】今季初のサヨナラ負けで3位転落...戸田が延長10回2死二・三塁から伏兵・伊藤にV打を浴びる 10回の攻撃で2死満塁は無得点,76,https://news.yahoo.co.jp/articles/e2f10d472eeece252703ddf56ebb87927b95c7b6,4/20(日) 21:54
2025-04-21,04:06,TTL,総合,29,with online,有村藍里「整形前に顔が戻っている」「劣化した」というコメントに、私が思うこと,75,https://news.yahoo.co.jp/articles/5e810ce375078ba1c2c3c7206709136cabc5babc,4/20(日) 11:01
2025-04-21,04:06,TTL,総合,30,Full-Count,記者席にこだました「What？」　大谷翔平の長女誕生報告に現場騒然…米記者も興奮,73,https://news.yahoo.co.jp/articles/4b25f68b68dcfc62a065464a9aae114d67557140,4/20(日) 5:47
2025-04-21,04:06,TTL,総合,31,ENCOUNT,とんねるずの芸風「私は大っ嫌い」　大御所芸人が告白「関西やからかなあ」「笑いが分からない」,71,https://news.yahoo.co.jp/articles/bcfd065de1c7e1cf49f0f7d830f128e4d19ebd74,4/20(日) 13:36
2025-04-21,04:06,TTL,総合,32,スポニチアネックス,宮沢博行氏　自民党政権下の減税実現に否定的「自民党が政権のうちは実現しないと」「バックには…」,71,https://news.yahoo.co.jp/articles/00efc67e84f2716bd621df1bcb47e5bf4b64f953,4/20(日) 21:11
2025-04-21,04:06,TTL,総合,33,日刊スポーツ,立民野田代表「民主主義が分かっていない」参院選投開票日「３連休中日」7・20の可能性に苦言,70,https://news.yahoo.co.jp/articles/8ee063c65c295192b012b515718256000fd6ac30,4/20(日) 15:44
2025-04-21,04:06,TTL,総合,34,マネーポストWEB,石破政権に与野党から「減税包囲網」が敷かれるも“増税マフィア”が巻き返し工作　財務省は「給付金なら次の選挙でも配れるが減税すると配れない」と政治家を説得,69,https://news.yahoo.co.jp/articles/2aeab01c6e5f03f0c17f212527cafce465268c0b,4/20(日) 7:16
2025-04-21,04:06,TTL,総合,35,中日スポーツ,大谷翔平、21日のレンジャーズ戦復帰決定、球団発表…「父親リスト」から外れる、ロサリオがDFA,69,https://news.yahoo.co.jp/articles/af8818161b8bb1bdc65983259ea58fc0f101bde3,4/20(日) 23:59
2025-04-21,04:06,TTL,総合,36,日本海テレビ,草刈りをしていた50代男性が熱中症の疑い　心肺停止の状態で搬送　地区の草刈り作業に参加　倉吉市では5月中旬の気温に　鳥取県倉吉市,61,https://news.yahoo.co.jp/articles/fd7b6afb26aec2716d3cfa66aad088323287e4be,4/20(日) 19:21
2025-04-21,04:06,TTL,総合,37,スポニチアネックス,【柔道皇后杯】角田夏実　去就明言せず　「まだまだ勝負の世界にいたい」改めて感じた現役への思い,59,https://news.yahoo.co.jp/articles/cb815c351488bbd457771e38af486f878ea9734c,4/20(日) 21:28
2025-04-21,04:06,TTL,総合,38,RONSPO,泥沼5連敗で最下位のソフトバンクはトレードなどの緊急補強をすべきか…近藤、柳田、正木ら主力の故障離脱続出で西武の隅田に0－1完封負け,58,https://news.yahoo.co.jp/articles/9b747c0384a12ba018087c281712cf8a5136d2cd,4/20(日) 7:07
2025-04-21,04:06,TTL,総合,39,ABEMA TIMES,「バラマキ」or「消費税減税」今後どうなる？元議員が明言「バックに財務省がいるから減税は実現しない」,58,https://news.yahoo.co.jp/articles/b17a4bb43e45e1c8ef5548f98207d90142cbde8e,4/20(日) 17:51
2025-04-21,04:06,TTL,総合,40,日テレNEWS NNN,【速報】埼玉・戸田市議会議員の渡辺塁容疑者を公職選挙法違反（買収）の疑いで逮捕　埼玉県警,56,https://news.yahoo.co.jp/articles/a43f9390b7dea8eb559483e0584f73d84dfc2e4a,4/20(日) 15:03
