scrp_date,scrp_time,genre_en,genre_jp,rank,media_jp,title,comment,link,date_original
2025-01-30,13:08,domestic,国内,1,朝日新聞デジタル,道路陥没が拡大、一つの大きな穴に　埼玉県、水は河川に「緊急放流」,618,https://news.yahoo.co.jp/articles/510b8f924d86189e5ed65e0a1ebbc4d4c4dae098,1/30(木) 11:02
2025-01-30,13:08,domestic,国内,2,共同通信,外務省、国連委に対抗措置　皇室典範の改正勧告巡り,351,https://news.yahoo.co.jp/articles/13066db168df1d54199a2a88d73771c9a0d07785,1/29(水) 17:51
2025-01-30,13:08,domestic,国内,3,週刊金曜日,在日クルド人へのヘイトデモ禁止をさいたま地裁が決定　「大きな一歩」喜びの声,291,https://news.yahoo.co.jp/articles/ba8b768f6bc83ed2ba792940dde4b1287091800b,1/30(木) 11:10
2025-01-30,13:08,domestic,国内,4,毎日新聞,旧安倍派元会計責任者の参考人招致　野党賛成多数で議決　衆院予算委,227,https://news.yahoo.co.jp/articles/b272566a3a19ef8a86367a55e6e7392ba4fa0dbf,1/30(木) 9:04
2025-01-30,13:08,domestic,国内,5,産経新聞,空自音楽隊コンサートが突然中止に　反対派の圧力か、県教組が直前に中止要請,225,https://news.yahoo.co.jp/articles/f286a7f56d31ccaec76e566f2db3a1a4983bfa40,1/29(水) 21:07
2025-01-30,13:08,domestic,国内,6,TBS NEWS DIG Powered by JNN,中居正広さん女性トラブル、文春“訂正”の波紋　街の人「納得できない」「メディア不信に」 フジテレビは「第三者委の調査に委ねる」【news23】,185,https://news.yahoo.co.jp/articles/dd99e327690a49c14f57581913a816d8aa6de015,1/30(木) 12:13
2025-01-30,13:08,domestic,国内,7,共同通信,袴田さん2億円超の刑事補償請求　47年7カ月間拘束,182,https://news.yahoo.co.jp/articles/358a7eff7cc682925b21c843f90d63440f166e86,1/29(水) 17:16
2025-01-30,13:08,domestic,国内,8,共同通信,八潮の道路陥没、穴の範囲拡大　発生3日目、男性の救助続く,179,https://news.yahoo.co.jp/articles/dcb6f83a23480b1a8510f0b29c36f41fa2b45082,1/30(木) 4:20
2025-01-30,13:08,domestic,国内,9,FNNプライムオンライン（フジテレビ系）,「風俗で一生働くか、山に埋められるか選べ」「俺はヤクザだ」SNSで知り合った10代女性を脅し性的暴行加えた疑い　吉岡欧樹容疑者（58）逮捕　警視庁,178,https://news.yahoo.co.jp/articles/4618fb940d7bcd442e17aa1e09d57fe6a45a72b0,1/30(木) 9:49
2025-01-30,13:08,domestic,国内,10,デイリー新潮,議員宿舎に「見知らぬ女性が侵入」　ビザ緩和で渦中の「岩屋外務大臣」を襲った“重大事件”…一歩間違えば“命の危険”も,128,https://news.yahoo.co.jp/articles/f003d6564006faf6d6fc08cbdf6cf13066abcb27,1/30(木) 11:11
2025-01-30,13:08,domestic,国内,11,TBS NEWS DIG Powered by JNN,石破総理「2025年度の個人消費は0.1ポイント程度押し上げ」見通し示す 「年収103万円の壁」引き上げなどで,126,https://news.yahoo.co.jp/articles/71e8314613dc0fd1eee2cd64467a1957b96f7f4e,1/29(水) 14:49
2025-01-30,13:08,domestic,国内,12,MBSニュース,"フジ会見欠席の日枝久相談役...かつて創業者一族の「右腕」で1988年に社長就任""絶対権力者""に　専門家は「日枝氏がフジサンケイグループ代表も含め完全引退するか」に注目",112,https://news.yahoo.co.jp/articles/366117818cc71fa6261a1255a8569550c7aaac2e,1/30(木) 7:02
2025-01-30,13:08,domestic,国内,13,日刊スポーツ,岩田明子氏、文春記事訂正に「どこまで堅い情報があったのか」「ちゃんと説明してほしい」,100,https://news.yahoo.co.jp/articles/0fbbed505ace419948c2fe4c9eb9aeaf71ab4e5b,1/30(木) 11:55
2025-01-30,13:08,domestic,国内,14,J-CASTニュース,「お前ばかか？」千代田区長選討論配信で「政治団体Q」黒川敦彦氏が暴言＆接触　退場なしに女性候補者が怒り,99,https://news.yahoo.co.jp/articles/e109b299ef7046b65f1ecb152e9e2ffefa29b024,1/30(木) 10:50
2025-01-30,13:08,domestic,国内,15,J-CASTニュース,残った給食でまかない調理→減給にSNS賛否　実は「先に取り分けて...」京都市教委明かす処分理由,94,https://news.yahoo.co.jp/articles/f9beccd731949ed2d1e0abc11751bb5674fc6583,1/29(水) 16:50
2025-01-30,13:08,domestic,国内,16,FNNプライムオンライン（フジテレビ系）,【速報】政府がフジテレビへの広告出稿見合わせ　番組制作協力は個別に対応検討,89,https://news.yahoo.co.jp/articles/2d621463c58717d658fc89ae6526804484471724,1/30(木) 11:17
2025-01-30,13:08,domestic,国内,17,TBS NEWS DIG Powered by JNN,【速報】埼玉県八潮市の道路陥没事故　新方川へ汚水の緊急放流開始　県「飲み水への影響はない」,86,https://news.yahoo.co.jp/articles/0f4008374f466f1a99f92d32f5da405f95b2c17d,1/29(水) 22:37
2025-01-30,13:08,domestic,国内,18,テレビ朝日系（ANN）,広告出稿はすべて取りやめ　政府 フジテレビへの対応,86,https://news.yahoo.co.jp/articles/8c7b17d27adbb49723d4908f24a91ee495cabc3b,1/30(木) 12:00
2025-01-30,13:08,domestic,国内,19,日刊スポーツ,古市憲寿氏「記者としてあり得ない」フジ会見での一部記者を批判、岩田明子氏も厳しく指摘,83,https://news.yahoo.co.jp/articles/104a6208d90cd22739d773461c3019eb300ca678,1/30(木) 12:06
2025-01-30,13:08,domestic,国内,20,共同通信,【独自】卓球の丹羽孝希選手、書類送検　オンラインカジノ賭博疑い,81,https://news.yahoo.co.jp/articles/25f7a2df0b9435d4027f99d2cc64281b679bbdcb,1/29(水) 21:04
2025-01-30,13:08,domestic,国内,21,朝日新聞デジタル,「接客対応が悪い」、出禁のスーパーで15分間怒鳴った疑いで男逮捕,75,https://news.yahoo.co.jp/articles/80eb75a4cea7c088cf2fa7fb66f7b908c1dbd311,1/30(木) 12:10
2025-01-30,13:08,domestic,国内,22,毎日新聞,わいせつ被害後も加害隊員の接触禁じず　元空自女性隊員が国を提訴,73,https://news.yahoo.co.jp/articles/a63e7fb264ed74b12bbc10cfd937e228a334f0df,1/30(木) 5:00
2025-01-30,13:08,domestic,国内,23,TBS NEWS DIG Powered by JNN,【速報】約13時間ぶりに救助活動再開　埼玉・八潮市の道路陥没で転落したトラックの男性運転手の安否不明,65,https://news.yahoo.co.jp/articles/848cf69ed6a0572fc2db6c2d631e2c8d117927b8,1/29(水) 16:09
2025-01-30,13:08,domestic,国内,24,日テレNEWS NNN,道路陥没“下水道の緊急放流”準備　発生33時間…トラック運転手の救助難航【中継】,62,https://news.yahoo.co.jp/articles/76b2673fd8a06379d7e1ae4fab19eeae599013df,1/29(水) 19:17
2025-01-30,13:08,domestic,国内,25,読売新聞オンライン,元理事長逮捕の東京女子医大、補助金全額不交付へ…前年度は私学事業団から２０億円,60,https://news.yahoo.co.jp/articles/d807a586b73c1fa98faa33bd02e143a799f10c9d,1/30(木) 5:08
2025-01-30,13:08,domestic,国内,26,読売新聞オンライン,スキー場でそりに衝突、女性と女児にけがさせた疑い…旅行中の中国籍の男逮捕,59,https://news.yahoo.co.jp/articles/fbba3753aa73171ca2d9d05ef4e15a41fc075093,1/30(木) 11:50
2025-01-30,13:08,domestic,国内,27,テレビ朝日系（ANN）,石破総理の答弁に国民民主・玉木氏反発「123万円のままなら予算案には反対」,57,https://news.yahoo.co.jp/articles/72ee64b56277af65d20e3817a6188a085de614ce,1/30(木) 11:02
2025-01-30,13:08,domestic,国内,28,FRIDAY,「早よパトカー乗せろや！」血だらけになった阪急十三駅前　はさみを振り回した容疑者が連行される瞬間,56,https://news.yahoo.co.jp/articles/f4ae0a1dc23e67c3f36101ea2039507960f2d217,1/30(木) 11:00
2025-01-30,13:08,domestic,国内,29,プレジデントオンライン,「文春の訂正」でも、「フジ社長の辞任」でもACジャパンのまま…離れたスポンサーがフジテレビを許す絶対条件,56,https://news.yahoo.co.jp/articles/648b220ebfc75614ae2d4ca737484c0defc88dee,1/30(木) 7:36
2025-01-30,13:08,domestic,国内,30,デイリー新潮,なぜ「フジテレビ」は“キャンセル”されたのか…複雑化する社会に広がる「善悪二元論」と「自己正当化の物語」,54,https://news.yahoo.co.jp/articles/75b24ccf874939de07d703b46e2b7c19af9e8b78,1/30(木) 11:10
2025-01-30,13:08,domestic,国内,31,よろず～ニュース,斎藤知事 元総務部長の情報漏洩疑惑「私が聞いた時は否定」「第三者委員会の調査を踏まえて県として対応」,53,https://news.yahoo.co.jp/articles/1c8d88fdb038cd421e60f4bb8e41a3fcbaa240d6,1/30(木) 6:50
2025-01-30,13:08,domestic,国内,32,デイリースポーツ,茂木健一郎氏、文春の記事訂正を「世紀の大誤報」というのは「明らかに大げさ」,51,https://news.yahoo.co.jp/articles/19eb388b59556ccaf52c8e726d6e7867e40e612c,1/30(木) 12:35
2025-01-30,13:08,domestic,国内,33,JBpress,異例の10時間会見で明らかになった2つのこと、フジテレビの「ガバナンス不在」と日本のジャーナリズムの「浅薄さ」,51,https://news.yahoo.co.jp/articles/dd6326eda7b514fa45923664ac657e8eb36b7485,1/30(木) 11:32
2025-01-30,13:08,domestic,国内,34,毎日新聞,厚生年金の適用拡大、2035年に先送りへ　中小零細の負担考慮,51,https://news.yahoo.co.jp/articles/1dc3056f348fa6729fb0fdd8ebc0ae8cf705f00f,1/29(水) 16:46
2025-01-30,13:08,domestic,国内,35,デイリースポーツ,玉川徹氏、自らの発言謝罪「間違ったらすぐに訂正しますんで…すいませんでした」　文春が記事訂正に「僕もさっき間違ったから訂正した」,45,https://news.yahoo.co.jp/articles/4a4aac9876e22f8f28da1a76974a1f308de2370a,1/30(木) 10:38
2025-01-30,13:08,domestic,国内,36,プレジデントオンライン,だからコメの値段が下がらない、下げるつもりもない…JA農協のために備蓄米を利用する農水省の呆れた実態,43,https://news.yahoo.co.jp/articles/94e00c6e005106de7e94ea4a0b069476de75d574,1/29(水) 18:17
2025-01-30,13:08,domestic,国内,37,ABEMA TIMES,「タバコのポイ捨て」「深夜に大声」アパートのはずが…東京・北区の“民泊”に住民が激怒 不動産業者を直撃,42,https://news.yahoo.co.jp/articles/1d0d1c89e529935d79cfa70d6c89c0f742f7c74d,1/30(木) 7:02
2025-01-30,13:08,domestic,国内,38,FNNプライムオンライン,“しれっと訂正”「訂正の仕方がひきょう、姑息」橋下徹氏が語る週刊文春の「記事訂正」　フジテレビ遠藤副会長は辞任の意向示す,42,https://news.yahoo.co.jp/articles/cab3697332f34ec58f0e2d4bc85f1c38aa7e1afc,1/29(水) 21:57
2025-01-30,13:08,domestic,国内,39,読売新聞オンライン,陸上自衛隊のヘリコプターが抗議行動で着陸地変更…沖縄県名護市での災害訓練、反対する数人が現場離れず,40,https://news.yahoo.co.jp/articles/f6105e5abd1e6b28574806d9b7ebe3cc925fb2b2,1/30(木) 11:31
2025-01-30,13:08,domestic,国内,40,FNNプライムオンライン,「人が多いよ! 」京都・伏見稲荷大社近くの踏切内で観光客が“もみくちゃ”に…「歩けないぐらいの時もある」警報ボタンも要因か,37,https://news.yahoo.co.jp/articles/867c1216932a9b86ce8e1c824d8edd30ca192e57,1/29(水) 20:47
