scrp_date,scrp_time,genre_en,genre_jp,rank,media_jp,title,comment,link,date_original
2024-05-18,20:14,business,経済,1,読売新聞オンライン,早期・希望退職を募集する大手企業続出、３年ぶりに１万人超の可能性…黒字のうちに構造改革か,162,https://news.yahoo.co.jp/articles/d09967ed99f9be24395b07aa2285357607cf7367,5/18(土) 11:42
2024-05-18,20:14,business,経済,2,共同通信,中国、日本水産施設を停止　5月から税関当局の登録,138,https://news.yahoo.co.jp/articles/d983f3652982bdefcb0be68a8c613e849e72c4cf,5/17(金) 23:15
2024-05-18,20:14,business,経済,3,ファイナンシャルフィールド,1km5円の「走行税」の導入が検討されていると聞きました。地方在住で車は必須なのですが、「維持費」にどれだけ影響するでしょうか…？,89,https://news.yahoo.co.jp/articles/63e5b549873ef06f2b932684af81fc679c877c70,5/18(土) 13:50
2024-05-18,20:14,business,経済,4,日刊ゲンダイDIGITAL,パー券の公開基準を5万円、10万円引き下げるだけで大騒ぎ…自民「プライバシー配慮」の意味不明,57,https://news.yahoo.co.jp/articles/a4d908ea103dd56d0ad8cfc54f9604c97616cca4,5/18(土) 9:06
2024-05-18,20:14,business,経済,5,ベストカーWeb,結局[ハイブリッド]が無敵か!? EVはやっぱり厳しかった?? 北米ビッグ3が方針見直しへ,44,https://news.yahoo.co.jp/articles/899eab0024b9fceeaabbcd2bff572182b455dd2e,5/18(土) 17:00
2024-05-18,20:14,business,経済,6,共同通信,改正放送法、TV離れ加速に対応　NHK受信料、公平負担が課題,41,https://news.yahoo.co.jp/articles/53b061d25c1b6cfe2afcc36b99b1a06748814664,5/17(金) 20:14
2024-05-18,20:14,business,経済,7,乗りものニュース,ジャングルから里帰りした「飛燕」なんとパイロット判明！ 知られざる“エース”と新戦闘機ミュージアムとの「奇跡の縁」,40,https://news.yahoo.co.jp/articles/0a749e650268e22fa848b4a8f2af417bb351f436,5/18(土) 18:12
2024-05-18,20:14,business,経済,8,THE GOLD ONLINE（ゴールドオンライン）,社員「家を買いました」　会社「きみ、転勤ね」⇒じゃあ会社辞めます…社員の意欲を根こそぎ奪う“昭和人事”,31,https://news.yahoo.co.jp/articles/69eb5c617d7ebcda058ee0c5c7a99f2a27e5bdd0,5/18(土) 7:51
2024-05-18,20:14,business,経済,9,共同通信,零細企業、46％が賃上げせず　将来不安で、大同生命調査,28,https://news.yahoo.co.jp/articles/2c10400c84d0d5df4eb59ca46865d1ff2a7ce35c,5/18(土) 14:43
2024-05-18,20:14,business,経済,10,ニューズウィーク日本版,EVが売れると自転車が爆発する...EV大国の中国で次々に明らかになる落とし穴,27,https://news.yahoo.co.jp/articles/2fe5eec7433a8f3e8f0125e2f3667025b588d2c6,5/18(土) 8:50
2024-05-18,20:14,business,経済,11,現代ビジネス,なぜ日本はここまで「衰退」したのか…多くの人が取り憑かれた「病理の正体」,27,https://news.yahoo.co.jp/articles/7423346ea3098046630e157c086c16908b332950,5/18(土) 6:18
2024-05-18,20:14,business,経済,12,読売新聞オンライン,ＮＹダウ終値、史上初の４万ドル台…インフレ沈静化と年内利下げの期待高まる,27,https://news.yahoo.co.jp/articles/c58366c80ab04bb1f84efbcb01eb5b29c529c011,5/18(土) 5:13
2024-05-18,20:14,business,経済,13,マネーポストWEB,《ネズミ混入》“食パンシェアNo.1”『超熟』製造現場ルポ　工場裏の産廃コンテナにはみ出すほどのゴミの山、広報は「混入との因果関係は低い」,24,https://news.yahoo.co.jp/articles/2abd734f3207f24020c7d7721cd6b8f74addb1a3,5/18(土) 7:15
2024-05-18,20:14,business,経済,14,くるまのニュース,クルマのバッテリー 結局「どこを触ると」危ないの？ 「実際に感電したら」どうなる!? 怖いけど怖くない、でもやっぱり怖い「素人のバッテリー作業」とは,23,https://news.yahoo.co.jp/articles/abaaa53ed4935fe4792b01ca1eb63c04562272b6,5/18(土) 18:10
2024-05-18,20:14,business,経済,15,ベストカーWeb,[カブトムシ]と呼ばれた超意外なクルマ!? 虫の愛称がつけられた名車たち,21,https://news.yahoo.co.jp/articles/5e0d205c225231fa88cd1a29dcc6fb16f00baa24,5/18(土) 19:00
2024-05-18,20:14,business,経済,16,夕刊フジ,円安基調の裏に日本の〝対米従属〟構造　財務省が覆面でドル売り・円買い介入もビクともせず　思い出す安倍首相の「日本はカムバック」,21,https://news.yahoo.co.jp/articles/94e39632e78df3cd5e105b973e9ec1220f7f350e,5/18(土) 17:00
2024-05-18,20:14,business,経済,17,ファイナンシャルフィールド,「ミニバン」に乗っている50代夫婦です。ディーラーの営業で「軽自動車への乗り換え」を勧められるのですが、メリットはありますか？「大は小を兼ねる」と言いますし、断るべきでしょうか？,21,https://news.yahoo.co.jp/articles/c4db0b6bfcd1f94948abeced4c004a701de7ec57,5/18(土) 13:40
2024-05-18,20:14,business,経済,18,夕刊フジ,米国は景気減速が鮮明、いずれ利下げに向かい…為替が落ち着く可能性　時間稼ぎとして政府・日銀の為替介入はあり得る,20,https://news.yahoo.co.jp/articles/e3d47db73c290e768b5af48871d081e549e33f74,5/18(土) 17:00
2024-05-18,20:14,business,経済,19,LIMO,【富裕層】元金融機関職員が思わず「これがホンモノ」と確信したお金持ちの共通点。日本で「純金融資産1億円以上」の資産家は何パーセントいる？,19,https://news.yahoo.co.jp/articles/a04913591824c77efd825afae701775b97e6ff96,5/18(土) 6:32
2024-05-18,20:14,business,経済,20,乗りものニュース,「羽田は国内線、成田は国際線」なぜ撤廃？ かつての首都圏空港“鉄のオキテ”が変わったワケ,19,https://news.yahoo.co.jp/articles/b946322d91addd1a58e47701f9a4be6643ad7bf3,5/18(土) 7:42
2024-05-18,20:14,business,経済,21,東洋経済オンライン,10両が主力の首都圏私鉄に「短い編成」が残る事情　「ホームの長さが足りない」以外にも理由はある,19,https://news.yahoo.co.jp/articles/895967ed9301e0d9b249bd22114156bf3a342a58,5/18(土) 4:32
2024-05-18,20:14,business,経済,22,JBpress,円安反転のために金利上昇を受け入れる日本、利払い不安に伴う円、国債、日本株のトリプル安も現実味,18,https://news.yahoo.co.jp/articles/614deb6e10a1e4863d975dfbc0a6afb8c9934507,5/18(土) 11:32
2024-05-18,20:14,business,経済,23,ベストカーWeb,トヨタはセリカの「名ばかりのGTは道を開ける」で日産を挑発! 激怒した日産はどんなCMコピーで反撃したのか?,17,https://news.yahoo.co.jp/articles/51d87e755d0590a028b8131f38a2794db1c2be39,5/18(土) 11:30
2024-05-18,20:14,business,経済,24,Merkmal,「国が対策打ち出せ」 赤字だらけの四国3路線、JR四国＆沿線自治体はいつまで責任を押し付け合うのか？,16,https://news.yahoo.co.jp/articles/7214cbe01569423a97bdaa24f584f7f804205eec,5/18(土) 6:11
2024-05-18,20:14,business,経済,25,THE GOLD ONLINE（ゴールドオンライン）,ほぼ「富裕層」？50歳で「月給75万円」…「国家公務員夫婦」のお給与事情,15,https://news.yahoo.co.jp/articles/705c1f1600ba07d983a70be2adab98b29d74908c,5/18(土) 19:42
2024-05-18,20:14,business,経済,26,まいどなニュース,なぜJR宝塚線は運賃が高いのか！？…実は“めちゃくちゃ複雑”だったJR西の運賃体系　京阪神エリアの運賃体系を見直しへ,15,https://news.yahoo.co.jp/articles/df6fe9549efee87590e82bbd092c91661cd3a880,5/18(土) 15:00
2024-05-18,20:14,business,経済,27,ベストカーWeb,[新事実]10年でバッテリーが壊れるは嘘!? 最近のハイブリッドはマジで頑丈だぞ,15,https://news.yahoo.co.jp/articles/eac23696a75036f48f90c6170723bf5674b52bf6,5/18(土) 7:00
2024-05-18,20:14,business,経済,28,鉄道コム,関東1都6県で「新幹線の駅がない」県は？　1県は「通るのに駅がない」って？,15,https://news.yahoo.co.jp/articles/962dfec0d2ab6c6b6b0f829300fa13504f43d84f,5/18(土) 10:25
2024-05-18,20:14,business,経済,29,TBS NEWS DIG Powered by JNN,GDP2％減の衝撃、順序が逆の「好循環」個人消費は「リーマンショック」以来の4四半期連続マイナス【播摩卓士の経済コラム】,15,https://news.yahoo.co.jp/articles/eeb564c3e5b8ac2b691c994d784efcbe24bfc80f,5/18(土) 14:02
2024-05-18,20:14,business,経済,30,WEB CARTOP,「俺のはフルチューンだから」……とかクルマ好きたるもの一度はいってみたい！　とはいえ「フルチューン」ってなに？,15,https://news.yahoo.co.jp/articles/05fdd00c86c47461961abc77fb27be48bbdfe442,5/18(土) 11:51
2024-05-18,20:14,business,経済,31,ファイナンシャルフィールド,78歳の祖父が「孫に渡すほうが得」と、毎年「100万円」を贈与してくれます。父に贈与しても「非課税」だと思うのですが、なぜ私なのでしょうか…？,14,https://news.yahoo.co.jp/articles/61b966c34783bab97f228558871623dea0189697,5/18(土) 13:50
2024-05-18,20:14,business,経済,32,ファイナンシャルフィールド,40代の夫が異業種・異職種に転職して年収100万円もダウン！ さすがにお小遣いを「減額」しても許されますよね？,14,https://news.yahoo.co.jp/articles/3f4e2a2541ee4b415db12848d354374469cf908b,5/18(土) 18:30
2024-05-18,20:14,business,経済,33,Auto Messe Web,『帰ってきた あぶない刑事』は5月24日公開！ 舞台は横浜、手放し運転でショットガン撃ちまくるのも「映画とは文化を描くもの」だからです,14,https://news.yahoo.co.jp/articles/843a4c011994e05493211baf8382ff9be521e4ec,5/18(土) 15:10
2024-05-18,20:14,business,経済,34,現代ビジネス,誰が「貧困者」になっているのか？…日本で「若者と高齢者の貧困率」が高い深刻な理由,13,https://news.yahoo.co.jp/articles/21537b9477d328933e24bf926595a4ff67e2a6d9,5/18(土) 6:33
2024-05-18,20:14,business,経済,35,読売新聞オンライン,１００円ショップの市場規模、昨年度初の１兆円超え…円安で採算悪化し「脱１００円」へ岐路,13,https://news.yahoo.co.jp/articles/875a1ba0f44bf5a86e9566804944dd8d6e520231,5/18(土) 17:42
2024-05-18,20:14,business,経済,36,ファイナンシャルフィールド,40歳の独身会社員、貯金の平均は「1000万円」って本当ですか？ 自分は「100万円」しかないので老後が不安になりました。こんな思いをしているのは“自分だけ”ですか…？,13,https://news.yahoo.co.jp/articles/bbe1e324f5c10bf52cf73b8e5997746b7be05f59,5/18(土) 14:30
2024-05-18,20:14,business,経済,37,J-CASTニュース,「実家から通えて経済的に楽だから」　地元就職希望がじわり増える...背景に若者の不安？,13,https://news.yahoo.co.jp/articles/6166fc26b16520c3bd0f7a7bfa446e92264d1508,5/18(土) 12:00
2024-05-18,20:14,business,経済,38,ファイナンシャルフィールド,夫の転勤で地方へ引っ越すことになりました。地方は車が必須のイメージがあるのですが、中古車を買うのとカーリースだとどちらが安いですか？,12,https://news.yahoo.co.jp/articles/b23becb84587b3c2fcc170b573977557fb73d343,5/18(土) 19:10
2024-05-18,20:14,business,経済,39,くるまのニュース,謎の「A／Cボタン」いつ使う？ 押すと何が起こる？ 暑い時期に重要な機能だった,12,https://news.yahoo.co.jp/articles/14bf84a0fbed3c2e6db75abaeb7af8ec5e3f5323,5/18(土) 9:10
2024-05-18,20:14,business,経済,40,くるまのニュース,ホンダ「オデッセイ タイプR」!? 迫力顔がめちゃカッコイイ！ 夢の「最速ミニバン」予想CGを公開,12,https://news.yahoo.co.jp/articles/a9a1f684e00a76c841fbe5faa402167aef9dc531,5/18(土) 10:10
