scrp_date,scrp_time,genre_en,genre_jp,rank,media_jp,title,comment,link,date_original
2025-02-17,04:06,world,国際,1,共同通信,希少鉱物の供与、安保確約が条件　署名拒否でゼレンスキー大統領,81,https://news.yahoo.co.jp/articles/6fdca10b1a7a0ee2c4bc4b6d12e71633ad808eac,2/16(日) 9:12
2025-02-17,04:06,world,国際,2,共同通信,和平交渉、欧州に「席なし」　トランプ政権特使が明言,49,https://news.yahoo.co.jp/articles/c9d110a929692a41e9ada3d5f550be82bc5f7b9c,2/16(日) 5:11
2025-02-17,04:06,world,国際,3,テレビ朝日系（ANN）,オーストリア南部で無差別テロか　シリア国籍の男を逮捕　通行人が襲われ14歳少年死亡,43,https://news.yahoo.co.jp/articles/0a983c8b0f22d6c0e46721a87591590a19ac1318,2/16(日) 8:32
2025-02-17,04:06,world,国際,4,共同通信,インド列車に乗客殺到18人死亡　祭典「クンブ・メラ」向かう途中,36,https://news.yahoo.co.jp/articles/391f467227d57fc900d8fd44c082b6d4484432af,2/16(日) 5:47
2025-02-17,04:06,world,国際,5,FNNプライムオンライン（フジテレビ系）,アメリカ政府高官「ロシアは“領土譲歩”必要」　ウクライナ侵攻の停戦交渉めぐり,34,https://news.yahoo.co.jp/articles/15692d3cec91fecebeadf54e9a91ca075ffa62da,2/16(日) 6:19
2025-02-17,04:06,world,国際,6,毎日新聞,トランプ政権のウクライナ巡る発信、二転三転　停戦交渉は加速の構え,33,https://news.yahoo.co.jp/articles/087e1d948c3154b0157b576c189f6a7144f8aa41,2/16(日) 14:40
2025-02-17,04:06,world,国際,7,共同通信,米ロ高官サウジで数日内にも交渉　首脳、和平巡り下旬会談か,29,https://news.yahoo.co.jp/articles/084b0de1745d9cdd005a29f97c779a2e23e8b317,2/16(日) 5:13
2025-02-17,04:06,world,国際,8,TBS NEWS DIG Powered by JNN,タリバン幹部らが訪日へ　タリバン関係者「国際社会との関係深めるうえで訪日の意義大きく」 実権を握った2021年以降、タリバン政権幹部の来日は初,29,https://news.yahoo.co.jp/articles/34633af309289efeede4736d4ce26a565e50c84e,2/17(月) 0:47
2025-02-17,04:06,world,国際,9,47NEWS,コロナ「震源地」中国武漢の今を歩く。残された傷は 　トランプ２．０発足で「中国ウイルス」の批判再来も、くすぶる両国間の火種,25,https://news.yahoo.co.jp/articles/080666bb3b3b2c4feb6c8978c82266dc750e4247,2/16(日) 9:02
2025-02-17,04:06,world,国際,10,FNNプライムオンライン（フジテレビ系）,タリバン高官が来日へ、復権後初めてか　女性抑圧政策で国際社会は承認せず,23,https://news.yahoo.co.jp/articles/52f7c6e6cf3790ee8663e5d1649f88fdfea960f3,2/16(日) 23:13
2025-02-17,04:06,world,国際,11,ニューズウィーク日本版,戦車不足ロシア、ついに80年前の主力戦車を出撃準備の「証拠映像」拡散…「現代兵器にどう対抗するのか」,21,https://news.yahoo.co.jp/articles/27148a9a5da4f37a50ee2d6cab33682590050f9e,2/16(日) 19:10
2025-02-17,04:06,world,国際,12,共同通信,トランプ大統領の権限拡大に懸念　米調査、「あまりに危険」65％,20,https://news.yahoo.co.jp/articles/bee16cdab4f354e36f9011c3aa301bda4463f048,2/16(日) 7:41
2025-02-17,04:06,world,国際,13,週プレNEWS,日本の最東端「南鳥島」を中国が取りにくるって本当!?,19,https://news.yahoo.co.jp/articles/3e744c6681c413c5c946ea9d3ca1c3fd14e40736,2/16(日) 6:30
2025-02-17,04:06,world,国際,14,NEWSポストセブン,《アメリカ物価高に絶望》「日本の2倍、いや3倍くらい高い」大工、フードデリバリー、ライドシェア、YouTube…仕事掛け持ちでも“家族4人キッツキツ生活”,18,https://news.yahoo.co.jp/articles/01da11ed8d17e44199ebc3d72004c4bcb0b8b64f,2/16(日) 15:58
2025-02-17,04:06,world,国際,15,テレビ朝日系（ANN）,ゼレンスキー大統領　「欧州軍」の創設を訴える,17,https://news.yahoo.co.jp/articles/f8d03e4b7c40791c38233a501757f6448c6dcded,2/16(日) 14:47
2025-02-17,04:06,world,国際,16,NEWSポストセブン,《過激化する性コンテンツ》道ゆく人に「触って」と…“裸ダンボール”企画で韓国美女インフルエンサーに有罪判決「表面に出ていなくても妄想を膨らませる」,14,https://news.yahoo.co.jp/articles/12226bcadd1d5e9389065466fae710a0a53b4a41,2/16(日) 7:15
2025-02-17,04:06,world,国際,17,読売新聞オンライン,オーストリアで通行人を次々刺した２３歳男は「イスラム国」の影響か…１４歳少年が死亡・５人重軽傷,14,https://news.yahoo.co.jp/articles/f5c7bc850bb20edc148f8db3ad6149f2d8dea861,2/16(日) 19:46
2025-02-17,04:06,world,国際,18,テレビ朝日系（ANN）,ウクライナの戦闘終結めぐり　米特使「ヨーロッパの席はない」,13,https://news.yahoo.co.jp/articles/64c570a8e60c64253cae21c8b9c5df62efa589df,2/16(日) 12:22
2025-02-17,04:06,world,国際,19,TBS NEWS DIG Powered by JNN,「USAID」ターゲットに　“影の大統領”イーロン・マスク氏、強権的な手法に波紋【サンデーモーニング】,13,https://news.yahoo.co.jp/articles/63de89f1e4c30096dc10688978183810262b7f7f,2/16(日) 15:08
2025-02-17,04:06,world,国際,20,読売新聞オンライン,「ロシアの勝利は中国に誤ったメッセージ与える」…岩屋外相がミュンヘン安保会議で警鐘,13,https://news.yahoo.co.jp/articles/96e9d5610993d92e743cadbcb2c1a96564326777,2/16(日) 20:25
2025-02-17,04:06,world,国際,21,TBS NEWS DIG Powered by JNN,アメリカ世論調査　トランプ大統領にさらなる権限　65％が「非常に危険」,13,https://news.yahoo.co.jp/articles/625463726df73ed1791f8fb0870c79910b8ab893,2/16(日) 21:39
2025-02-17,04:06,world,国際,22,毎日新聞,「私たちは日本に行く」　アフガンのタリバン高官、初の訪日と投稿,13,https://news.yahoo.co.jp/articles/c82c1eba891b0c91c68f257dadb7c123f6dba875,2/16(日) 9:52
2025-02-17,04:06,world,国際,23,時事通信,米国務省HP、「台湾独立不支持」を削除　中央通信,11,https://news.yahoo.co.jp/articles/592835f479d8a8be079fe82e4b7fb17ee9a2fdc4,2/16(日) 20:53
2025-02-17,04:06,world,国際,24,中央日報日本語版,カリブ海のビーチでサメと写真撮ろうとして…両手失った５０代女性,11,https://news.yahoo.co.jp/articles/62d0aaacfef0e3662eceba897de7d00eebf500b6,2/16(日) 13:26
2025-02-17,04:06,world,国際,25,ＡＦＰ＝時事,クック諸島、中国と「パートナーシップ」協定,11,https://news.yahoo.co.jp/articles/1f22aacc33317cf598e4ab08520af21f51bf5a51,2/16(日) 15:25
2025-02-17,04:06,world,国際,26,TBS NEWS DIG Powered by JNN,アメリカ・トランプ政権のロシア・ウクライナ担当特使 “ロシアは占領地の譲歩必要”戦闘終結に向けた交渉で,10,https://news.yahoo.co.jp/articles/a4e928eb168b0adcca3f984c7ab397c7cd0d568f,2/16(日) 10:09
2025-02-17,04:06,world,国際,27,時事通信,トランプ氏権限拡大、6割超懸念　民主党支持者では9割　米世論調査,10,https://news.yahoo.co.jp/articles/5be3adcefe2a9e9891f083e72189f409ff0fcb41,2/16(日) 22:13
2025-02-17,04:06,world,国際,28,ABEMA TIMES,米国の停戦に向けた仲介に ゼレンスキー大統領が不満表明,10,https://news.yahoo.co.jp/articles/5c9ee298c444206ec4159d30d50d4e1a309b2756,2/16(日) 8:42
2025-02-17,04:06,world,国際,29,TBS NEWS DIG Powered by JNN,アメリカ・ケロッグ特使 ロシアに占領地の譲歩を求める考え　「交渉に欧州は不参加」見通しに欧州側反発,9,https://news.yahoo.co.jp/articles/f0501644f4c3e077c4935ce7c592c99ed45f54e1,2/16(日) 17:38
2025-02-17,04:06,world,国際,30,テレビ朝日系（ANN）,アメリカ主導の“和平交渉”に待った　ゼレンスキー氏「ヨーロッパ軍」創設を,8,https://news.yahoo.co.jp/articles/7c983fe33dbbc17b35b6b619ee9d3e9186863f03,2/16(日) 18:24
2025-02-17,04:06,world,国際,31,TBS NEWS DIG Powered by JNN,中国　ウクライナと外相会談「全ての当事者が受け入れられる合意を」 アメリカをけん制,8,https://news.yahoo.co.jp/articles/5624f80de562d07a2c479ba819a70907d16613e6,2/16(日) 22:53
2025-02-17,04:06,world,国際,32,AERA dot.,「トランプ大統領は失敗するだろう」　エマニュエル・トッドが示す「経済問題」「ドル覇権」二つの根拠,8,https://news.yahoo.co.jp/articles/7b6013de4fd5bdccc6929619e35abfbc74d2704c,2/16(日) 8:32
2025-02-17,04:06,world,国際,33,ニューズウィーク日本版,カメラが捉えたメーガン妃の行動に批判の声 「親切のつもりだろうが…」「相手に失礼」,8,https://news.yahoo.co.jp/articles/9bbb001f5399ad369aac7d410379afa10cfddfc0,2/16(日) 13:10
2025-02-17,04:06,world,国際,34,共同通信,米ロ協議、ウクライナは不参加と高官,8,https://news.yahoo.co.jp/articles/5bc0d6bdc70c766ebee1dab0f452c149bcfa36dd,2/16(日) 16:55
2025-02-17,04:06,world,国際,35,CNN.co.jp,ゼレンスキー氏、欧州に米国の関与低下を警告　「統一軍」の創設呼び掛け,8,https://news.yahoo.co.jp/articles/664bc381d7412c4cd665a315fac98a9c67bc9eb4,2/16(日) 12:44
2025-02-17,04:06,world,国際,36,テレビ朝日系（ANN）,タイ・バンコク近郊の高速道路料金所に車が衝突し日本人男性死亡　ゴルフ帰りか,7,https://news.yahoo.co.jp/articles/166daa72f2871f55dd3dff561152f9c3c6eaea6f,2/16(日) 23:52
2025-02-17,04:06,world,国際,37,テレビ朝日系（ANN）,ルビオ国務長官がネタニヤフ首相と会談「ハマスが残る以上　和平は不可能」,7,https://news.yahoo.co.jp/articles/7f82366681e5fdbea34f80f9785c355b981e006b,2/17(月) 1:01
2025-02-17,04:06,world,国際,38,TBS NEWS DIG Powered by JNN,タリバン幹部らが訪日へ 「国際社会との関係深めるうえで意義大きく」,7,https://news.yahoo.co.jp/articles/266fd732f059c30b9bc30e62fc75323b6056a908,2/16(日) 19:52
2025-02-17,04:06,world,国際,39,ＡＦＰ＝時事,マリで違法金鉱山が崩落、48人死亡,7,https://news.yahoo.co.jp/articles/164aabd7f65aad1d6b56875a9c658ad0b0cb6caf,2/16(日) 14:07
2025-02-17,04:06,world,国際,40,ダイヤモンド・オンライン,「ハーバード卒より配管工のほうが賢い」米国保守派の「若きカリスマ」の演説にインテリが熱狂するワケ,7,https://news.yahoo.co.jp/articles/35483c325cea9d34fe28b4833b1968e9ad1fa39e,2/16(日) 8:32
