scrp_date,scrp_time,genre_en,genre_jp,rank,media_jp,title,comment,link,date_original
2025-02-17,14:07,domestic,国内,1,MBSニュース,「なんで4なないの」息子は3年前のきょう命絶った…死後に母が突き止めた苛烈なSNSいじめ　命日のきょう加害生徒側との民事裁判はじまる,396,https://news.yahoo.co.jp/articles/88a7a366404725e597ace047700239401b2a31e2,2/17(月) 8:03
2025-02-17,14:07,domestic,国内,2,FNNプライムオンライン（フジテレビ系）,石破首相が拉致被害者有本恵子さんの父明弘さん死去受け「本当に残念」トランプ大統領から金正恩氏への解決提起「意義深い」,380,https://news.yahoo.co.jp/articles/46bbd7b78284a09c834c066da77d31954ded1f4f,2/17(月) 9:32
2025-02-17,14:07,domestic,国内,3,毎日新聞,石破内閣支持率30％　2カ月ぶり回復　毎日新聞世論調査,289,https://news.yahoo.co.jp/articles/a893d372fd8ff9aec3217642feb2e5cbc56c3352,2/16(日) 16:53
2025-02-17,14:07,domestic,国内,4,読売新聞オンライン,大和ミュージアム、人気が出過ぎて休館…47億円かけ大規模改修・混雑解消や回遊性高める工夫,223,https://news.yahoo.co.jp/articles/ecf3391d758b82b062c8488210e05382ba722a8d,2/17(月) 10:40
2025-02-17,14:07,domestic,国内,5,現代ビジネス,【独自】現役法務大臣に公職選挙法違反疑惑…！法務省の全職員に崎陽軒の「月餅」を配っていた！,170,https://news.yahoo.co.jp/articles/f42484bfabd7fec4bc06e8d96580d435a40ffb36,2/17(月) 7:01
2025-02-17,14:07,domestic,国内,6,TBS NEWS DIG Powered by JNN,名古屋市営バスで運行記録の「改ざん」 残業を「なかったこと」にするケースも 「市バスの運行は乗務員の犠牲の上に」,162,https://news.yahoo.co.jp/articles/299b01df633f9c30d1c9817d93d45776319143b8,2/17(月) 12:09
2025-02-17,14:07,domestic,国内,7,ABEMA TIMES,“消えた21万トン”はどこへ？米価の高騰は一部業者のストックが影響か「どこかで得をしている人が間違いなくいる」,160,https://news.yahoo.co.jp/articles/f155c0e6d21f5236a3d8caf79f8468dd54aa8366,2/17(月) 13:01
2025-02-17,14:07,domestic,国内,8,TBS NEWS DIG Powered by JNN,【速報】埼玉・川口市でトラックと車が衝突し0歳児が心肺停止の状態で病院に搬送　このほか3人がけが,132,https://news.yahoo.co.jp/articles/ad08f09b4b03a35f12bd3e339611f2a5a4c51d02,2/17(月) 11:38
2025-02-17,14:07,domestic,国内,9,現代ビジネス,悠仁さまが「一人暮らし」される可能性も...筑波大学内に「謎の一軒家」が完成していた…！,117,https://news.yahoo.co.jp/articles/873cb9fb7f87efbdd7285fe6e22fec34db7d1708,2/17(月) 7:01
2025-02-17,14:07,domestic,国内,10,神戸新聞NEXT,拉致被害者有本恵子さんの父、明弘さん96歳で死去「ぎりぎりいっぱいまで生きてきた」　神戸,102,https://news.yahoo.co.jp/articles/a47a66f33af96881b2091d0caedb8dd8cd01f8cc,2/17(月) 0:17
2025-02-17,14:07,domestic,国内,11,産経新聞,百条委、疑惑、予算…斎藤知事、正念場の2月議会 　兵庫県政の混乱 収束への道険しく,102,https://news.yahoo.co.jp/articles/98ffe04da27cb4b632141fa023e64d86da5510dd,2/17(月) 7:40
2025-02-17,14:07,domestic,国内,12,FNNプライムオンライン（フジテレビ系）,【独自】悠仁さまが運転免許を取得　筑波大学入学に向けて準備進む　教習所で路上実習も,83,https://news.yahoo.co.jp/articles/809efcae71760405d35265bf2d7be4b1350959e0,2/17(月) 11:32
2025-02-17,14:07,domestic,国内,13,JBpress,給料増えないのに防衛増税？主眼は反撃力の向上だが…円安・インフレ・トランプ2.0の三重苦、所得税上乗せに反発も,80,https://news.yahoo.co.jp/articles/07bab3ccf94e0084daa3cf384cb6ebbb0a6a1b57,2/17(月) 11:06
2025-02-17,14:07,domestic,国内,14,47NEWS,「近代国家として驚くべきこと」。周回遅れのジェンダー平等、日本に突きつけられた厳しい勧告,80,https://news.yahoo.co.jp/articles/aed7eb73393677df3c9325a7fd2a39d25fad9437,2/17(月) 9:02
2025-02-17,14:07,domestic,国内,15,よろず～ニュース,河野太郎氏、外国人の国民健康保険加入「プラスかも」“可能性”強調　ネットからは積年の数字求める声も,80,https://news.yahoo.co.jp/articles/7ca18d447460095656084578b16b079ec8c319b4,2/16(日) 17:50
2025-02-17,14:07,domestic,国内,16,毎日新聞,旧安倍派の会計責任者、参考人招致に「出る方向」　日程は与野党協議,75,https://news.yahoo.co.jp/articles/d666e9ec24cd4265293b11c1801c99ff718e54fb,2/17(月) 12:48
2025-02-17,14:07,domestic,国内,17,時事通信,高額療養費、負担増凍結せず　首相「制度維持に必要」　衆院予算委,66,https://news.yahoo.co.jp/articles/9b6f5fb98f0948b40deabc00f58faf779e519c8d,2/17(月) 12:08
2025-02-17,14:07,domestic,国内,18,プレジデントオンライン,"充電スタンドはテスラ車で大渋滞…ロス山火事で加速する""EV離れ""の現実「日産リーフを手放します」の声も",64,https://news.yahoo.co.jp/articles/243531a9b742673978626031efa8cdec4bec45c3,2/17(月) 8:17
2025-02-17,14:07,domestic,国内,19,朝日新聞,要介護度高い高齢者に「高額値付け」　老人ホーム紹介ビジネスが横行,63,https://news.yahoo.co.jp/articles/220d7a0f3391e18ba3ef6011dc47652318865a1b,2/17(月) 4:00
2025-02-17,14:07,domestic,国内,20,中日スポーツ,弁護士の紀藤正樹さん、大阪・関西万博『行きたいと思わない』67％の世論調査に私見「もはや時代にそぐわない」「バズるような対象がないと…」,60,https://news.yahoo.co.jp/articles/d740f74199f1911a10e3f70828b8590504986f6c,2/16(日) 22:15
2025-02-17,14:07,domestic,国内,21,FNNプライムオンライン,パトカー2台が車検切れ・自賠責保険入らず1カ月間運転 走行距離約4000キロ 有効期限1年遅く記入する管理ミス,60,https://news.yahoo.co.jp/articles/137e89e005d840891156e564a9d3672d0e012ab9,2/17(月) 12:02
2025-02-17,14:07,domestic,国内,22,日刊スポーツ,玉川徹氏「全然違うよね」メジャーに比べプロ野球の報道量少ないと私見「アメリカの話なんです」,57,https://news.yahoo.co.jp/articles/f5b1c7ebb211a4b8bf422ebade30be307f186da6,2/17(月) 12:13
2025-02-17,14:07,domestic,国内,23,フジテレビドキュメンタリー,小倉美咲さんの母と姉　もがき続けた5年――「自分が学校に行って笑っていることさえ罪悪感」#ザ・ノンフィクション #ydocs,52,https://news.yahoo.co.jp/articles/8ef03afee87ba09fef347282164a2801c936cd01,2/16(日) 14:00
2025-02-17,14:07,domestic,国内,24,毎日新聞,私立高の就学支援、上限45万円に引き上げへ政府調整　26年度から,48,https://news.yahoo.co.jp/articles/8f5d7b210c18fff34e3430cd0b02f6c2db4f146f,2/17(月) 10:36
2025-02-17,14:07,domestic,国内,25,J-CASTニュース,水道管漏水で濁った風呂を「有馬温泉」に例える京都人　遠回し表現に「ぶぶ漬けでも」を思い出す,48,https://news.yahoo.co.jp/articles/0f3ec23cead2ce694ff4d659a0c602169c6a4b77,2/17(月) 12:20
2025-02-17,14:07,domestic,国内,26,現代ビジネス,デヴィ夫人が新党結成！共同代表に就いた「謎の中国出身・慈善家」の正体,47,https://news.yahoo.co.jp/articles/5a17b76a47646f0d6acff8ba27004038a29e1af5,2/17(月) 7:01
2025-02-17,14:07,domestic,国内,27,読売新聞オンライン,他候補応援目的の「２馬力」選挙に対策を…１９府県知事らが緊急声明「応援された側の選挙運動も妨害」,47,https://news.yahoo.co.jp/articles/9218be13a67cf5fb196d7b790b6794891fd1b957,2/17(月) 12:44
2025-02-17,14:07,domestic,国内,28,共同通信,【独自】消防職場でハラスメント多発　初の全国調査、176件判明,44,https://news.yahoo.co.jp/articles/2da01ea1c033a71f61a665aa5a8271e0a91c671b,2/16(日) 21:00
2025-02-17,14:07,domestic,国内,29,デイリースポーツ,成田悠輔氏　マスク氏のＵＳＡＩＤ停止は「文化大革命に近い思想弾圧」クーデターと危険視「日本も他人事じゃない」,42,https://news.yahoo.co.jp/articles/e6f7f58c61867d07491211255d48835539ab9296,2/16(日) 17:56
2025-02-17,14:07,domestic,国内,30,選挙ドットコム,維新の「高校授業料無償化」はバラマキ政策じゃない！その先にある教育の機会平等と学校間競争の意義とは？,42,https://news.yahoo.co.jp/articles/ea434aef46c6beba37335ef5cf6d6374d88b6d06,2/17(月) 12:11
2025-02-17,14:07,domestic,国内,31,TOKYO MX,備蓄米21万トン放出決定でコメ価格値下がり狙う　江藤農水相「必要あればさらに拡大」,42,https://news.yahoo.co.jp/articles/f298cb02a440a102005622da79a26566298b63af,2/17(月) 10:30
2025-02-17,14:07,domestic,国内,32,日刊スポーツ,「本当はトラウマあるが、グッとがまん」立民・野田佳彦氏が石破首相に思い吐露　衆院予算委,41,https://news.yahoo.co.jp/articles/d9ea35ec651061179bd9f992799c138959b7ea08,2/17(月) 11:45
2025-02-17,14:07,domestic,国内,33,テレビ朝日系（ANN）,元タレント「なぜ被害者が…」旧ジャニーズ事務所の補償巡る裁判,40,https://news.yahoo.co.jp/articles/03cfa42e13162df94d3b62e6446cb83d179beaf6,2/17(月) 12:11
2025-02-17,14:07,domestic,国内,34,東海テレビ,トヨタ86の右側面が激しく損傷…車が単独でガードパイプ突き破る 運転していた27歳男性が死亡 同乗の2人もケガ 同僚3人でドライブ中か,39,https://news.yahoo.co.jp/articles/45f8cfc8d198ad109ac2f60f669a0075d61b1437,2/17(月) 7:23
2025-02-17,14:07,domestic,国内,35,FNNプライムオンライン,【独自】悠仁さまが運転免許を取得　筑波大学入学に向け「ふさわしい通学方法をお考えに」　教習所で路上実習も,35,https://news.yahoo.co.jp/articles/08a953fcda9164c7fb9abddc37250ef50ce30dfe,2/17(月) 12:22
2025-02-17,14:07,domestic,国内,36,ウェザーマップ,17日（月）夜にかけて北風強まる　日本海側は雪の範囲が拡大　今週は真冬の寒さ居座る,34,https://news.yahoo.co.jp/articles/2c47b14718098dec2171111850a41d8b4b956135,2/17(月) 11:21
2025-02-17,14:07,domestic,国内,37,共同通信,石破茂首相、長期患者の負担据え置きを表明,33,https://news.yahoo.co.jp/articles/d0ef1abffc39f3b8913b6172ae97376ac5719831,2/17(月) 9:53
2025-02-17,14:07,domestic,国内,38,テレビ朝日系（ANN）,「高額療養費制度」長期治療受ける患者負担は据え置き　石破総理「政府として決断」,31,https://news.yahoo.co.jp/articles/cb9691f8bd71208f1ae0c735e580154521842960,2/17(月) 13:00
2025-02-17,14:07,domestic,国内,39,関西テレビ,【速報】「しんでみてーや」などと中傷　いじめ苦に自殺中3男子生徒の遺族が加害生徒ら訴えた裁判　「卑劣極まりない攻撃をした罪を潔く認めていただきたい。決して忘れることなく、一生背負って生きてほしい」と男子生徒の母が涙ぐみながら法廷で訴え,31,https://news.yahoo.co.jp/articles/dce52e5fe7accc2716566b7f7cc3d1f8d6466745,2/17(月) 11:54
2025-02-17,14:07,domestic,国内,40,読売新聞オンライン,信号無視の反則金納めず、裁判所への出頭要請にも従わず逮捕…運送業の男「仕事の都合で行けなかった」,31,https://news.yahoo.co.jp/articles/69cc7a614a49a3c6e7f93779b9745b23ab3f2f38,2/17(月) 12:54
