scrp_date,scrp_time,genre_en,genre_jp,rank,media_jp,title,comment,link,date_original
2025-02-20,09:30,life,ライフ,1,週刊SPA!,現役ホテル従業員が明かした“中国人観光客のトイレマナー”の悪さ「ツインルームが2日間使えなくなりました」,111,https://news.yahoo.co.jp/articles/c69a86fddf6c6978abbc1fccb5095f3b7b3fc802,2/19(水) 15:55
2025-02-20,09:30,life,ライフ,2,まいどなニュース,高3娘が財布を紛失…見つかったが1万円札がない！　あきらめながらも警察へ→2日後に犯人発覚「丸くおさまって良かった」「名乗り出るのも勇気がいる」,94,https://news.yahoo.co.jp/articles/5567051276adcc87d4e84b6dc06d1b57a965f181,2/20(木) 6:50
2025-02-20,09:30,life,ライフ,3,まいどなニュース,「婚約者じゃなく『犬』を選んだ」20代女性の決断に励ましの声が殺到「犬の世話も丸投げでは人の子の世話など無理」「優しい人と出会えるで！」,62,https://news.yahoo.co.jp/articles/627d73e1ad6718e115a4055623a6c043da71d6ce,2/20(木) 7:35
2025-02-20,09:30,life,ライフ,4,ウィメンズヘルス,「ビキニにはふさふさのアンダーヘアを」と訴える女性に152万のいいね！支持する若者が海外で増加,41,https://news.yahoo.co.jp/articles/ebaec0b6eaa244e44aee2cc44f5911f18d4f87f4,2/19(水) 23:00
2025-02-20,09:30,life,ライフ,5,プレジデントオンライン,「営業しか就職先がない」有象無象の私文大学は必要なのか…「高卒は恥ずかしい」という親が目を背けている現実,41,https://news.yahoo.co.jp/articles/14802248cc55dc1d3509025c4f57e92248f2768d,2/19(水) 17:17
2025-02-20,09:30,life,ライフ,6,FORZA STYLE,「44歳の高齢出産だから…？」発達グレーの息子が生まれた理由を憂うバリキャリ母。子どもの特性を受け入れられない親に共通するある「性質」,39,https://news.yahoo.co.jp/articles/12e0cb181f957fcc91492bf7b80c028425e91da9,2/20(木) 7:02
2025-02-20,09:30,life,ライフ,7,ウォーカープラス,「フツーはワリカンとかないかなー？」そこから教えなきゃダメ？“おごられて当然”昭和引きずり女の本音【作者に聞く】,34,https://news.yahoo.co.jp/articles/1a3076168c4d76235fc9dec9a1e428437fcaab60,2/20(木) 7:00
2025-02-20,09:30,life,ライフ,8,まいどなニュース,「ディズニーランドホテルで車が盗難」…「ハンドルロックしたのに」盗難対策どうすれば？,31,https://news.yahoo.co.jp/articles/8e69889df1c76322e22dbf504010ed1251118503,2/20(木) 7:00
2025-02-20,09:30,life,ライフ,9,ピンズバNEWS,男性が「苦手な女性バラエティタレント」ランキング、みちょぱを抑えた圧倒的トップは「言葉遣いが荒い」【トップ3】,26,https://news.yahoo.co.jp/articles/c616aa3654da9c20da4383b658e721e72f1bf266,2/19(水) 19:01
2025-02-20,09:30,life,ライフ,10,週刊SPA!,4人の“夫人”と“勝手に一夫多妻”の共同生活を送る37歳男性。“第2夫人との離婚騒動”の顛末「デートの順番をせっつかれて」,24,https://news.yahoo.co.jp/articles/c640b661c11ac13449923725f8fe256ac0d37da6,2/20(木) 8:53
2025-02-20,09:30,life,ライフ,11,magacol,「小学生からお化粧するのはアリorなし？」小中学生向け美容雑誌がスゴい！｜美ST,22,https://news.yahoo.co.jp/articles/362dddb86ac1a027cba875c79b90fb9252085ffd,2/20(木) 8:00
2025-02-20,09:30,life,ライフ,12,ARTnews JAPAN,米国立公園局がウェブサイトから「トランスジェンダー」表記を削除。活動家らは「歴史の抹消」と猛抗議,20,https://news.yahoo.co.jp/articles/96573e23ec91814aaaa5e2ce071a9ce36da85c45,2/20(木) 8:30
2025-02-20,09:30,life,ライフ,13,女性セブンプラス,《「皇室は女性差別」問題について》弁護士の菅野志桜里さん、愛子さまの現状に「私たちはもっと反省を」「皇室に入った女性を苦しめる制度はやめるべき」,20,https://news.yahoo.co.jp/articles/aeef980379fdb8d0e92e7dd24fe7f5d0eb163def,2/19(水) 16:00
2025-02-20,09:30,life,ライフ,14,大手小町（読売新聞）,「カレー10皿分ない」問題…ルーの箱レシピの謎をメーカーに聞いた,20,https://news.yahoo.co.jp/articles/be69c33ff5b7bdc126d649fd425dde4cee646477,2/19(水) 12:11
2025-02-20,09:30,life,ライフ,15,ほ・とせなNEWS,高校生の娘に贈った最後のお弁当　そのクオリティに「泣けちゃう」「嬉しすぎる」 「娘さん幸せ」,19,https://news.yahoo.co.jp/articles/7eb6f46652ae1c6112a61551720d699cef7cc316,2/20(木) 7:30
2025-02-20,09:30,life,ライフ,16,ねとらぼ,アリアナ・グランデ、約8年ぶりに来日　“20分以上に及ぶファンサービス”　両親と“初の日本観光”も,17,https://news.yahoo.co.jp/articles/acc744187e9a143b28e359b89cf4b0fb0ac9fd3a,2/19(水) 19:49
2025-02-20,09:30,life,ライフ,17,ファイナンシャルフィールド,うちは世帯年収が「360万円」しかなく貧乏ですが、妻が「5万円」を超えるドライヤーを欲しがっています…年収に見合っていないでしょうか？,17,https://news.yahoo.co.jp/articles/feeeb6a1c836730ebfbbb9507b4f06a33e34daf8,2/19(水) 13:30
2025-02-20,09:30,life,ライフ,18,女子SPA！,品川区の「オーガニック給食」に賛否。オーガニックにモヤモヤする人に伝えたい4つの事実,15,https://news.yahoo.co.jp/articles/526d3b9df644c0e388a929f0e214055fab07845b,2/20(木) 8:46
2025-02-20,09:30,life,ライフ,19,AERA dot.,子育てしながら管理職になる女性が「ロールモデル」？　独身・既婚、どちらも「普通」でいい,15,https://news.yahoo.co.jp/articles/239987968a323c34e842c8304b33781cf0e6820a,2/19(水) 16:32
2025-02-20,09:30,life,ライフ,20,ねとらぼ,大阪・梅田のど真ん中で派手にスカート裂けた → 笑うしかない大失態に「ちょ待てよ」「こうなった時の気持ち考えて」,15,https://news.yahoo.co.jp/articles/1cb38e982b1d897b917d91f6ca06ac4821e9a8dd,2/20(木) 7:50
2025-02-20,09:30,life,ライフ,21,オリコン,無印良品、「折りたためるスツール」回収対象を拡大　“転倒の恐れ”使用中止呼び掛け謝罪,14,https://news.yahoo.co.jp/articles/4bdf99b6779f47445b08f21a5d21163937516d95,2/19(水) 10:14
2025-02-20,09:30,life,ライフ,22,現代ビジネス,フランス人が「ちょっと変」だと思う、日本人には当たり前の行動…驚きの「意識の差」があった,13,https://news.yahoo.co.jp/articles/f3f065fef90dc951cf8ee329e19134e4ce220dd6,2/20(木) 7:01
2025-02-20,09:30,life,ライフ,23,Book Bang,韓国を美容大国にした思想とは？　容姿はアジア人、頭脳はアメリカ人の女性記者が「模範的顧客」になってわかった原動力（レビュー）,13,https://news.yahoo.co.jp/articles/5d02a6644ea58958e4d288aedf3e00e474d5ab54,2/20(木) 6:00
2025-02-20,09:30,life,ライフ,24,AUTO BILD JAPAN Web,【クラッシュ！！！】あっちゃー　マヌケでドジ（笑）　それとも酔ってた？5千万円のマラネロ製V12フェラーリ812が凡ミスによって衝突＆破損,12,https://news.yahoo.co.jp/articles/385996d5d5dd2f43ce5f7a7ef3d8664662b40cfe,2/20(木) 8:40
2025-02-20,09:30,life,ライフ,25,ねとらぼ,【男性が選ぶ】2日連続でもいける「ラーメンチェーン」ランキング！　2位は「ラーメンショップ」、1位は？,12,https://news.yahoo.co.jp/articles/a09017564cc05566f7361bf778cceacfe971ef2c,2/19(水) 19:55
2025-02-20,09:30,life,ライフ,26,オトナンサー,イマドキの“学校あるある”「授業終わりに混む」→さっぱり分からない大人世代から困惑の声「え…知らん…」「老いを実感」,11,https://news.yahoo.co.jp/articles/8add28d2077fff8718b19cd90a2953dba0cae957,2/19(水) 22:10
2025-02-20,09:30,life,ライフ,27,ねとらぼ,「レギュラーガソリンが安い都道府県」ランキング！　2位は「千葉県」の174.2円、1位は？【2025年2月18日時点】,10,https://news.yahoo.co.jp/articles/3fc8203391e3ae92081b6aab88e9c25efe07a75e,2/20(木) 8:30
2025-02-20,09:30,life,ライフ,28,ファイナンシャルフィールド,釣りでかかった「伊勢海老」の持ち帰りは禁止？持ち帰ろうとしたら地元の方に注意されたけど、密漁とみなされる？,10,https://news.yahoo.co.jp/articles/a9ad1dcc869c4ef8a6b7d366fe4214cd325f7083,2/19(水) 11:20
2025-02-20,09:30,life,ライフ,29,ラジトピ　ラジオ関西トピックス,1年足らずで10万袋売れた『ニャンふル』って知ってる？　猫型の“焼麩”が「かわいすぎる」と話題に,10,https://news.yahoo.co.jp/articles/f2c53acf3cff3378eefd172ef6878f826c06a004,2/20(木) 6:55
2025-02-20,09:30,life,ライフ,30,週刊SPA!,日本人と国際結婚したロシア人女性が語る、日本人男性の魅力「感情表現がシャイで繊細なところも素敵だと思います」,10,https://news.yahoo.co.jp/articles/55dab9025539e8e99b727503ecdea659e3c46a0e,2/19(水) 15:53
2025-02-20,09:30,life,ライフ,31,ファイナンシャルフィールド,「現金なんて不要！」そう思っていたら駐車場の精算機が「現金」のみ？ 「キャッシュレス派」が困る瞬間を紹介,10,https://news.yahoo.co.jp/articles/745be984ab99214748725d8b74bfd1dec5c39b7f,2/19(水) 15:10
2025-02-20,09:30,life,ライフ,32,現代ビジネス,”嫌韓”によって「孤独の病」を患ってしまった父…”極左的思考”や”新興宗教”などあらゆるシーンで起こっている!?,9,https://news.yahoo.co.jp/articles/81a4c2d7666dd810596616df1492b6644c14b17d,2/20(木) 7:01
2025-02-20,09:30,life,ライフ,33,TOKYO FM＋,新NISA開始から1年 つみたて投資枠は「平均47万円」 吉田明世「日々の値動きに左右されず、強い気持ちを持って待つことが大事」,9,https://news.yahoo.co.jp/articles/fb5c901a3c6c0ab679852eb758e66a23b1a42035,2/20(木) 6:50
2025-02-20,09:30,life,ライフ,34,ENGINE WEB,なぜ従来型のオーナーは悩み、悔しがるのか？　マイナーチェンジで新しくなった三菱アウトランダーを公道で試乗した,9,https://news.yahoo.co.jp/articles/183c49dae8ddb7954e11eb002b5904179ad61f26,2/20(木) 7:10
2025-02-20,09:30,life,ライフ,35,ねとらぼ,すっぴんボサボサのママがメイクをしたら……　目を疑う“衝撃の変身”が250万再生「飲み物吹いたw」「同一人物と思えない」【海外】,8,https://news.yahoo.co.jp/articles/adbe1fa29acdd77aa1846d7e0d2a671300403f40,2/20(木) 7:30
2025-02-20,09:30,life,ライフ,36,ファイナンシャルフィールド,実家の母に「出産は早いほうがいい」と言われたけど、世帯年収350万円で経済面が不安です。「最近は児童手当もあるし、子育てはなんとかなる」とのことだけど、本当に大丈夫でしょうか…？,8,https://news.yahoo.co.jp/articles/11649347e27487b5dbab2985edf46fbb1a69bc09,2/19(水) 13:50
2025-02-20,09:30,life,ライフ,37,ねとらぼ,「クッキーにしたらいい感じになる都道府県ランキング」を発表 →“まさかの結果”に地元民歓喜　「誇りを持っていこうと思います」,7,https://news.yahoo.co.jp/articles/4111df37c794b3b9ec80a94be2d8ce7e16085883,2/20(木) 7:40
2025-02-20,09:30,life,ライフ,38,ねとらぼ,孫がおばあちゃん家に泊まったら……　誰もが身に覚えのある“世界共通の現象”に「これ見て車の中で泣いてる」【海外】,7,https://news.yahoo.co.jp/articles/08588fc3d78e25ef364d51a5de1b9c637fcf4cfa,2/19(水) 19:54
2025-02-20,09:30,life,ライフ,39,NEWSポストセブン,真冬も白ソックスに生足を強いるブラック校則　批判の一方、学校側の事情「3次募集ですら定員の埋まらない高校なんて厳しく管理しなきゃ崩壊」,7,https://news.yahoo.co.jp/articles/52692988875581319012d9a7c693e1253b50faf0,2/19(水) 16:15
2025-02-20,09:30,life,ライフ,40,Book Bang,カラスに突かれ、土の上に横たわる子猫…「麦のように踏まれても立ち上がって」と願った保護主が目を見張った“奇跡のような回復”,7,https://news.yahoo.co.jp/articles/353eafc317ff75b297f922a29353a069e4d2570e,2/20(木) 6:00
