scrp_date,scrp_time,genre_en,genre_jp,rank,media_jp,title,comment,link,date_original
2025-08-31,09:36,TTL,総合,1,産経新聞,性犯罪再犯クルド人が控訴　傍聴女性はトルコ語で擁護「人を殺したわけではない」　「移民」と日本人,981,https://news.yahoo.co.jp/articles/ccc317ea80656a85256cb3661a578b153f23997e,8/31(日) 7:00
2025-08-31,09:36,TTL,総合,2,オトナンサー,歯磨き前、歯ブラシはぬらすorぬらさない？　SNS「ぬらすと泡だらけに」…歯科衛生士が教える“正しい使い方”,441,https://news.yahoo.co.jp/articles/0f1874c922c1266c173177f00532888dc60662a4,8/31(日) 8:10
2025-08-31,09:36,TTL,総合,3,共同通信,【独自】生活保護申請時に財布の中身確認　三重県鈴鹿市、1円単位で,391,https://news.yahoo.co.jp/articles/7d1fd5f9da5e83b022248f5d22e6e0e21cfb8968,8/30(土) 21:00
2025-08-31,09:36,TTL,総合,4,中国新聞デジタル,生理止まれば「それで正解」と言う顧問、広島の高校部活の実態　卒業生「洗脳状態だった」,388,https://news.yahoo.co.jp/articles/dca7caea7c29b5d345312f0bf42c4e07149fcabb,8/31(日) 7:01
2025-08-31,09:36,TTL,総合,5,CHANTO WEB,「俺のオカン、モモコやで」3児の母ハイヒール・モモコの子育て方針「死んでもお金は残さない。それがお互いのため」,285,https://news.yahoo.co.jp/articles/fd29b2459e8a943e10cb62fe9b660ce9f1ceb365,8/31(日) 6:01
2025-08-31,09:36,TTL,総合,6,朝日新聞,アダルト動画の違法ダウンロード、相次ぐ開示請求　高額な示談金も,236,https://news.yahoo.co.jp/articles/2f3cabc7fa249c00b781358601912a279d0c9587,8/31(日) 8:00
2025-08-31,09:36,TTL,総合,7,共同通信,歴史問題でも中国と共闘　ロシア大統領、日本名指し,216,https://news.yahoo.co.jp/articles/cb98a2364bc90e0fe6cc0fc1144f9e9c0f532831,8/30(土) 11:49
2025-08-31,09:36,TTL,総合,8,CBCテレビ,「元の体に戻りたい」 新型コロナワクチン後遺症に悩む患者たち  救済進まずかさむ医療負担,195,https://news.yahoo.co.jp/articles/bd45dae5425dbbb7aced4ed2160d3da557777977,8/30(土) 14:02
2025-08-31,09:36,TTL,総合,9,スポニチアネックス,中日・井上監督“苦肉の藤浪対策”示唆「左打者が主になると思う」31日に対戦,186,https://news.yahoo.co.jp/articles/5102a0a80777a4b39f9d51404559a7d30fbaea86,8/30(土) 23:03
2025-08-31,09:36,TTL,総合,10,日刊スポーツ,石丸伸二氏、全敗参院選２日後の本音「そろそろ卒業ですかね」政治家引退に言及、理由も明かした,183,https://news.yahoo.co.jp/articles/b43f7cce6a65a5ec49f48a7ece3cd24fb6dcc4e0,8/31(日) 5:00
2025-08-31,09:36,TTL,総合,11,朝日新聞,東京23区の中古「億ション」10年で16倍　港・千代田で半数以上,174,https://news.yahoo.co.jp/articles/ff9ce22111d13a5d3c3ccf366cca9ce0bad0f448,8/31(日) 6:30
2025-08-31,09:36,TTL,総合,12,プレジデントオンライン,"だから若者が都会に逃げていく…日本人を貧しくした""一極集中""と""失われた30年""の知られざる関係",160,https://news.yahoo.co.jp/articles/9d99d415ac360dcf7ff958a050ffb509c3613e54,8/31(日) 8:16
2025-08-31,09:36,TTL,総合,13,日刊スポーツ,「再生の道」代表退任の石丸伸二氏「石丸さんいないなら辞めますという人は政治家に向いてない」,137,https://news.yahoo.co.jp/articles/a76e6d2ac70a405eeeacf9cf4f7cf079370b6029,8/31(日) 5:00
2025-08-31,09:36,TTL,総合,14,日刊スポーツ,ひろゆき氏「やっぱ、参政党支持者はアホなんちゃう？」と私見,121,https://news.yahoo.co.jp/articles/469c75956363745a3e0e00c81f8be40fe16415a7,8/31(日) 9:11
2025-08-31,09:36,TTL,総合,15,毎日新聞,北海道・滝川の高速道路で車とクマが接触　けが人なし、クマは死ぬ,117,https://news.yahoo.co.jp/articles/b7bfed90429f94c5627fe316307c4e6ff8ad1298,8/30(土) 22:40
2025-08-31,09:36,TTL,総合,16,日刊スポーツ,黒沢年雄、老舗飲食店の味の変化に落胆し「有名店の奢りと勉強不足」手厳しくバッサリ,112,https://news.yahoo.co.jp/articles/8f87cdb40afd9eef7b29fa1fd7896c5a3fc191fb,8/31(日) 5:30
2025-08-31,09:36,TTL,総合,17,スポニチアネックス,【高校野球】広陵新主将「勝ててよかった」神妙　逆風の中、主将に立候補「自分からやらせてくださいと」,108,https://news.yahoo.co.jp/articles/3906492ed9a00b8e227b5b29df9c4f560ea43b02,8/30(土) 16:53
2025-08-31,09:36,TTL,総合,18,ENCOUNT,『24時間テレビ』横山裕、深夜までに39km走って早朝に再出発　亡母への思い「おかんがタスキをかけてくれたんだと」,107,https://news.yahoo.co.jp/articles/0e0fd852057fe20cd033f1a4bd48345f3e11878c,8/31(日) 8:11
2025-08-31,09:36,TTL,総合,19,ダイヤモンド・オンライン,「MARCHって学力も就活も中途半端じゃないですか？ それなのに社会での評価が高すぎると思います」。大学の評価はどう決まっているのか考える,106,https://news.yahoo.co.jp/articles/38eccd29949589a74374ee4a7c2a2f8f21667cc7,8/31(日) 7:40
2025-08-31,09:36,TTL,総合,20,読売新聞オンライン,プーチン大統領「日本の軍国主義が復活しつつある」と主張…新華社書面インタビュー,103,https://news.yahoo.co.jp/articles/9bd635541f7315e7321eff8d60f09a6dc63d653b,8/31(日) 5:00
2025-08-31,09:36,TTL,総合,21,ENCOUNT,フジ50億円訴追で浮上「役員保険」問題　港氏、大多氏を“フジ負担の保険”が救うねじれ現象…上限ありなら自己破産の可能性も,101,https://news.yahoo.co.jp/articles/40e95b7e995a848fe521893e21c84a446d2d9480,8/31(日) 8:24
2025-08-31,09:36,TTL,総合,22,ベースボールキング,岡田彰布氏、阪神内野手登録の熊谷、高寺がレフトで先発する現状に「専門の外野手がいてるんだけど、情けない」,100,https://news.yahoo.co.jp/articles/d4905210070a9e143abde8f55797896910a71145,8/31(日) 8:00
2025-08-31,09:36,TTL,総合,23,NEWSポストセブン,《トリプルボギー不倫》女子プロ2人が被害妻から“敵前逃亡”、唯一出場した川崎春花が「逃げられなかったワケ」,98,https://news.yahoo.co.jp/articles/c613ddb10c01822b5827ecffe220c56292190794,8/31(日) 7:15
2025-08-31,09:36,TTL,総合,24,テレビ朝日系（ANN）,太陽光パネルのリサイクル断念　コストに課題…負担は誰が　「再エネ拡大阻害」懸念も,94,https://news.yahoo.co.jp/articles/e483aab9ed9a1f0345c2a3bf482ea8af35fa2f20,8/30(土) 15:01
2025-08-31,09:36,TTL,総合,25,産経新聞,プーチン氏「架空の中露脅威論で軍国主義を復活」と日本非難　歴史でも中露共闘アピール,93,https://news.yahoo.co.jp/articles/32ab33c704a2f4df2052f7e4d066bc56015163ef,8/31(日) 8:14
2025-08-31,09:36,TTL,総合,26,デイリースポーツ,ヤクルト・村上が衝撃の１試合３発！全てバックスクリーンへ　チームトップ１４号　驚異的ペースで本塁打量産,93,https://news.yahoo.co.jp/articles/13756694fe099953334acd3f38a19812a06e994e,8/30(土) 20:40
2025-08-31,09:36,TTL,総合,27,中国新聞デジタル,複数女児にわいせつ容疑の小学教諭にいまだ給与　広島市教委処分できず,92,https://news.yahoo.co.jp/articles/09d9fceb2c8647968c8a7c054264560b32310fd7,8/30(土) 12:49
2025-08-31,09:36,TTL,総合,28,デイリースポーツ,新体制の広陵が秋の初戦を五回コールドで突破　２３－０で大勝　報道陣は約２０社が集結　秋季広島大会地区予選,89,https://news.yahoo.co.jp/articles/8060f096468630052c55e631863bb2cbd00b450d,8/30(土) 16:07
2025-08-31,09:36,TTL,総合,29,日刊スポーツ,「８歳に発情する49歳なんてどう考えても異常。世の中には鬼畜がいる」アイドルが私見,88,https://news.yahoo.co.jp/articles/b91e4d49cb20804f1548f71b074a98b5e25bf82e,8/30(土) 14:40
2025-08-31,09:36,TTL,総合,30,BuzzFeed Japan,「人々は独裁者を望んでいる」トランプ氏の発言が波紋…SNS「支持者ですら言ってない」,87,https://news.yahoo.co.jp/articles/cd7f5ad4e017ed43e4fa3a312809cef3b0527712,8/31(日) 7:05
2025-08-31,09:36,TTL,総合,31,時事通信,森山氏、「石破降ろし」けん制　国民と自民内の乖離懸念,86,https://news.yahoo.co.jp/articles/d306e83fc937c7aeed87fb6aab5d866d48585203,8/30(土) 16:20
2025-08-31,09:36,TTL,総合,32,スポニチアネックス,60歳沢口靖子　異例の月9主演　ドラマ視聴者高齢化　関係者「主演俳優の年齢が上がる傾向になるかも」,86,https://news.yahoo.co.jp/articles/1fff3c1a3b3af2eff65a0be0eeb0ada86a7e6e12,8/31(日) 5:00
2025-08-31,09:36,TTL,総合,33,ウェザーマップ,8月終盤の異例の酷暑　最終日も収まらず　東海や近畿中心に危険な暑さで名古屋40℃予想,85,https://news.yahoo.co.jp/articles/36b47b496bc36a22f9ea904b78f3947521620272,8/31(日) 6:30
2025-08-31,09:36,TTL,総合,34,スポニチアネックス,電撃婚発表のはじめしゃちょー、一般人の妻巡り注意喚起「詮索や盗撮しないで」動画での共演もしない方針,85,https://news.yahoo.co.jp/articles/33112b4d126bb43bbd0fc2b783e842988238c489,8/30(土) 18:40
2025-08-31,09:36,TTL,総合,35,オリコン,13歳で妊娠、14歳で母になった女性…母娘で歩んだ20年を振り返り「周りに何を言われようが、娘のためなら我慢もできたし、耐えられた」,83,https://news.yahoo.co.jp/articles/024a333fe66f6583c6d62304ec9d4ecd735756c8,8/31(日) 7:20
2025-08-31,09:36,TTL,総合,36,産経新聞,「あしき前例に」「責務歪める」…自民総裁選「賛成なら政務三役辞任」論に若手・中堅異論,83,https://news.yahoo.co.jp/articles/a8d6d7e7b541c1d42c5fa2d34a48af6e6323f8ec,8/31(日) 7:00
2025-08-31,09:36,TTL,総合,37,ウェザーマップ,8月最終日に名古屋で40度か　31日(日)は広く晴れて危険な暑さに,80,https://news.yahoo.co.jp/articles/f001cfd1f638299e04acbcdbde4a4bd004f579aa,8/30(土) 22:39
2025-08-31,09:36,TTL,総合,38,テレビ朝日系（ANN）,中ロ朝3首脳が北京で一堂に　並んでパレード観閲へ,80,https://news.yahoo.co.jp/articles/08654d5347a70deb065f7dfe18d6718dff0d4f50,8/30(土) 22:30
2025-08-31,09:36,TTL,総合,39,デイリースポーツ,フジ退社→ＰＴＳＤ公表の渡邊渚アナ「体のラインが美しく見える写真多め」見応えに自信　未公開カットのデジタル写真集３５２０円発売発表,79,https://news.yahoo.co.jp/articles/da99de9cf4bc9e5eb16129259907f57f245bde14,8/31(日) 9:02
2025-08-31,09:36,TTL,総合,40,FRIDAY,「裏金議員を名指しして刺し違えては？」石丸伸二氏が止まらない「石破おろし」に苦戦の石破総理に助言,76,https://news.yahoo.co.jp/articles/eb3fc9e5f84a7c5c1820cc7e87dcb80e965b4437,8/31(日) 8:00
