scrp_date,scrp_time,genre_en,genre_jp,rank,media_jp,title,comment,link,date_original
2025-08-31,11:36,TTL,総合,1,毎日新聞,子どもへの「日本人ファースト」影響　夏休み明け、教員に懸念広がる,1390,https://news.yahoo.co.jp/articles/ed889de3c05cb5408027f7bdc18dbb268b8dfdeb,8/31(日) 10:00
2025-08-31,11:36,TTL,総合,2,産経新聞,性犯罪再犯クルド人が控訴　傍聴女性はトルコ語で擁護「人を殺したわけではない」　「移民」と日本人,815,https://news.yahoo.co.jp/articles/ccc317ea80656a85256cb3661a578b153f23997e,8/31(日) 7:00
2025-08-31,11:36,TTL,総合,3,日刊スポーツ,ひろゆき氏「やっぱ、参政党支持者はアホなんちゃう？」と私見,376,https://news.yahoo.co.jp/articles/469c75956363745a3e0e00c81f8be40fe16415a7,8/31(日) 9:11
2025-08-31,11:36,TTL,総合,4,週刊SPA!,ロン毛、金髪…若者よりも中年に“派手な髪形”が増えているワケ。「脱・小汚いおじさん」のために足掻く男性の胸中,351,https://news.yahoo.co.jp/articles/bbfc2533a5609d8110a870819b630a1834fef67b,8/31(日) 8:54
2025-08-31,11:36,TTL,総合,5,共同通信,【独自】生活保護申請時に財布の中身確認　三重県鈴鹿市、1円単位で,349,https://news.yahoo.co.jp/articles/7d1fd5f9da5e83b022248f5d22e6e0e21cfb8968,8/30(土) 21:00
2025-08-31,11:36,TTL,総合,6,デイリースポーツ,上原浩治氏「阪神にいってもらうぐらいのルールを作った方がいいんじゃないかな」虎独走、２位巨人と１５ゲーム＆２位以下借金のＣＳ争いに指摘「２位以下が日本Ｓ出て優勝したらどうなの？って疑問が」,334,https://news.yahoo.co.jp/articles/2ee29e5243dd19b7b92c71b8d0b287ef3981978d,8/31(日) 9:51
2025-08-31,11:36,TTL,総合,7,オトナンサー,歯磨き前、歯ブラシはぬらすorぬらさない？　SNS「ぬらすと泡だらけに」…歯科衛生士が教える“正しい使い方”,317,https://news.yahoo.co.jp/articles/0f1874c922c1266c173177f00532888dc60662a4,8/31(日) 8:10
2025-08-31,11:36,TTL,総合,8,中国新聞デジタル,生理止まれば「それで正解」と言う顧問、広島の高校部活の実態　卒業生「洗脳状態だった」,282,https://news.yahoo.co.jp/articles/dca7caea7c29b5d345312f0bf42c4e07149fcabb,8/31(日) 7:01
2025-08-31,11:36,TTL,総合,9,朝日新聞,アダルト動画の違法ダウンロード、相次ぐ開示請求　高額な示談金も,234,https://news.yahoo.co.jp/articles/2f3cabc7fa249c00b781358601912a279d0c9587,8/31(日) 8:00
2025-08-31,11:36,TTL,総合,10,CHANTO WEB,「俺のオカン、モモコやで」3児の母ハイヒール・モモコの子育て方針「死んでもお金は残さない。それがお互いのため」,224,https://news.yahoo.co.jp/articles/fd29b2459e8a943e10cb62fe9b660ce9f1ceb365,8/31(日) 6:01
2025-08-31,11:36,TTL,総合,11,スポーツ報知,上原浩治さん、セＣＳ争いに提言　２位以下が勝率５割切り「何かルールを作ってほしいなって思いますね」,217,https://news.yahoo.co.jp/articles/ccbb96fc8134fd77602853898f3105d6f96baac2,8/31(日) 9:26
2025-08-31,11:36,TTL,総合,12,デイリースポーツ,埼玉県大野知事　治安悪化で警察署を新設→外務省にトルコ国籍者への短期滞在者ビザ免除を一時停止求めた意図,208,https://news.yahoo.co.jp/articles/e120d54fff8e15c49f66a78beb6f54db07d6be52,8/31(日) 10:03
2025-08-31,11:36,TTL,総合,13,共同通信,歴史問題でも中国と共闘　ロシア大統領、日本名指し,199,https://news.yahoo.co.jp/articles/cb98a2364bc90e0fe6cc0fc1144f9e9c0f532831,8/30(土) 11:49
2025-08-31,11:36,TTL,総合,14,中央日報日本語版,「中国で日本人っぽい行動控えて」…日本、自国民に公開警戒令,190,https://news.yahoo.co.jp/articles/82ee9ce33b610660ca2dcd18748fc14043578bcc,8/31(日) 9:46
2025-08-31,11:36,TTL,総合,15,CBCテレビ,「元の体に戻りたい」 新型コロナワクチン後遺症に悩む患者たち  救済進まずかさむ医療負担,179,https://news.yahoo.co.jp/articles/bd45dae5425dbbb7aced4ed2160d3da557777977,8/30(土) 14:02
2025-08-31,11:36,TTL,総合,16,日刊スポーツ,石丸伸二氏、全敗参院選２日後の本音「そろそろ卒業ですかね」政治家引退に言及、理由も明かした,166,https://news.yahoo.co.jp/articles/b43f7cce6a65a5ec49f48a7ece3cd24fb6dcc4e0,8/31(日) 5:00
2025-08-31,11:36,TTL,総合,17,毎日新聞,一番過酷だった「水ダウ」のロケ　田村真子アナ救った親鸞聖人の教え,164,https://news.yahoo.co.jp/articles/aab61303e46e44287669e504f44b5e5f2e6d7f15,8/31(日) 9:00
2025-08-31,11:36,TTL,総合,18,スポニチアネックス,中日・井上監督“苦肉の藤浪対策”示唆「左打者が主になると思う」31日に対戦,159,https://news.yahoo.co.jp/articles/5102a0a80777a4b39f9d51404559a7d30fbaea86,8/30(土) 23:03
2025-08-31,11:36,TTL,総合,19,日刊スポーツ,小沢一郎氏“自民党の終焉に最もふさわしい人物”の実名あげバッサリ「頭の中は利権と選挙だけ」,157,https://news.yahoo.co.jp/articles/2253f634aafd5802dd3bd21f1238dbab82085eac,8/31(日) 9:47
2025-08-31,11:36,TTL,総合,20,女性自身,「言い過ぎだよ」上田晋也　ギネス目指すラリー企画をミスした宮川大輔への“執拗いじり”に批判噴出,152,https://news.yahoo.co.jp/articles/9954d7ff8d6633b7496e3b4d85a4573e2b5c2bdc,8/31(日) 11:00
2025-08-31,11:36,TTL,総合,21,朝日新聞,東京23区の中古「億ション」10年で16倍　港・千代田で半数以上,129,https://news.yahoo.co.jp/articles/ff9ce22111d13a5d3c3ccf366cca9ce0bad0f448,8/31(日) 6:30
2025-08-31,11:36,TTL,総合,22,RKB毎日放送,「同僚女性の水筒に自らの体液を混入させ飲ませた」認定した裁判所　51歳男に「性的自由を侵害する度合い大きい」厳しく指摘【判決詳報】,128,https://news.yahoo.co.jp/articles/4cec3ec69d28de93245024dc28cb6dc0a0bc77b8,8/31(日) 10:01
2025-08-31,11:36,TTL,総合,23,プレジデントオンライン,「令和のコメ騒動」は再び起こる…価格高騰の真犯人は「日本人の胃袋に小麦を詰め込む」アメリカの政策だった,111,https://news.yahoo.co.jp/articles/c49c2c00e3e8adc0c2ad3c3bd416611269e9533c,8/31(日) 9:16
2025-08-31,11:36,TTL,総合,24,日刊スポーツ,「再生の道」代表退任の石丸伸二氏「石丸さんいないなら辞めますという人は政治家に向いてない」,110,https://news.yahoo.co.jp/articles/a76e6d2ac70a405eeeacf9cf4f7cf079370b6029,8/31(日) 5:00
2025-08-31,11:36,TTL,総合,25,日刊スポーツ,橋下徹氏、移民問題めぐりフランスで現場視察したと明かす「きれいごとだけではすまない問題に」,108,https://news.yahoo.co.jp/articles/a855f3872c777290f3d54f35867fbf828b0bbe98,8/31(日) 9:09
2025-08-31,11:36,TTL,総合,26,デイリースポーツ,酷暑の中激走の横山裕　「つまずいたか、ひねったか」アナが中継→右足ひきずる　ＳＮＳ上「背中押すのがつらい」「大丈夫？」「心配」「どうか無事に」「頑張って」,108,https://news.yahoo.co.jp/articles/e8a9f98df3a8b176fb62fd1509fc43de7fdd7099,8/31(日) 9:32
2025-08-31,11:36,TTL,総合,27,週刊SPA!,新幹線で化粧をする女性の“まさかの行動”に絶句…注意した結果返ってきた「予想外すぎる一言」,107,https://news.yahoo.co.jp/articles/01fc4a22cf0c81216dadb280880c88ec6a2d7b27,8/31(日) 8:53
2025-08-31,11:36,TTL,総合,28,ENCOUNT,『24時間テレビ』横山裕、深夜までに39km走って早朝に再出発　亡母への思い「おかんがタスキをかけてくれたんだと」,106,https://news.yahoo.co.jp/articles/0e0fd852057fe20cd033f1a4bd48345f3e11878c,8/31(日) 8:11
2025-08-31,11:36,TTL,総合,29,テレビ朝日系（ANN）,愛子さま担当1人から3人へ増員要求  ティアラ新調は見送り 宮内庁,102,https://news.yahoo.co.jp/articles/c2d930e91b3d3db456810085fb13f93ae19ab023,8/31(日) 9:39
2025-08-31,11:36,TTL,総合,30,デイリースポーツ,フジ退社→ＰＴＳＤ公表の渡邊渚アナ「体のラインが美しく見える写真多め」見応えに自信　未公開カットのデジタル写真集３５２０円発売発表,101,https://news.yahoo.co.jp/articles/da99de9cf4bc9e5eb16129259907f57f245bde14,8/31(日) 9:02
2025-08-31,11:36,TTL,総合,31,毎日新聞,北海道・滝川の高速道路で車とクマが接触　けが人なし、クマは死ぬ,101,https://news.yahoo.co.jp/articles/b7bfed90429f94c5627fe316307c4e6ff8ad1298,8/30(土) 22:40
2025-08-31,11:36,TTL,総合,32,スポニチアネックス,【高校野球】広陵新主将「勝ててよかった」神妙　逆風の中、主将に立候補「自分からやらせてくださいと」,99,https://news.yahoo.co.jp/articles/3906492ed9a00b8e227b5b29df9c4f560ea43b02,8/30(土) 16:53
2025-08-31,11:36,TTL,総合,33,みんかぶマガジン,元NHK党秘書が批判「日本ファクトチェックセンターは国民から信頼を失っている」形式的なデータ比較に終始し重要論点、社会構造など無視,97,https://news.yahoo.co.jp/articles/c3f48a0b57bb7a4b8b22b53f66e4f5e3b1684cee,8/31(日) 9:10
2025-08-31,11:36,TTL,総合,34,女子SPA！,「父親のふりをする男」が5歳の娘を連れ去ろうと…ショッピングモールの“魔の構造”が生んだ、わずか5分の恐怖,97,https://news.yahoo.co.jp/articles/6f6797e48a79505696a1cd63b4192e83f2a3a53a,8/31(日) 8:46
2025-08-31,11:36,TTL,総合,35,プレジデントオンライン,"だから若者が都会に逃げていく…日本人を貧しくした""一極集中""と""失われた30年""の知られざる関係",96,https://news.yahoo.co.jp/articles/9d99d415ac360dcf7ff958a050ffb509c3613e54,8/31(日) 8:16
2025-08-31,11:36,TTL,総合,36,ENCOUNT,ロバート秋山、喪黒福造“再現”の舞台裏　オファー時はMAX体重103kg「できる限り雰囲気を似せられるように」,90,https://news.yahoo.co.jp/articles/cda6adcb149e8ff0616f11c5b16650c3a3979939,8/31(日) 10:20
2025-08-31,11:36,TTL,総合,37,オリコン,13歳で妊娠、14歳で母になった女性…母娘で歩んだ20年を振り返り「周りに何を言われようが、娘のためなら我慢もできたし、耐えられた」,89,https://news.yahoo.co.jp/articles/024a333fe66f6583c6d62304ec9d4ecd735756c8,8/31(日) 7:20
2025-08-31,11:36,TTL,総合,38,日刊スポーツ,黒沢年雄、老舗飲食店の味の変化に落胆し「有名店の奢りと勉強不足」手厳しくバッサリ,88,https://news.yahoo.co.jp/articles/8f87cdb40afd9eef7b29fa1fd7896c5a3fc191fb,8/31(日) 5:30
2025-08-31,11:36,TTL,総合,39,テレビ朝日系（ANN）,太陽光パネルのリサイクル断念　コストに課題…負担は誰が　「再エネ拡大阻害」懸念も,88,https://news.yahoo.co.jp/articles/e483aab9ed9a1f0345c2a3bf482ea8af35fa2f20,8/30(土) 15:01
2025-08-31,11:36,TTL,総合,40,ベースボールキング,岡田彰布氏、阪神内野手登録の熊谷、高寺がレフトで先発する現状に「専門の外野手がいてるんだけど、情けない」,87,https://news.yahoo.co.jp/articles/d4905210070a9e143abde8f55797896910a71145,8/31(日) 8:00
