scrp_date,scrp_time,genre_en,genre_jp,rank,media_jp,title,comment,link,date_original
2025-08-31,12:23,business,経済,1,朝日新聞,東京23区の中古「億ション」10年で16倍　港・千代田で半数以上,115,https://news.yahoo.co.jp/articles/ff9ce22111d13a5d3c3ccf366cca9ce0bad0f448,8/31(日) 6:30
2025-08-31,12:23,business,経済,2,プレジデントオンライン,「令和のコメ騒動」は再び起こる…価格高騰の真犯人は「日本人の胃袋に小麦を詰め込む」アメリカの政策だった,99,https://news.yahoo.co.jp/articles/c49c2c00e3e8adc0c2ad3c3bd416611269e9533c,8/31(日) 9:16
2025-08-31,12:23,business,経済,3,みんかぶマガジン,元NHK党秘書が批判「日本ファクトチェックセンターは国民から信頼を失っている」形式的なデータ比較に終始し重要論点、社会構造など無視,86,https://news.yahoo.co.jp/articles/c3f48a0b57bb7a4b8b22b53f66e4f5e3b1684cee,8/31(日) 9:10
2025-08-31,12:23,business,経済,4,テレビ朝日系（ANN）,太陽光パネルのリサイクル断念　コストに課題…負担は誰が　「再エネ拡大阻害」懸念も,85,https://news.yahoo.co.jp/articles/e483aab9ed9a1f0345c2a3bf482ea8af35fa2f20,8/30(土) 15:01
2025-08-31,12:23,business,経済,5,プレジデントオンライン,"だから若者が都会に逃げていく…日本人を貧しくした""一極集中""と""失われた30年""の知られざる関係",83,https://news.yahoo.co.jp/articles/9d99d415ac360dcf7ff958a050ffb509c3613e54,8/31(日) 8:16
2025-08-31,12:23,business,経済,6,ファイナンシャルフィールド,日本の平均年収は「460万円」らしいですが、周りでそれほど稼いでる人をあまり見かけません。実際平均くらい稼いでる人ってどれくらいいますか？,64,https://news.yahoo.co.jp/articles/fdf7e07c1a2bf2fa08d9b268ea17fda6705833f7,8/31(日) 11:30
2025-08-31,12:23,business,経済,7,TBS NEWS DIG Powered by JNN,三菱商事が洋上風力から撤退、『切り札』脱落で再エネ戦略に暗雲【播摩卓士の経済コラム】,50,https://news.yahoo.co.jp/articles/b9efb2cf564acb842075d72116832a798ce0538f,8/30(土) 14:01
2025-08-31,12:23,business,経済,8,東洋経済オンライン,「打率1割台」でも強打者扱いされるメジャーリーグが、日本のプロ野球より進んでいるワケ,47,https://news.yahoo.co.jp/articles/57ecb7acc2867adcf187f2823b81d65e83a04c50,8/31(日) 9:01
2025-08-31,12:23,business,経済,9,東洋経済オンライン,地頭がいいのに5浪した彼の自戒 「帰国子女→名門校中退→高2で大検取得」もなかなか突破できなかった医学部の壁,42,https://news.yahoo.co.jp/articles/bb00ae4d8bdbd09c6028735e7c6d7bcac9f645e6,8/31(日) 8:31
2025-08-31,12:23,business,経済,10,THE GOLD ONLINE（ゴールドオンライン）,"さ、採用です…！年収500万円の40歳居酒屋店長、年収2,000万円だった65歳元大企業部長が面接に来てびっくり、即採用→1ヵ月後「最悪の勘違い」に気づき大後悔した理由【FPが解説】",41,https://news.yahoo.co.jp/articles/280aa2d97de08ca55dc2878577487f4f176aab56,8/31(日) 10:31
2025-08-31,12:23,business,経済,11,テレビ朝日系（ANN）,AI開発「オルツ」不正会計で上場廃止　株価100分の1,36,https://news.yahoo.co.jp/articles/7f854af61070ee32e4039290d8b266a4179bdb2f,8/31(日) 10:34
2025-08-31,12:23,business,経済,12,マネーポストWEB,「外国人労働者に頼らなければ日本社会は回らない」は本当か？　生成AIの進化と普及でホワイトカラーの仕事は縮小、政府も着目する雇用シフトの行方,28,https://news.yahoo.co.jp/articles/4ac159592f2d79a93e1fbe4b62d71e231d0d659f,8/31(日) 6:59
2025-08-31,12:23,business,経済,13,テレビ朝日系（ANN）,「データセンター銀座」の千葉・印西市　駅前新設を制限へ,28,https://news.yahoo.co.jp/articles/16cbb312cc4f5df01008e0d830c5e6ece36895c5,8/31(日) 9:48
2025-08-31,12:23,business,経済,14,共同通信,農相、水田保有への所得補償否定　土地集約で効率化,24,https://news.yahoo.co.jp/articles/a146387d548b2547546f0752108476c40e12de3e,8/31(日) 11:46
2025-08-31,12:23,business,経済,15,THE GOLD ONLINE（ゴールドオンライン）,そこまで言わないとわからないのか…Z世代部下への指示「なるべく早めに提出して」→「きょうの18時までに提出して」死ぬほど丁寧に伝えなきゃいけない理由,24,https://news.yahoo.co.jp/articles/c9b7ac805b6960819f85104675808b82bfe52f03,8/31(日) 5:01
2025-08-31,12:23,business,経済,16,共同通信,米大統領令、共同文書同時か　関税下げ実現へ譲歩,21,https://news.yahoo.co.jp/articles/c9cfb632f81a860c38126b12abe11e7a5374ed9a,8/30(土) 18:32
2025-08-31,12:23,business,経済,17,THE GOLD ONLINE（ゴールドオンライン）,"誰にも言えませんでした…年金18万円・貯蓄3,000万円で渋谷区“推定2億円”の一軒家に暮らす72歳女性、綺麗な身なりで豪華ランチ・観劇を楽しむ「優雅な老後」がいとも簡単に崩壊したワケ【CFPの助言】",19,https://news.yahoo.co.jp/articles/33cee6922dd40f5d7f84f2fe974c668b98f9c1cc,8/31(日) 10:01
2025-08-31,12:23,business,経済,18,マネーポストWEB,《中国資本が続々と日本酒の「酒蔵」を買収》“事業の再生”につながる一方で、従来の人間関係が崩れるリスクも,19,https://news.yahoo.co.jp/articles/b9e8f231c684f961d494cc9a3258fdb832be8bd9,8/31(日) 7:15
2025-08-31,12:23,business,経済,19,マネーポストWEB,3万人超から2000億円を集めた『みんなで大家さん』配当ストップ騒動　運営会社・共生バンクグループの“命取りになりかねない内部資料”と“困り果てて頼った人物”,19,https://news.yahoo.co.jp/articles/4101adf56714831e5dab44e29016da2c58e27b83,8/30(土) 16:15
2025-08-31,12:23,business,経済,20,ファイナンシャルフィールド,駅の“トイレ”を使うためだけに「通勤定期券」で改札内に入る同僚。「入場券」などは買っていないようですが問題ないのでしょうか…？,18,https://news.yahoo.co.jp/articles/1544abf0cf64369981fb601954dbc6533987b6e4,8/30(土) 13:40
2025-08-31,12:23,business,経済,21,ベストカーWeb,よかれと思った行為が実は逆効果!! 愛車の寿命を縮める間違いだらけのやりがちNG行為とは,17,https://news.yahoo.co.jp/articles/c136c01043717e2e984e965f683d1738961203bf,8/31(日) 11:00
2025-08-31,12:23,business,経済,22,MotorFan,レーザー兵器で弾道ミサイルを撃墜!?「ミサイル対処用レーザーシステム」とは…,17,https://news.yahoo.co.jp/articles/909b7fc0df9d9f251f66b6677f1d822e72335f85,8/31(日) 7:10
2025-08-31,12:23,business,経済,23,ダイヤモンド・オンライン,頭のいい人は「休みは、どうだった？」と聞かない。では、代わりになんと聞く？,17,https://news.yahoo.co.jp/articles/46a12852f9f9dde8916f1c016646b1f89901692b,8/31(日) 6:35
2025-08-31,12:23,business,経済,24,共同通信,農相、農地保有での所得補償否定,16,https://news.yahoo.co.jp/articles/696110a98fefe553d3c992f7331b352492a61945,8/31(日) 11:38
2025-08-31,12:23,business,経済,25,Merkmal,なぜ中国は「EVバッテリー」を大量廃棄するのか？ 非正規業者「18万社」の現実とは,15,https://news.yahoo.co.jp/articles/ee7896154b2206bc6243e85fca986776f934fece,8/31(日) 5:51
2025-08-31,12:23,business,経済,26,産経新聞,賛否呼ぶ「スポット保育士」　スキマバイトアプリ使う現場の実態は？　近ごろ都に流行るもの,14,https://news.yahoo.co.jp/articles/6aafadd50e0ea8bc556bb496e43f1163fb4588fe,8/31(日) 11:00
2025-08-31,12:23,business,経済,27,ファイナンシャルフィールド,生活保護を受けている場合に「月3万円」だけバイトしたらどうなる？税金や社会保険、手取り額の影響は？,14,https://news.yahoo.co.jp/articles/1c6232060f511e1806d0ec87b6941e35f526cd17,8/31(日) 9:10
2025-08-31,12:23,business,経済,28,THE GOLD ONLINE（ゴールドオンライン）,〈相続の話を切り出しただけで…〉母の顔が一変。「もう死なせる気なの？」と言われた長男の“その後”,14,https://news.yahoo.co.jp/articles/90785faa5ac2289bbbcb20663a01ae7715d313c8,8/31(日) 9:01
2025-08-31,12:23,business,経済,29,ダイヤモンド・オンライン,「株で資産を増やす人と減らす人の差」専門家が指摘する1つの決定的な要因,13,https://news.yahoo.co.jp/articles/a16eb707a35a72da86f14a097999869531faaac4,8/31(日) 6:01
2025-08-31,12:23,business,経済,30,withnews,わらびもちに「黒蜜ついてない！」コストカットかと思ったらメーカーの戦略だった　地域で差をつける理由は,13,https://news.yahoo.co.jp/articles/f4cde34d6017f89bc9b8eaccab26dd3fe85c21e2,8/31(日) 7:00
2025-08-31,12:23,business,経済,31,鉄道コム,消えた特急列車が10年ぶりに復活？ 10月に特急「あやめ（佐原秋まつり）」運転,13,https://news.yahoo.co.jp/articles/e8be457bef136d6def2e01219d718fa62d156424,8/31(日) 10:35
2025-08-31,12:23,business,経済,32,ファイナンシャルフィールド,高齢の親が介護施設に入所した。無人になった実家、維持すべき？ 売るべき？,11,https://news.yahoo.co.jp/articles/af9fb2390cffc30b998de55d18d9bf255dff9689,8/31(日) 10:10
2025-08-31,12:23,business,経済,33,THE GOLD ONLINE（ゴールドオンライン）,悔やんでいます…〈年金月14万円〉82歳母のため、55歳娘が選んだ「格安老人ホーム」の悲惨な実態に絶句,10,https://news.yahoo.co.jp/articles/a8f6bb8add1a28e9381b00975b56b61d9a05125e,8/31(日) 5:01
2025-08-31,12:23,business,経済,34,ダイヤモンド・オンライン,「一応、早慶出身だから就活はなんとかなると思う」。高学歴なのに就活で落ちぶれる人の特徴・ワースト3,9,https://news.yahoo.co.jp/articles/027e5eb7680825adc6365d12ea105004345ff936,8/31(日) 7:25
2025-08-31,12:23,business,経済,35,朝日新聞,企業誘致、8年連続全国1位の茨城県　圏央道沿線に集中、雇用格差も,9,https://news.yahoo.co.jp/articles/edbb6da88b8690f511c2ff46ea06698cc087953a,8/31(日) 10:00
2025-08-31,12:23,business,経済,36,ダイヤモンド・オンライン,「なぜあの人は高学歴なのに使えないのか？」その悲しすぎる本当の理由,9,https://news.yahoo.co.jp/articles/1f773a89fcaf2d400bdcf7f94ef18f41b9195c1c,8/31(日) 6:50
2025-08-31,12:23,business,経済,37,ファイナンシャルフィールド,「ガソリン代」ついに大幅減!? 暫定税率が“11月廃止”の場合、減税効果はどのくらい？「月8000円」のケースで効果を試算,9,https://news.yahoo.co.jp/articles/8f611a47bc8db0a6d5687dbc9e1fb9cc73b7b939,8/30(土) 13:40
2025-08-31,12:23,business,経済,38,MONEY PLUS,ドライブレコーダーは前方だけで大丈夫？ リアカメラが必要といえる理由,8,https://news.yahoo.co.jp/articles/d26bce5f9b80602afe4323ba6ce51471992bc88a,8/31(日) 11:30
2025-08-31,12:23,business,経済,39,ベストカーWeb,何か特別な使い道でもあるの? たま〜に見かけるバスの「0番乗り場」のヒミツが深すぎる!!,8,https://news.yahoo.co.jp/articles/1cd06cc94b78a2c04896e5efb9a91116d0319d8d,8/31(日) 11:00
2025-08-31,12:23,business,経済,40,産経新聞,11年ぶりフルモデルチェンジ  スライドドア初採用 ダイハツ・ムーヴ　ＣＡＲストーリー,8,https://news.yahoo.co.jp/articles/13306878096df08ac188a7b16a809c5228dbb9b8,8/31(日) 9:38
