scrp_date,scrp_time,genre_en,genre_jp,rank,media_jp,title,comment,link,date_original
2025-03-20,20:06,sports,スポーツ,1,東スポWEB,大谷翔平が今季１号ソロ　フェンス際でファンが触れてビデオ判定,136,https://news.yahoo.co.jp/articles/a5820465ba410d2c26c809c06cf6f9483a6fa0bf,3/19(水) 20:51
2025-03-20,20:06,sports,スポーツ,2,デイリースポーツ,顔面死球で負傷交代の天理・石井は仲間の反撃を胸に刻む　整列には加わらずベンチ前で礼　左目をアイシング、目の下にはガーゼの痛々しい姿,102,https://news.yahoo.co.jp/articles/47649b860e21a7ba79f2a52ac434c070c569c0c1,3/20(木) 14:27
2025-03-20,20:06,sports,スポーツ,3,中日スポーツ,大谷翔平の今季1号、複数の米中継局の解説者が異議唱える「入ったとは思わない」「観客のインターフェアで二塁打」,91,https://news.yahoo.co.jp/articles/bae698082141d2b9db9a9d95e293056a53ce9e20,3/20(木) 17:52
2025-03-20,20:06,sports,スポーツ,4,スポニチアネックス,大谷翔平　2025年の広告収入は推定1億ドル　タイガー・ウッズなど過去達成者はわずか3人の偉業,85,https://news.yahoo.co.jp/articles/f71cf606c792b221e436cff62ffb4a252b118c42,3/20(木) 9:12
2025-03-20,20:06,sports,スポーツ,5,デイリー新潮,“凱旋帰国中”の「大谷翔平」とテレビ局がトラブルに「ルール違反を指摘されて記者が出入り禁止処分」　会社に直撃すると「カメラを回していなかったのですが…」,74,https://news.yahoo.co.jp/articles/df8b34e054ca4cd1b1f8a9c1052fc3304d0d37d8,3/19(水) 20:15
2025-03-20,20:06,sports,スポーツ,6,日刊スポーツ,【中日】井上監督が中軸構想明かす　３番カリステ、４番石川昂、５番細川　好調上林にもチャンス,72,https://news.yahoo.co.jp/articles/ec118ca08f01e582b9b9acd229c176f594d0753c,3/20(木) 18:20
2025-03-20,20:06,sports,スポーツ,7,中日スポーツ,「なんか違和感」 大谷翔平らドジャースVSカブスの開幕シリーズ、相次ぐ著名人の観戦報告… 「公平な売り方してほしい」,71,https://news.yahoo.co.jp/articles/071fe3cf4d6f65b1b4aca719d3ef9beac6ffba5b,3/20(木) 18:40
2025-03-20,20:06,sports,スポーツ,8,Full-Count,大谷翔平、日本開幕戦で自己最速1号！　ファンの手に当たりビデオ判定も…東京ドーム熱狂,68,https://news.yahoo.co.jp/articles/45935566a7f56d4e183f944dc8cc1564d35d94c6,3/19(水) 20:26
2025-03-20,20:06,sports,スポーツ,9,スポーツ報知,大谷翔平のホームラン球は１０歳の少年がゲット「家宝として大事にします」,62,https://news.yahoo.co.jp/articles/6a9bd5519c567168f3ba89a6ac1c525131259b43,3/19(水) 21:45
2025-03-20,20:06,sports,スポーツ,10,NEWSポストセブン,“トリプルボギー不倫”女子ゴルフ選手を待ち受ける「罰金地獄」…「4人目」への波及も噂され周囲がハラハラ,56,https://news.yahoo.co.jp/articles/d8058f01ad745ea644d0fb450d479033088b9206,3/20(木) 11:15
2025-03-20,20:06,sports,スポーツ,11,Full-Count,佐々木朗希の“異変”に同情も…ロッテ時代からの課題が再浮上　専門家の見解,55,https://news.yahoo.co.jp/articles/9203d4c7e5ad4e24789c7993794d62969fe7d144,3/20(木) 8:58
2025-03-20,20:06,sports,スポーツ,12,ベースボールチャンネル,【速報】大谷翔平、今季第1号ホームラン！　フェンスギリギリでスタンドイン【MLB東京シリーズ】,51,https://news.yahoo.co.jp/articles/4c9ef54b9166361b08bc17bad05f93b7b250c84c,3/19(水) 20:31
2025-03-20,20:06,sports,スポーツ,13,東スポWEB,【日本代表】堂安律の〝Ｗ杯優勝〟発言に韓国メディア皮肉「日本は１６強、韓国は４強」,51,https://news.yahoo.co.jp/articles/4cecc48d5b07641a5a169d4e72a5249d7120123f,3/20(木) 13:51
2025-03-20,20:06,sports,スポーツ,14,TBS NEWS DIG Powered by JNN,大谷翔平、待望の今季1号！自身最速の開幕8打席目で達成、VTR検証後にHR判定→ドームに大歓声響く,51,https://news.yahoo.co.jp/articles/a71347f023dc9fd58f8d474a317679271d559a19,3/19(水) 20:28
2025-03-20,20:06,sports,スポーツ,15,時事通信,バッハ氏、終身名誉会長へ　総会で涙のスピーチ―IOC,51,https://news.yahoo.co.jp/articles/64d89cf8a82c450d1429e1fbad6a525a51cb9a2c,3/20(木) 7:47
2025-03-20,20:06,sports,スポーツ,16,Full-Count,大谷翔平の確信歩きで「ギリギリはない」　飛び交う“天井弾”説…「軌道が変わった」,51,https://news.yahoo.co.jp/articles/a0e070c15cd0db346bc1dcb7c08c836517c92a7b,3/20(木) 18:42
2025-03-20,20:06,sports,スポーツ,17,TBS NEWS DIG Powered by JNN,【オリックス】DeNAに完封負け OP戦10敗目...4イニング連続で得点圏も1本出ず 先発・椋木は6回途中2失点 紅林は猛打賞も痛恨落球,48,https://news.yahoo.co.jp/articles/1b4d89228bc837f964501137b22aca59d0776a11,3/20(木) 15:52
2025-03-20,20:06,sports,スポーツ,18,CoCoKARAnext,中日が開幕直前に大ピンチ　ボスラーに続き、負傷離脱の福永に代わる「3番打者」「二塁手」は誰に？,47,https://news.yahoo.co.jp/articles/7a068d8466e1a739ea269ca8e8e3e7bd36814012,3/20(木) 16:31
2025-03-20,20:06,sports,スポーツ,19,TBS NEWS DIG Powered by JNN,【カーリング世界選手権】日本はトルコに敗れ3勝6敗…ミラノ五輪出場枠獲得は極めて厳しい状況に,46,https://news.yahoo.co.jp/articles/faa26d884b6929e8592748f884c1495a447767be,3/20(木) 11:37
2025-03-20,20:06,sports,スポーツ,20,中日スポーツ,全米唯一の全国紙、大谷翔平の今季1号は「二塁打にすべきだった」と寄稿記事　多くの米メディアで「議論呼ぶ」と見出し,45,https://news.yahoo.co.jp/articles/0188fbe49f4eb58cdb2df181950089c9c439b412,3/20(木) 16:57
2025-03-20,20:06,sports,スポーツ,21,東スポWEB,【新日本】「Ｊｕｓｔ　４　Ｇｕｙｓ」が本隊と電撃合体　ユニットは存続し「あくまで共闘という形で戦っていく」,44,https://news.yahoo.co.jp/articles/98a6adbf71377fd0a3dc2e5645f1e8d28a08d3f3,3/20(木) 19:06
2025-03-20,20:06,sports,スポーツ,22,デイリースポーツ,広島がオープン戦最終盤で計８人の一、二軍入れ替え　ケガ明けの石原が１軍昇格へ「１００％で動けている」,42,https://news.yahoo.co.jp/articles/0a47dfa7b5e7b92786e16cb9dcc3ea6bcb31e93d,3/20(木) 17:34
2025-03-20,20:06,sports,スポーツ,23,CoCoKARAnext,「流石にうんざり」大谷翔平の凱旋弾に議論百出！ ビデオ検証後の本塁打判定に米メディアが猛反発「明らかなファンの妨害」,41,https://news.yahoo.co.jp/articles/c5d79502f9acf84c83baece0a603881eba62d13f,3/20(木) 5:30
2025-03-20,20:06,sports,スポーツ,24,THE ANSWER,「野球人気は米国より日本の方がずっと大きい」　東京DでLAレポーターから聞いた「日本野球」への敬意,40,https://news.yahoo.co.jp/articles/29854f3ec347607b49f7cc9223f2d171c5e6a4ff,3/20(木) 18:03
2025-03-20,20:06,sports,スポーツ,25,ゲキサカ,W杯王手の森保Jスタメン発表!! 久保建英、三笘薫ら先発で史上最速決定へ,40,https://news.yahoo.co.jp/articles/cab929cffaee1c550f5056648f97b5326a9c7d3f,3/20(木) 18:12
2025-03-20,20:06,sports,スポーツ,26,日テレNEWS NNN,【巨人】田中将大が2軍戦で4回1失点　最速は145キロを計測　毎回ランナー背負うも粘りの投球,39,https://news.yahoo.co.jp/articles/d8c0ff762e7102ab2d51d4a16bfda93058079f4c,3/20(木) 14:56
2025-03-20,20:06,sports,スポーツ,27,スポーツ報知,【巨人】田中将大が２軍戦で４回７安打１失点　最速１４５キロ　初の木曜日登板　実戦は計１０回２失点,39,https://news.yahoo.co.jp/articles/6ef7ac160948ca5bb70442dffbe45c3d6c3f5392,3/20(木) 14:54
2025-03-20,20:06,sports,スポーツ,28,スポーツ報知,【オリックス】7日にトミー・ジョン手術の吉田輝星が激白！パワーアップして「１５０キロをバンバン出す」,39,https://news.yahoo.co.jp/articles/e4643cda54a86d7499fa2f2a8cfcce742a2ba354,3/20(木) 5:00
2025-03-20,20:06,sports,スポーツ,29,motorsport.com 日本版,エディ・ジョーダン亡くなる。現アストンマーティンF1の源流、日本とも縁深い『ジョーダン・グランプリ』の創設者,39,https://news.yahoo.co.jp/articles/c99e5b467b9fcb6a0906157aea1da1c41f1611be,3/20(木) 18:19
2025-03-20,20:06,sports,スポーツ,30,共同通信,栄和人氏、至学館大の監督退任へ　レスリング吉田さんら指導,38,https://news.yahoo.co.jp/articles/219f3e28f57b49d8ee1255dd9073eb23ba77f66e,3/20(木) 11:46
2025-03-20,20:06,sports,スポーツ,31,THE ANSWER,大谷1号は東京D天井に直撃してた？　急失速の原因、ネット上で相次ぐ指摘「疑惑でもなんでもない」,37,https://news.yahoo.co.jp/articles/92b486b02d443e0198f1e680a11c81e0244b0b09,3/20(木) 10:03
2025-03-20,20:06,sports,スポーツ,32,デイリースポーツ,エンゼルスに珍規律　ロッカーでスマホ使用禁止　ワシントン監督発令「野球に集中してもらいたい」　米報道,36,https://news.yahoo.co.jp/articles/fd2a7538aed86261cb6ac3ac455faa1d2e62be53,3/20(木) 6:58
2025-03-20,20:06,sports,スポーツ,33,THE DIGEST,角田裕毅の“レッドブル昇格”を推す声がF1関係者から続出...元F1チーム代表「ユウキがやれるか見極めるべき」「リアムが活躍する可能性は非常に低い」,35,https://news.yahoo.co.jp/articles/58d9668a572b0d1da06c594b9f01508322a43510,3/20(木) 17:34
2025-03-20,20:06,sports,スポーツ,34,東スポWEB,【Ｆ１】ローソンがマクラーレンＣＥＯのレッドブル批判に怒り「彼と話したことは一度もない」,34,https://news.yahoo.co.jp/articles/107a273d1f8ef7e5c59c2a1c40a0a3a440f220ba,3/20(木) 19:16
2025-03-20,20:06,sports,スポーツ,35,Full-Count,オリックス紅林、西野らマルチ、計8安打も無得点…椋木は6回途中2失点,34,https://news.yahoo.co.jp/articles/997a65a6087b18ed69dd2357376fadaaa07d3a0f,3/20(木) 18:45
2025-03-20,20:06,sports,スポーツ,36,ABEMA TIMES,日本代表、スタメン発表！ 久保建英や三笘薫、復帰の伊藤洋輝などが先発“史上最速＆世界最速”Ｗ杯出場かかるバーレーン戦,34,https://news.yahoo.co.jp/articles/14a04e8dace21710ba2f64ce39618e0467c076a0,3/20(木) 18:32
2025-03-20,20:06,sports,スポーツ,37,Full-Count,離島からの大応援団に「涙出そう」　甲子園初出場で敗退も…21世紀枠に「大社を思い出した」,33,https://news.yahoo.co.jp/articles/65959785e5bbc9feb15be1bdfc02c530d77e6bfc,3/20(木) 16:40
2025-03-20,20:06,sports,スポーツ,38,ベースボールキング,牧秀悟は2番確定…！？今季のDeNA打線に谷繁氏「牧はやっぱり2番ですかね。基本はバントをしないチームですから」,31,https://news.yahoo.co.jp/articles/961fc95be78baeb3152f560afb99b65842ddf6db,3/20(木) 17:50
2025-03-20,20:06,sports,スポーツ,39,スポニチアネックス,【センバツ】3年連続初戦突破も笑顔なしの山梨学院・吉田洸二監督「勝った気がしない」　相手捕手にも謝罪,30,https://news.yahoo.co.jp/articles/10b8461503c20c96ab13a755ddf3da77bb4bea87,3/20(木) 14:33
2025-03-20,20:06,sports,スポーツ,40,中日スポーツ,グランパス、苦しみながら今季公式戦初白星　J3宮崎相手に延長戦までもつれる大苦戦　GKシュミット、スーパーセーブで貢献【ルヴァン杯】,29,https://news.yahoo.co.jp/articles/59e40cab491e1d30ecb3f9031cd96ae00f30c18e,3/20(木) 16:45
