scrp_date,scrp_time,genre_en,genre_jp,rank,media_jp,title,comment,link,date_original
2025-06-20,21:13,TTL,総合,1,スポーツ報知,ＴＯＫＩＯ国分太一が無期限活動休止を発表「自分を見つめ直す」ＳＴＡＲＴＯ社も謝罪「心よりお詫び」,1065,https://news.yahoo.co.jp/articles/b5ffe0b37eaa3e889aabb193abf524daffdef5e1,6/20(金) 15:01
2025-06-20,21:13,TTL,総合,2,オリコン,TOKIO国分太一、無期限活動休止　謝罪コメントも発表「自分を見つめ直させていただきます」【全文掲載】,999,https://news.yahoo.co.jp/articles/260bcbfabd2154b28d260ffbc3bc88d1b3ba92b1,6/20(金) 15:01
2025-06-20,21:13,TTL,総合,3,日テレNEWS NNN,国分太一さんの番組降板を発表、過去にコンプライアンス上の問題行為が複数あったと確認　日本テレビ,435,https://news.yahoo.co.jp/articles/98661ff0bda599212e01d3460abe9653b4eadff4,6/20(金) 11:30
2025-06-20,21:13,TTL,総合,4,UX新潟テレビ21,【特集】「人生を狂わされた」住宅メーカーが破産…マイホームに2000万円支払い済…契約者の憤り【新潟】,389,https://news.yahoo.co.jp/articles/e443c2bf30a838530d8adcd1a159637fd8d0bdd3,6/20(金) 19:34
2025-06-20,21:13,TTL,総合,5,毎日新聞,兵庫・斎藤知事を公選法違反容疑で書類送検　知事選でPR会社に報酬,371,https://news.yahoo.co.jp/articles/b6df641f11c1d4e0ec49b05de1f53489efa3723a,6/20(金) 14:23
2025-06-20,21:13,TTL,総合,6,読売テレビ,【速報】斎藤知事「適法にしてきたという認識変わりない」知事選めぐりPR会社社長と公選法違反疑いで書類送検,368,https://news.yahoo.co.jp/articles/d437d9519e401abc8597f7fd291028b548e960da,6/20(金) 16:04
2025-06-20,21:13,TTL,総合,7,オリコン,日テレ社長、国分太一の番組降板受け会見　事案の詳細明かさず、刑事告訴は「考えていない」,346,https://news.yahoo.co.jp/articles/fc842436698834d843eaa8635bdc101ab0ab2d17,6/20(金) 13:00
2025-06-20,21:13,TTL,総合,8,ABEMA TIMES,フジ社長が被害女性に謝罪受け 中居氏側がコメント「双方に同じ人権がある」,305,https://news.yahoo.co.jp/articles/2e9254d3278a6d2d9e6b9ef2d66d2e08dc39bdd8,6/20(金) 10:27
2025-06-20,21:13,TTL,総合,9,スポーツ報知,作新学院・小針崇宏監督は１２・８まで謹慎６か月　素手捕球指示で選手骨折が危険行為と判断…審査室会議,262,https://news.yahoo.co.jp/articles/c3268cb1f881fea74ba2ed844807a833e76f6442,6/20(金) 16:29
2025-06-20,21:13,TTL,総合,10,デイリー新潮,グラスを片手に「いま、私が国会にいなくちゃダメでしょ！」　蓮舫氏の参院選出馬ほぼ確定か,247,https://news.yahoo.co.jp/articles/b5cbea49e6f1ac450aa339556185f2ac3bc939ef,6/20(金) 5:52
2025-06-20,21:13,TTL,総合,11,スポニチアネックス,国分太一 （株）TOKIOが解雇も　全番組降板申し入れ　コンプラ違反で日テレが20日会見,243,https://news.yahoo.co.jp/articles/3d802db04d5e89110b8fcb0d682f6eeb6a532ad8,6/20(金) 4:00
2025-06-20,21:13,TTL,総合,12,TBS NEWS DIG Powered by JNN,【中日】両リーグ最多タイ15度目の完封負け...借金「5」日本ハム伊藤に5安打完封許す 大野は今季最長7回を1失点も援護なく3敗目,212,https://news.yahoo.co.jp/articles/531fb7c724f9d8c5299fc28ada07ef65e18adcc1,6/20(金) 20:41
2025-06-20,21:13,TTL,総合,13,FBS福岡放送,「いじめではなく、おしおき」上級生が法廷で主張　粘着テープで畳に貼り付けわいせつ行為　動画を送信された高2生徒が自殺,193,https://news.yahoo.co.jp/articles/3b09306efe27f777cb3d3988c8623d33b28f6785,6/20(金) 17:39
2025-06-20,21:13,TTL,総合,14,文春オンライン,テニス錦織圭（35）がモデル女性と“ユニクロ着用LUUPデート”不倫「妻との挙式直前に遠征先で…」《本人が謝罪コメント》,191,https://news.yahoo.co.jp/articles/1f782eadb875bd0eafa66e3fbc5dc94d6c50eb53,6/19(木) 22:24
2025-06-20,21:13,TTL,総合,15,共同通信,公明党の山口元代表、政界引退へ　トップ最長8期15年,190,https://news.yahoo.co.jp/articles/8d5ec694846999659cf3d5fb245b264e307e18db,6/20(金) 12:39
2025-06-20,21:13,TTL,総合,16,朝日新聞,アベノマスクの契約過程、文書の開示を再検討へ　国の敗訴判決が確定,187,https://news.yahoo.co.jp/articles/47542ae2fa7938a83140649ce86bbca1050916eb,6/20(金) 11:59
2025-06-20,21:13,TTL,総合,17,スポーツ報知,バイきんぐ・小峠英二、結婚を発表「今後ともご指導、ご鞭撻のほどよろしくお願いいたします」,182,https://news.yahoo.co.jp/articles/cff675546311c223328805879551f5058bf5dccf,6/20(金) 10:00
2025-06-20,21:13,TTL,総合,18,産経新聞,N党立花氏、兵庫県三木市長選への立候補を表明　「斎藤知事を応援するかしないか」,176,https://news.yahoo.co.jp/articles/e2ce3f6a5715b0114019061751d1b92841f695be,6/20(金) 19:29
2025-06-20,21:13,TTL,総合,19,ABEMA TIMES,【緊急解説】なぜ日テレ社長は会見で「プライバシー保護の観点から詳細は言えない」と繰り返したのか？ フジ問題との違いは？ 弁護士の見解 TOKIO国分さん“複数のコンプラ違反”,174,https://news.yahoo.co.jp/articles/fe73e10283ab74df621fad0d3317332974f0dfc1,6/20(金) 17:18
2025-06-20,21:13,TTL,総合,20,中日スポーツ,渡邊渚さん、初写真集の裏側を動画で公開　「自由に生きるって幸せなこと」発売控え心境つづる,172,https://news.yahoo.co.jp/articles/0d5bbd064e92d0f6f8e9814753cd7fa9e5dcd95e,6/20(金) 20:13
2025-06-20,21:13,TTL,総合,21,サンケイスポーツ,国分太一、20日にも無期限の活動休止を発表へ　何らかの不祥事を起こしたか,170,https://news.yahoo.co.jp/articles/e18c62f6c896fcea9974ce0d8f127780f1b560d9,6/20(金) 1:51
2025-06-20,21:13,TTL,総合,22,スポーツ報知,元フジアナ渡邊渚さん　白シャツ姿で美ぼう全開「発売は来週だよ！」ファースト写真集に言及,150,https://news.yahoo.co.jp/articles/582d01172f8433a1315ac8454fd663319b3e2b7d,6/20(金) 14:55
2025-06-20,21:13,TTL,総合,23,日刊スポーツ,「ま・る・な・げ」自民党が異例の絶叫合唱　衆院本会議でガソリン減税法案採決前に野党を批判,146,https://news.yahoo.co.jp/articles/17108cd72c4c445560277f4e895a7aa75fec5bc0,6/20(金) 13:59
2025-06-20,21:13,TTL,総合,24,スポーツ報知,中居正広氏側がコメント発表　フジテレビの被害女性への謝罪を受け,136,https://news.yahoo.co.jp/articles/b72286c747a124226b367e544732b2dd96d9c2a5,6/20(金) 11:41
2025-06-20,21:13,TTL,総合,25,J-CASTニュース,小泉進次郎農水相、車内で昼食牛丼→賛否で反響　「要らんパフォーマンス」「逆に何食えば正解？」,129,https://news.yahoo.co.jp/articles/16619a1edb8a9e9c9405abace72b17c416e61f96,6/20(金) 12:07
2025-06-20,21:13,TTL,総合,26,ベースボールチャンネル,ドジャース・大谷翔平に再び”報復死球”…？両軍監督が退場の大荒れムードも本人は”制止”,128,https://news.yahoo.co.jp/articles/290e09e63a477216340c3d55b2d2da12604a4b38,6/20(金) 14:50
2025-06-20,21:13,TTL,総合,27,スポニチアネックス,へずまりゅう、無所属で出馬宣言「日本を良くする為に…」「誰よりも国民に寄り添うことを誓います」,124,https://news.yahoo.co.jp/articles/420307b1589a79afaa487c3a310d4ea5743c888e,6/20(金) 18:24
2025-06-20,21:13,TTL,総合,28,TBS NEWS DIG Powered by JNN,【西武】逆転負け 日本ハムと3.5差に... 髙橋光成が小林にⅤ打献上で4敗目 7回無死一・二塁で滝澤 痛恨犠打空振りから児玉が走塁死,123,https://news.yahoo.co.jp/articles/900371a0801bbe8c3532c02e1aaedf2023022ad9,6/20(金) 20:45
2025-06-20,21:13,TTL,総合,29,MBSニュース,イワナ１万尾死ぬ「レッドマウス病」国内２例目　米原市の醒井養鱒場　滋賀県は約３４万尾を処分,120,https://news.yahoo.co.jp/articles/7e0a923dfe871e0c7ed8f14bed2615dae15b40a7,6/20(金) 18:45
2025-06-20,21:13,TTL,総合,30,TBS NEWS DIG Powered by JNN,“ガソリン減税”法案めぐり、あす土曜日も国会審議へ　与党が野党の要求受け入れ,119,https://news.yahoo.co.jp/articles/1373b032e3ddab372f10412d74ef02a6849e7b9f,6/20(金) 16:49
2025-06-20,21:13,TTL,総合,31,日刊スポーツ,【ヤクルト】小川泰弘炎上、４回８失点　３週間ぶり１軍登板も「試合つくれず申し訳ない」,114,https://news.yahoo.co.jp/articles/3ba83bb46a3e4ae65f889aec59880055fd275b39,6/20(金) 20:02
2025-06-20,21:13,TTL,総合,32,スポーツ報知,日テレが国分太一に関する声明発表　コンプライアンス上の問題行為を複数確認「適切でないと判断」番組降板を決定,110,https://news.yahoo.co.jp/articles/c3802242e2067f4a99736f0cdeb08c1a6697f1c1,6/20(金) 11:56
2025-06-20,21:13,TTL,総合,33,中日スポーツ,中居正広氏の代理人、フジ社長の女性への謝罪受けコメント「双方に同じ人権があることを厳にご認識いただきますよう」,108,https://news.yahoo.co.jp/articles/3a8d3d059d39c01643ede7c1acdb5cd60f4cd4bf,6/20(金) 15:15
2025-06-20,21:13,TTL,総合,34,週刊SPA!,高級ミニバンを“残クレ”で買う若者を皮肉った「残クレアルファード」制作者を直撃。正体は“15万円の中古トヨタ”に乗る40代サラリーマン,107,https://news.yahoo.co.jp/articles/96565c0a61f2b750a7729699c57a5bafc56d9d4c,6/20(金) 8:55
2025-06-20,21:13,TTL,総合,35,テレビ朝日系（ANN）,自民「2万円給付＆年収100万円増」参院選の公約発表　20万円給付8人家族「もやもや」,105,https://news.yahoo.co.jp/articles/f0990f5774b6fa50ddb19cf0d83c9da6e90ad6e0,6/20(金) 12:46
2025-06-20,21:13,TTL,総合,36,女性自身,「もう静かに暮らして」中居正広氏　 “被害女性へのフジの謝罪”受け“人権尊重”訴えも疑問噴出,104,https://news.yahoo.co.jp/articles/b07d92b85581d8e568584209f430c86673856e60,6/20(金) 19:10
2025-06-20,21:13,TTL,総合,37,毎日新聞,トップ当選の国民民主市議、当選無効　「居住実態なし」　埼玉・入間,101,https://news.yahoo.co.jp/articles/053c00a3e43d8e8867a5d73816988ea05d21f7a8,6/20(金) 20:26
2025-06-20,21:13,TTL,総合,38,スポニチアネックス,西武・高橋光成　6回2失点の粘投も白星ならず　打線の援護なく…交流戦は16試合未勝利,99,https://news.yahoo.co.jp/articles/924f16815e82de3f715ea70cc316dbf063df4f8d,6/20(金) 20:12
2025-06-20,21:13,TTL,総合,39,ピンズバNEWS,キャッシュレスは時代遅れに　店舗が続々「現金のみ」へ回帰する“切実な理由”,99,https://news.yahoo.co.jp/articles/63d5cd0ca0d2009323401a91fa9d6c8d0be6ea19,6/20(金) 6:02
2025-06-20,21:13,TTL,総合,40,SmartFLASH,【錦織圭は謝罪】不倫の“お相手”モデル、瞬く間に事務所退所＆SNS削除の“失踪”状態に…大きすぎた“代償”,97,https://news.yahoo.co.jp/articles/50fad6f25303940baea84e7390a6a0bef6fbd7b1,6/20(金) 18:50
