scrp_date,scrp_time,genre_en,genre_jp,rank,media_jp,title,comment,link,date_original
2024-06-03,11:34,TTL,総合,1,TBS NEWS DIG Powered by JNN,【速報】岸田内閣の支持率25.1% 先月から4.7ポイント下落　6月JNN世論調査,328,https://news.yahoo.co.jp/articles/f8389532391bc64a6dce96ac4332262dede3cd4a,6/2(日) 22:53
2024-06-03,11:34,TTL,総合,2,現代ビジネス,「国会を舐めている」と大ヒンシュク…自民党・今井絵理子議員が国会を長期欠席していた「あきれた理由」,298,https://news.yahoo.co.jp/articles/a581ec9dad978e62a60e747d7507c199274b139e,6/3(月) 7:23
2024-06-03,11:34,TTL,総合,3,毎日新聞,初任給が急騰、大卒5.68%上昇　企業間格差縮める動き活発に,228,https://news.yahoo.co.jp/articles/57ad151e2e01e752ab5193c9f11ab1f8fb83e2d5,6/3(月) 6:00
2024-06-03,11:34,TTL,総合,4,FNNプライムオンライン（フジテレビ系）,【速報】政治資金規正法改正案　4日衆院通過で合意　岸田首相出席の質疑行った上での採決を与野党が確認,206,https://news.yahoo.co.jp/articles/ef81a08d7037f66c3b1a83db768009e2a953c49c,6/3(月) 9:55
2024-06-03,11:34,TTL,総合,5,日刊スポーツ,都知事選にも影響か…自民また敗れる　東京・港区長選で推薦の現職敗北、49歳清家愛氏が初当選,206,https://news.yahoo.co.jp/articles/383f8f579de310c1eefb3d87551e79f0f9712d7c,6/3(月) 10:17
2024-06-03,11:34,TTL,総合,6,現代ビジネス,蓮舫の「都知事選」出馬で党内にまさかの異変が…！これから大復活しそうな「大物議員」の名前,194,https://news.yahoo.co.jp/articles/27638277ab537f35db54712ea88a2178212b5459,6/3(月) 6:33
2024-06-03,11:34,TTL,総合,7,青森放送,【速報】　青森空港に航空自衛隊三沢基地の「Ｆ－３５Ａ」２機が緊急着陸,187,https://news.yahoo.co.jp/articles/d54338ae9eba9b7963db98cb0fe09222ee49c782,6/3(月) 9:34
2024-06-03,11:34,TTL,総合,8,TBS NEWS DIG Powered by JNN,4歳が脱毛サロンに通う　きっかけは保育園で言われた何気ない一言　「不安を取り除きたい」という親の思い　#令和の子,181,https://news.yahoo.co.jp/articles/d5d5a3aed6fdd45f000ba817eabdb1a3d4bbfb56,6/2(日) 18:03
2024-06-03,11:34,TTL,総合,9,ゴルフ総合サイト ALBA Net,渋野日向子が“復活”のメジャー2位　「ここから新しい章をスタートできる」,177,https://news.yahoo.co.jp/articles/ebf12aad1c1787843f6818600901b2d82b8ba014,6/3(月) 8:00
2024-06-03,11:34,TTL,総合,10,オリコン,Snow Man渡辺翔太＆中村アン、『青島くんはいじわる』連ドラ化でW主演　年の差“超”王道ラブコメに挑戦,176,https://news.yahoo.co.jp/articles/eb9bc40b1cc5ca66dc4bf5d0c4570489a90cfcf0,6/3(月) 5:00
2024-06-03,11:34,TTL,総合,11,MBSニュース,【独自・万博】「ガスは目に見えないし...みんな怖いと」爆発事故現場近くにいた作業員は協会の対応に不信感　会期中の“万が一”の事態を懸念,174,https://news.yahoo.co.jp/articles/c79879dd7c059a4eb1d22e182fff986237a6748c,6/3(月) 7:03
2024-06-03,11:34,TTL,総合,12,日刊スポーツ,【全米女子オープン】笹生優花Ｖ日本勢初の米メジャー２度目優勝　渋野日向子とワンツー！,167,https://news.yahoo.co.jp/articles/7fbbad703556900c2ed6cf98da72a25a82c81ac2,6/3(月) 7:18
2024-06-03,11:34,TTL,総合,13,みんかぶマガジン,竹中平蔵「日本人は移民を受け入れるべきだ。そして社員をレイオフできる国にするべきだ」外国人はあなたの職を奪わない,161,https://news.yahoo.co.jp/articles/a6914076b916a98d1eb716bd8da5b95ae1cae732,6/2(日) 17:10
2024-06-03,11:34,TTL,総合,14,日刊スポーツ,「蓮舫は批判ばかり、はおかしい！」蓮舫氏が都知事選出馬表明後初めての街頭演説でほえる,156,https://news.yahoo.co.jp/articles/d2504f10669a3da2ad0b5dceb549d9169b424de4,6/2(日) 17:34
2024-06-03,11:34,TTL,総合,15,中日スポーツ,真鍋かをり、蓮舫氏による都知事選での自民党批判に「ウンザリ」発言連発　SNSではさまざまな意見も,147,https://news.yahoo.co.jp/articles/c9adc1f6a0e9768773c7f12e979c13c5fb1dc0be,6/2(日) 22:18
2024-06-03,11:34,TTL,総合,16,FNNプライムオンライン（フジテレビ系）,【速報】気象庁が今後1週間程度は震度5強程度の揺れに注意するよう呼びかけ　石川県輪島市・珠洲市で震度5強,144,https://news.yahoo.co.jp/articles/baa776b46f57a4c0ee9ff4bc622d63ec7bf8d7df,6/3(月) 8:52
2024-06-03,11:34,TTL,総合,17,レスキューナウニュース,〔地震〕石川県輪島市・珠洲市で震度5強、津波被害の心配なし(6/3),143,https://news.yahoo.co.jp/articles/d0dbb9e1765fa8a6474d65399d8c95a9a2c6bf5e,6/3(月) 6:35
2024-06-03,11:34,TTL,総合,18,読売新聞オンライン,能登半島の輪島などで震度５強の地震、若干の海面変動の可能性…９分後には珠洲で震度４の地震,140,https://news.yahoo.co.jp/articles/19a8b20526feab3c452f88892b740f55eb1251f0,6/3(月) 6:48
2024-06-03,11:34,TTL,総合,19,プレジデントオンライン,「年収1200万円超は金持ち」という前提がおかしい…ひろゆき「日本では頑張る人ほど税金を搾り取られる」,111,https://news.yahoo.co.jp/articles/dbc574184cdf619936227af11208e2b963323301,6/3(月) 9:17
2024-06-03,11:34,TTL,総合,20,弁護士JPニュース,電動キックボードの赤信号無視で“あわや”大事故　「それでも僕が悪いですか？」バイク運転者の疑問に弁護士の回答は…,111,https://news.yahoo.co.jp/articles/99e9b2e1358e017eb9e6faae86c920b290595e3b,6/3(月) 10:20
2024-06-03,11:34,TTL,総合,21,プレジデントオンライン,小池百合子氏に「排除」された勢力の逆襲である…蓮舫氏の出馬で「都知事選の意義が深まった」と考える理由,103,https://news.yahoo.co.jp/articles/de0c3d36435783e30cd170b80e756254126d4e1f,6/3(月) 9:17
2024-06-03,11:34,TTL,総合,22,朝日新聞デジタル,娘の最期の作文、いじめなくすため　両親「一人じゃない。逃げて」,101,https://news.yahoo.co.jp/articles/cd2dfb25640c9dc34b5c70a6aa443e27b56ee686,6/2(日) 15:00
2024-06-03,11:34,TTL,総合,23,TBS NEWS DIG Powered by JNN,石川県で最大震度5強の強い地震　石川県・輪島市、珠洲市,92,https://news.yahoo.co.jp/articles/150f0feac0763c4cf04ec539ffd988e405d01638,6/3(月) 6:34
2024-06-03,11:34,TTL,総合,24,withnews,「おかしいとおもわなかったのか」〝名札〟に名前が書かれない「岸田文雄夫人」　園遊会光景にSNSで議論,89,https://news.yahoo.co.jp/articles/4e7746c44dacb13dd793e49d9247de1de3609a64,6/3(月) 7:00
2024-06-03,11:34,TTL,総合,25,日刊ゲンダイDIGITAL,佳子さま“ギリシャフィーバー”束の間「婚約内定近し」の噂…スクープ合戦の火ブタが切られた,88,https://news.yahoo.co.jp/articles/d03442ed15c8d2ffc0e7fd97d33bfa48d92ae776,6/3(月) 9:06
2024-06-03,11:34,TTL,総合,26,プレジデントオンライン,愛子さま、佳子さまの「将来の年収」を左右する…「女性皇族は結婚後も皇族残留案」の抜群のメリット,83,https://news.yahoo.co.jp/articles/e98b1cbe15c8bcc780d2297c0d9fe5e0aaef336c,6/3(月) 9:17
2024-06-03,11:34,TTL,総合,27,日刊スポーツ,室井佑月氏「裏金を批判したら悪、みたいな常識になってんの？」タレントの発言に疑問,81,https://news.yahoo.co.jp/articles/76cc27b9ec878ecc73baea5eae9ba7c970d3337d,6/3(月) 9:30
2024-06-03,11:34,TTL,総合,28,スポーツ報知,大谷翔平、第５打席は移籍後初の申告敬遠　１死満塁からフリーマンが中犠飛で追加点,80,https://news.yahoo.co.jp/articles/78ebef8ac3a7a9da5c23e3ff34e0373e7c5f06a0,6/3(月) 7:35
2024-06-03,11:34,TTL,総合,29,週刊SPA!,23区内で“家賃3万円”の激安シェアハウス。オーナーも住人も働かない生活だが「将来の不安はないです」,79,https://news.yahoo.co.jp/articles/f163f75ef2c5f1b3f2e2743720f27f91c60fda88,6/3(月) 8:55
2024-06-03,11:34,TTL,総合,30,FRIDAY,「あなたたちの言葉響いてません」５年ぶりのテレビ出演が“消滅”した宮迫博之が「アンチへ宣戦布告」,77,https://news.yahoo.co.jp/articles/cceb7fda9bd708ec87fd8a198d6c92762c664131,6/3(月) 11:00
2024-06-03,11:34,TTL,総合,31,デイリースポーツ,いしだ壱成４度目結婚へ「しっかりと進めていきたい」結婚３度の父・純一と親子でトークショー,77,https://news.yahoo.co.jp/articles/cfd03004b4b9f4f9688f708177ba97569a7b4459,6/2(日) 15:13
2024-06-03,11:34,TTL,総合,32,FNNプライムオンライン,「それでも私は結婚したい…」フラれて泣いた日々に、いつかサヨナラ…進藤さんの婚活漂流記 #ザ・ノンフィクション #ydocs,75,https://news.yahoo.co.jp/articles/ed9d16fdc868fe9eb8cc4c0e64cbfa5510ffa8e8,6/2(日) 14:00
2024-06-03,11:34,TTL,総合,33,読売新聞オンライン,脱炭素分野で日本・ＥＵが調達ルール…安価な中国製念頭、価格以外も考慮へ,75,https://news.yahoo.co.jp/articles/b7fd34f4a8bf9093320709135b6937a4a9daf477,6/3(月) 5:00
2024-06-03,11:34,TTL,総合,34,TBS NEWS DIG Powered by JNN,石川・志賀原発　新潟・柏崎刈羽原発「異常なし」　モニタリングポストも変化なし　原子力規制庁,74,https://news.yahoo.co.jp/articles/3c4db2c2fb6629fab9ab86394bbbefd845785d31,6/3(月) 6:57
2024-06-03,11:34,TTL,総合,35,FNNプライムオンライン（フジテレビ系）,佳子さまがギリシャ訪問終えて皇居・賢所参拝　淡いピンク色の装いで笑顔で手を振られる　5日には帰国後初公務へ,72,https://news.yahoo.co.jp/articles/ef3fc8e0299a25bae74fbc4fb47c0d214d749328,6/3(月) 9:55
2024-06-03,11:34,TTL,総合,36,東スポWEB,【阪神】佐藤輝明一軍待望論噴出もＯＢは見解〝真っ二つ〟　即時昇格か我慢の「長期塩漬け」か,71,https://news.yahoo.co.jp/articles/05e8b0db6a18b33255f5b9644a4d2acb694e2a82,6/3(月) 5:16
2024-06-03,11:34,TTL,総合,37,読売新聞オンライン,「無縁遺体」５年間で３割増、独り暮らし増加や親類の引き取り拒否広がり…読売調査,71,https://news.yahoo.co.jp/articles/e86097c6646bb2025fb73f4768dc5d80f30d8b89,6/3(月) 5:01
2024-06-03,11:34,TTL,総合,38,まいどなニュース,「手数料はお店が払ってるんだよね？ 利益が減るのは嫌」ところが…　キャッシュレス決済を渋っていたお店が“方針転換”した理由,70,https://news.yahoo.co.jp/articles/de8f0f551c1eb836923b917ceb1d44f38ded7216,6/3(月) 7:35
2024-06-03,11:34,TTL,総合,39,時事通信,韓国、拡声器宣伝を検討　北朝鮮、汚物風船の中断表明,68,https://news.yahoo.co.jp/articles/82a6cfdf3682cefe2c559d06ae50b9069b1e4288,6/2(日) 12:13
2024-06-03,11:34,TTL,総合,40,信濃毎日新聞デジタル,やりがち？むせた人の「背中を叩く」行為、実は危険！「水を飲む」もNG　専門家に正しい対応を聞いた,66,https://news.yahoo.co.jp/articles/2cc7079b5143c6922959ac54dcb6bfab71fb7761,6/3(月) 8:10
