scrp_date,scrp_time,genre_en,genre_jp,rank,media_jp,title,comment,link,date_original
2024-09-09,12:09,business,経済,1,TBS NEWS DIG Powered by JNN,日経平均株価一時1100円超下落　背景に再熱するアメリカの景気不安　アメリカ“雇用統計”が市場予想を下回る,342,https://news.yahoo.co.jp/articles/27e4f02d2fadbb28aadf3dbb9499ed46dccc4ad6,9/9(月) 9:05
2024-09-09,12:09,business,経済,2,マネーポストWEB,【独占インタビュー】楽天・三木谷浩史社長が柳井正氏の「日本人は滅びる」論争に応えた　「日本に元気がないのは事実」「日本だけ『早く帰れ』では勝負にならない」,208,https://news.yahoo.co.jp/articles/19a7b70f925c8d5d393c9cf4b585f87cacde8d4a,9/9(月) 7:16
2024-09-09,12:09,business,経済,3,乗りものニュース,125ccを50cc扱いにする「新基準原付」制度ほぼ決まり 「あとは税金だけ」総務省は首を縦に振るのか？,138,https://news.yahoo.co.jp/articles/ca5a8746bb14cc5a7ff5f56c7e78c913ddc2fe94,9/9(月) 9:42
2024-09-09,12:09,business,経済,4,Bloomberg,クシュタール、７&ｉの友好的な買収で合意に意欲と表明－株反発,117,https://news.yahoo.co.jp/articles/4b4455fd543cb68c6ac5e9acb1ba55e5628a0574,9/9(月) 3:50
2024-09-09,12:09,business,経済,5,47NEWS,経営悪化はＪＲ四国の責任にあらず「人口が少ないからサービス削減は言い訳」　関西大・宇都宮浄人教授、国策転換を求める,117,https://news.yahoo.co.jp/articles/a3cfd2bb11d4e558974fc6e7f74107bf389ccf24,9/9(月) 10:32
2024-09-09,12:09,business,経済,6,Merkmal,毎年500か所が消滅！ 全然止まらぬ「ガソリンスタンド」衰退の末路とは,81,https://news.yahoo.co.jp/articles/72dc2151b141bf6c677268b1800bd4ac71abff90,9/9(月) 5:41
2024-09-09,12:09,business,経済,7,THE GOLD ONLINE（ゴールドオンライン）,神戸市長「タワマンは将来の廃棄物」…市内JR駅前のタワマンを買う、年収920万円の40歳・気ままなおひとりさまに待ち受ける「絶望的未来」【FPが解説】,75,https://news.yahoo.co.jp/articles/a1bebdda8fbd836c670d611c314c1de6b2de1666,9/9(月) 10:32
2024-09-09,12:09,business,経済,8,くるまのニュース,やってる人多い…「停止線」超えたら違反？ 「前が見づらいので…」  警察が推奨する停止方法とは,67,https://news.yahoo.co.jp/articles/cae9a1a40f3af76f9fee1598bad636b8f6195b8a,9/9(月) 11:10
2024-09-09,12:09,business,経済,9,Bloomberg,ロシア無人機、ＮＡＴＯ加盟国ラトビアで墜落－ルーマニア領空も侵犯,64,https://news.yahoo.co.jp/articles/479fbd6e9241a9f9a4243a4fc3f611ddd6c0efc6,9/9(月) 3:09
2024-09-09,12:09,business,経済,10,週刊SPA!,昔の面影がなくなった大阪「黒門市場」…インバウンド価格で“儲け主義”に走った先に訪れる未来,64,https://news.yahoo.co.jp/articles/18ff638fd4a64dea612c4823eedc1777d44ee3d4,9/9(月) 8:55
2024-09-09,12:09,business,経済,11,THE GOLD ONLINE（ゴールドオンライン）,年金で細々暮らす65歳・元会社員が新NISAに退職金を突っ込んだ結果…米国株神話を盲信した「にわか投資家」の末路【FPの助言】,58,https://news.yahoo.co.jp/articles/66e75960cbcfc5e8345ba0ae1993e897202a3368,9/9(月) 11:02
2024-09-09,12:09,business,経済,12,THE GOLD ONLINE（ゴールドオンライン）,年金なんて、さっさともらっておけば…年金月23万円・75歳の高齢男性、「年金を70歳まで繰下げたこと」をいまだに後悔する理由,51,https://news.yahoo.co.jp/articles/0a17ae1e69e726c8188acf522a25a8d7578fa3fe,9/9(月) 10:02
2024-09-09,12:09,business,経済,13,バイクのニュース,バイク事故が急増中!? リターンライダーが気を付けるべきこととは,37,https://news.yahoo.co.jp/articles/c601eea244c3aec142fdd1f62e9b853d66c84e18,9/9(月) 10:10
2024-09-09,12:09,business,経済,14,東洋経済オンライン,2070年、人口は8000万人台に。そのとき日本が直面する「危険な状態」とは？北海道には既に「空白地帯」が発生,34,https://news.yahoo.co.jp/articles/74ea686313314dbb1cf90f6486722d61c60c7ce8,9/8(日) 17:02
2024-09-09,12:09,business,経済,15,THE GOLD ONLINE（ゴールドオンライン）,結婚するつもりで肉体関係を持ったのに…婚活パーティで出会った相手に捨てられた20代前半女性、弁護士相談で得た「意外な回答」,33,https://news.yahoo.co.jp/articles/0f6efb02e0320d96e06efd11f86b742e97b7dbe3,9/9(月) 9:46
2024-09-09,12:09,business,経済,16,乗りものニュース,ぜ～ッたい渋滞してる！「埼玉の4大市街地」なぜ鬼門？ スイスイ通過できない・させない鉄壁の構造とは!?,32,https://news.yahoo.co.jp/articles/16ea3c305bbd4c26db6bf8e63519c026e89804f2,9/9(月) 8:12
2024-09-09,12:09,business,経済,17,くるまのニュース,トヨタ「“本格SUV”ルーミー!?」 展示に反響多数!? 「ランクルだわ」「普通にすごい」高級オフロード仕様に進化「ランクルーミー」とは,30,https://news.yahoo.co.jp/articles/f9f3f298ad50958848cc113ef753adf495b0b105,9/9(月) 8:10
2024-09-09,12:09,business,経済,18,ベストカーWeb,【衝撃】マジかよボルボ!! EV専業やめるの!? じゃあベンツたちはどーすんの!?,28,https://news.yahoo.co.jp/articles/a087848288049da8d8ef845bab32fd04bdc00969,9/9(月) 7:00
2024-09-09,12:09,business,経済,19,プレジデントオンライン,値下げを求める「団体ツアー客」はお断り…ジリ貧の「旧大名家の料亭旅館」を復活させた立花家18代目社長の決断,25,https://news.yahoo.co.jp/articles/642cc60cb39d6e178cea9d764773a6f46822e77b,9/9(月) 8:17
2024-09-09,12:09,business,経済,20,マネーポストWEB,《通常版は約8万円》PlayStation5大幅値上げ、ユーザーたちの衝撃と戸惑い　“鞍替え”も視野に「Switch次世代機」への注目度高まる,25,https://news.yahoo.co.jp/articles/1eb02368aea7941fc64a1c71db50a6d35e4b7537,9/8(日) 15:15
2024-09-09,12:09,business,経済,21,ベストカーWeb,バスマニアの人が基準にしている座席の選び方が深すぎた!? 快適さが天と地ほど違うってマジ?,23,https://news.yahoo.co.jp/articles/e2d2c303c7628a7fe5e914cb9af4bea5d70372ae,9/9(月) 11:00
2024-09-09,12:09,business,経済,22,乗りものニュース,領空侵犯対処で大失敗のスイス「軍の営業時間は午前9時からです」日本にとっても他人事ではない理由,22,https://news.yahoo.co.jp/articles/6404fc556e6df257972aa82af88c50673493d850,9/9(月) 6:12
2024-09-09,12:09,business,経済,23,ダイヤモンド・オンライン,サイテーな管理職は「あの件、どうなった？」と確認する。じゃあ、いい管理職はどうする？,21,https://news.yahoo.co.jp/articles/af36386dc4c76781a149d853cb71ab3bf10b4718,9/9(月) 6:02
2024-09-09,12:09,business,経済,24,くるまのニュース,ホンダ「プレリュード」復活で「スペシャルティカー」に熱視線！ トヨタ「ソアラ」待望論も!? 一体どんなモデル？,21,https://news.yahoo.co.jp/articles/5d0fe3d91b618885da2fa2e68534733943773fc6,9/9(月) 10:10
2024-09-09,12:09,business,経済,25,FNNプライムオンライン（フジテレビ系）,明治神宮外苑の再開発で樹木伐採を124本減らす案を三井不動産が公表…ラグビー場ずらす等で743本伐採を619本に,20,https://news.yahoo.co.jp/articles/daa8d490be5191c227706e61b232913879addd2e,9/9(月) 11:04
2024-09-09,12:09,business,経済,26,WEB CARTOP,路線バスは「乗客」が自ら身を守らなければ「車内事故」は避けられない！　運転士の努力だけではどうにもならない現実とは,19,https://news.yahoo.co.jp/articles/bf629795df579e2f392d9a430c4d274d211b6a1b,9/9(月) 6:30
2024-09-09,12:09,business,経済,27,帝国データバンク,医療機関の倒産、過去最多ペースで推移　「患者が戻らない……」苦戦する診療所、歯科医院が続出,19,https://news.yahoo.co.jp/articles/3a6257fd1a14c5f22a6b40f636d7146d67b8f9ac,9/9(月) 10:00
2024-09-09,12:09,business,経済,28,プレジデントオンライン,「1日たった20杯」から月商500万円まで10年…どん底の「六厘舎初代店長」を救ったアルバイト女性の夫婦物語,19,https://news.yahoo.co.jp/articles/83e30d950ebb151d32a268f9ed74c1d2cbfeed4b,9/9(月) 10:17
2024-09-09,12:09,business,経済,29,WEB CARTOP,新車購入の高揚感で思わず付けちゃったけど……要らなかった!?　納車後ちょっと経つと後悔しがちなオプション7選,18,https://news.yahoo.co.jp/articles/ac334408b5351dda7be550aa537a5d04ec328326,9/8(日) 17:30
2024-09-09,12:09,business,経済,30,プレジデントオンライン,車2、3台分の資産が吹き飛んだ…株価暴落で痛手を負ったFPが「まさかの安値」を狙って準備していること,18,https://news.yahoo.co.jp/articles/62b84611d064b44d07e3ebc853cb0548dd01dd54,9/9(月) 10:17
2024-09-09,12:09,business,経済,31,現代ビジネス,《秋田の三越》「お釣りはピン札、消費税は取らない」「休業後もネオン看板は灯り、草抜きも…」地元住民から「伝説」と呼ばれる「木内百貨店の謎」,18,https://news.yahoo.co.jp/articles/625a6064fb81e40e80ad84c570abe5d486435786,9/9(月) 8:05
2024-09-09,12:09,business,経済,32,東洋経済オンライン,JR東海リニア「名古屋―新大阪」着工時期の矛盾　国がゴリ押し「2037年全線開業」高いハードル,17,https://news.yahoo.co.jp/articles/9b3e169697a9b2957e74a71698bea0d9b33d60a5,9/9(月) 4:32
2024-09-09,12:09,business,経済,33,LIMO,【2024年10月】社会保険適用拡大で「106万円・130万円の壁」どうなる？週20時間勤務で扶養外れるか,17,https://news.yahoo.co.jp/articles/a215c7deb40283b1fd76d0d26b2b185cd73c8ad8,9/9(月) 5:26
2024-09-09,12:09,business,経済,34,ベストカーWeb,なんでよ!! [ソリオ]の兄弟なのに[クロスビー]がイマイチ売れていない衝撃のワケ,16,https://news.yahoo.co.jp/articles/59867d34343b7bfb148e2f328283a33cc638af92,9/9(月) 11:00
2024-09-09,12:09,business,経済,35,ファイナンシャルフィールド,「お金ないから国立大を目指して」と言われましたが、うちの親は公務員で年収600万くらいだと思います。そんなに大変なのでしょうか？,15,https://news.yahoo.co.jp/articles/e88afab46a71e7d5266d72aecf132bbaf615c902,9/8(日) 16:10
2024-09-09,12:09,business,経済,36,WEB CARTOP,事故って動かん！　放置でボロボロ！　「不動車買い取ります」って怪しいイメージもあるけどどんなビジネス？,15,https://news.yahoo.co.jp/articles/82326e5f7d226f3a7e9c65dac79d24864b27677b,9/9(月) 10:10
2024-09-09,12:09,business,経済,37,ベストカーWeb,利用料金は最安!! だけどレンタカーで軽自動車を選ばないワケ,15,https://news.yahoo.co.jp/articles/9a2ed915f5190f9dcffb28848fe79806aae98be4,9/8(日) 22:00
2024-09-09,12:09,business,経済,38,テレビ朝日系（ANN）,"7月の経常黒字 ""過去最大""3兆1930億円　インバウンド効果で旅行収支最大",15,https://news.yahoo.co.jp/articles/9731397744e4cbc5b4d49f97306d5c4b1161ba9c,9/9(月) 10:31
2024-09-09,12:09,business,経済,39,ベストカーWeb,気づいたら消えてた[イスト]がアフリカで大ブレイク! 中古で[バカ売れ]してるクルマって?,15,https://news.yahoo.co.jp/articles/34af41387bfd7946281d86ce8d3e9325c6780476,9/9(月) 10:00
2024-09-09,12:09,business,経済,40,ファイナンシャルフィールド,先月の帰省で義父から「交通費に使って」ともらった封筒を開けると10万円が…！もらいすぎで贈与税がかかることはないですか？,14,https://news.yahoo.co.jp/articles/ac389c64579f48ab38125e1ea45fd0a6d4557eea,9/9(月) 11:30
