scrp_date,scrp_time,genre_en,genre_jp,rank,media_jp,title,comment,link,date_original
2024-09-09,14:07,domestic,国内,1,読売新聞オンライン,兵庫・斎藤元彦知事が維新の辞職要求方針決定を受け、改めて続投する考え表明,1874,https://news.yahoo.co.jp/articles/0e30c3bf3b8c1cde56ce14f7f55675068f90232e,9/9(月) 10:10
2024-09-09,14:07,domestic,国内,2,東海テレビ,田んぼに転落…緊急走行中の救急車が交差点で乗用車と衝突 搬送していた患者1人を含む計5人がケガ,545,https://news.yahoo.co.jp/articles/00994325a85d4f57ab8a98c2cdaed30bd91d3873,9/9(月) 11:57
2024-09-09,14:07,domestic,国内,3,文春オンライン,「アメリカに自衛隊の基地を置くべき」石破茂元幹事長が明かした“驚きの秘策”,300,https://news.yahoo.co.jp/articles/437716d54a777ac3da5f69b6574c00fcde6e4eaf,9/9(月) 8:42
2024-09-09,14:07,domestic,国内,4,TBS NEWS DIG Powered by JNN,【速報】岸田内閣の支持率が34.3%　先月より3.3ポイント上昇　9月JNN世論調査,296,https://news.yahoo.co.jp/articles/0260d7a7c9d8b291a97107f4a50331d877987da5,9/8(日) 22:44
2024-09-09,14:07,domestic,国内,5,FNNプライムオンライン（フジテレビ系）,東京の梅毒感染者2400人超で過去最多ペースで増加…内訳は男性7割女性3割　無料・匿名の検査相談室を新宿や多摩地域に設置,230,https://news.yahoo.co.jp/articles/b5f3c759530a2352d76ebacd0a4d24e16aff3b45,9/9(月) 9:25
2024-09-09,14:07,domestic,国内,6,スポニチアネックス,兵庫・斎藤知事、改めて続投する考え表明にネット「もう不信任決議しか」「弁護士の存在が大きいのでは」,170,https://news.yahoo.co.jp/articles/d50c4a03024093c1d1f73bdf43e130a782cf8957,9/9(月) 12:49
2024-09-09,14:07,domestic,国内,7,読売新聞オンライン,スーパーに並び始めた２４年産の新米、品薄は解消に向かっているが…昨年産より３～５割高く,166,https://news.yahoo.co.jp/articles/4e8fc1aa578cda2c68c7d47d5fa85672d9bc7477,9/9(月) 10:24
2024-09-09,14:07,domestic,国内,8,週刊金曜日,在日外国人の無年金状態解消求め市民団体が要望書　国の「問題放置」を厳しく批判,160,https://news.yahoo.co.jp/articles/31000808b469d8c41f01a6ac9210f715f49c6c21,9/9(月) 9:10
2024-09-09,14:07,domestic,国内,9,読売新聞オンライン,兵庫県議会、全５会派が斎藤元彦知事に辞職を求める見通し…維新・吉村洋文代表の説得に知事応じず,141,https://news.yahoo.co.jp/articles/74e5c42f6b2e35ca39ab8d655be460e7188ac5f0,9/9(月) 11:29
2024-09-09,14:07,domestic,国内,10,FNNプライムオンライン（フジテレビ系）,河野デジタル相”健康保険証の廃止延期”を否定　林官房長官の“マイナ一本化先送り検討”に反論,121,https://news.yahoo.co.jp/articles/3876434d28ae2c578319a25b40f6562c024fe6ad,9/8(日) 16:22
2024-09-09,14:07,domestic,国内,11,プレジデントオンライン,なぜ「兵庫県知事のイス」にしがみつくのか…「おねだり」「パワハラ」と言われても斎藤元彦知事が辞職を拒むワケ,110,https://news.yahoo.co.jp/articles/d8dc051834f94eb6cb90fa2a8a5b1349ea1fa45c,9/9(月) 7:17
2024-09-09,14:07,domestic,国内,12,文春オンライン,嵐ファンからクレーム殺到→斎藤元彦・兵庫県知事が職員を「激詰め」…自死職員の“追加通報文書”を入手！「知事から何度も叱責されたと直接聞いた」,103,https://news.yahoo.co.jp/articles/d37f44126b4018c1e8dfb6ddca413e233959d887,9/9(月) 6:12
2024-09-09,14:07,domestic,国内,13,デイリースポーツ,兵庫県の斎藤元彦知事、東大時代のあだ名は「フェンディ」同級生の大島てる氏が思い出す,95,https://news.yahoo.co.jp/articles/0de3f52683e1b64ad8ca9d8566b8cf45bb7544c5,9/9(月) 9:59
2024-09-09,14:07,domestic,国内,14,FRIDAY,「飛び石で傷ついた」…フェラーリに乗り因縁の男女３人組「免許証撮影でクレカ偽造か」戦慄の素顔写真,93,https://news.yahoo.co.jp/articles/621a0eab21b515d12af4d64a3b73a0af871d41cf,9/9(月) 7:00
2024-09-09,14:07,domestic,国内,15,朝日新聞デジタル,批判高まる神宮外苑再開発、樹木の伐採を124本減らす見直し案公表,92,https://news.yahoo.co.jp/articles/1f6838d6210b02a0f0a20dfb9115b95fa7512f93,9/9(月) 10:12
2024-09-09,14:07,domestic,国内,16,文春オンライン,小泉進次郎はまさかの3位…では1位は？ 自民党総裁「なってほしい人」2400名アンケート結果発表！「最下位はあの地味男」「意外と人気な“女性候補”」,87,https://news.yahoo.co.jp/articles/b7fb980414ca1ec864edfba68713006b6c527b09,9/9(月) 6:12
2024-09-09,14:07,domestic,国内,17,デイリー新潮,「菅氏の主流派への復権は濃厚です」　まさかの“大物”まで麻生氏を見限って…決選投票に進むのは「菅系候補」の二人か,87,https://news.yahoo.co.jp/articles/4380e12616a69bad40d7adb5f8fe82b2b50f752b,9/9(月) 6:06
2024-09-09,14:07,domestic,国内,18,時事通信,石井氏、公明代表就任へ　幹事長は西田氏で調整,82,https://news.yahoo.co.jp/articles/b7c21add7420604cbc2d8d5c9519f826e53c7d0c,9/9(月) 5:25
2024-09-09,14:07,domestic,国内,19,J-CASTニュース,マークシート、勘で記入してはダメ？　　試験の「不自然な回答」「一律0点」が波紋、早大「問題があった」と教授を厳重注意,69,https://news.yahoo.co.jp/articles/d3ec9aa8824f3f2e703b67650273d404130abb5b,9/9(月) 10:40
2024-09-09,14:07,domestic,国内,20,中日スポーツ,兵庫・斎藤元彦知事、維新が辞職要求方針も『続投を強調』に衝撃 「メンタル最強すぎて草」「まだ粘るんかい」,68,https://news.yahoo.co.jp/articles/d9aa83a51b9b7e71941f2a43bd8ee5bdd6d5a160,9/9(月) 13:40
2024-09-09,14:07,domestic,国内,21,産経新聞,「LGBTQの時代、男系男子でなくても」「台湾独立は中国の利益にもとる」鳩山由紀夫氏　民主党政権誕生から15年インタビュー（下）,67,https://news.yahoo.co.jp/articles/d849b6d95ff6f537b982899a9f15042d08d81259,9/9(月) 12:00
2024-09-09,14:07,domestic,国内,22,産経新聞,兵庫知事支援の維新が午後に辞職要求へ、全会派が一致　斎藤氏は応じない構え,64,https://news.yahoo.co.jp/articles/7c5a8813d874de667d91b308985bf3604478bfb2,9/9(月) 12:23
2024-09-09,14:07,domestic,国内,23,集英社オンライン,〈兵庫県知事・不信任決議秒読みか〉「（県庁に届く贈答品は）私が全部いただく」おねだり知事のあきれた“マイルール”に百条委員会では「支離滅裂やん」と大ブーイング,64,https://news.yahoo.co.jp/articles/d6802e2d6d75125e0257a733fa8e2c6f30c4aa40,9/8(日) 18:02
2024-09-09,14:07,domestic,国内,24,テレビ朝日系（ANN）,パワハラ疑惑 兵庫県知事 県議会全会派の「辞職要求」応じない考え,61,https://news.yahoo.co.jp/articles/3c23e6ab02d559e70cb1162382d820f38c3718d4,9/9(月) 12:32
2024-09-09,14:07,domestic,国内,25,関西テレビ,【速報】斎藤知事辞職否定「県民に大切な予算事業これからも進めていく」　維新きょう9日に辞職申し入れへ,60,https://news.yahoo.co.jp/articles/42b02b59ea9093b39668d9d914057b19b0d83b3c,9/9(月) 9:37
2024-09-09,14:07,domestic,国内,26,週刊SPA!,悠仁さまの「東大進学反対署名」に東大生が反応。「受験生に忖度するような情けない大学じゃない」,59,https://news.yahoo.co.jp/articles/b8cd8742b114259d5d2581aecdbefb20da8927a2,9/8(日) 15:55
2024-09-09,14:07,domestic,国内,27,SmartFLASH,「義理も人情もねえ」三原じゅん子氏“恩人”裏切る「進次郎氏支援」の“変わり身”に猛批判…岸田首相にも見せていた“無礼発言”,56,https://news.yahoo.co.jp/articles/551ae023f877e8ec3547d60688a1f9176016383a,9/8(日) 15:10
2024-09-09,14:07,domestic,国内,28,TBS NEWS DIG Powered by JNN,【速報】「次の自民党総裁にふさわしい人」1位は小泉進次郎氏、「立憲代表にふさわしい人」1位は野田佳彦氏　9月JNN世論調査,56,https://news.yahoo.co.jp/articles/896918d25121dbdee7dd576137a896cc48c2a684,9/8(日) 22:52
2024-09-09,14:07,domestic,国内,29,プレジデントオンライン,「とんでもない人が総理になる」と自民党内が大混乱…従来の総裁選ではありえない「決選投票に残る弱い3人」の名前,52,https://news.yahoo.co.jp/articles/4e8f3de251d6cfdd56ce4eafc179ce2b97d1cd3a,9/9(月) 8:17
2024-09-09,14:07,domestic,国内,30,CBCテレビ,28歳の女性看護師死亡 国道の追い越し車線に倒れ車両とぶつかった形跡 現場にサンダルやめがね残される,45,https://news.yahoo.co.jp/articles/e7187a00493e5b8724e21467757b5dab557c742f,9/9(月) 11:36
2024-09-09,14:07,domestic,国内,31,集英社オンライン,〈スーパーカー飛び石詐欺〉「さらっちまうぞ！」「燃やすぞ」恫喝ざんまいだったタワマン住まいの“セレブ気どり夫婦” 車の修理業者にも「俺のフェラーリに勝手に乗りやがって」「傷つけた」とイチャモン,44,https://news.yahoo.co.jp/articles/b76f86b393946efbeab7298630b857e2a1581647,9/8(日) 16:57
2024-09-09,14:07,domestic,国内,32,産経新聞,立民代表選、「対維新」巡り温度差　野田氏・枝野氏・泉氏・吉田氏がNHK番組で論戦,44,https://news.yahoo.co.jp/articles/e59997f3fff85191045a615cfbd7e02286d13627,9/8(日) 16:32
2024-09-09,14:07,domestic,国内,33,日刊スポーツ,菅義偉前首相「進次郎さんに日本のかじ取り託したい」自民総裁選での小泉進次郎氏支援を明言,44,https://news.yahoo.co.jp/articles/9c7babd230b3853f4bf60f4f793c683657e1ab0a,9/8(日) 17:20
2024-09-09,14:07,domestic,国内,34,FNNプライムオンライン,「『2枚持ち』で便利にもならない」マイナ保険証をユーチューバーがバッサリ「金と労力かけて何したいの」,44,https://news.yahoo.co.jp/articles/8a958ad331a8e944a4000a0a88d906be3ca3f376,9/9(月) 12:52
2024-09-09,14:07,domestic,国内,35,日刊スポーツ,「現代の裸の王様」兵庫・斎藤元彦知事をフジ解説委員が指摘「県職員を使用人扱いしている」,42,https://news.yahoo.co.jp/articles/632bd3b9867930c8d3b840b0259a5a7636da352f,9/9(月) 10:07
2024-09-09,14:07,domestic,国内,36,日刊スポーツ,フジ25歳アナ「本当に恥ずかしい。この上司の下で働きたくない」斎藤知事おにぎり疑惑に私見,42,https://news.yahoo.co.jp/articles/87cb6951a91cde7aa2feb75c854bde7d6e0a0af6,9/9(月) 10:45
2024-09-09,14:07,domestic,国内,37,ENCOUNT,兵庫・斎藤知事の「通報者探し」は違法　専門家論破「真実相当性は関係ない」…弁護士解説「背景に法律改正」,41,https://news.yahoo.co.jp/articles/c01eb589ead37734f80f405e283ce46e0c3ee08f,9/9(月) 10:10
2024-09-09,14:07,domestic,国内,38,ウェザーマップ,東日本や東北南部　激しい雷雨のおそれ　厳しい残暑続く　西日本中心に熱中症警戒,41,https://news.yahoo.co.jp/articles/35e53b5356a8c67e34f89aeb77cc3693fde317a8,9/9(月) 11:18
2024-09-09,14:07,domestic,国内,39,プレジデントオンライン,「日本人にお金がなくなったから」だけではない…日本人男性の「キャバクラ離れ」が加速している深い事情,41,https://news.yahoo.co.jp/articles/4d32899955e3bab8a638e296d5b69ddc05c799f3,9/8(日) 16:17
2024-09-09,14:07,domestic,国内,40,朝日新聞デジタル,米農家の所得はわずか年1万円　米価下落と資材費高騰のＷパンチ,38,https://news.yahoo.co.jp/articles/dfed4409b2c908009b1338e0de58998cafb7e844,9/9(月) 6:00
