scrp_date,scrp_time,genre_en,genre_jp,rank,media_jp,title,comment,link,date_original
2024-04-04,22:19,TTL,総合,1,毎日新聞,岸田首相、森元首相に電話聴取　「関与確認できず」　自民裏金問題,1130,https://news.yahoo.co.jp/articles/e7818a516e3a3cccb5f7ff6871c7123ffe0c43a7,4/4(木) 20:02
2024-04-04,22:19,TTL,総合,2,毎日新聞,自民裏金、党紀委が塩谷・世耕両氏に離党勧告　39人の処分決定,703,https://news.yahoo.co.jp/articles/0b9d8e7951f41ad36159872b80af1c170f14eac6,4/4(木) 18:07
2024-04-04,22:19,TTL,総合,3,MBSニュース,【離党勧告処分】世耕弘成氏が取材応じる「党本部に離党届を提出した」処分に不満は…と問われ「明鏡止水の心境」,570,https://news.yahoo.co.jp/articles/8799f6ad98105c70920a3f52422d9030912dfcf7,4/4(木) 18:44
2024-04-04,22:19,TTL,総合,4,毎日新聞,英語は通じず、時には暴力も　海外売春経験の女性「命の危険感じた」,514,https://news.yahoo.co.jp/articles/239c8ee6d8761d8e0a69a55bb1f7e630db28d7f3,4/4(木) 17:21
2024-04-04,22:19,TTL,総合,5,テレビ朝日系（ANN）,“裏金処分”午後に正式決定　安倍派幹部「納得できない」,323,https://news.yahoo.co.jp/articles/683d26f15386b3a13a23688726e8acb7fc0d3754,4/4(木) 12:22
2024-04-04,22:19,TTL,総合,6,毎日新聞,自民裏金、党紀委員会、議員ら39人処分の内容,246,https://news.yahoo.co.jp/articles/9e78ac8fd4eaf238a481f8222429e69fa7f81174,4/4(木) 18:08
2024-04-04,22:19,TTL,総合,7,SmartFLASH,「自分と身内にとことん甘い」「国民なめすぎ」岸田首相、長男・翔太郎氏の「秘書活動復帰」で非難轟々,234,https://news.yahoo.co.jp/articles/94f54353e81f28afdef6303a2364a65b726b3d41,4/4(木) 20:01
2024-04-04,22:19,TTL,総合,8,スポニチアネックス,亀梨和也＆田中みな実　交際報道後初、2人そろってイベント登場　亀梨がみな実をいじる場面も,215,https://news.yahoo.co.jp/articles/a99ae1130ed8976ad6779055d4707ed102ac1cbc,4/4(木) 17:01
2024-04-04,22:19,TTL,総合,9,スポニチアネックス,ゆたぼん　今後は「高卒認定試験を受けようと思います」　高校不合格は内申点の差も「後悔してない」,197,https://news.yahoo.co.jp/articles/98f1747aa08294042f57a1f8feb2fc17987df8fc,4/4(木) 19:19
2024-04-04,22:19,TTL,総合,10,UTYテレビ山梨,中央道・笹子トンネルで追突事故　1歳の男児が死亡,178,https://news.yahoo.co.jp/articles/4e966341b036bc050ad28a26250a7dc145b53f3f,4/4(木) 16:57
2024-04-04,22:19,TTL,総合,11,毎日新聞,「裸一貫ゼロから再出発」　「初心立ち返る」　処分受けた主な自民議員,170,https://news.yahoo.co.jp/articles/ef676b4aa966a8c1dba0e1565d77d8f4f7768204,4/4(木) 21:08
2024-04-04,22:19,TTL,総合,12,よろず～ニュース,ゆたぼん、高校は行かない！入試では友人の「倍以上」得点も登校していないのが響いた　高卒認定試験挑戦へ,169,https://news.yahoo.co.jp/articles/e1b02fd8865573edf5bf34811d8c84661cbf29c1,4/4(木) 20:57
2024-04-04,22:19,TTL,総合,13,FNNプライムオンライン,「玉川徹出禁」実は可能だった?吉村代表の発言に波紋…国会で「権限ない前提」崩れる議論　橋下徹氏「マズいな」,166,https://news.yahoo.co.jp/articles/8d4d24357d217752b647a161f372ec5a02346241,4/4(木) 21:13
2024-04-04,22:19,TTL,総合,14,時事通信,「休日の業務連絡」対応する？しない？◇つながらない権利、日本で実現できるか【時事ドットコム取材班】＃令和に働く,165,https://news.yahoo.co.jp/articles/02f1e7f1faf71a8b55f953df3b31b380fc948531,4/4(木) 19:03
2024-04-04,22:19,TTL,総合,15,ABEMA TIMES,大谷翔平、移籍後初今季1号特大ソロホームラン 開幕41打席目＆224日ぶり待望アーチに球場総立ち,156,https://news.yahoo.co.jp/articles/da7486a5d742755aa77c397d41402be67499ccc1,4/4(木) 13:09
2024-04-04,22:19,TTL,総合,16,TBS NEWS DIG Powered by JNN,【ロッテ】ソフトバンクに大敗で2カード連続負け越し… 美馬が初回6失点の大炎上 ドラ1上田がプロ初安打&藤岡の先制弾も霧散,153,https://news.yahoo.co.jp/articles/e9f8aa32fd6ad4275417abb6da614737877459a6,4/4(木) 20:50
2024-04-04,22:19,TTL,総合,17,TBS NEWS DIG Powered by JNN,【阪神】逆転負けで2カード連続負け越し...単独最下位に転落 西勇が6回途中3失点 岡田監督2度のリクエスト成功＆佐藤輝の好走塁も,141,https://news.yahoo.co.jp/articles/7b782edb422e27e00ef45a874ec89ac57a9685f8,4/4(木) 21:17
2024-04-04,22:19,TTL,総合,18,時事通信,春闘賃上げ率、中小4．69％　全体も33年ぶり5％超維持　人手不足が押し上げ・連合中間集計,128,https://news.yahoo.co.jp/articles/3d324f3a085e9179cebeb2247e767836549da9ad,4/4(木) 16:18
2024-04-04,22:19,TTL,総合,19,中日スポーツ,さらなる衝撃発言…川勝平太・静岡知事『リニア一段落で辞表』が火に油　「遅らせるのが目的か」「環境問題どうでもいいってこと？」非難殺到,125,https://news.yahoo.co.jp/articles/8b43f8d16587ee0ecc1128130b12a4c0b0853742,4/4(木) 11:38
2024-04-04,22:19,TTL,総合,20,オトナンサー,一度使った「バスタオル」で体を拭くとどうなる？　“感染症”リスクを皮膚科医が解説,120,https://news.yahoo.co.jp/articles/fbf378b2d9cdf2f83b93e31c5f0cc193ae42f55c,4/4(木) 9:10
2024-04-04,22:19,TTL,総合,21,デイリースポーツ,広島が終盤の逆転劇で３連勝！貯金生活に突入　新井監督の代打策がズバリ　松山が決勝タイムリーで試合を決める,116,https://news.yahoo.co.jp/articles/7e535f5e872c3c855a73f43548c659e48f120130,4/4(木) 21:31
2024-04-04,22:19,TTL,総合,22,スポーツ報知,大谷翔平「はやっているので…」　新天地１号も体調不良だったことを明かす　せき込む姿も,113,https://news.yahoo.co.jp/articles/8c49eb7468330d7b2f6d3838770f2e62ea8f9ff8,4/4(木) 14:42
2024-04-04,22:19,TTL,総合,23,TBS NEWS DIG Powered by JNN,【ヤクルト】大逆転負け…先発・高橋は7回2失点の好投 8回救援陣・清水、嘉弥真が4失点の誤算 サンタナの適時打などで3点先制も,111,https://news.yahoo.co.jp/articles/cded04784e5888080743d52c9ab5b31a56b298d2,4/4(木) 21:52
2024-04-04,22:19,TTL,総合,24,AERA dot.,札幌ドームがさらなる“窮地”に？　「日本ハムに続きコンサドーレも去る日」が来る予感も,111,https://news.yahoo.co.jp/articles/66fcb99a303cd4e94f544e4c629d8ffaf101c08b,4/4(木) 18:01
2024-04-04,22:19,TTL,総合,25,デイリースポーツ,阪神が逆転負けで開幕２カード連続負け越し　岡田政権下では初の屈辱「ちょっと想定外」中野がプロ初の１試合２併殺打　佐藤輝６番降格も,110,https://news.yahoo.co.jp/articles/cef8dcda7975906f7088f30c61563ce1b8dc60bd,4/4(木) 21:18
2024-04-04,22:19,TTL,総合,26,テレビ静岡NEWS,【リニア】JRが発注見通しを発表　山梨県駅の新設工事の工期は80カ月　完了見通しは2031年　静岡,107,https://news.yahoo.co.jp/articles/b16161981d5e0ed0dd3999e1d140de7046d9155a,4/4(木) 15:17
2024-04-04,22:19,TTL,総合,27,ねとらぼ,「撮影マナーをなぜ守っていただけないのでしょうか」　銚子電鉄が“迷惑行為”に注意喚起　「これほど悪意な事象は今までなかった」,104,https://news.yahoo.co.jp/articles/d9faa30b755c1edfc19064af70dd6b3541d5d401,4/4(木) 11:07
2024-04-04,22:19,TTL,総合,28,デイリースポーツ,松本人志の飲み会参加名乗り霜月るな「売名野郎」の大量ＤＭ来たと告白「何も信用できず」も人気タレントと対談明かす,103,https://news.yahoo.co.jp/articles/a94396ec24efb0dab1e1da2961e9d86e26735493,4/4(木) 20:33
2024-04-04,22:19,TTL,総合,29,スポニチアネックス,巨人・菅野智之　7回零封で今季初登板初先発初勝利　657日ぶりスガコバで躍動,101,https://news.yahoo.co.jp/articles/eddcbe9dd5467e2138f773e0aeb8b4aa2c3adf3c,4/4(木) 20:46
2024-04-04,22:19,TTL,総合,30,Full-Count,大谷翔平「焦る気持ちを我慢しながら」　41打席目での移籍後1号…裏に指揮官からの助言,100,https://news.yahoo.co.jp/articles/c9276f10203a260dbd095fb59b62de2aa812cb70,4/4(木) 13:40
2024-04-04,22:19,TTL,総合,31,埼玉新聞,帰れ…迷惑な一部外国人を挙げ、民族全体へ批判　「出ていけ」と9人デモ行進、対抗する「カウンター」100人も集結し騒然　警官も大勢配備　近年ヘイト団体が向かう埼玉、カウンターとは別のグループも誕生「許さない」,99,https://news.yahoo.co.jp/articles/303fcded0a4a64d0a13f71fc0ec895ee17b02c05,4/4(木) 13:20
2024-04-04,22:19,TTL,総合,32,FNNプライムオンライン（フジテレビ系）,「出禁」実は可能 吉村氏どう釈明　橋下徹氏も「今回はマズい」,98,https://news.yahoo.co.jp/articles/4983f2312963e6d59f9a0e3099e4f513d2b7711c,4/4(木) 19:43
2024-04-04,22:19,TTL,総合,33,デイリースポーツ,ＤｅＮＡが２カード連続勝ち越し　牧が横っ跳びでチームのピンチ救う　ドラ１度会は気迫のヘッスラ　気迫みなぎるプレー,96,https://news.yahoo.co.jp/articles/5846d1d4210ba0d9494e3aedf40ffe90c2bc0679,4/4(木) 21:19
2024-04-04,22:19,TTL,総合,34,スポニチアネックス,TBS謝罪　「水ダウ」相撲企画ロケ収録中にトムブラウン布川が左足人差し指骨折　1カ月の加療,93,https://news.yahoo.co.jp/articles/9e66786c9be41dd645c5b4797f1871ee6d0cd945,4/4(木) 11:32
2024-04-04,22:19,TTL,総合,35,AERA dot.,筒香争奪戦にソフトバンクが好条件で参戦か　あの投手と「ダブル獲り」の可能性も,92,https://news.yahoo.co.jp/articles/46fba79d0370a7cf8970731265999bd3eecf36d3,4/4(木) 16:01
2024-04-04,22:19,TTL,総合,36,TBS NEWS DIG Powered by JNN,【中日】巨人に完封負けで3タテ＆689日ぶりの貯金ならず… 打線が3イニング連続併殺の拙攻 梅津は6回2失点も今季初白星ならず,89,https://news.yahoo.co.jp/articles/66b3a37659b14120f3049719f98130af9935d49d,4/4(木) 20:45
2024-04-04,22:19,TTL,総合,37,47NEWS,県庁の〝手のひら返し〟で大損した民間企業が激怒「『契約書準備してます』っていうから発注したのに…」いきなり大量キャンセル、契約前なら行政は許されるの？,88,https://news.yahoo.co.jp/articles/6a12e0649d375e5f821ef525c9fc8d1e17d03e67,4/4(木) 10:02
2024-04-04,22:19,TTL,総合,38,TBS NEWS DIG Powered by JNN,【広島】逆転勝ちで3連勝の貯金1！7回に會澤が2点適時打、8回2死から上本、代打・松山、矢野の3連続適時打で鮮やかに逆転,85,https://news.yahoo.co.jp/articles/a5b8814d8320254677ecb03c4bec1b35b9e958dc,4/4(木) 21:30
2024-04-04,22:19,TTL,総合,39,マグミクス,コンプラ的にもう無理？　いつの間にか無くなったマンガ・アニメの「不適切表現」,84,https://news.yahoo.co.jp/articles/049f2e355b5e83f0130b188609b1f7bb216d8989,4/4(木) 17:10
2024-04-04,22:19,TTL,総合,40,中日スポーツ,ヤクルト・高橋奎二、今季初先発　調整法を一昨年の方法に再び採用「パチンと腕が振れる」と手応え,83,https://news.yahoo.co.jp/articles/dc64481788415a66a83eef1b9325860c124403d0,4/4(木) 20:36
