scrp_date,scrp_time,genre_en,genre_jp,rank,media_jp,title,comment,link,date_original
2024-04-04,18:18,sports,スポーツ,1,ABEMA TIMES,大谷翔平、移籍後初今季1号特大ソロホームラン 開幕41打席目＆224日ぶり待望アーチに球場総立ち,279,https://news.yahoo.co.jp/articles/da7486a5d742755aa77c397d41402be67499ccc1,4/4(木) 13:09
2024-04-04,18:18,sports,スポーツ,2,Full-Count,大谷翔平「焦る気持ちを我慢しながら」　41打席目での移籍後1号…裏に指揮官からの助言,162,https://news.yahoo.co.jp/articles/c9276f10203a260dbd095fb59b62de2aa812cb70,4/4(木) 13:40
2024-04-04,18:18,sports,スポーツ,3,AERA dot.,筒香争奪戦にソフトバンクが好条件で参戦か　あの投手と「ダブル獲り」の可能性も,127,https://news.yahoo.co.jp/articles/46fba79d0370a7cf8970731265999bd3eecf36d3,4/4(木) 16:01
2024-04-04,18:18,sports,スポーツ,4,スポーツ報知,エンゼルス、大谷翔平がいなくても…１０得点で昨年７月以来の４連勝！無安打のレンドン外しが的中か,81,https://news.yahoo.co.jp/articles/5216b516fca135a417a28a3f7312feefa9a258cf,4/4(木) 5:00
2024-04-04,18:18,sports,スポーツ,5,スポニチアネックス,大谷翔平　開幕から自己最悪不発記録更新の一因は体調不良だった「みんな流行っているので、ここ数日は」,71,https://news.yahoo.co.jp/articles/5237054fe96da18614213b00e07fef745ee3d16e,4/4(木) 14:22
2024-04-04,18:18,sports,スポーツ,6,デイリースポーツ,中日　立浪監督がロドリゲスを熱血指導　遊撃ポジションで実演も　開幕戦で“落球”も期待の星にアドバイス,64,https://news.yahoo.co.jp/articles/f21c2c55b56a43875d8832d3245b400db931d731,4/4(木) 16:38
2024-04-04,18:18,sports,スポーツ,7,デイリースポーツ,阪神・岡田監督が決断　佐藤輝を６番に降格→５番に前川を抜てき　ＤｅＮＡは走塁ミスの関根をスタメン起用,55,https://news.yahoo.co.jp/articles/ced29ad506fc436ec53475948931ac573c402a72,4/4(木) 17:27
2024-04-04,18:18,sports,スポーツ,8,FOOTBALL ZONE,北朝鮮代表デビューの24歳Jリーガー、「在日朝鮮人で良かった」と語る訳　「形上は敵だけどこんなにも応援してくださる」【独占インタビュー】,51,https://news.yahoo.co.jp/articles/74326ab57f98d0c0a06640fc2a8af4c586385d52,4/4(木) 6:50
2024-04-04,18:18,sports,スポーツ,9,夕刊フジ,巨人・阿部監督、またも助っ人見限る　来日２年目のメンデスに即時の２軍行きを通告、開幕から〝純国産化〟へ加速の一途,47,https://news.yahoo.co.jp/articles/e07a0019b4fcfd89954fbdb798fa944d84a9ad7e,4/4(木) 17:00
2024-04-04,18:18,sports,スポーツ,10,Number Web,「かなりビックリした」阪神・佐藤輝明が明かす“59打席連続無安打”より追い込まれた“まさかの二軍行き”「岡田監督ってプレー以外も見てる方なんやな」,47,https://news.yahoo.co.jp/articles/d272fa7e75b148980368d97617c4a34342800609,4/4(木) 17:06
2024-04-04,18:18,sports,スポーツ,11,東スポWEB,【巨人】メンデスが４回４失点ＫＯ　昨季防御率０・００の〝中日キラー〟まさかの乱調,46,https://news.yahoo.co.jp/articles/0afb51aa3c9d6143b3bc6a159974adff160789bb,4/3(水) 19:46
2024-04-04,18:18,sports,スポーツ,12,デイリースポーツ,３連敗の巨人・阿部監督　乱調の助っ人左腕に即２軍落ち通達「もう一回やり直してくれ、と」「体にキレもないし内容が良くない」,44,https://news.yahoo.co.jp/articles/1a67dbbde45722a27952dad7c71df9fdcff951e8,4/3(水) 21:15
2024-04-04,18:18,sports,スポーツ,13,スポニチアネックス,阪神2軍　投手陣が踏ん張れず5回までに14失点,44,https://news.yahoo.co.jp/articles/8cc401c90767a4c0dc22e116aeb090c9e79b7e8b,4/4(木) 15:08
2024-04-04,18:18,sports,スポーツ,14,サンケイスポーツ,巨人・メンデスが４回４安打４失点　昨季２試合で無失点の中日に４四球で自滅,44,https://news.yahoo.co.jp/articles/547acf4c33246bd88d3d8240fffa85239f4b8461,4/3(水) 20:04
2024-04-04,18:18,sports,スポーツ,15,スポニチアネックス,西武惜敗も…開幕2カード連続勝ち越し　松井監督「最後の最後まで諦めずにやってくれた」,40,https://news.yahoo.co.jp/articles/547a790d6232c1f39f8199c777dd1ecea0ae2303,4/4(木) 16:52
2024-04-04,18:18,sports,スポーツ,16,スポニチアネックス,大谷翔平　ジャイアンツ戦「2番・DH」で先発出場　開幕9戦目で待望のドジャース1号出るか,40,https://news.yahoo.co.jp/articles/be184dd53e2c5da76e7a1b89d794a94245b4fbf4,4/4(木) 7:24
2024-04-04,18:18,sports,スポーツ,17,Full-Count,大谷翔平、衝撃の1号…131メートルの特大弾　本拠地騒然、“自身最遅”41打席目で移籍後初アーチ,39,https://news.yahoo.co.jp/articles/0fe898325998c4b864798dd64453137fba59c26a,4/4(木) 13:09
2024-04-04,18:18,sports,スポーツ,18,デイリースポーツ,ＤｅＮＡ・浜口の出場選手登録を抹消　３日の阪神戦で森下に逆転２ランを被弾し初黒星　チームも逆転負け,38,https://news.yahoo.co.jp/articles/7266e37c4250d8c02eb05e2d594909270cc77ce9,4/4(木) 16:11
2024-04-04,18:18,sports,スポーツ,19,日テレNEWS NNN,【ロッテ】不動の守護神・益田直也が登録抹消　2試合連続でセーブ機会失敗,38,https://news.yahoo.co.jp/articles/3f30c02edb86446675d5fa889dce3c2bf5137bb9,4/4(木) 16:32
2024-04-04,18:18,sports,スポーツ,20,日刊ゲンダイDIGITAL,【巨人】阿部監督が隠し持つ二の矢、三の矢…最弱中日にまさかの連敗も泰然自若,37,https://news.yahoo.co.jp/articles/ded6140c952005419ca7602abfa0e7860a4d8abb,4/4(木) 11:40
2024-04-04,18:18,sports,スポーツ,21,ベースボールキング,ついに出た大谷翔平の今季1号！　開幕9戦41打席目で待望のドジャース移籍後初本塁打,36,https://news.yahoo.co.jp/articles/994bdc40837e4890db985bf09cb91f49312d360d,4/4(木) 13:13
2024-04-04,18:18,sports,スポーツ,22,Full-Count,大谷翔平、記念球は「すごく特別」　女性ファンへ見返りはバット＆帽子「サインも書きました」,35,https://news.yahoo.co.jp/articles/2d14c5ad134d9019f37e2c5b57f19c2fdc455b24,4/4(木) 14:05
2024-04-04,18:18,sports,スポーツ,23,日刊スポーツ,【阪神】２軍５回までに14失点　秋山拓巳、津田淳哉、森木大智が粘れず中日に黒星,34,https://news.yahoo.co.jp/articles/f06261d04d12adf539a256ef9c1ff4c188d21808,4/4(木) 17:18
2024-04-04,18:18,sports,スポーツ,24,デイリースポーツ,西武　オリックス・東を打ち崩せず、連勝は２でストップ　先発転向のタカハシが６回途中２失点の好投も,34,https://news.yahoo.co.jp/articles/42eb3158c0c0b86564e9d4df92da5b1cd28a61cb,4/4(木) 16:00
2024-04-04,18:18,sports,スポーツ,25,CoCoKARAnext,「なぜ止めようとしなかった」水原氏の違法賭博騒動で大谷翔平に疑問 名将マッドンが指摘した“会計の謎”「理解ができない」,33,https://news.yahoo.co.jp/articles/bb6e81afaac4cc3416b1ac15823af7967408a17d,4/4(木) 11:27
2024-04-04,18:18,sports,スポーツ,26,カナロコ by 神奈川新聞,【ＤｅＮＡ】２年目松尾汐恩が初先発マスクへ　三浦監督「思い切ってやって」,33,https://news.yahoo.co.jp/articles/cc5984e59d96ed3db94dfb4a48bce9cd40c03dec,4/4(木) 17:00
2024-04-04,18:18,sports,スポーツ,27,西スポWEB OTTO！,西武、1点差の惜敗で3連勝ならず　初先発のボーが好投も打線がオリックス投手陣の前に1得点,33,https://news.yahoo.co.jp/articles/8f61b6322f722211ab4eec32dcaa0a91cb12b999,4/4(木) 15:55
2024-04-04,18:18,sports,スポーツ,28,FOOTBALL ZONE,U-23日本代表、パリ五輪切符懸けたアジア杯メンバー23人発表　松木ら選出…GK鈴木はメンバー外,32,https://news.yahoo.co.jp/articles/46b57bd5bbc227736203d4f9d5d966ebebbf471c,4/4(木) 14:00
2024-04-04,18:18,sports,スポーツ,29,スポニチアネックス,大谷翔平　ついに出た！開幕9試合、41打席目で待望のドジャース1号　今季2度目完売本拠ファンも総立ち,32,https://news.yahoo.co.jp/articles/3191e7267c7ec368d878279dbf1d5daec07ca966,4/4(木) 13:09
2024-04-04,18:18,sports,スポーツ,30,Full-Count,ロッテ、守護神の益田直也を抹消…2戦連続で救援失敗　巨人助っ人も降格、4日の公示,31,https://news.yahoo.co.jp/articles/9c669b77ee12ee0f7b65eb0404358e8584c2c9aa,4/4(木) 16:04
2024-04-04,18:18,sports,スポーツ,31,スポニチアネックス,オリックス・中嶋監督　6人スタメン入れ替えで辛勝　安達の3出塁に「ああいうのを見てどう思うか」,31,https://news.yahoo.co.jp/articles/987d5af858cef7c29547574ff8b65af87f2d0f1d,4/4(木) 17:05
2024-04-04,18:18,sports,スポーツ,32,TBS NEWS DIG Powered by JNN,【4日・巨人スタメン】外野は萩尾1番ライト 丸3番レフト オコエ6番センター 岡本和4番ファースト 先発・菅野 捕手は小林7番,29,https://news.yahoo.co.jp/articles/5bd7f45be83a038aeb4dfda8e73c82dcc795a49a,4/4(木) 17:37
2024-04-04,18:18,sports,スポーツ,33,東スポWEB,渋野日向子　７２位と出遅れにＳＮＳ〝激評〟「飛ばない、寄らない、入らない」「破滅の道」,29,https://news.yahoo.co.jp/articles/c732b4ad3e82a3d4febb5918ff68daf06cea3ad7,4/4(木) 11:36
2024-04-04,18:18,sports,スポーツ,34,Full-Count,大谷翔平の1号球は「1.5億円の価値」　“交換条件”にファン論争「ポルシェ貰えた」,29,https://news.yahoo.co.jp/articles/9df9a905365dfc82c8c57731851b4269278ca869,4/4(木) 16:01
2024-04-04,18:18,sports,スポーツ,35,スポニチアネックス,657日ぶり結成！巨人“最強バッテリー”スガコバで借金生活脱出へ！小林誠司の先発出場は336日ぶり,28,https://news.yahoo.co.jp/articles/b080536cf2b13455d66dd9d59afff6dc7810e080,4/4(木) 17:15
2024-04-04,18:18,sports,スポーツ,36,中日スポーツ,中日スタメン、打線は３戦連続で同じオーダー 今季初登板の先発・梅津晃大は４年ぶりの巨人戦,28,https://news.yahoo.co.jp/articles/49836f10335fd5eaa8c70f66983d3226ae0b4f43,4/4(木) 17:24
2024-04-04,18:18,sports,スポーツ,37,中国新聞デジタル,カープのレイノルズとシャイナーがリハビリ開始　左肩痛と右手中指剝離骨折で出場選手登録抹消,28,https://news.yahoo.co.jp/articles/9b978a75bda783ee652faabf0625d95f8dfa1663,4/4(木) 16:32
2024-04-04,18:18,sports,スポーツ,38,サンケイスポーツ,オリックス・山下舜平大、制球に苦しみ二回までに３四球１失点,28,https://news.yahoo.co.jp/articles/c7a05d662657313aee46a4058e3ece2ce2a1d15a,4/3(水) 18:49
2024-04-04,18:18,sports,スポーツ,39,日刊スポーツ,大谷翔平が第４打席で待望のドジャース１号！41打席目のアーチにかみしめるようにベースを１周,27,https://news.yahoo.co.jp/articles/fbd8dd84859b7c849fc2350fb1c741b9f7f4f11c,4/4(木) 13:20
2024-04-04,18:18,sports,スポーツ,40,スポーツ報知,【巨人】２番手で赤星優志が５回から今季初登板　２イニングをパーフェクト,27,https://news.yahoo.co.jp/articles/98ec107c80d7020976a72b6d27d2e33a9101324b,4/3(水) 19:56
