scrp_date,scrp_time,genre_en,genre_jp,rank,media_jp,title,comment,link,date_original
2024-04-04,05:21,sports,スポーツ,1,デイリースポーツ,３連敗の巨人・阿部監督　乱調の助っ人左腕に即２軍落ち通達「もう一回やり直してくれ、と」「体にキレもないし内容が良くない」,92,https://news.yahoo.co.jp/articles/1a67dbbde45722a27952dad7c71df9fdcff951e8,4/3(水) 21:15
2024-04-04,05:21,sports,スポーツ,2,Full-Count,大谷翔平の不振は「タイミング」　自己最悪の開幕8戦HRなしも…指揮官は“楽観視”,92,https://news.yahoo.co.jp/articles/d4d2223497e608dec3eb6d026c3463f1064e3550,4/3(水) 15:17
2024-04-04,05:21,sports,スポーツ,3,デイリースポーツ,巨人が痛恨３連敗で借金１　先発メンデスが４回４失点ＫＯ　萩尾プロ１号も空砲、梶谷は左膝痛で抹消,66,https://news.yahoo.co.jp/articles/bbbd75b66198b9b2424dd8c0f78891399bae9c9a,4/3(水) 20:47
2024-04-04,05:21,sports,スポーツ,4,スポーツ報知,【巨人】４回に岡本和真の遊ゴロで１点を返す　２回にメンデスが２失点,50,https://news.yahoo.co.jp/articles/eaf1869f8de120cdda390459a83e3db12426a37c,4/3(水) 19:10
2024-04-04,05:21,sports,スポーツ,5,THE DIGEST,ドジャース３連勝もMVPトリオに明暗… 大谷翔平は37打席ノーアーチ。ベッツがリーグ単独トップ５号、フリーマン３安打と躍動,45,https://news.yahoo.co.jp/articles/24b2933b4e003ecb4762886ed3afb1f4631229bc,4/3(水) 14:07
2024-04-04,05:21,sports,スポーツ,6,東スポWEB,【Ｆ１】角田裕毅がレッドブル昇格候補外れると英ＢＢＣ報道「ホンダから押し付けられ評価していない」,44,https://news.yahoo.co.jp/articles/6a9d3b4142309ebeb150c6883293e4171d974420,4/3(水) 12:51
2024-04-04,05:21,sports,スポーツ,7,サンケイスポーツ,巨人・メンデスが４回４安打４失点　昨季２試合で無失点の中日に４四球で自滅,44,https://news.yahoo.co.jp/articles/547acf4c33246bd88d3d8240fffa85239f4b8461,4/3(水) 20:04
2024-04-04,05:21,sports,スポーツ,8,中日スポーツ,大谷翔平、開幕8戦、37打席ノーアーチ　自己ワースト更新　この日は3打数無安打1四球　ドジャースは逃げ切り3連勝,41,https://news.yahoo.co.jp/articles/8db172fb0819095e696db6f6b339391bc0daedb0,4/3(水) 14:08
2024-04-04,05:21,sports,スポーツ,9,中日スポーツ,ロッテ、延長12回制し連敗脱出！途中出場の荻野貴司が決勝打、9回には代打・角中もタイムリー,38,https://news.yahoo.co.jp/articles/72d82f935b5b3ed637bd4619b168327a0cf6e003,4/3(水) 22:24
2024-04-04,05:21,sports,スポーツ,10,スポニチアネックス,巨人、序盤から苦しい戦い　昨季中日戦防御率0.00のメンデスが4回4失点KO　4四球乱調で73球降板,38,https://news.yahoo.co.jp/articles/237cab83af5848b9afd421a636c458b790dcbdb8,4/3(水) 19:32
2024-04-04,05:21,sports,スポーツ,11,デイリースポーツ,ＤｅＮＡ　痛恨の走塁ミスでチャンス消える　八回１死二塁で関根が牽制でアウトに,37,https://news.yahoo.co.jp/articles/97e42fc4e81548481c212e3d37ab28f7e56fa127,4/3(水) 20:11
2024-04-04,05:21,sports,スポーツ,12,Full-Count,“水飲み厳禁”「そりゃやめる」　130人→20人に消えた部員…起こした脱水症状,36,https://news.yahoo.co.jp/articles/b723954106b205bc1a95df058ca3b2e882c76331,4/3(水) 6:50
2024-04-04,05:21,sports,スポーツ,13,スポーツ報知,大谷翔平、初回１打席目は見三振で３４打席連続本塁打なし…待望の新天地初アーチなるか,35,https://news.yahoo.co.jp/articles/141486542dade900a226cdcd711db9c56ee90e09,4/3(水) 11:22
2024-04-04,05:21,sports,スポーツ,14,東スポWEB,【巨人】メンデスが４回４失点ＫＯ　昨季防御率０・００の〝中日キラー〟まさかの乱調,34,https://news.yahoo.co.jp/articles/0afb51aa3c9d6143b3bc6a159974adff160789bb,4/3(水) 19:46
2024-04-04,05:21,sports,スポーツ,15,Full-Count,巨人、開幕3番の梶谷を抹消　オコエが今季初昇格、2軍で打率.393…3日の公示,33,https://news.yahoo.co.jp/articles/a3289fe538c3d1600dfc57171ba2a07e0f9a86bc,4/3(水) 16:03
2024-04-04,05:21,sports,スポーツ,16,東スポWEB,井岡一翔　エストラーダ戦消滅　ジム関係者「お金で持っていかれました。過去最高」,33,https://news.yahoo.co.jp/articles/3f2372c8e1b44651ae48300f45c78cb7b67c5eec,4/3(水) 15:06
2024-04-04,05:21,sports,スポーツ,17,ABEMA TIMES,大谷翔平「顔が暗い」「疲れているのでは？」見逃し三振後にベンチで見せた表情に心配の声相次ぐ事態に,32,https://news.yahoo.co.jp/articles/f37e0502110594941ed2b3bf8eead82dc157d7da,4/3(水) 18:46
2024-04-04,05:21,sports,スポーツ,18,ゲキサカ,首位町田がついにJ1初黒星…進撃止めたのは無敗広島!! 終盤ロングスロー被弾も逃げ切り成功,31,https://news.yahoo.co.jp/articles/90ce1de3a37d32a9b42e1a1ee9d8b9e6a057ae1a,4/3(水) 20:59
2024-04-04,05:21,sports,スポーツ,19,デイリースポーツ,ＤｅＮＡ・三浦監督「あそこは慌てる必要がなかった」関根の痛恨走塁ミスを悔やむ「流れが変わってしまった」,30,https://news.yahoo.co.jp/articles/77e62f5eee0505da09af50c2abeb690b8c067fe0,4/3(水) 21:29
2024-04-04,05:21,sports,スポーツ,20,サンケイスポーツ,オリックス・山下舜平大、制球に苦しみ二回までに３四球１失点,30,https://news.yahoo.co.jp/articles/c7a05d662657313aee46a4058e3ece2ce2a1d15a,4/3(水) 18:49
2024-04-04,05:21,sports,スポーツ,21,中日スポーツ,守護神・益田直也、２戦連続で救援失敗　押し出し四球で同点許す【ロッテ】,29,https://news.yahoo.co.jp/articles/c2b1d0c79589e5180dbcd43662bb470f390932a8,4/3(水) 21:31
2024-04-04,05:21,sports,スポーツ,22,スポーツ報知,【巨人】 打撃好調のオコエ瑠偉が１軍合流　前日に梶谷隆幸がコンディション不良でベンチ外,29,https://news.yahoo.co.jp/articles/7dc1b009f1d69fdadaa281dfbc140e6bc3153aa4,4/3(水) 14:20
2024-04-04,05:21,sports,スポーツ,23,スポーツ報知,【巨人】２番手で赤星優志が５回から今季初登板　２イニングをパーフェクト,27,https://news.yahoo.co.jp/articles/98ec107c80d7020976a72b6d27d2e33a9101324b,4/3(水) 19:56
2024-04-04,05:21,sports,スポーツ,24,スポーツ報知,大谷翔平が開幕８戦目も４打席目まで無安打で本塁打なし,26,https://news.yahoo.co.jp/articles/7b61da50c2018d83eb6156b60cf6eabd3b73ba0d,4/3(水) 13:16
2024-04-04,05:21,sports,スポーツ,25,西スポWEB OTTO！,ソフトバンク、延長12回に力尽き痛い敗戦　同点の9回に守護神オスナがまさかの失点　土壇場で追いつき今季初の延長戦に持ち込むも…,26,https://news.yahoo.co.jp/articles/71c7abedc242b66ab49c3c9c97a79330d81e08f4,4/3(水) 22:17
2024-04-04,05:21,sports,スポーツ,26,ベースボールキング,中日が連勝で勝率5割！山﨑武司氏「スワローズ戦の悪夢はもう消えましたね」,25,https://news.yahoo.co.jp/articles/52932034e803d87bd03553643b4d8b8f14dd66f1,4/3(水) 21:08
2024-04-04,05:21,sports,スポーツ,27,イーファイト,ブレイキングダウンに参戦した「サカキマキオ」、強盗容疑逮捕から“不起訴”を報告,25,https://news.yahoo.co.jp/articles/dcab9d650a628e909fc47b408a76fa7e142fcbcd,4/3(水) 18:59
2024-04-04,05:21,sports,スポーツ,28,東スポWEB,【巨人】阿部監督が乱調メンデスに二軍降格を通達「キャッチャーは配球にならない」,25,https://news.yahoo.co.jp/articles/aae22014b702e82f740e9871133a944145874402,4/3(水) 21:51
2024-04-04,05:21,sports,スポーツ,29,スポーツ報知,待望のドジャース初アーチへ大谷翔平「２番・ＤＨ」でスタメン　自己ワースト７戦＆３３打席不発も,25,https://news.yahoo.co.jp/articles/7ef31a8f64d723207497d4d2e4a506dcfdfa1f20,4/3(水) 7:07
2024-04-04,05:21,sports,スポーツ,30,スポニチアネックス,宮城野親方が転籍先の伊勢ケ浜親方から“謝罪行脚”指令「全国回って親御さんに会ってきなさい」,24,https://news.yahoo.co.jp/articles/7fd248a70ba4fb80de82f3258b825653764d93bc,4/3(水) 13:19
2024-04-04,05:21,sports,スポーツ,31,スポーツ報知,大谷翔平がいなくなったエンゼルスが”破竹”の３連勝で昨年８月４日以来の貯金１,23,https://news.yahoo.co.jp/articles/62ae6eabdee0650aa212a1dd0bd5f24da8596a5e,4/3(水) 10:08
2024-04-04,05:21,sports,スポーツ,32,スポーツ報知,【阪神】佐藤輝明、１死一、三塁の好機で見逃し三振　ＮＰＢシーズン記録上回るハイペース,23,https://news.yahoo.co.jp/articles/4c30a265773ed2f72d279ab6d519de4f4f71e2f7,4/3(水) 19:34
2024-04-04,05:21,sports,スポーツ,33,スポーツ報知,【巨人】オコエ瑠偉が昇格即「７番・中堅」、「１番」は２戦連続で萩尾匡也…中日戦スタメン発表,22,https://news.yahoo.co.jp/articles/bbb606a62e23e92820bed45c62caa46a96f2e647,4/3(水) 17:29
2024-04-04,05:21,sports,スポーツ,34,Number Web,19歳で妊娠が判明「ゴルフよりも、命を優先したかった」4度目で悲願のプロテスト合格…ママさんゴルファー神谷和奏22歳の挑戦,22,https://news.yahoo.co.jp/articles/e466a37a3e33c7dd9e815400e1a376cbd3bce904,4/3(水) 11:06
2024-04-04,05:21,sports,スポーツ,35,Full-Count,大谷翔平に見えた“孤独”　いるはずの人物がいない…米記者が指摘「貫禄なくなってる」,22,https://news.yahoo.co.jp/articles/ba60a562b6115ea2b0f01d9a2a0692ba75911d58,4/3(水) 17:27
2024-04-04,05:21,sports,スポーツ,36,東スポWEB,町田がＪ１初黒星　試合後にコーチが審判に怒りの抗議も「Ｊ１にはＶＡＲがある」の指摘,22,https://news.yahoo.co.jp/articles/127624004f073b4fee18f7c9b58b7b0a948260a8,4/3(水) 21:51
2024-04-04,05:21,sports,スポーツ,37,中日スポーツ,中日・大野雄大、556日ぶり白星！「はい、ただいま、はい」5イニング1失点、完全復活へ幸先のいいスタート,22,https://news.yahoo.co.jp/articles/c1fd1e80646a323e48dfd3a0b4fe77582c6e4950,4/3(水) 20:44
2024-04-04,05:21,sports,スポーツ,38,日刊スポーツ,【町田】広島との無敗対決敗れ開幕からの負けなし５でストップ　自慢の堅守崩される,22,https://news.yahoo.co.jp/articles/a95c7bc30b88bfa5cc7540747fc7e53dbd7b29a6,4/3(水) 21:10
2024-04-04,05:21,sports,スポーツ,39,中日スポーツ,中日・立浪監督、サード高橋周平は「12球団で間違いなくトップクラス」守備を称賛「タイムリー１本に値するプレー」,21,https://news.yahoo.co.jp/articles/fd0c135fef06e58a3d7aa43a61e3a4a863611164,4/3(水) 21:49
2024-04-04,05:21,sports,スポーツ,40,デイリー新潮,「本人確認不要で50万ドル一括送金も可能です」　水原一平氏の違法賭博問題、残された“最大の謎”、具体的なシステムを解説,21,https://news.yahoo.co.jp/articles/713c6b5caf8c0d323a72ef1f2f1f8707a4c0d9f2,4/3(水) 11:42
