scrp_date,scrp_time,genre_en,genre_jp,rank,media_jp,title,comment,link,date_original
2025-10-11,16:07,world,国際,1,ロイター,玉木国民代表「首相務める覚悟ある」、公明の連立離脱で,245,https://news.yahoo.co.jp/articles/2b8d0f71b3cbd60d5beeb1ceb7ef9c3c5e6fce7f,10/10(金) 17:35
2025-10-11,16:07,world,国際,2,毎日新聞,トランプ氏、ノーベル平和賞受賞ならず　八つの戦争解決と主張も,124,https://news.yahoo.co.jp/articles/4942550144564bef43f12a8d416f163b62cb4377,10/10(金) 18:01
2025-10-11,16:07,world,国際,3,ロイター,米、11月から中国に100％の追加関税　トランプ氏が表明,109,https://news.yahoo.co.jp/articles/34d9eed20efca5c47ae3a5f0eab7cc9ce15973a9,10/11(土) 6:11
2025-10-11,16:07,world,国際,4,ＡＦＰ＝時事,15歳少女レイプ殺害犯の死刑執行 米インディアナ州,85,https://news.yahoo.co.jp/articles/b1f8c410c98809b16d50bee8624381122e6aafc9,10/11(土) 11:55
2025-10-11,16:07,world,国際,5,共同通信,平和賞「トランプ氏にささげる」　マチャド氏、野党勢力支持で,68,https://news.yahoo.co.jp/articles/25e718489a58ab96b44d5ea8c2da61d4ba3794d3,10/10(金) 23:07
2025-10-11,16:07,world,国際,6,BuzzFeed Japan,“リス”だと勘違い。狩猟中に誤射事故、17歳男子高校生が死亡→当局が注意喚起 （米アイオワ州）,61,https://news.yahoo.co.jp/articles/fbb9f820866ee2543ffdb533a6127ed268e2f912,10/11(土) 14:10
2025-10-11,16:07,world,国際,7,ロイター,米政府、大規模な人員削減開始　政府機関閉鎖10日目,58,https://news.yahoo.co.jp/articles/6cca7c1aea050db038cd2e91790c5d47a63fb846,10/11(土) 5:27
2025-10-11,16:07,world,国際,8,ハンギョレ新聞,自民党の高市総裁、首相に就任できない可能性も,56,https://news.yahoo.co.jp/articles/83538880e4638276ff05b0aacf46108d30b713bf,10/11(土) 7:29
2025-10-11,16:07,world,国際,9,TBS NEWS DIG Powered by JNN,トランプ大統領　今月開催予定の米中首脳会談「中止していない」 レアアース規制への反発で中止示唆から一転,45,https://news.yahoo.co.jp/articles/7d8aa4fd99cf3451813d8f66f48c2712a76647f6,10/11(土) 10:02
2025-10-11,16:07,world,国際,10,ＡＦＰ＝時事,トランプ派の意に沿わぬ人間は「アンティファ」扱い、殺害予告受けた大学教授が米国脱出,40,https://news.yahoo.co.jp/articles/3cf45f3cf328e5b84fa9d2ad4dbeae2359668a3e,10/11(土) 14:47
2025-10-11,16:07,world,国際,11,中央日報日本語版,「東京の路上でネズミにかまれて出血」…旅行客が載せた映像,35,https://news.yahoo.co.jp/articles/e91634a8e17c752aa432e0350e3a31b65e649b83,10/11(土) 11:36
2025-10-11,16:07,world,国際,12,FNNプライムオンライン（フジテレビ系）,ノーベル平和賞にベネズエラの野党指導者マリア・コリナ・マチャド氏　弾圧受けるも、政権交代への期待高まるうねり導く,34,https://news.yahoo.co.jp/articles/a03074b3d710af750dc99b3447a060f51e6eabaf,10/10(金) 18:16
2025-10-11,16:07,world,国際,13,中央日報日本語版,プーチン大統領「ノーベル平和賞、何もしていない人に授与した事例も」,23,https://news.yahoo.co.jp/articles/74439f38b8d456e9d17fec808748a24212a2b15c,10/11(土) 13:15
2025-10-11,16:07,world,国際,14,TBS NEWS DIG Powered by JNN,石破総理戦後80年所感、韓国外交部「過去の歴史を直視するのは望ましい」,22,https://news.yahoo.co.jp/articles/5712cfa6ab615143f2048209c29622095e4d2775,10/11(土) 14:32
2025-10-11,16:07,world,国際,15,CNN.co.jp,トランプ氏、新型コロナとインフルのワクチン接種受ける　今年２回目の健康診断で,19,https://news.yahoo.co.jp/articles/55f2f8cddf3496d27f19f6764dbb9a86491bcf80,10/11(土) 12:20
2025-10-11,16:07,world,国際,16,Wedge（ウェッジ）,「クソみたいなことはもう終わりだ」「太った将軍はうんざり」…言いたい放題のヘグセス米国防長官の意見に米国社会は賛成か、反対か？,19,https://news.yahoo.co.jp/articles/991911d9b7d4126601c7954dec9b3af41cd0251f,10/11(土) 5:48
2025-10-11,16:07,world,国際,17,FNNプライムオンライン（フジテレビ系）,ノーベル平和賞のマチャド氏から「平和賞にはトランプ氏がふさわしい」と言われたとトランプ大統領が主張,18,https://news.yahoo.co.jp/articles/cb2cc5da1fe045e644540eda645ea4f519ce1faf,10/11(土) 14:46
2025-10-11,16:07,world,国際,18,Forbes JAPAN,財政の限界にぶつかったロシア、軍人への給与支払いに苦労し始める可能性,16,https://news.yahoo.co.jp/articles/05f94af6ade1e362304d7cae1009f4dacc608a79,10/11(土) 9:00
2025-10-11,16:07,world,国際,19,時事通信,トランプ氏、健康診断「良好」　コロナワクチンも接種,15,https://news.yahoo.co.jp/articles/27ca00dc88fc6579d418aeb2089ec4c82ce55417,10/11(土) 15:09
2025-10-11,16:07,world,国際,20,ロイター,公明が自民との連立離脱、「政治とカネ」で溝埋まらず　26年間の関係解消,15,https://news.yahoo.co.jp/articles/1d26209634d1ed1ea5476906c238cdf9bfedc796,10/10(金) 16:57
2025-10-11,16:07,world,国際,21,中央日報日本語版,トランプ大統領、中国のレアアース統制に怒り…「APECで習近平主席に会う理由ない」,14,https://news.yahoo.co.jp/articles/90d5faac074daa88c151bd09ef75af9e1d639781,10/11(土) 13:40
2025-10-11,16:07,world,国際,22,テレビ朝日系（ANN）,トランプ大統領、ノーベル平和賞逃す　ホワイトハウスは不満あらわ,14,https://news.yahoo.co.jp/articles/15023aa1c6cf3b2af15a8adb8c08dfa61f6b9836,10/11(土) 11:27
2025-10-11,16:07,world,国際,23,ロイター,トランプ氏、心臓年齢は実年齢マイナス14歳　健康状態に医師が太鼓判,13,https://news.yahoo.co.jp/articles/fd40d40f24b0e0ac02ab2d6f503379fce4ff0de3,10/11(土) 15:03
2025-10-11,16:07,world,国際,24,KOREA WAVE,韓国の成人61％「自分の生活水準は親より良い」…「子ども世代は良くなる」42％にとどまる,13,https://news.yahoo.co.jp/articles/81337c498d51ede1218e9d2f07c8db22fc64c87b,10/11(土) 15:12
2025-10-11,16:07,world,国際,25,FNNプライムオンライン（フジテレビ系）,公明連立離脱を中国メディアも速報　日本メディアを引用する形で,13,https://news.yahoo.co.jp/articles/a90210d921a3911702df7413985b259c787960d2,10/10(金) 16:36
2025-10-11,16:07,world,国際,26,共同通信,米の爆薬工場で爆発、死者複数　南部テネシー州、18人不明,12,https://news.yahoo.co.jp/articles/eb96bc4510039adc1f1cec863fd52aad3a1fad36,10/11(土) 5:22
2025-10-11,16:07,world,国際,27,ＡＦＰ＝時事,グレタさんは「反キリスト」の手先 シリコンバレー有力者,12,https://news.yahoo.co.jp/articles/ab486a2bb3dc61192938f3822834c9a71b7e11b0,10/11(土) 8:40
2025-10-11,16:07,world,国際,28,ＡＦＰ＝時事,ホワイトハウス、トランプ氏選考漏れを批判「平和より政治優先」 ノーベル平和賞,11,https://news.yahoo.co.jp/articles/8a5e9a70ae8ca40c8da6500cc6262107b4bdf9d9,10/11(土) 7:37
2025-10-11,16:07,world,国際,29,ハンギョレ新聞,韓国特検、旧統一教会・韓鶴子総裁を拘束起訴,11,https://news.yahoo.co.jp/articles/e6c179ff7f87e84dfcb5eef48f36443ffa2e17ac,10/11(土) 8:59
2025-10-11,16:07,world,国際,30,ABEMA TIMES,トランプ政権 連邦職員の解雇開始「民主党寄りの人々を対象」,11,https://news.yahoo.co.jp/articles/27f8cea25a54e57d54a344db3d43d1734ccb93ea,10/11(土) 12:06
2025-10-11,16:07,world,国際,31,KOREA WAVE,韓国銀行所蔵・美術品に「親日」作家の作品5点…国会で「処分の是非」問う声,11,https://news.yahoo.co.jp/articles/09349946e5a8806fc1b807969e7bd581ef59190a,10/11(土) 6:12
2025-10-11,16:07,world,国際,32,読売新聞オンライン,トランプ氏、ノーベル賞マチャド氏から電話受け「私にくれとは言わなかった」…受賞に未練にじむ,11,https://news.yahoo.co.jp/articles/413b896a9497814d0d7b472bab9cb6220679b855,10/11(土) 12:24
2025-10-11,16:07,world,国際,33,TBS NEWS DIG Powered by JNN,トランプ大統領が今年2回目の健康診断　医師「並外れて健康」 心血管の状態は実年齢よりも“14歳”若い,10,https://news.yahoo.co.jp/articles/23b7ae129769755902f978df4e7d69277043634a,10/11(土) 14:39
2025-10-11,16:07,world,国際,34,KOREA WAVE,螺鈿充電器から酒器までMZ世代と外国人が熱狂する「Kグッズ」…数億ウォン単位のヒット連発,10,https://news.yahoo.co.jp/articles/d89d7601bc217a19b5b429f23212d64b4e554800,10/11(土) 14:12
2025-10-11,16:07,world,国際,35,TBS NEWS DIG Powered by JNN,チリ南部沖ドレーク海峡でマグニチュード7.6の地震　日本への津波の影響なし　気象庁発表,10,https://news.yahoo.co.jp/articles/55fa3e2207a310ccea1d79011d559bc527aed03f,10/11(土) 6:30
2025-10-11,16:07,world,国際,36,読売新聞オンライン,イスラエル軍が停戦発効を宣言、合意地点まで後退…合意監視のため米軍要員２００人派遣へ,9,https://news.yahoo.co.jp/articles/e28268591245bcf995b9eaedbeb478ac26a03de2,10/10(金) 21:38
2025-10-11,16:07,world,国際,37,NEWSポストセブン,《金髪美女コンビがNYからイギリスに大麻35kg密輸》有罪判決後も会員制サイトで過激コンテンツを販売し大炎上、被告らは「私たちの友情は揺るがないわ」,9,https://news.yahoo.co.jp/articles/5fe0a47328558cd870accd763995236ed4b48264,10/11(土) 11:15
2025-10-11,16:07,world,国際,38,読売新聞オンライン,トランプ政権が連邦職員の解雇始める、対象４０００人超…政府閉鎖１０日でも収束めど立たず,9,https://news.yahoo.co.jp/articles/4250fd7e2257b449a63f28dc6f7a8553f78e11d8,10/11(土) 10:26
2025-10-11,16:07,world,国際,39,時事通信,米政府、ノーベル平和賞の結果批判　トランプ氏受賞逃す,9,https://news.yahoo.co.jp/articles/8a64e1c04eaa7f12f0846662591326db97bb6b88,10/10(金) 21:56
2025-10-11,16:07,world,国際,40,ＡＦＰ＝時事,米国、海洋輸送における炭素税支持国への制裁を示唆,9,https://news.yahoo.co.jp/articles/9154698e180cac6c578b156838107d6d790c32d9,10/11(土) 13:58
