scrp_date,scrp_time,genre_en,genre_jp,rank,media_jp,title,comment,link,date_original
2024-09-21,14:06,TTL,総合,1,TBS NEWS DIG Powered by JNN,大谷翔平、本拠地でいきなり“52－52”達成！1HR3安打1盗塁と連夜の大爆発、イチロー氏の日本人最多56盗塁に迫る,944,https://news.yahoo.co.jp/articles/89e6bcdc6fb8edb2fe5f3a8b40b440faa0adab92,9/21(土) 13:05
2024-09-21,14:06,TTL,総合,2,中京テレビＮＥＷＳ,「なに　いきって歩いとんねん」 高速SAで因縁つけ暴行か 不良グループのリーダー6回目の逮捕,502,https://news.yahoo.co.jp/articles/c3f612343f3a11281a39fa6132d401c5b73a0eb7,9/21(土) 9:58
2024-09-21,14:06,TTL,総合,3,AERA dot.,高市早苗氏の恐るべき“居直り体質”と“軍拡主義”　もし首相になったら「日本は終わる」　古賀茂明,407,https://news.yahoo.co.jp/articles/b70a6628904e9193ff3a4deefc2db950ca173512,9/21(土) 10:32
2024-09-21,14:06,TTL,総合,4,AERA dot.,PTAで「知らない人が自宅をピンポン」　強制加入問題「気づいたら会員だった」が6割の現実,309,https://news.yahoo.co.jp/articles/b0ddc6cfa0d659d3459f7965b447d92c77406e51,9/21(土) 7:32
2024-09-21,14:06,TTL,総合,5,デイリースポーツ,土曜朝にネット騒然　不信任の兵庫知事→全国ＴＶに生出演「自分の思い伝わり切れてない」と３０分　辞職ｏｒ解散は考え中「出てきた」「凄いな」,235,https://news.yahoo.co.jp/articles/2dac4b115ff1b3134a07d8a381db543ab11c8cc3,9/21(土) 9:43
2024-09-21,14:06,TTL,総合,6,毎日新聞,「別姓にしたい」事実婚を切り出され、口走った婚約破棄　選択的夫婦別姓の議論、決着願う夫婦,232,https://news.yahoo.co.jp/articles/dcdc6aa017582c2d91bda7ce3ea3c99659304407,9/21(土) 11:03
2024-09-21,14:06,TTL,総合,7,毎日新聞,石川・輪島、仮設住宅が床上浸水　住民救助、けが人なし,228,https://news.yahoo.co.jp/articles/ce4259c40a8c938a400906afd6c521ecfd8fff0d,9/21(土) 12:45
2024-09-21,14:06,TTL,総合,8,日刊ゲンダイDIGITAL,小室圭さん騒動時を彷彿させる宮内庁長官の“ズレ”…まずは悠仁さま世代の受験生が納得する丁寧な説明を【秋篠宮家の学校選び】,228,https://news.yahoo.co.jp/articles/0a7aec66528293145297d5c737f602a3c7e6a463,9/21(土) 9:06
2024-09-21,14:06,TTL,総合,9,デイリースポーツ,大谷翔平、2戦連発52号逆転2ラン　悪球打ち129メートル豪快弾に本拠地熱狂　史上初「50－50」達成翌日も勢い継続　MLBキングのジャッジに1差,215,https://news.yahoo.co.jp/articles/8e301f7df10d61a0be83e58c6cacbf1271685764,9/21(土) 12:29
2024-09-21,14:06,TTL,総合,10,スポーツ報知,兵庫県・斎藤元彦知事、「ウェークアップ」生出演…「進退」問われ「少しずつ自分の思いは固まりつつある」,196,https://news.yahoo.co.jp/articles/183c561115bd8239310801c8148798be3491a62c,9/21(土) 8:19
2024-09-21,14:06,TTL,総合,11,TBS NEWS DIG Powered by JNN,「被爆体験者」全員に被爆者と同等の医療費助成へ　岸田総理が長崎県知事らに表明,193,https://news.yahoo.co.jp/articles/728e07137e0162cfd394794add6539c2287391ea,9/21(土) 8:57
2024-09-21,14:06,TTL,総合,12,デイリー新潮,「元県民局長が亡くなったのは“自責の念”から」…不信任決議の当日も「斎藤兵庫県知事」を擁護していた「維新」県議団幹部,188,https://news.yahoo.co.jp/articles/05bb5c132932153ee89294b08f929066678bddcc,9/21(土) 11:13
2024-09-21,14:06,TTL,総合,13,TBS NEWS DIG Powered by JNN,大谷翔平、勢い止まらず52号逆転2ラン！2戦4発でついにジャッジと1本差　“51－51”翌日の凱旋試合でファンへ御礼弾,186,https://news.yahoo.co.jp/articles/913f7245f4440a6285abb8f3810a554b10ddbce2,9/21(土) 12:29
2024-09-21,14:06,TTL,総合,14,MRO北陸放送,石川県に大雨特別警報 レベル5相当 最大級の警戒を,181,https://news.yahoo.co.jp/articles/90ddce28b9130f36ae8c608ee077afaaf34e8409,9/21(土) 10:51
2024-09-21,14:06,TTL,総合,15,TBS NEWS DIG Powered by JNN,中国、日本の水産物「輸入を徐々に再開する」,180,https://news.yahoo.co.jp/articles/aecfb28ce55ad776137d089116fbe65b58b909dc,9/20(金) 16:11
2024-09-21,14:06,TTL,総合,16,読売新聞オンライン,深圳の男児刺殺、中国官製メディアほぼ沈黙…ＳＮＳへの投稿は続々と削除,178,https://news.yahoo.co.jp/articles/65fe5b678f9addb2aca37c2949ae8e00aaa0f6a9,9/20(金) 21:39
2024-09-21,14:06,TTL,総合,17,CoCoKARAnext,中日の「次期監督」を考える　ベターは内部昇格、在野なら経験者…いっそのこと外国人招へいも？,177,https://news.yahoo.co.jp/articles/17663b5e16b7cfd396fc9e971ae8b029981684a8,9/21(土) 11:10
2024-09-21,14:06,TTL,総合,18,ビジネス＋IT,3位転落 小泉進次郎の「誤算」、自民党総裁選の終盤情勢は？「高市総理」誕生なるか,164,https://news.yahoo.co.jp/articles/3a92d46fe23a110c6a98305613d43fda34b15092,9/21(土) 6:10
2024-09-21,14:06,TTL,総合,19,石川テレビ,石川県能登北部に大雨特別警報　午前11時時点の被害まとめ,149,https://news.yahoo.co.jp/articles/df8e171b0a0af7e49445128047af00da721262c0,9/21(土) 11:24
2024-09-21,14:06,TTL,総合,20,日刊ゲンダイDIGITAL,巨人・阿部監督1年目V目前で唇かむ原前監督…自身は事実上クビで「おいしいとこ取り」された憤まん,144,https://news.yahoo.co.jp/articles/261c133afe66c8d3a472c83a7658b1f81628371d,9/21(土) 9:06
2024-09-21,14:06,TTL,総合,21,スポーツ報知,ジャングルポケット・斉藤慎二が当面活動休止　体調不良で,144,https://news.yahoo.co.jp/articles/bfbd5f396e3deab1f9170e87152407b479d4fdce,9/20(金) 20:00
2024-09-21,14:06,TTL,総合,22,デイリースポーツ,高橋洋一氏　総裁選の全票予想を公表　「メッキはげた」急落候補の名前　トップは２人並ぶ「３強が２強に」と　都知事選ではズバリ実績,139,https://news.yahoo.co.jp/articles/0826e12a232d1ac439b6ffd2dc9fb05ad1da1062,9/21(土) 13:13
2024-09-21,14:06,TTL,総合,23,ABEMA TIMES,通信制の高校に入学したゆたぼん、YouTubeの収益や9歳で不登校になった理由を明かす「先生や学校が信用できなくなった」,135,https://news.yahoo.co.jp/articles/e6395ca81149e01ba7af832c9aea292da2ec9461,9/21(土) 11:32
2024-09-21,14:06,TTL,総合,24,FNNプライムオンライン,【速報】日本産水産物の禁輸を解除へ　中国側が段階的に実施と発表　中国産魚介類の価格も上昇　“海鮮離れ”に不満も,133,https://news.yahoo.co.jp/articles/eb2b376f09ed346e6e36b1430257a425a780eb25,9/20(金) 18:36
2024-09-21,14:06,TTL,総合,25,スポーツ報知,桐朋・森井翔太郎がメジャー挑戦決断　４球団オファー　４５発＆最速１５３キロの二刀流　マイナー契約から「はい上がっていきたい」,129,https://news.yahoo.co.jp/articles/ccb03928ae236948262bc0f69cc8c646127c24c9,9/21(土) 4:00
2024-09-21,14:06,TTL,総合,26,THE GOLD ONLINE（ゴールドオンライン）,"惨めです…最高月収120万円、退職金3,500万円「61歳・勝ち組サラリーマン」が一転、1人で「カップ麺」をすする毎日を送るワケ",125,https://news.yahoo.co.jp/articles/d7569f3fafb591b6ec64a9513cac8a1c778fb90d,9/21(土) 6:02
2024-09-21,14:06,TTL,総合,27,TBS NEWS DIG Powered by JNN,【21日・DeNAスタメン】宮崎はベンチ 捕手・戸柱5番 三遊間は京田7番サード 森敬8番ショート 神里6番センター 先発・濱口,124,https://news.yahoo.co.jp/articles/0c8bfe49fff6beab65ddef3b884e63a5f079e74c,9/21(土) 13:17
2024-09-21,14:06,TTL,総合,28,TBS NEWS DIG Powered by JNN,小泉進次郎元環境大臣　解雇規制見直しの総裁選公約に関し「再就職までの間に生活支援も」,119,https://news.yahoo.co.jp/articles/0a2760453c436d296fc559633d5506dd2a0270ef,9/21(土) 12:44
2024-09-21,14:06,TTL,総合,29,産経新聞,小泉氏58票でリード、党員票も優位　石破・高市両氏含め決選投票見通し　総裁選議員動向,118,https://news.yahoo.co.jp/articles/410731d70c9b1ed1218d29105ad85900e5512c3d,9/20(金) 21:22
2024-09-21,14:06,TTL,総合,30,日刊スポーツ,元NGT48中井りか第１子妊娠を発表　「オールナイトフジコ」で　３月にテレ東三宅優樹Ｄと結婚,106,https://news.yahoo.co.jp/articles/398593294b08cd1ddb7767b7b79809058b051131,9/21(土) 1:14
2024-09-21,14:06,TTL,総合,31,TBS NEWS DIG Powered by JNN,上級生が激しくドアを叩き…「おい!出てこい!」 防衛大の元学生“いじめ”の訴え 適応障害で退校 幹部自衛官養成の現場で何が【調査報道】,104,https://news.yahoo.co.jp/articles/30d8692b35661a19afd959049fd5cabeff12f6f1,9/20(金) 14:02
2024-09-21,14:06,TTL,総合,32,日刊スポーツ,斎藤元彦知事「辞職しないで与えられた４年任期全うさせて頂きたい」18億円知事選は県民の税金,95,https://news.yahoo.co.jp/articles/dc0c9a1bacde42044b94b3ef332232055b5844a7,9/21(土) 11:55
2024-09-21,14:06,TTL,総合,33,ABEMA TIMES,大谷翔平、2試合連続52個目の盗塁で「52-52」達成！ 90%超え29連続成功 残り8試合でイチロー氏の記録56に迫る,94,https://news.yahoo.co.jp/articles/49a5d36ea96aeb8f26dd76218d38bb53043c6c94,9/21(土) 13:05
2024-09-21,14:06,TTL,総合,34,共同通信,9候補、裏金議員の要職否定せず　自民総裁選、再調査必要はゼロ,92,https://news.yahoo.co.jp/articles/bc9957de7b92f11f0b2c6226006b0ea3b650c70c,9/20(金) 21:02
2024-09-21,14:06,TTL,総合,35,読売新聞オンライン,深圳の男児刺殺、地元警察「偶発的な事件」と発表…日本人を狙った事件でないと示唆し幕引き図る,84,https://news.yahoo.co.jp/articles/e88d78d989fe5a2f5f3a8899a6e0ecd69ba69c55,9/20(金) 15:41
2024-09-21,14:06,TTL,総合,36,TBS NEWS DIG Powered by JNN,「卵子提供」国内で進まない理由は? “似ていない”兄弟と指摘され…出産後も親が抱える不安【報道特集】,81,https://news.yahoo.co.jp/articles/d342246bb0bb57f202723e7b8313c705e1541da5,9/21(土) 6:32
2024-09-21,14:06,TTL,総合,37,SmartFLASH,テレビで見たくない不倫女性タレントは誰？3位は唐田えりか、2位はベッキー、1位は「あんなに可愛かったのに」とため息【500人に聞いた】,81,https://news.yahoo.co.jp/articles/238632751ebe5f39fc96e6ecc3caf6e9fd4d318d,9/21(土) 11:29
2024-09-21,14:06,TTL,総合,38,FNNプライムオンライン（フジテレビ系）,【速報】佳子さまが鳥取県を訪問　ベージュの秋の装いで笑顔　手話パフォーマンス甲子園出席へ,78,https://news.yahoo.co.jp/articles/0881105473ff7a9b4ea1d8e09507c54a6e2e0b54,9/21(土) 11:13
2024-09-21,14:06,TTL,総合,39,毎日新聞,トランプ氏創設のSNS株が最安値更新　半年で時価総額は3分の1に,78,https://news.yahoo.co.jp/articles/8705b253562103d8f5796a9666a50b176243ca87,9/21(土) 9:55
2024-09-21,14:06,TTL,総合,40,静岡放送（SBS）,「後で支払うつもりだった」伊豆の老舗高級旅館に4泊5日　代金払わず立ち去った疑い　1年9か月後、大阪で逮捕の32歳男は容疑を否認,78,https://news.yahoo.co.jp/articles/56884c2dea52d9504592e926858eaefb974694db,9/21(土) 10:32
