scrp_date,scrp_time,genre_en,genre_jp,rank,media_jp,title,comment,link,date_original
2024-04-21,17:21,TTL,総合,1,SmartFLASH,維新を「ヤクザと一緒」立憲・杉尾議員に集まる批判「元キャスターががっかり」“公選法違反疑惑“投稿も,383,https://news.yahoo.co.jp/articles/ebc49de79849811e4dca0d5de07b6e5379da7f76,4/21(日) 16:16
2024-04-21,17:21,TTL,総合,2,TBS NEWS DIG Powered by JNN,【速報】那須で2人の焼けた遺体　死体損壊容疑で25歳の男を逮捕　逮捕されたのは今月17日に都内の交番に出頭した男　栃木県警と警視庁の合同捜査本部,376,https://news.yahoo.co.jp/articles/6cf79d7122e0a27735e1ec5eebcbfb164d28e22a,4/21(日) 14:55
2024-04-21,17:21,TTL,総合,3,産経新聞,ホストに籠絡され、マカオで売春　心身壊し、貯蓄も奪われ…当事者の証言　深層　歌舞伎町,238,https://news.yahoo.co.jp/articles/edb46f91af16fc671ace412b5f7d0132180d2ab3,4/20(土) 19:00
2024-04-21,17:21,TTL,総合,4,Full-Count,大谷翔平、得点圏で0割台に「コントロールしないと」　満塁の絶好機で三振…指揮官が指摘,215,https://news.yahoo.co.jp/articles/163b98f0912d8b679cbd6e697d298013b301d9d1,4/21(日) 9:22
2024-04-21,17:21,TTL,総合,5,デイリー新潮,大行列に客から怒号も……「みどりの窓口」続々廃止で続く“大混乱”　電子化が進む“航空券”との決定的な違いとは,210,https://news.yahoo.co.jp/articles/39f132c85c80b5cd373e6d32ab5eee8f230bb1f0,4/21(日) 9:10
2024-04-21,17:21,TTL,総合,6,AERA dot.,【独占告白】「私の精子から97人子どもが生まれた」　米国人男性（33）が告発する精子バンクの実態,201,https://news.yahoo.co.jp/articles/664844098d76f92fa293edd1df45a8d9fd15642c,4/21(日) 11:32
2024-04-21,17:21,TTL,総合,7,時事通信,保湿塗り薬、10月に負担増　美容目的の不適切利用、是正も　厚労省,172,https://news.yahoo.co.jp/articles/a6f76fd55a83092202e7b54fd788f9b89f1bfa0e,4/21(日) 7:22
2024-04-21,17:21,TTL,総合,8,テレビ朝日系（ANN）,海自ヘリ2機墜落　3機で対潜訓練中に事故　酒井海幕長　別機の搭乗員から確認進める,169,https://news.yahoo.co.jp/articles/c6ec65a63ab02cdc9abdbfc4ec9d2a2217deebcb,4/21(日) 15:34
2024-04-21,17:21,TTL,総合,9,FNNプライムオンライン（フジテレビ系）,大阪・関西万博の赤字「府と市で負担する考え方ある」　吉村知事が赤字負担に初めて言及,167,https://news.yahoo.co.jp/articles/36b60a6135d8d8b9d140777d42f75f2b6ffa4cb7,4/21(日) 12:22
2024-04-21,17:21,TTL,総合,10,西スポWEB OTTO！,最下位の西武が連敗　5位楽天と1ゲーム差　高橋光成は好投も試合前半の拙攻響き援護ゼロ,160,https://news.yahoo.co.jp/articles/5e251ec24c054d8aeb813db2b5160fa1258c99cf,4/21(日) 16:48
2024-04-21,17:21,TTL,総合,11,産経新聞,2600人の町に観光客140万人が殺到　インフラ維持の限界、高野山に「入山税」導入へ,160,https://news.yahoo.co.jp/articles/decb6ae1d976f2c8c3020b980d33b2ce627712b5,4/21(日) 8:56
2024-04-21,17:21,TTL,総合,12,毎日新聞,岸田内閣支持率22％　3カ月ぶり20％台回復　毎日新聞世論調査,155,https://news.yahoo.co.jp/articles/95355574bd2cad067001fce4350412e4f17cf5eb,4/21(日) 16:37
2024-04-21,17:21,TTL,総合,13,TBS NEWS DIG Powered by JNN,立憲・酒井氏優勢　維新・金澤氏と諸派・飯山氏が追う　衆院・東京15区補選　JNN中盤情勢調査,153,https://news.yahoo.co.jp/articles/0ebc01ed355bb61d35d01010cdef8cdf845c30a2,4/21(日) 15:31
2024-04-21,17:21,TTL,総合,14,毎日新聞,海自ヘリ2機は衝突後に墜落か　1人死亡　フライトレコーダーを回収,144,https://news.yahoo.co.jp/articles/9f2c8f436b49fa0ec9ec2516820a0f8084c62422,4/21(日) 9:29
2024-04-21,17:21,TTL,総合,15,日刊ゲンダイDIGITAL,マイナ保険証“洗脳計画”GWに政府ゴリ押し 厚労相「利用率にかかわらず廃止」発言は大炎上,142,https://news.yahoo.co.jp/articles/f2e22d39a4ab2878e9faaf73cbb3d9ca6e5f1def,4/21(日) 9:06
2024-04-21,17:21,TTL,総合,16,デイリースポーツ,西武が単独最下位転落　４カード連続の負け越し　今季３度目の完封負け　７回１失点の高橋光成を見殺しに,141,https://news.yahoo.co.jp/articles/2a57a5fc40adbd31de59607cb3816f6c35572545,4/21(日) 16:52
2024-04-21,17:21,TTL,総合,17,TBS NEWS DIG Powered by JNN,柔軟剤「多めに入れちゃおう」がダメな訳　2倍入れても2倍柔らかくはならない…意外と知らないその基本,137,https://news.yahoo.co.jp/articles/3bea05682439dc10c72b0b5ab92d584d110dff1d,4/21(日) 7:02
2024-04-21,17:21,TTL,総合,18,TBS NEWS DIG Powered by JNN,【中日】泥沼4連敗で首位陥落...佐藤輝に3ラン被弾後に雨天コールド、カリステ走塁失敗で好機作れず、無念の涙雨,135,https://news.yahoo.co.jp/articles/a43302911f299e051b5f493c57470433cefa5f99,4/21(日) 17:04
2024-04-21,17:21,TTL,総合,19,スポーツ報知,【巨人】降雨コールドで引き分け　６回に小林誠司の犠飛で１点挙げるも幻に,132,https://news.yahoo.co.jp/articles/a767ec9f004a20b8ad0374b08143c54fdffeafbe,4/21(日) 15:58
2024-04-21,17:21,TTL,総合,20,読売新聞オンライン,海自ヘリ２機が衝突か、１人死亡・不明の７人「全力で捜索」…フライトレコーダー回収し原因分析,124,https://news.yahoo.co.jp/articles/306f0273c5fb7ba8a6ff1ab44be73c778d97eb0c,4/21(日) 12:26
2024-04-21,17:21,TTL,総合,21,デイリースポーツ,巨人　１点先制直後に試合中断→コールドゲームに　セーフティースクイズ失敗の小林が犠飛を放った直後　コールドゲームで得点認められず,122,https://news.yahoo.co.jp/articles/63536ef7145c10e2919821ce089320acac027117,4/21(日) 15:24
2024-04-21,17:21,TTL,総合,22,共同通信,岸田首相が島根入り、街頭演説　衆院補選、議席死守にてこ入れ,121,https://news.yahoo.co.jp/articles/502630a6540076a99b14d875079c331c3786a481,4/21(日) 12:11
2024-04-21,17:21,TTL,総合,23,共同通信,海自ヘリ2機墜落、衝突か　1人死亡7人行方不明、鳥島東方,121,https://news.yahoo.co.jp/articles/2527b5ebe0fc283c6404a9199019b1c571f6dd23,4/21(日) 1:13
2024-04-21,17:21,TTL,総合,24,ABEMA TIMES,大谷翔平、1安打3四球 リーグトップ33安打も満塁絶好機で空振り三振、悔しい表情 チームは今季初3連敗,120,https://news.yahoo.co.jp/articles/4897fb034cb1553a0337896cfe274578bf91add2,4/21(日) 8:26
2024-04-21,17:21,TTL,総合,25,デイリースポーツ,巨人がまさか　小林の先制犠飛が幻となってドロー　六回表の攻撃完了できずも阿部監督「前向きに考えていこう」,116,https://news.yahoo.co.jp/articles/5333b8aeec11f5da6b4dc8d79ee0e795956550a8,4/21(日) 15:51
2024-04-21,17:21,TTL,総合,26,日刊スポーツ,カズレーザー、国民年金延長案に「ナンセンス…若い子からしたらこれ何のため払ってるの？って」,111,https://news.yahoo.co.jp/articles/0fed67cca4c76ff9792a3c43961d4653cd0c2b52,4/21(日) 15:11
2024-04-21,17:21,TTL,総合,27,ダイヤモンド・オンライン,「ちゅ～るちゅ～るはもう歌えない！」愛猫家が吐露、いなば食品への落胆と憤りはかくも深い,109,https://news.yahoo.co.jp/articles/39012f04a9dfa4a055e4b76af6f156be63646b98,4/21(日) 7:02
2024-04-21,17:21,TTL,総合,28,ＡＦＰ＝時事,中国競泳23選手、東京五輪前に薬物陽性 処分なしで出場,103,https://news.yahoo.co.jp/articles/217b6d5d946c44087bd6d4c45320227f67bcc7cc,4/21(日) 10:31
2024-04-21,17:21,TTL,総合,29,中日スポーツ,「巨人は築地移転で確定！」「東京ドーム跡地にウェンブリー級のサッカースタジアム！」跡地を巡りネット沸く,103,https://news.yahoo.co.jp/articles/8f3fe74d86587902ece549c16b835d1ee10aaaa2,4/21(日) 11:34
2024-04-21,17:21,TTL,総合,30,デイリースポーツ,巨人　１死満塁からセーフティースクイズ敢行も先制できず　小林のバントは投前へ→本塁フォースアウト　吉川も凡退,101,https://news.yahoo.co.jp/articles/abc508b6242ca0a1944c3532d6a16044533faac9,4/21(日) 14:36
2024-04-21,17:21,TTL,総合,31,デイリースポーツ,阪神　佐藤輝明が先制の３号３ラン　雨を切り裂き右翼席へ１７６キロの弾丸ライナーでたたきこむ　才木も拍手＆甲子園は騒然,100,https://news.yahoo.co.jp/articles/f6f5d7b525e5fa88c7a116a2936eaeed62b5e330,4/21(日) 16:53
2024-04-21,17:21,TTL,総合,32,TBS NEWS DIG Powered by JNN,【広島】雨天コールド 今季2度目のドロー...大瀬良が6回途中1点を先制された直後に雨脚強まる 打線は3度 先頭打者が出塁で無得点,92,https://news.yahoo.co.jp/articles/8248fd6a97335aa15422213bc6e23d5bc7d9ddca,4/21(日) 16:09
2024-04-21,17:21,TTL,総合,33,THE DIGEST,「元NBAスター選手が言ってたよ。オオタニは有罪だって」大谷翔平を“悪人”に仕立て上げようとする米記者に非難の声が殺到！「お前は哀れだ」「もううんざり」,89,https://news.yahoo.co.jp/articles/0f6da91e03218f590e2025d7d322b19ca797efc4,4/21(日) 16:03
2024-04-21,17:21,TTL,総合,34,TBS NEWS DIG Powered by JNN,【阪神】降雨コールドも6連勝 今季初の首位奪取！中日に今季初の同一カード3連勝 佐藤輝が値千金3号3ラン 才木が7回無失点2勝目,84,https://news.yahoo.co.jp/articles/4682bdc0af0657fe6d1e8a43369c5fd366c13d2f,4/21(日) 17:04
2024-04-21,17:21,TTL,総合,35,デイリースポーツ,広島がラッキーな引き分け　恵みの雨で巨人の１点が幻に　六回表が完了せず先制点がなかったことに,81,https://news.yahoo.co.jp/articles/fdba2104c02b2f2f3c955267d960163b0eff8438,4/21(日) 15:54
2024-04-21,17:21,TTL,総合,36,スポーツ報知,【巨人】 阿部監督、６連戦で３つの引き分けに「３勝３敗だと思って帰ろうかなと思います」…一問一答,79,https://news.yahoo.co.jp/articles/0b81fea8a3b23c96a4951e2ea31968756eb5d5d0,4/21(日) 16:29
2024-04-21,17:21,TTL,総合,37,SmartFLASH,「イメージ違ってショック」大谷“ハワイ26億円別荘購入”で論争…思い出される「広告塔」トラブル,78,https://news.yahoo.co.jp/articles/914ccbe16a4d66b5d4a030e6ba24308b1b9caf8f,4/20(土) 19:00
2024-04-21,17:21,TTL,総合,38,デイリースポーツ,日本ハム一挙５点の猛攻　万波、マルティネス２者連続本塁打　「昨日お好み焼きじゃない。昨日ジンギスカン！」マルティネスは謎のコメント,76,https://news.yahoo.co.jp/articles/840e8af905e07afc9c237e19984d8e5abb635272,4/21(日) 14:07
2024-04-21,17:21,TTL,総合,39,THE ANSWER,ガルシア、無敗王者ヘイニーを衝撃撃破！　前日計量1.45kg大幅超過も…超大激戦判定勝ちに会場熱狂,73,https://news.yahoo.co.jp/articles/c7d71ebae48b33c369b64fe92019eff30499c6b6,4/21(日) 14:14
2024-04-21,17:21,TTL,総合,40,中日スポーツ,米山隆一議員、「失敗をごまかすばかげた言い訳」 大阪・関西万博めぐる橋下徹さんの発言をバッサリ,72,https://news.yahoo.co.jp/articles/d7ffdc8b899a88161c75b4863a612f3c0e5f59c1,4/21(日) 16:34
