scrp_date,scrp_time,genre_en,genre_jp,rank,media_jp,title,comment,link,date_original
2025-09-17,15:12,life,ライフ,1,産経新聞,市政停滞招いた学歴問題　解決策は辞職と謝罪のみ　書く書く鹿じか,47,https://news.yahoo.co.jp/articles/3e5451f4ff50486b36f0d7641ddfde128fc608fa,9/17(水) 11:02
2025-09-17,15:12,life,ライフ,2,産経新聞,秋篠宮さま、アジア競技大会名誉総裁ご就任　過去には上皇さまや天皇陛下も,46,https://news.yahoo.co.jp/articles/ec05d585505e7efa970f430f582d1dad8c0fa474,9/17(水) 12:40
2025-09-17,15:12,life,ライフ,3,Hint-Pot,「イギリスでは普通のこと」　イギリス人インフルエンサーが語った日本の第一印象に賛否　不便に思ったこととは,39,https://news.yahoo.co.jp/articles/fa8f608bc75c0ab60f09e978d5220f8a890a4330,9/17(水) 5:20
2025-09-17,15:12,life,ライフ,4,オリコン,やる気スイッチグループが謝罪、元従業員「不同意わいせつの容疑」　監視カメラ等“対策”も…「慚愧の念に堪えません」,38,https://news.yahoo.co.jp/articles/caefde7c516443ea25cdcacea4f11940c4c56942,9/17(水) 12:38
2025-09-17,15:12,life,ライフ,5,ダイヤモンド・オンライン,「日東駒専に落ちて無名大学に通っています。足りないものはなんだったのでしょうか」。偏差値50の壁にある決定的な差,29,https://news.yahoo.co.jp/articles/a3ae8ccf25a53bc4a423b252f8cbc67da0b62ea5,9/17(水) 6:50
2025-09-17,15:12,life,ライフ,6,ファイナンシャルフィールド,子どもが私立大学医学部に通っているという上司は「貯蓄1500万じゃ6年分の学費を賄えそうにない」そうです。ウチの子は来年大学受験ですが、私立文系なので「600万」あれば足りますよね？,25,https://news.yahoo.co.jp/articles/f0a8bac4ac5911ccdb365ff255b0cb647f106864,9/17(水) 14:10
2025-09-17,15:12,life,ライフ,7,ENCOUNT,スーパーの秋鮭に「めちゃデカイアニサキス」　うごめく様子に主婦衝撃…「買う気はなくなる」と本音も,23,https://news.yahoo.co.jp/articles/9ebbe223ab7bf0706481ca11452f5ca9c2d9ab1c,9/16(火) 16:40
2025-09-17,15:12,life,ライフ,8,THE GOLD ONLINE（ゴールドオンライン）,もう、良き夫を演じるのは限界だ…〈月収49万円〉42歳サラリーマン〈小遣い月2万円〉、豪華な妻の手作り料理に絶望するワケ,22,https://news.yahoo.co.jp/articles/6ba6e44f94b0166fcd11209b8ac87ebb83fed5ba,9/17(水) 5:01
2025-09-17,15:12,life,ライフ,9,オリコン,万博、10・13閉幕日のファイナルイベント発表　ラストは「ありがとうと旅立ちの祭典」音楽ライブも予定【概要】,21,https://news.yahoo.co.jp/articles/b4d25086fbd2dcb829cc95c38697311ac834b60b,9/17(水) 14:36
2025-09-17,15:12,life,ライフ,10,女性セブンプラス,《「きれいだね」の感嘆の声》愛子さまは”小ぶりなもの”がお好み　美智子さまの頃より受け継がれる“皇室パール”,21,https://news.yahoo.co.jp/articles/24b0950261ba9701bf9f0bce8461b15cb904a4df,9/17(水) 10:00
2025-09-17,15:12,life,ライフ,11,AERA with Kids＋,不登校の子を持つ親、SNSの“つながり”が支えに　「顔も名前も知らない相手だからこそ、深い闇も打ち明けられた」,20,https://news.yahoo.co.jp/articles/6fe03a597c2533d6aa965224dd56bdb57b7e6160,9/17(水) 7:01
2025-09-17,15:12,life,ライフ,12,ファイナンシャルフィールド,夫の実家に“帰省手土産”で毎回1万円…「家族なんだから5000円で十分」と思いますが、1万円は妥当でしょうか？,20,https://news.yahoo.co.jp/articles/7a046cf986c8254b95182a163323807374059d38,9/17(水) 13:50
2025-09-17,15:12,life,ライフ,13,THE GOLD ONLINE（ゴールドオンライン）,年収280万円・節約生活なのに「預金2億円」…静かに暮らす67歳“団地のおばあちゃん”の正体,20,https://news.yahoo.co.jp/articles/47c00666232c99c5792ab17c54d073a141ade60a,9/16(火) 19:36
2025-09-17,15:12,life,ライフ,14,ファイナンシャルフィールド,新型iPhoneが発売決定！ 一番安いモデルでも「13万円」近くするようですが、できるだけ安く買い替える方法はありますか？,20,https://news.yahoo.co.jp/articles/3e476991755dfa7a5f7292d083ce9caa7eb8f9d1,9/17(水) 13:30
2025-09-17,15:12,life,ライフ,15,All About,中国人の移住増加は「日本が好きだから」ではない……中国ウォッチャーが東大で見た驚きの光景,19,https://news.yahoo.co.jp/articles/47f645201b2c21736eb33267eb6c328fdabc3834,9/16(火) 21:50
2025-09-17,15:12,life,ライフ,16,共同通信,奈良知事「審査に問題も」と批判　シカ番組のBPO対応,18,https://news.yahoo.co.jp/articles/aedf75c2d4730d6cef6c0662eb5b71adfd02707f,9/17(水) 12:59
2025-09-17,15:12,life,ライフ,17,めざましmedia,約36％が「将来的に子ども希望しない」減り続ける人口と増え続ける“子育て費用”　鈴木おさむ氏「大学生の多くが奨学金で通っている」,18,https://news.yahoo.co.jp/articles/9f9f2e96988a656322193e057edb0fcda9b27c7d,9/16(火) 19:36
2025-09-17,15:12,life,ライフ,18,トラベル Watch,JR西日本、10月14日にダイヤ修正。「エキスポライナー」など万博にあわせた増便は終了,17,https://news.yahoo.co.jp/articles/1956d3327120a9dca020cf517340a17cf4ef7b28,9/17(水) 14:02
2025-09-17,15:12,life,ライフ,19,まいどなニュース,18歳で児童福祉は終了…「放課後デイに週5日通っていた生活はどうなる？」　特別支援学校3年生と母が、卒業後を見据えて重ねた５つの準備,17,https://news.yahoo.co.jp/articles/4f0721fcb94e119db0d06b06a5bf9921d4c6a7ad,9/17(水) 7:30
2025-09-17,15:12,life,ライフ,20,大手小町（読売新聞）,2026年は「令和のひのえうま」～60年前は出生数激減、来年の出産避ける妊活も？,16,https://news.yahoo.co.jp/articles/6fcb94e0b1279892e8d20a84b60db9726f93e43c,9/17(水) 11:53
2025-09-17,15:12,life,ライフ,21,デイリースポーツ,認知度ほぼゼロ！？メーカーが語る「名古屋のういろうはまずい」と言われてしまう本当の理由,15,https://news.yahoo.co.jp/articles/f55ee5dfdd9b014ad5a7b1e9b141479e87b0fe4d,9/17(水) 11:00
2025-09-17,15:12,life,ライフ,22,ファイナンシャルフィールド,8月のビール販売数が減ったとニュースで見かけたけど、うちは夫が「毎晩1本」飲んでいます…健康と食費節約のためにも本数を減らした方がいいですよね…？,14,https://news.yahoo.co.jp/articles/a9c302e34bf1ed9b8e77e02544a18bab8c901dbb,9/17(水) 13:10
2025-09-17,15:12,life,ライフ,23,大手小町（読売新聞）,「手作りジャム」ってもらって嬉しい？大久保佳代子のイメージは「スプーンおばさん」や「ハイソな存在」…でも、もらった手作りジャムを食べずに捨ててしまった理由,13,https://news.yahoo.co.jp/articles/73078f68ecb90e6c81aca1c9d6fe171dc7b46b57,9/17(水) 11:40
2025-09-17,15:12,life,ライフ,24,よろず～ニュース,高校生の62.5%が「今年テレビドラマを見ていない」→理由が手厳し過ぎる「ドラマ見るより…」,13,https://news.yahoo.co.jp/articles/81131db4db31c2e17115b17439db850756a3e96b,9/17(水) 7:50
2025-09-17,15:12,life,ライフ,25,トラベル Watch,ミャクミャクのひっぱりだこ飯が登場。9月18日から淡路屋の駅ナカ店などで先行販売,12,https://news.yahoo.co.jp/articles/9195940111258b1d0c430d01733125d67926142c,9/17(水) 13:19
2025-09-17,15:12,life,ライフ,26,＠ＤＩＭＥ,「残業時間が多い」と感じるのは何時間？残業時間をめぐる管理職と非管理職の本音,11,https://news.yahoo.co.jp/articles/ce1983c2a0be403d05d9f8cada017c1217b964a2,9/17(水) 12:20
2025-09-17,15:12,life,ライフ,27,ねとらぼ,予定日にふ化しなかったダチョウの卵、ペンチで割ったら……「おー!!!」　まさかの中身が190万再生「ハラハラした」「不思議だなあ」,11,https://news.yahoo.co.jp/articles/02d38161ce9b8ccfe9af57865e367d89585db0b2,9/17(水) 11:45
2025-09-17,15:12,life,ライフ,28,大手小町（読売新聞）,もしや「結婚と出産に適した相手」だから選ばれた？あからさまに「私は不機嫌です」という態度をとるフキハラ気味な恋人との将来に不安「少しずつズレていく」,11,https://news.yahoo.co.jp/articles/91a5404f3d3f61f53e3785fde7c0546e69637044,9/17(水) 11:31
2025-09-17,15:12,life,ライフ,29,THE GOLD ONLINE（ゴールドオンライン）,「大丈夫」と笑っていた79歳母。〈年金月15万円〉のはずが…こっそり見た預金通帳に50歳息子「涙が止まりません」のワケ,10,https://news.yahoo.co.jp/articles/f47e89361a81c0f801022322544ae38f9c1fc6cb,9/17(水) 10:01
2025-09-17,15:12,life,ライフ,30,ファイナンシャルフィールド,「国産にこだわる妻」と「節約したい夫」。野菜を外国産にすると、実際どれくらい出費が変わるのでしょうか？,9,https://news.yahoo.co.jp/articles/2053ab93d6cbf79ed3cc4c17ddbb628904c3540b,9/17(水) 14:30
2025-09-17,15:12,life,ライフ,31,まいどなニュース,搬出されたジンベエザメ「10代目ユウユウ」が死亡　かごしま水族館「重く受け止め反省」それでも展示を続ける水族館の意義とは,9,https://news.yahoo.co.jp/articles/8d769de87dccd1b14ac260c178eb3c2fd1720bdf,9/17(水) 6:50
2025-09-17,15:12,life,ライフ,32,プレジデントオンライン,アメリカの「ご意向」に安倍政権はあっさり服従した…「遺伝子組み換えでない」の表示がスーパーから消えた理由,9,https://news.yahoo.co.jp/articles/544f76c83a50b2224cff2824c1e3bab00d6bbee6,9/16(火) 18:16
2025-09-17,15:12,life,ライフ,33,Lmaga.jp,【速報】開幕時期の約４倍！？ 万博きのう９月１６日（火）の一般入場者数は２０万５０００人…今日のイベントは？＜閉幕まで２６日＞,9,https://news.yahoo.co.jp/articles/fa4790b9fb1fc945ddffd924d70e564c4ea2a1c7,9/17(水) 9:50
2025-09-17,15:12,life,ライフ,34,KURU KURA（くるくら）,日本初のミッドシップ2シーター「トヨタ・MR2」。自動車ライター下野康史の名車談「ぼくは、車と生きてきた」,9,https://news.yahoo.co.jp/articles/622e4f7fffaa0a1a6a284647beb6d82a74cb12a3,9/17(水) 12:11
2025-09-17,15:12,life,ライフ,35,弁護士ドットコムニュース,日経平均4万5千円超え、「結婚前」に買った株も分けるの？ 離婚時に知っておきたい「財産分与」の落とし穴,9,https://news.yahoo.co.jp/articles/6e34aab058b6a9832ce5adbf586ff3c0359b5a60,9/17(水) 11:25
2025-09-17,15:12,life,ライフ,36,婦人公論.jp,「結婚」は男性に長生きをもたらすが、女性は関係性がよくなければ恩恵がなく…スタンフォード大・長寿研究者が教える＜長生きの秘訣＞,8,https://news.yahoo.co.jp/articles/3789ff1699f57d9a47fda2cd24bc540ccc9dd366,9/17(水) 12:30
2025-09-17,15:12,life,ライフ,37,ほ・とせなNEWS,パパが書いた保育園の連絡帳→しかしよく見ると…「爆笑しましたw」その内容に「ツボすぎる」「字が綺麗すぎる！」「連絡事項…ですよね？笑」,8,https://news.yahoo.co.jp/articles/7391a2a6a13bafabf822890639054ad8b3cda412,9/17(水) 8:00
2025-09-17,15:12,life,ライフ,38,All About,“牛丼並盛30円値下げ”で話題の「すき家」に、吉野家と松屋が単純に追随しないワケ【企業の価格戦略】,8,https://news.yahoo.co.jp/articles/f66aca73bf3554b42c80acc485b94d13f736a054,9/16(火) 21:35
2025-09-17,15:12,life,ライフ,39,オリコン,ミャクミャク＆“新しいお友達”が初コラボ、グッズお披露目　梅田で2ショットイベントも開催【一覧】,7,https://news.yahoo.co.jp/articles/60c92d579f38cde85766c8309df873b5e5c2f64a,9/17(水) 13:06
2025-09-17,15:12,life,ライフ,40,Hint-Pot,「同じものを食べてもカナダでは2000円はする」　日本通のカナダ人が驚き　母国との差が歴然としているものとは【万博】,7,https://news.yahoo.co.jp/articles/4896eb4acb835499f9d5c41a74c3cfc275c75e2e,9/17(水) 11:50
