scrp_date,scrp_time,genre_en,genre_jp,rank,media_jp,title,comment,link,date_original
2024-11-04,09:31,world,国際,1トランプ氏、報道席を銃弾が貫いても「気にしない」　軽率な暴力への言及相次ぐ毎日新聞11/4(月) 6:54265件/時,毎日新聞,トランプ氏、報道席を銃弾が貫いても「気にしない」　軽率な暴力への言及相次ぐ,265,https://news.yahoo.co.jp/articles/7e638b231fdf3980ceec9d29bf01274856e491e5,11/4(月) 6:54
2024-11-04,09:31,world,国際,2「日本人を一度、殴ってやりたい」ハングル字幕の元女優、動画非公開「すみませんでした」KOREA WAVE11/3(日) 14:0387件/時,KOREA WAVE,「日本人を一度、殴ってやりたい」ハングル字幕の元女優、動画非公開「すみませんでした」,87,https://news.yahoo.co.jp/articles/a18bbdec52c07100e9c0bec0d3499c55611f5673,11/3(日) 14:03
2024-11-04,09:31,world,国際,3韓国・失われたマナー…ビルの階段はトイレじゃない！迷惑夫婦の“共演”に批判続出KOREA WAVE11/4(月) 8:0382件/時,KOREA WAVE,韓国・失われたマナー…ビルの階段はトイレじゃない！迷惑夫婦の“共演”に批判続出,82,https://news.yahoo.co.jp/articles/87de344689306a4c133cac7529775de8f17df60f,11/4(月) 8:03
2024-11-04,09:31,world,国際,4静観の中国、内心いら立ち　北朝鮮のロシア派兵時事通信11/3(日) 19:0331件/時,時事通信,静観の中国、内心いら立ち　北朝鮮のロシア派兵,31,https://news.yahoo.co.jp/articles/f74326356a24207abb93c0290bd4e8e18d262623,11/3(日) 19:03
2024-11-04,09:31,world,国際,5北朝鮮、白書で韓国の尹政権批判　対敵研究院「無能な統治」共同通信11/3(日) 14:3231件/時,共同通信,北朝鮮、白書で韓国の尹政権批判　対敵研究院「無能な統治」,31,https://news.yahoo.co.jp/articles/d54e94ea785022d38cd3ae84cb8df966301a682c,11/3(日) 14:32
2024-11-04,09:31,world,国際,6ゼレンスキー大統領「北朝鮮軍への先制攻撃」に言及…長距離兵器の支援求めるハンギョレ新聞11/4(月) 6:4930件/時,ハンギョレ新聞,ゼレンスキー大統領「北朝鮮軍への先制攻撃」に言及…長距離兵器の支援求める,30,https://news.yahoo.co.jp/articles/c28dd98ea875181cfab3d6ab794c69714511c432,11/4(月) 6:49
2024-11-04,09:31,world,国際,7韓国人被爆者もオスロでのノーベル平和賞授賞式に出席へハンギョレ新聞11/4(月) 7:1929件/時,ハンギョレ新聞,韓国人被爆者もオスロでのノーベル平和賞授賞式に出席へ,29,https://news.yahoo.co.jp/articles/b6e948891bf872890aa8b7e69d8ca8a5cb9d67c4,11/4(月) 7:19
2024-11-04,09:31,world,国際,8海沿いの別荘からヒズボラ幹部連行、イスラエル特殊部隊がレバノン北部へ上陸作戦読売新聞オンライン11/3(日) 17:5226件/時,読売新聞オンライン,海沿いの別荘からヒズボラ幹部連行、イスラエル特殊部隊がレバノン北部へ上陸作戦,26,https://news.yahoo.co.jp/articles/405ff4f5248d2c37a2674ae2853321b8464aea1c,11/3(日) 17:52
2024-11-04,09:31,world,国際,9ドジャースの英雄を見るため２２万人集結…ＬＡ都心まひ中央日報日本語版11/4(月) 8:0424件/時,中央日報日本語版,ドジャースの英雄を見るため２２万人集結…ＬＡ都心まひ,24,https://news.yahoo.co.jp/articles/4a2548d7f6a435db4e4161b1062ed3d82ad42131,11/4(月) 8:04
2024-11-04,09:31,world,国際,10「赤い州」のはずが…　中西部アイオワで「ハリス氏優勢」の地元紙世論調査　トランプ陣営は「明らかに異常な数値」と火消しTBS NEWS DIG Powered by JNN11/4(月) 4:5224件/時,TBS NEWS DIG Powered by JNN,「赤い州」のはずが…　中西部アイオワで「ハリス氏優勢」の地元紙世論調査　トランプ陣営は「明らかに異常な数値」と火消し,24,https://news.yahoo.co.jp/articles/58c72b85f878eb0bbebf4a6f96ae3ffcfb290637,11/4(月) 4:52
2024-11-04,09:31,world,国際,11習近平は「準備万端」か…「第三次世界大戦」が起こる確率は…米軍トップが明かした「意外すぎる」実情現代ビジネス11/4(月) 6:5021件/時,現代ビジネス,習近平は「準備万端」か…「第三次世界大戦」が起こる確率は…米軍トップが明かした「意外すぎる」実情,21,https://news.yahoo.co.jp/articles/56b5725bab1421592467dcee962dfd1ffcbc56d7,11/4(月) 6:50
2024-11-04,09:31,world,国際,12ウクライナ「北朝鮮軍、６０ミリ迫撃砲とＲＰＧ－７で武装…７０００人を戦線に配置」中央日報日本語版11/4(月) 7:3319件/時,中央日報日本語版,ウクライナ「北朝鮮軍、６０ミリ迫撃砲とＲＰＧ－７で武装…７０００人を戦線に配置」,19,https://news.yahoo.co.jp/articles/e4f20febdf5713e41c3c2c0f149f74a6267762dc,11/4(月) 7:33
2024-11-04,09:31,world,国際,13トランプ氏、選挙集会でマイクを巡り激怒。性行為を真似るような行動も物議を醸すハフポスト日本版11/3(日) 14:2118件/時,ハフポスト日本版,トランプ氏、選挙集会でマイクを巡り激怒。性行為を真似るような行動も物議を醸す,18,https://news.yahoo.co.jp/articles/b0d895b1a3842d8d83f711d5f08836e96073df59,11/3(日) 14:21
2024-11-04,09:31,world,国際,14今まさに「朝鮮半島情勢の急変」と「金正恩の末路」が懸念されている「差し迫った理由」現代ビジネス11/4(月) 8:0414件/時,現代ビジネス,今まさに「朝鮮半島情勢の急変」と「金正恩の末路」が懸念されている「差し迫った理由」,14,https://news.yahoo.co.jp/articles/2813f63618b99c2e9045e7f2a82c8ffba7556c9f,11/4(月) 8:04
2024-11-04,09:31,world,国際,15韓国の航空・旅行業界「ノービザ特需」に期待感…中国行き航空便増便も中央日報日本語版11/4(月) 8:0814件/時,中央日報日本語版,韓国の航空・旅行業界「ノービザ特需」に期待感…中国行き航空便増便も,14,https://news.yahoo.co.jp/articles/81e90ca1c66c3792c7c322818fa880a204e7e40a,11/4(月) 8:08
2024-11-04,09:31,world,国際,16【米大統領選2024】 両陣営、最後の週末に激戦州で訴え　有権者の期待と不安BBC News11/3(日) 12:4114件/時,BBC News,【米大統領選2024】 両陣営、最後の週末に激戦州で訴え　有権者の期待と不安,14,https://news.yahoo.co.jp/articles/efcb8cd03b5ee923e754dcdc6828384f83694fcf,11/3(日) 12:41
2024-11-04,09:31,world,国際,17北朝鮮兵に不吉な兆候　ロ軍偵察部隊、クルスク州で無謀な突撃命じられ半数失うForbes JAPAN11/3(日) 10:0014件/時,Forbes JAPAN,北朝鮮兵に不吉な兆候　ロ軍偵察部隊、クルスク州で無謀な突撃命じられ半数失う,14,https://news.yahoo.co.jp/articles/2ad9cce7cd192fd7de941eb0e2936afcd08bf6a0,11/3(日) 10:00
2024-11-04,09:31,world,国際,18「家族は見た目も、心も冷たい」と語る、ヘンリー王子の映像が話題に...「不幸なプリンセス」メーガン妃との寂しい最後の公務ニューズウィーク日本版11/4(月) 9:0013件/時,ニューズウィーク日本版,「家族は見た目も、心も冷たい」と語る、ヘンリー王子の映像が話題に...「不幸なプリンセス」メーガン妃との寂しい最後の公務,13,https://news.yahoo.co.jp/articles/78602162a84cb31a75033ca8146308e5284484e3,11/4(月) 9:00
2024-11-04,09:31,world,国際,19国連総長、北朝鮮派兵に「強い懸念」時事通信11/4(月) 8:0513件/時,時事通信,国連総長、北朝鮮派兵に「強い懸念」,13,https://news.yahoo.co.jp/articles/b8ac78dd49a6b3a36f354cb56e392fdf8b4777d5,11/4(月) 8:05
2024-11-04,09:31,world,国際,20留学生がスケープゴートに　オーストラリア、住宅不足で門戸狭める時事通信11/4(月) 8:0512件/時,時事通信,留学生がスケープゴートに　オーストラリア、住宅不足で門戸狭める,12,https://news.yahoo.co.jp/articles/9c3e80a8ccaa8c196e915cb7b15fd8c7b04e76f4,11/4(月) 8:05
2024-11-04,09:31,world,国際,21イスラム教徒のウーバー運転手に催涙スプレーを噴射した女、憎悪犯罪で起訴 米BuzzFeed Japan11/4(月) 6:0011件/時,BuzzFeed Japan,イスラム教徒のウーバー運転手に催涙スプレーを噴射した女、憎悪犯罪で起訴 米,11,https://news.yahoo.co.jp/articles/ce0b1d88cb3829fc02e1a7fcbd13f4cbcbfb5203,11/4(月) 6:00
2024-11-04,09:31,world,国際,22米大統領選、投票日はなぜ火曜日？　19世紀の名残、11月にも理由毎日新聞11/3(日) 11:5311件/時,毎日新聞,米大統領選、投票日はなぜ火曜日？　19世紀の名残、11月にも理由,11,https://news.yahoo.co.jp/articles/48a7635df887fc487518536e650a2ddcbcd256ce,11/3(日) 11:53
2024-11-04,09:31,world,国際,23中華料理店で5000円無銭飲食カップル…韓国で拡散された「その一部始終」の映像KOREA WAVE11/3(日) 13:039件/時,KOREA WAVE,中華料理店で5000円無銭飲食カップル…韓国で拡散された「その一部始終」の映像,9,https://news.yahoo.co.jp/articles/520a5df8b253711d1f3c9431c1b5cb2480abd38e,11/3(日) 13:03
2024-11-04,09:31,world,国際,24軍事作戦へ3344人が国籍取得　ロシア発表、今年に入り共同通信11/4(月) 5:439件/時,共同通信,軍事作戦へ3344人が国籍取得　ロシア発表、今年に入り,9,https://news.yahoo.co.jp/articles/f717f9f3995980bd70ad493fd621c3e764d9bf28,11/4(月) 5:43
2024-11-04,09:31,world,国際,25米大統領選、財政悪化を懸念　バラマキ色強く、金利上昇　金融市場時事通信11/4(月) 7:099件/時,時事通信,米大統領選、財政悪化を懸念　バラマキ色強く、金利上昇　金融市場,9,https://news.yahoo.co.jp/articles/46c0ae3c4e66c4feed57ace8ed07e890068c3b4c,11/4(月) 7:09
2024-11-04,09:31,world,国際,26最終盤で「アイオワの衝撃」　米大統領選　世論調査でハリス氏優勢毎日新聞11/3(日) 12:019件/時,毎日新聞,最終盤で「アイオワの衝撃」　米大統領選　世論調査でハリス氏優勢,9,https://news.yahoo.co.jp/articles/c6184d05b460ee81f06cbfd7b19a949952a15122,11/3(日) 12:01
2024-11-04,09:31,world,国際,27北朝鮮軍捕虜を連れてくる？ 捕らぬ狸の皮算用をする尹政権【コラム】ハンギョレ新聞11/4(月) 8:108件/時,ハンギョレ新聞,北朝鮮軍捕虜を連れてくる？ 捕らぬ狸の皮算用をする尹政権【コラム】,8,https://news.yahoo.co.jp/articles/11bef8821271270520f810bc89fa8e28f57f406f,11/4(月) 8:10
2024-11-04,09:31,world,国際,28バイデン米政権、イランに警告か　ハメネイ師も「壊滅的な報復」を予告して牽制産経新聞11/3(日) 19:418件/時,産経新聞,バイデン米政権、イランに警告か　ハメネイ師も「壊滅的な報復」を予告して牽制,8,https://news.yahoo.co.jp/articles/1439da3c37bf38194f964a3ac3cf7dde23cee0e6,11/3(日) 19:41
2024-11-04,09:31,world,国際,29プーチン氏側近「米国、ウクライナ戦争に油注げば第３次大戦」中央日報日本語版11/3(日) 12:578件/時,中央日報日本語版,プーチン氏側近「米国、ウクライナ戦争に油注げば第３次大戦」,8,https://news.yahoo.co.jp/articles/3dcab35412a0bf093a8de4f80420042e7944195a,11/3(日) 12:57
2024-11-04,09:31,world,国際,300:53“投資の神様”アップル株25％売却テレビ朝日系（ANN）11/4(月) 9:167件/時,テレビ朝日系（ANN）,“投資の神様”アップル株25％売却,7,https://news.yahoo.co.jp/articles/7ef20476b71b68fd50475d06d4c178454354503a,11/4(月) 9:16
2024-11-04,09:31,world,国際,31モルドバ大統領選の決選投票、親欧米派サンドゥ現大統領が勝利へ　親露派候補破る産経新聞11/4(月) 8:247件/時,産経新聞,モルドバ大統領選の決選投票、親欧米派サンドゥ現大統領が勝利へ　親露派候補破る,7,https://news.yahoo.co.jp/articles/eb2296ffa67e201d91e656259f4fbe0fcc17b4c6,11/4(月) 8:24
2024-11-04,09:31,world,国際,32スペイン　洪水の死者が217人に　国王が被災地訪問　泥を投げるなど住民らは抗議TBS NEWS DIG Powered by JNN11/4(月) 5:297件/時,TBS NEWS DIG Powered by JNN,スペイン　洪水の死者が217人に　国王が被災地訪問　泥を投げるなど住民らは抗議,7,https://news.yahoo.co.jp/articles/9fa68e00471000fbde6083b3779bd9c49251d3d1,11/4(月) 5:29
2024-11-04,09:31,world,国際,33エヌビディアが研究で夜を明かす時、韓国半導体は５２時間の足かせ中央日報日本語版11/4(月) 7:057件/時,中央日報日本語版,エヌビディアが研究で夜を明かす時、韓国半導体は５２時間の足かせ,7,https://news.yahoo.co.jp/articles/6996805e9d97097a1ca629debc82eb35e9550fa2,11/4(月) 7:05
2024-11-04,09:31,world,国際,34ハリス氏、自分のモノマネ俳優と対面。投票日直前に人気コメディ番組に出演ハフポスト日本版11/3(日) 16:387件/時,ハフポスト日本版,ハリス氏、自分のモノマネ俳優と対面。投票日直前に人気コメディ番組に出演,7,https://news.yahoo.co.jp/articles/ed49efb85dbdacf256512054d0cc4fd74b940d5f,11/3(日) 16:38
2024-11-04,09:31,world,国際,35ロシア軍、東部要衝まで3キロ　高齢者ら1400人とどまる中共同通信11/4(月) 5:377件/時,共同通信,ロシア軍、東部要衝まで3キロ　高齢者ら1400人とどまる中,7,https://news.yahoo.co.jp/articles/9a6520414f4f162181fa7fc1bf322809ebe9c5b7,11/4(月) 5:37
2024-11-04,09:31,world,国際,36「神舟18号」宇宙飛行士が帰還　「天宮」に半年滞在　中国時事通信11/4(月) 5:237件/時,時事通信,「神舟18号」宇宙飛行士が帰還　「天宮」に半年滞在　中国,7,https://news.yahoo.co.jp/articles/eee2579509f1fa647ff78d41743e514b77b452b2,11/4(月) 5:23
2024-11-04,09:31,world,国際,37“頑固な角質が取れた！”効果PR→実は米粒・のり・薄力粉による偽装だった…韓国通販4社KOREA WAVE11/4(月) 6:037件/時,KOREA WAVE,“頑固な角質が取れた！”効果PR→実は米粒・のり・薄力粉による偽装だった…韓国通販4社,7,https://news.yahoo.co.jp/articles/2b54a3719a8145603541196203ef4392ea7a64a7,11/4(月) 6:03
2024-11-04,09:31,world,国際,38ガザ停戦なら再報復に影響とイラン大統領共同通信11/4(月) 7:067件/時,共同通信,ガザ停戦なら再報復に影響とイラン大統領,7,https://news.yahoo.co.jp/articles/4b68bed65371d3e4d013b06a922451f2f980068a,11/4(月) 7:06
2024-11-04,09:31,world,国際,39観光客に安全な都市、2位・東京、8位・大阪…韓国が気にするソウルの順位KOREA WAVE11/3(日) 15:037件/時,KOREA WAVE,観光客に安全な都市、2位・東京、8位・大阪…韓国が気にするソウルの順位,7,https://news.yahoo.co.jp/articles/3009fc275dd5c737f520c143a37488ca50af0dc8,11/3(日) 15:03
2024-11-04,09:31,world,国際,40米大統領選「最後の週末」、両候補が激戦州をはしごＡＦＰ＝時事11/3(日) 15:106件/時,ＡＦＰ＝時事,米大統領選「最後の週末」、両候補が激戦州をはしご,6,https://news.yahoo.co.jp/articles/b8d2d337fce94a405329ac9a3014b2afdc9d42dd,11/3(日) 15:10
