scrp_date,scrp_time,genre_en,genre_jp,rank,media_jp,title,comment,link,date_original
2024-10-29,03:09,business,経済,1独ＶＷ、国内で大規模人員削減し3工場閉鎖へ　労組幹部表明ロイター10/28(月) 20:1258件/時,ロイター,独ＶＷ、国内で大規模人員削減し3工場閉鎖へ　労組幹部表明,58,https://news.yahoo.co.jp/articles/403f55d2896f55cb5e9e3203082bb4d6d85dd7fd,10/28(月) 20:12
2024-10-29,03:09,business,経済,20:51今年の賃上げ平均が月1万1961円!引き上げ率4.1％は過去最高に　賃上げ予定企業は91.2％FNNプライムオンライン（フジテレビ系）10/28(月) 13:5757件/時,FNNプライムオンライン（フジテレビ系）,今年の賃上げ平均が月1万1961円!引き上げ率4.1％は過去最高に　賃上げ予定企業は91.2％,57,https://news.yahoo.co.jp/articles/2053045725b2f6c0acf9184dbc3b01c08e54c0ca,10/28(月) 13:57
2024-10-29,03:09,business,経済,3「真摯に受け止めを」　政治の信頼回復求める　経済3団体【24衆院選】時事通信10/28(月) 11:2154件/時,時事通信,「真摯に受け止めを」　政治の信頼回復求める　経済3団体【24衆院選】,54,https://news.yahoo.co.jp/articles/93d69fd50aaa736191dbbfe830becc1f7d20c955,10/28(月) 11:21
2024-10-29,03:09,business,経済,4共産党は“裏金スクープ連発”で自民惨敗させるも議席減…強まる《政党名変えたら？》に党の見解は日刊ゲンダイDIGITAL10/28(月) 16:0348件/時,日刊ゲンダイDIGITAL,共産党は“裏金スクープ連発”で自民惨敗させるも議席減…強まる《政党名変えたら？》に党の見解は,48,https://news.yahoo.co.jp/articles/da5b7612fb0071fa890007f22059cd0e41e004de,10/28(月) 16:03
2024-10-29,03:09,business,経済,5なぜ「セブン-イレブン離れ」が起きているのか…お荷物の「イトーヨーカ堂」を捨てられないセブン&アイの苦悩プレジデントオンライン10/28(月) 9:1748件/時,プレジデントオンライン,なぜ「セブン-イレブン離れ」が起きているのか…お荷物の「イトーヨーカ堂」を捨てられないセブン&アイの苦悩,48,https://news.yahoo.co.jp/articles/fd7e71df4026bbd097b5ba5fc6b41f6b17251951,10/28(月) 9:17
2024-10-29,03:09,business,経済,6日経平均一時700円超上昇、荒い値動き　円安進み一時153円台朝日新聞デジタル10/28(月) 9:4241件/時,朝日新聞デジタル,日経平均一時700円超上昇、荒い値動き　円安進み一時153円台,41,https://news.yahoo.co.jp/articles/da8523b74133d9a123ae0a3568d9c9f14526cc98,10/28(月) 9:42
2024-10-29,03:09,business,経済,7TOTO、中国事業「抜本的に見直す」　年5%成長目標も引き下げへ朝日新聞デジタル10/28(月) 19:3739件/時,朝日新聞デジタル,TOTO、中国事業「抜本的に見直す」　年5%成長目標も引き下げへ,39,https://news.yahoo.co.jp/articles/a3e75e0a150d11a3a30cf1e283fb181d41d693c3,10/28(月) 19:37
2024-10-29,03:09,business,経済,80:56【速報】神宮外苑の再開発で樹木伐採開始…反対運動受けて伐採本数124本減らすなど計画変更FNNプライムオンライン（フジテレビ系）10/28(月) 13:0238件/時,FNNプライムオンライン（フジテレビ系）,【速報】神宮外苑の再開発で樹木伐採開始…反対運動受けて伐採本数124本減らすなど計画変更,38,https://news.yahoo.co.jp/articles/551b5a2b6b8fcef8e9c7008fda99907e692fd1c4,10/28(月) 13:02
2024-10-29,03:09,business,経済,9円下落、一時153円23銭　3カ月ぶり、政局混迷観測共同通信10/28(月) 7:2838件/時,共同通信,円下落、一時153円23銭　3カ月ぶり、政局混迷観測,38,https://news.yahoo.co.jp/articles/ebe01e20741a6b77b8210728b21ff0556a4f7d03,10/28(月) 7:28
2024-10-29,03:09,business,経済,10トヨタとNTT　自動運転で提携　数千億円規模TBS NEWS DIG Powered by JNN10/28(月) 19:5938件/時,TBS NEWS DIG Powered by JNN,トヨタとNTT　自動運転で提携　数千億円規模,38,https://news.yahoo.co.jp/articles/0f11d503b0b227fbba0a6bafb3b83ffcb19c592f,10/28(月) 19:59
2024-10-29,03:09,business,経済,11船井電機破産の背景に見る「AVメーカーの不振」、なぜ日本勢は世界に誇る技術力とブランド力を失ってしまったのかJBpress10/28(月) 11:5135件/時,JBpress,船井電機破産の背景に見る「AVメーカーの不振」、なぜ日本勢は世界に誇る技術力とブランド力を失ってしまったのか,35,https://news.yahoo.co.jp/articles/88e388bc6dae2df4b80cd5d005203b57d74abe79,10/28(月) 11:51
2024-10-29,03:09,business,経済,12オリンパス社長が辞任　違法薬物購入の疑い時事通信10/28(月) 8:5630件/時,時事通信,オリンパス社長が辞任　違法薬物購入の疑い,30,https://news.yahoo.co.jp/articles/c76563dc6279b55b0125eb128b0a19a5c7c43f28,10/28(月) 8:56
2024-10-29,03:09,business,経済,13「重いから手には持てないし…」電車内 “リュックの前抱え”も迷惑？ SNSで意見多数なマナー問題の結論とはVAGUE10/28(月) 12:4029件/時,VAGUE,「重いから手には持てないし…」電車内 “リュックの前抱え”も迷惑？ SNSで意見多数なマナー問題の結論とは,29,https://news.yahoo.co.jp/articles/fb4956c217d10316fc594206807d6cd57c77bb1b,10/28(月) 12:40
2024-10-29,03:09,business,経済,14衆院選大敗も石破首相は続投の意向：選挙後DAY1（初日）の金融市場は予想外の円安・株高にNRI研究員の時事解説10/28(月) 15:1129件/時,NRI研究員の時事解説,衆院選大敗も石破首相は続投の意向：選挙後DAY1（初日）の金融市場は予想外の円安・株高に,29,https://news.yahoo.co.jp/articles/119404bf8563e78f96eef0e04d41677af86dd1f2,10/28(月) 15:11
2024-10-29,03:09,business,経済,15合流は1台置きに……の「ファスナー合流」がコレだけ伝えられているのにまだブロックする意地悪車がいる！　ただし残念ながらブロックを罪に問える法はなかったWEB CARTOP10/28(月) 10:1023件/時,WEB CARTOP,合流は1台置きに……の「ファスナー合流」がコレだけ伝えられているのにまだブロックする意地悪車がいる！　ただし残念ながらブロックを罪に問える法はなかった,23,https://news.yahoo.co.jp/articles/fd0097a55760e99df80267437ddfc27388f25867,10/28(月) 10:10
2024-10-29,03:09,business,経済,16【速報】日経平均株価が一時700円以上値上がりTBS NEWS DIG Powered by JNN10/28(月) 9:1719件/時,TBS NEWS DIG Powered by JNN,【速報】日経平均株価が一時700円以上値上がり,19,https://news.yahoo.co.jp/articles/828d1e0e1cdd19afadcb77b091580cc864c6bc0e,10/28(月) 9:17
2024-10-29,03:09,business,経済,17目の前の相手が「仕事できる人か」「仕事できない人か」を見破る“すごい質問”ダイヤモンド・オンライン10/28(月) 6:0217件/時,ダイヤモンド・オンライン,目の前の相手が「仕事できる人か」「仕事できない人か」を見破る“すごい質問”,17,https://news.yahoo.co.jp/articles/cce1eaffd62e726b935f287e1927ea9e1083e5c4,10/28(月) 6:02
2024-10-29,03:09,business,経済,18オリンパス、カウフマン社長辞任　違法薬物を購入か、警視庁が捜査共同通信10/28(月) 9:4716件/時,共同通信,オリンパス、カウフマン社長辞任　違法薬物を購入か、警視庁が捜査,16,https://news.yahoo.co.jp/articles/49fcd07dab2aaa65a62473adb80eb37eef124ed7,10/28(月) 9:47
2024-10-29,03:09,business,経済,19衆院選結果に市場は株買い円売り、最悪のシナリオは回避との声もロイター10/28(月) 10:3616件/時,ロイター,衆院選結果に市場は株買い円売り、最悪のシナリオは回避との声も,16,https://news.yahoo.co.jp/articles/c547a464a3fecc951b7afdad21ec7b7c905db68a,10/28(月) 10:36
2024-10-29,03:09,business,経済,205組に1組の「夫」がDVを受けている、衝撃の実態。妻に毎日土下座させられ、蹴りつけられ…それでも「恥ずかしくて人に言えない」【離婚専門弁護士が解説】THE GOLD ONLINE（ゴールドオンライン）10/28(月) 8:3214件/時,THE GOLD ONLINE（ゴールドオンライン）,5組に1組の「夫」がDVを受けている、衝撃の実態。妻に毎日土下座させられ、蹴りつけられ…それでも「恥ずかしくて人に言えない」【離婚専門弁護士が解説】,14,https://news.yahoo.co.jp/articles/50cd16eb80b742913bc55cf80df10e2654d43a0b,10/28(月) 8:32
2024-10-29,03:09,business,経済,21VW、ドイツ国内の3工場閉鎖を検討共同通信10/28(月) 20:1912件/時,共同通信,VW、ドイツ国内の3工場閉鎖を検討,12,https://news.yahoo.co.jp/articles/7a8239cf278695a9bc6c1196d54b458907a3fb48,10/28(月) 20:19
2024-10-29,03:09,business,経済,22円が３カ月ぶり安値、日本株下落の公算－自公過半数割れで政治不安Bloomberg10/28(月) 6:5712件/時,Bloomberg,円が３カ月ぶり安値、日本株下落の公算－自公過半数割れで政治不安,12,https://news.yahoo.co.jp/articles/11e03c751cd7c6d845b1ea045d5e7a65ada08b11,10/28(月) 6:57
2024-10-29,03:09,business,経済,23日本、ウクライナに4700億円超融資へ共同通信10/28(月) 20:4611件/時,共同通信,日本、ウクライナに4700億円超融資へ,11,https://news.yahoo.co.jp/articles/8641b3e12a8ef9c22b29afaf7082a458313c9953,10/28(月) 20:46
2024-10-29,03:09,business,経済,24塩野義製薬の新型コロナ治療薬「ゾコーバ」、目標の売り上げ下回る　感染者数が大幅減少産経新聞10/28(月) 19:3810件/時,産経新聞,塩野義製薬の新型コロナ治療薬「ゾコーバ」、目標の売り上げ下回る　感染者数が大幅減少,10,https://news.yahoo.co.jp/articles/4e2243b06d6a855a5d33873366b90522219a8ff8,10/28(月) 19:38
2024-10-29,03:09,business,経済,25【原因はなに?】韓国で相次ぐ[EV]発火事故……[電気自動車]ユーザーは電池製造元の確認をベストカーWeb10/28(月) 20:0010件/時,ベストカーWeb,【原因はなに?】韓国で相次ぐ[EV]発火事故……[電気自動車]ユーザーは電池製造元の確認を,10,https://news.yahoo.co.jp/articles/5a8d66293ec5e986fde57528e0179fb69af38250,10/28(月) 20:00
2024-10-29,03:09,business,経済,26海外で「15ドルのランチ」を食べるとわかる…我が子が「日本だけで暮らすこと」の本当のリスクTHE GOLD ONLINE（ゴールドオンライン）10/28(月) 14:0210件/時,THE GOLD ONLINE（ゴールドオンライン）,海外で「15ドルのランチ」を食べるとわかる…我が子が「日本だけで暮らすこと」の本当のリスク,10,https://news.yahoo.co.jp/articles/a90044ff761e53430e15d1386cbc426572e2246d,10/28(月) 14:02
2024-10-29,03:09,business,経済,27《総選挙“ひとり勝ち”は大新聞とテレビ》総務省の資料から判明！　血税約79億円が投じられる大メディアの「選挙ビジネス」のカラクリマネーポストWEB10/28(月) 16:1510件/時,マネーポストWEB,《総選挙“ひとり勝ち”は大新聞とテレビ》総務省の資料から判明！　血税約79億円が投じられる大メディアの「選挙ビジネス」のカラクリ,10,https://news.yahoo.co.jp/articles/3e18b7601f1811bd997bdd861df302c5b9f7994d,10/28(月) 16:15
2024-10-29,03:09,business,経済,28【速報】光学機器大手「オリンパス」のカウフマン社長兼CEOが辞任　違法薬物購入でテレビ朝日系（ANN）10/28(月) 9:079件/時,テレビ朝日系（ANN）,【速報】光学機器大手「オリンパス」のカウフマン社長兼CEOが辞任　違法薬物購入で,9,https://news.yahoo.co.jp/articles/58c265b92b058876bfd70fcf40d626920690678b,10/28(月) 9:07
2024-10-29,03:09,business,経済,29「やっぱり気持ちいいのは“手コギ”だよね」ピュアスポーツカー以外でも3ペダルのMT設定が残る日本車3選VAGUE10/28(月) 14:109件/時,VAGUE,「やっぱり気持ちいいのは“手コギ”だよね」ピュアスポーツカー以外でも3ペダルのMT設定が残る日本車3選,9,https://news.yahoo.co.jp/articles/5ce969abca0e60a52327807d3beea279bdb5402d,10/28(月) 14:10
2024-10-29,03:09,business,経済,30いすゞ自動車にも抜かれた？低迷する「日産自動車」の利益大幅減を招いた“ある原因”ビジネス＋IT10/28(月) 6:509件/時,ビジネス＋IT,いすゞ自動車にも抜かれた？低迷する「日産自動車」の利益大幅減を招いた“ある原因”,9,https://news.yahoo.co.jp/articles/ef5fda649d45447caed1b90025cc435c342955b7,10/28(月) 6:50
2024-10-29,03:09,business,経済,31セブン、従業員の名札はアルファベットや役職名のみもOKに　プライバシー保護の観点からITmedia ビジネスオンライン10/28(月) 12:578件/時,ITmedia ビジネスオンライン,セブン、従業員の名札はアルファベットや役職名のみもOKに　プライバシー保護の観点から,8,https://news.yahoo.co.jp/articles/1d1697d2b85fe5fa9a6cb65bb36e0ba4158f68e8,10/28(月) 12:57
2024-10-29,03:09,business,経済,32「頭がいい人」と「頭よく見せているだけの人」の根本的な違いダイヤモンド・オンライン10/28(月) 11:028件/時,ダイヤモンド・オンライン,「頭がいい人」と「頭よく見せているだけの人」の根本的な違い,8,https://news.yahoo.co.jp/articles/791cf8d7416f9240d5a84d88dc6769f938c1c6ef,10/28(月) 11:02
2024-10-29,03:09,business,経済,33円が対ドルで下落、一時153円台－衆院選は自公過半数割れBloomberg10/28(月) 4:158件/時,Bloomberg,円が対ドルで下落、一時153円台－衆院選は自公過半数割れ,8,https://news.yahoo.co.jp/articles/4749edf771556b0e56164a2619eb010cce25fbfb,10/28(月) 4:15
2024-10-29,03:09,business,経済,34少数与党、予算や税制改正が停滞の恐れ…野党との調整長引く可能性読売新聞オンライン10/28(月) 22:598件/時,読売新聞オンライン,少数与党、予算や税制改正が停滞の恐れ…野党との調整長引く可能性,8,https://news.yahoo.co.jp/articles/25abbe67e6c33c8feb0d35278cf755d8f6b0a3ac,10/28(月) 22:59
2024-10-29,03:09,business,経済,35トヨタ新型「“小型”商用バン」新発表に反響多数!?「結構好きかも」「お願いします」斬新“お試しプラン”爆誕!? 超静音モデルの「シティ」が話題くるまのニュース10/28(月) 6:108件/時,くるまのニュース,トヨタ新型「“小型”商用バン」新発表に反響多数!?「結構好きかも」「お願いします」斬新“お試しプラン”爆誕!? 超静音モデルの「シティ」が話題,8,https://news.yahoo.co.jp/articles/4a971d8193615c1bd8b30ff9a9064448581fc69b,10/28(月) 6:10
2024-10-29,03:09,business,経済,36「仕事ができない人」一発でわかる“2大NGワード” ダメ社員「なんとなく」の発言、あまりに多い訳東洋経済オンライン10/28(月) 8:027件/時,東洋経済オンライン,「仕事ができない人」一発でわかる“2大NGワード” ダメ社員「なんとなく」の発言、あまりに多い訳,7,https://news.yahoo.co.jp/articles/65c1ba9b43c083745ae0e95f485166c8fc35ea7e,10/28(月) 8:02
2024-10-29,03:09,business,経済,37「自民党は結果を真摯に受け止めよ」衆院選受け経済界からコメントテレビ朝日系（ANN）10/28(月) 12:147件/時,テレビ朝日系（ANN）,「自民党は結果を真摯に受け止めよ」衆院選受け経済界からコメント,7,https://news.yahoo.co.jp/articles/f197fc12466bbba31314180c9817c512c39f573e,10/28(月) 12:14
2024-10-29,03:09,business,経済,38なぜ外国人は「ホテルの住所」で免許取得？ 学科は超簡単で優遇しすぎ？ 「外免切替」で試験場には長蛇の列も…！ 何が起こってる？ 一部試験場では対応に変化もくるまのニュース10/28(月) 9:107件/時,くるまのニュース,なぜ外国人は「ホテルの住所」で免許取得？ 学科は超簡単で優遇しすぎ？ 「外免切替」で試験場には長蛇の列も…！ 何が起こってる？ 一部試験場では対応に変化も,7,https://news.yahoo.co.jp/articles/34a9f8f51f02cf4e791387f7ffdf5b08f7f7d334,10/28(月) 9:10
2024-10-29,03:09,business,経済,39もうすぐ「原付バイク」が消える⁉今乗っている原付も乗れなくなりますか？ファイナンシャルフィールド10/28(月) 11:207件/時,ファイナンシャルフィールド,もうすぐ「原付バイク」が消える⁉今乗っている原付も乗れなくなりますか？,7,https://news.yahoo.co.jp/articles/069771527d5f85995e7019190c18d701c7a023ef,10/28(月) 11:20
2024-10-29,03:09,business,経済,40自動運転技術開発で協業　トヨタとNTT、AI活用共同通信10/28(月) 19:267件/時,共同通信,自動運転技術開発で協業　トヨタとNTT、AI活用,7,https://news.yahoo.co.jp/articles/1c2ee08430b6b2b01ad6a7b33223756332ac288f,10/28(月) 19:26
