scrp_date,scrp_time,genre_en,genre_jp,rank,media_jp,title,comment,link,date_original
2024-10-29,07:06,world,国際,1石破首相「先頭に立ち取り組む」と続投に意欲、野党との連立想定せずロイター10/28(月) 14:19159件/時,ロイター,石破首相「先頭に立ち取り組む」と続投に意欲、野党との連立想定せず,159,https://news.yahoo.co.jp/articles/666e487f8ccb9d7d3de7af30618c6493f10d9c93,10/28(月) 14:19
2024-10-29,07:06,world,国際,21:14北京市内の小学校近くで子どもを含む5人が男に刃物で切り付けられけがテレビ朝日系（ANN）10/28(月) 19:2559件/時,テレビ朝日系（ANN）,北京市内の小学校近くで子どもを含む5人が男に刃物で切り付けられけが,59,https://news.yahoo.co.jp/articles/452909029e21ddceec009aaf0ce472f1e2735172,10/28(月) 19:25
2024-10-29,07:06,world,国際,3米欧、日本の政権先行きを懸念　過半数割れ、各国で大きく報道共同通信10/28(月) 16:4048件/時,共同通信,米欧、日本の政権先行きを懸念　過半数割れ、各国で大きく報道,48,https://news.yahoo.co.jp/articles/3d5694912cac4cc80c81300a1dcf7be89466479b,10/28(月) 16:40
2024-10-29,07:06,world,国際,4「石破首相に罰」「賭けが裏目に」　海外メディアも詳報【24衆院選】時事通信10/28(月) 7:2234件/時,時事通信,「石破首相に罰」「賭けが裏目に」　海外メディアも詳報【24衆院選】,34,https://news.yahoo.co.jp/articles/08ab563b6c5b379054f1db77deb1461f2517fbf0,10/28(月) 7:22
2024-10-29,07:06,world,国際,5韓国“自己中心”女性、口論相手に車をぶつけ、さらには「当たり屋」扱いKOREA WAVE10/29(火) 6:0328件/時,KOREA WAVE,韓国“自己中心”女性、口論相手に車をぶつけ、さらには「当たり屋」扱い,28,https://news.yahoo.co.jp/articles/beec9bd88003b452bdbf4a2910bda86fb08418b4,10/29(火) 6:03
2024-10-29,07:06,world,国際,61:02小学校校門近くで男が刃物振り回し子ども3人含む5人ケガ「一瞬で起きた」50代男拘束も動機不明　日本大使館注意呼びかけ　中国・北京FNNプライムオンライン（フジテレビ系）10/29(火) 6:1923件/時,FNNプライムオンライン（フジテレビ系）,小学校校門近くで男が刃物振り回し子ども3人含む5人ケガ「一瞬で起きた」50代男拘束も動機不明　日本大使館注意呼びかけ　中国・北京,23,https://news.yahoo.co.jp/articles/a1158d71dd28386fb072ff7e4e637975019f476d,10/29(火) 6:19
2024-10-29,07:06,world,国際,7トランプ氏集会で差別発言のコメディアン、両党から強い非難ロイター10/29(火) 5:5219件/時,ロイター,トランプ氏集会で差別発言のコメディアン、両党から強い非難,19,https://news.yahoo.co.jp/articles/0abb176660535163022d4757e5eecbaf62852fa6,10/29(火) 5:52
2024-10-29,07:06,world,国際,8韓国・小学校で起きた「おぞましい」性暴力事件…加害児童は「出席停止10日」で十分か？KOREA WAVE10/28(月) 18:0318件/時,KOREA WAVE,韓国・小学校で起きた「おぞましい」性暴力事件…加害児童は「出席停止10日」で十分か？,18,https://news.yahoo.co.jp/articles/43e05f3cfbd1a28f87c70a0a1d33f2dfd54020d9,10/28(月) 18:03
2024-10-29,07:06,world,国際,9トランプ氏、ニューヨーク中心部で大規模集会　応援演説に差別発言もロイター10/28(月) 11:0915件/時,ロイター,トランプ氏、ニューヨーク中心部で大規模集会　応援演説に差別発言も,15,https://news.yahoo.co.jp/articles/ebd61f099a0ed972352e35bdd4ea94a9df5364cf,10/28(月) 11:09
2024-10-29,07:06,world,国際,10「カワハギの干物」注文すると「カワハギの干物の菓子」が届いた…韓国・抗議受けた店「材料は同じだ」逆ギレKOREA WAVE10/29(火) 4:0312件/時,KOREA WAVE,「カワハギの干物」注文すると「カワハギの干物の菓子」が届いた…韓国・抗議受けた店「材料は同じだ」逆ギレ,12,https://news.yahoo.co.jp/articles/a7524183871f2e884b16c666e18157af84edee09,10/29(火) 4:03
2024-10-29,07:06,world,国際,111:00自民・公明、過半数割れ 石破氏「非常に厳しい審判」 衆院選AFPBB News10/28(月) 10:1812件/時,AFPBB News,自民・公明、過半数割れ 石破氏「非常に厳しい審判」 衆院選,12,https://news.yahoo.co.jp/articles/115dc75d5338b18916c604c9d56d16851c02f2ed,10/28(月) 10:18
2024-10-29,07:06,world,国際,12日本政界に「異例の大変動」　衆院解散・総選挙の結果BBC News10/28(月) 15:0812件/時,BBC News,日本政界に「異例の大変動」　衆院解散・総選挙の結果,12,https://news.yahoo.co.jp/articles/105cb0e318ae8006d6d6b02cf2e0eb16dc24589a,10/28(月) 15:08
2024-10-29,07:06,world,国際,130:32【速報】MLBワールドシリーズ第3戦スタメン　大谷翔平は1番DH　ドジャースが発表テレビ朝日系（ANN）10/29(火) 5:3911件/時,テレビ朝日系（ANN）,【速報】MLBワールドシリーズ第3戦スタメン　大谷翔平は1番DH　ドジャースが発表,11,https://news.yahoo.co.jp/articles/d5db6b238b0debf60318be74b9174660a40f7ecd,10/29(火) 5:39
2024-10-29,07:06,world,国際,14李康仁があいさつすると「行け、中国人」…ＰＳＧファンから人種差別中央日報日本語版10/28(月) 8:4611件/時,中央日報日本語版,李康仁があいさつすると「行け、中国人」…ＰＳＧファンから人種差別,11,https://news.yahoo.co.jp/articles/c0222744b3237cc0ed0e149efd952be1d85f8e1a,10/28(月) 8:46
2024-10-29,07:06,world,国際,15トランプ氏「金正恩に武器開発をやめて浜辺で休むよう伝えた」中央日報日本語版10/28(月) 16:0910件/時,中央日報日本語版,トランプ氏「金正恩に武器開発をやめて浜辺で休むよう伝えた」,10,https://news.yahoo.co.jp/articles/1a3613524a9fce04034af25f42339e417c4a9ebc,10/28(月) 16:09
2024-10-29,07:06,world,国際,16ホテルで子犬と遊んでいた大学生、減速できずに窓の外に飛び出し転落死＝インド中央日報日本語版10/28(月) 10:4910件/時,中央日報日本語版,ホテルで子犬と遊んでいた大学生、減速できずに窓の外に飛び出し転落死＝インド,10,https://news.yahoo.co.jp/articles/18d50bfab9615fb3327ad9946db95d7f354eb81f,10/28(月) 10:49
2024-10-29,07:06,world,国際,17ジョージア総選挙に「不正」批判相次ぐ　EUは調査要求毎日新聞10/28(月) 9:5610件/時,毎日新聞,ジョージア総選挙に「不正」批判相次ぐ　EUは調査要求,10,https://news.yahoo.co.jp/articles/8dbad38d40b423411bfae1ad5eae88b69b13b3f0,10/28(月) 9:56
2024-10-29,07:06,world,国際,18小泉自民選対委員長が辞任、「責任取るのが最低限の対応」ロイター10/28(月) 12:5710件/時,ロイター,小泉自民選対委員長が辞任、「責任取るのが最低限の対応」,10,https://news.yahoo.co.jp/articles/5d2d2f27584df42e6259ef3108f189d0c47ecaa7,10/28(月) 12:57
2024-10-29,07:06,world,国際,19自民・公明、過半数割れ 石破氏「非常に厳しい審判」 衆院選ＡＦＰ＝時事10/28(月) 8:4010件/時,ＡＦＰ＝時事,自民・公明、過半数割れ 石破氏「非常に厳しい審判」 衆院選,10,https://news.yahoo.co.jp/articles/f3a62e18549ae294629eecabfe634ff3c0980746,10/28(月) 8:40
2024-10-29,07:06,world,国際,20トランプ氏集会、差別発言相次ぐ　共和党、陣営は火消しに躍起共同通信10/28(月) 15:1810件/時,共同通信,トランプ氏集会、差別発言相次ぐ　共和党、陣営は火消しに躍起,10,https://news.yahoo.co.jp/articles/c313c360f2ed8f3a0bf5621e7f5cc1bf670bee80,10/28(月) 15:18
2024-10-29,07:06,world,国際,21「芸能人はなぜ特別扱いするのか」批判に…仁川空港「専用出入口制度」撤回中央日報日本語版10/28(月) 9:029件/時,中央日報日本語版,「芸能人はなぜ特別扱いするのか」批判に…仁川空港「専用出入口制度」撤回,9,https://news.yahoo.co.jp/articles/daa4a97251ef0fe2a53883ec161fc8839946f227,10/28(月) 9:02
2024-10-29,07:06,world,国際,22ウクライナ、部隊に朝鮮語表現集　戦闘の前線に「武器を捨てろ」共同通信10/28(月) 16:249件/時,共同通信,ウクライナ、部隊に朝鮮語表現集　戦闘の前線に「武器を捨てろ」,9,https://news.yahoo.co.jp/articles/9ce15f0c3305b41d5eeb9279e4994be3fe1f11d0,10/28(月) 16:24
2024-10-29,07:06,world,国際,23東京・大阪はもうつまらない…韓国で予約率800％増、人気の「日本の小都市」とは？KOREA WAVE10/28(月) 8:039件/時,KOREA WAVE,東京・大阪はもうつまらない…韓国で予約率800％増、人気の「日本の小都市」とは？,9,https://news.yahoo.co.jp/articles/9abf2f7eff9eae1bfdc2a878cbaf3d0380bfc725,10/28(月) 8:03
2024-10-29,07:06,world,国際,24北朝鮮がウクライナ戦争に派兵へ…その目的は「カネ」「実戦経験」「トランプ」現代ビジネス10/29(火) 6:058件/時,現代ビジネス,北朝鮮がウクライナ戦争に派兵へ…その目的は「カネ」「実戦経験」「トランプ」,8,https://news.yahoo.co.jp/articles/ed251face4b1da80633966c0509a6edba2b6e8bc,10/29(火) 6:05
2024-10-29,07:06,world,国際,25北朝鮮兵、ロシアに1万人　一部はウクライナ国境近くに　米国防総省時事通信10/29(火) 5:248件/時,時事通信,北朝鮮兵、ロシアに1万人　一部はウクライナ国境近くに　米国防総省,8,https://news.yahoo.co.jp/articles/2b38a6cd1138ff5d8cd8ea943c998e33117c4a67,10/29(火) 5:24
2024-10-29,07:06,world,国際,26英メディア、総選挙結果は「有権者の怒り過小評価」　「高市首相」に道開くとの指摘も産経新聞10/28(月) 8:128件/時,産経新聞,英メディア、総選挙結果は「有権者の怒り過小評価」　「高市首相」に道開くとの指摘も,8,https://news.yahoo.co.jp/articles/4dc53cb09d0f45332692bee4ef70224cfebdf56b,10/28(月) 8:12
2024-10-29,07:06,world,国際,27「ベビーシッターと不倫＆妊娠」「女性を平手打ち」　カマラ・ハリス夫の二つのスキャンダルとはデイリー新潮10/29(火) 6:087件/時,デイリー新潮,「ベビーシッターと不倫＆妊娠」「女性を平手打ち」　カマラ・ハリス夫の二つのスキャンダルとは,7,https://news.yahoo.co.jp/articles/4fa73782f6e52cd6456b905aeac442bb8de3b536,10/29(火) 6:08
2024-10-29,07:06,world,国際,28米メディア、衆院選の自公大敗を「日本政治の不確実性」予測　石破氏「首相の座危うい」産経新聞10/28(月) 10:497件/時,産経新聞,米メディア、衆院選の自公大敗を「日本政治の不確実性」予測　石破氏「首相の座危うい」,7,https://news.yahoo.co.jp/articles/243a847f34e5025796c992a7bce1ee01d82ddade,10/28(月) 10:49
2024-10-29,07:06,world,国際,29トランプ陣営、ヒスパニック系に差別的発言 ハリス陣営が非難ＡＦＰ＝時事10/28(月) 12:527件/時,ＡＦＰ＝時事,トランプ陣営、ヒスパニック系に差別的発言 ハリス陣営が非難,7,https://news.yahoo.co.jp/articles/3e2e2a3555b5cd1982cca231409979a67a12158f,10/28(月) 12:52
2024-10-29,07:06,world,国際,30イスラエル国会、UNRWA禁止法案を可決　ガザ支援に影響時事通信10/29(火) 5:177件/時,時事通信,イスラエル国会、UNRWA禁止法案を可決　ガザ支援に影響,7,https://news.yahoo.co.jp/articles/fb41471e2b5ba77a77a18532cf9f917fe9d9cccb,10/29(火) 5:17
2024-10-29,07:06,world,国際,311:14トランプ氏　ニューヨーク中心部で大規模集会 「独裁者」と抗議活動も　アメリカ大統領選挙まであと1週間あまりTBS NEWS DIG Powered by JNN10/28(月) 9:587件/時,TBS NEWS DIG Powered by JNN,トランプ氏　ニューヨーク中心部で大規模集会 「独裁者」と抗議活動も　アメリカ大統領選挙まであと1週間あまり,7,https://news.yahoo.co.jp/articles/ec1f52a703f5a596ec7b4669022c499632530a3d,10/28(月) 9:58
2024-10-29,07:06,world,国際,32北朝鮮兵を民間トラックで移送　ロシア軍の通信傍受、前線へ共同通信10/28(月) 9:067件/時,共同通信,北朝鮮兵を民間トラックで移送　ロシア軍の通信傍受、前線へ,7,https://news.yahoo.co.jp/articles/cfdccc2e1dbeb6138482e085b7df2abe069dfc98,10/28(月) 9:06
2024-10-29,07:06,world,国際,33フォルクスワーゲン ドイツ国内の少なくとも3工場の閉鎖などを検討TBS NEWS DIG Powered by JNN10/29(火) 5:326件/時,TBS NEWS DIG Powered by JNN,フォルクスワーゲン ドイツ国内の少なくとも3工場の閉鎖などを検討,6,https://news.yahoo.co.jp/articles/69fa7b0a7ae2e68be90e5ef645a3333ec22420fe,10/29(火) 5:32
2024-10-29,07:06,world,国際,34韓国大統領室「中東情勢の影響は制限的…原油問題時には油類税引き下げ」中央日報日本語版10/28(月) 7:556件/時,中央日報日本語版,韓国大統領室「中東情勢の影響は制限的…原油問題時には油類税引き下げ」,6,https://news.yahoo.co.jp/articles/692e0624956d65ce05cc2062a5def01894daffd6,10/28(月) 7:55
2024-10-29,07:06,world,国際,35見慣れた尹大統領の支持率２０％…「危機認識も低い」懸念が噴出した韓国与党中央日報日本語版10/28(月) 7:536件/時,中央日報日本語版,見慣れた尹大統領の支持率２０％…「危機認識も低い」懸念が噴出した韓国与党,6,https://news.yahoo.co.jp/articles/2d6e47a5821d599adc193849e482f17963400132,10/28(月) 7:53
2024-10-29,07:06,world,国際,36＜ゴルフ＞プレーオフで敗れた怒りを抑えられず…ロッカー扉を壊した韓国選手中央日報日本語版10/28(月) 11:486件/時,中央日報日本語版,＜ゴルフ＞プレーオフで敗れた怒りを抑えられず…ロッカー扉を壊した韓国選手,6,https://news.yahoo.co.jp/articles/9c2f72a50be964731edd3e5aaf7ba40b386c4a7b,10/28(月) 11:48
2024-10-29,07:06,world,国際,37北京の小学校前で刃物襲撃　5人負傷、男を取り押さえ時事通信10/28(月) 18:496件/時,時事通信,北京の小学校前で刃物襲撃　5人負傷、男を取り押さえ,6,https://news.yahoo.co.jp/articles/30c525fcd06dd208c8b4bf31b6cf0305719a88bd,10/28(月) 18:49
2024-10-29,07:06,world,国際,38トランプ氏がNYで大規模集会　著名人そろえ、最後の追い込み毎日新聞10/28(月) 19:516件/時,毎日新聞,トランプ氏がNYで大規模集会　著名人そろえ、最後の追い込み,6,https://news.yahoo.co.jp/articles/98840ef8fe083c5790f5b890878a75eeadd192d3,10/28(月) 19:51
2024-10-29,07:06,world,国際,39韓国・トラックから「子豚」ポロリ…落ちたのは「豚クッパ店」前という出来すぎた話KOREA WAVE10/29(火) 5:036件/時,KOREA WAVE,韓国・トラックから「子豚」ポロリ…落ちたのは「豚クッパ店」前という出来すぎた話,6,https://news.yahoo.co.jp/articles/93fe44d980344ac5042be1f6c83ecdf6da4263b4,10/29(火) 5:03
2024-10-29,07:06,world,国際,40このままだと次の戦場は朝鮮半島になる【コラム】ハンギョレ新聞10/28(月) 10:396件/時,ハンギョレ新聞,このままだと次の戦場は朝鮮半島になる【コラム】,6,https://news.yahoo.co.jp/articles/05e4b04f1169156b6f8d6527e2f1007f65e462c9,10/28(月) 10:39
