scrp_date,scrp_time,genre_en,genre_jp,rank,media_jp,title,comment,link,date_original
2024-10-29,21:11,TTL,総合,1立憲・野田佳彦代表、30日に維新・共産と党首会談へ毎日新聞10/29(火) 17:30784件/時,毎日新聞,立憲・野田佳彦代表、30日に維新・共産と党首会談へ,784,https://news.yahoo.co.jp/articles/3fe09dcb9e898afc421aaf9fcb6867ddcee91b93,10/29(火) 17:30
2024-10-29,21:11,TTL,総合,2「選挙終わったばかりなのに」テレビの大谷報道に「もうウンザリ」の声…フジ『めざまし』は60分丸ごと“番宣”SmartFLASH10/29(火) 18:04493件/時,SmartFLASH,「選挙終わったばかりなのに」テレビの大谷報道に「もうウンザリ」の声…フジ『めざまし』は60分丸ごと“番宣”,493,https://news.yahoo.co.jp/articles/d0ae2a01c5d1fab821f8ca3cb91b4d0c4824b22c,10/29(火) 18:04
2024-10-29,21:11,TTL,総合,3れいわ・大石あきこ氏　立民議員提訴意向の製薬会社を非難「許されない」「国民への脅し」デイリースポーツ10/29(火) 19:23487件/時,デイリースポーツ,れいわ・大石あきこ氏　立民議員提訴意向の製薬会社を非難「許されない」「国民への脅し」,487,https://news.yahoo.co.jp/articles/54e642a1a2a15e9825b5cdc321b5387ab3b51874,10/29(火) 19:23
2024-10-29,21:11,TTL,総合,4ばんばんざい・ぎしが結婚発表、お相手はモデル桜井美悠 猛アタックで交際発展…入籍日＆プロポーズ秘話も明かす【モデルプレス独占インタビュー】モデルプレス10/29(火) 18:01455件/時,モデルプレス,ばんばんざい・ぎしが結婚発表、お相手はモデル桜井美悠 猛アタックで交際発展…入籍日＆プロポーズ秘話も明かす【モデルプレス独占インタビュー】,455,https://news.yahoo.co.jp/articles/a1c6468d5ca885c81dfb24267bce3ad1a497a763,10/29(火) 18:01
2024-10-29,21:11,TTL,総合,5「赤旗のスクープ知らないの？」連合・芳野会長 「共産党と共闘しなくても勝てる」発言に非難轟々…都知事選では敗戦の責任なすりつけSmartFLASH10/29(火) 17:48428件/時,SmartFLASH,「赤旗のスクープ知らないの？」連合・芳野会長 「共産党と共闘しなくても勝てる」発言に非難轟々…都知事選では敗戦の責任なすりつけ,428,https://news.yahoo.co.jp/articles/12e8001897163e17ef8406c4f372d2ca27c1c3a5,10/29(火) 17:48
2024-10-29,21:11,TTL,総合,620歳男子大学生“全裸”暴行死　女子大学生ら10代～20代男女４人を傷害致死容疑などで逮捕　26日公園で心肺停止の状態で見つかり警察が捜査　北海道江別市HBCニュース北海道10/29(火) 9:46426件/時,HBCニュース北海道,20歳男子大学生“全裸”暴行死　女子大学生ら10代～20代男女４人を傷害致死容疑などで逮捕　26日公園で心肺停止の状態で見つかり警察が捜査　北海道江別市,426,https://news.yahoo.co.jp/articles/cf810768c7ada623f6b1367d01ea053abb16cfa9,10/29(火) 9:46
2024-10-29,21:11,TTL,総合,7東北電、女川原発2号機を再稼働　13年ぶり、大震災被災地で初共同通信10/29(火) 19:00417件/時,共同通信,東北電、女川原発2号機を再稼働　13年ぶり、大震災被災地で初,417,https://news.yahoo.co.jp/articles/88b3ba30f5e851e7be1620d93f882cd060ee9317,10/29(火) 19:00
2024-10-29,21:11,TTL,総合,8石破内閣の支持率、32％に下落　自公政権の継続望まず、53％共同通信10/29(火) 18:41407件/時,共同通信,石破内閣の支持率、32％に下落　自公政権の継続望まず、53％,407,https://news.yahoo.co.jp/articles/485525b91619a54b5b292349fac37ce6cd8dfb33,10/29(火) 18:41
2024-10-29,21:11,TTL,総合,9「日本人はモルモット」ワクチンのデマを流す立憲・原口一博議員を製薬会社が提訴へ。過去には“生物兵器まがい”との発言も集英社オンライン10/29(火) 17:13384件/時,集英社オンライン,「日本人はモルモット」ワクチンのデマを流す立憲・原口一博議員を製薬会社が提訴へ。過去には“生物兵器まがい”との発言も,384,https://news.yahoo.co.jp/articles/a190066184b6dc97a15d72738bb8029d6884fe93,10/29(火) 17:13
2024-10-29,21:11,TTL,総合,10国民民主・玉木代表　部分連合「定義がわからない」　連立入りは否定毎日新聞10/29(火) 11:32318件/時,毎日新聞,国民民主・玉木代表　部分連合「定義がわからない」　連立入りは否定,318,https://news.yahoo.co.jp/articles/a1006342e46caa6a87931762cf675db6fd7dd240,10/29(火) 11:32
2024-10-29,21:11,TTL,総合,11「私が辞めねば政権持たない」、自民・小泉進次郎氏　首相・幹事長の慰留振り切り辞任産経新聞10/28(月) 21:30311件/時,産経新聞,「私が辞めねば政権持たない」、自民・小泉進次郎氏　首相・幹事長の慰留振り切り辞任,311,https://news.yahoo.co.jp/articles/25b28956c859609d5a7503c49e5be1901fa12313,10/28(月) 21:30
2024-10-29,21:11,TTL,総合,12衆院選で最年少当選の大空幸星氏、「立場が違う」発言で“同志”コメンテーター陣から反論「バカにしすぎ」ENCOUNT10/29(火) 20:21290件/時,ENCOUNT,衆院選で最年少当選の大空幸星氏、「立場が違う」発言で“同志”コメンテーター陣から反論「バカにしすぎ」,290,https://news.yahoo.co.jp/articles/5d03de25ff9d92b7372cbb8f793e44b66b5d2d0b,10/29(火) 20:21
2024-10-29,21:11,TTL,総合,13パン最大手 山崎製パン　1月から食パンなど290品目値上げ　包装材料高騰などでテレビ朝日系（ANN）10/29(火) 16:49274件/時,テレビ朝日系（ANN）,パン最大手 山崎製パン　1月から食パンなど290品目値上げ　包装材料高騰などで,274,https://news.yahoo.co.jp/articles/8875b0ba3deb9f31c92babc28d5339cc53cef20b,10/29(火) 16:49
2024-10-29,21:11,TTL,総合,14進次郎氏、選対本部長辞任「2000万円送金」知らされず「森山幹事長に激怒」「詰め腹を切らされた」党内で飛び交う噂と同情SmartFLASH10/29(火) 17:07274件/時,SmartFLASH,進次郎氏、選対本部長辞任「2000万円送金」知らされず「森山幹事長に激怒」「詰め腹を切らされた」党内で飛び交う噂と同情,274,https://news.yahoo.co.jp/articles/3363618fa3917058ed30678736c4874c50d3e6b4,10/29(火) 17:07
2024-10-29,21:11,TTL,総合,15落選の旧安倍派不記載議員　自民党執行部に不満あらわ「普通に選挙をしていれば当選」「安倍派潰し高市派潰し」デイリースポーツ10/29(火) 20:02274件/時,デイリースポーツ,落選の旧安倍派不記載議員　自民党執行部に不満あらわ「普通に選挙をしていれば当選」「安倍派潰し高市派潰し」,274,https://news.yahoo.co.jp/articles/e9603c985bdfe8f74e8e3766c38c3f3ae7a00fc3,10/29(火) 20:02
2024-10-29,21:11,TTL,総合,16マイナ免許証、来年3月運用開始　関連政令を閣議決定　政府時事通信10/29(火) 10:24197件/時,時事通信,マイナ免許証、来年3月運用開始　関連政令を閣議決定　政府,197,https://news.yahoo.co.jp/articles/014fd1be7b1d34ff5a1bb281d842ef5b444e5868,10/29(火) 10:24
2024-10-29,21:11,TTL,総合,173議席獲得の日本保守党 百田尚樹代表「憲法違反だ」「もう本当ムカついてる」「何億円も用意できるはずがない」政治の参入障壁に憤りABEMA TIMES10/29(火) 16:54189件/時,ABEMA TIMES,3議席獲得の日本保守党 百田尚樹代表「憲法違反だ」「もう本当ムカついてる」「何億円も用意できるはずがない」政治の参入障壁に憤り,189,https://news.yahoo.co.jp/articles/a9f316bea4a3bd47af0e6be7360e0d8ff78f228d,10/29(火) 16:54
2024-10-29,21:11,TTL,総合,18「トラックに殺されそうになった」超接近で追い越し、自転車の男性はジャージ破ける　犯罪では？弁護士ドットコムニュース10/29(火) 10:02179件/時,弁護士ドットコムニュース,「トラックに殺されそうになった」超接近で追い越し、自転車の男性はジャージ破ける　犯罪では？,179,https://news.yahoo.co.jp/articles/6468d215f3a27bea9dbcad8af7d4db4e710046cb,10/29(火) 10:02
2024-10-29,21:11,TTL,総合,19北海道の全裸男性遺体、交際相手の女子大学生ら４人を傷害致死容疑で逮捕…「ほかにも関与者」読売新聞オンライン10/29(火) 11:31178件/時,読売新聞オンライン,北海道の全裸男性遺体、交際相手の女子大学生ら４人を傷害致死容疑で逮捕…「ほかにも関与者」,178,https://news.yahoo.co.jp/articles/04634b4de6127089f5d981b22a6962cfc28765ff,10/29(火) 11:31
2024-10-29,21:11,TTL,総合,20ド軍が4年ぶりWS制覇へ王手　大谷翔平は2戦無安打も1得点2出塁…左肩負傷から強行出場Full-Count10/29(火) 12:42172件/時,Full-Count,ド軍が4年ぶりWS制覇へ王手　大谷翔平は2戦無安打も1得点2出塁…左肩負傷から強行出場,172,https://news.yahoo.co.jp/articles/e69e70fb63592633d4afbb2da2bb89456778c107,10/29(火) 12:42
2024-10-29,21:11,TTL,総合,212:485人以上が暴行か　大学生の女ら４人逮捕「人の気持ちを考えられない子」大学生死亡事件・江別市STVニュース北海道10/29(火) 16:05167件/時,STVニュース北海道,5人以上が暴行か　大学生の女ら４人逮捕「人の気持ちを考えられない子」大学生死亡事件・江別市,167,https://news.yahoo.co.jp/articles/98448eccb5fc575c6dbcc7c7b0bea72b533d9427,10/29(火) 16:05
2024-10-29,21:11,TTL,総合,221:08＜全職員が利用できる”週休3日制”＞『宮城県』が2026年4月から導入へ　県としては東北で”初導入”ミヤギテレビ10/29(火) 14:09166件/時,ミヤギテレビ,＜全職員が利用できる”週休3日制”＞『宮城県』が2026年4月から導入へ　県としては東北で”初導入”,166,https://news.yahoo.co.jp/articles/1dc7275bce2b7da9d5323e4d084d42472e9b3e9c,10/29(火) 14:09
2024-10-29,21:11,TTL,総合,23「ギョッとする」「注意される前に調べなよ」木村拓哉、「虹の橋を渡った」西田敏行さん追悼の表現にあきれ殺到、近年の言動に懸念SmartFLASH10/29(火) 16:01163件/時,SmartFLASH,「ギョッとする」「注意される前に調べなよ」木村拓哉、「虹の橋を渡った」西田敏行さん追悼の表現にあきれ殺到、近年の言動に懸念,163,https://news.yahoo.co.jp/articles/ee19db5773000100b0734f945e72719a7fa80ad8,10/29(火) 16:01
2024-10-29,21:11,TTL,総合,24維新・吉村洋文共同代表　立憲を秒速拒絶、ＴＶで首班指名の協力断る→目合わせず「信頼損ねる」　大阪方は政局参戦を懸念「勘違い」デイリースポーツ10/29(火) 17:18160件/時,デイリースポーツ,維新・吉村洋文共同代表　立憲を秒速拒絶、ＴＶで首班指名の協力断る→目合わせず「信頼損ねる」　大阪方は政局参戦を懸念「勘違い」,160,https://news.yahoo.co.jp/articles/0380e4e100fc623bce08c296e2d7effe2dd70e51,10/29(火) 17:18
2024-10-29,21:11,TTL,総合,25「比例って意味ある？」元グラドル森下千里は“即当確”、“ゾンビ議員”続々で高まる「比例不要論」FRIDAY10/29(火) 11:00156件/時,FRIDAY,「比例って意味ある？」元グラドル森下千里は“即当確”、“ゾンビ議員”続々で高まる「比例不要論」,156,https://news.yahoo.co.jp/articles/3e5509ae4cc1e9f1b108b40dafeaf1a6fa3f5b0a,10/29(火) 11:00
2024-10-29,21:11,TTL,総合,26高市早苗氏、衆院選で40カ所応援行脚も「落選率60％」威光示せず“ポスト石破”に暗雲の仏頂面SmartFLASH10/29(火) 15:52131件/時,SmartFLASH,高市早苗氏、衆院選で40カ所応援行脚も「落選率60％」威光示せず“ポスト石破”に暗雲の仏頂面,131,https://news.yahoo.co.jp/articles/0e19f79903ecba32276966ed63f7dfb12d51e6da,10/29(火) 15:52
2024-10-29,21:11,TTL,総合,27共産の供託金没収4億2900万円　小選挙区だけで前回の3倍超　共闘転換で213人擁立産経新聞10/29(火) 16:53129件/時,産経新聞,共産の供託金没収4億2900万円　小選挙区だけで前回の3倍超　共闘転換で213人擁立,129,https://news.yahoo.co.jp/articles/c493d69c04528cdbca5961e9008cb7b82910cb48,10/29(火) 16:53
2024-10-29,21:11,TTL,総合,28「紙の保険証（嘲笑）」 維新・猪瀬直樹議員、マイナ保険証めぐる議論で立憲民主党・野田佳彦代表ら反対派を挑発中日スポーツ10/29(火) 18:07127件/時,中日スポーツ,「紙の保険証（嘲笑）」 維新・猪瀬直樹議員、マイナ保険証めぐる議論で立憲民主党・野田佳彦代表ら反対派を挑発,127,https://news.yahoo.co.jp/articles/b5bf6d5b9deb54e22f250e83c987edf9e8671393,10/29(火) 18:07
2024-10-29,21:11,TTL,総合,29暴行被害の小嶋陽菜　所属事務所が声明発表　「法的措置含む対抗策」実行を宣言デイリースポーツ10/29(火) 17:24124件/時,デイリースポーツ,暴行被害の小嶋陽菜　所属事務所が声明発表　「法的措置含む対抗策」実行を宣言,124,https://news.yahoo.co.jp/articles/c59e6574728cb5d596cb6313dcfbf82a1cf4bf24,10/29(火) 17:24
2024-10-29,21:11,TTL,総合,30「雑すぎてイライラ」橋本環奈『おむすび』震災シーンの “分別ないひと言” が物議…無邪気すぎる言動に違和感SmartFLASH10/29(火) 16:30121件/時,SmartFLASH,「雑すぎてイライラ」橋本環奈『おむすび』震災シーンの “分別ないひと言” が物議…無邪気すぎる言動に違和感,121,https://news.yahoo.co.jp/articles/a2b733392147eb1bf353dd5ffccbe8f4bf46dc6e,10/29(火) 16:30
2024-10-29,21:11,TTL,総合,31東国原　石破倒閣→高市の乱「反乱起こすのはあのグループしか」僚友の大物議員が生還　内閣不信任で造反→連立野党で高市総裁「ゼロではない」デイリースポーツ10/29(火) 15:49119件/時,デイリースポーツ,東国原　石破倒閣→高市の乱「反乱起こすのはあのグループしか」僚友の大物議員が生還　内閣不信任で造反→連立野党で高市総裁「ゼロではない」,119,https://news.yahoo.co.jp/articles/acfcd558d5d4b6c5d0e368bb54a874638a35c77a,10/29(火) 15:49
2024-10-29,21:11,TTL,総合,32“敗軍の将”石破首相は「むしろ功績」　自民惨敗“本当の戦犯”2人を専門家が名指し「日本中がカチンときた」ENCOUNT10/29(火) 7:20119件/時,ENCOUNT,“敗軍の将”石破首相は「むしろ功績」　自民惨敗“本当の戦犯”2人を専門家が名指し「日本中がカチンときた」,119,https://news.yahoo.co.jp/articles/dcca9bbee27fea330b720e8a0e82e44487851d16,10/29(火) 7:20
2024-10-29,21:11,TTL,総合,33晩節汚したベテラン声優・古谷徹…4年半にわたる「不倫・DV・中絶」醜聞認めこのまま引退へ日刊ゲンダイDIGITAL10/29(火) 9:06116件/時,日刊ゲンダイDIGITAL,晩節汚したベテラン声優・古谷徹…4年半にわたる「不倫・DV・中絶」醜聞認めこのまま引退へ,116,https://news.yahoo.co.jp/articles/2bd20d8c5089c733115e77c59d9a6225bc856af3,10/29(火) 9:06
2024-10-29,21:11,TTL,総合,"34YOSHIKI、手越が加入XYプロデューサー辞任示唆…メンバー反応「Boss, 話し合いませんか？」スポニチアネックス10/29(火) 15:51116件/時",スポニチアネックス,"YOSHIKI、手越が加入XYプロデューサー辞任示唆…メンバー反応「Boss, 話し合いませんか？」",116,https://news.yahoo.co.jp/articles/aa5337c6fcd2631079ded8927672488fb3eaa179,10/29(火) 15:51
2024-10-29,21:11,TTL,総合,35小嶋陽菜　29日の写真集イベントを中止と発表「怪我はありませんが、万全を期して」28日夜に暴行被害スポニチアネックス10/29(火) 14:29115件/時,スポニチアネックス,小嶋陽菜　29日の写真集イベントを中止と発表「怪我はありませんが、万全を期して」28日夜に暴行被害,115,https://news.yahoo.co.jp/articles/b17693d7842073d301f468f6ab18eaf585c8e0b5,10/29(火) 14:29
2024-10-29,21:11,TTL,総合,36【速報】イベント後の小嶋陽菜さんに暴行容疑　ファンか…外国籍の男を現行犯逮捕　警視庁日テレNEWS NNN10/29(火) 2:25115件/時,日テレNEWS NNN,【速報】イベント後の小嶋陽菜さんに暴行容疑　ファンか…外国籍の男を現行犯逮捕　警視庁,115,https://news.yahoo.co.jp/articles/a4c7902bad67b48fe04e6a396e1b96ab4574496f,10/29(火) 2:25
2024-10-29,21:11,TTL,総合,37ＤｅＮＡ・オースティン　見逃し三振の判定に怒りあらわ　原球審に向かって不満つぶやくデイリースポーツ10/29(火) 19:44109件/時,デイリースポーツ,ＤｅＮＡ・オースティン　見逃し三振の判定に怒りあらわ　原球審に向かって不満つぶやく,109,https://news.yahoo.co.jp/articles/26294f982e8d8a5f881b1996a78a6dae46d798a1,10/29(火) 19:44
2024-10-29,21:11,TTL,総合,38激震の公明、悩む後任選び　石井代表落選で大混乱、31日にも辞任表明産経新聞10/28(月) 21:28109件/時,産経新聞,激震の公明、悩む後任選び　石井代表落選で大混乱、31日にも辞任表明,109,https://news.yahoo.co.jp/articles/0e36f099b3cbc8359bd05d9740aa5670278763d6,10/28(月) 21:28
2024-10-29,21:11,TTL,総合,39SUGIZO　2人に1人が投票行かない日本人に嘆き…「極めて残念、と言うか情けない」スポニチアネックス10/29(火) 15:13107件/時,スポニチアネックス,SUGIZO　2人に1人が投票行かない日本人に嘆き…「極めて残念、と言うか情けない」,107,https://news.yahoo.co.jp/articles/591cb90385af92f2d32aabd242b1dd64c54860d6,10/29(火) 15:13
2024-10-29,21:11,TTL,総合,40小里農相が辞意表明共同通信10/29(火) 11:17107件/時,共同通信,小里農相が辞意表明,107,https://news.yahoo.co.jp/articles/adc15d75d7ef62230665c399925c08531fdaf231,10/29(火) 11:17
