scrp_date,scrp_time,genre_en,genre_jp,rank,media_jp,title,comment,link,date_original
2024-08-08,10:33,TTL,総合,1,文春オンライン,「本人の希望も含め謹慎」KAT-TUN中丸雄一（40）が橋本環奈似女子大生と“アパホテル密会”休業へ　事務所は「家族やお相手に辛い思いをさせたことを深く反省」「弊社も看過できず、大変遺憾」,463,https://news.yahoo.co.jp/articles/ae0c5a519a05d68596836803d24f2832084836c1,8/7(水) 13:02
2024-08-08,10:33,TTL,総合,2,読売新聞オンライン,日清食品、「カップヌードル」店頭価格の一律引き上げ強要か…公正取引委員会が近く警告へ,427,https://news.yahoo.co.jp/articles/5467ff6cbc622b38cfae709043de12d1ab3df377,8/8(木) 3:00
2024-08-08,10:33,TTL,総合,3,産経新聞,東京都の小池百合子知事、プロ野球の始球式で膝を剥離骨折　全治２カ月でテレワークへ,303,https://news.yahoo.co.jp/articles/d9987adb7e8c0e809c94dd2a7c905da585152fa6,8/7(水) 13:59
2024-08-08,10:33,TTL,総合,4,FNNプライムオンライン（フジテレビ系）,「後悔の念しかございません」KAT-TUNの中丸雄一さんが謹慎発表「お叱りの⾔葉を全てしっかりと受け⽌める」妻以外の女性との密会報道受け,289,https://news.yahoo.co.jp/articles/fec38672e72d253677660ec40edf572e26c6e985,8/7(水) 16:00
2024-08-08,10:33,TTL,総合,5,TBS NEWS DIG Powered by JNN,卓球日本男子 、準決勝でスウェーデンに敗れる...フルマッチの激闘も第5試合で張本敗れ崩れ落ちる、2－0から大逆転負け【パリ五輪】,284,https://news.yahoo.co.jp/articles/2c7faa97fdae4e71c719404b502f0b6278bb638b,8/8(木) 6:34
2024-08-08,10:33,TTL,総合,6,日刊ゲンダイDIGITAL,やす子&フワちゃん騒動が寄付金着服「24時間テレビ」を救う？ “和解シーン”あれば視聴率爆騰！,241,https://news.yahoo.co.jp/articles/1b4b506a80871c5cb9ce94dc52a03637d900dd53,8/8(木) 9:06
2024-08-08,10:33,TTL,総合,7,TBS NEWS DIG Powered by JNN,アメリカやイギリスなど少なくとも6か国の駐日大使、長崎の原爆式典を一斉に欠席へ　イスラエル不招待を受け,234,https://news.yahoo.co.jp/articles/f3e89a0b4867f478af354aa2c712ac32d024fde2,8/7(水) 15:34
2024-08-08,10:33,TTL,総合,8,SmartFLASH,「芸能人として恥ずかしすぎる」KAT-TUN中丸　失笑を集めた“女子大生アパ密会”の失態,203,https://news.yahoo.co.jp/articles/9edf5f6797ed35848f9c67370017e35ede5bda27,8/8(木) 6:00
2024-08-08,10:33,TTL,総合,9,スポニチアネックス,中丸雄一　テレビ各局が「出演見合わせ」対応を発表　テレ朝、日テレにラジオ…人気番組レギュラー多数,194,https://news.yahoo.co.jp/articles/397c1a359f3b211069837216263f48001007aa97,8/7(水) 16:18
2024-08-08,10:33,TTL,総合,10,HBCニュース北海道,女性用下着を頭にかぶり手には包丁「やめて」と抵抗する10代姉妹の胸や尻を…２階の無施錠窓から侵入か　47歳の男「僕がやったことです」北海道帯広市,191,https://news.yahoo.co.jp/articles/d02b246016a3085cd526953f9883e057ad9955fa,8/8(木) 8:38
2024-08-08,10:33,TTL,総合,11,スポニチアネックス,俳優・岸田タツヤとフリーアナの高木由梨奈が結婚発表「手を取り合い温かい家庭を」,182,https://news.yahoo.co.jp/articles/f3520d48090b222e800d936124e39b35090c6a72,8/8(木) 8:08
2024-08-08,10:33,TTL,総合,12,オリコン,広末涼子、約25年ぶりにライブ開催　音楽を通して「ありがとうの気持ちを届けたい」,181,https://news.yahoo.co.jp/articles/d8d482c97501aa37cfd3135820b2ea4c1a36d690,8/7(水) 18:18
2024-08-08,10:33,TTL,総合,13,RONSPO,パリ五輪で性別騒動の台湾女子ボクサーリンが圧勝で決勝進出も敗れたトルコ選手がまた「X」ポーズの侮辱的問題行動,162,https://news.yahoo.co.jp/articles/1bafb5d79b928e379922698ba4481cbd785142c0,8/8(木) 6:38
2024-08-08,10:33,TTL,総合,14,スポニチアネックス,フワちゃん　なぜ説明しないのか　やす子に不適切発言　経緯や背景など本人が語る必要性指摘する声,148,https://news.yahoo.co.jp/articles/a4826960eabe00b0afab8851f1e48702431394f3,8/8(木) 4:45
2024-08-08,10:33,TTL,総合,15,THE ANSWER,「そりゃフランス勝ちますよ」　バスケ誤審騒動再び、事態知った日本人も批判「目の前にいるのに」,146,https://news.yahoo.co.jp/articles/77ae20a6ed91ca3c67605e7b4bd290dcbb48f25a,8/8(木) 5:13
2024-08-08,10:33,TTL,総合,16,北海道新聞,＜独自＞北海道・北見市、非正規公務員90人削減方針　25年度　経費抑制策の一環,145,https://news.yahoo.co.jp/articles/3de2eea1b4f07a1d24becc0d091fde2bbd1e5e21,8/8(木) 5:00
2024-08-08,10:33,TTL,総合,17,スポニチアネックス,中丸雄一、妻・笹崎里菜さんへ謝罪「後悔の念しかない」　妻とはすでに対話「しっかり自分と向き合って」,144,https://news.yahoo.co.jp/articles/28111ced22e1c20fe7fc93ab025c7e2fab920bf8,8/7(水) 16:05
2024-08-08,10:33,TTL,総合,18,日テレNEWS NNN,単独取材：金融庁・井藤英樹新長官　株価乱高下の中、投資について,131,https://news.yahoo.co.jp/articles/59604e871429d25c5b65a8cfda7e33cf2ac1065b,8/7(水) 18:00
2024-08-08,10:33,TTL,総合,19,スポーツ報知,選手村の食事に不満の声…ＩＯＣ委員が私見「ご飯を楽しむために行っているわけではない」「食堂に不満が出ない大会あったかなって」,128,https://news.yahoo.co.jp/articles/acbd07a223edf4b5c9249088b39aae2b88c4ce0c,8/7(水) 11:20
2024-08-08,10:33,TTL,総合,20,日刊ゲンダイDIGITAL,フワちゃん芸能界追放へ…やす子への暴言炎上は鎮火せず SNSの“NGフレーズ”が致命傷,128,https://news.yahoo.co.jp/articles/520f639622b68608210c66f2829c0fb16de05eaf,8/7(水) 11:03
2024-08-08,10:33,TTL,総合,21,共同通信,川入らせ部下溺死させたか、静岡　重過失致死疑い、男を再逮捕,118,https://news.yahoo.co.jp/articles/7483e41b27390a7984425358a0d4dad9290e8b60,8/7(水) 12:56
2024-08-08,10:33,TTL,総合,22,読売新聞オンライン,兵庫知事、パワハラ告発を把握直後に調査指示…「公益通報とは認識していなかった」,116,https://news.yahoo.co.jp/articles/5a7884de03c08e6c78b41455ff5c5aab0579671f,8/8(木) 9:20
2024-08-08,10:33,TTL,総合,23,THE DIGEST,「時間の問題だな…」11歳、13歳、16歳、“10代だらけ”のスケートボードに反響止まず…「年齢制限」を求める声も「小柄な方が圧倒的に有利」【パリ五輪】,112,https://news.yahoo.co.jp/articles/ae9a7c631735829e00a7f5e3ebc1054f514437b0,8/8(木) 4:03
2024-08-08,10:33,TTL,総合,24,関西テレビ,【速報】「パワハラ疑惑告発めぐり『職員の私物スマートフォン』を調査」に兵庫・斎藤知事「行ったかどうかお答えできないが、一般論として任意の依頼に相手が応じれば問題ない」　告発した元県民局長とのSNSのやり取りを確認,112,https://news.yahoo.co.jp/articles/3df0bda53c444f784ced52ce89f33fa7df2d5ad7,8/7(水) 11:30
2024-08-08,10:33,TTL,総合,25,みんかぶマガジン,「死人がゴロゴロ出る相場」鬼の岸田政権、最後の置き土産に国民絶望…日経平均一時大暴落、新しい資本主義とは何だったのか,100,https://news.yahoo.co.jp/articles/0215fe85a786ca81d493d3e77d34191f634cfa46,8/8(木) 9:10
2024-08-08,10:33,TTL,総合,26,AERA dot.,東京都心で「日傘男子」が急増中　直撃ルポでわかった「帽子じゃダメな理由」と「女性からの評判」,100,https://news.yahoo.co.jp/articles/1e26486b2849c03de01102ceacb2454b12d7461f,8/8(木) 7:32
2024-08-08,10:33,TTL,総合,27,デイリースポーツ,体重超過で失格のインド選手がＳＮＳで引退表明「さようならレスリング」「ごめんなさい」,100,https://news.yahoo.co.jp/articles/c345c61085cf9b1d25e9f4cc1df06e2bac83d0bc,8/8(木) 9:18
2024-08-08,10:33,TTL,総合,28,時事通信,市場不安定なら「利上げせず」　当面、現在の緩和継続　内田日銀副総裁,99,https://news.yahoo.co.jp/articles/33a59cc29be636cf96220b0cadc59d18ca6c7e20,8/7(水) 10:53
2024-08-08,10:33,TTL,総合,29,スポーツ報知,ＡＳ、新ルール作成メンバー国が上位３つに　違反、直前の変更など無法状態…中島ＨＣも怒り「私たちが絶対ダメだと思ってたことを、普通にやっていた」,98,https://news.yahoo.co.jp/articles/08d165abf06c8dd010a43fed6f816507040affa8,8/8(木) 4:57
2024-08-08,10:33,TTL,総合,30,SmartFLASH,フジテレビ「もう終わっていい」バラエティランキング『占ってもいいですか』と並ぶ1位は「司会者が嫌いすぎ」【500人にきいた】,98,https://news.yahoo.co.jp/articles/22e8cc772d002869eeab724d1ce319c2ad536e18,8/8(木) 6:00
2024-08-08,10:33,TTL,総合,31,マネーポストWEB,「時期尚早すぎた」日銀の利上げが日本経済に与える負のインパクト　デフレ脱却への期待感は一気に剥落、株価乱高下で新NISAブームにも冷や水,94,https://news.yahoo.co.jp/articles/addb93a628347dfc4c7e54fc7953c74dce090a9f,8/8(木) 7:15
2024-08-08,10:33,TTL,総合,32,BuzzFeed Japan,「女性候補に投票する男性はマザコン」米大統領選、テレビキャスターの暴論に批判集まる,92,https://news.yahoo.co.jp/articles/172a189cc0641c5f1d88eb67737e585345fb5f21,8/8(木) 8:15
2024-08-08,10:33,TTL,総合,33,RONSPO,なぜパリ五輪から男女に解禁されたアーティスティックスイミングに1人も男子選手が出場しなかったのか…「力強さはあっても必要な技術がない」…代表漏れに失望して引退した選手も,91,https://news.yahoo.co.jp/articles/19944027ad12221ed60e0fa8c177ea7d48e60ded,8/8(木) 8:09
2024-08-08,10:33,TTL,総合,34,東洋経済オンライン,「陰湿すぎる」「いじめっ子を思わせる」と非難轟々。フワちゃん「やす子へ公開暴言」が示す根深い問題とは？,87,https://news.yahoo.co.jp/articles/fdfaae3fd6b9c5e59f61c3aaa708cb4ea2331eaf,8/7(水) 13:32
2024-08-08,10:33,TTL,総合,35,朝日新聞デジタル,カップヌードル、どん兵衛など価格拘束か　独禁法違反の疑いで警告へ,85,https://news.yahoo.co.jp/articles/6459d2b6fb262fec04e008175994034b4c51a81a,8/8(木) 5:00
2024-08-08,10:33,TTL,総合,36,スポニチアネックス,力尽き、ぼう然の張本智和「意味が分からない」　9日に3位決定戦「力は残っていない」,83,https://news.yahoo.co.jp/articles/e8eacefbee8c4499381b6e8d41516616ef6ba2e1,8/8(木) 7:12
2024-08-08,10:33,TTL,総合,37,共同通信,大手企業ボーナス94万円、今夏　4.23％増、2番目の高水準,79,https://news.yahoo.co.jp/articles/02ad6242d248e6801a259404a8f1baa58db6c1b3,8/7(水) 16:58
2024-08-08,10:33,TTL,総合,38,日刊スポーツ,三浦瑠麗氏、中丸雄一の不倫報道「被害を受けたNo. 1は中丸さんの妻」「文春くん何様問題」,77,https://news.yahoo.co.jp/articles/445ae72a05382358a381cc153354e31846b56d48,8/8(木) 9:29
2024-08-08,10:33,TTL,総合,39,日テレNEWS NNN,「あんなのルール上ありなん？？」卓球男子団体スウェーデン選手の“六角形ラケット”が話題に,77,https://news.yahoo.co.jp/articles/1b5ad424b9f9e8e76123de1ee356e7e30076cfcd,8/8(木) 7:11
2024-08-08,10:33,TTL,総合,40,日刊スポーツ,遠野なぎこ、号泣阿部詩を擁護も「唯一炎上したタレント」と指摘され「余計なことしちゃった…」,75,https://news.yahoo.co.jp/articles/f815d86966707985f07e1a6c626b7a8c7ba08a18,8/8(木) 8:24
