scrp_date,scrp_time,genre_en,genre_jp,rank,media_jp,title,comment,link,date_original
2024-05-09,07:18,sports,スポーツ,1,共同通信,韓国スポーツ、相次ぐ不振　パリ五輪へ「危機」と懸念,111,https://news.yahoo.co.jp/articles/6489fe3caff42c7b38f25e4974820805dfaa409e,5/8(水) 19:07
2024-05-09,07:18,sports,スポーツ,2,ゲキサカ,苦労人FWホセルが窮地から大逆転2発!! R・マドリー、王者シティに続きバイエルンも劇的に破って2年ぶり欧州CL決勝へ,110,https://news.yahoo.co.jp/articles/c6ffeaa3707a5775c7c02e6353138af979ad1da5,5/9(木) 6:02
2024-05-09,07:18,sports,スポーツ,3,GOAL,レアル・マドリー、バイエルン相手にも“いつもの”劇的勝利！88＆91分のホセル弾で逆転‼︎2年ぶりのCL決勝進出決める,102,https://news.yahoo.co.jp/articles/8e1f04e6851252ab4666c7f9fdf13d852f715fd1,5/9(木) 6:01
2024-05-09,07:18,sports,スポーツ,4,東スポWEB,井上尚弥のダウンをカシメロが嘲笑　ネリのＫＯ負けには「俺なら違う結果になった」,99,https://news.yahoo.co.jp/articles/8cec3e440c5e6a291c35f86ba6ca0027c365a8cf,5/9(木) 5:16
2024-05-09,07:18,sports,スポーツ,5,THE DIGEST,大谷翔平から水原一平容疑者が盗んだ総額は「1697万5010ドル」や「６億円の所得申告漏れ」「歯の治療と嘘」など新事実が続々発覚！ 連邦検察は「正義の鉄槌を下す」と宣言,93,https://news.yahoo.co.jp/articles/d20b9291120aa6611543406a4c233571160038f9,5/9(木) 6:35
2024-05-09,07:18,sports,スポーツ,6,SOCCER DIGEST Web,マドリーが２季ぶりのファイナル進出！ 終盤にホセルが２発、２戦合計４－３でバイエルンを撃破！ 決勝ではドルトムントと激突,89,https://news.yahoo.co.jp/articles/3e07e8fccd1d642d209a888f91d0a4a66f24b8da,5/9(木) 6:01
2024-05-09,07:18,sports,スポーツ,7,CoCoKARAnext,グッドマンに井上尚弥戦は「自殺行為」 合意間近の一戦に豪伝説戦士が辛辣意見！「世界王者になるなら、今はやめるべき」,72,https://news.yahoo.co.jp/articles/b7e898f678c1025c8c621bfb80095d979bedada4,5/9(木) 6:02
2024-05-09,07:18,sports,スポーツ,8,デイリースポーツ,阪神　連敗で２カード連続負け越し　ゲラがまさかの２失点ＫＯ　３番・ノイジーら中軸がブレーキ　岡田監督「そら真ん中でヒットでえへんから」,67,https://news.yahoo.co.jp/articles/bd70e5098ec86a1257a9184725b3507b67fcbfa9,5/8(水) 20:54
2024-05-09,07:18,sports,スポーツ,9,TBS NEWS DIG Powered by JNN,【中日】2連敗で借金2...藤嶋が8回 自身の暴投が絡み長野に適時三塁打で致命的な3失点 打線は9安打で9回に石川昂の適時打 1点のみ,58,https://news.yahoo.co.jp/articles/9f93aac6fd3f0037cc9ca0ce77c5c25b36a69b7b,5/8(水) 21:07
2024-05-09,07:18,sports,スポーツ,10,スポーツ報知,【巨人】 山瀬慎之助が１軍合流へ　不振の大城卓三と入れ替え,56,https://news.yahoo.co.jp/articles/bf897b3ad5971488126b9106d359d59cd6039d68,5/8(水) 12:14
2024-05-09,07:18,sports,スポーツ,11,東スポWEB,【巨人】大迷惑だ！　元ドラ１投手が窃盗で逮捕に球団関係者怒り「せっかくイメージ良くしたのに」,54,https://news.yahoo.co.jp/articles/482cdcdd0f683d02cfa087f50de666757ddfd96c,5/9(木) 5:16
2024-05-09,07:18,sports,スポーツ,12,東スポWEB,大谷翔平〝胴長短足、ポケットに札束〟米雑誌の表紙が「下劣極まりない」と日米で物議,54,https://news.yahoo.co.jp/articles/b943a365047a168ce1b3bc8c6a77d7ecf55b6184,5/8(水) 23:36
2024-05-09,07:18,sports,スポーツ,13,東スポWEB,【中日】〝貧打病再発〟の危機…　宇野勝氏は岡林勇希をキーマンに指名「試合に出した方がいい」,53,https://news.yahoo.co.jp/articles/98cd9d4e01c75ed9fd894559ca99d3dfa2f54ed9,5/9(木) 6:16
2024-05-09,07:18,sports,スポーツ,14,サッカーキング,これがレアル・マドリード！　終盤にホセルが2発、バイエルンに劇的逆転で2年ぶりCL決勝進出,52,https://news.yahoo.co.jp/articles/d6770ee7cd960d4c2e4e1063c17cb20f58a4d6fe,5/9(木) 6:23
2024-05-09,07:18,sports,スポーツ,15,THE ANSWER,ネリ、井上尚弥は「強いわけじゃない」　敗北から一夜の強がり発言　「彼は126でも成し遂げる」とも,52,https://news.yahoo.co.jp/articles/fdb45504b22ba044dbac831db9c158c9cdb1b791,5/8(水) 11:36
2024-05-09,07:18,sports,スポーツ,16,Full-Count,上沢直之がマイナー降格　球団発表…2試合で防御率2.25、デビュー戦では球団2人目の記録も,52,https://news.yahoo.co.jp/articles/4c9f7619cf36b8e5ef74e850d034d9e084e2a905,5/9(木) 4:48
2024-05-09,07:18,sports,スポーツ,17,スポニチアネックス,【欧州CL】Rマドリード　88分からFWホセル2発で劇的大逆転勝利　激闘制し2季ぶり決勝進出,52,https://news.yahoo.co.jp/articles/b371e8b30f202db8e4cf33078e6d552710be6520,5/9(木) 6:01
2024-05-09,07:18,sports,スポーツ,18,デイリースポーツ,甲子園が大きくどよめいた新井采配　なぜ大瀬良に代打を出さず？「ビッグチャンス以外は大地」本人も予想外の続投劇,50,https://news.yahoo.co.jp/articles/6bbfdc3e8c65f1a75d5b5838308f98ae427a7f2e,5/8(水) 22:00
2024-05-09,07:18,sports,スポーツ,19,中日スポーツ,大谷翔平、胴長短足のイラストが物議　ポケットには札束、アメリカ老舗雑誌の表紙に「理解」「不快」反応飛びかう,49,https://news.yahoo.co.jp/articles/34bab4799ff7cbc7e8af000c368274cca5634fad,5/8(水) 19:47
2024-05-09,07:18,sports,スポーツ,20,スポーツ報知,カブス今永昇太、渡米後最長８回のマウンドで痛恨逆転２ラン被弾し降板,48,https://news.yahoo.co.jp/articles/001bce94247bfaa1bfd6d415f161d8b0c109f0b7,5/8(水) 10:41
2024-05-09,07:18,sports,スポーツ,21,スポーツ報知,カブス今永昇太、タティスらから３者連続三振…パドレス戦で５回まで無失点、６勝目権利,48,https://news.yahoo.co.jp/articles/2a19ceb29cdbf94cdbf4301666756322802ee5ca,5/8(水) 9:50
2024-05-09,07:18,sports,スポーツ,22,東スポWEB,【Ｆ１】角田裕毅の評価高騰　〝名門〟へのステップアップ予想する声「メルセデスは契約すべきだ」,44,https://news.yahoo.co.jp/articles/7d7026621931e7c65a7149b0f7d743b74c1544d0,5/9(木) 5:16
2024-05-09,07:18,sports,スポーツ,23,デイリースポーツ,巨人・大城卓が無期限２軍降格　打率・１８８と開幕から極度の打撃不振　阿部監督「一番のメインは気分転換」山瀬が昇格,43,https://news.yahoo.co.jp/articles/6f16427098810e7958206b87b744ebb313bdb9dc,5/8(水) 16:00
2024-05-09,07:18,sports,スポーツ,24,スポーツ報知,【巨人】終盤の決定打で連勝！先発・堀田賢慎が６回途中無失点で２勝目　長野久義が８回に試合決める３点三塁打,42,https://news.yahoo.co.jp/articles/45081f94c7c7ad6cf0a706f7c598c0bec7b05f3b,5/8(水) 21:07
2024-05-09,07:18,sports,スポーツ,25,超WORLDサッカー！,途中出場ホセルがドブレーテの大仕事、レアル・マドリーが終盤の劇的逆転劇でドルトムントの待つ決勝に進出【CL】,41,https://news.yahoo.co.jp/articles/158309fe49adfcc05ae7f4e30f2860051ae4f438,5/9(木) 6:05
2024-05-09,07:18,sports,スポーツ,26,TBS NEWS DIG Powered by JNN,山本由伸、本拠地初白星の4勝目！自己最長8回2失点の好投、2被弾も打線8得点　大谷無安打もド軍6連勝,41,https://news.yahoo.co.jp/articles/1cb0bcec48b26fa50c43b631b83e657cae812b1c,5/8(水) 13:21
2024-05-09,07:18,sports,スポーツ,27,GOAL,CL決勝カードが決定！レアル・マドリーとドルトムントが激突ヘ…6/1にウェンブリーで開催,41,https://news.yahoo.co.jp/articles/5930f6f6caea2bc9749a4dff1f74fe25f51d54a4,5/9(木) 6:01
2024-05-09,07:18,sports,スポーツ,28,サンケイスポーツ,那須川天心がＷＢＯＡＰバンタム級１位に　次戦は７月２０日に東京で王座決定戦か,40,https://news.yahoo.co.jp/articles/70006489dcf340299cbb7ec27698fc550c047644,5/8(水) 22:58
2024-05-09,07:18,sports,スポーツ,29,THE DIGEST,「今永のほうが優れている」山本由伸、ド軍初の珍記録達成の裏で…アンチから皮肉の声止まず！「また初回に被弾したじゃないか」,40,https://news.yahoo.co.jp/articles/d13a0f2726d355baa839d1fa24ac5a9fffe17358,5/9(木) 5:40
2024-05-09,07:18,sports,スポーツ,30,CoCoKARAnext,阪神2カード連続負け越しで首位陥落危機　奮起が求められる「選手の名前」「危惧されていたポイント」,39,https://news.yahoo.co.jp/articles/a02079152bd7305d29b5469fcd179f070e924cc6,5/9(木) 6:31
2024-05-09,07:18,sports,スポーツ,31,GOAL,アンチェロッティが偉業！6度目のCL決勝進出は監督として史上初に…レアル・マドリーが劇的逆転でドルトムントとのファイナルへ,39,https://news.yahoo.co.jp/articles/d941733a2c24124d1da41927e65c38e5fcb13913,5/9(木) 6:24
2024-05-09,07:18,sports,スポーツ,32,TBS NEWS DIG Powered by JNN,【DeNA】ヤクルトに完敗 再び借金生活... 7試合ぶり1番の度会が痛恨落球 石田は初回に5安打3失点で初黒星 筒香3打数無安打2三振,39,https://news.yahoo.co.jp/articles/c360bcf298cb24a9a8ed8c65034acb3e2a06bbb0,5/8(水) 21:28
2024-05-09,07:18,sports,スポーツ,33,イーファイト,悪童レオ、BD出禁に！視聴者からクレーム相次ぎ、涙の謝罪,38,https://news.yahoo.co.jp/articles/aa12aa4b6180e83f2246fd71416e78e0219f894c,5/8(水) 20:50
2024-05-09,07:18,sports,スポーツ,34,文春オンライン,《ラブラブ動画入手》DeNAドラ1・度会隆輝（21）はやっぱり“橋本環奈似アイドル”と熱愛中だった！《ハグ、おんぶ、ディズニーデートも》《本人を直撃すると…》,36,https://news.yahoo.co.jp/articles/640b38b357d6b2510ff400f8771c2582f682cc36,5/8(水) 16:12
2024-05-09,07:18,sports,スポーツ,35,東スポWEB,【中日】６カード連続勝ち越しなしで借金２　立浪監督「クリーンアップが打たないと点が入らない形になっています」,36,https://news.yahoo.co.jp/articles/9552fce935d663f829b006242b879c768cda4e27,5/8(水) 22:16
2024-05-09,07:18,sports,スポーツ,36,サンケイスポーツ,阪神あぁ２連敗　大竹が６回１失点も打線は４安打,36,https://news.yahoo.co.jp/articles/2ed5fa9124c1799ca214a791ae486d0f405a5d71,5/8(水) 21:06
2024-05-09,07:18,sports,スポーツ,37,フットボールチャンネル,レアル・マドリードが試合終盤に劇的逆転勝利。途中出場の伏兵が2ゴールで決勝に導く【8日結果まとめ／欧州CL】,35,https://news.yahoo.co.jp/articles/fb8ed701968a8d88f739b0f798d04350e7a345c7,5/9(木) 6:11
2024-05-09,07:18,sports,スポーツ,38,スポニチアネックス,田淵幸一氏　DeNA・筒香の2三振に見えた「目切りの早さ」…本来の姿に戻るにはもう少し時間かかる,35,https://news.yahoo.co.jp/articles/23dcc575f0cfb852caa7b5d3e49e6f048797a174,5/9(木) 5:30
2024-05-09,07:18,sports,スポーツ,39,CoCoKARAnext,「イノウエは世界最高ではない」ネリ、完敗の井上尚弥に“未練” 米メディアでまさかの負け惜しみ「それほど強くなかった」,35,https://news.yahoo.co.jp/articles/08f0c92628318937d665e6d114a6af563004b87e,5/8(水) 16:00
2024-05-09,07:18,sports,スポーツ,40,スポーツ報知,【日本ハム】今季初同一カード３連敗　２回先頭安打から２４人連続アウトで３安打のみ　首位・ソフトバンクとは５・５差に,34,https://news.yahoo.co.jp/articles/36ddefdc142f55c13c4cdca4a965a002e031dcaa,5/8(水) 20:31
