scrp_date,scrp_time,genre_en,genre_jp,rank,media_jp,title,comment,link,date_original
2024-07-01,22:08,world,国際,1,CNN.co.jp,警官にレプリカ銃向けた１３歳少年を射殺　ＮＹ州,481,https://news.yahoo.co.jp/articles/d84a4df29bdf487c7b10ef1f8ea9991d48ee67d2,7/1(月) 17:37
2024-07-01,22:08,world,国際,2,BBC News,海上でボトル発見、中身飲んだ漁師4人死亡　スリランカ沖,227,https://news.yahoo.co.jp/articles/74e1463411fc63da5c45d90a447f8614adfe31f2,7/1(月) 17:04
2024-07-01,22:08,world,国際,3,TBS NEWS DIG Powered by JNN,北朝鮮が北東方向に弾道ミサイル発射　26日の弾道ミサイルは正常飛行せず、空中爆発か　韓国軍・合同参謀本部,55,https://news.yahoo.co.jp/articles/40b606b4c6f7466a38fd8243f3fa161eef5cdbf3,7/1(月) 5:24
2024-07-01,22:08,world,国際,4,産経新聞,フィリピンの女性市長に「中国のスパイ」疑惑　指紋で別人と判明、中国人の可能性が高く,51,https://news.yahoo.co.jp/articles/55abc54f9fbcff87b2fb1eff7d5e1dba2565bda0,7/1(月) 15:11
2024-07-01,22:08,world,国際,5,中央日報日本語版,「プーチン氏、ヒトラーと同じ難関に…今年末から『力の均衡』が変わるだろう」,49,https://news.yahoo.co.jp/articles/60324fecc9abb121b49421cfc8c6cfea8c6e6c8b,7/1(月) 13:05
2024-07-01,22:08,world,国際,6,共同通信,ミャンマー、邦人拘束と発表　イオン関係者、コメ販売で,40,https://news.yahoo.co.jp/articles/b171a19dae1ded731237aef42805740496038fa9,7/1(月) 4:35
2024-07-01,22:08,world,国際,7,中央日報日本語版,「韓国、佐渡金山朝鮮人慰霊施設など要求…日本、保守派のせいで苦心」,38,https://news.yahoo.co.jp/articles/ea9eb40a4620946438c4566d0e51b5595fb0d117,7/1(月) 9:46
2024-07-01,22:08,world,国際,8,CNN.co.jp,米大統領一家、バイデン氏の選挙戦継続促す　側近の更迭も検討,38,https://news.yahoo.co.jp/articles/53fedbdc694a6b7427118a7d010b672770d2af4b,7/1(月) 13:49
2024-07-01,22:08,world,国際,9,毎日新聞,「LINE奪うのか」　行政指導受け、韓国反発　不買運動には至らず,37,https://news.yahoo.co.jp/articles/153268bf66d00355c0af1397bd1cf8633810943d,7/1(月) 18:17
2024-07-01,22:08,world,国際,10,KOREA WAVE,「韓流グループに東京ドームは歓喜に満ちていた」…韓国メディアが伝えた「日本各紙の異例の大きな扱い」,37,https://news.yahoo.co.jp/articles/2543607126819c1dfd9908b1563f8c4022c6645e,7/1(月) 20:51
2024-07-01,22:08,world,国際,11,クーリエ・ジャポン,「私の親はこの街の役人だぞ！」と店員に怒鳴りつづける迷惑客　店員2人が平謝りするも周囲がドン引きする声量で怒り散らす,31,https://news.yahoo.co.jp/articles/4f39cec83e5f1d11a187ad2b7b8f26409f2f7e8f,7/1(月) 19:37
2024-07-01,22:08,world,国際,12,ロイター,ロシア、ベラルーシの報告を懸念　ウクライナが国境で兵力増強,29,https://news.yahoo.co.jp/articles/486957e6a329eed27f00f893c5ef579deb9f9001,7/1(月) 20:36
2024-07-01,22:08,world,国際,13,産経新聞,河野洋平元衆院議長が中国に「人的交流」呼び掛け　訪中団が習氏懐刀の何立峰副首相と会談,27,https://news.yahoo.co.jp/articles/7f5828563f7ef9c6a8815b99e6e57e69da5afe5b,7/1(月) 21:10
2024-07-01,22:08,world,国際,14,ロイター,バイデン氏交代論、米民主幹部ら否定　大統領選撤退求める声,27,https://news.yahoo.co.jp/articles/b6f0d3b8c87382756bf0e9132ac26e9f260932f7,7/1(月) 7:53
2024-07-01,22:08,world,国際,15,時事通信,与党と左派、候補一本化へ　「極右内閣」誕生阻止で　仏総選挙,24,https://news.yahoo.co.jp/articles/fe187019a47dabd3b6f4f8bbd593287069d21be3,7/1(月) 20:46
2024-07-01,22:08,world,国際,16,東方新報,中国旅行社の訪日ビザ申請権取り消し、靖国神社事件との関連は,24,https://news.yahoo.co.jp/articles/9376e8e07e2d8bb5bd21a9aa7f1f49d2e3a1ee3d,7/1(月) 18:16
2024-07-01,22:08,world,国際,17,ダイヤモンド・オンライン,中国・日本人学校のバス襲撃、事件後に削除された「反日動画」…中国人が「日本人学校バッシング」に走るおぞましい理由,22,https://news.yahoo.co.jp/articles/034b8aaccf469d3082140bf2a7a48cfdefb85c03,7/1(月) 6:32
2024-07-01,22:08,world,国際,18,FNNプライムオンライン（フジテレビ系）,「朝鮮中央テレビ」が韓国の一部地域で観れない状態に　衛星が“ロシア製”に切り替えられたことが原因か,20,https://news.yahoo.co.jp/articles/409b1db45acef22f30279012f2c25abd96b3b762,7/1(月) 20:39
2024-07-01,22:08,world,国際,19,夕刊フジ,中国人の〝蛮行〟叩けない卑屈な韓国のマスコミ　済州島、ゴミ放置の団体客を非難せず…むしろコンビニ側を批判,19,https://news.yahoo.co.jp/articles/5d3eb5189a0529b6eaded8c8e58ef558d36b60aa,7/1(月) 17:00
2024-07-01,22:08,world,国際,20,中央日報日本語版,日本の新紙幣に韓国経済侵奪の渋沢栄一で波紋…「歴史修正小細工」,15,https://news.yahoo.co.jp/articles/c5d23c976867e9c8cb74883155291b668139d07a,7/1(月) 9:41
2024-07-01,22:08,world,国際,21,FNNプライムオンライン（フジテレビ系）,【ずさん】エンジン燃焼テストのはずが予期せずロケット発射され…空中で傾き横向きに落下し地上で大爆発　中国,14,https://news.yahoo.co.jp/articles/2089d23c350d84724c77854d4b0ada0675c41ce1,7/1(月) 19:33
2024-07-01,22:08,world,国際,22,読売新聞オンライン,ロシア寄りのハンガリーがＥＵ議長国に…政策議論で主導的役割、欧州議会は信頼性を疑問視,14,https://news.yahoo.co.jp/articles/1b428b11c8ee09ba008cb6275b0ff8501024c440,7/1(月) 20:55
2024-07-01,22:08,world,国際,23,FNNプライムオンライン,「老齢化した大統領を見捨てる」イギリスメディアが“予言”　テレビ討論会で“失態”のバイデン氏に撤退求める声相次ぐ,14,https://news.yahoo.co.jp/articles/475535b09a5e804ffaf3b0bbf6b13aeefb729ff7,7/1(月) 16:32
2024-07-01,22:08,world,国際,24,共同通信,中国IT企業、反日感情あおる投稿規制,13,https://news.yahoo.co.jp/articles/70ab539118a8ac789ab08c3828d12ae28e0d31a7,7/1(月) 20:51
2024-07-01,22:08,world,国際,25,ニューズウィーク日本版,5つの独立運動に包囲された中国に「スイスモデル」という解決策,13,https://news.yahoo.co.jp/articles/958c0e6df1c86ba2f68f7a0d611081ad846a37a8,7/1(月) 17:50
2024-07-01,22:08,world,国際,26,毎日新聞,「バイデン氏は出馬すべきでない」が7割　討論会後の米世論調査,13,https://news.yahoo.co.jp/articles/9275f7000b4d852659e042a2bc7c5a8cc70de95d,7/1(月) 13:16
2024-07-01,22:08,world,国際,27,Forbes JAPAN,米最高裁、ホームレスの「野外での寝泊まり禁止」を容認,13,https://news.yahoo.co.jp/articles/7a6ab833d1c9a3277d3e8e754fa7a5b0d4cf1ef5,7/1(月) 17:30
2024-07-01,22:08,world,国際,28,産経新聞,暴漢から邦人守って死亡の中国人女性　胡友平さんに敬意と哀悼の表明広がる　与野党議員,12,https://news.yahoo.co.jp/articles/81673fc558a902ce721f750152467cdfe8d22178,7/1(月) 19:14
2024-07-01,22:08,world,国際,29,日テレNEWS NNN,北朝鮮、短距離弾道ミサイルなど2発相次ぎ発射　韓国軍発表,12,https://news.yahoo.co.jp/articles/94fdebd5c0a4857f896bb1ebf572fdadbbd59bb3,7/1(月) 7:27
2024-07-01,22:08,world,国際,30,テレビ朝日系（ANN）,交代論くすぶるも…バイデン氏の家族が選挙戦の継続促す,11,https://news.yahoo.co.jp/articles/0400a8b68026199dd4cf27f6ffbef750c14a9114,7/1(月) 10:22
2024-07-01,22:08,world,国際,31,TBS NEWS DIG Powered by JNN,中国の民間ロケットが山中に墜落,11,https://news.yahoo.co.jp/articles/8d5174226fec21f5d442db4af575368ad37250c9,7/1(月) 10:30
2024-07-01,22:08,world,国際,32,読売新聞オンライン,衰え目立つバイデン氏に、大統領選からの撤退求める声…指名辞退なら民主党内の分裂招く恐れ,11,https://news.yahoo.co.jp/articles/42c48e3c4c9a35712c21a6324e739a977919bdd2,7/1(月) 18:04
2024-07-01,22:08,world,国際,33,TBS NEWS DIG Powered by JNN,中国でスパイ取締り新規定施行　個人の携帯電話やパソコンの検査が可能に,11,https://news.yahoo.co.jp/articles/7b7e945e67af1af476b730e7d22e5345aaf76d06,7/1(月) 10:53
2024-07-01,22:08,world,国際,34,文春オンライン,スタバに行く＝「見せびらかしたい」？　フラペチーノや“Macポチポチ問題”がコーヒーよりも話題になるワケ,11,https://news.yahoo.co.jp/articles/ab16c39496a7c0c378449f948b46e1626761cb03,7/1(月) 11:12
2024-07-01,22:08,world,国際,35,時事通信,中ロ首脳、ウクライナ情勢巡り会談へ　前のめりのプーチン氏　上海協力機構首脳会議が3日開幕,10,https://news.yahoo.co.jp/articles/b7bcd20aac7daf30f3837ae58a70300287f252ba,7/1(月) 20:47
2024-07-01,22:08,world,国際,36,TBS NEWS DIG Powered by JNN,中国IT大手らが続々と「中日対立」引き起こす投稿規制　蘇州日本人学校バス襲撃受け,10,https://news.yahoo.co.jp/articles/79cbf2300b76f6a1ad602059df30f7d7ba6f7956,7/1(月) 1:46
2024-07-01,22:08,world,国際,37,TBS NEWS DIG Powered by JNN,中国「嘘や偽情報ばかり」と反発　アメリカの“信教の自由に関する報告書で中国非難”に,10,https://news.yahoo.co.jp/articles/bd4a9c4f9530d5ae731cc325bdc52551bcc3af0e,7/1(月) 17:44
2024-07-01,22:08,world,国際,38,KOREA WAVE,スリ目的で韓国入り、3人で役割分担…ロシア人グループに実刑判決,10,https://news.yahoo.co.jp/articles/ce686cb28e62ac4d73c166c558c35a63ceaa3774,7/1(月) 19:03
2024-07-01,22:08,world,国際,39,共同通信,「北朝鮮が弾道ミサイル発射」と韓国軍,10,https://news.yahoo.co.jp/articles/3336dd4514a2179c750ce955292357797c51a6f1,7/1(月) 5:25
2024-07-01,22:08,world,国際,40,FNNプライムオンライン（フジテレビ系）,【速報】北朝鮮が弾道ミサイル発射と韓国軍が発表…詳細分析中　アメリカの原子力空母韓国入港に反発か,10,https://news.yahoo.co.jp/articles/0515fe3b1a1f1206467065f3544ce6ed111a31dd,7/1(月) 6:02
