scrp_date,scrp_time,genre_en,genre_jp,rank,media_jp,title,comment,link,date_original
2025-10-28,00:08,TTL,総合,1,日刊スポーツ,共産党志位議長、高市氏に強い憤り表明「こんな人物に唯一の戦争被爆国の首相を担う資格はない」,597,https://news.yahoo.co.jp/articles/1c93372adc6122867e62edcca345e0012cd0cdaf,10/27(月) 13:44
2025-10-28,00:08,TTL,総合,2,秋田朝日放送,クマ被害多発で自衛隊派遣を要請へ　秋田県・鈴木知事「もう限界を超えている」　２８日に防衛大臣を訪問,320,https://news.yahoo.co.jp/articles/30517a65db05115a578bf740f2e776a15eb03d40,10/27(月) 18:57
2025-10-28,00:08,TTL,総合,3,読売新聞オンライン,「自衛隊法でクマの銃駆除は困難」と箱わな運搬など支援要請、秋田県知事が小泉防衛相と面会へ,317,https://news.yahoo.co.jp/articles/ccff2560d86d44a333576527386142e7e96d1879,10/27(月) 20:55
2025-10-28,00:08,TTL,総合,4,デイリースポーツ,国民・玉木代表　臨時国会での高市首相への代表質問「募集！」「参考にします」ＳＮＳで呼びかけ,303,https://news.yahoo.co.jp/articles/5f84fba2a3dcb9ec89746d46d2a0161e8a1a3ea3,10/27(月) 20:37
2025-10-28,00:08,TTL,総合,5,オリコン,マクドナルド、紙ストロー終了へ　11・19より「ストローなし」のフタに変更、開発に3年以上,297,https://news.yahoo.co.jp/articles/0cdbafc3dcf04a1d9ad04608b46970b341bbb30f,10/27(月) 14:09
2025-10-28,00:08,TTL,総合,6,岩手めんこいテレビ,【速報】クマに襲われたか　住宅敷地内に身元不明の遺体発見　遺体に獣による爪跡、遺体の近くに死んだ飼い犬　クマ1頭を駆除＜情報更新＞　岩手県一関市,293,https://news.yahoo.co.jp/articles/75c6b7858b60d13eb590e42c78b5ef85f1380169,10/27(月) 12:36
2025-10-28,00:08,TTL,総合,7,毎日新聞,「クマなんか見たことない集落で…」　各地で人的被害か　4人死傷,292,https://news.yahoo.co.jp/articles/038e0f0330071bc52a376939f3e4c7951d514931,10/27(月) 20:08
2025-10-28,00:08,TTL,総合,8,中日スポーツ,鈴木憲和・農相、朝の生放送で”無双状態”に「すげぇ」「玉川さん達言い返せないｗ」ネット沸く,277,https://news.yahoo.co.jp/articles/19bbefbb37da0bf539356846fcf89c3dc205dedd,10/27(月) 13:01
2025-10-28,00:08,TTL,総合,9,毎日新聞,バイクと小型犬が交差点で接触事故　飼い主と運転手の双方に賠償命令,252,https://news.yahoo.co.jp/articles/4a11ba3dbcb8178777eb4b53ee627b4526626c42,10/27(月) 20:58
2025-10-28,00:08,TTL,総合,10,秋田朝日放送,【速報】秋田市雄和の側溝で損傷の激しい女性の遺体見つかる　近くではクマの目撃情報が,252,https://news.yahoo.co.jp/articles/746501b1f67df5d3d66b2a279296a964c7090d03,10/27(月) 15:46
2025-10-28,00:08,TTL,総合,11,女性自身,「国籍だけ持ってても…」参政党・神谷代表　『TVタックル』で「日本人の定義」を激論…一部から“曖昧”と疑問の声,234,https://news.yahoo.co.jp/articles/747417e699064cbae1bb0809ff47c9023c7c68f8,10/27(月) 17:50
2025-10-28,00:08,TTL,総合,12,TBS NEWS DIG Powered by JNN,【速報】天皇陛下とトランプ大統領が皇居・御所で面会　6年ぶり　英語で挨拶交わし再会を喜ぶ　周辺は大規模警備,232,https://news.yahoo.co.jp/articles/48901f8312c5fce1da9a67b676965f4a9ebc8eae,10/27(月) 18:32
2025-10-28,00:08,TTL,総合,13,スポニチアネックス,橋下徹氏　クマ被害相次ぐ秋田県への自衛隊派遣に反対　“災害、国防が一番”「綺麗事かも分からないけど」,222,https://news.yahoo.co.jp/articles/743189221a7b77df3f3931902de81ab4c86bc744,10/27(月) 17:38
2025-10-28,00:08,TTL,総合,14,日テレNEWS NNN,【独自】クマ対策での自衛隊派遣　秋田県知事の要請あれば防衛省は派遣の方向で調整,215,https://news.yahoo.co.jp/articles/14b238604cc4ed88d5784a0ee6c3e58f91c56d06,10/27(月) 10:14
2025-10-28,00:08,TTL,総合,15,岩手めんこいテレビ,人に向かってきたクマ1頭を駆除　住宅敷地内にクマに襲われたとみられる身元不明の遺体発見　遺体の近くに死んだ飼い犬　岩手県一関市,210,https://news.yahoo.co.jp/articles/dfc3b4634e7022489f60973c63415233ec280520,10/27(月) 14:53
2025-10-28,00:08,TTL,総合,16,産経新聞,国民民主と参政が失速…高市政権誕生で保守層離れたか　産経FNN世論調査,169,https://news.yahoo.co.jp/articles/b6392d111be6e8436789aaa7b3312a7452dbedb6,10/27(月) 21:05
2025-10-28,00:08,TTL,総合,17,FNNプライムオンライン（フジテレビ系）,マクドナルドが「紙ストロー」廃止へ…11月19日からストロー不要の“新型フタ”導入　テイクアウト時にも漏れや吹きこぼれないような作りに,166,https://news.yahoo.co.jp/articles/a9efe7642b7b7456887159a49fa33afcad42069c,10/27(月) 17:27
2025-10-28,00:08,TTL,総合,18,時事通信,「さらに上がる」期待の声　一時的上昇に警戒も　株価5万円突破・東京,159,https://news.yahoo.co.jp/articles/9eb15371f90ec6c59d29d7807b3b62aba2545c20,10/27(月) 17:09
2025-10-28,00:08,TTL,総合,19,J-CASTニュース,国会ヤジ騒動渦中の立憲・岡田悟議員、吉村知事に「ら抜き言葉」指摘→SNS批判殺到　「低レベル」「バカバカし過ぎる」,155,https://news.yahoo.co.jp/articles/f7af486af8eb8a6cc61eb337a9cc242457fe1b3e,10/27(月) 12:58
2025-10-28,00:08,TTL,総合,20,中日スポーツ,倉田真由美さん、『クマ』駆除への抗議に「生かしてどうするというのか」「責任持って『自分が飼う』というなら分かるが…」「被害者の方々に失礼」,153,https://news.yahoo.co.jp/articles/7cc3635d0c3c7790498b29508de284774ec40add,10/27(月) 22:07
2025-10-28,00:08,TTL,総合,21,共同通信,石破茂前首相、早期解散「痛恨」　退任後初の地元鳥取入りで謝意,142,https://news.yahoo.co.jp/articles/f8b66c61a2268427a894b73924ac439300d47abc,10/27(月) 11:05
2025-10-28,00:08,TTL,総合,22,スポーツ報知,玉川徹氏、若い層の高市内閣への高支持率に警鐘「良く変わらなければ意味がないんだよってことも言っておきたい」,137,https://news.yahoo.co.jp/articles/b5fbb0a5930104ccded8058bfae4e003be40d91e,10/27(月) 8:44
2025-10-28,00:08,TTL,総合,23,日本農業新聞,中国は日本の30倍…シャインマスカット流出拡大　ライセンス許諾も「効果は未知数」の声,133,https://news.yahoo.co.jp/articles/38535046b7893a15f9ba005a175c043f2f89a6f7,10/27(月) 7:30
2025-10-28,00:08,TTL,総合,24,日刊スポーツ,日テレ社長、国分太一側の対応に会見で言及「現在のままでは対話に応じることは難しい」,132,https://news.yahoo.co.jp/articles/a60d77d9d8e1e9c5e86ac49acdb5a87e8f949397,10/27(月) 15:01
2025-10-28,00:08,TTL,総合,25,TBS NEWS DIG Powered by JNN,【速報】日経平均 史上初めて5万円を突破 一時1100円以上値上がり　高市総理の政策への期待など追い風に,129,https://news.yahoo.co.jp/articles/29c63f3c85c9014d2d1ea6a6620a673c8cc27981,10/27(月) 9:03
2025-10-28,00:08,TTL,総合,26,テレビ朝日系（ANN）,【速報】トランプ大統領が来日　第2次政権では初、6年4カ月ぶり,126,https://news.yahoo.co.jp/articles/008ab3776b06ad461ccb97aa72700f60aa95833d,10/27(月) 17:02
2025-10-28,00:08,TTL,総合,27,テレビ静岡NEWS,石破前首相「政治家はウケることばかりやると国は滅びる」　自衛官の国会答弁は必要と改めて主張　安全保障と防衛技術をテーマに講演,124,https://news.yahoo.co.jp/articles/f3b52cc76fb6439edc394757c80bf8278ed19ee8,10/27(月) 5:00
2025-10-28,00:08,TTL,総合,28,日刊スポーツ,橋下徹氏「幼稚園なの？　頭悪いんじゃないの？」首相所信表明演説での立憲民主党のヤジを酷評,123,https://news.yahoo.co.jp/articles/ce427a4862c6ac9dbf3719970e6334dc3ac18c89,10/27(月) 17:26
2025-10-28,00:08,TTL,総合,29,All About,最近見かけない「2000円札」が12万円に大化け！今後“持っているだけ”で価値が上がりそうな紙幣とは!?,121,https://news.yahoo.co.jp/articles/3296364fe145eb4ceedc9062e7cb87a4725a6b60,10/27(月) 21:50
2025-10-28,00:08,TTL,総合,30,日刊スポーツ,鈴木憲和農相「総理が4000円台であってはならないと発言すべきではない」石破茂前首相に反論,117,https://news.yahoo.co.jp/articles/57117603bc855f1d3a5275a3778715f630908284,10/27(月) 12:51
2025-10-28,00:08,TTL,総合,31,週刊SPA!,ラオスで横行する「日本人による児童買春」の実態。恐怖で泣き叫ぶ10歳の少女に“500ドルを払い行為を強行”30代男性の鬼畜ぶり,117,https://news.yahoo.co.jp/articles/9dff63bb323e7a32b29157cea19e2a2ea0f78089,10/27(月) 15:53
2025-10-28,00:08,TTL,総合,32,日刊スポーツ,三原じゅん子氏が週刊誌報道に不快感「学歴ハラスメント。私への侮辱と受け止めました」,117,https://news.yahoo.co.jp/articles/ced0a5c9f04dfe4c3154123462cfa9001c5226de,10/27(月) 11:43
2025-10-28,00:08,TTL,総合,33,デイリースポーツ,橋下徹氏　国会ヤジに「頭悪いんじゃないの？」「幼稚園なの？」「立憲も体質変えないと」安住幹事長、Ｘ投稿波紋の小西議員に「意識変えないと」,116,https://news.yahoo.co.jp/articles/258f2edecc7949bce2efc97736398be30a31291a,10/27(月) 14:50
2025-10-28,00:08,TTL,総合,34,スポニチアネックス,「沢村賞」に日本ハム・伊藤大海！　選考基準クリアは3項目も投球回など5部門で両リーグトップを評価,114,https://news.yahoo.co.jp/articles/c3644e47c7ca9af8e0c906891ac1e1b2e3f9f56c,10/27(月) 17:00
2025-10-28,00:08,TTL,総合,35,時事通信,国会前で大量のビール瓶散乱　荷崩れか、米大統領警戒中　警視庁,111,https://news.yahoo.co.jp/articles/03b15914a9e410c78a035f70ee80d4b25947bb53,10/27(月) 22:33
2025-10-28,00:08,TTL,総合,36,スポニチアネックス,日テレ　「DOWNTOWN＋」への協力を発表「“ガキ使”のコンテンツ提供」　松本人志の地上波復帰は…,111,https://news.yahoo.co.jp/articles/37312b4e4bd6fe4837922891dbc74eaa2f4404a9,10/27(月) 15:00
2025-10-28,00:08,TTL,総合,37,共同通信,JR東日本、地方36路線で赤字　24年度、総額790億円,110,https://news.yahoo.co.jp/articles/10c0379ee32947bef9843aa8680c433da68937f8,10/27(月) 16:16
2025-10-28,00:08,TTL,総合,38,読売新聞オンライン,旧統一教会、元信者３９人に解決金１２億８９００万円…集団調停で２例目の成立,108,https://news.yahoo.co.jp/articles/2509732a99b15a095dc3e384cfe6535ba3190c43,10/27(月) 18:32
2025-10-28,00:08,TTL,総合,39,ABEMA TIMES,参政・神谷代表「日本の国旗に対して“×”をつけたり街頭演説の妨害をしてくる人たちがいた。それは国家に対する冒涜になる」国旗損壊に関する法案提出,104,https://news.yahoo.co.jp/articles/61b7a75fdb9e73fff29889e6c76de017b75c4ca9,10/27(月) 19:18
2025-10-28,00:08,TTL,総合,40,静岡放送（SBS）,「国のリーダーとして逆行するような発言」高市総理の“労働時間規制緩和”に連合静岡会長が疑問呈す,102,https://news.yahoo.co.jp/articles/494b70f923901f0aa6cb9eae06e6e7fea22dbcca,10/27(月) 14:50
