scrp_date,scrp_time,genre_en,genre_jp,rank,media_jp,title,comment,link,date_original
2025-06-25,13:15,business,経済,1,東洋経済オンライン,【限界の自販機】「コカ・コーラ」200円時代突入へ、今秋値上げで赤字自販機は2〜3割に激増も。サントリーやダイドーも苦戦で、連携の動きは加速か,320,https://news.yahoo.co.jp/articles/d95ca8996b7dfcb87bcdf4bb754d5130400a5e54,6/25(水) 6:02
2025-06-25,13:15,business,経済,2,TBS NEWS DIG Powered by JNN,「役員報酬が高すぎる」巨額の赤字に陥った日産自動車の株主総会で怒号　3時間にもおよぶ総会の内容,223,https://news.yahoo.co.jp/articles/d9dbbeb84941cba9cae9a4666c06a735d544a7de,6/24(火) 16:56
2025-06-25,13:15,business,経済,3,共同通信,フジテレビ親会社株主総会で謝罪　「性暴力」で経営混乱,112,https://news.yahoo.co.jp/articles/270b911a5b72615a573ec995750a41584883203a,6/25(水) 10:38
2025-06-25,13:15,business,経済,4,週刊SPA!,「子供に食べさせるため自分は一日1食だけ」家族旅行は深夜バスで…38歳シングルマザー、年収500万円でも厳しい生活,107,https://news.yahoo.co.jp/articles/678500ebca77759cfc5020329598055d5b4a3e8b,6/25(水) 8:54
2025-06-25,13:15,business,経済,5,帝国データバンク,有名プロデューサー中村喜伸氏が代表、アンビエントが破産,74,https://news.yahoo.co.jp/articles/18112bc6f9b18dbd3905aba4a214c27b28a1da17,6/25(水) 10:09
2025-06-25,13:15,business,経済,6,みんかぶマガジン,リニア計画を10年も停滞させた川勝前静岡県知事の難クセ「大井川の水問題」はやっぱり難クセだった,66,https://news.yahoo.co.jp/articles/1cc57383b1038f8d22f68e56ebac531faeb172a5,6/25(水) 9:10
2025-06-25,13:15,business,経済,7,JBpress,消費税減税・現金給付・基礎年金底上げ…超長期金利の急上昇で先送り、財政リスク要因の増加が止まらない,44,https://news.yahoo.co.jp/articles/9843c1f7b6c5c8089b10bcbce6ccf31fc71c4087,6/25(水) 11:21
2025-06-25,13:15,business,経済,8,食品新聞,蛇口をひねると「カルピス」　アサヒ飲料が新ビジネスを構想　飲み物の価値を引き上げる良質な原体験と新たな接点の創出が狙い,44,https://news.yahoo.co.jp/articles/840339c3b4570a06bc4a8357d76486e3bcbe02a9,6/24(火) 14:36
2025-06-25,13:15,business,経済,9,プレジデントオンライン,そりゃボーナスが減るわ…同じ人件費で「新卒初任給アップ」のため中堅の年収50万円ダウンという理不尽,40,https://news.yahoo.co.jp/articles/6c938b031a9eeb71dd9522a99408f812442b4a7e,6/25(水) 7:17
2025-06-25,13:15,business,経済,10,日テレNEWS NNN,今夏は「うなぎ」がお得に　1000円台も続々　シラスウナギ豊漁で,37,https://news.yahoo.co.jp/articles/1e09880d25ee1603d10c6cc2de660a3454c113ef,6/24(火) 20:59
2025-06-25,13:15,business,経済,11,集英社オンライン,ついに始まった地獄の倒産連鎖…名物投資家が警鐘「勝ち組２割」「負け組８割」にくっきり分かれた日本,35,https://news.yahoo.co.jp/articles/28defdf255f5cdc434f218c873cdca63e73b6740,6/25(水) 11:02
2025-06-25,13:15,business,経済,12,週プレNEWS,世界でハイブリッドが売れに売れているが、日本勢では三菱が先行......トヨタの「PHEV」がパッとしないのはなぜ？,33,https://news.yahoo.co.jp/articles/c64f6e363223140f09b4375cd76ef1319a1a6983,6/25(水) 11:30
2025-06-25,13:15,business,経済,13,ダイヤモンド・オンライン,吉野家と松屋、店内を見れば一発でわかる「大きな違い」,32,https://news.yahoo.co.jp/articles/360f06ee0cc09b1760c7f669cda1b4cb8317cd0e,6/25(水) 11:06
2025-06-25,13:15,business,経済,14,文春オンライン,「ジョナサン」「ガスト」が減る一方、謎の“香港式ファミレス”が登場…ファミレス業界に起きている「世代交代」の真相,27,https://news.yahoo.co.jp/articles/72b72ea36078fc7c4523be32d9e181453b1b55de,6/25(水) 6:22
2025-06-25,13:15,business,経済,15,週刊SPA!,「黒字なのにリストラ」する企業が急増中の理由。誰もに迫る“クビ”の恐怖,27,https://news.yahoo.co.jp/articles/6dbe5257210fc21dd870ac3cb3c897e447f5870d,6/25(水) 8:53
2025-06-25,13:15,business,経済,16,ファイナンシャルフィールド,「オイル交換は半年に1回」整備士に“言われるがまま”払ってたけど、「年間1万円」はコストがかかる…頻度を減らしても問題ない？ ディーラー・ガソリンスタンドなどの「交換費用」も確認,26,https://news.yahoo.co.jp/articles/829bd3a3212fea15c0d20d01bd84c61f7984475a,6/24(火) 13:40
2025-06-25,13:15,business,経済,17,ITmedia ビジネスオンライン,国分太一さん降板で“語らぬ会見”　日テレの判断は「正解」か「裏目」か,25,https://news.yahoo.co.jp/articles/5c2cf37936ea8041d495b48a058db1edf2183245,6/25(水) 9:51
2025-06-25,13:15,business,経済,18,プレジデントオンライン,どんなに優秀でもAI先生には絶対にできないことがある…これから淘汰される教師、生き残る教師の決定的違い,25,https://news.yahoo.co.jp/articles/32888846c63dbd1280c25813c27bda8359ff1e36,6/25(水) 11:17
2025-06-25,13:15,business,経済,19,THE GOLD ONLINE（ゴールドオンライン）,"俺の人生は失敗だったのか…住宅ローン完済・資産4,000万円・年金30万円の67歳・元大手企業会社員。「誰もが羨む老後」のはずが、〈嫉妬〉と〈虚無感〉に蝕まれたワケ【CFPの助言】",24,https://news.yahoo.co.jp/articles/608e69ec8cf0a67634b3db20cf72d342f004921c,6/25(水) 10:02
2025-06-25,13:15,business,経済,20,TBS NEWS DIG Powered by JNN,「不適切点呼」問題で揺れる日本郵便　親会社の株主総会で社長が陳謝　株主から「法令順守の意識が欠けている」などの厳しい意見相次ぐ,22,https://news.yahoo.co.jp/articles/29977f5baa26e38e838ffd727deb30d61c87e09e,6/25(水) 11:57
2025-06-25,13:15,business,経済,21,ベストカーWeb,いまはもう必要がない…それでも語り継ぎたい「いにしえの運転術」たち,21,https://news.yahoo.co.jp/articles/4f438a7087d5e8cc3087ae6adfa34356b33eaf8c,6/25(水) 12:00
2025-06-25,13:15,business,経済,22,共同通信,中国首相、自由貿易擁護訴え,17,https://news.yahoo.co.jp/articles/f251d69aebee85288d36b9c480b9ecde647d2037,6/25(水) 12:12
2025-06-25,13:15,business,経済,23,くるまのニュース,不正改造車「43台」に「ただちにクルマを直しなさい！」国交省ブチギレ！ 「大黒PA」集結の“大迷惑”「爆音マフラー」「シャコタン」スポーツカーを“一斉摘発”！ 取締り実施,17,https://news.yahoo.co.jp/articles/090c5f20efcae69e6c24316c0aadec2e6a6103ac,6/25(水) 7:20
2025-06-25,13:15,business,経済,24,LIMO,シニア世代、みんな何歳まで働きたい？【65歳から】厚生年金・国民年金だけの生活は難しいのか。ひと月の支出はいくら？,16,https://news.yahoo.co.jp/articles/36bde805b8b8689ffa25d874fbada2a36001ea59,6/25(水) 11:37
2025-06-25,13:15,business,経済,25,ダイヤモンド・オンライン,「こりゃ本気かも…」西武トップが「新宿線と東西線の直通運転」に“前のめり発言”した事情,16,https://news.yahoo.co.jp/articles/29cea3ffe741a611efc78ccde6422b89a8c6ea22,6/25(水) 4:02
2025-06-25,13:15,business,経済,26,MotorFan,クラウンスポーツとホンダZR-Vを比較！約150万円の価格差をどう考えるか？使い勝手は同じ？内装は？,15,https://news.yahoo.co.jp/articles/32e2895632b4a87b7c1ea7baf82f5acc30fd592d,6/25(水) 7:00
2025-06-25,13:15,business,経済,27,東洋経済オンライン,朝日新聞トップが語った「反省」と「未来」…“朝日新聞らしさ”をどう再定義するのか　「これまで記者の主張が入り込んで失敗してきた」,15,https://news.yahoo.co.jp/articles/6c64ab148deada39c3e9f6e778b31d8993aac3cd,6/25(水) 6:02
2025-06-25,13:15,business,経済,28,東洋経済オンライン,新自由主義を推し進めていれば、日本は失われた30年を回避できたのか。それは最善の経済体制か、それとも問題だらけのしくみか,15,https://news.yahoo.co.jp/articles/90620dd884b818b4bc5e0344a7d3b79466895e3e,6/25(水) 10:32
2025-06-25,13:15,business,経済,29,共同通信,日本郵政の増田社長、不祥事陳謝　株主総会「極めて深刻な事態」,14,https://news.yahoo.co.jp/articles/15b470bae9179e4fbc9f7d0b11d3a5a3b9b80beb,6/25(水) 12:13
2025-06-25,13:15,business,経済,30,MotorFan,スバルS210のCVTはMT派も納得!?  S210とWRX S4を乗り比べ！さらに元祖STIコンプリートカーのレガシィRSタイプRAとも比べてみた,14,https://news.yahoo.co.jp/articles/b16a1bbebf640b5af1f7db16f0dec04cf8f49c55,6/25(水) 12:15
2025-06-25,13:15,business,経済,31,THE GOLD ONLINE（ゴールドオンライン）,"遺されたのは〈タンス預金78万円〉と〈遺族年金月9万6,000円〉のみ…口数は少ないが、情の深い夫が隠した「やるせない事実」に67歳妻、昏倒【FPの助言】",14,https://news.yahoo.co.jp/articles/2b06ec1d306a124458bc9e0949c2c57671ec50b4,6/25(水) 10:32
2025-06-25,13:15,business,経済,32,Car Watch,日産、新型「パトロール NISMO」世界初公開 史上最高出力495HPのV6ツインターボエンジン搭載,14,https://news.yahoo.co.jp/articles/b51feb881a8e89b97d85919ad87012a11e4850c8,6/25(水) 10:00
2025-06-25,13:15,business,経済,33,毎日新聞,25日にフジHD株主総会　ダルトン含めた取締役人事案に注目,13,https://news.yahoo.co.jp/articles/4811d3fa206d6a83e338999eb38f409372d4b6e8,6/25(水) 0:00
2025-06-25,13:15,business,経済,34,TBS NEWS DIG Powered by JNN,賞味期限4か月「ロングライフ牛乳」本格発売　森永乳業　背景に人手不足 海外輸出も視野,13,https://news.yahoo.co.jp/articles/234ce496007d211df9b7e3663e4f27191c565191,6/24(火) 18:19
2025-06-25,13:15,business,経済,35,毎日新聞,＜1分で解説＞日産自動車株主総会　赤字は?　退任役員報酬に批判集中,12,https://news.yahoo.co.jp/articles/18bfccdd2de604772fa74867274c954aa58ff353,6/25(水) 10:29
2025-06-25,13:15,business,経済,36,ベストカーWeb,日産 レパードJ.フェリーは伝統や威厳を主張した車種と一線を画す新高級パーソナルセダン! こんなクルマよく売ったな!! 【愛すべき日本の珍車と珍技術】,12,https://news.yahoo.co.jp/articles/9a66881554c37195a5fb906e7cde88b256655be5,6/24(火) 21:00
2025-06-25,13:15,business,経済,37,FNNプライムオンライン（フジテレビ系）,在宅・不在にかかわらず宅配は「置き配」を標準に…国交省が新ルール検討　手渡しには追加料金かかる仕組みも　宅配ボックス市場も活発,12,https://news.yahoo.co.jp/articles/72b75bab6b782d0ec6437e9d972586ff7977608d,6/24(火) 18:40
2025-06-25,13:15,business,経済,38,J-CASTニュース,農家の倉庫から米袋を次々に積み込んで去っていく男たち　南魚沼「コシヒカリ」生産地で1年前に起きたこと,11,https://news.yahoo.co.jp/articles/cfe875edd7bd280e5ca03f1f80034d446475bd73,6/25(水) 12:10
2025-06-25,13:15,business,経済,39,東洋経済オンライン,外資コンサルや5大商社への就職が多い大学は？ 2025年最新版「難関業種に強い大学」ランキング①,11,https://news.yahoo.co.jp/articles/7789462d2b424656a64f59a512e1f63b7dc90b3a,6/25(水) 6:02
2025-06-25,13:15,business,経済,40,ベストカーWeb,無人タクシーの黒船襲来!! 米ウェイモが東京で運行準備をスタート,11,https://news.yahoo.co.jp/articles/f7fbd8cf43cdf13e5943df5f40421b65c9937727,6/25(水) 7:00
