scrp_date,scrp_time,genre_en,genre_jp,rank,media_jp,title,comment,link,date_original
2025-06-25,16:09,business,経済,1,朝日新聞,日本郵便の事業許可取り消し、安全確保命令も　不適切点呼で国交省,588,https://news.yahoo.co.jp/articles/fd6d4cae71ca2bd99f8677913eacb2083bdb11da,6/25(水) 14:00
2025-06-25,16:09,business,経済,2,東洋経済オンライン,【限界の自販機】「コカ・コーラ」200円時代突入へ、今秋値上げで赤字自販機は2〜3割に激増も。サントリーやダイドーも苦戦で、連携の動きは加速か,293,https://news.yahoo.co.jp/articles/d95ca8996b7dfcb87bcdf4bb754d5130400a5e54,6/25(水) 6:02
2025-06-25,16:09,business,経済,3,TBS NEWS DIG Powered by JNN,「役員報酬が高すぎる」巨額の赤字に陥った日産自動車の株主総会で怒号　3時間にもおよぶ総会の内容,194,https://news.yahoo.co.jp/articles/d9dbbeb84941cba9cae9a4666c06a735d544a7de,6/24(火) 16:56
2025-06-25,16:09,business,経済,4,TBS NEWS DIG Powered by JNN,フジ株主総会で会社提案の候補者全員選任　ファンド提案のSBI北尾会長らは選任されず,174,https://news.yahoo.co.jp/articles/f78f9c7791ff71879031ac89929cff7a0f52f0f4,6/25(水) 14:30
2025-06-25,16:09,business,経済,5,帝国データバンク,有名プロデューサー中村喜伸氏が代表、アンビエントが破産,114,https://news.yahoo.co.jp/articles/18112bc6f9b18dbd3905aba4a214c27b28a1da17,6/25(水) 10:09
2025-06-25,16:09,business,経済,6,読売新聞オンライン,北陸新幹線延伸で「小浜・京都ルートに全力」…福井・杉本知事、石川・国会議員の「米原」主張受け,80,https://news.yahoo.co.jp/articles/1d93a8f031c108bcb0821e23df421cdd46618aa0,6/25(水) 15:10
2025-06-25,16:09,business,経済,7,週刊SPA!,「子供に食べさせるため自分は一日1食だけ」家族旅行は深夜バスで…38歳シングルマザー、年収500万円でも厳しい生活,75,https://news.yahoo.co.jp/articles/678500ebca77759cfc5020329598055d5b4a3e8b,6/25(水) 8:54
2025-06-25,16:09,business,経済,8,朝日新聞,日本郵政社長ら、株主総会で謝罪　批判続出「法律を守る意識ない」,75,https://news.yahoo.co.jp/articles/fb2a95ef2e8477d40eb86bf29c5faaccd7f0b162,6/25(水) 12:11
2025-06-25,16:09,business,経済,9,共同通信,フジHD新体制、会社案承認　株主総会、新社長ら11人,68,https://news.yahoo.co.jp/articles/270b911a5b72615a573ec995750a41584883203a,6/25(水) 10:38
2025-06-25,16:09,business,経済,10,みんかぶマガジン,リニア計画を10年も停滞させた川勝前静岡県知事の難クセ「大井川の水問題」はやっぱり難クセだった,59,https://news.yahoo.co.jp/articles/1cc57383b1038f8d22f68e56ebac531faeb172a5,6/25(水) 9:10
2025-06-25,16:09,business,経済,11,MotorFan,ダイハツ「ミラ イースGR SPORT」、いよいよ今秋発売へ!? 5速MT＋ターボエンジンは64馬力か,38,https://news.yahoo.co.jp/articles/beba25ace4a6dd621314bbbcdef8adcbdccfa6b0,6/25(水) 14:22
2025-06-25,16:09,business,経済,12,ねとらぼ,ダイソーで販売の“中国産スナック”から「禁止添加物」……　回収命令下る「深くお詫び」,38,https://news.yahoo.co.jp/articles/ba7184c7829c9910052921ca29f4cd76cc931e19,6/25(水) 13:15
2025-06-25,16:09,business,経済,13,集英社オンライン,ついに始まった地獄の倒産連鎖…名物投資家が警鐘「勝ち組２割」「負け組８割」にくっきり分かれた日本,33,https://news.yahoo.co.jp/articles/28defdf255f5cdc434f218c873cdca63e73b6740,6/25(水) 11:02
2025-06-25,16:09,business,経済,14,日テレNEWS NNN,今夏は「うなぎ」がお得に　1000円台も続々　シラスウナギ豊漁で,31,https://news.yahoo.co.jp/articles/1e09880d25ee1603d10c6cc2de660a3454c113ef,6/24(火) 20:59
2025-06-25,16:09,business,経済,15,プレジデントオンライン,そりゃボーナスが減るわ…同じ人件費で「新卒初任給アップ」のため中堅の年収50万円ダウンという理不尽,30,https://news.yahoo.co.jp/articles/6c938b031a9eeb71dd9522a99408f812442b4a7e,6/25(水) 7:17
2025-06-25,16:09,business,経済,16,JBpress,消費税減税・現金給付・基礎年金底上げ…超長期金利の急上昇で先送り、財政リスク要因の増加が止まらない,29,https://news.yahoo.co.jp/articles/9843c1f7b6c5c8089b10bcbce6ccf31fc71c4087,6/25(水) 11:21
2025-06-25,16:09,business,経済,17,ファイナンシャルフィールド,世帯年収1600万円で「7500万円」の住宅ローンを組もうとしています。親に「子どもは1人しか育てられないよ」といわれましたが、この世帯年収なら子ども2人まで余裕ですよね？,28,https://news.yahoo.co.jp/articles/82b6fbaf8fe92349a7b4a4aaa9fea5accf7a228d,6/25(水) 13:50
2025-06-25,16:09,business,経済,18,毎日新聞,自動車の「スズキ」がレトルトカレー発売　インド人従業員向けに開発,28,https://news.yahoo.co.jp/articles/f1cbdb37518d6f4d6474eb52ea839932590c3053,6/25(水) 10:00
2025-06-25,16:09,business,経済,19,ITmedia ビジネスオンライン,国分太一さん降板で“語らぬ会見”　日テレの判断は「正解」か「裏目」か,25,https://news.yahoo.co.jp/articles/5c2cf37936ea8041d495b48a058db1edf2183245,6/25(水) 9:51
2025-06-25,16:09,business,経済,20,ダイヤモンド・オンライン,吉野家と松屋、店内を見れば一発でわかる「大きな違い」,25,https://news.yahoo.co.jp/articles/360f06ee0cc09b1760c7f669cda1b4cb8317cd0e,6/25(水) 11:06
2025-06-25,16:09,business,経済,21,週プレNEWS,世界でハイブリッドが売れに売れているが、日本勢では三菱が先行......トヨタの「PHEV」がパッとしないのはなぜ？,24,https://news.yahoo.co.jp/articles/c64f6e363223140f09b4375cd76ef1319a1a6983,6/25(水) 11:30
2025-06-25,16:09,business,経済,22,文春オンライン,「ジョナサン」「ガスト」が減る一方、謎の“香港式ファミレス”が登場…ファミレス業界に起きている「世代交代」の真相,22,https://news.yahoo.co.jp/articles/72b72ea36078fc7c4523be32d9e181453b1b55de,6/25(水) 6:22
2025-06-25,16:09,business,経済,23,毎日新聞,日本郵便に運送業許可の取り消し処分　トラック2500台使用不可に,19,https://news.yahoo.co.jp/articles/2c2dc9ca9485e48b1e604d4e2a7c903c2245add9,6/25(水) 15:10
2025-06-25,16:09,business,経済,24,週刊SPA!,「黒字なのにリストラ」する企業が急増中の理由。誰もに迫る“クビ”の恐怖,19,https://news.yahoo.co.jp/articles/6dbe5257210fc21dd870ac3cb3c897e447f5870d,6/25(水) 8:53
2025-06-25,16:09,business,経済,25,プレジデントオンライン,どんなに優秀でもAI先生には絶対にできないことがある…これから淘汰される教師、生き残る教師の決定的違い,18,https://news.yahoo.co.jp/articles/32888846c63dbd1280c25813c27bda8359ff1e36,6/25(水) 11:17
2025-06-25,16:09,business,経済,26,マネーポストWEB,「中古スマホ販売店が外国人観光客だらけ…」なぜわざわざ日本に来て中古スマホを購入するのか？　円安だけじゃない「日本人が使ったスマホ」が人気になるワケ,17,https://news.yahoo.co.jp/articles/350f559e2b0db0e327a66479d542e992ee0c4978,6/25(水) 15:15
2025-06-25,16:09,business,経済,27,THE GOLD ONLINE（ゴールドオンライン）,"俺の人生は失敗だったのか…住宅ローン完済・資産4,000万円・年金30万円の67歳・元大手企業会社員。「誰もが羨む老後」のはずが、〈嫉妬〉と〈虚無感〉に蝕まれたワケ【CFPの助言】",17,https://news.yahoo.co.jp/articles/608e69ec8cf0a67634b3db20cf72d342f004921c,6/25(水) 10:02
2025-06-25,16:09,business,経済,28,共同通信,日本郵政の増田社長、不祥事陳謝　株主総会「極めて深刻な事態」,16,https://news.yahoo.co.jp/articles/15b470bae9179e4fbc9f7d0b11d3a5a3b9b80beb,6/25(水) 12:13
2025-06-25,16:09,business,経済,29,LIMO,【厚生年金に一度も入っていない人】「老後の年金」受給額は月額どれくらい？平均年収別「年金受給額の目安」をシミュレーション！,14,https://news.yahoo.co.jp/articles/99740af8abbe391e2d5a8b90060adac33a35672f,6/25(水) 14:27
2025-06-25,16:09,business,経済,30,くるまのニュース,不正改造車「43台」に「ただちにクルマを直しなさい！」国交省ブチギレ！ 「大黒PA」集結の“大迷惑”「爆音マフラー」「シャコタン」スポーツカーを“一斉摘発”！ 取締り実施,14,https://news.yahoo.co.jp/articles/090c5f20efcae69e6c24316c0aadec2e6a6103ac,6/25(水) 7:20
2025-06-25,16:09,business,経済,31,共同通信,中国首相、自由貿易擁護訴え,14,https://news.yahoo.co.jp/articles/f251d69aebee85288d36b9c480b9ecde647d2037,6/25(水) 12:12
2025-06-25,16:09,business,経済,32,ダイヤモンド・オンライン,「こりゃ本気かも…」西武トップが「新宿線と東西線の直通運転」に“前のめり発言”した事情,13,https://news.yahoo.co.jp/articles/29cea3ffe741a611efc78ccde6422b89a8c6ea22,6/25(水) 4:02
2025-06-25,16:09,business,経済,33,J-CASTニュース,農家の倉庫から米袋を次々に積み込んで去っていく男たち　南魚沼「コシヒカリ」生産地で1年前に起きたこと,13,https://news.yahoo.co.jp/articles/cfe875edd7bd280e5ca03f1f80034d446475bd73,6/25(水) 12:10
2025-06-25,16:09,business,経済,34,東洋経済オンライン,朝日新聞トップが語った「反省」と「未来」…“朝日新聞らしさ”をどう再定義するのか　「これまで記者の主張が入り込んで失敗してきた」,13,https://news.yahoo.co.jp/articles/6c64ab148deada39c3e9f6e778b31d8993aac3cd,6/25(水) 6:02
2025-06-25,16:09,business,経済,35,TBS NEWS DIG Powered by JNN,賞味期限4か月「ロングライフ牛乳」本格発売　森永乳業　背景に人手不足 海外輸出も視野,12,https://news.yahoo.co.jp/articles/234ce496007d211df9b7e3663e4f27191c565191,6/24(火) 18:19
2025-06-25,16:09,business,経済,36,LIMO,シニア世代、みんな何歳まで働きたい？【65歳から】厚生年金・国民年金だけの生活は難しいのか。ひと月の支出はいくら？,12,https://news.yahoo.co.jp/articles/36bde805b8b8689ffa25d874fbada2a36001ea59,6/25(水) 11:37
2025-06-25,16:09,business,経済,37,THE GOLD ONLINE（ゴールドオンライン）,"遺されたのは〈タンス預金78万円〉と〈遺族年金月9万6,000円〉のみ…口数は少ないが、情の深い夫が隠した「やるせない事実」に67歳妻、昏倒【FPの助言】",12,https://news.yahoo.co.jp/articles/2b06ec1d306a124458bc9e0949c2c57671ec50b4,6/25(水) 10:32
2025-06-25,16:09,business,経済,38,ファイナンシャルフィールド,45歳の独身会社員。貯蓄は全部で「600万円」ですが、同世代は「平均900万円」と聞き心配になりました。年金をもらうまで、あといくら増やせば“普通”になりますか？ 40歳代の「平均値・中央値」もあわせて解説,12,https://news.yahoo.co.jp/articles/a054d983c7081602528c11376323e01e490bdba8,6/25(水) 13:30
2025-06-25,16:09,business,経済,39,ファイナンシャルフィールド,住宅ローンが35年返済で完済が「70歳」を過ぎます。年金生活になっても払い続ける人は多いのでしょうか？,12,https://news.yahoo.co.jp/articles/8de3cbf6b16f4f87e3e162b289af38b859826197,6/25(水) 13:40
2025-06-25,16:09,business,経済,40,毎日新聞,25日にフジHD株主総会　ダルトン含めた取締役人事案に注目,11,https://news.yahoo.co.jp/articles/4811d3fa206d6a83e338999eb38f409372d4b6e8,6/25(水) 0:00
