scrp_date,scrp_time,genre_en,genre_jp,rank,media_jp,title,comment,link,date_original
2025-05-12,16:08,sports,スポーツ,1,スポーツ報知,巨人・秋広優人、大江竜聖とソフトバンク・リチャードの２対１電撃トレード成立,729,https://news.yahoo.co.jp/articles/a523bf173d63c6e245262db72fe21c90b170b512,5/12(月) 12:00
2025-05-12,16:08,sports,スポーツ,2,日刊スポーツ,【巨人】電撃トレード！ソフトバンクのリチャードと秋広優人＆大江竜聖の２対１で成立,183,https://news.yahoo.co.jp/articles/30596d5255d9da122e558e027e9878dcf1bd46fa,5/12(月) 12:00
2025-05-12,16:08,sports,スポーツ,3,中日スポーツ,中日・土田龍空、出場選手登録を抹消…負傷の村松開人に代わり4月25日に昇格も打率.143と振るわず,159,https://news.yahoo.co.jp/articles/a3a67664cd0034a0d04c86b487fb753be3f3d775,5/12(月) 15:17
2025-05-12,16:08,sports,スポーツ,4,週刊女性PRIME,「本当に嫌われてたのか」巨人・秋広優人の電撃トレード、ファンが危惧していた“阿部監督への大暴言”,127,https://news.yahoo.co.jp/articles/8623e1fcd9b6f77b8487701adfacc3bcc475015a,5/12(月) 15:06
2025-05-12,16:08,sports,スポーツ,5,スポーツ報知,巨人・坂本勇人が登録抹消へ　２軍再調整の見込み…９打席連続ノーヒット,125,https://news.yahoo.co.jp/articles/710edb84c7af5553f15b35c40e1f23c53255c4ac,5/12(月) 4:00
2025-05-12,16:08,sports,スポーツ,6,デイリースポーツ,巨人ファンに激震　驚きとショック　ＳＮＳでぼう然自失「秋広え？？？？？？」「巨人で頑張ってほしかったからショックがでかい」,115,https://news.yahoo.co.jp/articles/85915ce79e44010bcbb0ca45f781196f5ccb5d5b,5/12(月) 12:40
2025-05-12,16:08,sports,スポーツ,7,デイリースポーツ,異例ずくめの電撃トレードの裏側に何があったのか　巨人・秋広は前日まで１軍ベンチにいた,101,https://news.yahoo.co.jp/articles/cf539387252f12de0486534f87c0523d075a7f39,5/12(月) 14:00
2025-05-12,16:08,sports,スポーツ,8,スポーツ報知,【巨人】電撃トレードでソフトバンク・リチャード獲得の理由　前日まで１軍の秋広優人、大江竜聖との交換で緊急補強,95,https://news.yahoo.co.jp/articles/c5afe55f76db3e50f25180b45a8213cdcb696bd4,5/12(月) 12:31
2025-05-12,16:08,sports,スポーツ,9,Full-Count,“メジャー最低”に沈む佐々木朗希　見えぬ復調気配…球速低下だけではない深刻な「10.1」,89,https://news.yahoo.co.jp/articles/980c80035afc83a4429864d1fb78f5e5e08ef9c6,5/12(月) 6:25
2025-05-12,16:08,sports,スポーツ,10,Full-Count,巨人へ電撃移籍…“未完の大砲”に鷹党混乱「こりゃ驚き」　突然の発表も「覚醒しそう」,84,https://news.yahoo.co.jp/articles/af5e173bbdcd0a97dabdf0e57ac4bf2add23e5ef,5/12(月) 13:34
2025-05-12,16:08,sports,スポーツ,11,日刊スポーツ,【ソフトバンク】「ロマン砲」リチャード放出で巨人秋広優人＆大江竜聖をトレードで獲得／解説,76,https://news.yahoo.co.jp/articles/bf65f2f168303fc072340c5a3d7e572c6fe6963f,5/12(月) 12:00
2025-05-12,16:08,sports,スポーツ,12,デイリースポーツ,阪神・小幡竜平が登録抹消「左下肢の軽度の筋挫傷」の診断　１１日・中日戦の六回に途中交代,70,https://news.yahoo.co.jp/articles/fcbb7d47d8f63bd348e756a039bfdb1433c7cb1d,5/12(月) 15:18
2025-05-12,16:08,sports,スポーツ,13,THE ANSWER,プロ野球で飛び込んできた1対2電撃トレードにX仰天「嘘だろ！？」「スマホ開いたら…何これ？」,63,https://news.yahoo.co.jp/articles/ee92bef9dcd8672081f9ba8c6f16985c2dbb46bc,5/12(月) 12:54
2025-05-12,16:08,sports,スポーツ,14,日刊スポーツ,【巨人】阿部慎之助監督就任以降では5件目のトレード成立　24年6月の松原と若林など,62,https://news.yahoo.co.jp/articles/947145eff2a96677d2e166c33bbb12e480803ea8,5/12(月) 12:03
2025-05-12,16:08,sports,スポーツ,15,スポーティングニュース日本版,ドジャースの佐々木朗希の先発ローテーション落ち、マイナー降格の可能性を米メディアが指摘,61,https://news.yahoo.co.jp/articles/2c2d0fb2d7b9af530e8bd7cbb04dc3f62481b1d0,5/12(月) 12:36
2025-05-12,16:08,sports,スポーツ,16,THE DIGEST,巨人ファン激震！「ええええ!?」秋広優人がソフトバンクにトレード移籍「泣いていいですか」「ちょっと衝撃...」,58,https://news.yahoo.co.jp/articles/e39e0689153b3d1fc371adcae98753ba34c1991f,5/12(月) 15:08
2025-05-12,16:08,sports,スポーツ,17,日刊スポーツ,【阪神】小幡竜平に試練　左下肢張りで全体練習欠席　遊撃レギュラー手中しかける24歳,51,https://news.yahoo.co.jp/articles/d79d37ba15e5dc140288f9e4ceac6dea9b61439e,5/12(月) 9:30
2025-05-12,16:08,sports,スポーツ,18,ABEMA TIMES,大相撲生観戦で“お断り行為”が発生「つまみ出せ！」「誰か注意して」マナー知らずに非難殺到,50,https://news.yahoo.co.jp/articles/92da76ba63b07151c0e4e18e747397bc4f49d649,5/12(月) 7:02
2025-05-12,16:08,sports,スポーツ,19,TBS NEWS DIG Powered by JNN,【中日】2戦連続、両リーグ最多8度目の完封負け...今季最悪借金4 松葉5回1失点も援護なく 6回の絶好機生かせず、4番中田は不発,46,https://news.yahoo.co.jp/articles/9fcf4be5ec5ce90b8ab23ac61a93ce1457ce73b5,5/11(日) 16:34
2025-05-12,16:08,sports,スポーツ,20,Full-Count,巨人と鷹の電撃トレードは「嘘だろ…」　期待の逸材“放出”にX激震「理解が追いつかん」,44,https://news.yahoo.co.jp/articles/3985bd7320e2bf629a25422b226a0097da48ca8e,5/12(月) 13:16
2025-05-12,16:08,sports,スポーツ,21,スポニチアネックス,藤田さいき「もう動けない」プレーオフ惜敗に涙　ワールド・サロンパスC,43,https://news.yahoo.co.jp/articles/d459d40d5016c552931c0728c45969b3674d301e,5/11(日) 17:29
2025-05-12,16:08,sports,スポーツ,22,THE ANSWER,大谷翔平とキム・ヘソンは「兄と弟の日韓デュオ」　コミカルなやり取りに韓国注目「心を捉えた」,41,https://news.yahoo.co.jp/articles/5586d3b2030684810988d1ec310399345f03dbad,5/12(月) 15:03
2025-05-12,16:08,sports,スポーツ,23,スポーツ報知,【ソフトバンク】移籍志願かなったリチャード　王貞治会長も薄々分かっていたはずの“大化け処方箋”が実現,39,https://news.yahoo.co.jp/articles/804d8649fea034e31859f0c03e3c79e110f3a54e,5/12(月) 14:15
2025-05-12,16:08,sports,スポーツ,24,中日スポーツ,矢野燿大さん「走姿顕心」の言葉で中日にエール「『俺がやってやる！』という姿があふれ出てくると、チームは変わる」,39,https://news.yahoo.co.jp/articles/d3f22b9881912d1ad397faeae84e82f47fd3376a,5/12(月) 13:28
2025-05-12,16:08,sports,スポーツ,25,高校野球ドットコム,巨人とソフトバンクのトレードが「電撃過ぎる」野球ファン驚愕の移籍で「信じられない」「言葉が見つからない」,39,https://news.yahoo.co.jp/articles/5e3acd226c5f3bad3179c232b771c01da78159c6,5/12(月) 14:51
2025-05-12,16:08,sports,スポーツ,26,Full-Count,巨人に電撃トレードの鷹リチャード「心折れそうになったことも」　期待応えられず「心残り」,39,https://news.yahoo.co.jp/articles/184ce50aaac6579d401e2c541a1121634ed46fb6,5/12(月) 12:35
2025-05-12,16:08,sports,スポーツ,27,Full-Count,コーチから理不尽な鉄拳制裁　即ゴミ箱に捨てた野球道具…怒り抑え「辞めまーす」,38,https://news.yahoo.co.jp/articles/a0f30f170e2015d71c5ffc3c865a4370c7848989,5/12(月) 6:50
2025-05-12,16:08,sports,スポーツ,28,ENCOUNT,クレベル、62秒KO負け後にレフェリーへ暴言「クレイジー」　直後にサトシが神対応「聖人すぎた」,37,https://news.yahoo.co.jp/articles/e49a274f06c4563aaa1dbc567e92a09874a2cc11,5/12(月) 14:53
2025-05-12,16:08,sports,スポーツ,29,デイリースポーツ,巨人へトレードのリチャード「期待に応えられないままなのが心残り」とコメント　王会長や小久保監督、先輩の山川への思い　新天地での活躍で恩返し誓う,37,https://news.yahoo.co.jp/articles/257c0aded1a6905cc4a5e760d2b00264bcd94ab1,5/12(月) 12:50
2025-05-12,16:08,sports,スポーツ,30,J-CASTニュース,ノッコン寺田、ブレイキングダウン人気選手「出禁」は「陰湿なイジメみたい」...運営の処分疑問視「もっとやり方ある」,36,https://news.yahoo.co.jp/articles/722032a29397b4c7e27860de3e60edeb2beca3a0,5/12(月) 12:08
2025-05-12,16:08,sports,スポーツ,31,スポーツ報知,大谷翔平、パパになって初の「母の日」に感謝の２安打１打点　敵地１０連戦白星締めで真美子夫人＆長女と再会へ,36,https://news.yahoo.co.jp/articles/5ed2836a3480d01a0685a5646e05bb3d1d84a7c1,5/12(月) 8:02
2025-05-12,16:08,sports,スポーツ,32,日刊スポーツ,【巨人】秋広優人、大江竜聖とソフトバンク・リチャードの２対１の交換トレードが成立　球団発表,35,https://news.yahoo.co.jp/articles/59f4cdb97a77dd4227457d3916f3ea26a9299a47,5/12(月) 12:43
2025-05-12,16:08,sports,スポーツ,33,ENCOUNT,飯田将成、BreakingDown16で復帰予定も「このままなら試合には出ない」　突然のブチギレ＆欠場示唆,35,https://news.yahoo.co.jp/articles/59054560fc472a11a4d99803fd8a314741abf298,5/12(月) 9:28
2025-05-12,16:08,sports,スポーツ,34,中日スポーツ,中日、深刻48イニング連続タイムリーなし…松中信彦打撃統括コーチ「戦う集団にならないとこの壁は越えていけない」,35,https://news.yahoo.co.jp/articles/53331b19c90477092eca0d36efe1ab91bd47f84b,5/12(月) 5:45
2025-05-12,16:08,sports,スポーツ,35,TBS NEWS DIG Powered by JNN,【広島】大拙攻の惜敗 貯金1...2回無死満塁で無得点が響く 堂林がブレーキ 計10安打12残塁 小園1号ソロ＆適時打のみ 玉村3敗目,34,https://news.yahoo.co.jp/articles/8b560410997ef33783a640248cfc44387feb0da0,5/11(日) 16:59
2025-05-12,16:08,sports,スポーツ,36,J-CASTニュース,ドジャースのキム・ヘソン、大リーグ初の２塁打は「盗まれた」　韓国メディア嘆き...セーフ判定もチャレンジで覆る,34,https://news.yahoo.co.jp/articles/d7d186262c34c2327668461c549c4f06258fefda,5/12(月) 13:27
2025-05-12,16:08,sports,スポーツ,37,CoCoKARAnext,阪神24歳左腕は「本当にルーキー？」与四球の少なさも話題「ずっとローテーションにいてほしい」,34,https://news.yahoo.co.jp/articles/47cc0910d8eb1b0b71ffb45e31e05b3f30629b8c,5/12(月) 12:21
2025-05-12,16:08,sports,スポーツ,38,デイリースポーツ,井岡一翔　死闘も無念判定負け　無敗王者と再戦でリベンジならず　１０回左フックでダウン奪うも序盤からの劣勢響く　会場ため息も井岡は晴れ晴れ　王者の手を掲げ敬意,33,https://news.yahoo.co.jp/articles/027aa137f96a24f8d76ce922b22e6edc7cf2d39b,5/11(日) 21:06
2025-05-12,16:08,sports,スポーツ,39,CoCoKARAnext,巨人、電撃トレード成立！秋広優人、大江竜聖、SBリチャードとの2対1　浮上する「両球団の思惑」とは,33,https://news.yahoo.co.jp/articles/ef399064c6600fa740a3e9075c880721306aa902,5/12(月) 14:30
2025-05-12,16:08,sports,スポーツ,40,Full-Count,163億円の“韓国のイチロー”　突如止まった打棒に母国メディア嘆き「大変だ」「なぜ…」,32,https://news.yahoo.co.jp/articles/27200a1062bef727289f87a072c4bba4471b1e4b,5/11(日) 19:36
