scrp_date,scrp_time,genre_en,genre_jp,rank,media_jp,title,comment,link,date_original
2024-10-10,13:08,world,国際,1中国の校門前で小学生ら３人刺される、不満のはけ口に子供狙ったか…日本総領事館が注意喚起読売新聞オンライン10/9(水) 17:40169件/時,読売新聞オンライン,中国の校門前で小学生ら３人刺される、不満のはけ口に子供狙ったか…日本総領事館が注意喚起,169,https://news.yahoo.co.jp/articles/1deda1cb7c7387f5779559af54c21b4f82f20581,10/9(水) 17:40
2024-10-10,13:08,world,国際,2再送-レバノン「ガザ化」容認できず、ガザ人道状況イスラエルと協議＝米国務省ロイター10/10(木) 6:0277件/時,ロイター,再送-レバノン「ガザ化」容認できず、ガザ人道状況イスラエルと協議＝米国務省,77,https://news.yahoo.co.jp/articles/bcb11b33259330642edf0e34114800c4c9ccc8e9,10/10(木) 6:02
2024-10-10,13:08,world,国際,3新型コロナ感染による心臓発作・脳卒中の発症リスク、感染から３年後も２倍　新研究CNN.co.jp10/10(木) 11:1269件/時,CNN.co.jp,新型コロナ感染による心臓発作・脳卒中の発症リスク、感染から３年後も２倍　新研究,69,https://news.yahoo.co.jp/articles/7ed9760f529c34bd6ea6a36301e3ea9ab786cce2,10/10(木) 11:12
2024-10-10,13:08,world,国際,4石破総理の「北朝鮮との連絡事務所設置」はあまりにもナンセンス…本気で拉致被害者を救出する意思があるなら「特殊部隊による救出作戦決行の覚悟」が必要だ現代ビジネス10/10(木) 12:0542件/時,現代ビジネス,石破総理の「北朝鮮との連絡事務所設置」はあまりにもナンセンス…本気で拉致被害者を救出する意思があるなら「特殊部隊による救出作戦決行の覚悟」が必要だ,42,https://news.yahoo.co.jp/articles/d41e26cdb4bd5b50cd9ba0abf6e93dd64ff71306,10/10(木) 12:05
2024-10-10,13:08,world,国際,5米大統領選 ハリスは「ガラスの天井」を破れるか　日本で「いよいよ優勢」に見えても米国に残る「大きな壁」AERA dot.10/10(木) 11:0240件/時,AERA dot.,米大統領選 ハリスは「ガラスの天井」を破れるか　日本で「いよいよ優勢」に見えても米国に残る「大きな壁」,40,https://news.yahoo.co.jp/articles/d1f595fb52aac057b03fba1d185ef1d0207aeb7d,10/10(木) 11:02
2024-10-10,13:08,world,国際,60:56イランへの報復で「重要な決定が下された」 イスラエル・メディア報じる　イスラエル国防相「攻撃は致命的で正確で驚くべきものになる」TBS NEWS DIG Powered by JNN10/10(木) 12:0131件/時,TBS NEWS DIG Powered by JNN,イランへの報復で「重要な決定が下された」 イスラエル・メディア報じる　イスラエル国防相「攻撃は致命的で正確で驚くべきものになる」,31,https://news.yahoo.co.jp/articles/43ed499d58e5769b6bcba4426d436e67928f1243,10/10(木) 12:01
2024-10-10,13:08,world,国際,7在日中国人、本国から「口封じ」　ヒューマン・ライツ・ウオッチ共同通信10/10(木) 7:4729件/時,共同通信,在日中国人、本国から「口封じ」　ヒューマン・ライツ・ウオッチ,29,https://news.yahoo.co.jp/articles/aeba2dcf6797aa4567424af8ca0ae66fcfd80036,10/10(木) 7:47
2024-10-10,13:08,world,国際,8習近平の「台湾侵攻」をひそかに待ち望んでいる「意外すぎる国」の実名現代ビジネス10/10(木) 7:0025件/時,現代ビジネス,習近平の「台湾侵攻」をひそかに待ち望んでいる「意外すぎる国」の実名,25,https://news.yahoo.co.jp/articles/37a2f0df9b23365cc0fb46916c4f3ab6b35dd53e,10/10(木) 7:00
2024-10-10,13:08,world,国際,9急発進・急加速の“乱暴運転”批判にさらされるソウル市内バス…背景には「定時運行厳守のプレッシャー」KOREA WAVE10/10(木) 11:3325件/時,KOREA WAVE,急発進・急加速の“乱暴運転”批判にさらされるソウル市内バス…背景には「定時運行厳守のプレッシャー」,25,https://news.yahoo.co.jp/articles/420de23422fdaead4fbda732f3367a45691cca9e,10/10(木) 11:33
2024-10-10,13:08,world,国際,10トランプ氏、ＦＯＸニュース主催の討論会も拒否ロイター10/10(木) 10:1123件/時,ロイター,トランプ氏、ＦＯＸニュース主催の討論会も拒否,23,https://news.yahoo.co.jp/articles/eea84b86d57cdb872cd9e8abb2c3282b5ce30f05,10/10(木) 10:11
2024-10-10,13:08,world,国際,11米大統領選　トランプ氏がテレビ討論会の再戦を拒否「もう討論する議題はない」TBS NEWS DIG Powered by JNN10/10(木) 12:2722件/時,TBS NEWS DIG Powered by JNN,米大統領選　トランプ氏がテレビ討論会の再戦を拒否「もう討論する議題はない」,22,https://news.yahoo.co.jp/articles/b25a8fbb0df247d495eb7da9da6495f1590ca969,10/10(木) 12:27
2024-10-10,13:08,world,国際,12「窒素死亡カプセル」３７１人申請したが…スイス、使用中止ハンギョレ新聞10/10(木) 7:2920件/時,ハンギョレ新聞,「窒素死亡カプセル」３７１人申請したが…スイス、使用中止,20,https://news.yahoo.co.jp/articles/10b7fef12f409d469fed7f4799ce9def05daf871,10/10(木) 7:29
2024-10-10,13:08,world,国際,13独裁者はなぜ間違えるのか？――「バカだから」では説明できない毛沢東・習近平の判断ミス新潮社 フォーサイト10/10(木) 10:5419件/時,新潮社 フォーサイト,独裁者はなぜ間違えるのか？――「バカだから」では説明できない毛沢東・習近平の判断ミス,19,https://news.yahoo.co.jp/articles/39087c35b642e4d557c0cef367fba9484e3e9909,10/10(木) 10:54
2024-10-10,13:08,world,国際,14欧州「極右」の勝利は“民主主義の危機”ではない…「リベラル政治家」は中間層の怒りと向き合うべきデイリー新潮10/10(木) 11:0017件/時,デイリー新潮,欧州「極右」の勝利は“民主主義の危機”ではない…「リベラル政治家」は中間層の怒りと向き合うべき,17,https://news.yahoo.co.jp/articles/66caeb22d2a7f80d614d77f8dd4aa3b12a9941ee,10/10(木) 11:00
2024-10-10,13:08,world,国際,15《ブラジル》ギリシャ人男性が頭撃たれ死亡＝オービスで車減速させた直後ブラジル日報10/10(木) 7:4616件/時,ブラジル日報,《ブラジル》ギリシャ人男性が頭撃たれ死亡＝オービスで車減速させた直後,16,https://news.yahoo.co.jp/articles/22f48a6c5ed5f3e08f3030b2abaf1da53361b9c8,10/10(木) 7:46
2024-10-10,13:08,world,国際,16「来年中に戦争終結も」　ゼレンスキー氏、欧米の軍事・外交支援が条件産経新聞10/10(木) 9:2515件/時,産経新聞,「来年中に戦争終結も」　ゼレンスキー氏、欧米の軍事・外交支援が条件,15,https://news.yahoo.co.jp/articles/57861abbf732fd34996ea13ccef08061aee71bb0,10/10(木) 9:25
2024-10-10,13:08,world,国際,17アジア系米国人への憎悪がネットで増加、ハリス氏ら台頭で＝報告ロイター10/10(木) 12:0514件/時,ロイター,アジア系米国人への憎悪がネットで増加、ハリス氏ら台頭で＝報告,14,https://news.yahoo.co.jp/articles/45b1accecdafb5dc559d44f5cc6634345af9e1e8,10/10(木) 12:05
2024-10-10,13:08,world,国際,18米利下げ「0．25％」主張も　FRB高官、見解相違　FOMC議事要旨時事通信10/10(木) 6:5814件/時,時事通信,米利下げ「0．25％」主張も　FRB高官、見解相違　FOMC議事要旨,14,https://news.yahoo.co.jp/articles/ac5ffcfeae0b928198e90168d677d6b33cd2a83c,10/10(木) 6:58
2024-10-10,13:08,world,国際,19バイデン大統領、“トランプ氏が偽情報を流している”と批判 ハリケーン対応めぐりABEMA TIMES10/10(木) 8:1614件/時,ABEMA TIMES,バイデン大統領、“トランプ氏が偽情報を流している”と批判 ハリケーン対応めぐり,14,https://news.yahoo.co.jp/articles/863d067a9ba24b7145eb2ecf19694dc8a05c1a73,10/10(木) 8:16
2024-10-10,13:08,world,国際,201:45ペット散歩中のカップル死亡　ヒズボラが越境ロケット攻撃  AP通信10/10(木) 12:1113件/時,AP通信,ペット散歩中のカップル死亡　ヒズボラが越境ロケット攻撃,13,https://news.yahoo.co.jp/articles/b3b134b8a997d2d24fd40db37d8e8fb5b20409b6,10/10(木) 12:11
2024-10-10,13:08,world,国際,21兵士不足に苦しむロシア　新兵”高齢化”進む 「隊員はおじいちゃんだ」の声も日テレNEWS NNN10/9(水) 23:5413件/時,日テレNEWS NNN,兵士不足に苦しむロシア　新兵”高齢化”進む 「隊員はおじいちゃんだ」の声も,13,https://news.yahoo.co.jp/articles/234dca4cc1c835530e40d10722365bdd6f036227,10/9(水) 23:54
2024-10-10,13:08,world,国際,22中国・広州市の小学校前で児童ら3人が刃物で切り付けられ負傷テレビ朝日系（ANN）10/9(水) 13:1013件/時,テレビ朝日系（ANN）,中国・広州市の小学校前で児童ら3人が刃物で切り付けられ負傷,13,https://news.yahoo.co.jp/articles/9b2a8bd2e2de14c310d8c33cd9ae33a4a12c6677,10/9(水) 13:10
2024-10-10,13:08,world,国際,23中国外相、台湾問題で日本側にクギ　「日本は政治的な約束厳守を」産経新聞10/10(木) 0:4813件/時,産経新聞,中国外相、台湾問題で日本側にクギ　「日本は政治的な約束厳守を」,13,https://news.yahoo.co.jp/articles/70458dbc20049ec6e3ff02bf126d15730989bbec,10/10(木) 0:48
2024-10-10,13:08,world,国際,24これが流行？　授業中に突然教師に侮辱的な発言…高校生の衝撃映像＝韓国中央日報日本語版10/10(木) 10:1413件/時,中央日報日本語版,これが流行？　授業中に突然教師に侮辱的な発言…高校生の衝撃映像＝韓国,13,https://news.yahoo.co.jp/articles/4c429fbb76c092bbf2ce61d65979080478f6e175,10/10(木) 10:14
2024-10-10,13:08,world,国際,252:07トランプ氏が米政府の災害対策に関して「偽情報」、バイデン氏が非難「ばかげている」ロイター10/10(木) 9:2613件/時,ロイター,トランプ氏が米政府の災害対策に関して「偽情報」、バイデン氏が非難「ばかげている」,13,https://news.yahoo.co.jp/articles/c4d51fa274bc6c17101dca2b1bb24f9da7f52739,10/10(木) 9:26
2024-10-10,13:08,world,国際,26電気・ガス・ガソリン補助金支援の継続、当面は必要＝石井公明党代表ロイター10/10(木) 11:5812件/時,ロイター,電気・ガス・ガソリン補助金支援の継続、当面は必要＝石井公明党代表,12,https://news.yahoo.co.jp/articles/079f6250cbf909ca8d86aa214784b9e231cd831d,10/10(木) 11:58
2024-10-10,13:08,world,国際,27「ハングルの落書き」場所はソウルではない、かのグランド・キャニオンだった…韓国系米国人「恥ずかしい」KOREA WAVE10/10(木) 5:0312件/時,KOREA WAVE,「ハングルの落書き」場所はソウルではない、かのグランド・キャニオンだった…韓国系米国人「恥ずかしい」,12,https://news.yahoo.co.jp/articles/3dd34fa19328b5a555a08ddc0c59ee0e736925d3,10/10(木) 5:03
2024-10-10,13:08,world,国際,28【インド】ＢＹＤ、６～７人乗りＥＶを発売NNA10/10(木) 11:3112件/時,NNA,【インド】ＢＹＤ、６～７人乗りＥＶを発売,12,https://news.yahoo.co.jp/articles/bff913bf913de1255be0923cd5d2041dbddcef49,10/10(木) 11:31
2024-10-10,13:08,world,国際,291:14イスラエル、UNRWAの活動を事実上禁止する法案審議　UNRWAトップは「国連憲章違反だ」と批判日テレNEWS NNN10/10(木) 7:1412件/時,日テレNEWS NNN,イスラエル、UNRWAの活動を事実上禁止する法案審議　UNRWAトップは「国連憲章違反だ」と批判,12,https://news.yahoo.co.jp/articles/1dc1afa958dfbc03df480cd99ac74b057a5e9c1b,10/10(木) 7:14
2024-10-10,13:08,world,国際,30背中に４０センチの裂傷も「手術する医師いない」…釜山から大田まで行った中学生中央日報日本語版10/10(木) 11:4412件/時,中央日報日本語版,背中に４０センチの裂傷も「手術する医師いない」…釜山から大田まで行った中学生,12,https://news.yahoo.co.jp/articles/dd14597ef46924ebfcd8a8a6628790e7109a2f1e,10/10(木) 11:44
2024-10-10,13:08,world,国際,31大統領選が近づくにつれ不安を募らせる民主党、ハリス氏は「行き詰まっている」CNN.co.jp10/10(木) 8:5212件/時,CNN.co.jp,大統領選が近づくにつれ不安を募らせる民主党、ハリス氏は「行き詰まっている」,12,https://news.yahoo.co.jp/articles/a5265195593fd56790dfb765c864277661d269b5,10/10(木) 8:52
2024-10-10,13:08,world,国際,32イスラエル、対イラン報復は「致命的なものに」　首相は米と電話協議毎日新聞10/10(木) 7:2412件/時,毎日新聞,イスラエル、対イラン報復は「致命的なものに」　首相は米と電話協議,12,https://news.yahoo.co.jp/articles/f2d143d067f9bb07431795c252bf813c5206b3bd,10/10(木) 7:24
2024-10-10,13:08,world,国際,331:34大蛇VS酔っ払い「勝負したい」とバトル挑みヘビにキス連発…最後は消防隊に救助されヘビは山に帰る　中国FNNプライムオンライン（フジテレビ系）10/9(水) 19:3811件/時,FNNプライムオンライン（フジテレビ系）,大蛇VS酔っ払い「勝負したい」とバトル挑みヘビにキス連発…最後は消防隊に救助されヘビは山に帰る　中国,11,https://news.yahoo.co.jp/articles/764a5dbc7bc1db58412f041812167b1c0d5935d8,10/9(水) 19:38
2024-10-10,13:08,world,国際,34日中外相が電話会談、岩屋氏は刺殺事件と領空侵犯への説明求めるロイター10/10(木) 8:4911件/時,ロイター,日中外相が電話会談、岩屋氏は刺殺事件と領空侵犯への説明求める,11,https://news.yahoo.co.jp/articles/86347cf7b1e284433e8c5c4f5eed35b1887f1b9d,10/10(木) 8:49
2024-10-10,13:08,world,国際,35イランへの反撃は「致命的で驚くべきものに」イスラエル国防相　強力な反撃を示唆テレビ朝日系（ANN）10/10(木) 9:4311件/時,テレビ朝日系（ANN）,イランへの反撃は「致命的で驚くべきものに」イスラエル国防相　強力な反撃を示唆,11,https://news.yahoo.co.jp/articles/eaf0962ba7462a58a6f6b867dfb27fe39a1373e2,10/10(木) 9:43
2024-10-10,13:08,world,国際,36ネパールの18歳、高峰14座制覇 最年少記録更新ＡＦＰ＝時事10/9(水) 18:2211件/時,ＡＦＰ＝時事,ネパールの18歳、高峰14座制覇 最年少記録更新,11,https://news.yahoo.co.jp/articles/f3c89878317da535a8930551429ed29bf0c7c8f9,10/9(水) 18:22
2024-10-10,13:08,world,国際,37韓国の高齢層、半数以上が年金を受給しながらも働き続けるという実態KOREA WAVE10/10(木) 9:0311件/時,KOREA WAVE,韓国の高齢層、半数以上が年金を受給しながらも働き続けるという実態,11,https://news.yahoo.co.jp/articles/215bc6d7734e73c49f8f0bfd1e3629e982daadce,10/10(木) 9:03
2024-10-10,13:08,world,国際,38イスラエルの対レバノン軍事攻撃は「侵略」 スペイン首相ＡＦＰ＝時事10/10(木) 10:5211件/時,ＡＦＰ＝時事,イスラエルの対レバノン軍事攻撃は「侵略」 スペイン首相,11,https://news.yahoo.co.jp/articles/802b2a20571f2527608a423d86f53c94c0e9bf6c,10/10(木) 10:52
2024-10-10,13:08,world,国際,390:26レバノンの村にイスラエル国旗　限定作戦中のイスラエル軍  AP通信10/10(木) 10:5811件/時,AP通信,レバノンの村にイスラエル国旗　限定作戦中のイスラエル軍,11,https://news.yahoo.co.jp/articles/2d9510cdeb5fd8e5100e7b729d35dd956529ad19,10/10(木) 10:58
2024-10-10,13:08,world,国際,40トランプ氏、「再戦なし」　ＦＯＸニュースが討論会提案もCNN.co.jp10/10(木) 12:1410件/時,CNN.co.jp,トランプ氏、「再戦なし」　ＦＯＸニュースが討論会提案も,10,https://news.yahoo.co.jp/articles/41b4223d29b10f01d4b2f27dd1eed3c7e286acbf,10/10(木) 12:14
