scrp_date,scrp_time,genre_en,genre_jp,rank,media_jp,title,comment,link,date_original
2025-10-21,15:12,life,ライフ,1,ねとらぼ,「こんなことある？」　ジョブチューンで“全員不合格”のセブン-イレブン商品に騒然　「マジかよ」「衝撃だよこれ」,61,https://news.yahoo.co.jp/articles/c558e44adfd45f6e3ecd39d28b9f1d5bdb105062,10/21(火) 6:30
2025-10-21,15:12,life,ライフ,2,LASISA,【マイルドヤンキーの象徴！？】SNSでバズる《残クレアルファード界隈》とは？なぜ「アルファード」？次なる標的は「ランクルFJ？」日本人の“見栄と金欠”の深すぎる闇,59,https://news.yahoo.co.jp/articles/12e20e2cf41dcfd8eea303b52e079694f8565fc3,10/21(火) 12:02
2025-10-21,15:12,life,ライフ,3,AERA with Kids＋,いまや学校給食の牛乳の4割が「パックから直飲み」の時代に　“ストローなし”が進んだきっかけとは？,59,https://news.yahoo.co.jp/articles/feda46d36f938773784d003bcbf75a0669676f85,10/21(火) 7:01
2025-10-21,15:12,life,ライフ,4,産経新聞,国立大への税金投入を批判した神谷代表、阿部文科相「就職先と支援の結びつけは難しい」,55,https://news.yahoo.co.jp/articles/91ef0a1742adfa7217b3fa80c8202dd201b68e4b,10/21(火) 11:54
2025-10-21,15:12,life,ライフ,5,ほ・とせなNEWS,「止まるなんてありえない！」来日した外国人男性が驚愕。その内容に「考えられない」「衝撃」,50,https://news.yahoo.co.jp/articles/6f805a3ba26071849f3c632c2ff709a655b52383,10/21(火) 12:20
2025-10-21,15:12,life,ライフ,6,ワールドジェットスポーツマガジン,「クルマの盗難」が多発！ブラジル人が「CANインベーダー」使って逮捕！『 なぜ？「クルマの盗難装置」が、今日も “隣国” で、正々堂々と 販売されている現実』を“放置”しているのか！,40,https://news.yahoo.co.jp/articles/7a6110b78ec66730803bde9064ace301c29913e5,10/21(火) 11:13
2025-10-21,15:12,life,ライフ,7,プレジデントオンライン,野菜を一瞬でダメにし、「高血圧、動脈硬化」のリスク大…循環器専門医が「冷蔵庫に置いていない」と断言する調味料,23,https://news.yahoo.co.jp/articles/2dd9867661c327f617f5e26eb8e724892cbe8665,10/21(火) 9:16
2025-10-21,15:12,life,ライフ,8,よろず～ニュース,中3息子のスマホに母が嘆き…「私の登録名が“日本”だった」 SNSで共感の声多数,21,https://news.yahoo.co.jp/articles/999228036b9b038883508166ef9a73bea2c69787,10/21(火) 13:00
2025-10-21,15:12,life,ライフ,9,ねとらぼ,免許証更新の為に神田センターへ→到着したのは……　想定外の展開が2400万表示「なんか可哀想」,20,https://news.yahoo.co.jp/articles/82cc41b1f2e0cebcd3d7d0d6227db445965eb33d,10/21(火) 9:15
2025-10-21,15:12,life,ライフ,10,FORZA STYLE,「初めてなのに4回も」教え子の20歳の誕生日を待った家庭教師。避妊を拒んだ「先生」が事後に勧めたものとは【専門家助言】,20,https://news.yahoo.co.jp/articles/bfc926a0eccefd87375d36e9409743a5278066ea,10/20(月) 21:01
2025-10-21,15:12,life,ライフ,11,共同通信,日テレバラエティーに放送倫理違反とBPO,19,https://news.yahoo.co.jp/articles/a7b3f695467ad5efc70decafa874c33fd30700a9,10/21(火) 14:43
2025-10-21,15:12,life,ライフ,12,NEWSポストセブン,三笠宮家の新当主、彬子さまがエッセイで匂わせた母・信子さまとの“距離感”　公の場では顔も合わさず、言葉を交わす場面も目撃されていない母娘関係,18,https://news.yahoo.co.jp/articles/5b5325dcf138b9d24296c1f198b6607d9b216d5e,10/21(火) 7:15
2025-10-21,15:12,life,ライフ,13,NEWSポストセブン,《10歳女児の身体中に刺青が…》「14歳の女子中学生に彫られた」ある児童養護施設で起きた“子供同士のトラブル”　職員は気づかず2ヶ月放置か,18,https://news.yahoo.co.jp/articles/86c89d35ef3761826f396f309fa3e3d12e921917,10/20(月) 16:20
2025-10-21,15:12,life,ライフ,14,FORZA STYLE,「もうやめて」運動会でお遊戯に「だせー！」と叫ぶ40代夫婦に子が懇願。崩壊したモンペの末路【専門家解説】,16,https://news.yahoo.co.jp/articles/0bd2a99b2099f527acca7be4f70938fa3f151740,10/21(火) 7:01
2025-10-21,15:12,life,ライフ,15,ラジトピ　ラジオ関西トピックス,「言葉づかい」「メロンパン」「コープ」…etc　神戸の“ちょっぴり特殊”な文化を若手芸人が紹介,16,https://news.yahoo.co.jp/articles/61e66ca1363a63c032636153a3ee34ea0692d1f4,10/21(火) 12:10
2025-10-21,15:12,life,ライフ,16,THE GOLD ONLINE（ゴールドオンライン）,「どうせローンでしょ？」同僚の一言に燃えた夫…残価設定ローンで買った〈憧れのSUV〉がもたらした夫婦の分岐点,16,https://news.yahoo.co.jp/articles/4baa041080b6f1e46bef28f02446cc0e4a598dce,10/20(月) 16:36
2025-10-21,15:12,life,ライフ,17,THE GOLD ONLINE（ゴールドオンライン）,老後の命綱のはずが…「年金」から「税金」が天引きされる理不尽。日本人が避けられない、生涯納税の過酷【税理士が解説】,15,https://news.yahoo.co.jp/articles/90981584fa375c25a2d20c597ada9bfe7814e5e3,10/21(火) 14:31
2025-10-21,15:12,life,ライフ,18,ワールドジェットスポーツマガジン,余罪は2億円以上！ ブラジル人が「CANインベーダー」使い、クルマを盗難！『 問題の本質は「クルマの盗難装置」が、今日も “隣国” で、正々堂々と 販売されている現実』を“放置”していること！,15,https://news.yahoo.co.jp/articles/06772147f67cb76663c4c3948f74e0e7436c4856,10/20(月) 17:04
2025-10-21,15:12,life,ライフ,19,ねとらぼ,彼女「簡単なものでいい？」→彼氏が“お弁当”を開けてみると……　「全然簡単じゃない」「最高かよ」「絶対逃してはいけない」,15,https://news.yahoo.co.jp/articles/1cc533e52bdf12482b80adcd70e16eb3eb25319f,10/21(火) 11:20
2025-10-21,15:12,life,ライフ,20,ダイヤモンド・オンライン,【全人類やめるべき】人生がダメになる「最悪のNG習慣」ワースト1,14,https://news.yahoo.co.jp/articles/715dcebcef96a9df0e64c58c2b7d63b5ad6f7817,10/21(火) 6:55
2025-10-21,15:12,life,ライフ,21,ファイナンシャルフィールド,子どもに「友だちとNetflixのアカウント共有していい？」と聞かれた！ うちが“月額を払ってる”のによその子にまで見せるのべきですか？ 規約もあわせ確認,13,https://news.yahoo.co.jp/articles/a74e06c4f2205f968ddce83b806360011e8b93ca,10/21(火) 13:50
2025-10-21,15:12,life,ライフ,22,LASISA,「質問なき報道陣」と「説明なき大臣」三原じゅん子の30秒会見が発端“7.3兆円予算”の大論争！ヤフコメ3000件が示した「こども家庭庁の存在意義への疑問」と「予算の誤解」,13,https://news.yahoo.co.jp/articles/45d7c15fc23130f273a5fad5eb71d7981337ce97,10/20(月) 18:51
2025-10-21,15:12,life,ライフ,23,弁護士ドットコムニュース,レンタル「モバイルバッテリー」友人に貸したら未返却状態に！  違約金は誰が支払うべき？,13,https://news.yahoo.co.jp/articles/197c48130710fb95e8d0077252d907a46825976c,10/21(火) 10:06
2025-10-21,15:12,life,ライフ,24,THE GOLD ONLINE（ゴールドオンライン）,猫に月1万円もかけるなんて…孫は可愛くないんですか？突然キレ始めた〈34歳嫁〉に唖然。68歳女性が息子一家と距離を置こうと決めたワケ,13,https://news.yahoo.co.jp/articles/d2252efed730491d02def9de7dc427979cd895f0,10/21(火) 8:01
2025-10-21,15:12,life,ライフ,25,Hint-Pot,「日本ではざらにあるんだ」　スペイン人が日本の街に感動するも……「もう少しあってもいい」と思ったものとは,12,https://news.yahoo.co.jp/articles/f13a91588b7b46b853832f8f85a3143c7a5c4572,10/21(火) 14:24
2025-10-21,15:12,life,ライフ,26,文春オンライン,“食い尽くし系”夫は「結婚前に比べて、体重が20キロほど増えました」「席につく頃には料理がなくなっている…」,12,https://news.yahoo.co.jp/articles/ce069875c2ee3ab48148770a20fba5bb51b9d960,10/20(月) 17:12
2025-10-21,15:12,life,ライフ,27,LASISA,なぜ男性は女性の“気遣い”を当たり前に思うのか？SNSで悲痛な声「心が折れる！」メンタルケアする女性たちの実態,12,https://news.yahoo.co.jp/articles/2485a9a59cd75e500b40480da6812556a021c98e,10/20(月) 18:15
2025-10-21,15:12,life,ライフ,28,FNNプライムオンライン,物価高のなか高級魚フグが“お手頃”価格　寿司店「安定した漁獲量」「規制緩和で届け出不要」で取り扱い拡大,11,https://news.yahoo.co.jp/articles/95d6c18951abd7cc9f54a9d153337e5a9d6d3b18,10/20(月) 22:48
2025-10-21,15:12,life,ライフ,29,オリコン,京都の行列ラーメン「本家第一旭」大阪初出店を発表　直営店が天満に10・31誕生【詳細・コメント】,11,https://news.yahoo.co.jp/articles/b1c795d28ba44d97534f57dd9e392086bd7a05fd,10/21(火) 13:39
2025-10-21,15:12,life,ライフ,30,マイナビニュース,"金2万円は""生活コスト上昇""の裏返し。専門家「一部利確×分割購入で家計防衛を」",11,https://news.yahoo.co.jp/articles/2692b3fafb317e0dddc8332233628e149d3b0039,10/21(火) 12:11
2025-10-21,15:12,life,ライフ,31,よろず～ニュース,"物価高騰でラーメンが1,300円！実はトッピングマシマシ「妥当なんじゃ...」【漫画】",11,https://news.yahoo.co.jp/articles/896871e6ad1f5f2cbf12959880dc5bbb8392629b,10/21(火) 12:10
2025-10-21,15:12,life,ライフ,32,まいどなニュース,ココス×ちいかわコラボメニュー、販売5日で売り切れ続出…メルカリ転売でファン悲鳴「第1弾は諦めた」,11,https://news.yahoo.co.jp/articles/7620b9c24d601a7cec064101cf1295fbdf6f9123,10/21(火) 6:50
2025-10-21,15:12,life,ライフ,33,Hint-Pot,「日本の小学校は、子どもやその親のことを疑っていないんだ！」　日本とアメリカ、宿題の意外な違いとは,10,https://news.yahoo.co.jp/articles/278e238d144e44243961f93fd9e03312de0e6765,10/21(火) 9:14
2025-10-21,15:12,life,ライフ,34,WEB歴史街道,日本はなぜ植民地支配を免れたのか？ 古代ローマとの共通点から考えられること,10,https://news.yahoo.co.jp/articles/8269ab698aea10b0ba7019a447736ab085250e7a,10/21(火) 11:53
2025-10-21,15:12,life,ライフ,35,THE GOLD ONLINE（ゴールドオンライン）,もう夫とは同じ空気も吸いたくない！48歳専業主婦「モラハラ夫に三行半」で清々するも、2年後に感じた猛烈な後悔「何かの間違いでは」,9,https://news.yahoo.co.jp/articles/7da6aa69f13870a402eb75f082d1f28ed408e5fb,10/21(火) 5:01
2025-10-21,15:12,life,ライフ,36,THE GOLD ONLINE（ゴールドオンライン）,"東京が恋しい…〈退職金2,300万円〉60歳定年男性、「沖縄移住」1カ月で号泣も、三線を片手に笑うワケ",9,https://news.yahoo.co.jp/articles/66a52640b02f7c5efad3ed1509db9a3f4433046c,10/21(火) 8:01
2025-10-21,15:12,life,ライフ,37,THE GOLD ONLINE（ゴールドオンライン）,まるで私が悪者みたいじゃない…父のため介護離職した56歳長女の叫び。54歳弟が帰省した途端「遺産を分けろ」と迫った理由【FPの助言】,9,https://news.yahoo.co.jp/articles/fa70c0221b1b169469bc016d02f9545e8289a584,10/21(火) 11:01
2025-10-21,15:12,life,ライフ,38,ENGINE WEB,日産が内燃エンジン搭載のティアナとPHEVのN6を年内に発売！日本への導入はあるのか,8,https://news.yahoo.co.jp/articles/8537fd1cb6f5901cce601d08bf135d991f4bf0a4,10/21(火) 7:00
2025-10-21,15:12,life,ライフ,39,まいどなニュース,親しくないのに…「一口ちょうだい」と私のケーキにフォークを伸ばすママ友→スタバの540円ケーキ半分をぱくっ！　非常識人物にはどう接したらいいですか？【心理カウンセラーが解説】,8,https://news.yahoo.co.jp/articles/790d4e53a5caa3ccc6b15028bfdfe0291c4bb1bf,10/21(火) 7:30
2025-10-21,15:12,life,ライフ,40,デイリー新潮,「転職なんて当たり前」の時代だからこそ「会社にしがみつく人生」が有利になる理由…65歳を過ぎてから威力を発揮する“転職0回の強み”とは,8,https://news.yahoo.co.jp/articles/a683b4d6a97f44dc3c63df8f339a6cbcd0cc68cf,10/21(火) 6:12
