scrp_date,scrp_time,genre_en,genre_jp,rank,media_jp,title,comment,link,date_original
2024-11-06,14:07,world,国際,1ドナルド・トランプ氏、「激戦州」のノースカロライナ州で勝利を確実に読売新聞オンライン11/6(水) 13:26518件/時,読売新聞オンライン,ドナルド・トランプ氏、「激戦州」のノースカロライナ州で勝利を確実に,518,https://news.yahoo.co.jp/articles/0ad619502a36246b73df8b46eb39db81f6ff0fcd,11/6(水) 13:26
2024-11-06,14:07,world,国際,2【開票速報】トランプ氏が新たにテキサス州・ノースダコタ州・サウスダコタ州・ワイオミング州で勝利し選挙人計154人獲得　ハリス氏は新たにデラウェア州で勝利し選挙人計30人獲得　FNNプライムオンライン（フジテレビ系）11/6(水) 11:19418件/時,FNNプライムオンライン（フジテレビ系）,【開票速報】トランプ氏が新たにテキサス州・ノースダコタ州・サウスダコタ州・ワイオミング州で勝利し選挙人計154人獲得　ハリス氏は新たにデラウェア州で勝利し選挙人計30人獲得,418,https://news.yahoo.co.jp/articles/613ca76c6b44f848e6060dba291b2ede2c2ae2b8,11/6(水) 11:19
2024-11-06,14:07,world,国際,3【開票速報】トランプ氏は新たにアイオワ・カンザスで勝利し選挙人計207人獲得　ハリス氏は計91人獲得　　FNNプライムオンライン（フジテレビ系）11/6(水) 12:49290件/時,FNNプライムオンライン（フジテレビ系）,【開票速報】トランプ氏は新たにアイオワ・カンザスで勝利し選挙人計207人獲得　ハリス氏は計91人獲得,290,https://news.yahoo.co.jp/articles/c037c4438db0fa10c0089f08425ec918361a7736,11/6(水) 12:49
2024-11-06,14:07,world,国際,4トランプ氏、フロリダ州で勝利確実【アメリカ大統領選挙】TBS NEWS DIG Powered by JNN11/6(水) 10:18163件/時,TBS NEWS DIG Powered by JNN,トランプ氏、フロリダ州で勝利確実【アメリカ大統領選挙】,163,https://news.yahoo.co.jp/articles/a5c81ce0813f794cbcfd9e8094b828f61eabc6cb,11/6(水) 10:18
2024-11-06,14:07,world,国際,5トランプ前大統領の勝利可能性が80％以上と分析　勝敗左右する“激戦州7州”では5つの州でトランプ優勢か　ニューヨーク・タイムズ紙FNNプライムオンライン（フジテレビ系）11/6(水) 12:58104件/時,FNNプライムオンライン（フジテレビ系）,トランプ前大統領の勝利可能性が80％以上と分析　勝敗左右する“激戦州7州”では5つの州でトランプ優勢か　ニューヨーク・タイムズ紙,104,https://news.yahoo.co.jp/articles/619bb8d4abbfabd13c787d53a071f3cc23d49ecb,11/6(水) 12:58
2024-11-06,14:07,world,国際,6読めない勝者、大接戦の米大統領選　統計分析や賭けサイトも予想割れ毎日新聞11/6(水) 5:3097件/時,毎日新聞,読めない勝者、大接戦の米大統領選　統計分析や賭けサイトも予想割れ,97,https://news.yahoo.co.jp/articles/eef10f777ef038c95dc6d8a9498cce4850880730,11/6(水) 5:30
2024-11-06,14:07,world,国際,7世紀の接戦、カギ握る7州　天王山はペンシルベニア　米大統領選時事通信11/6(水) 7:1363件/時,時事通信,世紀の接戦、カギ握る7州　天王山はペンシルベニア　米大統領選,63,https://news.yahoo.co.jp/articles/9cffdea21da3653e1ca1d648e30047b83bdd947f,11/6(水) 7:13
2024-11-06,14:07,world,国際,8北朝鮮兵多数死亡と米有力紙共同通信11/6(水) 9:3947件/時,共同通信,北朝鮮兵多数死亡と米有力紙,47,https://news.yahoo.co.jp/articles/c9c4928225c5ff1b4746141e58202114990beb40,11/6(水) 9:39
2024-11-06,14:07,world,国際,9「トランプ氏の当選見たくない」　欧州の米大使館で大統領選「観戦パーティー」中止相次ぐ産経新聞11/6(水) 12:3247件/時,産経新聞,「トランプ氏の当選見たくない」　欧州の米大使館で大統領選「観戦パーティー」中止相次ぐ,47,https://news.yahoo.co.jp/articles/4da98ed421d1d4ceb9f3dcc0c6b86c60361ff50c,11/6(水) 12:32
2024-11-06,14:07,world,国際,10米大統領選、投票始まる　歴史的接戦、大勢判明に数日か時事通信11/5(火) 20:0940件/時,時事通信,米大統領選、投票始まる　歴史的接戦、大勢判明に数日か,40,https://news.yahoo.co.jp/articles/0b4f992a783d232378edac2a32fcec8305fde28e,11/5(火) 20:09
2024-11-06,14:07,world,国際,11アイオワ州、トランプ氏が勝利確実　直前の世論調査ではハリス氏優勢毎日新聞11/6(水) 13:0634件/時,毎日新聞,アイオワ州、トランプ氏が勝利確実　直前の世論調査ではハリス氏優勢,34,https://news.yahoo.co.jp/articles/e5d4591b3f3c98b3aae95e01f94f9e8973350644,11/6(水) 13:06
2024-11-06,14:07,world,国際,12「ハリス５６％、トランプ４３％」　米大統領選当日に大差の予測中央日報日本語版11/6(水) 8:2934件/時,中央日報日本語版,「ハリス５６％、トランプ４３％」　米大統領選当日に大差の予測,34,https://news.yahoo.co.jp/articles/eba7f6391f443abbc4bdf770e9a346d28b5b3f26,11/6(水) 8:29
2024-11-06,14:07,world,国際,13「エアショー・チャイナ2024」でJ-35Aステルス戦闘機を初公開・中国東方新報11/6(水) 13:0233件/時,東方新報,「エアショー・チャイナ2024」でJ-35Aステルス戦闘機を初公開・中国,33,https://news.yahoo.co.jp/articles/7fd699928131ce9092717a7230406be50c4cb695,11/6(水) 13:02
2024-11-06,14:07,world,国際,14ハリス氏が選挙人54のカリフォルニア州で勝利確実　これまでの開票状況は？“激戦州”を制するのは？【アメリカ大統領選挙】TBS NEWS DIG Powered by JNN11/6(水) 13:0532件/時,TBS NEWS DIG Powered by JNN,ハリス氏が選挙人54のカリフォルニア州で勝利確実　これまでの開票状況は？“激戦州”を制するのは？【アメリカ大統領選挙】,32,https://news.yahoo.co.jp/articles/e62aac97065d18c8021b90ab8847dc232725c0c6,11/6(水) 13:05
2024-11-06,14:07,world,国際,15【開票速報】ハリス氏が新たに最大票田カリフォルニアで勝利し選挙人合計145人獲得　トランプ氏はアイダホ勝利で計211人獲得　　FNNプライムオンライン（フジテレビ系）11/6(水) 13:0929件/時,FNNプライムオンライン（フジテレビ系）,【開票速報】ハリス氏が新たに最大票田カリフォルニアで勝利し選挙人合計145人獲得　トランプ氏はアイダホ勝利で計211人獲得,29,https://news.yahoo.co.jp/articles/fa95d3f316f0e97bc821952e18fe4e9574736658,11/6(水) 13:09
2024-11-06,14:07,world,国際,16WHO、ワクチン開発を優先すべき17種の病原体をリスト化ＡＦＰ＝時事11/6(水) 12:5828件/時,ＡＦＰ＝時事,WHO、ワクチン開発を優先すべき17種の病原体をリスト化,28,https://news.yahoo.co.jp/articles/d7ebade723ae57f426624d974b77fb9c1496b61a,11/6(水) 12:58
2024-11-06,14:07,world,国際,17トランプ氏、午前2時まで演説　「投票は明日ではなく今日」毎日新聞11/5(火) 17:4628件/時,毎日新聞,トランプ氏、午前2時まで演説　「投票は明日ではなく今日」,28,https://news.yahoo.co.jp/articles/8d32135a25989924202997f1fa1cfe68243f7368,11/5(火) 17:46
2024-11-06,14:07,world,国際,18【開票速報】ハリス氏が新たにオレゴン州で勝利し選挙人合計153人獲得　トランプ氏はアイダホ勝利で計211人獲得　　FNNプライムオンライン（フジテレビ系）11/6(水) 13:2227件/時,FNNプライムオンライン（フジテレビ系）,【開票速報】ハリス氏が新たにオレゴン州で勝利し選挙人合計153人獲得　トランプ氏はアイダホ勝利で計211人獲得,27,https://news.yahoo.co.jp/articles/05cb9a114520dc0e5f58ed949e799ca925e687d8,11/6(水) 13:22
2024-11-06,14:07,world,国際,19露プーチン大統領、各国の新任大使を前に演説「西側との対立は望んでいない」日テレNEWS NNN11/5(火) 23:1727件/時,日テレNEWS NNN,露プーチン大統領、各国の新任大使を前に演説「西側との対立は望んでいない」,27,https://news.yahoo.co.jp/articles/7e3be33040643ca2bf0085574d15f8159b018e44,11/5(火) 23:17
2024-11-06,14:07,world,国際,20最激戦州で「ブルーミラージュ」　開票序盤でハリス氏が実態よりリード毎日新聞11/6(水) 12:0526件/時,毎日新聞,最激戦州で「ブルーミラージュ」　開票序盤でハリス氏が実態よりリード,26,https://news.yahoo.co.jp/articles/9599bf31b37e7bbeb0f68b322395e62adaef66a9,11/6(水) 12:05
2024-11-06,14:07,world,国際,21米大統領選、開票所など有刺鉄線で囲み州警察も派遣…トランプ氏敗北の場合「暴力心配」が５７％読売新聞オンライン11/5(火) 20:2125件/時,読売新聞オンライン,米大統領選、開票所など有刺鉄線で囲み州警察も派遣…トランプ氏敗北の場合「暴力心配」が５７％,25,https://news.yahoo.co.jp/articles/8e4a23d851745ba16ea2f4be28bfa14fe4a3e524,11/5(火) 20:21
2024-11-06,14:07,world,国際,221:09「絶対に落とせない」ペンシルベニア州はハリス氏優勢　差は詰まる【アメリカ大統領選】TBS NEWS DIG Powered by JNN11/6(水) 11:5424件/時,TBS NEWS DIG Powered by JNN,「絶対に落とせない」ペンシルベニア州はハリス氏優勢　差は詰まる【アメリカ大統領選】,24,https://news.yahoo.co.jp/articles/d9c5683433dab647a48f4875e84ab51300e3be49,11/6(水) 11:54
2024-11-06,14:07,world,国際,23日帝時代の「朝鮮一の土地長者」反民族親日派ミン・ヨンフィの財産没収運動開始ハンギョレ新聞11/6(水) 9:4924件/時,ハンギョレ新聞,日帝時代の「朝鮮一の土地長者」反民族親日派ミン・ヨンフィの財産没収運動開始,24,https://news.yahoo.co.jp/articles/90849ac46b8ce03c3409f4979d28da4748901ff0,11/6(水) 9:49
2024-11-06,14:07,world,国際,24開票進む米大統領選　激戦7州が勝敗左右　少なくとも3州で勝利必要毎日新聞11/6(水) 11:0824件/時,毎日新聞,開票進む米大統領選　激戦7州が勝敗左右　少なくとも3州で勝利必要,24,https://news.yahoo.co.jp/articles/f68f33eba90d6ba1189c4c388c7a561d6021edf8,11/6(水) 11:08
2024-11-06,14:07,world,国際,25アングル：迫る米大統領選、騒乱に身構える有権者　不安極限にロイター11/5(火) 12:1820件/時,ロイター,アングル：迫る米大統領選、騒乱に身構える有権者　不安極限に,20,https://news.yahoo.co.jp/articles/6b48d502392aedb4eba9e2a367f04e29e2213633,11/5(火) 12:18
2024-11-06,14:07,world,国際,26トランプ氏、激戦州で「大規模な不正行為」と投稿　当局は否定毎日新聞11/6(水) 7:5318件/時,毎日新聞,トランプ氏、激戦州で「大規模な不正行為」と投稿　当局は否定,18,https://news.yahoo.co.jp/articles/7741b226e73a3943e288022977a3c206060b9ca3,11/6(水) 7:53
2024-11-06,14:07,world,国際,27激戦4州の投票所に偽の爆破予告、ロシアから発信か　米大統領選ロイター11/6(水) 4:3717件/時,ロイター,激戦4州の投票所に偽の爆破予告、ロシアから発信か　米大統領選,17,https://news.yahoo.co.jp/articles/43176c5b62aaad5de874e0d5b6ba32347a5d814b,11/6(水) 4:37
2024-11-06,14:07,world,国際,28【開票速報】トランプ氏は新たにオハイオ州で勝利し選挙人計195人獲得　ハリス氏が新たにコロラド州で勝利し選挙人計91人獲得　　FNNプライムオンライン（フジテレビ系）11/6(水) 12:2815件/時,FNNプライムオンライン（フジテレビ系）,【開票速報】トランプ氏は新たにオハイオ州で勝利し選挙人計195人獲得　ハリス氏が新たにコロラド州で勝利し選挙人計91人獲得,15,https://news.yahoo.co.jp/articles/3f256d3ffc2326f4b1d8d381ef9a9cf030e51976,11/6(水) 12:28
2024-11-06,14:07,world,国際,29韓国・失われたマナー…靴のまま横たわる女性は「いったい、どこの（国の）人？」KOREA WAVE11/6(水) 5:0315件/時,KOREA WAVE,韓国・失われたマナー…靴のまま横たわる女性は「いったい、どこの（国の）人？」,15,https://news.yahoo.co.jp/articles/312738939d6de89867cf804e77cac726085a8b8a,11/6(水) 5:03
2024-11-06,14:07,world,国際,301:33米大統領選　開票おおむね順調　トランプ氏早々に“勝利宣言”の見方もテレビ朝日系（ANN）11/6(水) 12:3014件/時,テレビ朝日系（ANN）,米大統領選　開票おおむね順調　トランプ氏早々に“勝利宣言”の見方も,14,https://news.yahoo.co.jp/articles/63c0fb604439ac155339a62cc1ae12a5105add84,11/6(水) 12:30
2024-11-06,14:07,world,国際,31玉木氏、年収の壁の上げ幅こだわらずと理解＝宮沢自民税調会長ロイター11/6(水) 11:3114件/時,ロイター,玉木氏、年収の壁の上げ幅こだわらずと理解＝宮沢自民税調会長,14,https://news.yahoo.co.jp/articles/28597543dd610a148b2bb9c4d156fe0c83b0041a,11/6(水) 11:31
2024-11-06,14:07,world,国際,32北朝鮮兵がウクライナ軍と初めて交戦し多数死亡か…ゼレンスキー大統領「世界の不安定化の新たな一章の幕開け」FNNプライムオンライン（フジテレビ系）11/6(水) 13:4313件/時,FNNプライムオンライン（フジテレビ系）,北朝鮮兵がウクライナ軍と初めて交戦し多数死亡か…ゼレンスキー大統領「世界の不安定化の新たな一章の幕開け」,13,https://news.yahoo.co.jp/articles/0c6621d510134696b79df28688599bff43b0ef14,11/6(水) 13:43
2024-11-06,14:07,world,国際,33【米大統領選】トランプ氏「公正な選挙なら、負けた場合には認める」テレビ朝日系（ANN）11/6(水) 7:3413件/時,テレビ朝日系（ANN）,【米大統領選】トランプ氏「公正な選挙なら、負けた場合には認める」,13,https://news.yahoo.co.jp/articles/e9c4f2c6034a92757973cb93cb268257d416506f,11/6(水) 7:34
2024-11-06,14:07,world,国際,34中国系ハッカー集団「ソルト・タイフーン」、米安全保障担当の高官らの携帯電話回線に侵入か読売新聞オンライン11/6(水) 10:5913件/時,読売新聞オンライン,中国系ハッカー集団「ソルト・タイフーン」、米安全保障担当の高官らの携帯電話回線に侵入か,13,https://news.yahoo.co.jp/articles/3a9d8bec6d12c74c2f7846112e6db592fefd2430,11/6(水) 10:59
2024-11-06,14:07,world,国際,35〈米大統領選〉前日の予想では７つの激戦州のうち５州でトランプがリードか、ニューヨークに住む中国系の住人も「トランプ！トランプ！トランプ！」と熱狂集英社オンライン11/6(水) 11:1813件/時,集英社オンライン,〈米大統領選〉前日の予想では７つの激戦州のうち５州でトランプがリードか、ニューヨークに住む中国系の住人も「トランプ！トランプ！トランプ！」と熱狂,13,https://news.yahoo.co.jp/articles/bf16548d4812d1b245fa2603eac735907ea21d01,11/6(水) 11:18
2024-11-06,14:07,world,国際,36ベトナム女性観光客、全身レギンス姿でソウル景福宮でヨガ…「恥ずかしい」自国で袋叩きに中央日報日本語版11/6(水) 9:0213件/時,中央日報日本語版,ベトナム女性観光客、全身レギンス姿でソウル景福宮でヨガ…「恥ずかしい」自国で袋叩きに,13,https://news.yahoo.co.jp/articles/2d1b7b0c2a5bbae7885c4ded1a64be3943505760,11/6(水) 9:02
2024-11-06,14:07,world,国際,37中国の「独裁体制」にいったい何が…「習近平の名前」が党中央政治局と人民解放軍の重要文書から消えた！現代ビジネス11/6(水) 6:1013件/時,現代ビジネス,中国の「独裁体制」にいったい何が…「習近平の名前」が党中央政治局と人民解放軍の重要文書から消えた！,13,https://news.yahoo.co.jp/articles/826cdb709ff3e3dd81423f10984b58f635590795,11/6(水) 6:10
2024-11-06,14:07,world,国際,38韓国の“ハワイ”は日本の領土？カナダの教科書に誤記…「現地人は済州島を日本領と学んでいる？」危機感KOREA WAVE11/6(水) 4:0312件/時,KOREA WAVE,韓国の“ハワイ”は日本の領土？カナダの教科書に誤記…「現地人は済州島を日本領と学んでいる？」危機感,12,https://news.yahoo.co.jp/articles/eb50a34266bc28b58e219dcdeb61b0130003b792,11/6(水) 4:03
2024-11-06,14:07,world,国際,39北朝鮮兵が味方のロシア兵に発砲して2人死亡!?　ウクライナ軍と北朝鮮兵が初交戦ニューズウィーク日本版11/5(火) 17:5912件/時,ニューズウィーク日本版,北朝鮮兵が味方のロシア兵に発砲して2人死亡!?　ウクライナ軍と北朝鮮兵が初交戦,12,https://news.yahoo.co.jp/articles/7763547878c2b5bb0eaf5aa6c310fa2f0352c8ad,11/5(火) 17:59
2024-11-06,14:07,world,国際,40【開票速報】ハリス氏が新たにニューヨーク州・イリノイ州で勝利し選挙人計81人獲得　トランプ氏は新たにルイジアナ州で勝利し選挙人計162人獲得　FNNプライムオンライン（フジテレビ系）11/6(水) 11:4312件/時,FNNプライムオンライン（フジテレビ系）,【開票速報】ハリス氏が新たにニューヨーク州・イリノイ州で勝利し選挙人計81人獲得　トランプ氏は新たにルイジアナ州で勝利し選挙人計162人獲得,12,https://news.yahoo.co.jp/articles/6b4fde8d5745d389ee14d205965fda79a8c90b24,11/6(水) 11:43
