scrp_date,scrp_time,genre_en,genre_jp,rank,media_jp,title,comment,link,date_original
2024-11-06,11:27,business,経済,1ヤマトＨＤが業績予想下方修正、コスト上昇　4─9月期は赤字転落ロイター11/5(火) 16:57157件/時,ロイター,ヤマトＨＤが業績予想下方修正、コスト上昇　4─9月期は赤字転落,157,https://news.yahoo.co.jp/articles/219bf5af94b23bf87fe8a6104f3edff6b386f945,11/5(火) 16:57
2024-11-06,11:27,business,経済,2「カフェが混みすぎて座れない」「いじわるベンチを使うのは訪日客だけ」…東京に「座るにも金が要る街」が増えた本質的な理由とは？東洋経済オンライン11/6(水) 6:3679件/時,東洋経済オンライン,「カフェが混みすぎて座れない」「いじわるベンチを使うのは訪日客だけ」…東京に「座るにも金が要る街」が増えた本質的な理由とは？,79,https://news.yahoo.co.jp/articles/5c13392ead1c737ff40784d210ad4cbeeabbd4d4,11/6(水) 6:36
2024-11-06,11:27,business,経済,3視聴率が証明した残酷な格差…ファッション好き20～40代独身女性がDeNAよりドジャースの男たちに虜のワケプレジデントオンライン11/6(水) 10:1772件/時,プレジデントオンライン,視聴率が証明した残酷な格差…ファッション好き20～40代独身女性がDeNAよりドジャースの男たちに虜のワケ,72,https://news.yahoo.co.jp/articles/3ba78e6f38ec7e414b6cc6515aee8ab7efeb3a4e,11/6(水) 10:17
2024-11-06,11:27,business,経済,4広島空港、なぜ市街地からメチャ遠い？「新幹線の方が速くね？」な謎立地となった経緯とは乗りものニュース11/6(水) 8:1260件/時,乗りものニュース,広島空港、なぜ市街地からメチャ遠い？「新幹線の方が速くね？」な謎立地となった経緯とは,60,https://news.yahoo.co.jp/articles/8ecfebfcda94f801fafe7edb81a3180e980db8ca,11/6(水) 8:12
2024-11-06,11:27,business,経済,5電動キックボードで「飲酒運転」続発、レンタル最大手Luupの監査役に元警視総監が就任する狙いとは？ダイヤモンド・オンライン11/6(水) 7:0260件/時,ダイヤモンド・オンライン,電動キックボードで「飲酒運転」続発、レンタル最大手Luupの監査役に元警視総監が就任する狙いとは？,60,https://news.yahoo.co.jp/articles/87b6ed9e38e1decc5c72f6125f570c8c5b88efae,11/6(水) 7:02
2024-11-06,11:27,business,経済,6103万円の壁を巡る“攻防”で「財務省が置き去りに…」　国民民主党の主張と財務省の懸念　エコノミスト末廣徹氏「玉木さんが損しない構図」TBS NEWS DIG Powered by JNN11/6(水) 10:4851件/時,TBS NEWS DIG Powered by JNN,103万円の壁を巡る“攻防”で「財務省が置き去りに…」　国民民主党の主張と財務省の懸念　エコノミスト末廣徹氏「玉木さんが損しない構図」,51,https://news.yahoo.co.jp/articles/ac3601da4936d693b7b570c9278a4515fbb8f99e,11/6(水) 10:48
2024-11-06,11:27,business,経済,7「無敵の人」はなぜ生まれるのか？私たちがあえて見ないようにしている「助けたい姿をしていない弱者」という存在THE GOLD ONLINE（ゴールドオンライン）11/6(水) 10:0244件/時,THE GOLD ONLINE（ゴールドオンライン）,「無敵の人」はなぜ生まれるのか？私たちがあえて見ないようにしている「助けたい姿をしていない弱者」という存在,44,https://news.yahoo.co.jp/articles/3bca67cb35bbd442cd3f42dac7861e5331532398,11/6(水) 10:02
2024-11-06,11:27,business,経済,8日経平均一時５００円超上昇、終値４２１円高の３万８４７４円…７０年ぶり終了延長の初日読売新聞オンライン11/5(火) 15:4241件/時,読売新聞オンライン,日経平均一時５００円超上昇、終値４２１円高の３万８４７４円…７０年ぶり終了延長の初日,41,https://news.yahoo.co.jp/articles/395437af537f5164324d8c3baea834664bcf0aac,11/5(火) 15:42
2024-11-06,11:27,business,経済,9漏洩パスワード、最も多い文字列は「123456」　配列なぞった「qwerty」も4位産経新聞11/5(火) 17:2840件/時,産経新聞,漏洩パスワード、最も多い文字列は「123456」　配列なぞった「qwerty」も4位,40,https://news.yahoo.co.jp/articles/985b662015cb076a4429fe69f60c68812796c9a1,11/5(火) 17:28
2024-11-06,11:27,business,経済,10「社長、あの人とは働けません」退職希望者が続出…元凶の“年上の新入社員”をクビにできるのか？弁護士ドットコムニュース11/6(水) 10:0032件/時,弁護士ドットコムニュース,「社長、あの人とは働けません」退職希望者が続出…元凶の“年上の新入社員”をクビにできるのか？,32,https://news.yahoo.co.jp/articles/8b14e9d9cec4242068a13a03fee461972393605b,11/6(水) 10:00
2024-11-06,11:27,business,経済,11「歯医者」の倒産・廃業、前年超え年間最多　前年比1.8倍ペース 歯科医の高齢化が影響　廃業時の平均年齢は70歳にせまる帝国データバンク11/6(水) 10:0132件/時,帝国データバンク,「歯医者」の倒産・廃業、前年超え年間最多　前年比1.8倍ペース 歯科医の高齢化が影響　廃業時の平均年齢は70歳にせまる,32,https://news.yahoo.co.jp/articles/dc87532e864d801b8cd7a00bc4feea115b5a9305,11/6(水) 10:01
2024-11-06,11:27,business,経済,12「右眼球が眼窩から外れて露出」…恐怖のクマ被害が日本列島で増加中に「日当8500円」に猟師たちも怒り爆発！いくらなんでも安すぎるみんかぶマガジン11/6(水) 9:1020件/時,みんかぶマガジン,「右眼球が眼窩から外れて露出」…恐怖のクマ被害が日本列島で増加中に「日当8500円」に猟師たちも怒り爆発！いくらなんでも安すぎる,20,https://news.yahoo.co.jp/articles/b9ba066e9ad98d85fa6871661bac9d408ecb5408,11/6(水) 9:10
2024-11-06,11:27,business,経済,13アルファードの敵!? 新型[エルグランド]がカッコいい!! 高級感マシマシの予想CG大公開ベストカーWeb11/6(水) 6:0019件/時,ベストカーWeb,アルファードの敵!? 新型[エルグランド]がカッコいい!! 高級感マシマシの予想CG大公開,19,https://news.yahoo.co.jp/articles/5d013cc728838968779dd520dc9e1b1c31e8e722,11/6(水) 6:00
2024-11-06,11:27,business,経済,14免許取得から3年経っているのに、娘が「初心者マーク」を付けて運転していました。さすがに罰金にはならないですよね…？ファイナンシャルフィールド11/6(水) 8:4018件/時,ファイナンシャルフィールド,免許取得から3年経っているのに、娘が「初心者マーク」を付けて運転していました。さすがに罰金にはならないですよね…？,18,https://news.yahoo.co.jp/articles/a65353c817448998ca6ef56d81a8715ba6ad6741,11/6(水) 8:40
2024-11-06,11:27,business,経済,15「年収103万円の壁」議論へ　自民税調が非公式幹部会共同通信11/6(水) 9:5418件/時,共同通信,「年収103万円の壁」議論へ　自民税調が非公式幹部会,18,https://news.yahoo.co.jp/articles/a3bedc6179e4f70f92d6116c50772ea4cd5d6627,11/6(水) 9:54
2024-11-06,11:27,business,経済,16「売れ残りタワマン6000万戸」という中国の悪夢…大迷走の中国経済を待ち受ける「”失われた30年超”の暗黒期」現代ビジネス11/6(水) 7:3017件/時,現代ビジネス,「売れ残りタワマン6000万戸」という中国の悪夢…大迷走の中国経済を待ち受ける「”失われた30年超”の暗黒期」,17,https://news.yahoo.co.jp/articles/00fef6210305fd45f2676d3ca41abce41340d5c4,11/6(水) 7:30
2024-11-06,11:27,business,経済,17NHK、34年ぶり赤字の原因はどこにある？　ネトフリと比べて分かる“いびつ”な構造ITmedia ビジネスオンライン11/5(火) 12:1017件/時,ITmedia ビジネスオンライン,NHK、34年ぶり赤字の原因はどこにある？　ネトフリと比べて分かる“いびつ”な構造,17,https://news.yahoo.co.jp/articles/2783c47d7386cbe08de110e468772e138b75107a,11/5(火) 12:10
2024-11-06,11:27,business,経済,18東京メトロ、有楽町線・南北線の延伸工事を開始　2030年代半ばに開業予定鉄道コム11/5(火) 17:0016件/時,鉄道コム,東京メトロ、有楽町線・南北線の延伸工事を開始　2030年代半ばに開業予定,16,https://news.yahoo.co.jp/articles/47a2b5bf8db9cedb22fbe21892ce5edf4f0fa8a2,11/5(火) 17:00
2024-11-06,11:27,business,経済,19「990円ジーンズ」の衝撃から15年、GU愛用者たちが実感する“低価格イメージ”の変化　「もはや昔のユニクロ価格」「自分のなかで中途半端な立ち位置に」マネーポストWEB11/5(火) 15:1515件/時,マネーポストWEB,「990円ジーンズ」の衝撃から15年、GU愛用者たちが実感する“低価格イメージ”の変化　「もはや昔のユニクロ価格」「自分のなかで中途半端な立ち位置に」,15,https://news.yahoo.co.jp/articles/0003a32aee9b027f651129be8975c649345a69f9,11/5(火) 15:15
2024-11-06,11:27,business,経済,20タイヤはクルマの命綱なだけに見た目で選ぶのはダメ！　とりわけ選択肢の多いクロカン4WD車のタイヤ選びの正解とはWEB CARTOP11/6(水) 10:1015件/時,WEB CARTOP,タイヤはクルマの命綱なだけに見た目で選ぶのはダメ！　とりわけ選択肢の多いクロカン4WD車のタイヤ選びの正解とは,15,https://news.yahoo.co.jp/articles/705e791416af47871ce838a08548c09d2b53355a,11/6(水) 10:10
2024-11-06,11:27,business,経済,21ボーイングのスト終結、賃上げ案を承認　6日にも生産再開へロイター11/5(火) 14:1313件/時,ロイター,ボーイングのスト終結、賃上げ案を承認　6日にも生産再開へ,13,https://news.yahoo.co.jp/articles/165b88787dc93f659fa1b0bebd0e1d223a8b745f,11/5(火) 14:13
2024-11-06,11:27,business,経済,22日本の航空機工業界の第一人者に聞く、「国産航空機」を製造する秘策とはビジネス＋IT11/6(水) 6:5012件/時,ビジネス＋IT,日本の航空機工業界の第一人者に聞く、「国産航空機」を製造する秘策とは,12,https://news.yahoo.co.jp/articles/2c891997044e41432675950b11324ff8d24086b6,11/6(水) 6:50
2024-11-06,11:27,business,経済,23中国海軍の国産空母と巨大ミサイル艦が日本近海に出現！「ベテラン護衛艦」が警戒監視  艦載機の発着も確認乗りものニュース11/6(水) 6:1212件/時,乗りものニュース,中国海軍の国産空母と巨大ミサイル艦が日本近海に出現！「ベテラン護衛艦」が警戒監視  艦載機の発着も確認,12,https://news.yahoo.co.jp/articles/5d3ef485b6c2887b0d37f4b7e113ccb49b2b3e6c,11/6(水) 6:12
2024-11-06,11:27,business,経済,24国民民主が唱える「103万円の壁」解消に政府が喧伝…“金持ちほど恩恵”のレッテル貼りはマヤカシ日刊ゲンダイDIGITAL11/5(火) 16:0312件/時,日刊ゲンダイDIGITAL,国民民主が唱える「103万円の壁」解消に政府が喧伝…“金持ちほど恩恵”のレッテル貼りはマヤカシ,12,https://news.yahoo.co.jp/articles/a90552420913ec3a22eceb219bee32e8361dea17,11/5(火) 16:03
2024-11-06,11:27,business,経済,25スライドドアは正義じゃない!! 意外なデメリットも!? 走りが超いい[トヨタ]のヒンジドアミニバン5選ベストカーWeb11/6(水) 7:0011件/時,ベストカーWeb,スライドドアは正義じゃない!! 意外なデメリットも!? 走りが超いい[トヨタ]のヒンジドアミニバン5選,11,https://news.yahoo.co.jp/articles/92def87782f2a56bb5355de101ee2da74cd7a828,11/6(水) 7:00
2024-11-06,11:27,business,経済,26ルールを知ってる？ 違反にならないためのタンデムの5つの条件とはバイクのニュース11/6(水) 10:1010件/時,バイクのニュース,ルールを知ってる？ 違反にならないためのタンデムの5つの条件とは,10,https://news.yahoo.co.jp/articles/8a96373dde2d4672f9e26db995316ce0119ea47a,11/6(水) 10:10
2024-11-06,11:27,business,経済,27育休を終えた30代女性、職場復帰したら降格に……。これってマタハラになる？ダイヤモンド・オンライン11/6(水) 6:0210件/時,ダイヤモンド・オンライン,育休を終えた30代女性、職場復帰したら降格に……。これってマタハラになる？,10,https://news.yahoo.co.jp/articles/f20b749f0fcfd8f2411670e1d1065af41f9554e1,11/6(水) 6:02
2024-11-06,11:27,business,経済,28「103万円の壁」見直し　「国と地方の負担のあり方も検討」　加藤勝信財務相が指摘産経新聞11/5(火) 12:5710件/時,産経新聞,「103万円の壁」見直し　「国と地方の負担のあり方も検討」　加藤勝信財務相が指摘,10,https://news.yahoo.co.jp/articles/571bdf2dc75352643f0f5dd5b90aca08679d825d,11/5(火) 12:57
2024-11-06,11:27,business,経済,29石破首相「適材適所」どこに？ 裏金問題を扱う法相の後任に裏金疑惑の鈴木馨祐氏を充てる仰天日刊ゲンダイDIGITAL11/5(火) 15:0310件/時,日刊ゲンダイDIGITAL,石破首相「適材適所」どこに？ 裏金問題を扱う法相の後任に裏金疑惑の鈴木馨祐氏を充てる仰天,10,https://news.yahoo.co.jp/articles/1d338eb8a6ef9d66ea77ede310ceabfa368262d2,11/5(火) 15:03
2024-11-06,11:27,business,経済,30ヤマトHD赤字111億円　ネット通販の荷物振るわず共同通信11/5(火) 18:5010件/時,共同通信,ヤマトHD赤字111億円　ネット通販の荷物振るわず,10,https://news.yahoo.co.jp/articles/5794f4129e87d056cc3d3626e74d3f560c5b6b06,11/5(火) 18:50
2024-11-06,11:27,business,経済,31マツダ「“軽”RX-7!?」に反響多数！ まさかの「スズキ製」エンジンに驚きの声も！ 上野美装「エフディーノ」まもなく登場くるまのニュース11/5(火) 11:509件/時,くるまのニュース,マツダ「“軽”RX-7!?」に反響多数！ まさかの「スズキ製」エンジンに驚きの声も！ 上野美装「エフディーノ」まもなく登場,9,https://news.yahoo.co.jp/articles/6eb5580582e35860c9b72475afa539018b0aad3d,11/5(火) 11:50
2024-11-06,11:27,business,経済,32生産性が低い企業は市場から退出を迫られる…これから日本経済で起こること現代ビジネス11/6(水) 6:209件/時,現代ビジネス,生産性が低い企業は市場から退出を迫られる…これから日本経済で起こること,9,https://news.yahoo.co.jp/articles/eb3b65af9ac735f11e54006b10793a29f9071bf8,11/6(水) 6:20
2024-11-06,11:27,business,経済,33「新幹線だけの駅」本庄早稲田、知らない間に大発展していた　駅名ばかりで判断すると「真の姿」を見誤る東洋経済オンライン11/6(水) 4:329件/時,東洋経済オンライン,「新幹線だけの駅」本庄早稲田、知らない間に大発展していた　駅名ばかりで判断すると「真の姿」を見誤る,9,https://news.yahoo.co.jp/articles/bfbc2fdc527f7a69390a9f1e8b597c385d4d1e47,11/6(水) 4:32
2024-11-06,11:27,business,経済,34国民民主が自公に迫る「手取り増」　専門家が「生活の助けになるが、年収の壁解消の決め手にはならない」断言する理由J-CASTニュース11/5(火) 19:579件/時,J-CASTニュース,国民民主が自公に迫る「手取り増」　専門家が「生活の助けになるが、年収の壁解消の決め手にはならない」断言する理由,9,https://news.yahoo.co.jp/articles/023650f3342c9fb72a378ff85faaac2d44e97aa2,11/5(火) 19:57
2024-11-06,11:27,business,経済,35ボーイング1万7000人削減の衝撃！ 「B777X」も完成延期で、ストライキ1兆円損失で泣きっ面に蜂！ 一体どこへ向かうのか？Merkmal11/6(水) 5:418件/時,Merkmal,ボーイング1万7000人削減の衝撃！ 「B777X」も完成延期で、ストライキ1兆円損失で泣きっ面に蜂！ 一体どこへ向かうのか？,8,https://news.yahoo.co.jp/articles/19104f7cc5b5f6240cb8e9ec9b436502ecd8674d,11/6(水) 5:41
2024-11-06,11:27,business,経済,36首都高が新型「黄バイ」を初公開！ “白バイ”ではない「新たな緊急車両」が都心に登場！ ホンダ製から史上初の「輸入モデル」に！ BMW「F900 XR」パトロール仕様を投入くるまのニュース11/6(水) 8:258件/時,くるまのニュース,首都高が新型「黄バイ」を初公開！ “白バイ”ではない「新たな緊急車両」が都心に登場！ ホンダ製から史上初の「輸入モデル」に！ BMW「F900 XR」パトロール仕様を投入,8,https://news.yahoo.co.jp/articles/8de2018959831812b52d6ae0ad0b9d692bf145f1,11/6(水) 8:25
2024-11-06,11:27,business,経済,37住民税減収は4兆円と総務相　「年収の壁」見直しなら共同通信11/5(火) 19:188件/時,共同通信,住民税減収は4兆円と総務相　「年収の壁」見直しなら,8,https://news.yahoo.co.jp/articles/61c12833d987ddf8860f3fab777fb4d051c37db3,11/5(火) 19:18
2024-11-06,11:27,business,経済,38ホンダがV型3気筒エンジンコンセプトを初公開！電動過給機付きは世界初…EICMA2024レスポンス11/6(水) 6:008件/時,レスポンス,ホンダがV型3気筒エンジンコンセプトを初公開！電動過給機付きは世界初…EICMA2024,8,https://news.yahoo.co.jp/articles/73f134c610f593432779a554bf53c2c56e6f6711,11/6(水) 6:00
2024-11-06,11:27,business,経済,39夫より稼いでいる妻が「ワンオペ育児」 を理由に「離婚」を決断も、夫は頑なに拒否…訴訟でも認められないワケ【弁護士が解説】THE GOLD ONLINE（ゴールドオンライン）11/5(火) 14:328件/時,THE GOLD ONLINE（ゴールドオンライン）,夫より稼いでいる妻が「ワンオペ育児」 を理由に「離婚」を決断も、夫は頑なに拒否…訴訟でも認められないワケ【弁護士が解説】,8,https://news.yahoo.co.jp/articles/66c93a24b74ef8fbb335e4240d276e232d1d6209,11/5(火) 14:32
2024-11-06,11:27,business,経済,40国民民主党・経済政策の財源問題②：教育国債とは何か？NRI研究員の時事解説11/6(水) 6:038件/時,NRI研究員の時事解説,国民民主党・経済政策の財源問題②：教育国債とは何か？,8,https://news.yahoo.co.jp/articles/ce32ec5f4139fdfba56193cc4e7e622d222967dd,11/6(水) 6:03
