scrp_date,scrp_time,genre_en,genre_jp,rank,media_jp,title,comment,link,date_original
2024-05-06,07:19,TTL,総合,1,TBS NEWS DIG Powered by JNN,【速報】岸田内閣の支持率29.8％　前回調査より7.0ポイント上昇　5月JNN世論調査,710,https://news.yahoo.co.jp/articles/b0780dd88df2723b1d5953c2a3c9f61dd0bc753d,5/5(日) 22:30
2024-05-06,07:19,TTL,総合,2,日テレNEWS NNN,河川敷でバーベキューの男性不明…川底から遺体で発見　茨城・日立市,203,https://news.yahoo.co.jp/articles/98ae1e6e26f7e1d994946c4565ce1b2562e41bbc,5/5(日) 17:05
2024-05-06,07:19,TTL,総合,3,Full-Count,大谷翔平、球団95年ぶりの快挙達成　止まらぬ長打…9号2ランで到達した異次元の領域,184,https://news.yahoo.co.jp/articles/a2037cf89b8d732e4b2773d5b7291def0218869d,5/6(月) 6:05
2024-05-06,07:19,TTL,総合,4,デイリー新潮,「ナンパされて車に連れ込まれそうに…」「車を盗まれて全損」　川口市が直面する「クルド人問題」に迫る【スクープその後】,158,https://news.yahoo.co.jp/articles/7ebfa194c7608b6526b8de138d56326b51fab35c,5/6(月) 6:09
2024-05-06,07:19,TTL,総合,5,読売新聞オンライン,自転車ヘルメット浸透せず、都内着用９％…「面倒」「置き場所ない」「髪形崩れる」,146,https://news.yahoo.co.jp/articles/6bc638212479f9671b77a789ef845f1080777777,5/5(日) 14:34
2024-05-06,07:19,TTL,総合,6,FNNプライムオンライン（フジテレビ系）,鈴木財務相“低所得国支援に1600億円余”　アジア開発銀行の年次総会で,101,https://news.yahoo.co.jp/articles/f718432b1b30cd5fd6f56883fd045c2366ff7e65,5/6(月) 1:02
2024-05-06,07:19,TTL,総合,7,ENCOUNT,「本当に邪魔」レジの行列、家族全員で並ぶのはマナー違反？　店員の本音に賛否両論,99,https://news.yahoo.co.jp/articles/5cff7f397879aae39d8d1e1efca53ae6c8eca211,5/5(日) 10:10
2024-05-06,07:19,TTL,総合,8,TBS NEWS DIG Powered by JNN,大谷翔平 今季初となる1試合2本目の10号！リーグホームラン王争いトップタイ、4年連続2桁ホームラン達成,90,https://news.yahoo.co.jp/articles/a31d54ac8b8ab402505f385f4afff2ca6eb46f46,5/6(月) 7:01
2024-05-06,07:19,TTL,総合,9,デイリースポーツ,岸田首相の「６月イチカバチカ解散」恐怖指摘　青山氏が衝撃の自民惨敗→議席激減数字をＴＶ予想　過半数割れ「恐怖拭い去れない」正義のミカタ,89,https://news.yahoo.co.jp/articles/ee7280996bb15c2a505be51ab1e790bb78572120,5/5(日) 20:48
2024-05-06,07:19,TTL,総合,10,共同通信,国民民主、「親小池」路線不発　衆院補選で敗北、見直し論浮上,87,https://news.yahoo.co.jp/articles/41a08a04cb75277d96e19478523c336e28d1ac93,5/5(日) 16:08
2024-05-06,07:19,TTL,総合,11,ITmedia ビジネスオンライン,人気撮影スポット「富士山ローソン」で新たな対応　道路の横断禁止を訴える看板設置,84,https://news.yahoo.co.jp/articles/772696f8ce010adcdff685680e28a90f89bcb895,5/5(日) 10:48
2024-05-06,07:19,TTL,総合,12,TopNews,【F1マイアミGP】やった！ノリスF1参戦6年目で念願の初優勝！角田裕毅7位！セーフティカーで流れが変わる,76,https://news.yahoo.co.jp/articles/2d684d02144383926efd3183601558e416b312ff,5/6(月) 6:35
2024-05-06,07:19,TTL,総合,13,DAZN News,ノリスがマイアミGPを制し、110戦目で涙のF1初勝利！フェルスタッペン、ルクレール表彰台…角田裕毅はSC中ピットインが奏功し7位入賞｜F1,74,https://news.yahoo.co.jp/articles/f57fe43e00211be7029351603abb274bc80fd879,5/6(月) 6:36
2024-05-06,07:19,TTL,総合,14,ニッポン放送,リニア中央新幹線「失敗すれば国民負担の可能性も……あらためて必要性の国民的議論を」石川和男が指摘,73,https://news.yahoo.co.jp/articles/4ffa4f0e6df44c7dea27d02bc1e89dea5fb8cb93,5/5(日) 11:40
2024-05-06,07:19,TTL,総合,15,THE ANSWER,ネリ、異例のグラブ変更要求　愛用品→日本製「見た目が小さい」　井上陣営は困惑「よくわからない」,71,https://news.yahoo.co.jp/articles/deb87a34ac2dfffd017f4fae2d1f9de8dbb365e1,5/5(日) 15:09
2024-05-06,07:19,TTL,総合,16,くるまのニュース,空いているのに…「なぜ隣に？」話題の 「トナラー問題」起こるワケ、対策方法はある？ 賛否ある行為の問題点とは,70,https://news.yahoo.co.jp/articles/68aac7e3f1ea61c6cb1f45d12fe77255af6d4e2e,5/5(日) 9:10
2024-05-06,07:19,TTL,総合,17,東洋経済オンライン,「先生が壊れる」　若手教員に病休者が多い深刻事情　失われる意欲、なぜ教員は追いつめられるのか,70,https://news.yahoo.co.jp/articles/99d86729f420d9350756b9938c98c58a1e3f518a,5/5(日) 15:02
2024-05-06,07:19,TTL,総合,18,毎日新聞,GWのUターンラッシュ本格化、各地で混雑　6日がピークの見込み,69,https://news.yahoo.co.jp/articles/258b08074bb29d706e5dd497724ee2edd8cbcaf7,5/5(日) 19:12
2024-05-06,07:19,TTL,総合,19,時事通信,アイヌ差別、罰則求める声　自民・杉田氏投稿で論議,62,https://news.yahoo.co.jp/articles/94e83e4bbb4d7c8fdba258e0a66925ff1d160bec,5/5(日) 19:04
2024-05-06,07:19,TTL,総合,20,クックパッドニュース,専門医が「なるべく避けて」と警告　どんどん老けていく人が選びがちな食べもの,61,https://news.yahoo.co.jp/articles/60aa8180b6d459a0f89ec8d168e6ab0a3410078e,5/5(日) 20:03
2024-05-06,07:19,TTL,総合,21,おとなの週末,「そろそろ電気自動車は買い時か?」補助金が「50万円」以上出たとしても「決断」が難しいワケとは!?,61,https://news.yahoo.co.jp/articles/958177bef521077cb04186baae2aa13ee03bf43c,5/6(月) 6:00
2024-05-06,07:19,TTL,総合,22,時事通信,日本より深刻、韓国の少子化　背景に女性の「爆発的」高学歴化,60,https://news.yahoo.co.jp/articles/dae1142432dc97d29178daa88712163aa61d1e8c,5/5(日) 8:30
2024-05-06,07:19,TTL,総合,23,東洋経済オンライン,江東区で記者が目撃した「選挙妨害騒ぎ」の阿鼻叫喚　江戸情緒残る下町は地獄絵図と化していた,59,https://news.yahoo.co.jp/articles/afbb82233fd6b2585f53ebb4d35b4be7355a0d77,5/6(月) 5:41
2024-05-06,07:19,TTL,総合,24,東スポWEB,【西武】低迷の助っ人アギラー　打線に深刻な影響及ぼす〝初球ストライクを振れない〟問題,56,https://news.yahoo.co.jp/articles/22a11d541ecd814f2ed62a6ef55b808c6ba8098e,5/6(月) 6:16
2024-05-06,07:19,TTL,総合,25,FRIDAY,「誰も注意できない」中条きよし議員“違法貸し付け”疑惑　政治生命はおろか「タレント生命もアウト」,55,https://news.yahoo.co.jp/articles/2752aae7d494512a1483935bcee4a892e803f279,5/5(日) 12:00
2024-05-06,07:19,TTL,総合,26,Hint-Pot,ちょんまげ姿で採用され話題　「自分はこれだ！」とひらめいた瞬間　肯定してくれた友人や今の職場への思いとは,55,https://news.yahoo.co.jp/articles/425dbd3424b41cbe46e74b6ec1898ab2ed7a95b8,5/5(日) 9:17
2024-05-06,07:19,TTL,総合,27,TBS NEWS DIG Powered by JNN,大谷翔平 今季3度目となる2試合連続の9号！リーグトップに浮上、4年連続2桁ホームランに王手,54,https://news.yahoo.co.jp/articles/d09fb31775df27450b55322ffc6cc2eb726a7b46,5/6(月) 5:23
2024-05-06,07:19,TTL,総合,28,スポニチアネックス,広島、左打者8人並べるも不発…コイのぼらず今季6度目零敗　一日で単独最下位逆戻り,53,https://news.yahoo.co.jp/articles/278201933f5443c1de406e3e307f1e1d41159080,5/6(月) 5:45
2024-05-06,07:19,TTL,総合,29,motorsport.com 日本版,F1マイアミ決勝速報｜ランド・ノリス、F1参戦6年目にして初優勝！　フェルスタッペンを下す。角田裕毅7位入賞,50,https://news.yahoo.co.jp/articles/c5b2e09cf5c04d26329e83790558b69c026a3f2a,5/6(月) 6:38
2024-05-06,07:19,TTL,総合,30,TBS NEWS DIG Powered by JNN,“学校に通いたいのに通えない” 中国当局が小学生に圧力,50,https://news.yahoo.co.jp/articles/4bf4c5738eee41709ec4868191827d884032b3c9,5/5(日) 18:01
2024-05-06,07:19,TTL,総合,31,スポニチアネックス,日本ハム・清宮　不振でまた2軍降格　4月19日に今季初昇格も9試合で打率・083,50,https://news.yahoo.co.jp/articles/fa88a97dede3b4e68214786b070a55540a219836,5/6(月) 6:00
2024-05-06,07:19,TTL,総合,32,スポニチアネックス,日本ハム・新庄監督　打率・083の清宮の2軍降格を決断,50,https://news.yahoo.co.jp/articles/8c2f84e00091d78f114f4263b58245b5522eb893,5/5(日) 17:51
2024-05-06,07:19,TTL,総合,33,オートスポーツweb,マクラーレンのランド・ノリスが参戦6年目／110戦目にして涙のF1初優勝。角田裕毅は7位入賞【決勝レポート／第6戦マイアミGP】,49,https://news.yahoo.co.jp/articles/df1b5a0ea0677f0d4c4422c5ddaf3e45dd6372fa,5/6(月) 6:48
2024-05-06,07:19,TTL,総合,34,スポニチアネックス,粗品、超大物ユーチューバーにかみつく「トップクラスでおもんない」超バズリ動画にも「学園祭の出し物？」,44,https://news.yahoo.co.jp/articles/6d46f7bc61799d3b30bbf606558840c0abc22c7e,5/5(日) 15:16
2024-05-06,07:19,TTL,総合,35,文春オンライン,愛子さま（22）日赤ご就職は内々での“極秘の決断”だった…「院試出願のギリギリまで悩み抜かれた」知られざる“秘話”,43,https://news.yahoo.co.jp/articles/d4c422ec0eee23219ecd21bbaccbb216b861ba74,5/6(月) 6:12
2024-05-06,07:19,TTL,総合,36,デイリースポーツ,打てない広島　早くも今季６度目の完封負け　日曜日の本拠地で３戦合計０得点　借金２、ファンため息,43,https://news.yahoo.co.jp/articles/216920f42d64cd7fe2ab5cfa0c79b940887c918c,5/5(日) 16:29
2024-05-06,07:19,TTL,総合,37,オートスポーツweb,【順位結果】2024年F1第6戦マイアミGP決勝,42,https://news.yahoo.co.jp/articles/b5d9ac869338459ec429faf5ac6406f83f2042f0,5/6(月) 6:36
2024-05-06,07:19,TTL,総合,38,TBS NEWS DIG Powered by JNN,【5日・中日スタメン】中田はベンチ 板山が登録即6番セカンド  細川4番 石川5番ファースト 岡林8番 先発・高橋宏 捕手は宇佐見7番,42,https://news.yahoo.co.jp/articles/2769dd3e8d9c35be8d130a1e3a10ebb6769dbbac,5/5(日) 17:25
2024-05-06,07:19,TTL,総合,39,日刊スポーツ,「コロナがまた増えてきています」感染拡大時にメディア多数出演の医師が注意喚起,42,https://news.yahoo.co.jp/articles/46c839005de80cb19302ade31b048ec1e44da9ab,5/5(日) 16:48
2024-05-06,07:19,TTL,総合,40,スポニチアネックス,“始球式ユニホーム捨て”動画で大炎上のがーどまん、実行犯が謝罪も…「責任は取りたくない」,41,https://news.yahoo.co.jp/articles/1e3bb0801ffefa487a0950a6570303bf60019c06,5/5(日) 19:32
