scrp_date,scrp_time,genre_en,genre_jp,rank,media_jp,title,comment,link,date_original
2024-03-13,04:16,TTL,総合,1,まいどなニュース,キリン、成田悠輔氏の「氷結」広告を取り下げ　「高齢者は集団自決」発言に強まる批判 「過度な表現あった」と説明,377,https://news.yahoo.co.jp/articles/d8aee270e23ff2d951a3ab59d4e37328ffed5ca1,3/12(火) 17:22
2024-03-13,04:16,TTL,総合,2,産経新聞,中３生徒暴行で腎臓損傷　兵庫・西脇市教委「重大事態」認定,349,https://news.yahoo.co.jp/articles/fdac1b4aae8787ecf39eaca994805f05e4880d03,3/12(火) 15:00
2024-03-13,04:16,TTL,総合,3,ねとらぼ,「高齢者は集団自決すればいい」　キリン、発言物議の成田悠輔起用の広告取り下げ　「何で起用したの」「不快感しかない」,318,https://news.yahoo.co.jp/articles/f13e30370bc4637ef604065e876c23f383446099,3/12(火) 18:19
2024-03-13,04:16,TTL,総合,4,FBS福岡放送,【速報】市民襲撃4事件　工藤会トップの1審の死刑判決を破棄し無期懲役　元漁協組合長の射殺事件は野村被告は無罪　福岡高裁,281,https://news.yahoo.co.jp/articles/ff87a0c0c14be5e8b09c1f9d9c7bd39c21c52eae,3/12(火) 10:05
2024-03-13,04:16,TTL,総合,5,デイリースポーツ,「子連れママに厳しすぎ」で物議の元アイドル「子育て世代は子連れ時のみタクシー乗り放題に」と要望　雨天送迎のつらさ訴える,172,https://news.yahoo.co.jp/articles/c1ff14df79495e253a3eed90f733ae889e5c9f28,3/12(火) 15:05
2024-03-13,04:16,TTL,総合,6,共同通信,自民党員、裏金事件で3万人減　「不信招いた」と分析,171,https://news.yahoo.co.jp/articles/1cb59ed00a2fd6d6b061f082d4c90f9b69350599,3/12(火) 11:50
2024-03-13,04:16,TTL,総合,7,時事通信,水産物禁輸、主張変わらず　「完全に正当で合理的」　中国,165,https://news.yahoo.co.jp/articles/bf435d3b80da11d124de0bbc1d447dc84f44aa8b,3/12(火) 18:14
2024-03-13,04:16,TTL,総合,8,チューリップテレビ,「苦しみを知ってもらいたい」実名・顔出しで父親からの性被害訴えた24歳女性【会見詳報】当時10代の娘に性的暴行の疑いで逮捕された父親は黙秘,162,https://news.yahoo.co.jp/articles/d9d3bcd312d418a6ab8ae1aedfe71b3bf24ef9d4,3/12(火) 11:23
2024-03-13,04:16,TTL,総合,9,FNNプライムオンライン（フジテレビ系）,過激ショー問題で女性閣僚の発言に差　加藤鮎子氏・自見英子氏は「極めて不適切」　高市早苗氏はダンスや衣装は批判せず,145,https://news.yahoo.co.jp/articles/0b014e103f0cf7506a89487603a826a95fc235ce,3/12(火) 16:02
2024-03-13,04:16,TTL,総合,10,TBS NEWS DIG Powered by JNN,都内在住の5歳未満の男の子が「はしか」感染　先月末に南アジアから帰国　東京都発表,142,https://news.yahoo.co.jp/articles/3881cf91050558cdc24651f1fb6bc4e4d8411217,3/12(火) 22:18
2024-03-13,04:16,TTL,総合,11,オリコン,26年大河ドラマ『豊臣兄弟！』主演は仲野太賀　主人公は天下人の弟・豊臣秀長　【過去10年のタイトル＆主演掲載】,141,https://news.yahoo.co.jp/articles/f097616c93840d84cfef3b25aa9a4299f8c081a6,3/12(火) 15:03
2024-03-13,04:16,TTL,総合,12,FASHIONSNAP,TOKYO BASEが初任給40万円に引き上げ、ベースアップも実施,133,https://news.yahoo.co.jp/articles/b932196a943d1ad1137bc53e2b6e70a441892af2,3/12(火) 12:48
2024-03-13,04:16,TTL,総合,13,日刊スポーツ,「松本人志飲み会」セクシー女優「同じ人間と思えへん」たむけんめぐる一部記事執筆者に怒り露わ,131,https://news.yahoo.co.jp/articles/397a2dd91145eda43184fa68d3801e6dd8f06012,3/12(火) 19:27
2024-03-13,04:16,TTL,総合,14,共同通信,SNSで女性装い誘ったか、大阪　中2男子、大学生転落死,129,https://news.yahoo.co.jp/articles/1cf1a2e6811d4e8e695e7d62387876a34a4dd6d0,3/12(火) 10:33
2024-03-13,04:16,TTL,総合,15,ファイナンシャルフィールド,新幹線の予約していた「特大荷物」スペースに「ベビーカーを置きたい」と言われました…譲る必要がありますか？,120,https://news.yahoo.co.jp/articles/773ae067daf3862fc896d22fa79f379cfba7ece0,3/12(火) 15:20
2024-03-13,04:16,TTL,総合,16,BBC News,米ボーイング機の安全性問題を告発した元従業員、遺体で見つかる,116,https://news.yahoo.co.jp/articles/9db02365bd1ba5f8d213c1b24a31d28eeff0214c,3/12(火) 14:36
2024-03-13,04:16,TTL,総合,17,スポニチアネックス,光上せあら　「子育て世帯は子連れの時のみタクシー乗り放題」訴える　荒天時の自転車送迎「辛すぎて」,113,https://news.yahoo.co.jp/articles/f4fe9d879c304911e2a744d80b503cf2667ae4cb,3/12(火) 22:22
2024-03-13,04:16,TTL,総合,18,FNNプライムオンライン（フジテレビ系）,コストコ“下請けいじめ”　公取委が勧告　20社がセール時値引き原資を負担…1999年日本初出店から常習の可能性,112,https://news.yahoo.co.jp/articles/b2dd7a1a9c86e97ffbc3feeaf03791033b456da0,3/12(火) 15:00
2024-03-13,04:16,TTL,総合,19,スポニチアネックス,「オモウマい店」番組最後に「大変な混雑」を謝罪　「運営の不手際により多大なご迷惑を…」,111,https://news.yahoo.co.jp/articles/a9031e915f9744d8e8df878ba4f3af85117e5578,3/12(火) 20:10
2024-03-13,04:16,TTL,総合,20,J-CASTニュース,「子連れの時のみタクシー乗り放題にして」　元SDN光上せあら、悪天候時の自転車送迎「辛すぎて」願望訴え,104,https://news.yahoo.co.jp/articles/5da9445e987be0fc296c80e4ddf5a38ca3ca0d20,3/12(火) 14:04
2024-03-13,04:16,TTL,総合,21,共同通信,万博時、タクシー2000台不足　国のライドシェア、大阪府が試算,102,https://news.yahoo.co.jp/articles/c9e4a46511893ea16037f0a0ce4c6ab45eb734a4,3/12(火) 16:52
2024-03-13,04:16,TTL,総合,22,現代ビジネス,大臣の答弁が下手すぎて、議場騒然！「あまりに能力不足」…官僚たちも呆れている「議員の名前」,85,https://news.yahoo.co.jp/articles/6e98d2b19c338ea63d06e77717a3f2a212b1b818,3/12(火) 7:33
2024-03-13,04:16,TTL,総合,23,毎日新聞,工藤会トップ、無期判決説明に前のめり　高裁では無言のまま退廷,84,https://news.yahoo.co.jp/articles/8cdf5bd0e690a26842b404a93ac3c98be93cc622,3/12(火) 20:11
2024-03-13,04:16,TTL,総合,24,時事通信,自民処分、4月補選前を検討　裏金事件、対象・軽重焦点に,82,https://news.yahoo.co.jp/articles/d6efeaf0f505af9d52136354fc4a427632e9c302,3/12(火) 7:09
2024-03-13,04:16,TTL,総合,25,FNNプライムオンライン（フジテレビ系）,【独自】自民・過激ダンスショー画像4枚入手　チップ口移しは世耕氏の秘書か　手を叩いて笑う姿も,81,https://news.yahoo.co.jp/articles/41692ceddb732794a2730287a6142e89b1599920,3/12(火) 18:43
2024-03-13,04:16,TTL,総合,26,FNNプライムオンライン,【独自】肌を露出した女性に“口移し”でチップを…自民「過激ダンスショー」の決定的瞬間を入手　企画した県議「エスコートさせていただいた」,81,https://news.yahoo.co.jp/articles/576aa82971b1b74ebf6f60d65bc2cf77b77a771f,3/12(火) 19:42
2024-03-13,04:16,TTL,総合,27,毎日新聞,鶴岡八幡宮が神社本庁を離脱へ　理由は明記されず　神奈川・鎌倉,81,https://news.yahoo.co.jp/articles/d7ce5965817932384b2326063ba8402f168ea562,3/12(火) 15:46
2024-03-13,04:16,TTL,総合,28,女性自身,金属工場の“猛毒”六価クロム槽に猫が転落…市役所が明かした「苦情電話の内容」,80,https://news.yahoo.co.jp/articles/f2668889ef24e21f89c02cd60cf02e230d356822,3/12(火) 17:15
2024-03-13,04:16,TTL,総合,29,オリコン,斎藤佑樹氏＆桐谷美玲、日テレ『news every.』でキャスター就任　自ら取材するコーナーも,72,https://news.yahoo.co.jp/articles/b3b1781b244828b5db2bf127b6bf0dccec491ced,3/12(火) 5:00
2024-03-13,04:16,TTL,総合,30,沖縄タイムス,市長のTikTok動画　「ソジハラ」と指摘　制服リサイクル店のセーラー服売り場うろつく場面　有識者検証委で問題視　沖縄・浦添市,66,https://news.yahoo.co.jp/articles/f794e150fd7f1a76c1955e0586e589ba66e2c5d8,3/12(火) 7:43
2024-03-13,04:16,TTL,総合,31,TBS NEWS DIG Powered by JNN,【速報】橋本聖子元五輪大臣「公の場で説明する責任ある」 参院政倫審に出席の意向,64,https://news.yahoo.co.jp/articles/43146dde26f3cc210358d05fac9576510311f04c,3/12(火) 12:27
2024-03-13,04:16,TTL,総合,32,ファイナンシャルフィールド,子どもが生まれたので「アルファード」を買おうとしたら、妻に「保育園の送迎だけなのに贅沢」と止められました。頭金も「100万円」貯めたので大丈夫だと思うのですが、ほかの車を選ぶべきでしょうか？,62,https://news.yahoo.co.jp/articles/0c310095ed53a28655b9f38aeb31b6df4cd97f39,3/12(火) 11:30
2024-03-13,04:16,TTL,総合,33,TBS NEWS DIG Powered by JNN,JR亀戸駅前の「みずほ銀行」に強盗か　男1人が現行犯逮捕　警視庁,61,https://news.yahoo.co.jp/articles/bffaa5488a796f9e014b58206049eea3ebdf496e,3/12(火) 13:36
2024-03-13,04:16,TTL,総合,34,読売新聞オンライン,死にたいくらい憧れた「東京」も今は薄れた？…地方から首都圏大学への進学、２３年度は３２％どまり,60,https://news.yahoo.co.jp/articles/365a543309036e50d91729a3e552e5c00591f337,3/12(火) 5:00
2024-03-13,04:16,TTL,総合,35,日刊スポーツ,へずまりゅう、焼肉店「出禁」でブチギレ報告「これなら迷惑系で嫌われた方が…本当に苦しい」,59,https://news.yahoo.co.jp/articles/113a06faf1211b6534f8aceb7046c001c2b4c38f,3/12(火) 19:09
2024-03-13,04:16,TTL,総合,36,共同通信,千葉市協が全国組織退会へ　PTA、分担金理由に,58,https://news.yahoo.co.jp/articles/67fb5de4c31aaf53abd9fabd603404fb97cc819d,3/12(火) 21:07
2024-03-13,04:16,TTL,総合,37,デイリー新潮,「秋篠宮さま」が今もなお漏らされている「即位」に関することとは,55,https://news.yahoo.co.jp/articles/c4bfb0964b896b66e862cfa998853816424c4bfb,3/12(火) 6:10
2024-03-13,04:16,TTL,総合,38,女性自身,「本当に死んだんじゃねえだろう」令和の虎　司会者が出演者の“身内の不幸”を疑い胸ぐら掴んで大炎上「胸糞悪い」,55,https://news.yahoo.co.jp/articles/602460205cdb51371e187520bd3de7f7f16446f2,3/12(火) 18:41
2024-03-13,04:16,TTL,総合,39,TNCテレビ西日本,「人が引きずられている」　大型トラックに自転車はねられ１７歳の女子高校生死亡　運転手の男を逮捕,54,https://news.yahoo.co.jp/articles/9bfaaf541e7fb1719e35388b8b505fdceacba1ec,3/12(火) 16:18
2024-03-13,04:16,TTL,総合,40,日刊スポーツ,新幹線で号泣幼児を注意、が賛否　整形YouTuber「子持ち様ＶＳまともな子持ちと子無し」,53,https://news.yahoo.co.jp/articles/a89b68275923e09858ac5a158847fffc37179254,3/12(火) 13:12
