scrp_date,scrp_time,genre_en,genre_jp,rank,media_jp,title,comment,link,date_original
2024-10-04,13:08,sports,スポーツ,1山本由伸、“PO開幕投手”に急転抜擢　編成トップ明言…ダルビッシュとの投げ合いは幻にFull-Count10/4(金) 8:14140件/時,Full-Count,山本由伸、“PO開幕投手”に急転抜擢　編成トップ明言…ダルビッシュとの投げ合いは幻に,140,https://news.yahoo.co.jp/articles/0b8c3cade3e75efcf4894beb4363bc78ecdebd7c,10/4(金) 8:14
2024-10-04,13:08,sports,スポーツ,2ジャッジこそ“No.1” 「守れない」大谷翔平との比較論で米誌編集長が断言する理由「オオタニの貢献は攻撃面だけ」CoCoKARAnext10/4(金) 6:02137件/時,CoCoKARAnext,ジャッジこそ“No.1” 「守れない」大谷翔平との比較論で米誌編集長が断言する理由「オオタニの貢献は攻撃面だけ」,137,https://news.yahoo.co.jp/articles/40821224641d8fc4d4d3e93dcfa391bb54019cad,10/4(金) 6:02
2024-10-04,13:08,sports,スポーツ,3なぜ阪神は岡田監督に続投要請をしなかったのか？RONSPO10/4(金) 8:05120件/時,RONSPO,なぜ阪神は岡田監督に続投要請をしなかったのか？,120,https://news.yahoo.co.jp/articles/8b083cb87cb4c02f1f2337513bb3dee25e2892a4,10/4(金) 8:05
2024-10-04,13:08,sports,スポーツ,4阪神岡田監督は連覇達成でも「解任」だった…背景に《阪神電鉄への人事権「大政奉還」》日刊ゲンダイDIGITAL10/4(金) 11:37120件/時,日刊ゲンダイDIGITAL,阪神岡田監督は連覇達成でも「解任」だった…背景に《阪神電鉄への人事権「大政奉還」》,120,https://news.yahoo.co.jp/articles/04ed45c5e6347e67923f8a4c7dfaac2427e8803c,10/4(金) 11:37
2024-10-04,13:08,sports,スポーツ,5【西武】渡辺久信監督代行がGM職も退任し退団の意向　シーズン終了後に西口－鳥越体制発表へ日刊スポーツ10/4(金) 4:0097件/時,日刊スポーツ,【西武】渡辺久信監督代行がGM職も退任し退団の意向　シーズン終了後に西口－鳥越体制発表へ,97,https://news.yahoo.co.jp/articles/1330f5817d6f80b5364b2e1767443cb17f9884cd,10/4(金) 4:00
2024-10-04,13:08,sports,スポーツ,6RB入りのローソンは「角田を基準に評価したい」とホーナー。一方、実力示す他チームのルーキーに疑問オートスポーツweb10/4(金) 11:4584件/時,オートスポーツweb,RB入りのローソンは「角田を基準に評価したい」とホーナー。一方、実力示す他チームのルーキーに疑問,84,https://news.yahoo.co.jp/articles/8c8e9d128f7e88428e0f9cc5b46495ae678212a0,10/4(金) 11:45
2024-10-04,13:08,sports,スポーツ,7監督に激怒しトレード志願「この人は無理」　身に沁みた中日愛…「死ぬほど泣いた」理由Full-Count10/4(金) 6:5084件/時,Full-Count,監督に激怒しトレード志願「この人は無理」　身に沁みた中日愛…「死ぬほど泣いた」理由,84,https://news.yahoo.co.jp/articles/1a3d35a6a6d981c796d53c4aad596ece36d589d5,10/4(金) 6:50
2024-10-04,13:08,sports,スポーツ,8中日、井上一樹2軍監督への次期監督要請に「安堵」した理由CoCoKARAnext10/4(金) 11:4180件/時,CoCoKARAnext,中日、井上一樹2軍監督への次期監督要請に「安堵」した理由,80,https://news.yahoo.co.jp/articles/94db4fc1d875a909f91416f6e18edc12ddaa0440,10/4(金) 11:41
2024-10-04,13:08,sports,スポーツ,9阿部巨人が気を揉む阪神「岡田ロス」の反動《一体感が増すのが一番怖い》…よぎる2014年の悪夢日刊ゲンダイDIGITAL10/4(金) 11:3778件/時,日刊ゲンダイDIGITAL,阿部巨人が気を揉む阪神「岡田ロス」の反動《一体感が増すのが一番怖い》…よぎる2014年の悪夢,78,https://news.yahoo.co.jp/articles/82e014c3033143a09f78770f6404273f5ba77886,10/4(金) 11:37
2024-10-04,13:08,sports,スポーツ,102位躍進で下克上狙う日本ハム「新庄監督の長期政権」熱望の声が週刊ベースボールONLINE10/4(金) 11:0176件/時,週刊ベースボールONLINE,2位躍進で下克上狙う日本ハム「新庄監督の長期政権」熱望の声が,76,https://news.yahoo.co.jp/articles/ec36772d2f8b45621f546518a1408384cc314c81,10/4(金) 11:01
2024-10-04,13:08,sports,スポーツ,11大谷翔平「50－50」ボール、マグワイア70号ボールに次ぐ史上２番目の価値まで上昇日刊スポーツ10/4(金) 10:1074件/時,日刊スポーツ,大谷翔平「50－50」ボール、マグワイア70号ボールに次ぐ史上２番目の価値まで上昇,74,https://news.yahoo.co.jp/articles/cd1e32392a127e27074cffffe887a0372094f819,10/4(金) 10:10
2024-10-04,13:08,sports,スポーツ,12ジャッジが「絶対に勝っている」　“大谷が格上”を完全否定…強気な米報道「信じられない」Full-Count10/3(木) 20:4064件/時,Full-Count,ジャッジが「絶対に勝っている」　“大谷が格上”を完全否定…強気な米報道「信じられない」,64,https://news.yahoo.co.jp/articles/a12c8b9ea9ca43fef09dd86ca94bd63e10e0fb48,10/3(木) 20:40
2024-10-04,13:08,sports,スポーツ,13DeNA戦力外の大田泰示、球団OBが「推薦」する移籍先は？　「右打者の外野手が不足している球団」J-CASTニュース10/4(金) 12:1661件/時,J-CASTニュース,DeNA戦力外の大田泰示、球団OBが「推薦」する移籍先は？　「右打者の外野手が不足している球団」,61,https://news.yahoo.co.jp/articles/8cfe4a5ce139c4358fc5ebbe599fa88f89c0dea9,10/4(金) 12:16
2024-10-04,13:08,sports,スポーツ,14昇格決定的の中日・井上二軍監督は立浪監督と何から何まで“正反対”《明るさと社交性のある熱い男》日刊ゲンダイDIGITAL10/4(金) 11:4260件/時,日刊ゲンダイDIGITAL,昇格決定的の中日・井上二軍監督は立浪監督と何から何まで“正反対”《明るさと社交性のある熱い男》,60,https://news.yahoo.co.jp/articles/776ce074fcdff87856fe9689504bd3d3a92dd04c,10/4(金) 11:42
2024-10-04,13:08,sports,スポーツ,15J1町田のロングスロー問題に黒田監督が「沈黙」を決めた理由RONSPO10/4(金) 6:2756件/時,RONSPO,J1町田のロングスロー問題に黒田監督が「沈黙」を決めた理由,56,https://news.yahoo.co.jp/articles/361f49e50907c3e0ed492686683502c2b975b7ca,10/4(金) 6:27
2024-10-04,13:08,sports,スポーツ,16ハマスタスタンドに「岡田監督ありがとう」の文字　退任の岡田監督へ虎党涙「岡田コール」もスポニチアネックス10/3(木) 21:2254件/時,スポニチアネックス,ハマスタスタンドに「岡田監督ありがとう」の文字　退任の岡田監督へ虎党涙「岡田コール」も,54,https://news.yahoo.co.jp/articles/42c6f8cf29dfff746a9167a1041fd97dcbd70be5,10/3(木) 21:22
2024-10-04,13:08,sports,スポーツ,17巨人・阿部監督はなぜ浅野の起用にこだわったのかデイリースポーツ10/4(金) 10:0054件/時,デイリースポーツ,巨人・阿部監督はなぜ浅野の起用にこだわったのか,54,https://news.yahoo.co.jp/articles/bb02626f5790d795c9382fc3b4cb0b1804e0b97a,10/4(金) 10:00
2024-10-04,13:08,sports,スポーツ,18ドジャースファン“締め出し”　パ軍の異例対応を米批判「とても非常識」「やめさせるべき」Full-Count10/4(金) 8:0851件/時,Full-Count,ドジャースファン“締め出し”　パ軍の異例対応を米批判「とても非常識」「やめさせるべき」,51,https://news.yahoo.co.jp/articles/ee333dec0a282f9c88fa25343255751e6e2ae55d,10/4(金) 8:08
2024-10-04,13:08,sports,スポーツ,19町田の“ルール外行為”は「ずる賢い」　元日本代表が持論「そこまで考えていなかった」【インタビュー】FOOTBALL ZONE10/4(金) 7:2049件/時,FOOTBALL ZONE,町田の“ルール外行為”は「ずる賢い」　元日本代表が持論「そこまで考えていなかった」【インタビュー】,49,https://news.yahoo.co.jp/articles/50bb28727b8d639acc2c8e1304475bddd7ce2022,10/4(金) 7:20
2024-10-04,13:08,sports,スポーツ,208カ月前には夢にも思わなかったメジャー登板ゼロ　日本か米3年目か…藤浪晋太郎の決断やいかにスポニチアネックス10/4(金) 7:0049件/時,スポニチアネックス,8カ月前には夢にも思わなかったメジャー登板ゼロ　日本か米3年目か…藤浪晋太郎の決断やいかに,49,https://news.yahoo.co.jp/articles/30305ae9c10bce7f730d84fb341db3d62e591e41,10/4(金) 7:00
2024-10-04,13:08,sports,スポーツ,21「岡本和真28歳は巨人に残ったほうがいい」NHK解説者・武田一浩（巨人OB）がメジャー移籍を止めるワケ「ゆくゆくは巨人のコーチ、監督に…」Number Web10/3(木) 18:2248件/時,Number Web,「岡本和真28歳は巨人に残ったほうがいい」NHK解説者・武田一浩（巨人OB）がメジャー移籍を止めるワケ「ゆくゆくは巨人のコーチ、監督に…」,48,https://news.yahoo.co.jp/articles/5e99e518ab781e07966de9bc9be51775a2c0bcd5,10/3(木) 18:22
2024-10-04,13:08,sports,スポーツ,22ドジャース編成トップ、佐々木朗希について言及「いい投球」…日本で一番の食事は「アメージング寿司」中日スポーツ10/4(金) 8:5948件/時,中日スポーツ,ドジャース編成トップ、佐々木朗希について言及「いい投球」…日本で一番の食事は「アメージング寿司」,48,https://news.yahoo.co.jp/articles/9ced5003a6dfc4c90226887bb7fb6ed94481b25a,10/4(金) 8:59
2024-10-04,13:08,sports,スポーツ,23ＤｅＮＡ　三浦監督がファンに謝罪「３位という結果に終わってすみませんでした」帽子を取り深々と頭を下げる　本拠地は拍手デイリースポーツ10/3(木) 21:3844件/時,デイリースポーツ,ＤｅＮＡ　三浦監督がファンに謝罪「３位という結果に終わってすみませんでした」帽子を取り深々と頭を下げる　本拠地は拍手,44,https://news.yahoo.co.jp/articles/9724b8f1f3396bdd1b707bdd670c64c0f44a67dd,10/3(木) 21:38
2024-10-04,13:08,sports,スポーツ,24「韓国サッカー界混乱の序幕」代表監督選任問題で揺れる韓国、クリンスマン前監督就任から問題あり？W杯出場権剥奪の可能性もフットボールチャンネル10/4(金) 11:5742件/時,フットボールチャンネル,「韓国サッカー界混乱の序幕」代表監督選任問題で揺れる韓国、クリンスマン前監督就任から問題あり？W杯出場権剥奪の可能性も,42,https://news.yahoo.co.jp/articles/bc7f07798b868932e69c88d90917a90c14e28fc7,10/4(金) 11:57
2024-10-04,13:08,sports,スポーツ,25【Ｆ１】角田裕毅〝飼い殺し〟のレッドブルを専門家が批判「なぜ彼にチャンスが与えられないのか」東スポWEB10/4(金) 6:1740件/時,東スポWEB,【Ｆ１】角田裕毅〝飼い殺し〟のレッドブルを専門家が批判「なぜ彼にチャンスが与えられないのか」,40,https://news.yahoo.co.jp/articles/3e68498f23f31d425b96af025e1a6f899f11bdbc,10/4(金) 6:17
2024-10-04,13:08,sports,スポーツ,26渡辺監督の”後任”は…？西武の監督候補に挙がる大物（2）いまだに絶えない“待望論”ベースボールチャンネル10/4(金) 11:5139件/時,ベースボールチャンネル,渡辺監督の”後任”は…？西武の監督候補に挙がる大物（2）いまだに絶えない“待望論”,39,https://news.yahoo.co.jp/articles/60e32352b75fa56139ebafe3da8e8a4e30af1017,10/4(金) 11:51
2024-10-04,13:08,sports,スポーツ,27春季キャンプに垣間見えた「阿部巨人」V奪還の兆候　「和やかムード」の理由は“名物コーチ”が消えたからデイリー新潮10/4(金) 6:1138件/時,デイリー新潮,春季キャンプに垣間見えた「阿部巨人」V奪還の兆候　「和やかムード」の理由は“名物コーチ”が消えたから,38,https://news.yahoo.co.jp/articles/0bcb556b5c105bdc2c6206ae746697d045c75a56,10/4(金) 6:11
2024-10-04,13:08,sports,スポーツ,28広島の侍21歳は「カープの宝」　若さ溢れる超美技に騒然…来季は「間違いなく1軍確定」Full-Count10/4(金) 7:4037件/時,Full-Count,広島の侍21歳は「カープの宝」　若さ溢れる超美技に騒然…来季は「間違いなく1軍確定」,37,https://news.yahoo.co.jp/articles/b16bf4a7ce74a6315dfbd70898de18e59fa91452,10/4(金) 7:40
2024-10-04,13:08,sports,スポーツ,29「再契約の可能性は低い」FAの菊池雄星　アストロズ地元メディアは退団濃厚と予想　球団GMは「賢明な判断を下さなければ」CoCoKARAnext10/4(金) 12:2936件/時,CoCoKARAnext,「再契約の可能性は低い」FAの菊池雄星　アストロズ地元メディアは退団濃厚と予想　球団GMは「賢明な判断を下さなければ」,36,https://news.yahoo.co.jp/articles/888e1dd0c7b76f7d28277b8bb71dadbcf1175b60,10/4(金) 12:29
2024-10-04,13:08,sports,スポーツ,30新旧の所属球団に明暗…中田翔を獲った中日は“損”、退団した巨人は“得”をしたのかAERA dot.10/3(木) 18:0136件/時,AERA dot.,新旧の所属球団に明暗…中田翔を獲った中日は“損”、退団した巨人は“得”をしたのか,36,https://news.yahoo.co.jp/articles/96498edbfe379aaa1bb25d29c00e55be6a3603a7,10/3(木) 18:01
2024-10-04,13:08,sports,スポーツ,31大谷50号HR球のオークションで日本人社長が2億2000万円で入札　目的達成へ「引き続き戦います」THE ANSWER10/4(金) 10:0035件/時,THE ANSWER,大谷50号HR球のオークションで日本人社長が2億2000万円で入札　目的達成へ「引き続き戦います」,35,https://news.yahoo.co.jp/articles/07fefc66db83fb5949104c448d3c82ea48a10a16,10/4(金) 10:00
2024-10-04,13:08,sports,スポーツ,32関学大、アメフト部員５人の処分発表　うち１人は無期限活動停止　大麻所持・使用に関する処分は物的証拠なく留保　スポーツ報知10/3(木) 17:0035件/時,スポーツ報知,関学大、アメフト部員５人の処分発表　うち１人は無期限活動停止　大麻所持・使用に関する処分は物的証拠なく留保,35,https://news.yahoo.co.jp/articles/23ffd044c5ecb284afd8441f61a1320f5d1aed45,10/3(木) 17:00
2024-10-04,13:08,sports,スポーツ,33阿部巨人に優勝をもたらした「3捕手併用」　守備力を重視した指揮官の眼力CoCoKARAnext10/4(金) 12:2033件/時,CoCoKARAnext,阿部巨人に優勝をもたらした「3捕手併用」　守備力を重視した指揮官の眼力,33,https://news.yahoo.co.jp/articles/03d315e317df0a4089cc6ca86c85cc3852beee73,10/4(金) 12:20
2024-10-04,13:08,sports,スポーツ,34阪神新監督　藤川球児氏が最有力　「もろ手を挙げて賛成」阪急阪神HD角和夫会長　岡田彰布監督は今季限りで退任サンケイスポーツ10/4(金) 7:3032件/時,サンケイスポーツ,阪神新監督　藤川球児氏が最有力　「もろ手を挙げて賛成」阪急阪神HD角和夫会長　岡田彰布監督は今季限りで退任,32,https://news.yahoo.co.jp/articles/d270ce9e1cdc3d345871357db526053574e7c229,10/4(金) 7:30
2024-10-04,13:08,sports,スポーツ,35大谷が示す「新しい王道」　歴史的活躍に鈴村准教授―米大リーグ時事通信10/4(金) 7:1130件/時,時事通信,大谷が示す「新しい王道」　歴史的活躍に鈴村准教授―米大リーグ,30,https://news.yahoo.co.jp/articles/9a39a1b9ae02654e62f548ed2ce478b9ea6d204b,10/4(金) 7:11
2024-10-04,13:08,sports,スポーツ,36中日が根尾昂投手らフェニックス・リーグ参加３０選手を発表【メンバー一覧】デイリースポーツ10/4(金) 12:2729件/時,デイリースポーツ,中日が根尾昂投手らフェニックス・リーグ参加３０選手を発表【メンバー一覧】,29,https://news.yahoo.co.jp/articles/3f2019dfe5094c9565cd0d1b350e54a1509d9e33,10/4(金) 12:27
2024-10-04,13:08,sports,スポーツ,37若貴の母・藤田紀子　東京駅で転倒し救急搬送　座骨骨折で１週間の入院デイリースポーツ10/3(木) 17:0728件/時,デイリースポーツ,若貴の母・藤田紀子　東京駅で転倒し救急搬送　座骨骨折で１週間の入院,28,https://news.yahoo.co.jp/articles/3e26d820b78aafdf0ca8702f4fc8f9fbd3de0913,10/3(木) 17:07
2024-10-04,13:08,sports,スポーツ,38【阪神】岡田監督「退任」は有終日本一へのカンフル剤になるか　球団関係者の不安は〝矢野前監督の二の舞い〟東スポWEB10/4(金) 5:1628件/時,東スポWEB,【阪神】岡田監督「退任」は有終日本一へのカンフル剤になるか　球団関係者の不安は〝矢野前監督の二の舞い〟,28,https://news.yahoo.co.jp/articles/c063f5b9c31c1b5ad9fb9b710a7eb630f8af2c63,10/4(金) 5:16
2024-10-04,13:08,sports,スポーツ,39中日、みやざきフェニックスリーグ参加の30選手を発表 今季飛躍の松木平優太もメンバー入り中日スポーツ10/4(金) 12:2727件/時,中日スポーツ,中日、みやざきフェニックスリーグ参加の30選手を発表 今季飛躍の松木平優太もメンバー入り,27,https://news.yahoo.co.jp/articles/023e24261de1322d4cef88a6012aeba19669a78a,10/4(金) 12:27
2024-10-04,13:08,sports,スポーツ,40レッズのデラクスルが史上初の“珍３冠王”を達成！　２２歳の遊撃手は盗塁王だけじゃない！スポーツ報知10/4(金) 12:0527件/時,スポーツ報知,レッズのデラクスルが史上初の“珍３冠王”を達成！　２２歳の遊撃手は盗塁王だけじゃない！,27,https://news.yahoo.co.jp/articles/9fe8e58af92ee00174eb3d4974c64635c10b12c4,10/4(金) 12:05
