scrp_date,scrp_time,genre_en,genre_jp,rank,media_jp,title,comment,link,date_original
2024-10-11,20:06,world,国際,1国連軍に発砲、非難殺到　イスラエルは正当化時事通信10/11(金) 16:02377件/時,時事通信,国連軍に発砲、非難殺到　イスラエルは正当化,377,https://news.yahoo.co.jp/articles/5c34eccaf679bf6bf428dfce24d3dd3668703762,10/11(金) 16:02
2024-10-11,20:06,world,国際,2「58人の男を愛人に」「バッグには常にコンドーム」　12億円ワイロで捕まった「中国共産党美人幹部」のやりたい放題エピソードデイリー新潮10/11(金) 11:0067件/時,デイリー新潮,「58人の男を愛人に」「バッグには常にコンドーム」　12億円ワイロで捕まった「中国共産党美人幹部」のやりたい放題エピソード,67,https://news.yahoo.co.jp/articles/0387429955e37f128f236940065270e2122ca42e,10/11(金) 11:00
2024-10-11,20:06,world,国際,33:29【独自】虐待の瞬間…韓国の保育園で日本人男児の顔を何度も殴打「首にあざが…」叩いていないと反論も泣いて「警察に届け出ないで」FNNプライムオンライン（フジテレビ系）10/11(金) 18:4733件/時,FNNプライムオンライン（フジテレビ系）,【独自】虐待の瞬間…韓国の保育園で日本人男児の顔を何度も殴打「首にあざが…」叩いていないと反論も泣いて「警察に届け出ないで」,33,https://news.yahoo.co.jp/articles/f07d38e69258fa5e5556a4b88d4aa2ce49b75a4c,10/11(金) 18:47
2024-10-11,20:06,world,国際,4南シナ海の平和への中国の努力尊重を、李首相が域外諸国に訴えロイター10/11(金) 18:5431件/時,ロイター,南シナ海の平和への中国の努力尊重を、李首相が域外諸国に訴え,31,https://news.yahoo.co.jp/articles/16db62857237d7a078d02c95b48cf4e7858f7716,10/11(金) 18:54
2024-10-11,20:06,world,国際,5ロシア軍の戦死者が1日平均「1271人」に急増…「年収790万円」の超好待遇でも兵士確保できず「北朝鮮正規軍」を東部戦線に投入の可能性もデイリー新潮10/11(金) 6:1229件/時,デイリー新潮,ロシア軍の戦死者が1日平均「1271人」に急増…「年収790万円」の超好待遇でも兵士確保できず「北朝鮮正規軍」を東部戦線に投入の可能性も,29,https://news.yahoo.co.jp/articles/183ac77c3ee7b3f206b5168452dcb2850dc57fb0,10/11(金) 6:12
2024-10-11,20:06,world,国際,6機内食にゴキブリのような虫が混入か、半分食べ終えたところで気づく。乗客は体調不良を訴え（インド）BuzzFeed Japan10/11(金) 17:1025件/時,BuzzFeed Japan,機内食にゴキブリのような虫が混入か、半分食べ終えたところで気づく。乗客は体調不良を訴え（インド）,25,https://news.yahoo.co.jp/articles/2922c7f0a995cd17eee38249969476c3ce58c3a9,10/11(金) 17:10
2024-10-11,20:06,world,国際,7レバノン国連部隊にまたイスラエル軍が発砲、2人負傷＝国連筋ロイター10/11(金) 18:5824件/時,ロイター,レバノン国連部隊にまたイスラエル軍が発砲、2人負傷＝国連筋,24,https://news.yahoo.co.jp/articles/650e76bf0eeb870e2616425399175413a850de0e,10/11(金) 18:58
2024-10-11,20:06,world,国際,8北朝鮮衛星「非常に低性能」　光学画像のみ撮影可能　夜間や天候不良時の偵察困難・韓国軍分析時事通信10/11(金) 7:0924件/時,時事通信,北朝鮮衛星「非常に低性能」　光学画像のみ撮影可能　夜間や天候不良時の偵察困難・韓国軍分析,24,https://news.yahoo.co.jp/articles/d24b1b0458a88e80cab57a070e79c370c3afcae4,10/11(金) 7:09
2024-10-11,20:06,world,国際,9イスラエルがガザで「絶滅行為」、医療従事者・施設を意図的に攻撃 国連調査委ＡＦＰ＝時事10/11(金) 11:2220件/時,ＡＦＰ＝時事,イスラエルがガザで「絶滅行為」、医療従事者・施設を意図的に攻撃 国連調査委,20,https://news.yahoo.co.jp/articles/1368018dee3a0b9bfc80b454d0575eb4106754d2,10/11(金) 11:22
2024-10-11,20:06,world,国際,10オバマ氏、ハリス氏集会初登場 「狂った」トランプ氏を非難ＡＦＰ＝時事10/11(金) 15:3720件/時,ＡＦＰ＝時事,オバマ氏、ハリス氏集会初登場 「狂った」トランプ氏を非難,20,https://news.yahoo.co.jp/articles/a75ddc59e90609e1c29629aed9f82ae1ed2e0515,10/11(金) 15:37
2024-10-11,20:06,world,国際,11被団協にノーベル平和賞　被爆の実相訴え68年共同通信10/11(金) 18:0419件/時,共同通信,被団協にノーベル平和賞　被爆の実相訴え68年,19,https://news.yahoo.co.jp/articles/29755645c3f968d639358e4c03d5f0c809900bba,10/11(金) 18:04
2024-10-11,20:06,world,国際,121:33【速報】日本被団協にノーベル平和賞　1974年の佐藤栄作元総理以来50年ぶりTBS NEWS DIG Powered by JNN10/11(金) 18:0618件/時,TBS NEWS DIG Powered by JNN,【速報】日本被団協にノーベル平和賞　1974年の佐藤栄作元総理以来50年ぶり,18,https://news.yahoo.co.jp/articles/a9cd881a117ac33a3a0a543e2502e23f466374ba,10/11(金) 18:06
2024-10-11,20:06,world,国際,13イスラエル軍、イスラム聖戦最高司令官を殺害 ヨルダン川西岸ＡＦＰ＝時事10/11(金) 17:4618件/時,ＡＦＰ＝時事,イスラエル軍、イスラム聖戦最高司令官を殺害 ヨルダン川西岸,18,https://news.yahoo.co.jp/articles/2e903d70833b7b0b7d1106226fbd357d82e3d4cd,10/11(金) 17:46
2024-10-11,20:06,world,国際,141:28【速報】ノーベル平和賞「日本被団協」に決定日テレNEWS NNN10/11(金) 18:0517件/時,日テレNEWS NNN,【速報】ノーベル平和賞「日本被団協」に決定,17,https://news.yahoo.co.jp/articles/9265d582cc64ad3299e2641d72d8c721ca1e9ccd,10/11(金) 18:05
2024-10-11,20:06,world,国際,15「家族がどうなっても知らないぞ」 中国当局が日本で暮らす中国出身者に「圧力」 国際人権団体が報告書発表TBS NEWS DIG Powered by JNN10/10(木) 22:2117件/時,TBS NEWS DIG Powered by JNN,「家族がどうなっても知らないぞ」 中国当局が日本で暮らす中国出身者に「圧力」 国際人権団体が報告書発表,17,https://news.yahoo.co.jp/articles/f64144adbfad0b0af9ff1d1ba920e687912c595d,10/10(木) 22:21
2024-10-11,20:06,world,国際,16黒人男性によるトランプ氏支持、「受け入れられない」とオバマ氏CNN.co.jp10/11(金) 13:5516件/時,CNN.co.jp,黒人男性によるトランプ氏支持、「受け入れられない」とオバマ氏,16,https://news.yahoo.co.jp/articles/ed23ea3b32afe02663bac80fb00d0d6ce7e9f7e4,10/11(金) 13:55
2024-10-11,20:06,world,国際,17《女攻略のために韓国遠征行ってきます》“ナンパ師グループ”の「SNSで性的画像投稿」が国内外で物議　グループは「無期限活動自粛」も、韓国メディアは「取材を進めている」NEWSポストセブン10/11(金) 11:3016件/時,NEWSポストセブン,《女攻略のために韓国遠征行ってきます》“ナンパ師グループ”の「SNSで性的画像投稿」が国内外で物議　グループは「無期限活動自粛」も、韓国メディアは「取材を進めている」,16,https://news.yahoo.co.jp/articles/fca7682bd52678cb49b71530652672215ea076c9,10/11(金) 11:30
2024-10-11,20:06,world,国際,18中国「台湾に主権は存在しない」建国記念日〝双十節〟に武力威嚇　軍用機27機、軍艦など14隻「サラミ戦術の一環」山下裕貴氏夕刊フジ10/11(金) 17:0016件/時,夕刊フジ,中国「台湾に主権は存在しない」建国記念日〝双十節〟に武力威嚇　軍用機27機、軍艦など14隻「サラミ戦術の一環」山下裕貴氏,16,https://news.yahoo.co.jp/articles/4e5591ce01bfc51420308c8ec3b6dfcf76aac1a9,10/11(金) 17:00
2024-10-11,20:06,world,国際,19ノーベル文学賞　韓国人作家のハン・ガン氏が受賞　アジア人女性で初毎日新聞10/10(木) 20:0616件/時,毎日新聞,ノーベル文学賞　韓国人作家のハン・ガン氏が受賞　アジア人女性で初,16,https://news.yahoo.co.jp/articles/aac0c519c088c34d43ac30adac3adfabc30ff9f5,10/10(木) 20:06
2024-10-11,20:06,world,国際,20ウクライナには「F16が緊急にもっと必要」だが、フランスはミラージュ戦闘機を供与すると発表ニューズウィーク日本版10/11(金) 17:0215件/時,ニューズウィーク日本版,ウクライナには「F16が緊急にもっと必要」だが、フランスはミラージュ戦闘機を供与すると発表,15,https://news.yahoo.co.jp/articles/64f14794a294d9f458a9273016292fc9096c287c,10/11(金) 17:02
2024-10-11,20:06,world,国際,21ハリケーン「ミルトン」直撃で死者10人、停電300万世帯以上　球場の屋根も吹き飛ぶ　アメリカ・フロリダ州FNNプライムオンライン（フジテレビ系）10/11(金) 4:1914件/時,FNNプライムオンライン（フジテレビ系）,ハリケーン「ミルトン」直撃で死者10人、停電300万世帯以上　球場の屋根も吹き飛ぶ　アメリカ・フロリダ州,14,https://news.yahoo.co.jp/articles/78a14a6f675c7b69e204a189e57daf6ca63702b0,10/11(金) 4:19
2024-10-11,20:06,world,国際,22韓国・20代男性、オフィステルの60代警備員に暴行・死亡…拡散するその瞬間の映像KOREA WAVE10/11(金) 17:3312件/時,KOREA WAVE,韓国・20代男性、オフィステルの60代警備員に暴行・死亡…拡散するその瞬間の映像,12,https://news.yahoo.co.jp/articles/f163658f0f042a48fdb2b65ac3cd40003d428a2a,10/11(金) 17:33
2024-10-11,20:06,world,国際,23トランプ氏勝利すれば激変と指摘　米大統領選情勢で神戸大院教授共同通信10/11(金) 16:2412件/時,共同通信,トランプ氏勝利すれば激変と指摘　米大統領選情勢で神戸大院教授,12,https://news.yahoo.co.jp/articles/28a34b2884581e3aa51b9df3319c043a59beb86b,10/11(金) 16:24
2024-10-11,20:06,world,国際,240:58「国家的な慶事」韓国で2人目のノーベル賞受賞者　韓江さんが文学賞受賞し大統領やBTSなど祝福続々FNNプライムオンライン（フジテレビ系）10/11(金) 6:1312件/時,FNNプライムオンライン（フジテレビ系）,「国家的な慶事」韓国で2人目のノーベル賞受賞者　韓江さんが文学賞受賞し大統領やBTSなど祝福続々,12,https://news.yahoo.co.jp/articles/bd1cc43071f9114173bf57badf2314402e6604eb,10/11(金) 6:13
2024-10-11,20:06,world,国際,25日本被団協にノーベル平和賞　「核兵器廃絶へ努力」と評価時事通信10/11(金) 18:0612件/時,時事通信,日本被団協にノーベル平和賞　「核兵器廃絶へ努力」と評価,12,https://news.yahoo.co.jp/articles/f3373cbbac81b5dc0fa661e7036a71f5a174df72,10/11(金) 18:06
2024-10-11,20:06,world,国際,26ノーベル文学賞を受賞した韓江氏の本が有害図書？　逆風が吹く京畿教育庁中央日報日本語版10/11(金) 15:3412件/時,中央日報日本語版,ノーベル文学賞を受賞した韓江氏の本が有害図書？　逆風が吹く京畿教育庁,12,https://news.yahoo.co.jp/articles/59cab96ddbe87290656eed0f37087244ebd7f2fd,10/11(金) 15:34
2024-10-11,20:06,world,国際,270:41「飼い主は処罰されるべきだ」　フロリダ州知事怒りの会見  AP通信10/11(金) 11:2412件/時,AP通信,「飼い主は処罰されるべきだ」　フロリダ州知事怒りの会見,12,https://news.yahoo.co.jp/articles/2adc9d8cb426c1facfb584ec654832e25dee7017,10/11(金) 11:24
2024-10-11,20:06,world,国際,28ノーベル平和賞、日本被団協に　被爆者証言が「核のタブー」成立に貢献と評価BBC News10/11(金) 17:4411件/時,BBC News,ノーベル平和賞、日本被団協に　被爆者証言が「核のタブー」成立に貢献と評価,11,https://news.yahoo.co.jp/articles/1718705c734b832a8f4a04c11d0837a554c4254c,10/11(金) 17:44
2024-10-11,20:06,world,国際,29米国はイスラエルを抑制できていないだけなのか、それとも中東戦争を煽っているのか　相反するバイデン政権の評価クーリエ・ジャポン10/11(金) 18:2511件/時,クーリエ・ジャポン,米国はイスラエルを抑制できていないだけなのか、それとも中東戦争を煽っているのか　相反するバイデン政権の評価,11,https://news.yahoo.co.jp/articles/9c860bf0ea90fd731daa97b0b37477f7eaa102d9,10/11(金) 18:25
2024-10-11,20:06,world,国際,30ハリケーン「ミルトン」で少なくとも16人死亡　米フロリダ州BBC News10/11(金) 11:1411件/時,BBC News,ハリケーン「ミルトン」で少なくとも16人死亡　米フロリダ州,11,https://news.yahoo.co.jp/articles/91cb3daa3dd7a9f5ccd044d1b304fcb0cc89dc87,10/11(金) 11:14
2024-10-11,20:06,world,国際,311:58石破首相の外交デビュー、各国受け止めは　きょうは東アジアサミット出席日テレNEWS NNN10/11(金) 17:4110件/時,日テレNEWS NNN,石破首相の外交デビュー、各国受け止めは　きょうは東アジアサミット出席,10,https://news.yahoo.co.jp/articles/938106abafcf7f6210ca5dd057b317814cd3c994,10/11(金) 17:41
2024-10-11,20:06,world,国際,32なぜ？ カリフォルニア州で“タコの養殖禁止”…想起される「捕鯨への圧力」 日本への影響は？ABEMA TIMES10/11(金) 14:0010件/時,ABEMA TIMES,なぜ？ カリフォルニア州で“タコの養殖禁止”…想起される「捕鯨への圧力」 日本への影響は？,10,https://news.yahoo.co.jp/articles/911e5eaa3951ece7893cef3913d3c512a015f9a6,10/11(金) 14:00
2024-10-11,20:06,world,国際,33トランプ氏、ニューヨーク・タイムズへの脅迫とも取れる発言「何をするか楽しみにしていてくれ」ハフポスト日本版10/11(金) 6:0210件/時,ハフポスト日本版,トランプ氏、ニューヨーク・タイムズへの脅迫とも取れる発言「何をするか楽しみにしていてくれ」,10,https://news.yahoo.co.jp/articles/6a5e0d5dc5806fa27ad5b3f5a135def1b8b5fc0b,10/11(金) 6:02
2024-10-11,20:06,world,国際,34中国ファーウェイ「三つ折り」スマホ、発売直後に耐久性問題が浮上KOREA WAVE10/11(金) 12:3310件/時,KOREA WAVE,中国ファーウェイ「三つ折り」スマホ、発売直後に耐久性問題が浮上,10,https://news.yahoo.co.jp/articles/38aa8623d48efe5699709c22935690e64c8bb777,10/11(金) 12:33
2024-10-11,20:06,world,国際,35プーチン大統領「新しい世界秩序必要」、トルクメニスタン訪問ロイター10/11(金) 17:1610件/時,ロイター,プーチン大統領「新しい世界秩序必要」、トルクメニスタン訪問,10,https://news.yahoo.co.jp/articles/9f82f5eff9a2233e7415e9effd927dd6008aa671,10/11(金) 17:16
2024-10-11,20:06,world,国際,36韓国大統領が「日本人拉致問題」に言及、「至急解決」訴え　日本との連携誇示産経新聞10/11(金) 17:5610件/時,産経新聞,韓国大統領が「日本人拉致問題」に言及、「至急解決」訴え　日本との連携誇示,10,https://news.yahoo.co.jp/articles/2a69fb76496266457e9c179211cdfa4a5efbc169,10/11(金) 17:56
2024-10-11,20:06,world,国際,37トランプ氏、ラストベルトで上昇…ミシガン・ウィスコンシン州２カ所は逆転中央日報日本語版10/11(金) 8:5710件/時,中央日報日本語版,トランプ氏、ラストベルトで上昇…ミシガン・ウィスコンシン州２カ所は逆転,10,https://news.yahoo.co.jp/articles/708f25f28fa84246c483d30d84618fd2a4b0aab1,10/11(金) 8:57
2024-10-11,20:06,world,国際,38「メーガン妃のスタッフいじめ」を最初に報じたイギリス人記者が見た、「メーガン妃問題」とはニューズウィーク日本版10/11(金) 11:009件/時,ニューズウィーク日本版,「メーガン妃のスタッフいじめ」を最初に報じたイギリス人記者が見た、「メーガン妃問題」とは,9,https://news.yahoo.co.jp/articles/debf87c609294c1915f004db93b74b8287975c03,10/11(金) 11:00
2024-10-11,20:06,world,国際,39ノーベル平和賞に日本被団協、１９７４年の佐藤栄作元首相以来２例目読売新聞オンライン10/11(金) 18:209件/時,読売新聞オンライン,ノーベル平和賞に日本被団協、１９７４年の佐藤栄作元首相以来２例目,9,https://news.yahoo.co.jp/articles/5c5faf958a7ca2d5a6994c03d8d29d75f3fd1a6a,10/11(金) 18:20
2024-10-11,20:06,world,国際,40国連軍に発砲で抗議　「イスラエルは戦争犯罪の可能性」　イタリア時事通信10/11(金) 5:249件/時,時事通信,国連軍に発砲で抗議　「イスラエルは戦争犯罪の可能性」　イタリア,9,https://news.yahoo.co.jp/articles/5a624fecc32af43f386bfbda40f4070f8807b7e6,10/11(金) 5:24
