scrp_date,scrp_time,genre_en,genre_jp,rank,media_jp,title,comment,link,date_original
2024-06-30,10:33,domestic,国内,1,共同通信,旭川中2凍死「いじめが主原因」　再調査委で初認定、きょう公表へ,506,https://news.yahoo.co.jp/articles/8b78a947c6404f560b7a85dea8a3857065aadffc,6/30(日) 6:00
2024-06-30,10:33,domestic,国内,2,文春オンライン,「正直何も思ってなかった」自慰行為強要、わいせつ画像拡散のイジメ加害生徒らを直撃【旭川14歳女子凍死】《調査結果公表へ》,345,https://news.yahoo.co.jp/articles/2c06173556788cf46fb1c5e949ac3662c6d1a021,6/30(日) 6:12
2024-06-30,10:33,domestic,国内,3,TBS NEWS DIG Powered by JNN,クルド人と過激ヘイト 「仮放免者にも就労を」 川口市で見えた外国人政策の課題【報道特集】,243,https://news.yahoo.co.jp/articles/a918db3edb2478cef41a94a2e481838a4014a11d,6/30(日) 7:32
2024-06-30,10:33,domestic,国内,4,朝日新聞デジタル,小学校2校で教諭のミスでプールの水が流出　学校長、損失負担の意向,222,https://news.yahoo.co.jp/articles/fa4c80cc6051a97eac1dc37f15891ff2e0cbddb9,6/29(土) 10:45
2024-06-30,10:33,domestic,国内,5,テレビ朝日系（ANN）,【賛否】人気ラーメン店「イヤホンやめて」SNS投稿　片手でゲーム…回転率はダウン,208,https://news.yahoo.co.jp/articles/b2ea8a39d6ec321cef71e6467f3a9c6de35ba5cd,6/29(土) 11:46
2024-06-30,10:33,domestic,国内,6,現代ビジネス,「愛子天皇」を９割の国民が熱望…そのウラで多くの人が犯している「勘違い」,184,https://news.yahoo.co.jp/articles/c9896b79398100b3377c77efb66d5a9a58f0811c,6/30(日) 8:03
2024-06-30,10:33,domestic,国内,7,FNNプライムオンライン（フジテレビ系）,自民・茂木氏「首相になってやりたい仕事があるのは間違いない」,136,https://news.yahoo.co.jp/articles/13013ee422e8c86fcee5885fdf7102d9dbe28462,6/30(日) 9:18
2024-06-30,10:33,domestic,国内,8,テレビ朝日系（ANN）,【独自】未解決のまま2年…八田與一容疑者の“親友”が証言,129,https://news.yahoo.co.jp/articles/14b100cd26b9bdfb3ed04696a2f0c0cc8967db08,6/30(日) 0:22
2024-06-30,10:33,domestic,国内,9,スポニチアネックス,蓮舫氏「都民投票」の新公約　神宮外苑再開発で有権者と交流、否定意見多数　小池氏を“リング”に上げる,121,https://news.yahoo.co.jp/articles/40b99e314cd5e5122982f4dda5b47e08b405646b,6/30(日) 4:40
2024-06-30,10:33,domestic,国内,10,弁護士ドットコムニュース,男子校は女子差別？ 共学化論争に欠けた「機会の平等」議論と「東大至上主義」への疑問　おおたとしまささん,113,https://news.yahoo.co.jp/articles/ac14d8b25352d191e7cf815798dd77ebb41b1019,6/30(日) 8:04
2024-06-30,10:33,domestic,国内,11,デイリースポーツ,「サンモニ」孫正義氏　円安原因「日本の底力低下」　この３０年、大経営者らが新技術を軽視「若い者が何言ってると叩き」　立て直しには,99,https://news.yahoo.co.jp/articles/d4697d6522565573f1cba7c7166e3360ee09cf61,6/30(日) 10:02
2024-06-30,10:33,domestic,国内,12,ダイヤモンド・オンライン,映画館で予約した席になぜか先客「空いてる席に座ればいいじゃん」とナメくさった返事→何と返すのが大人の対応？,99,https://news.yahoo.co.jp/articles/3b2c40ccd16b870d7641f7f6f174c8febf909b9c,6/30(日) 6:02
2024-06-30,10:33,domestic,国内,13,時事通信,蓮舫氏、政権批判票狙う　立・共共闘、衆院選に影　東京都知事選,94,https://news.yahoo.co.jp/articles/0d4680dbe786aff0c06292facccc7de5d51295e0,6/30(日) 7:05
2024-06-30,10:33,domestic,国内,14,弁護士JPニュース,ブックオフで「架空買い取り」横行か… 一部店舗で休業、北海道では3200万円所在不明で店長が失踪,71,https://news.yahoo.co.jp/articles/861206218fec11f77b64dd961330711c6f6eedfa,6/30(日) 9:30
2024-06-30,10:33,domestic,国内,15,デイリースポーツ,橋下徹氏　大阪万博「不満の人はチケット全額払い戻し！倍返し！」吉村知事に迫る「言い切らないと」開幕日間違えるミスも,71,https://news.yahoo.co.jp/articles/a6951003821251d9f20fff6cbf558a89a0977b50,6/29(土) 19:09
2024-06-30,10:33,domestic,国内,16,読売新聞オンライン,トヨタ系、下請け５０社に金型を無償で長期保管させる…最大３０年・被害総額は数億円の可能性,70,https://news.yahoo.co.jp/articles/7237b597507d8d6ccaed618d102d2d419923c962,6/30(日) 5:01
2024-06-30,10:33,domestic,国内,17,TBS NEWS DIG Powered by JNN,「送還されたら死ぬまで刑務所」“強制送還”と“ヘイト”のはざまで暮らす家族　川口のクルド人のいま【報道特集】,68,https://news.yahoo.co.jp/articles/c4563fea02f61471160093e5944a879a78a1ad11,6/30(日) 7:32
2024-06-30,10:33,domestic,国内,18,文春オンライン,「死ぬから画像を消してください」旭川14歳女子死亡“ウッペツ川飛び込み”イジメ事件の全貌《調査結果公表へ》,66,https://news.yahoo.co.jp/articles/c4cc6a6998661b779f5abab6d4312da43bbfb190,6/30(日) 6:12
2024-06-30,10:33,domestic,国内,19,FNNプライムオンライン（フジテレビ系）,蓮舫氏演説会場で暴行　59歳の男を現行犯逮捕　抗議活動中に男性の手殴る,65,https://news.yahoo.co.jp/articles/43a9b61d013d826e9c11b8d2a358cae6973ba5d2,6/30(日) 1:22
2024-06-30,10:33,domestic,国内,20,朝日新聞デジタル,救急車でコンビニ利用を容認へ　連続出動で昼食抜きの隊員多く　堺市,65,https://news.yahoo.co.jp/articles/61608b5414c4a18827f7c61fcbd2ef9586c44031,6/30(日) 8:15
2024-06-30,10:33,domestic,国内,21,集英社オンライン,〈都知事選・Z世代が期待する候補者〉不適切選挙ポスターは“ゆとり教育”の影響？　カオスな東京都知事選挙に対するZ世代の本音,64,https://news.yahoo.co.jp/articles/5e12b1170790b39420fa186dfe84a59931d849dd,6/30(日) 8:02
2024-06-30,10:33,domestic,国内,22,文春オンライン,「ママ、死にたい」自慰行為強要、わいせつ画像拡散……氷点下の旭川で凍死した14歳女子中学生への“壮絶イジメ”《調査結果公表へ》,62,https://news.yahoo.co.jp/articles/ff28919dbb94187f8441826ab27b40641912f264,6/30(日) 6:12
2024-06-30,10:33,domestic,国内,23,SmartFLASH,「時間があるなら質問に答えて」小池百合子都知事「公務優先」のなか「都電プロレス」登場で有権者の批判殺到,62,https://news.yahoo.co.jp/articles/dc9d751a49fb4923c3b6a4872638ae14d3a00c71,6/29(土) 18:40
2024-06-30,10:33,domestic,国内,24,現代ビジネス,円安が怖すぎて…日本から海外への留学生数がもはや「韓国のたった4分の1」に低落！絶望的に開いていく日韓の「能力格差」,61,https://news.yahoo.co.jp/articles/55c8d36e3c10572b8d5f08ceeaa044d90537666e,6/30(日) 6:04
2024-06-30,10:33,domestic,国内,25,TBS NEWS DIG Powered by JNN,沖縄で米兵による性的暴行事件がまた発覚　専門家「適切な情報共有があれば再発防止策が取られていたはず」【news23】,59,https://news.yahoo.co.jp/articles/51453e04a6ad3d4438e71657ffb0e43fc7d1b05e,6/29(土) 14:09
2024-06-30,10:33,domestic,国内,26,弁護士JPニュース,国民の過半数が賛成の「選択的夫婦別姓」が実現しないのはナゼ？　現役の“敏腕裁判長”が語る…最高裁判事が「全員65歳代後半」の深刻なリスク,58,https://news.yahoo.co.jp/articles/e594aed16eed40f8e4f4fa62e86bdc714db74918,6/30(日) 9:00
2024-06-30,10:33,domestic,国内,27,デイリー新潮,注目の石丸伸二氏は街頭演説でどんな話をしているのか　選挙のプロは「支持者以外にはやや拍子抜けの印象」【都知事選】,57,https://news.yahoo.co.jp/articles/473bf19036d96856e0f8e2b80d1b225d743fa0ae,6/29(土) 11:00
2024-06-30,10:33,domestic,国内,28,共同通信,旭川いじめ再調査、30日公表へ　自殺との因果関係焦点,56,https://news.yahoo.co.jp/articles/9baecbc8ac0d71c79e697d686d640a010e53deb4,6/29(土) 12:16
2024-06-30,10:33,domestic,国内,29,朝日新聞デジタル,世界的ミスコン準GP　モデルと医師の二刀流めざす島根大医学部生,55,https://news.yahoo.co.jp/articles/60825d6dd5da7aa0090f5f1e6a5e2ed6f305f986,6/30(日) 9:00
2024-06-30,10:33,domestic,国内,30,日テレNEWS NNN,【密着】履歴書・面接なしで働ける「スキマバイト」　幅広い年代で利用…気軽にさまざまな仕事の経験も,53,https://news.yahoo.co.jp/articles/34eeab96221a0c947c42346da849f506c5f35c71,6/29(土) 15:02
2024-06-30,10:33,domestic,国内,31,毎日新聞,都知事選でフェイク相次ぐ　加工画像で候補者の誤った情報が拡散,44,https://news.yahoo.co.jp/articles/7c2c97c08e80b80f1c633f0262bf759727c4d5ba,6/29(土) 17:40
2024-06-30,10:33,domestic,国内,32,夕刊フジ,都知事選、華麗なる「経済人応援団」の存在　ドトールだけじゃない！石丸伸二氏に「大物２０人」、ひまそらあかね氏に「新生姜」社長も,42,https://news.yahoo.co.jp/articles/a073d22e43113cb8aa5129d52bc51a2267cb2f50,6/29(土) 17:00
2024-06-30,10:33,domestic,国内,33,読売新聞オンライン,車内で泥酔状態の２０代女性に性的行為の疑い、タクシー運転手を逮捕「介抱しているうちに…」,41,https://news.yahoo.co.jp/articles/2cf719c84b914ce2f828be1937689b2a7115b1e2,6/29(土) 18:37
2024-06-30,10:33,domestic,国内,34,日テレNEWS NNN,川で沢登り中に流され　男女2人心肺停止　岐阜,41,https://news.yahoo.co.jp/articles/7f801d03a1689343a108304b8d3b3a85f8b6de9e,6/29(土) 17:15
2024-06-30,10:33,domestic,国内,35,日刊スポーツ,泉房穂氏「電撃視察」を予告　都知事選ラストサンデー「見かけてもそっとしておいてくださいね」,39,https://news.yahoo.co.jp/articles/09051eab7cc6500ecb264eb0c22b7735c745fb0f,6/30(日) 9:58
2024-06-30,10:33,domestic,国内,36,スポニチアネックス,小池百合子都知事　23区で初の街頭演説に聴衆約1200人　「都政をもっとよく」,39,https://news.yahoo.co.jp/articles/4cb151c8c269a4cf62157d8bb9d2cdbaa62015b2,6/29(土) 20:05
2024-06-30,10:33,domestic,国内,37,ABEMA TIMES,八田容疑者に対し「非常に人間的に不愉快」「明かに殺人でしょ」千原ジュニアが別府ひき逃げ死亡事件について想いを激白,38,https://news.yahoo.co.jp/articles/0c96a850c76c5a70a95cbb912403852de28208da,6/30(日) 7:02
2024-06-30,10:33,domestic,国内,38,関西テレビ,「マイナカードは？」と聞いたら患者にカード投げつけられ…　混乱する医療現場　マイナ保険証の利用「ゴリ押し」キャンペーンの波紋（後編）,38,https://news.yahoo.co.jp/articles/a9bc59a7df3720b86b3471520c1fff8cf4190c77,6/29(土) 18:40
2024-06-30,10:33,domestic,国内,39,日刊スポーツ,蓮舫氏「都民の声を聞きたい」都知事選の新公約を発表「神宮外苑再開発を問う都民投票を提案」,38,https://news.yahoo.co.jp/articles/2661e8bd5b4bd2024f0afc1dff034617b9b4235c,6/29(土) 16:08
2024-06-30,10:33,domestic,国内,40,ニッポン放送,政治にかかるカネには2種類　「まっとうな政治活動に必要な金と“みかじめ料”的金」元衆議院議員・豊田真由子氏が明かす,33,https://news.yahoo.co.jp/articles/0af8fcab3c8d69fa7cc23bc67cf2115f156399e0,6/30(日) 9:00
