scrp_date,scrp_time,genre_en,genre_jp,rank,media_jp,title,comment,link,date_original
2024-06-30,11:21,local,地域,1,NBS長野放送,粗大ごみの中から現金9万円　警察に届け出ず処理施設の職員たちが焼き肉店での飲食に使用　見つけた現金で菓子やジュース購入…習慣化　広域連合が処分や指導,208,https://news.yahoo.co.jp/articles/3e7a768c66b61dd3dc1fe4efaf15efca568b9bd7,6/29(土) 11:50
2024-06-30,11:21,local,地域,2,沖縄タイムス,米兵による性的暴行事件　15件が非公表か　1995年～2024年の30件中　23年以降は逮捕や起訴後も公表せず　沖縄県警の判断が変容,120,https://news.yahoo.co.jp/articles/98ed33384e7edf63cee09469b94b78f776cd204f,6/30(日) 5:43
2024-06-30,11:21,local,地域,3,HBCニュース北海道,田村瑠奈被告「私の首を絞めることが責任だ」父親「私は誰も殺しません。私にはできません」約３年間の“狂乱”の音声データ、証拠として提出…犯行認識は「おじさんの頭を持って帰ってきた」の後、娘に従うしかなかった関係を父親証言へ　ススキノ首切断事件,94,https://news.yahoo.co.jp/articles/5db774565c7421a06ae99430d90b2a13e98a8655,6/30(日) 7:03
2024-06-30,11:21,local,地域,4,STVニュース北海道,面識のない男性を“結婚相手”と思い込んだか 男性の部屋に侵入した40代の女を現行犯逮捕,79,https://news.yahoo.co.jp/articles/fbfd3269da3626dd28013715f0b179ca83272042,6/30(日) 10:24
2024-06-30,11:21,local,地域,5,HBCニュース北海道,所持金がないのにタクシーに乗車し到着すると「お金がない」運賃770円払えず…19歳の女「家に着いてからお金を取りに行って払えばいいと思った」,52,https://news.yahoo.co.jp/articles/ed352b51ec696a44c0b48896b1a618475ec1c51e,6/30(日) 8:39
2024-06-30,11:21,local,地域,6,読売新聞オンライン,3時間にわたり交際相手の18歳女性に暴行、鼓膜破る…容疑で32歳を逮捕,44,https://news.yahoo.co.jp/articles/ae15e13afa629c0f5695ddb8d67d06ad408511a1,6/30(日) 10:43
2024-06-30,11:21,local,地域,7,メ〜テレ（名古屋テレビ）,【速報】飛騨川で沢登り中の男女2人が流され行方不明　岐阜県七宗町,35,https://news.yahoo.co.jp/articles/db05328f5eb01387deacea1f99ce51b80fa1042e,6/29(土) 13:52
2024-06-30,11:21,local,地域,8,山陰中央新報,都と地方 財政力の差歴然　東京都知事選の論戦を通じ格差浮き彫りに 「財政力指数」４７都道府県で最下位の島根　東京一極集中の加速を懸念,30,https://news.yahoo.co.jp/articles/f7522bce48823a10eee813a3755c70a951a4c8f3,6/30(日) 7:00
2024-06-30,11:21,local,地域,9,神戸新聞NEXT,タクシーが自転車とあわや衝突、急ブレーキで乗客けが　自転車の人物にひき逃げ容疑　神戸,27,https://news.yahoo.co.jp/articles/2a6deb28ffec206ffadc42659bcc3e807a5214a9,6/30(日) 8:47
2024-06-30,11:21,local,地域,10,宮崎日日新聞,交番加入電話 県内あす廃止　県警、初動対応迅速化へ,26,https://news.yahoo.co.jp/articles/402cc72017fcfc0970245ba210e5a3f10d7e3f51,6/30(日) 9:42
2024-06-30,11:21,local,地域,11,RKB毎日放送,「誰の女に手出しとん」美人局か…16～18歳の男女3人逮捕　専門学校生から12万円など脅し取った疑い,22,https://news.yahoo.co.jp/articles/dc614f3e02929496cfc445ba0f2b60a5d9d92f21,6/29(土) 22:24
2024-06-30,11:21,local,地域,12,HBCニュース北海道,“停車が遅い”手を挙げて止まったタクシーに因縁、65歳の男性運転手の顔面を殴る…現場は警察署の前　暴行容疑の37歳男「殴ってない」,21,https://news.yahoo.co.jp/articles/ad407eab6eab4a51d2f6385263515804ff37db52,6/30(日) 9:01
2024-06-30,11:21,local,地域,13,北海道ニュースUHB,警察署の目の前で… タクシーを呼び止めた男「タクシーの止まり方が悪い」因縁つけてタクシー蹴り運転手殴り現行犯逮捕 札幌市厚別区,20,https://news.yahoo.co.jp/articles/ceeb2edf23eda77638e19d43ae7af1508d53e358,6/30(日) 9:18
2024-06-30,11:21,local,地域,14,八重山日報,辞世の句「削除しないで」　仲村氏が15旅団に要請,20,https://news.yahoo.co.jp/articles/45120648d7cb58a3e671dcb58dcba0ac45b58cf8,6/30(日) 4:00
2024-06-30,11:21,local,地域,15,RSK山陽放送,車掌の首を絞めるなどした疑い　自称・自営業の男（自称61）を現行犯逮捕　男は「全く覚えていない」と供述　列車は1時間の遅れ【岡山】,20,https://news.yahoo.co.jp/articles/942a5577b4de5644d65499c0a84b31db75e75a4c,6/30(日) 9:44
2024-06-30,11:21,local,地域,16,RSK山陽放送,JR赤穂線　夜の列車内で「乗客複数人によるけんか」か　加害者とみられる男性1人の身柄確保　当該列車が1時間の遅れ【岡山】,17,https://news.yahoo.co.jp/articles/3b2b86e2de5bb634bb1f406a2d1ad2213668e508,6/30(日) 8:04
2024-06-30,11:21,local,地域,17,HBCニュース北海道,「結婚相手から“念力”で入るように言われた」40代の女が面識のない49歳男性宅に侵入…目撃者「留守のはずなのに入っていった」と通報　北海道函館市,16,https://news.yahoo.co.jp/articles/39f3155cfdd8c78f5085b9391580cd1f0b6bee00,6/30(日) 10:53
2024-06-30,11:21,local,地域,18,中国新聞デジタル,広島市のファミリープール、新サカスタ側から「丸見え」　盗撮懸念で対策,15,https://news.yahoo.co.jp/articles/3949e4abdc9d4727dd2a8514259d05533e5d9aac,6/30(日) 8:20
2024-06-30,11:21,local,地域,19,HBCニュース北海道,路上で30代妻の髪の毛や胸倉をつかみ暴行　妻が自ら警察へ「夫から暴力を受けた」飲酒の24歳の男「間違いありません」北海道苫小牧市,14,https://news.yahoo.co.jp/articles/d0ead81c33efb2df1d121699aa35963132bc1328,6/30(日) 9:54
2024-06-30,11:21,local,地域,20,RSK山陽放送,県道187号交差点で軽乗用車とバイクが衝突　バイクの男性（18）が死亡　軽乗用車運転のアルバイトの女（29）を現行犯逮捕【香川】,14,https://news.yahoo.co.jp/articles/0a4cc59fb0b39fa46abfb90219cb3ce6f9814639,6/30(日) 7:38
2024-06-30,11:21,local,地域,21,京都新聞,乗り込もうと後部ドアに手、そこへ路線バス　接触の女性が指を複雑骨折する重傷,14,https://news.yahoo.co.jp/articles/9dcaed272f56cff2c6d08df0953c0cb07ca7081e,6/29(土) 22:57
2024-06-30,11:21,local,地域,22,UX新潟テレビ21,来夏の参院選　立憲民主党県連・現職 打越さく良氏を擁立へ  自民・裏金問題で「風が吹いている」【新潟】,13,https://news.yahoo.co.jp/articles/b92db7c86be4bcd617aea70db04f5c1cd2b4c7a4,6/30(日) 10:00
2024-06-30,11:21,local,地域,23,関西テレビ,支援学級で学ぶ児童や保護者ら 「通常学級」での時間を制限する通知「撤回を」 インクルーシブ教育シンポ,13,https://news.yahoo.co.jp/articles/8936c3d0c5b28eb4cd3ced7275929a55e9967e98,6/29(土) 18:34
2024-06-30,11:21,local,地域,24,埼玉新聞,母だまされたふり…「急いで」の電話は息子じゃない　当初は現金を下ろそうとした母、寸前で気付いた人が阻止　通報し母が警官に協力…詐欺師とスーパーで待ち合わせ、声かけてきた女逮捕　何も知らず現れた25歳,13,https://news.yahoo.co.jp/articles/452b523cf992fb4d843ceaabb4dec20673a4d71f,6/30(日) 7:44
2024-06-30,11:21,local,地域,25,カナロコ by 神奈川新聞,南武線津田山駅で線路内に人が転落　一時運転見合わせ,13,https://news.yahoo.co.jp/articles/d220715b927e31c7d924c65c6d1324db79f0c5bd,6/30(日) 9:50
2024-06-30,11:21,local,地域,26,あなたの静岡新聞,時短の看護師、一般病棟“出張”　静岡市立静岡病院が応援チーム新設、好評,12,https://news.yahoo.co.jp/articles/cd52a0ef02859ebc76864949e6d0b1022a8703bf,6/30(日) 8:14
2024-06-30,11:21,local,地域,27,MBSニュース,近鉄けいはんな線　新石切～学研奈良登美ヶ丘で始発から運転見合わせ　土砂崩れの影響,12,https://news.yahoo.co.jp/articles/124c5d1665cc1b79a20a0f5164db0aa7c9775967,6/30(日) 9:25
2024-06-30,11:21,local,地域,28,中京テレビＮＥＷＳ,面識のない７歳男児を殴ったか　前歯が折れるけが　男（４９）を逮捕　岐阜県警,12,https://news.yahoo.co.jp/articles/cde591499c7236ff9354b3acba7386451b3ae36e,6/30(日) 6:48
2024-06-30,11:21,local,地域,29,HBCニュース北海道,通りかかった24歳と48歳の女性２人に突然襲いかかる「友人が殴られた」一緒にいた友人が通報　酒酔いの62歳男「顔をたたいた」北海道帯広市,12,https://news.yahoo.co.jp/articles/3b88ebfbbb431fe8cf8a09ce2fdb94e3d35b65a4,6/30(日) 9:29
2024-06-30,11:21,local,地域,30,岐阜新聞Ｗｅｂ,飲食店で７歳男児の顔殴った疑い、４９歳男逮捕　犯行時は飲酒、岐阜中署,12,https://news.yahoo.co.jp/articles/0aa9fa5c0fc00a6a39e4b26c659aefc39813c6aa,6/30(日) 8:21
2024-06-30,11:21,local,地域,31,HBCニュース北海道,次期衆院選に不出馬の自民・堀井学氏「心の底からおわび」北海道９区支部は後任を公募で選考へ　支部長代行「総裁選があるので９月上旬までに」,12,https://news.yahoo.co.jp/articles/c265aea138f8a63559f9ca65c137e8c04a9ec504,6/30(日) 9:12
2024-06-30,11:21,local,地域,32,RCC中国放送,宅配便の10件に1件が「再配達」 年間“6万人分の労働力”に相当　トラックドライバー不足の中で「置き配」呼びかけ　最新グッズは【物流2024年問題】,11,https://news.yahoo.co.jp/articles/614d92074668ac7990847c81a3ed64a9ec85743c,6/29(土) 15:02
2024-06-30,11:21,local,地域,33,中京テレビＮＥＷＳ,父親の顔面を数十発殴った疑い　警察官の男を逮捕　親子間でトラブルか　愛知県警,11,https://news.yahoo.co.jp/articles/5ab8d3fda41926fe41cec57c8996223456005e6a,6/30(日) 0:59
2024-06-30,11:21,local,地域,34,HBCニュース北海道,「歩行者が歩道から車道に飛び出した」横断歩道ない道路で、87歳の男性死亡…その場で逮捕、乗用車ではねた24歳の無職「私が前をよく見ないで運転し、起こした事故です」 北海道帯広市,11,https://news.yahoo.co.jp/articles/af9bd7104bf64ed66ca6acaa1dc5285bf5438187,6/29(土) 13:50
2024-06-30,11:21,local,地域,35,北日本新聞,売掛金回収でデリヘル紹介疑い　富山のホストクラブ経営者ら逮捕,11,https://news.yahoo.co.jp/articles/016415a5f98aaac9037e27d90b8fd59b6834b6dd,6/30(日) 8:10
2024-06-30,11:21,local,地域,36,琉球新報,逃げたシカ、残りの1頭も捕獲　沖縄こどもの国、自ら園内に戻る　きょう30日も臨時休園,10,https://news.yahoo.co.jp/articles/2a8dae27520e4c8ca29750edcbcbf4a26dc6bd40,6/30(日) 10:26
2024-06-30,11:21,local,地域,37,静岡朝日テレビ,ビルの階段で飲食店で働く女性の体を触った疑いで自称無職の男を逮捕　静岡・葵区,10,https://news.yahoo.co.jp/articles/1398cad4113fe7cfdaa435364d807dd4b27a89dc,6/30(日) 9:27
2024-06-30,11:21,local,地域,38,テレビ静岡NEWS,富士山を下山中に道を間違え…険しすぎて戻れず救助要請　山岳遭難救助隊が50歳男性を無事救助,10,https://news.yahoo.co.jp/articles/900bf8d8187f59229e1e3352c3b87a85c28814a3,6/29(土) 21:15
2024-06-30,11:21,local,地域,39,ｔｙｓテレビ山口,「がっちりマンデー!!」で紹介「儲かるpH（ピーエイチ）」「ペーハー」で習った世代も。大人は知らない…変わる小学校の新常識!,10,https://news.yahoo.co.jp/articles/284a2879e8fe93c354ec8d9ab6e583a3e6ff2992,6/30(日) 8:14
2024-06-30,11:21,local,地域,40,北海道ニュースUHB,「家に着いてからお金を取りにいって払えばいいと思っていた」770円のタクシー代金を払わなかった19歳の女が逮捕 しかし”降車場所”は自宅から遠く… 札幌市中央区,10,https://news.yahoo.co.jp/articles/d3ef0caece4713fc90a3e658f83a0fa8ce6a85c2,6/30(日) 9:16
