scrp_date,scrp_time,genre_en,genre_jp,rank,media_jp,title,comment,link,date_original
2026-01-10,04:09,business,経済,1,共同通信,冬のボーナス最高更新、2年連続　主要企業、平均95万7千円超,229,https://news.yahoo.co.jp/articles/ac30fda215b3e560a838fc4ea8b632426185d059,1/9(金) 16:45
2026-01-10,04:09,business,経済,2,ロイター,イオン、クスリのアオキＨＤとの資本業務提携を解約　「自社理念に反する」,73,https://news.yahoo.co.jp/articles/7b2699375549bdbd73398f5373809acb569aea67,1/9(金) 16:41
2026-01-10,04:09,business,経済,3,東洋経済オンライン,「“私刑”されて当然」vs「ネットで晒すのは二次加害」  栃木・県立高《トイレで暴行事件》の加害者への“私刑”賛否に「ヒートアップする人たち」が見落とす重大視点,48,https://news.yahoo.co.jp/articles/ca5a5d38f4fe8025ed061fe160875c326dd1a0ed,1/9(金) 14:16
2026-01-10,04:09,business,経済,4,ロイター,日経平均先物が急伸、高市首相が衆院解散を検討と報道　ドル／円も上昇,44,https://news.yahoo.co.jp/articles/b7a6ba728ed7f7645c861b3c09fe74c5e32ce672,1/9(金) 23:57
2026-01-10,04:09,business,経済,5,読売新聞オンライン,日本向けレアアース、中国が輸出制限…高市首相の台湾有事答弁受けた軍民両用製品の輸出禁止の一環か,37,https://news.yahoo.co.jp/articles/99752720ecb3b4be0fade5ae0ee50899bf0eed41,1/10(土) 1:31
2026-01-10,04:09,business,経済,6,週刊SPA!,Amazon配達員が「勝手に置き配する」ケースが多発。「一日あたり200個以上配達することも…」配達員のミスや勘違いが原因か,37,https://news.yahoo.co.jp/articles/cf2479e1d62267140fe932407d020bc000691eef,1/9(金) 8:54
2026-01-10,04:09,business,経済,7,共同通信,対日レアアース制限と報道　米紙、中国が輸出審査停止,33,https://news.yahoo.co.jp/articles/073be4500d3223f141324136b88c2a527b3bb389,1/9(金) 23:12
2026-01-10,04:09,business,経済,8,読売新聞オンライン,スーパーのコメ価格、過去最高額を更新…前週より９３円高い５キロ４４１６円,33,https://news.yahoo.co.jp/articles/ca5766692f1ab87215385ab250685766dc2f9d21,1/9(金) 17:43
2026-01-10,04:09,business,経済,9,ITmedia ビジネスオンライン,「残クレアルファード」を笑えない日が来る？　スマホに住宅、今後も残クレが広がっていきそうな納得の理由,31,https://news.yahoo.co.jp/articles/442f7dd91451784ba121d9cfdaa5c5a5e8bc8169,1/9(金) 5:55
2026-01-10,04:09,business,経済,10,プレジデントオンライン,"自社のうどんは一杯も売らなかった…丸亀製麺が「店舗ゼロの丸亀市」で""地元店だけ""のうどん祭りを開いた理由",28,https://news.yahoo.co.jp/articles/7573f9dbe0a4c996f2e86df57b78cdae0ec33467,1/9(金) 17:15
2026-01-10,04:09,business,経済,11,東洋経済オンライン,ドン・キホーテが「ジャングル陳列」を捨てた？　30〜50代女性の本音“安くても汚い店は嫌”を受け……新業態で狙う全国400商業施設の“空白地帯”,28,https://news.yahoo.co.jp/articles/23d3ae00c87e4c8963311697a37d6e6b1acef12a,1/9(金) 5:30
2026-01-10,04:09,business,経済,12,プレジデントオンライン,首相自ら「瀕死の状態」と宣言する大失態…原発も石炭も手放し「一人負け」、ドイツが崩壊寸前に至ったワケ,27,https://news.yahoo.co.jp/articles/8efca0f8e56ccd14be0325a00cc0312974a0eff3,1/9(金) 19:15
2026-01-10,04:09,business,経済,13,読売新聞オンライン,訪日外国人の見通し、中国・香港からの来日減り５年ぶり減少…欧米豪の伸びは続き消費額は増加,26,https://news.yahoo.co.jp/articles/6d96ea2001bb96805e8213e618f793e3c6ad2190,1/9(金) 21:47
2026-01-10,04:09,business,経済,14,FNNプライムオンライン（フジテレビ系）,円相場1年ぶりに一時1ドル=158円台に急落　高市首相解散検討報道で,25,https://news.yahoo.co.jp/articles/0b53ffff7309ad89377f80d1dd3b1b766fb5da6d,1/10(土) 1:45
2026-01-10,04:09,business,経済,15,ITmedia ビジネスオンライン,“サボり”は美徳か、裏切りか？　「効率化」と混同される危険な言葉,24,https://news.yahoo.co.jp/articles/a94018c1e7d20c62d11dfbb4b0561652e1866f0c,1/9(金) 8:10
2026-01-10,04:09,business,経済,16,TBS NEWS DIG Powered by JNN,コメ価格「安くなる」見通しなのに…また史上最高値更新 “5キロ平均4416円” 本格的な値下がり時期は不透明,24,https://news.yahoo.co.jp/articles/53631ca2ac52bb697eb4d20361779970dab612ae,1/10(土) 1:07
2026-01-10,04:09,business,経済,17,TBS NEWS DIG Powered by JNN,レアアースめぐる中国の動き「非常に遺憾」片山財務大臣　G7財務相らで重要鉱物の供給網の安定化を議論へ,24,https://news.yahoo.co.jp/articles/e2d5493fa0614f419dc7e3b448ca2164929c4370,1/9(金) 16:07
2026-01-10,04:09,business,経済,18,読売新聞オンライン,ＡＮＡがドローン物流を全国で事業化へ…離島に医薬品、災害時は孤立地域へ食料を輸送,23,https://news.yahoo.co.jp/articles/ac68c1c17ac69ab218c7a8684f5f67805c404bea,1/9(金) 5:00
2026-01-10,04:09,business,経済,19,共同通信,中国が対日レアアース輸出制限開始と米紙,23,https://news.yahoo.co.jp/articles/469dd5e7ec9668c31ce34228481df1a0bfd22e2e,1/9(金) 22:59
2026-01-10,04:09,business,経済,20,テレビ朝日系（ANN）,『5キロ4416円』コメ価格また最高値更新も…足元では“下落”の兆しも,22,https://news.yahoo.co.jp/articles/aa0533eabd0e4ef3024fa7972e80adc648f88883,1/10(土) 2:12
2026-01-10,04:09,business,経済,21,東洋経済オンライン,「海外では当たり前」「中身が違うんだから問題なくない？」 大阪家系ラーメン店の《外国人への“二重価格”》に肯定意見が多数も、やはり悪手だったワケ,19,https://news.yahoo.co.jp/articles/91a7f6a899eae21f1a2b41aa1007449acbfc9137,1/9(金) 15:50
2026-01-10,04:09,business,経済,22,日テレNEWS NNN,日本の加工食品など…通関手続きに数週間程度の遅れ“高市首相答弁”以降　中国,19,https://news.yahoo.co.jp/articles/ee844b913f9de043d161ce8f9d07b948b03b6142,1/9(金) 15:41
2026-01-10,04:09,business,経済,23,東京商工リサーチ,2025年「介護事業者」倒産 過去最多176件「訪問介護」の倒産が突出、認知症GHも増加,19,https://news.yahoo.co.jp/articles/a3495ba4666b57b3f5893334a6fa073039c3607b,1/9(金) 11:02
2026-01-10,04:09,business,経済,24,TBS NEWS DIG Powered by JNN,【速報】1年ぶりに1ドル＝158円台に下落　高市政権“解散検討”報道で,19,https://news.yahoo.co.jp/articles/b2192ec2e57a9e8233ea463b40dd185796e18fc8,1/10(土) 0:01
2026-01-10,04:09,business,経済,25,テレビ朝日系（ANN）,チケット個人取引トラブル　直撃に釈明「詐欺ではない」警察相談後に急展開【詳細版】,18,https://news.yahoo.co.jp/articles/4f24e86695f83ad17bce105280c4dbf119f1126b,1/9(金) 11:06
2026-01-10,04:09,business,経済,26,Bloomberg,円が対ドルで下げ幅拡大、一時157円80銭－米雇用統計受け,17,https://news.yahoo.co.jp/articles/a7771ce90ee0448bc217d7565dc58067a2928839,1/9(金) 22:32
2026-01-10,04:09,business,経済,27,産経新聞,大阪難波のラーメン店「二重価格」で中国人客とトラブル　英語表記はトッピング付きで高額,17,https://news.yahoo.co.jp/articles/b05ae61daa77aab306641de5d632f1c04a23f7c5,1/9(金) 19:00
2026-01-10,04:09,business,経済,28,Yahoo!ニュース オリジナル THE PAGE,【ヤフコメで話題】「介護現場の過酷な実態と処遇改善の必要性」「人手不足と倫理的課題に意見」 - 介護業界の現場を巡る議論,16,https://news.yahoo.co.jp/articles/644280c0205677d5d9cd4743548da6c37b27b2b1,1/9(金) 13:13
2026-01-10,04:09,business,経済,29,プレジデントオンライン,出店するなら大歓迎だけど…「香川県では選ばれにくい」丸亀製麺を初めて食べた地元の人の本音,16,https://news.yahoo.co.jp/articles/7103b4ad28b8a3abb6dda38a32a72ba5302dc921,1/9(金) 17:20
2026-01-10,04:09,business,経済,30,時事通信,閉店後の名鉄百貨店、一部で営業継続を検討,16,https://news.yahoo.co.jp/articles/f7052a662a12ec373c0563d02defb741024598a6,1/9(金) 20:00
2026-01-10,04:09,business,経済,31,TBS NEWS DIG Powered by JNN,コメ価格 なぜきょうも「過去最高値」を更新？ “下がる見通し”なのに「高止まり」…要因は？いつ安くなる？専門家に聞く,15,https://news.yahoo.co.jp/articles/9bedff78a20c1dfe8c2df5fe63f0ea1e3b349cbb,1/9(金) 18:36
2026-01-10,04:09,business,経済,32,日経ビジネス,三菱地所「インターンシップを廃止します」　過熱する就活に一石,15,https://news.yahoo.co.jp/articles/a68c30e5e8f73f97b0da0f382bd574b5acfca5c5,1/9(金) 6:00
2026-01-10,04:09,business,経済,33,Bloomberg,【来週の円相場】円安継続へ、日銀の追加利上げ観測薄れ買い材料欠く,15,https://news.yahoo.co.jp/articles/111fa085a9423b4ad3818e307f85adf91674eaca,1/9(金) 14:13
2026-01-10,04:09,business,経済,34,Bloomberg,中国の軍事動向が最大の関心、自衛隊増強支持は過去最多－政府調査,14,https://news.yahoo.co.jp/articles/4eb404faddf71c2187db8c2600d452fac911e6e1,1/9(金) 17:00
2026-01-10,04:09,business,経済,35,共同通信,円下落、1年ぶり158円台,13,https://news.yahoo.co.jp/articles/5af8ff600d8555fbf2afd428c1b868ece1ede8b7,1/9(金) 23:54
2026-01-10,04:09,business,経済,36,プレジデントオンライン,"「日本はAIで完敗」は大間違い…エヌビディアもテスラもマネできない日本だけが持っている""最強の資産""",13,https://news.yahoo.co.jp/articles/e7dd0ed82da328981203eb50f72e58ff8d66d784,1/9(金) 7:15
2026-01-10,04:09,business,経済,37,テレビ朝日系（ANN）,フラット35、初の金利2％超　2カ月前より負担150万円　4000万円借り入れの夫婦に聞く,13,https://news.yahoo.co.jp/articles/5ae474d0ed8d0268b3deffe3537628e8b88df1ba,1/9(金) 12:39
2026-01-10,04:09,business,経済,38,共同通信,コメ千店平均で最高値　全国のスーパー4416円,12,https://news.yahoo.co.jp/articles/0148a542574c0c43beac609a0e52e6aacb8867de,1/9(金) 18:46
2026-01-10,04:09,business,経済,39,共同通信,イオン、クスリのアオキと業務提携解消,12,https://news.yahoo.co.jp/articles/57d237fb9c7ae31f2c6de9a0dc292c7ec304ab29,1/9(金) 16:44
2026-01-10,04:09,business,経済,40,THE GOLD ONLINE（ゴールドオンライン）,「心が押し潰されました」手に職をつけるため介護士になった月収23万円・28歳女性…入社1週間、有料老人ホームの“裏側”で目撃した〈踏みにじられる瞬間〉【FPが解説】,12,https://news.yahoo.co.jp/articles/760c649c5fda09920dedfed110d1194d9bb28f3c,1/9(金) 10:30
