scrp_date,scrp_time,genre_en,genre_jp,rank,media_jp,title,comment,link,date_original
2024-05-19,13:23,sports,スポーツ,1,THE ANSWER,今永昇太に観客総立ち！　驚異の防御率0.84はMLB史上No.1デビュー、また7回0封にX熱狂「惑星最高」　カブスサヨナラ勝ち,108,https://news.yahoo.co.jp/articles/7371d8b4cab50c93255ab5413bbee3303581e7bc,5/19(日) 5:27
2024-05-19,13:23,sports,スポーツ,2,スポニチアネックス,中日、4連敗で今季ワースト借金5　立浪監督「仕切り直してやっていく」4月の快進撃がかすむ失速,103,https://news.yahoo.co.jp/articles/fa651405b0ed71114412abf41fe004689fc77d05,5/19(日) 7:00
2024-05-19,13:23,sports,スポーツ,3,THE ANSWER,13kg差のヘビー級4団体統一は「井上尚弥がタンクに勝つのと同等だ」　ウシクPFP1位を米記者主張,96,https://news.yahoo.co.jp/articles/c43734884a9e7f59cf7ace47c5e3291003492bd0,5/19(日) 12:13
2024-05-19,13:23,sports,スポーツ,4,THE ANSWER,「井上尚弥であるべき」「ウシクがNo.1だ！」　史上初のヘビー級4団体統一、早くもPFP論争再燃,81,https://news.yahoo.co.jp/articles/ce3d6bb8fbc92a92592fc2839e9e50431c574360,5/19(日) 9:06
2024-05-19,13:23,sports,スポーツ,5,スポーツ報知,落合博満氏と中畑清氏、「サンモニ」で「自力優勝消滅」西武を巡り対論…松井稼頭央監督に「喝」の中畑氏に落合氏が解説しスタジオ白熱,75,https://news.yahoo.co.jp/articles/9cb6e091b37d33ecf3525853d6d0d8a5c7a9d0a0,5/19(日) 10:05
2024-05-19,13:23,sports,スポーツ,6,日刊スポーツ,【西武】逆転負けで自力優勝の可能性が消滅　今季５度目の４連敗で借金ワースト「13」,66,https://news.yahoo.co.jp/articles/13ae60f9b27d81c1602eb30a1e89356913e61571,5/18(土) 16:55
2024-05-19,13:23,sports,スポーツ,7,THE ANSWER,ウシク4団体統一、井上尚弥らとPFP争うクロフォード反応「お前ら敬意を払うべきだぞ」,59,https://news.yahoo.co.jp/articles/47f084279a2caa5745baae6e839f76b6799c5b38,5/19(日) 11:33
2024-05-19,13:23,sports,スポーツ,8,THE ANSWER,ウシク、史上初のヘビー級4団体統一の偉業！　判定2-1の大接戦、9回ダウン奪取で歴史的一戦制す,58,https://news.yahoo.co.jp/articles/e7cdf081dfcd4b30a003da50c57a17b889a09923,5/19(日) 8:38
2024-05-19,13:23,sports,スポーツ,9,スポニチアネックス,MLB史上最高の防御率0.84　記録的快投の今永昇太に敵将も脱帽「打撃コーチに悪夢を与えるだろう」,52,https://news.yahoo.co.jp/articles/20dbd2216dc3a2c3ddba12eb1d27ea2d34ce9ba8,5/19(日) 9:29
2024-05-19,13:23,sports,スポーツ,10,CoCoKARAnext,中日今季ワーストの借金5　今季2度目の4連敗　響いた「悪手」と「主砲不在」の現状,48,https://news.yahoo.co.jp/articles/b999a2b7316cc9822fb63dc47a125ad43db7f94b,5/18(土) 19:50
2024-05-19,13:23,sports,スポーツ,11,Full-Count,大谷翔平、メジャー8冠→5冠に後退　4の0で2試合ぶり無安打…リーグでは7冠,47,https://news.yahoo.co.jp/articles/13fa40b93085e8240edd392cb687319bdace8a08,5/19(日) 12:38
2024-05-19,13:23,sports,スポーツ,12,東スポWEB,【Ｆ１】角田裕毅が驚異の予選で初表彰台への期待が沸騰「今のパフォーマンスなら夢じゃない」,47,https://news.yahoo.co.jp/articles/3118fe36c465271893443fb50bd4cf634ee1db71,5/19(日) 10:46
2024-05-19,13:23,sports,スポーツ,13,中日スポーツ,相手投手に被弾は6年ぶり…歯車かみ合わず今季1点差試合で5連敗の中日 ミスをカバーするのがチーム力だ,45,https://news.yahoo.co.jp/articles/522e9b549910a3d0d8d6c184baae98564365266e,5/19(日) 10:36
2024-05-19,13:23,sports,スポーツ,14,スポニチアネックス,西武もう自力V消滅…球団史上最速39試合目　稼頭央監督「最後の最後までやっていきたい」,44,https://news.yahoo.co.jp/articles/9a7eaeb5b185e0e67532b25e2f173d9748819e96,5/19(日) 5:30
2024-05-19,13:23,sports,スポーツ,15,THE ANSWER,惜敗フューリー不満「俺が勝った」「10月にまたやる」　9回ダウンも1-2判定の接戦、再戦匂わす,44,https://news.yahoo.co.jp/articles/7028bb58d4cc404f6ef0da8c13970d50eebb5eaa,5/19(日) 9:28
2024-05-19,13:23,sports,スポーツ,16,NEWSポストセブン,《羽生結弦の永遠のライバル》ネイサン・チェンが衝撃の卒業論文　題材は羽生と同じくフィギュアスケートでも視点は正反対,43,https://news.yahoo.co.jp/articles/7101f189724ecf76b5c6d5c03dcc8e6f91b3db09,5/19(日) 7:15
2024-05-19,13:23,sports,スポーツ,17,Full-Count,大谷翔平、4の0で首位打者“陥落”　初の1番起用で無安打も…ド軍2連勝で貯金14,41,https://news.yahoo.co.jp/articles/bd11918450c5f39d4d0efc3d3d792c45597b7482,5/19(日) 12:17
2024-05-19,13:23,sports,スポーツ,18,中日スポーツ,中日、今季2度目の4連敗で借金ワースト『5』に…2試合連続の“1点差負け”、投手・中川颯に2ラン献上の松葉が3敗目,41,https://news.yahoo.co.jp/articles/b1b32af184aa6b9c65b2810d5812653d0446b98b,5/18(土) 16:43
2024-05-19,13:23,sports,スポーツ,19,スポニチアネックス,大谷翔平　移籍後初1番は4打数無安打、6毛差で首位打者陥落　ビューラーが右肘手術から725日ぶり勝利,40,https://news.yahoo.co.jp/articles/7ccaed68469b34c36d7d96f7990c25550c92193b,5/19(日) 12:18
2024-05-19,13:23,sports,スポーツ,20,週刊ベースボールONLINE,巨人の内野陣がGG賞を独占？「吉川尚輝が受賞していないのが不思議」との指摘が,40,https://news.yahoo.co.jp/articles/132e98afda34b4beff8848286ebbefad933b64b2,5/19(日) 11:01
2024-05-19,13:23,sports,スポーツ,21,スポニチアネックス,ウシクが史上初ヘビー級4団体統一王者に　フューリーからダウン奪い2階級で4団体王座統一,39,https://news.yahoo.co.jp/articles/7f2faab5c6174c437d1676a854d66fe2b3be54cf,5/19(日) 8:38
2024-05-19,13:23,sports,スポーツ,22,ベースボールキング,貯金16！首位を独走するソフトバンク　田尾安志氏「今10以上貯金があるというのは…」,38,https://news.yahoo.co.jp/articles/a96d6d9007c0c9b07b4f42e991114e2aad45cebb,5/19(日) 9:00
2024-05-19,13:23,sports,スポーツ,23,デイリースポーツ,落合博満氏が自力Ｖ消滅の西武に打開策を提言「いい選手を休ますことなく」「グラウンドに立つのは選手」中畑氏は「特に監督」,38,https://news.yahoo.co.jp/articles/81d9831ea6583430fe123d3ca1b4c3aba75c5b9d,5/19(日) 9:25
2024-05-19,13:23,sports,スポーツ,24,スポーツ報知,ウシクが歴史的世界４団体ヘビー級統一戦で判定勝ち　井上尚弥のＰＦＰ１位を奪う可能性も,36,https://news.yahoo.co.jp/articles/9229a2ccfee7a46ccd3cba01ebf9a8993585129c,5/19(日) 10:37
2024-05-19,13:23,sports,スポーツ,25,東スポWEB,大谷翔平が水原被告に〝盗まれた〟２６億円を取り戻す唯一の方法　北村弁護士がズバリ,35,https://news.yahoo.co.jp/articles/0214fe849392af3c47bf0eedc65325ed405c4199,5/19(日) 5:16
2024-05-19,13:23,sports,スポーツ,26,テレ東スポーツ,【西武】借金13 もう自力優勝消滅… 39試合目での自力V消滅は球団史上最速,35,https://news.yahoo.co.jp/articles/65057698dcb3af750cdc700610e861896ab20631,5/19(日) 9:52
2024-05-19,13:23,sports,スポーツ,27,デイリー新潮,巨人、築地新球場は屋根付き人工芝、開閉式で天然芝じゃないの？　専門家は「経営側がどちらを向いているかということ」,35,https://news.yahoo.co.jp/articles/92dc35b9a6597db0919df73c64f54bbe6a9f17a2,5/19(日) 10:52
2024-05-19,13:23,sports,スポーツ,28,スポーツ報知,ロッテ・メルセデス―日本ハム・加藤貴之…スタメン発表,34,https://news.yahoo.co.jp/articles/139f89a02e81f5c6aa871f879c8124c3bb0fb959,5/18(土) 13:21
2024-05-19,13:23,sports,スポーツ,29,ベースボールチャンネル,「想像してほしい」大谷翔平の元通訳・水原一平被告へ新たに批判が殺到！？　米メディア「最大級のヒールに…」,33,https://news.yahoo.co.jp/articles/2c56122866b1bc9a006828181cc40a73b6309be4,5/19(日) 12:04
2024-05-19,13:23,sports,スポーツ,30,Full-Count,2軍降格の29歳は「もったいない」　新庄監督が喝…161キロ剛球生かせず“ガッカリ”,33,https://news.yahoo.co.jp/articles/31922832da25d48cf62718e0bdd7440590b672a5,5/19(日) 8:10
2024-05-19,13:23,sports,スポーツ,31,CoCoKARAnext,「馬鹿げてる。これはおかしい」大谷翔平の激レア人形を巡る“転売騒動” 80万円超えの売却に米識者が愕然「誰が買うんだ」,33,https://news.yahoo.co.jp/articles/38d21dc0d298a7160dedbc7d1a2ec6a260ca2452,5/19(日) 11:07
2024-05-19,13:23,sports,スポーツ,32,ABEMA TIMES,大谷翔平、移籍後初の打順1番も4打数無安打とブレーキ 打率.350で首位打者陥落 チームは完封リレーで2連勝,32,https://news.yahoo.co.jp/articles/d1d20d2a477598a35e59aabf2942969a2851ec6d,5/19(日) 12:17
2024-05-19,13:23,sports,スポーツ,33,スポーツ報知,【西武】今季５度目の４連敗で自力優勝の可能性が消滅　松井稼頭央監督「最後の最後までやっていきたい」,32,https://news.yahoo.co.jp/articles/d2533c7c3efa347345fc26f5d553efde08691ea2,5/18(土) 17:59
2024-05-19,13:23,sports,スポーツ,34,スポニチアネックス,中日　浮上のきっかけ見えない4連敗　9カード連続勝ち越しなし　立浪監督「もう一回、仕切り直して…」,32,https://news.yahoo.co.jp/articles/36276d761390a5abb3cfbb12f60b448b5283ee2b,5/18(土) 17:27
2024-05-19,13:23,sports,スポーツ,35,TBS NEWS DIG Powered by JNN,【19日・巨人スタメン】泉口2番ショート 門脇はベンチ 外野は丸1番レフト 萩尾6番センター 佐々木8番ライト 先発高橋礼 捕手は小林,31,https://news.yahoo.co.jp/articles/916b348699e2af3674bac36ac56406588c7bd939,5/19(日) 12:58
2024-05-19,13:23,sports,スポーツ,36,デイリースポーツ,巨人がマツダで痛恨連敗　「鬼門」でまた勝てず…今季３敗２分け、岸田が負傷交代,31,https://news.yahoo.co.jp/articles/6c41e98d631d1d88b4829b02ebbb2b7c8353d139,5/18(土) 17:20
2024-05-19,13:23,sports,スポーツ,37,中日スポーツ,【ボクシング】ウシクが史上初のヘビー級4団体統一王者に！12回判定2―1で勝利、井上尚弥を抜いて全階級最強ランクも1位になる可能性も,30,https://news.yahoo.co.jp/articles/cf154ab240a89652110453f82fc435cd4034d964,5/19(日) 9:01
2024-05-19,13:23,sports,スポーツ,38,東スポWEB,【中日】４連敗で今季ワースト借金「５」　苦しい９カード連続勝ち越しなし,30,https://news.yahoo.co.jp/articles/41ac2469c74e04d7c38a508385bef4674bca1280,5/18(土) 17:16
2024-05-19,13:23,sports,スポーツ,39,デイリースポーツ,広島　九里の出場選手登録を抹消　１８日・巨人戦で今季初勝利　お立ち台で涙をにじませ「苦しかったです」,30,https://news.yahoo.co.jp/articles/d2258e568444b5ca49e59f80852de059d5a0396c,5/19(日) 11:39
2024-05-19,13:23,sports,スポーツ,40,スポーツ報知,ソフトバンク・大津亮介―西武・渡辺勇太朗…スタメン発表,29,https://news.yahoo.co.jp/articles/1b32ecefc29b464df9c1620100dfb938e3e329ab,5/18(土) 13:18
