scrp_date,scrp_time,genre_en,genre_jp,rank,media_jp,title,comment,link,date_original
2024-11-02,08:06,business,経済,1トリガー条項の凍結解除、実現可能性は　国民民主が主張産経新聞11/1(金) 18:05194件/時,産経新聞,トリガー条項の凍結解除、実現可能性は　国民民主が主張,194,https://news.yahoo.co.jp/articles/73b4ced575b8ec239778aad31ab97e075707d797,11/1(金) 18:05
2024-11-02,08:06,business,経済,2半導体支援にNTT株活用　政府、新国債の裏付けに共同通信11/1(金) 22:3086件/時,共同通信,半導体支援にNTT株活用　政府、新国債の裏付けに,86,https://news.yahoo.co.jp/articles/664b6072dc69f8b6a2b703f83e2eb4d9d0c518ba,11/1(金) 22:30
2024-11-02,08:06,business,経済,3石破自公「少数与党」経済の悲惨な末路…！バラマキ政策連発の放漫財政でインフレが悪化、実質賃金の上昇は不可能に現代ビジネス11/2(土) 6:0578件/時,現代ビジネス,石破自公「少数与党」経済の悲惨な末路…！バラマキ政策連発の放漫財政でインフレが悪化、実質賃金の上昇は不可能に,78,https://news.yahoo.co.jp/articles/c08831549bd1005bf05b6177a5954616b7f937c0,11/2(土) 6:05
2024-11-02,08:06,business,経済,4「さっさと降りてくれ！」 バス降車時の運賃支払いモヤモヤ、“現金派40%”が立ちはだかる現実とはMerkmal11/2(土) 6:1159件/時,Merkmal,「さっさと降りてくれ！」 バス降車時の運賃支払いモヤモヤ、“現金派40%”が立ちはだかる現実とは,59,https://news.yahoo.co.jp/articles/fe6b74e5cdff07a5d377f781893bc2a6a1b97640,11/2(土) 6:11
2024-11-02,08:06,business,経済,51:03【速報】日経平均株価が1027円安の3万8053円で取引終了　米ハイテク株下落と日銀早期利上げ観測で円高進行TBS NEWS DIG Powered by JNN11/1(金) 9:0450件/時,TBS NEWS DIG Powered by JNN,【速報】日経平均株価が1027円安の3万8053円で取引終了　米ハイテク株下落と日銀早期利上げ観測で円高進行,50,https://news.yahoo.co.jp/articles/840386ef8513da0f641a3cd1d964700032ad0991,11/1(金) 9:04
2024-11-02,08:06,business,経済,60:27日本マクドナルド“オレンジジュース”は「Sサイズのみ販売」に…オレンジ不作で価格高騰影響日テレNEWS NNN11/1(金) 16:2547件/時,日テレNEWS NNN,日本マクドナルド“オレンジジュース”は「Sサイズのみ販売」に…オレンジ不作で価格高騰影響,47,https://news.yahoo.co.jp/articles/5e6e0e2c6ab13188c9d794f96975be10ecffd0fe,11/1(金) 16:25
2024-11-02,08:06,business,経済,7日本復活に「経済政策」は不要どころか、逆効果だ東洋経済オンライン11/2(土) 6:3235件/時,東洋経済オンライン,日本復活に「経済政策」は不要どころか、逆効果だ,35,https://news.yahoo.co.jp/articles/e391e2696d159d614737cf4bfb420bb2a2e4455b,11/2(土) 6:32
2024-11-02,08:06,business,経済,8なぜ車のプロは“赤い車”を買わないのか？「やってはいけない車選び」を元ディーラー営業マンが暴露週刊SPA!11/1(金) 8:5435件/時,週刊SPA!,なぜ車のプロは“赤い車”を買わないのか？「やってはいけない車選び」を元ディーラー営業マンが暴露,35,https://news.yahoo.co.jp/articles/2829df37219803869dbf509ed344940baf5191ab,11/1(金) 8:54
2024-11-02,08:06,business,経済,9トリガー発動、実務に課題　林官房長官共同通信11/1(金) 17:3733件/時,共同通信,トリガー発動、実務に課題　林官房長官,33,https://news.yahoo.co.jp/articles/25ed10adcbcf263426262895f24b5eb952692a17,11/1(金) 17:37
2024-11-02,08:06,business,経済,10三井住友信託の元管理職がインサイダーの疑い、 他社株で複数回Bloomberg11/1(金) 16:4433件/時,Bloomberg,三井住友信託の元管理職がインサイダーの疑い、 他社株で複数回,33,https://news.yahoo.co.jp/articles/82eb8c3887bbb714c06e66ebd9a18be32ded23c5,11/1(金) 16:44
2024-11-02,08:06,business,経済,11美智子さまが「何年にもわたって、誕生日に花を贈り続けた相手」をご存じですか？ 上皇ご夫妻にとって大切だった「意外な存在」現代ビジネス11/2(土) 7:0032件/時,現代ビジネス,美智子さまが「何年にもわたって、誕生日に花を贈り続けた相手」をご存じですか？ 上皇ご夫妻にとって大切だった「意外な存在」,32,https://news.yahoo.co.jp/articles/ab0140fa9c900e60cec77c071a7d1868fd75f75c,11/2(土) 7:00
2024-11-02,08:06,business,経済,12タクシー不足解消に向けて「新人タクシー運転手増加」の功罪　利用客は「同じ料金なのにストレスが貯まる」と困惑、地理試験廃止で質の低下を懸念する声もマネーポストWEB11/2(土) 7:1527件/時,マネーポストWEB,タクシー不足解消に向けて「新人タクシー運転手増加」の功罪　利用客は「同じ料金なのにストレスが貯まる」と困惑、地理試験廃止で質の低下を懸念する声も,27,https://news.yahoo.co.jp/articles/f6b8dd70dfa437e452ba28ce2893636a2664b286,11/2(土) 7:15
2024-11-02,08:06,business,経済,13国民が愚かになっていくとき…「タテ社会の論理」への過剰な依存がもたらす「深刻な事態」現代ビジネス11/2(土) 6:0527件/時,現代ビジネス,国民が愚かになっていくとき…「タテ社会の論理」への過剰な依存がもたらす「深刻な事態」,27,https://news.yahoo.co.jp/articles/88a8b5d1cbeddcecf1d8b582572b50e21fc4d8b8,11/2(土) 6:05
2024-11-02,08:06,business,経済,14無料の住宅情報誌「スーモ」休刊　リクルート、来年3月末めどに共同通信11/1(金) 15:4126件/時,共同通信,無料の住宅情報誌「スーモ」休刊　リクルート、来年3月末めどに,26,https://news.yahoo.co.jp/articles/b98453ee1e4e8a40f84a4a2e086d632ff64937f2,11/1(金) 15:41
2024-11-02,08:06,business,経済,15パナソニック子会社、社長が不正を隠蔽　報酬50％を4カ月自主返納朝日新聞デジタル11/1(金) 16:0125件/時,朝日新聞デジタル,パナソニック子会社、社長が不正を隠蔽　報酬50％を4カ月自主返納,25,https://news.yahoo.co.jp/articles/60ce3934cf73d6db71f99f1cff83d26958180f97,11/1(金) 16:01
2024-11-02,08:06,business,経済,"16「月収64万円」「退職金2,300万円」大手メーカーで定年を迎える〈60歳父〉を仲良し家族が祝福。ビールで乾杯も一転、妻が大号泣の大修羅場「何かの間違いでは」THE GOLD ONLINE（ゴールドオンライン）11/2(土) 5:0224件/時",THE GOLD ONLINE（ゴールドオンライン）,"「月収64万円」「退職金2,300万円」大手メーカーで定年を迎える〈60歳父〉を仲良し家族が祝福。ビールで乾杯も一転、妻が大号泣の大修羅場「何かの間違いでは」",24,https://news.yahoo.co.jp/articles/374eaa3ebc0f2b62d3b93dc213c7a2221bbf55e7,11/2(土) 5:02
2024-11-02,08:06,business,経済,17キリンの「クラフトビール」が苦戦、10年目の大反省。大量の広告投資から転換、事業部立ち上げ再起東洋経済オンライン11/2(土) 5:4123件/時,東洋経済オンライン,キリンの「クラフトビール」が苦戦、10年目の大反省。大量の広告投資から転換、事業部立ち上げ再起,23,https://news.yahoo.co.jp/articles/3b630391b54322dea665d9832343701ace59c0b2,11/2(土) 5:41
2024-11-02,08:06,business,経済,18野村HD、不祥事続発を陳謝　相場操縦や強殺未遂時事通信11/1(金) 17:2622件/時,時事通信,野村HD、不祥事続発を陳謝　相場操縦や強殺未遂,22,https://news.yahoo.co.jp/articles/457e574d9d3f020fb133964ee8912a43290c719b,11/1(金) 17:26
2024-11-02,08:06,business,経済,"19ユニクロの「3990円デニム」に敗北しただけではない…「何でも売れたアパレル店」ライトオンが""超失速""のワケプレジデントオンライン11/1(金) 8:1719件/時",プレジデントオンライン,"ユニクロの「3990円デニム」に敗北しただけではない…「何でも売れたアパレル店」ライトオンが""超失速""のワケ",19,https://news.yahoo.co.jp/articles/70e124d7c15e3318ab22136667fbf55fd49db20e,11/1(金) 8:17
2024-11-02,08:06,business,経済,20空自のF-15戦闘機が「北朝鮮の弾道ミサイル」を空中で確認!? 防衛省が画像を公開乗りものニュース11/2(土) 6:1219件/時,乗りものニュース,空自のF-15戦闘機が「北朝鮮の弾道ミサイル」を空中で確認!? 防衛省が画像を公開,19,https://news.yahoo.co.jp/articles/1195b683b236b4e235d739af65ee0b1a5a7ec1cf,11/2(土) 6:12
2024-11-02,08:06,business,経済,21突然の破産「船井電機」に起こっていた異変…調査会社が倒産の「Xデー」に目撃した驚きの現場東洋経済オンライン11/1(金) 12:3219件/時,東洋経済オンライン,突然の破産「船井電機」に起こっていた異変…調査会社が倒産の「Xデー」に目撃した驚きの現場,19,https://news.yahoo.co.jp/articles/e085ab1f90f3142a16867bb5ff54c83e91360ced,11/1(金) 12:32
2024-11-02,08:06,business,経済,22ミスを指摘されたとき「すぐ言い訳する人」と「誠実に受け止められる人」の決定的な差ダイヤモンド・オンライン11/2(土) 6:0218件/時,ダイヤモンド・オンライン,ミスを指摘されたとき「すぐ言い訳する人」と「誠実に受け止められる人」の決定的な差,18,https://news.yahoo.co.jp/articles/27852c79b5bc71d56d9ccc3e8624460fa52dd9d8,11/2(土) 6:02
2024-11-02,08:06,business,経済,23森永卓郎氏が警鐘を鳴らす「世界恐慌の前触れ」　老後資金を失う人が続出する未来THE21オンライン11/1(金) 11:5217件/時,THE21オンライン,森永卓郎氏が警鐘を鳴らす「世界恐慌の前触れ」　老後資金を失う人が続出する未来,17,https://news.yahoo.co.jp/articles/4c81f493456980d6aea5247b2fbda41f73576435,11/1(金) 11:52
2024-11-02,08:06,business,経済,24なぜ停止線の「めちゃ手前」で止まる？ “スペース空け過ぎ”に「違反なの？」「正直ありがたい」「トラックのため」の声も！ 「狭い道では助かる!?」謎の行為に反響集まる！くるまのニュース11/1(金) 9:1017件/時,くるまのニュース,なぜ停止線の「めちゃ手前」で止まる？ “スペース空け過ぎ”に「違反なの？」「正直ありがたい」「トラックのため」の声も！ 「狭い道では助かる!?」謎の行為に反響集まる！,17,https://news.yahoo.co.jp/articles/f354549eba762671961bf0154b6e86f8ba665471,11/1(金) 9:10
2024-11-02,08:06,business,経済,25職場で出世する人は「忙しい」と絶対に言わない。では何と言う？ダイヤモンド・オンライン11/2(土) 6:0216件/時,ダイヤモンド・オンライン,職場で出世する人は「忙しい」と絶対に言わない。では何と言う？,16,https://news.yahoo.co.jp/articles/b3b79a7b664b0c4558765fe288f07c70f844b568,11/2(土) 6:02
2024-11-02,08:06,business,経済,26高速で「オービス“もどき”」急増中!? まさかの“そっくりさん”出現に驚きの声も！ 謎の“新設機器”の正体とはくるまのニュース11/2(土) 7:1015件/時,くるまのニュース,高速で「オービス“もどき”」急増中!? まさかの“そっくりさん”出現に驚きの声も！ 謎の“新設機器”の正体とは,15,https://news.yahoo.co.jp/articles/c8b6364275aae9f9b32cbf92baeee5b8f61a384f,11/2(土) 7:10
2024-11-02,08:06,business,経済,27米軍「B-29」を撃墜しまくった日本戦闘機「月光」、その「ヤバすぎる実力」と「悲劇すぎる末路」…！現代ビジネス11/2(土) 7:3014件/時,現代ビジネス,米軍「B-29」を撃墜しまくった日本戦闘機「月光」、その「ヤバすぎる実力」と「悲劇すぎる末路」…！,14,https://news.yahoo.co.jp/articles/2ce7af7f4a2ec3b2cb06934c66d4a0fc6f690c94,11/2(土) 7:30
2024-11-02,08:06,business,経済,28たった3時間で32万9000円　自転車罰則強化スタート　ながら運転・イヤホン・逆走は全部違反関西テレビ11/1(金) 18:5714件/時,関西テレビ,たった3時間で32万9000円　自転車罰則強化スタート　ながら運転・イヤホン・逆走は全部違反,14,https://news.yahoo.co.jp/articles/66e5ebd226594ad4f6250c79646c7ece761db190,11/1(金) 18:57
2024-11-02,08:06,business,経済,290:47天丼てんや 8日から値上げ コメの価格高騰で　ご飯おかわり無料サービスも終了TBS NEWS DIG Powered by JNN11/2(土) 5:5414件/時,TBS NEWS DIG Powered by JNN,天丼てんや 8日から値上げ コメの価格高騰で　ご飯おかわり無料サービスも終了,14,https://news.yahoo.co.jp/articles/bd8178813157536061583a359ce7d46b7ea2c55a,11/2(土) 5:54
2024-11-02,08:06,business,経済,30国民・立民が政策協議実施を確認、来週に党首会談－国会運営で連携もBloomberg11/1(金) 10:1013件/時,Bloomberg,国民・立民が政策協議実施を確認、来週に党首会談－国会運営で連携も,13,https://news.yahoo.co.jp/articles/830729914fd86c73c8b10083bf719d9d62bca167,11/1(金) 10:10
2024-11-02,08:06,business,経済,31急増するJPNタクシー、現役ドライバーが明かす不満点「車内空間は広いけど」週刊SPA!11/1(金) 8:5213件/時,週刊SPA!,急増するJPNタクシー、現役ドライバーが明かす不満点「車内空間は広いけど」,13,https://news.yahoo.co.jp/articles/f5dd7edfc7fc7f84ba4839fd26e6feee872e11ca,11/1(金) 8:52
2024-11-02,08:06,business,経済,32自公大敗後の試金石の緊急経済対策、「規模ありき」ではなく実質賃金上昇の基盤整備が王道ダイヤモンド・オンライン11/2(土) 6:4612件/時,ダイヤモンド・オンライン,自公大敗後の試金石の緊急経済対策、「規模ありき」ではなく実質賃金上昇の基盤整備が王道,12,https://news.yahoo.co.jp/articles/9a783afd63b332bbba73249356cc5c5478a2d4e8,11/2(土) 6:46
2024-11-02,08:06,business,経済,331:16経済同友会・新浪代表幹事　最低賃金1500円は「経済再生の試金石」　テレビ朝日系（ANN）11/1(金) 9:1412件/時,テレビ朝日系（ANN）,経済同友会・新浪代表幹事　最低賃金1500円は「経済再生の試金石」,12,https://news.yahoo.co.jp/articles/91ab53dc95b38fe0c989a2ab3d93616595e76a50,11/1(金) 9:14
2024-11-02,08:06,business,経済,34領内クルスク奪還へ焦りを強めるプーチン大統領、侵攻から3年にらみ2024年末に北朝鮮から追加派兵も東洋経済オンライン11/2(土) 6:0212件/時,東洋経済オンライン,領内クルスク奪還へ焦りを強めるプーチン大統領、侵攻から3年にらみ2024年末に北朝鮮から追加派兵も,12,https://news.yahoo.co.jp/articles/fe815eb60d00566a8d90c92e2bd66edd9d5e399b,11/2(土) 6:02
2024-11-02,08:06,business,経済,3585歳の脳科学者が断言、「勉強ができる子」「勉強ができない子」の”親の共通点”がわかった…！現代ビジネス11/2(土) 7:3011件/時,現代ビジネス,85歳の脳科学者が断言、「勉強ができる子」「勉強ができない子」の”親の共通点”がわかった…！,11,https://news.yahoo.co.jp/articles/c1503cf2ac10f92a0b9bc5e488194803c725b9f7,11/2(土) 7:30
2024-11-02,08:06,business,経済,36フェアレディZはコスパ最高の[ターボ]よ! 3L・V6ターボの[納得の性能]って?ベストカーWeb11/2(土) 7:0011件/時,ベストカーWeb,フェアレディZはコスパ最高の[ターボ]よ! 3L・V6ターボの[納得の性能]って?,11,https://news.yahoo.co.jp/articles/326614e750bf13b3657653102a13c3cf18e58c5e,11/2(土) 7:00
2024-11-02,08:06,business,経済,37日本で「75歳男性」はどう生きるか…意外と知らない「その現実」現代ビジネス11/2(土) 6:4511件/時,現代ビジネス,日本で「75歳男性」はどう生きるか…意外と知らない「その現実」,11,https://news.yahoo.co.jp/articles/5f60f5d33ac42eaa0fd0ddb2bd1447f1f404c19f,11/2(土) 6:45
2024-11-02,08:06,business,経済,38【そういえば食べなくなったかも…】“コンビニの中華まん”離れした大人たちが振り返る若き日の思い出　「部活帰りによく食べた」「貧乏飯として重宝」「最近の学生はどうしてるの？」マネーポストWEB11/1(金) 15:1511件/時,マネーポストWEB,【そういえば食べなくなったかも…】“コンビニの中華まん”離れした大人たちが振り返る若き日の思い出　「部活帰りによく食べた」「貧乏飯として重宝」「最近の学生はどうしてるの？」,11,https://news.yahoo.co.jp/articles/749da94cce394f5fdf983e3ce420424fdd436ce2,11/1(金) 15:15
2024-11-02,08:06,business,経済,39意外と知らない、これから日本で「賃金上昇」していく「当然の理由」現代ビジネス11/2(土) 6:1511件/時,現代ビジネス,意外と知らない、これから日本で「賃金上昇」していく「当然の理由」,11,https://news.yahoo.co.jp/articles/af7f24f6883e8b0cc5441b59e94a5eef0c115935,11/2(土) 6:15
2024-11-02,08:06,business,経済,40ドン・キホーテのコスメから「基準値超え細菌」検出……　商品を自主回収「心より深くお詫び」ねとらぼ11/2(土) 7:1010件/時,ねとらぼ,ドン・キホーテのコスメから「基準値超え細菌」検出……　商品を自主回収「心より深くお詫び」,10,https://news.yahoo.co.jp/articles/885ac4e9f2ddc10d905d3252c0b4636bb567954b,11/2(土) 7:10
