scrp_date,scrp_time,genre_en,genre_jp,rank,media_jp,title,comment,link,date_original
2025-06-09,11:42,world,国際,1,共同通信,活動家グレタさんのガザ行き阻止　イスラエル、船を拿捕,159,https://news.yahoo.co.jp/articles/c9002eb368f03a95788cc45490332a39f225fbe5,6/8(日) 21:58
2025-06-09,11:42,world,国際,2,日テレNEWS NNN,不法移民取り締まりへの抗議デモ激化　トランプ政権派遣の州兵到着　米ロサンゼルス,150,https://news.yahoo.co.jp/articles/d460573acbb59493aad3d3b36a67a1201c66442f,6/9(月) 5:21
2025-06-09,11:42,world,国際,3,NEWSポストセブン,「6時間で583人の男性と関係を持つ」企画…直後に入院した海外の20代女性インフルエンサー、莫大な収入と引き換えに不調を抱えながらも新たなチャレンジに意欲,110,https://news.yahoo.co.jp/articles/fcbff0d0b097e5665483164b4e41671fc99f2626,6/9(月) 7:15
2025-06-09,11:42,world,国際,4,ＡＦＰ＝時事,ウクライナでドローン製造を検討 仏ルノー,106,https://news.yahoo.co.jp/articles/aae286ba61391791d13ce08c7a3afcf71c353905,6/9(月) 9:37
2025-06-09,11:42,world,国際,5,テレビ朝日系（ANN）,【トランプ×マスク対立激化】蜜月終焉で罵倒合戦“減税法案に暗雲”決裂の代償は？,67,https://news.yahoo.co.jp/articles/fbef2ad059bfef046022551afc0b0ddf38301c34,6/8(日) 22:07
2025-06-09,11:42,world,国際,6,中央日報日本語版,「マスクとは終わった」腹を立てたトランプ大統領、乗っていたテスラまで売却へ,50,https://news.yahoo.co.jp/articles/982e65951cc09c4ddca3c17c91190343c4053965,6/9(月) 8:14
2025-06-09,11:42,world,国際,7,読売新聞オンライン,マスク氏との関係修復は「ない」…トランプ氏「彼は大統領職を軽視している」,44,https://news.yahoo.co.jp/articles/2b0f4bb4259044f30dc591ca23c85a1bd0c1994b,6/9(月) 10:09
2025-06-09,11:42,world,国際,8,CNN.co.jp,トランプ米大統領、ロサンゼルスに州兵派遣　移民摘発めぐり抗議デモ,36,https://news.yahoo.co.jp/articles/d65cf67d80e83caf28c49d6f294abcb85f598ff5,6/8(日) 12:46
2025-06-09,11:42,world,国際,9,中央日報日本語版,見せかけの密着だったか…ロシア秘密文書に「中国は敵」,31,https://news.yahoo.co.jp/articles/381f43394e132aa234fd1a7208da82c94ac9c498,6/9(月) 6:49
2025-06-09,11:42,world,国際,10,毎日新聞,グレタさんら乗る船、拿捕される　「イスラエル軍が船に乗り込んだ」,29,https://news.yahoo.co.jp/articles/a26135fe04e9a425201e0cf9fc0d0ef5e89cf9f5,6/9(月) 9:55
2025-06-09,11:42,world,国際,11,クーリエ・ジャポン,英紙が注目　中国BYDの「軽EV」は苦戦する日本市場での「黒船」となるか,26,https://news.yahoo.co.jp/articles/8388daabc0430837c02582ea86ebe43429180a65,6/8(日) 19:53
2025-06-09,11:42,world,国際,12,JBpress,1万円札は「ノー」でも「韓国ウォンなら両替できます」、東南アジアのハワイは「韓国」で溢れていた,23,https://news.yahoo.co.jp/articles/c254104371f39b94078207e4750133141675dfd2,6/9(月) 10:51
2025-06-09,11:42,world,国際,13,CNN.co.jp,グレタ・トゥンベリさんら乗せた船のガザ到達、軍に阻止を指示　イスラエル国防相,22,https://news.yahoo.co.jp/articles/196e12291cf5b62ba82d79af43f394b4ec6c6ac5,6/9(月) 10:46
2025-06-09,11:42,world,国際,14,読売新聞オンライン,ロシア地上部隊が新たな州に進軍、占領拡大の動き…「併合４州」隣接のドニプロペトロウシク州,21,https://news.yahoo.co.jp/articles/b489a77eeb8f98284d95c6b3c98907932e3ab141,6/9(月) 10:45
2025-06-09,11:42,world,国際,15,ハフポスト日本版,グレタ・トゥーンベリがイスラエル軍に拘束される。ガザへ向かう途中で動画を投稿「私たちは拉致された」,21,https://news.yahoo.co.jp/articles/8771dff8dcc01b084f688c53a7fa729d3e8a637c,6/9(月) 11:15
2025-06-09,11:42,world,国際,16,Wedge（ウェッジ）,「反日」どころではすまない韓国・李在明大統領のヤバい考え、核武装に走る可能性も…2度の自殺未遂、市長、弁護士経験という異色の大統領はどんな人物か？,21,https://news.yahoo.co.jp/articles/b998c421b760d378aaefc35d0b8f99d4387310ba,6/9(月) 5:02
2025-06-09,11:42,world,国際,17,KOREA WAVE,「私はバイセクシュアル」…韓流ガールズグループ、2人目の「LGBTQ」告白メンバー,19,https://news.yahoo.co.jp/articles/18be255b11e82730f95bd01700019c9c8f5a1bf9,6/9(月) 9:33
2025-06-09,11:42,world,国際,18,Wedge（ウェッジ）,【世界にとって悪夢】トランプ退任後の米露関係と世界を見据えるプーチン…2027年、ロシア軍とNATO軍の軍事衝突で起こるシナリオ,19,https://news.yahoo.co.jp/articles/c1688f93ff0e6d42f58f668991860178aa98e025,6/9(月) 5:02
2025-06-09,11:42,world,国際,19,KOREA WAVE,韓国1人当たり国民所得、初の5000万ウォン超え…世界6位・2年連続で日本を上回る,18,https://news.yahoo.co.jp/articles/89344d3a431550d17940c3a9894ca6f722c97689,6/9(月) 11:03
2025-06-09,11:42,world,国際,20,時事通信,東部州を地上攻撃か　ウクライナ侵攻でロシア,18,https://news.yahoo.co.jp/articles/827fd006b5bddb1338d108d33d6d7b9b22f6fe8f,6/8(日) 19:08
2025-06-09,11:42,world,国際,21,時事通信,グレタさん搭乗船のガザ行き阻止　イスラエル軍が拿捕か,17,https://news.yahoo.co.jp/articles/89e776e330a68e83e7e68f59bc4c74c74315cf98,6/9(月) 10:58
2025-06-09,11:42,world,国際,22,FNNプライムオンライン,「夢の国で喧嘩しないで」上海ディズニーランドで乱闘騒ぎ　写真撮影に“子供映り込み”巡りカップルが3人家族に激高…女が女児を突き飛ばし警察出動,17,https://news.yahoo.co.jp/articles/b95588f73a30c5329a0c71e679dbb0431edc24b6,6/8(日) 13:02
2025-06-09,11:42,world,国際,23,共同通信,イスラエル、グレタさんガザ到着阻止を指示,17,https://news.yahoo.co.jp/articles/0967ec8ad8bd715c4567495c786603b30e81fcbc,6/8(日) 21:23
2025-06-09,11:42,world,国際,24,FNNプライムオンライン（フジテレビ系）,トランプ大統領「民主党は不法移民の味方を続けている」ロサンゼルスへの州兵派遣の正当性を改めて主張　海兵隊派遣の可能性にも言及,15,https://news.yahoo.co.jp/articles/8e937557a0d465862136377e50f9c47fad92ef66,6/9(月) 10:25
2025-06-09,11:42,world,国際,25,ＡＦＰ＝時事,イスラエル、支援船を阻止 グレタさんら活動家は帰国予定と発表,15,https://news.yahoo.co.jp/articles/c073cde4e5394e6d6b71df9469d5e60399d54fed,6/9(月) 10:28
2025-06-09,11:42,world,国際,26,中央日報日本語版,負債総額１０６４兆ウォンの自営業者ひと息つけるか…李在明印の負債棒引き、問題は財源,15,https://news.yahoo.co.jp/articles/8352ba4525a355a6256932d27513a4de044d5364,6/9(月) 9:31
2025-06-09,11:42,world,国際,27,中央日報日本語版,「天安門事態は民主化運動」　中国歴史家の章立凡氏が死去,15,https://news.yahoo.co.jp/articles/0e581191d915bba6e65abd12b4e938d5b72d909f,6/9(月) 10:12
2025-06-09,11:42,world,国際,28,ハンギョレ新聞,日帝時代にマーシャル諸島に連行された７００人あまりの朝鮮人の名簿、新たに発見,15,https://news.yahoo.co.jp/articles/9d5c05673644982659ca73859b1400edccc8f5c5,6/9(月) 8:09
2025-06-09,11:42,world,国際,29,ＡＦＰ＝時事,イスラエル、支援船のガザ到達阻止を軍に命令 グレタさんら乗船,15,https://news.yahoo.co.jp/articles/17c67586d77bbce21fee0a53920c0f69b441d769,6/9(月) 8:52
2025-06-09,11:42,world,国際,30,NEWSポストセブン,《“度を超えた不倫”で中国共産党除名》同棲、妊娠、中絶…超エリート医師の妻が暴露した乱倫行為「感情がコントロールできず、麻酔をかけた患者を40分放置」,14,https://news.yahoo.co.jp/articles/11981081501b10cd83d97ef94055e58246a450a1,6/9(月) 11:15
2025-06-09,11:42,world,国際,31,テレビ朝日系（ANN）,グレタさんが乗った船をイスラエル軍が拿捕し活動家らを拘束　現地メディア,14,https://news.yahoo.co.jp/articles/46233cf7f3122d0d77b8d4c34db2cf59e2af042a,6/9(月) 11:17
2025-06-09,11:42,world,国際,32,KOREA WAVE,韓国の駐車場で“割り込みポルシェ”騒動…高級車夫婦の「非常識行動」に批判殺到,14,https://news.yahoo.co.jp/articles/9b03ec7d15db9cf2b8e1257d1af9d2113c6ad644,6/9(月) 5:33
2025-06-09,11:42,world,国際,33,中央日報日本語版,李在明印の「エネルギーハイウェー」が急浮上、電線業界が笑う,13,https://news.yahoo.co.jp/articles/f8fe926c27f2cff80fc7e849fe8ae6d14414a4cb,6/9(月) 10:13
2025-06-09,11:42,world,国際,34,ロイター,ウクライナ各地に激しいミサイル攻撃、西部ルツクで複数発が着弾する様子撮影,13,https://news.yahoo.co.jp/articles/3a8d22a7e7fa926f8dc951839d271b44e7521a4b,6/9(月) 10:00
2025-06-09,11:42,world,国際,35,FNNプライムオンライン（フジテレビ系）,グレタ・トゥンベリさんのガザ行きの船「あらゆる措置を講じて」イスラエル国防相が到着阻止するよう指示,12,https://news.yahoo.co.jp/articles/4dca56bc731ff930e5d69464127627cc4dd2c3b6,6/9(月) 10:58
2025-06-09,11:42,world,国際,36,ABEMA TIMES,トランプ大統領がマスク氏をけん制 野党・民主党の候補に献金なら「報いを受けるだろう」,12,https://news.yahoo.co.jp/articles/d5db71b51feb436346688b521dc82d1b7ec8e2e3,6/8(日) 17:01
2025-06-09,11:42,world,国際,37,中央日報日本語版,米民主党知事、トランプ氏のＬＡデモ軍投入に「権力乱用」,12,https://news.yahoo.co.jp/articles/fd204ec51356cf9963d4f4a99fb3fe39fedd8655,6/9(月) 9:46
2025-06-09,11:42,world,国際,38,ハンギョレ新聞,【社説】日本のような長期不況の入り口に来た韓国、新たな成長戦略で突破を,11,https://news.yahoo.co.jp/articles/b034c4252584d0324232d7b6459360309f09b188,6/9(月) 6:49
2025-06-09,11:42,world,国際,39,FNNプライムオンライン（フジテレビ系）,ロサンゼルスで地元住民と州兵がもみ合い…不法移民摘発で衝突続き州兵2000人派遣,11,https://news.yahoo.co.jp/articles/1852ab214dd319c52f88d196feed3b21e86dc612,6/9(月) 6:34
2025-06-09,11:42,world,国際,40,AP通信,ドローンによる露爆撃機破壊　ウクライナさらなる映像公開,10,https://news.yahoo.co.jp/articles/e19d03fa34330ed97d95982a0afc4850a0c76e48,6/9(月) 10:56
