scrp_date,scrp_time,genre_en,genre_jp,rank,media_jp,title,comment,link,date_original
2025-06-09,14:09,domestic,国内,1,朝日新聞,唐揚げ1個の給食、SNSで「寂しい」相次ぐ　市「2個分あるので」,902,https://news.yahoo.co.jp/articles/b2b99a8ad536e2f1b1749597fe2a10430c31acf5,6/9(月) 8:00
2025-06-09,14:09,domestic,国内,2,FNNプライムオンライン（フジテレビ系）,自民・森山氏「消費減税は慎重が上にも慎重であるべき。財源が今はない」　「参院選で過半数失えば大変なことに」,483,https://news.yahoo.co.jp/articles/4e879051eacfcddfad058dea81780fd7b1dac006,6/8(日) 15:17
2025-06-09,14:09,domestic,国内,3,FNNプライムオンライン（フジテレビ系）,【独自】備蓄米「家畜用」と投稿した原口一博議員を立憲執行部が注意　その後も「古古古米はニワトリさんが一番食べている」,374,https://news.yahoo.co.jp/articles/2e99113741edca874d861ee983275503e63a7212,6/9(月) 13:17
2025-06-09,14:09,domestic,国内,4,FNNプライムオンライン,家出中学生を自宅に住まわせ売春させた男2人逮捕…ネット上で少女になりすまし「パパ活」交渉、売春場所に送迎も　警視庁,350,https://news.yahoo.co.jp/articles/7570b29dc3e684e03b610dba3b278dde81adeaba,6/9(月) 12:19
2025-06-09,14:09,domestic,国内,5,CBCテレビ,名古屋・栄のホテルで遺体 32歳男性が殺害された事件  20歳男を強盗殺人の疑いで緊急逮捕 名古屋市中区【独自】,327,https://news.yahoo.co.jp/articles/b5534bf6e3a9ff05bd34166585f8c776687fe36b,6/9(月) 10:57
2025-06-09,14:09,domestic,国内,6,デイリー新潮,備蓄米の放出で倉庫業者が“廃業危機”報道も…「大量に保管していたのはJA」との指摘　“江藤米”の流通が遅れた真の理由とは,324,https://news.yahoo.co.jp/articles/a5de3d56329b16a6ad19e03c70f3cc7925c73bfd,6/9(月) 6:12
2025-06-09,14:09,domestic,国内,7,TBS NEWS DIG Powered by JNN,【速報】石破総理が韓国・李在明新大統領と電話会談,304,https://news.yahoo.co.jp/articles/9281066ba694ff11667419040139428d540cbbe5,6/9(月) 12:43
2025-06-09,14:09,domestic,国内,8,テレビ朝日系（ANN）,【独自】“家賃2.5倍”マンションで新展開 中国人オーナー直撃で値上げ撤回＆謝罪,261,https://news.yahoo.co.jp/articles/5c5345bf4e564a638bfa824bdc41a40e560765b3,6/8(日) 23:30
2025-06-09,14:09,domestic,国内,9,毎日新聞,警視庁が「仮装身分捜査」実施　全国初　詐欺未遂の容疑者を摘発,239,https://news.yahoo.co.jp/articles/52381da29d415ba32e4ba4bf010b989d63075b53,6/9(月) 10:28
2025-06-09,14:09,domestic,国内,10,テレビ朝日系（ANN）,石破内閣支持率34.4％　先月より上昇　ANN世論調査,220,https://news.yahoo.co.jp/articles/60a30277c6787bea5746cd4b85e3693c10feb153,6/9(月) 7:07
2025-06-09,14:09,domestic,国内,11,産経新聞,川口のごみ置き場から外国人の国保と税金の督促状、動物の骨付き丸焼きも　地元住民が清掃　「移民」と日本人,191,https://news.yahoo.co.jp/articles/de4cba7e0fb9cf17a7c6983fbac432cfaefbc453,6/9(月) 7:00
2025-06-09,14:09,domestic,国内,12,TBS NEWS DIG Powered by JNN,「金を稼ぎたかった」当時14歳の家出少女を寝泊まりさせて売春させたか　自称・山口組系暴力団関係者の男ら2人を逮捕　警視庁,183,https://news.yahoo.co.jp/articles/a8211b93f186785a25640619947d93d2895ed32a,6/9(月) 12:02
2025-06-09,14:09,domestic,国内,13,日刊スポーツ,岡野タケシ弁護士「的外れ」中居正広氏めぐる文春の一部報道に指摘,154,https://news.yahoo.co.jp/articles/1fea7190894cde80f69d6dd69f11586070c28941,6/9(月) 10:11
2025-06-09,14:09,domestic,国内,14,デイリースポーツ,小泉進次郎大臣の輸入米発言は在庫持っている人へのメッセージか　専門家が推測,146,https://news.yahoo.co.jp/articles/08eba64635ea626979ce64709af9026474629e35,6/9(月) 13:16
2025-06-09,14:09,domestic,国内,15,産経新聞,出生前診断で「異常なし」、生まれた子はダウン症　30代夫婦が病院に起こした訴訟の行方,137,https://news.yahoo.co.jp/articles/4cbbcba8c52427255291301295e56dd00737e862,6/8(日) 19:00
2025-06-09,14:09,domestic,国内,16,スポーツ報知,カズレーザー、米の価格について私見「僕は普通に上がるべきだと思うんです」とした真意は…サン！シャイン,136,https://news.yahoo.co.jp/articles/31c9fbc42159ddeb972c1cf4cd8de99833330d6a,6/9(月) 10:57
2025-06-09,14:09,domestic,国内,17,ABEMA TIMES,“小泉コメ劇場”にムネオ氏の娘・貴子氏が物申す「政治が価格に介入をすることは慎重であるべき」「小泉大臣と対立軸を作るのは不毛」,119,https://news.yahoo.co.jp/articles/54d8a8acd1dda158a189cbdf016fefedfb9307e3,6/9(月) 6:51
2025-06-09,14:09,domestic,国内,18,デイリー新潮,コメの流通経路は「際立って前時代的」と「ドンキ」社長が喝破…「小泉大臣」方式の圧倒的なスピード感に「これまで遅かったのは誰のせい？」,109,https://news.yahoo.co.jp/articles/3f1a4b0c7d8309b4030b8cccaf41c488459b1c83,6/9(月) 6:11
2025-06-09,14:09,domestic,国内,19,FNNプライムオンライン,南青山で“中指立て挑発” するスーツ姿の男…「バス運転手をあおっていた」自転車でフラフラ走行　急ブレーキで乗客に影響も　東京・港区,104,https://news.yahoo.co.jp/articles/5306e2ab0504ce258424ad0d63f306e0302bfd80,6/9(月) 12:32
2025-06-09,14:09,domestic,国内,20,デイリー新潮,小室圭さん夫妻「品位を失わない生活を送れているか」　第一子誕生で聞こえてきた心配の声,103,https://news.yahoo.co.jp/articles/2c6e565ee7ec9db484e36fdaeb7cd27287bc3d11,6/9(月) 6:00
2025-06-09,14:09,domestic,国内,21,デイリー新潮,日本からパンダが消える？　中国が貸し出しに慎重になっている理由　「大切な動物を簡単に国外に出すなという意見も強い」,101,https://news.yahoo.co.jp/articles/f2d47b4ebe7cd2cab25f2a5f9a659882d51b3399,6/9(月) 10:50
2025-06-09,14:09,domestic,国内,22,時事通信,コメ輸入前倒し検討示唆　「最大の効果模索」　農水相,100,https://news.yahoo.co.jp/articles/f6d1f3cd8baf6182e09646756d8baa77f7cc090a,6/9(月) 12:45
2025-06-09,14:09,domestic,国内,23,集英社オンライン,「客寄せパンダ扱いはもうイヤ」失速する今井絵理子政務官（41）パワハラ報道、県連入りもかなわず…トラブル続きで迫られる2つの“卒業”,96,https://news.yahoo.co.jp/articles/6a565ef55cd6d2ba646dd0663d8c4b7f24f5605f,6/9(月) 11:02
2025-06-09,14:09,domestic,国内,24,日刊スポーツ,「君たち早く出してねというメッセージ」小泉進次郎農相のコメ緊急輸入検討発言を専門家が解説,94,https://news.yahoo.co.jp/articles/aefa41c5a722d1ed0d3227f974c79d34dfc144ed,6/9(月) 13:25
2025-06-09,14:09,domestic,国内,25,J-CASTニュース,「5kg83円が2000円」「あと1、2週で価格下がった」　備蓄米放出で小泉進次郎氏たたく野党発言に反発も,88,https://news.yahoo.co.jp/articles/5fe602a58bbaf7ca055cb1c2bd96f0791a8148e9,6/8(日) 18:10
2025-06-09,14:09,domestic,国内,26,日刊スポーツ,池上彰氏、選挙前の「高度な作戦」とチクリ　自民幹事長＆進次郎農相のコメ輸入めぐる対照的発言に,87,https://news.yahoo.co.jp/articles/7ffc7f2fd7513f186342ad74cc0d032fce377f72,6/9(月) 12:16
2025-06-09,14:09,domestic,国内,27,共同通信,中国空母が南鳥島沖に初進出　発着艦も、警戒監視強化,87,https://news.yahoo.co.jp/articles/15f661a0982bb7cd392b1600e0d7ac4fa3c13f68,6/8(日) 22:43
2025-06-09,14:09,domestic,国内,28,スポーツ報知,玉川徹氏、輸入米の緊急輸入に私見「海外から入れるしかないんじゃないかって僕は思っているので」…モーニングショー,83,https://news.yahoo.co.jp/articles/54b8cce9521cb075eb9b2fe2cee524551060c4df,6/9(月) 8:31
2025-06-09,14:09,domestic,国内,29,tenki.jp,東海・近畿・中国地方が梅雨入り　平年より3日遅く　本格的な雨のシーズンに,73,https://news.yahoo.co.jp/articles/e66a25bc0907169b6ca1ee368cc456c30ecb53df,6/9(月) 11:01
2025-06-09,14:09,domestic,国内,30,FNNプライムオンライン,ウズラの卵を喉に詰まらせ小1男児が死亡  「とにかく息子を返してくれ。生きたまま返してくれ」 遺族が損害賠償求める 【福岡発】,71,https://news.yahoo.co.jp/articles/b3d94d8a52d27c227e5ae2157d75c386a5669202,6/8(日) 16:55
2025-06-09,14:09,domestic,国内,31,テレビ朝日系（ANN）,消費税減税「財源ない」自民・森山幹事長　慎重な考え,70,https://news.yahoo.co.jp/articles/01b7e10b77bfa2ba4155689fa863db9b35b18bd0,6/9(月) 8:48
2025-06-09,14:09,domestic,国内,32,スポニチアネックス,自民・森山幹事長　消費減税について「慎重の上にも慎重であるべきだ。新しい財源が今はない」,67,https://news.yahoo.co.jp/articles/cdc2db08e87f36952f355e3b980b5ea6624067b8,6/8(日) 17:58
2025-06-09,14:09,domestic,国内,33,弁護士JPニュース,「万博で恥ずかしくないように」大阪公立中で2時間“集団行動訓練”に疑問の声…博覧会協会は関与否定、では誰の指示？,65,https://news.yahoo.co.jp/articles/987f02d023b0792210453e6c7e0a6005a8e59a52,6/9(月) 10:10
2025-06-09,14:09,domestic,国内,34,東海テレビ,女子14人を盗撮か…小学校で児童が着替える教室に“録画状態のスマホ” 33歳教師を懲戒免職「ストレス溜まっていた」,63,https://news.yahoo.co.jp/articles/4beaa6e56e90f4b53e6a020129b70b8f8d311aa0,6/9(月) 11:58
2025-06-09,14:09,domestic,国内,35,日テレNEWS NNN,交差点で自転車の男性はねられる　“逃走”の建設作業員の男逮捕　千葉市,63,https://news.yahoo.co.jp/articles/2ae9491c2dbd73fd4b3e90d133ff81972a22cd56,6/9(月) 5:28
2025-06-09,14:09,domestic,国内,36,日刊スポーツ,小沢一郎氏、「みんな忘れてくれる、と」　自民・森山裕幹事長の「危機感」発言に「実際は…」,56,https://news.yahoo.co.jp/articles/27cc4926a8397911ab7da1b273ace0023716775b,6/9(月) 10:48
2025-06-09,14:09,domestic,国内,37,文春オンライン,小泉進次郎農水相が就任早々、JA全農トップに直談判した“異例の内容”は？〈独占告白〉,55,https://news.yahoo.co.jp/articles/ab8bb59bc2bc8f6e38e4c4fbf75acca96932de76,6/9(月) 8:42
2025-06-09,14:09,domestic,国内,38,JBpress,コメ不足でこの騒ぎ、ならば密かに進行する「外資の農地買収」をなぜ見過ごすのか、これこそ食料安保の危機なのに,53,https://news.yahoo.co.jp/articles/7370e4018f19f25e97e8d728b672392717157883,6/9(月) 11:02
2025-06-09,14:09,domestic,国内,39,Yahoo!ニュース オリジナル 特集,「くたばれトランプ」「米国を出ることも」TikTokで声を上げる米国市民 #SNSの功罪,49,https://news.yahoo.co.jp/articles/0a84ba5bff77b91d1e3a4c9b35d067d964cdd058,6/9(月) 10:04
2025-06-09,14:09,domestic,国内,40,TBS NEWS DIG Powered by JNN,【独自】「暴力団員」を隠し宿泊疑い　指定暴力団「住吉会」2次団体総長の男ら5人逮捕　中国人マフィアとみられる男らと盃交わしたか　警視庁,49,https://news.yahoo.co.jp/articles/c999b932d0f14805bdb975752462558292c3a23a,6/9(月) 9:43
