scrp_date,scrp_time,genre_en,genre_jp,rank,media_jp,title,comment,link,date_original
2025-09-28,17:08,domestic,国内,1,集英社オンライン,〈田久保市長の疑惑に新証言〉「卒業式後の飲み会に眞紀ちゃんは来てない」「ニセ卒業証書も作っていない」東洋大時代からの友人が覚えた告発文への違和感「何かチカラが働いている…」,384,https://news.yahoo.co.jp/articles/d2b89d80bffe63003ef1c7a0dcf62f197072400f,9/28(日) 11:01
2025-09-28,17:08,domestic,国内,2,文春オンライン,林芳正がわずか1年で政治資金1300万を会食に使っていた　うなぎ、ステーキ…老舗フグ屋では「芸者さんを呼ぶこともできる」VIP待遇も,380,https://news.yahoo.co.jp/articles/c8f87d0483828244ed43ef00305c3817057d4231,9/28(日) 7:12
2025-09-28,17:08,domestic,国内,3,読売新聞オンライン,万博黒字化の目安、来場者２２００万人を突破…９月中旬から連日２０万人以上,368,https://news.yahoo.co.jp/articles/43ef3f930328ff1b6854bfb075a07a8d767cf013,9/28(日) 13:01
2025-09-28,17:08,domestic,国内,4,文春オンライン,ラブホ密会に“無理な釈明” 小川晶・前橋市長「田久保眞紀・伊東市長のように…」「政治家としての能力がわかる」コメント欄は厳しい反応,287,https://news.yahoo.co.jp/articles/7d0acd5d2d414d81857be2b381956d2ebe076633,9/28(日) 16:12
2025-09-28,17:08,domestic,国内,5,共同通信,企業献金の規制強化に全員慎重　総裁選5候補、公開重視を主張,275,https://news.yahoo.co.jp/articles/4cbda0368b174f9c3a290b4546cb4189e2d65dc3,9/28(日) 10:52
2025-09-28,17:08,domestic,国内,6,読売新聞オンライン,けんか多発で県警に中止要請されても…こんぴらさん「突き合わせ」実施へ、周辺で入場規制,268,https://news.yahoo.co.jp/articles/611c71bb9dc96f0ddd4e2f65b5f13f9349c1841c,9/28(日) 9:30
2025-09-28,17:08,domestic,国内,7,TBS NEWS DIG Powered by JNN,論戦低調の自民党総裁選　独自色見えぬ各候補　「外国人」めぐっては積極的発信も　「解党的出直し」はどこへ?【サンデーモーニング】,239,https://news.yahoo.co.jp/articles/6d4607b1aec2a85db449b70485c74ba685e2bedb,9/28(日) 14:14
2025-09-28,17:08,domestic,国内,8,読売新聞オンライン,万博とは異なる景色広がる「ニシヨドスタン」、多くのパキスタン人が住む地域を記者が取材…対立あおるSNSの誤情報,226,https://news.yahoo.co.jp/articles/cbbfd417c9354e6abfac87cff556db87175ae790,9/28(日) 9:13
2025-09-28,17:08,domestic,国内,9,時事通信,出産直後の乳児殺害容疑　22歳母親逮捕「首絞めた」　警視庁,204,https://news.yahoo.co.jp/articles/5c8ae0c08c7a51f536fb9527af62c38f7cfe0f71,9/28(日) 15:26
2025-09-28,17:08,domestic,国内,10,スポニチアネックス,小泉進次郎氏、改めて「最後まで戦い抜く」決意示す　陣営ステマ問題、番組で生謝罪「トップの責任」,195,https://news.yahoo.co.jp/articles/a89076b20e1e82b187acbdb38bd31b8f29c99c94,9/28(日) 16:14
2025-09-28,17:08,domestic,国内,11,読売新聞オンライン,大学授業料無償化に「3浪の壁」、おかしくない？…「若者が挑戦する機会奪う恐れがある」との指摘も,195,https://news.yahoo.co.jp/articles/f0f3da22b7989e987e9fd3dcd1828158afb58564,9/28(日) 9:35
2025-09-28,17:08,domestic,国内,12,AERA DIGITAL,大阪で「中国系」企業設立ラッシュは「駆け込み移住」か　日本の「経営・管理ビザ」3000万円が微妙すぎる理由,187,https://news.yahoo.co.jp/articles/716ef730417a98ae7a9697c321f157da05f77d2c,9/28(日) 9:31
2025-09-28,17:08,domestic,国内,13,スポニチアネックス,ひろゆき氏　英語で質問　コロンビア大院卒進次郎氏“逃げた”　ハーバード大院卒の茂木氏、林氏は回答,186,https://news.yahoo.co.jp/articles/7ca0694a3c8c915b43fbf183d68eb73835895499,9/28(日) 5:30
2025-09-28,17:08,domestic,国内,14,J-CASTニュース,不倫疑惑の前橋市長、まさかの一人称にネット驚愕　「YouTuberになったら人気出そう」,185,https://news.yahoo.co.jp/articles/7ca21e31ae8623cb01926359d02bf01b844462dd,9/28(日) 15:15
2025-09-28,17:08,domestic,国内,15,日刊スポーツ,蓮舫氏が進次郎氏陣営ステマ問題に初言及「勝つための異常な熱があったとすればその時点でもう」,177,https://news.yahoo.co.jp/articles/95cebde48375088ed5e1bf0711c995eab6b4eead,9/28(日) 13:32
2025-09-28,17:08,domestic,国内,16,よろず～ニュース,吉村洋文氏 万博黒字化目安の来場者数2200万人突破に「やって良かった」「開幕前は全メディアから詰められた」,160,https://news.yahoo.co.jp/articles/dbe509f084396e729f7477f5d967959d0e13b1f1,9/28(日) 15:40
2025-09-28,17:08,domestic,国内,17,よろず～ニュース,蓮舫氏「ステマ。」と進次郎氏陣営の指示問題に言及 「誰もやめた方がいいと言わなかったのでしょうか」,150,https://news.yahoo.co.jp/articles/229ea613b1c45689fddf37d92540e1d4e24cd08c,9/28(日) 15:06
2025-09-28,17:08,domestic,国内,18,読売新聞オンライン,教育実習生に「お前みたいなやつがいるから、くずな教員ばっかり」と指導教諭が暴言…千葉県が和解へ,145,https://news.yahoo.co.jp/articles/2022e544da27e3157548b0c6cfb9daf1049c605f,9/28(日) 12:52
2025-09-28,17:08,domestic,国内,19,ABEMA TIMES,自民党総裁選情勢 国会議員票で小泉農水大臣がリード,116,https://news.yahoo.co.jp/articles/80e1de072b8aae356c5cd06d160778f5a5f2535e,9/28(日) 15:54
2025-09-28,17:08,domestic,国内,20,TBS NEWS DIG Powered by JNN,【全文公開】“ラブホテル密会” 小川晶・前橋市長の謝罪会見「最初にホテルへ誘ったのはどちらから?」記者と小川晶市長の一問一答（9月24日夜）【前編】,114,https://news.yahoo.co.jp/articles/2277b9dc5d8793b1e2b87d059675fd8a25f4ca15,9/28(日) 6:01
2025-09-28,17:08,domestic,国内,21,日刊スポーツ,石破首相引用の首相官邸Ｘ“衝撃”３文字にSNS驚き「わざわざ書かんでもええんちゃうの？」,113,https://news.yahoo.co.jp/articles/ecf5f26bfd964cd3474d5f2275d45b64bd7e55a6,9/28(日) 13:59
2025-09-28,17:08,domestic,国内,22,デイリースポーツ,杉村太蔵が嫌悪感露わ「上は裏金、下はステマでどうにもならねえな」自民総裁選“やらせコメ”投稿「書かれてる内容が気持ち悪い」,109,https://news.yahoo.co.jp/articles/ee19dea64219b6e1032e173f352983d4eb1e926a,9/28(日) 15:49
2025-09-28,17:08,domestic,国内,23,TBS NEWS DIG Powered by JNN,カバン奪って手をにぎり…東京・清瀬市の路上で10代の大学生の女性に性的暴行か　板橋区役所の職員（37）を逮捕　警視庁,108,https://news.yahoo.co.jp/articles/4f62bc09811034cc899d4ccd24b661bc1e4c8356,9/28(日) 16:15
2025-09-28,17:08,domestic,国内,24,日刊スポーツ,へずまりゅう氏、家族の死去を報告「もう絶対に悪い道には戻りません」,107,https://news.yahoo.co.jp/articles/163bdb1a7326069a8e83964ecddd49ea8116eea9,9/28(日) 7:12
2025-09-28,17:08,domestic,国内,25,女性自身,「とんでもないプリンセスオーラ」佳子さま　世界陸上の“ドットワンピース”姿が大絶賛！悠仁さまとのご公務に「希望を感じる」の声も,102,https://news.yahoo.co.jp/articles/18301d7fb3c2802be332daa7b9e4bdc7fce8ce9f,9/28(日) 11:00
2025-09-28,17:08,domestic,国内,26,デイリースポーツ,【ポスト石破】橋下氏　高市早苗氏に砲撃「民主国家の政治家としてダメ」　僕も直接聞いた「総理で靖国」曖昧→「これで行ったら選挙で嘘ついた総理になる」言えばいいと,101,https://news.yahoo.co.jp/articles/260b5901fb6ad0b2f71e89ac5a24863f40ba77ec,9/27(土) 20:40
2025-09-28,17:08,domestic,国内,27,読売新聞オンライン,「稼げる」と誘われカンボジアで「かけ子」、中国人監視下で朝から晩まで詐欺電話…「成績」悪いと暴行も,100,https://news.yahoo.co.jp/articles/e27f3a7773aea5e7fb0b27a63610073a553206ca,9/28(日) 7:02
2025-09-28,17:08,domestic,国内,28,AERA DIGITAL,【小泉氏「ステマ問題」】“指示”の牧島氏は「功を焦った」？　高市VS.林の決選投票も　自民党のモラル問われる総裁選,97,https://news.yahoo.co.jp/articles/0fde36d14d609f487ba3fd29246d69eb14c7376c,9/28(日) 16:40
2025-09-28,17:08,domestic,国内,29,毎日新聞,＜1分で解説＞小泉陣営「やらせ」問題で広報班長辞任　殺害予告も,95,https://news.yahoo.co.jp/articles/04489be965553932fd7b19d329c06188d9d46d17,9/28(日) 15:29
2025-09-28,17:08,domestic,国内,30,日刊スポーツ,ラブホ密会の女性市長を群馬知事またバッサリ「10人が10人、ウソだと思う言い訳」続報も懸念,93,https://news.yahoo.co.jp/articles/bf00494bbc7ac077d30035709457b07f7629b1a7,9/28(日) 16:42
2025-09-28,17:08,domestic,国内,31,TBS NEWS DIG Powered by JNN,【全文公開】“ラブホテル密会” 小川晶・前橋市長の謝罪会見「どちらからホテルに誘うことが多かった?」記者と小川晶市長の一問一答（9月24日夜）【後編】,90,https://news.yahoo.co.jp/articles/97ad30417aa1c150eff3ee9350c2937f5ca1719a,9/28(日) 6:01
2025-09-28,17:08,domestic,国内,32,読売新聞オンライン,「心霊スポット」廃ホテルに若者が相次ぎ侵入、警察「人生台無しにするな」と激怒…騒音やポイ捨ても,87,https://news.yahoo.co.jp/articles/d1721ec1b32a4faa0976ba38e5ccd2e147968d72,9/27(土) 21:52
2025-09-28,17:08,domestic,国内,33,時事通信,小林・高市氏、防衛費増を主張　自民総裁選、財源論乏しく,87,https://news.yahoo.co.jp/articles/3f70201d4e419b2004e8db7c52d4cbf2848fb208,9/28(日) 7:04
2025-09-28,17:08,domestic,国内,34,集英社オンライン,「セコいことするのはロッカーじゃない！」大学時代、ハードロックの歌姫だった田久保市長は“信念の人”だったと東洋大同級生が証言「市長を続けるのはきっと私利私欲のためではない」,86,https://news.yahoo.co.jp/articles/505f52c4a1aff9fc3db3fcd3eeabb96ac139ecb8,9/28(日) 11:01
2025-09-28,17:08,domestic,国内,35,産経新聞,学歴問題の静岡・伊東市長、メガソーラー反対で巻き返し図る　Xで肯定的投稿が一時優勢に,85,https://news.yahoo.co.jp/articles/89a0074a738cc74b4d2f673cf98ca7baf25a2a22,9/27(土) 17:51
2025-09-28,17:08,domestic,国内,36,共同通信,自民党総裁選で小泉、高市氏が先行,81,https://news.yahoo.co.jp/articles/ef524903f480c5baa7aed5ffc77a2ffb59b17293,9/28(日) 16:00
2025-09-28,17:08,domestic,国内,37,日刊スポーツ,【総裁選】高市早苗氏、ステマ問題発覚後初の小泉進次郎氏と顔合わせ「当事者」の感想問われ…,80,https://news.yahoo.co.jp/articles/86d6f0f1a10a9f7ebc085db8f7870c760e3b6e42,9/28(日) 12:58
2025-09-28,17:08,domestic,国内,38,時事通信,高市氏、靖国参拝「手は合わせたい」　林氏はA級戦犯分祀に前向き　自民総裁選,78,https://news.yahoo.co.jp/articles/7da6c0a5a6f54b8faea16db5bbc56d645a0886b9,9/28(日) 15:38
2025-09-28,17:08,domestic,国内,39,スポーツ報知,「最後まで戦い抜いてまいりたい」…陣営「称賛投稿」要請の波紋を巡り小泉進次郎農相、「日曜報道」生出演で決意を述べる,72,https://news.yahoo.co.jp/articles/72c62af60c8638688b9b4519daeefaea6bf4b61d,9/28(日) 8:50
2025-09-28,17:08,domestic,国内,40,スポーツ報知,「書かれている内容がホント気持ち悪い…どうにもならねぇな」…小泉進次郎氏「陣営」投稿依頼問題…「サンジャポ」杉村太蔵が憤慨,69,https://news.yahoo.co.jp/articles/e884cdf574efcdd2250eb5a8eb7928066f8a0755,9/28(日) 10:30
