scrp_date,scrp_time,genre_en,genre_jp,rank,media_jp,title,comment,link,date_original
2024-10-20,20:06,domestic,国内,1子ども2人目は「現実的に無理」…子育て世帯にのしかかる経済負担、かつてない勢いで進む少子化毎日新聞10/20(日) 17:00945件/時,毎日新聞,子ども2人目は「現実的に無理」…子育て世帯にのしかかる経済負担、かつてない勢いで進む少子化,945,https://news.yahoo.co.jp/articles/df85d554308d4a7ec7092e0cfbfc346fa0b14131,10/20(日) 17:00
2024-10-20,20:06,domestic,国内,2比例自民22％、3ポイント減　立民14％で差が縮小、衆院選共同通信10/20(日) 18:20198件/時,共同通信,比例自民22％、3ポイント減　立民14％で差が縮小、衆院選,198,https://news.yahoo.co.jp/articles/98344abf92a906862dd552b76c6402a5b93c116d,10/20(日) 18:20
2024-10-20,20:06,domestic,国内,3れいわ幹部がNHKで暴露「地方議員が自民の車で」非公認の裏金議員応援「不可解なのは公明党」日刊スポーツ10/20(日) 19:14181件/時,日刊スポーツ,れいわ幹部がNHKで暴露「地方議員が自民の車で」非公認の裏金議員応援「不可解なのは公明党」,181,https://news.yahoo.co.jp/articles/42787cbb4ad6217ddb187b021a3b9a85aac23d0e,10/20(日) 19:14
2024-10-20,20:06,domestic,国内,4江川紹子氏　現役大臣を「卑劣」と断罪　大臣としての資質を疑問視デイリースポーツ10/20(日) 18:41148件/時,デイリースポーツ,江川紹子氏　現役大臣を「卑劣」と断罪　大臣としての資質を疑問視,148,https://news.yahoo.co.jp/articles/6e76a8fa4b0451329f638e808f009c804765a7b1,10/20(日) 18:41
2024-10-20,20:06,domestic,国内,5横浜高齢者殺害　強盗殺人容疑で22歳逮捕　連続強盗との関連捜査毎日新聞10/19(土) 23:01140件/時,毎日新聞,横浜高齢者殺害　強盗殺人容疑で22歳逮捕　連続強盗との関連捜査,140,https://news.yahoo.co.jp/articles/04e573b033832d02a55511e639c40f732ecb2f9b,10/19(土) 23:01
2024-10-20,20:06,domestic,国内,6「マーガリンは体によくない」→ではなぜ日本で売られている？ダイヤモンド・オンライン10/20(日) 6:02130件/時,ダイヤモンド・オンライン,「マーガリンは体によくない」→ではなぜ日本で売られている？,130,https://news.yahoo.co.jp/articles/e2346bd6a923a4962ba92e0c09f951cda7598b4e,10/20(日) 6:02
2024-10-20,20:06,domestic,国内,7自民非公認、失った金看板　「裏金」候補、保守派が支え　衆院東京24区ルポ・「みそぎは済むのか」（3）・完【24衆院選】時事通信10/20(日) 6:55126件/時,時事通信,自民非公認、失った金看板　「裏金」候補、保守派が支え　衆院東京24区ルポ・「みそぎは済むのか」（3）・完【24衆院選】,126,https://news.yahoo.co.jp/articles/7d92dcfb751e717d9189779e2506d7afc74fcd6d,10/20(日) 6:55
2024-10-20,20:06,domestic,国内,8山車倒れ男性1人が意識不明　もう1人けが、岡山・浅口の神社共同通信10/20(日) 16:07119件/時,共同通信,山車倒れ男性1人が意識不明　もう1人けが、岡山・浅口の神社,119,https://news.yahoo.co.jp/articles/090c4cb5506d80541b9a59d858ad00c5a1c2dc9d,10/20(日) 16:07
2024-10-20,20:06,domestic,国内,9立民・野田佳彦代表が世襲批判も　身内にも複数「自民とは全然違う」産経新聞10/20(日) 18:08111件/時,産経新聞,立民・野田佳彦代表が世襲批判も　身内にも複数「自民とは全然違う」,111,https://news.yahoo.co.jp/articles/76e5f4ebb2bc7c75b180da44c51f842326d7dca2,10/20(日) 18:08
2024-10-20,20:06,domestic,国内,10「裏金議員」烙印が…萩生田光一氏が立憲・有田芳生氏とデッドヒート 丸川珠代氏は夫と“共演NG”FRIDAY10/20(日) 12:0099件/時,FRIDAY,「裏金議員」烙印が…萩生田光一氏が立憲・有田芳生氏とデッドヒート 丸川珠代氏は夫と“共演NG”,99,https://news.yahoo.co.jp/articles/44cc138f3375022abadd3cb0d0a6ce548e8d8002,10/20(日) 12:00
2024-10-20,20:06,domestic,国内,110:41強盗殺人容疑者の父親 「なんでやっちゃったのかな…」テレビ朝日系（ANN）10/20(日) 18:0592件/時,テレビ朝日系（ANN）,強盗殺人容疑者の父親 「なんでやっちゃったのかな…」,92,https://news.yahoo.co.jp/articles/6f77e54b03aa6adf774b8ec49d7b0b3da6863d55,10/20(日) 18:05
2024-10-20,20:06,domestic,国内,121:02「SNS上のバイトに応募した」横浜市緊縛強盗殺人事件で逮捕された実行役の22歳の男を逮捕　自分の車に他の実行役2人を乗せ犯行に及んだか　神奈川県警TBS NEWS DIG Powered by JNN10/20(日) 5:1088件/時,TBS NEWS DIG Powered by JNN,「SNS上のバイトに応募した」横浜市緊縛強盗殺人事件で逮捕された実行役の22歳の男を逮捕　自分の車に他の実行役2人を乗せ犯行に及んだか　神奈川県警,88,https://news.yahoo.co.jp/articles/de45970dd81958d1cc6abe03560f50a3668d30af,10/20(日) 5:10
2024-10-20,20:06,domestic,国内,131:04【独自】“ガスマスク”着用…臼田敦伸容疑者（49）周到な準備で犯行か　自民党本部・官邸襲撃事件FNNプライムオンライン（フジテレビ系）10/20(日) 12:0787件/時,FNNプライムオンライン（フジテレビ系）,【独自】“ガスマスク”着用…臼田敦伸容疑者（49）周到な準備で犯行か　自民党本部・官邸襲撃事件,87,https://news.yahoo.co.jp/articles/c5f838592713c563bfc1d66e1a4d3f7bbf775dc6,10/20(日) 12:07
2024-10-20,20:06,domestic,国内,14立民・野田佳彦代表「無理して変えることはない」　朝鮮学校の無償化産経新聞10/20(日) 18:4287件/時,産経新聞,立民・野田佳彦代表「無理して変えることはない」　朝鮮学校の無償化,87,https://news.yahoo.co.jp/articles/4f69ab5053239c779c5aba240d68ca42f62402b5,10/20(日) 18:42
2024-10-20,20:06,domestic,国内,15日本保守党・百田尚樹代表＆河村たかし氏初“競演”　軽妙やりとりで聴衆沸かすスポニチアネックス10/20(日) 16:1171件/時,スポニチアネックス,日本保守党・百田尚樹代表＆河村たかし氏初“競演”　軽妙やりとりで聴衆沸かす,71,https://news.yahoo.co.jp/articles/901d2ae372afe42a7bc20ae38387fbe8a4de4633,10/20(日) 16:11
2024-10-20,20:06,domestic,国内,16旧統一教会問題で逆風…自民の山本朋広氏と山際大志郎氏、異例の“ステルス作戦”　衆院選・注目区ルポカナロコ by 神奈川新聞10/20(日) 5:3067件/時,カナロコ by 神奈川新聞,旧統一教会問題で逆風…自民の山本朋広氏と山際大志郎氏、異例の“ステルス作戦”　衆院選・注目区ルポ,67,https://news.yahoo.co.jp/articles/b7bbcc32e4eb98af41a024c9e931bea31ad7e5f0,10/20(日) 5:30
2024-10-20,20:06,domestic,国内,17石破内閣の支持率41％、不支持率40％共同通信10/20(日) 17:2267件/時,共同通信,石破内閣の支持率41％、不支持率40％,67,https://news.yahoo.co.jp/articles/5ebcf8f196b21d890b0642f8b74873698c4a4bbd,10/20(日) 17:22
2024-10-20,20:06,domestic,国内,18コインパーキングに3時間駐車で「53万円」請求！　お笑い芸人がトラブル報告...運営会社が説明するその理由J-CASTニュース10/20(日) 11:0067件/時,J-CASTニュース,コインパーキングに3時間駐車で「53万円」請求！　お笑い芸人がトラブル報告...運営会社が説明するその理由,67,https://news.yahoo.co.jp/articles/a822ddc691c77317baf1f5e2881f17d78cb387da,10/20(日) 11:00
2024-10-20,20:06,domestic,国内,19藤井聡太竜王「完敗」シリーズ初黒星 挑戦者・佐々木勇気八段に敗れ通算1勝1敗に 竜王戦七番勝負での敗戦は2期ぶりABEMA TIMES10/20(日) 16:5664件/時,ABEMA TIMES,藤井聡太竜王「完敗」シリーズ初黒星 挑戦者・佐々木勇気八段に敗れ通算1勝1敗に 竜王戦七番勝負での敗戦は2期ぶり,64,https://news.yahoo.co.jp/articles/3aac896cc19de01e9f5701d4d0b16022a8e77f24,10/20(日) 16:56
2024-10-20,20:06,domestic,国内,20安倍昭恵さん　“裏金議員”応援行脚にネット「安倍さんは裏金やめさせようと…」「これぞ政治家の妻」スポニチアネックス10/20(日) 10:5163件/時,スポニチアネックス,安倍昭恵さん　“裏金議員”応援行脚にネット「安倍さんは裏金やめさせようと…」「これぞ政治家の妻」,63,https://news.yahoo.co.jp/articles/466fce268bdc5182819e1d12d9379df1a1921191,10/20(日) 10:51
2024-10-20,20:06,domestic,国内,21夫の食事だけ作らない妻、風俗に走る夫　死を招いた壮絶な「家庭内別居」　法廷から産経新聞10/20(日) 19:0061件/時,産経新聞,夫の食事だけ作らない妻、風俗に走る夫　死を招いた壮絶な「家庭内別居」　法廷から,61,https://news.yahoo.co.jp/articles/f2b5e96d35982692cc71fa45c186a04b0efcaf9f,10/20(日) 19:00
2024-10-20,20:06,domestic,国内,22有権者は投票で少しでも「まし」な人を選ぶべき「時間はかかるがダメな議員は淘汰される」　茨城大・村上信夫特任教授産経新聞10/20(日) 15:4257件/時,産経新聞,有権者は投票で少しでも「まし」な人を選ぶべき「時間はかかるがダメな議員は淘汰される」　茨城大・村上信夫特任教授,57,https://news.yahoo.co.jp/articles/174e92209223bbd1aaf2ce42dde8cff9f0292254,10/20(日) 15:42
2024-10-20,20:06,domestic,国内,23丸川珠代氏の “極秘”選挙活動に関係者やきもき　演説予定は非公開、区議にも「参加できる人いれば」と控えめAERA dot.10/20(日) 16:3655件/時,AERA dot.,丸川珠代氏の “極秘”選挙活動に関係者やきもき　演説予定は非公開、区議にも「参加できる人いれば」と控えめ,55,https://news.yahoo.co.jp/articles/ba26a8e75430fed070d8d0caa84c1b35e4b0a5db,10/20(日) 16:36
2024-10-20,20:06,domestic,国内,24石破内閣は国民に見限られた？　支持率28％の危険水域　原因は「 安倍一強」に甘えた自民党のレベルAERA dot.10/20(日) 11:3653件/時,AERA dot.,石破内閣は国民に見限られた？　支持率28％の危険水域　原因は「 安倍一強」に甘えた自民党のレベル,53,https://news.yahoo.co.jp/articles/e4ac4127b352cc81ecbfc12e3ee6c8ac099b41ae,10/20(日) 11:36
2024-10-20,20:06,domestic,国内,25紀藤弁護士　松井一郎氏による東京24区・萩生田氏応援に「萩生田氏にとっても維新にとってもマイナス」スポニチアネックス10/20(日) 9:5352件/時,スポニチアネックス,紀藤弁護士　松井一郎氏による東京24区・萩生田氏応援に「萩生田氏にとっても維新にとってもマイナス」,52,https://news.yahoo.co.jp/articles/ff1be98324046719d9788b475fd8304dee6ff9c8,10/20(日) 9:53
2024-10-20,20:06,domestic,国内,26「騒音バイク」の110番、倍増　福岡県警が取り締まり強化毎日新聞10/20(日) 15:0952件/時,毎日新聞,「騒音バイク」の110番、倍増　福岡県警が取り締まり強化,52,https://news.yahoo.co.jp/articles/f5d7b6f9a2af40dcae5f55acaa8912ef9b4fae94,10/20(日) 15:09
2024-10-20,20:06,domestic,国内,27比例投票先、自民・立民8ポイント差に縮小共同通信10/20(日) 17:2052件/時,共同通信,比例投票先、自民・立民8ポイント差に縮小,52,https://news.yahoo.co.jp/articles/21f1a06d1b4aa77a1f1b980176f822a74a7f0772,10/20(日) 17:20
2024-10-20,20:06,domestic,国内,28「トイレに行くだけで１８回も挙手」…参院選買収事件で服役した河井克行・元法相が刑務所生活語る読売新聞オンライン10/20(日) 14:5251件/時,読売新聞オンライン,「トイレに行くだけで１８回も挙手」…参院選買収事件で服役した河井克行・元法相が刑務所生活語る,51,https://news.yahoo.co.jp/articles/9d46e39c75513e3c50f01378afc7112a9cda03f7,10/20(日) 14:52
2024-10-20,20:06,domestic,国内,29選挙区投票先、野党系33％で与党系上回る共同通信10/20(日) 17:2149件/時,共同通信,選挙区投票先、野党系33％で与党系上回る,49,https://news.yahoo.co.jp/articles/12dc2244104bfbbf4ae0844fec1daa3301fb08cd,10/20(日) 17:21
2024-10-20,20:06,domestic,国内,30高圧洗浄機で機動隊員に液体噴射　逮捕の49歳男、自民党前で　官邸突入時事通信10/20(日) 19:0048件/時,時事通信,高圧洗浄機で機動隊員に液体噴射　逮捕の49歳男、自民党前で　官邸突入,48,https://news.yahoo.co.jp/articles/674165561a9e4bb8424bc7f13d7f3875f15d0bf5,10/20(日) 19:00
2024-10-20,20:06,domestic,国内,31エリート家庭のお嬢様→少年院にも入る筋金入りのワル→“日本初の女ヤクザ”になった西村まこ（58）の壮絶人生「学校のテストは100点以外なら竹の棒で体罰」文春オンライン10/20(日) 12:1247件/時,文春オンライン,エリート家庭のお嬢様→少年院にも入る筋金入りのワル→“日本初の女ヤクザ”になった西村まこ（58）の壮絶人生「学校のテストは100点以外なら竹の棒で体罰」,47,https://news.yahoo.co.jp/articles/fb933f3753b3b1dd7eae7a24f3073c32b9c9f64d,10/20(日) 12:12
2024-10-20,20:06,domestic,国内,32石破茂首相が和歌山２区応援入り、自民党本部襲撃を受け厳戒態勢に「皆さんの中に入りたいが…」日刊スポーツ10/20(日) 13:1046件/時,日刊スポーツ,石破茂首相が和歌山２区応援入り、自民党本部襲撃を受け厳戒態勢に「皆さんの中に入りたいが…」,46,https://news.yahoo.co.jp/articles/e437f170c8672e7b97c3ba1dd3aa8ad683507f17,10/20(日) 13:10
2024-10-20,20:06,domestic,国内,33上皇后美智子さま90歳＝卒寿をお迎えに　骨折前の映像公開　上皇さまをお支えするため毎日リハビリを続けるFNNプライムオンライン（フジテレビ系）10/20(日) 0:0045件/時,FNNプライムオンライン（フジテレビ系）,上皇后美智子さま90歳＝卒寿をお迎えに　骨折前の映像公開　上皇さまをお支えするため毎日リハビリを続ける,45,https://news.yahoo.co.jp/articles/a3e2638aae6847803ffb7e7d95fc9a7c47fea9e7,10/20(日) 0:00
2024-10-20,20:06,domestic,国内,34【将棋】福間女流５冠、妊娠体調不良でタイトル戦不戦敗続き　塚田女流二段「休むも指すも大切」日刊スポーツ10/20(日) 13:1644件/時,日刊スポーツ,【将棋】福間女流５冠、妊娠体調不良でタイトル戦不戦敗続き　塚田女流二段「休むも指すも大切」,44,https://news.yahoo.co.jp/articles/f9eecce91b5aebcbc2257c23462b8452913ec8ec,10/20(日) 13:16
2024-10-20,20:06,domestic,国内,35遭難が日本一多い山は富士山ではなく「高尾山」　標高599メートル「下りの山道」に潜むホントの危険AERA dot.10/20(日) 9:3243件/時,AERA dot.,遭難が日本一多い山は富士山ではなく「高尾山」　標高599メートル「下りの山道」に潜むホントの危険,43,https://news.yahoo.co.jp/articles/7df021aa4cfbba2323f1f59774dad75e78f56af3,10/20(日) 9:32
2024-10-20,20:06,domestic,国内,36「維新は命おろそか」「自公で国難乗り切れぬ」首相ら各党幹部が関西入り、厳戒のなか舌戦産経新聞10/20(日) 19:1941件/時,産経新聞,「維新は命おろそか」「自公で国難乗り切れぬ」首相ら各党幹部が関西入り、厳戒のなか舌戦,41,https://news.yahoo.co.jp/articles/7ed7f2c7c2cd1793bfa5cc48c13880671f6ca0f1,10/20(日) 19:19
2024-10-20,20:06,domestic,国内,37「第三次世界大戦のリスクが」 北朝鮮、ウクライナ侵攻に参戦の報道… 杉村太蔵が強い懸念、専門家も同調中日スポーツ10/20(日) 11:4741件/時,中日スポーツ,「第三次世界大戦のリスクが」 北朝鮮、ウクライナ侵攻に参戦の報道… 杉村太蔵が強い懸念、専門家も同調,41,https://news.yahoo.co.jp/articles/d8471d88df6847269530455c8025357582c55b1f,10/20(日) 11:47
2024-10-20,20:06,domestic,国内,38ビジネス上のリスク、キャリアの分断 経団連が選択的夫婦別姓の早期導入を求めた理由 #家族とわたしYahoo!ニュース オリジナル 特集10/20(日) 17:0040件/時,Yahoo!ニュース オリジナル 特集,ビジネス上のリスク、キャリアの分断 経団連が選択的夫婦別姓の早期導入を求めた理由 #家族とわたし,40,https://news.yahoo.co.jp/articles/b7c02a71837ea8cd5a996b09794989f2e8db0295,10/20(日) 17:00
2024-10-20,20:06,domestic,国内,39飲酒逆走事故　中国籍の男を送検容疑より刑軽い過失運転致死で家裁送致　さいたま地検テレビ朝日系（ANN）10/20(日) 7:3839件/時,テレビ朝日系（ANN）,飲酒逆走事故　中国籍の男を送検容疑より刑軽い過失運転致死で家裁送致　さいたま地検,39,https://news.yahoo.co.jp/articles/0afe056f496f8982b48bdf44125c62b508b6a9cd,10/20(日) 7:38
2024-10-20,20:06,domestic,国内,40「あいつらは何かやる」。外国人には「とりあえず職質」、その狙いは。元警察幹部が証言【レイシャル・プロファイリング】ハフポスト日本版10/20(日) 17:0739件/時,ハフポスト日本版,「あいつらは何かやる」。外国人には「とりあえず職質」、その狙いは。元警察幹部が証言【レイシャル・プロファイリング】,39,https://news.yahoo.co.jp/articles/e91a76f05fdf5999223ff0056c5fc958fd9f991a,10/20(日) 17:07
