scrp_date,scrp_time,genre_en,genre_jp,rank,media_jp,title,comment,link,date_original
2025-12-05,20:08,TTL,総合,1,プレジデントオンライン,"「おこめ券」でJAを救済したいだけ…税金4000億円で""史上最高値のコメ""を買わせる農水大臣とJAの癒着ぶり",652,https://news.yahoo.co.jp/articles/4cf49fcfdccba9ffb651476641ce8ed670377850,12/5(金) 18:15
2025-12-05,20:08,TTL,総合,2,テレビ朝日系（ANN）,【速報】コメ平均価格4335円/5kg（前週比+23円）過去最高値更新　全国スーパー1000店舗,649,https://news.yahoo.co.jp/articles/b6c4fed49d929e46737fb91042898b1f55e460b9,12/5(金) 17:09
2025-12-05,20:08,TTL,総合,3,読売新聞オンライン,経営ビザで中国系「ペーパー会社」大阪で乱立、移民ビジネスの仕組み…500社超で「取締役」の日本側協力者も,588,https://news.yahoo.co.jp/articles/5e158b1e4cbebf6469f39fd13ab48636d0974f08,12/5(金) 11:00
2025-12-05,20:08,TTL,総合,4,テレビ朝日系（ANN）,会社で58歳女性刺される　殺人未遂容疑で中国籍の男逮捕　女性死亡　千葉・いすみ市,551,https://news.yahoo.co.jp/articles/11ea4e7296f0fe31306ce429fbed0509f344390f,12/5(金) 17:15
2025-12-05,20:08,TTL,総合,5,クーリエ・ジャポン,香港紙がバッサリ「中国人にとって、ボイコットする価値のある日本製品はもはやない」,453,https://news.yahoo.co.jp/articles/5c8b75c6ddaa02af1d7ca530b17ded0b4c2ed27f,12/5(金) 17:45
2025-12-05,20:08,TTL,総合,6,TBS NEWS DIG Powered by JNN,【速報】自民・維新が議員定数削減法案を国会に提出,453,https://news.yahoo.co.jp/articles/abeb5d7f8d8f99c27333f879576a99287c037729,12/5(金) 15:57
2025-12-05,20:08,TTL,総合,7,テレビ朝日系（ANN）,高市内閣の閣僚資産を公開　小泉大臣がトップも全額クリステルさん名義,288,https://news.yahoo.co.jp/articles/1c7d164a6a820c8b6335a7121f3fba0d1498fcf0,12/5(金) 17:00
2025-12-05,20:08,TTL,総合,8,日刊スポーツ,共産志位議長、香港TVで「高市氏台湾発言」に言及「日本国憲法を蹂躙する危険極まりない発言」,287,https://news.yahoo.co.jp/articles/a5421770eea6e93aef90e93b7d0bc98279a63e29,12/5(金) 9:41
2025-12-05,20:08,TTL,総合,9,テレビ朝日系（ANN）,冬眠しないクマ被害相次ぐも　箱わな妨害騒動…足蹴り破壊　獣害悩むハンター怒り,284,https://news.yahoo.co.jp/articles/8eaf4b8dc4d6b0c06312cbd5f518e239a7f44405,12/5(金) 11:54
2025-12-05,20:08,TTL,総合,10,毎日新聞,「何でもないことに大騒ぎするな」　中国、近隣海域での艦船展開で,261,https://news.yahoo.co.jp/articles/70062b4f9950741881bc70461b71633bea73738c,12/5(金) 17:57
2025-12-05,20:08,TTL,総合,11,デイリー新潮,〈このハゲーっ！〉豊田真由子氏がまたもや“事件”を起こしていた！　「要望が通らないと態度を豹変させ、大声を張り上げて…」,248,https://news.yahoo.co.jp/articles/5fe437eb07ba234dd387c95c697781dd36a52465,12/5(金) 5:40
2025-12-05,20:08,TTL,総合,12,TBS NEWS DIG Powered by JNN,旧統一教会・田中富広会長が辞任へ　高額献金「補償委員会」設置など区切りに　今後、記者会見し表明予定　高額献金被害の元信者らへの謝罪表明も検討,241,https://news.yahoo.co.jp/articles/6e8bc769c2e6e782c8db49000b05acd5cd4b8e4d,12/5(金) 13:51
2025-12-05,20:08,TTL,総合,13,TBS NEWS DIG Powered by JNN,“税”めぐる議論が本格化…「住宅ローン減税」「“年収の壁”引き上げ」など“高市カラー”にじむ減税政策で国民負担どうなる?一方で財源は【news23】,231,https://news.yahoo.co.jp/articles/c30d84216f89cdb91cbab08e0ce40e004f2fc876,12/5(金) 13:58
2025-12-05,20:08,TTL,総合,14,中日スポーツ,「中国は圧力を弱めない」舛添要一さん、『高市発言』撤回を促す投稿　「トランプ政権はあえて介入しない」,218,https://news.yahoo.co.jp/articles/05cc734c88f1f3784ddd84d9d65b9678f98ce881,12/5(金) 12:20
2025-12-05,20:08,TTL,総合,15,中日スポーツ,「裏切られた」高市政権、高校生の”扶養控除”縮小報道に…子育て世帯から嘆き「差し引きゼロの世界」,208,https://news.yahoo.co.jp/articles/7792695099d286662ea4f66c0598758c4af8d1b0,12/5(金) 16:25
2025-12-05,20:08,TTL,総合,16,女性自身,「考え方がオカシイ」おこめ券に“使用期限”“転売対策”…鈴木農水大臣のフシギ発言にネット冷笑,200,https://news.yahoo.co.jp/articles/7e122932a28b9005e67149f6a42a0a546a810170,12/5(金) 19:10
2025-12-05,20:08,TTL,総合,17,デイリースポーツ,【高市自民】ネット大荒れ「はあ？」「子育てに罰金」「高市支持やめる！」　高校生の扶養控除縮小検討の報道に騒然「意味分からん」「ほーら増税始まった」「涙出る」「子育て支援は嘘」　公明離脱で再燃,195,https://news.yahoo.co.jp/articles/b099cc29d2714806db3b37c125536a157b8287ae,12/4(木) 22:26
2025-12-05,20:08,TTL,総合,18,八重山日報,玉城知事「個人や企業の立場」  沖縄巡る中国メディア宣伝に,194,https://news.yahoo.co.jp/articles/c5ca35b21e228e87db0d12907476b9a6fb1828b6,12/5(金) 18:36
2025-12-05,20:08,TTL,総合,19,オリコン,カズレーザー「おこめ券」に持論「だとしたら国が国民全員に…」,192,https://news.yahoo.co.jp/articles/ebf3a31f8d41091f3306c81b83de078230875723,12/5(金) 16:47
2025-12-05,20:08,TTL,総合,20,産経新聞,CF型ふるさと納税返礼品の遠藤航選手スパイク、申し込みゼロ　横浜市戸塚区「申し訳ない」,192,https://news.yahoo.co.jp/articles/aec755886539c42a1e44b00655d5ab38e90d0e2b,12/5(金) 16:14
2025-12-05,20:08,TTL,総合,21,毎日新聞,事実上の減反政策を法定化へ　農水省方針　「需要に応じた生産」推進,176,https://news.yahoo.co.jp/articles/376cdb6cef400715237ca6da9ac309f18277fa65,12/5(金) 5:00
2025-12-05,20:08,TTL,総合,22,J-CASTニュース,3COINSに「10000円超」お目見え、売上は「予想を上回る」　異例「5桁台」商品の開発背景とは,163,https://news.yahoo.co.jp/articles/4b7e2cb792f9d816b4fb90b7f8ee25bccd23283b,12/5(金) 18:38
2025-12-05,20:08,TTL,総合,23,スポーツ報知,【高校野球】２８年センバツをめどに７イニング制導入が理想　夏の甲子園は早期実施希望も反対多く継続審議,147,https://news.yahoo.co.jp/articles/b0dce08aae9c59aa54c631287563498cd95fbd0c,12/5(金) 18:11
2025-12-05,20:08,TTL,総合,24,TBS NEWS DIG Powered by JNN,中国軍や海警局が100隻超の艦船展開と報道　「法に則って活動」中国外務省が主張,142,https://news.yahoo.co.jp/articles/4a1cf7e08352218ec5eebf3b013a28ad7f329108,12/5(金) 18:48
2025-12-05,20:08,TTL,総合,25,日刊スポーツ,中国大使館、改めて尖閣は「中国固有の領土」と投稿しツッコミ相次ぐ「そろそろ黙ってくれ」,141,https://news.yahoo.co.jp/articles/72b46e9da6e81ac8f26ba7f04ce42ae4208153ba,12/5(金) 7:32
2025-12-05,20:08,TTL,総合,26,ＡＦＰ＝時事,「日本の軍国主義者を全滅せよ」ロシア、ウクライナの子どもを北朝鮮に送り「再教育」,141,https://news.yahoo.co.jp/articles/8d87a86dbc3629ba227c69435a389cad34609fae,12/5(金) 8:07
2025-12-05,20:08,TTL,総合,27,TBS NEWS DIG Powered by JNN,鈴木農水大臣「おこめ券」に使用期限設定と正式表明　物価高対策として速やかに活用してもらうため　“来年9月末まで”の見通し,141,https://news.yahoo.co.jp/articles/c87cfc4bb5d8d8453e4725bd9465cc81167cd3f7,12/5(金) 16:19
2025-12-05,20:08,TTL,総合,28,毎日新聞,外国人の日本国籍取得を厳格化へ　居住期間「10年以上」で検討,140,https://news.yahoo.co.jp/articles/863fab14a3cbc99736abd408bef18efcb27781f8,12/4(木) 20:21
2025-12-05,20:08,TTL,総合,29,オリコン,【紅白】RADWIMPS、出場決定　朝ドラ『あんぱん』主題歌も話題に「感謝と愛を込めて演奏させて頂きます」,139,https://news.yahoo.co.jp/articles/06d5d5a2fa92e6ae123433454342628c6fbcaa58,12/5(金) 17:02
2025-12-05,20:08,TTL,総合,30,共同通信,マイナカード保有が1億枚超え　交付10年、保険証利用は伸びず,137,https://news.yahoo.co.jp/articles/6a5bd322867a7f678e6a9b2e7d67b5e01616eb64,12/5(金) 10:27
2025-12-05,20:08,TTL,総合,31,MBSニュース,「日本はスリがしやすい」観光客など101人の財布を盗んだ疑い　逮捕・起訴された中国籍の男　「カードの写真を海外に送ると1枚2000円の報酬も」,136,https://news.yahoo.co.jp/articles/cd398cb7215085f1fcedc01a1ad88838527393af,12/5(金) 15:58
2025-12-05,20:08,TTL,総合,32,毎日新聞,防衛所得増税、27年1月開始で調整　財源確保必要と判断　自民,133,https://news.yahoo.co.jp/articles/94126665c244bc22b7f92acb2e2706f771e6b2f4,12/4(木) 21:10
2025-12-05,20:08,TTL,総合,33,読売テレビ,【速報】“信号待ち”中国人観光客2人死亡の山陽電鉄踏切事故　遺族が約1億4000万円賠償求め提訴　神戸地裁,133,https://news.yahoo.co.jp/articles/295497b0d78b580b34943b061e4be41d54011107,12/5(金) 10:54
2025-12-05,20:08,TTL,総合,34,スポニチアネックス,中国の日本対抗措置、次なるカードは？　峯村健司氏が指摘「カードがなくなって困っている状況」,132,https://news.yahoo.co.jp/articles/416dcaf817aa11fef368bb2d9509daf7a8066332,12/5(金) 16:28
2025-12-05,20:08,TTL,総合,35,テレビ静岡NEWS,不登校は「親が悪い」発言の富士宮市長が議会で謝罪　「短絡的に述べたことが多くの人を傷つけた」　発言の真意は「学校だけが悪いのではないということ。不登校は様々な要因によるものということは承知している」,132,https://news.yahoo.co.jp/articles/8d660f81f8c95a47a492c4a825cc6270ad88c32d,12/5(金) 13:57
2025-12-05,20:08,TTL,総合,36,くるまのニュース,トヨタ「GR GT」「GR GT3」「LEXUS LFAコンセプト」世界初公開！ 15年ぶりフラッグシップスポーツ復活！ 異なる3モデル展開へ GRは27年投入へ,126,https://news.yahoo.co.jp/articles/e3e7157061d3e4d68c95882e25b89818066191d4,12/5(金) 11:05
2025-12-05,20:08,TTL,総合,37,デイリースポーツ,【高市自民】小泉大臣、憤慨中国にＴＶ反論　台湾１００ｋｍの日本ミサイル非難→「地対空ミサイル、中国に届くわけない」　計画３年前は「こんな反応しなかった」　国論割り混乱させる意図と,125,https://news.yahoo.co.jp/articles/f8751cf74604aae61f3bddb277039f53d1957baf,12/5(金) 19:29
2025-12-05,20:08,TTL,総合,38,スポニチアネックス,橋下徹氏　中国の駐日本大使館の尖閣諸島巡る主張に「国際社会に向けて…高市政権に戦略はあるのか」,122,https://news.yahoo.co.jp/articles/c165dcac517e5da2f3c7715590e0c38420bc4c9c,12/5(金) 12:14
2025-12-05,20:08,TTL,総合,39,デイリースポーツ,【高市自民】「玉木さん絶対阻止してくれ！」　「子育て罰金」と大荒れの「高校生の扶養控除縮小」→玉木代表が反対表明→Ｘに殺到「止めてくれ」「絶対許せん」「国民民主が名挙げるチャンス」,122,https://news.yahoo.co.jp/articles/961b2685acc35367f1f6ffe74c7e0470c24fbce9,12/5(金) 16:05
2025-12-05,20:08,TTL,総合,40,共同通信,中国、フランスとパンダ協力延長　2027年に2頭,117,https://news.yahoo.co.jp/articles/fc9fcca34e4eda83d17728c9b8dd082664851cd9,12/4(木) 22:59
