scrp_date,scrp_time,genre_en,genre_jp,rank,media_jp,title,comment,link,date_original
2025-08-08,20:08,TTL,総合,1,読売テレビ,【速報】「夫の尊厳を守りたい」死亡した元兵庫県議の妻がNHK党・立花氏を名誉棄損の疑いで刑事告訴 「警察の調べ受けている」街頭演説などでウソの発言,1197,https://news.yahoo.co.jp/articles/8f1deca5fab83d522fa48bcd7fc6d300de0a79d2,8/8(金) 16:31
2025-08-08,20:08,TTL,総合,2,静岡朝日テレビ,【速報】『学歴詐称疑惑』田久保市長が百条委からの再度の〝卒業証書〟提出要請を拒否,1009,https://news.yahoo.co.jp/articles/65c1c80121b234dc46251635d8f90406330c862e,8/8(金) 15:52
2025-08-08,20:08,TTL,総合,3,時事通信,広陵高の暴行事案「大変遺憾」　SNS過熱、冷静対応求める　阿部文科相,476,https://news.yahoo.co.jp/articles/0e81d9bfc9b1788a262966ced84cda33211102a7,8/8(金) 11:52
2025-08-08,20:08,TTL,総合,4,ABCニュース,【速報】海水浴場に来ていたサッカーチームの2人が溺れる　53歳の男性が死亡　男子中学生が意識不明　京都・京丹後市,395,https://news.yahoo.co.jp/articles/44661bb607cbf33db9c6f483a45ddc31ff7d4796,8/8(金) 18:27
2025-08-08,20:08,TTL,総合,5,時事通信,総裁選前倒し、選管が意思確認　自民、過半数の賛同焦点　首相なお続投意欲・両院総会,363,https://news.yahoo.co.jp/articles/702d0dce763581a4dde828a996fe4b94c31c93a2,8/8(金) 14:59
2025-08-08,20:08,TTL,総合,6,スポニチアネックス,YOSHIKI、アニメ「ダンダダン」劇中歌に困惑「弁護士から連絡」「著作権侵害の可能性」,359,https://news.yahoo.co.jp/articles/36c092f78efbb368f811ee06d3211112c54ba2a9,8/8(金) 15:57
2025-08-08,20:08,TTL,総合,7,時事通信,大手夏ボーナス、過去最高97万円　製造業は初の100万円超え　経団連,338,https://news.yahoo.co.jp/articles/1a93e2477dcdd81c28fe6933058f1c9a7915fa3d,8/8(金) 12:21
2025-08-08,20:08,TTL,総合,8,日刊スポーツ,人気ミュージシャン、「あからさまな差別煽動」へずまりゅう氏の処分を奈良市長に求む,299,https://news.yahoo.co.jp/articles/d58d03264007c5b2e4e02f93300bd57eed4c7d4e,8/8(金) 11:50
2025-08-08,20:08,TTL,総合,9,毎日新聞,赤沢氏「大統領令を修正すると説明あった」　関税巡り米閣僚と協議,282,https://news.yahoo.co.jp/articles/af00f406416c467ac4c2cb885cdd3c2d8a6d8cac,8/8(金) 8:22
2025-08-08,20:08,TTL,総合,10,毎日新聞,「首相だけのせいじゃない」　参院選大敗後に内閣支持率上昇の「怪」,275,https://news.yahoo.co.jp/articles/fd3ca60b85f48ba9c5408405b811f8e5ca7ac2ae,8/8(金) 11:30
2025-08-08,20:08,TTL,総合,11,大手小町（読売新聞）,トイレの記号「青は男、赤は女という決めつけは良くない」「スカートは女、ズボンは男のシルエットも決めつけ」の声に浮上した「左右固定」案,263,https://news.yahoo.co.jp/articles/49ec806b3df99c93ded06bad41cb5fc6ecad4b90,8/8(金) 11:51
2025-08-08,20:08,TTL,総合,12,TBS NEWS DIG Powered by JNN,戦争で「日系人は馬小屋に」涙流した黒人女性　綾瀬はるかが聞いた、絆を引き裂いた戦争の実態　#きおくをつなごう #戦争の記憶,246,https://news.yahoo.co.jp/articles/63231b5f1427d523b2abe349a027e2feabe5ccbd,8/8(金) 18:05
2025-08-08,20:08,TTL,総合,13,日刊スポーツ,百田尚樹氏、米山隆一氏の「日本にも過ち」に反論「自虐史観と偽善に基づいた捻じ曲がった解釈」,231,https://news.yahoo.co.jp/articles/12fb1cffc0583f571df219de50ed4c5bd9edb73e,8/8(金) 17:13
2025-08-08,20:08,TTL,総合,14,産経新聞,日米、トランプ関税で食い違い表面化　合意文書なしが裏目、石破首相の責任論に発展も,230,https://news.yahoo.co.jp/articles/e545d94bb3b0b857cfaf1337b828b0a35bacecce,8/7(木) 20:17
2025-08-08,20:08,TTL,総合,15,女性自身,「心底呆れた」相互関税をめぐる赤沢大臣の“ユルすぎ“投稿が物議「これが石破政権」の指摘も,225,https://news.yahoo.co.jp/articles/a2519a5d7b3b8f3228c7b7184d51e188b7ec4b6d,8/8(金) 18:50
2025-08-08,20:08,TTL,総合,16,静岡朝日テレビ,田久保市長「続投会見」での発言を訂正しHPに掲載へ　幹部職員「市長と職員には計り知れない溝がある」　静岡・伊東市,212,https://news.yahoo.co.jp/articles/cf733f13faff3555e004c31d618d1b1976e5770e,8/8(金) 13:31
2025-08-08,20:08,TTL,総合,17,デイリースポーツ,石破おろし両院議員総会→１時間後に突然「一気にステージ変わった」臨時総裁選が議題に　「石破総理は非常に不満そう」青山議員が読テレ出演し明かす,206,https://news.yahoo.co.jp/articles/e667bef941d01708443c11b8afc4d37c030bee70,8/8(金) 17:22
2025-08-08,20:08,TTL,総合,18,Full-Count,広陵・中井監督が“反省”　試合中に思わず険しい表情…初戦突破も「生徒に失礼なことした」,191,https://news.yahoo.co.jp/articles/c9aa3ad1cb327434a0da68c1e46cb2f825fbd815,8/8(金) 12:56
2025-08-08,20:08,TTL,総合,19,日刊スポーツ,北村晴男氏「ここまで無能な政権は、鳩山由紀夫政権以下かも知れない」石破政権に痛烈指摘,182,https://news.yahoo.co.jp/articles/388d383cea955a6ba5af3a091e06f230c9101f6f,8/8(金) 13:18
2025-08-08,20:08,TTL,総合,20,毎日新聞,事務処理で米側混乱か　相互関税大統領令「適時修正」へ　払い戻しも,179,https://news.yahoo.co.jp/articles/7ab054bc148de7384906d71e4e568007175b117f,8/8(金) 10:53
2025-08-08,20:08,TTL,総合,21,集英社オンライン,〈広陵が大炎上〉「SNSでは名前とか顔まで…違ったらどうすんだ。責任取れんのか」吹奏楽もチアガールもなし…異様な雰囲気に包まれた初戦現地ルポ,175,https://news.yahoo.co.jp/articles/8a0a585f613ff38fd347ecdef8d70bfec5d7ff7c,8/8(金) 11:16
2025-08-08,20:08,TTL,総合,22,スポニチアネックス,山田邦子「総理のこと言い過ぎじゃない？」　戦後80年見解巡り石破首相の胸中推測「出したいと思うよ」,173,https://news.yahoo.co.jp/articles/74ea8396febecfc8469c47ac8136c74f31a9136f,8/8(金) 18:49
2025-08-08,20:08,TTL,総合,23,tennis365.net,大坂なおみ 準Vに失意 会見欠席、文書で物議のスピーチ釈明＜女子テニス＞,172,https://news.yahoo.co.jp/articles/f51f04827dad980f1a15a286183d4dec217bc2b1,8/8(金) 13:55
2025-08-08,20:08,TTL,総合,24,TBS NEWS DIG Powered by JNN,【夏の甲子園】悲願の夏制覇へ！広陵が旭川志峯を破り3年連続の初戦突破！エース堀田昂佑が9回1失点完投 4番・草島絃太がV打,171,https://news.yahoo.co.jp/articles/0cdbce79a3b2acc690358732a8b1a8abeaab11be,8/7(木) 21:15
2025-08-08,20:08,TTL,総合,25,共同通信,農水省「コメ足りている」を謝罪　自民部会で誤り認める,164,https://news.yahoo.co.jp/articles/f169b26d55d750d676fecd394ca858a5ee5896bb,8/8(金) 10:52
2025-08-08,20:08,TTL,総合,26,スポニチアネックス,44歳・壇蜜　「産んでないと非国民って言われるのなに？しょっちゅう言われるんだよね」苦言呈す,160,https://news.yahoo.co.jp/articles/af930e2b547d3c4f13eb27e0ce21a78596bca418,8/8(金) 15:31
2025-08-08,20:08,TTL,総合,27,女性自身,「ツッコまれたら“日和る”の繰り返し」神谷代表　宮城県知事との公開討論からも逃げ…参政党ウォッチャーが指摘する“ディフェンスの弱さ”,150,https://news.yahoo.co.jp/articles/08d1127a96550336e555a37f05c5eee9059f1d79,8/8(金) 11:00
2025-08-08,20:08,TTL,総合,28,デイリースポーツ,江川紹子氏　広陵高校の暴力事案で私見「一番気になるのは被害生徒が転校した、という点。なぜ…」,149,https://news.yahoo.co.jp/articles/3d0ae5dd8dc7187d481340b89b8d6b0b62f483d1,8/8(金) 15:51
2025-08-08,20:08,TTL,総合,29,女性セブンプラス,趣里、三山凌輝との結婚発表延期　父・水谷豊より難色を示したのは母・伊藤蘭、「彼だけはダメ」と頑なに反対か　白紙に戻る可能性も,143,https://news.yahoo.co.jp/articles/596097ae823a3ea2a4cf7bdda3cd2f3e37158a69,8/8(金) 11:00
2025-08-08,20:08,TTL,総合,30,産経新聞,「加害者扱い、即時撤回せよ」　辺野古ダンプ事故、抗議女性聴取でオール沖縄会議が声明,140,https://news.yahoo.co.jp/articles/b0bf02bc26f53fc5b372446d0eba3a338142829e,8/8(金) 17:19
2025-08-08,20:08,TTL,総合,31,琉球新報,「許可取ってこい」宮古島の陸自トップ、市民を恫喝　許可は不要、陸自側も申請なく訓練　沖縄,135,https://news.yahoo.co.jp/articles/8a5042a3b2dc93228602c0d43862d6c76e228b88,8/8(金) 15:11
2025-08-08,20:08,TTL,総合,32,週刊女性PRIME,実名告発「性被害に遭いました」広陵高校に“別の事案”が発覚、隠蔽体質を疑われる後手対応,135,https://news.yahoo.co.jp/articles/0741116e36c8bf461c58e6e796462df79ee89c0a,8/8(金) 17:01
2025-08-08,20:08,TTL,総合,33,日刊スポーツ,宮本慎也氏、夏の甲子園開催に異議「甲子園でやりたいのは痛いほど分かる」「心配なのは…」,130,https://news.yahoo.co.jp/articles/4c625546067f5e71919f305c9991213026cd5998,8/8(金) 11:25
2025-08-08,20:08,TTL,総合,34,J-CASTニュース,暴力事案に揺れる広陵高校、甲子園初戦突破で続く「いばらの道」　敗戦の旭川志峯「握手拒否」に賛否,130,https://news.yahoo.co.jp/articles/bb366024e9bd6d270b47de271a901d52f3c38ef8,8/8(金) 11:19
2025-08-08,20:08,TTL,総合,35,読売テレビ,【速報】維新“新たな共同代表”は幹事長経験者の藤田文武氏　参院選の結果を受け前原氏は辞任「厳しい党勢だが、再生させる」,116,https://news.yahoo.co.jp/articles/6291885a5ea12e5f11f92aa9ec636af9d9f3d37c,8/8(金) 14:44
2025-08-08,20:08,TTL,総合,36,スポニチアネックス,【甲子園】広陵巡り別の事案で情報提供　学校が第三者委を設置し調査中と日本高野連が発表,115,https://news.yahoo.co.jp/articles/df25a063e46c75a59b7408d465e2b26a11e7355f,8/7(木) 21:37
2025-08-08,20:08,TTL,総合,37,よろず～ニュース,百田尚樹氏、広島の碑文「過ち」巡り私見「人類が主語は後付けのこじつけ」「自虐史観のリトマス試験紙」,111,https://news.yahoo.co.jp/articles/612b0b7897c452bbfcbd62cf8e60b3845211ce5d,8/8(金) 14:35
2025-08-08,20:08,TTL,総合,38,東海テレビ,建築資材の高騰などで幻に…『キッザニア名古屋』の開業中止 港区の再開発エリアで建設検討も東邦ガス等が断念,108,https://news.yahoo.co.jp/articles/4b70429ce915254194fb37cda9e3cc1abd09b39d,8/8(金) 11:53
2025-08-08,20:08,TTL,総合,39,毎日新聞,逮捕した容疑者に暴行か　容疑で警部補2人を書類送検　群馬県警,108,https://news.yahoo.co.jp/articles/546a0fdd06c79bfded1e51257ad16677ee247a7d,8/8(金) 17:44
2025-08-08,20:08,TTL,総合,40,CBCテレビ,運転免許の学科試験で採点ミス  合格だった143人を不合格に…  マークシートで正解と不正解を誤って採点  愛知,108,https://news.yahoo.co.jp/articles/9378aad94bc2dea5091b8a14bd0318f0a4246fb9,8/8(金) 12:03
