scrp_date,scrp_time,genre_en,genre_jp,rank,media_jp,title,comment,link,date_original
2024-06-14,22:22,TTL,総合,1,オリコン,アンジャッシュ渡部建、活動再開後初の地上波TV生出演決定　TOKYO MX『5時に夢中！』登場へ,952,https://news.yahoo.co.jp/articles/b405b4732918a245c087f7e9f87ff6c4a8111d3c,6/14(金) 18:00
2024-06-14,22:22,TTL,総合,2,メ〜テレ（名古屋テレビ）,部活動で中学生が大けがするも顧問が救急対応を怠る　保護者に連れられ緊急手術　名古屋市,526,https://news.yahoo.co.jp/articles/fe52499f600ee61ae68092c6856399ffa99f90ae,6/14(金) 19:35
2024-06-14,22:22,TTL,総合,3,ABEMA TIMES,ディズニーは違う意味で“夢の国”になった？「入口ゲートを越えた瞬間、みんなスマホばっかり見ている」「家族4人バケパ利用で40万円は高すぎ」…懸念の声は人気ゆえ？ オリエンタルランドに聞いた,403,https://news.yahoo.co.jp/articles/820641b429afb7962a39668da5006cfad80a89b3,6/14(金) 8:30
2024-06-14,22:22,TTL,総合,4,テレビ朝日系（ANN）,【速報】バス車内で”刃物振り回す”　20代男性刺されけが　男を現行犯逮捕　中国人留学生どうしのトラブルか　東京・港区,305,https://news.yahoo.co.jp/articles/14ebe56c6ef5afec7c57bdde6d450d13df100078,6/14(金) 18:15
2024-06-14,22:22,TTL,総合,5,FNNプライムオンライン（フジテレビ系）,【独自】自民・岸田派が事務所をきょう閉鎖…5人の首相出した派閥が解散へ　派閥資金問題受けて,291,https://news.yahoo.co.jp/articles/2c6bc96eaeca14409c3a3ee7e8e3080ce4056951,6/14(金) 19:02
2024-06-14,22:22,TTL,総合,6,日刊スポーツ,蓮舫氏、連合東京の小池百合子知事支持報道に「内々に支援表明の労組ある」と主張　都知事選,270,https://news.yahoo.co.jp/articles/a1f1a7fd5ec16a05d92359344dea507337755377,6/14(金) 21:00
2024-06-14,22:22,TTL,総合,7,スポニチアネックス,【阪神・岡田監督語録】8回三振併殺のノイジーに怒!!「真っすぐ当たらへんねんもん。え？」,254,https://news.yahoo.co.jp/articles/0e52683340ca6735c535ab1bf78986ba2499b5ac,6/14(金) 21:43
2024-06-14,22:22,TTL,総合,8,沖縄タイムス,那覇市職員、メンタル不調で93人休職　「業務に対する不安」などが原因　2023年度、過去最多タイ,237,https://news.yahoo.co.jp/articles/f191a25b6356ba04c8ca3048871f70c3e958d8a6,6/14(金) 10:43
2024-06-14,22:22,TTL,総合,9,FNNプライムオンライン（フジテレビ系）,北朝鮮で撮影?金日成主席の石碑に墨汁かける動画がSNSに「世襲の命を絶つ」反金一族の団体が声明…活動活発化か,236,https://news.yahoo.co.jp/articles/9d677f5e1eeb2624f6631dc9a9e5cb712d073044,6/14(金) 18:52
2024-06-14,22:22,TTL,総合,10,毎日新聞,麻生、茂木両氏が会食　外遊中の首相けん制か、自民党総裁選控え,223,https://news.yahoo.co.jp/articles/2753e53bbef4d1d3f49b3fd9f6981f85db9a7767,6/14(金) 18:42
2024-06-14,22:22,TTL,総合,11,J-CASTニュース,点字ブロックふさいで演説、支援者装って撮影&投稿→議員「顔覚えてますし、対応考えます」　これは果たして「脅迫」なのか,211,https://news.yahoo.co.jp/articles/74510e0c4bf76a03dc75288d7dff51bcea555156,6/14(金) 12:00
2024-06-14,22:22,TTL,総合,12,デイリースポーツ,阪神　２年連続で交流戦負け越し決定　チグハグ攻撃で痛恨完封負け　９回で５度得点圏に走者進めるも…最後は佐藤輝が空振り三振で１４Ｋ,201,https://news.yahoo.co.jp/articles/ce4a7e254a83c84d8b7411ab9472396c0a5c0a6c,6/14(金) 21:02
2024-06-14,22:22,TTL,総合,13,スポニチアネックス,ヤクルト奥川恭伸が号泣ヒロイン「温かい声援…本当に…うれしかった…」長かった980日ぶり勝利,199,https://news.yahoo.co.jp/articles/152717d75a5ebaf134616fe7100b1773430a2cfe,6/14(金) 21:35
2024-06-14,22:22,TTL,総合,14,TBS NEWS DIG Powered by JNN,【広島】執念の延長戦勝利で今季最多タイ貯金7！矢野が11回1死三塁から決勝打 代走・羽月の三盗が効く 投手陣6人で無失点継投,196,https://news.yahoo.co.jp/articles/6342af47f7bfc711ec83c7e68ac8d9528e4fb79d,6/14(金) 21:27
2024-06-14,22:22,TTL,総合,15,デイリースポーツ,阪神・岡田監督「ミスばっかりや、なあ」試合中にサインの伝達ミス？「点なんか入るわけない。もう全然、そら」,188,https://news.yahoo.co.jp/articles/fffc2acbe9049768065413a3b38d9dba1fe58bad,6/14(金) 21:31
2024-06-14,22:22,TTL,総合,16,女性自身,粗品　“降参した宮迫”に次ぐ標的は「超大物芸能人」…“私怨”で続ける毒舌に「その内仕事無くなる」の声,175,https://news.yahoo.co.jp/articles/88973ef21380642b06916771a7108b68f9a5c3ea,6/14(金) 15:31
2024-06-14,22:22,TTL,総合,17,日刊スポーツ,【阪神】１発で同点やったけど…９回無死一塁で糸原健斗、前川右京、佐藤輝明の代打攻勢も実らず,174,https://news.yahoo.co.jp/articles/d226d6480dc7c831949bed01838b926cd5456eac,6/14(金) 21:21
2024-06-14,22:22,TTL,総合,18,ロイター,トヨタ、認証不正の3車種、7月も生産・出荷停止　調査継続で,168,https://news.yahoo.co.jp/articles/cbbe4da8ed86eac4093044635b3d7df3e5c1ffed,6/14(金) 17:48
2024-06-14,22:22,TTL,総合,19,日刊ゲンダイDIGITAL,マイナ保険証はトラブル続きなのに…河野デジタル相は紙廃止「問題なし」一点張りの厚顔不遜,165,https://news.yahoo.co.jp/articles/60b0866776c5cd3df043af34ef9ebdd199b1e985,6/14(金) 16:03
2024-06-14,22:22,TTL,総合,20,スポーツ報知,【広島】羽月の“神三盗”から矢野がＶ犠飛で延長戦を制す　７年ぶりの交流戦勝ち越しに王手,160,https://news.yahoo.co.jp/articles/db9c47261346329a3b7e6def434291bf5b739705,6/14(金) 21:32
2024-06-14,22:22,TTL,総合,21,共同通信,追加利上げ「あり得る」と総裁　円安けん制、日銀国債保有縮小へ,158,https://news.yahoo.co.jp/articles/53a24692ed3b094de14d79558e25e4b6c59e46ad,6/14(金) 17:33
2024-06-14,22:22,TTL,総合,22,週刊女性PRIME,「もう日本で投げたくないんだろうな」佐々木朗希、2度目の登録抹消に“気持ちはメジャー”を疑う声,154,https://news.yahoo.co.jp/articles/bece2883f9c8cafe507cc833d8799af3f71bf017,6/14(金) 11:51
2024-06-14,22:22,TTL,総合,23,女性自身,高学歴YouTuber 登録者100万越えYouTuberに暴行を受け緊急搬送されたと告白「数字持ってから言えよって」,151,https://news.yahoo.co.jp/articles/9fa4ea02a55033d5381ac28dd1710eb82a9b4c87,6/14(金) 16:55
2024-06-14,22:22,TTL,総合,24,日刊スポーツ,粗品、舌戦した宮迫博之への「恨み」を具体的告白　千原せいじ「それは腹立つなあ」,144,https://news.yahoo.co.jp/articles/e5bcadc69b56f8b6b0e912b23960fdca8d2b2b04,6/14(金) 12:59
2024-06-14,22:22,TTL,総合,25,SmartFLASH,橋下徹氏、時給2000円の万博スタッフ応募殺到に「雇用が生まれる！お金が回る！」大興奮も…「一瞬のバイトに意味ねえ」冷めた声,138,https://news.yahoo.co.jp/articles/47094f5d411dfae472c8d78730dfe4df4d00687e,6/14(金) 17:01
2024-06-14,22:22,TTL,総合,26,TBS NEWS DIG Powered by JNN,【中日】延長戦を制し連敗ストップ 10回に中田がV打 2失策＆3暴投とミス相次ぎ3度同点許すも執念 マルティネスが5年連続20S,125,https://news.yahoo.co.jp/articles/5f1b6f836309cfe2f21ad7735bc264a59979d6ad,6/14(金) 21:51
2024-06-14,22:22,TTL,総合,27,J-CASTニュース,対馬の神社が韓国人「出禁」表明→「韓国人はまったく来なくなりました」　迷惑行為沈静化で「衷心より御礼」,124,https://news.yahoo.co.jp/articles/e9708c6c05c0f186e85487204ec1079aa5a76dc4,6/14(金) 20:01
2024-06-14,22:22,TTL,総合,28,デイリースポーツ,阪神　９イニング中５度得点圏に走者置くも完封負け　計１４三振喫する悪夢　序盤の走塁ミス＆併殺打響く　交流戦負け越し決定,124,https://news.yahoo.co.jp/articles/7cc0b8d0d90dffdf7a3417d87b01dcdf7d83ed34,6/14(金) 19:45
2024-06-14,22:22,TTL,総合,29,TBS NEWS DIG Powered by JNN,東京大学の学生ら「教育の機会を閉ざすことに」学費の値上げ検討に抗議　運営費交付金の増額など国に対策求め要望書を提出,121,https://news.yahoo.co.jp/articles/23b58c0887e0ac958b5d7f29b85fea0e75ded5f7,6/14(金) 13:24
2024-06-14,22:22,TTL,総合,30,デイリースポーツ,ロッテ　悪夢の５連敗で交流戦負け越しが決定　延長十回、中田翔に決勝打を許す　大型連勝でスタートもまさかの展開,120,https://news.yahoo.co.jp/articles/6bf89a5b9e5385f947a976d9d5c257a5e0f2d163,6/14(金) 21:52
2024-06-14,22:22,TTL,総合,31,デイリースポーツ,広島　新井野球全開で延長戦制す　代走・羽月が決死の三盗→矢野犠飛で決勝点　交流戦勝率５割以上が確定,120,https://news.yahoo.co.jp/articles/dc7ad63abd777cd28305910de1733fd3fa733fc7,6/14(金) 21:29
2024-06-14,22:22,TTL,総合,32,時事通信,円急落、157円台後半　国債買い入れ、減額幅不明で　東京市場,119,https://news.yahoo.co.jp/articles/1c55eeecb522c81b9b5a158863a9531206fed7fc,6/14(金) 13:23
2024-06-14,22:22,TTL,総合,33,J-CASTニュース,「年金を一度も払っていなかった」人気YouTuber、還付金35万円が差し押さえに　3か所滞納で大ピンチ,116,https://news.yahoo.co.jp/articles/962594d39439807ce3101d82cf4f48b7b0fcf1a1,6/14(金) 18:26
2024-06-14,22:22,TTL,総合,34,OBS大分放送,熱中症で高齢男性が死亡　店舗駐車場の車内で意識不明の状態を従業員が発見　大分市は最高気温が31.7度,116,https://news.yahoo.co.jp/articles/4c74a7b9a342197b8a1cdf7535a02da3d82aaaa8,6/14(金) 20:13
2024-06-14,22:22,TTL,総合,35,産経新聞,名画に食べ物投げつけ、道路や橋を封鎖　環境活動家の「エコテロ」世界各国で相次ぐ,116,https://news.yahoo.co.jp/articles/426fe746fe35101f45b076e1e963d57534642ab2,6/14(金) 15:17
2024-06-14,22:22,TTL,総合,36,文春オンライン,蓮舫にうんざり！で大炎上　眞鍋かをりが週刊文春だけに語った「ココだけの話」,113,https://news.yahoo.co.jp/articles/741cfeb2469ca3923e5bc50e3f9052e31fa780a6,6/14(金) 6:12
2024-06-14,22:22,TTL,総合,37,TBS NEWS DIG Powered by JNN,眞鍋ジャパンのパリ五輪出場が決定！日本バレーボール協会が発表、2試合残し6大会連続切符に眞鍋監督「ホッとしています」,105,https://news.yahoo.co.jp/articles/c600db29c36c7bdf1b8457a3cc9e13348c6f7155,6/14(金) 14:02
2024-06-14,22:22,TTL,総合,38,OBS大分放送,顔を押さえつけて暴行　2歳の女の子が窒息死　傷害致死の疑いで25歳の男を逮捕　大分,103,https://news.yahoo.co.jp/articles/12ed89a335085829121b6e1f3c01d30fca03d80a,6/14(金) 16:08
2024-06-14,22:22,TTL,総合,39,スポーツ報知,【オリックス】交流戦優勝が消滅…７連勝から２連敗　カスティーヨの奮闘実らず,101,https://news.yahoo.co.jp/articles/5905e087fbea7935a3106847ea17a5da57e488b8,6/14(金) 21:23
2024-06-14,22:22,TTL,総合,40,共同通信,日銀、国債購入減を決定　「量的引き締め」にかじ,99,https://news.yahoo.co.jp/articles/57cdb420c6db660e66531d9f5df1ae3d8c584cc4,6/14(金) 12:24
