scrp_date,scrp_time,genre_en,genre_jp,rank,media_jp,title,comment,link,date_original
2024-08-14,04:06,business,経済,1,ABEMA TIMES,“生卵投げつけ女”による4年間毎日続いた嫌がらせ「1日2パック」「原因わからず」被害女性が語る苦悩の日々,175,https://news.yahoo.co.jp/articles/8cf29b182f6eda4783adf1447fd0feed9d16f093,8/13(火) 6:50
2024-08-14,04:06,business,経済,2,読売新聞オンライン,東京・目黒の住宅で男女２人が死亡、熱中症か…窓閉まり扇風機回っていたがエアコン作動しておらず,102,https://news.yahoo.co.jp/articles/3cd6ce19db120f7752a9bf07c5f27121f1594bad,8/13(火) 16:28
2024-08-14,04:06,business,経済,3,MBSニュース,【速報】東海道新幹線で計画運休や運転見合わせの可能性　16日～17日にかけて　台風7号の影響　列車の遅れの可能性も,80,https://news.yahoo.co.jp/articles/7e9d7777aeba93bd6f343aa5adc2879ab793f2df,8/13(火) 18:22
2024-08-14,04:06,business,経済,4,朝日新聞デジタル,メルカリ営業益は過去最高 　米国事業は「越境取引」強化でてこ入れ,58,https://news.yahoo.co.jp/articles/63d6724604b0ae0ae68c81b2a181d17c524ae193,8/13(火) 17:15
2024-08-14,04:06,business,経済,5,TBS NEWS DIG Powered by JNN,株価暴落前の水準に戻した日経平均株価　1200円以上値上がりして3万6000円台を回復 背景には「円キャリー取引」,48,https://news.yahoo.co.jp/articles/b111fb2ecbdecc819e53d0c1e9de33de6a9831fd,8/13(火) 15:03
2024-08-14,04:06,business,経済,6,TBS NEWS DIG Powered by JNN,【速報】13日東京株式市場　日経平均株価　一時1000円超上昇し3万6000円台回復　NYハイテク株上昇うけて半導体関連銘柄が買われる,46,https://news.yahoo.co.jp/articles/b06885b200b4db814632c3eb22430f51d7723c31,8/13(火) 9:09
2024-08-14,04:06,business,経済,7,東洋経済オンライン,「(芸人仲間は)この件とは関係ありません」。「やす子への公開暴言」で活動休止のフワちゃん。謝罪投稿に見えた「無邪気」という”危うさ”,42,https://news.yahoo.co.jp/articles/ba60684f48af9fc25f7fabafbb5018c7a88bc7a8,8/13(火) 11:56
2024-08-14,04:06,business,経済,8,プレジデントオンライン,なぜ日本はここまで貧乏な国になったのか…安倍晋三氏から相談を受けていた筆者が思う「アベノミクスの壮大な失敗」,40,https://news.yahoo.co.jp/articles/11874d175119f63fd3fbf6dc20728f16871c28f3,8/13(火) 8:17
2024-08-14,04:06,business,経済,9,AERA dot.,“張りぼての株価”は小康状態のあと「またドーンと大きく下げる」　長期投資家・澤上篤人さんが「相場から離れるべき」と警告する理由,37,https://news.yahoo.co.jp/articles/db0bf289953aa0208974d3968b59351826973dc2,8/13(火) 17:32
2024-08-14,04:06,business,経済,10,ABEMA TIMES,最大の理由は「恐怖」！？ブラックマンデー超えの株価大暴落…まだ終わってない？経済評論家がざっくり解説,36,https://news.yahoo.co.jp/articles/3616b637bb7c6080fe9ac324545198a3de31c759,8/13(火) 6:50
2024-08-14,04:06,business,経済,11,読売新聞オンライン,日経平均株価、一時１０００円超上昇…３万５９００円台を推移,29,https://news.yahoo.co.jp/articles/986a9041d5f46a9453aa5d36fdb7ec58e099f985,8/13(火) 9:07
2024-08-14,04:06,business,経済,12,乗りものニュース,「新幹線が通っているのに駅がない」唯一の県とは 通過に誰も気づかない!?  素通り阻止する“新駅構想”も,28,https://news.yahoo.co.jp/articles/57d397763c75b719511c211026150a03c6a4d7bc,8/13(火) 8:42
2024-08-14,04:06,business,経済,13,ロイター,海外勢、日本株に弱気に転じる　乱高下受け,27,https://news.yahoo.co.jp/articles/c353099d85be24e8d2cfc9a27a4215a2506a555e,8/13(火) 15:57
2024-08-14,04:06,business,経済,14,現代ビジネス,進学のタイミングで若者がいなくなる「100万都市」の現実,22,https://news.yahoo.co.jp/articles/39bd2f0876d528f3cf649c73d53ffc716873c376,8/13(火) 6:30
2024-08-14,04:06,business,経済,15,MBSニュース,【速報】小林製薬　新たに11人分の死亡疑い事例の報告漏れ発表「紅麹サプリ」巡る問題　社長が会見で謝罪「確認体制に不備…申し訳ございません」,22,https://news.yahoo.co.jp/articles/b66e59152ccb00b2fe5f64505e030288cc185c8b,8/13(火) 16:05
2024-08-14,04:06,business,経済,16,MBSニュース,【速報】「プッチンプリン」販売再開を江崎グリコ発表　8月13日以降、順次店頭に「お帰りなさい」「夢に見るほど待っていました」SNSに再開を喜ぶ声も,20,https://news.yahoo.co.jp/articles/84baa1e51e90fa1cdb96dad720c0b6c6c9a803d6,8/13(火) 11:35
2024-08-14,04:06,business,経済,17,みんかぶマガジン,「フランス人よ、恥を知れ！」”最悪の大会”に各国疑問…セーヌ川レース、カナダ「10回嘔吐」、ポルトガル「2人胃腸感染症」、ベルギー「水質問題は？」,16,https://news.yahoo.co.jp/articles/80e1f583c7a0a43ed155b4334087c40b53bc9fbf,8/13(火) 9:10
2024-08-14,04:06,business,経済,18,WEB CARTOP,大型免許にAT限定導入でドライバーが増える……とはいかない？　そんなに簡単じゃない大型ATトラックの運転,16,https://news.yahoo.co.jp/articles/b7ad4c6e83bdf64385bb5dc83d9be7d3ebf74a21,8/13(火) 20:10
2024-08-14,04:06,business,経済,19,読売新聞オンライン,ＮＹダウは３営業日ぶり反落、１４０ドル安の３万９３５７ドル…地政学リスク高まりを嫌気,15,https://news.yahoo.co.jp/articles/75e7f81e32fe32ec451f6b21adec01c347185da3,8/13(火) 5:33
2024-08-14,04:06,business,経済,20,マネーポストWEB,《人気凋落に歯止め？》パチンコ・パチスロ人口が昨年の過去最低から回復傾向　スマスロではヒット機種が続々登場、広告宣伝のルール緩和も追い風に,15,https://news.yahoo.co.jp/articles/04dfe5fd01ec47ff0e5080c8f0a55da1a736d5cd,8/13(火) 16:15
2024-08-14,04:06,business,経済,21,ベストカーWeb,なんか効率悪くね? 0.5刻みで良くない? 半端な排気量のエンジンはナゼ載せられるのか,13,https://news.yahoo.co.jp/articles/9811a26d44caf4b170a9761af0d8cc1ada397695,8/13(火) 21:00
2024-08-14,04:06,business,経済,22,プレジデントオンライン,「ダメだこの人、なんで管理職になれたんだ？」50代のダメ上司が無能ぶりをフルに発揮している歴史的理由,13,https://news.yahoo.co.jp/articles/caf586863a2c7f3f009226c25fd734f341d204b9,8/13(火) 7:17
2024-08-14,04:06,business,経済,23,Bloomberg,ウクライナの越境攻撃、ロシア動揺狙い複数の選択肢から実行－当局者,11,https://news.yahoo.co.jp/articles/d083702a4a2c4bca522000c30747783ea4276990,8/14(水) 2:07
2024-08-14,04:06,business,経済,24,東洋経済オンライン,「夫婦じゃなくて親子に見える」 “花王ハミングのPR動画が炎上”への強烈な違和感ーーまたSNS上で“エア炎上”が起こっているのか？,10,https://news.yahoo.co.jp/articles/5d1cec9f16f576b0ed983515f515c920c55b7f76,8/13(火) 12:17
2024-08-14,04:06,business,経済,25,FNNプライムオンライン（フジテレビ系）,【速報】日経平均株価1207円超高で取引終了し3万6000円台回復…今週は「波乱含みとなるリスクも」市場関係者指摘,9,https://news.yahoo.co.jp/articles/5746e5bf619819d34039c315cffce3f4b15a1dc8,8/13(火) 15:17
2024-08-14,04:06,business,経済,26,時事通信,日経平均、1100円超高＝東京株式,9,https://news.yahoo.co.jp/articles/efc1bab0b951ba15413508df796778ec0eacccb5,8/13(火) 14:00
2024-08-14,04:06,business,経済,27,NRI研究員の時事解説,"南海トラフ地震への警戒が経済に悪影響：旅行関連消費は1,964億円程度減少も",9,https://news.yahoo.co.jp/articles/b56cb600247bfe5b66bfae49dba5ea291c9f00f3,8/13(火) 8:35
2024-08-14,04:06,business,経済,28,ベストカーWeb,[ヤリスクロス]の燃費が反則レベル!? [ガソリン]でも燃費が良すぎるコンパクトSUVを一気見,8,https://news.yahoo.co.jp/articles/fa2e1c522da27eea4956625764ef607a3a6f8380,8/13(火) 19:00
2024-08-14,04:06,business,経済,29,ABEMA TIMES,「パチンコ店で涼んで！」全日遊連がポスター作成し“酷暑の避難場所“として呼びかけ,8,https://news.yahoo.co.jp/articles/a53a521b635185be9bc3fb45fd3690450757c4d1,8/13(火) 7:06
2024-08-14,04:06,business,経済,30,読売新聞オンライン,日経平均終値は急騰、前週末比１２０７円高の３万６２３２円…史上最大の下落から幅広く買い戻し,7,https://news.yahoo.co.jp/articles/207b72bcbe562b64c5930917948ca4c7f094fe01,8/13(火) 14:52
2024-08-14,04:06,business,経済,31,LIMO,【厚生年金】8月15日の年金支給日に「30万円（月額15万円）」が振り込まれる人の現役時代の年収はいくら？,7,https://news.yahoo.co.jp/articles/9280c35b453571efbfcd7b9748b7d7f321c386b7,8/13(火) 4:52
2024-08-14,04:06,business,経済,32,現代ビジネス,堀江貴文「子どもを不幸にする”教師ガチャ”を一瞬で解決」…誰でもどこでも「いい授業」を受けられる方法,7,https://news.yahoo.co.jp/articles/8fd61a65989cad174d5021bbf9a2c20d95b38f76,8/13(火) 8:00
2024-08-14,04:06,business,経済,33,くるまのニュース,MTあり！ スバル新型「スポーツカー」に大反響！ 「かなり良い！」「トルクが違う！」新型「BRZ」に称賛の声！ 何が変わった？,7,https://news.yahoo.co.jp/articles/001609eabdaeb771cb008c71701370f6f1552301,8/13(火) 20:10
2024-08-14,04:06,business,経済,34,朝日新聞デジタル,日銀総裁、株価の乱高下どう説明？　23日に衆院財務金融委開催へ,7,https://news.yahoo.co.jp/articles/92cf3f85af0fb93185fc697ddf94a987422fc536,8/13(火) 17:00
2024-08-14,04:06,business,経済,35,日テレNEWS NNN,日経平均株価、上げ幅1200円超　“大暴落”前の水準を1週間で回復,6,https://news.yahoo.co.jp/articles/9fd79ec662bd04158aa392857136683f99b49f2a,8/13(火) 16:44
2024-08-14,04:06,business,経済,36,ダイヤモンド・ザイ,令和のブラックマンデー到来、今後のマーケットは？戻り基調だが、二番底含めてボラの激しい展開続く。米利下げ開始による金融相場到来で上昇トレンドに,6,https://news.yahoo.co.jp/articles/5a9f71cb39da565437d5c5baba16a90c955fb849,8/13(火) 21:01
2024-08-14,04:06,business,経済,37,現代ビジネス,遠からず日経平均は再び「4万円」を超え、それが「底値になる」…！今回の急落が「株買い増し」千載一遇の好機といえるワケ,6,https://news.yahoo.co.jp/articles/76dac363d5a3df89633cac8ac794bc79447c5757,8/13(火) 6:04
2024-08-14,04:06,business,経済,38,乗りものニュース,「新基準原付？税金は『自動二輪』ですよ」 ユーザーが望まない“原付消滅” 税負担だけアップ!? 分厚い“縦割りの壁”,6,https://news.yahoo.co.jp/articles/38833ad59ebf1665f5e4cea23f56967e32224455,8/13(火) 9:42
2024-08-14,04:06,business,経済,39,FNNプライムオンライン,お墓参りする人が減少　熱心に墓掃除するのは「代行サービス」　「墓じまい」の申し込みが数年前の10倍近くという業者も,6,https://news.yahoo.co.jp/articles/dacbfda4061a8aa40f26d0ce367e380f1d32c8a8,8/13(火) 19:13
2024-08-14,04:06,business,経済,40,くるまのニュース,日産「キューブ」まもなく復活!? ニッサンの「“コンパクト”ミニバン」いつ出る？ ホンダとの“関係強化”で高まる可能性とは,6,https://news.yahoo.co.jp/articles/c62f354194d038a277964571adf4e5b6feb0ea63,8/13(火) 19:10
