scrp_date,scrp_time,genre_en,genre_jp,rank,media_jp,title,comment,link,date_original
2025-11-02,03:09,TTL,総合,1,OBS大分放送,岩屋前外相が新政権に注文「石破政権の熟議の政治受け継いで」,834,https://news.yahoo.co.jp/articles/59a07cee4c2ad90c7a044d88d7657bf2b9eb53db,11/1(土) 15:35
2025-11-02,03:09,TTL,総合,2,オリコン,松本人志、1年10ヶ月ぶり活動再開で感極まる「松本動きました」　『DOWNTOWN＋』始動,525,https://news.yahoo.co.jp/articles/42e3314fd51f5d608e0a933b27fa0c560ee179cd,11/1(土) 22:44
2025-11-02,03:09,TTL,総合,3,産経新聞,「もう始まった…」石破氏が「後ろから鉄砲」解禁か　高市政権批判も党内「丁寧な無視で」,506,https://news.yahoo.co.jp/articles/301375e15ecf5296be3ab81ce8103e0fbebd4512,11/1(土) 7:00
2025-11-02,03:09,TTL,総合,4,スポーツ報知,ダウンタウン・松本人志、復帰　１年１０か月ぶりの公の場　「ＤＯＷＮＴＯＷＮ＋」生配信登場,490,https://news.yahoo.co.jp/articles/67ee12773d7cd9ffa5642924672e823f56bfc291,11/1(土) 21:02
2025-11-02,03:09,TTL,総合,5,スポニチアネックス,維新市議「今すぐクマを絶滅させるべき」に批判も…「私は失言ではなく名言だったと思う」と主張曲げず,313,https://news.yahoo.co.jp/articles/c8981af2a04369661f1f25ba8e504c81a0a8d2c5,11/1(土) 19:40
2025-11-02,03:09,TTL,総合,6,共同通信,高市首相、台湾代表と会談　握手写真を投稿、中国は抗議,304,https://news.yahoo.co.jp/articles/d0e8f258931ad76c84c998b4ea74ddec0e618acb,11/1(土) 23:36
2025-11-02,03:09,TTL,総合,7,TBS NEWS DIG Powered by JNN,高市総理「今は解散について考える暇はない」支持率高水準でも,212,https://news.yahoo.co.jp/articles/7a5e55e800eea898511f1497c096c9b8ba46b984,11/1(土) 19:08
2025-11-02,03:09,TTL,総合,8,毎日新聞,岩屋前外相「人気取りのための定数削減は乱暴」　衆院巡る自維合意に,203,https://news.yahoo.co.jp/articles/fbbbcc1e1e05511f56d5e1a09c8fcc10ca94db5b,11/1(土) 14:07
2025-11-02,03:09,TTL,総合,9,静岡新聞DIGITAL,【伊東市長失職】わずか5カ月で退場　成果、説明なく混乱や不安残し　退職金は192万円,190,https://news.yahoo.co.jp/articles/f1271e2c56994cbae9978bd2210043ad457d64d6,11/1(土) 8:33
2025-11-02,03:09,TTL,総合,10,デイリースポーツ,【高市自民】緊急事態　与党トップが不審カネ疑惑で釈明会見へ　維新吉村代表が「連休明けに説明させます」　本人「適法」も橋下氏が怒涛追及「公金で身内の会社に仕事発注を許すのか！」,186,https://news.yahoo.co.jp/articles/be5d6f483a98d816db79b569320e2d6d1dc4db0e,11/1(土) 17:30
2025-11-02,03:09,TTL,総合,11,デイリースポーツ,【高市自民】「ええっ！」ＴＶ騒然　自維の合意書に堂々書いてある衝撃の軍事武器の名前→高橋洋一氏「高市さん、トランプに言ってんじゃないか？」　公明なら絶対反対　藤井教授も「１００％無理だった話が」,184,https://news.yahoo.co.jp/articles/7599e0a2c862fac9c10135577e904cb31545d5ba,11/1(土) 21:24
2025-11-02,03:09,TTL,総合,12,スポーツ報知,国政復帰の蓮舫氏　印象違う！キュートな姿「美人」「素敵ですね」「お肌も綺麗」猫とたわむれる,178,https://news.yahoo.co.jp/articles/89771daa5831ac1ef22894f172325ece98accc24,11/1(土) 20:55
2025-11-02,03:09,TTL,総合,13,日刊スポーツ,共産党43歳女性元議員、高市早苗氏めぐり「現地妻という悲しい言葉を思い出す」投稿で意見続々,138,https://news.yahoo.co.jp/articles/c8581f21509d9bb3768b8c9e3960d38721645979,11/1(土) 13:03
2025-11-02,03:09,TTL,総合,14,毎日新聞,高市首相が日韓首脳会談で太極旗に一礼　「異例だ」韓国で注目集める,138,https://news.yahoo.co.jp/articles/c8c0687b12824523a6102745a7b1d2fd913e1aee,11/1(土) 8:19
2025-11-02,03:09,TTL,総合,15,テレビ静岡NEWS,新東名で死亡ひき逃げ　静岡県警が飲食店経営の40歳男を緊急逮捕　帰宅後に自ら110番「新東名でモノにぶつかる事故を起こした」現場の破片は男の車と一致　車外にいたトラック運転手の55歳男性が死亡,135,https://news.yahoo.co.jp/articles/6fe1c5807a9727595b1479cef072dfa3e3317438,11/1(土) 21:58
2025-11-02,03:09,TTL,総合,16,中日スポーツ,高市早苗首相、「強い相手に媚びへつらうことでは…」外交姿勢に小沢一郎議員は苦言 「呆れ返るのは」,131,https://news.yahoo.co.jp/articles/00b6a48c74868218ad39ea659688de06ab04c2c6,11/1(土) 12:05
2025-11-02,03:09,TTL,総合,17,スポーツ報知,ドジャースが接戦制し逆王手、グラスノー神救援で勝負は第７戦へ　山本由伸６回１失点、大谷翔平３戦ぶり安打,131,https://news.yahoo.co.jp/articles/09dd331d90893a04a9b3a8c654c41feb38afe944,11/1(土) 12:11
2025-11-02,03:09,TTL,総合,18,読売新聞オンライン,高羽悟さん「自分の知人だったので、奈美子に悪いなと思う」…妻殺害２６年後の容疑者逮捕に涙,129,https://news.yahoo.co.jp/articles/04d9487a3f364bce049f464f03c65bd358a10e1d,11/1(土) 20:26
2025-11-02,03:09,TTL,総合,19,テレビユー山形,南陽市でクマ警戒中の市職員がクマに襲われる　突然やぶからクマが…自治体職員のリスクも国が考える段階か（山形）,129,https://news.yahoo.co.jp/articles/d397652a5d02dfa7205f425e8a8d91acd0fa3079,11/1(土) 9:32
2025-11-02,03:09,TTL,総合,20,FNNプライムオンライン,「クマをなぜ殺す」「山に帰せたのでは」“出没件数”過去最多の新潟　“最大級の警戒”呼びかけも駆除後に問い合わせや批判の電話,124,https://news.yahoo.co.jp/articles/a22fe5c3f5cc3920d4f76d734a44d6595fa5db29,11/1(土) 20:00
2025-11-02,03:09,TTL,総合,21,スポニチアネックス,ソフトバンク山川　来季に向け大人気の「どすこい」パフォーマンス封印し打撃復調狙う,116,https://news.yahoo.co.jp/articles/b2fee6a5d1f7f90e33d926c8c899ce13cbe9c2af,11/1(土) 13:05
2025-11-02,03:09,TTL,総合,22,J-CASTニュース,「オーバーツーリズム対策に外国人から入国税を」　国民民主・古川代表代行が主張「税額も1000円から引き上げていい」,109,https://news.yahoo.co.jp/articles/d0be6f47a4626dd7b92aaaeb5086db6fe00b9025,11/1(土) 17:50
2025-11-02,03:09,TTL,総合,23,デイリースポーツ,維新吉村代表「すごいな」東洋大学歴騒動の市長に→退職金１９２万円報道に衝撃「これで退職金」維新はゼロか半減公約、吉村知事は１億２千万円→０円と,102,https://news.yahoo.co.jp/articles/7661ff22e5516a01af32e0e13d0b82ae26a122b3,11/1(土) 16:42
2025-11-02,03:09,TTL,総合,24,読売新聞オンライン,高市首相「解散について考えている暇はない」…韓国・慶州で内外記者会見,100,https://news.yahoo.co.jp/articles/b7e8e15f1a911093986449faa1872e0879524df4,11/1(土) 17:52
2025-11-02,03:09,TTL,総合,25,FNNプライムオンライン（フジテレビ系）,DNA型提出拒むも一転…10月に任意の提出に応じていた安福久美子容疑者（69）今年に入り複数回任意で話聞く　26年前の名古屋主婦殺害事件,96,https://news.yahoo.co.jp/articles/0ecb4378d234120aa2bbe47abe972bf2a61777b7,11/1(土) 12:00
2025-11-02,03:09,TTL,総合,26,時事通信,軍事活動拡大に懸念伝達　小泉氏、中国国防相と初会談,96,https://news.yahoo.co.jp/articles/78e7a75b9709c3f5e5202f47e77cc38a097a5ba6,11/1(土) 19:56
2025-11-02,03:09,TTL,総合,27,Full-Count,佐々木朗希が安堵「助かったと思った」　ピンチで降板→劇的勝利で“逆王手”…試合後に本音,95,https://news.yahoo.co.jp/articles/ef2190e687d9aeb948393a144175b777f6cf4d91,11/1(土) 12:56
2025-11-02,03:09,TTL,総合,28,カナロコ by 神奈川新聞,「クマだって人間を避けて生きたいんだ」　餌得られる山に、神奈川の猟師が奔走　相次ぐ人身被害に危機感,95,https://news.yahoo.co.jp/articles/452f775f61e5257e80bc91bb60eaa02b4e3bd3c8,11/1(土) 23:10
2025-11-02,03:09,TTL,総合,29,日刊スポーツ,小沢一郎氏、高市首相の外交に痛烈苦言「呆れ返るのは…」「外交は媚びへつらうことではない」,89,https://news.yahoo.co.jp/articles/e000dd3574a6e37d1ad369d098d2edbfd9519af0,11/1(土) 7:15
2025-11-02,03:09,TTL,総合,30,福島民友新聞,クマ遭遇の恐れ考慮...福島・学法石川が東北高校駅伝辞退　会場の秋田で出没相次ぐ,87,https://news.yahoo.co.jp/articles/5bf638298bd45d11d3cb688cfb95d110859f66b5,11/1(土) 12:24
2025-11-02,03:09,TTL,総合,31,文春オンライン,《卒アル入手》「クラスに目立たない子が多い中で感じは良かった」名古屋主婦殺害・安福久美子容疑者（69）の高校時代の素顔,86,https://news.yahoo.co.jp/articles/feceecc7a5d0ff5e70a16b0e9ca463a49cd8603b,11/1(土) 21:15
2025-11-02,03:09,TTL,総合,32,岩手めんこいテレビ,「顔が血だらけで真っ赤に」狩猟中のハンターが山中でクマに襲われる　猟友会70代男性が顔面に大けが　岩手・大槌町,83,https://news.yahoo.co.jp/articles/88eef41abbd24a519cfd9a6c5bb8e148aaa960c4,11/1(土) 18:48
2025-11-02,03:09,TTL,総合,33,TBS NEWS DIG Powered by JNN,【日韓】韓国・李大統領「高市総理は立派 心配事消えた」日韓関係の未来に期待感　高市総理の地元・奈良訪問にも意欲,79,https://news.yahoo.co.jp/articles/be44c44d9fd92a0d473fd1279647fac536cc3636,11/1(土) 14:57
2025-11-02,03:09,TTL,総合,34,読売新聞オンライン,公明、与党と「距離」か…高校無償化巡り正式合意加わらず…自民中堅「これまで３党で協議してきたのに」,78,https://news.yahoo.co.jp/articles/83d2c64d870b8b5a5819314b87993de97d398fc2,11/1(土) 6:28
2025-11-02,03:09,TTL,総合,35,時事通信,家計負担、7600円軽減　恩恵に地域差、脱炭素逆行も　ガソリン暫定税率廃止,77,https://news.yahoo.co.jp/articles/f0be4bd0398da8a3a33b60c940c03f1ddc75fad6,11/1(土) 7:08
2025-11-02,03:09,TTL,総合,36,スポニチアネックス,ドジャース連覇へ逆王手！山本由伸が6回1失点と崖っ縁で好投「プレッシャーあったけど全力で投げました」,75,https://news.yahoo.co.jp/articles/5a692b15916efd146a91fb8cca0e6143dfe354af,11/1(土) 12:13
2025-11-02,03:09,TTL,総合,37,日テレNEWS NNN,山下公園近くの海に上半身だけの遺体　横浜市,73,https://news.yahoo.co.jp/articles/1b288f5190cc028f2fb3988a22761d4b59ae9e5f,11/1(土) 16:40
2025-11-02,03:09,TTL,総合,38,女性自身,「自分が増税したのに？」「今更どの口が」立憲・野田代表が“食料品の消費税ゼロ法案“提出に不満続出,72,https://news.yahoo.co.jp/articles/ce4a6daaa52772bbb9e0026540356b6c0bf310db,11/1(土) 16:14
2025-11-02,03:09,TTL,総合,39,デイリースポーツ,【高市自民】与党衝撃　維新トップが不審カネ疑惑で会見する事態→なぜか元気がない野党に橋下氏「同じ事やってるのか？」　公金で秘書の会社に仕事発注と怒涛追及→「身内猛批判」と報じられ「僕は身内ではない」,72,https://news.yahoo.co.jp/articles/3ac89145fdd88169f38d428426799ac54d1d2dfc,11/1(土) 23:25
2025-11-02,03:09,TTL,総合,40,スポニチアネックス,田久保まき氏、Xプロフィールを「元伊東市長」に変更　退職金192万円が支給,71,https://news.yahoo.co.jp/articles/c79e556914b1e9496aa9e6659d223660fac8ea3d,11/1(土) 17:56
