scrp_date,scrp_time,genre_en,genre_jp,rank,media_jp,title,comment,link,date_original
2025-03-18,02:07,business,経済,1,FNNプライムオンライン（フジテレビ系）,【速報】スーパーの米価格初の4000円超え　備蓄米放出も10週連続の値上がり　農林水産省,340,https://news.yahoo.co.jp/articles/75e7d3def99206397c8163a4adfb2e686c7a62c4,3/17(月) 16:55
2025-03-18,02:07,business,経済,2,朝日新聞,JA全農、備蓄米販売で利益とらず　「備蓄米と表示しないで」要請も,330,https://news.yahoo.co.jp/articles/e50b01ef767807ad4ca79b2feb0f80b12d5efc80,3/17(月) 18:49
2025-03-18,02:07,business,経済,3,読売新聞オンライン,コメ高騰、備蓄米放出は「不足分補うだけで値下がり期待できず」…生産量不足の見方も,92,https://news.yahoo.co.jp/articles/1616aca92e439d74979b49c4867f7089b10b6ee7,3/17(月) 8:51
2025-03-18,02:07,business,経済,4,産経新聞,万博前売り券「1021万枚」、実売数に修学旅行など加える　十倉会長「愛知博上回った」,87,https://news.yahoo.co.jp/articles/bacadc11f5bfec72ba0009f4973c880a773ed9f3,3/17(月) 19:29
2025-03-18,02:07,business,経済,5,マネーポストWEB,【「年収の壁」引き上げが「123万円」に値切られた背景】物価上昇率を論拠に持ち込んだ財務省、“物価はそんなに上がっていないから、課税最低限も少しだけ上げればいい”の主張か,47,https://news.yahoo.co.jp/articles/26ec84ac44d25ccd88a853d8b4c9f047889742dd,3/17(月) 7:13
2025-03-18,02:07,business,経済,6,プレジデントオンライン,だから「一軒家よりマンション派」が増えている…戸建購入者が覚悟しておくべき決定的デメリット,41,https://news.yahoo.co.jp/articles/85edb249a55f5b3e9855d42bea3fcb1a19ffba3f,3/17(月) 18:17
2025-03-18,02:07,business,経済,7,日テレNEWS NNN,飲食店“悲鳴”…コメ価格 「最高値」更新　5キロ4000円台に…「備蓄米」流通で変化は？,39,https://news.yahoo.co.jp/articles/e09c427b51509d634142d34ba1c12c7c3311635d,3/18(火) 0:49
2025-03-18,02:07,business,経済,8,ABEMA TIMES,コメの平均価格4000円超え 2024年のほぼ2倍,37,https://news.yahoo.co.jp/articles/ef936c8a2c1d9895fbb41dea502516be2ab9b599,3/17(月) 23:39
2025-03-18,02:07,business,経済,9,東洋経済オンライン,「コンサル覆面座談会」 コンサル会社は天国か？地獄か？　最高年収4000万円、“上司ガチャ”、余剰なコンサル,37,https://news.yahoo.co.jp/articles/213b69e4b1f03b1d07506bf91908df3dab9f34da,3/17(月) 5:32
2025-03-18,02:07,business,経済,10,マネーポストWEB,パチスロ新機能「ボーナストリガー」の全容が判明　ユーザーからは「“即ヤメ勝ち逃げ”がしやすくなる」「パチンコと同じような感覚で楽しめそう」の声、業界活性化への期待も,35,https://news.yahoo.co.jp/articles/67e0751c9d5ed141408a6c00ff64a6ebf9df470a,3/17(月) 16:15
2025-03-18,02:07,business,経済,11,乗りものニュース,「左折のみ」の駐車場出口で「意地でも右折しようとするクルマ」が邪魔です。何を考えているのでしょうか？,34,https://news.yahoo.co.jp/articles/47b191b5aaed33b511376a9a2819cabe9f193f77,3/17(月) 9:42
2025-03-18,02:07,business,経済,12,みんかぶマガジン,橋下氏に代表復帰してほしい…維新ガバナンス委員・竹中平蔵が大学無償化に大反対「今の維新は意思決定がうまくできない」,28,https://news.yahoo.co.jp/articles/07e1ac469e58e603ab175a9df06dfb75add0b1b6,3/17(月) 9:10
2025-03-18,02:07,business,経済,13,みんかぶマガジン,コメの高騰「自民党の2枚舌」が原因だった！日本の農家を騙し続け、消費者を叩く「日米交渉もほぼやらせ」,27,https://news.yahoo.co.jp/articles/a8cc9263e692000e643c93b7c616e89321a0eeea,3/17(月) 9:10
2025-03-18,02:07,business,経済,14,食品新聞,キリン、紅茶を飲まない人を取り込むために「午後の紅茶」でタンブラー施策　「個性の時代」に着目してアイスティー訴求を後押し,24,https://news.yahoo.co.jp/articles/b735e774a78d233642eee0d5ad95c4ce66297c72,3/17(月) 22:52
2025-03-18,02:07,business,経済,15,日テレNEWS NNN,JA全農、備蓄米「落札金額に最低限の費用のみ加えて販売」,23,https://news.yahoo.co.jp/articles/de389ce3c3b1c749960564578cb792ac4234d56c,3/17(月) 16:44
2025-03-18,02:07,business,経済,16,THE GOLD ONLINE（ゴールドオンライン）,"もう、無理…世帯年収1,480万円の30代パワーカップル「7,500万円の住宅ローン」で千葉県・始発駅近くのタワマンを購入「順調そのもの」だったが…2年後に発覚した“まさかの事実”に悲鳴【FPが解説】",22,https://news.yahoo.co.jp/articles/dc4efb997b43803218df488175b94a464334ce02,3/17(月) 10:32
2025-03-18,02:07,business,経済,17,TBS NEWS DIG Powered by JNN,4月も“値上げラッシュ”に…調味料など4100品目以上 値上げ見通し　牛丼 450円→480円も【Nスタ解説】,22,https://news.yahoo.co.jp/articles/b9cb59b57910e6d3cb863db8d15a04f9c1b438d6,3/17(月) 22:19
2025-03-18,02:07,business,経済,18,JBpress,米価高騰に鈍感な石破内閣が残念なほど理解していない「日本人の心情」,21,https://news.yahoo.co.jp/articles/7a70d9f91ebb8f90b5c7581d087e28cc28c9e72f,3/17(月) 14:02
2025-03-18,02:07,business,経済,19,ベストカーWeb,これぞ日産の本気か!? まもなく発売される新型EV[N7]の性能がぶっ飛んでる件!!!,20,https://news.yahoo.co.jp/articles/557ab169bfe6b60352fd94fc2e1d642ab467d7d8,3/17(月) 23:00
2025-03-18,02:07,business,経済,20,東洋経済オンライン,「新人議員くんね、商品券を10万円分あげよう」→「法的に問題ない」はなぜ悪手だったか。石破首相「ねっとり構文」が不祥事に悪手なワケ,19,https://news.yahoo.co.jp/articles/d4862989923f519a704467fdeacf30eddd115877,3/17(月) 15:21
2025-03-18,02:07,business,経済,21,ファイナンシャルフィールド,税理士の父の年収は「800万円」ほどだそうです。これって一般的に高い方なのでしょうか？,19,https://news.yahoo.co.jp/articles/d5584d53098f42edbbee10e5e97282c9f4667584,3/17(月) 13:50
2025-03-18,02:07,business,経済,22,Wedge（ウェッジ）,コメ農家は1000で足りる？農政を頼り翻弄されてきた日本の農家、 自分の頭で考える農業の実践を,18,https://news.yahoo.co.jp/articles/dfefbcf58e9cfa967b166e09e301ebd038b086f7,3/17(月) 5:02
2025-03-18,02:07,business,経済,23,マネーポストWEB,「包装されてて見た目は“無傷”だけど…」スーパーやコンビニで「床に落とした」食料品は責任を持って買うべきか？　コンビニで目撃された、おにぎりを落とした男性の“見たくなかった”行為,17,https://news.yahoo.co.jp/articles/8af83040d0cf4ceff7abb84bd3a8ce0bb2b3885d,3/17(月) 15:15
2025-03-18,02:07,business,経済,24,共同通信,関税「国際ルールのっとるべきだ」と財務相,16,https://news.yahoo.co.jp/articles/4149a5fb6ee082a2aba378a57975d4ee86d7fe67,3/17(月) 21:57
2025-03-18,02:07,business,経済,25,マネーポストWEB,【米価格が爆上がり！】米を溜め込み価格を上げて儲けようとする業者を罰する法律はないのか？　弁護士が解説する「それだけで罰することはできない」理由,16,https://news.yahoo.co.jp/articles/a6731fca3ddf7c4d5a4de8de0dae78a095e9491c,3/17(月) 15:15
2025-03-18,02:07,business,経済,26,現代ビジネス,「103万円の壁もNISAも、正直どうでもいい」…成田悠輔がそう思うワケ,16,https://news.yahoo.co.jp/articles/31412ae77f9bad412c6ae628b2550a7e2eabe255,3/17(月) 6:01
2025-03-18,02:07,business,経済,27,毎日新聞,中堅・中小企業の9割「新卒採用厳しい」　計画通りに採用できず,16,https://news.yahoo.co.jp/articles/7723ac8fe5bf2bfe7e89d4bf89379950e17cf389,3/17(月) 20:18
2025-03-18,02:07,business,経済,28,東洋経済オンライン,「リベンジ退職」のリアル　忙しい時期を狙って退職・引き継ぎ拒否…　会社を揺るがす報復劇の実態　代表的なパターンと予防策から見えてくること,15,https://news.yahoo.co.jp/articles/09c2de0201d65e107410251d2ac7a7b38fca6f00,3/17(月) 5:17
2025-03-18,02:07,business,経済,29,バイクのニュース,伝統の「GT-Rブルー」が新登場！ 日産が米国市場で「Ｚ」の2025年モデルを発売,15,https://news.yahoo.co.jp/articles/53f3df6b225b6621010f4bb4f8d88c8979490a23,3/17(月) 14:55
2025-03-18,02:07,business,経済,30,共同通信,コメ5キロ価格4077円、10週連続上昇,15,https://news.yahoo.co.jp/articles/7ab895d89317352966999494d4da6f0ed2592cf5,3/17(月) 17:13
2025-03-18,02:07,business,経済,31,共同通信,米鉄鋼アルミ関税「例外設けず」　トランプ氏、ロイター報道,15,https://news.yahoo.co.jp/articles/2e02dd917906f1ff822f5aa7235e6cc62f027a72,3/17(月) 13:44
2025-03-18,02:07,business,経済,32,MBSニュース,政府の意図は？品薄＆高騰なのに米の輸出量『約8倍』の目標　専門家「不足基調の中で輸出を増やせば国内の価格は上がるだろう」【解説】,14,https://news.yahoo.co.jp/articles/d2df1a31e45250771784432aa9750672bb9e4bf9,3/17(月) 14:26
2025-03-18,02:07,business,経済,33,TBS NEWS DIG Powered by JNN,長野県が本気で“そば県”目指す!背景に“おいしいそば”圏外も　「納豆」「日本酒」意外な1位は?【Nスタ解説】,13,https://news.yahoo.co.jp/articles/657753bc0f07decad6d1a90b97c4a93481c5b923,3/17(月) 22:02
2025-03-18,02:07,business,経済,34,TBS NEWS DIG Powered by JNN,加藤財務大臣、トランプ政権の追加関税強化「遺憾」　G7財務相会合で,13,https://news.yahoo.co.jp/articles/f0a5e53a6b2884c8ee69a882c9d37d153f3b5d8d,3/17(月) 23:06
2025-03-18,02:07,business,経済,35,バイクのニュース,バイクでの「すり抜け」は法律違反じゃないって知ってた？ すり抜けが違反になってしまう条件とは,13,https://news.yahoo.co.jp/articles/8a05f63c9e3bf85572200b7cd903ecb89fa69704,3/17(月) 8:55
2025-03-18,02:07,business,経済,36,ファイナンシャルフィールド,4月から社会人になり一人暮らしを始める娘。初任給が「手取り月15万円」だそうですが、仕送りなしでも生活できるのでしょうか？,12,https://news.yahoo.co.jp/articles/f40793e05d3b72e28c68cb751848fadf0da4d76c,3/17(月) 13:40
2025-03-18,02:07,business,経済,37,ABEMA TIMES,フルタイム労働者の平均月給 33万円で過去最高を更新,12,https://news.yahoo.co.jp/articles/f8dd6f4f9d73423acde0d15728e804e423ae474b,3/17(月) 16:31
2025-03-18,02:07,business,経済,38,ファイナンシャルフィールド,宝くじを買い続けた母が、ついに「1000万円」当せん！ 兄と私に「100万円」ずつ渡してくれましたが、当せん金は非課税なので、この分の「確定申告」は不要ですよね？,12,https://news.yahoo.co.jp/articles/de73853f185105711b81e2dae4d8058deea4628f,3/17(月) 13:30
2025-03-18,02:07,business,経済,39,共同通信,西武HD、大卒初任給32万円　過去最大、6万8千円引き上げ,12,https://news.yahoo.co.jp/articles/db457cce2993e137b1a8fa2aaa8803045582b1b2,3/17(月) 18:24
2025-03-18,02:07,business,経済,40,WWDJAPAN.com,「新宿ミロード」が40年の歴史に幕　４万人が若者のファッション聖地の別れを惜しむ,12,https://news.yahoo.co.jp/articles/6f3a8c8eeab7a17ff4908254d8aa0693bf6c7989,3/17(月) 6:00
