scrp_date,scrp_time,genre_en,genre_jp,rank,media_jp,title,comment,link,date_original
2025-03-18,17:10,domestic,国内,1,産経新聞,自民・松山参院幹事長　ガソリン暫定税率の早期廃止を主張　「国民生活は非常に厳しい」,445,https://news.yahoo.co.jp/articles/fdf517df0ed50b5bafdff584dee37aea25503224,3/18(火) 14:44
2025-03-18,17:10,domestic,国内,2,デイリー新潮,「子どもを託児所に預けたまま飲みに出かけて…」　最上あいさんの「カネの使い道」を知人が証言　「複数のボーイズバーで貢いでいた」【高田馬場ライバー刺殺事件】,303,https://news.yahoo.co.jp/articles/77bb8d564125b2384a254255fb39667a5d4e6fc0,3/18(火) 11:41
2025-03-18,17:10,domestic,国内,3,文春オンライン,《兵庫知事疑惑》「あまりにも怖いです」自死した元県議・竹内英明氏（享年50）が「週刊文春」記者に“訴えていたこと”,244,https://news.yahoo.co.jp/articles/c1665da622f1778b3d7211cb25c064c9c2ec1b8a,3/18(火) 16:12
2025-03-18,17:10,domestic,国内,4,TBS NEWS DIG Powered by JNN,【速報】悠仁さま「充実した3年間」「忘れられない友達を作ることができました」筑波大学付属高校を卒業　秋篠宮ご夫妻も卒業式に,227,https://news.yahoo.co.jp/articles/cd44acbd9d750e1a25308bbc16b0dc8568eea1f3,3/18(火) 11:19
2025-03-18,17:10,domestic,国内,5,ABEMA TIMES,通勤手当をもらう人は「手取り」が減るのか？ 立憲議員「毎月2万円違ってくる」 国会で追及,185,https://news.yahoo.co.jp/articles/49ac506a01814f709c68899d953eb1068440c0af,3/18(火) 12:57
2025-03-18,17:10,domestic,国内,6,TBS NEWS DIG Powered by JNN,「隣の男性がかわいいと思った」走行中の夜行バス車内で隣に座る男子大学生（22）に性的暴行か　56歳の男を逮捕　神奈川県警,160,https://news.yahoo.co.jp/articles/e65cb58a0e929b486ae2524834628de661bc2647,3/18(火) 4:20
2025-03-18,17:10,domestic,国内,7,産経新聞,「みんなに配れ10万円♪」れいわ山本太郎氏、首相の商品券配布揶揄　東京・杉並でデモ,160,https://news.yahoo.co.jp/articles/57b98cc8623bc9a9d17a6748b1684fffefa4fea7,3/18(火) 7:00
2025-03-18,17:10,domestic,国内,8,産経新聞,維新、7年度予算再修正案に賛成へ　前原氏「われわれの方向性にかなっている」,145,https://news.yahoo.co.jp/articles/20106bbe0e3a667af1249ac56b98e94d380ac245,3/18(火) 15:24
2025-03-18,17:10,domestic,国内,9,読売新聞オンライン,デジタル導入の「教育先進国」で成績低下や心身の不調が顕在化…フィンランド、紙の教科書復活「歓迎」,131,https://news.yahoo.co.jp/articles/012105af5a04e7d139807a8bb5983da00a8488da,3/18(火) 5:01
2025-03-18,17:10,domestic,国内,10,文春オンライン,「開けた瞬間、『これはヤバいな』と」石破首相から“10万円商品券”を渡された自民・新人議員が本音を明かした！,124,https://news.yahoo.co.jp/articles/2fc7f0c09f462156d1fdbb7ec0e7aa15d93cac41,3/18(火) 16:12
2025-03-18,17:10,domestic,国内,11,読売新聞オンライン,介護職員数が初の減少、２１２万６０００人に…小規模事業者に財政支援し連携や再編促す,120,https://news.yahoo.co.jp/articles/3a1966b6ae80ff0eeff801c01027f2616571fa8f,3/18(火) 5:00
2025-03-18,17:10,domestic,国内,12,共同通信,商品券配布、国民理解へさらに努力と首相,106,https://news.yahoo.co.jp/articles/5f3ef59a03c3b884078f53c68dca3682e21716f9,3/18(火) 15:24
2025-03-18,17:10,domestic,国内,13,TBS NEWS DIG Powered by JNN,【独自】悠仁さま　筑波大学通学のためつくば市内に新たに住居を準備　早朝深夜の通学や帰宅に備え　当面は東京から車で通学,103,https://news.yahoo.co.jp/articles/31a4b0f0282ee450fb7d0b85a0e7b8f5eaf70532,3/18(火) 9:48
2025-03-18,17:10,domestic,国内,14,時事通信,自民保守議連、別姓反対提言へ,84,https://news.yahoo.co.jp/articles/7ccb5d577fd9cb92e494596ccbb18e446ae8c37c,3/18(火) 16:12
2025-03-18,17:10,domestic,国内,15,読売新聞オンライン,小学校の女性教諭がキャバクラで100万円の収入、「給料物足りなく」…停職3か月,77,https://news.yahoo.co.jp/articles/f02d8d207a75048528efbc4f0fd66e4874a51d73,3/18(火) 11:50
2025-03-18,17:10,domestic,国内,16,日テレNEWS NNN,ナゼ今、広がる？　“財務省解体デモ”分析で見えたコトとは…,73,https://news.yahoo.co.jp/articles/711f901064c6ad7e53bad9aaae2d94d2f86ca3e9,3/17(月) 18:37
2025-03-18,17:10,domestic,国内,17,朝日新聞,酩酊運転、警察への通報は11日後,68,https://news.yahoo.co.jp/articles/0569ab0a0b9eba7433d98c5a3b7948417f07d9e3,3/18(火) 5:00
2025-03-18,17:10,domestic,国内,18,FNNプライムオンライン（フジテレビ系）,立憲・小沢一郎氏「不人気の石破首相の方が選挙にいいやは消極的。困ったもんだね」執行部の対応に不満表明,66,https://news.yahoo.co.jp/articles/a5fe151200f27dad01ec404083fb10ff1241ec2e,3/18(火) 15:07
2025-03-18,17:10,domestic,国内,19,日刊スポーツ,"議場騒然…石破首相塩答弁で野党から""ヤジ質問""乱舞も商品券配布問題で従来主張　衆院本会議",60,https://news.yahoo.co.jp/articles/0817f2aab94d50640897dc50ddfc2d2b20cd1b02,3/18(火) 16:21
2025-03-18,17:10,domestic,国内,20,デイリー新潮,高額商品券をドケチな石破首相がなぜ配布？　永田町でささやかれる指南役は「ドンの息子」,59,https://news.yahoo.co.jp/articles/0a97d7f95f73e0256cc920ec9c7f36d4ecc19ba7,3/18(火) 11:48
2025-03-18,17:10,domestic,国内,21,J-CASTニュース,共産党の調布市議、「議員用のクラウドのログイン情報を元議員に伝えた」報道認め謝罪,55,https://news.yahoo.co.jp/articles/2bc77d90386dee426c9ca9fdbc948c9ca2f89036,3/18(火) 16:00
2025-03-18,17:10,domestic,国内,22,女性自身,ライバー刺殺事件　被害女性の「婚約者」名乗る男がXに登場…内幕明かすライブ配信実施→突如終了でネット騒然,55,https://news.yahoo.co.jp/articles/0fb68b4f9ccdad7cef1aded4ab7722d47ef0d9a0,3/18(火) 11:00
2025-03-18,17:10,domestic,国内,23,女性自身,眞子さん　目撃された“ゆったりシルエット”アウターに広がる驚き…NY生活3年で見せた「ファッションの変化」,51,https://news.yahoo.co.jp/articles/6a0a71b118217b58d5b5eb63e5b7a1fff0ab0514,3/18(火) 6:00
2025-03-18,17:10,domestic,国内,24,読売新聞オンライン,対象者乗せずに使用、違反切符…「駐禁除外」不正一斉取り締まり,50,https://news.yahoo.co.jp/articles/973c5cf511a23764951caff9285329bc3cea0087,3/18(火) 11:39
2025-03-18,17:10,domestic,国内,25,tenki.jp,熊本県で震度4の地震　津波の心配なし,48,https://news.yahoo.co.jp/articles/9e1b50bb99fd673d816fafcd2688eefcdcad591e,3/18(火) 5:06
2025-03-18,17:10,domestic,国内,26,東洋経済オンライン,「1年で500万の“投げ銭”をした」30歳男性が借金してまで「女性ライバー」にハマってしまったワケ　その背景に“闇落ち”させる投げ銭の仕組みがあった,47,https://news.yahoo.co.jp/articles/56fca9c6d07add9555dac6668479edd64e6d4261,3/18(火) 5:02
2025-03-18,17:10,domestic,国内,27,FNNプライムオンライン,【独自】車ドロボーが「録画を開始します」の音声に大慌て…400万のSUV盗む「どんな神経してるのか」ドラレコが捉えた犯行の瞬間,46,https://news.yahoo.co.jp/articles/95ccbaf3c0af2d53fe2213e8d173217030d7a4eb,3/18(火) 15:02
2025-03-18,17:10,domestic,国内,28,現代ビジネス,「小室圭さん・眞子さん」の子どもが”未来の天皇”になる可能性は？…ネット上の疑問の声に答えた「識者の見解」,46,https://news.yahoo.co.jp/articles/f556f30f2508bebb82fc70178ce59506671f6be9,3/18(火) 7:01
2025-03-18,17:10,domestic,国内,29,よろず～ニュース,立花孝志氏「目標をはるかに超える」千葉で選挙運動をほとんどせずに県知事選4.8％の得票率,45,https://news.yahoo.co.jp/articles/09432060a4967d217d200f53113bdedea1772385,3/17(月) 18:10
2025-03-18,17:10,domestic,国内,30,FNNプライムオンライン（フジテレビ系）,国民・玉木氏　石破首相の政倫審出席を重ねて要求「商品券問題に審議時間を費やすのは国益に良くない」,44,https://news.yahoo.co.jp/articles/af61768d2e9111ed9b3d9dbd70c9516495c84b75,3/18(火) 13:02
2025-03-18,17:10,domestic,国内,31,テレビ朝日系（ANN）,高速料金「3連休は休日割引なし」に　ドライバー不満　道の駅は客足が心配,42,https://news.yahoo.co.jp/articles/127f8f1c016832ae5cef49cac4f636d9942aa10e,3/18(火) 10:57
2025-03-18,17:10,domestic,国内,32,プレジデントオンライン,"「胸を舐められた」は濡れ衣だった…逮捕された乳腺外科医が""無罪確定""までの9年で仕事も息子も失った悲痛",42,https://news.yahoo.co.jp/articles/b4e1f99bd13215666334327306c7d0244a91e124,3/18(火) 12:17
2025-03-18,17:10,domestic,国内,33,読売新聞オンライン,エレベーターが急上昇し天井に衝突、２人重傷…仙台市のマンションで昨年１月,42,https://news.yahoo.co.jp/articles/ede5a3bb35751aa67d61d48b6c2dd1e8d56c29b9,3/18(火) 15:31
2025-03-18,17:10,domestic,国内,34,FNNプライムオンライン（フジテレビ系）,【速報】石破首相が政倫審出席に応じる意向…10万円商品券配布問題で野党側が要求,41,https://news.yahoo.co.jp/articles/a6e3823f1c2d2fa8c0616a02e15090c98c168a8c,3/18(火) 16:49
2025-03-18,17:10,domestic,国内,35,文春オンライン,正座してひざまずき「無期限だ。一生奴隷でいろ」40代女性医師に性行為、奴隷契約も…探偵会社社長（59）の悪質すぎる手口,41,https://news.yahoo.co.jp/articles/2f2a041e4026c4c2a04c72780efb18ad44b0fb24,3/18(火) 11:12
2025-03-18,17:10,domestic,国内,36,産経新聞,大阪・岸和田市長選に永野前市長が出馬表明　維新は擁立見送りへ,41,https://news.yahoo.co.jp/articles/e0ae7f9c61b618f73075ce15bfdc8cacaae8e3c2,3/18(火) 12:52
2025-03-18,17:10,domestic,国内,37,信濃毎日新聞デジタル,断っても「お宅は対象なので」と玄関先で30分以上勧誘…虚偽の説明受けたケースも　電気代高騰　蓄電池の訪問販売トラブルが全国的に増加、注意点は？,40,https://news.yahoo.co.jp/articles/b8350bf2c2fe401bbf4b18ea7216b5f93a370a4d,3/18(火) 6:04
2025-03-18,17:10,domestic,国内,38,TBS NEWS DIG Powered by JNN,「伊藤塾」運営会社の前代表が確定申告せず所得税約6800万円脱税か　東京国税局査察部が刑事告発,40,https://news.yahoo.co.jp/articles/a80a8d3dc58dc024500c9d377d2aebb0511b8bd7,3/18(火) 11:30
2025-03-18,17:10,domestic,国内,39,デイリー新潮,維新が胸を張る「高校の授業料無償化」に税金の無駄遣いの声…お膝元「大阪」で名門府立高が定員割れの衝撃　専門家は「教育が“弱肉強食”を加速させかねない」,40,https://news.yahoo.co.jp/articles/c1030e27a9311c5a072c1de6221c7932cb4b36d6,3/18(火) 6:11
2025-03-18,17:10,domestic,国内,40,JBpress,改憲派も護憲派も“悶絶”？自民から共産までもが警戒する、立憲・枝野憲法審会長の絶妙なテーマ設定,40,https://news.yahoo.co.jp/articles/7a4d8e5ae72bf829bdee047b2e3015c2d1be82b7,3/18(火) 11:36
