scrp_date,scrp_time,genre_en,genre_jp,rank,media_jp,title,comment,link,date_original
2024-09-19,07:06,business,経済,1,毎日新聞,FRB、政策金利0.5％引き下げ　2年半ぶり「引き締め」から「緩和」へ,104,https://news.yahoo.co.jp/articles/8d90a51aed42d1c24dfd9b63fdc4b882088d6feb,9/19(木) 3:03
2024-09-19,07:06,business,経済,2,ダイヤモンド・オンライン,職場で「陰口を言われたとき」頭の回転が速い人が咄嗟にする1つのこと,96,https://news.yahoo.co.jp/articles/b5360db0a0568ca73f2e945ec48959eae22a372e,9/19(木) 6:02
2024-09-19,07:06,business,経済,3,ITmedia ビジネスオンライン,「若者のディズニー離れは“料金が高い”から」説は、本当か,76,https://news.yahoo.co.jp/articles/0013bc8f5158226518595408171186c000c5e13f,9/18(水) 7:40
2024-09-19,07:06,business,経済,4,Merkmal,「高齢者を駅まで歩かせるのか」 関西でさらに深刻化するバス運転士不足、万博バス問題去ってまた一難！ 現場は「地域の足守りたい」の悲痛声,73,https://news.yahoo.co.jp/articles/f83842d987c868f1cc9970f99fefc603b40aa9fc,9/19(木) 5:41
2024-09-19,07:06,business,経済,5,THE GOLD ONLINE（ゴールドオンライン）,「年金なんて将来どうせ…」働き続け、払い続けて「もらえる年金額」に戦慄,47,https://news.yahoo.co.jp/articles/31c51d0097bcec39d755e4943b3336238c80f4e6,9/18(水) 21:54
2024-09-19,07:06,business,経済,6,ダイヤモンド・オンライン,なぜ、「ゴルフ」をやらない人は出世しないのか？ 決定的に生まれる1つの差＜最短出世中・現役メガバンカーが教える＞,40,https://news.yahoo.co.jp/articles/354661d290fa3173493f88a5c76520952fc1102d,9/19(木) 6:02
2024-09-19,07:06,business,経済,7,ロイター,米タッパーウェア、破産法適用を申請　需要低迷で赤字拡大,40,https://news.yahoo.co.jp/articles/1bbabc376b139a49afd2a2de3fc2e400b67b3b13,9/18(水) 13:58
2024-09-19,07:06,business,経済,8,FNNプライムオンライン（フジテレビ系）,【速報】8月の訪日外国人は293.3万人で過去最高に!前年より36％増でコロナ前も上回る　1～8月は2400万人超えて去年の2507万人に迫る,39,https://news.yahoo.co.jp/articles/da2a3caf373e8f8ca5a38f4596d98eba3a4c4d86,9/18(水) 16:17
2024-09-19,07:06,business,経済,9,ファイナンシャルフィールド,中古車を買いたいのですが、「10万km」を超えている車はやめた方がいいですか？あまり費用がないのですが、車は必要です。,39,https://news.yahoo.co.jp/articles/cacf31a7aebbf01d3731a20c035680f00f7f3425,9/18(水) 18:10
2024-09-19,07:06,business,経済,10,ニューズウィーク日本版,岸田政権「円高容認」の過ち...日本経済の成長率を高められる次期首相は高市氏だ,36,https://news.yahoo.co.jp/articles/82c0372520f86564afdc2f1e4d200c9bb0f8c05a,9/18(水) 17:22
2024-09-19,07:06,business,経済,11,MBSニュース,【速報】小林製薬「紅麹」問題　原因物質は「プベルル酸」と特定　厚生労働省「複数の化合物で腎毒性を調査も確認されず」,35,https://news.yahoo.co.jp/articles/d437e49859b39a1879a327cc285244eedae0ee9e,9/18(水) 14:17
2024-09-19,07:06,business,経済,12,ロイター,レバノンで爆発の機器、台湾企業「権利持つブタペスト会社が製造」,26,https://news.yahoo.co.jp/articles/f66af0f68a928ace7f67d79e907b30193fed4f16,9/18(水) 12:23
2024-09-19,07:06,business,経済,13,くるまのニュース,なぜガソスタで「給油出来ない」と拒否される？ 「燃料入れたいだけなのに…」 断られる意外な理由とは？,26,https://news.yahoo.co.jp/articles/101da35d6c0afe37778af8ff568a4a7dd7996b61,9/18(水) 9:10
2024-09-19,07:06,business,経済,14,ダイヤモンド・オンライン,「超一流デザイナー起用の服」大量廃棄に涙する社員、セブン＆アイ傘下の百貨店社員が労組委員長になる覚悟を決めたワケ,23,https://news.yahoo.co.jp/articles/de05c48118ed75051715d7b139a91fc16e2a7088,9/19(木) 6:02
2024-09-19,07:06,business,経済,15,東洋経済オンライン,「部長、その話、キツいっす」部下が辞める雑談2種　部下が未来に絶望していく、何気ない2つの話題,22,https://news.yahoo.co.jp/articles/e57775cee372b378ff864d4a12d8c21d3a0278b2,9/19(木) 6:02
2024-09-19,07:06,business,経済,16,＠ＤＩＭＥ,上場廃止が決まり転換期を迎えたケンタッキーの未来,20,https://news.yahoo.co.jp/articles/9bf71f64f9e7a71d5c1bb92365bf53d5a257ab31,9/18(水) 21:20
2024-09-19,07:06,business,経済,17,ファイナンシャルフィールド,「乗り慣れない車種の運転は怖い」と15年間同じデミオを運転している友人。維持費は高くならないのでしょうか？,20,https://news.yahoo.co.jp/articles/ce90a116dcd378be1ba0b9226636bbc5c002473a,9/18(水) 19:10
2024-09-19,07:06,business,経済,18,MBSニュース,【速報】梅田ロフトが2025年春に営業終了　大阪・茶屋町で約34年間営業　同じキタエリア内に移転へ　競合他社の影響… ピーク時の売上も確保できないため,18,https://news.yahoo.co.jp/articles/4a60bd6728782ddb4a4dc8ede1d9df91c858217f,9/18(水) 11:01
2024-09-19,07:06,business,経済,19,乗りものニュース,自衛隊も購入！ 最新「ステルス巡航ミサイル」ウクライナに提供間近か？ ただ“邪魔者”が米国に,17,https://news.yahoo.co.jp/articles/ec24f9c13b17b42633c843af5e333d6473dd0238,9/19(木) 6:12
2024-09-19,07:06,business,経済,20,現代ビジネス,「物価は上がったが、日本人の生活は貧しくなった」　実は根拠薄弱だった、物価目標2％の理論的な根拠。黒田日銀が犯した致命的なミスとは,16,https://news.yahoo.co.jp/articles/3755d5438bba8f253d878ff4c78c1f4ec929c865,9/19(木) 6:05
2024-09-19,07:06,business,経済,21,共同通信,三菱3社に過怠金計5億円　日証協、顧客情報の無断共有,16,https://news.yahoo.co.jp/articles/223a9bda267c5d2f51c5d63eed4ffb7a3aef72b6,9/18(水) 12:44
2024-09-19,07:06,business,経済,22,ファイナンシャルフィールド,母に新NISAで「月5万円」投資していると話したら、「株価が急落してるのに危ない」と言われました。損をすると心配なようですが、変動が大きいなら“貯金”のほうが良いのでしょうか…？,15,https://news.yahoo.co.jp/articles/19c7dc95daeb21b6268ae27be446fc17598eb204,9/18(水) 13:50
2024-09-19,07:06,business,経済,23,ロイター,日鉄のＵＳスチール買収再申請へ、米政府の判断は大統領選後に,15,https://news.yahoo.co.jp/articles/de7e6bd4b1b4463a474f72efec7da93e6699dd39,9/18(水) 9:14
2024-09-19,07:06,business,経済,24,プレジデントオンライン,「世界遺産」で大喜びするのは日本人だけ…観光客が4倍に跳ね上がった群馬・富岡製糸場がたどった悲しい結末,15,https://news.yahoo.co.jp/articles/9e2cf10fcfcab0d5f627e4acd717dba56cff5de8,9/18(水) 10:17
2024-09-19,07:06,business,経済,25,毎日新聞,インスタグラム、18歳未満の制限強化　メッセージや動画閲覧規制,15,https://news.yahoo.co.jp/articles/e9ea34cd6067cfe0c0108cf4d77d5a4b6f0eadc6,9/18(水) 11:09
2024-09-19,07:06,business,経済,26,読売新聞オンライン,バレイショ４０％高・トマトやタマネギ２８％高、生鮮食品の高騰続く…農水省が価格調査,14,https://news.yahoo.co.jp/articles/f0fe4b7095f10e3c192126c865930ad7f03562a9,9/18(水) 20:57
2024-09-19,07:06,business,経済,27,共同通信,グーグル制裁金の支払い取り消し　独禁法違反、EU敗訴,13,https://news.yahoo.co.jp/articles/131ccb19f230abc6516d64086e72f5412b91b082,9/18(水) 17:53
2024-09-19,07:06,business,経済,28,ファイナンシャルフィールド,令和6年12月2日から「健康保険証」が「マイナンバーカード」に一本化されると聞き、よく分からず不安です。何かメリットがあるのでしょうか？,12,https://news.yahoo.co.jp/articles/a01a4fadd320b48f9289abad92d66d111f79c342,9/18(水) 14:10
2024-09-19,07:06,business,経済,29,FNNプライムオンライン（フジテレビ系）,時給上昇も「年収の壁」意識し今後約210万人が労働時間を削減する可能性　野村総研調査,12,https://news.yahoo.co.jp/articles/15851a345f3ae5199d5ec9b2ed1d2c9a7073e8c5,9/18(水) 17:32
2024-09-19,07:06,business,経済,30,ファイナンシャルフィールド,夏のボーナスをMAZDA「CX-5」の頭金で使い切ったと言う彼…30代で年収340万円ですが、車のローンを払っていけるのでしょうか？,11,https://news.yahoo.co.jp/articles/55e69fcc98e70c41b70a588e1f8a5c62bfcd5659,9/18(水) 14:20
2024-09-19,07:06,business,経済,31,GQ JAPAN,34歳、ゲレンデを買う──勢いにもほどがある。それもまた人生だ！（Vol.3）,11,https://news.yahoo.co.jp/articles/3d427ba3114fec9fb1a7872c355bf0a9fec1d63d,9/18(水) 20:40
2024-09-19,07:06,business,経済,32,Bloomberg,円は対ドルで141円半ばに上昇、米大幅利下げ観測強い－実需の買いも,11,https://news.yahoo.co.jp/articles/501afcea323ab5e9ab829bc97e847295e896af56,9/18(水) 7:15
2024-09-19,07:06,business,経済,33,東洋経済オンライン,「タイミー」上場後初の決算で株価が大幅下落、メルカリ参入の影響は？新たに浮上した課題も,11,https://news.yahoo.co.jp/articles/5dec60cb5296836aa5efc8c304c47ff22b2dfc12,9/19(木) 5:02
2024-09-19,07:06,business,経済,34,週プレNEWS,欧州「EVシフト」大誤算の舞台裏。旗振り役のフォルクスワーゲンに続いてボルボも窮地でついにバブル崩壊！,10,https://news.yahoo.co.jp/articles/3d2c195449c27b30d4009776d9520009c8b03cbd,9/19(木) 6:30
2024-09-19,07:06,business,経済,35,ファイナンシャルフィールド,「新紙幣」の導入でどうやって「家に保管しているお金」がバレるのでしょうか？ 少しずつ使っていけばバレないですよね…。,10,https://news.yahoo.co.jp/articles/d64d428098c1374c9090b2575fc7c09fb097587b,9/18(水) 10:10
2024-09-19,07:06,business,経済,36,ABEMA TIMES,経済同友会代表 解雇規制「金銭解決を議論すべき」,10,https://news.yahoo.co.jp/articles/29132ed6707a434c8184c35829ea2305a1b46bf0,9/18(水) 9:16
2024-09-19,07:06,business,経済,37,ABEMA TIMES,コメの取引価格 品薄で8月として過去最高,10,https://news.yahoo.co.jp/articles/dc4d7cef29f4b2ce84d7782e671290023fa5ec46,9/18(水) 9:16
2024-09-19,07:06,business,経済,38,時事通信,【図解】8月訪日客、293万人＝過去最高、中国など増加―日本政府観光局,9,https://news.yahoo.co.jp/articles/ad4d2c19ad00b3fe3058b9cccb5ae2afe50e237f,9/18(水) 17:19
2024-09-19,07:06,business,経済,39,日刊ゲンダイDIGITAL,アマゾンがテレワーク廃止の衝撃…経営側が効率低下を懸念、それで日本はどうなる？,9,https://news.yahoo.co.jp/articles/7cacf8236a90dd1b907b584cde9a68f01b068044,9/18(水) 10:52
2024-09-19,07:06,business,経済,40,ファイナンシャルフィールド,なぜお金をもらったら「所得税」を支払うのに、お金を失うときも「消費税」などの税金がかかるのですか？,9,https://news.yahoo.co.jp/articles/7c010be479a3416b7327530252b07a99415f08b4,9/18(水) 12:10
