scrp_date,scrp_time,genre_en,genre_jp,rank,media_jp,title,comment,link,date_original
2025-10-18,17:09,sports,スポーツ,1,TBS NEWS DIG Powered by JNN,ドジャースが2年連続WS進出！大谷翔平、衝撃3ホーマー＆7回途中無失点で歴史的活躍！最後は佐々木朗希が締める,388,https://news.yahoo.co.jp/articles/35699631847d6c46fb0890027d129a6914b8a6c1,10/18(土) 12:20
2025-10-18,17:09,sports,スポーツ,2,日刊スポーツ,大谷翔平「今日はおいしいお酒を飲んでください」シリーズMVP初獲得「最高の気分」／一問一答,334,https://news.yahoo.co.jp/articles/0cdb3f2fe7cc8c2c01c6903d4e73ad1027b8226b,10/18(土) 13:11
2025-10-18,17:09,sports,スポーツ,3,Full-Count,大谷翔平、史上11人目の1試合3発　松井氏超えの特大5号＆7回途中無失点…本拠地大喝采,315,https://news.yahoo.co.jp/articles/34962f4b8b50171d819135af092617c4da9c2bf1,10/18(土) 11:44
2025-10-18,17:09,sports,スポーツ,4,スポーツ報知,「１番投手」大谷翔平が１試合３本塁打の圧巻大暴れ　不調はどこへ…　投げては７回途中２安打無失点１０K,200,https://news.yahoo.co.jp/articles/6389fbd54b47fb1cf26b772a0120b1b97c86e12b,10/18(土) 11:44
2025-10-18,17:09,sports,スポーツ,5,デイリースポーツ,大谷翔平、1試合3本塁打PS3、4、5号　四回2本目は驚愕の143メートル“場外弾”　七回の3本目は中越え鮮やかアーチ　本拠地騒然　MVPコールも,165,https://news.yahoo.co.jp/articles/ccae506dd2edce8ebfe2e6ce498a5225aafbae96,10/18(土) 10:56
2025-10-18,17:09,sports,スポーツ,6,Full-Count,鷹にアクシデント…中村晃が審判と激突し負傷交代　担架で退場→救急車で搬送、球場騒然,125,https://news.yahoo.co.jp/articles/5aeed47a7d38d374367d119159427379ce4552b6,10/18(土) 15:08
2025-10-18,17:09,sports,スポーツ,7,デイリースポーツ,大谷翔平、9戦ぶりPS3号先頭打者弾　3連続K直後に136メートル特大アーチで自分を援護　投手のPS本塁打は球団史上初の快挙→衝撃の2本目も143メートル　本拠地熱狂,116,https://news.yahoo.co.jp/articles/8ebca3523d09e7e4df060a99a7d35328f82441f6,10/18(土) 9:50
2025-10-18,17:09,sports,スポーツ,8,TBS NEWS DIG Powered by JNN,大谷翔平、二刀流で衝撃の1試合2ホーマー！確信の特大143m場外弾、勝てばWS進出の一戦、“大谷劇場”に本拠地沸く,89,https://news.yahoo.co.jp/articles/777486ecb05636602da4355e66554c3f2adba992,10/18(土) 10:56
2025-10-18,17:09,sports,スポーツ,9,MLB公式日本語サイト,【MLB】 ドジャースがリーグ連覇＆ワールドシリーズ進出　大谷翔平が10三振・3本塁打の怪物パフォーマンス,87,https://news.yahoo.co.jp/articles/92bfff3428b09ebaf933ae58971a31213fa91281,10/18(土) 12:20
2025-10-18,17:09,sports,スポーツ,10,バトル・ニュース,クマに襲われ死亡した男性には6歳と4歳の娘。今年3月に一家で移住したばかり…クマによる犠牲者が過去最多へ,77,https://news.yahoo.co.jp/articles/75c103d19e3dbdac0b0a66300981e741437b00bb,10/18(土) 14:09
2025-10-18,17:09,sports,スポーツ,11,デイリースポーツ,大谷翔平　衝撃の１試合３発　ベンチのマーフィー監督も思わず首かしげる　打った瞬間に絶叫の一撃はバックスクリーン左へ,73,https://news.yahoo.co.jp/articles/e408e249883c15e8dbd7dd1f336f35bef1bf29c2,10/18(土) 11:50
2025-10-18,17:09,sports,スポーツ,12,Full-Count,村上宗隆に浮上した300億円大型契約　米メディアが予想する移籍先「残念ながらドジャース」,70,https://news.yahoo.co.jp/articles/d4af9097d605896cbeb3464a72b298e7220a4b67,10/18(土) 6:30
2025-10-18,17:09,sports,スポーツ,13,スポーツ報知,渋野日向子「超悔しい１日」　首位発進↘２１位　痛恨ダボ＆４ボギー　予選は６戦ぶり突破…富士通レディース,70,https://news.yahoo.co.jp/articles/12ffdcb4f4d5eb03e691f18687b9eb25679f9fdc,10/18(土) 15:27
2025-10-18,17:09,sports,スポーツ,14,FOOTBALL ZONE,浦和が横浜FMに0-4完敗　安部裕葵が初出場も、前半の4失点重く…終盤には金子拓郎が一発退場に,69,https://news.yahoo.co.jp/articles/96b228433f8ec5ad12cd47cc6a56d1c351c7842e,10/18(土) 16:02
2025-10-18,17:09,sports,スポーツ,15,AERA DIGITAL,巨人の二岡ヘッド、駒田3軍監督が退団の衝撃　「来年は優勝どころかBクラス」の声も,66,https://news.yahoo.co.jp/articles/e69e81a379c4bb847203cd79d252c2346ee65a70,10/18(土) 9:31
2025-10-18,17:09,sports,スポーツ,16,スポニチアネックス,完全覚醒！大谷翔平が二刀流で2発！今PS4本目は143メートル場外弾　フリーマンら同僚も頭抱え呆然,64,https://news.yahoo.co.jp/articles/d12965e83f005314ec074df796052a4f429f8170,10/18(土) 10:57
2025-10-18,17:09,sports,スポーツ,17,日テレNEWS NNN,【箱根駅伝】本選出場20校が決定　中央学院大学が予選会トップ通過　わずか“17秒差”で法政大学が涙　日本体育大学は78年連続の切符,64,https://news.yahoo.co.jp/articles/f9e017f05d705c28411e19ad8c9f4143f375c4a9,10/18(土) 10:17
2025-10-18,17:09,sports,スポーツ,18,デイリースポーツ,球場騒然　ソフトバンク・中村晃にアクシデント　一塁塁審と激しく衝突し負傷交代　動けず担架で搬送→救急車で病院へ　意識はあり会話もできる状況,62,https://news.yahoo.co.jp/articles/96ae8bfc983b0ad09dc6d58d1d8c3873e1b2176d,10/18(土) 15:09
2025-10-18,17:09,sports,スポーツ,19,週刊女性PRIME,「キレやすい悪ガキだった」ソフトバンク外野手に婚約者“顔面殴打”報道、語っていた幼少期の“素顔”,61,https://news.yahoo.co.jp/articles/9ccdcd1e465ed5659ec97582f8dc23becb93e5dc,10/18(土) 15:01
2025-10-18,17:09,sports,スポーツ,20,ゲキサカ,新潟のJ1残留は極めて難しい状況に…東京Vに敗れて残り4試合の全勝と横浜FMの全敗が最低条件、得失点も大きな差,58,https://news.yahoo.co.jp/articles/bb2b42d540c937c423d63ad0f7c23a3a79689577,10/18(土) 16:03
2025-10-18,17:09,sports,スポーツ,21,スポニチアネックス,ブルワーズ監督「ポストシーズンの個人では史上最高のパフォーマンス」　大谷の伝説的な活躍を称える,57,https://news.yahoo.co.jp/articles/8021b811a7086530bf908096cab44af1668ca877,10/18(土) 12:48
2025-10-18,17:09,sports,スポーツ,22,日刊スポーツ,【DeNA】バウアーとオースティンが退団濃厚、ケイとジャクソンも流出危機…助っ人陣再構築も,55,https://news.yahoo.co.jp/articles/3483af93af6e42ce9583284b3a1f02e91c87f96f,10/18(土) 2:30
2025-10-18,17:09,sports,スポーツ,23,デイリースポーツ,ソフトバンク・中村晃　負傷交代に「大事に至らないことを祈ります」「やっと復帰したのに」とＳＮＳ心配　「みんな精一杯のプレーだったから…」「誰も悪くないよねぇ」の声も,54,https://news.yahoo.co.jp/articles/7e34f19b96734d3e35a0ada187541eac1017ba40,10/18(土) 15:25
2025-10-18,17:09,sports,スポーツ,24,CoCoKARAnext,米国で広まる“史上最高”の声　想像を超えた大谷翔平の3HR＆10Kに重鎮記者も感嘆「これは不公平だ」「オオタニは王」,53,https://news.yahoo.co.jp/articles/86b2e00c2e38a78a854fffcac05f725d4666042f,10/18(土) 12:28
2025-10-18,17:09,sports,スポーツ,25,西スポWEB OTTO！,ソフトバンク、日本シリーズ進出決定は持ち越し　上沢直之が古巣相手に7回途中6失点…打線も伊藤大海を攻略できず零封負け,52,https://news.yahoo.co.jp/articles/fff9eff330edbd6560e6b7ba7ef217fa879e59c5,10/17(金) 21:14
2025-10-18,17:09,sports,スポーツ,26,デイリースポーツ,ＤｅＮＡ　涙の三浦監督　１１分の取材対応で最後は謝罪「こういう性格なもので。申し訳ございませんでした」,52,https://news.yahoo.co.jp/articles/655cc280349c05f5b7cb78b7c2f25becb9a302cf,10/17(金) 22:30
2025-10-18,17:09,sports,スポーツ,27,RONSPO,「他に何があると言うんだ？」角田裕毅が渋滞で米国GPスプリント予選の最終アタックができず18番手に沈み不快感示す…接触しかけたローソンにも「彼にいつもあの通りだ」と激怒,52,https://news.yahoo.co.jp/articles/9b1df6962802356ec1dadc80b0d658638a83c484,10/18(土) 11:58
2025-10-18,17:09,sports,スポーツ,28,中日スポーツ,ソフトバンク、中村晃が一塁塁審と激突して負傷交代、担架でベンチ裏に運ばれる…塁審は立ち上がってアウトを宣告,50,https://news.yahoo.co.jp/articles/71a65276debab8289ce79f6f18ca65f563e092fe,10/18(土) 15:28
2025-10-18,17:09,sports,スポーツ,29,中日スポーツ,名古屋グランパス、残留争いをする横浜FCとドロー、残り4試合で降格圏18位との勝ち点差は8のまま,48,https://news.yahoo.co.jp/articles/c96301cb0e66c07f9894911b833964a222bd7761,10/18(土) 16:19
2025-10-18,17:09,sports,スポーツ,30,ベースボールキング,ブリュワーズ、昨季王者ドジャースに屈辱の4連敗　30球団最高勝率＆球団最多97勝も、WS制覇の悲願叶わず,48,https://news.yahoo.co.jp/articles/4725c0e41660a1c0f29d6682f60047307169d25f,10/18(土) 14:50
2025-10-18,17:09,sports,スポーツ,31,TBS NEWS DIG Powered by JNN,【阪神】無傷の3連勝で2年ぶり日本S進出決定！高橋が8回1死までノーヒット・ノーランの快投 佐藤輝が先制3ラン＆大山が追撃打,48,https://news.yahoo.co.jp/articles/495e7af50fc8a5c848f78b46026c756e26b47473,10/17(金) 21:00
2025-10-18,17:09,sports,スポーツ,32,TopNews,【F1アメリカGP：スプリント予選SQ1】角田裕毅まさかの18番手　レッドブル勢明暗、ハジャーは7番手好走,47,https://news.yahoo.co.jp/articles/e789526fbf4431cb47dbe4ee417617eada0bd87d,10/18(土) 6:52
2025-10-18,17:09,sports,スポーツ,33,東スポWEB,ドジャース・大谷翔平の圧巻ショーで古巣エンゼルスに非難殺到「大谷の長い時間を無駄にした」,46,https://news.yahoo.co.jp/articles/3baeb3a3863320045b58b57011c11acb3448c715,10/18(土) 16:10
2025-10-18,17:09,sports,スポーツ,34,CoCoKARAnext,「気持ちの強さが違う」阿部巨人で獲得に浮上する＂3投手＂を球界OBが考察　「竜の柱」「楽天日本一を支えた勝負右腕」,46,https://news.yahoo.co.jp/articles/df4bc019db35408dcefccf7449f98ae7c90b33a9,10/18(土) 11:12
2025-10-18,17:09,sports,スポーツ,35,CoCoKARAnext,「インコースに行き過ぎて苦しんでいる気が…」ホークスの内角一辺倒を前オリ監督の名将が疑問視「散らした方がいい」,44,https://news.yahoo.co.jp/articles/624a347c60b497cb8a605c0b29e4465f15768d4d,10/18(土) 16:30
2025-10-18,17:09,sports,スポーツ,36,西スポWEB OTTO！,またもレイエスに…ソフトバンクが痛恨の2ラン被弾　キーマン抑えられず勝ち越し許す,44,https://news.yahoo.co.jp/articles/1c957ef28f7546e959afb05e572e5b84e85a87f1,10/18(土) 14:59
2025-10-18,17:09,sports,スポーツ,37,CoCoKARAnext,「この男には7億ドルの価値がある」大谷翔平、優勝決定シリーズMVP！先発試合で1試合3発＆7回途中10K、史上初の快挙に米驚愕　「史上最高の選手が史上最高の試合をしている」,44,https://news.yahoo.co.jp/articles/7cb48cbff39204eb68f083f8fbff092aa12e1c6d,10/18(土) 12:42
2025-10-18,17:09,sports,スポーツ,38,スポーツ報知,「その男は１０個の三振を奪い、３本のホームランを放った」敗軍の将ブルワーズ監督、大谷の名を出さず「ＰＳ史上最も素晴らしい個人パフォーマンス」,44,https://news.yahoo.co.jp/articles/99450cff029d749e65b7dd9b6c8949d6bf9326d4,10/18(土) 13:09
2025-10-18,17:09,sports,スポーツ,39,中日スポーツ,大谷翔平、衝撃2発目…今季自己最長143メートルの超特大弾、PS4号は自己最多で2009年松井秀喜に並ぶ,43,https://news.yahoo.co.jp/articles/5b2f1e1e6e0744ac9e2437c2ef141d48fa99ca21,10/18(土) 11:02
2025-10-18,17:09,sports,スポーツ,40,中日スポーツ,ソフトバンク・中村晃が塁審と激突に「無事やと良いが…」「一塁手がかなりイレギュラーな動き、仕方ない部分も…」,43,https://news.yahoo.co.jp/articles/f798627131900ae382d60e5dba8b6855acc9fbb4,10/18(土) 15:48
