scrp_date,scrp_time,genre_en,genre_jp,rank,media_jp,title,comment,link,date_original
2025-08-04,02:07,business,経済,1,ファイナンシャルフィールド,政府・与党が掲げた「一律2万円」の給付金。4人家族なら「8万円」のはずが、住民税非課税世帯なら「16万円」もらえるって本当ですか？“給付金の検討内容”を確認,58,https://news.yahoo.co.jp/articles/bf3ffcba3912fd41e0d903c98487d6b87a17d1c4,8/3(日) 13:30
2025-08-04,02:07,business,経済,2,産経新聞,トラブル続出の「特区民泊」外国人不動産取得の温床に　参入容易、大阪は運営4割が中国人,51,https://news.yahoo.co.jp/articles/743a866d74e72a5af917552010a2ab72255bc65d,8/3(日) 21:13
2025-08-04,02:07,business,経済,3,産経新聞,そっくり「ニセ日本製」はびこる海外ECサイト　国内メーカー、模倣品対処もいたちごっこ,48,https://news.yahoo.co.jp/articles/bc1c50dc43168560a59d76907c813557b100c3a0,8/3(日) 12:00
2025-08-04,02:07,business,経済,4,産経新聞,エアコンの設置業者不足が深刻　記録的猛暑の北海道ではダイキンやパナソニックが対策強化,41,https://news.yahoo.co.jp/articles/bca68833d183dbdf5d7018307dccbd150f4452c2,8/3(日) 13:35
2025-08-04,02:07,business,経済,5,Bloomberg,ＯＰＥＣプラス、９月の大幅増産で合意－減産解除を１年前倒し,39,https://news.yahoo.co.jp/articles/5ee0ac9a14ee917ed90102363f4383f829b6960a,8/3(日) 21:00
2025-08-04,02:07,business,経済,6,東洋経済オンライン,「流山って“千葉のニコタマ”って言われてるのか…え、開発した会社が同じなの!?」　人口急増の街・流山を洗練させ続ける会社の“正体”,35,https://news.yahoo.co.jp/articles/77244f42d1d8f999304248e4d83744ff61b45780,8/3(日) 6:31
2025-08-04,02:07,business,経済,7,週刊SPA!,“大量リストラ”自動車メーカー、夏のボーナス額を51歳技術職が暴露。100万円超でも「不安は尽きない」ワケ,25,https://news.yahoo.co.jp/articles/e00e6636280ac5eeb4780300dd3601ed8312f84a,8/3(日) 15:55
2025-08-04,02:07,business,経済,8,ダイヤモンド・オンライン,イチローの英語スピーチが「中学レベル＋α」でも世界から絶賛されたワケ【専門家が解説】,21,https://news.yahoo.co.jp/articles/1ecfd5b89cea04307ae732990b073536eb8ada1f,8/3(日) 6:01
2025-08-04,02:07,business,経済,9,読売新聞オンライン,中国が生産の９６％握るガリウム、日米で豪州に生産設備…レアメタル安定調達で経済安保強化,21,https://news.yahoo.co.jp/articles/109b06d2af0d7244a1feee1012a96a325eb48ca1,8/3(日) 5:00
2025-08-04,02:07,business,経済,10,東洋経済オンライン,「1秒でも早く脱ぎたい！」グンゼ『アセドロン』猛暑のインナーを変えた新機能… 200万枚突破、大ヒットのワケ,20,https://news.yahoo.co.jp/articles/f496da0bacaabc312f1f46edb982adb1ed31026e,8/3(日) 5:01
2025-08-04,02:07,business,経済,11,ファイナンシャルフィールド,国の予想より「14年」も早く、出生数が70万人割れ！ 今の生活では実感がわかないけど…… 将来、何が起こるの？,20,https://news.yahoo.co.jp/articles/3f3f2002e3f66cc7242ac32d4e8460eb642a2d37,8/3(日) 9:10
2025-08-04,02:07,business,経済,12,読売新聞オンライン,三菱ＵＦＪ銀行が１年物の定期預金金利１・０％に引き上げ…期間限定、預入額の上限１００万円,19,https://news.yahoo.co.jp/articles/6db596abd30040000cf8d17f2662814f9ad964c6,8/4(月) 0:00
2025-08-04,02:07,business,経済,13,ベストカーWeb,なんと中国でEVが値引き合戦!? 急成長市場もまさかの息切れの気配か,17,https://news.yahoo.co.jp/articles/8d5a28758a602086cfd5e3c0637aad556844bf04,8/3(日) 9:00
2025-08-04,02:07,business,経済,14,FNNプライムオンライン（フジテレビ系）,1年前の「8月ショック」再来するか?アメリカ雇用悪化で市場は一変…週明け円高株安は,16,https://news.yahoo.co.jp/articles/64d48e9914c78fddb917badb6c9e3ac814c28ae5,8/3(日) 18:01
2025-08-04,02:07,business,経済,15,THE GOLD ONLINE（ゴールドオンライン）,"専業主婦として長い間支えてくれてありがとう…「退職金2,400万円」「年金329万円」感謝の気持ち「47万円のブランドバッグ」を買って帰宅した65歳夫。定年翌日、63歳妻から静かに告げられた〈人生が覆るひと言〉",15,https://news.yahoo.co.jp/articles/5a65f4d391cd68dcebbdaf1531f85a6347c30087,8/3(日) 5:01
2025-08-04,02:07,business,経済,16,テレビ朝日系（ANN）,小泉大臣 ため池給水を視察　渇水深刻でコメ生産ピンチ　異例の給水車も,14,https://news.yahoo.co.jp/articles/c2beb454b1a34e00e62e402546552405b465823f,8/3(日) 12:15
2025-08-04,02:07,business,経済,17,ファイナンシャルフィールド,「日本の平均年収は460万円」と聞きますが、これは東京や大阪など都市部のみでしょうか？地方在住だと、どれくらいの年収が“平均的”とされるのでしょうか？,14,https://news.yahoo.co.jp/articles/5a1e67bb3308da5bf7c02c0723208d501848a8e3,8/3(日) 11:40
2025-08-04,02:07,business,経済,18,東洋経済オンライン,イギリスではわずか44日で政権が崩壊、最近の金利上昇が示唆する“多党化時代”の日本に迫り来る「トリプル安」の恐怖,14,https://news.yahoo.co.jp/articles/cc12b89010befcd7e9164312eed216c68fdd27eb,8/3(日) 8:01
2025-08-04,02:07,business,経済,19,THE GOLD ONLINE（ゴールドオンライン）,日本で高福祉・高負担が難しい理由…日本がスウェーデンになれない“構造的な違い”とは【国際税務の専門家が解説】,13,https://news.yahoo.co.jp/articles/c795116e2fc3018253c8449df64ee6f341d6acda,8/3(日) 11:01
2025-08-04,02:07,business,経済,20,THE GOLD ONLINE（ゴールドオンライン）,山手線なのにマンションが安い…東京駅まで16分、都内屈指の人気散策エリアを庭にする「資産価値が落ちにくい」穴場駅【不動産のプロが推薦】,12,https://news.yahoo.co.jp/articles/4b3aa5a9e0a6ad1f59fa5f25441e7c92a12b09a1,8/3(日) 14:31
2025-08-04,02:07,business,経済,21,鉄道コム,「増発」「急行運転」はできないの？　「日本一混む路線」日暮里・舎人ライナーの改善が困難な理由とは,12,https://news.yahoo.co.jp/articles/1903efa5129e4b843c4a02ef842ce3396331783b,8/3(日) 10:35
2025-08-04,02:07,business,経済,22,ファイナンシャルフィールド,子どもが「医師」になりたいと言っています。世帯年収“600万円”なのですが、医療系の大学進学のためにいくら準備すればいいのでしょうか？,12,https://news.yahoo.co.jp/articles/88c02ce9c0c824a85d2507b65477874a706c1f17,8/3(日) 14:10
2025-08-04,02:07,business,経済,23,Bloomberg,ソニー、アニメと音楽の相乗効果で勝ち組に－グローバル展開加速,12,https://news.yahoo.co.jp/articles/2ea10fcafb83b44df68faddde72af6e8ba055e9f,8/3(日) 8:00
2025-08-04,02:07,business,経済,24,Finasee,65歳以上世帯「公的年金だけ」で生活している割合は？ 現実を直視する,12,https://news.yahoo.co.jp/articles/08d3a32fbccef44708feef84bd993c69c96507ca,8/3(日) 19:50
2025-08-04,02:07,business,経済,25,ベストカーWeb,残る? それとも消える? 人気スポーツモデルの気になる「今後」,12,https://news.yahoo.co.jp/articles/ac7d3e5cf95a0060edf11c37eb802482e82ff0b1,8/3(日) 21:00
2025-08-04,02:07,business,経済,26,ファイナンシャルフィールド,「誰も住んでいない家」を更地にしたら、固定資産税が「5万円→30万円」に…。空き家を放置せず壊したのになぜ税金が高くなるのでしょうか？,12,https://news.yahoo.co.jp/articles/8dc856df3d9f227828529cb2a1525b930c2799ea,8/3(日) 10:10
2025-08-04,02:07,business,経済,27,THE GOLD ONLINE（ゴールドオンライン）,働き者で優しい夫、享年69歳で死去。遺された妻、〈貯金300万円〉〈遺族年金月8万円〉の“あまりに厳しい現実”と“ひた隠しにされた秘密”に静かな涙「あまりに情けない」,12,https://news.yahoo.co.jp/articles/29612886d21b0785267a42b381f67603c0d54426,8/3(日) 10:01
2025-08-04,02:07,business,経済,28,ニューズウィーク日本版,結局、TACOだったトランプ米大統領...関税交渉で最悪の事態回避も、日本経済の厳しい夏は続く,11,https://news.yahoo.co.jp/articles/8b6c49d543a398df99ea2299817ddad92c8ba901,8/3(日) 11:30
2025-08-04,02:07,business,経済,29,東洋経済オンライン,国税庁とのバトルが激化、狭まる“富裕層包囲網”。ルールどおり申告しても待ったがかかるケース続出,10,https://news.yahoo.co.jp/articles/31ec984a670a0be3f678b74b5d4e02126ed9f723,8/3(日) 5:31
2025-08-04,02:07,business,経済,30,carview！,【17位転落の衝撃】ホンダ「フィット」が売れていない？ ライバルに大敗で“存在感が薄い”本当の理由とは,9,https://news.yahoo.co.jp/articles/344adc91e966844fa9c4233afd2d938e10ece35f,8/3(日) 13:00
2025-08-04,02:07,business,経済,31,ベストカーWeb,ホンダ シティは自由な発想と若々しいエネルギーから生まれた新時代のライヴビークル【愛すべき日本の珍車と珍技術】,9,https://news.yahoo.co.jp/articles/f5cae72dccb8576319c15e959a313b4f3de1897b,8/3(日) 20:00
2025-08-04,02:07,business,経済,32,ファイナンシャルフィールド,会社では飲み物を持参し、昼食は200円以内で手作り…都内で手取り19万円でもこんな生活をするしかないのですが、普通でしょうか？,9,https://news.yahoo.co.jp/articles/d0c65246f4049d5b17a6af47a2fda285ebbaca64,8/3(日) 11:30
2025-08-04,02:07,business,経済,33,WEB CARTOP,お前らプロならプロらしい運転してくれ！　元大型トラックドライバーが嘆く「街道仁義」を無視した大型トラックの「マナーの低下っぷり」,9,https://news.yahoo.co.jp/articles/e45e8dafb63bceb6a43d2735c7fd0bc36d9c053b,8/3(日) 20:10
2025-08-04,02:07,business,経済,34,共同通信,コメ直販、「増やす意向」が4割　価格高騰で協会初調査,9,https://news.yahoo.co.jp/articles/52fdcd94c94f42a9b8e9985ec51f221a819d046f,8/3(日) 15:11
2025-08-04,02:07,business,経済,35,AMP［アンプ］,東大32位・京大50位──QS世界大学ランキングが示す“研究大国ニッポン”後退とアジア勢の躍進,8,https://news.yahoo.co.jp/articles/f0cb2f3ddd402e23275c693433e80dcb402b219c,8/3(日) 12:04
2025-08-04,02:07,business,経済,36,LIMO,シニア世帯の平均生活費を確認！年金「月20万円」で生活できる？支出内訳から見える現実とは,8,https://news.yahoo.co.jp/articles/2cf426f6285b10a78f079c1247aa87a312602cb8,8/3(日) 11:46
2025-08-04,02:07,business,経済,37,みんかぶマガジン,「何でも無償化」の先は”地獄”が待っている…「医療費無償化で起きた子どもへの投薬過剰問題」それでも政府は減税を否定する,8,https://news.yahoo.co.jp/articles/2a19d241061448feef7cacc93d9c0cc05ad76a9d,8/3(日) 9:10
2025-08-04,02:07,business,経済,38,ファイナンシャルフィールド,「お盆の新幹線、高すぎ！」家族3人“東京→京都”の帰省が、日程次第で「7000円」以上お得になるって本当ですか？「行き・帰り」が安くなるスケジュールを解説,8,https://news.yahoo.co.jp/articles/9b7c3bb48c84cf2b333b424421600b55a3a2096b,8/3(日) 13:50
2025-08-04,02:07,business,経済,39,＆GP,330円でコスパ最強!?風量アップで後部座席までエアコンの風をしっかり飛ばせるように！【CARGoodsPress】,8,https://news.yahoo.co.jp/articles/c3805e62f2813882f479174cea4385cee69c1da2,8/3(日) 21:40
2025-08-04,02:07,business,経済,40,MotorFan,「往年のR30型スカイラインバンとどこまでも・・・」RB25DE＆amp;5速AT化で快速エステートに大変身!!,8,https://news.yahoo.co.jp/articles/194f74ea9d132349d41de9524f06b348bd716881,8/3(日) 7:30
