scrp_date,scrp_time,genre_en,genre_jp,rank,media_jp,title,comment,link,date_original
2025-06-23,17:11,business,経済,1,朝日新聞,「置き配」が標準、手渡しは追加料金　国交省が宅配の新ルール検討,611,https://news.yahoo.co.jp/articles/1275b37ccd4a212080bf5cff498fb7cdea617a68,6/23(月) 5:00
2025-06-23,17:11,business,経済,2,Bloomberg,原油先物が上げ幅縮小、米による核施設攻撃へのイランの反応待ちに,80,https://news.yahoo.co.jp/articles/68eb78204fdbe51198015d545c5139e94d175b33,6/23(月) 7:12
2025-06-23,17:11,business,経済,3,マネーポストWEB,パチスロ「ボーナストリガー」搭載機がデビューもユーザーから辛口評価の理由　ノーマルタイプとAT機で二極化するなか“中間層”を狙う機種の難しさ　“最後の一勝負”向きとの声も,64,https://news.yahoo.co.jp/articles/b9c7552516cda8c140402d66190af16951554e28,6/23(月) 16:15
2025-06-23,17:11,business,経済,4,毎日新聞,札幌ドームの「2期ぶり黒字」の裏にカラクリ　楽観できぬ経営状況,49,https://news.yahoo.co.jp/articles/952d991d9a3e5391dc243e180c402b8d54bac813,6/23(月) 13:18
2025-06-23,17:11,business,経済,5,ファイナンシャルフィールド,ガソリン代が高いと愚痴ったら、職場の先輩から「うちはコストコで140円台で給油してる」と驚きの返答が！ 自分も使いたいけど、ガソリン代だけのために会員になるのは“お得”にならないの？ 平均価格とも比較,34,https://news.yahoo.co.jp/articles/2ee4e16032b0acfca999aa8a14719d090b0ba155,6/23(月) 13:40
2025-06-23,17:11,business,経済,6,マネーポストWEB,【スーパーの中国産ピーマンから基準値超えの残留農薬】「冷凍加工で菌が完全に死滅したり、添加物や農薬が消えることは基本的にない」輸入冷凍食品のリスク,32,https://news.yahoo.co.jp/articles/9e59675de95758fe1feced291eddb135ce2ed2b7,6/23(月) 15:15
2025-06-23,17:11,business,経済,7,みんかぶマガジン,竹中平蔵「山尾志桜里さんの公認取り消し、不適切だ」国民民主党、政党としての正当性に疑問…日本の未来を左右するのは8月・9月の内閣改造,31,https://news.yahoo.co.jp/articles/c65fd5eaf2cb17edbdeee141e6d963b29bed08a4,6/23(月) 9:10
2025-06-23,17:11,business,経済,8,THE GOLD ONLINE（ゴールドオンライン）,日本人の平均給与「460万円」36年前と比べて「わずか8万円増」の衝撃…賃上げ実現のため政府が用意した“秘策”の正体【社労士が解説】,30,https://news.yahoo.co.jp/articles/c7be33a95f76f52fb4767d2e2235e397421a5f4d,6/23(月) 11:02
2025-06-23,17:11,business,経済,9,ITmedia ビジネスオンライン,高級おにぎりブームの裏に「凄腕IT人材」!?　“大人の遊び”が社会現象になるまで,28,https://news.yahoo.co.jp/articles/54c850f28c549682de992814c81205342055a132,6/22(日) 17:15
2025-06-23,17:11,business,経済,10,朝日新聞,郵政社長、不祥事続出「かなりマイナス」退任前に郵政法改正でも持論,27,https://news.yahoo.co.jp/articles/d19c239314a06d9496f781de2b4f32668f1d3855,6/23(月) 16:00
2025-06-23,17:11,business,経済,11,マネーポストWEB,日本で増殖する「中華系ネイルサロン」　勤務していた日本人ネイリストが見た驚きの内情「“オラオラ接客”で高額メニューに誘導」「初回来店客を練習台にしてトラブルも」,23,https://news.yahoo.co.jp/articles/e6fec288d7a29ba00d928d5e4c404251d0d20fa4,6/23(月) 15:16
2025-06-23,17:11,business,経済,12,THE GOLD ONLINE（ゴールドオンライン）,お金持ちじゃないふりをしています…年金17万円・大地主の65歳次男「資産億超え・月200万円の不労所得」も、20年来恋人にもひた隠し・地味暮らしを装う理由【FPが解説】,22,https://news.yahoo.co.jp/articles/dd26a2de1ce20df373a71bfeda53bed21152d6d0,6/23(月) 10:32
2025-06-23,17:11,business,経済,13,ファイナンシャルフィールド,夫が事故で亡くなり、私は妊娠7ヶ月、義父母は健在です。夫の遺産「1500万円」はどのように分割したらいいでしょうか？,22,https://news.yahoo.co.jp/articles/5b1ba8be5eb339f40aa8cc9fa511442696236eca,6/23(月) 11:42
2025-06-23,17:11,business,経済,14,ダイヤモンド・オンライン,「すみません、それ聞いてません」と言われたとき、頭のいい管理職は何と言う？,21,https://news.yahoo.co.jp/articles/3e3cd5de09589a03707fbfed6a369b7e80ee0cf3,6/23(月) 7:26
2025-06-23,17:11,business,経済,15,ニュースイッチ,踏み間違い事故防止装置、新型車に義務化へ,20,https://news.yahoo.co.jp/articles/ab860dfeccb37e381656ca77b4812b7fcbbd7b35,6/23(月) 13:10
2025-06-23,17:11,business,経済,16,ファイナンシャルフィールド,コンビニで現金払いしたら、同僚に「現金だと年1万円損するのと同じ」と言われてビックリ！ 現金だから“高く支払っている”わけではないと思うのですが、どういうこと？ 気づかず「損」しないためのポイントとは,20,https://news.yahoo.co.jp/articles/44b4de4c9a63e301b2f4dec1ced79d5149c5addf,6/23(月) 14:10
2025-06-23,17:11,business,経済,17,ニッポン放送,都議選終わる、参院選への影響は？「仰天シナリオ」も？,19,https://news.yahoo.co.jp/articles/8a2d3998e8b7e6687c5c87f339f23e4ac61ea812,6/23(月) 13:45
2025-06-23,17:11,business,経済,18,MotorFan,日産「セレナ」が2025年夏にもマイナーチェンジ!? フロントマスクをリフレッシュ＆ホイールベース延長！,19,https://news.yahoo.co.jp/articles/eea1663b1e6fdb8ab9e6950b2cfa5597ed7bc4d3,6/23(月) 11:36
2025-06-23,17:11,business,経済,19,共同通信,札幌ドーム、初の黒字　24年度決算、日ハム移転影響も,18,https://news.yahoo.co.jp/articles/6e1df33c9d41905c7a29f582ac83da2a5c48aeea,6/23(月) 12:45
2025-06-23,17:11,business,経済,20,東洋経済オンライン,「何か隠してるだろ」「メディア企業としてどうなんだ」との声もあるが…。日テレ「国分太一騒動で会見」”内容ゼロ”が実は真っ当であるワケ,18,https://news.yahoo.co.jp/articles/01708d8b98eba5b7deba850de324f202c0fd9003,6/23(月) 12:32
2025-06-23,17:11,business,経済,21,Bloomberg,都議選で自民・公明が大敗、参院選へ厳しい結果－立民や国民は議席増,18,https://news.yahoo.co.jp/articles/d2f854c5fede42466e4d47dbc60544e81ed08693,6/23(月) 11:48
2025-06-23,17:11,business,経済,22,FNNプライムオンライン,イオン熊本が備蓄米2200袋を販売開始し即日完売　5キロ1袋が税込み2138円　開店前に約400人が長蛇の列,17,https://news.yahoo.co.jp/articles/f282ddca42f3b808cbe2a9b41a0a6efb72be333e,6/23(月) 11:02
2025-06-23,17:11,business,経済,23,日経ビジネス,東京メトロ、運転士のスニーカー・ピアス着用OK　憧れの職業に採用難,15,https://news.yahoo.co.jp/articles/bd7c2f9e879fb742dad2b4243120fece4fb6c68c,6/23(月) 6:00
2025-06-23,17:11,business,経済,24,読売新聞オンライン,シニアのリゾートバイト増加、「やりがい」プラス老後資金…人手不足の観光地で即戦力,15,https://news.yahoo.co.jp/articles/63c5bab8d5fa4baabed968b6200912078ab4f824,6/23(月) 15:00
2025-06-23,17:11,business,経済,25,NOSWEB,ひと回り大きくなったミッドシップエクスプレス：非常にピーキーだった初期型｜1991年式 トヨタ MR2 Gリミテッド,15,https://news.yahoo.co.jp/articles/966abbd85fffbd2d4ed34352d33a9c050fc41a39,6/23(月) 15:02
2025-06-23,17:11,business,経済,26,TBS CROSS DIG with Bloomberg,パキスタン、トランプ氏をノーベル平和賞に推薦へ-対米関係強化図る,15,https://news.yahoo.co.jp/articles/d1aa840ab103d5ddc31230744627d6c710e3021b,6/23(月) 15:24
2025-06-23,17:11,business,経済,27,デイリー新潮,異なるメーカーの製品は同じトラックで運べない…「下請け企業」が頭を抱える大手メーカーの“ナゾすぎる商慣習”,15,https://news.yahoo.co.jp/articles/b0cf1c3d49f1e64cd33344e8bc5642262c40fa95,6/23(月) 9:10
2025-06-23,17:11,business,経済,28,ベストカーWeb,2026年春 or 夏……ついに日本導入!! スバル WRX S4に待望の6MTがやってくる!!,14,https://news.yahoo.co.jp/articles/03bc4d92b76d30f21286ea19a1e636320d10b77d,6/23(月) 11:00
2025-06-23,17:11,business,経済,29,AMP［アンプ］,「実家を出ない」「我慢してまで貯蓄しない」──Z世代が再定義する“新しい豊かさ”のかたち,14,https://news.yahoo.co.jp/articles/46aa44eabca5689870b41075a7889d3307f44ecb,6/23(月) 6:03
2025-06-23,17:11,business,経済,30,THE GOLD ONLINE（ゴールドオンライン）,え？なんで？…退職金が「100万円」も減るのに、65歳直前で辞めた同期。謎が深まるも、労いの席で聞いた“知られざる事実”に「最良の選択」と納得したワケ【FPが解説】,14,https://news.yahoo.co.jp/articles/e5273ecd2878d28ab861ba85c7cb120e6a3c739f,6/23(月) 5:02
2025-06-23,17:11,business,経済,31,くるまのニュース,「過積載絶対やらないで！」警察ブチギレ!? “大迷惑”「重量オーバートラック」を検挙！ ドライバーも運送会社も“荷主”も「全員処罰です」 人命軽視の「違法積載」強化取締りへ 茨城,14,https://news.yahoo.co.jp/articles/722b1967c722f38165aee6ad5266a57c61abaa72,6/23(月) 12:20
2025-06-23,17:11,business,経済,32,共同通信,空港係員、スニーカー着用　AIRDO、7月から,14,https://news.yahoo.co.jp/articles/5c347f322888696cf9febca7c2fe8403a0975056,6/23(月) 15:55
2025-06-23,17:11,business,経済,33,マネーポストWEB,プラチナNISA導入検討も「高齢者に資産運用させる必要はあるのか？」　60才過ぎてから投資に挑戦するシニアへの警鐘、「10年運用しても、増やせる保証はない」,13,https://news.yahoo.co.jp/articles/636ba7664812faca58169f3c07d894a24a99cb0b,6/23(月) 16:15
2025-06-23,17:11,business,経済,34,共同通信,札幌ドーム、日ハム本拠地移転後初の黒字,13,https://news.yahoo.co.jp/articles/2f69ad764d7192bbcacff6d7f8b85551b25fa46a,6/23(月) 11:48
2025-06-23,17:11,business,経済,35,テレビ朝日系（ANN）,5月の23区新築マンション 1億円超　人気エリアの超高額物件が価格を押し上げ,12,https://news.yahoo.co.jp/articles/3a3b449d4c8f53630ff887b705d9239b50b649a7,6/23(月) 15:37
2025-06-23,17:11,business,経済,36,LIMO,60歳以上の経済的暮らし向き「不安はない」が65.9％に。年金平均額はいくらか,12,https://news.yahoo.co.jp/articles/044b506d94958cfa1c67fb50a46bc0d97c0d8415,6/23(月) 14:52
2025-06-23,17:11,business,経済,37,ファイナンシャルフィールド,「新卒正社員・手取り17万円」vs「派遣社員・時給2500円」生涯賃金が“ほぼ同じ”なら、正社員でいるメリットはないの？「退職金・ボーナス」なども含め比較,12,https://news.yahoo.co.jp/articles/39d9d53b5142d59cc9d4f5de87c77f770104fef2,6/23(月) 11:30
2025-06-23,17:11,business,経済,38,ITmedia ビジネスオンライン,「アンナミラーズ」が3年ぶりに復活　空白の3年間、どこで何をしていた？,12,https://news.yahoo.co.jp/articles/09307195fb2d2fee6f76fe562a54aa9df4cdbbc9,6/23(月) 14:44
2025-06-23,17:11,business,経済,39,FNNプライムオンライン（フジテレビ系）,5月の東京23区新築マンション平均価格再び1億円台に　首都圏全体でも平均9396万円と1億円に迫る,12,https://news.yahoo.co.jp/articles/9149925e24a2c3e01347410fda0fb3338b291d39,6/23(月) 14:32
2025-06-23,17:11,business,経済,40,KOREA WAVE,韓国が「AI三大強国」入りへ本格始動…李在明大統領のAI戦略,12,https://news.yahoo.co.jp/articles/8d4cbc3cd28ae6f3bb1e2590f83645420851169e,6/23(月) 12:33
