scrp_date,scrp_time,genre_en,genre_jp,rank,media_jp,title,comment,link,date_original
2025-07-16,09:37,business,経済,1,毎日新聞,日産車体湘南も日産車の生産終了へ　社長「苦渋の決断だ」,118,https://news.yahoo.co.jp/articles/8deecb77ad5d5ea5e7ba253ef20b8b23e838f17c,7/15(火) 17:40
2025-07-16,09:37,business,経済,2,読売新聞オンライン,日産が追浜工場の閉鎖発表、九州工場に移管・統合へ…エスピノーサ社長「苦渋の判断」,115,https://news.yahoo.co.jp/articles/ccdb6afed8b956e065296a2d46b04d7a9ebd24ab,7/15(火) 14:50
2025-07-16,09:37,business,経済,3,FNNプライムオンライン（フジテレビ系）,「今年のコメ収穫量が前年比56万トン増の見通し」小泉農水相が発表　価格高騰など受け生産者の増産意欲が影響か,78,https://news.yahoo.co.jp/articles/19cdb16c0df987bca8ebf585d4589e79dd8f0f25,7/15(火) 12:32
2025-07-16,09:37,business,経済,4,共同通信,米、インドネシア関税合意　トランプ氏表明「19％に」,55,https://news.yahoo.co.jp/articles/825fb40c17f02edd914009a90d2d7d20ec04e8ad,7/16(水) 3:50
2025-07-16,09:37,business,経済,5,共同通信,大東建託、がん診断なら百万円　治療と業務の両立を支援,55,https://news.yahoo.co.jp/articles/9f2e6b67a15c857335742a60d43f611eed0ba48d,7/15(火) 15:36
2025-07-16,09:37,business,経済,6,TBS NEWS DIG Powered by JNN,長期金利が一時1.595%まで上昇　リーマンショック直後以来約17年ぶりの高水準,51,https://news.yahoo.co.jp/articles/3ddb5c35cb8c6d3e94eae751a61cffccc2a20660,7/15(火) 10:06
2025-07-16,09:37,business,経済,7,みんかぶマガジン,竹中平蔵「給料を上げるのは間違った政策だ」石破茂も結局はポピュリスト「利権団体を守る自民党」と参政党への危惧,49,https://news.yahoo.co.jp/articles/bfea5f0d58f1b820f5bb4be9c9d355f773100048,7/16(水) 9:10
2025-07-16,09:37,business,経済,8,読売新聞オンライン,「技術の日産」と呼ばれた名門復活へ、温存された過剰設備に大ナタ…「Ｖ字回復」再現なるか,48,https://news.yahoo.co.jp/articles/2081d845bb86b7c422ead51cb13ba2834576c0ad,7/16(水) 7:21
2025-07-16,09:37,business,経済,9,帝国データバンク,「上場企業」の平均年収、2024年度は671.1万円　「過去20年で最高」更新,47,https://news.yahoo.co.jp/articles/6d5cb91cb9952e9c0f559932bd7bfa8aa1936695,7/15(火) 10:00
2025-07-16,09:37,business,経済,10,NewsPicks ＋ｄ,日本で「子持ち様」論争が起きるのはなぜ？　女性同士の“もやもや”や“いがみ合い”を生む原因とは,46,https://news.yahoo.co.jp/articles/a6317ced13eb8f37c7910575315bca2bade23635,7/16(水) 7:05
2025-07-16,09:37,business,経済,11,毎日新聞,「ほっとした」「存在感高まる」　日産工場移管、九州経済界は安堵,45,https://news.yahoo.co.jp/articles/721eb585e591862278c30f72ede65d52e6946ba0,7/15(火) 20:26
2025-07-16,09:37,business,経済,12,ダイヤモンド・オンライン,「『本当の賢さ』と学歴はまったくの別物だと思います。低学歴でも地頭はいい人はいます」。学歴と知力の関係性を考える,32,https://news.yahoo.co.jp/articles/2ad3fd349ea37b226a6dc1aead92de5ecf6265a6,7/16(水) 6:21
2025-07-16,09:37,business,経済,13,マネーポストWEB,渋谷の高級住宅地・松濤の物件を中国富裕層が“インバウンド購入”の実態　「ローンを組まずに現金払いが多い」と中国系不動産業者、“松濤爆買い”の今後はどうなるか,29,https://news.yahoo.co.jp/articles/b25241dfac82bdaa05579ea4ac4b10a6696fa938,7/16(水) 7:15
2025-07-16,09:37,business,経済,14,BUSINESS INSIDER JAPAN,ランクルは300、250、70…どのモデルがベストバイ？ レクサス版とも比較、資産性も考えると…,27,https://news.yahoo.co.jp/articles/afcb420c70f748556dc8156f7c01a3269d2cf004,7/16(水) 7:00
2025-07-16,09:37,business,経済,15,ベストカーWeb,もう歳だから…と思わない!!! 高齢になっても「クルマ好きを主張できる」ラクラク車4選,26,https://news.yahoo.co.jp/articles/1c4177b8ecf924643fda32fc148c9d1abf8adced,7/16(水) 8:00
2025-07-16,09:37,business,経済,16,TBS NEWS DIG Powered by JNN,消費税の減税・廃止論めぐり村上総務大臣が懸念「地方税収に穴」,24,https://news.yahoo.co.jp/articles/e64e77e2791280d6e65bc499ef828c7c1a2b66ef,7/15(火) 14:33
2025-07-16,09:37,business,経済,17,朝日新聞,日本生命社員、出向先の銀行情報を不正持ち出し　「逆流厳禁」で共有,22,https://news.yahoo.co.jp/articles/d48521e241c54100e4eaae9a7da1b438b0ab03e0,7/15(火) 17:00
2025-07-16,09:37,business,経済,18,ITmedia ビジネスオンライン,「Agodaのシステムには何らかの問題がある」　ホテル業界が名指しで批判しても、事態が改善しなさそうな理由,22,https://news.yahoo.co.jp/articles/53cdff289612eac1040603f24db3a207c21342e1,7/16(水) 5:55
2025-07-16,09:37,business,経済,19,毎日新聞,「未来なくなるのと一緒」　日産生産終了で地元に落胆広がる　神奈川,20,https://news.yahoo.co.jp/articles/14ec18fb06e38c087c1fce09e5a892e70bfa82be,7/16(水) 6:00
2025-07-16,09:37,business,経済,20,読売新聞オンライン,日産「マザー工場」閉鎖、聖域なきリストラ断行の構え示す…トランプ関税・中国販売不振で再建遠く,18,https://news.yahoo.co.jp/articles/495fb600f45d9b503b5e5c959632971c85913bc4,7/16(水) 5:00
2025-07-16,09:37,business,経済,21,時事通信,日産の象徴、65年の歴史に幕　追浜工場、活用策を検討,18,https://news.yahoo.co.jp/articles/7245f5b13d0050a59980fcb9725ed34ed8280339,7/16(水) 7:06
2025-07-16,09:37,business,経済,22,ビジネス＋IT,二俣川だけじゃない？相鉄線が「激アツ路線」になってきた理由、沿線価値上昇の秘密,18,https://news.yahoo.co.jp/articles/72984204b5f8eda797d8bf07c47cec54381d433b,7/16(水) 6:50
2025-07-16,09:37,business,経済,23,週プレNEWS,"高残価率のアルファード、ヴェルファイアの「新車乗り継ぎ」に暗雲!?　""残クレ民""の未来が中東情勢とリンクする理由",17,https://news.yahoo.co.jp/articles/9bbce592929fba283f032a6bbbaedeadb0faffee,7/15(火) 18:00
2025-07-16,09:37,business,経済,24,LIMO,【国民健康保険料】上限額は引き上げに。所得500万円の人なら保険料は年額で「70万円超え」の自治体も,17,https://news.yahoo.co.jp/articles/282aec15c153b87d8f9d47483a24ca9948a8ca05,7/16(水) 7:02
2025-07-16,09:37,business,経済,25,くるまのニュース,不正改造車「43台」を“一斉検挙”！ 「ただちにクルマを直しなさい！」命令も!? 「大黒PA」集結の“大迷惑”「爆音マフラー」「シャコタン」を排除！ 「今後も取締ります」宣言 神奈川,17,https://news.yahoo.co.jp/articles/5cb34e116cebc6a7f5ef73b11f928aca39c079b0,7/16(水) 7:20
2025-07-16,09:37,business,経済,26,THE GOLD ONLINE（ゴールドオンライン）,老人ホーム職員「至急、本人・家族と面談したい」…埼玉県草加市、待機者426人の〈特養〉に80代父が申請1か月ですんなり入所できたワケ,16,https://news.yahoo.co.jp/articles/11d9b580248de3ae25b655dc0bcb0788490036fd,7/16(水) 7:32
2025-07-16,09:37,business,経済,27,TBS NEWS DIG Powered by JNN,「苦渋の判断だった」日産自動車「追浜工場」生産を2027年度末に終了へ エスピノーサ社長が会見　横浜市 急遽「対策会議」開催,15,https://news.yahoo.co.jp/articles/2494bfb5f575469401d15317c6dc78a1985af745,7/15(火) 19:07
2025-07-16,09:37,business,経済,28,マネーポストWEB,「ヘビメタが生きがいです」Apple WatchのCMに一部のメタルファンが抱いた強い違和感　背景にある“ヘビメタ＝蔑称”論争を読み解く,15,https://news.yahoo.co.jp/articles/770e8d9b447377aa1d75138b10e8dd0b5464940e,7/15(火) 15:15
2025-07-16,09:37,business,経済,29,時事通信,異次元緩和、長期戦の様相に　遠のく2％物価目標　日銀15年上期議事録,13,https://news.yahoo.co.jp/articles/786b137efde054667afaf45aefdd9b7820ef2e93,7/16(水) 9:00
2025-07-16,09:37,business,経済,30,ファイナンシャルフィールド,そろそろ定年。「退職金2000万円」を一括で受け取ると「税金」でがっつり引かれるって本当？年金型との違いは？,13,https://news.yahoo.co.jp/articles/1149c8f9aef97b7109c3ceb832c6347559519cbf,7/16(水) 8:30
2025-07-16,09:37,business,経済,31,家電 Watch,プロ野球公式グッズで家電豊富なのは? 圧勝はあの球団,13,https://news.yahoo.co.jp/articles/56cb45826c3c7929e09928fb160a0a288f54e9af,7/16(水) 8:05
2025-07-16,09:37,business,経済,32,共同通信,追浜工場の生産を日産自動車九州に統合へ,12,https://news.yahoo.co.jp/articles/561779dcef98416ae7bfdb1b89e605d642bba0ae,7/15(火) 14:48
2025-07-16,09:37,business,経済,33,ベストカーWeb,50代以上のおじさんが思わず「イラっとくる」装備と一度味わったらないと困る「グッとくる」装備,11,https://news.yahoo.co.jp/articles/18f766fe1646332e96188a7c8c045f9ec8b5a7c9,7/15(火) 11:30
2025-07-16,09:37,business,経済,34,ファイナンシャルフィールド,50代独身で貯蓄は「1500万円」ありますが、老後資金は足りないでしょうか？50代はどのくらい貯蓄があるのが一般的ですか？,11,https://news.yahoo.co.jp/articles/f0b77bc24040a6d140dd4b11b1c1258f126b64b7,7/15(火) 13:50
2025-07-16,09:37,business,経済,35,産経新聞,長期国債の金利上昇、財政悪化への懸念映す　英国での「トラスショック」再現に警戒も,10,https://news.yahoo.co.jp/articles/41a95944e0c4e4471a7b2f5bdc510a4595b65711,7/15(火) 20:07
2025-07-16,09:37,business,経済,36,東洋経済オンライン,「あそこの串カツ田中、潰れたのか…え、そんな店に変わったの!?」　串カツ田中“跡地“に出現した「高級とんかつ店」の正体,10,https://news.yahoo.co.jp/articles/7236dae3e74213ef53a1fd3f25d51e9cdb846e2b,7/16(水) 7:21
2025-07-16,09:37,business,経済,37,TBS NEWS DIG Powered by JNN,「現金給付か消費減税か」財政悪化で日本国債の“信用”が課題に「金利急騰の恐怖感は底なし沼」【選挙の日、そのまえに】,10,https://news.yahoo.co.jp/articles/04dc64ccadb913841553f54cc85f961da8fdf37f,7/15(火) 12:19
2025-07-16,09:37,business,経済,38,日本の人事部,“賃金46％減”なぜ「子育てペナルティ」は生まれるのか　人事データから見えてきたその要因,10,https://news.yahoo.co.jp/articles/a3a0da66a86835394c6a82062fb2712b2c105d73,7/16(水) 7:31
2025-07-16,09:37,business,経済,39,集英社オンライン,石破首相「なめられてたまるか」トランプ関税は日本をもっと貧しくするか…価格転嫁できない中小企業経営者は「賃下げ」「ボーナスカット」「人員削減」も視野に,10,https://news.yahoo.co.jp/articles/71b15c35ef466e757c0bd361a6d1cc9bfec62142,7/16(水) 7:02
2025-07-16,09:37,business,経済,40,ファイナンシャルフィールド,父がエアコンの「無料点検」を頼んだら、“出張費”として「3300円」を請求されたそうです…。無料って書いてあったのに、請求されるのが普通なのでしょうか？,10,https://news.yahoo.co.jp/articles/9e2795cae51e79ad71e68b7bf70d58b5fd21a186,7/15(火) 12:30
