scrp_date,scrp_time,genre_en,genre_jp,rank,media_jp,title,comment,link,date_original
2025-01-16,19:07,TTL,総合,1,テレビ朝日系（ANN）,「頂き女子りりちゃん」実刑確定へ 　懲役8年6カ月詐欺などの罪　最高裁が上告棄却,634,https://news.yahoo.co.jp/articles/438b73fa2c006e5c269c4353041c3ac4bf7b7b0e,1/16(木) 17:15
2025-01-16,19:07,TTL,総合,2,文春オンライン,《資料入手》「フジ社長は“女性アナ接待”の常習者」中居正広9000万円トラブルを引き起こしたフジテレビの“上納文化”,492,https://news.yahoo.co.jp/articles/6343455dccc581c08fd455dca4ff8eab237a3714,1/16(木) 16:12
2025-01-16,19:07,TTL,総合,3,スポニチアネックス,フジテレビ社長17日会見へ　中居正広女性トラブル関連を説明か,485,https://news.yahoo.co.jp/articles/3616af4c815f866b7a35c4db8eb5da7664dbef9b,1/16(木) 12:09
2025-01-16,19:07,TTL,総合,4,時事通信,内閣支持、微増28．2％　国民民主、野党トップ　年収の壁「178万円」最多・時事世論調査,375,https://news.yahoo.co.jp/articles/3d37c4eef62d05159a6529418b0d0bfc0385ee58,1/16(木) 15:05
2025-01-16,19:07,TTL,総合,5,共同通信,津波避難指定ビルが受け入れ拒否　日向灘地震、宮崎の施設が謝罪,328,https://news.yahoo.co.jp/articles/9f41ee7ecc17c3a594482e8a42ba52d211f5740b,1/16(木) 15:40
2025-01-16,19:07,TTL,総合,6,FRIDAY,中居問題はフジだけでなくテレビ全体に…被害女性が続々＃Me Tooで局幹部やタレントは戦々恐々,292,https://news.yahoo.co.jp/articles/bf85cd5ff890f54229da3b8a92c12af6456f05ae,1/16(木) 17:00
2025-01-16,19:07,TTL,総合,7,KAB熊本朝日放送,生後数日で殺処分…「ジャージー牛のオスの現実知って」元ホストの繁殖農家の挑戦,273,https://news.yahoo.co.jp/articles/d2c538f4e047820e91890b79d804d955188955d1,1/16(木) 11:47
2025-01-16,19:07,TTL,総合,8,TBS NEWS DIG Powered by JNN,イチロー氏が殿堂入り！有資格1年目では史上7人目「何とか日本野球の力になりたい」岩瀬仁紀ら4名が選ばれる、王貞治氏も祝福,272,https://news.yahoo.co.jp/articles/a9ad994fa15af3de8790a161b22b0e40de506efd,1/16(木) 15:30
2025-01-16,19:07,TTL,総合,9,スポニチアネックス,フジ現役女性アナウンサーが告発　中居会食に呼ばれた　男性タレントが全裸で手招きも…拒絶　文春報道,271,https://news.yahoo.co.jp/articles/5bcaa8310ec5074b0cfcd48ec9a4d9e021f8485b,1/16(木) 4:10
2025-01-16,19:07,TTL,総合,10,TBS NEWS DIG Powered by JNN,「権力の濫用を野放しにすれば 危険な結末が待っている」バイデン大統領が国民に向けた“最後の演説”でトランプ新政権を痛烈批判,186,https://news.yahoo.co.jp/articles/592336dd6b7ddc945cdc3c0f5e163c939f5c02d6,1/16(木) 11:41
2025-01-16,19:07,TTL,総合,11,テレビ朝日系（ANN）,タワマン急増、人口3倍激増の武蔵小杉　町内会解散へ　防災体制どうする？,179,https://news.yahoo.co.jp/articles/50b5fd02a78e23d7d990022525ad873f555af3a8,1/16(木) 11:36
2025-01-16,19:07,TTL,総合,12,ENCOUNT,フジ、中居正広問題での社長会見を明日「記者会のみ」で強行へ…理由は「会見場が狭い」　生中継、配信もNG,178,https://news.yahoo.co.jp/articles/597eb04930648aa2d8325178b5aac8c399f59b91,1/16(木) 17:05
2025-01-16,19:07,TTL,総合,13,静岡放送（SBS）,どこまで責任問える?司法の判断は…家族3人殺害の被告に懲役30年「別人格」の捉え方【記者解説】,171,https://news.yahoo.co.jp/articles/f065f9d284ca68b7bad211aa405225eab633ab7c,1/15(水) 21:46
2025-01-16,19:07,TTL,総合,14,夕刊フジ,中居正広の復帰は2年後？　香川照之が一定の基準、松本人志のように配信でも　TV局側「支障なく続けられる」発言に反発,167,https://news.yahoo.co.jp/articles/80f70ca52f2f6b6cca5603847c29d22f422e40bf,1/16(木) 17:00
2025-01-16,19:07,TTL,総合,15,ピンズバNEWS,中居正広の女性トラブルが大炎上　 内部告発に大株主の激怒…フジテレビが迎えた「過去最大の窮地」,153,https://news.yahoo.co.jp/articles/07c6cfb0e153d3b8beaefa48911f2fd325fd603c,1/16(木) 7:12
2025-01-16,19:07,TTL,総合,16,TBS NEWS DIG Powered by JNN,「暴行の犯人であるとして有罪とする根拠はない」1歳児を死なせた罪に問われた元保育士に無罪判決　横浜地裁,153,https://news.yahoo.co.jp/articles/7dc10880e4e5fa72c45900d1a8dfa1f00fb8dac7,1/16(木) 15:01
2025-01-16,19:07,TTL,総合,17,ねとらぼ,「まじで終わってる」　マクドナルド「エヴァ」コラボ品“高額転売”に嘆く声……　「結局欲しい人が買えない」,151,https://news.yahoo.co.jp/articles/c9a918d8ebe38faf3c62dbb56b36767510583788,1/16(木) 14:53
2025-01-16,19:07,TTL,総合,18,産経新聞,＜独自＞川口クルド人ら業界団体を設立「日本クルド建設業協会」中東系解体業者は170社　「移民」と日本人,150,https://news.yahoo.co.jp/articles/8843601e3683ba11b902796c8de7b4f39de69a97,1/16(木) 11:48
2025-01-16,19:07,TTL,総合,19,SmartFLASH,「日本は9.5割ヴァカの国」千原せいじ　世間の“中居正広騒動一色”に苦言、政治への関心低下を嘆き共感殺到,148,https://news.yahoo.co.jp/articles/8fbd0f145bb07804ab39358301035757fa751443,1/16(木) 18:17
2025-01-16,19:07,TTL,総合,20,TBS NEWS DIG Powered by JNN,アメリカで合成着色料「赤色3号」が使用禁止に　動物にがんを引き起こすとの研究結果,147,https://news.yahoo.co.jp/articles/5e946751fdddf9c0424867df350c4297abac871f,1/16(木) 6:05
2025-01-16,19:07,TTL,総合,21,時事通信,半沢頭取ら報酬減額処分　貸金庫窃盗、追加防止策も　三菱UFJ銀,144,https://news.yahoo.co.jp/articles/0c0915b97cb6d9c2c2e4556b0e4dfb9c63fedc3c,1/16(木) 15:39
2025-01-16,19:07,TTL,総合,22,夕刊フジ,石破政権がガソリン値上がりを〝放置〟　補助金縮小、今後185円近くに　荻原博子氏「国民民主の手柄にしたくないのか…」,143,https://news.yahoo.co.jp/articles/70c0a547d8bb7f71596df06fc769737a8aabf4b2,1/16(木) 17:00
2025-01-16,19:07,TTL,総合,23,女性自身,《“前例”ができた》女性トラブルの中居正広、日テレ『ザ！世界仰天ニュース』降板で次に“クビになる番組”,137,https://news.yahoo.co.jp/articles/ce703e4e5a9dd2fd938b7932692952726bee07fd,1/16(木) 15:52
2025-01-16,19:07,TTL,総合,24,時事通信,メダル劣化、返送相次ぐ　選手から100個以上―パリ五輪,136,https://news.yahoo.co.jp/articles/1a57465ffd2de03ad35b2a2d286875ad5e346153,1/16(木) 13:32
2025-01-16,19:07,TTL,総合,25,夕刊フジ,広島「夏場のデーゲーム」消滅に複雑　地元テレビ局から要請も…「ナイターは編成上、番組差し替えのハードル上がる」と球団関係者,133,https://news.yahoo.co.jp/articles/fb581ebca16d47a6edd625685e5bbf986b27f1a7,1/16(木) 17:00
2025-01-16,19:07,TTL,総合,26,スポーツ報知,【広島】オリックスにＦＡ移籍した九里亜蓮の補償は金銭に決定　昨季年俸６０％相当の推定８４００万円,128,https://news.yahoo.co.jp/articles/f64706e3d4dbcdb0b1e4d89e7420578c5b4cbc23,1/16(木) 16:03
2025-01-16,19:07,TTL,総合,27,スポニチアネックス,中居の女性トラブル騒動で渦中の、名物プロデューサーだったフジ幹部が出社停止「心身の負担が募っている」,128,https://news.yahoo.co.jp/articles/957dfa3bf39550f8d5bb7cdb0fd28311d998774e,1/16(木) 4:10
2025-01-16,19:07,TTL,総合,28,集英社オンライン,「SNS監修はPR会社にお願いすることに」神戸市議が暴露した決定的証拠のLINEは警察にも持ちこまれていた…その意図とは？〈兵庫県政大混乱〉,124,https://news.yahoo.co.jp/articles/649cbd49ee0a08f0a65d6dd815dd0d16da76776a,1/16(木) 11:02
2025-01-16,19:07,TTL,総合,29,スポニチアネックス,オズワルド伊藤　妹・沙莉の結婚を発表前に生放送ラジオで暴露し「鼻血が出るぐらい怒られました」,117,https://news.yahoo.co.jp/articles/cdab1c16bb205bfa4b97a395a9cf7832b8ba330c,1/16(木) 16:13
2025-01-16,19:07,TTL,総合,30,日刊スポーツ,フジ「Mr.サンデー」今春２時間枠拡大「だれかtoなかい」後任番組　裏は「有働Times」,111,https://news.yahoo.co.jp/articles/c5ed3b3c532a395886a55f1e8bfc03da68aeac9f,1/16(木) 5:00
2025-01-16,19:07,TTL,総合,31,J-CASTニュース,「非常に残念」禁煙の部屋で大量喫煙　出禁にして清掃費も請求、温泉宿が明かした呆れる実態,109,https://news.yahoo.co.jp/articles/96730f3d455c71439f47491ef23f87a13afe1729,1/16(木) 14:14
2025-01-16,19:07,TTL,総合,32,THE GOLD ONLINE（ゴールドオンライン）,氷河期世代の暗黒「正規で働きたいのに…」→「年金をもらうのすら厳しい」老後破産の現実味,109,https://news.yahoo.co.jp/articles/a72c07b2f339c32faa3f122afbd61eadbff3f4cd,1/16(木) 17:09
2025-01-16,19:07,TTL,総合,33,ENCOUNT,中居正広問題、文春が新たな「フジ女性アナ」“告発”掲載…大株主は激怒、OBは心配「第三者委員会の設置を」,106,https://news.yahoo.co.jp/articles/b3604ee290e3d37670ae0accb97779f60f5490ff,1/16(木) 8:14
2025-01-16,19:07,TTL,総合,34,よろず～ニュース,「千切りキャベツ」量が減っちゃう！パッケージサラダ大手が決断「安定供給のため」一時的に変更,101,https://news.yahoo.co.jp/articles/de11364a008ca87521b7b4a734244da7a3b1527c,1/16(木) 15:50
2025-01-16,19:07,TTL,総合,35,共同通信,イオンが中華丼5万個回収　樹脂混入の可能性,101,https://news.yahoo.co.jp/articles/1c44cd6b61771f4c430871585ceff09cd1baba96,1/16(木) 11:40
2025-01-16,19:07,TTL,総合,36,まいどなニュース,老舗温泉宿の禁煙室に吸い殻…強烈なタバコ臭→客を出禁に「最低限のルール守って」,101,https://news.yahoo.co.jp/articles/73374078e8da6af3b39d7fdd434303603f04f49c,1/16(木) 8:30
2025-01-16,19:07,TTL,総合,37,SmartFLASH,『水ダウ』ヘビを天井から落下させるドッキリに集まる不快感…日本爬虫類両生類協会が指摘する「動物愛護法違反と告発される可能性」,99,https://news.yahoo.co.jp/articles/aed13484b6ea18dd124af8c78288a3e0a15fcf4e,1/16(木) 18:27
2025-01-16,19:07,TTL,総合,38,読売新聞オンライン,万博のチケット購入方法「複雑だ」…参加国から改善求める声「買おうとしている人を怒らせる」,95,https://news.yahoo.co.jp/articles/d9f8c35812f93ac2f57257b005f0a8d8f00eb829,1/16(木) 9:48
2025-01-16,19:07,TTL,総合,39,日テレNEWS NNN,三菱UFJ銀行、半沢頭取らの報酬減額処分へ　元行員の貸金庫窃盗事件で,93,https://news.yahoo.co.jp/articles/2a82b484970552e43a7b0355edf02d9d1dc1f438,1/16(木) 11:46
2025-01-16,19:07,TTL,総合,40,中日スポーツ,イチローさん満票ならず「逆張りしとる7・4％なんやねん」「誰やったら満票取れんねん」ネットは疑問の声【野球殿堂】,91,https://news.yahoo.co.jp/articles/20df5aca9dc2d2454e212eada26d27bcf6d6bb36,1/16(木) 18:00
