scrp_date,scrp_time,genre_en,genre_jp,rank,media_jp,title,comment,link,date_original
2024-10-24,06:06,domestic,国内,14:07在留ベトナム人が見た日本の選挙　選挙権のない彼女たちの衆院選への期待メ〜テレ（名古屋テレビ）10/23(水) 14:00358件/時,メ〜テレ（名古屋テレビ）,在留ベトナム人が見た日本の選挙　選挙権のない彼女たちの衆院選への期待,358,https://news.yahoo.co.jp/articles/f235320dbc75b2b8643e9c99f9312fc3c146a2bf,10/23(水) 14:00
2024-10-24,06:06,domestic,国内,2自民、非公認候補の支部に助成金2000万円　「活動費」と説明毎日新聞10/23(水) 12:44311件/時,毎日新聞,自民、非公認候補の支部に助成金2000万円　「活動費」と説明,311,https://news.yahoo.co.jp/articles/cd107c1578d9ba89945f91091250bdf023465f80,10/23(水) 12:44
2024-10-24,06:06,domestic,国内,3山の斜面が丸刈りに「迷惑施設化」する再エネ施設　脱炭素で原発回帰にかじ、福島から懸念の声毎日新聞10/23(水) 17:03207件/時,毎日新聞,山の斜面が丸刈りに「迷惑施設化」する再エネ施設　脱炭素で原発回帰にかじ、福島から懸念の声,207,https://news.yahoo.co.jp/articles/91c6da03e99791d57ba2196156bcb3ebda8f94fe,10/23(水) 17:03
2024-10-24,06:06,domestic,国内,4「偽装非公認」「なぜ税金2000万円が裏金議員に」自民党が非公認候補へ2000万円支給し国民怒り心頭、森山幹事長は「候補ではなく支部」言い訳の破廉恥SmartFLASH10/23(水) 20:43195件/時,SmartFLASH,「偽装非公認」「なぜ税金2000万円が裏金議員に」自民党が非公認候補へ2000万円支給し国民怒り心頭、森山幹事長は「候補ではなく支部」言い訳の破廉恥,195,https://news.yahoo.co.jp/articles/e0e3e5ca1776855610c6f3621c67fcdc3fd384d4,10/23(水) 20:43
2024-10-24,06:06,domestic,国内,5「心底腹が立つ」丸川珠代氏　選挙演説での“涙アピール”に疑問続出…有名実業家も「クソしょうもねえ」女性自身10/23(水) 19:10179件/時,女性自身,「心底腹が立つ」丸川珠代氏　選挙演説での“涙アピール”に疑問続出…有名実業家も「クソしょうもねえ」,179,https://news.yahoo.co.jp/articles/e7f0a8cd057fec7783649c7dde5babd8033d4510,10/23(水) 19:10
2024-10-24,06:06,domestic,国内,6【速報】与党で過半数割れの可能性も　日本保守党は政党要件満たす見込み　衆院選JNN終盤情勢調査TBS NEWS DIG Powered by JNN10/23(水) 17:50150件/時,TBS NEWS DIG Powered by JNN,【速報】与党で過半数割れの可能性も　日本保守党は政党要件満たす見込み　衆院選JNN終盤情勢調査,150,https://news.yahoo.co.jp/articles/e5a3d5a4ce203e4e8ed4c6925299825173039a58,10/23(水) 17:50
2024-10-24,06:06,domestic,国内,7「限りなくナメてる」自民党“裏金非公認”候補への「税金2000万円」支給に国民の怒り爆発…公約の「ルールを守る」もガン無視女性自身10/23(水) 18:50142件/時,女性自身,「限りなくナメてる」自民党“裏金非公認”候補への「税金2000万円」支給に国民の怒り爆発…公約の「ルールを守る」もガン無視,142,https://news.yahoo.co.jp/articles/226ecec5f9c70b8e08108003ae3fac64045a73e9,10/23(水) 18:50
2024-10-24,06:06,domestic,国内,8〈本人直撃〉なぜ家系ラーメン店はライス残し客にDM連絡を要求したのか「あれ以降クズ、潰れろ、中卒だのＤＭが来ます」　　集英社オンライン10/23(水) 11:02132件/時,集英社オンライン,〈本人直撃〉なぜ家系ラーメン店はライス残し客にDM連絡を要求したのか「あれ以降クズ、潰れろ、中卒だのＤＭが来ます」,132,https://news.yahoo.co.jp/articles/138c96af81ef1612efe14f26dba80117e0d06cc1,10/23(水) 11:02
2024-10-24,06:06,domestic,国内,9自民党「裏金非公認議員にも2000万円支給」にネット紛糾「これはひどい」「非公認ってなに？　国民のことなめすぎ」中日スポーツ10/23(水) 15:58129件/時,中日スポーツ,自民党「裏金非公認議員にも2000万円支給」にネット紛糾「これはひどい」「非公認ってなに？　国民のことなめすぎ」,129,https://news.yahoo.co.jp/articles/1f9a0ef67e8c332e6c578ce99aab52109df330c1,10/23(水) 15:58
2024-10-24,06:06,domestic,国内,10《自民衝撃の197議席》衆院選、どこよりも詳しい「最終予測」は…政権交代以来の大惨敗！「石破内閣は21世紀最低の数字に」【選挙情勢最新レポート】文春オンライン10/23(水) 16:12115件/時,文春オンライン,《自民衝撃の197議席》衆院選、どこよりも詳しい「最終予測」は…政権交代以来の大惨敗！「石破内閣は21世紀最低の数字に」【選挙情勢最新レポート】,115,https://news.yahoo.co.jp/articles/1bc176b58d957328481aec9e4f6b8201b10d4c23,10/23(水) 16:12
2024-10-24,06:06,domestic,国内,11石破首相、立民は「悪夢のような民主党政権」　立民・野田氏は自民の世襲選挙を批判「失われた30年」スポニチアネックス10/24(木) 5:20112件/時,スポニチアネックス,石破首相、立民は「悪夢のような民主党政権」　立民・野田氏は自民の世襲選挙を批判「失われた30年」,112,https://news.yahoo.co.jp/articles/efe1703a07e0fa42ffc6dd6347f496931dca84a8,10/24(木) 5:20
2024-10-24,06:06,domestic,国内,12闇バイトが住宅侵入、1階の母親助けるため棒を床に叩きつけながら叫び撃退テレビ朝日系（ANN）10/23(水) 11:16109件/時,テレビ朝日系（ANN）,闇バイトが住宅侵入、1階の母親助けるため棒を床に叩きつけながら叫び撃退,109,https://news.yahoo.co.jp/articles/491ca683cc4f37b8b98817d4f6408326fbd28b32,10/23(水) 11:16
2024-10-24,06:06,domestic,国内,13「裏金、裏金と言われて、心痛んでいる」　萩生田光一氏が集会で語った“まるで被害者”な本音デイリー新潮10/23(水) 11:4289件/時,デイリー新潮,「裏金、裏金と言われて、心痛んでいる」　萩生田光一氏が集会で語った“まるで被害者”な本音,89,https://news.yahoo.co.jp/articles/57a7bde18b3c37e85dbab90d1035ec142db86ed1,10/23(水) 11:42
2024-10-24,06:06,domestic,国内,140:49「死刑でしか償えないと思っている」東京・狛江市の強盗致死事件などの実行役　被害者や遺族に対して涙ながらに謝罪FNNプライムオンライン（フジテレビ系）10/24(木) 0:3986件/時,FNNプライムオンライン（フジテレビ系）,「死刑でしか償えないと思っている」東京・狛江市の強盗致死事件などの実行役　被害者や遺族に対して涙ながらに謝罪,86,https://news.yahoo.co.jp/articles/92c9e99e3f08a38374af59d66ce0d5227f8a62fa,10/24(木) 0:39
2024-10-24,06:06,domestic,国内,15声上げて泣き出す…“頂き女子りりちゃん”裁判中に号泣 母が明かした理由「結局刑務所に入らないといけないと…」FNNプライムオンライン10/23(水) 20:0284件/時,FNNプライムオンライン,声上げて泣き出す…“頂き女子りりちゃん”裁判中に号泣 母が明かした理由「結局刑務所に入らないといけないと…」,84,https://news.yahoo.co.jp/articles/eea0794e56f543cfafce57d1565291fe54ecae95,10/23(水) 20:02
2024-10-24,06:06,domestic,国内,16自民総裁選で注目された選択的夫婦別姓制度が公約で後回しになる理由　ジェンダー平等は争点化されにくい？各党の主張を読むポイントを聞く【衆院選２０２４】47NEWS10/23(水) 11:0283件/時,47NEWS,自民総裁選で注目された選択的夫婦別姓制度が公約で後回しになる理由　ジェンダー平等は争点化されにくい？各党の主張を読むポイントを聞く【衆院選２０２４】,83,https://news.yahoo.co.jp/articles/5d0501b76f9162e3889c04b6adc47a4c77ed1eed,10/23(水) 11:02
2024-10-24,06:06,domestic,国内,17自民にまた裏金問題　非公認候補者の党支部に活動費2000万円支給　立民・野田代表「国民を欺いている」スポニチアネックス10/24(木) 5:3077件/時,スポニチアネックス,自民にまた裏金問題　非公認候補者の党支部に活動費2000万円支給　立民・野田代表「国民を欺いている」,77,https://news.yahoo.co.jp/articles/a6b3642a3d4709c1b19d67747a331816f259412f,10/24(木) 5:30
2024-10-24,06:06,domestic,国内,18福井・中3殺害事件　服役後の男性に再審認める　名古屋高裁金沢支部毎日新聞10/23(水) 10:0273件/時,毎日新聞,福井・中3殺害事件　服役後の男性に再審認める　名古屋高裁金沢支部,73,https://news.yahoo.co.jp/articles/c46cb735bb4ae4733faaab9f0951af51caea6ed6,10/23(水) 10:02
2024-10-24,06:06,domestic,国内,19石破おろしで「玉木首相」誕生？　国民民主、連立入りなら首班要求を　高市氏を後継にしたくない菅氏や森山氏、岸田前首相の再登板も夕刊フジ10/23(水) 17:0070件/時,夕刊フジ,石破おろしで「玉木首相」誕生？　国民民主、連立入りなら首班要求を　高市氏を後継にしたくない菅氏や森山氏、岸田前首相の再登板も,70,https://news.yahoo.co.jp/articles/35f669db4ae35fd24976e190a3ca51cad37feee0,10/23(水) 17:00
2024-10-24,06:06,domestic,国内,20「まさかの劣勢」に自民党関係者も絶句…最新調査で判明した激戦区東京「落選が危ぶまれる大物議員」の名前プレジデントオンライン10/23(水) 7:1769件/時,プレジデントオンライン,「まさかの劣勢」に自民党関係者も絶句…最新調査で判明した激戦区東京「落選が危ぶまれる大物議員」の名前,69,https://news.yahoo.co.jp/articles/acdd4b1aecad28ea9bfc1bb2d1c94e6d55d02463,10/23(水) 7:17
2024-10-24,06:06,domestic,国内,21【法廷ルポ】「アポ電強致死」やり直し裁判で3被告に無期懲役　3年前「よっしゃー」と叫んだ男は憮然とした表情を浮かべ「傍聴席にガンを飛ばしまくっていた」デイリー新潮10/23(水) 14:3665件/時,デイリー新潮,【法廷ルポ】「アポ電強致死」やり直し裁判で3被告に無期懲役　3年前「よっしゃー」と叫んだ男は憮然とした表情を浮かべ「傍聴席にガンを飛ばしまくっていた」,65,https://news.yahoo.co.jp/articles/f9e40d3927fe667c711c583e95843bf3eeb16259,10/23(水) 14:36
2024-10-24,06:06,domestic,国内,220:38横浜市港北区の路上で小2男児　重機にはねられ心肺停止日テレNEWS NNN10/23(水) 20:5663件/時,日テレNEWS NNN,横浜市港北区の路上で小2男児　重機にはねられ心肺停止,63,https://news.yahoo.co.jp/articles/a2ad6c503cc4842ed3e1bac1ce39f71c9f2557fd,10/23(水) 20:56
2024-10-24,06:06,domestic,国内,23再審開始決定「浮かれるわけにはいかない」　21歳で逮捕、司法判断が二転三転産経新聞10/23(水) 11:0662件/時,産経新聞,再審開始決定「浮かれるわけにはいかない」　21歳で逮捕、司法判断が二転三転,62,https://news.yahoo.co.jp/articles/9c0e7e61a09f1f91bc4419386a9928e37e6d1d79,10/23(水) 11:06
2024-10-24,06:06,domestic,国内,24「萩生田さんをみんなでいじめて…でも負けやしない」誇りだった‟八王子の元ヤン”激戦東京24区に市民大困惑「いや地元の恥だ」みんかぶマガジン10/23(水) 9:1059件/時,みんかぶマガジン,「萩生田さんをみんなでいじめて…でも負けやしない」誇りだった‟八王子の元ヤン”激戦東京24区に市民大困惑「いや地元の恥だ」,59,https://news.yahoo.co.jp/articles/9f1e9291a36c2003548683579dd617a364b11c23,10/23(水) 9:10
2024-10-24,06:06,domestic,国内,25夫婦で落選の危機にある丸川珠代氏　「悪質さでは群を抜く」「自分で政治資金規正法違反を認めている」デイリー新潮10/23(水) 6:0658件/時,デイリー新潮,夫婦で落選の危機にある丸川珠代氏　「悪質さでは群を抜く」「自分で政治資金規正法違反を認めている」,58,https://news.yahoo.co.jp/articles/8c6448e01451f21699ce596af16f8fc5a7644723,10/23(水) 6:06
2024-10-24,06:06,domestic,国内,26「私も死にもの狂い」石破首相、あまりの劣勢に緊急通達で鼓舞…“過半数割れ” 見越し「国民民主」との “イヤイヤ連立” も議論SmartFLASH10/23(水) 18:5853件/時,SmartFLASH,「私も死にもの狂い」石破首相、あまりの劣勢に緊急通達で鼓舞…“過半数割れ” 見越し「国民民主」との “イヤイヤ連立” も議論,53,https://news.yahoo.co.jp/articles/512bb5d88bdef0de1ff38f68d12b8b51dce2b9cc,10/23(水) 18:58
2024-10-24,06:06,domestic,国内,27国民民主・岡野純子氏、疲労回復のため「点滴」に批判→「軽はずみな投稿」謝罪　「当然自由診療」と説明J-CASTニュース10/23(水) 20:1648件/時,J-CASTニュース,国民民主・岡野純子氏、疲労回復のため「点滴」に批判→「軽はずみな投稿」謝罪　「当然自由診療」と説明,48,https://news.yahoo.co.jp/articles/37ac2e370ca9d004f285e9250f5ce06d8603d6bf,10/23(水) 20:16
2024-10-24,06:06,domestic,国内,28川崎の繁華街で５０代男性に暴行加え、死亡させた疑い…１９歳の「客引き」２人逮捕読売新聞オンライン10/24(木) 5:0046件/時,読売新聞オンライン,川崎の繁華街で５０代男性に暴行加え、死亡させた疑い…１９歳の「客引き」２人逮捕,46,https://news.yahoo.co.jp/articles/f0a7ce346d652aa73009dc5acda8bce2ab166b58,10/24(木) 5:00
2024-10-24,06:06,domestic,国内,29議員の“資質”疑問視続きの今井絵理子氏、衆院選応援に引っ張りだこの背景に参院「沖縄県選挙区」目指す“野望”SmartFLASH10/23(水) 20:2444件/時,SmartFLASH,議員の“資質”疑問視続きの今井絵理子氏、衆院選応援に引っ張りだこの背景に参院「沖縄県選挙区」目指す“野望”,44,https://news.yahoo.co.jp/articles/834da908ef4f347caa3966a1464c70ec8886f91c,10/23(水) 20:24
2024-10-24,06:06,domestic,国内,30「世耕弘成氏の復党はありません」「非常に残念」森山𥙿幹事長（79）が後藤謙次氏に明かした“裏金議員の復党問題”文春オンライン10/23(水) 16:1243件/時,文春オンライン,「世耕弘成氏の復党はありません」「非常に残念」森山𥙿幹事長（79）が後藤謙次氏に明かした“裏金議員の復党問題”,43,https://news.yahoo.co.jp/articles/074c49dbaa667aae4d9394e80a0ffddb33974b89,10/23(水) 16:12
2024-10-24,06:06,domestic,国内,31〈横浜・強盗殺人〉「もうモンストできない」親友が語った“闇バイト”22歳男のフツーすぎる素顔と“ホワイト案件”の罠集英社オンライン10/23(水) 19:3943件/時,集英社オンライン,〈横浜・強盗殺人〉「もうモンストできない」親友が語った“闇バイト”22歳男のフツーすぎる素顔と“ホワイト案件”の罠,43,https://news.yahoo.co.jp/articles/91af0d6793ff61db6fd8f100846e7758d6b9a689,10/23(水) 19:39
2024-10-24,06:06,domestic,国内,32自民、裏金非公認支部へ2千万円　森山幹事長「党勢拡大の活動費」共同通信10/23(水) 16:1942件/時,共同通信,自民、裏金非公認支部へ2千万円　森山幹事長「党勢拡大の活動費」,42,https://news.yahoo.co.jp/articles/2c6b29d5d690695c4a62edb39d5bcbb42ff8d1ff,10/23(水) 16:19
2024-10-24,06:06,domestic,国内,3313:16「子どもを投げてつぶしたい」保護者が暴いた“保育虐待”の実態　記録された保育士たちの異常な暴言行政の限界も…なぜ防げない?【news23】TBS NEWS DIG Powered by JNN10/23(水) 14:1942件/時,TBS NEWS DIG Powered by JNN,「子どもを投げてつぶしたい」保護者が暴いた“保育虐待”の実態　記録された保育士たちの異常な暴言行政の限界も…なぜ防げない?【news23】,42,https://news.yahoo.co.jp/articles/d13b2616a2cc4aeb99f0a5bd365cd96a29cedc2e,10/23(水) 14:19
2024-10-24,06:06,domestic,国内,34「生活保護バッシング」から見えた「もれなく救う」と「不正受給を防ぐ」のジレンマ 、生活保護制度の理想と現実Wedge（ウェッジ）10/24(木) 5:0241件/時,Wedge（ウェッジ）,「生活保護バッシング」から見えた「もれなく救う」と「不正受給を防ぐ」のジレンマ 、生活保護制度の理想と現実,41,https://news.yahoo.co.jp/articles/61b17daeef818670f663e4c3c349d31d060c4d4f,10/24(木) 5:02
2024-10-24,06:06,domestic,国内,35孤立深める共産　機関紙で立国維を攻撃「野田佳彦氏個人への批判は控えている」産経新聞10/23(水) 20:2941件/時,産経新聞,孤立深める共産　機関紙で立国維を攻撃「野田佳彦氏個人への批判は控えている」,41,https://news.yahoo.co.jp/articles/bc52231b682250e675589493a112dbe5f630fecb,10/23(水) 20:29
2024-10-24,06:06,domestic,国内,36れいわ山本太郎氏「詐欺師集団にまた騙されることなきよう」裏金非公認候補への自民2000万円支給日刊スポーツ10/23(水) 21:1841件/時,日刊スポーツ,れいわ山本太郎氏「詐欺師集団にまた騙されることなきよう」裏金非公認候補への自民2000万円支給,41,https://news.yahoo.co.jp/articles/15435919c459753a0c97220544a1ffee3f6dd152,10/23(水) 21:18
2024-10-24,06:06,domestic,国内,37「死刑を望む」「ルフィ」強盗事件の実行役が被告人質問で謝罪　東京・狛江市の強盗致死事件の被害者に　東京地裁立川支部TBS NEWS DIG Powered by JNN10/24(木) 0:4341件/時,TBS NEWS DIG Powered by JNN,「死刑を望む」「ルフィ」強盗事件の実行役が被告人質問で謝罪　東京・狛江市の強盗致死事件の被害者に　東京地裁立川支部,41,https://news.yahoo.co.jp/articles/9337418be551bd9bcc8405346a2d2dd041b7f4a4,10/24(木) 0:43
2024-10-24,06:06,domestic,国内,38まるで新たな“裏金”!　自民党「非公認候補に2000万円支給」報道ではがれた「庶民派アピール」の化けの皮、国民の怒り頂点にSmartFLASH10/23(水) 19:4239件/時,SmartFLASH,まるで新たな“裏金”!　自民党「非公認候補に2000万円支給」報道ではがれた「庶民派アピール」の化けの皮、国民の怒り頂点に,39,https://news.yahoo.co.jp/articles/ea6aadf1bcadd921791f9c318907a06bd0949ce6,10/23(水) 19:42
2024-10-24,06:06,domestic,国内,390:59【速報】JR川崎駅近くの歓楽街で男性を暴行し死亡させたか　客引きの男2人を傷害致死の疑いで逮捕　警視庁TBS NEWS DIG Powered by JNN10/24(木) 4:0039件/時,TBS NEWS DIG Powered by JNN,【速報】JR川崎駅近くの歓楽街で男性を暴行し死亡させたか　客引きの男2人を傷害致死の疑いで逮捕　警視庁,39,https://news.yahoo.co.jp/articles/79c7a17c8be1ecefafac46b6c3287b1785d7694c,10/24(木) 4:00
2024-10-24,06:06,domestic,国内,40議論深まらぬ原発政策　原発立地でも「選挙戦では触れもしない」毎日新聞10/23(水) 20:0039件/時,毎日新聞,議論深まらぬ原発政策　原発立地でも「選挙戦では触れもしない」,39,https://news.yahoo.co.jp/articles/224cf2459efb29b2e698decc9df4c9aa11c37c8f,10/23(水) 20:00
