scrp_date,scrp_time,genre_en,genre_jp,rank,media_jp,title,comment,link,date_original
2025-04-07,04:06,business,経済,1,共同通信,【独自】ガソリン値下げ幅10円検討　抑制の目安廃止、定額に,537,https://news.yahoo.co.jp/articles/3eb4a55c988fa7b5faeaead6473ac83745a6b044,4/6(日) 16:42
2025-04-07,04:06,business,経済,2,NEWSポストセブン,小学生ゲーム実況YouTuberの「中学校通わない宣言」に批判の声も…筑駒→東大出身の父親が考える「息子の将来設計」,366,https://news.yahoo.co.jp/articles/9793367e5898338117ae93d6610297fab2c5b053,4/6(日) 16:13
2025-04-07,04:06,business,経済,3,NEWSポストセブン,「中学校には通いません」宣言の小学生YouTuber親子が明かす「ゲーム世界大会出場」の夢「1日10時間以上練習しないと追いつけない」,157,https://news.yahoo.co.jp/articles/3d7c979df732ba1e1ee2695ca0f249e93dc152d5,4/6(日) 11:57
2025-04-07,04:06,business,経済,4,乗りものニュース,「ETC大規模障害」混乱続く現場 東名・中央道などNEXCO中日本管内8都県 「そのまま通過して」,122,https://news.yahoo.co.jp/articles/301ec695e5d485b0624a03054d7dfdf1189bd194,4/6(日) 14:47
2025-04-07,04:06,business,経済,5,帝国データバンク,「売るコメがない」米屋が苦境、廃業が2年連続で増加,107,https://news.yahoo.co.jp/articles/d9755d50d8f25e9f6488187b9033e2cf732edc29,4/6(日) 7:03
2025-04-07,04:06,business,経済,6,TBS NEWS DIG Powered by JNN,「時給10円だぜ、考えられる?」コメ農家の窮状 “令和の百姓一揆”から見えた「食料安全保障」の危機【サンデーモーニング】,54,https://news.yahoo.co.jp/articles/8734e77fab0c5f7a22f236049557c7d5348b5507,4/6(日) 16:29
2025-04-07,04:06,business,経済,7,共同通信,政府、ガソリン価格値下げ10円軸に検討,38,https://news.yahoo.co.jp/articles/cdd8aad8d9817735c3dcf33f903a1fbf8f49765a,4/6(日) 16:34
2025-04-07,04:06,business,経済,8,共同通信,台湾、報復関税の計画なし　頼総統、米相互関税で談話,37,https://news.yahoo.co.jp/articles/7d0f0c8662f42bb693f4694738d0c0378b2b50a3,4/6(日) 21:44
2025-04-07,04:06,business,経済,9,プレジデントオンライン,「オルカン」「S&P500」は絶対におすすめしない…森永卓郎さん「いますぐ新NISAをやめなさい」と語った真意,35,https://news.yahoo.co.jp/articles/6d8b0a53fea7cea59fb05cbd2aa761ce88124e43,4/6(日) 7:17
2025-04-07,04:06,business,経済,10,FNNプライムオンライン,「血を見ることになる」強まる“トランプ不況”　アメリカで「iPhone40％値上がり」試算も,31,https://news.yahoo.co.jp/articles/1d0af656fc474142afd8e4b9e5f24f2768679c36,4/6(日) 19:02
2025-04-07,04:06,business,経済,11,東洋経済オンライン,【日本が大好きで来日したのに…】「面接した53社から不採用！」「外国籍に不動産は貸せないよ」“日本を愛する外国人女性”を襲った厳しすぎる現実,29,https://news.yahoo.co.jp/articles/ebed2829eb379389cdf805f515e5465cd1a9179a,4/6(日) 6:02
2025-04-07,04:06,business,経済,12,TBS NEWS DIG Powered by JNN,精算は現金のみ ダイエーでシステム障害　徐々に復旧　あすの営業には支障がでない見通し,26,https://news.yahoo.co.jp/articles/34822ee310fb639591206df43d00d75c711eb841,4/6(日) 18:32
2025-04-07,04:06,business,経済,13,東洋経済オンライン,「失礼ですが、旦那様とは偽装結婚ではないですよね…？」日本を愛して来日し、永住権を持つ外国人女性が経験した“日本の見えない壁”,23,https://news.yahoo.co.jp/articles/341351850b20e7e5d934478cd4772191974df6cb,4/6(日) 6:02
2025-04-07,04:06,business,経済,14,東洋経済オンライン,コメ高騰で「夕食パスタ16.5％増」日本の家庭が選ぶ“救世主メニュー”の正体,19,https://news.yahoo.co.jp/articles/fcad0c432c331863a6b61256ae8ed81120183653,4/6(日) 5:02
2025-04-07,04:06,business,経済,15,産経新聞,ビル70棟建て替え再開発「天神ビッグバン」佳境　世界都市ランク上昇めざす福岡市の戦略,17,https://news.yahoo.co.jp/articles/4045269730b650e8159182f1f3470c1b4e2446a3,4/6(日) 8:13
2025-04-07,04:06,business,経済,16,Merkmal,日本に「戦車」は本当に必須なのか？ 防衛省も認める削減方針に、なぜか「軍事オタク」が猛反発するワケ 海空優先vs感情論の衝突を考える,17,https://news.yahoo.co.jp/articles/7c5e83dcd996a7b9b49a5d8f63ae6aad772cd3ef,4/6(日) 11:51
2025-04-07,04:06,business,経済,17,WEB CARTOP,コロナ禍なんてとっくに終わってるのに「受注停止」に「納期遅延」が蔓延！　新車販売の世界は一体どうなってる？,16,https://news.yahoo.co.jp/articles/77ed0cde76ea725d16594586d1e0a12759983c44,4/6(日) 10:10
2025-04-07,04:06,business,経済,18,プレジデントオンライン,"野球離れでも「2万5000円の座席」が売れる…""万年赤字""だったベイスターズが過去最高の売上収益を出せたワケ",14,https://news.yahoo.co.jp/articles/b7b41b3f1afb885aca60bf724fdb4a60281f29c0,4/6(日) 16:17
2025-04-07,04:06,business,経済,19,WEB CARTOP,タクシーの近距離利用で嫌味タラタラ……って客が悪いの？　そろそろ海外を見習って「近距離を使いやすい」タクシーの整備をすべきとき,14,https://news.yahoo.co.jp/articles/c5c0c813cbc33e481bb5238ae06165087b207ad4,4/6(日) 7:10
2025-04-07,04:06,business,経済,20,ファイナンシャルフィールド,子どもが巣立ったので、7人乗りミニバンから「軽自動車」に乗り換えようと思います。維持費が「年間15万円」安くなるなら、200万円の新車でも安いものですよね？,13,https://news.yahoo.co.jp/articles/bd82f2abef05c40ecd739c790572f0599a664899,4/6(日) 13:30
2025-04-07,04:06,business,経済,21,現代ビジネス,「玉木代表への過剰な期待は禁物」…森永卓郎さんの息子・康平さんの30年間動かなかった「103万の壁問題」への見解,13,https://news.yahoo.co.jp/articles/12041523619079fd606cd0138c8a3e55205a8db3,4/6(日) 7:03
2025-04-07,04:06,business,経済,22,共同通信,米相互関税「延期しない」　商務長官、9日に第2弾,12,https://news.yahoo.co.jp/articles/b4c37b209426a5f58d148a2d6689193a90e8a05d,4/7(月) 0:31
2025-04-07,04:06,business,経済,23,AERA DIGITAL,なぜ年収1000万円「プチ富裕層」でも首が回らないのか　教育費は底なし、家も車も、消費が加速,11,https://news.yahoo.co.jp/articles/e177ddad1f3f83a0f00053715217a69f941ab8b1,4/6(日) 10:32
2025-04-07,04:06,business,経済,24,共同通信,マスク氏「関税ゼロ望ましい」　欧州と米国,11,https://news.yahoo.co.jp/articles/c1dd9b527b2b8eb73ab8959d129a5ad8498208ac,4/6(日) 10:04
2025-04-07,04:06,business,経済,25,ダイヤモンド・オンライン,すき家「ネズミ混入」、焼肉きんぐ「嘔吐トラブル」…店員を見れば一発でわかる〈不祥事チェーン〉の共通点,11,https://news.yahoo.co.jp/articles/ebd07d861aae9dab6da3fe06c0189c7752d25d8e,4/6(日) 6:32
2025-04-07,04:06,business,経済,26,産経新聞,関西、52年ぶり「転入超過」へ　今年の人口　都心再開発や教育支援が奏功か,11,https://news.yahoo.co.jp/articles/792d0b29f05b3d291c38b595526a9d9f2b3614e5,4/6(日) 19:06
2025-04-07,04:06,business,経済,27,Forbes JAPAN,テスラ・サイバートラックは過去数十年で「最大の失敗作」,11,https://news.yahoo.co.jp/articles/2ca5b4f8af665dd17e02077bbe4e18264f14ae11,4/6(日) 9:00
2025-04-07,04:06,business,経済,28,ファイナンシャルフィールド,九州で公務員をしていますが、ボーナスの総支給額は「150万円」ほどでした。東京の公務員のボーナスはもっと高いのでしょうか？,10,https://news.yahoo.co.jp/articles/8c0a0acd17e94e637b407d098e70437d52877092,4/6(日) 11:10
2025-04-07,04:06,business,経済,29,共同通信,「相互関税」の実施、延期なしと米商務長官,9,https://news.yahoo.co.jp/articles/093147bac6188b731cee7f90e3ed45f81933fb0a,4/7(月) 0:15
2025-04-07,04:06,business,経済,30,JBpress,個人クリニックでも月1000万円の利益、美容クリニックの経理担当者が語る「潤う仕組み」とその裏側,9,https://news.yahoo.co.jp/articles/d09056eea5f0942d0b8f617698515e20ac643c67,4/6(日) 17:41
2025-04-07,04:06,business,経済,31,ファイナンシャルフィールド,新型iPhoneが「実質24円」で手に入る!? その詳細とは？,9,https://news.yahoo.co.jp/articles/06f4f51c19712d9b96129e71d1fb49a9e9302070,4/6(日) 8:40
2025-04-07,04:06,business,経済,32,現代ビジネス,老後に突然「家庭にも居場所がなくなる」男たちが「経営下手」であるワケ,9,https://news.yahoo.co.jp/articles/3ccc39c32900b2aa6e0a10c1bb37cb57c94b45d4,4/6(日) 23:03
2025-04-07,04:06,business,経済,33,東京商工リサーチ,2024年度の「中古車販売店」倒産、1.4倍増の98件　小・零細販売店が押し上げ、負債は過去最大に膨らむ,8,https://news.yahoo.co.jp/articles/c5fb6d0f541fb0916232f1adb042e796162c0969,4/6(日) 7:03
2025-04-07,04:06,business,経済,34,マネーポストWEB,資産2億円達成の人気ブロガーが「生命保険・医療保険には入らず、損害保険には加入する」選択をした理由　コスパとリスクから考える“保険の大原則”,8,https://news.yahoo.co.jp/articles/8e1d4b5a77c163a7e3c5fe7bea703d5ed0844091,4/6(日) 15:15
2025-04-07,04:06,business,経済,35,ファイナンシャルフィールド,夫の口座に義父の「遺産500万円」があります。家計管理は妻の私が行っているのでお金を移したいのですが「贈与税」がかかるかもしれないって本当ですか？,8,https://news.yahoo.co.jp/articles/4c8718476c454d0068993357af8feea1d712f541,4/6(日) 11:40
2025-04-07,04:06,business,経済,36,WEB CARTOP,「ここにいるんだから止まってくれるハズ」の信頼は捨てるべき！　自転車乗りが身を守るために知るべきクルマの死角,8,https://news.yahoo.co.jp/articles/43e2866dd9f4027d79f18e44c284a1ded6bb6e10,4/6(日) 20:10
2025-04-07,04:06,business,経済,37,Auto Messe Web,EVの急速充電器がかえって不便！ ホテルなど設置場所によっては普通充電器をもっと普及させるべきじゃない？【Key’s note】,8,https://news.yahoo.co.jp/articles/9f13249c4330d86be5689676f7492cc76c415eed,4/6(日) 8:10
2025-04-07,04:06,business,経済,38,Bloomberg,中東の株価急落、サウジアラムコ安い－関税と原油下落で二重の脅威,8,https://news.yahoo.co.jp/articles/8945272b35e53026ef00c7eb1283ebbfb797190c,4/7(月) 1:02
2025-04-07,04:06,business,経済,39,ファイナンシャルフィールド,2020年代のうちに最低賃金「1500円」を目標にしていると聞きました。現在九州地方の最低賃金は1000円未満ですが本当に可能なのでしょうか？,8,https://news.yahoo.co.jp/articles/78d60655e5647769399a14b1919db70da75d96f1,4/6(日) 14:40
2025-04-07,04:06,business,経済,40,NRI研究員の時事解説,トランプ関税による株価大幅下落の連鎖が続く：中国が34％の報復関税を発表,8,https://news.yahoo.co.jp/articles/68ff08e813e1829d3e1cd5bd9815c3d32e1848fa,4/6(日) 21:20
