scrp_date,scrp_time,genre_en,genre_jp,rank,media_jp,title,comment,link,date_original
2024-10-02,07:06,world,国際,10:56イランがイスラエルに向けて弾道ミサイル180発以上発射　イスラエル軍“大半を迎撃もイスラエル中部と南部で着弾確認”TBS NEWS DIG Powered by JNN10/2(水) 5:55254件/時,TBS NEWS DIG Powered by JNN,イランがイスラエルに向けて弾道ミサイル180発以上発射　イスラエル軍“大半を迎撃もイスラエル中部と南部で着弾確認”,254,https://news.yahoo.co.jp/articles/9fa4bb334194a6c93a1e96441f7aadfdfc150b60,10/2(水) 5:55
2024-10-02,07:06,world,国際,2テルアビブで銃乱射、少なくとも6人死亡　イランによる攻撃直前ロイター10/2(水) 4:2783件/時,ロイター,テルアビブで銃乱射、少なくとも6人死亡　イランによる攻撃直前,83,https://news.yahoo.co.jp/articles/b610bd36ef4457067c3efa05e51ef2dfd5cde3c0,10/2(水) 4:27
2024-10-02,07:06,world,国際,31:03上海のスーパーで切り付け　18人死傷　男を拘束日テレNEWS NNN10/1(火) 13:4774件/時,日テレNEWS NNN,上海のスーパーで切り付け　18人死傷　男を拘束,74,https://news.yahoo.co.jp/articles/b0e368b7afb0b26c4d0fc08241e691084da6b389,10/1(火) 13:47
2024-10-02,07:06,world,国際,4イスラエル地上侵攻　緊張のレバノン、混乱必至　10万人以上出国毎日新聞10/1(火) 9:2764件/時,毎日新聞,イスラエル地上侵攻　緊張のレバノン、混乱必至　10万人以上出国,64,https://news.yahoo.co.jp/articles/cb3f44a919a8b62496da98647fb89130c8d23094,10/1(火) 9:27
2024-10-02,07:06,world,国際,5イスラエル軍がレバノン南部に地上侵攻　ヒズボラ掃討狙う毎日新聞10/1(火) 8:2453件/時,毎日新聞,イスラエル軍がレバノン南部に地上侵攻　ヒズボラ掃討狙う,53,https://news.yahoo.co.jp/articles/a8633495f359d77c128f9f88df954fc26643496f,10/1(火) 8:24
2024-10-02,07:06,world,国際,6「核爆弾で日本を消せ！」　デマ、臆測だらけの中国SNS…なぜ日本人学校が近年ターゲットになったのかデイリー新潮10/2(水) 6:0752件/時,デイリー新潮,「核爆弾で日本を消せ！」　デマ、臆測だらけの中国SNS…なぜ日本人学校が近年ターゲットになったのか,52,https://news.yahoo.co.jp/articles/bc8a0c51cea397c93e91e1ae36373f5002955e8d,10/2(水) 6:07
2024-10-02,07:06,world,国際,7海上自衛隊が中国船の乗員を救助　中国国内から感謝の声　報じない中国メディアへの批判もTBS NEWS DIG Powered by JNN10/1(火) 16:1046件/時,TBS NEWS DIG Powered by JNN,海上自衛隊が中国船の乗員を救助　中国国内から感謝の声　報じない中国メディアへの批判も,46,https://news.yahoo.co.jp/articles/c1b554f1370cced93ca1e2d7c21d22c3916ef1a4,10/1(火) 16:10
2024-10-02,07:06,world,国際,8バス炎上、子供ら23人死亡　校外学習で移動中　タイ時事通信10/1(火) 18:2644件/時,時事通信,バス炎上、子供ら23人死亡　校外学習で移動中　タイ,44,https://news.yahoo.co.jp/articles/175dd1a3604d3c488eaaedbf7539f11673d349da,10/1(火) 18:26
2024-10-02,07:06,world,国際,9【速報】イランがイスラエルに大規模報復攻撃　「400発以上のミサイル発射」イラン発表FNNプライムオンライン（フジテレビ系）10/2(水) 1:5240件/時,FNNプライムオンライン（フジテレビ系）,【速報】イランがイスラエルに大規模報復攻撃　「400発以上のミサイル発射」イラン発表,40,https://news.yahoo.co.jp/articles/334332928da23f6ef4a358ec3f65dbc832e98c04,10/2(水) 1:52
2024-10-02,07:06,world,国際,10「尖閣は中国の領土」発言のNHKスタッフ、靖国“トイレ”落書き犯　帰国後は「反日英雄」扱い、中国内で広がる「反日無罪」の風潮NEWSポストセブン10/1(火) 16:1537件/時,NEWSポストセブン,「尖閣は中国の領土」発言のNHKスタッフ、靖国“トイレ”落書き犯　帰国後は「反日英雄」扱い、中国内で広がる「反日無罪」の風潮,37,https://news.yahoo.co.jp/articles/641ad211178e14413641c837781d7ab878c1858a,10/1(火) 16:15
2024-10-02,07:06,world,国際,11死亡ハマス幹部は国連職員　UNRWA活動継続難航も共同通信10/1(火) 6:5430件/時,共同通信,死亡ハマス幹部は国連職員　UNRWA活動継続難航も,30,https://news.yahoo.co.jp/articles/52b1908be7395ae4f0763e0726ee20a363e6d980,10/1(火) 6:54
2024-10-02,07:06,world,国際,12イランがイスラエルに向けてミサイル発射　米CNNなど報じる毎日新聞10/2(水) 1:5628件/時,毎日新聞,イランがイスラエルに向けてミサイル発射　米CNNなど報じる,28,https://news.yahoo.co.jp/articles/40c50db81c8f153b26037a2cd497b176c563cc72,10/2(水) 1:56
2024-10-02,07:06,world,国際,13「空爆が自宅でも聞こえる」「避難所にごみ散乱」限定地上侵攻のベイルート、在住邦人語る産経新聞10/1(火) 17:4724件/時,産経新聞,「空爆が自宅でも聞こえる」「避難所にごみ散乱」限定地上侵攻のベイルート、在住邦人語る,24,https://news.yahoo.co.jp/articles/7b4137a71fac402b9fdd649a3fce52c12a411427,10/1(火) 17:47
2024-10-02,07:06,world,国際,14イラン、イスラエルにミサイル発射　エルサレムやテルアビブで爆発音毎日新聞10/2(水) 2:1524件/時,毎日新聞,イラン、イスラエルにミサイル発射　エルサレムやテルアビブで爆発音,24,https://news.yahoo.co.jp/articles/4a9dc229a71143528b0f86dd7751433291f4194b,10/2(水) 2:15
2024-10-02,07:06,world,国際,15スーパーで“無差別切りつけ”　刃物持った37歳男を拘束　18人死傷も…公安が”口止め”か　「国慶節」初日の中国・上海市　FNNプライムオンライン10/1(火) 19:5818件/時,FNNプライムオンライン,スーパーで“無差別切りつけ”　刃物持った37歳男を拘束　18人死傷も…公安が”口止め”か　「国慶節」初日の中国・上海市,18,https://news.yahoo.co.jp/articles/a4b86bf5172fe77d81c01b3063e440661be0dc9b,10/1(火) 19:58
2024-10-02,07:06,world,国際,16イラン、ミサイル発射　イスラエル中部などで警報発令時事通信10/1(火) 23:0818件/時,時事通信,イラン、ミサイル発射　イスラエル中部などで警報発令,18,https://news.yahoo.co.jp/articles/c5238eaff87631574d3429c36b417dcd22af016a,10/1(火) 23:08
2024-10-02,07:06,world,国際,17「イスラエルはトルコも標的」　エルドアン大統領が批判時事通信10/2(水) 5:0218件/時,時事通信,「イスラエルはトルコも標的」　エルドアン大統領が批判,18,https://news.yahoo.co.jp/articles/96158e02feac6464aedfecb4cd847cb8fe77c83d,10/2(水) 5:02
2024-10-02,07:06,world,国際,18イスラエル国連大使「イランはテロ国家だ」と非難　イランがイスラエルに向け弾道ミサイル発射TBS NEWS DIG Powered by JNN10/2(水) 6:2816件/時,TBS NEWS DIG Powered by JNN,イスラエル国連大使「イランはテロ国家だ」と非難　イランがイスラエルに向け弾道ミサイル発射,16,https://news.yahoo.co.jp/articles/ba0c4b706ab49682ff8c015e791097668e422025,10/2(水) 6:28
2024-10-02,07:06,world,国際,19米紙が問う「自民党の一党支配が70年も続く日本は、それでも民主主義国家といえるのか」クーリエ・ジャポン10/1(火) 19:0016件/時,クーリエ・ジャポン,米紙が問う「自民党の一党支配が70年も続く日本は、それでも民主主義国家といえるのか」,16,https://news.yahoo.co.jp/articles/ba6b45f3cf3d834a892f73441c634fddd93103a9,10/1(火) 19:00
2024-10-02,07:06,world,国際,20「あなたも感じてみなさい」友達をいじめた息子に水をかける…「真の教育」と賛辞を受けた中国人の母親中央日報日本語版10/1(火) 9:2516件/時,中央日報日本語版,「あなたも感じてみなさい」友達をいじめた息子に水をかける…「真の教育」と賛辞を受けた中国人の母親,16,https://news.yahoo.co.jp/articles/e19cab37eea4c96918a486cbd3c15993c4d44001,10/1(火) 9:25
2024-10-02,07:06,world,国際,21イラン革命防衛隊、ミサイル数十発　「ヒズボラ指導者ら殺害の報復」毎日新聞10/2(水) 2:3816件/時,毎日新聞,イラン革命防衛隊、ミサイル数十発　「ヒズボラ指導者ら殺害の報復」,16,https://news.yahoo.co.jp/articles/179e30b11cb26fe5b53bec6df269e0b3fc4aac8c,10/2(水) 2:38
2024-10-02,07:06,world,国際,22トランプ前大統領が米政権批判　「制御不能の悪循環」共同通信10/2(水) 6:1415件/時,共同通信,トランプ前大統領が米政権批判　「制御不能の悪循環」,15,https://news.yahoo.co.jp/articles/a55ada70f3758853068782366b19ab79f673e1da,10/2(水) 6:14
2024-10-02,07:06,world,国際,230:35【速報】イラン　イスラエルへの弾道ミサイル攻撃を開始日テレNEWS NNN10/2(水) 1:4415件/時,日テレNEWS NNN,【速報】イラン　イスラエルへの弾道ミサイル攻撃を開始,15,https://news.yahoo.co.jp/articles/6bf6620e17103b898f1406040d68b2001b69ad4c,10/2(水) 1:44
2024-10-02,07:06,world,国際,24「イランの攻撃は打ち負かされた」　米高官、迎撃成功との見方示す毎日新聞10/2(水) 5:4415件/時,毎日新聞,「イランの攻撃は打ち負かされた」　米高官、迎撃成功との見方示す,15,https://news.yahoo.co.jp/articles/2e93c4bc32f4df4eef2cd80f573824a0c97c3155,10/2(水) 5:44
2024-10-02,07:06,world,国際,25「ハト派」石破氏に期待　首相選出で速報　韓国時事通信10/1(火) 20:3414件/時,時事通信,「ハト派」石破氏に期待　首相選出で速報　韓国,14,https://news.yahoo.co.jp/articles/0ab7180b81d2fa9ad461f8dcfcd199d995520b34,10/1(火) 20:34
2024-10-02,07:06,world,国際,26イラン革命防衛隊、イスラエルへのミサイル「９０％命中」と主張…空軍基地など標的と発表読売新聞オンライン10/2(水) 5:4114件/時,読売新聞オンライン,イラン革命防衛隊、イスラエルへのミサイル「９０％命中」と主張…空軍基地など標的と発表,14,https://news.yahoo.co.jp/articles/863bfc887867ea26eebe3ebb1b453c07093819f9,10/2(水) 5:41
2024-10-02,07:06,world,国際,27タイ　児童ら25人死亡のバス事故　非常口開かず被害拡大かテレビ朝日系（ANN）10/1(火) 22:4714件/時,テレビ朝日系（ANN）,タイ　児童ら25人死亡のバス事故　非常口開かず被害拡大か,14,https://news.yahoo.co.jp/articles/69c863c97b424c5a921338fc663a6f399443ed6f,10/1(火) 22:47
2024-10-02,07:06,world,国際,28中国・上海のスーパーで男が刃物で切りつけ　3人死亡15人けが　日本人の被害なしテレビ朝日系（ANN）10/1(火) 14:1013件/時,テレビ朝日系（ANN）,中国・上海のスーパーで男が刃物で切りつけ　3人死亡15人けが　日本人の被害なし,13,https://news.yahoo.co.jp/articles/ae1c08b0ab340ca6ed3da97acf463ecfd4d3d078,10/1(火) 14:10
2024-10-02,07:06,world,国際,29「韓国の東海『併記』の努力、１９５２年から…日本の誤った主張を正すべき」ハンギョレ新聞10/1(火) 8:0913件/時,ハンギョレ新聞,「韓国の東海『併記』の努力、１９５２年から…日本の誤った主張を正すべき」,13,https://news.yahoo.co.jp/articles/6c68b29d3ecef09822152d7a480156e012476dd6,10/1(火) 8:09
2024-10-02,07:06,world,国際,30日本のジャーナリスト「浮島丸などの歴史を覆い隠すと韓日間に信頼生まれない」ハンギョレ新聞10/1(火) 7:1913件/時,ハンギョレ新聞,日本のジャーナリスト「浮島丸などの歴史を覆い隠すと韓日間に信頼生まれない」,13,https://news.yahoo.co.jp/articles/dd9a6d373afa57e5f707c5161d7ce144f8d3c86b,10/1(火) 7:19
2024-10-02,07:06,world,国際,31上海で切り付け、3人が死亡　郊外のスーパーで中国人の男共同通信10/1(火) 11:1412件/時,共同通信,上海で切り付け、3人が死亡　郊外のスーパーで中国人の男,12,https://news.yahoo.co.jp/articles/bf5cc0f2bb6fcee0f0502e0260e5588aa615d5de,10/1(火) 11:14
2024-10-02,07:06,world,国際,32「“女性版安倍”の高市氏じゃなくてよかった…」石破茂新総理（67）の誕生に韓国は右も左も歓迎ムード…始まりは「ノーアベ」だった？文春オンライン10/1(火) 11:1212件/時,文春オンライン,「“女性版安倍”の高市氏じゃなくてよかった…」石破茂新総理（67）の誕生に韓国は右も左も歓迎ムード…始まりは「ノーアベ」だった？,12,https://news.yahoo.co.jp/articles/11497f14d89f9748dd6b5627d0276b7d76debd03,10/1(火) 11:12
2024-10-02,07:06,world,国際,33中国軍、南シナ海で警戒パトロール＝国営メディアロイター10/1(火) 15:0612件/時,ロイター,中国軍、南シナ海で警戒パトロール＝国営メディア,12,https://news.yahoo.co.jp/articles/dfe52a47fc15ef3dc1e61c2fae94095adb72bf6e,10/1(火) 15:06
2024-10-02,07:06,world,国際,34イランが弾道ミサイルでイスラエル攻撃準備の兆候　ロイター報道毎日新聞10/2(水) 0:2311件/時,毎日新聞,イランが弾道ミサイルでイスラエル攻撃準備の兆候　ロイター報道,11,https://news.yahoo.co.jp/articles/28afa63abe3746a3c6cde89de663c5eb12baafdc,10/2(水) 0:23
2024-10-02,07:06,world,国際,35「裏山の崖から飛び降りて命を絶つ」…韓国・中学の試験に出た「元大統領侮辱」例文に非難集中KOREA WAVE10/2(水) 4:0311件/時,KOREA WAVE,「裏山の崖から飛び降りて命を絶つ」…韓国・中学の試験に出た「元大統領侮辱」例文に非難集中,11,https://news.yahoo.co.jp/articles/06573a36b69cba7548a7eabbfe215899033252bb,10/2(水) 4:03
2024-10-02,07:06,world,国際,360:39【速報】イランがイスラエルに向けて弾道ミサイルを発射TBS NEWS DIG Powered by JNN10/2(水) 2:3211件/時,TBS NEWS DIG Powered by JNN,【速報】イランがイスラエルに向けて弾道ミサイルを発射,11,https://news.yahoo.co.jp/articles/807bc3c68e4e75ee04b3f4afcd605580d7b0a8cf,10/2(水) 2:32
2024-10-02,07:06,world,国際,37イランが攻撃に極超音速弾道ミサイル使用共同通信10/2(水) 4:2211件/時,共同通信,イランが攻撃に極超音速弾道ミサイル使用,11,https://news.yahoo.co.jp/articles/767e45b70a32072bc4f2fe2a249db1160f1f91f2,10/2(水) 4:22
2024-10-02,07:06,world,国際,38米、石破氏の安保閣僚人事を歓迎　安定の政治基盤構築へ衆院選注視共同通信10/1(火) 16:5711件/時,共同通信,米、石破氏の安保閣僚人事を歓迎　安定の政治基盤構築へ衆院選注視,11,https://news.yahoo.co.jp/articles/28a57ee34bf78e147e01fefbc927e5128880f840,10/1(火) 16:57
2024-10-02,07:06,world,国際,39「石破首相と緊密に協力することを楽しみにしている」…ゼレンスキー大統領がＸに投稿読売新聞オンライン10/1(火) 16:5111件/時,読売新聞オンライン,「石破首相と緊密に協力することを楽しみにしている」…ゼレンスキー大統領がＸに投稿,11,https://news.yahoo.co.jp/articles/eac6ea01e6356c53f2dee569ec2fbe7bd58ffdb0,10/1(火) 16:51
2024-10-02,07:06,world,国際,40中国軍のミサイル艦　フィリピン機に“レーザー照射”　領有権争い激化の南シナ海TBS NEWS DIG Powered by JNN10/1(火) 18:4411件/時,TBS NEWS DIG Powered by JNN,中国軍のミサイル艦　フィリピン機に“レーザー照射”　領有権争い激化の南シナ海,11,https://news.yahoo.co.jp/articles/093c378169a2c3f19cad0a058a4b964518c0a26c,10/1(火) 18:44
