scrp_date,scrp_time,genre_en,genre_jp,rank,media_jp,title,comment,link,date_original
2024-10-02,18:07,world,国際,1イランは「代償払う」、イスラエル首相が報復姿勢鮮明にロイター10/2(水) 6:04175件/時,ロイター,イランは「代償払う」、イスラエル首相が報復姿勢鮮明に,175,https://news.yahoo.co.jp/articles/de9a4682f1a41509a290eeeeb25bfa38dd05f894,10/2(水) 6:04
2024-10-02,18:07,world,国際,20:56イランがイスラエルに向けて弾道ミサイル180発以上発射　イスラエル軍“大半を迎撃もイスラエル中部と南部で着弾確認”TBS NEWS DIG Powered by JNN10/2(水) 5:55129件/時,TBS NEWS DIG Powered by JNN,イランがイスラエルに向けて弾道ミサイル180発以上発射　イスラエル軍“大半を迎撃もイスラエル中部と南部で着弾確認”,129,https://news.yahoo.co.jp/articles/9fa4bb334194a6c93a1e96441f7aadfdfc150b60,10/2(水) 5:55
2024-10-02,18:07,world,国際,3エルサレムに空襲警報、地下シェルターに住民避難「この戦争はいつ終わるんだ」読売新聞オンライン10/2(水) 10:33120件/時,読売新聞オンライン,エルサレムに空襲警報、地下シェルターに住民避難「この戦争はいつ終わるんだ」,120,https://news.yahoo.co.jp/articles/f77e51e84958f8127cdd157ef3d66c7c2b21f9cc,10/2(水) 10:33
2024-10-02,18:07,world,国際,42:13止まらない報復の連鎖、イランがイスラエルに向け180発超のミサイル発射　一部が着弾　イスラエルも報復を宣言ロイター10/2(水) 10:23116件/時,ロイター,止まらない報復の連鎖、イランがイスラエルに向け180発超のミサイル発射　一部が着弾　イスラエルも報復を宣言,116,https://news.yahoo.co.jp/articles/554a60e190b65dc5bc664c765f7a449b2d7bf188,10/2(水) 10:23
2024-10-02,18:07,world,国際,5「禁書」が広がるアメリカ、ＬＧＢＴＱ関連本を図書館から撤去　保守派「価値観の押しつけ」と主張、反対派は「多様性の尊重が重要」と批判47NEWS10/2(水) 10:3289件/時,47NEWS,「禁書」が広がるアメリカ、ＬＧＢＴＱ関連本を図書館から撤去　保守派「価値観の押しつけ」と主張、反対派は「多様性の尊重が重要」と批判,89,https://news.yahoo.co.jp/articles/4183ea71799059b168488ef283464e7212146145,10/2(水) 10:32
2024-10-02,18:07,world,国際,6海自救助　中国SNSで話題に　国営メディアも報道すべきだの声も毎日新聞10/2(水) 14:2471件/時,毎日新聞,海自救助　中国SNSで話題に　国営メディアも報道すべきだの声も,71,https://news.yahoo.co.jp/articles/79a2091d136b7a187cc030efcd96ccc1e59e0a00,10/2(水) 14:24
2024-10-02,18:07,world,国際,7深圳で男児刺殺、日本政府の対応に“弱腰”批判も…「誠に遺憾です」で国を守れる？専門家「怒るべき時に怒るのは日本外交にとって大事」ABEMA TIMES10/2(水) 11:4568件/時,ABEMA TIMES,深圳で男児刺殺、日本政府の対応に“弱腰”批判も…「誠に遺憾です」で国を守れる？専門家「怒るべき時に怒るのは日本外交にとって大事」,68,https://news.yahoo.co.jp/articles/31957387566043bb5ff273ca773a0b1a496173be,10/2(水) 11:45
2024-10-02,18:07,world,国際,8スイスで保育園に行っていた５歳児３人が刃物に刺される事件…犯人は２０代の中国人中央日報日本語版10/2(水) 6:5867件/時,中央日報日本語版,スイスで保育園に行っていた５歳児３人が刃物に刺される事件…犯人は２０代の中国人,67,https://news.yahoo.co.jp/articles/aac3c1ce3f4299caa88b60f75376ec761060a4f5,10/2(水) 6:58
2024-10-02,18:07,world,国際,9中国上海で「無差別」切りつけ事件…３人死亡、１５人負傷中央日報日本語版10/2(水) 15:5954件/時,中央日報日本語版,中国上海で「無差別」切りつけ事件…３人死亡、１５人負傷,54,https://news.yahoo.co.jp/articles/58011639d646d29d3f023fd61a11044eaef6449b,10/2(水) 15:59
2024-10-02,18:07,world,国際,10イラン「戦争準備できている」と米に通告共同通信10/2(水) 15:2246件/時,共同通信,イラン「戦争準備できている」と米に通告,46,https://news.yahoo.co.jp/articles/5e3515741d394c1627b8eb0e1dd4630187793823,10/2(水) 15:22
2024-10-02,18:07,world,国際,11バス炎上、子供ら23人死亡　校外学習で移動中　タイ時事通信10/1(火) 18:2641件/時,時事通信,バス炎上、子供ら23人死亡　校外学習で移動中　タイ,41,https://news.yahoo.co.jp/articles/175dd1a3604d3c488eaaedbf7539f11673d349da,10/1(火) 18:26
2024-10-02,18:07,world,国際,12石破政権発足で中国主席から祝辞、官房長官「前向きなメッセージ」ロイター10/2(水) 16:4339件/時,ロイター,石破政権発足で中国主席から祝辞、官房長官「前向きなメッセージ」,39,https://news.yahoo.co.jp/articles/c2b76c7283fdc96b03588c48677e72cbe49396f8,10/2(水) 16:43
2024-10-02,18:07,world,国際,130:47テルアビブ中心部で銃乱射　7人死亡17人けがテレビ朝日系（ANN）10/2(水) 4:1638件/時,テレビ朝日系（ANN）,テルアビブ中心部で銃乱射　7人死亡17人けが,38,https://news.yahoo.co.jp/articles/6835dae38f61bea499f488a1055ab713d0bcc802,10/2(水) 4:16
2024-10-02,18:07,world,国際,144:15イスラエル、レバノンで地上作戦　「せん滅させるまで」…エスカレート懸念　“全面戦争”なら原油高騰→日本の物価高に拍車？日テレNEWS NNN10/2(水) 10:1038件/時,日テレNEWS NNN,イスラエル、レバノンで地上作戦　「せん滅させるまで」…エスカレート懸念　“全面戦争”なら原油高騰→日本の物価高に拍車？,38,https://news.yahoo.co.jp/articles/a7d0d68078ef2a17839a25486f824afa6eea2035,10/2(水) 10:10
2024-10-02,18:07,world,国際,15テルアビブで銃乱射、少なくとも6人死亡　イランによる攻撃直前ロイター10/2(水) 4:2737件/時,ロイター,テルアビブで銃乱射、少なくとも6人死亡　イランによる攻撃直前,37,https://news.yahoo.co.jp/articles/b610bd36ef4457067c3efa05e51ef2dfd5cde3c0,10/2(水) 4:27
2024-10-02,18:07,world,国際,16インド外相、石破首相の「アジア版NATO」創設支持せず　「重く受け止めなければ」との声も産経新聞10/2(水) 14:3435件/時,産経新聞,インド外相、石破首相の「アジア版NATO」創設支持せず　「重く受け止めなければ」との声も,35,https://news.yahoo.co.jp/articles/cba4fef68a21081672387dcdd0d25a71b246c18a,10/2(水) 14:34
2024-10-02,18:07,world,国際,17６８５万台売れたが…世界初「三つ折り」中国スマホに耐久性問題提起中央日報日本語版10/2(水) 14:4833件/時,中央日報日本語版,６８５万台売れたが…世界初「三つ折り」中国スマホに耐久性問題提起,33,https://news.yahoo.co.jp/articles/01557c419a875d524b0d84cd02c775e908d442d5,10/2(水) 14:48
2024-10-02,18:07,world,国際,18習近平氏が石破氏に祝電　「中国と歩み寄ることを希望」　日本との関係安定化継続の意向産経新聞10/2(水) 13:5230件/時,産経新聞,習近平氏が石破氏に祝電　「中国と歩み寄ることを希望」　日本との関係安定化継続の意向,30,https://news.yahoo.co.jp/articles/21172967cc4e102cdfdde60481505ab642389396,10/2(水) 13:52
2024-10-02,18:07,world,国際,19イスラエル、数日中にイランに報復開始へ　石油施設など標的＝報道ロイター10/2(水) 14:1830件/時,ロイター,イスラエル、数日中にイランに報復開始へ　石油施設など標的＝報道,30,https://news.yahoo.co.jp/articles/a9993ee8a9067c75a514cf626ddb6b41f6fdcb0a,10/2(水) 14:18
2024-10-02,18:07,world,国際,20中国人による“反日トラブル”が日本国内で続発　処理水放出直後には福島県内の飲食店に中国の国番号『86』から始まる番号の嫌がらせ電話1000件NEWSポストセブン10/2(水) 7:1528件/時,NEWSポストセブン,中国人による“反日トラブル”が日本国内で続発　処理水放出直後には福島県内の飲食店に中国の国番号『86』から始まる番号の嫌がらせ電話1000件,28,https://news.yahoo.co.jp/articles/4e4c62fb85ba657182594d85fd730cb320073530,10/2(水) 7:15
2024-10-02,18:07,world,国際,211:59スイスの保育園付近で襲撃事件、男児3人負傷　中国人の男逮捕ロイター10/2(水) 13:5725件/時,ロイター,スイスの保育園付近で襲撃事件、男児3人負傷　中国人の男逮捕,25,https://news.yahoo.co.jp/articles/729d23dcc7b2d2868f75943ceb5607b26e70ca88,10/2(水) 13:57
2024-10-02,18:07,world,国際,22「日中が一衣帯水の隣国」中国の習近平国家主席が石破総理大臣に祝電「建設的で安定的な日中関係の構築への努力希望」FNNプライムオンライン（フジテレビ系）10/2(水) 15:0925件/時,FNNプライムオンライン（フジテレビ系）,「日中が一衣帯水の隣国」中国の習近平国家主席が石破総理大臣に祝電「建設的で安定的な日中関係の構築への努力希望」,25,https://news.yahoo.co.jp/articles/1d946d2ca135837842916e7d9f411b9b888dbd1f,10/2(水) 15:09
2024-10-02,18:07,world,国際,23イスラエル　イランのミサイル攻撃「大規模な報復」数日以内に開始へ　米報道日テレNEWS NNN10/2(水) 17:0222件/時,日テレNEWS NNN,イスラエル　イランのミサイル攻撃「大規模な報復」数日以内に開始へ　米報道,22,https://news.yahoo.co.jp/articles/06078de4963083f2f47f9f39a9af6ebe8af0737e,10/2(水) 17:02
2024-10-02,18:07,world,国際,24テイラー・スウィフトさんの好感度急減　米大統領選でハリス氏への支持表明後産経新聞10/2(水) 13:1922件/時,産経新聞,テイラー・スウィフトさんの好感度急減　米大統領選でハリス氏への支持表明後,22,https://news.yahoo.co.jp/articles/f01b5de0680138037e4fcd272a84a7dd8682e631,10/2(水) 13:19
2024-10-02,18:07,world,国際,25「核爆弾で日本を消せ！」　デマ、臆測だらけの中国SNS…なぜ日本人学校が近年ターゲットになったのかデイリー新潮10/2(水) 6:0722件/時,デイリー新潮,「核爆弾で日本を消せ！」　デマ、臆測だらけの中国SNS…なぜ日本人学校が近年ターゲットになったのか,22,https://news.yahoo.co.jp/articles/bc8a0c51cea397c93e91e1ae36373f5002955e8d,10/2(水) 6:07
2024-10-02,18:07,world,国際,26中国「デフレ経済」習政権の失政を海外のせいに　主因は消費低迷と不動産不況も　矛先は米国などに…危険な世論形成夕刊フジ10/2(水) 17:0020件/時,夕刊フジ,中国「デフレ経済」習政権の失政を海外のせいに　主因は消費低迷と不動産不況も　矛先は米国などに…危険な世論形成,20,https://news.yahoo.co.jp/articles/28195cb8e3c6a1e50fe43631b076b86c72dfbe75,10/2(水) 17:00
2024-10-02,18:07,world,国際,270:55イスラエルにミサイル200発 イラン、反撃で「全インフラ標的」と警告AFPBB News10/2(水) 16:5020件/時,AFPBB News,イスラエルにミサイル200発 イラン、反撃で「全インフラ標的」と警告,20,https://news.yahoo.co.jp/articles/e878708442f831a5274dabf76425e359bca0e74c,10/2(水) 16:50
2024-10-02,18:07,world,国際,28メキシコ初の女性大統領就任　シェインバウム氏、男性優位の価値観非難時事通信10/2(水) 6:1219件/時,時事通信,メキシコ初の女性大統領就任　シェインバウム氏、男性優位の価値観非難,19,https://news.yahoo.co.jp/articles/906b24dc635f129d57e9c34929d9bdc4b5ab0185,10/2(水) 6:12
2024-10-02,18:07,world,国際,29「イスラエルはトルコも標的」　エルドアン大統領が批判時事通信10/2(水) 5:0219件/時,時事通信,「イスラエルはトルコも標的」　エルドアン大統領が批判,19,https://news.yahoo.co.jp/articles/96158e02feac6464aedfecb4cd847cb8fe77c83d,10/2(水) 5:02
2024-10-02,18:07,world,国際,30アメリカ南部でハリケーンによる被害拡大　160人以上が死亡 約600人が行方不明TBS NEWS DIG Powered by JNN10/2(水) 8:0419件/時,TBS NEWS DIG Powered by JNN,アメリカ南部でハリケーンによる被害拡大　160人以上が死亡 約600人が行方不明,19,https://news.yahoo.co.jp/articles/ab70a3d8f4baab0fef680aae5232ff6466e97f90,10/2(水) 8:04
2024-10-02,18:07,world,国際,31中国の習主席、石破氏に祝電　両国関係の安定目指す共同通信10/2(水) 11:4919件/時,共同通信,中国の習主席、石破氏に祝電　両国関係の安定目指す,19,https://news.yahoo.co.jp/articles/d48f56fb08bbf37e80c6fd646875633e899182ea,10/2(水) 11:49
2024-10-02,18:07,world,国際,32イラン、イスラエルにミサイル発射　エルサレムやテルアビブで爆発音毎日新聞10/2(水) 2:1519件/時,毎日新聞,イラン、イスラエルにミサイル発射　エルサレムやテルアビブで爆発音,19,https://news.yahoo.co.jp/articles/4a9dc229a71143528b0f86dd7751433291f4194b,10/2(水) 2:15
2024-10-02,18:07,world,国際,33【独占インタビュー】ベッツが語る大谷翔平の素顔「ショウは普通の男」「自由がないのは気の毒」「野球は超人的」ニューズウィーク日本版10/2(水) 13:2619件/時,ニューズウィーク日本版,【独占インタビュー】ベッツが語る大谷翔平の素顔「ショウは普通の男」「自由がないのは気の毒」「野球は超人的」,19,https://news.yahoo.co.jp/articles/058c6a1baf58cc685a74289eed89a56affe06eaa,10/2(水) 13:26
2024-10-02,18:07,world,国際,34【速報】イランがイスラエルに大規模報復攻撃　「400発以上のミサイル発射」イラン発表FNNプライムオンライン（フジテレビ系）10/2(水) 1:5219件/時,FNNプライムオンライン（フジテレビ系）,【速報】イランがイスラエルに大規模報復攻撃　「400発以上のミサイル発射」イラン発表,19,https://news.yahoo.co.jp/articles/334332928da23f6ef4a358ec3f65dbc832e98c04,10/2(水) 1:52
2024-10-02,18:07,world,国際,35北東部ボウチャンシクでロ軍が装甲車20両で反撃、ほぼ壊滅する大失敗　100人ほど戦死かForbes JAPAN10/2(水) 17:0017件/時,Forbes JAPAN,北東部ボウチャンシクでロ軍が装甲車20両で反撃、ほぼ壊滅する大失敗　100人ほど戦死か,17,https://news.yahoo.co.jp/articles/ee80cea8e5b7cea02692c711cad413a34376780a,10/2(水) 17:00
2024-10-02,18:07,world,国際,36イスラエルにミサイル200発 イラン、反撃で「全インフラ標的」と警告ＡＦＰ＝時事10/2(水) 15:4617件/時,ＡＦＰ＝時事,イスラエルにミサイル200発 イラン、反撃で「全インフラ標的」と警告,17,https://news.yahoo.co.jp/articles/87097770c6184bc4c7452cb51a131104d6827755,10/2(水) 15:46
2024-10-02,18:07,world,国際,37イラン、ミサイル発射　イスラエル中部などで警報発令時事通信10/1(火) 23:0817件/時,時事通信,イラン、ミサイル発射　イスラエル中部などで警報発令,17,https://news.yahoo.co.jp/articles/c5238eaff87631574d3429c36b417dcd22af016a,10/1(火) 23:08
2024-10-02,18:07,world,国際,38《ブラジル》6カ所同時に美容整形手術で死亡＝24歳女性、「割引価格で」と医師にお勧めされブラジル日報10/2(水) 7:4117件/時,ブラジル日報,《ブラジル》6カ所同時に美容整形手術で死亡＝24歳女性、「割引価格で」と医師にお勧めされ,17,https://news.yahoo.co.jp/articles/a869b70a67cfe426e1dd8ced77e5f01935235d3c,10/2(水) 7:41
2024-10-02,18:07,world,国際,39石破氏のアジア版ＮＡＴＯ構想、共有せず＝インド外相ロイター10/2(水) 8:1116件/時,ロイター,石破氏のアジア版ＮＡＴＯ構想、共有せず＝インド外相,16,https://news.yahoo.co.jp/articles/ba6886e0549393bd7cb900b59e05b53acf7351e1,10/2(水) 8:11
2024-10-02,18:07,world,国際,400:32石破新内閣、女性閣僚は2人のみ 前政権の5人から減少AFPBB News10/2(水) 11:1615件/時,AFPBB News,石破新内閣、女性閣僚は2人のみ 前政権の5人から減少,15,https://news.yahoo.co.jp/articles/fbd5557b334d89eb2fb1f493e2bbd6e115cfc051,10/2(水) 11:16
