scrp_date,scrp_time,genre_en,genre_jp,rank,media_jp,title,comment,link,date_original
2024-10-02,16:06,business,経済,1ファミマ、イートイン削減→売り場に変更　全国の店舗で順次ITmedia ビジネスオンライン10/2(水) 11:41529件/時,ITmedia ビジネスオンライン,ファミマ、イートイン削減→売り場に変更　全国の店舗で順次,529,https://news.yahoo.co.jp/articles/076a335378d542868bec9d3d97d7380041cb1cda,10/2(水) 11:41
2024-10-02,16:06,business,経済,2「味噌汁かけご飯」否定派と肯定派、それぞれが抱えるモヤモヤ　「行儀が悪い」とは思うけど「お茶漬けは？」「ラーメンの汁にご飯は？」で堂々巡りマネーポストWEB10/2(水) 15:15185件/時,マネーポストWEB,「味噌汁かけご飯」否定派と肯定派、それぞれが抱えるモヤモヤ　「行儀が悪い」とは思うけど「お茶漬けは？」「ラーメンの汁にご飯は？」で堂々巡り,185,https://news.yahoo.co.jp/articles/d19e10b24b054113c4b35196f01fb201f7e04d8a,10/2(水) 15:15
2024-10-02,16:06,business,経済,3【日経平均】一時1000円超急落　中東リスク警戒や円高傾向受け　取引終了前に下げ幅拡大テレビ朝日系（ANN）10/2(水) 15:08158件/時,テレビ朝日系（ANN）,【日経平均】一時1000円超急落　中東リスク警戒や円高傾向受け　取引終了前に下げ幅拡大,158,https://news.yahoo.co.jp/articles/c2fb762188da1c0b0d251fc2037cecf39efec17b,10/2(水) 15:08
2024-10-02,16:06,business,経済,4「焼肉店」の倒産、前年から倍増　年間で過去最多を更新　輸入牛肉に加え野菜の高騰も打撃、値上げ進まず小規模店で苦戦帝国データバンク10/2(水) 10:00155件/時,帝国データバンク,「焼肉店」の倒産、前年から倍増　年間で過去最多を更新　輸入牛肉に加え野菜の高騰も打撃、値上げ進まず小規模店で苦戦,155,https://news.yahoo.co.jp/articles/91215640746997075d7dfca94dd9bb7e739ace06,10/2(水) 10:00
2024-10-02,16:06,business,経済,5アンパンマンの玩具を自主回収　バンダイ、子どもが誤飲の恐れ共同通信10/2(水) 12:24127件/時,共同通信,アンパンマンの玩具を自主回収　バンダイ、子どもが誤飲の恐れ,127,https://news.yahoo.co.jp/articles/6596d9ed276a19122b60b55e2a689290b7cc4a7e,10/2(水) 12:24
2024-10-02,16:06,business,経済,6Tシャツ1枚が200万円越え…！ ヴィンテージTシャツの「値上がり」が止まらないワケ現代ビジネス10/2(水) 8:05123件/時,現代ビジネス,Tシャツ1枚が200万円越え…！ ヴィンテージTシャツの「値上がり」が止まらないワケ,123,https://news.yahoo.co.jp/articles/123560ebf025f842e2b8e81dded9c5dab84cacec,10/2(水) 8:05
2024-10-02,16:06,business,経済,7ドラクエ3リメーク版の性別撤廃にマスク氏も「非常識だ」　堀井氏動画リポストで〝参戦〟産経新聞10/2(水) 14:06115件/時,産経新聞,ドラクエ3リメーク版の性別撤廃にマスク氏も「非常識だ」　堀井氏動画リポストで〝参戦〟,115,https://news.yahoo.co.jp/articles/72a4f33197439082259687cea4068471c8a45c1c,10/2(水) 14:06
2024-10-02,16:06,business,経済,8五輪最高位スポンサー、日本企業3社全て撤退　ブリヂストンも表明朝日新聞デジタル10/1(火) 15:21100件/時,朝日新聞デジタル,五輪最高位スポンサー、日本企業3社全て撤退　ブリヂストンも表明,100,https://news.yahoo.co.jp/articles/4e2dca35ac080671f79c6b13b473c7c809b1001c,10/1(火) 15:21
2024-10-02,16:06,business,経済,9「ありかも！」長澤まさみのCMで認知度爆上がりの中国の電気自動車「BYD」 高性能なのに日本で苦戦している理由とは？集英社オンライン10/2(水) 8:0272件/時,集英社オンライン,「ありかも！」長澤まさみのCMで認知度爆上がりの中国の電気自動車「BYD」 高性能なのに日本で苦戦している理由とは？,72,https://news.yahoo.co.jp/articles/ed8b97d800267fb292c6e4111a7f9d9cd8f0c00f,10/2(水) 8:02
2024-10-02,16:06,business,経済,10ガソリンを満タン後、さらに入れるのはNG！「継ぎ足し給油」が禁止されている理由とは？…オートストップ機能が早く働きすぎる!?Auto Messe Web10/2(水) 15:1058件/時,Auto Messe Web,ガソリンを満タン後、さらに入れるのはNG！「継ぎ足し給油」が禁止されている理由とは？…オートストップ機能が早く働きすぎる!?,58,https://news.yahoo.co.jp/articles/e88cc8cfa523120f1909ace29fba4b77a9ae1d3d,10/2(水) 15:10
2024-10-02,16:06,business,経済,11運転免許が「本人確認書類」にならない？ なぜ？ 今後はマイナカードに1本化!? 免許偽造で4000万円被害も… オンライン契約は何が変わる？　くるまのニュース10/2(水) 9:1552件/時,くるまのニュース,運転免許が「本人確認書類」にならない？ なぜ？ 今後はマイナカードに1本化!? 免許偽造で4000万円被害も… オンライン契約は何が変わる？,52,https://news.yahoo.co.jp/articles/2355c779665d786d644277415e1caa62368d25a2,10/2(水) 9:15
2024-10-02,16:06,business,経済,12高市早苗の築いた牙城を突き崩す…石破茂新総理が行った「思った以上にまともな閣僚と党人事」を解説しよう現代ビジネス10/2(水) 8:0551件/時,現代ビジネス,高市早苗の築いた牙城を突き崩す…石破茂新総理が行った「思った以上にまともな閣僚と党人事」を解説しよう,51,https://news.yahoo.co.jp/articles/9c5a32f640349f4d9a49b9cae787b59c397f57ad,10/2(水) 8:05
2024-10-02,16:06,business,経済,13米アップル、新型「ｉＰｈｏｎｅＳＥ」投入　来年初販売へ＝報道ロイター10/2(水) 11:5144件/時,ロイター,米アップル、新型「ｉＰｈｏｎｅＳＥ」投入　来年初販売へ＝報道,44,https://news.yahoo.co.jp/articles/3459258c2a52feba7ccd7ecb0c5fce90d58ea43f,10/2(水) 11:51
2024-10-02,16:06,business,経済,14フォーブス米長者番付、資産35兆円のマスクが「3年連続」首位にForbes JAPAN10/2(水) 12:1543件/時,Forbes JAPAN,フォーブス米長者番付、資産35兆円のマスクが「3年連続」首位に,43,https://news.yahoo.co.jp/articles/c3f415c8445c12e5c7fd71fb7197d219766fc21b,10/2(水) 12:15
2024-10-02,16:06,business,経済,15イラン、イスラエルに対し弾道ミサイル攻撃を準備中－米当局者Bloomberg10/1(火) 23:1941件/時,Bloomberg,イラン、イスラエルに対し弾道ミサイル攻撃を準備中－米当局者,41,https://news.yahoo.co.jp/articles/4cfe4247351e4789e2f74d3e0eb7f571059ac87a,10/1(火) 23:19
2024-10-02,16:06,business,経済,16警察の捜査に協力したら、お礼として「菓子折り」をもらいました。元々は「税金」だと思うのですが、受け取っても問題はないのでしょうか？ファイナンシャルフィールド10/2(水) 15:1036件/時,ファイナンシャルフィールド,警察の捜査に協力したら、お礼として「菓子折り」をもらいました。元々は「税金」だと思うのですが、受け取っても問題はないのでしょうか？,36,https://news.yahoo.co.jp/articles/4de494b40770892de4474cc9f51f1e57c49f726c,10/2(水) 15:10
2024-10-02,16:06,business,経済,17郊外にあったホームセンターが、なぜ「大都市の駅前」に出店しているのかITmedia ビジネスオンライン10/2(水) 6:1031件/時,ITmedia ビジネスオンライン,郊外にあったホームセンターが、なぜ「大都市の駅前」に出店しているのか,31,https://news.yahoo.co.jp/articles/589939e16d7a1a9693676b3107dd396f7805963c,10/2(水) 6:10
2024-10-02,16:06,business,経済,18ＮＹダウ、一時４００ドル近く下げる…終値は１７３ドル安の４万２１５６ドル読売新聞オンライン10/2(水) 5:4928件/時,読売新聞オンライン,ＮＹダウ、一時４００ドル近く下げる…終値は１７３ドル安の４万２１５６ドル,28,https://news.yahoo.co.jp/articles/d0d68b5c59b35bee5bbe842caf5cd5a75dbea2df,10/2(水) 5:49
2024-10-02,16:06,business,経済,19“コメ騒動”で定期便予約4倍も…　新米出回り1トン分キャンセル　農家困惑テレビ朝日系（ANN）10/2(水) 11:5727件/時,テレビ朝日系（ANN）,“コメ騒動”で定期便予約4倍も…　新米出回り1トン分キャンセル　農家困惑,27,https://news.yahoo.co.jp/articles/abbe2b80d03d85f22d9c45821fe00c5e1cc5c018,10/2(水) 11:57
2024-10-02,16:06,business,経済,20車の購入を家族に相談。「ディーゼル車ならガソリン代が節約できる」と言われましたが、対応車種も少ないし“コスト”も正直あまり変わらないですよね？ 実際どのくらい違うのでしょうか？ファイナンシャルフィールド10/2(水) 11:3027件/時,ファイナンシャルフィールド,車の購入を家族に相談。「ディーゼル車ならガソリン代が節約できる」と言われましたが、対応車種も少ないし“コスト”も正直あまり変わらないですよね？ 実際どのくらい違うのでしょうか？,27,https://news.yahoo.co.jp/articles/9978af1146c8de965637ddbb59220f63a35c4055,10/2(水) 11:30
2024-10-02,16:06,business,経済,21「自立した女性が好き」という同僚に理想相手を聞いてみたら「年収500万円以上」との回答が…！そんなに稼いでいる女性は日本にどれくらいいるのでしょうか？ファイナンシャルフィールド10/2(水) 14:1026件/時,ファイナンシャルフィールド,「自立した女性が好き」という同僚に理想相手を聞いてみたら「年収500万円以上」との回答が…！そんなに稼いでいる女性は日本にどれくらいいるのでしょうか？,26,https://news.yahoo.co.jp/articles/de84902e9f6473cecd5571fd42b52bbd68701417,10/2(水) 14:10
2024-10-02,16:06,business,経済,22石破新内閣、経済閣僚の顔ぶれに抜擢感なく　景気浮揚へ課題山積、キーマンは平デジタル相産経新聞10/2(水) 11:3421件/時,産経新聞,石破新内閣、経済閣僚の顔ぶれに抜擢感なく　景気浮揚へ課題山積、キーマンは平デジタル相,21,https://news.yahoo.co.jp/articles/a9fc4e9f21f585af517dd72910461441654996a3,10/2(水) 11:34
2024-10-02,16:06,business,経済,23日経平均、1000円超安＝東京株式時事通信10/2(水) 15:0020件/時,時事通信,日経平均、1000円超安＝東京株式,20,https://news.yahoo.co.jp/articles/8d6ad1ef36f4684a1085846ce88a4d0308fb0cf4,10/2(水) 15:00
2024-10-02,16:06,business,経済,24ビル・ゲイツが世界富豪ランキングで12位に下落、1991年以来初のトップ10圏外Forbes JAPAN10/2(水) 12:5520件/時,Forbes JAPAN,ビル・ゲイツが世界富豪ランキングで12位に下落、1991年以来初のトップ10圏外,20,https://news.yahoo.co.jp/articles/26d1e46caa052cd5edc1a57afb032bf20f6523e7,10/2(水) 12:55
2024-10-02,16:06,business,経済,25ガソリンの自己着火という「夢の技術」で業界騒然となったSKYACTIV-X！　どんな技術でなぜ広まらなかったのか？WEB CARTOP10/2(水) 11:5220件/時,WEB CARTOP,ガソリンの自己着火という「夢の技術」で業界騒然となったSKYACTIV-X！　どんな技術でなぜ広まらなかったのか？,20,https://news.yahoo.co.jp/articles/92a1ec41ef5525985cc8d4c06115b4521c3e7e61,10/2(水) 11:52
2024-10-02,16:06,business,経済,26大学進学を目指す高3です。両親から学費を払わないから「奨学金」を申し込むように言われました。これって普通なのでしょうか？ファイナンシャルフィールド10/2(水) 15:2019件/時,ファイナンシャルフィールド,大学進学を目指す高3です。両親から学費を払わないから「奨学金」を申し込むように言われました。これって普通なのでしょうか？,19,https://news.yahoo.co.jp/articles/0bf8a4d84caa0b3c88f514ad1c8b0fe5e0cb8565,10/2(水) 15:20
2024-10-02,16:06,business,経済,27日本の人材力、横ばい43位　国際性低く最低順位継続共同通信10/2(水) 14:3219件/時,共同通信,日本の人材力、横ばい43位　国際性低く最低順位継続,19,https://news.yahoo.co.jp/articles/af4353210f3683f72d0916788319304c4f6355e9,10/2(水) 14:32
2024-10-02,16:06,business,経済,28「石破のせがれ預かってくれんかね。頼むよ」電話口で響いた田中角栄のダミ声…“緊縮派”の宰相・石破茂誕生の瞬間JBpress10/2(水) 11:4619件/時,JBpress,「石破のせがれ預かってくれんかね。頼むよ」電話口で響いた田中角栄のダミ声…“緊縮派”の宰相・石破茂誕生の瞬間,19,https://news.yahoo.co.jp/articles/514e84425d0912e2dd6b8e1ee1b08f8b9dd284cf,10/2(水) 11:46
2024-10-02,16:06,business,経済,29石破首相が利上げに前向きとの見方は必ずしも正しくない－赤沢再生相Bloomberg10/2(水) 11:5819件/時,Bloomberg,石破首相が利上げに前向きとの見方は必ずしも正しくない－赤沢再生相,19,https://news.yahoo.co.jp/articles/6a67dc14b938eb36cd56d8f0170eea17d214b4d4,10/2(水) 11:58
2024-10-02,16:06,business,経済,30ドラクエ３リメーク版の「性別撤廃」に〝生みの親〟堀井雄二氏が苦言「誰か文句言う？」産経新聞10/1(火) 16:2918件/時,産経新聞,ドラクエ３リメーク版の「性別撤廃」に〝生みの親〟堀井雄二氏が苦言「誰か文句言う？」,18,https://news.yahoo.co.jp/articles/ca6a02ebd06a4f7b22ed7514bda7acc2fa09dd2f,10/1(火) 16:29
2024-10-02,16:06,business,経済,31石破氏の「アジア版NATO」構想はポエムに過ぎない、ASEAN首脳会議で失笑買う恐れ東洋経済オンライン10/2(水) 11:0217件/時,東洋経済オンライン,石破氏の「アジア版NATO」構想はポエムに過ぎない、ASEAN首脳会議で失笑買う恐れ,17,https://news.yahoo.co.jp/articles/9616e7f3eda99005ddefce7f90d70eaa21b78dde,10/2(水) 11:02
2024-10-02,16:06,business,経済,32まさかオイルパンにジャッキかけてない? [タイヤ交換]で絶対やっちゃいけない作業とは?ベストカーWeb10/2(水) 7:0017件/時,ベストカーWeb,まさかオイルパンにジャッキかけてない? [タイヤ交換]で絶対やっちゃいけない作業とは?,17,https://news.yahoo.co.jp/articles/565157e7fbb4530f5d5075433b4f2b9d49acdec3,10/2(水) 7:00
2024-10-02,16:06,business,経済,33任天堂はこの機を狙った？　訴訟でも「パルワールド」はTGS大出展…「和解はないのでは」と専門家デイリー新潮10/2(水) 11:1117件/時,デイリー新潮,任天堂はこの機を狙った？　訴訟でも「パルワールド」はTGS大出展…「和解はないのでは」と専門家,17,https://news.yahoo.co.jp/articles/2e9f3ea4fe49be4d306915d9feadea53bf8eacec,10/2(水) 11:11
2024-10-02,16:06,business,経済,34村上誠一郎総務大臣「論理的におかしいことはおかしい」アベノミクスについてTBS NEWS DIG Powered by JNN10/2(水) 12:5917件/時,TBS NEWS DIG Powered by JNN,村上誠一郎総務大臣「論理的におかしいことはおかしい」アベノミクスについて,17,https://news.yahoo.co.jp/articles/82ef7e5468a1413bf822b25255c7fd0967a530c5,10/2(水) 12:59
2024-10-02,16:06,business,経済,35えっ走行距離2万キロ台!? それも完全ノーマル車！ 25年前の日産「R34スカイラインGT-R」Vスペックを海外で発見 気になるお値段とはVAGUE10/2(水) 14:1016件/時,VAGUE,えっ走行距離2万キロ台!? それも完全ノーマル車！ 25年前の日産「R34スカイラインGT-R」Vスペックを海外で発見 気になるお値段とは,16,https://news.yahoo.co.jp/articles/7390a0346b0813138315e946e4d96324c22a708f,10/2(水) 14:10
2024-10-02,16:06,business,経済,36日経平均、800円超安＝東京株式時事通信10/2(水) 14:3015件/時,時事通信,日経平均、800円超安＝東京株式,15,https://news.yahoo.co.jp/articles/6dc97d8cf6e790153f94bcfd64a8d0eb26ce34bc,10/2(水) 14:30
2024-10-02,16:06,business,経済,37彼女の日産Z32「フェアレディZ」は母が乗っていた真っ赤なZを再現！「私が乗れなくなったら廃車にしたいくらい」という言葉の真意とは？Auto Messe Web10/2(水) 11:1015件/時,Auto Messe Web,彼女の日産Z32「フェアレディZ」は母が乗っていた真っ赤なZを再現！「私が乗れなくなったら廃車にしたいくらい」という言葉の真意とは？,15,https://news.yahoo.co.jp/articles/5b6238299f3bfb34b6d00ce2ed8499aa99fc1c43,10/2(水) 11:10
2024-10-02,16:06,business,経済,38日本の装備品なぜ輸出ふるわない？「まず考えられるのは…」日本メーカーが米企業と組んで学んだ“決定的な違い” 【中編】乗りものニュース10/2(水) 9:4215件/時,乗りものニュース,日本の装備品なぜ輸出ふるわない？「まず考えられるのは…」日本メーカーが米企業と組んで学んだ“決定的な違い” 【中編】,15,https://news.yahoo.co.jp/articles/e6764d7f4d992365c3fe8b79ceb515e8fb867089,10/2(水) 9:42
2024-10-02,16:06,business,経済,39EV販売「44%減」の衝撃！ 結局“補助金”がないと売れないのか？ 欧州8月の厳しい現実、自動車全体で「2割減」という更なる懸念もMerkmal10/2(水) 11:5115件/時,Merkmal,EV販売「44%減」の衝撃！ 結局“補助金”がないと売れないのか？ 欧州8月の厳しい現実、自動車全体で「2割減」という更なる懸念も,15,https://news.yahoo.co.jp/articles/e15e15006dcc22124bff101f56efc2d445da8fa8,10/2(水) 11:51
2024-10-02,16:06,business,経済,40国内販売1強N-BOXの陰で[N-WGN][N-ONE]が大不振! なぜN-WGNはN-BOXの17％しか売れていないのか?ベストカーWeb10/2(水) 11:4514件/時,ベストカーWeb,国内販売1強N-BOXの陰で[N-WGN][N-ONE]が大不振! なぜN-WGNはN-BOXの17％しか売れていないのか?,14,https://news.yahoo.co.jp/articles/5a9d120ffca9cc9a72cd4df259dc22e67ee6b686,10/2(水) 11:45
