scrp_date,scrp_time,genre_en,genre_jp,rank,media_jp,title,comment,link,date_original
2025-11-27,20:07,business,経済,1,Bloomberg,トランプ氏、高市氏に台湾巡り中国を刺激しないよう助言－WSJ,266,https://news.yahoo.co.jp/articles/9d7e5a22b3863cbba6abe809fe595f34db66e4e1,11/27(木) 8:45
2025-11-27,20:07,business,経済,2,FNNプライムオンライン（フジテレビ系）,【速報】ニホンウナギ含むウナギ全種類を国際取引の規制対象にする案は「否決」　12月5日本会議で可決の可能性も,217,https://news.yahoo.co.jp/articles/70c728efe8f4dca8110b82e38389857493b6c7cc,11/27(木) 16:00
2025-11-27,20:07,business,経済,3,NEWSポストセブン,《“訪日控え”で夜の街も大ピンチ？》上野の高級チャイナパブに波及する高市発言の影響「ボトルは『山崎』、20万〜30万円の会計はざら」「お金持ち中国人は余裕があって安心」,194,https://news.yahoo.co.jp/articles/a3d89fbef78da73508c1c6a0080f790d5f56cffa,11/27(木) 16:15
2025-11-27,20:07,business,経済,4,ITmedia ビジネスオンライン,ReFa「5400円の水」に勝算はあるのか　バルミューダ後の“空白市場”をつかむ？,116,https://news.yahoo.co.jp/articles/ad0fa93da1526575cb1760d75083d9d7164dfabf,11/27(木) 8:10
2025-11-27,20:07,business,経済,5,TBS NEWS DIG Powered by JNN,【鈴木農水大臣生出演】コメ政策の“将来像”は　都内のスーパーでは5キロ6000円超えも…どうなる?今後のコメ価格【news23】,104,https://news.yahoo.co.jp/articles/36ed2c7166444a9fd072205c7e2d9b69e8084b29,11/27(木) 14:50
2025-11-27,20:07,business,経済,6,読売新聞オンライン,低迷するＥＶの戦略見直し相次ぐ、米国市場での販売も見通せず…当面はＨＶに注力の構え,71,https://news.yahoo.co.jp/articles/373cf6bc07071d161cfef0f00ea0617a08abc667,11/27(木) 7:14
2025-11-27,20:07,business,経済,7,サンデー毎日×週刊エコノミストOnline,中国人観光客消費はGDP0.3％分相当　侮れない“渡航自粛”効果　小林真一郎,71,https://news.yahoo.co.jp/articles/bbdbf645e330b7397c10980fa61aaf039d3c21ce,11/27(木) 9:54
2025-11-27,20:07,business,経済,8,みんかぶマガジン,石破さん頼む、黙ってくれ！「おこめ券配布の原資は？」前総理の異議に経済誌元編集長が激怒…全部あなたの尻拭い！国民と日本農業の重荷,66,https://news.yahoo.co.jp/articles/5b5d6ce2dabd5ba8591412f37722308949ca4ec4,11/27(木) 9:10
2025-11-27,20:07,business,経済,9,TBS NEWS DIG Powered by JNN,【速報】日経平均 5万円回復して取引終了　27日終値5万167円　アメリカの株高を受け続伸,54,https://news.yahoo.co.jp/articles/c68ca884d009bcef56e3d1b699aabb6ef7625542,11/27(木) 15:32
2025-11-27,20:07,business,経済,10,共同通信,イオン、中国に新大型店を開業　混乱なく地元客でにぎわい,53,https://news.yahoo.co.jp/articles/c821d34d4f87f76bb6da0309dd3a947d9be949e6,11/27(木) 18:46
2025-11-27,20:07,business,経済,11,日本農業新聞,小泉氏の発言巡り鈴木農相が陳謝　米価高騰の要因とされた卸に「おわび申し上げたい」,53,https://news.yahoo.co.jp/articles/6c92aad9aefb9a0d28dcf972252e81d6c1399364,11/27(木) 14:53
2025-11-27,20:07,business,経済,12,プレジデントオンライン,米価格の最高値更新に慌てる必要はない…鈴木憲和農水相の「大増産しない」方針に一理も二理もあるワケ,53,https://news.yahoo.co.jp/articles/bb5731d224eea242252fd09d88f5d2a90842d594,11/27(木) 8:15
2025-11-27,20:07,business,経済,13,毎日新聞,アサヒHD社長、完全復旧は「2月以降」　12月2日から受注再開,47,https://news.yahoo.co.jp/articles/0eb154243d865e73df079bdbbfb4216d950af65f,11/27(木) 12:05
2025-11-27,20:07,business,経済,14,ファイナンシャルフィールド,令和7年秋から“500円増額”された「生活扶助の特例加算」。4人家族の「生活保護受給世帯」だと“計6000円”も毎月上乗せされるって本当!?,43,https://news.yahoo.co.jp/articles/e499b46f9eece1bd0d0a859cac7e2234bf5659b6,11/27(木) 17:50
2025-11-27,20:07,business,経済,15,ファイナンシャルフィールド,友人に車を出してもらい「高速代の半額」を支払い→後日「全額負担が常識」と知りショック！ 無免許なのですが“運転へのお礼”ってどうすべきなのでしょうか…？,35,https://news.yahoo.co.jp/articles/21dbdf98f990be5be8bd595420f421eb968f03d8,11/27(木) 13:40
2025-11-27,20:07,business,経済,16,読売新聞オンライン,ＡＩ・半導体・宇宙など国家戦略６分野の投資促進へ「４０％減税」案…経産省、研究開発税制の拡充要望,35,https://news.yahoo.co.jp/articles/7292ac173413ed28b854d54a3b26cfe63bd19a2f,11/27(木) 5:00
2025-11-27,20:07,business,経済,17,読売新聞オンライン,「転勤手当」最大６０万円に、住友生命が中堅以上対象に…離職防止・全国の拠点維持へ大幅増,33,https://news.yahoo.co.jp/articles/8d49970e81b58d322c4e91bae20b2930a2a2e3dc,11/27(木) 5:00
2025-11-27,20:07,business,経済,18,ファイナンシャルフィールド,“3500万円の相続”が終わり残された遺品を整理していたところ、“500万円”の「タンス預金」を発見！ 黙っていれば税務署にバレないですよね？,28,https://news.yahoo.co.jp/articles/4777ab5e7c8cf03880375f4ef4da8d06b945da56,11/27(木) 15:40
2025-11-27,20:07,business,経済,19,Wedge（ウェッジ）,「おこめ券」は米価を上げるだけの愚策！これでは低所得者は楽にならない、物価対策として見落としていること,28,https://news.yahoo.co.jp/articles/c291490fde3021127889e9c5e36362a68a4c37d2,11/27(木) 5:00
2025-11-27,20:07,business,経済,20,ニュースイッチ,外国人取得、東京都新宿区は14.6％…国交省調査が明らかにしたマンション取引の実態,27,https://news.yahoo.co.jp/articles/e8b93d6c2433f5a43a2c5fe4c2db4df501a82c87,11/27(木) 15:10
2025-11-27,20:07,business,経済,21,朝日新聞,車購入時の税「環境性能割」の廃止要求　自工会部会長「二重課税だ」,26,https://news.yahoo.co.jp/articles/6e1c1defae1a590c26115a958a16b3ce8e8eb566,11/27(木) 18:56
2025-11-27,20:07,business,経済,22,ロイター,マンダムのＭＢＯ、ＴＯＢ価格を3割引き上げ　成立の公算高まる,26,https://news.yahoo.co.jp/articles/921b52b90841160fcde65bb4d4b42a785517f5c3,11/27(木) 16:31
2025-11-27,20:07,business,経済,23,ファイナンシャルフィールド,2028年頃導入予定の「新マイナンバーカード」、現行カードとの違いは？ 切り替えないと「マイナ保険証」が使えなくなる！？,23,https://news.yahoo.co.jp/articles/14c847aa9e779ea05fc89f77f0804d5ae501b551,11/27(木) 15:30
2025-11-27,20:07,business,経済,24,みんかぶマガジン,都心マンション価格が今後も“上がり続ける”可能性が高い構造的要因,21,https://news.yahoo.co.jp/articles/b184744e903a97c298f4eb9b9be05d61af30ed71,11/27(木) 19:10
2025-11-27,20:07,business,経済,25,朝日新聞,高市政権の農業政策転換支持、JA茨城会長「前大臣に翻弄された」,21,https://news.yahoo.co.jp/articles/a3fa159ce3a4691785d2bb994a68367e9c282907,11/27(木) 11:15
2025-11-27,20:07,business,経済,26,FNNプライムオンライン（フジテレビ系）,【速報】鈴木農水相「まずはほっとしている」…ニホンウナギ含むウナギの国際取引の規制案が否決に　日中“連携”「結果を見ればそれが全て」,19,https://news.yahoo.co.jp/articles/f991dc8d9a7537b5d9a0502f558ee51082fbc0f1,11/27(木) 18:03
2025-11-27,20:07,business,経済,27,ロイター,次年度国債発行、30年債の優先減額求める声＝財務省幹部,18,https://news.yahoo.co.jp/articles/116f215fc595efeba5674d9eed515fdb73bb5c3d,11/27(木) 18:59
2025-11-27,20:07,business,経済,28,THE GOLD ONLINE（ゴールドオンライン）,"結婚後、夫の貯金が増えていない…大手企業勤務、年収約1,000万円の管理職妻が絶句した、「ギャンブルでも、浮気でもない」まさかの使い道",18,https://news.yahoo.co.jp/articles/9d5a0adfcc18097ebb6fa399c60617a95fa62a0a,11/27(木) 11:00
2025-11-27,20:07,business,経済,29,共同通信,浜岡原発工事で不祥事20件　中部電、数十億円未精算,18,https://news.yahoo.co.jp/articles/87803ee62fe34778a3fd92ec8494b1ac509defd1,11/27(木) 13:37
2025-11-27,20:07,business,経済,30,読売新聞オンライン,日銀の野口審議委員が大分で講演、利上げ検討姿勢示す…「緩和度合いを徐々に調整する方針に立ち帰る」,18,https://news.yahoo.co.jp/articles/96e4ddf4189fafb09b7ec99747a3d8848bc61fd5,11/27(木) 18:48
2025-11-27,20:07,business,経済,31,マネーポストWEB,《ホールの売上に直結》パチンコホールの広告宣伝で拡大する「来店イベント」　有名タレントより一般的には無名の“演者”が重宝される理由,17,https://news.yahoo.co.jp/articles/bdb9412284301f0f6788c78270c957ffc5092620,11/27(木) 16:13
2025-11-27,20:07,business,経済,32,Bloomberg,日本は「軍国主義」で世界に挑戦、中国国営メディアが非難,16,https://news.yahoo.co.jp/articles/124099de0f669bbde7af01b782124d1bd1097685,11/27(木) 1:27
2025-11-27,20:07,business,経済,33,ベストカーWeb,初代86の中古は100万円以下！　学生に選ばれる理由と全世代に刺さる魅力,16,https://news.yahoo.co.jp/articles/920fc5a33cd0f334d20651c967e34de8d458d175,11/27(木) 18:00
2025-11-27,20:07,business,経済,34,ベストカーWeb,大都会の大手バス事業者って1年に何台くらいの車両を入れ替えてる？　都営がちょっと凄すぎた!!,15,https://news.yahoo.co.jp/articles/5787f90936ead37c9f5b39b27154788db06a0aa5,11/27(木) 19:00
2025-11-27,20:07,business,経済,35,MotorFan,「ATからMTへの載せ換えっていくらかかるの!?」ミッションスワップを得意とする専門プロに聞いた,15,https://news.yahoo.co.jp/articles/684e6e32f40d2f03e41d7650ab9e6ad7ca611d47,11/27(木) 16:00
2025-11-27,20:07,business,経済,36,ファイナンシャルフィールド,「ガソリン給油」のためだけに“年会費5280円”かけて「コストコ」の会員になるのはアリ！？ お得なクーポンゲットのチャンスも！,15,https://news.yahoo.co.jp/articles/3e4f4a4f6b5091bfc79b87f21524b616cdce64e1,11/27(木) 14:30
2025-11-27,20:07,business,経済,37,ベストカーWeb,ホンダN-BOXが年間販売ランキング1位から一気に5位に陥落!!　メーカー＆ディーラーに直撃してわかった本当の理由,15,https://news.yahoo.co.jp/articles/d733a95d63de4a78fb922fca8775eda5a657d3eb,11/27(木) 8:00
2025-11-27,20:07,business,経済,38,朝日新聞,長野ガソリン問題、組合への改善命令も視野　知事「大変遺憾な行為」,14,https://news.yahoo.co.jp/articles/820229c98088195aa8df7a9d7b447a2813a2be6a,11/27(木) 19:00
2025-11-27,20:07,business,経済,39,共同通信,利上げ「慎重に」　日銀の野口審議委員,14,https://news.yahoo.co.jp/articles/df46073bb7104e93d1d47ec3ab9aca6de3905c8a,11/27(木) 11:31
2025-11-27,20:07,business,経済,40,東洋経済オンライン,1つの国に過度に依存してはいけない…中国の水産物「輸入停止」よりもヤバい資源の実態,14,https://news.yahoo.co.jp/articles/842dff60d89040fee46d7bc7942b23ef8a7863c5,11/27(木) 5:00
