scrp_date,scrp_time,genre_en,genre_jp,rank,media_jp,title,comment,link,date_original
2025-11-23,21:12,domestic,国内,1,共同通信,首相は中国に真意説明を　立民・野田代表、関係改善に向け,1737,https://news.yahoo.co.jp/articles/24244eeec9c340161d5dbf2886dba1885591070c,11/23(日) 15:52
2025-11-23,21:12,domestic,国内,2,スポニチアネックス,石破茂前首相　おこめ券配布に異議「その原資は何ですか？国民の税金でしょう？」,931,https://news.yahoo.co.jp/articles/31f7b08b33e0a0348085a0a7a7ba11b809408e8e,11/23(日) 16:55
2025-11-23,21:12,domestic,国内,3,スポニチアネックス,立民・岡田克也氏　「存立危機事態」答弁引き出した質問への批判に反論「全く理解できない」,734,https://news.yahoo.co.jp/articles/306652a949f27d9aacadaa30b8aa8ff10b489b0e,11/23(日) 19:44
2025-11-23,21:12,domestic,国内,4,毎日新聞,高市内閣支持65％横ばい　高支持率を維持　毎日新聞世論調査,639,https://news.yahoo.co.jp/articles/de8f2025b5f55beae0d0781dd6f88be96b26632d,11/23(日) 15:47
2025-11-23,21:12,domestic,国内,5,読売新聞オンライン,石破前首相、自公の連立解消「正しいとは思っていない」「進み過ぎる時に『待った』をしてくれた」,518,https://news.yahoo.co.jp/articles/c002dc682f4d781a6634d400b12d5f8097ce9d78,11/23(日) 11:00
2025-11-23,21:12,domestic,国内,6,ABEMA TIMES,“台湾有事”中国が反発…石破前総理の見解は「外交は世の中からボロクソ言われても国益のために守らなきゃいけないことがある」「どうすれば台湾有事にならないかを考えるべき」,334,https://news.yahoo.co.jp/articles/0fd7c9926ce40608a9938d70e3c37fc60ade63dc,11/23(日) 16:06
2025-11-23,21:12,domestic,国内,7,読売新聞オンライン,中国大使館「敗戦国に軍事行動取れる」とＸに投稿、外務省反論「国連の旧敵国条項の死文化に中国も賛成」,290,https://news.yahoo.co.jp/articles/7e638df5c3d37c3a4fce8149677489dd40881bc9,11/23(日) 20:33
2025-11-23,21:12,domestic,国内,8,日刊スポーツ,「報道特集」高市首相の台湾有事発言は「百害あって一利なし」小泉政権の元外務審議官が批判,265,https://news.yahoo.co.jp/articles/f53220248eb08554235f900a15377f52df488112,11/23(日) 13:59
2025-11-23,21:12,domestic,国内,9,中日スポーツ,米山隆一議員、台湾有事質問の岡田克也氏への非難に”反論”　「高市氏も過去に質問」の事実挙げ「『国会でするな』と言う保守の方は筋違い」と苦言,238,https://news.yahoo.co.jp/articles/0b3374af31238e408eb5c38da0463b118e60090e,11/23(日) 20:26
2025-11-23,21:12,domestic,国内,10,ABEMA TIMES,「日本はすでに代価を支払った」中国SNSで1位に,233,https://news.yahoo.co.jp/articles/c28992254b4d49365b271a2e3a1e2e63d8e1cc51,11/23(日) 11:36
2025-11-23,21:12,domestic,国内,11,FNNプライムオンライン（フジテレビ系）,対中国「あらゆる機会に対話を」立憲・野田氏　「首相の勇み足が発端。真意と公式見解を説明することが大事だ」,187,https://news.yahoo.co.jp/articles/035bf2042613ef9bef262cadef4150ffea69cdc5,11/23(日) 18:12
2025-11-23,21:12,domestic,国内,12,毎日新聞,「タコ山」「箱型ブランコ」の次はジャングルジム？　姿消す公園遊具,186,https://news.yahoo.co.jp/articles/bb7cb86c0b541cca1e7bc50d9bcedc2f54dfd8ca,11/23(日) 7:30
2025-11-23,21:12,domestic,国内,13,共同通信,皇族数確保の協議、越年へ　自維「男系男子の養子案」優先,176,https://news.yahoo.co.jp/articles/6c672ebb29d048e70b1ab885d91a10a6c512653d,11/23(日) 16:41
2025-11-23,21:12,domestic,国内,14,テレビ朝日系（ANN）,3連休 紅葉ピーク箱根大混雑　人気スポット1時間待ち行列　大渋滞「1km進むのに80分」,173,https://news.yahoo.co.jp/articles/3541fa8a41b1e59041157442b230e3a4407f3da8,11/23(日) 12:09
2025-11-23,21:12,domestic,国内,15,文春オンライン,"維新・藤田共同代表に続き…高木かおり総務会長も秘書への""公金還流""発覚で批判の声相次ぐ《「ここまで同じ手口とは」「単なる議員と秘書の関係じゃ…」2ショット撮も》",172,https://news.yahoo.co.jp/articles/2349f1d71b575d097b0a366637f5d6205f838aa9,11/23(日) 18:12
2025-11-23,21:12,domestic,国内,16,プレジデントオンライン,やっぱり進次郎のほうがマシ…「コメの値下げは無理」と言い張る農水大臣に、高市首相が命じるべき「5つの策」,169,https://news.yahoo.co.jp/articles/82aae8666bda674347889e705058be973a212664,11/23(日) 12:15
2025-11-23,21:12,domestic,国内,17,日刊スポーツ,ラサール石井氏、小泉進次郎防衛相の「愛国心」言及をうけ「真の愛国は、戦争を起こさない事」,144,https://news.yahoo.co.jp/articles/f747675027e394722f1ebc2afc854926ee5d3898,11/23(日) 8:48
2025-11-23,21:12,domestic,国内,18,デイリースポーツ,杉村太蔵氏　「オレは富裕層だと言う気はないけど、うちにまで子供手当が４万円くる」→２１兆円の経済対策を批判「正気の沙汰とは思えない」,143,https://news.yahoo.co.jp/articles/ef225b674ec73ee14accbd753a2c778358ebb26d,11/23(日) 10:58
2025-11-23,21:12,domestic,国内,19,スポニチアネックス,立民・岡田克也氏　高市首相発言に“さら問い”しなかったワケ「突っ込んでいったら…」,140,https://news.yahoo.co.jp/articles/e9839987cc381b57699f937b9944801cf66432b7,11/23(日) 19:47
2025-11-23,21:12,domestic,国内,20,J-CASTニュース,「独善的で無反省な態度」斎藤知事再選から1年に厳しい評価　「適正、適法」繰り返すも捜査はまだ続いている,140,https://news.yahoo.co.jp/articles/4cebcb2d1195d04f98a621add804d2e39f2a3a08,11/23(日) 16:30
2025-11-23,21:12,domestic,国内,21,中日スポーツ,『事態を悪化させるだけの高市内閣』 小沢一郎議員、台湾有事めぐる政府対応を疑問視 「『今後は気をつけます』で済む状況なのか」,132,https://news.yahoo.co.jp/articles/41d8bf4700c3462312513e3b733bc2c8d558f2de,11/23(日) 16:35
2025-11-23,21:12,domestic,国内,22,TBS NEWS DIG Powered by JNN,74歳男性が自宅の庭先でクマに襲われけが　妻が大声をあげてクマは逃げ出し、その後猟友会が駆除　栃木・鹿沼市,110,https://news.yahoo.co.jp/articles/40c8c402f29ea5ac27d744747267c95626fd7bcf,11/23(日) 16:26
2025-11-23,21:12,domestic,国内,23,日刊スポーツ,中国大使館、日本へ「直接軍事行動を取る権利を有する」旨Ｘで主張　田母神俊雄氏が強く警鐘,101,https://news.yahoo.co.jp/articles/79dc037e9a009760433727f0266e51f03a330474,11/23(日) 8:12
2025-11-23,21:12,domestic,国内,24,中日スポーツ,「正気の沙汰とは思えません」 高市早苗首相『子ども１人２万円給付』政策、杉村太蔵が批判 「例えばマイナンバーで資産を…」,98,https://news.yahoo.co.jp/articles/3ed26c5559d88894d29bb607ebfa25b761e4a0de,11/23(日) 16:00
2025-11-23,21:12,domestic,国内,25,日刊スポーツ,中谷元氏「中国の人、日本のお寿司をパクパク食べてますからね」中国の”日本は危険”にクギ,88,https://news.yahoo.co.jp/articles/6f5b42879c9195927feb34f50b6751b41e3256a2,11/23(日) 15:36
2025-11-23,21:12,domestic,国内,26,スポーツ報知,維新・吉村洋文代表、社会保険料の応能負担「能力のある方は申し訳ないが」…マイナンバーとのヒモ付け「やった方がいい」,85,https://news.yahoo.co.jp/articles/c34483ffa35dafa2d132f42ebbf7c3c11c3d3637,11/23(日) 19:42
2025-11-23,21:12,domestic,国内,27,TBS NEWS DIG Powered by JNN,日本側は撮影知らず? 日中協議で“中国優位”演出か　「渡航自粛」で大量キャンセルも中国国民からは冷静な反応も…【サンデーモーニング】,85,https://news.yahoo.co.jp/articles/19eb3434a111493dce192582d57ed23b1fda4230,11/23(日) 12:52
2025-11-23,21:12,domestic,国内,28,スポニチアネックス,鈴木憲和農相　目指すのは「現場から見て納得感のある農政」　海外マーケット開拓に意欲「国が前面に…」,84,https://news.yahoo.co.jp/articles/f3dd77ecb86736dc04ac0c01654e789fea153fe2,11/23(日) 19:39
2025-11-23,21:12,domestic,国内,29,TBS NEWS DIG Powered by JNN,G20今夜閉幕「かなりのスピードで関係強化。高市総理ならでは」初日は笑顔の積極外交も日中接触は未だ実現せず,76,https://news.yahoo.co.jp/articles/c789b0a778a2be55b3262fedfbc44e6b5e6d880e,11/23(日) 18:20
2025-11-23,21:12,domestic,国内,30,スポニチアネックス,石破茂前首相　台湾有事巡る議論に考え示す「我々がやらなければいかんのは、どうすれば…」,73,https://news.yahoo.co.jp/articles/22adc12a084ea36c635b654742cdc1514f5ca97f,11/23(日) 16:07
2025-11-23,21:12,domestic,国内,31,日刊スポーツ,「報道特集」山本恵里伽アナ、高市首相発言で地元熊本の声代弁「地域の分断、そんな危機感を…」,72,https://news.yahoo.co.jp/articles/c3b51480f92fe78434c861efbe77c3bf7231a494,11/23(日) 13:10
2025-11-23,21:12,domestic,国内,32,中日スポーツ,共産党議員、高市首相『マウント取れる服』投稿に「外交でマウント…唖然とする」と問題視「事実と道理、国際法など埒外の恥ずべき姿勢」,69,https://news.yahoo.co.jp/articles/54758c1b914e6966d2aaccd4d8b2773adeaac26a,11/22(土) 22:32
2025-11-23,21:12,domestic,国内,33,毎日新聞,高市首相の台湾有事答弁「問題ない」50％　毎日新聞世論調査,64,https://news.yahoo.co.jp/articles/399c57ce95533e7a04157079c92fb804dc464a6f,11/23(日) 16:04
2025-11-23,21:12,domestic,国内,34,日刊スポーツ,紀藤正樹弁護士、「妄想と言うほかない」　北村弁護士の日弁連の政治活動禁止求める国会質問に,63,https://news.yahoo.co.jp/articles/0d8ef860404b5cb74da13e0faedd8c0476ea85f0,11/23(日) 7:36
2025-11-23,21:12,domestic,国内,35,スポニチアネックス,維新・吉村洋文代表　台湾有事発言で高市首相と「話はしました」「撤回する必要はない」も「ただ…」,61,https://news.yahoo.co.jp/articles/95c69b3db68aff335fc926abe7bb04d70132fbe3,11/23(日) 12:59
2025-11-23,21:12,domestic,国内,36,よろず～ニュース,中国は「旧敵国条項」削除に賛成→「恫喝」は無理筋　山尾志桜里氏が指摘「日本は積極的・戦略的な法律戦」を,60,https://news.yahoo.co.jp/articles/a248d9e5c0b2af13001ecc06e6e920d7431555f3,11/23(日) 17:10
2025-11-23,21:12,domestic,国内,37,文春オンライン,「女性総理はよくてなぜ女性天皇はダメなのか」ラオス大歓待で再燃する「愛子天皇」待望論「敬宮愛子さまを皇太子に」,59,https://news.yahoo.co.jp/articles/2eb5ad81a2b982ba13bdb8e59793abc298b3bd53,11/23(日) 7:12
2025-11-23,21:12,domestic,国内,38,集英社オンライン,〈赤坂ライブハウス×印襲撃〉「9年前にSNSで被害女性と知り合い、家族がいると伏せていたけど…6月に円満に別れた」“ゲス不倫・自衛官”は茨城の“公務員一家”のおぼっちゃま,59,https://news.yahoo.co.jp/articles/ae0ce42d41f8961b031ea42d88e9e2d8943e3b15,11/23(日) 18:54
2025-11-23,21:12,domestic,国内,39,スポニチアネックス,中谷元前防衛相　日本ら“敵国”「直接軍事行動を取る権利を有する」投稿に「本当に常軌を逸している」,58,https://news.yahoo.co.jp/articles/e780c725063abeaf585d7617c1f64e1486ad48b9,11/23(日) 10:43
2025-11-23,21:12,domestic,国内,40,共同通信,前橋市長続投「市政もっと停滞」　有志500人集会、辞職求め,57,https://news.yahoo.co.jp/articles/63e094eb420ef38ac09bdaaab65b26e595f7ccd0,11/23(日) 19:07
