scrp_date,scrp_time,genre_en,genre_jp,rank,media_jp,title,comment,link,date_original
2025-05-19,07:07,business,経済,1,JBpress,イオンがカリフォルニア産米を販売、これが日本の食料安全保障にとって取り返しのつかない一歩になりかねない理由,131,https://news.yahoo.co.jp/articles/6ba4aecf11d88a2aa0b5154b4b94280de2c89495,5/19(月) 6:02
2025-05-19,07:07,business,経済,2,共同通信,【独自】日産、NV200終了検討　湘南工場閉鎖案、生産移管せず,105,https://news.yahoo.co.jp/articles/1d6e86d7283db54d92651f639b822386763a01f8,5/18(日) 15:21
2025-05-19,07:07,business,経済,3,朝日新聞,増える「電話が怖い」社員たち　SNS世代ならではの不安と責任感,73,https://news.yahoo.co.jp/articles/0bdc6913f0e363f3ba9feab98413e024381c1766,5/18(日) 15:00
2025-05-19,07:07,business,経済,4,共同通信,中国、日米台欧に不当廉売関税　樹脂に最大74％,63,https://news.yahoo.co.jp/articles/b98b5301e369ae248c60a9f30176310f560ede71,5/18(日) 20:33
2025-05-19,07:07,business,経済,5,読売新聞オンライン,「日産２工場閉鎖」で地元に衝撃、追浜・湘南…「面食らっている」「飲食店への影響も」,56,https://news.yahoo.co.jp/articles/42ea3b112d8038f4d50049544f1e01b54d97d2a1,5/18(日) 8:36
2025-05-19,07:07,business,経済,6,東京商工リサーチ,"2025年1-5月の「早期・希望退職」募集人数は8,711人で前年2倍に急増、相次ぐ大型募集",49,https://news.yahoo.co.jp/articles/4b78c31528af4a4c4d39db77d5639f125d34a7d6,5/18(日) 7:03
2025-05-19,07:07,business,経済,7,東洋経済オンライン,「非常に悲しく、大きな痛みを伴う決定だ」ーー日産自動車が「2万人削減と7工場閉鎖」の大リストラ、遅すぎた決断の代償,47,https://news.yahoo.co.jp/articles/8b67f4639e7084c5ab50b1bc1ef3ea4744d0b680,5/19(月) 5:26
2025-05-19,07:07,business,経済,8,マネーポストWEB,なぜ人は“飲食店でのスマホ注文”に不満を抱くのか？「通信料がかかる」「細かいカスタマイズができない」「LINE登録なんて絶対に嫌」…リアルな本音,43,https://news.yahoo.co.jp/articles/487a88e5dce9dfa66a4b3957dfd7984d3fab70bf,5/18(日) 15:15
2025-05-19,07:07,business,経済,9,東洋経済オンライン,業績堅調なのになぜ？パナソニック1万人リストラの深刻 、調理家電やエアコンなど不採算事業にメスの一方で“ほぼ無風”部門も,23,https://news.yahoo.co.jp/articles/f56b54737f49ceabeb74eeb71b5fb9d2df0aaf8f,5/19(月) 5:47
2025-05-19,07:07,business,経済,10,読売新聞オンライン,原油価格は下落傾向なのに高止まりしているガソリン平均価格…九州・沖縄が全国で最も高い「特有の事情」,17,https://news.yahoo.co.jp/articles/4fb6926d2b8518e676c21ba70cda7423d574ff65,5/18(日) 10:18
2025-05-19,07:07,business,経済,11,TBS NEWS DIG Powered by JNN,止まらぬコメ高騰 背景には「買い戻し」条件と「備蓄米の入札価格高騰」の二重の壁　政府買い入れ当時の“2倍”に【サンデーモーニング】,17,https://news.yahoo.co.jp/articles/3737101747f23d28de960f2d757e0144ba8ef040,5/18(日) 15:06
2025-05-19,07:07,business,経済,12,ファイナンシャルフィールド,300万円のカローラを「現金一括」で購入したい！ 友人に相談したら「ローンの方がお得」と言われたけど、金利の分“損”じゃないの？ お得になる理由を解説,15,https://news.yahoo.co.jp/articles/2139774e52e3d945911a63938291927796c697df,5/18(日) 13:30
2025-05-19,07:07,business,経済,13,FNNプライムオンライン,アメリカの信用格付け「最上位」から転落…トランプ減税に逆風か　どうなる「アメリカ売り」,15,https://news.yahoo.co.jp/articles/3279a36d036f9b353c15bee35303d559659cf880,5/18(日) 19:02
2025-05-19,07:07,business,経済,14,Merkmal,で、でたーｗ 日本の運送業界を骨の髄までボロボロにした「規制緩和」とかいう極悪奴ｗｗｗ,14,https://news.yahoo.co.jp/articles/76a079778784901cf90f3010dfab50fdd5c23f90,5/19(月) 5:51
2025-05-19,07:07,business,経済,15,テレビ朝日系（ANN）,卸通さず小売店へ　政府が流通改善策　備蓄米“上乗せ3倍”　高止まり一因か,14,https://news.yahoo.co.jp/articles/6a783bdcb62c637b4d9432460304230589ad2ab3,5/18(日) 11:39
2025-05-19,07:07,business,経済,16,Merkmal,なぜ駅そばは「うまい」のか？ 情報過多の現代で「早い・安い・うまい」が刺さる理由！ 5月「根の上そば」閉店で考える,13,https://news.yahoo.co.jp/articles/a2f7bf6532c32298d5ddbec35177f409b99245a0,5/18(日) 20:51
2025-05-19,07:07,business,経済,17,ファイナンシャルフィールド,同じ車を購入した友人の方が自動車税は「4000円」安い!?購入した年で税額は変わるの？,12,https://news.yahoo.co.jp/articles/84da3d4cfae5e6f6140bab452b1e4d505831a5a8,5/18(日) 8:40
2025-05-19,07:07,business,経済,18,MBSニュース,【コメ価格】いくらなら納得？1．3万人に聞いた本音「子どもに好きなだけ食べてって言いたい」　専門家は「5kg2000円には戻らないだろう」見解示す,12,https://news.yahoo.co.jp/articles/425b79d9399ec5698573dde433a3c7aaebc9c00c,5/18(日) 14:03
2025-05-19,07:07,business,経済,19,テレビ朝日系（ANN）,日産　早期退職募集へ　国内では18年ぶり,11,https://news.yahoo.co.jp/articles/8c152ba09639820da40d44b4c7c92969ffd318cf,5/18(日) 11:08
2025-05-19,07:07,business,経済,20,毎日新聞,消費減税「食品だけ」33％「一律」25％、反対16％　世論調査,11,https://news.yahoo.co.jp/articles/bee38ef82a2682cdc8aff375d9c9c8c2e9a616c6,5/18(日) 16:20
2025-05-19,07:07,business,経済,21,LIMO,老後の年金「月15万円」受給してたら「たくさんもらってる」方なの？！,11,https://news.yahoo.co.jp/articles/c23d6844cc4e5e0bdb38309c83dd58602f7c4837,5/18(日) 14:52
2025-05-19,07:07,business,経済,22,読売新聞オンライン,不妊治療で退職など経済損失３０００億円…企業が「妊活」支援、女性管理職増も図る,10,https://news.yahoo.co.jp/articles/af1cd9252d475ccfe642e545dabd5001b3bfb0ff,5/18(日) 13:33
2025-05-19,07:07,business,経済,23,共同通信,日産、NV200バネットの生産終了検討,10,https://news.yahoo.co.jp/articles/7343619e184fa09022976315431e4ce139eaca8d,5/18(日) 14:41
2025-05-19,07:07,business,経済,24,プレジデントオンライン,「東京産本マグロ」に1キロ4000円の高値がつく…東京の海で天然本マグロがバンバン獲れるようになったワケ,10,https://news.yahoo.co.jp/articles/bc5eb304483b0ad4fc8d12293b9309b1e40480ff,5/18(日) 17:17
2025-05-19,07:07,business,経済,25,Wedge（ウェッジ）,コンプライアンスの本質を理解できない日本人、これでは製造業も負け続ける…２つの大きな勘違い,9,https://news.yahoo.co.jp/articles/7e2168e14844893f005629f6a7cb8bceb863534b,5/19(月) 5:02
2025-05-19,07:07,business,経済,26,読売新聞オンライン,車バイオ燃料、２０２８年度から一部地域で先行導入…対象エリアを今秋めどに決定,9,https://news.yahoo.co.jp/articles/c5b5d755118dac20f9d195a7ebeac4b7131c3652,5/19(月) 5:00
2025-05-19,07:07,business,経済,27,Merkmal,「バスが数分遅れた」「わがまま過ぎる」 なぜネット民は“障害者”を執拗に叩くのか？ 合理的配慮が“被害者意識”にすり替わる根本理由！ 三島由紀夫の言説から考える,9,https://news.yahoo.co.jp/articles/78c7347ea822999a08300d0f3142b4232f20245b,5/18(日) 8:51
2025-05-19,07:07,business,経済,28,THE EV TIMES,やっぱりEVの値落ちは激しい！　エンジン車と残価率を比べるとEVを買いづらい理由が見えてくる,9,https://news.yahoo.co.jp/articles/e55248dd6d243bb9990350649992f04607ff04a0,5/18(日) 18:01
2025-05-19,07:07,business,経済,29,TBS NEWS DIG Powered by JNN,"高級シャンプーや最新コスメなど「無料サンプル自販機」が全国で急増するワケとは?【THE TIME,】",9,https://news.yahoo.co.jp/articles/b7230e98191a20852ed4620b7c447a8d2160a173,5/18(日) 7:02
2025-05-19,07:07,business,経済,30,ファイナンシャルフィールド,「万一が怖い」と、保険に「月9万円」払う妻。家族4人分ではありますが、さすがに多すぎですよね？“保険貧乏”をさけるためのチェックポイントとは,8,https://news.yahoo.co.jp/articles/75afe45063ebfafdda95075df9e647604009e445,5/18(日) 14:30
2025-05-19,07:07,business,経済,31,共同通信,日産、国内で早期退職を募集　18年ぶり、事務系が対象,8,https://news.yahoo.co.jp/articles/e7807271a959b2af677d271ea1727ac571558bc1,5/18(日) 10:58
2025-05-19,07:07,business,経済,32,ファイナンシャルフィールド,亡くなった母は借金があると聞いていたので相続放棄をしたのですが、あとから「5000万円」の遺産が見つかりました…相続放棄は取り消せますか？,8,https://news.yahoo.co.jp/articles/fb83065365ae7c974d021e49e9d9d123ed394491,5/18(日) 8:10
2025-05-19,07:07,business,経済,33,共同通信,米長官、地域別の同率関税示唆　日本対象外か、18の相手に注力,7,https://news.yahoo.co.jp/articles/6a5b24ff293438e778efae2b919e1953b732533c,5/19(月) 0:10
2025-05-19,07:07,business,経済,34,レスポンス,「これなら日本人に受ける」BYD初のPHEVワゴン発表に、SNS衝撃「出たら買うのに！」,7,https://news.yahoo.co.jp/articles/b67ace775e1891ffedb2ca1699419411cd853232,5/18(日) 8:00
2025-05-19,07:07,business,経済,35,ファイナンシャルフィールド,「東京で働いて年収400万円」と話したら、母に「高年収だ」と驚かれた！ 1人暮らしで余裕はないですが、本当に高収入なのでしょうか？“地方の収入”と比較,7,https://news.yahoo.co.jp/articles/d553461b772e754f546cb930520a09a9a7c3a65f,5/18(日) 11:30
2025-05-19,07:07,business,経済,36,AERA DIGITAL,大手コメ卸の株価が爆上げ　コメ高騰を追い風に業績拡大「JA全農の集荷シェアを奪う」強気が勝因,7,https://news.yahoo.co.jp/articles/c0ca53ed8f69fadcdf6a838e16b6a6d221f77931,5/18(日) 10:32
2025-05-19,07:07,business,経済,37,東洋経済オンライン,JR東日本の「荷物新幹線」、料金をJR貨物と比べてみると？　専用車両も導入「新しい発想」何を載せて運ぶか　価格だけが勝負ではない,7,https://news.yahoo.co.jp/articles/7d3d145cb454b632c5eefd3f2f3cc206f880bf33,5/19(月) 4:32
2025-05-19,07:07,business,経済,38,産経新聞,「女性が集まる街」福岡に企業が熱視線　アマゾンが異例の販促強化、商業施設も続々進出,7,https://news.yahoo.co.jp/articles/c989b863a5bb4510cc95184f0637069fbd46a38b,5/18(日) 10:25
2025-05-19,07:07,business,経済,39,乗りものニュース,「ガンダム搭載してないです！」でお馴染みの揚陸艦 ついに退役へ！ かつてはイギリス海軍の旗艦を務めたことも,6,https://news.yahoo.co.jp/articles/feeebb868da9f90c4c825572ad33cda39c6d1e9b,5/19(月) 6:12
2025-05-19,07:07,business,経済,40,NRI研究員の時事解説,トランプ減税恒久化法案に逆風：90日間一時停止後の相互関税率を各国に一方的に通知,6,https://news.yahoo.co.jp/articles/c41666c99009771a4d890cf562fc94fae066b1d1,5/19(月) 6:01
