scrp_date,scrp_time,genre_en,genre_jp,rank,media_jp,title,comment,link,date_original
2024-06-05,07:20,life,ライフ,1,Hint-Pot,旅館の女湯に男児2人　「見たことないくらい大きい子」にあ然…　問われる親のモラルと混浴年齢,137,https://news.yahoo.co.jp/articles/470fa3122cf1a4cf145eed3d5ec5e7093faff2d4,6/4(火) 9:10
2024-06-05,07:20,life,ライフ,2,Hint-Pot,マクドナルドが紙ストローをプラスチックに戻した？　ネットで情報拡散　同社に見解を聞いた,64,https://news.yahoo.co.jp/articles/be9ac50904e0630c12cacebca687d0edbac50b87,6/4(火) 15:05
2024-06-05,07:20,life,ライフ,3,まいどなニュース,「令和生まれが絶対分からない」電車内にあったモノ　懐かしむ声続々…喫煙が当たり前な時代ならでは,41,https://news.yahoo.co.jp/articles/dd90beaf11f51cdee893393151ea4826c023bca3,6/4(火) 19:45
2024-06-05,07:20,life,ライフ,4,オトナンサー,笑うと「歯茎」が目立つ…「ガミースマイル」はなぜ起こる？　歯科医師に聞いて分かった“4つの原因”,36,https://news.yahoo.co.jp/articles/51274ec67e7ba74da3577c21cc9b7fac9b9cff06,6/4(火) 9:10
2024-06-05,07:20,life,ライフ,5,ENCOUNT,学校健診で上半身裸に…担当医特定が物議　日本医師会苦言「一番困るのは子どもたち自身」,28,https://news.yahoo.co.jp/articles/30426edc7134931385e906fc0bdc1377b92a0a79,6/4(火) 16:40
2024-06-05,07:20,life,ライフ,6,日刊ゲンダイDIGITAL,小池都知事3選の“不安材料”は田母神俊雄氏の出馬と維新の出方…最悪「100万票」がパーに？,25,https://news.yahoo.co.jp/articles/4700cbd8b9329f8ad89776b731b84ea1bd3246bf,6/4(火) 9:06
2024-06-05,07:20,life,ライフ,7,弁護士ドットコムニュース,なぜ？ 駐車券紛失したら、料金「3万6000円→3000円」に　弁護士は「罪に問われることはないが…」,17,https://news.yahoo.co.jp/articles/625aeb586ec7953c0bbaf88cc6440f236debb930,6/4(火) 9:41
2024-06-05,07:20,life,ライフ,8,ファイナンシャルフィールド,高校生がファミレスのドリンクバーだけで「2時間」居座っていた！店側の収益はどうなる？,17,https://news.yahoo.co.jp/articles/b5bf6a81d49ae991c41661aa0c306df325b6ddd9,6/4(火) 14:50
2024-06-05,07:20,life,ライフ,9,FNNプライムオンライン,ノボせもんなべさん“髪芸”で世界へ　福岡の38歳お笑い芸人がイギリスの人気番組で躍進　決勝逃すも「また道が開ける」,15,https://news.yahoo.co.jp/articles/2f52c1a1fd4ade51cacecd7b2ea99100eff305af,6/4(火) 8:02
2024-06-05,07:20,life,ライフ,10,ファイナンシャルフィールド,銀行のキャッシュカードが折れ曲がり破損…！再発行手数料の「1000円」を「無料」にする方法はないですか？,14,https://news.yahoo.co.jp/articles/a1c8567c5f9436f9d4ceef9b2189556ce1c772d4,6/4(火) 20:40
2024-06-05,07:20,life,ライフ,11,ファイナンシャルフィールド,焼肉食べ放題のお店で「上カルビ」だけ頼んでいたら出禁になる？ルールに則っていてもNG？,14,https://news.yahoo.co.jp/articles/d9b32ed31b592d98231692d6818acf220c54ea50,6/4(火) 18:50
2024-06-05,07:20,life,ライフ,12,ファイナンシャルフィールド,ママ友がみんな「ニューバランス」のスニーカーを履いていますが、私にはとても手が出ません。どうやってお金を捻出しているのでしょうか？,12,https://news.yahoo.co.jp/articles/19019e67c74745418967406601397f7079bbb6ef,6/4(火) 21:40
2024-06-05,07:20,life,ライフ,13,クーリエ・ジャポン,「ビッグマックを買ってから1年間放置しました」　開けたら出てきた衝撃の中身,10,https://news.yahoo.co.jp/articles/a9cfe0213ae3e4377ce735a362163cd2a01f5007,6/4(火) 20:30
2024-06-05,07:20,life,ライフ,14,ねとらぼ,「もはやデカいイオン」「マジ建築物」と驚きの声　港に停まる“デカすぎる船”に目がバグりそう,10,https://news.yahoo.co.jp/articles/ce0a5b46a41d254d494037504e5eded81d565352,6/4(火) 16:00
2024-06-05,07:20,life,ライフ,15,ピンズバNEWS,40～50代男性が「理解できないギャルファッション」“危険すぎる”靴が1位に【トップ3】,9,https://news.yahoo.co.jp/articles/cb84f5d5c308ca9b7cefffd2903e483446ab0b22,6/4(火) 11:32
2024-06-05,07:20,life,ライフ,16,FORZA STYLE,田んぼに響く「死にてえのか、ババア！」狭い農道をマイカーで暴走通勤。地方都市の交通マナー「ヤバすぎる現状」,9,https://news.yahoo.co.jp/articles/afed114e753434768d550e629f8b135efd241c66,6/4(火) 20:03
2024-06-05,07:20,life,ライフ,17,めざましmedia,【徹底解説】ディズニー新エリア 入園チケットだけでは入れない!? 今から間に合う無料パスや有料サービスを紹介  アナ雪・ラプンツェル・ピーターパンのアトラクションに待たずに乗るには,9,https://news.yahoo.co.jp/articles/f144d8aed6f8d9cb1a98cf143329cb9ef98732f4,6/4(火) 22:22
2024-06-05,07:20,life,ライフ,18,日刊ゲンダイDIGITAL,今や外食ランチは平均1200円超の“高嶺の花”に…昼抜き「欠食サラリーマン」が増殖中？,9,https://news.yahoo.co.jp/articles/fda0b0778db3a41c4b7f51c62d20de7ce30ff517,6/4(火) 9:06
2024-06-05,07:20,life,ライフ,19,THE GOLD ONLINE（ゴールドオンライン）,税務署はすべてお見通し!?  「8割が追徴税」となる税務調査、「狙われやすい人」の共通点【税理士監修】,9,https://news.yahoo.co.jp/articles/7963736a09b6c8cdbb43defa6987b5f9867199e8,6/4(火) 10:46
2024-06-05,07:20,life,ライフ,20,Book Bang,ニホンザルが絶滅危惧種「ライチョウ」を捕食の衝撃…国を挙げた“復活作戦”の面白さ！（レビュー）,8,https://news.yahoo.co.jp/articles/355bc55965660685db0da7ba09601ac801b5c801,6/5(水) 6:00
2024-06-05,07:20,life,ライフ,21,ENCOUNT,国際結婚したタワマンマダムの嘆き「日本のマンションって」　20年ぶり帰国で不満あらわ,8,https://news.yahoo.co.jp/articles/46de84749f86b7bfa91f1596879f7616f25ea3d6,6/4(火) 11:30
2024-06-05,07:20,life,ライフ,22,ねとらぼ,「エグい」　最寄りのスタバに行こうとしたら……　北海道の“驚きの広大さ”に「試される大地」,8,https://news.yahoo.co.jp/articles/e1575d05880026f489aad6949b7385c9dc6d1398,6/4(火) 21:00
2024-06-05,07:20,life,ライフ,23,ファイナンシャルフィールド,娘に電車やバスの支払いを「交通系IC」にした方が節約できると言われました。実際どうなのでしょうか？,8,https://news.yahoo.co.jp/articles/560f95d5e4ec5c32dfcd9eb2420e1184181be978,6/4(火) 20:51
2024-06-05,07:20,life,ライフ,24,FORZA STYLE,「親からの援助があるだろ？」結婚式割り勘論争でブチギレ、冷戦に。「新郎新婦の埋められない経済格差」,8,https://news.yahoo.co.jp/articles/fe3a4a0a1ac8e0c9082400556f54f5836d0f9948,6/4(火) 9:12
2024-06-05,07:20,life,ライフ,25,毎日新聞,筆箱は箱形以外もOK、靴下は黒、紺も　子供の意見聞き校則見直し,8,https://news.yahoo.co.jp/articles/a8319f96f251c7d1eebdf2a52fe20b11196dd559,6/4(火) 14:30
2024-06-05,07:20,life,ライフ,26,まいどなニュース,「アフターピルというセリフ好ましくない」セクシー田中さん報告書に呆れる声相次ぐ、原作表現を日テレ側が当初削除「そんな人たちがドラマ作ってるのか」,8,https://news.yahoo.co.jp/articles/8429270c12d5a43839496cd8314e0bc2d3dcc3dd,6/4(火) 7:45
2024-06-05,07:20,life,ライフ,27,AERA dot.,経済効果わずか0.19％　4万円定額減税、遅きに失した？　6月スタート、仕組みも複雑,8,https://news.yahoo.co.jp/articles/52b829f524884cedc3cb7ceda85e9dc27978218a,6/4(火) 16:32
2024-06-05,07:20,life,ライフ,28,産経新聞,昭和天皇が国王から「立憲君主制」を学ばれたことも　皇室と英王室の深い歴史,8,https://news.yahoo.co.jp/articles/560542a16599b4026f6794d13be184a7a55f3b28,6/4(火) 15:53
2024-06-05,07:20,life,ライフ,29,FNNプライムオンライン,子どもを“1時間単位”で預けられる「誰でも通園制度」1時間300円、月10時間まで　保護者の就労は問わず,8,https://news.yahoo.co.jp/articles/3e68cb45d866b1ff3bfb2d0333c942ebd028b288,6/4(火) 20:02
2024-06-05,07:20,life,ライフ,30,FORZA STYLE,「オジサン、その短パン、小学生かよ！」この夏オジサンたちが知っておきたいメンズショーツスタイルの神髄,7,https://news.yahoo.co.jp/articles/134cd943c2f32cad661a26645b029d2236915ba0,6/5(水) 7:02
2024-06-05,07:20,life,ライフ,31,Hint-Pot,初訪日のアメリカ人「絶対に見たかった」　ハリウッド映画で有名に　日本で感動した場所とは,7,https://news.yahoo.co.jp/articles/d2eb517c071c3821a5c5eeeb0b8cb807ecd8b60b,6/5(水) 6:03
2024-06-05,07:20,life,ライフ,32,FORZA STYLE,「煽る蓮舫vs.無視する小池百合子」都民不在で盛り上がる都知事選の二人をSNS住民が拒絶する理由！,7,https://news.yahoo.co.jp/articles/bd7ddbb9eebfccfb124af454ac662d9d02ecd635,6/5(水) 7:02
2024-06-05,07:20,life,ライフ,33,たまひよONLINE,出生体重4980ｇ。生まれる途中で肩がひっかかり、右腕の神経が切れるトラブルに。すべてを受け入れることは一生難しい【体験談】,7,https://news.yahoo.co.jp/articles/828163db48376a129dc1b4e3d668d7ebf7640652,6/4(火) 11:55
2024-06-05,07:20,life,ライフ,34,まいどなニュース,「居酒屋でお盆からビールを直接取る人は…」ウエストランド井口が怒り　“居酒屋の客あるある”対策に共感続々,7,https://news.yahoo.co.jp/articles/d269c861cc9f383a3d6d8fc7652eac3d3c69c6a7,6/4(火) 7:20
2024-06-05,07:20,life,ライフ,35,毎日新聞,子ども・子育て支援法　財源どうなる?　歳出改革は2025年度か,7,https://news.yahoo.co.jp/articles/f2f089793a11e7aaca33b5dd55f7c07f1131943b,6/5(水) 5:01
2024-06-05,07:20,life,ライフ,36,まいどなニュース,「新紙幣」、使ってみたいですか？　2024年7月に発行開始される「新紙幣」…今の3人の知名度は,7,https://news.yahoo.co.jp/articles/d1f6d204e10816b48148d9e8139ebdb1eca8ffa7,6/4(火) 11:40
2024-06-05,07:20,life,ライフ,37,FORZA STYLE,【何気に売れている】オデッセイがアルヴェルに負けないためには「低床」よりも「全長」だと!?,7,https://news.yahoo.co.jp/articles/d43f1108a56aa42f8c49436f39d29778e3ec2bc1,6/4(火) 19:02
2024-06-05,07:20,life,ライフ,38,All About,メルカリで購入したら、商品を紛失したと言われました。出品者にペナルティを与えることはできますか？,7,https://news.yahoo.co.jp/articles/057c26bb690ff6cae9f20e8afddf900657f9984e,6/4(火) 21:25
2024-06-05,07:20,life,ライフ,39,まいどなニュース,自転車に乗る時は必ずヘルメットを被るべき！（そしてジロジロ見られるがいい…）　なぜ人の視線が？思わず笑ってしまう真相に反響,6,https://news.yahoo.co.jp/articles/e140db936600f42204d66f8236f3273cee8bf519,6/5(水) 6:50
2024-06-05,07:20,life,ライフ,40,ファイナンシャルフィールド,友人のスニーカーが可愛かったので、値段を聞くと「3万円」との返事が…。靴ってそんなにお金をかけるものなのですか？,6,https://news.yahoo.co.jp/articles/7b80bcb2070d549d2b8470245acc4323ebdbc3c0,6/4(火) 21:50
