scrp_date,scrp_time,genre_en,genre_jp,rank,media_jp,title,comment,link,date_original
2025-06-04,23:07,world,国際,1,TBS NEWS DIG Powered by JNN,「分裂の政治を終わらせる」韓国大統領に李在明氏が就任　3年ぶりの政権交代を果たす,161,https://news.yahoo.co.jp/articles/81354134b3c8d9683b3b1028f71206b1d76e7a00,6/4(水) 11:46
2025-06-04,23:07,world,国際,2,共同通信,韓国大統領に李在明氏　革新系勝利、日韓関係見通せず,139,https://news.yahoo.co.jp/articles/cf15f8ccd1c2b24d5fc0dc466c6769c62678d9b1,6/3(火) 23:40
2025-06-04,23:07,world,国際,3,時事通信,李在明氏、韓国大統領に就任　「全ての国民に仕える」　強固な日米韓協力表明,100,https://news.yahoo.co.jp/articles/d51d3e430b94b1e591a32edf9cd489f961a5575a,6/4(水) 7:22
2025-06-04,23:07,world,国際,4,毎日新聞,台湾の人気菓子に「抗日戦争勝利」の特別パッケージ　その狙い,81,https://news.yahoo.co.jp/articles/c284ff402f1414c024dc897a2f99598e38c23965,6/4(水) 8:15
2025-06-04,23:07,world,国際,5,FNNプライムオンライン,橋下徹氏自身と考え違っても韓国・李在明新大統領は「芯のある政治家。日本に対峙できる人いる?」“反日”レッテルに「すぐ『反日』と腐すな」,64,https://news.yahoo.co.jp/articles/b67cfaf0a2f6e1603b36e976cd5b090f1076cce2,6/4(水) 22:17
2025-06-04,23:07,world,国際,6,FNNプライムオンライン（フジテレビ系）,【速報】トランプ政権が鉄鋼・アルミニウム製品の追加関税を発動、2倍の50％に引き上げ　アメリカの専門家「自動車価格が2000～4000ドル上昇する可能性」,50,https://news.yahoo.co.jp/articles/76fb949c1772eb0990f06dfdceecdcce855914fd,6/4(水) 13:01
2025-06-04,23:07,world,国際,7,時事通信,横転の北朝鮮駆逐艦、状態戻る　人力で復元か　米分析サイト,45,https://news.yahoo.co.jp/articles/0749918cdf7c746f608a8d45b520f6542374e018,6/4(水) 20:28
2025-06-04,23:07,world,国際,8,時事通信,「米国の世紀」トランプ氏が終止符も　知日派ジョセフ・ナイ氏遺稿　米外交誌,41,https://news.yahoo.co.jp/articles/1b55d98af64af6ea8b14e141f8fcfcfab89bc8d5,6/4(水) 20:32
2025-06-04,23:07,world,国際,9,共同通信,横倒し駆逐艦、直立に　北朝鮮、衛星画像で判明,36,https://news.yahoo.co.jp/articles/8a49a1c4bb24b8cb427238e802c705c5e3fb528d,6/4(水) 6:42
2025-06-04,23:07,world,国際,10,産経新聞,徴用工問題「政策の一貫性が特に重要」　李在明韓国大統領、尹前政権の解決策維持を示唆,34,https://news.yahoo.co.jp/articles/f1cbece5fa57613e5a8877612b3162955ae5bc0c,6/4(水) 21:30
2025-06-04,23:07,world,国際,11,毎日新聞,「食べられる草木も知っていた」　李在明氏、極貧から大統領に,34,https://news.yahoo.co.jp/articles/e4acf269d26688869d462e25d7af4720bb97ae5d,6/3(火) 23:45
2025-06-04,23:07,world,国際,12,文春オンライン,選挙戦では「日本の国民に強い好感」と…韓国新大統領・李在明のホンネは“反日左派”なのか,32,https://news.yahoo.co.jp/articles/18d84bc30691b0da97f0b488161977f08f43e569,6/4(水) 6:13
2025-06-04,23:07,world,国際,13,ニューズウィーク日本版,世界もあきれる「ハーバード潰し」...トランプが失墜させる「アメリカン・ブランド」と、その代償とは？,32,https://news.yahoo.co.jp/articles/6ab7b021eaf64d63de4f2b6e6dd6e9df65812604,6/4(水) 18:47
2025-06-04,23:07,world,国際,14,デイリー新潮,韓国で始まる「反日」よりも深刻な「報復」の時代　“保守派は監獄送りで根こそぎに”宣言の李在明大統領――鈴置高史氏が読む,31,https://news.yahoo.co.jp/articles/59d35826a3a83fb5abee64f50444801edc0f9849,6/4(水) 17:11
2025-06-04,23:07,world,国際,15,FNNプライムオンライン（フジテレビ系）,【速報】トランプ大統領“鉄鋼・アルミ追加関税”の大統領令に署名「25％から50％」に引き上げへ　専門家「幅広い分野で価格上昇を招く」,30,https://news.yahoo.co.jp/articles/33fcffb974c00497b0ee4904a31a883a1fde7812,6/4(水) 6:25
2025-06-04,23:07,world,国際,16,TBS NEWS DIG Powered by JNN,日本を「敵性国家」とも表現…韓国新大統領に“反日”李在明氏　無意味な「ノージャパン」は起きない？今後の日韓関係は,23,https://news.yahoo.co.jp/articles/e932b62641f1b45d1e03ac422974ee5437f0b549,6/4(水) 18:39
2025-06-04,23:07,world,国際,17,CNN.co.jp,メーガン妃、長女リリベットちゃんの写真を珍しく公開　４歳の誕生日に,23,https://news.yahoo.co.jp/articles/6bb35828232761f015f6c8689b2ad373cf14328c,6/4(水) 20:17
2025-06-04,23:07,world,国際,18,クーリエ・ジャポン,日本のスタートアップが「100万円の1人乗り電気自動車」を開発したシンプルな理由　「EV後進国」の市場を変える原動力になるか　米メディアも注目,19,https://news.yahoo.co.jp/articles/c64f6bbcdbc9f7d6e96caef0ed407a17ba28c23f,6/4(水) 18:56
2025-06-04,23:07,world,国際,19,ロイター,ウクライナ戦争、リスクレベル「急上昇」　爆撃機攻撃で米特使,18,https://news.yahoo.co.jp/articles/c3822fc6073803982a54c701f208d642c98da10b,6/4(水) 18:38
2025-06-04,23:07,world,国際,20,ＡＦＰ＝時事,トランス選手の陸上競技優勝に激怒、加州に制裁金警告 トランプ氏,17,https://news.yahoo.co.jp/articles/7d86c57bac4d0dfdf3c535dd53ecdb24afc34078,6/4(水) 8:46
2025-06-04,23:07,world,国際,21,毎日新聞,韓国大統領選　李在明氏が当選確実　3年ぶり進歩勢力が政権奪還,17,https://news.yahoo.co.jp/articles/f378f6d9ac5b87c0ea0c80ae50c75bad28e37d51,6/3(火) 23:41
2025-06-04,23:07,world,国際,22,FNNプライムオンライン（フジテレビ系）,【解説】「反日」イメージの李新大統領、就任後のスタンスは　韓国では日本への好感度が過去最高、李氏は“世論の動向に敏感に反応するタイプ”,17,https://news.yahoo.co.jp/articles/68055aee957a2286537b44625c5c8f42a4a735e7,6/4(水) 16:25
2025-06-04,23:07,world,国際,23,日テレNEWS NNN,韓国大統領選　最大野党「共に民主党」李在明前代表が勝利宣言,16,https://news.yahoo.co.jp/articles/cf6f334b343b32824f289b8a6e9f64a99232a74d,6/4(水) 5:16
2025-06-04,23:07,world,国際,24,FNNプライムオンライン（フジテレビ系）,盗まれたフランス・マクロン大統領の「ろう人形」返還「グリーンピース」が声明発表…ロシアと貿易続けるフランス政府に抗議のため美術館から盗んだもの,16,https://news.yahoo.co.jp/articles/062dd20227b179bee63f259205b5d6cfdaee8860,6/4(水) 20:39
2025-06-04,23:07,world,国際,25,NEWSポストセブン,避妊具拒否、ビール持参で、体調不良の15歳少女を襲った…シンガポール元トップ俳優（35）に実刑判決、母親は「初めての相手は、本当に彼女を愛してくれる人であるべきだった」,16,https://news.yahoo.co.jp/articles/053236adb394c7318a572eb65b1446c024a8bce5,6/4(水) 11:15
2025-06-04,23:07,world,国際,26,TBS NEWS DIG Powered by JNN,韓国・李在明大統領 新政権スタート 「反日姿勢はとらないのではないか…」気になる日韓関係どうなる？,15,https://news.yahoo.co.jp/articles/76ed7b5248d6caecc4582428e5a5b94fc8e0dea7,6/4(水) 16:13
2025-06-04,23:07,world,国際,27,ロイター,横転の北朝鮮駆逐艦、直立状態に　衛星画像で判明＝米分析サイト,15,https://news.yahoo.co.jp/articles/b6f3dc4b6c15e69263ba79133c5955c38a575c89,6/4(水) 14:38
2025-06-04,23:07,world,国際,28,ロイター,「我慢ならない」「恥を知れ」　マスク氏がトランプ減税法案に痛烈批判　蜜月関係に変化の兆しも,14,https://news.yahoo.co.jp/articles/5d7621756912a4d83fd57719825437bb0d66cf9b,6/4(水) 15:55
2025-06-04,23:07,world,国際,29,毎日新聞,李在明氏「国民の生活回復に全力を尽くす」　日本は対日政策注視,14,https://news.yahoo.co.jp/articles/d5560abf46647f1a6a8dd15732e503d542cf7646,6/4(水) 10:43
2025-06-04,23:07,world,国際,30,中央日報日本語版,韓国大統領選挙についての立場を聞かれると…ホワイトハウス報道官、書類をひっくり返しながら「ここにあったのに」,13,https://news.yahoo.co.jp/articles/213ff4097047001ca74324b7ecdb5c62318a12d9,6/4(水) 7:01
2025-06-04,23:07,world,国際,31,ロイター,中国と共に「覇権主義といじめ」に反対を、ベラルーシ大統領に習氏,12,https://news.yahoo.co.jp/articles/6bc14119b6eb3fbfee50b8f45077dccb1f9ce93e,6/4(水) 19:57
2025-06-04,23:07,world,国際,32,クーリエ・ジャポン,流出した文書で明らかになった、ロシアが“米国なしでは戦争を継続できない”切実な理由,12,https://news.yahoo.co.jp/articles/69920854e9f29c7721d0d56455467c3cf8499df3,6/4(水) 12:10
2025-06-04,23:07,world,国際,33,毎日新聞,李在明氏が抱える五つの裁判　法改正の動きに最大野党はクギ刺す,12,https://news.yahoo.co.jp/articles/266edcf62d98877118d8603f01ecb9513bc74fd9,6/4(水) 20:36
2025-06-04,23:07,world,国際,34,時事通信,ロシア兵死傷者95万人　第2次大戦後で最多　ウクライナ侵攻,12,https://news.yahoo.co.jp/articles/2d9e881cfa0602a0ef971390227c3f8102dd078a,6/4(水) 19:48
2025-06-04,23:07,world,国際,35,JBpress,ウクライナが無人機攻撃でロシアの爆撃機など40機以上破壊、プーチンのメンツ潰した“ドローン奇襲”成功までの執念,12,https://news.yahoo.co.jp/articles/fd0a3967207444e3f8f67625b0163658615a1cef,6/4(水) 16:02
2025-06-04,23:07,world,国際,36,テレビ朝日系（ANN）,韓国・新大統領に李在明氏 どう変わる？日韓関係,11,https://news.yahoo.co.jp/articles/95c80b682c9e9292079948f4ef2f667af7deb2ff,6/4(水) 21:38
2025-06-04,23:07,world,国際,37,読売新聞オンライン,韓国大統領に就任の李在明氏、社会の分断克服へ「全ての国民に仕える」…北朝鮮と対話の意向も示す,11,https://news.yahoo.co.jp/articles/28e48a6066ed51454650a1d008d3b3b37ee791cf,6/4(水) 12:16
2025-06-04,23:07,world,国際,38,KOREA WAVE,韓国中古車が新車より高値に？…海外需要爆発で“空前の好況”,11,https://news.yahoo.co.jp/articles/294f42a1f8c26408c6024d88d719e05c29acb174,6/4(水) 11:36
2025-06-04,23:07,world,国際,39,CNN.co.jp,マスク氏、トランプ氏主導の法案を酷評　「むかつくほど嫌い」,11,https://news.yahoo.co.jp/articles/3a096f34f1f7c46740e9a8b9eedf146cbf9c8ab4,6/4(水) 9:55
2025-06-04,23:07,world,国際,40,テレビ朝日系（ANN）,「日米韓協力を固める」李在明氏 韓国大統領就任式で,11,https://news.yahoo.co.jp/articles/8c2d4d9dad9bfdbdd282354074614045a40612ab,6/4(水) 12:23
