scrp_date,scrp_time,genre_en,genre_jp,rank,media_jp,title,comment,link,date_original
2025-09-05,18:08,sports,スポーツ,1,J-CASTニュース,巨人・阿部監督「レベル低い」発言にG党苦言、「言葉に配慮がない」「選手にも家族いる」...又木鉄平投手に2軍通告,248,https://news.yahoo.co.jp/articles/5e8fe90a7556c72ffff2da4b4e6e08ec065a4af8,9/5(金) 11:45
2025-09-05,18:08,sports,スポーツ,2,TBS NEWS DIG Powered by JNN,【巨人5日スタメン】キャベッジ2番センター クリーンナップは首位打者・泉口 岡本 岸田 中山6番 リチャード7番 吉川8番 先発・山﨑,109,https://news.yahoo.co.jp/articles/98b0bd6e98f64fd4779127aa43a9005317b7d000,9/5(金) 17:27
2025-09-05,18:08,sports,スポーツ,3,文春オンライン,「現役選手たちはビビりまくっている」懲罰交代、居残り練習は当たり前…広島カープが見据える“ポスト新井貴浩”筆頭の昭和型OBとは,108,https://news.yahoo.co.jp/articles/e391743449308a364f5808a186862c6e3089d744,9/5(金) 17:12
2025-09-05,18:08,sports,スポーツ,4,NEWSポストセブン,《広陵高校・暴力問題》謹慎処分のコーチに加え「残りのコーチ2人も退任」していた　中井監督、部長も退任で野球経験のある指導者は「34歳新監督のみ」　160人の部員を指導できるのか,103,https://news.yahoo.co.jp/articles/f3e3fad93e57965e589487acf2950d9e3e9065b7,9/5(金) 16:15
2025-09-05,18:08,sports,スポーツ,5,TBS NEWS DIG Powered by JNN,【阪神5日スタメン】優勝マジック4...小幡はベンチ 熊谷6番レフト 木浪7番ショート 坂本8番 上位陣は不動 先発・大竹は広島戦14勝2敗,99,https://news.yahoo.co.jp/articles/f1ff2d52c9d4388a12f6aa281354491e3dbfd620,9/5(金) 17:17
2025-09-05,18:08,sports,スポーツ,6,TBS NEWS DIG Powered by JNN,大坂なおみ、出産後初の4大大会ファイナル進出逃す...フルセットの大激闘も世界ランク9位アニシモバに逆転負け,89,https://news.yahoo.co.jp/articles/409a13ea874dca1e8b0b9fbbb5b016f2b1b0881e,9/5(金) 13:53
2025-09-05,18:08,sports,スポーツ,7,週刊女性PRIME,「結果を出して」ロバーツ監督が佐々木朗希に喝、“大リーガーの夢達成”でモチベ薄れた？ファン落胆,82,https://news.yahoo.co.jp/articles/73fa02277320d1b74c246c9990057a6609c4d139,9/5(金) 8:31
2025-09-05,18:08,sports,スポーツ,8,中日スポーツ,中日・祖父江大輔、引退の決断は３日前「まだ続けるか、引退するかというときに、中日で終わりたかった」,81,https://news.yahoo.co.jp/articles/2fdcd3630e916eb97ed3ab2077f7173c90577905,9/5(金) 13:20
2025-09-05,18:08,sports,スポーツ,9,TBS NEWS DIG Powered by JNN,ドジャース地区優勝M消滅...大谷翔平4戦ぶりノーヒットで元気なし、中地区最下位パイレーツに3連敗,75,https://news.yahoo.co.jp/articles/5c1937b0a1ac99e0533bb64f5157d3bb09839592,9/5(金) 10:15
2025-09-05,18:08,sports,スポーツ,10,TBS NEWS DIG Powered by JNN,【中日5日スタメン】福永が登録即2番サード クリーンナップは上林 細川 ボスラー 山本6番セカンド ロドリゲス7番ショート 先発・柳 捕手は石伊,66,https://news.yahoo.co.jp/articles/c80e83d493dfab0e8c16417dd0a60de8c913a74f,9/5(金) 17:24
2025-09-05,18:08,sports,スポーツ,11,東スポWEB,ドジャース・ロバーツ監督の采配に本場ファン不満爆発「なぜ解雇されないのか」「集中力ない」,62,https://news.yahoo.co.jp/articles/1967847eeb3c95cc74aef607c52c6a60a2c78205,9/5(金) 16:20
2025-09-05,18:08,sports,スポーツ,12,CoCoKARAnext,「3A相手ならもっとできると期待したい」ド軍ロバーツ監督が厳しく断じた佐々木朗希の“実力不足”　メジャー復帰の目途は？,60,https://news.yahoo.co.jp/articles/ab6d9032a8efd35b1c08a1931edcf1f51002e28e,9/5(金) 12:11
2025-09-05,18:08,sports,スポーツ,13,デイリースポーツ,巨人・阿部監督　１２失点大敗を謝罪「こんな雨の中、ファンの人に申し訳ない」野手の増田大も登板準備,56,https://news.yahoo.co.jp/articles/733376eaaf13a4e82e21c3dabd29494012641b4d,9/4(木) 21:48
2025-09-05,18:08,sports,スポーツ,14,週刊ベースボールONLINE,廣岡達朗コラム「森祇晶はなぜ教えないのか？ “教育によって人間の能力は開発される”を阿部慎之助監督は銘じるべき」,52,https://news.yahoo.co.jp/articles/446c50ecf0a3f701d34e69c10f3f58f3760ca6cf,9/5(金) 11:00
2025-09-05,18:08,sports,スポーツ,15,デイリースポーツ,ヤクルト・村上が衝撃の満塁弾！球場どよめく１試合２発でリーグ単独３位に浮上　ここ６戦７本塁打　復帰後３３戦１７本塁打と驚異のハイペース,49,https://news.yahoo.co.jp/articles/759a80132a5cf40eb44625db5627b3fcccda9ad9,9/4(木) 19:30
2025-09-05,18:08,sports,スポーツ,16,中日スポーツ,中日、福永裕基を出場選手登録 代わって２人抹消,46,https://news.yahoo.co.jp/articles/32cbdedd67932e44163f0131f200deb5e896f88b,9/5(金) 16:15
2025-09-05,18:08,sports,スポーツ,17,日刊スポーツ,広陵コーチに３カ月謹慎処分　１分間にわたり廊下正座をさせて口頭で指導　学生野球審査室会議,46,https://news.yahoo.co.jp/articles/4a86e04a0648092486979bf0645fd2798ab5e4de,9/5(金) 11:20
2025-09-05,18:08,sports,スポーツ,18,Yahoo!ニュース オリジナル THE PAGE,【ヤフコメで話題】「浅野翔吾選手の成長に疑問の声」「ドラフト1位の期待と現状のギャップ」 - 巨人・浅野翔吾選手の起用と今後に注目集まる,45,https://news.yahoo.co.jp/articles/77ad479ea0474f4ff9b433b20e7246e9648ab6ce,9/5(金) 17:09
2025-09-05,18:08,sports,スポーツ,19,スポニチアネックス,残り20戦　巨人が一気に4選手入れ替え　鉄腕・高梨が5月以来の復帰　又木、浅野が抹消に,44,https://news.yahoo.co.jp/articles/02016efa830adc3a0de37b847340cea11ed3d938,9/5(金) 16:07
2025-09-05,18:08,sports,スポーツ,20,スポーツ報知,大坂なおみ　ぼう然　“勝率１００％”の無敗神話崩れる…準決勝で敗退　全米ＯＰテニス,44,https://news.yahoo.co.jp/articles/efbe8928f4d36b165fcea3f39bdfc7f9cc0be919,9/5(金) 14:19
2025-09-05,18:08,sports,スポーツ,21,デイリー新潮,佐々木朗希「リハビリ登板」も初回に2被弾4失点…防御率7点台では「メジャー昇格はムリ。今シーズンはほぼ終了」と専門家　「課題は球速より球種」,44,https://news.yahoo.co.jp/articles/7c98432c792659013ac950cfedbd963ac9be31e6,9/5(金) 6:13
2025-09-05,18:08,sports,スポーツ,22,スポーツ報知,【巨人】三塚琉生、高梨雄平、乙坂智が１軍昇格へ,44,https://news.yahoo.co.jp/articles/dac24c07314f6dbeaa521740a2a82f5ccf803847,9/5(金) 11:09
2025-09-05,18:08,sports,スポーツ,23,スポニチアネックス,鶴岡慎也氏　日本ハムからソフトバンクFA移籍で衝撃的な体験「全然違うチーム来ちゃった」,44,https://news.yahoo.co.jp/articles/ec85c15127fd1b61b5eacc2258a424a322df2d2b,9/5(金) 15:54
2025-09-05,18:08,sports,スポーツ,24,スポニチアネックス,中日・祖父江大輔が今季限りで現役引退　竜一筋12年、通算509試合に登板　20年に最優秀中継ぎ投手,42,https://news.yahoo.co.jp/articles/8e1179547f3aa7830563699c8bb85c983b3882d8,9/5(金) 5:00
2025-09-05,18:08,sports,スポーツ,25,J-CASTニュース,前田健太が日本球界復帰表明、移籍先は？識者が候補に挙げた3球団...獲得には「資金源とか多少余裕がないと」,39,https://news.yahoo.co.jp/articles/5ee658db957954de5c8a99e2aa831cb0d24bd82f,9/5(金) 15:30
2025-09-05,18:08,sports,スポーツ,26,J-CASTニュース,最下位低迷のヤクルト、次期監督に池山隆寛2軍監督が最有力も...立て直しどうなる？暗黒時代突入に懸念,38,https://news.yahoo.co.jp/articles/759bdf9987832a10e728a3b8d41e9fb8869b9699,9/5(金) 14:07
2025-09-05,18:08,sports,スポーツ,27,サンケイスポーツ,ロバーツ監督采配悔いる…一発出れば逆転も打者は打率.095　九回の絶好機逃す「打席回ると分かっていれば…」,37,https://news.yahoo.co.jp/articles/262e02c588353c0bf5b9df263ef73f1d2f923b4e,9/5(金) 11:14
2025-09-05,18:08,sports,スポーツ,28,デイリースポーツ,オリックス－日本ハムは午後７時１５分開始に　台風影響で日本ハムの移動交通手段が遅延　異例の１時間１５分遅れ,36,https://news.yahoo.co.jp/articles/f3ec0d0172b89d9b80bf00176fe358cca0fe1995,9/5(金) 17:07
2025-09-05,18:08,sports,スポーツ,29,中日スポーツ,中日・福永裕基、１軍合流！ ４日のウエスタン広島戦では復帰後初適時打、回復ぶり順調,36,https://news.yahoo.co.jp/articles/a0302d5578a33b6a499cf4e02389acf0e4935d65,9/5(金) 13:33
2025-09-05,18:08,sports,スポーツ,30,Full-Count,ド軍、最下位球団に痛恨3連敗でM消滅　ベッツ弾で零敗阻止も…体調不良の大谷は2三振,36,https://news.yahoo.co.jp/articles/c1336adaf4251cbc76d666eeae967a5cee861f6e,9/5(金) 10:15
2025-09-05,18:08,sports,スポーツ,31,スポーツ報知,【巨人】 キャベッジを「２番・中堅」でスタメン起用　山崎伊織が１１勝目を目指して先発,35,https://news.yahoo.co.jp/articles/adf600976ab868fa5d5f88a6aed7e51216fb591c,9/5(金) 17:33
2025-09-05,18:08,sports,スポーツ,32,Full-Count,ド軍25億円男の“優遇”は「大きな問題」　打率1割台でも続く起用…存在しなかった「区切り」,35,https://news.yahoo.co.jp/articles/51e7c67e8fa0d40b7ee53cb75b57a4e6d8f3eea0,9/5(金) 16:44
2025-09-05,18:08,sports,スポーツ,33,ＡＦＰ＝時事,レジェンドのタイソンとメイウェザー、26年春にエキシビションで対戦へ,35,https://news.yahoo.co.jp/articles/7647c70acf9c79a7207ed9508f0b89c799f0422e,9/5(金) 10:43
2025-09-05,18:08,sports,スポーツ,34,THE DIGEST,「控えめに言って、今季最も恥ずかしいシリーズだ」　地区最下位パイレーツに３連敗のドジャースに米記者怒り「あってはならない。ただただ許しがたい」,35,https://news.yahoo.co.jp/articles/64757ea172598189573957f6a516063cbbfd41b9,9/5(金) 16:36
2025-09-05,18:08,sports,スポーツ,35,J-CASTニュース,【女子バレー】4強入り日本は「うらやましい限り」、韓国メディア羨望...「韓国は本選さえ出場できなかった」,35,https://news.yahoo.co.jp/articles/8aba2d67876ec9e20e3dab79ca7cd77e4ac39499,9/5(金) 13:24
2025-09-05,18:08,sports,スポーツ,36,デイリースポーツ,ＤｅＮＡ　山崎康晃が「新幹線動かない」横浜への移動中に台風の影響直撃　車内から悲痛な叫び「動けーっ！！」→練習開始に間に合う,34,https://news.yahoo.co.jp/articles/ac2f212ed719e688418c84ae611424de5e068034,9/5(金) 11:27
2025-09-05,18:08,sports,スポーツ,37,デイリー新潮,ヤクルト来季はブンブン丸「池山監督」でほぼ確定　「次の次」で名前があがる名選手の名は,32,https://news.yahoo.co.jp/articles/0eb0692dd62320656ed97bf9ffa8be167369a01f,9/5(金) 6:01
2025-09-05,18:08,sports,スポーツ,38,Full-Count,ド軍は「誰も笑ってない」　ロハスが打ち明けたチームの“分裂”「恥ずかしい」,32,https://news.yahoo.co.jp/articles/9ed59a7e948337e0dff1e9e2f0dd06773dd5661c,9/5(金) 12:17
2025-09-05,18:08,sports,スポーツ,39,日刊スポーツ,【DeNA】台風15号で新幹線遅延も広島→横浜移動のナインは無事に到着　試合も開催へ準備,31,https://news.yahoo.co.jp/articles/63ef7f7b8dd6faeef76e51c45b5b2baaf19cf5e5,9/5(金) 16:29
2025-09-05,18:08,sports,スポーツ,40,日刊スポーツ,【日本ハム】２選手だけで試合前練習を開始…チーム本隊は午後４時17分に名古屋駅までたどり着く,31,https://news.yahoo.co.jp/articles/e0d8356992d93e65a85a9aa26546775cdbeb134f,9/5(金) 16:42
