scrp_date,scrp_time,genre_en,genre_jp,rank,media_jp,title,comment,link,date_original
2025-09-05,17:10,TTL,総合,1,共同通信,与野党、ガソリン減税合意できず　5回目協議、隔たり大きく,728,https://news.yahoo.co.jp/articles/bb6b6813778ae9e489f1a082dfd0d060647ea51a,9/5(金) 12:41
2025-09-05,17:10,TTL,総合,2,読売新聞オンライン,千葉の津波避難タワー、完成１０年でもう使用不能に…住民「こんなに早く駄目になるとは」,322,https://news.yahoo.co.jp/articles/61940ce531a847b27d314cc2c196a4c380f4549d,9/5(金) 10:02
2025-09-05,17:10,TTL,総合,3,女性自身,「かなりやつれていた」中居正広氏　知人は地元・湘南に呼び出されて…“少数精鋭”飲み会で漏らした“本音”,315,https://news.yahoo.co.jp/articles/a95a875b9d315455bcb98cc2970b97b792c2f85c,9/5(金) 11:00
2025-09-05,17:10,TTL,総合,4,J-CASTニュース,巨人・阿部監督「レベル低い」発言にG党苦言、「言葉に配慮がない」「選手にも家族いる」...又木鉄平投手に2軍通告,270,https://news.yahoo.co.jp/articles/5e8fe90a7556c72ffff2da4b4e6e08ec065a4af8,9/5(金) 11:45
2025-09-05,17:10,TTL,総合,5,FNNプライムオンライン（フジテレビ系）,【独自】鈴木馨祐法相が総裁選前倒し要求の意向　石破首相に伝達　現役閣僚で初,215,https://news.yahoo.co.jp/articles/21d07a7d7e4724d354a0c27208c15e8bddc4c356,9/5(金) 11:24
2025-09-05,17:10,TTL,総合,6,ABCニュース,小林製薬　美容クリーム５７万個を自主回収　医薬部外品の規格逸脱する可能性,214,https://news.yahoo.co.jp/articles/88e7f1b711749894835275e18571d31a30dc5eb1,9/5(金) 14:46
2025-09-05,17:10,TTL,総合,7,読売新聞オンライン,石破首相、衆院解散を本格検討も実現にハードル…「居座り」批判への対抗手段狭まる,209,https://news.yahoo.co.jp/articles/c26e997bbeba39c99e5c52ecee5a603aeecbe388,9/5(金) 7:21
2025-09-05,17:10,TTL,総合,8,読売新聞オンライン,「アインシュタイン」稲田直樹さんのインスタアカウント乗っ取りか、３２歳男を再逮捕,206,https://news.yahoo.co.jp/articles/0cd1860b67b88f5a3d45ae193c4b9c3ec4fa9ede,9/5(金) 10:00
2025-09-05,17:10,TTL,総合,9,SmartFLASH,「遅刻を責める人は能力低い」EXIT・兼近の持論に議論沸騰…ひろゆきも「遅刻容認」コメントの過去,199,https://news.yahoo.co.jp/articles/ab78d282aed7c93755b2f6243a0f28e85ad0c125,9/4(木) 18:20
2025-09-05,17:10,TTL,総合,10,TBS NEWS DIG Powered by JNN,「日米関係の黄金時代をともに築いていきたい」石破総理がトランプ大統領に親書　関税交渉、自動車関税は15%に引き下げ,193,https://news.yahoo.co.jp/articles/4febfb52b8b89fcc12c59cb750ec3a6b547dedec,9/5(金) 12:18
2025-09-05,17:10,TTL,総合,11,産経新聞,宮城の村井嘉浩知事、外国人共生へ「日本人は海外で差別経験を」　土葬墓地「議論が必要」,192,https://news.yahoo.co.jp/articles/9f0867ebe048241d64e3068a7cf22955ba33ab9a,9/5(金) 7:00
2025-09-05,17:10,TTL,総合,12,神戸新聞NEXT,通学中の中学生をひき逃げ　車運転の25歳女を逮捕　目撃者がナンバー控え,187,https://news.yahoo.co.jp/articles/7eb9c1412936b7577f4f375e14a72898867025a2,9/5(金) 8:57
2025-09-05,17:10,TTL,総合,13,tenki.jp,台風15号　関東で大雨のピーク　18時頃にかけて猛烈な雨の恐れ　内水氾濫に警戒,175,https://news.yahoo.co.jp/articles/9650a3b859ec4908b6e4fbbe7458bd726c347a0d,9/5(金) 15:12
2025-09-05,17:10,TTL,総合,14,AERA DIGITAL,参政党の演説で聴衆が口論「10円50銭と言ってみな」の野蛮　私たちは「差別」にどう向き合うか　北原みのり,153,https://news.yahoo.co.jp/articles/4c98bd82c4f1e04783f244e0e62517eaceb599f8,9/5(金) 16:31
2025-09-05,17:10,TTL,総合,15,毎日新聞,訪中の金正恩氏、スイス製高級腕時計　妹与正氏はディオールのバッグ,148,https://news.yahoo.co.jp/articles/1d2c11505f93babe3d9d2d2a96ad2b13621c87ff,9/5(金) 6:45
2025-09-05,17:10,TTL,総合,16,プレジデントオンライン,テレビで扱うほど「田久保応援団」は増えていく…「辞めない」「卒業証書見せない」田久保市長が狙う「ゴネ得」,144,https://news.yahoo.co.jp/articles/ef2ec27f8b6c44c6b3a41bc3d56877ba32b197b9,9/5(金) 9:16
2025-09-05,17:10,TTL,総合,17,TBS NEWS DIG Powered by JNN,飲酒運転で逆走…衝突された車の男性は死亡　当時18歳の中国籍の男に懲役9年求刑,142,https://news.yahoo.co.jp/articles/ed46180e1f20577083e30f102a6457744da59ca3,9/5(金) 14:40
2025-09-05,17:10,TTL,総合,18,読売新聞オンライン,ＪＡＬ飲酒機長、アルコール検査記録を改ざん…飲酒リスク高い「要注意者リスト」に名前,136,https://news.yahoo.co.jp/articles/5569e0669725aee5523a5bd3b5b43883af4ad499,9/4(木) 21:34
2025-09-05,17:10,TTL,総合,19,よろず～ニュース,参政党・神谷氏、水道事業でも“バトル”した村井知事に「白黒つけましょう」宮城県知事選に候補者擁立へ,132,https://news.yahoo.co.jp/articles/b449c57659c434bdbf5f853a797ebbf98aacf1db,9/5(金) 16:10
2025-09-05,17:10,TTL,総合,20,日刊スポーツ,へずまりゅう氏”会計前に商品食べる外国人”巡り「自分は捕まえて外国人は捕まえないなら差別」,130,https://news.yahoo.co.jp/articles/be4d4ba67e7331aebd9ed04ae86e9f69f426e61c,9/5(金) 12:10
2025-09-05,17:10,TTL,総合,21,TBS NEWS DIG Powered by JNN,【速報】日米関税合意　トランプ大統領が大統領令に署名「日本の自動車関税15％に引き下げ」「相互関税15％の特例措置」など,127,https://news.yahoo.co.jp/articles/3f49b83bae7db11410c77c1c295dd38985b765be,9/5(金) 5:57
2025-09-05,17:10,TTL,総合,22,デイリー新潮,自民党「総裁選前倒し」議論が白熱するウラで「国民は置き去り」の声…「これほど世論と乖離してしまった自民党は見たことがない」と識者,124,https://news.yahoo.co.jp/articles/f3e90a291689da608418c8b2aaf2fe24fdbeed59,9/5(金) 15:05
2025-09-05,17:10,TTL,総合,23,日テレNEWS NNN,【独自入手】アレフ内部の音声記録　“松本智津夫元死刑囚の二男”が教団幹部“裏会議”に参加,119,https://news.yahoo.co.jp/articles/d49646300e2315daa4580e1336b9abcaa5e45f5d,9/5(金) 6:33
2025-09-05,17:10,TTL,総合,24,女性自身,「いつまでキングメーカー気取り」麻生太郎（84）　総裁選前倒しを公然要求も自身の引退求める声が…失言癖で石破首相以上の“嫌われぶり”,117,https://news.yahoo.co.jp/articles/04a1b8121fe8085bfe39dc6b7264f33f3f0923b8,9/4(木) 19:15
2025-09-05,17:10,TTL,総合,25,女性自身,「ただの迷惑集団」点字ブロックを塞ぎ、高齢男性に足もぶつかり…韓国人気女性グループの“路上ダンス動画”が波紋,115,https://news.yahoo.co.jp/articles/c0fa43d1b8db9fa825958f4f2c0d30044754d150,9/5(金) 11:00
2025-09-05,17:10,TTL,総合,26,シネマトゥデイ,ハリウッド実写版『ストリートファイター』2026年10月米公開！キャスト17名が正式発表,112,https://news.yahoo.co.jp/articles/84afd58f053376385d15624de09c5a9b0b9de80b,9/5(金) 10:37
2025-09-05,17:10,TTL,総合,27,日刊スポーツ,假屋崎省吾さん、来年度から徴収が始まる「独身税」に「偽装結婚するしかないかな～」,111,https://news.yahoo.co.jp/articles/ebe6fad8cb2e5af2419bd5ebb493273f760c35fd,9/5(金) 14:16
2025-09-05,17:10,TTL,総合,28,TBS NEWS DIG Powered by JNN,大坂なおみ、出産後初の4大大会ファイナル進出逃す...フルセットの大激闘も世界ランク9位アニシモバに逆転負け,107,https://news.yahoo.co.jp/articles/409a13ea874dca1e8b0b9fbbb5b016f2b1b0881e,9/5(金) 13:53
2025-09-05,17:10,TTL,総合,29,中日スポーツ,中日・祖父江大輔、引退の決断は３日前「まだ続けるか、引退するかというときに、中日で終わりたかった」,106,https://news.yahoo.co.jp/articles/2fdcd3630e916eb97ed3ab2077f7173c90577905,9/5(金) 13:20
2025-09-05,17:10,TTL,総合,30,東洋経済オンライン,「これ絶対記憶あるって」「もうエンタメだろ」との心ないコメントも…島根で発見《記憶喪失の男性》をめぐる反応に“決定的に欠けた視点”,102,https://news.yahoo.co.jp/articles/a31b1e8c6ac23303a5c0bbab8b89792e743365fb,9/5(金) 14:31
2025-09-05,17:10,TTL,総合,31,スポニチアネックス,田崎史郎氏　麻生氏の総裁選前倒し署名表明で影響解説「若手の主導にベテランたちが…」,101,https://news.yahoo.co.jp/articles/1dc334104e23971bddef805768e08f77504789ae,9/5(金) 15:17
2025-09-05,17:10,TTL,総合,32,オリコン,山田孝之、日本俳優の待遇改善を訴え「安い！」　Netflixに直談判「ギャラをあげてほしい」,100,https://news.yahoo.co.jp/articles/dc631bcf525148542f36bcecc6f1cd154d240c02,9/4(木) 17:41
2025-09-05,17:10,TTL,総合,33,NEWSポストセブン,《広陵高校・暴力問題》謹慎処分のコーチに加え「残りのコーチ2人も退任」していた　中井監督、部長も退任で野球経験のある指導者は「34歳新監督のみ」　160人の部員を指導できるのか,96,https://news.yahoo.co.jp/articles/f3e3fad93e57965e589487acf2950d9e3e9065b7,9/5(金) 16:15
2025-09-05,17:10,TTL,総合,34,SmartFLASH,「点字ブロックの上で踊り歩行者を蹴る」フィフィも非難、期待の韓国アイドル「MEOVV」が日本で起こした“失態”,93,https://news.yahoo.co.jp/articles/0eb074f82be3502af240436a06be900ab38f18ee,9/5(金) 16:05
2025-09-05,17:10,TTL,総合,35,ロイター,トランプ米大統領、国防総省を「戦争省」に改称へ＝政府高官,91,https://news.yahoo.co.jp/articles/71b9d89e331a117c8d5851243656a88faeb8825a,9/5(金) 9:42
2025-09-05,17:10,TTL,総合,36,週刊女性PRIME,「結果を出して」ロバーツ監督が佐々木朗希に喝、“大リーガーの夢達成”でモチベ薄れた？ファン落胆,91,https://news.yahoo.co.jp/articles/73fa02277320d1b74c246c9990057a6609c4d139,9/5(金) 8:31
2025-09-05,17:10,TTL,総合,37,TBS NEWS DIG Powered by JNN,ドジャース地区優勝M消滅...大谷翔平4戦ぶりノーヒットで元気なし、中地区最下位パイレーツに3連敗,86,https://news.yahoo.co.jp/articles/5c1937b0a1ac99e0533bb64f5157d3bb09839592,9/5(金) 10:15
2025-09-05,17:10,TTL,総合,38,共同通信,共産・田村氏、外国人差別に反対　「危険な潮流を包囲しよう」,85,https://news.yahoo.co.jp/articles/93f170196bd6a2dd2e839e034f19bcb8e1694f01,9/4(木) 21:40
2025-09-05,17:10,TTL,総合,39,MBSニュース,【速報】東海道新幹線きょう2回目の運転見合わせ　これまで1時間最大133ミリの雨　下り：東京―名古屋　上り：新大阪ー東京　台風15号の影響,84,https://news.yahoo.co.jp/articles/5e414205ae3a2083f0e61c9f7a0ba21906c03222,9/5(金) 12:34
2025-09-05,17:10,TTL,総合,40,テレビ朝日系（ANN）,危険…道路占拠　大型トラックの路上駐車「とめたくても場所がない」運転手たちの悲鳴,84,https://news.yahoo.co.jp/articles/68840c58c27df0627b87910ca0f1dab24825f51c,9/5(金) 15:24
