scrp_date,scrp_time,genre_en,genre_jp,rank,media_jp,title,comment,link,date_original
2024-11-12,11:26,business,経済,1副業促進へ、割増賃金の「労働時間通算ルール」見直し　厚労省が検討朝日新聞デジタル11/12(火) 5:00168件/時,朝日新聞デジタル,副業促進へ、割増賃金の「労働時間通算ルール」見直し　厚労省が検討,168,https://news.yahoo.co.jp/articles/ee5df81a37f2d242ef64ec08214397f4a9d9eaf8,11/12(火) 5:00
2024-11-12,11:26,business,経済,2結婚したくてもできない男性が増加中…もう止められない日本の少子化「深刻すぎる現実」現代ビジネス11/12(火) 6:04151件/時,現代ビジネス,結婚したくてもできない男性が増加中…もう止められない日本の少子化「深刻すぎる現実」,151,https://news.yahoo.co.jp/articles/8def2fbc24ff5aaff754f7af4e314a811eda677a,11/12(火) 6:04
2024-11-12,11:26,business,経済,3「ワタミのサブウェイ」成功率は”かぎりなく低い”と言える残念な理由…美味しいのに「日本人にさっぱり流行らない」のはなぜなのか現代ビジネス11/12(火) 7:34142件/時,現代ビジネス,「ワタミのサブウェイ」成功率は”かぎりなく低い”と言える残念な理由…美味しいのに「日本人にさっぱり流行らない」のはなぜなのか,142,https://news.yahoo.co.jp/articles/7b378f46cccbaaba6f64df215c7d1dfbfd3becd5,11/12(火) 7:34
2024-11-12,11:26,business,経済,4国民民主党が掲げる「103万円の壁」は突破可能だが…それを阻む「真の元凶」の正体現代ビジネス11/12(火) 7:1495件/時,現代ビジネス,国民民主党が掲げる「103万円の壁」は突破可能だが…それを阻む「真の元凶」の正体,95,https://news.yahoo.co.jp/articles/0353bb42805b85b210f81f56402391e96986e90d,11/12(火) 7:14
2024-11-12,11:26,business,経済,5『松屋』100円コーラ販売の意図とは？ 「コーラだけ注文したい」に対する広報担当者の本音「ご遠慮いただきたい気持ちはありますが…」集英社オンライン11/11(月) 17:5175件/時,集英社オンライン,『松屋』100円コーラ販売の意図とは？ 「コーラだけ注文したい」に対する広報担当者の本音「ご遠慮いただきたい気持ちはありますが…」,75,https://news.yahoo.co.jp/articles/aa56b07466e35483b6296c93f3cda5b6aeb1f4f0,11/11(月) 17:51
2024-11-12,11:26,business,経済,6船井電機破産、不可解な資金の流れ　出版社が買収後3年半、347億円の現預金ほぼ枯渇産経新聞11/11(月) 22:2168件/時,産経新聞,船井電機破産、不可解な資金の流れ　出版社が買収後3年半、347億円の現預金ほぼ枯渇,68,https://news.yahoo.co.jp/articles/efedd78ed9aabab0857314aaf8073ba458675bbc,11/11(月) 22:21
2024-11-12,11:26,business,経済,7大幅減益の日産はこのまま復活できないのか、カギを握るのは不振の米国に投入した新商品とEV最重要技術の「収穫」JBpress11/12(火) 8:5163件/時,JBpress,大幅減益の日産はこのまま復活できないのか、カギを握るのは不振の米国に投入した新商品とEV最重要技術の「収穫」,63,https://news.yahoo.co.jp/articles/2928739db94c066854f95c2ae893a2cd8862076b,11/12(火) 8:51
2024-11-12,11:26,business,経済,8バイオ混合ガソリンを全新車に　政府目標、30年代早期に共同通信11/11(月) 18:3963件/時,共同通信,バイオ混合ガソリンを全新車に　政府目標、30年代早期に,63,https://news.yahoo.co.jp/articles/11646854f042cb4ac727454aeb0bf03b5a5a269a,11/11(月) 18:39
2024-11-12,11:26,business,経済,9女性が人力車を引く姿に「虐待」「かわいそう」外国人から批判的な声…浅草の女性俥夫は「好きなので頑張りたい」FNNプライムオンライン11/12(火) 11:0262件/時,FNNプライムオンライン,女性が人力車を引く姿に「虐待」「かわいそう」外国人から批判的な声…浅草の女性俥夫は「好きなので頑張りたい」,62,https://news.yahoo.co.jp/articles/0fbef12402ca96b59be273e6203e77ec5f6f34e5,11/12(火) 11:02
2024-11-12,11:26,business,経済,10「ラスベガスでは1か月暮らすのに最低75万円」アメリカで急増するホームレス　トランプ新大統領に望むことは「生活費の水準を昔に戻してほしい。家賃を下げて」切実な訴えMBSニュース11/11(月) 13:0355件/時,MBSニュース,「ラスベガスでは1か月暮らすのに最低75万円」アメリカで急増するホームレス　トランプ新大統領に望むことは「生活費の水準を昔に戻してほしい。家賃を下げて」切実な訴え,55,https://news.yahoo.co.jp/articles/08024161aaaedc9d910e8a26476a6de219d72a57,11/11(月) 13:03
2024-11-12,11:26,business,経済,1110月倒産では11年ぶりの900件台、負債1億円未満が今年最高の77.1％東京商工リサーチ11/11(月) 13:3054件/時,東京商工リサーチ,10月倒産では11年ぶりの900件台、負債1億円未満が今年最高の77.1％,54,https://news.yahoo.co.jp/articles/9a992fdd3ded4b5145c4d025b2198537e0170eeb,11/11(月) 13:30
2024-11-12,11:26,business,経済,12【解説】106万円の壁撤廃で「かなり手取りが減ってしまう」懸念…週20時間以上の労働で“社会保険加入”に　「将来安心」伝わっていない可能性FNNプライムオンライン11/11(月) 14:0250件/時,FNNプライムオンライン,【解説】106万円の壁撤廃で「かなり手取りが減ってしまう」懸念…週20時間以上の労働で“社会保険加入”に　「将来安心」伝わっていない可能性,50,https://news.yahoo.co.jp/articles/edabd477f04331fe6d16ccf24da1d42edf02fe64,11/11(月) 14:02
2024-11-12,11:26,business,経済,13「株高でも景気は最悪」「GDPは2位￫38位に急落」残酷な事実を直視できない衰退国家ニッポンの末路プレジデントオンライン11/12(火) 6:1746件/時,プレジデントオンライン,「株高でも景気は最悪」「GDPは2位￫38位に急落」残酷な事実を直視できない衰退国家ニッポンの末路,46,https://news.yahoo.co.jp/articles/9dd98f95761d46ccb45c9534fbf48cfb7d8e1208,11/12(火) 6:17
2024-11-12,11:26,business,経済,14「106万円の壁」撤廃へ…議論本格化　社会保険加入“20時間の壁”　200万人に影響…「これ以上減らされたら困る」手取り減の懸念FNNプライムオンライン11/11(月) 13:0246件/時,FNNプライムオンライン,「106万円の壁」撤廃へ…議論本格化　社会保険加入“20時間の壁”　200万人に影響…「これ以上減らされたら困る」手取り減の懸念,46,https://news.yahoo.co.jp/articles/01b11fda7ca84e38a3519bc9277228644d46bf7f,11/11(月) 13:02
2024-11-12,11:26,business,経済,15日産9000人削減の衝撃！ ゴーン前会長が残した3つの“負の遺産”とは何か？ 「ルノー支配」「販売偏重」のツケが招いた辛らつ現実を再考するMerkmal11/12(火) 5:4142件/時,Merkmal,日産9000人削減の衝撃！ ゴーン前会長が残した3つの“負の遺産”とは何か？ 「ルノー支配」「販売偏重」のツケが招いた辛らつ現実を再考する,42,https://news.yahoo.co.jp/articles/d88a03db42f8857f6dc7a3d2512c407fb13c8df1,11/12(火) 5:41
2024-11-12,11:26,business,経済,16木造の自衛艦が炎上・沈没!?「なぜ鉄で造らないんですか？」鋼製船体じゃ逆に危ないワケ乗りものニュース11/12(火) 9:4237件/時,乗りものニュース,木造の自衛艦が炎上・沈没!?「なぜ鉄で造らないんですか？」鋼製船体じゃ逆に危ないワケ,37,https://news.yahoo.co.jp/articles/134e0b49b645c85970d94c11395be483c636b623,11/12(火) 9:42
2024-11-12,11:26,business,経済,17AI・半導体に10兆円超を支援　経済対策、22日にも閣議決定共同通信11/11(月) 20:0736件/時,共同通信,AI・半導体に10兆円超を支援　経済対策、22日にも閣議決定,36,https://news.yahoo.co.jp/articles/6513d7a080a470659b1bd8b9bcacdab2a50e9b50,11/11(月) 20:07
2024-11-12,11:26,business,経済,18築地銀だこ12月4日値上げ、「たこ焼8個入り」はテイクアウト626円から669円に/ホットランド食品産業新聞社ニュースWEB11/12(火) 10:0433件/時,食品産業新聞社ニュースWEB,築地銀だこ12月4日値上げ、「たこ焼8個入り」はテイクアウト626円から669円に/ホットランド,33,https://news.yahoo.co.jp/articles/90f223eb392c53fd61e49d40808ba57ac301b428,11/12(火) 10:04
2024-11-12,11:26,business,経済,19国連の女性差別撤廃委員会が日本政府に突きつけた「4度目の勧告」日刊ゲンダイDIGITAL11/12(火) 9:0633件/時,日刊ゲンダイDIGITAL,国連の女性差別撤廃委員会が日本政府に突きつけた「4度目の勧告」,33,https://news.yahoo.co.jp/articles/4264b5d1869489cbaa93ee3e019b20098d186f47,11/12(火) 9:06
2024-11-12,11:26,business,経済,20「スゴい機体だった」米空軍で屈指の人気チームがラストフライト！  A-10が退役にますます近づく乗りものニュース11/12(火) 8:4230件/時,乗りものニュース,「スゴい機体だった」米空軍で屈指の人気チームがラストフライト！  A-10が退役にますます近づく,30,https://news.yahoo.co.jp/articles/6748a8dd4b7f9a5a82ccd4f3219a113db0c3ec46,11/12(火) 8:42
2024-11-12,11:26,business,経済,21なぜ日本は電気自動車の「電費」がイマイチなのか、その納得の理由現代ビジネス11/12(火) 8:0427件/時,現代ビジネス,なぜ日本は電気自動車の「電費」がイマイチなのか、その納得の理由,27,https://news.yahoo.co.jp/articles/5d37996b427cb3c3a54af43ffcf131f0d654f700,11/12(火) 8:04
2024-11-12,11:26,business,経済,22教員残業代　働き方改革条件に段階的引き上げへ　財務省案テレビ朝日系（ANN）11/11(月) 17:2927件/時,テレビ朝日系（ANN）,教員残業代　働き方改革条件に段階的引き上げへ　財務省案,27,https://news.yahoo.co.jp/articles/aedc456b578877ccc37e68af3d25b148c5f498ff,11/11(月) 17:29
2024-11-12,11:26,business,経済,23私、仕事も辞めたんですけど…先妻の子どもにも平等に遺産を分けないとダメですか？夫を亡くした63歳女性、意地でも〈妻の寄与分〉を認めてほしいワケ【相続の専門家の助言】THE GOLD ONLINE（ゴールドオンライン）11/12(火) 10:0226件/時,THE GOLD ONLINE（ゴールドオンライン）,私、仕事も辞めたんですけど…先妻の子どもにも平等に遺産を分けないとダメですか？夫を亡くした63歳女性、意地でも〈妻の寄与分〉を認めてほしいワケ【相続の専門家の助言】,26,https://news.yahoo.co.jp/articles/ffd02858a62be3a8e9672f0cfda82726d4d23bbb,11/12(火) 10:02
2024-11-12,11:26,business,経済,24「コンテナホテル」ぞくぞく出現、全国に91店舗　「リピート客」が4割、どこを評価？ITmedia ビジネスオンライン11/12(火) 7:1526件/時,ITmedia ビジネスオンライン,「コンテナホテル」ぞくぞく出現、全国に91店舗　「リピート客」が4割、どこを評価？,26,https://news.yahoo.co.jp/articles/3d858c5252bfbf7ff8e40cf3fd630472ddbcbdda,11/12(火) 7:15
2024-11-12,11:26,business,経済,25就職氷河期世代「年金15万円なんて、どうせもらえない」…「割りを食った世代」の厳しさTHE GOLD ONLINE（ゴールドオンライン）11/11(月) 17:1626件/時,THE GOLD ONLINE（ゴールドオンライン）,就職氷河期世代「年金15万円なんて、どうせもらえない」…「割りを食った世代」の厳しさ,26,https://news.yahoo.co.jp/articles/79f093092ca0c8e417913d0aa3efd43bf8b4c492,11/11(月) 17:16
2024-11-12,11:26,business,経済,26ＮＹダウ終値、２営業日連続で最高値更新の４万４２９３ドル…トランプ次期政権への期待続く読売新聞オンライン11/12(火) 6:2224件/時,読売新聞オンライン,ＮＹダウ終値、２営業日連続で最高値更新の４万４２９３ドル…トランプ次期政権への期待続く,24,https://news.yahoo.co.jp/articles/3c185bfad190383b72166927aec07cf04017e26a,11/12(火) 6:22
2024-11-12,11:26,business,経済,27ちょっと前から話題に上っている「ゲームボーイ」で「クルマを盗む」ってどういうこと？　絶対的な対策がない窃盗団の手口とはWEB CARTOP11/12(火) 7:1124件/時,WEB CARTOP,ちょっと前から話題に上っている「ゲームボーイ」で「クルマを盗む」ってどういうこと？　絶対的な対策がない窃盗団の手口とは,24,https://news.yahoo.co.jp/articles/81b96283536c20c5270dde43172e20faff357431,11/12(火) 7:11
2024-11-12,11:26,business,経済,28BYDは過去最高も…輸入車EV販売、3ヶ月連続減ニュースイッチ11/12(火) 9:4024件/時,ニュースイッチ,BYDは過去最高も…輸入車EV販売、3ヶ月連続減,24,https://news.yahoo.co.jp/articles/b0eabc479b1fb6ecc3c6c4d698915963992eaa46,11/12(火) 9:40
2024-11-12,11:26,business,経済,29あしき慣行「車買ったら保険を売る」　見返り明示のディーラー大幅減朝日新聞デジタル11/12(火) 7:0022件/時,朝日新聞デジタル,あしき慣行「車買ったら保険を売る」　見返り明示のディーラー大幅減,22,https://news.yahoo.co.jp/articles/b6d76f49fad5c95ba919c99b5371359b97e6afe6,11/12(火) 7:00
2024-11-12,11:26,business,経済,30「玉木潰しだ」「無能より、不倫する有能がいい」との声も…。玉木氏の「不倫報道」でも無傷か、国民民主党がここまで躍進した理由とは？東洋経済オンライン11/11(月) 17:1122件/時,東洋経済オンライン,「玉木潰しだ」「無能より、不倫する有能がいい」との声も…。玉木氏の「不倫報道」でも無傷か、国民民主党がここまで躍進した理由とは？,22,https://news.yahoo.co.jp/articles/0f04a07032a7f06097470221c687370cb63e10f2,11/11(月) 17:11
2024-11-12,11:26,business,経済,31日産が新型「3列シートSUV」発表！ 約2000万円の「超高級モデル」は“めちゃ豪華内装”がスゴい！ 全長5.4m×全幅2.2m級の「ワイドボディ」採用しドバイで発表！くるまのニュース11/12(火) 10:3020件/時,くるまのニュース,日産が新型「3列シートSUV」発表！ 約2000万円の「超高級モデル」は“めちゃ豪華内装”がスゴい！ 全長5.4m×全幅2.2m級の「ワイドボディ」採用しドバイで発表！,20,https://news.yahoo.co.jp/articles/bdd4342ff8abae8c60cea2fb84536b730228427d,11/12(火) 10:30
2024-11-12,11:26,business,経済,32「衰退」してばかりの日本は世界から取り残される「ヤバい現実」現代ビジネス11/12(火) 6:1920件/時,現代ビジネス,「衰退」してばかりの日本は世界から取り残される「ヤバい現実」,20,https://news.yahoo.co.jp/articles/67428cb3b94b55974974750d3ca801ddfe4ba3f4,11/12(火) 6:19
2024-11-12,11:26,business,経済,33ひし形マーク「意味知らない」 人が半数以上!? 覚えて無い人「免許返納した方が…」 正しく理解すべき謎マークとはくるまのニュース11/12(火) 9:1019件/時,くるまのニュース,ひし形マーク「意味知らない」 人が半数以上!? 覚えて無い人「免許返納した方が…」 正しく理解すべき謎マークとは,19,https://news.yahoo.co.jp/articles/52ccf34414bd9d304e3f98f992707e568fcf12e1,11/12(火) 9:10
2024-11-12,11:26,business,経済,34同じ世帯年収800万円でも、自分と妻に税金がかかる「共働き」の方が「片働き」よりも手取り額は少ないのでしょうか？ファイナンシャルフィールド11/12(火) 10:5018件/時,ファイナンシャルフィールド,同じ世帯年収800万円でも、自分と妻に税金がかかる「共働き」の方が「片働き」よりも手取り額は少ないのでしょうか？,18,https://news.yahoo.co.jp/articles/ab330b345cb041be5cc339cacfd504a4d62e1898,11/12(火) 10:50
2024-11-12,11:26,business,経済,351:05「企業倒産」11年ぶりに年1万件超えかテレビ朝日系（ANN）11/12(火) 9:4918件/時,テレビ朝日系（ANN）,「企業倒産」11年ぶりに年1万件超えか,18,https://news.yahoo.co.jp/articles/791fdbc45477a200a21a7354ef3b37b9d16888db,11/12(火) 9:49
2024-11-12,11:26,business,経済,36ガソリン補助、段階的に縮小へ共同通信11/11(月) 21:1618件/時,共同通信,ガソリン補助、段階的に縮小へ,18,https://news.yahoo.co.jp/articles/7617008073e1b4a168356fad80951e089a9a73d9,11/11(月) 21:16
2024-11-12,11:26,business,経済,37車両が大きいほど停められない! そんなケースが増えてトラックドライバーが困っていますベストカーWeb11/12(火) 10:0018件/時,ベストカーWeb,車両が大きいほど停められない! そんなケースが増えてトラックドライバーが困っています,18,https://news.yahoo.co.jp/articles/236d85605bc5d7b0acc9c652ccef4092c6aa2c7d,11/12(火) 10:00
2024-11-12,11:26,business,経済,38MARCH文系志望の受験生がいます。地方在住の4人家族で世帯年収700万円、高等教育の修学支援新制度は利用できません。学校独自の学費軽減制度を受けられますか？ファイナンシャルフィールド11/12(火) 7:3018件/時,ファイナンシャルフィールド,MARCH文系志望の受験生がいます。地方在住の4人家族で世帯年収700万円、高等教育の修学支援新制度は利用できません。学校独自の学費軽減制度を受けられますか？,18,https://news.yahoo.co.jp/articles/d227bb74c28801e22b459c064944be865548f6f2,11/12(火) 7:30
2024-11-12,11:26,business,経済,39【独占】「駄目になれば、米政府への訴訟も考えます」 日本製鉄・橋本英二会長が語ったUSスチール買収《トランプ氏は「ディールを阻止する」とも発言》文春オンライン11/12(火) 7:1216件/時,文春オンライン,【独占】「駄目になれば、米政府への訴訟も考えます」 日本製鉄・橋本英二会長が語ったUSスチール買収《トランプ氏は「ディールを阻止する」とも発言》,16,https://news.yahoo.co.jp/articles/25b29a043ebcae96c918602439342a5192937946,11/12(火) 7:12
2024-11-12,11:26,business,経済,40徹底解説「米国が再びトランプを選んだ」深い理由東洋経済オンライン11/12(火) 5:4116件/時,東洋経済オンライン,徹底解説「米国が再びトランプを選んだ」深い理由,16,https://news.yahoo.co.jp/articles/af19a52515d8ad1a8ee1b7a92a5b3da16571cc2b,11/12(火) 5:41
