scrp_date,scrp_time,genre_en,genre_jp,rank,media_jp,title,comment,link,date_original
2025-03-02,14:07,TTL,総合,1,TBS NEWS DIG Powered by JNN,【独自】みのもんたさん自宅に侵入か　窃盗目的とみて警察が逃げた人物の行方追う,747,https://news.yahoo.co.jp/articles/09a6096827ba3ec258925912bba50bf9c2b4e657,3/2(日) 11:42
2025-03-02,14:07,TTL,総合,2,スポニチアネックス,橋下徹氏　コシヒカリ過去最高5キロ4363円に「官僚が価格を統制できるなんて考えるのは前近代的」,339,https://news.yahoo.co.jp/articles/2055d23f0fd0a38ad7b994cc506a28416ea88a13,3/2(日) 11:38
2025-03-02,14:07,TTL,総合,3,共同通信,「米国の恥」、野党民主党が批判　共和党にゼレンスキー氏の自滅論,303,https://news.yahoo.co.jp/articles/ee245cd8d1a758feecc349bb1575394abc4ac6fa,3/1(土) 21:34
2025-03-02,14:07,TTL,総合,4,弁護士JPニュース,30代シングルマザー「息子の高校“入学金”が払えない」“高校授業料無償化”の落とし穴…母子が行政の“たらい回し”の果て「生活保護」選んだ理由,276,https://news.yahoo.co.jp/articles/42f65df81f1c3aba3e5efef984eb748ff7b81c36,3/2(日) 9:02
2025-03-02,14:07,TTL,総合,5,産経新聞,「参院選が心配」維新悩ます不祥事の波　諮問機関近く立ち上げも、ガバナンス強化どこまで,199,https://news.yahoo.co.jp/articles/efa898f4bd55cb49633747804d2b20cb5658aec7,3/1(土) 22:36
2025-03-02,14:07,TTL,総合,6,集英社オンライン,最低な「ごんぎつね」の感想文？　小学生の回答に先生から“厳しい指摘”「国語嫌いになっちゃう指導の仕方だ」とSNS上で批判も…,195,https://news.yahoo.co.jp/articles/b0be99eb79278e652b2261704b038e98fbfcdd0f,3/2(日) 11:02
2025-03-02,14:07,TTL,総合,7,産経新聞,「ルールを守りなさい！」安住予算委員長、質問時間超過のれいわ・大石氏「でも…」に一喝,194,https://news.yahoo.co.jp/articles/6ea9b5e0ce4e0c5d3676766a880352a738a201f5,3/2(日) 7:00
2025-03-02,14:07,TTL,総合,8,産経新聞,「まずは私の名前覚えて」維新・前原共同代表、党大会で訴え「自公の補完勢力でない」連呼,191,https://news.yahoo.co.jp/articles/a1e61356df40288931c1173e51853b969a7cbc7f,3/2(日) 7:00
2025-03-02,14:07,TTL,総合,9,テレビ朝日系（ANN）,トランプ大統領との会談決裂から一夜　ゼレンスキー氏 英首相と前倒しで会談　「全面的にウクライナを支持」英首相が強調,189,https://news.yahoo.co.jp/articles/a7b6f9a1a9ecdf5424fa72af8fc7b2add95b10a5,3/2(日) 4:50
2025-03-02,14:07,TTL,総合,10,日刊スポーツ,ひろゆき氏、日本の核武装を主張「理解する人も増えたかな？」米ウクライナ首脳会談決裂受け,185,https://news.yahoo.co.jp/articles/338e05288346b7daf58be9dd1a1633235417d042,3/2(日) 13:09
2025-03-02,14:07,TTL,総合,11,時事通信,米大統領、ゼレンスキー氏の服装やゆ　親トランプの米記者も加担,178,https://news.yahoo.co.jp/articles/f8d8a02a0b5bbce98430baa47a39abea8fbb10e0,3/1(土) 14:13
2025-03-02,14:07,TTL,総合,12,デイリースポーツ,青学大・太田蒼生は無念の途中棄権　３６キロ地点で　ホロ苦初マラソンも世界と真っ向勝負　中間点まで２時間２分台ペース、日本勢唯一食らいつくも急失速,165,https://news.yahoo.co.jp/articles/2aac33fa1d1bd7c49ddb1924c7cf300cc7b81f62,3/2(日) 11:25
2025-03-02,14:07,TTL,総合,13,オトナンサー,「牛丼」で栄養をしっかり摂取できるの？　管理栄養士が勧める“太りにくい食べ方”,164,https://news.yahoo.co.jp/articles/a689f73b1a3b95ea462634b614543721b84b8af7,3/2(日) 8:10
2025-03-02,14:07,TTL,総合,14,ＳＢＣ信越放送,リンゴ畑で「野焼き」の穴に落ちて火が…　農作業中の下草火災相次ぐ中　枝を焼いていた79歳男性が両足を大やけどし死亡,163,https://news.yahoo.co.jp/articles/38e77c65732121d2e5cd4e3ead308cecb4932d2c,3/2(日) 10:13
2025-03-02,14:07,TTL,総合,15,集英社オンライン,日本のほとんどのタワマンがいずれ中国人所有になる…相続税がなく膨張する中国人マネーが“占領”「日本人は一生賃貸」の地獄絵図,162,https://news.yahoo.co.jp/articles/a827c9ae795d4aa7894657f6969150acea8a2d7e,3/2(日) 10:02
2025-03-02,14:07,TTL,総合,16,時事通信,〔国際女性デー50年〕女性議員、セクハラ深刻　地方議会、3人に1人被害　支援団体「公的な相談窓口を」,151,https://news.yahoo.co.jp/articles/c043d7a3612c41203b4be3cb4f282e9916d333e9,3/2(日) 7:20
2025-03-02,14:07,TTL,総合,17,デイリースポーツ,「不快すぎる」喧嘩自慢がＤＥＥＰ代表に水ぶっかけ暴挙が波紋　会場悲鳴、ＳＮＳ炎上、ＢＤ選手も批判も本人悪びれず「暴力じゃなく水にしてやった」,148,https://news.yahoo.co.jp/articles/4732a74422df0e66a32b9901d152d413629a8c76,3/2(日) 9:45
2025-03-02,14:07,TTL,総合,18,スポニチアネックス,橋下徹氏　日本を含む西側諸国に「ウクライナを支えるというんだったら、本気でロシアと戦う覚悟を…」,144,https://news.yahoo.co.jp/articles/16ab5b554b46929afaf1125bba8c41cd4f480ad8,3/2(日) 9:05
2025-03-02,14:07,TTL,総合,19,共同通信,「吐き気する」と痛烈批判　身内の米共和党議員、政権に,141,https://news.yahoo.co.jp/articles/19fdbf434cab91db9a737329bde1e045f2c82a9c,3/2(日) 7:45
2025-03-02,14:07,TTL,総合,20,MBSニュース,不正使用が相次ぐ『駐禁除外』の標章めぐってついに逮捕者　大阪・ミナミで毎日のように止まる「オレンジ色の車」...ダッシュボードの標章が“コピー”だと捜査員が見抜く,130,https://news.yahoo.co.jp/articles/031bd16a6c2e1af30fc826e3d812bd0796500120,3/2(日) 9:33
2025-03-02,14:07,TTL,総合,21,集英社オンライン,「初任給30万円は一部のエリートだけ」氷河期世代からの不満にZ世代が反論…世代間での分断が進む「コロナ世代もリーマン世代もキツい」,128,https://news.yahoo.co.jp/articles/6a50e7564bb119a21b9e83ff0161930dc9672e4d,3/2(日) 9:02
2025-03-02,14:07,TTL,総合,22,オリコン,太田光、タイタンのオンラインカジノ該当者発覚に言及　名前を公表しない意図も「必ず法的な責任を負って…」【ほぼ全文】,120,https://news.yahoo.co.jp/articles/c1fbcda2feb8f325d410e75e0f362fe01903a2ff,3/2(日) 11:16
2025-03-02,14:07,TTL,総合,23,毎日新聞,保守評論家の石平氏が参院選不出馬を表明　ネットの「誹謗中傷」理由,117,https://news.yahoo.co.jp/articles/f35dbeded14f326eac1ebffdb5c201775c959d35,3/2(日) 11:46
2025-03-02,14:07,TTL,総合,24,読売テレビ,【独自解説】「国家的殺人」「結論から言えば論外」国会での議論なく『高額療養費』見直し決定に批判殺到　“長瀬効果”主張の政府に当事者は怒り「受診控えたら数値がすぐに悪くなる。そうしろということか？ふざけるな！」,117,https://news.yahoo.co.jp/articles/810de5cf8caa754189eb853dae47d68a2c3e6ef0,3/2(日) 12:00
2025-03-02,14:07,TTL,総合,25,TBS NEWS DIG Powered by JNN,発生5日目　岩手県・大船渡市の山林火災　焼失面積は約1800ヘクタールに拡大　4596人への避難指示は継続中,115,https://news.yahoo.co.jp/articles/313a1f99e82c46787ab781782a7f2e3e1eb45e2b,3/2(日) 11:41
2025-03-02,14:07,TTL,総合,26,集英社オンライン,”爆益”ホテル業界も賃金は上がらず…国民には恩恵ナシの石破政権「貧乏日本人排除のインバウンド政策」が鬼すぎる,114,https://news.yahoo.co.jp/articles/8c3514dc6c5cab3dad0520be1a351fc34750e7ef,3/2(日) 10:02
2025-03-02,14:07,TTL,総合,27,週プレNEWS,渡邊渚がついに週プレ表紙＆DVDに登場！　なぜ彼女はグラビアに挑戦するのか？「週プレの表紙を飾れると聞いたときに本当に救われたんです」,113,https://news.yahoo.co.jp/articles/330e2335848e6d1a1753a8e8037587ccb3e68703,3/2(日) 13:00
2025-03-02,14:07,TTL,総合,28,CNN.co.jp,西側諸国が一斉にウクライナ支持を表明、米ウ首脳会談の決裂受け,110,https://news.yahoo.co.jp/articles/d7300b89c04df30ac7a7178aa1a4cdf24f32e781,3/2(日) 10:52
2025-03-02,14:07,TTL,総合,29,FNNプライムオンライン（フジテレビ系）,国民・玉木氏 維新に「反対してほしい」　「年収の壁」与党案めぐり,109,https://news.yahoo.co.jp/articles/c702588ee5763ce95d8c736a873d8fd04216a2a4,3/2(日) 6:22
2025-03-02,14:07,TTL,総合,30,中央日報日本語版,ウクライナ大使は絶望した…「ゼレンスキー大統領、トランプ氏に『不意打ち』食らったもの」,105,https://news.yahoo.co.jp/articles/8b26ece1dcf0e1507fff237f5d6af196b7dca94b,3/2(日) 11:30
2025-03-02,14:07,TTL,総合,31,スポニチアネックス,兒玉遥　病院での卵子凍結巡り長文で声明「男性に局部を…精神的負担あった」「モヤモヤと不快な思いが…」,99,https://news.yahoo.co.jp/articles/591da144a17dbfa017c3c5cc7472193eb8b930e1,3/1(土) 19:15
2025-03-02,14:07,TTL,総合,32,北海道新聞,ニセコ地域　外国人の交通事故急増　雪道に不慣れ　無理な運転も,91,https://news.yahoo.co.jp/articles/0e889a52be619d7565c97ba96c6db09907a943e6,3/2(日) 6:01
2025-03-02,14:07,TTL,総合,33,NEWSポストセブン,《女性バックパッカー（28）殺害事件》「裸の遺体がビーチで発見」「性的暴行を受けたあと殺害された」有罪判決まで8年もかかった“インド司法の闇”,91,https://news.yahoo.co.jp/articles/428374ef4c1cf0c48806ae8a29c3f90bb979d780,3/2(日) 11:15
2025-03-02,14:07,TTL,総合,34,クーリエ・ジャポン,トランプとゼレンスキーの「怒鳴り合い会談」に揺れる欧州　英紙は「ゼレンスキーの政治力」を辛辣に報じる,84,https://news.yahoo.co.jp/articles/029df0d8b1482e66a59c60b413637b24ddc10ae8,3/2(日) 12:28
2025-03-02,14:07,TTL,総合,35,時事通信,米テスラ株、2カ月半で4割安　マスク氏嫌われ販売急減,82,https://news.yahoo.co.jp/articles/34f167b29d623421e3d07c6a715f71a7719cd9d2,3/1(土) 20:32
2025-03-02,14:07,TTL,総合,36,デイリースポーツ,中日前監督　立浪和義氏への誹謗中傷で法的措置へ　公式ＨＰで警告「あらゆる手段を用いて断固たる措置を実行」,81,https://news.yahoo.co.jp/articles/f5c8806cc0056cb0fcd063e22c73739f28dd87e1,3/2(日) 13:19
2025-03-02,14:07,TTL,総合,37,ウェザーマップ,【関東地方】あす～5日にかけて雪予報で積雪のおそれ　東京都心で雪のタイミングは2回か　真冬の厳寒に逆戻りで週明けは雪と寒さ対策を,81,https://news.yahoo.co.jp/articles/211bf5b3804be8e574b1c561123561d8ff9ac088,3/2(日) 12:04
2025-03-02,14:07,TTL,総合,38,日刊スポーツ,トランプ氏が「キレた瞬間」…米ウ首脳会談を元外務省幹部が分析「トランプは怒らせてはだめ」,80,https://news.yahoo.co.jp/articles/53bc0114b8beed8527a2c98ed697b43af3eb584c,3/2(日) 9:52
2025-03-02,14:07,TTL,総合,39,日刊スポーツ,国民・玉木雄一郎氏が3・4党代表に正式復帰へ　不倫問題で役職停止から３カ月ぶり　露出も強化,78,https://news.yahoo.co.jp/articles/7cc7c14305f78e438a18537f4546169aabeb9c82,3/2(日) 11:00
2025-03-02,14:07,TTL,総合,40,スポニチアネックス,「タイタン」所属タレント含む4人の「オンラインカジノ利用発覚」を発表し「深くお詫び」実名は公表せず,78,https://news.yahoo.co.jp/articles/3091aafbbe5ef83b82e1042c85221e88b7dd1b60,3/1(土) 17:00
