scrp_date,scrp_time,genre_en,genre_jp,rank,media_jp,title,comment,link,date_original
2025-12-15,18:14,business,経済,1,産経新聞,わずか9平方メートル…都心に近い「極小」アパートが若者に人気　狭くても“住めば都”,161,https://news.yahoo.co.jp/articles/536007d1f3c8adc9adfade8523fcd354fae5dcc7,12/15(月) 8:00
2025-12-15,18:14,business,経済,2,みんかぶマガジン,竹中平蔵「日本の年金は太っ腹すぎる」支給額の調整、開始の後ろ倒しは”当たり前”…高市政権19兆円経済対策は「極めて昭和的」,147,https://news.yahoo.co.jp/articles/b5f94c3e3b41248e50666999f0ed9c62ff42f099,12/15(月) 9:10
2025-12-15,18:14,business,経済,3,TBS CROSS DIG with Bloomberg,「ルンバ」製造のアイロボット、連邦破産法11条適用申請-近年収益減,124,https://news.yahoo.co.jp/articles/8ef35267b6a177f4d69285c4db9f54f2c58de663,12/15(月) 11:02
2025-12-15,18:14,business,経済,4,東洋経済オンライン,「トラックドライバーのソウルフード」「東京23区にはあえて出店しない」 ラーメンチェーン《山岡家》が全国区で老若男女に愛されているワケ,105,https://news.yahoo.co.jp/articles/6bcbf37f7c2a2f5dc5b2de1dbd2b621ade96e22c,12/15(月) 5:46
2025-12-15,18:14,business,経済,5,朝日新聞,ゆうちょPay、1年後に終了　連携の横浜・福岡・沖縄・広島銀も,71,https://news.yahoo.co.jp/articles/74fe92428a5380fb5cf08da115847cb5c3b47f08,12/15(月) 16:32
2025-12-15,18:14,business,経済,6,テレビ朝日系（ANN）,コメ「余っている」年明けに下落も？　大量の在庫、赤字の恐れ「値下げするしか…」,69,https://news.yahoo.co.jp/articles/fcc64f3fd6d2bc6589c47e6756b5ca67e0f3fd7d,12/15(月) 17:57
2025-12-15,18:14,business,経済,7,朝日新聞,リカバリーウェア、年300万枚超の売れ筋　流行語大賞候補にも,67,https://news.yahoo.co.jp/articles/455cc7d9d49060d99b8bc94fc27cdd5a9953d1cb,12/15(月) 6:00
2025-12-15,18:14,business,経済,8,プレジデントオンライン,"給料は増えないのに物価と住宅ローンは上がり続ける…高市首相の「強気な経済政策」が招く""最悪のシナリオ""",46,https://news.yahoo.co.jp/articles/60b8c06dec368f57f62a111430b469094a42e606,12/15(月) 9:15
2025-12-15,18:14,business,経済,9,毎日新聞,12月の日銀短観、大企業・製造業でプラス15　改善は3四半期連続,40,https://news.yahoo.co.jp/articles/e8ff7c1f656123f329e1b15551daa2c9dc480516,12/15(月) 8:58
2025-12-15,18:14,business,経済,10,TBS CROSS DIG with Bloomberg,中国EVメーカー、タイで大幅値引き攻勢-BYDセダンは最大38％引き,38,https://news.yahoo.co.jp/articles/4d64c56d9ac7191097876f5a75c75d5cad1107ab,12/15(月) 17:02
2025-12-15,18:14,business,経済,11,ロイター,フジＨＤ、33.3％まで株式買い増しと通知受領　村上氏の長女から,30,https://news.yahoo.co.jp/articles/c903d75e402c369d25b957298c0db0e3747ef612,12/15(月) 15:55
2025-12-15,18:14,business,経済,12,ファイナンシャルフィールド,日本は「平均年収478万円」と聞きましたが、私は30代で「360万円」です…正社員なのに“少なすぎ”ますか？ 平均が高すぎるのでしょうか？ 中央値もあわせて確認,29,https://news.yahoo.co.jp/articles/12c6197716fedd1d5d55de068dba065d37619900,12/15(月) 11:40
2025-12-15,18:14,business,経済,13,ファイナンシャルフィールド,50代後半、貯蓄は「100万円」です。“貯蓄ゼロ”で定年を迎える人はどれくらいいるのでしょうか？,28,https://news.yahoo.co.jp/articles/f762969835718b90f560bc1e6088d4279cbd254a,12/15(月) 17:20
2025-12-15,18:14,business,経済,14,Bloomberg,習主席、成長率の数字水増しする当局者を処罰と明言－人民日報,26,https://news.yahoo.co.jp/articles/ea374780487bbe6c76a136a4c4f273844334191a,12/15(月) 10:45
2025-12-15,18:14,business,経済,15,マネーポストWEB,《攻略法が発覚した？》パチスロ『L荒野のコトブキ飛行隊』が全国のホールで「稼働停止」騒動　出玉を左右する不具合の発覚が“今の時代では異例の事態”と言われる所以,24,https://news.yahoo.co.jp/articles/7f50a0cffcd502f5e4b650be8f998207028a2143,12/15(月) 16:16
2025-12-15,18:14,business,経済,16,東洋経済オンライン,「忘年会参加したくない」50代が多い“切実なワケ”　若者の飲み会離れはウソ？　参加意欲が低い世代、高い世代の意外な結果,23,https://news.yahoo.co.jp/articles/90c8de0e86bae78663d49ab9bf635f1c735b698a,12/15(月) 5:30
2025-12-15,18:14,business,経済,17,ファイナンシャルフィールド,会社の業績が悪化し「今年の冬のボーナスはゼロ」と社長が…。生活もあるのに、いきなり「ボーナスカット」は法的に問題ないの？,21,https://news.yahoo.co.jp/articles/9ff8599c47e16bedb44fa74682883c7e6f127395,12/15(月) 17:40
2025-12-15,18:14,business,経済,18,東洋経済オンライン,急増する飲食店の《セルフオーダー》、「サイゼリヤはOK」「客のリソースにタダ乗り」の声も…あり・なし論争の前に考えるべき“根本的な問題”,21,https://news.yahoo.co.jp/articles/6b1a411033f8a34399cd1d3de79a7e9ef381211d,12/15(月) 5:00
2025-12-15,18:14,business,経済,19,MotorFan,「2ドア×5速MTのクラウンなんて存在したのか!?」昭和最後の“異端児”を追う,21,https://news.yahoo.co.jp/articles/5b8440478ebb0cf7fe70a8b6ca1033047a2cc5a1,12/15(月) 17:00
2025-12-15,18:14,business,経済,20,文春オンライン,世界初「3Dプリンター駅舎」が和歌山に出現…見た目によらず“意外と頑丈”なその理由とは？,20,https://news.yahoo.co.jp/articles/da58f51827b462663b9e2983a5427e66c345bba7,12/15(月) 6:12
2025-12-15,18:14,business,経済,21,Bloomberg,中国、元自衛隊制服組トップの岩崎茂氏に制裁－資産凍結や入国禁止,20,https://news.yahoo.co.jp/articles/0fd0cf060a4cda1c8dd2788a0d97f62e2d0eb3f8,12/15(月) 14:49
2025-12-15,18:14,business,経済,22,マネーポストWEB,《政策金利が30年ぶりの高水準に》日銀利上げがもたらす株式市場への影響　株価には、逆風かと思いきや、利上げ局面だからこそ浮上する「勝ち組セクター」に注目する投資家も,20,https://news.yahoo.co.jp/articles/93bde0fc8bc8529faf13bc2bf313bf0eb3d527a8,12/15(月) 16:15
2025-12-15,18:14,business,経済,23,ファイナンシャルフィールド,返礼品ももらえるし、税金が安くなるならと「10万円近く」ふるさと納税したら、親に「それ損してない？」と言われました。どういうことでしょうか？,19,https://news.yahoo.co.jp/articles/097d6696389d5dcd979868305a1b5fea92e6f030,12/15(月) 13:50
2025-12-15,18:14,business,経済,24,TBS NEWS DIG Powered by JNN,メガソーラー 2027年度以降の新規事業への支援廃止へ　環境破壊や安全性に対する地域の懸念など背景か,16,https://news.yahoo.co.jp/articles/0ed33b75195e670946327ef20e3b0a4b668023f2,12/15(月) 16:55
2025-12-15,18:14,business,経済,25,Bloomberg,高市首相、輸入の太陽光パネルでなくペロブスカイト電池の普及を促進,15,https://news.yahoo.co.jp/articles/402bb699c52fcb7f555ff723a00864debe748c3c,12/15(月) 14:41
2025-12-15,18:14,business,経済,26,ベストカーWeb,え、ガソリンスタンドで給油中のスマホ操作はなんでダメなの！　電子タバコも言語道断！,15,https://news.yahoo.co.jp/articles/52b848ccd62c65d5309f27710de6f86c6e9084a2,12/15(月) 11:30
2025-12-15,18:14,business,経済,27,THE GOLD ONLINE（ゴールドオンライン）,【過去20年で最悪水準】全国の病院の6割超、本業が赤字──医療材料費・人件費急騰で「増収減益」固定化、診療停止も相次ぎ、地域医療は崩壊寸前に,15,https://news.yahoo.co.jp/articles/a3fdb27329bfaf3f89ff10a66b8acca855f95582,12/15(月) 5:00
2025-12-15,18:14,business,経済,28,共同通信,政府が新規のメガソーラー支援廃止へ,14,https://news.yahoo.co.jp/articles/d70776a408ca92059e08ce2e180331d8148d7a41,12/15(月) 9:53
2025-12-15,18:14,business,経済,29,ファイナンシャルフィールド,都内の家賃が高く、月15万円の年金暮らしには厳しい…都営住宅に引っ越したら23区内でも月3万円以内で暮らせるって本当？,13,https://news.yahoo.co.jp/articles/5742999c26f7d15b5c60ed11ff900f845a4f992b,12/15(月) 13:10
2025-12-15,18:14,business,経済,30,ロイター,為替は様々な要因を背景に市場において決まるもの＝高市首相,13,https://news.yahoo.co.jp/articles/7f7a2c6f2a8e157a4fe0effba1930f038f4923e8,12/15(月) 10:54
2025-12-15,18:14,business,経済,31,ファイナンシャルフィールド,父が“年金開始直前”に急逝… 40年間支払った国民年金保険料「約800万円」と厚生年金保険料は1円も返ってこないの？,13,https://news.yahoo.co.jp/articles/a264b8024b51a91f8a02796b6a6396a9cf676648,12/15(月) 8:10
2025-12-15,18:14,business,経済,32,鉄道コム,JR東、ホーム上での危険な「録音」「撮影」行為に注意喚起　12月16日からポスター掲出,12,https://news.yahoo.co.jp/articles/b40429ec60f55cc07c67970aa3a361f4bd30c5d3,12/15(月) 14:21
2025-12-15,18:14,business,経済,33,Bloomberg,高市首相、財政の持続可能性に十分配慮－金利・為替は市場動向を注視,12,https://news.yahoo.co.jp/articles/d5be3b8930acf36fd3464c4ce55952e5c1e6dc5c,12/15(月) 13:10
2025-12-15,18:14,business,経済,34,THE GOLD ONLINE（ゴールドオンライン）,月収25万円・営業事務の29歳男性…「奨学金280万円」を背負ってまで「専門学校」に行ったワケ,12,https://news.yahoo.co.jp/articles/fa56d5311cef4d7582dcec6bbd4249b55fb3f31f,12/15(月) 13:30
2025-12-15,18:14,business,経済,35,Yahoo!ニュース オリジナル THE PAGE,【ヤフコメで話題】「減税の恩恵が限定的との声」「社会保険料や税負担の見直しを求める意見」 - 減税政策の実効性と課題に注目集まる,12,https://news.yahoo.co.jp/articles/9fb501e6bfa33ed24d16693c45b389e592df7bfe,12/15(月) 14:09
2025-12-15,18:14,business,経済,36,トラベルボイス,米国のSNS提出義務化案に、旅行業界団体が反発、旅行者離れを招くとの指摘相次ぐ,12,https://news.yahoo.co.jp/articles/f8772c831c717d6035a4030df9bec98557e2579a,12/15(月) 13:30
2025-12-15,18:14,business,経済,37,Yahoo!ニュース オリジナル THE PAGE,【ヤフコメで話題】「家賃の上昇が生活を圧迫」「狭小住宅は合理的選択なのか」 - 都市部の家賃高騰と若者の住環境に注目集まる,12,https://news.yahoo.co.jp/articles/928409efbedf3dc6298ffb5d78aa8cfc7dc3928b,12/15(月) 11:08
2025-12-15,18:14,business,経済,38,日テレNEWS NNN,日銀短観、3期連続で改善“利上げ判断後押し”,11,https://news.yahoo.co.jp/articles/8571a7db9e11f5cd1cfbae4c019e17a3211d05b8,12/15(月) 17:26
2025-12-15,18:14,business,経済,39,プレジデントオンライン,"「金利5%定期預金」はゴロゴロある…お金のプロが「知らないと損をする」という""高金利のカラクリ""",11,https://news.yahoo.co.jp/articles/e073d04b147847af86f7781aea355379115ab7b1,12/15(月) 8:15
2025-12-15,18:14,business,経済,40,ファイナンシャルフィールド,ふるさと納税の返礼品で「熱気球に乗ってきた」というママ友がいました。調べると寄付金額「50万円」…。年収1000万円以上ということでしょうか？,11,https://news.yahoo.co.jp/articles/beecbecf3c0e1e8f0815528cba33161cb6919536,12/15(月) 11:33
