scrp_date,scrp_time,genre_en,genre_jp,rank,media_jp,title,comment,link,date_original
2024-03-18,17:22,business,経済,1,TBS NEWS DIG Powered by JNN,日経平均終値3万9740円、1032円↑　今年2番目の上げ幅,225,https://news.yahoo.co.jp/articles/bf183486c33ef21884830c95922f378b33887a70,3/18(月) 15:04
2024-03-18,17:22,business,経済,2,47NEWS,バブルの象徴、狂乱のディスコ「ジュリアナ東京」跡地はどうなった？　かつての倉庫街に押し寄せる巨額の投資マネー,153,https://news.yahoo.co.jp/articles/f1713921237a0e412715223b43ecd12486c28fc7,3/18(月) 11:02
2024-03-18,17:22,business,経済,3,TBS NEWS DIG Powered by JNN,【速報】日経平均1000円以上値上がり、終値3万9740円 今年2番目の上げ幅,151,https://news.yahoo.co.jp/articles/449d83b1af89c3da8817a04056dcf41f87a50f0b,3/18(月) 14:55
2024-03-18,17:22,business,経済,4,現代ビジネス,なぜ「日本の若者」は「結婚」しなくなったのか、この国の想像以上に「厳しすぎる現実」,132,https://news.yahoo.co.jp/articles/c05be3a5ed60352e7986d61df8f5c60d0f3c20c2,3/18(月) 6:48
2024-03-18,17:22,business,経済,5,マネーポストWEB,【がん闘病】経済アナリスト・森永卓郎さんが「標準治療」から「月150万円の自由診療」への切り替えを決意した理由,75,https://news.yahoo.co.jp/articles/b45a3062bc4908eb38c8fb5e73817de97d154bc8,3/18(月) 15:15
2024-03-18,17:22,business,経済,6,読売新聞オンライン,日経平均、一時９００円超の上昇…午前の終値は８１３円高の３万９５２１円,52,https://news.yahoo.co.jp/articles/1bf8e226e0247b08c0ec6662eace1dce46063013,3/18(月) 9:18
2024-03-18,17:22,business,経済,7,くるまのニュース,超有名な日産「R34GT-R」が盗難!? 約3週間後に「無事発見！」 輸出間際の「コンテナ」で発見、盗難からの経緯とは,48,https://news.yahoo.co.jp/articles/7d7593f91c1373b56ba15a19fcae0e88e795dca4,3/18(月) 16:10
2024-03-18,17:22,business,経済,8,東洋経済オンライン,日経平均は「マイナス金利解除」後にどうなる？ 異次元緩和は終わっても、この異次元相場はまだ続く,43,https://news.yahoo.co.jp/articles/0f7796d2e566d58ca0999571d1022ea01976f652,3/18(月) 7:32
2024-03-18,17:22,business,経済,9,産経新聞,島根から百貨店が消えた日　65年の歴史に幕　一畑百貨店閉店で地元の嘆き　百貨店「ゼロ県」に,42,https://news.yahoo.co.jp/articles/9f8335d8e57e49fa101d907b0482217397e3d829,3/18(月) 7:00
2024-03-18,17:22,business,経済,10,共同通信,東証大幅反発、一時900円超高　午前終値は3万9521円,40,https://news.yahoo.co.jp/articles/1d3e84e2a529fe42b26dd87da7d49544c3f76491,3/18(月) 9:25
2024-03-18,17:22,business,経済,11,くるまのニュース,狭い駐車場どうすれば？ クルマぶつけるトラブル続出⁉ 「ドアパンチ」の対処法は？,37,https://news.yahoo.co.jp/articles/5b456a05b75d3283bcf871c506bcf79362809d0f,3/18(月) 14:10
2024-03-18,17:22,business,経済,12,ITmedia ビジネスオンライン,高級寿司と回転寿司は何が違うのか　同じ魚なのに“味に違い”があるワケ,32,https://news.yahoo.co.jp/articles/18055da5b35cbc31069084c4a3f907def39f62fb,3/18(月) 5:35
2024-03-18,17:22,business,経済,13,THE GOLD ONLINE（ゴールドオンライン）,年金の支給開始年齢が65歳→70歳に引き上げ!?…日本の年金制度にささやかれる“恐怖の改定案”【メガバンク出身のコンサルタントが解説】,30,https://news.yahoo.co.jp/articles/ec485ed78c53dbdcfda66db0ca6e174b3c4b22b0,3/18(月) 11:02
2024-03-18,17:22,business,経済,14,Bloomberg,ソニーＧが「ＰＳＶＲ２」の生産休止、在庫積み上がる－関係者,29,https://news.yahoo.co.jp/articles/875b7a939b12b9017bc72a2ff6f73b9791c61431,3/18(月) 10:56
2024-03-18,17:22,business,経済,15,AMP［アンプ］,誰かとの食事中、スマホを触って注意された経験がある人は約半数　そのうち7割以上の人が注意されて「不快に感じた」,28,https://news.yahoo.co.jp/articles/9f0fe846de91e8999a29764baa3bd627e46a6f54,3/18(月) 14:36
2024-03-18,17:22,business,経済,16,東洋経済オンライン,中国の空飛ぶクルマ「100km超のデモ飛行」に成功 オートフライト、商用運航の実現へ一歩前進,27,https://news.yahoo.co.jp/articles/282bebe27276afc21bec21da0eb2996e0dbd3719,3/18(月) 16:02
2024-03-18,17:22,business,経済,17,ファイナンシャルフィールド,共働きで世帯年収は500万円です。夫が「子どもが生まれるからヴェルファイアの新車を買いたい」と言っていますが、家計的に厳しいですよね？ 実際どうなんでしょうか…？,26,https://news.yahoo.co.jp/articles/f2ad86b18a564b112def3e1709522d696ecf6772,3/18(月) 11:21
2024-03-18,17:22,business,経済,18,乗りものニュース,「あの飛行機、タイヤがむき出し…」一体なぜ？ 普通はあるカバーを“わざわざ廃した”メリットとは,25,https://news.yahoo.co.jp/articles/8ff04b0c2c122c03df6660a2eb8b3041c2597c30,3/18(月) 16:12
2024-03-18,17:22,business,経済,19,マネーポストWEB,【パチンコホールの広告宣伝に新基準】来店イベント告知は可能でも「公約」「ステマ」は禁止に　ルール緩和と健全化で来店増となるか,25,https://news.yahoo.co.jp/articles/aa850a6e45d4fddcfd294f66baf03be3cad4629b,3/18(月) 15:15
2024-03-18,17:22,business,経済,20,現代ビジネス,先進国のなかで“安すぎる”日本の人件費…台湾メーカー「TSMC」工場の熊本進出で露呈した、日本のヤバさ,24,https://news.yahoo.co.jp/articles/3bfccef90dd5ab8130ccc5ae1fcbc2f101e9e631,3/18(月) 7:03
2024-03-18,17:22,business,経済,21,マネーポストWEB,【中学受験に異変】最難関校・筑駒で「繰り上げ合格」増加はなぜ？　御三家から中堅校まで「玉突き状態」に,22,https://news.yahoo.co.jp/articles/13c4d041b94751f892cb49c05b1048201c00663c,3/18(月) 16:12
2024-03-18,17:22,business,経済,22,乗りものニュース,「日本と韓国、助けて！」アメリカ海軍長官が直談判しに来たワケ 大ピンチの「造船」 強すぎる中国,22,https://news.yahoo.co.jp/articles/012bcc4005cb281f0c9559c5f55f32f3df59bb74,3/18(月) 7:42
2024-03-18,17:22,business,経済,23,Merkmal,総額1100億円！ JR北海道に国交省「監督命令」 財政支援“3年延長”に未来はあるのか？,21,https://news.yahoo.co.jp/articles/62b13a712b5b38e6d37017dfc64ae6d6f0722b5b,3/18(月) 14:11
2024-03-18,17:22,business,経済,24,WEB CARTOP,「キーを捻れば」「ボタンを押せば」エンジンがかかるのはイマドキの話！　昔のクルマ好きなら誰もが引いた「チョーク」とは,21,https://news.yahoo.co.jp/articles/92282048e6ae2b6e8de9b9ae3a1714ee3d7934db,3/18(月) 11:51
2024-03-18,17:22,business,経済,25,J-CASTニュース,日本で普及しないEVは米国でも販売失速、「アップル開発撤退」報道　電気自動車がクリアすべき問題点,20,https://news.yahoo.co.jp/articles/368c65e2e3e5fc95fcd367f5bbac85da15681611,3/17(日) 20:00
2024-03-18,17:22,business,経済,26,読売新聞オンライン,新幹線延伸で関西・名古屋から北陸へは「敦賀乗り換え」必要に…専門家「高速バスに流れる恐れも」,20,https://news.yahoo.co.jp/articles/0803f329c346415d8ece22749343976a3b32c803,3/17(日) 18:00
2024-03-18,17:22,business,経済,27,くるまのニュース,事業化お預け「北千葉道路」最後の1区間「東松戸～鎌ヶ谷」どうなる!? 外環道～成田空港直結の高速道路 今どこまで進んでいるのか,18,https://news.yahoo.co.jp/articles/9cc0818f0311bbd78dd4d842ae219e1b587b0e69,3/18(月) 16:40
2024-03-18,17:22,business,経済,28,みんかぶマガジン,4万円突破に米有力紙が大激怒「日経平均は欠陥のある指標だ」ユニクロがトヨタの10倍の影響力行使“日本株はまだ市場最高値を更新していない”,18,https://news.yahoo.co.jp/articles/4d25044dbcfcab737da6b5c499ef516689da386b,3/18(月) 9:10
2024-03-18,17:22,business,経済,29,共同通信,日銀、19日に利上げ決定　マイナス金利政策、8年で解除,17,https://news.yahoo.co.jp/articles/360cbe2d72ca5af0a5b8769c4ad615057934a111,3/18(月) 16:19
2024-03-18,17:22,business,経済,30,ファイナンシャルフィールド,30代で「クレカ」を持ってないってヤバいですか？ 現金主義なので作ったことがないのですが、ある程度の年齢になったら作るべきでしょうか…？,17,https://news.yahoo.co.jp/articles/dfb02d0fd063de8f309ed743dc3a3ec773a99a33,3/18(月) 13:40
2024-03-18,17:22,business,経済,31,現代ビジネス,財政緊縮派が日本の「教育」をめちゃくちゃにした…世界の「豊かさランキング」が示す「わが国の失敗」,17,https://news.yahoo.co.jp/articles/340e9ef45d6df8851405d9209b0fad0b9086f0a4,3/18(月) 7:19
2024-03-18,17:22,business,経済,32,CHANTO WEB,「世界の山ちゃん」創業者が急逝。元教師で専業主婦だった妻が後継者への決意をするまで,17,https://news.yahoo.co.jp/articles/7a3ec0d70c29b3b7274ac02553a14ba2a95d5d12,3/18(月) 6:46
2024-03-18,17:22,business,経済,33,Merkmal,リベラルもEVも大っ嫌い！ トランプが当選すれば、EVはむしろ米国外で独自進化を遂げ、爆発普及するかもしれない,16,https://news.yahoo.co.jp/articles/95e8a5fdb7f8e9bf37c3f3ae789e30d896f8518b,3/18(月) 11:51
2024-03-18,17:22,business,経済,34,日刊ゲンダイDIGITAL,自民党「2024運動方針」と岸田首相答弁のショボすぎる共通点は…「具体的な中身ゼロ」なこと,15,https://news.yahoo.co.jp/articles/dbe9f764b5be151a77ad15cbd1f3a9b615746267,3/18(月) 14:26
2024-03-18,17:22,business,経済,35,テレビ朝日系（ANN）,“マイナス金利解除”近付く　住宅ローン金利上昇？「かなり不安」　ポジティブ面は…,14,https://news.yahoo.co.jp/articles/8b48286e68ba821fb2b15a187e20a05379cac4dd,3/18(月) 11:36
2024-03-18,17:22,business,経済,36,Bloomberg,中国、スイスが計画するウクライナ和平会議への参加を検討－報道,14,https://news.yahoo.co.jp/articles/1b460a1c27652c842e116b05c5f85ab14c6e40b2,3/18(月) 15:45
2024-03-18,17:22,business,経済,37,乗りものニュース,JR北海道の廃線が加速か？ 「次の3年間が最後の機会」 国も確実な成果を求める,14,https://news.yahoo.co.jp/articles/460203f9be7b85fec65817006a80c8ce2a530a05,3/18(月) 7:12
2024-03-18,17:22,business,経済,38,ベストカーWeb,「稼げる職業」から一気に転落……トラックドライバー不足の2024年問題はなぜ起きる?? ほかの輸送機関に変えることはできるのか!!,13,https://news.yahoo.co.jp/articles/2718d7784e2527e4b700a48774540b8e7af042e2,3/18(月) 9:00
2024-03-18,17:22,business,経済,39,ベストカーWeb,いくらGT-Rでも3000万はちょっとねぇ……!! そこまでして買う価値あるの? 「宿敵」ポルシェ911ターボも届く強気価格のなぜ,13,https://news.yahoo.co.jp/articles/c9eb0ab92c302dce9c298a3c83058efeb10a87fb,3/18(月) 7:00
2024-03-18,17:22,business,経済,40,WEB CARTOP,最近Aピラーが寝かされたかっこいいクルマが多い分なおさら悩ましい……フロントガラスの内側の先端はどうキレイにするのが正解？,13,https://news.yahoo.co.jp/articles/4824ff544e8c597e5c42b47c29234829c81edc16,3/18(月) 10:10
