scrp_date,scrp_time,genre_en,genre_jp,rank,media_jp,title,comment,link,date_original
2025-01-15,10:34,sports,スポーツ,1,日刊ゲンダイDIGITAL,佐々木朗希いったい何様？ ロッテ球団スタッフ3人引き抜きメジャー帯同の波紋,109,https://news.yahoo.co.jp/articles/ee197ac818ec876373b8382a245e665cf5e59dc9,1/14(火) 11:12
2025-01-15,10:34,sports,スポーツ,2,RONSPO,井上尚弥戦を2度中止のグッドマンに仰天情報？！「1億5700万円のファイトマネーを当てにして家を購入していたがショックで一度は引退を考える」…豪州メディア報道,104,https://news.yahoo.co.jp/articles/033067ec6a53bdd91d520083e8192e66df19ca7f,1/15(水) 6:31
2025-01-15,10:34,sports,スポーツ,3,webスポルティーバ,広岡達朗が語る村上宗隆と清宮幸太郎への期待と不安 「打率２割４分台でメジャー挑戦なんて馬鹿げている」「監督が新庄じゃなかったら...」,56,https://news.yahoo.co.jp/articles/f8e5cad3db643b306bd6702d893fc752cade763c,1/15(水) 7:05
2025-01-15,10:34,sports,スポーツ,4,THE DIGEST,「もし事実なら、ササキは即座に球界最大の悪役になる」去就大詰めの佐々木朗希、米記者が懸念「反ドジャースの感情が爆発するだろう」,53,https://news.yahoo.co.jp/articles/612be6fef61202bbc87bbc6bf99e912dda2aefe5,1/15(水) 5:00
2025-01-15,10:34,sports,スポーツ,5,ゴルフのニュース,“出禁”はもちろん警察への通報も辞さず… ゴルフ場が断固としたカスハラ対策に乗り出す事情　従業員の日常生活に影響も,49,https://news.yahoo.co.jp/articles/a5ac45d076e74389e277c417434836c2e80addd6,1/15(水) 9:10
2025-01-15,10:34,sports,スポーツ,6,現代ビジネス,日ハム「エスコンフィールド」は野球場の中で異次元…業績を左右する野球ファン「以外」の存在,39,https://news.yahoo.co.jp/articles/0004638e8b3d34d39fc0e4f04db40392e418c5e0,1/15(水) 8:04
2025-01-15,10:34,sports,スポーツ,7,東スポWEB,久保建英がビッグクラブ移籍できない理由　選手代理人は「日本代表が最大の要因」と指摘,39,https://news.yahoo.co.jp/articles/331520e9a7688e21a11d1786f02847d95ce58e2b,1/15(水) 5:16
2025-01-15,10:34,sports,スポーツ,8,ENCOUNT,皇治、意外な大物俳優と飲み友　銀座で一晩「400万円」の豪遊ぶりにスタジオ騒然,36,https://news.yahoo.co.jp/articles/a8fdb661cb9d6b91f1f14ffa4b2d978a88068efb,1/15(水) 8:05
2025-01-15,10:34,sports,スポーツ,9,デイリースポーツ,佐々木朗希、ドジャースときょう2度目の面談　最終候補3球団　米報道　大谷翔平、山本由伸と豪華日本人先発トリオ誕生なるか,36,https://news.yahoo.co.jp/articles/0e9949e4b1794a6e7b389a2ae88b166da81800b6,1/15(水) 6:38
2025-01-15,10:34,sports,スポーツ,10,スポーツ報知,偏差値７１桐朋の二刀流・森井翔太郎がアスレチックス入り決断　ＮＰＢ新人超え契約金２億４０００万円,36,https://news.yahoo.co.jp/articles/f249672682de7f0be1be80ec035f3299f1af2ecf,1/15(水) 5:00
2025-01-15,10:34,sports,スポーツ,11,Full-Count,巨人加入の田中将大は「上がれない可能性も」　恩師が指摘…危惧される“起用パターン”,34,https://news.yahoo.co.jp/articles/9dbf971d0461c5cf4ea4e472bdeb3a6d3033fef3,1/15(水) 7:20
2025-01-15,10:34,sports,スポーツ,12,ゴング格闘技,【BreakingDown】ポーランドの刺客が“ビンタ対決”に警鐘「どこの国でも禁止にされるべき」「ポーランドでは――」自身はプロボクサー目指し今週プロテスト,33,https://news.yahoo.co.jp/articles/9c9280e46d9f557de0392a5bf7bf7d79ef5ffdfb,1/15(水) 6:40
2025-01-15,10:34,sports,スポーツ,13,東スポWEB,【新日本】ライガーがドーム２連戦を総括「大舞台を経験した海野翔太は大化けするぜって思えるね」,27,https://news.yahoo.co.jp/articles/2c55e31834c7e4651e80e0fb8a5af0e2207cf2bf,1/15(水) 6:16
2025-01-15,10:34,sports,スポーツ,14,CoCoKARAnext,2度目交渉でドジャース入り加速か　佐々木朗希“争奪戦”で「最終決定権を得る」米記者報道,27,https://news.yahoo.co.jp/articles/a7ea01b6df235c97c412c4dc00260307fd210c3b,1/15(水) 9:11
2025-01-15,10:34,sports,スポーツ,15,日刊ゲンダイDIGITAL,巨人・戸郷翔征「メジャー移籍2年計画」…今季は最多勝&沢村賞→26年WBC活躍でスカウトに売り込み,26,https://news.yahoo.co.jp/articles/822a89f42314df73f0cb256cf6abd3ae91161114,1/15(水) 9:06
2025-01-15,10:34,sports,スポーツ,16,スポニチアネックス,綱取りの両大関が明暗！豊昇龍、圧勝で3連勝　琴桜は翔猿に苦杯…早くも2敗目,26,https://news.yahoo.co.jp/articles/9b619aa27f8814c556aad1f090719c0dc0e4a802,1/14(火) 17:58
2025-01-15,10:34,sports,スポーツ,17,スポニチアネックス,亀田和毅が素直な感想ぶつける「井上尚弥チャンピオンはもったいない」「やるレベルやないわな」,25,https://news.yahoo.co.jp/articles/16d686a7f7afcc79e14c1deb91d03ef5a4f80077,1/14(火) 16:59
2025-01-15,10:34,sports,スポーツ,18,週刊女性PRIME,佐々木朗希の移籍待ちで“渋滞”か、ポスティング期限迫るも「進展なし」煽りを食う“2選手の去就”,24,https://news.yahoo.co.jp/articles/d0e31885f0b819ae1a8ef919eef5374561b312bd,1/15(水) 7:17
2025-01-15,10:34,sports,スポーツ,19,SOCCER DIGEST Web,日本で101戦89発のブラジル人FWが驚きの中国代表入りか。同国メディアも期待「帰化する可能性が高い」,24,https://news.yahoo.co.jp/articles/5c2e1105c44621bdf15482a2591d9493e8ce8ccd,1/15(水) 6:04
2025-01-15,10:34,sports,スポーツ,20,スポニチアネックス,「記事には出てないんですけど…」“韓国の逸材”キム・ヘソンがドジャース、背番号「6」を選んだ理由,23,https://news.yahoo.co.jp/articles/9f6c5376da6d0bf0d78d1cb82cfd68d558728fb3,1/15(水) 9:09
2025-01-15,10:34,sports,スポーツ,21,J-CASTニュース,日本はなぜ「韓国のイチロー」への関心が高い？　父は中日でプレーした名選手...韓国メディア分析,22,https://news.yahoo.co.jp/articles/86975a83558b46ae711bc0e3f9ea6a34f6bdb366,1/14(火) 17:44
2025-01-15,10:34,sports,スポーツ,22,産経新聞,青柳のメジャー挑戦に暗雲　マイナー契約→自由契約なら「有原式FA」の最短記録更新も　「鬼筆」越後屋のトラ漫遊記,21,https://news.yahoo.co.jp/articles/f6a2f240a1d9462e8d3f19452fc8d533ac95db9f,1/14(火) 11:33
2025-01-15,10:34,sports,スポーツ,23,FOOTBALL ZONE,退場＆PK判定が誤審「お前、間違っているぞ」　精神崩壊…恐怖で「最寄り駅にも行けない」帰路【インタビュー】,20,https://news.yahoo.co.jp/articles/0ecd8e642b932a7fa438027b208e7a95099a289b,1/15(水) 6:50
2025-01-15,10:34,sports,スポーツ,24,THE ANSWER,「太田と若林がケンカしてます！」　箱根駅伝の11日前、青学大の食堂で2人が譲れなかった男性の存在【前編】,20,https://news.yahoo.co.jp/articles/38e46d16a3d704af24c49f1a47eb6aa5a836b68b,1/15(水) 6:43
2025-01-15,10:34,sports,スポーツ,25,CoCoKARAnext,レッドブル入りで重圧を背負うローソン　新シーズンの戦いを米メディアも危惧「ツノダは準備が整っている」,20,https://news.yahoo.co.jp/articles/00b3b45d1c8296c83c9171abfb8ada392a031ca9,1/15(水) 6:31
2025-01-15,10:34,sports,スポーツ,26,週刊女性PRIME,日大アメフト部が「有志の会」で再出発と脱薬物も、大学が答えた新部創設の可能性,18,https://news.yahoo.co.jp/articles/a2b16153f9826ceb1a4b0394ff88eda73b0d8bde,1/15(水) 10:02
2025-01-15,10:34,sports,スポーツ,27,ＡＦＰ＝時事,ラケットとカメラ破壊のメドベ、多額の罰金の恐れ 全豪OP,17,https://news.yahoo.co.jp/articles/536a9e39fd405d0382643eaa3cf0421d1fa57e4f,1/15(水) 9:55
2025-01-15,10:34,sports,スポーツ,28,netkeiba,三冠馬コントレイル産駒が今夏いよいよデビュー 25年新種牡馬たちの評判は？,17,https://news.yahoo.co.jp/articles/e9b4c606eb77daf72f0041809edaf22de03d160c,1/15(水) 8:00
2025-01-15,10:34,sports,スポーツ,29,CoCoKARAnext,立浪中日の3年間とは何だったのか　腹心コーチが語る＂無念＂「これだけうまくいかないんだなということを…」,17,https://news.yahoo.co.jp/articles/eb1aed423e7127bb799998729093d492a9f440ff,1/15(水) 5:30
2025-01-15,10:34,sports,スポーツ,30,東スポWEB,1・31ジャイアント馬場没25年追善興行 チケット完売も…全日勢は不参加　木原アナ「オファーしたんですけど…」,16,https://news.yahoo.co.jp/articles/e213e2e2eba6768525be38de681d78609f2a4253,1/15(水) 6:16
2025-01-15,10:34,sports,スポーツ,31,Full-Count,スタメン免除“打診”も指揮官「2軍へ行ってこい」　遅かった猛省…甘さで失った居場所,16,https://news.yahoo.co.jp/articles/4307583bb30485afe7637c1021b0953f76a2a41b,1/15(水) 7:10
2025-01-15,10:34,sports,スポーツ,32,日刊ゲンダイDIGITAL,高校サッカーV前橋育英からJ入りゼロのなぜ？ 英プレミアの三笘薫が優良モデルケース,15,https://news.yahoo.co.jp/articles/cec06c7ff107d2e0d730f831b81b0391461a6060,1/15(水) 9:06
2025-01-15,10:34,sports,スポーツ,33,サンケイスポーツ,IBFとWBOが井上尚弥との試合をキャンセルしたグッドマンの指名挑戦権を維持させる予定だと豪州メディア報じる,15,https://news.yahoo.co.jp/articles/4f7e638bd0ff8d735866c47a2f1c6c0605332b59,1/14(火) 16:27
2025-01-15,10:34,sports,スポーツ,34,サンケイスポーツ,佐々木朗希、争奪戦はドジャース、パドレス、ブルージェイズの三つ巴に　24日早朝の交渉期限へ大詰め,15,https://news.yahoo.co.jp/articles/f92dd589b562354012aaf5f735a321031b0b53e7,1/14(火) 22:20
2025-01-15,10:34,sports,スポーツ,35,デイリースポーツ,ソフトバンク前監督　甲斐の巨人移籍の真相を語る「当然、残りたかったと思うんですよね」ＯＢも同調,15,https://news.yahoo.co.jp/articles/558ad45facfd664a2ed8a5f7435c59decc5a7bb7,1/14(火) 19:53
2025-01-15,10:34,sports,スポーツ,36,日刊ゲンダイDIGITAL,下半身醜聞の西武・源田壮亮 異例「不倫謝罪会見」のウラ…背に腹を変えられぬ球団事情,14,https://news.yahoo.co.jp/articles/4daae0525fbb97c40cb11a46299a6c1b14ea62e8,1/14(火) 11:12
2025-01-15,10:34,sports,スポーツ,37,SOCCER DIGEST Web,スロット采配ズバリ！首位リバプールが３位フォレストと１－１ドローで“ダブル”を回避、途中出場コンビがファーストプレーでアシスト＆ゴール！遠藤航は出番なし,14,https://news.yahoo.co.jp/articles/839608befe6dc7ee558a5433a88ee2e7bc1aa591,1/15(水) 6:55
2025-01-15,10:34,sports,スポーツ,38,スポーツ報知,那須川天心が世界主要４団体すべてで世界ランカーに　新たにＩＢＦ１４位にランクイン,14,https://news.yahoo.co.jp/articles/be84c7cfdb0d2a487f4eda04003e30517be8d161,1/14(火) 15:16
2025-01-15,10:34,sports,スポーツ,39,夕刊フジ,決勝PKでまさかの〝トラブル〟歴代最多観衆5万8347人の高校サッカー、日テレ生中継で肝心な場面がぶつ切り…ＳＮＳに苦情殺到,13,https://news.yahoo.co.jp/articles/3b0a8012b7900fbaae7cd03e56989d99713610bd,1/14(火) 17:00
2025-01-15,10:34,sports,スポーツ,40,CBCテレビ,「ヤバいほど仕上がっている」中日・木下拓哉選手が2025シーズンを予言！今年注目の飛躍するドラ選手とは？,13,https://news.yahoo.co.jp/articles/81a8d91d942d02dad294385b60ee45cea9fdb607,1/15(水) 6:10
