scrp_date,scrp_time,genre_en,genre_jp,rank,media_jp,title,comment,link,date_original
2025-10-25,15:10,sports,スポーツ,1,TBS NEWS DIG Powered by JNN,ドジャース初戦大敗…大谷翔平WS1号2ランも空砲、投手陣崩壊で3被弾11失点、佐々木朗希の出番なし,405,https://news.yahoo.co.jp/articles/79a9a677015e9dc8e20dbc0b2e19c1d2eb78045b,10/25(土) 12:27
2025-10-25,15:10,sports,スポーツ,2,Full-Count,大谷翔平へ「お前はいらない」の大合唱　打席で敵ファンが“痛烈コール”…WS1号も11失点大敗,398,https://news.yahoo.co.jp/articles/69d43b0db8fc2b520c39cc36d0ba600d8333a1d8,10/25(土) 12:24
2025-10-25,15:10,sports,スポーツ,3,デイリースポーツ,大谷翔平、WS初本塁打　2戦連発PS6号2ラン　敵地ブーイングしずめる　継投ミス大敗の展開から反撃の一発,258,https://news.yahoo.co.jp/articles/4ecd2d9e3ff85d778e99b3973b4b292e8ee27587,10/25(土) 11:45
2025-10-25,15:10,sports,スポーツ,4,デイリースポーツ,広島　磯村嘉孝、山足達也、韮沢雄也、名原典彦の４人に戦力外通告　プロ１５年目の磯村、今季わずか６試合出場にとどまる　名原は育成再契約へ,148,https://news.yahoo.co.jp/articles/764254e71048ef31c6b0a7e5382e10742ae639a0,10/25(土) 13:52
2025-10-25,15:10,sports,スポーツ,5,デイリースポーツ,ドジャースが悪夢の大量９失点　ロバーツ監督の継投失敗　無死満塁から投入のシーハン乱調→バンダが満塁弾被弾　スネルは５失点ＫＯ,133,https://news.yahoo.co.jp/articles/5064d35670fe948988887203be3d721283f3eb1e,10/25(土) 11:34
2025-10-25,15:10,sports,スポーツ,6,Full-Count,広島、磯村嘉孝ら4選手の戦力外を発表　現ドラ移籍の山足達也はわずか1年で通告,118,https://news.yahoo.co.jp/articles/207443e85280412286cb4762622abe08ae8fbdf2,10/25(土) 13:51
2025-10-25,15:10,sports,スポーツ,7,THE ANSWER,「なぜ先発のシーハンを出すのか」　WS初戦、大量失点招いたド軍ロバーツ采配に疑問符,99,https://news.yahoo.co.jp/articles/77c3866bb57e84236d72e32ea5184fd50264e719,10/25(土) 12:30
2025-10-25,15:10,sports,スポーツ,8,Full-Count,ロバーツ監督、乱調スネルに苦言「制球できてなかった」　まさかの5失点…11失点大敗に落胆,90,https://news.yahoo.co.jp/articles/88d47caf76e04e3eb53a9edc40507e0d1b1e3bab,10/25(土) 12:49
2025-10-25,15:10,sports,スポーツ,9,サンケイスポーツ,ドジャース〝弱点〟の救援陣が大炎上…ロバーツ監督、継投失敗　25歳右腕が走者全て生還→バンダ満塁弾　スネルの粘投フイ,78,https://news.yahoo.co.jp/articles/460e135b243f4ff7134a13bca6dc608dffb34e43,10/25(土) 11:40
2025-10-25,15:10,sports,スポーツ,10,Full-Count,ド軍、6回に悪夢の大量9失点　満塁＆2ラン被弾で2-11、スネルKOから相手打線止まらず,63,https://news.yahoo.co.jp/articles/9beb0a71ae1c3877fc03add3d5a5a95605cf382d,10/25(土) 11:33
2025-10-25,15:10,sports,スポーツ,11,スポニチアネックス,八村塁　豪快なアリウープダンクで吠えた！2本の3P含む今季最多23得点　レイカーズ今季初勝利,61,https://news.yahoo.co.jp/articles/1f921914aa1a9db71a66b16f39af1bcde85be3e0,10/25(土) 13:44
2025-10-25,15:10,sports,スポーツ,12,Full-Count,大谷翔平、WS初HR　松井秀喜以来の快挙、PS通算9号で日本人最多へあと1…反撃2ランに敵地騒然,61,https://news.yahoo.co.jp/articles/31dede652859fa95fc468282cdec4cc3bcfcc247,10/25(土) 11:45
2025-10-25,15:10,sports,スポーツ,13,Full-Count,ド軍、投壊11失点で黒星発進　大谷翔平は意地のWS初アーチも…6回の大量9失点が響く,59,https://news.yahoo.co.jp/articles/0ae5fb699ff33a5563ee4e2560be62e5a1e66c3d,10/25(土) 12:27
2025-10-25,15:10,sports,スポーツ,14,Full-Count,中日のドラフト戦略に疑問「見直すべきでは」　投手にも悪循環…OBが指摘した致命的な弱点,58,https://news.yahoo.co.jp/articles/d97b1056b2cb0c691a170f297bd6d3f69e31e148,10/25(土) 7:30
2025-10-25,15:10,sports,スポーツ,15,THE ANSWER,5失点炎上ド軍スネル「言い訳できない」　ベンチ裏で肩落とし…反省の言葉「本当に悔しい」,55,https://news.yahoo.co.jp/articles/ffad084259ec99fb96c99695830e449d41817a8e,10/25(土) 13:22
2025-10-25,15:10,sports,スポーツ,16,馬トク報知,未勝利戦で単勝１・１倍がまさかの掲示板外にＳＮＳ悲鳴「飛んで悲しすぎる」「雨が嫌だった？」,54,https://news.yahoo.co.jp/articles/218842e533755988aba78d57479fe7100bb8f5d3,10/25(土) 11:21
2025-10-25,15:10,sports,スポーツ,17,TBS NEWS DIG Powered by JNN,ド軍、投手陣大崩壊で6回悪夢の9失点...スネル6回途中で降板、シーハンが無死満塁踏ん張れず→バンダが満塁HR＆2ラン被弾,52,https://news.yahoo.co.jp/articles/45aeabf7c6e4210f7e01610460fbbb2b120b857b,10/25(土) 11:20
2025-10-25,15:10,sports,スポーツ,18,デイリースポーツ,ドジャース　スネルがまさかの同点２ラン被弾　六回途中５失点ＫＯでＰＳ初黒星　３戦３勝、防御率０・８６の絶対エースが,50,https://news.yahoo.co.jp/articles/b8f28d487a80162fc4abd432f62e417d443eebc5,10/25(土) 10:39
2025-10-25,15:10,sports,スポーツ,19,THE DIGEST,「なんでストライクになるの？」“フレーミング”技術の脅威に長谷川滋利氏も脱帽　ド軍ファン悲鳴…「大谷さんテオスカーが被害者か」,48,https://news.yahoo.co.jp/articles/0d5e57ceb1e75afc4f5047322f2ff9da772009aa,10/25(土) 11:59
2025-10-25,15:10,sports,スポーツ,20,中日スポーツ,巨人・大城卓三、メジャー挑戦の岡本和真、引退の長野久義への思いを語る,47,https://news.yahoo.co.jp/articles/4df6e061758835d3dc4a015017d559f6ca2c1d6e,10/25(土) 13:45
2025-10-25,15:10,sports,スポーツ,21,AERA DIGITAL,佐々木麟太郎がドラフト1位で競合の衝撃 　「DeNAはクジを外して良かった」との声も,47,https://news.yahoo.co.jp/articles/42869c63eb5490fcbfd1a08311794daad53f2c5c,10/24(金) 20:30
2025-10-25,15:10,sports,スポーツ,22,Full-Count,「もう終わったことだ」　大敗から切り替え強調も…ベッツが悔やんだ「試合の分かれ目」,46,https://news.yahoo.co.jp/articles/93334f3ea576bee7dd2e02d87e64ad4d99b701ca,10/25(土) 13:41
2025-10-25,15:10,sports,スポーツ,23,スポニチアネックス,スネル　本来の実力発揮できず5回0/3を5失点降板　リリーフ陣も崩れ6回に悪夢の大量9失点,45,https://news.yahoo.co.jp/articles/93924748e14d8293063a0e401770c3e6406dcbd1,10/25(土) 11:28
2025-10-25,15:10,sports,スポーツ,24,CoCoKARAnext,「単純に考えたら、力はある」防御率0.00男の新天地はいかに？阪神を戦力外となった29歳右腕を球界OBが考察「ヤクルトとか投手に苦しんでいるところとか面白い」,45,https://news.yahoo.co.jp/articles/a066f6e2ac72cb9413d9814b458976400417f3a8,10/25(土) 11:41
2025-10-25,15:10,sports,スポーツ,25,スポニチアネックス,【近畿大会】龍谷大平安が来春選抜厳しい見通し　京都1位も初戦敗退、川口監督の初聖地遠のく,44,https://news.yahoo.co.jp/articles/f15c76dbbd2089966c6c77c31fd36aa24886b645,10/25(土) 14:29
2025-10-25,15:10,sports,スポーツ,26,Full-Count,大谷翔平に飛んだ“衝撃のコール”　7点差9回2死なのに…敵地ファン絶叫の真相,44,https://news.yahoo.co.jp/articles/5f83882d7945cebf257e23dea600a268d2eeaa04,10/25(土) 14:19
2025-10-25,15:10,sports,スポーツ,27,スポーツ報知,スネル、同点の６回に無死満塁のピンチを招いて無念の降板→２番手シーハンが勝ち越し許す　バンダは悪夢の満塁被弾　６回は大量９失点,44,https://news.yahoo.co.jp/articles/985057d20a3e44e1009a5d93465fc7f936f81711,10/25(土) 11:17
2025-10-25,15:10,sports,スポーツ,28,THE ANSWER,大谷翔平へ「俺らに君は必要ない！」　敵地4万4353人が息の合ったヤジ…再燃した2年前の因縁,43,https://news.yahoo.co.jp/articles/12eb7388e88cce9935eab00572f8838c4aeada9c,10/25(土) 12:28
2025-10-25,15:10,sports,スポーツ,29,中日スポーツ,スネルどうした… ６回無死満塁のピンチ招き５失点降板、最後は特大ファウル→すっぽ抜け死球、代わったシーハンが打たれ勝ち越し許す,41,https://news.yahoo.co.jp/articles/4e1d99149f74869dc7d8dc90995e53b3ad586e51,10/25(土) 11:28
2025-10-25,15:10,sports,スポーツ,30,スポニチアネックス,広島・磯村、山足らに戦力外通告　磯村は現役引退を表明,41,https://news.yahoo.co.jp/articles/74d1e412325c9bd27c0f3f6b99d0bb21c503806d,10/25(土) 13:52
2025-10-25,15:10,sports,スポーツ,31,スポーツ報知,渋野日向子「なかなか流れを変えられなかった」　ダボ発進から巻き返せず　１オーバーでホールアウト,36,https://news.yahoo.co.jp/articles/bcf2773a9739706959df3ad6e30d5f109a599822,10/25(土) 13:48
2025-10-25,15:10,sports,スポーツ,32,THE DIGEST,「俺たちに大谷翔平なんて必要ない！」敵地で轟いたブルージェイズファンからの「いらない」大合唱　異様な雰囲気に米震撼,35,https://news.yahoo.co.jp/articles/f05af67cebc497081acacae9ab29978228596434,10/25(土) 13:34
2025-10-25,15:10,sports,スポーツ,33,サンケイスポーツ,浜村淳が大腸がんで入院と手術　MBSラジオ「ありがとう浜村淳です土曜日です」は森たけしが代演,35,https://news.yahoo.co.jp/articles/10b1ed1c9339d076890b6990a85c69db19113bc7,10/25(土) 11:17
2025-10-25,15:10,sports,スポーツ,34,中日スポーツ,大谷翔平、ワールドシリーズ１号！ 松井秀喜以来の日本選手２人目、９点ビハインドから意地の一撃,34,https://news.yahoo.co.jp/articles/428d6a8d9d0b6e79e60830748765b60242a3da8d,10/25(土) 11:47
2025-10-25,15:10,sports,スポーツ,35,中日スポーツ,大谷翔平に「お前はいらない」大合唱… 2023年に移籍実現せず、ブルージェイズファン容赦ない洗礼,34,https://news.yahoo.co.jp/articles/95c4f13fa8584e2ab81a3633dac0ae3f41f207cc,10/25(土) 12:40
2025-10-25,15:10,sports,スポーツ,36,中日スポーツ,中日、森野将彦打撃・作戦コーチが退団,34,https://news.yahoo.co.jp/articles/e7bfb3860779058e2ef14e81cd8613fce9e13623,10/25(土) 9:57
2025-10-25,15:10,sports,スポーツ,37,デイリースポーツ,飯田将成が呆然「キレるより笑える」対戦相手が１３キロ体重超過　ＢＤ欠場騒動からの復帰戦、８５キロ契約で「相手９８キロなんだけど、、、」,34,https://news.yahoo.co.jp/articles/e498d005d8e9ffb4ea6554869e7f3d28e5ae79cc,10/25(土) 12:57
2025-10-25,15:10,sports,スポーツ,38,日テレNEWS NNN,【広島】4選手と来季の契約を結ばず　現役ドラフトで加入の山足達也はわずか1年で...　名原典彦は育成選手での再契約を予定,33,https://news.yahoo.co.jp/articles/926cb7877fe1dcafee1d316aa19ff25fc5370d9d,10/25(土) 14:38
2025-10-25,15:10,sports,スポーツ,39,RONSPO,角田裕毅が「かなり満足な内容」でメキシコGPのFP2で7番手でも英メディアが「彼の将来に悪い兆候」と悲観的に報じた理由とは？,32,https://news.yahoo.co.jp/articles/532d911bc610b04982ee85aef820947f96bfc2bc,10/25(土) 12:24
2025-10-25,15:10,sports,スポーツ,40,高校野球ドットコム,聖隷クリストファーがコールド負け…全試合完投の超高校級左腕は6回10失点で東海3枠目も厳しい立場に【東海大会】,32,https://news.yahoo.co.jp/articles/fd2c45f2ecd0a39ac5c4c1993642b9e92e34b5db,10/25(土) 11:59
