scrp_date,scrp_time,genre_en,genre_jp,rank,media_jp,title,comment,link,date_original
2025-12-10,07:08,TTL,総合,1,共同通信,前橋市、ホテル面会の職員を停職　54歳副参事、今月末で依願退職,301,https://news.yahoo.co.jp/articles/03a1131dccf429a3c82969448cde5bd41e97768d,12/9(火) 17:05
2025-12-10,07:08,TTL,総合,2,ABEMA TIMES,「私がJAグループに何か利益誘導するということは全くありません」“おこめ券”めぐり鈴木農水大臣が“JA救済”をきっぱりと否定,247,https://news.yahoo.co.jp/articles/72592b6068cdea5e25efb00003b28e19df79f135,12/9(火) 13:18
2025-12-10,07:08,TTL,総合,3,共同通信,「日本のレーダーも感知」と中国メディア,214,https://news.yahoo.co.jp/articles/f70fec4558270f88f26109e055e3c1af4c9ddaad,12/9(火) 21:46
2025-12-10,07:08,TTL,総合,4,SmartFLASH,相次ぐ中国公演中止に「補償が先」世界的DJ、高市首相の「海外支援の強化」発言に異論「失敗の穴埋めに税金を使うな」,205,https://news.yahoo.co.jp/articles/87eef7ac930ccf1e2e13e3c24e2c56649ae87556,12/9(火) 19:06
2025-12-10,07:08,TTL,総合,5,女性自身,「何を言っているのだ」ネット冷笑　おこめ券騒動の鈴木農水大臣“コメ価格維持の考えナシ”に批判殺到,202,https://news.yahoo.co.jp/articles/a3aab6800582c0684ea0e62b8947e29c706bced6,12/10(水) 6:00
2025-12-10,07:08,TTL,総合,6,デイリー新潮,「お米券は絶対に配らない」　高市総理の経済対策に大阪・交野市長が真っ向から反論　識者も「1袋5キロのコメも買えないから、意味がない」,184,https://news.yahoo.co.jp/articles/a20c9911b0764ae62f2ae54ed9aaddd6027344f1,12/10(水) 5:51
2025-12-10,07:08,TTL,総合,7,デイリースポーツ,【高市自民】まさか衝撃事態　中国軍が小泉大臣に反論「反論余地ない証拠」と軍事音声データをＸ公開　中国空母が無線で訓練通告→日本が「了解」　事前に訓練連絡したと　レーダー照射問題で激突,162,https://news.yahoo.co.jp/articles/2c0f97156517b1fb0672a5c121a8479359d23692,12/9(火) 23:25
2025-12-10,07:08,TTL,総合,8,共同通信,米価維持の意図「一切ない」　おこめ券で鈴木農相,155,https://news.yahoo.co.jp/articles/294fb3f9295f4992b851a3fcdce002071dc6068b,12/9(火) 10:51
2025-12-10,07:08,TTL,総合,9,文春オンライン,前中国大使が高市首相に渾身の緊急提言「数年単位の冷却化は避けられない。これを機に対中戦略を……」,142,https://news.yahoo.co.jp/articles/a44ec118237e8b829494618e9c4d386792ecb292,12/10(水) 6:12
2025-12-10,07:08,TTL,総合,10,女性自身,「事前の報告はなかった」京都の名門私立高　生徒のバリ島「集団窃盗」が物議…府の文教課が明かした“騒動の余波”,123,https://news.yahoo.co.jp/articles/9c289d821b0e612827336ec274cb9b7173fa65d6,12/10(水) 6:00
2025-12-10,07:08,TTL,総合,11,J-CASTニュース,「ものすごい恐怖だ」中国機のレーダー照射、170キロ先に届く最新性能　日本側から見えないまま,116,https://news.yahoo.co.jp/articles/34b1945ee85dcdf6d689702d528d5a4a08d35a96,12/9(火) 16:30
2025-12-10,07:08,TTL,総合,12,中央日報日本語版,高市首相がまた妄言「竹島は日本の領土…毅然と対応していく」,114,https://news.yahoo.co.jp/articles/819ef852958e8ccf45a00b5e4244218f5cbbb5bf,12/9(火) 16:25
2025-12-10,07:08,TTL,総合,13,産経新聞,モバイルバッテリー発火か　京都のホテル客室で火災　従業員を搬送、約120人が一時避難,108,https://news.yahoo.co.jp/articles/cd4fafa28f900bd8d1eb9c8566bf1b2261b82752,12/9(火) 22:14
2025-12-10,07:08,TTL,総合,14,デイリースポーツ,人気高校生YouTuberバイク事故で入院「対向車線の車が」　振込で「お見舞金」募る　ただし「領収書発行なし」,106,https://news.yahoo.co.jp/articles/6124232f96e0433e64082d061e53b99c1f0e4346,12/9(火) 20:41
2025-12-10,07:08,TTL,総合,15,デイリースポーツ,【高市自民】ネット大荒れ「これ本物か？」「日本側の女性の声が」「怪しい」　中国軍まさか→小泉大臣に反論、訓練通告の音源Ｘ公開「反論余地ない証拠」と　真偽不明で騒然「違和感」「中国訛りの英語のような」「これでなぜレーダー照射」,105,https://news.yahoo.co.jp/articles/2dfae2ac10f8098ca14ed2726405b39e19a80f51,12/10(水) 0:29
2025-12-10,07:08,TTL,総合,16,まいどなニュース,車椅子ユーザー、セルフで給油できず「代わりに入れてもらえますか？」→「無理ですね」鼻で笑って断ったガソリンスタンド,93,https://news.yahoo.co.jp/articles/3b719722dbf795b770f08d8ebb3c14c890af23c4,12/9(火) 14:46
2025-12-10,07:08,TTL,総合,17,スポニチアネックス,巨人・坂本勇人　2億円減の年俸3億円で更改「このまま終わりたくない」今季不調で2度の2軍降格,89,https://news.yahoo.co.jp/articles/eb52d37eb88e19c1f3d7b05f6c339873505b2cbe,12/9(火) 12:40
2025-12-10,07:08,TTL,総合,18,テレビ静岡NEWS,“おこめ券”を一刀両断　「物価高騰対策ならば米価を下げるための対策を…」　富士市長が国の施策に疑問符　富士宮市長は「“おこめ券”はコメ業界のみ潤す」,89,https://news.yahoo.co.jp/articles/e73f4c79638fba1ee19efdf4b3751534ec030423,12/10(水) 5:00
2025-12-10,07:08,TTL,総合,19,デイリースポーツ,【高市自民】Ｘ大荒れ「地震の日にこれか！」「大使館は暇なのか」在東京の中国大使館→高市発言に警告画像「蟷螂の斧の如く」と　２千コメ殺到「地震の後に程度が知れる」「トランプに言って」「後にしてくれ」,87,https://news.yahoo.co.jp/articles/db39afb4143fb452c1d122a81df8325828d1f340,12/9(火) 18:16
2025-12-10,07:08,TTL,総合,20,日テレNEWS NNN,中国国営メディア、中国軍と自衛隊の“音声データ”公開　日本側「事前通報なかった」主張対立　レーダー照射問題,85,https://news.yahoo.co.jp/articles/74facffd59013e024f63f9b2779fca76503a5797,12/10(水) 1:22
2025-12-10,07:08,TTL,総合,21,スポニチアネックス,ソフトバンク戦力外　風間球打が現役引退　独白「未練はない。やりきった」21年ドラ１、会社員で再出発,84,https://news.yahoo.co.jp/articles/2bf2d03c43638793d1513009511d579c1dbff7d2,12/10(水) 6:00
2025-12-10,07:08,TTL,総合,22,CoCoKARAnext,なぜ森保ジャパンを“軽視”？　オランダ人識者が論じた日本への過小評価「トップレベルの試合において、日本人は全く歯が立たない」【北中米W杯】,84,https://news.yahoo.co.jp/articles/20a20a4d3f19c240799dbabce9e7b8c04b94ed74,12/10(水) 5:30
2025-12-10,07:08,TTL,総合,23,デイリースポーツ,浜崎あゆみ　来年１月のマカオ公演中止を発表「諸般の事情により」　上海に続き「大変無念」,84,https://news.yahoo.co.jp/articles/7296c9df21d36eadb0b373b3ae69cc5d3b3e106f,12/9(火) 19:13
2025-12-10,07:08,TTL,総合,24,NEWSポストセブン,《完全な失敗に終わるに違いない》最大震度6強・青森県東方沖地震、発生後の「在日中国大使館」公式Xでのポスト内容が波紋拡げる、注目される台湾総統の“対照的な対応”,83,https://news.yahoo.co.jp/articles/3deca8d69c8ee8b397252ffe55b3748dd9a74165,12/9(火) 17:10
2025-12-10,07:08,TTL,総合,25,日刊スポーツ,中国駐日大使館「中国統一という大業の妨害企てる勢力」へ警告ポスト「失敗に終わる」に意見続々,82,https://news.yahoo.co.jp/articles/ede761a717515f8e72cb765dca8dd133e5208198,12/9(火) 12:39
2025-12-10,07:08,TTL,総合,26,東洋経済オンライン,「ひらがなも書けない新人」に現場は激怒　人手不足でも“学歴フィルター厳格化”に踏み切った企業の本音,80,https://news.yahoo.co.jp/articles/a599a1327c2c5b6712bbaecb07ad7ffb435eb00d,12/10(水) 5:00
2025-12-10,07:08,TTL,総合,27,デイリー新潮,「高市さんは財務省を意図的に“敵視”している」　補正予算会議で財務官僚をシャットアウト　「安倍さんの“財務省不信”を受け継いでいる」,77,https://news.yahoo.co.jp/articles/e322cea89fed0ec539f411cd1556552da89a5797,12/10(水) 5:50
2025-12-10,07:08,TTL,総合,28,FNNプライムオンライン（フジテレビ系）,沖縄沖で中国空母「遼寧」から発着艦140回…中露爆撃機も日本周辺で共同飛行　小泉防衛相「明確な示威行動」と警戒,71,https://news.yahoo.co.jp/articles/8ddf4b3e0759fdda75465181a2fdda3e23380802,12/10(水) 6:24
2025-12-10,07:08,TTL,総合,29,TBS NEWS DIG Powered by JNN,鈴木農水大臣「おこめ券」めぐり反論「値段に影響させたいとか一切ございません」「利益誘導をすることは一切ありません」,70,https://news.yahoo.co.jp/articles/2945f3f5e82c6c217c8b04bfd8007c2af9814b50,12/9(火) 18:49
2025-12-10,07:08,TTL,総合,30,共同通信,日本が武力で威嚇と中国外相,70,https://news.yahoo.co.jp/articles/96a3c423d3091a5fd11e328c01c142c258a1a914,12/9(火) 12:51
2025-12-10,07:08,TTL,総合,31,産経新聞,＜独自＞インテリジェンス担当相創設へ　情報組織の縦割り弊害打破、責任明確化も,68,https://news.yahoo.co.jp/articles/3bd5c1351711320d49c138ba3f84a20d41efbaf6,12/9(火) 7:29
2025-12-10,07:08,TTL,総合,32,クーリエ・ジャポン,英紙の報道「日中対立で高市を明確に支持しないトランプに焦る日本政府」,67,https://news.yahoo.co.jp/articles/33389df753e5f948965ab2f8863a9c5b26be6220,12/9(火) 18:40
2025-12-10,07:08,TTL,総合,33,Full-Count,大谷HRボールを691万円で売却「迷いはなかった」　女子大生が明かす“即決”の理由,66,https://news.yahoo.co.jp/articles/a6dc3673215a9d3c407b2ca03cd33fda55bd7fd1,12/9(火) 15:20
2025-12-10,07:08,TTL,総合,34,週刊SPA!,「もうキモくてキモくて…」29歳女性が語る“おぢアタック”の実態。「俺ならイケるかも」勘違いする中年男性には共通点が,65,https://news.yahoo.co.jp/articles/740e6c8920c156b633a77296ab1ea6d0b4eccc0e,12/9(火) 15:54
2025-12-10,07:08,TTL,総合,35,帝国データバンク,冬のボーナス、支給額「増加」企業は22.7％で頭打ち,64,https://news.yahoo.co.jp/articles/b9cec232503e9175fea7d26c9d3cc65b11ff998a,12/9(火) 10:30
2025-12-10,07:08,TTL,総合,36,TBS NEWS DIG Powered by JNN,【速報】小泉防衛大臣「航空情報や航行警報の事前通報の認識無し」　中国軍機による自衛隊機へのレーダー照射問題で反論,62,https://news.yahoo.co.jp/articles/87b94e36661d3d3197d950299de2b5a8f5ea35e1,12/9(火) 9:36
2025-12-10,07:08,TTL,総合,37,ピンズバNEWS,“日テレのコンプラ違反は?”松岡昌宏が北海道で「ほぼほぼできない」と語った『鉄腕DASH』の危険企画,61,https://news.yahoo.co.jp/articles/3ae610db6abf0f079dc5faeadd453ec0b7f36adc,12/10(水) 5:30
2025-12-10,07:08,TTL,総合,38,J-CASTニュース,やす子に視聴者ブチギレ「性格悪すぎ」　STARTO人気ジュニアへの発言で「禁句だよ」...批判殺到のワケ,60,https://news.yahoo.co.jp/articles/97b7c5b6e431e2215171f5d7728705a2bf025d94,12/9(火) 18:03
2025-12-10,07:08,TTL,総合,39,共同通信,中国、訓練通知の音声公開　「日本のレーダーも感知」,59,https://news.yahoo.co.jp/articles/b27998369ca718d3c71bb1823c89cd5d4bb3d12a,12/10(水) 6:17
2025-12-10,07:08,TTL,総合,40,よろず～ニュース,事故で入院、ゆたぼんに本当にお見舞金振り込まれた！「いかなる法的な義務も負いません」募集は継続,58,https://news.yahoo.co.jp/articles/4af8918592ece07d03695ce89ce6aeb25d6680d2,12/9(火) 14:20
