scrp_date,scrp_time,genre_en,genre_jp,rank,media_jp,title,comment,link,date_original
2024-06-08,13:24,business,経済,1,共同通信,ガソリン補助、夏以降も継続へ　政府、物価高で家計支援,217,https://news.yahoo.co.jp/articles/f09b1320c0e4390592858b15c19b35575dcdf2bc,6/7(金) 23:20
2024-06-08,13:24,business,経済,2,読売新聞オンライン,「ロト６」１等６億円が１年半で２回、奇跡の宝くじ売り場…「幸運のライン」として過去にも注目,69,https://news.yahoo.co.jp/articles/f2544854639e4516b5c16d9d493271e7981100c5,6/7(金) 15:56
2024-06-08,13:24,business,経済,3,東洋経済オンライン,都知事選を前に「蓮舫叩き」が盛り上がる事情、小池氏は出馬表明を遅らせ「公務に専念」と沈黙,67,https://news.yahoo.co.jp/articles/7044d6cb0509622bf3173011095ec8280b498f6c,6/8(土) 7:02
2024-06-08,13:24,business,経済,4,THE GOLD ONLINE（ゴールドオンライン）,「シャッター商店街を再生」「コンパクトシティー」は東京の価値観の押し付け!? 実は「イオンのある街は住みやすい」という、東京人が認めたがらない〈真実〉【専門家が解説】,50,https://news.yahoo.co.jp/articles/9bd55e0313bcff4a162681b334db39dddc58dd9e,6/8(土) 11:02
2024-06-08,13:24,business,経済,5,産経新聞,テーマパークで値上げ相次ぐ　海外より安いが…大型投資で魅力アップも淘汰進む恐れ,43,https://news.yahoo.co.jp/articles/58731f8d0286d0af1110f82bc8c069134ebb8862,6/7(金) 16:09
2024-06-08,13:24,business,経済,6,J-CASTニュース,「キッチンカー」東京では2年で激減　コロナ禍後に廃業した人たちの事情,36,https://news.yahoo.co.jp/articles/3e490d1d0d3ff6b2d5c33f4f8b5759baf7700830,6/7(金) 17:40
2024-06-08,13:24,business,経済,7,ITmedia ビジネスオンライン,「いきなり！」凋落の一方で規模拡大の「やっぱりステーキ」　明暗分かれた納得の理由,30,https://news.yahoo.co.jp/articles/2d05b5668c95ca8634b23823c9cbe34a919e3491,6/8(土) 6:30
2024-06-08,13:24,business,経済,8,日刊ゲンダイDIGITAL,規正法改正で公明は“同じ穴のムジナ”はっきり 衆院本会議では立憲を批判する《コラおじさん》まで,30,https://news.yahoo.co.jp/articles/31fa4d3d5bd5cab39c46b3c6081466e486c0f746,6/8(土) 9:06
2024-06-08,13:24,business,経済,9,ファイナンシャルフィールド,友人と2人で車で遠出！ 支払われたのは「高速代」を半分だったけど、これって妥当？「運転にかかる費用」や「お礼の方法」を紹介,30,https://news.yahoo.co.jp/articles/c9cf5cbd634266726c33a036cd62f13eefd0404e,6/8(土) 11:30
2024-06-08,13:24,business,経済,10,WEB CARTOP,感触悪いな……と思ったら「ノブ交換」を試す価値あり！　たかが「シフトノブ」と侮れないその効果とは？,27,https://news.yahoo.co.jp/articles/a0ece8843cbb6c2b2a43aab9f90c3be9cf207415,6/8(土) 11:50
2024-06-08,13:24,business,経済,11,Merkmal,1970年代「スーパーカーブーム」はなぜ盛り上がり、そして衰退したのか？ 当時の子どもはもう50代？ “夢のクルマ”の興奮をもう一度,26,https://news.yahoo.co.jp/articles/919416d9747f2987f5e49c0af2af5cd45cc8bcb2,6/8(土) 8:11
2024-06-08,13:24,business,経済,12,くるまのニュース,トヨタ新型「コンフォート＋」発表！ 約700万円の斬新「サメ顔モデル」！ 4.3m級の「コンパクトSUV」波に登場,22,https://news.yahoo.co.jp/articles/0fa666df48c63f51e0b37700df8eed76b59b78bd,6/8(土) 11:10
2024-06-08,13:24,business,経済,13,THE GOLD ONLINE（ゴールドオンライン）,「日本人だから日本株に投資」はナンセンスでしかない…積立も一括も「S&P500」一択と言い切れるワケ【投資アドバイザーが解説】,22,https://news.yahoo.co.jp/articles/d5e9ee4ff3b3864592fe97812396fba80d2fc1d6,6/8(土) 10:02
2024-06-08,13:24,business,経済,14,乗りものニュース,なぜ地味なのか「JR難波」 かつての一大ターミナル今後は大化け？ 実は30年前からあった“構想”,22,https://news.yahoo.co.jp/articles/c601f35236079b1c3d1acd0114931862aeacb98f,6/8(土) 7:12
2024-06-08,13:24,business,経済,15,乗りものニュース,「特殊な白いヤツも」ウクライナ向け自衛隊車両の引き渡しが完了！ その内訳は？,21,https://news.yahoo.co.jp/articles/ca7b6f6f0eb5eccb088edd65eb1b144fec78019e,6/8(土) 8:42
2024-06-08,13:24,business,経済,16,日刊ゲンダイDIGITAL,毒まんじゅう？ 岸田首相が規正法改正案審議中、公維にシュークリーム差し入れの魂胆,21,https://news.yahoo.co.jp/articles/56be07915ded218ef987dbbf06882d00d2ba384f,6/8(土) 9:06
2024-06-08,13:24,business,経済,17,マネーポストWEB,65歳以上の孤独死が20年で50倍に激増、背景にあるのは家族との「絶縁」か　“毒親なので親を捨てたい”と「家族じまい」代行業者への依頼も急増,21,https://news.yahoo.co.jp/articles/78333a02d5d84818d8c81f7fc3cba182cc8f393e,6/8(土) 7:15
2024-06-08,13:24,business,経済,18,乗りものニュース,「56機vs1200機超」あまりに劣勢のウクライナ空軍パイロットが“生き残った”理由とは？ 今も戦いは“終わらぬマラソン”,19,https://news.yahoo.co.jp/articles/5ce75d9ad82c8bc9737a21d505d2267b85b182aa,6/8(土) 11:42
2024-06-08,13:24,business,経済,19,ファイナンシャルフィールド,腹痛で「新幹線」を乗り逃した！ 指定席だったけど、チケットは買いなおす必要がある？ 支払いが「必要・不要」なパターンを解説,19,https://news.yahoo.co.jp/articles/fb98b3ca81282a46ce24a38217e62c8a9b2f03b7,6/8(土) 11:20
2024-06-08,13:24,business,経済,20,毎日新聞,損保有識者会議が報告書案　自主規制機関の設置求める,18,https://news.yahoo.co.jp/articles/c7b38802359ceab138d1548e5f4431010ec37fb8,6/7(金) 21:34
2024-06-08,13:24,business,経済,21,読売新聞オンライン,ほぼ完成のマンション、異例の解体へ…積水ハウスが開発の「グランドメゾン国立富士見通り」,18,https://news.yahoo.co.jp/articles/2f1f28c1d0b9c990a5c51809e35f7885f087ed3a,6/7(金) 21:19
2024-06-08,13:24,business,経済,22,朝日新聞デジタル,スーパー続々進出、東海で激戦　「地場の脅威」に店の魅力向上で対抗,18,https://news.yahoo.co.jp/articles/aad3265585326b0881c024149510e492a57d6504,6/8(土) 10:00
2024-06-08,13:24,business,経済,23,現代ビジネス,貯金は絶対できない…“2回の離婚、3人子育て”をするシングルマザーが直面する現実,18,https://news.yahoo.co.jp/articles/45905cd5003fb9ab83c0ed1db87c76ef1c8ff8af,6/8(土) 6:48
2024-06-08,13:24,business,経済,24,乗りものニュース,板橋名物「激低信号機」交差点 実は自転車で通ると「違反」!? 自転車の“ルールの矛盾”に困惑,17,https://news.yahoo.co.jp/articles/9bd614718b59c430b287c9d7e666d30ef90d3e0b,6/8(土) 12:12
2024-06-08,13:24,business,経済,25,THE GOLD ONLINE（ゴールドオンライン）,もう疲れました…〈月収28万円〉63歳の再雇用サラリーマン、91歳の母に抱く「どす黒い感情」,17,https://news.yahoo.co.jp/articles/96e2c9d6320a7d740dde7366384aabf5220f5a8a,6/8(土) 5:02
2024-06-08,13:24,business,経済,26,ファイナンシャルフィールド,新卒社員、「月給21万円」と聞いていたのに、振り込まれたのは「17万円」だった！「4万円」の差額の理由とは？「給与天引きの仕組み」を解説,17,https://news.yahoo.co.jp/articles/e4aad29ec1141197277c0a01900f39699c511193,6/8(土) 12:10
2024-06-08,13:24,business,経済,27,東洋経済オンライン,ディズニーシー、「来園者の高齢化」も何のその、3200億円を投資した新たなエリアでも「量より質」の勝ち筋,17,https://news.yahoo.co.jp/articles/939540cf223a1e4439202e0cfdc9114a40bd75c6,6/8(土) 5:02
2024-06-08,13:24,business,経済,28,THE GOLD ONLINE（ゴールドオンライン）,「1億円貯めたら会社員を辞めるのも怖くない」と思いきや…経験者が語る、FIREするために乗り越えなくてはならない「お金以外の壁」,16,https://news.yahoo.co.jp/articles/40de077671cfffd9aacc9b4a4699f54b02ec3d06,6/8(土) 11:32
2024-06-08,13:24,business,経済,29,FNNプライムオンライン,14カ月ぶりに2人以上世帯の消費支出がプラスに　消費の“二極化”顕著に　節約も限界で今後も支出は増加か,15,https://news.yahoo.co.jp/articles/04708de458c35265801f65fa2d2aeb5c816262db,6/8(土) 10:13
2024-06-08,13:24,business,経済,30,THE GOLD ONLINE（ゴールドオンライン）,1ドル150円超の「歴史的な円安」→企業は儲かり、家計は苦しい…個人が資産を守る“たったひとつ”の方法【マクロストラテジストが提言】,15,https://news.yahoo.co.jp/articles/29050526210426efbad06b0b4afbad5a257be9fd,6/8(土) 9:02
2024-06-08,13:24,business,経済,31,Merkmal,ホンダの電動化10兆円投資に世界が注目する理由 中国も「未来を見据えている」と絶賛、EV開発にとどまらない「事業構造改革」の本気度とは,15,https://news.yahoo.co.jp/articles/a7fe4589081250b8891d86757f41dfddba5b8392,6/8(土) 6:11
2024-06-08,13:24,business,経済,32,産経新聞,消えゆく地方のデパート、「ゼロ県」も漸増　多数の地方店を抱える近鉄百貨店の生存戦略,15,https://news.yahoo.co.jp/articles/320397f1ae2a70bcd822a1bd51a699fab1e128ed,6/8(土) 11:00
2024-06-08,13:24,business,経済,33,スマートモビリティJP,スズキが原付一種の折りたたみ電動モペッド、「e-PO」の公道走行調査を開始,15,https://news.yahoo.co.jp/articles/f4f657917829492f469fe065a75634b5e04a7c35,6/8(土) 12:07
2024-06-08,13:24,business,経済,34,日テレNEWS NNN,【解説】相次ぐ“自動車不正”…制度そのものにも疑問の声　浮き彫りになった2つの《課題》,14,https://news.yahoo.co.jp/articles/2be699694f28a4e15bfe79c2dffa928165dbb216,6/8(土) 8:02
2024-06-08,13:24,business,経済,35,くるまのニュース,「バナナの皮」で本当にクルマは滑る？ ゲームでは見慣れた光景だけど…「実車」で試した結果とは！,14,https://news.yahoo.co.jp/articles/2aa29760a9fcdfc3beb203c25085c85f33959403,6/8(土) 8:40
2024-06-08,13:24,business,経済,36,36Kr Japan,中国EV「理想汽車」、24年1～3月期は失速　純利益は前期比で約9割減,14,https://news.yahoo.co.jp/articles/8e2e30708d7a57779928d3a20de52d1062d7ec13,6/8(土) 10:01
2024-06-08,13:24,business,経済,37,マネーポストWEB,特に交際相手を求めていない若者たちが辟易とする「若者は恋人がほしくて当たり前」の価値観の押し付け　「勝手に不幸扱いしないでください」,14,https://news.yahoo.co.jp/articles/c360d61831a6e6ca11e9ff2351af410ae56b95e6,6/7(金) 15:15
2024-06-08,13:24,business,経済,38,ねとらぼ,ワークマン「8800円ランドセル」はアリ？　ナシ？　新商品めぐり激論　「これで十分」「低学年には厳しい」,13,https://news.yahoo.co.jp/articles/af87684fddf477a224d66c2c1620497f5b19d676,6/8(土) 7:30
2024-06-08,13:24,business,経済,39,みんかぶマガジン,元モルガン銀行東京支店長が最終警告！日本は国の借金返せない国ランキングでダントツのナンバーワン…ハイパーインフレが起こる日は近い,13,https://news.yahoo.co.jp/articles/f17e971639f10e1227509d745e404dee821fc488,6/7(金) 17:10
2024-06-08,13:24,business,経済,40,ベストカーWeb,お小遣い稼ぎに持って来い? ついに始まった[日本型ライドシェア] 規制マシマシだけど日本には丁度いいんじゃない,13,https://news.yahoo.co.jp/articles/554d830591b454a7d3742d1e9cc045002fb0bc83,6/8(土) 7:00
