scrp_date,scrp_time,genre_en,genre_jp,rank,media_jp,title,comment,link,date_original
2024-10-23,05:07,world,国際,1韓国、ウクライナに武器供与も　ロ朝協力強化に対抗ロイター10/22(火) 15:4439件/時,ロイター,韓国、ウクライナに武器供与も　ロ朝協力強化に対抗,39,https://news.yahoo.co.jp/articles/c3803c05f40cae8a39ba8a8835d940b939ac2f7f,10/22(火) 15:44
2024-10-23,05:07,world,国際,27:30日本人男児刺殺から1か月…中国で広がる不安「なるべく日本語話さない」日テレNEWS NNN10/22(火) 19:2333件/時,日テレNEWS NNN,日本人男児刺殺から1か月…中国で広がる不安「なるべく日本語話さない」,33,https://news.yahoo.co.jp/articles/1811de734bc391413103d40b2a1ca3ea275fdd46,10/22(火) 19:23
2024-10-23,05:07,world,国際,3ウクライナ人口、ロシアによる侵攻以降1000万人減少 国連ＡＦＰ＝時事10/22(火) 19:5230件/時,ＡＦＰ＝時事,ウクライナ人口、ロシアによる侵攻以降1000万人減少 国連,30,https://news.yahoo.co.jp/articles/17eef7a972d5bd30da81daee8996c317fc9124fc,10/22(火) 19:52
2024-10-23,05:07,world,国際,41:34『トップガン』の教官が墜落死　ニューメキシコ州航空ショーAP通信10/22(火) 13:0725件/時,AP通信,『トップガン』の教官が墜落死　ニューメキシコ州航空ショー,25,https://news.yahoo.co.jp/articles/1462b7b97b66076102ee6cc24592d3b4fee89770,10/22(火) 13:07
2024-10-23,05:07,world,国際,5英誌の報道「中国の日本人男児刺殺事件は起こるべくして起こった」クーリエ・ジャポン10/22(火) 19:0023件/時,クーリエ・ジャポン,英誌の報道「中国の日本人男児刺殺事件は起こるべくして起こった」,23,https://news.yahoo.co.jp/articles/58d88a210763f064d00a8b24b8462249d016fff3,10/22(火) 19:00
2024-10-23,05:07,world,国際,6ソウル市内で配られた地図に…「独島は日本の領土」表記中央日報日本語版10/22(火) 8:5220件/時,中央日報日本語版,ソウル市内で配られた地図に…「独島は日本の領土」表記,20,https://news.yahoo.co.jp/articles/b2d5e9473200602284b6964e4314844288b60a3d,10/22(火) 8:52
2024-10-23,05:07,world,国際,7米マクドナルド、トランプ氏にフライドポテト提供の許可出さず　フランチャイズの判断CNN.co.jp10/22(火) 15:3319件/時,CNN.co.jp,米マクドナルド、トランプ氏にフライドポテト提供の許可出さず　フランチャイズの判断,19,https://news.yahoo.co.jp/articles/a46d91354dc9d7a5e39e1e8aa7784592d18900f8,10/22(火) 15:33
2024-10-23,05:07,world,国際,8北朝鮮がロシアに投入したのは「暴風軍団」と呼ばれる精鋭部隊　金総書記も派兵直前に視察かFNNプライムオンライン（フジテレビ系）10/23(水) 0:3217件/時,FNNプライムオンライン（フジテレビ系）,北朝鮮がロシアに投入したのは「暴風軍団」と呼ばれる精鋭部隊　金総書記も派兵直前に視察か,17,https://news.yahoo.co.jp/articles/83ca415124e6e09bedcb6bb317af770635601c1b,10/23(水) 0:32
2024-10-23,05:07,world,国際,9北朝鮮のロシア派兵「絶望的」　英国防相が強い懸念共同通信10/22(火) 22:2917件/時,共同通信,北朝鮮のロシア派兵「絶望的」　英国防相が強い懸念,17,https://news.yahoo.co.jp/articles/cdc7b67408ecdbc2adb679b3edb1181fc10fa28d,10/22(火) 22:29
2024-10-23,05:07,world,国際,101:09香港の動物園でサルが大量死、1週間で11匹　当局は土壌汚染が原因との見方ロイター10/22(火) 9:2815件/時,ロイター,香港の動物園でサルが大量死、1週間で11匹　当局は土壌汚染が原因との見方,15,https://news.yahoo.co.jp/articles/3a42b533d5eeb2e99d959e7ea2e5ba92d9aa3345,10/22(火) 9:28
2024-10-23,05:07,world,国際,11「ダフ屋なら4倍」韓流“激戦チケット”…定価2万円・必死でゲットしてあげたのに謝礼1100円とは切ない？KOREA WAVE10/23(水) 4:0314件/時,KOREA WAVE,「ダフ屋なら4倍」韓流“激戦チケット”…定価2万円・必死でゲットしてあげたのに謝礼1100円とは切ない？,14,https://news.yahoo.co.jp/articles/a632c2be865635ed50b470f51a192cb46bfd5780,10/23(水) 4:03
2024-10-23,05:07,world,国際,12ガザでけがした妹を裸足で運ぶ少女の動画が拡散。原爆後の「焼き場に立つ少年」と重ねる声もハフポスト日本版10/22(火) 17:5614件/時,ハフポスト日本版,ガザでけがした妹を裸足で運ぶ少女の動画が拡散。原爆後の「焼き場に立つ少年」と重ねる声も,14,https://news.yahoo.co.jp/articles/d79b5577951e8a8d9d1bb01f168659c131b860a7,10/22(火) 17:56
2024-10-23,05:07,world,国際,13ハマス、集団指導体制に 最高指導者殺害受け 情報筋ＡＦＰ＝時事10/22(火) 15:0714件/時,ＡＦＰ＝時事,ハマス、集団指導体制に 最高指導者殺害受け 情報筋,14,https://news.yahoo.co.jp/articles/57dd4ef14f1bcbd53cbcf4b18ad297e138ed585c,10/22(火) 15:07
2024-10-23,05:07,world,国際,141:46「この命はいらない!」男が鉄パイプ振り回し大暴れ!無許可営業取締り当局に激怒　中国FNNプライムオンライン（フジテレビ系）10/22(火) 20:3213件/時,FNNプライムオンライン（フジテレビ系）,「この命はいらない!」男が鉄パイプ振り回し大暴れ!無許可営業取締り当局に激怒　中国,13,https://news.yahoo.co.jp/articles/5c163e45a691a9091f0251670598e6e45a169623,10/22(火) 20:32
2024-10-23,05:07,world,国際,15「アバクロ」前CEO逮捕・起訴　男性モデルら15人に性行為強要　捜査当局「成功を夢見る若者を餌食に」と批判FNNプライムオンライン（フジテレビ系）10/23(水) 3:1713件/時,FNNプライムオンライン（フジテレビ系）,「アバクロ」前CEO逮捕・起訴　男性モデルら15人に性行為強要　捜査当局「成功を夢見る若者を餌食に」と批判,13,https://news.yahoo.co.jp/articles/2084a08ff633f200db24ef2eef7fa0aa875dd344,10/23(水) 3:17
2024-10-23,05:07,world,国際,16北朝鮮、「暴風軍団」を投入　ロシア支援で精鋭、戦闘力未知共同通信10/22(火) 18:2513件/時,共同通信,北朝鮮、「暴風軍団」を投入　ロシア支援で精鋭、戦闘力未知,13,https://news.yahoo.co.jp/articles/b6ed84c6fde1e0c742d45ec68e49af66b8bc45ca,10/22(火) 18:25
2024-10-23,05:07,world,国際,17ドイツ・ベルリン“少女像”の撤去期限直前に韓国系市民団体が「差し止め仮処分申請」 撤去先延ばしの可能性もTBS NEWS DIG Powered by JNN10/22(火) 22:4712件/時,TBS NEWS DIG Powered by JNN,ドイツ・ベルリン“少女像”の撤去期限直前に韓国系市民団体が「差し止め仮処分申請」 撤去先延ばしの可能性も,12,https://news.yahoo.co.jp/articles/1a0f5bf4e583378a607f5003707f7831e04c5df4,10/22(火) 22:47
2024-10-23,05:07,world,国際,18【解説】 中国・深圳の日本人男児刺殺事件、ネットのナショナリズムが悪かったのかBBC News10/22(火) 11:5111件/時,BBC News,【解説】 中国・深圳の日本人男児刺殺事件、ネットのナショナリズムが悪かったのか,11,https://news.yahoo.co.jp/articles/d9d646728c5ecf5f4fcf20a67957b12234bcce1a,10/22(火) 11:51
2024-10-23,05:07,world,国際,19おなかが露出した服を着ていた女性、飛行機を降ろされる。「偏見と差別だ」と訴え 米BuzzFeed Japan10/22(火) 6:0411件/時,BuzzFeed Japan,おなかが露出した服を着ていた女性、飛行機を降ろされる。「偏見と差別だ」と訴え 米,11,https://news.yahoo.co.jp/articles/962632d5e2f1d18d59f417c6442bbc77ab43aa9b,10/22(火) 6:04
2024-10-23,05:07,world,国際,20首都圏では難関校進学を目指す中国人の子弟も…日本のエリート社会の“変化”文春オンライン10/22(火) 6:1211件/時,文春オンライン,首都圏では難関校進学を目指す中国人の子弟も…日本のエリート社会の“変化”,11,https://news.yahoo.co.jp/articles/3a95d45ee196eb8bb44ab377af9cae45fdce0608,10/22(火) 6:12
2024-10-23,05:07,world,国際,21「ハコモノ過剰」でズルズル落ちる韓国の国力　狭い国土になぜ15の飛行場、うち11が営業赤字も…10の新空港建設が進行中夕刊フジ10/22(火) 17:0011件/時,夕刊フジ,「ハコモノ過剰」でズルズル落ちる韓国の国力　狭い国土になぜ15の飛行場、うち11が営業赤字も…10の新空港建設が進行中,11,https://news.yahoo.co.jp/articles/2589786766f23237ff65583b782f8b0eac5dfbf1,10/22(火) 17:00
2024-10-23,05:07,world,国際,22中国外相、日本に「相互協力的で威嚇的でない」関係維持を要請ロイター10/22(火) 9:4211件/時,ロイター,中国外相、日本に「相互協力的で威嚇的でない」関係維持を要請,11,https://news.yahoo.co.jp/articles/479b0f7912b67764764395d8af29c2bc7105b707,10/22(火) 9:42
2024-10-23,05:07,world,国際,23「アバクロ」前CEOを逮捕　性的人身売買に関与か日テレNEWS NNN10/23(水) 0:3411件/時,日テレNEWS NNN,「アバクロ」前CEOを逮捕　性的人身売買に関与か,11,https://news.yahoo.co.jp/articles/4abbfc3057d415941c4d0ed093f2f615c3897046,10/23(水) 0:34
2024-10-23,05:07,world,国際,24若返りのため息子の血を輸血…米国４７歳の億万長者「私の血しょうは金」　近況をサプライズ報告中央日報日本語版10/22(火) 8:1310件/時,中央日報日本語版,若返りのため息子の血を輸血…米国４７歳の億万長者「私の血しょうは金」　近況をサプライズ報告,10,https://news.yahoo.co.jp/articles/91e1d78d61b7d88e4ce5e97fd3d7ef9d315eb0f9,10/22(火) 8:13
2024-10-23,05:07,world,国際,25ロシア、NATO新施設に抗議　ドイツ大使を呼び出し共同通信10/23(水) 3:1010件/時,共同通信,ロシア、NATO新施設に抗議　ドイツ大使を呼び出し,10,https://news.yahoo.co.jp/articles/4408f6b41687be26148aa76029dee1868b5a446e,10/23(水) 3:10
2024-10-23,05:07,world,国際,26ASEAN、同盟組むなら「中国選ぶ」が5割超　初めて「米国」上回る　識者ら調査産経新聞10/22(火) 20:0510件/時,産経新聞,ASEAN、同盟組むなら「中国選ぶ」が5割超　初めて「米国」上回る　識者ら調査,10,https://news.yahoo.co.jp/articles/48e6952f7531606451ca0649c96a0e143496d8a2,10/22(火) 20:05
2024-10-23,05:07,world,国際,27北朝鮮軍のロシア派兵に韓国政府「段階的に対応」　ウクライナへの武器支援検討もテレビ朝日系（ANN）10/22(火) 20:589件/時,テレビ朝日系（ANN）,北朝鮮軍のロシア派兵に韓国政府「段階的に対応」　ウクライナへの武器支援検討も,9,https://news.yahoo.co.jp/articles/d478273198091f1bfe2c61d0b2fb0efb73f4a182,10/22(火) 20:58
2024-10-23,05:07,world,国際,28ベルリン慰安婦像　韓国系団体が区の撤去命令に差し止め請求で提訴　今月末の期限前に産経新聞10/22(火) 11:479件/時,産経新聞,ベルリン慰安婦像　韓国系団体が区の撤去命令に差し止め請求で提訴　今月末の期限前に,9,https://news.yahoo.co.jp/articles/ed37874d89a25a388f7d55ada91e821495e3cfac,10/22(火) 11:47
2024-10-23,05:07,world,国際,291:50インドで川を埋め尽くす“ナゾの白い物体”深刻な環境汚染テレビ朝日系（ANN）10/22(火) 19:009件/時,テレビ朝日系（ANN）,インドで川を埋め尽くす“ナゾの白い物体”深刻な環境汚染,9,https://news.yahoo.co.jp/articles/a9bb8944ca8d4ef6d4b62a9869bdc93d7915e329,10/22(火) 19:00
2024-10-23,05:07,world,国際,302:33泳ぐ宝石「ニシキゴイ」中国への輸出、再開の見通し　約1年ぶり日テレNEWS NNN10/22(火) 21:379件/時,日テレNEWS NNN,泳ぐ宝石「ニシキゴイ」中国への輸出、再開の見通し　約1年ぶり,9,https://news.yahoo.co.jp/articles/6330d54b4eb900e43a91a6dc4eac9f5938647e2d,10/22(火) 21:37
2024-10-23,05:07,world,国際,31ロシア爆撃機2機が日本海飛行　約10時間、戦闘機同行共同通信10/22(火) 22:099件/時,共同通信,ロシア爆撃機2機が日本海飛行　約10時間、戦闘機同行,9,https://news.yahoo.co.jp/articles/b82ae05ccf506d245e761ac2335090f8eef57191,10/22(火) 22:09
2024-10-23,05:07,world,国際,32日本のコスト、台湾の4倍　SBIとの提携解消理由　PSMC時事通信10/22(火) 21:389件/時,時事通信,日本のコスト、台湾の4倍　SBIとの提携解消理由　PSMC,9,https://news.yahoo.co.jp/articles/8023118af9ff2040a6b40a3bf5903258c0c0d0b9,10/22(火) 21:38
2024-10-23,05:07,world,国際,33フォルクスワーゲンを追い詰めたドイツ政府のEV政策「右往左往」新潮社 フォーサイト10/22(火) 15:029件/時,新潮社 フォーサイト,フォルクスワーゲンを追い詰めたドイツ政府のEV政策「右往左往」,9,https://news.yahoo.co.jp/articles/96dab7403b2e7b89800ac9f7937f8b5c1e2a7c53,10/22(火) 15:02
2024-10-23,05:07,world,国際,343:20「カマラ、お前はクビだ。出て行きやがれ」トランプ氏　激戦州でハリス氏失速　10月はトランプ氏がわずかにリード　民主党に勢いの「郵便投票」がカギかTBS NEWS DIG Powered by JNN10/22(火) 17:418件/時,TBS NEWS DIG Powered by JNN,「カマラ、お前はクビだ。出て行きやがれ」トランプ氏　激戦州でハリス氏失速　10月はトランプ氏がわずかにリード　民主党に勢いの「郵便投票」がカギか,8,https://news.yahoo.co.jp/articles/05a5cb052f7733bfaa18d48a9abc1ecc7b345a3a,10/22(火) 17:41
2024-10-23,05:07,world,国際,35金与正氏、韓国とウクライナ非難　派兵問題に反発か　北朝鮮時事通信10/22(火) 19:268件/時,時事通信,金与正氏、韓国とウクライナ非難　派兵問題に反発か　北朝鮮,8,https://news.yahoo.co.jp/articles/ba074b1de47b8dfad40d3102c47529ab44792fc7,10/22(火) 19:26
2024-10-23,05:07,world,国際,36ゼレンスキー大統領「北朝鮮の現代戦経験、皆に有害なこと」中央日報日本語版10/22(火) 10:198件/時,中央日報日本語版,ゼレンスキー大統領「北朝鮮の現代戦経験、皆に有害なこと」,8,https://news.yahoo.co.jp/articles/4a647763aa336be9350f6bda5a659bf76f528b6d,10/22(火) 10:19
2024-10-23,05:07,world,国際,37元CIAのリアリストが日本被団協のノーベル平和賞受賞に思うことニューズウィーク日本版10/22(火) 14:568件/時,ニューズウィーク日本版,元CIAのリアリストが日本被団協のノーベル平和賞受賞に思うこと,8,https://news.yahoo.co.jp/articles/963293d7f1d6ada86e3aa15c55833eb4fa92d5f6,10/22(火) 14:56
2024-10-23,05:07,world,国際,38円大幅下落、一時151円台前半　3カ月ぶり安値　東京市場時事通信10/22(火) 13:238件/時,時事通信,円大幅下落、一時151円台前半　3カ月ぶり安値　東京市場,8,https://news.yahoo.co.jp/articles/e5d945d2fa49f302e6cbb2cc0d7e762652a15896,10/22(火) 13:23
2024-10-23,05:07,world,国際,390:49ヒズボラの武装資金か　病院地下に5億ドル保管テレビ朝日系（ANN）10/22(火) 11:478件/時,テレビ朝日系（ANN）,ヒズボラの武装資金か　病院地下に5億ドル保管,8,https://news.yahoo.co.jp/articles/bf3998d73602db0ead10ccc9b7f161c332a88557,10/22(火) 11:47
2024-10-23,05:07,world,国際,40イラン、核科学者殺害計画指示か　イスラエルが7人拘束共同通信10/22(火) 20:538件/時,共同通信,イラン、核科学者殺害計画指示か　イスラエルが7人拘束,8,https://news.yahoo.co.jp/articles/5fe319c18510bd8a91d8f5fa7b2617da7e4d57b5,10/22(火) 20:53
