scrp_date,scrp_time,genre_en,genre_jp,rank,media_jp,title,comment,link,date_original
2024-08-09,13:07,domestic,国内,1,毎日新聞,「核兵器廃絶は人類が生き残る絶対条件」　長崎平和宣言、鈴木市長,606,https://news.yahoo.co.jp/articles/7d5a2dbf20150d47ace3716a026feafa1259c7f7,8/9(金) 11:14
2024-08-09,13:07,domestic,国内,2,FNNプライムオンライン（フジテレビ系）,【速報】岸田首相が地震対応で中央アジア訪問を中止　南海トラフ臨時情報を受けて当日キャンセル,541,https://news.yahoo.co.jp/articles/984ae28e2fccf8269e32616fe329b9682096dd81,8/9(金) 12:02
2024-08-09,13:07,domestic,国内,3,日刊スポーツ,救命救急士資格持つ女性歌手、「ペーパー」批判に怒り「バカにすんのもいい加減にしなさい」,256,https://news.yahoo.co.jp/articles/6618f0c98cb673398caff98f0ecc03a35a941074,8/9(金) 12:02
2024-08-09,13:07,domestic,国内,4,テレビ朝日系（ANN）,宮崎、鹿児島で13人けが　震度6弱観測の地震で　南海トラフ「巨大地震注意」,171,https://news.yahoo.co.jp/articles/c2f490028f4743d81379ecea7d1b28adafd430b0,8/9(金) 10:39
2024-08-09,13:07,domestic,国内,5,時事通信,政府、核軍縮への影響懸念　G7大使の長崎式典欠席　原爆忌,166,https://news.yahoo.co.jp/articles/48187fd212d0bd5764522ec3481af9ef5f209597,8/9(金) 7:12
2024-08-09,13:07,domestic,国内,6,朝日新聞デジタル,南海トラフ地震臨時情報の対象の1都2府26県707市町村はこちら,128,https://news.yahoo.co.jp/articles/ed9905ed3319255b7e97d8d20e7ca08b987a07fd,8/8(木) 22:43
2024-08-09,13:07,domestic,国内,7,よろず～ニュース,蓮舫氏の都知事選敗北を立民が役員会で検証「ネット」「党の人間が前面に出過ぎ」「争点」長妻氏が明かす,109,https://news.yahoo.co.jp/articles/b11b8a7e4e910a67f0fe6c983b72a37a7f123802,8/9(金) 8:00
2024-08-09,13:07,domestic,国内,8,ABEMA TIMES,気象庁「大規模地震の発生可能性が平常時と比べて相対的に高まっている」南海トラフ巨大地震臨時情報「巨大地震注意」発表,101,https://news.yahoo.co.jp/articles/f10fdbbfc23dd765c66837c49d0d264fcd0db4ce,8/8(木) 19:57
2024-08-09,13:07,domestic,国内,9,読売新聞オンライン,南海トラフ注意「冷静な対応」呼びかけ…初の臨時情報、専門家「公式情報を参考に」,89,https://news.yahoo.co.jp/articles/b629c2790aae35d3f781b471e20f66dccf3125d6,8/8(木) 22:59
2024-08-09,13:07,domestic,国内,10,FRIDAY,「新紙幣の対応」で数千万円の出費が…「パチンコ店の閉店ラッシュ」が止まらない理由を現役店長が解説,88,https://news.yahoo.co.jp/articles/5596fd7188c26b1ac8152bec04e0bc64caf623ec,8/9(金) 11:00
2024-08-09,13:07,domestic,国内,11,FNNプライムオンライン（フジテレビ系）,【速報】南海トラフ想定震源域内で「一部割れ」と判断 巨大地震への注意呼びかけ　気象庁,76,https://news.yahoo.co.jp/articles/2bad8807b0e225db577b2e7dee73b7dbe7ddfed5,8/8(木) 19:19
2024-08-09,13:07,domestic,国内,12,日テレNEWS NNN,【速報】サッカー元日本代表・佐野海舟選手（23）を不起訴　東京地検　先月、不同意性交容疑で逮捕、その後釈放,74,https://news.yahoo.co.jp/articles/a2ef89bcc1885f6b3029200326fc60865ca3364a,8/8(木) 16:34
2024-08-09,13:07,domestic,国内,13,SmartFLASH,「二度と来なくていい」「原爆投下への無反省」長崎平和式典　米・英はじめ相次ぐ出席拒否…“イスラエルへの配慮”に殺到する怒り,69,https://news.yahoo.co.jp/articles/490d845ad14294dbdbee8676ccd142149a17a5f7,8/8(木) 19:10
2024-08-09,13:07,domestic,国内,14,FNNプライムオンライン（フジテレビ系）,江東区の住宅で老夫婦遺体発見　熱中症の可能性も　東京都で40人が熱中症で搬送,67,https://news.yahoo.co.jp/articles/7340e6b828e9728778852e635c93f5a6f17c1799,8/9(金) 3:39
2024-08-09,13:07,domestic,国内,15,TBS NEWS DIG Powered by JNN,【速報】気象庁が「南海トラフ地震臨時情報」を初めて発表　日向灘で発生した最大震度6弱の地震を受け,65,https://news.yahoo.co.jp/articles/a336ad0edbc551cd65dee28219d36e76d9c24a83,8/8(木) 17:04
2024-08-09,13:07,domestic,国内,16,SmartFLASH,「ご飯を楽しむために行っているわけではない」パリ五輪“選手村食事問題”にIOC委員が“擁護”も異論噴出「選手ファーストが当然」,64,https://news.yahoo.co.jp/articles/8f5d95d35d0cf3cc4adac709941d1a8f03dadb18,8/8(木) 13:15
2024-08-09,13:07,domestic,国内,17,ウェザーマップ,猛暑に雷雨に台風5号も　気が休まらない三連休　東北は連休後半から雨風強まる　東・北日本の太平洋側は高波に警戒,63,https://news.yahoo.co.jp/articles/0f284ea47f7f614f37a4a293eeca637f88ba2249,8/9(金) 11:21
2024-08-09,13:07,domestic,国内,18,時事通信,内閣支持、微増19．4％　自民政権の継続期待4割　時事世論調査,57,https://news.yahoo.co.jp/articles/2a1ea68bdbbe91aff8e71ad7a86b15546d8c961a,8/8(木) 15:08
2024-08-09,13:07,domestic,国内,19,TBS NEWS DIG Powered by JNN,気象庁「巨大地震注意」発表　南海トラフ地震臨時情報、TBS解説委員「まずは1週間程度、注意して生活を」,52,https://news.yahoo.co.jp/articles/351b310c3a708caa3a40f7a55dcf531a382028fc,8/8(木) 19:43
2024-08-09,13:07,domestic,国内,20,ウェザーマップ,台風5号　週明けにも北日本に接近　12日から13日にかけて大荒れのおそれ　暴風・高波に警戒,50,https://news.yahoo.co.jp/articles/a9ecc5ebacd3bca45d4e614efa5aa18d5ddf6b8b,8/9(金) 5:49
2024-08-09,13:07,domestic,国内,21,TBS NEWS DIG Powered by JNN,【速報】気象庁「巨大地震注意」の「南海トラフ地震臨時情報」を発表　地震への備えを,49,https://news.yahoo.co.jp/articles/efed4c4d62b927f721fcb253c1022de92b4882b4,8/8(木) 19:15
2024-08-09,13:07,domestic,国内,22,tenki.jp,南海トラフ地震臨時情報「巨大地震注意」　取るべき対応は?,48,https://news.yahoo.co.jp/articles/e44e2e45b64df160065456249204f0f95c7a4829,8/8(木) 20:16
2024-08-09,13:07,domestic,国内,23,読売新聞オンライン,「誤認逮捕で生活一変」取り調べで精神的苦痛…被告側は争う姿勢,45,https://news.yahoo.co.jp/articles/1fe9294ac9e335b4749136e8ec474404d2dbd227,8/9(金) 11:21
2024-08-09,13:07,domestic,国内,24,FNNプライムオンライン（フジテレビ系）,【速報】宮崎県南部平野部で震度6弱の地震　宮崎南部山沿、鹿児島大隅では震度5強,44,https://news.yahoo.co.jp/articles/703a4c3790b59ced9b19a7eb8aea9625f33edaa4,8/8(木) 16:49
2024-08-09,13:07,domestic,国内,25,J-CASTニュース,半年早く降伏なら「沖縄戦、広島・長崎なかった」...ウクライナを「日本の二の舞にしてはならない」　モスクワ帰りの鈴木宗男氏が主張,43,https://news.yahoo.co.jp/articles/544b22438adc93d021bb44dbad36691e08929711,8/8(木) 19:00
2024-08-09,13:07,domestic,国内,26,SlowNews／スローニュース,「母が死んでほっとしました」原爆を生き抜いた「ヤングケアラー」がいた…いまだ「被爆者」に認定されず,39,https://news.yahoo.co.jp/articles/d0a4b3acfef859957326224196c5e7e9b7aa78dc,8/9(金) 8:32
2024-08-09,13:07,domestic,国内,27,プレジデントオンライン,金メダル選手がアダルトサイトで生活費を稼いでいる…海外紙が報じた「オリンピック選手」の厳しい給与事情,36,https://news.yahoo.co.jp/articles/20e2b121dab00e05d43662e46f61281782900c55,8/9(金) 9:17
2024-08-09,13:07,domestic,国内,28,日テレNEWS NNN,女性宅のベランダに干されていた下着を盗んだか　千葉県警の警察官を逮捕,36,https://news.yahoo.co.jp/articles/64af804fbf38d053f882bba09b2401a59e4d0245,8/9(金) 9:52
2024-08-09,13:07,domestic,国内,29,現代ビジネス,大阪・関西万博の「深刻な工事の遅れ」、じつはあの「木造リング」が大きな影響を与えていた,35,https://news.yahoo.co.jp/articles/06172d782cefd2e8dd2b27d74966dd64d6712717,8/9(金) 7:00
2024-08-09,13:07,domestic,国内,30,TBS NEWS DIG Powered by JNN,【速報】モノレール高架下で男性作業員（50）が頭挟まれ死亡　高所作業車で　東京・東大和市,35,https://news.yahoo.co.jp/articles/2a19a75ef95f7ef6c4f2578fc617aea536d2cc2a,8/8(木) 23:36
2024-08-09,13:07,domestic,国内,31,FNNプライムオンライン（フジテレビ系）,【速報】1週間程度は最大震度6弱程度の地震に注意するよう呼びかけ　宮崎県南部平野部で震度6弱の地震　南海トラフ初の臨時情報発表　気象庁,35,https://news.yahoo.co.jp/articles/d4b9921be1fc818146e6656f5e40b15e883e7cbb,8/8(木) 18:07
2024-08-09,13:07,domestic,国内,32,神戸新聞NEXT,兵庫・斎藤知事「冷静な行動を」　南海トラフ地震注意の発表受け会見　「災害弱者への対応、市町と連携し進める」,34,https://news.yahoo.co.jp/articles/d2e747b174476af3a406deb861bdfa97ba0beded,8/9(金) 12:35
2024-08-09,13:07,domestic,国内,33,FNNプライムオンライン,【今後の注意点】余震に注意…夜寝る時は「できるだけ1階ではなく2階で」　津波も「1回ではなく複数回」警戒の重要性指摘　宮崎で最大震度6弱地震で専門家が指摘＜南海トラフ初の臨時情報発表＞,34,https://news.yahoo.co.jp/articles/f4600e6ccc65d70751d74b3ae3a43fe1dc9a93d8,8/8(木) 18:02
2024-08-09,13:07,domestic,国内,34,TBS NEWS DIG Powered by JNN,今できる備えは？ 南海トラフ「巨大地震注意」、筑波大・八木教授「防災に対する意識、イメージを膨らませて」【news23】,34,https://news.yahoo.co.jp/articles/458573a7fa8e406bf6f6adfc6e55a2f648b277ad,8/9(金) 1:01
2024-08-09,13:07,domestic,国内,35,スポニチアネックス,泉房穂氏「斎藤知事にアドバイスをしている弁護士は“中立の立場”ではなく…」兵庫県知事告発文書問題,33,https://news.yahoo.co.jp/articles/72291153b6028da301744676c16f543e392f3913,8/9(金) 8:10
2024-08-09,13:07,domestic,国内,36,読売新聞オンライン,スパーリングと称して後輩殴る、巡査を書類送検…「悪ふざけの延長」,31,https://news.yahoo.co.jp/articles/78fe7cb7c97028732b839e7bf5274117700c25d0,8/9(金) 11:21
2024-08-09,13:07,domestic,国内,37,Wedge（ウェッジ）,＜パリ五輪女子ボクシングの性別疑義騒動＞IOCとIBAの「政争の具」に巻き込まれる選手、社会変容に適した冷静なルール議論を,31,https://news.yahoo.co.jp/articles/d388872eb253ad22c0dde348a2432c6373cfd3fe,8/9(金) 5:02
2024-08-09,13:07,domestic,国内,38,現代ビジネス,なぜ俺たちだけなのか…！前代未聞の大量218人処分、「潜水手当の不正自給」で処分された海上自衛隊の「エリート潜水士」が明かした「不平等すぎる調査の中身」,30,https://news.yahoo.co.jp/articles/97cd38cc9acb186986f6cff76915ed91c97f9552,8/9(金) 7:00
2024-08-09,13:07,domestic,国内,39,JBpress,なぜ、親が大卒だと子も大卒に？京大生が教育格差を考えた…「3DS買ってもらえなかった」にみる階層再生産の子育て,30,https://news.yahoo.co.jp/articles/047cbdc9e0161cff4262275cab2f073629f4f0d3,8/9(金) 11:47
2024-08-09,13:07,domestic,国内,40,ABEMA TIMES,浮気や不倫とは違う？夫・妻・妻の彼氏の新たな関係性に「ありのままを発信している。法律を犯しているわけでもない」ひろゆきは反発「これがまともという価値観を振りまくのはよくない」,29,https://news.yahoo.co.jp/articles/c836b4a1948e09736911541bde31bc5717e269ea,8/9(金) 11:03
