scrp_date,scrp_time,genre_en,genre_jp,rank,media_jp,title,comment,link,date_original
2025-05-30,09:35,local,地域,1,テレビ新広島,保育所で園児が食事中に喉を詰まらせ意識不明　損害賠償金２億７千万円　福山市が保護者と和解へ　広島,158,https://news.yahoo.co.jp/articles/2a519da75c7c68c8c61865028eb4ab4b20382245,5/29(木) 17:27
2025-05-30,09:35,local,地域,2,埼玉新聞,マジで遊ぼう…女子中学生とドライブした男逮捕「怖い？」　以前から面識あり　昼から3時間半ほど車で誘拐した疑い　生徒の位置情報を見た父、異変に気付いて保護,110,https://news.yahoo.co.jp/articles/08efb3e4237d9ad9d0eba8bb19b693522adddfc1,5/30(金) 8:02
2025-05-30,09:35,local,地域,3,関西テレビ,15分で売り切れ…「抹茶ブーム」の余波で京都の茶畑に異変！生産減った「煎茶」も値上がり,85,https://news.yahoo.co.jp/articles/8d514d1b1efb27fb7457842d0803b4026159b3d6,5/30(金) 5:00
2025-05-30,09:35,local,地域,4,MBSニュース,斎藤知事は指示否定…「もう自分がどう言ったとか、認める認めないの話じゃないだろう」法政大・白鳥教授が“食い違いの行方”を指摘 　『情報漏洩』兵庫県議会は動くのか,70,https://news.yahoo.co.jp/articles/4a1c5c05212092b9c47bc5267c70055f17e8b346,5/29(木) 13:22
2025-05-30,09:35,local,地域,5,MBSニュース,【速報】保釈認められず「失明寸前」まで視力低下　拘置所の医師が外部での治療が必要との見解示すも…　「無罪推定のはずなのに、最低限の治療すら受けられないまま漫然と拘束」国に賠償求めた裁判　請求退ける判決,47,https://news.yahoo.co.jp/articles/3e99dbbfb20e81a3d726684090ceb66589259803,5/29(木) 13:10
2025-05-30,09:35,local,地域,6,カナロコ by 神奈川新聞,反戦デモ中、米兵が銃を携え警備…米軍に中止と謝罪要請「威圧許されない」　横須賀の市民団体,46,https://news.yahoo.co.jp/articles/cbc3b0758382da60654d6dca222e112b9e856bb9,5/29(木) 21:50
2025-05-30,09:35,local,地域,7,関西テレビ,【100人アンケート】斎藤知事「辞任すべき」63人「続投すべき」37人　２カ月で形勢逆転,37,https://news.yahoo.co.jp/articles/d2d6bb2bcaaa14d028b660148600bdaa55d36f92,5/29(木) 16:54
2025-05-30,09:35,local,地域,8,MRT宮崎放送,宮崎市の県立高校で10代男性の首を刃物で突き刺す　殺人未遂容疑で男子高校生（15）を逮捕,35,https://news.yahoo.co.jp/articles/a841964b5db9bfa09da9e2a69a666dfc2df82dae,5/29(木) 12:06
2025-05-30,09:35,local,地域,9,関西テレビ,「裁判官はいっさい耳を貸さず」 治療受けようと保釈求めるもかなわず　視力悪化した男性の請求を棄却,34,https://news.yahoo.co.jp/articles/17867f88711c3dc3bff473dfd514cb7d7fe7f3f1,5/30(金) 0:55
2025-05-30,09:35,local,地域,10,埼玉新聞,車とおまえボコるか、どっちがいい…女子中学生2人とドライブした男性2人が襲われる　20歳ら逮捕、強盗の疑い　現金欲しくて男性をコンビニに連れて行くもATMで残高不足…暴行　その後、20歳は理由不明の不起訴に,32,https://news.yahoo.co.jp/articles/7500f809759f556e96c5cf794a35ce7502d7da46,5/29(木) 12:26
2025-05-30,09:35,local,地域,11,HBCニュース北海道,走って来た自転車の前にわざと腕を伸ばして…面識のない61歳男性の顔面を殴打　暴行容疑の46歳の男「わざとではない」札幌市東区,31,https://news.yahoo.co.jp/articles/b8db891a82d305534b66b67bfb5feebaae8d5383,5/30(金) 9:09
2025-05-30,09:35,local,地域,12,ABCニュース,トイレに向かった女性部下のあとをつけ…スマホで盗撮した男性係長を懲戒処分　「責任を取りたい」と依願退職　兵庫・明石市,29,https://news.yahoo.co.jp/articles/04bd5611123175fa9a0e44adc536c2ac635ec547,5/30(金) 7:00
2025-05-30,09:35,local,地域,13,九州朝日放送,中国籍夫婦が太宰府市の国特別史跡内に”無断でキャンプ場”　初公判で起訴内容認める,26,https://news.yahoo.co.jp/articles/22b097b63812ab3616fbc001200dce8d8cbedfff,5/29(木) 20:30
2025-05-30,09:35,local,地域,14,埼玉新聞,【速報】埼京線で遅れ　大宮駅で荷物挟まりの影響　池袋駅で乗客救護も,25,https://news.yahoo.co.jp/articles/3c7698a7b48a7d9380fb7063cec2fb965ab291ab,5/30(金) 8:34
2025-05-30,09:35,local,地域,15,FBS福岡放送,中国人の夫婦を3度目の逮捕「SNS型投資詐欺の被害金」を正当な事業収益と装った疑い　マネーロンダリングで国外へ持ち出されたか　口座には計33億円,24,https://news.yahoo.co.jp/articles/7bed78a046197816ce1181972a912df872e984f2,5/29(木) 21:29
2025-05-30,09:35,local,地域,16,北海道ニュースUHB,"自転車に乗った60代男性の顔に""すれ違いざま""突然『ラリアット』腕で殴打―暴行の現行犯で46歳の無職男を逮捕「叩いてしまったことは悪いが、わざとではない」＜札幌市東区＞",23,https://news.yahoo.co.jp/articles/c66cf3ec1074853fb8e4818424692309cb712fcc,5/30(金) 5:50
2025-05-30,09:35,local,地域,17,長崎新聞,全国の被爆者、１０万人割れの見通し…前年度から７０００人減、手帳の交付開始以降で初,22,https://news.yahoo.co.jp/articles/e86a4de0ad9b6ae2d966634acf15359cc83aefb5,5/29(木) 10:30
2025-05-30,09:35,local,地域,18,静岡新聞DIGITAL,清水エスパルス本拠地アイスタ　背もたれ付き観客席を5000席に　静岡市方針、国際大会基準へ,22,https://news.yahoo.co.jp/articles/5ab03c9fd962d13d7b4cfe99826262bb3093fa82,5/30(金) 7:41
2025-05-30,09:35,local,地域,19,MBSニュース,【卑劣】「性的欲求満たすために100回ほど盗んだ」コインランドリーで下着の窃盗を繰り返したか　44歳男を逮捕　自宅から約450点の下着などを押収　大阪府警,20,https://news.yahoo.co.jp/articles/a49bd6b0d3be665ce46c78b0fabddc8bda111b85,5/29(木) 16:12
2025-05-30,09:35,local,地域,20,チューリップテレビ,ながらスマホ…1万2000円の反則金! 自転車の「青切符」導入で知っておくべき交通ルール,20,https://news.yahoo.co.jp/articles/6d1660e7a394cc1f5ac295dd1ebb1f396dd4579b,5/30(金) 6:02
2025-05-30,09:35,local,地域,21,北海道ニュースUHB,"「成績が心配なのにアルバイトしている場合なの？」相談しに来た男子生徒の足を高校教師が""インサイドキック""_別の生徒が教育委員会に相談し懲戒処分に「体罰という認識はなく和やかな雰囲気だった」と主張",19,https://news.yahoo.co.jp/articles/6c656ccb429d3f983594a9b09b0fb973ed4b341a,5/29(木) 20:46
2025-05-30,09:35,local,地域,22,MBSニュース,【速報】男子高校生を逮捕　母親の頭を皿で殴りケガさせた疑い　家事の分担めぐり口論に　京都市,19,https://news.yahoo.co.jp/articles/55750a1806aef598a09365b58d81718dacb95ec9,5/29(木) 16:32
2025-05-30,09:35,local,地域,23,読売テレビ,車16台が絡む多重事故で逮捕されたトラック運転手の男性を不起訴　大阪地検　理由を明らかにせず,18,https://news.yahoo.co.jp/articles/f54c8137a3482ffe26e9d3feee461ec8e5fcb9eb,5/30(金) 8:20
2025-05-30,09:35,local,地域,24,北海道ニュースUHB,【支笏湖沿いの国道】右折中のバイクに右側から追い越そうとした乗用車が衝突―50代男性が頭を強く打ち意識不明の状態で搬送…38歳男を過失運転致傷の現行犯で逮捕〈北海道千歳市〉,17,https://news.yahoo.co.jp/articles/1238a89a3161e65ef174ef2d37c60e366e686e08,5/30(金) 7:04
2025-05-30,09:35,local,地域,25,RKB毎日放送,国の特別史跡「大野城跡」で違法キャンプ場開設　「非常に安易な考えだった」中国籍の夫婦に懲役2年求刑,17,https://news.yahoo.co.jp/articles/24727b8baf85f095f24f6c53fe52e3640f8b7fda,5/29(木) 17:13
2025-05-30,09:35,local,地域,26,HBCニュース北海道,125ｃｃスクーターと乗用車が衝突、50代とみられる男性ライダー意識不明の重体　乗用車が追い越そうとし…38歳の韓国籍の男を過失運転傷害容疑で逮捕,16,https://news.yahoo.co.jp/articles/2bae3de293c8a817ed77c72cdeafc60fef19408c,5/29(木) 21:47
2025-05-30,09:35,local,地域,27,RBC琉球放送,「ひめゆりは歴史書き換え」発言で県議団　西田氏本人に抗議の面談要請も「都合つかない」と応じず党に抗議,16,https://news.yahoo.co.jp/articles/718c552ea950e21a1f9b78af8feeb7f44400586c,5/29(木) 19:51
2025-05-30,09:35,local,地域,28,OBS大分放送,「りんごのカードがほしい」来店客の要望に違和感…家電店員がとっさの判断　冷静な対応で詐欺見抜く,16,https://news.yahoo.co.jp/articles/171444a50b694e06ca6d75848622ed0afcd0e673,5/30(金) 6:02
2025-05-30,09:35,local,地域,29,メ〜テレ（名古屋テレビ）,高級ウイスキーの万引き繰り返したか　ペルー国籍の男女2人を逮捕　転売目的の可能性　愛知・豊橋市,16,https://news.yahoo.co.jp/articles/21a5e68284de16ba47884c7c51eb478fbdbe6a0a,5/29(木) 23:28
2025-05-30,09:35,local,地域,30,新潟日報,元フジテレビアナウンサー渡邊渚さん（阿賀野市出身）「度を超えた誹謗中傷や脅迫行為」法的措置に言及　公式サイトでスタッフ一同「お知らせ」,16,https://news.yahoo.co.jp/articles/c2b93d710744285cec3e047f07e8efc350886026,5/29(木) 18:02
2025-05-30,09:35,local,地域,31,岩手めんこいテレビ,クマがハチミツなめた後走り去る　商業施設付近に約7時間とどまる　翌朝も3ｋｍ先で目撃情報、同じ個体か　岩手県北上市,15,https://news.yahoo.co.jp/articles/b84d62abb7b17ec949551f3e0883a06a5ff739d1,5/29(木) 14:32
2025-05-30,09:35,local,地域,32,京都新聞,わいせつ動画多数のサイト「FC2」創業者に懲役3年求刑　「組織的、常習的に利益」,15,https://news.yahoo.co.jp/articles/6c20b0127a79eb07d5999ec1ed05546458a5578c,5/29(木) 20:32
2025-05-30,09:35,local,地域,33,MBSニュース,最終決裁者は斎藤知事　元総務部長の処分「停職６か月」→「３か月」に軽減と判明　知事は一貫して“漏えいの指示”を否定,15,https://news.yahoo.co.jp/articles/5fe4dbbf04b20c680be2b760dad4977fe1657893,5/29(木) 18:40
2025-05-30,09:35,local,地域,34,新潟ニュースNST,支給された交通費2200円を車に放置して紛失　30代と50代の男性職員2人を戒告処分　新潟・柏崎市,15,https://news.yahoo.co.jp/articles/e09a6056063eba5da1ccafee70691cceac197339,5/30(金) 5:30
2025-05-30,09:35,local,地域,35,伊勢新聞,新名神逆走、ペルー籍男を再逮捕　危険運転致傷の疑い　三重県警、玉突き事故誘発,14,https://news.yahoo.co.jp/articles/9d8f8b054df65b502792386a9b0040cde060350d,5/30(金) 8:01
2025-05-30,09:35,local,地域,36,HTB北海道ニュース,支笏湖の追い越し禁止の国道で オートバイを追い越した乗用車が衝突　オートバイの男性が重体,13,https://news.yahoo.co.jp/articles/0d24e59cbc2440d7def4f88b47dca1cd91089266,5/29(木) 23:22
2025-05-30,09:35,local,地域,37,北海道ニュースUHB,函館市の特別養護老人ホームで入所者に「身体拘束」運営法人に6か月の新規利用者の受け入れ停止処分＜北海道函館市＞,13,https://news.yahoo.co.jp/articles/4a5dd3b29802838c0a7ca88552ee3a654b80eba8,5/30(金) 5:00
2025-05-30,09:35,local,地域,38,RSK山陽放送,【速報】山陽道　ガス欠の中型トラックにトラックが衝突　トラック計3台絡む事故　下り・倉敷IC〜玉島IC通行止め【30日午前7時45分現在】,13,https://news.yahoo.co.jp/articles/8f2251118001d0d599e83a81560b0e008dbd3228,5/30(金) 7:11
2025-05-30,09:35,local,地域,39,UTYテレビ山梨,車掌を乗せていないまま列車発車　ホームで客が転倒→車掌がとっさの判断で下車→運転士に連絡せず　JR中央本線・梁川駅,13,https://news.yahoo.co.jp/articles/19f25e39c06d60a7e6f8d7e839b0b1fa9ad0c2f0,5/29(木) 12:28
2025-05-30,09:35,local,地域,40,FBS福岡放送,【詳しく】国の特別史跡「大野城跡」無断で造成してキャンプ場　中国籍の夫婦は起訴内容を認める　検察「再三の行政指導にもかかわらず他人の土地を大規模に変更」懲役2年を求刑,13,https://news.yahoo.co.jp/articles/e58eb973a0f801fbec9b0171ee1c526387486bb7,5/29(木) 13:24
