scrp_date,scrp_time,genre_en,genre_jp,rank,media_jp,title,comment,link,date_original
2025-07-17,22:19,business,経済,1,時事通信,東京23区マンション価格、過去最高　1億3000万円超、首都圏も更新　上半期,123,https://news.yahoo.co.jp/articles/30dfe0216c1b6f438b77e824f64f897bff56eb63,7/17(木) 14:16
2025-07-17,22:19,business,経済,2,朝日新聞,半導体生産のJSファンダリ破産で530人即解雇　県などが対策本部,115,https://news.yahoo.co.jp/articles/a66126e21d570c97cf8f71135bce9932e0390e1d,7/17(木) 9:56
2025-07-17,22:19,business,経済,3,毎日新聞,コクヨの「ランドセル生産終了」は市場の陰り？　「ラン活」に変化,102,https://news.yahoo.co.jp/articles/dbae00202a7a4827feb62c843dab196d9ac4e487,7/17(木) 7:30
2025-07-17,22:19,business,経済,4,FNNプライムオンライン（フジテレビ系）,【速報】カナダ・コンビニ大手　セブン＆アイの買収提案を撤回,96,https://news.yahoo.co.jp/articles/d992a6fb535566fc001b69870799c9b6ae0ad791,7/17(木) 7:47
2025-07-17,22:19,business,経済,5,東洋経済オンライン,「参政党支持者は頭が悪い」「おまけに差別主義者だ」と言うのは安易かもしれない…「参政党=排外主義」と一蹴する人に見えてない“真実”,69,https://news.yahoo.co.jp/articles/0fd45321052bb374eecc91135059becb793fee96,7/17(木) 7:32
2025-07-17,22:19,business,経済,6,毎日新聞,量、形、色をスキャンして健康管理　TOTOが最新トイレ発売へ,55,https://news.yahoo.co.jp/articles/8205dded0bca06a099c9e29d29cb746fb8b33447,7/16(水) 21:05
2025-07-17,22:19,business,経済,7,みんかぶマガジン,東大中退・堀江貴文氏「Fラン私大の学歴詐称なんかどーでもいい」…東洋大は本当にFランなのか、有権者はなぜ学歴にこだわるのか,48,https://news.yahoo.co.jp/articles/e382ef6a45d89132303a38109b2928757a662cd9,7/17(木) 9:10
2025-07-17,22:19,business,経済,8,読売新聞オンライン,セブン＆アイ株、終値９・２％安の２００７円…クシュタールの買収提案撤回で売り相次ぐ,46,https://news.yahoo.co.jp/articles/3e3166cf0f19c60ce4383f3d24663922e0e5ff49,7/17(木) 17:10
2025-07-17,22:19,business,経済,9,日テレNEWS NNN,セブン＆アイ、買収提案撤回したクシュタール社に反論,44,https://news.yahoo.co.jp/articles/d42a7b19a66abddd6bc5e1384d306b17536cac99,7/17(木) 9:57
2025-07-17,22:19,business,経済,10,Bloomberg,コカ・コーラ、米国内向けコーラでサトウキビ糖使用へ－トランプ氏,41,https://news.yahoo.co.jp/articles/311865f61c6a1524fe55d4a735ace9447108fb44,7/17(木) 10:22
2025-07-17,22:19,business,経済,11,FNNプライムオンライン,「佐賀県に納得いただくのは国の責任」石破首相が一部区間未着工の西九州新幹線をめぐり長崎で演説「西九州ルートは九州全体の発展につながる」,35,https://news.yahoo.co.jp/articles/3ac4d5649f677be5bb610aae0ba9b8675e91c664,7/17(木) 18:22
2025-07-17,22:19,business,経済,12,くるまのニュース,石破総裁「ガソリン暫定税率廃止」に否定的？「地方の財源が吹っ飛ぶ」とも!? 参院選直前に四国で演説！ 結局“ガソリン減税”はどうなるのか,27,https://news.yahoo.co.jp/articles/fec06282ca0a5cf556e29a25a01855672cae209a,7/17(木) 6:55
2025-07-17,22:19,business,経済,13,東洋経済オンライン,町岡さんが社長…ではなく『まちのおかしやさん』だから《おかしのまちおか》。創業71年目で明日上場、“独り勝ち”の意外と単純な理由とは？,25,https://news.yahoo.co.jp/articles/6584014bd49f5e3875be356ffa08667c69a3d079,7/17(木) 6:02
2025-07-17,22:19,business,経済,14,産経新聞,東京23区の新築マンション平均価格1・3億円　建設コスト上昇、外国人購入も後押し,19,https://news.yahoo.co.jp/articles/eac2d5a79496d58e2653d349a51a8e7010119dd4,7/17(木) 21:07
2025-07-17,22:19,business,経済,15,TBS NEWS DIG Powered by JNN,自動で炒める“調理ロボ”　ローソン初導入　注文から5分で受け取り　コンビニ“できたて”戦略強化へ,19,https://news.yahoo.co.jp/articles/f8a83f112bebb7fc9f996ad129f938fc36df44b6,7/17(木) 17:35
2025-07-17,22:19,business,経済,16,ベストカーWeb,高速道路の追い越し車線をどかないのはなぜ! あおられるのはアナタの運転が原因!? あおられないための5つの運転と防止策,19,https://news.yahoo.co.jp/articles/defb829749aff7dfc9c8afedfb275cc411249c08,7/17(木) 11:00
2025-07-17,22:19,business,経済,17,Aviation Wire,英BAE、次期戦闘機の有人実証機デザイン公開　28年初飛行へ,15,https://news.yahoo.co.jp/articles/4067fe219247dea2ce8cafe09221a3dfcf412f7a,7/17(木) 20:41
2025-07-17,22:19,business,経済,18,ロイター,新興政党の参政党、日本の政治に揺さぶり　外国人受け入れを争点化,15,https://news.yahoo.co.jp/articles/5198cf181e3aac3216bc1640cd3f9b751e7ada6e,7/17(木) 7:57
2025-07-17,22:19,business,経済,19,プレジデントオンライン,"名車「ブルーバード」を生んだ技術が狙われている…「売れる車」を作れなくなった日産を待つ""憂鬱なシナリオ""",15,https://news.yahoo.co.jp/articles/c8640237b6bb1adc99b47216eef714e46e115459,7/17(木) 9:17
2025-07-17,22:19,business,経済,20,ダイヤモンド・オンライン,「15時5分前に集合」→新人、15時3分に到着→「おい、遅刻だぞ！」と怒る上司…悪いのは新人と上司、どっち？【大人の言い換え力検定】,14,https://news.yahoo.co.jp/articles/46ae24fa1fe27d9836eaf92879c401cf54424c63,7/17(木) 6:01
2025-07-17,22:19,business,経済,21,共同通信,FRB議長解任の可能性は低いとトランプ氏,14,https://news.yahoo.co.jp/articles/19dd7fda864c3aa39ee796022f6ab2a289ba30b7,7/17(木) 1:09
2025-07-17,22:19,business,経済,22,ベストカーWeb,300万円台で登場熱望! スバルの新型スポーツカーに期待するコトって? 変態級なエンジン搭載を希望!!,14,https://news.yahoo.co.jp/articles/81675e377febfe299cd713d7f15475c3648b3f93,7/17(木) 20:00
2025-07-17,22:19,business,経済,23,TBS NEWS DIG Powered by JNN,日産自動車エスピノーサ社長が横浜市長を訪問　神奈川県内2工場での生産終了を報告　山中市長は今後について迅速な情報開示を要望,14,https://news.yahoo.co.jp/articles/5027c424e06ab1eae96eacc1844484f96ff288de,7/17(木) 12:37
2025-07-17,22:19,business,経済,24,Bloomberg,市場が財政悪化を警告、金利上昇を野党に聞く－参院選公約に変更なし,13,https://news.yahoo.co.jp/articles/f1f2d75e70ab5937c90fca61f423961d4080832a,7/17(木) 14:50
2025-07-17,22:19,business,経済,25,TBS NEWS DIG Powered by JNN,日産 エスピノーサ社長 横浜市長を訪問　追浜工場など神奈川県内2工場での生産終了報告　市内約800社が部品など供給,13,https://news.yahoo.co.jp/articles/668d62f824f4f472bc3bcfb47b3b598f83cc930c,7/17(木) 16:10
2025-07-17,22:19,business,経済,26,産経新聞,「7月に日本で大地震」風評被害の影響続く　6月、香港の訪日客は33・4％減少,12,https://news.yahoo.co.jp/articles/34d864921533583dde954402b3c31820d52c4d22,7/16(水) 22:30
2025-07-17,22:19,business,経済,27,乗りものニュース,ウクライナで「ドイツ製新防空システム」が火を噴き次々ドローンを撃墜 ミサイルよりはるかに経済的,12,https://news.yahoo.co.jp/articles/d67e262a7d04265d34db49cbcf72364b77beacf7,7/17(木) 15:12
2025-07-17,22:19,business,経済,28,みんかぶマガジン,中国・南京出身の著名エコノミストが日本語を勉強した意外なワケ…もう中国には戻れない？ 日本で生きていく決意をした瞬間,12,https://news.yahoo.co.jp/articles/c27ed442ba820126832aff2eb194341cf924b23d,7/17(木) 19:10
2025-07-17,22:19,business,経済,29,Car Watch,ホンダ、「シビック」一部改良で耐久性が従来比1.5倍以上向上する新塗料採用,12,https://news.yahoo.co.jp/articles/7da02cf9bf2cfa0df6f11d706f0740a4ba4c2a3b,7/17(木) 12:01
2025-07-17,22:19,business,経済,30,日本ネット経済新聞,日本郵便、「ゆうパック廃止」を否定 「あらゆる手段でサービス継続」,12,https://news.yahoo.co.jp/articles/91e02d0af7213a40f2f070fd3e53ce002c85c915,7/17(木) 14:30
2025-07-17,22:19,business,経済,31,ベストカーWeb,ホンダ シビックe:HEVが全車400万円超えに! でも新塗装で耐久性1.5倍に進化! 2025年改良の全貌,10,https://news.yahoo.co.jp/articles/c883d4af208f298ffde260ab5cfb4ed92db1819a,7/17(木) 18:30
2025-07-17,22:19,business,経済,32,TBS NEWS DIG Powered by JNN,日産2工場での生産終了　横浜市長が中小企業の「資金繰り支援」などを経産省に要望,10,https://news.yahoo.co.jp/articles/10380d287e74f7248c0903394c727dde06011f6e,7/17(木) 18:16
2025-07-17,22:19,business,経済,33,ニュースイッチ,「募集したが全くできなかった」17.8％…中小の建設業、採用厳しく,10,https://news.yahoo.co.jp/articles/6285e37a4218fdb15172e1a1d348022b67e9f1da,7/17(木) 13:10
2025-07-17,22:19,business,経済,34,ダイヤモンド・オンライン,物価高対策で「給付金」と「減税」の2択しかない日本人を待ち受ける「もっと深刻な生活苦」,10,https://news.yahoo.co.jp/articles/d5e9b910171579b6c895d5ea77f32beffc64f98a,7/17(木) 6:01
2025-07-17,22:19,business,経済,35,東洋経済オンライン,なぜ自動車メーカーは「アウトドアビジネス」に消極的なのか？　試金石が生かされない「製販分離」の功罪,10,https://news.yahoo.co.jp/articles/51f006b28dae84d84defd2b0d718d3bb6cf0b320,7/17(木) 13:32
2025-07-17,22:19,business,経済,36,ハフポスト日本版,参院選で「働かせたい改革」、専門家や遺族が強く反対。「命や子どもたちの未来を脅かす」と緊急声明,10,https://news.yahoo.co.jp/articles/91fcb07642935bb7dfe30c019eda541094761c97,7/17(木) 12:16
2025-07-17,22:19,business,経済,37,TBS NEWS DIG Powered by JNN,夏休み予算 初の10万円超も…「増やす人」「減らす人」二極化、国内旅行は予算アップ 海外旅行はダウンの理由【Nスタ解説】,9,https://news.yahoo.co.jp/articles/bb8527893d8bc4796721b281326124528b681de2,7/17(木) 21:31
2025-07-17,22:19,business,経済,38,読売新聞オンライン,「ドラフト会議」舞台のホテル、２６年度中に営業終了…ＪＲ品川駅前再開発の一環,9,https://news.yahoo.co.jp/articles/41ec162a9845074c8e8bc818ca760521b0267d93,7/17(木) 21:13
2025-07-17,22:19,business,経済,39,みんかぶマガジン,なぜ同じ「駅近」でもマンションの資産価値に天と地ほどの差が生まれるのか…20年後も資産価値を支える“最強の立地”の見極め方,9,https://news.yahoo.co.jp/articles/52ded273419d073a4e3c9874f7a431a025972a64,7/17(木) 19:10
2025-07-17,22:19,business,経済,40,東洋経済オンライン,「オルカン買う人は出世できない説」 FPがあの論争を見て感じたこと　出世はともかく、オルカンをそもそもどれだけ理解できているのか,9,https://news.yahoo.co.jp/articles/11b62c1202178672a5eae3d8035faa57cabffe94,7/17(木) 10:02
