scrp_date,scrp_time,genre_en,genre_jp,rank,media_jp,title,comment,link,date_original
2024-11-09,16:06,world,国際,1ハリス氏支持の芸能人落胆　「労働者置き去り」で裏目か　米大統領選時事通信11/9(土) 13:32103件/時,時事通信,ハリス氏支持の芸能人落胆　「労働者置き去り」で裏目か　米大統領選,103,https://news.yahoo.co.jp/articles/4f2143f93d8764213f8157702b1ee14d6c88bcbb,11/9(土) 13:32
2024-11-09,16:06,world,国際,2“バイデン氏がもっと早く撤退していれば” 民主党重鎮が大統領選の敗因を指摘ABEMA TIMES11/9(土) 15:1281件/時,ABEMA TIMES,“バイデン氏がもっと早く撤退していれば” 民主党重鎮が大統領選の敗因を指摘,81,https://news.yahoo.co.jp/articles/f7a726919f5c44e23164c41500d529286a2e4b3e,11/9(土) 15:12
2024-11-09,16:06,world,国際,3「ぶっ殺すぞ!」ライドシェア車内で泥酔客が大暴れ　首つかんで頭わしづかみ何度もビンタ…警察への通報止めようと暴挙　中国FNNプライムオンライン11/9(土) 13:3261件/時,FNNプライムオンライン,「ぶっ殺すぞ!」ライドシェア車内で泥酔客が大暴れ　首つかんで頭わしづかみ何度もビンタ…警察への通報止めようと暴挙　中国,61,https://news.yahoo.co.jp/articles/5f0bf09a171ea103eb9c714f9c03b0ba77bf213c,11/9(土) 13:32
2024-11-09,16:06,world,国際,4安倍氏はトランプ氏と「ゴルフ外交」…ゴルフしない石破氏が不安な日本中央日報日本語版11/9(土) 13:5648件/時,中央日報日本語版,安倍氏はトランプ氏と「ゴルフ外交」…ゴルフしない石破氏が不安な日本,48,https://news.yahoo.co.jp/articles/de8067b26a7fdf1b93f7f54bb083dc854da0781c,11/9(土) 13:56
2024-11-09,16:06,world,国際,5「プーチン独裁」はもはや新次元の領域へ突入…ロシア政府にもあきらめムードが漂う「クレイジーな男」の実態現代ビジネス11/9(土) 8:0035件/時,現代ビジネス,「プーチン独裁」はもはや新次元の領域へ突入…ロシア政府にもあきらめムードが漂う「クレイジーな男」の実態,35,https://news.yahoo.co.jp/articles/8341c7e59bde01124812ea23af267af7d3a228e3,11/9(土) 8:00
2024-11-09,16:06,world,国際,6トランプ氏、総得票数も勝利なら20年ぶり　強硬派ライトハイザー氏に通商代表打診と報道産経新聞11/9(土) 13:2835件/時,産経新聞,トランプ氏、総得票数も勝利なら20年ぶり　強硬派ライトハイザー氏に通商代表打診と報道,35,https://news.yahoo.co.jp/articles/23490a4dfc8c39f001f04ff4167009a50afc9aca,11/9(土) 13:28
2024-11-09,16:06,world,国際,7なぜトランプが勝利し、リベラルは負け続けるのか…多くの人が見過ごしている「問題点」現代ビジネス11/9(土) 6:0533件/時,現代ビジネス,なぜトランプが勝利し、リベラルは負け続けるのか…多くの人が見過ごしている「問題点」,33,https://news.yahoo.co.jp/articles/887cce7f4bf2b762c3979372215b5a41b617a4fe,11/9(土) 6:05
2024-11-09,16:06,world,国際,8「労働者階級を見捨てた民主党」　サンダース氏が批判、党内に波紋毎日新聞11/8(金) 22:0730件/時,毎日新聞,「労働者階級を見捨てた民主党」　サンダース氏が批判、党内に波紋,30,https://news.yahoo.co.jp/articles/a7b7f53f832bf5d98e2be73194cbf96826200e36,11/8(金) 22:07
2024-11-09,16:06,world,国際,9大統領選の賭けに勝ったマスク、トランプに「使い捨て」される可能性Forbes JAPAN11/9(土) 8:0030件/時,Forbes JAPAN,大統領選の賭けに勝ったマスク、トランプに「使い捨て」される可能性,30,https://news.yahoo.co.jp/articles/c23d6e6e4dff9cecabde414beee17f9a3eba4af8,11/9(土) 8:00
2024-11-09,16:06,world,国際,101:02ハリス氏の敗因はバイデン氏の選挙戦撤退の遅れ　民主党重鎮ペロシ氏が指摘テレビ朝日系（ANN）11/9(土) 10:3227件/時,テレビ朝日系（ANN）,ハリス氏の敗因はバイデン氏の選挙戦撤退の遅れ　民主党重鎮ペロシ氏が指摘,27,https://news.yahoo.co.jp/articles/5bdbdda81d7f095e68df5fe4372b6c2892d0b219,11/9(土) 10:32
2024-11-09,16:06,world,国際,11中国、「隠れ債務」対策に総額210兆円　地方政府の負担軽減図る産経新聞11/8(金) 20:1726件/時,産経新聞,中国、「隠れ債務」対策に総額210兆円　地方政府の負担軽減図る,26,https://news.yahoo.co.jp/articles/87da48e7a8762a4dab342bf1f48bb16c655724c5,11/8(金) 20:17
2024-11-09,16:06,world,国際,12イラン人工作員ら3人訴追　トランプ氏暗殺を計画　米司法当局時事通信11/9(土) 6:1924件/時,時事通信,イラン人工作員ら3人訴追　トランプ氏暗殺を計画　米司法当局,24,https://news.yahoo.co.jp/articles/c1cdc06c7b569ba6177a2dbfc497ce31a3d8aab1,11/9(土) 6:19
2024-11-09,16:06,world,国際,13メーガン妃も危機？　“トランプ圧勝”でヘンリー王子「国外追放」の可能性は…トランプ氏次男は「我々はもう彼らを必要としない」発言もデイリー新潮11/9(土) 11:0123件/時,デイリー新潮,メーガン妃も危機？　“トランプ圧勝”でヘンリー王子「国外追放」の可能性は…トランプ氏次男は「我々はもう彼らを必要としない」発言も,23,https://news.yahoo.co.jp/articles/a7ff0d83815b0cf82187fc59280a51b25bd78e63,11/9(土) 11:01
2024-11-09,16:06,world,国際,14「スピード勝負しよう」「お前なんかと?」車をバカにするように笑われ逆上　車で暴走繰り返し止めに入った男性をナイフで殺傷　中国・江蘇省FNNプライムオンライン11/9(土) 12:0222件/時,FNNプライムオンライン,「スピード勝負しよう」「お前なんかと?」車をバカにするように笑われ逆上　車で暴走繰り返し止めに入った男性をナイフで殺傷　中国・江蘇省,22,https://news.yahoo.co.jp/articles/6099a8a06a5356472139472d58d83b6a18a3ab95,11/9(土) 12:02
2024-11-09,16:06,world,国際,15「トランプ勝利」が“第三次世界大戦”を食い止める？　波乱を呼ぶ大統領は「今そこにある世界の危機」にどう対峙するかデイリー新潮11/9(土) 9:1122件/時,デイリー新潮,「トランプ勝利」が“第三次世界大戦”を食い止める？　波乱を呼ぶ大統領は「今そこにある世界の危機」にどう対峙するか,22,https://news.yahoo.co.jp/articles/d2b79694124370364515003333d827cc905a7bfc,11/9(土) 9:11
2024-11-09,16:06,world,国際,16火事現場に迷惑駐車で消防車進めず…「動かすぞ!せーの!」住民が一致団結で車を横転させ開通　サイドミラー破壊も持ち主無言　中国FNNプライムオンライン11/9(土) 15:0221件/時,FNNプライムオンライン,火事現場に迷惑駐車で消防車進めず…「動かすぞ!せーの!」住民が一致団結で車を横転させ開通　サイドミラー破壊も持ち主無言　中国,21,https://news.yahoo.co.jp/articles/d1d83f76e7c7a741a8e846a8f7c738b09d98bb69,11/9(土) 15:02
2024-11-09,16:06,world,国際,17マスク氏、ショルツ首相を「愚か者」呼ばわり 独政府は一蹴ＡＦＰ＝時事11/9(土) 10:5521件/時,ＡＦＰ＝時事,マスク氏、ショルツ首相を「愚か者」呼ばわり 独政府は一蹴,21,https://news.yahoo.co.jp/articles/b3bd753d0bb0dfe45c5f387fdae7e3725c7dbe64,11/9(土) 10:55
2024-11-09,16:06,world,国際,18トランプ氏、総得票も優勢　共和候補20年ぶりか共同通信11/9(土) 5:5320件/時,共同通信,トランプ氏、総得票も優勢　共和候補20年ぶりか,20,https://news.yahoo.co.jp/articles/f5d3abc4b1149a83ad6c666701dfd56f59e5022d,11/9(土) 5:53
2024-11-09,16:06,world,国際,19【米政権交代】　ペロシ氏「バイデン氏が早く撤退していたら」　次期大統領はマスク氏同席でゼレンスキー氏と電話BBC News11/9(土) 12:3819件/時,BBC News,【米政権交代】　ペロシ氏「バイデン氏が早く撤退していたら」　次期大統領はマスク氏同席でゼレンスキー氏と電話,19,https://news.yahoo.co.jp/articles/9910f2d7e08111ca543c367b7e2dfc216afdda98,11/9(土) 12:38
2024-11-09,16:06,world,国際,20米ＡＯＬ「ユー・ガット・メール」の声、エルウッド・エドワーズさん死去CNN.co.jp11/8(金) 14:0219件/時,CNN.co.jp,米ＡＯＬ「ユー・ガット・メール」の声、エルウッド・エドワーズさん死去,19,https://news.yahoo.co.jp/articles/aeb1858329f8037fe6d8fb9b3cc3dcfe79fdd8a8,11/8(金) 14:02
2024-11-09,16:06,world,国際,21米民主党、“お家芸”身内批判　ペロシ氏がバイデン氏に責任押しつけ毎日新聞11/9(土) 7:0716件/時,毎日新聞,米民主党、“お家芸”身内批判　ペロシ氏がバイデン氏に責任押しつけ,16,https://news.yahoo.co.jp/articles/dc3c2f3557d6bb59b71461891d0275af93448765,11/9(土) 7:07
2024-11-09,16:06,world,国際,22トランプ氏が４年前の大統領選を覆そうとした事件、裁判手続き延期…起訴取り下げに向けた動きか読売新聞オンライン11/9(土) 10:4615件/時,読売新聞オンライン,トランプ氏が４年前の大統領選を覆そうとした事件、裁判手続き延期…起訴取り下げに向けた動きか,15,https://news.yahoo.co.jp/articles/7f23882a85d25eded4612d54ae7277de3393b197,11/9(土) 10:46
2024-11-09,16:06,world,国際,23トランプ氏、気候変動対策「パリ協定」からの脱退に向けて準備か 米メディアABEMA TIMES11/9(土) 13:2214件/時,ABEMA TIMES,トランプ氏、気候変動対策「パリ協定」からの脱退に向けて準備か 米メディア,14,https://news.yahoo.co.jp/articles/41b67560be531428e497a3495ec2772b0bde1093,11/9(土) 13:22
2024-11-09,16:06,world,国際,24バイデン氏が早期撤退なら、状況は違っていた可能性─ペロシ氏＝新聞ロイター11/9(土) 7:2013件/時,ロイター,バイデン氏が早期撤退なら、状況は違っていた可能性─ペロシ氏＝新聞,13,https://news.yahoo.co.jp/articles/af0a526f328e1c4de117f508e38e26d517be9914,11/9(土) 7:20
2024-11-09,16:06,world,国際,25トランプ氏とゼレンスキー氏の電話協議、マスク氏も参加　米報道毎日新聞11/9(土) 7:2713件/時,毎日新聞,トランプ氏とゼレンスキー氏の電話協議、マスク氏も参加　米報道,13,https://news.yahoo.co.jp/articles/3658fbce4792638c9eeeb77710ea2bc9a25abc41,11/9(土) 7:27
2024-11-09,16:06,world,国際,26ウクライナのNATO加盟棚上げ　戦闘凍結で、トランプ陣営検討共同通信11/8(金) 18:4012件/時,共同通信,ウクライナのNATO加盟棚上げ　戦闘凍結で、トランプ陣営検討,12,https://news.yahoo.co.jp/articles/18a10dbcf2caed1ef1a9490fb12435e2b6435603,11/8(金) 18:40
2024-11-09,16:06,world,国際,27トランプ氏やその支持者は「反知性主義」なのか？　多くの日本人が誤解していることデイリー新潮11/9(土) 7:1512件/時,デイリー新潮,トランプ氏やその支持者は「反知性主義」なのか？　多くの日本人が誤解していること,12,https://news.yahoo.co.jp/articles/1907ce5cc6d245670d0863333fba9e7bc77437ad,11/9(土) 7:15
2024-11-09,16:06,world,国際,28イーロン・マスク氏、トランプ氏とゼレンスキー氏の電話会談に同席 米メディアABEMA TIMES11/9(土) 13:1811件/時,ABEMA TIMES,イーロン・マスク氏、トランプ氏とゼレンスキー氏の電話会談に同席 米メディア,11,https://news.yahoo.co.jp/articles/b11eef2feb82a86587475c952414865e71cbc1ed,11/9(土) 13:18
2024-11-09,16:06,world,国際,29ガザ地区の戦闘で死亡、7割近くが女性と子供　国連発表BBC News11/9(土) 14:3211件/時,BBC News,ガザ地区の戦闘で死亡、7割近くが女性と子供　国連発表,11,https://news.yahoo.co.jp/articles/11c87b07ea76d4b8e33c2af637d71d67cef61173,11/9(土) 14:32
2024-11-09,16:06,world,国際,30トランプvs習近平・プーチン・金正恩という悪夢、ウクライナ停戦の次は台湾海峡めぐる戦争リスクが急上昇JBpress11/9(土) 10:2611件/時,JBpress,トランプvs習近平・プーチン・金正恩という悪夢、ウクライナ停戦の次は台湾海峡めぐる戦争リスクが急上昇,11,https://news.yahoo.co.jp/articles/b8141237179b80d531b858c1b32d1dd20d5aff43,11/9(土) 10:26
2024-11-09,16:06,world,国際,31完全自動の二足歩行ロボット「アトラス」…韓国系企業が公開「動きが自然すぎる」世界が驚嘆KOREA WAVE11/9(土) 13:0311件/時,KOREA WAVE,完全自動の二足歩行ロボット「アトラス」…韓国系企業が公開「動きが自然すぎる」世界が驚嘆,11,https://news.yahoo.co.jp/articles/fbd0c3da23054b8c824f5786eb0d6bb6bb542418,11/9(土) 13:03
2024-11-09,16:06,world,国際,32ハリス氏の大敗「バイデンのせいだ」…大統領選からの撤退遅れ、「過信とエゴ」に不満も読売新聞オンライン11/8(金) 22:2011件/時,読売新聞オンライン,ハリス氏の大敗「バイデンのせいだ」…大統領選からの撤退遅れ、「過信とエゴ」に不満も,11,https://news.yahoo.co.jp/articles/f472c635b757d21196e8b4a60ace17caf676616d,11/8(金) 22:20
2024-11-09,16:06,world,国際,33米大統領選　街の人はどう受け止めた？ ニューヨークで聞いてみたTBS NEWS DIG Powered by JNN11/9(土) 8:3011件/時,TBS NEWS DIG Powered by JNN,米大統領選　街の人はどう受け止めた？ ニューヨークで聞いてみた,11,https://news.yahoo.co.jp/articles/3ea8d5423c4b9a4ec3f00a52d2af522b20454543,11/9(土) 8:30
2024-11-09,16:06,world,国際,34トヨタ、メキシコで2200億円投資　トランプ氏、高関税警告時事通信11/9(土) 9:2211件/時,時事通信,トヨタ、メキシコで2200億円投資　トランプ氏、高関税警告,11,https://news.yahoo.co.jp/articles/cfa8965a26d6e2242de6d98704edd93bfcbe5862,11/9(土) 9:22
2024-11-09,16:06,world,国際,35世界のリーダーが安倍晋三から学ぶべき「トランプの扱い方」を米紙が指南─「安倍ほどうまくトランプ付き合った指導者はいない」クーリエ・ジャポン11/9(土) 7:5010件/時,クーリエ・ジャポン,世界のリーダーが安倍晋三から学ぶべき「トランプの扱い方」を米紙が指南─「安倍ほどうまくトランプ付き合った指導者はいない」,10,https://news.yahoo.co.jp/articles/fc4ccc561c7535311b5545519f5cbb3db25688a2,11/9(土) 7:50
2024-11-09,16:06,world,国際,36マスク氏、トップ会談参加　ウクライナ支援でも存在感共同通信11/9(土) 6:3210件/時,共同通信,マスク氏、トップ会談参加　ウクライナ支援でも存在感,10,https://news.yahoo.co.jp/articles/353f35948e6fa24598a4791afe7004124b735684,11/9(土) 6:32
2024-11-09,16:06,world,国際,37「トランプ氏は１期目以上に孤立主義追求、間違いなく危険」…ボルトン元大統領補佐官読売新聞オンライン11/9(土) 6:3810件/時,読売新聞オンライン,「トランプ氏は１期目以上に孤立主義追求、間違いなく危険」…ボルトン元大統領補佐官,10,https://news.yahoo.co.jp/articles/97256c660022104073fcc1db52dd89bf082bd4f3,11/9(土) 6:38
2024-11-09,16:06,world,国際,38女性に広がる「4B運動」　トランプ氏勝利に失望、男性と接触拒否　米時事通信11/8(金) 20:3210件/時,時事通信,女性に広がる「4B運動」　トランプ氏勝利に失望、男性と接触拒否　米,10,https://news.yahoo.co.jp/articles/d2321e8687a14c8f75a3bb04aaf82d84d2662b80,11/8(金) 20:32
2024-11-09,16:06,world,国際,39アムステルダムで「反ユダヤ」主義の襲撃が吹き荒れる…襲撃者は「暴力行為」の動画を誇らしげにSNSで公開ニューズウィーク日本版11/9(土) 15:429件/時,ニューズウィーク日本版,アムステルダムで「反ユダヤ」主義の襲撃が吹き荒れる…襲撃者は「暴力行為」の動画を誇らしげにSNSで公開,9,https://news.yahoo.co.jp/articles/8cd9cefb308fe5e38056411599b6480797506c24,11/9(土) 15:42
2024-11-09,16:06,world,国際,40北朝鮮がGPS妨害　船舶や航空機に影響　韓国時事通信11/9(土) 15:109件/時,時事通信,北朝鮮がGPS妨害　船舶や航空機に影響　韓国,9,https://news.yahoo.co.jp/articles/fba0db5ea78f3fd839b37e7a3fcc8f4694891d30,11/9(土) 15:10
