scrp_date,scrp_time,genre_en,genre_jp,rank,media_jp,title,comment,link,date_original
2025-08-21,16:10,sports,スポーツ,1,Full-Count,大谷翔平、今季初黒星に謝罪「申し訳ない」　打球直撃は「今の段階では大丈夫」,160,https://news.yahoo.co.jp/articles/320c7228a5b6879f44e2244e2b31ff3229ec72cd,8/21(木) 12:29
2025-08-21,16:10,sports,スポーツ,2,Full-Count,沖縄尚学、劇的逆転で夏初の決勝進出　エース末吉が6回途中降板も…日大三と頂上決戦へ,155,https://news.yahoo.co.jp/articles/b696cefac1007c50c70b704760e3f18882e85d4e,8/21(木) 13:09
2025-08-21,16:10,sports,スポーツ,3,中日スポーツ,広陵高野球部、中井哲之監督の退任発表 暴力事案めぐり夏の甲子園は辞退…「交代？解任じゃなく？」「会見もせず逃げて」厳しい声,151,https://news.yahoo.co.jp/articles/c0ff4f50e97812b521a05aa5e4364d9ba0a9e7fb,8/21(木) 13:16
2025-08-21,16:10,sports,スポーツ,4,スポニチアネックス,【甲子園】左手にハンデ持つ県岐阜商・横山温大「プロに行けるような選手に」　聖地での完全燃焼に悔いなし,137,https://news.yahoo.co.jp/articles/18fca0c1498c3ba25d3ac5de33f2389ea71795c1,8/21(木) 11:08
2025-08-21,16:10,sports,スポーツ,5,スポニチアネックス,広陵が中井哲之監督の退任を発表　歴代7位春夏通算41勝　夏の甲子園は大会期間中に出場辞退,112,https://news.yahoo.co.jp/articles/64a85fc73931226b14ad680d3c40a5a4d2f1ba57,8/21(木) 11:43
2025-08-21,16:10,sports,スポーツ,6,ベースボールチャンネル,【速報】日大三、14年ぶりの決勝進出！延長タイブレークの末に県岐阜商を破る,107,https://news.yahoo.co.jp/articles/6e246e03e72c6f745c7a6710183ef5fa37cf71e1,8/21(木) 10:30
2025-08-21,16:10,sports,スポーツ,7,スポーツ報知,大谷翔平、右脚に打球直撃のアクシデントで続投も４回９安打５失点降板と乱調　標高１６００メートルの敵地登板に苦戦…節目のメジャー１０００試合目,102,https://news.yahoo.co.jp/articles/0addf8f508571ebf02f16441c3a3273ed5ef49c7,8/21(木) 10:50
2025-08-21,16:10,sports,スポーツ,8,スポーツ報知,【高校野球】広陵の中井哲之監督らが交代　部内暴力事案で夏の甲子園辞退「このままの体制で進むのは…」,98,https://news.yahoo.co.jp/articles/009ea6522ba69b4b3309fbc8d0e48f312e6f28bc,8/21(木) 14:27
2025-08-21,16:10,sports,スポーツ,9,CoCoKARAnext,大谷翔平は「謙虚ではない」――全米中継での野球少女が猛烈批判　“サイン無視の過去”が物議「誰もがオオタニを尊敬しているわけじゃない」,95,https://news.yahoo.co.jp/articles/619920dcda23b2b0ba952bcbe3aa7c2ee7e66790,8/21(木) 11:00
2025-08-21,16:10,sports,スポーツ,10,J-CASTニュース,巨人キャベッジ、怒りの「バット折り」に賛否 空振り三振で真っ二つ「子供に見せられない」「同情します」「懲罰交代してくれ」,90,https://news.yahoo.co.jp/articles/faf21a1dd7d9e06685633d3796cb94da0c73c8f7,8/21(木) 11:45
2025-08-21,16:10,sports,スポーツ,11,東スポWEB,角田裕毅を元Ｆ１ドライバーが酷評「チーム史上最悪」「来年のシート得る資格ない」,83,https://news.yahoo.co.jp/articles/12da30af755ac485ae4b50714ee1548fbd375d4f,8/21(木) 12:16
2025-08-21,16:10,sports,スポーツ,12,デイリースポーツ,巨人・キャベッジ　空振り三振に怒り爆発　バットをへし折り球場騒然　阿部監督も驚く,81,https://news.yahoo.co.jp/articles/1945d4b804513746d276c13d64e66d041293210e,8/20(水) 19:46
2025-08-21,16:10,sports,スポーツ,13,毎日新聞,「前売り券完売」なのになぜ空席？　背景に特殊事情　夏の甲子園,69,https://news.yahoo.co.jp/articles/7284d4fa6a1f0c19d6d965a9dd7043d0748de80b,8/21(木) 6:30
2025-08-21,16:10,sports,スポーツ,14,CoCoKARAnext,阪神29歳内野手は「他球団なら、レギュラー獲れるんじゃ？」2試合連続の遊撃スタメンでマルチ安打、攻守に奮闘、注目の.429「控えで置いておくのは、もったいない」,68,https://news.yahoo.co.jp/articles/5d000d647def3d2af366f5299d8d271a86a50235,8/21(木) 11:26
2025-08-21,16:10,sports,スポーツ,15,中日スポーツ,大谷翔平、異例のネガティブワード連発「申し訳ない」「情けない」「投球に不満」…今季10試合目の登板、課題が明確に「コーナーを狙った球が…」,57,https://news.yahoo.co.jp/articles/9b58a256e11ddd61608129679c87e864e523eadc,8/21(木) 13:51
2025-08-21,16:10,sports,スポーツ,16,東スポWEB,【甲子園】広陵が中井監督の交代を発表　秋季大会出場即発表に疑問の声も「おかしくないか」,55,https://news.yahoo.co.jp/articles/d1067111ff53e3bd3c96852ba7935f903011f056,8/21(木) 13:35
2025-08-21,16:10,sports,スポーツ,17,日刊スポーツ,浅井咲希が心中激白「自律神経が狂ったり」女子プロ３人と不倫で９年間“出禁”キャディーの妻,54,https://news.yahoo.co.jp/articles/f5351f4a5c87a5fb7eae40a36e0fd84cf4d7f131,8/21(木) 15:41
2025-08-21,16:10,sports,スポーツ,18,東スポWEB,「時間切れだ」ロバーツ監督に〝最後通告〟 コンフォート我慢起用に米メディア限界,54,https://news.yahoo.co.jp/articles/889209cdf5a9780df7a4cf5395d423bc011098eb,8/21(木) 12:16
2025-08-21,16:10,sports,スポーツ,19,日刊スポーツ,大谷翔平、２回に３安打許して２失点　元同僚モニアクに159キロを捉えられピンチ広げられる,51,https://news.yahoo.co.jp/articles/82ab17b3fb9eace88b9959490874a89d2ef00593,8/21(木) 10:29
2025-08-21,16:10,sports,スポーツ,20,産経新聞,甲子園辞退の広陵、中井哲之監督が退任　学校側「復帰可能性はあり」秋の地区予選に出場へ,51,https://news.yahoo.co.jp/articles/884955fa3040516329e0d35f84b756f619a9b41a,8/21(木) 12:06
2025-08-21,16:10,sports,スポーツ,21,サンケイスポーツ,ド軍・ロバーツ監督は打撃不振を嘆く「これはもう水に流すしかない」　パ軍に再び1差に詰められる,50,https://news.yahoo.co.jp/articles/d4fbb783c3673a10c8520c8dddb12caa93d3324b,8/21(木) 14:17
2025-08-21,16:10,sports,スポーツ,22,日刊スポーツ,【甲子園】沖縄尚学が逆転で初の決勝進出　新垣有絃が無失点救援　初Ｖ目指し日大三と対戦,49,https://news.yahoo.co.jp/articles/b3bec3c2e073550e4b66b7b5757566b613e2f38f,8/21(木) 13:09
2025-08-21,16:10,sports,スポーツ,23,Yahoo!ニュース オリジナル THE PAGE,【ヤフコメで話題】「神宮球場の座席が狭く観戦が辛い」「観戦環境の改善を望む声」 - 古い球場の観戦環境に関する意見が集まる,49,https://news.yahoo.co.jp/articles/7268fc16ee571aef8788a4ff8ab7d58bd40c1cd7,8/21(木) 11:20
2025-08-21,16:10,sports,スポーツ,24,Full-Count,佐々木朗希、3Aで2度目の登板は4回途中で降板　最速157キロをマークも3安打3四球,48,https://news.yahoo.co.jp/articles/a90918ab45f93cd5af2c979982125c9c1d29377a,8/21(木) 12:26
2025-08-21,16:10,sports,スポーツ,25,デイリースポーツ,広島のアキレス腱が徹底的に攻められた　オール完全セーフの４盗塁　「今からでも対応策を」と岡義朗氏,46,https://news.yahoo.co.jp/articles/3b2577bb7fe3090ba8747985cfbe3c1e0ad70a41,8/21(木) 9:00
2025-08-21,16:10,sports,スポーツ,26,週刊ベースボールONLINE,規定打席未到達も…「野球センス光る23歳の若武者」が首位打者のダークホースに,43,https://news.yahoo.co.jp/articles/2cf70211521eef1015116c4bc0d62df987bdd423,8/21(木) 15:01
2025-08-21,16:10,sports,スポーツ,27,スポニチアネックス,広陵・中井哲之監督退任、新監督は34歳　県高野連「問題ないと確認し、秋季大会出場を了承」,42,https://news.yahoo.co.jp/articles/c909ef7d4eb9598d28fba3146d0c01d1c21fdcbd,8/21(木) 12:26
2025-08-21,16:10,sports,スポーツ,28,週刊SPA!,高校野球のいじめ、しごきは「監督である大人の責任」。日大三の小倉前監督が“某名門校の生徒”に感じた違和感とは,41,https://news.yahoo.co.jp/articles/35a11b70d3f81c021d8e8a7723647839cbed46e2,8/21(木) 8:01
2025-08-21,16:10,sports,スポーツ,29,スポーツ報知,【巨人】５回に一気に４点を奪われる　先発・森田駿哉、５回途中８安打６失点で降板「粘り切れず悔しい」,40,https://news.yahoo.co.jp/articles/ef3228c34d518d6bb465476418c937823f18f8d0,8/20(水) 20:11
2025-08-21,16:10,sports,スポーツ,30,THE DIGEST,佐々木朗希、２度目のリハビリ登板は最速157キロをマークも制球に課題... ３回1/3を２失点、被安打３、奪三振２、与四球３で降板,39,https://news.yahoo.co.jp/articles/385b1c2f16eb829c296c9f0fcf19a767c2dd9bad,8/21(木) 15:11
2025-08-21,16:10,sports,スポーツ,31,東スポWEB,フリー〝発覚〟で中井卓大の去就再注目　根強いＪ待望論も「Ｊ３でも厳しいかもしれん」の声,39,https://news.yahoo.co.jp/articles/3103716259c0beaaa52990a1e2cd3dfff2f35379,8/21(木) 11:45
2025-08-21,16:10,sports,スポーツ,32,日刊スポーツ,大谷翔平「情けない」「自分の投球に不満」4回５失点768日ぶり黒星　打球直撃は「大丈夫かな」,38,https://news.yahoo.co.jp/articles/4757a4063bdc385f988fe9f603d076683f19004e,8/21(木) 12:52
2025-08-21,16:10,sports,スポーツ,33,スポニチアネックス,大谷翔平8回の第4打席で代打送られ途中交代　米通算1000試合は4回5失点＆1安打　打球が右足直撃も,37,https://news.yahoo.co.jp/articles/c764717ffc4b281f69e2b66a686b6ad8721af240,8/21(木) 11:37
2025-08-21,16:10,sports,スポーツ,34,ベースボールキング,江本氏、セ・リーグの2位以下の球団に喝！「反省しないといけない」,37,https://news.yahoo.co.jp/articles/d711fa814c3eee5ce46526c6f1dface6f8c1fe28,8/21(木) 10:00
2025-08-21,16:10,sports,スポーツ,35,デイリースポーツ,山梨学院のエース・菰田陽生　右肘痛めて１回で降板「自分から痛いと言った」逆転負けに泣き崩れる「来年、絶対に戻ってきたい」,37,https://news.yahoo.co.jp/articles/390c377e31858c29fd2fc9414cb6f8d97b09c9e1,8/21(木) 13:33
2025-08-21,16:10,sports,スポーツ,36,Full-Count,大谷翔平ガックリ、無念の4回9安打5失点降板　打球直撃のアクシデントも…またも5回投げ切れず,37,https://news.yahoo.co.jp/articles/6882f141aaebeeca55aedc5ac4c85713237aacdf,8/21(木) 10:59
2025-08-21,16:10,sports,スポーツ,37,TBS NEWS DIG Powered by JNN,大谷翔平、移籍後初黒星...4回9安打5失点と乱調、右脚打球直撃でヒヤリも続投　8回に代打送られ節目の1000試合出場飾れず,36,https://news.yahoo.co.jp/articles/6515744d06d4df3bcc1392fb1af506986a6bea29,8/21(木) 12:00
2025-08-21,16:10,sports,スポーツ,38,日刊スポーツ,【DeNA】筒香嘉智、２軍戦「４番三塁」でNPB復帰後初サード　試合前には三浦監督も視察,36,https://news.yahoo.co.jp/articles/a1b57e78d02be5120238e6d6f092b513009650ce,8/21(木) 13:36
2025-08-21,16:10,sports,スポーツ,39,日刊スポーツ,13ゲーム差で首位独走する阪神が貯金独占　残り40試合切る中で異常事態はいつまで続くのか,36,https://news.yahoo.co.jp/articles/2136a23c34f5d2523d0545f3aae794fe528ff2c8,8/21(木) 11:02
2025-08-21,16:10,sports,スポーツ,40,中日スポーツ,大谷翔平、メジャーワーストタイ被安打９、４イニング５失点降板 ロッキーズ本拠地の“打者天国”に苦しむ,35,https://news.yahoo.co.jp/articles/041564101eb6c1218215ad49ecc57d8a031befe8,8/21(木) 11:16
