scrp_date,scrp_time,genre_en,genre_jp,rank,media_jp,title,comment,link,date_original
2026-02-18,17:21,TTL,総合,1,読売新聞オンライン,１月の訪日外国人客数、単月として４年ぶりにマイナスの３５９万７５００人…日中関係悪化で中国人が大幅減少,807,https://news.yahoo.co.jp/articles/e9a41663e5349596ff453161e1b9f7a6e689ae00,2/18(水) 16:16
2026-02-18,17:21,TTL,総合,2,FNNプライムオンライン（フジテレビ系）,【速報】高市早苗氏を第105代首相に指名　衆院本会議で選出　今夜「第2次高市内閣」発足へ,532,https://news.yahoo.co.jp/articles/f3bcffbc989fcb4dd08ba0acbb7fd5dcaf1543a7,2/18(水) 15:01
2026-02-18,17:21,TTL,総合,3,共同通信,IMF、消費税の減税回避を提言　高市政権案には中立的評価,425,https://news.yahoo.co.jp/articles/026f2e1e2cd3c51c95920e642ed9d490d7cb15b8,2/18(水) 8:30
2026-02-18,17:21,TTL,総合,4,ABEMA TIMES,衆院選で社民党“議席ゼロ”…ラサール石井「非常に反省しなきゃいけない」「大きな変革をしないと絶対ダメだ」,315,https://news.yahoo.co.jp/articles/4826ffe63f721bb73151a83fc0929085aec6490f,2/18(水) 15:21
2026-02-18,17:21,TTL,総合,5,朝日新聞,高市首相、裁量労働制の見直し表明へ　拡充念頭か、施政方針演説原案,272,https://news.yahoo.co.jp/articles/e40eed125f3794cd572d36c4319c1ce1c0a17611,2/17(火) 20:47
2026-02-18,17:21,TTL,総合,6,TBS NEWS DIG Powered by JNN,【速報】高市内閣が総辞職　18日夜には第2次高市内閣発足へ　全閣僚再任の方針,254,https://news.yahoo.co.jp/articles/714707f4042e54a3507a3ee78e47a26ed98e93aa,2/18(水) 9:16
2026-02-18,17:21,TTL,総合,7,毎日新聞,旧警備業法は「違憲」　最高裁が初判断　成年後見利用者の就業を制限,239,https://news.yahoo.co.jp/articles/fcc7cb49de0edd36cf4fe4f53210ccd88930ab72,2/18(水) 15:33
2026-02-18,17:21,TTL,総合,8,日刊スポーツ,萩生田光一氏、新人議員研修で「一般的な心構えをお話しました」高市チルドレンら66人当選,231,https://news.yahoo.co.jp/articles/d7d289ca613a5f2d94c9f8f3f1ba6d424f05cd1a,2/18(水) 15:19
2026-02-18,17:21,TTL,総合,9,日刊スポーツ,蓮舫氏、午前４時すぎのＸ更新「気持ちはまだ静まりません」,222,https://news.yahoo.co.jp/articles/3eb150f0d15bbd50ee554a6611daa94f41c226f6,2/18(水) 9:13
2026-02-18,17:21,TTL,総合,10,スポニチアネックス,石原伸晃氏　“高市チルドレン”66人に皮肉「手を振ってるだけで当選しちゃった人もたくさん」,203,https://news.yahoo.co.jp/articles/77961ff2d719e9c0ed259c553699d3b2e7db5802,2/18(水) 16:08
2026-02-18,17:21,TTL,総合,11,デイリースポーツ,カーリング日本女子が涙の予選敗退　吉村も目に涙ため「悔しい気持ちでいっぱい。思い描いた結果にはならなかった」伊に敗れ６敗目で単独最下位に転落　３大会連続メダルの夢散る,188,https://news.yahoo.co.jp/articles/dcb632bad7f9336fbae603d4ed0d6672502786e1,2/18(水) 0:52
2026-02-18,17:21,TTL,総合,12,よろず～ニュース,れいわ離党前議員が痛烈批判 山本太郎代表、大石晃子共同代表に「物申す」「選挙の大敗の責任を」,185,https://news.yahoo.co.jp/articles/5f240d86f46057afe974d957ad1d15cabb8da2c2,2/18(水) 7:00
2026-02-18,17:21,TTL,総合,13,広島テレビ　ニュース,【速報】カープ・羽月被告を保釈　指定薬物使用の罪で前日に起訴,179,https://news.yahoo.co.jp/articles/0b6ba08bf98d5ba7af9fe895ecbaa499717b0a24,2/18(水) 11:51
2026-02-18,17:21,TTL,総合,14,AERA DIGITAL,国境を超える「買春」　ラオスで日本人が9歳少女を買春も,168,https://news.yahoo.co.jp/articles/e050035791bdd0dcc76d5197982f8256df836ace,2/17(火) 17:30
2026-02-18,17:21,TTL,総合,15,J-CASTニュース,れいわ新選組の新共同代表・奥田芙美代氏、打診に思い「地獄の釜の中に放り投げられる思い」,165,https://news.yahoo.co.jp/articles/7f8b45ef7ee826e6530a0cb8d07e63f219e8c178,2/18(水) 13:15
2026-02-18,17:21,TTL,総合,16,J-CASTニュース,落選の中道・酒井菜摘氏、娘からの質問に涙「ママ普通の人になったの？」　「娘と一緒にお風呂に入れる毎日が幸せ」,161,https://news.yahoo.co.jp/articles/5ca62a66ea3e885cefce29938ec2f15ef095c193,2/18(水) 13:00
2026-02-18,17:21,TTL,総合,17,毎日新聞,中学2年生、独学で国家資格など6資格取得　大卒レベルの資格も,160,https://news.yahoo.co.jp/articles/4fee1bf85710f6b05b7b6dc06cb58a47e406c664,2/18(水) 12:00
2026-02-18,17:21,TTL,総合,18,デイリー新潮,枝野幸男氏が落選後初めて胸中を独占告白「負けたのは足腰が弱っていただけ」「AKB48ならば『チャンスの順番』みたいな境地」,158,https://news.yahoo.co.jp/articles/5027fc6f624a4e0ec40b6f1eab4ec4b45862a4af,2/18(水) 11:32
2026-02-18,17:21,TTL,総合,19,毎日新聞,れいわ唯一の当選　山本譲司氏「四半世紀ぶりの国会議事堂で鬼退治」,148,https://news.yahoo.co.jp/articles/dd06b80d0f8f5ff83977f67762f9f0b58fdcc3c2,2/18(水) 11:58
2026-02-18,17:21,TTL,総合,20,女性自身,「橋下さんに絡んで味を占めて…」れいわ元副代表　大石あきこ氏の国民・玉木代表への“噛みつき”に警告…「お金大好き」とも揶揄され大石氏は猛反発,141,https://news.yahoo.co.jp/articles/5dc14d00415d31e9c177ea209deeadc1ee7f1845,2/18(水) 11:00
2026-02-18,17:21,TTL,総合,21,日刊スポーツ,野田佳彦氏「ガチンコ勝負で負けた実感ない」に落選議員が次々ツッコミ「現実逃避」「戦略ミス」,140,https://news.yahoo.co.jp/articles/e0d777c34810910972ce3ffc4fc80e5a417de094,2/18(水) 10:04
2026-02-18,17:21,TTL,総合,22,ABEMA TIMES,独自インタビューで心情吐露…「立憲に戻りたい」中道で落選の亀井亜紀子氏が“離党→立憲復党”を検討…「もっと立憲所属の地方議員の話なども聞くべきだった」,139,https://news.yahoo.co.jp/articles/656f08242fe5073dedb905b5e64076c6fee9fad2,2/18(水) 11:30
2026-02-18,17:21,TTL,総合,23,デイリースポーツ,【高市解散】壊滅れいわ　落選した大石晃子氏が共同代表続投→批判や疑念に反発「私は無給でやります」事実でないことを言い連ねるのはいいかげんにして　「いざ地獄の釜に突入」と,136,https://news.yahoo.co.jp/articles/f8a695598f8e6dc5d2b4cb0aaf168c8ba81c1b92,2/17(火) 17:55
2026-02-18,17:21,TTL,総合,24,文春オンライン,中道改革連合トップが警察の警護対象から外されていた！ 新代表・小川淳也氏事務所が「その通りです」と認める《衆院「野党第一党」に異例事態、「50議席以下」理由か》,134,https://news.yahoo.co.jp/articles/982de50ddb9ccd3fa790cca4f45b39ab727b8a2e,2/18(水) 16:12
2026-02-18,17:21,TTL,総合,25,スポニチアネックス,チームみらいが声明　ネット上で拡散されている情報に「行った事実はございません」,123,https://news.yahoo.co.jp/articles/52b387c1b226168390ad391b5cda318346b73810,2/18(水) 15:18
2026-02-18,17:21,TTL,総合,26,オリコン,『おかあさんといっしょ』“あづきおねえさん”秋元杏月、卒業を発表　7年を振り返り「本当に幸せな日々」　初代体操のお姉さん,122,https://news.yahoo.co.jp/articles/a2c1a0bfd6a38e82b8d14768f20b4f25ceb4119c,2/18(水) 15:30
2026-02-18,17:21,TTL,総合,27,中日スポーツ,「流石に笑う」 高市早苗首相、公式サイトから『ブログ全削除』か…過去には消費増税に理解の投稿 「隠滅しちゃったんだ」疑問の声,121,https://news.yahoo.co.jp/articles/439f42b40548a3a3c93ab0044ad19114d3063427,2/18(水) 11:30
2026-02-18,17:21,TTL,総合,28,スポニチアネックス,中道・安住淳氏撃破の自民・森下千里氏が爽やかに登院　選挙期間中の“SNS場外戦”にも言及,119,https://news.yahoo.co.jp/articles/8c8d702af4243dad72fb755245d2571929f1ee42,2/18(水) 16:14
2026-02-18,17:21,TTL,総合,29,TeNYテレビ新潟,中3少女が行方不明から3週間　情報提供は「似ている人を見た」など全国から約150件寄せられるも発見に至らず（18日正午時点）《新潟・十日町》,117,https://news.yahoo.co.jp/articles/adc07194747229870853d499610cf3e10e43b491,2/18(水) 12:10
2026-02-18,17:21,TTL,総合,30,時事通信,財源や外食離れ、高いハードル　食品消費税ゼロ、議論本格化へ　高市政権,110,https://news.yahoo.co.jp/articles/bc0aadc2f2a3bd4fa6d193423aa63027eed81974,2/18(水) 7:09
2026-02-18,17:21,TTL,総合,31,共同通信,日本の対米投資第1号決定　5.5兆円規模、3事業,107,https://news.yahoo.co.jp/articles/2370ece10d6effa45fd1a1705055fc15264777df,2/18(水) 6:16
2026-02-18,17:21,TTL,総合,32,テレビ静岡NEWS,学歴詐称の田久保前市長　代理人は押収拒絶権に自信「日本の弁護士で一番研究している」　3度目の事情聴取に応じる　強制捜査を受けてもなお卒業証書は提出しない方針　「否認事件であれば基本的に黙秘が原則」,106,https://news.yahoo.co.jp/articles/baefff33fe5b312627203a87b4534d9b7ad9d2a8,2/18(水) 11:55
2026-02-18,17:21,TTL,総合,33,時事通信,村山富市元首相しのぶ会、4月に延期,104,https://news.yahoo.co.jp/articles/a33ea68b9c907bad43c9c1e7457d0070fcd1dc88,2/18(水) 15:29
2026-02-18,17:21,TTL,総合,34,日刊スポーツ,れいわ大石晃子氏「改憲止めるために、いざ地獄の釜に突入」新共同代表の女性参院議員にエール,104,https://news.yahoo.co.jp/articles/6df783f137e09ecdf8d38ec640d8b62c7e04d3e2,2/18(水) 10:48
2026-02-18,17:21,TTL,総合,35,デイリースポーツ,１７歳、中井亜美が衝撃の首位発進！３Ａ成功で今季世界２位スコア「正直ビックリ」坂本花織が２位、千葉百音が４位で日本勢表彰台独占見据え１９日フリーへ,100,https://news.yahoo.co.jp/articles/d0d13507ace75985180932c33acfecf35f2116aa,2/18(水) 7:00
2026-02-18,17:21,TTL,総合,36,CoCoKARAnext,「メダルを奪われた」「銅はブリキに」ジャンプ4位ドイツも不満爆発…母国紙「運営側は一体何を考えていたのか？」【冬季五輪】,97,https://news.yahoo.co.jp/articles/a73e14a062a1ac32cae1085bf530a57d04df4a8a,2/18(水) 16:00
2026-02-18,17:21,TTL,総合,37,日刊スポーツ,【フィギュア】SP3位アリサ・リュウ「メダル？そんなものいらない」トップ中井亜美追う世界女王,95,https://news.yahoo.co.jp/articles/0675f444cd0f2d373314d894bf008a92d4847d16,2/18(水) 8:25
2026-02-18,17:21,TTL,総合,38,読売新聞オンライン,第２次高市内閣きょう発足、全閣僚を再任へ…党人事では衆院憲法審査会長に古屋圭司氏を起用方針,92,https://news.yahoo.co.jp/articles/f1594b9e2c5a24a0dd39c9bf12846d2dd05a6e0d,2/18(水) 5:01
2026-02-18,17:21,TTL,総合,39,日テレNEWS NNN,帰宅途中の女子高校生の顔面を殴り…財布奪ったか　中国籍の男を逮捕　横浜市,91,https://news.yahoo.co.jp/articles/70ab12157ea37bb5a97273b397d40b16d6c25d37,2/18(水) 10:39
2026-02-18,17:21,TTL,総合,40,PHILE WEB,Paramount+、3月末で日本での提供終了へ。「権利元の都合」により,90,https://news.yahoo.co.jp/articles/91e86c86c089f720af59c2547e78dc468b790e13,2/18(水) 13:25
