scrp_date,scrp_time,genre_en,genre_jp,rank,media_jp,title,comment,link,date_original
2025-03-25,09:32,domestic,国内,1,読売新聞オンライン,７５歳以上のＡＴＭ利用、上限３０万円に…特殊詐欺対策で警察庁検討,464,https://news.yahoo.co.jp/articles/cd3f06445f76483f441b354af418bce74ee87d20,3/25(火) 5:00
2025-03-25,09:32,domestic,国内,2,共同通信,首相、備蓄米追加放出も　「必要ならためらわず」,239,https://news.yahoo.co.jp/articles/11360469ecc790bdc6044431db94100a16ff5e51,3/24(月) 20:25
2025-03-25,09:32,domestic,国内,3,J-CASTニュース,民泊に1人で予約→6人で滞在、ゴミも散乱　中国人客に追加料金＆清掃代請求、経営者が明かしたその顛末,217,https://news.yahoo.co.jp/articles/e05f4171f5f1b43c1e5b56e7963c8e0dfda6c81f,3/24(月) 17:17
2025-03-25,09:32,domestic,国内,4,産経新聞,岩屋外相、王毅氏と「修学旅行の相互受け入れ促進」も「日本の学校に中国旅行を求めない」,199,https://news.yahoo.co.jp/articles/1f622f32aa2d05b21dbf9ee553d1e39c235bb8d5,3/25(火) 7:30
2025-03-25,09:32,domestic,国内,5,文春オンライン,《10万円の商品券報道》60％の人が“首相をやめる必要はない”と…それでも石破首相は辞めるべきだと考えるワケ「どっちみち使い捨てなのである」,180,https://news.yahoo.co.jp/articles/f6a60742f9b3922711345cbdf756dca94c894ec6,3/25(火) 6:12
2025-03-25,09:32,domestic,国内,6,共同通信,首相、再開の夜会食で陳謝　商品券配布問題で自粛,175,https://news.yahoo.co.jp/articles/dffa81350d467fd27f2111dbdeab89fe4a871863,3/24(月) 21:49
2025-03-25,09:32,domestic,国内,7,TBS NEWS DIG Powered by JNN,【速報】東京・西東京市のスナックで刺し傷のある男女が倒れているのを発見　女性は死亡、男性は意識もうろう状態で搬送　警視庁,149,https://news.yahoo.co.jp/articles/9601af21f15511b1c80cd36429b83ebb332b1a65,3/25(火) 7:21
2025-03-25,09:32,domestic,国内,8,文春オンライン,生産農家は「むしろ遅すぎ」と農水省の備蓄米放出を痛烈批判…「令和の米騒動」迎えた“新局面”,140,https://news.yahoo.co.jp/articles/912086a1b35513fb63c2c0ea50c748d5b1a1da71,3/25(火) 6:12
2025-03-25,09:32,domestic,国内,9,産経新聞,年290万円の院生支援、3割は中国人留学生　自民・有村氏「日本も自国の学生重視して」,137,https://news.yahoo.co.jp/articles/b08cfb990d5e528805834ecb2e60e9dfd41012f3,3/25(火) 7:10
2025-03-25,09:32,domestic,国内,10,スポニチアネックス,橋下徹氏　生番組で7分ず～っと泉房穂氏“口撃”　泉氏は“挑発”「いつまでも評論家やっとらんと…」,130,https://news.yahoo.co.jp/articles/0f46bed1579e6f7869684e1b9ec9ef6e538b0828,3/25(火) 5:30
2025-03-25,09:32,domestic,国内,11,集英社オンライン,〈大阪万博〉前売り券売上「1000万枚超え」も、その内訳に感じる圧倒的な違和感…早くもはじまった“集客ミス”の戦犯さがし,121,https://news.yahoo.co.jp/articles/f8c8ad37814971e21f25a848c4077d996850e5b6,3/25(火) 7:02
2025-03-25,09:32,domestic,国内,12,中日スポーツ,成田悠輔氏の弟・修造氏、「子供持ちたくない人バカだな」投稿への意見に補足説明「ステータスや属性批判してない」「社会構造自体がろくでもない」,118,https://news.yahoo.co.jp/articles/0aa218e9dca91c0b6f314a7ce2444a829c7157dd,3/25(火) 6:00
2025-03-25,09:32,domestic,国内,13,共同通信,給与増へ官民比較見直しを提言　国家公務員のなり手不足解消へ,115,https://news.yahoo.co.jp/articles/e8a4fbdf4eb9844e2a9b913e7e90e7a0ccdabfc6,3/24(月) 12:50
2025-03-25,09:32,domestic,国内,14,デイリー新潮,「小室さん夫妻」は「9・6」に一時帰国となるか　平安貴族の衣装で行われる「成年式」に合わせて,114,https://news.yahoo.co.jp/articles/fb49606d6ed7167589463d3618c226956eeeeebf,3/25(火) 6:13
2025-03-25,09:32,domestic,国内,15,デイリースポーツ,橋下徹氏　「斎藤さんを支持している方に考えてもらいたい」→選挙で許される問題と許されない問題がある,94,https://news.yahoo.co.jp/articles/709785c616f96ac20b7849284017252deea8f29e,3/24(月) 10:32
2025-03-25,09:32,domestic,国内,16,テレビ朝日系（ANN）,林官房長官『事実と異なり遺憾、直ちに削除要請』石破総理と王毅外相面会の中国発表文,94,https://news.yahoo.co.jp/articles/2262c66eee591fb607b0690c40c82dd59b4b880e,3/24(月) 12:32
2025-03-25,09:32,domestic,国内,17,産経新聞,「日本人ではなく『クルド人ではない方』の誤り」大野知事、答弁を訂正し謝罪　感謝状問題　「移民」と日本人,94,https://news.yahoo.co.jp/articles/29b732aad35d27364fdc8df0d8ce344e3719ce55,3/25(火) 7:00
2025-03-25,09:32,domestic,国内,18,J-CASTニュース,「極めて重大かつ許されない不敬行為」で「観光目的での参入を全てお断り」　対馬の神社が異例声明,91,https://news.yahoo.co.jp/articles/84b9188b6497822099cdf873d2b22cbfe5da104d,3/24(月) 11:20
2025-03-25,09:32,domestic,国内,19,よろず～ニュース,「不敬行為」「神域を荒らされる」対馬の神社が観光・撮影を拒否！外国人の「暴言」も　警察、役所も解決できず,90,https://news.yahoo.co.jp/articles/d8f6c3e6150050ffc0fa32e2a47c5dd19caa0bb8,3/25(火) 6:50
2025-03-25,09:32,domestic,国内,20,共同通信,国民民主党、地方選で好調　静岡市議に公認候補がトップ当選,90,https://news.yahoo.co.jp/articles/91d2d9f527a1851ed5147901695d1c4627b674d2,3/24(月) 17:59
2025-03-25,09:32,domestic,国内,21,読売新聞オンライン,再審無罪の袴田巌さんに２億１７００万円交付へ…刑事補償としては過去最高額か,86,https://news.yahoo.co.jp/articles/31a8c7c6e8244016a411ed261a9fef077afb5d67,3/24(月) 18:52
2025-03-25,09:32,domestic,国内,22,ABEMA TIMES,万博２億円トイレに批判「一般的なものより安い」「一部を切り取った物だった」設計者が反論,81,https://news.yahoo.co.jp/articles/57909d1fa1cdcf549564ddcbecd0c2981f091654,3/25(火) 6:52
2025-03-25,09:32,domestic,国内,23,時事通信,国民・玉木氏、対決路線に自信　「手取り増」堅持で勢い持続,76,https://news.yahoo.co.jp/articles/d17b90f8c5320e63bc131f3be2d48937d59304a8,3/25(火) 7:06
2025-03-25,09:32,domestic,国内,24,関西テレビ,【速報】兵庫県議会共産党が斎藤知事に辞職求める声明を県に提出　「パワハラ認定」など第三者委の報告受け,74,https://news.yahoo.co.jp/articles/70e3300e2f0f5d8545e7e8396879ba28bd466ae2,3/24(月) 17:00
2025-03-25,09:32,domestic,国内,25,読売新聞オンライン,福岡女性刺殺、当時１５歳の受刑者に５４００万円の賠償命令…母親の監督義務違反は認めず,70,https://news.yahoo.co.jp/articles/8fff744134c78cf1d69d9e111b9770892f1dd7a8,3/24(月) 11:56
2025-03-25,09:32,domestic,国内,26,集英社オンライン,おたる水族館で７万円の無料貸出ベビーカーが紛失「こっそりでもいいから返して」「特定の国のかたの仕業という声もSNSにありますが…」担当者のホンネ,69,https://news.yahoo.co.jp/articles/5613077a7ce95f48f5af1c2e70373d231059179b,3/24(月) 19:57
2025-03-25,09:32,domestic,国内,27,TBS NEWS DIG Powered by JNN,9歳の子ひとり避難、家に残った母　東京大空襲80年「逃げなかった」人たち　防空法と市民に広がった同調圧力　#きおくをつなごう #戦争の記憶,63,https://news.yahoo.co.jp/articles/625db3f0b4635a76f59513f99c1de90f55ca5458,3/24(月) 18:05
2025-03-25,09:32,domestic,国内,28,スポニチアネックス,橋下徹氏の主な発言「卑怯」「国会議員になりたいだけ」「勝負せんかい!」,58,https://news.yahoo.co.jp/articles/c6061feca27f45f19bfcc617231eb7177265cee7,3/25(火) 5:30
2025-03-25,09:32,domestic,国内,29,産経新聞,大阪・関西万博「全く行きたくない」44・2％　約7割が来場に否定的　産経・FNN合同世論調査,55,https://news.yahoo.co.jp/articles/95dc1724bf5d5e2d252a2090fa42b3205998e0d5,3/24(月) 15:16
2025-03-25,09:32,domestic,国内,30,現代ビジネス,「住所不定・無職」をまるで犯罪者のように…「働かない人」に厳しすぎる「日本の大問題」,54,https://news.yahoo.co.jp/articles/c0682a7414e9bdc4612bf45122101303d415a17c,3/25(火) 7:01
2025-03-25,09:32,domestic,国内,31,産経新聞,尖閣沖の中国海警船「退去させた」と海保が発表　領海侵入、過去最長への対抗措置か,52,https://news.yahoo.co.jp/articles/bd05797950c36412409d2db1e60b786c03e6d263,3/25(火) 7:50
2025-03-25,09:32,domestic,国内,32,女性自身,愛子さま　両陛下も期待寄せられる佳子さまとの“ペアご公務”、トラブルにも連携プレイで対処の「抜群の相性」,50,https://news.yahoo.co.jp/articles/bd284a7823abc0b7947f63dc206a1a44a8b307c7,3/25(火) 6:00
2025-03-25,09:32,domestic,国内,33,プレジデントオンライン,「反リニア」の川勝知事のほうがマシだった…「推進派」知事がトップに立っても開通が「遠い未来のまま」なワケ,49,https://news.yahoo.co.jp/articles/41f6b9a93d15f96654902bcfbb95a67404ea0647,3/25(火) 6:17
2025-03-25,09:32,domestic,国内,34,読売新聞オンライン,兵庫県の斎藤知事に共産党県委が辞職要求…「首長としての資質を備えていない」,47,https://news.yahoo.co.jp/articles/73fa44fe0b9fa4346f4a8817531d305c38fc3ad9,3/24(月) 19:20
2025-03-25,09:32,domestic,国内,35,文春オンライン,「多くは廃業、生活保護を受けている元ヤクザも…」ヤクザをやめた人はどうやって生活している？ ピークからはすでに10分の1以下に…《暴力団員が初の1万人割れ》,47,https://news.yahoo.co.jp/articles/acb634a2db29ce13f707747c8d4c5421e260587e,3/25(火) 7:12
2025-03-25,09:32,domestic,国内,36,FNNプライムオンライン,【注意】取得の順番を間違えると“交通違反”のおそれ?マイナ免許証のメリットと留意点を解説　初日は全国でトラブルも,46,https://news.yahoo.co.jp/articles/fe3b2759a0f82fc1a1f48bbafa6008dbbf5d71da,3/24(月) 20:32
2025-03-25,09:32,domestic,国内,37,FNNプライムオンライン,「ズルい、卑怯だ」橋下徹氏が泉房穂氏の参院選出馬表明に厳しい言葉『政権交代』と言いながら参院出馬に「国会議員になりたいだけなのか」,44,https://news.yahoo.co.jp/articles/1297df5c7d527a2083b9a176b5cb03791addcc58,3/24(月) 17:49
2025-03-25,09:32,domestic,国内,38,テレビ朝日系（ANN）,「アルファード」町長公用車に認められず,42,https://news.yahoo.co.jp/articles/627fef82698d041d0e6f8a9fdc3231b1cc3631dc,3/25(火) 9:06
2025-03-25,09:32,domestic,国内,39,日刊スポーツ,辛坊治郎氏、参院選出馬表明の泉房穂氏は「勉強が極めて良くできる一方、ある種の…」人格に言及,40,https://news.yahoo.co.jp/articles/364c3c2176422e57fe79a0f3f66c3aba94635c00,3/25(火) 7:13
2025-03-25,09:32,domestic,国内,40,産経新聞,国民民主が静岡、東京・小金井など4市議選トップ当選　玉木代表「手取り増の思い後押し」,40,https://news.yahoo.co.jp/articles/21960a77c4628db29545480ece96610e0cdbf8d6,3/25(火) 7:00
