scrp_date,scrp_time,genre_en,genre_jp,rank,media_jp,title,comment,link,date_original
2024-10-06,11:31,sports,スポーツ,1大谷翔平 PS開幕戦でいきなり同点3ラン！バット放り投げ雄叫び、初回3失点の由伸を援護、本拠地は大熱狂TBS NEWS DIG Powered by JNN10/6(日) 10:25622件/時,TBS NEWS DIG Powered by JNN,大谷翔平 PS開幕戦でいきなり同点3ラン！バット放り投げ雄叫び、初回3失点の由伸を援護、本拠地は大熱狂,622,https://news.yahoo.co.jp/articles/8e2e7533031f644df08e3a2e938f65a206a10321,10/6(日) 10:25
2024-10-06,11:31,sports,スポーツ,2【ヤクルト】村上宗隆が来オフに米移籍へ　「25歳ルール」満たせず今オフは断念日刊スポーツ10/6(日) 5:00266件/時,日刊スポーツ,【ヤクルト】村上宗隆が来オフに米移籍へ　「25歳ルール」満たせず今オフは断念,266,https://news.yahoo.co.jp/articles/35132321e4e8b85932c6fa289a51543327e94a1e,10/6(日) 5:00
2024-10-06,11:31,sports,スポーツ,3岡本和真メジャー挑戦の現実味　巨人が「阪神・大山獲り」FA参戦の可能性AERA dot.10/6(日) 8:32235件/時,AERA dot.,岡本和真メジャー挑戦の現実味　巨人が「阪神・大山獲り」FA参戦の可能性,235,https://news.yahoo.co.jp/articles/da2e87e824dd686607627d2d6e769cc79b2fd5b7,10/6(日) 8:32
2024-10-06,11:31,sports,スポーツ,4ドジャース大谷翔平、ポストシーズン初本塁打 持ってる男だ…同点3ランで山本由伸を援護中日スポーツ10/6(日) 10:26123件/時,中日スポーツ,ドジャース大谷翔平、ポストシーズン初本塁打 持ってる男だ…同点3ランで山本由伸を援護,123,https://news.yahoo.co.jp/articles/fac0ad6e02bd34c6635b94c4f74c77b28fd596dd,10/6(日) 10:26
2024-10-06,11:31,sports,スポーツ,5【BreakingDown】瓜田純士「こんなに打たれ弱くなってたらもう無理」　10人ニキにまさかのダウン…敗戦に悲痛ENCOUNT10/6(日) 8:47110件/時,ENCOUNT,【BreakingDown】瓜田純士「こんなに打たれ弱くなってたらもう無理」　10人ニキにまさかのダウン…敗戦に悲痛,110,https://news.yahoo.co.jp/articles/f49b43b37e7f25d2c1ab6ef2b97eb69ca2bf67ca,10/6(日) 8:47
2024-10-06,11:31,sports,スポーツ,6巨人　菅野智之がＭＬＢ挑戦を表明「向こうでプレーする気持ちでいる」一方で「大事な時期に申し訳ない」デイリースポーツ10/5(土) 12:01106件/時,デイリースポーツ,巨人　菅野智之がＭＬＢ挑戦を表明「向こうでプレーする気持ちでいる」一方で「大事な時期に申し訳ない」,106,https://news.yahoo.co.jp/articles/5cef9ff38149c8965e25d38b3a2f2074ee46c682,10/5(土) 12:01
2024-10-06,11:31,sports,スポーツ,7大谷翔平フィーバーに那須川天心が本音ポロリ「テレビつけたら大谷選手ばっかで飽きないですか？」東スポWEB10/5(土) 15:1193件/時,東スポWEB,大谷翔平フィーバーに那須川天心が本音ポロリ「テレビつけたら大谷選手ばっかで飽きないですか？」,93,https://news.yahoo.co.jp/articles/27765b63334cb285c9550857d20cfcc3c236ed0e,10/5(土) 15:11
2024-10-06,11:31,sports,スポーツ,8【中日】片岡篤史ヘッドコーチ、落合英二投手兼育成コーチ、和田一浩打撃コーチら5人が今季限りで退団中日スポーツ10/6(日) 5:0086件/時,中日スポーツ,【中日】片岡篤史ヘッドコーチ、落合英二投手兼育成コーチ、和田一浩打撃コーチら5人が今季限りで退団,86,https://news.yahoo.co.jp/articles/63c69d29dcfd0c4ee97ee535ce4a5fc9b5021210,10/6(日) 5:00
2024-10-06,11:31,sports,スポーツ,9大谷の同点弾直後に…山本由伸が3回にも2失点　ボガーツ勝ち越し打に悔しさあらわ　3回5失点で降板スポニチアネックス10/6(日) 10:4682件/時,スポニチアネックス,大谷の同点弾直後に…山本由伸が3回にも2失点　ボガーツ勝ち越し打に悔しさあらわ　3回5失点で降板,82,https://news.yahoo.co.jp/articles/9bf040783da9dadcc6b85f271367d1f7f24f0f25,10/6(日) 10:46
2024-10-06,11:31,sports,スポーツ,10【阪神】岡田彰布監督が退任を表明　甲子園での練習前にナイン、スタッフ集めて日刊スポーツ10/6(日) 10:4482件/時,日刊スポーツ,【阪神】岡田彰布監督が退任を表明　甲子園での練習前にナイン、スタッフ集めて,82,https://news.yahoo.co.jp/articles/9d03a5daaac9963b5722e44f7c7c512c5147f847,10/6(日) 10:44
2024-10-06,11:31,sports,スポーツ,11「帰っていい」に即反応も…扱いは“ボイコット”　頭に来た指揮官の「使えねぇーんだよ」Full-Count10/6(日) 6:5081件/時,Full-Count,「帰っていい」に即反応も…扱いは“ボイコット”　頭に来た指揮官の「使えねぇーんだよ」,81,https://news.yahoo.co.jp/articles/ca371d2d50f14820d3cbfe804f991d165b29a9bd,10/6(日) 6:50
2024-10-06,11:31,sports,スポーツ,12ドジャース”開幕投手”の山本由伸、初回いきなり3失点…パドレス4番マチャドに2ラン被弾、28球費やす中日スポーツ10/6(日) 10:0777件/時,中日スポーツ,ドジャース”開幕投手”の山本由伸、初回いきなり3失点…パドレス4番マチャドに2ラン被弾、28球費やす,77,https://news.yahoo.co.jp/articles/5e4416fe8701d6b267a657ac000a195e79be5f88,10/6(日) 10:07
2024-10-06,11:31,sports,スポーツ,13大谷翔平の同点３ラン直後に…　山本由伸が２点二塁打で再び勝ち越し許す　マウンド上で悔しさ爆発スポーツ報知10/6(日) 10:4574件/時,スポーツ報知,大谷翔平の同点３ラン直後に…　山本由伸が２点二塁打で再び勝ち越し許す　マウンド上で悔しさ爆発,74,https://news.yahoo.co.jp/articles/49a4585379b42d835ac3a378cced65e8751ffe26,10/6(日) 10:45
2024-10-06,11:31,sports,スポーツ,14阪神・藤川球児SA、来季監督内諾　球団が水面下で就任要請　CSと並行して新政権へ着々サンケイスポーツ10/6(日) 7:3074件/時,サンケイスポーツ,阪神・藤川球児SA、来季監督内諾　球団が水面下で就任要請　CSと並行して新政権へ着々,74,https://news.yahoo.co.jp/articles/61d8316e29d66aceb25369ebbe8339ca56c2d0c9,10/6(日) 7:30
2024-10-06,11:31,sports,スポーツ,15片岡ヘッドらコーチ5人が退団へ　中日、落合、和田コーチも共同通信10/6(日) 10:3273件/時,共同通信,片岡ヘッドらコーチ5人が退団へ　中日、落合、和田コーチも,73,https://news.yahoo.co.jp/articles/56d26dcf417702c31adf678a59045b7b60919f52,10/6(日) 10:32
2024-10-06,11:31,sports,スポーツ,16大谷翔平が同点３ランで絶叫！　PS初出場で本塁打の偉業！　日本人ＰＳ１２年ぶりアーチスポーツ報知10/6(日) 10:2573件/時,スポーツ報知,大谷翔平が同点３ランで絶叫！　PS初出場で本塁打の偉業！　日本人ＰＳ１２年ぶりアーチ,73,https://news.yahoo.co.jp/articles/6aa3ce68389b1730b8c03943d83e144970650a8f,10/6(日) 10:25
2024-10-06,11:31,sports,スポーツ,17「僕の人生もある」勇退か、続投か　注目集める新庄監督の去就問題　球界OBに語っていた＂本音＂とはCoCoKARAnext10/6(日) 10:3070件/時,CoCoKARAnext,「僕の人生もある」勇退か、続投か　注目集める新庄監督の去就問題　球界OBに語っていた＂本音＂とは,70,https://news.yahoo.co.jp/articles/c4668622961651747c4823d573eaf21e489f04e8,10/6(日) 10:30
2024-10-06,11:31,sports,スポーツ,18”イメチェン”瓜田純士、10人ニキにダウン奪われ敗退「もう無理だな、金髪でコンビニ行くのも恥ずかしい」引退示唆かイーファイト10/6(日) 7:0368件/時,イーファイト,”イメチェン”瓜田純士、10人ニキにダウン奪われ敗退「もう無理だな、金髪でコンビニ行くのも恥ずかしい」引退示唆か,68,https://news.yahoo.co.jp/articles/10261ba02bff289e20c90da99fdf98a6011d0c18,10/6(日) 7:03
2024-10-06,11:31,sports,スポーツ,19山本由伸　痛恨３回５失点ＫＯ　マチャドに２ラン被弾で本拠地スタンドが騒然　大谷同点弾直後に勝ち越し許すデイリースポーツ10/6(日) 9:4966件/時,デイリースポーツ,山本由伸　痛恨３回５失点ＫＯ　マチャドに２ラン被弾で本拠地スタンドが騒然　大谷同点弾直後に勝ち越し許す,66,https://news.yahoo.co.jp/articles/1e242fc3850670bb5bbf650533301120cd9779cd,10/6(日) 9:49
2024-10-06,11:31,sports,スポーツ,20ドジャース山本由伸 3回5失点で降板、試合中に修正もパ軍打線の勢い止まらず、大谷の同点アーチに応えられずTBS NEWS DIG Powered by JNN10/6(日) 10:5664件/時,TBS NEWS DIG Powered by JNN,ドジャース山本由伸 3回5失点で降板、試合中に修正もパ軍打線の勢い止まらず、大谷の同点アーチに応えられず,64,https://news.yahoo.co.jp/articles/3c8e56b4ccd6e48a224899945f25fe13f7ef7759,10/6(日) 10:56
2024-10-06,11:31,sports,スポーツ,21山本由伸は初回まさかの3失点　捕逸、暴投のバッテリーミスに加えマチャドに2ラン被弾　本拠ファン呆然スポニチアネックス10/6(日) 9:4662件/時,スポニチアネックス,山本由伸は初回まさかの3失点　捕逸、暴投のバッテリーミスに加えマチャドに2ラン被弾　本拠ファン呆然,62,https://news.yahoo.co.jp/articles/757b931158276d62613adfcdced943b18de5a456,10/6(日) 9:46
2024-10-06,11:31,sports,スポーツ,22大谷が絶叫、ポストシーズン第1号は値千金の同点3ラン！　弾丸180キロ、MVPコールの場内騒然THE ANSWER10/6(日) 10:3059件/時,THE ANSWER,大谷が絶叫、ポストシーズン第1号は値千金の同点3ラン！　弾丸180キロ、MVPコールの場内騒然,59,https://news.yahoo.co.jp/articles/31622cca14f35b029bbfcb453fc25d53de5650cf,10/6(日) 10:30
2024-10-06,11:31,sports,スポーツ,23激変金髪の瓜田純士、衝撃の敗戦　元最弱１０人ニキの強烈右フック被弾でリングに沈む　ＢＤ悪夢の４連敗　フラフラで立ち上がるも…　体重差５キロ厳しくデイリースポーツ10/5(土) 21:3657件/時,デイリースポーツ,激変金髪の瓜田純士、衝撃の敗戦　元最弱１０人ニキの強烈右フック被弾でリングに沈む　ＢＤ悪夢の４連敗　フラフラで立ち上がるも…　体重差５キロ厳しく,57,https://news.yahoo.co.jp/articles/ad9cfee33ec10ea1c46242ab9ba66eaf1141ccdf,10/5(土) 21:36
2024-10-06,11:31,sports,スポーツ,24ドジャース“開幕投手”の山本由伸、3イニング5失点で降板…制球に苦しみ、ストライクゾーンを巡って感情をあらわにする場面も中日スポーツ10/6(日) 10:5856件/時,中日スポーツ,ドジャース“開幕投手”の山本由伸、3イニング5失点で降板…制球に苦しみ、ストライクゾーンを巡って感情をあらわにする場面も,56,https://news.yahoo.co.jp/articles/713ecc652e0118c67faba1861ebb6e78603f1b89,10/6(日) 10:58
2024-10-06,11:31,sports,スポーツ,25広島、9月に20敗と大失速の理由に…高木豊氏「9月に入ってデーゲームになった。日程に関して考えた方が良い」と残暑対策を要求ベースボールキング10/6(日) 8:0054件/時,ベースボールキング,広島、9月に20敗と大失速の理由に…高木豊氏「9月に入ってデーゲームになった。日程に関して考えた方が良い」と残暑対策を要求,54,https://news.yahoo.co.jp/articles/c258c44945ba9f0e355b35c83bb5d96dae131686,10/6(日) 8:00
2024-10-06,11:31,sports,スポーツ,26阪神・大山、DeNA・佐野は「FA行使」の予感も　獲得に動くのは？ オフの移籍は“活発化”するかAERA dot.10/5(土) 18:0253件/時,AERA dot.,阪神・大山、DeNA・佐野は「FA行使」の予感も　獲得に動くのは？ オフの移籍は“活発化”するか,53,https://news.yahoo.co.jp/articles/84cd9ef461900c269f275b38dca26b461592c226,10/5(土) 18:02
2024-10-06,11:31,sports,スポーツ,27ドジャース・山本由伸 1回3失点の苦しいスタートに… プレーオフの洗礼受けるテレ東スポーツ10/6(日) 9:5550件/時,テレ東スポーツ,ドジャース・山本由伸 1回3失点の苦しいスタートに… プレーオフの洗礼受ける,50,https://news.yahoo.co.jp/articles/9bda0cc7f3c88cfce9ff00ecbbfd7634eed44469,10/6(日) 9:55
2024-10-06,11:31,sports,スポーツ,28【中日】メジャー目指す小笠原慎之介５勝11敗で今季終了「数字が物語っている」成績に不満日刊スポーツ10/6(日) 5:0150件/時,日刊スポーツ,【中日】メジャー目指す小笠原慎之介５勝11敗で今季終了「数字が物語っている」成績に不満,50,https://news.yahoo.co.jp/articles/29724f1c6f47aa9815ed2b33dc97a907f5cafa06,10/6(日) 5:01
2024-10-06,11:31,sports,スポーツ,29「スーパースターが過ぎる」大谷翔平の豪快3ランにファン歓喜　気合のバットフリップも出た「全てが至高」スポニチアネックス10/6(日) 10:3749件/時,スポニチアネックス,「スーパースターが過ぎる」大谷翔平の豪快3ランにファン歓喜　気合のバットフリップも出た「全てが至高」,49,https://news.yahoo.co.jp/articles/8147f2bcbfbb5bcb33d34bf5582c0b77ca7a44cd,10/6(日) 10:37
2024-10-06,11:31,sports,スポーツ,30最下位エ軍　モレノオーナーが宣言　来季の目標はPO進出「サラリー総額は確実に増える」積極的な投資約束スポニチアネックス10/6(日) 10:2847件/時,スポニチアネックス,最下位エ軍　モレノオーナーが宣言　来季の目標はPO進出「サラリー総額は確実に増える」積極的な投資約束,47,https://news.yahoo.co.jp/articles/ecd71e6a7475f98a9db7ef9551e86078a55c298b,10/6(日) 10:28
2024-10-06,11:31,sports,スポーツ,31大谷翔平、ポストシーズン１号は同点３ラン　日本人メジャー７人目、17本目日刊スポーツ10/6(日) 10:2547件/時,日刊スポーツ,大谷翔平、ポストシーズン１号は同点３ラン　日本人メジャー７人目、17本目,47,https://news.yahoo.co.jp/articles/79c575a6744e5235d8305540ee175997d0bedd42,10/6(日) 10:25
2024-10-06,11:31,sports,スポーツ,32中日・片岡ヘッドコーチが今季限りで退団　PL学園時代からの盟友・立浪監督退任に続き…スポニチアネックス10/6(日) 5:4546件/時,スポニチアネックス,中日・片岡ヘッドコーチが今季限りで退団　PL学園時代からの盟友・立浪監督退任に続き…,46,https://news.yahoo.co.jp/articles/6d3777c253146deba19349b71394f32c1ef8744f,10/6(日) 5:45
2024-10-06,11:31,sports,スポーツ,33井上尚弥戦を熱望のアフマダリエフがまたも挑発「私はあきらめない」「タイトル返上しろ」東スポWEB10/6(日) 7:1645件/時,東スポWEB,井上尚弥戦を熱望のアフマダリエフがまたも挑発「私はあきらめない」「タイトル返上しろ」,45,https://news.yahoo.co.jp/articles/8788befbabcfc3bfde319c4aa85c749e493047b0,10/6(日) 7:16
2024-10-06,11:31,sports,スポーツ,34山本由伸、ＰＳ初登板は３回５安打５失点　大谷翔平の援護弾に応えられず　苦手パドレス打線に悪夢再びスポーツ報知10/6(日) 10:5540件/時,スポーツ報知,山本由伸、ＰＳ初登板は３回５安打５失点　大谷翔平の援護弾に応えられず　苦手パドレス打線に悪夢再び,40,https://news.yahoo.co.jp/articles/172c390400f9224234c306aa548d92df9d5f4589,10/6(日) 10:55
2024-10-06,11:31,sports,スポーツ,35【阪神】藤川球児新監督が正式決定へ、すでに打診内諾か　岡田監督退任を近日中にも発表日刊スポーツ10/6(日) 3:0040件/時,日刊スポーツ,【阪神】藤川球児新監督が正式決定へ、すでに打診内諾か　岡田監督退任を近日中にも発表,40,https://news.yahoo.co.jp/articles/bd42b8bc339d1d7c8314036bcca8d0369863b863,10/6(日) 3:00
2024-10-06,11:31,sports,スポーツ,36阪神・岡田監督が突然勇退、球団から契約延長の要請もなく　今後は藤川球児氏を支えるフロント要職に…早大OBは驚き隠せず夕刊フジ10/5(土) 17:0039件/時,夕刊フジ,阪神・岡田監督が突然勇退、球団から契約延長の要請もなく　今後は藤川球児氏を支えるフロント要職に…早大OBは驚き隠せず,39,https://news.yahoo.co.jp/articles/cfe340564ebd7e6dc3f0021f693434239fc3c28f,10/5(土) 17:00
2024-10-06,11:31,sports,スポーツ,37初PO登板ほろ苦スタート… ドジャース・山本由伸 3回60球5失点で降板 初回に2ラン献上、制球に苦しむテレ東スポーツ10/6(日) 10:5138件/時,テレ東スポーツ,初PO登板ほろ苦スタート… ドジャース・山本由伸 3回60球5失点で降板 初回に2ラン献上、制球に苦しむ,38,https://news.yahoo.co.jp/articles/ff7716b347a9ad4e2954cb818938228618443a2b,10/6(日) 10:51
2024-10-06,11:31,sports,スポーツ,38いきなり飛び出した！大谷翔平 驚愕の同点3ラン！ポストシーズン初本塁打は弾丸ドライブアーチテレ東スポーツ10/6(日) 10:2538件/時,テレ東スポーツ,いきなり飛び出した！大谷翔平 驚愕の同点3ラン！ポストシーズン初本塁打は弾丸ドライブアーチ,38,https://news.yahoo.co.jp/articles/acef6a0c02b02e20842372970d7fae0ecb535b8b,10/6(日) 10:25
2024-10-06,11:31,sports,スポーツ,39【中日】片岡ヘッド、落合、和田、大西、上田の５コーチが退団申し入れ　立浪監督とともに退団へ日刊スポーツ10/6(日) 5:0138件/時,日刊スポーツ,【中日】片岡ヘッド、落合、和田、大西、上田の５コーチが退団申し入れ　立浪監督とともに退団へ,38,https://news.yahoo.co.jp/articles/bc801af2c049fb321581734f31b817be84626177,10/6(日) 5:01
2024-10-06,11:31,sports,スポーツ,40２キロ体重超過、逆ギレ大乱闘素手殴打の「博多の虎」異名の喧嘩自慢　試合は惨敗　パウンドでボコボコに…デイリースポーツ10/6(日) 7:0037件/時,デイリースポーツ,２キロ体重超過、逆ギレ大乱闘素手殴打の「博多の虎」異名の喧嘩自慢　試合は惨敗　パウンドでボコボコに…,37,https://news.yahoo.co.jp/articles/deda6d18c54d4cf760e7ae7cf8190a8be061082a,10/6(日) 7:00
