scrp_date,scrp_time,genre_en,genre_jp,rank,media_jp,title,comment,link,date_original
2024-10-06,06:06,TTL,総合,1呂布カルマ、大麻禁止の日本に苦言「海外では当たり前」「不公平過ぎる」「才能が海外に流出する」スポニチアネックス10/5(土) 15:11260件/時,スポニチアネックス,呂布カルマ、大麻禁止の日本に苦言「海外では当たり前」「不公平過ぎる」「才能が海外に流出する」,260,https://news.yahoo.co.jp/articles/1639b549a749c3a412c0ae5911913fb7d1a47efa,10/5(土) 15:11
2024-10-06,06:06,TTL,総合,2自民裏金議員の公認問題持ち越し　首相、6日にも再協議共同通信10/5(土) 20:34191件/時,共同通信,自民裏金議員の公認問題持ち越し　首相、6日にも再協議,191,https://news.yahoo.co.jp/articles/6c3e1b1444647787fae9d18c6e8aceb7511a1b71,10/5(土) 20:34
2024-10-06,06:06,TTL,総合,3【子どものいない人生】「産んでない人にはわからない」「自由で気楽でしょ」…自覚なき“子なしハラスメント”が残す傷跡ダイヤモンド・オンライン10/5(土) 7:32178件/時,ダイヤモンド・オンライン,【子どものいない人生】「産んでない人にはわからない」「自由で気楽でしょ」…自覚なき“子なしハラスメント”が残す傷跡,178,https://news.yahoo.co.jp/articles/b6d335cb4dc11b238145d7b98bc1e01be2c2f3a2,10/5(土) 7:32
2024-10-06,06:06,TTL,総合,4女子高生を男4人で監禁・集団暴行・コンクリート詰めに…“史上最悪の少年犯罪”「女子高生コンクリ殺人事件」犯人たちのその後（1988年の事件）文春オンライン10/5(土) 17:42164件/時,文春オンライン,女子高生を男4人で監禁・集団暴行・コンクリート詰めに…“史上最悪の少年犯罪”「女子高生コンクリ殺人事件」犯人たちのその後（1988年の事件）,164,https://news.yahoo.co.jp/articles/436d7af2170cab6f7a22e3dbc3cd7ebbb4a10821,10/5(土) 17:42
2024-10-06,06:06,TTL,総合,5首相、国民の不信に対応　野田氏は裏金議員へ対抗馬に意欲共同通信10/5(土) 17:44157件/時,共同通信,首相、国民の不信に対応　野田氏は裏金議員へ対抗馬に意欲,157,https://news.yahoo.co.jp/articles/ddad096f035ccc61c5599e9e14bc4583a9bcb1a8,10/5(土) 17:44
2024-10-06,06:06,TTL,総合,6信用保証協会トップ、98%が「天下り」　政府の是正約束、守られず朝日新聞デジタル10/5(土) 17:00154件/時,朝日新聞デジタル,信用保証協会トップ、98%が「天下り」　政府の是正約束、守られず,154,https://news.yahoo.co.jp/articles/0cd58f9ec8b4bf7ae2b22901f58e2e069d08bd8e,10/5(土) 17:00
2024-10-06,06:06,TTL,総合,7死亡事故の全長45メートル踏切、市長は廃止方針　住民は存続求める朝日新聞デジタル10/5(土) 11:00148件/時,朝日新聞デジタル,死亡事故の全長45メートル踏切、市長は廃止方針　住民は存続求める,148,https://news.yahoo.co.jp/articles/72d0c238cf107d9aa3a72ac80265fac00e38627b,10/5(土) 11:00
2024-10-06,06:06,TTL,総合,8【速報】石破首相が能登豪雨の激甚災害指定を表明　就任後初めて被災地を訪問FNNプライムオンライン（フジテレビ系）10/5(土) 14:47145件/時,FNNプライムオンライン（フジテレビ系）,【速報】石破首相が能登豪雨の激甚災害指定を表明　就任後初めて被災地を訪問,145,https://news.yahoo.co.jp/articles/7aba2aa6debce28deb8f811c0374b7d0150e37d3,10/5(土) 14:47
2024-10-06,06:06,TTL,総合,9巨人　菅野智之がＭＬＢ挑戦を表明「向こうでプレーする気持ちでいる」一方で「大事な時期に申し訳ない」デイリースポーツ10/5(土) 12:01137件/時,デイリースポーツ,巨人　菅野智之がＭＬＢ挑戦を表明「向こうでプレーする気持ちでいる」一方で「大事な時期に申し訳ない」,137,https://news.yahoo.co.jp/articles/5cef9ff38149c8965e25d38b3a2f2074ee46c682,10/5(土) 12:01
2024-10-06,06:06,TTL,総合,10東国原　石破自民が大量離党→分裂危機「高市さんとこの」　冷や飯の旧安倍派　裏金議員を公認しなかったら脱退→現在党外の大物と合流説もデイリースポーツ10/5(土) 14:58135件/時,デイリースポーツ,東国原　石破自民が大量離党→分裂危機「高市さんとこの」　冷や飯の旧安倍派　裏金議員を公認しなかったら脱退→現在党外の大物と合流説も,135,https://news.yahoo.co.jp/articles/5475334bcf085dae03107baedd21e48f44238568,10/5(土) 14:58
2024-10-06,06:06,TTL,総合,11大谷翔平フィーバーに那須川天心が本音ポロリ「テレビつけたら大谷選手ばっかで飽きないですか？」東スポWEB10/5(土) 15:11118件/時,東スポWEB,大谷翔平フィーバーに那須川天心が本音ポロリ「テレビつけたら大谷選手ばっかで飽きないですか？」,118,https://news.yahoo.co.jp/articles/27765b63334cb285c9550857d20cfcc3c236ed0e,10/5(土) 15:11
2024-10-06,06:06,TTL,総合,120:48【訃報】料理評論家・服部幸應さん（78）死去　都内の専門学校で突然気を失って倒れる　「料理の鉄人」にも出演FNNプライムオンライン（フジテレビ系）10/5(土) 20:07110件/時,FNNプライムオンライン（フジテレビ系）,【訃報】料理評論家・服部幸應さん（78）死去　都内の専門学校で突然気を失って倒れる　「料理の鉄人」にも出演,110,https://news.yahoo.co.jp/articles/c125a24f21b9c4128be7e9c36c41d73d01e8f030,10/5(土) 20:07
2024-10-06,06:06,TTL,総合,13宮崎謙介氏がひろゆき氏と大喧嘩　討論番組で「秘書５人雇用は無能」にブチ切れ「マジでぶっ飛ばしたくなる」「うるせーし」デイリースポーツ10/5(土) 19:4999件/時,デイリースポーツ,宮崎謙介氏がひろゆき氏と大喧嘩　討論番組で「秘書５人雇用は無能」にブチ切れ「マジでぶっ飛ばしたくなる」「うるせーし」,99,https://news.yahoo.co.jp/articles/661d30cbb2eed8fec22a52e6673ce9eaf03b6be9,10/5(土) 19:49
2024-10-06,06:06,TTL,総合,142:37“日本発”新型コロナ「レプリコンワクチン」に不安の声 厚労大臣が安全訴えテレビ朝日系（ANN）10/5(土) 22:3095件/時,テレビ朝日系（ANN）,“日本発”新型コロナ「レプリコンワクチン」に不安の声 厚労大臣が安全訴え,95,https://news.yahoo.co.jp/articles/6a1c2cf4a1e893c9a056459923cfe18eb75e24a2,10/5(土) 22:30
2024-10-06,06:06,TTL,総合,15宮崎謙介氏　ひろゆき氏と一触即発「バカじゃねえの」「現場分からねえくせに」場も凍るまさかの事態にスポニチアネックス10/5(土) 6:4094件/時,スポニチアネックス,宮崎謙介氏　ひろゆき氏と一触即発「バカじゃねえの」「現場分からねえくせに」場も凍るまさかの事態に,94,https://news.yahoo.co.jp/articles/aaf96a495702b21ab952d215568bcc7cfd69363d,10/5(土) 6:40
2024-10-06,06:06,TTL,総合,16大麻禁止「不公平」発言の呂布カルマ　「大麻ごときで」逮捕→破滅する人が「いなくなります様に」よろず～ニュース10/5(土) 18:4085件/時,よろず～ニュース,大麻禁止「不公平」発言の呂布カルマ　「大麻ごときで」逮捕→破滅する人が「いなくなります様に」,85,https://news.yahoo.co.jp/articles/8d58426d25132407556b381a1a7e9be73ccd3d28,10/5(土) 18:40
2024-10-06,06:06,TTL,総合,17激変金髪の瓜田純士、衝撃の敗戦　元最弱１０人ニキの強烈右フック被弾でリングに沈む　ＢＤ悪夢の４連敗　フラフラで立ち上がるも…　体重差５キロ厳しくデイリースポーツ10/5(土) 21:3684件/時,デイリースポーツ,激変金髪の瓜田純士、衝撃の敗戦　元最弱１０人ニキの強烈右フック被弾でリングに沈む　ＢＤ悪夢の４連敗　フラフラで立ち上がるも…　体重差５キロ厳しく,84,https://news.yahoo.co.jp/articles/ad9cfee33ec10ea1c46242ab9ba66eaf1141ccdf,10/5(土) 21:36
2024-10-06,06:06,TTL,総合,18グレタさん、また拘束　ベルギーでの抗議活動で共同通信10/6(日) 4:5982件/時,共同通信,グレタさん、また拘束　ベルギーでの抗議活動で,82,https://news.yahoo.co.jp/articles/72a5a45d17262e7b6d649fd600525671e6ee1a4c,10/6(日) 4:59
2024-10-06,06:06,TTL,総合,19“再放送”だらけのＮＨＫＢＳ、１０００億円カットで「カネがない」…番組継続には「まず予算削減を」読売新聞オンライン10/5(土) 7:0282件/時,読売新聞オンライン,“再放送”だらけのＮＨＫＢＳ、１０００億円カットで「カネがない」…番組継続には「まず予算削減を」,82,https://news.yahoo.co.jp/articles/7124b75ce154551828a766ee742a20b408b64ce2,10/5(土) 7:02
2024-10-06,06:06,TTL,総合,20高橋洋一氏こき下ろし　石破政権の「最低賃金１５００円」は「小学校レベルで出来ないって分かるバカな政策」計算式で証明デイリースポーツ10/5(土) 18:0380件/時,デイリースポーツ,高橋洋一氏こき下ろし　石破政権の「最低賃金１５００円」は「小学校レベルで出来ないって分かるバカな政策」計算式で証明,80,https://news.yahoo.co.jp/articles/3b551cb9375b024b39fc25310709ce4dc428c6b4,10/5(土) 18:03
2024-10-06,06:06,TTL,総合,21首相、能登半島の被災地視察　復旧復興の状況確認、野田氏も共同通信10/5(土) 9:0979件/時,共同通信,首相、能登半島の被災地視察　復旧復興の状況確認、野田氏も,79,https://news.yahoo.co.jp/articles/3eeb5366a3e76b5a710509caa4bf909d020aa79f,10/5(土) 9:09
2024-10-06,06:06,TTL,総合,22兵庫県知事選は最多6人出馬意向　自民県議団が擁立見送り方針を撤回テレビ朝日系（ANN）10/5(土) 11:2776件/時,テレビ朝日系（ANN）,兵庫県知事選は最多6人出馬意向　自民県議団が擁立見送り方針を撤回,76,https://news.yahoo.co.jp/articles/213ea720b093f793886cc43f5fa83a49bf251c28,10/5(土) 11:27
2024-10-06,06:06,TTL,総合,23高卒求人倍率が最高の３・７倍、若いうちから管理職起用も…就職支援会社「２０代の活躍期間長い」読売新聞オンライン10/5(土) 12:0976件/時,読売新聞オンライン,高卒求人倍率が最高の３・７倍、若いうちから管理職起用も…就職支援会社「２０代の活躍期間長い」,76,https://news.yahoo.co.jp/articles/009a2eae168babe043dd5c375d228f727c72bd46,10/5(土) 12:09
2024-10-06,06:06,TTL,総合,24“セクハラ”デマでためらう例も…AED、女性への“配慮”が物議　「最優先は人命」販売元の願いENCOUNT10/5(土) 10:2074件/時,ENCOUNT,“セクハラ”デマでためらう例も…AED、女性への“配慮”が物議　「最優先は人命」販売元の願い,74,https://news.yahoo.co.jp/articles/269e40d0d591f7ebb8fa005c3a6063e62234ae4f,10/5(土) 10:20
2024-10-06,06:06,TTL,総合,25【中日】片岡篤史ヘッドコーチ、落合英二投手兼育成コーチ、和田一浩打撃コーチら5人が今季限りで退団中日スポーツ10/6(日) 5:0073件/時,中日スポーツ,【中日】片岡篤史ヘッドコーチ、落合英二投手兼育成コーチ、和田一浩打撃コーチら5人が今季限りで退団,73,https://news.yahoo.co.jp/articles/63c69d29dcfd0c4ee97ee535ce4a5fc9b5021210,10/6(日) 5:00
2024-10-06,06:06,TTL,総合,26阪神・大山、DeNA・佐野は「FA行使」の予感も　獲得に動くのは？ オフの移籍は“活発化”するかAERA dot.10/5(土) 18:0273件/時,AERA dot.,阪神・大山、DeNA・佐野は「FA行使」の予感も　獲得に動くのは？ オフの移籍は“活発化”するか,73,https://news.yahoo.co.jp/articles/84cd9ef461900c269f275b38dca26b461592c226,10/5(土) 18:02
2024-10-06,06:06,TTL,総合,27悠仁さまの処遇めぐり保護者間で高まる懸念…筑付高は東大推薦入試で公平性を担保できるのか【秋篠宮家の学校選び】日刊ゲンダイDIGITAL10/5(土) 9:0673件/時,日刊ゲンダイDIGITAL,悠仁さまの処遇めぐり保護者間で高まる懸念…筑付高は東大推薦入試で公平性を担保できるのか【秋篠宮家の学校選び】,73,https://news.yahoo.co.jp/articles/bd0a70dd98c487add5890fceac748c445eaec7a3,10/5(土) 9:06
2024-10-06,06:06,TTL,総合,28初デート費用、女性は「1円もおごりたくない」「男性が全額負担すべき」…男性の本音は？　婚活男女897人調査で浮き彫りにオトナンサー10/5(土) 21:4072件/時,オトナンサー,初デート費用、女性は「1円もおごりたくない」「男性が全額負担すべき」…男性の本音は？　婚活男女897人調査で浮き彫りに,72,https://news.yahoo.co.jp/articles/24a11f85f11918a5984b46a2ed4b6a3c60b9b493,10/5(土) 21:40
2024-10-06,06:06,TTL,総合,29なぜ『TGC』はYouTuberの起用に踏み切ったのか　令和のトレンドを生むショーの“裏側”リアルサウンド10/5(土) 12:0457件/時,リアルサウンド,なぜ『TGC』はYouTuberの起用に踏み切ったのか　令和のトレンドを生むショーの“裏側”,57,https://news.yahoo.co.jp/articles/d62cb7bb4225609d7a7b18a5a2145b71a2a6f97c,10/5(土) 12:04
2024-10-06,06:06,TTL,総合,30橋下徹氏　日本の大学に“いらない”と思う学部ぶっちゃけ「海外と議論とか絶対できない」　自身の出身は…スポニチアネックス10/5(土) 17:0956件/時,スポニチアネックス,橋下徹氏　日本の大学に“いらない”と思う学部ぶっちゃけ「海外と議論とか絶対できない」　自身の出身は…,56,https://news.yahoo.co.jp/articles/abb8df96929c33451fa0cc4ec321cf4b57e66afd,10/5(土) 17:09
2024-10-06,06:06,TTL,総合,31【阪神】藤川球児新監督が正式決定へ、すでに打診内諾か　岡田監督退任を近日中にも発表日刊スポーツ10/6(日) 3:0056件/時,日刊スポーツ,【阪神】藤川球児新監督が正式決定へ、すでに打診内諾か　岡田監督退任を近日中にも発表,56,https://news.yahoo.co.jp/articles/bd42b8bc339d1d7c8314036bcca8d0369863b863,10/6(日) 3:00
2024-10-06,06:06,TTL,総合,32有吉弘行「オールスター感謝祭秋」ラストで「フワちゃん、見てる～？」にＸ上騒然、賛否の声日刊スポーツ10/6(日) 0:2854件/時,日刊スポーツ,有吉弘行「オールスター感謝祭秋」ラストで「フワちゃん、見てる～？」にＸ上騒然、賛否の声,54,https://news.yahoo.co.jp/articles/0a58e8e2c7536909e849c55b4209a02bda3519c0,10/6(日) 0:28
2024-10-06,06:06,TTL,総合,33阪神・岡田監督が突然勇退、球団から契約延長の要請もなく　今後は藤川球児氏を支えるフロント要職に…早大OBは驚き隠せず夕刊フジ10/5(土) 17:0052件/時,夕刊フジ,阪神・岡田監督が突然勇退、球団から契約延長の要請もなく　今後は藤川球児氏を支えるフロント要職に…早大OBは驚き隠せず,52,https://news.yahoo.co.jp/articles/cfe340564ebd7e6dc3f0021f693434239fc3c28f,10/5(土) 17:00
2024-10-06,06:06,TTL,総合,34「裁判戦略を練り直しか…」松本人志を悩ます文春証拠にあった「“松本と同格”男性タレント」の存在FRIDAY10/5(土) 11:0051件/時,FRIDAY,「裁判戦略を練り直しか…」松本人志を悩ます文春証拠にあった「“松本と同格”男性タレント」の存在,51,https://news.yahoo.co.jp/articles/dc296f8a00f0af875374f9c637c44834e8aef762,10/5(土) 11:00
2024-10-06,06:06,TTL,総合,35「なぜあなたは斎藤元彦・兵庫県知事を支持するのか？」失職した斎藤氏を応援する人に聞いたJBpress10/5(土) 17:0251件/時,JBpress,「なぜあなたは斎藤元彦・兵庫県知事を支持するのか？」失職した斎藤氏を応援する人に聞いた,51,https://news.yahoo.co.jp/articles/2d6a4cb82d30f8883e4bc6aefc94d6a4768afede,10/5(土) 17:02
2024-10-06,06:06,TTL,総合,36無視…駐車違反31人、違反金を滞納　催促も応じなかった男女、ついに80万円超を一斉徴収　口座、生命保険も差し押さえられた22～71歳「絶対に許さない」埼玉新聞10/5(土) 15:3548件/時,埼玉新聞,無視…駐車違反31人、違反金を滞納　催促も応じなかった男女、ついに80万円超を一斉徴収　口座、生命保険も差し押さえられた22～71歳「絶対に許さない」,48,https://news.yahoo.co.jp/articles/2a3d0c10e5f90edef15cf4e33fe21aa9b36d86dc,10/5(土) 15:35
2024-10-06,06:06,TTL,総合,37やす子が「オールスター後夜祭２４秋」生放送で突然呼びかけ「フワちゃん見てる～？」スポーツ報知10/6(日) 1:1547件/時,スポーツ報知,やす子が「オールスター後夜祭２４秋」生放送で突然呼びかけ「フワちゃん見てる～？」,47,https://news.yahoo.co.jp/articles/1434c39acdb62320e46b5aadf61ff68825391569,10/6(日) 1:15
2024-10-06,06:06,TTL,総合,38【阪神】掛布雅之氏が戦友・岡田彰布監督の退任に疑問を投げかけて「寂しい」　自身のＹｏｕＴｕｂｅでスポーツ報知10/5(土) 21:0947件/時,スポーツ報知,【阪神】掛布雅之氏が戦友・岡田彰布監督の退任に疑問を投げかけて「寂しい」　自身のＹｏｕＴｕｂｅで,47,https://news.yahoo.co.jp/articles/1fd5601362111f4fe220a6511ee042c48b53e4d5,10/5(土) 21:09
2024-10-06,06:06,TTL,総合,39イラン核施設「攻撃すべき」　反対のバイデン氏批判　トランプ氏時事通信10/5(土) 9:0246件/時,時事通信,イラン核施設「攻撃すべき」　反対のバイデン氏批判　トランプ氏,46,https://news.yahoo.co.jp/articles/c503ce18cad804d1671a5988a8bb2eccdf11e4ca,10/5(土) 9:02
2024-10-06,06:06,TTL,総合,40「虫がついている」服の中に入った虫を取るふりをして女性にわいせつ行為か　中国人旅行客の男（33）を再入港した福岡空港で逮捕　警視庁TBS NEWS DIG Powered by JNN10/5(土) 16:4546件/時,TBS NEWS DIG Powered by JNN,「虫がついている」服の中に入った虫を取るふりをして女性にわいせつ行為か　中国人旅行客の男（33）を再入港した福岡空港で逮捕　警視庁,46,https://news.yahoo.co.jp/articles/19bbdc80dbe461066f911c843be522093c47daa1,10/5(土) 16:45
