scrp_date,scrp_time,genre_en,genre_jp,rank,media_jp,title,comment,link,date_original
2024-07-17,17:08,domestic,国内,1,読売新聞オンライン,サッカー日本代表の佐野海舟容疑者を逮捕…３０代女性に３人で性的暴行の疑い,439,https://news.yahoo.co.jp/articles/931b97f547478afc29096bab8f9c4cb0c9d8025d,7/17(水) 5:03
2024-07-17,17:08,domestic,国内,2,FNNプライムオンライン（フジテレビ系）,【速報】岸田首相が原告らに直接謝罪「責任は極めて重大」 旧優生保護法による強制不妊 最高裁判決を受け官邸で面会,285,https://news.yahoo.co.jp/articles/263327866892cee1f78c00040da8fee1da87ad77,7/17(水) 14:56
2024-07-17,17:08,domestic,国内,3,FNNプライムオンライン,熱中症と似た症状も…新型コロナ“新変異株”「KP.3」患者激増　感染力が高く、喉の痛みや発熱の症状,209,https://news.yahoo.co.jp/articles/1fd0c46c219ba14ed2c16e93ec2cb2e76c696df3,7/16(火) 20:17
2024-07-17,17:08,domestic,国内,4,TBS NEWS DIG Powered by JNN,【速報】大麻草約2000本、5億円相当を栽培か 国内最大規模の「大麻栽培工場」摘発 密売Gのベトナム人6人逮捕 埼玉県警,205,https://news.yahoo.co.jp/articles/cba9b69b55fea593ce512ee14ecc6e8033be8e59,7/17(水) 11:00
2024-07-17,17:08,domestic,国内,5,文春オンライン,石丸伸二氏（41）が語った「女、子ども」発言批判への“反論”「チャンバラじゃないですか、どう考えても」《元乃木坂46を“一蹴”した理由は…》,191,https://news.yahoo.co.jp/articles/9d1d477c9a5ba2730508dedae62722c868e9df27,7/17(水) 16:12
2024-07-17,17:08,domestic,国内,6,日刊スポーツ,蓮舫氏「れんほう叩いていいよねの空気が…」自身の経験踏まえた次世代への思いをＸで吐露,190,https://news.yahoo.co.jp/articles/bd3935fb87213a05408f91c0fa9e20eeb6e7a7db,7/17(水) 9:00
2024-07-17,17:08,domestic,国内,7,現代ビジネス,紀子さまの「教育ママ」ぶりがスゴすぎる…悠仁さまの高校で見せた「衝撃のお姿」,141,https://news.yahoo.co.jp/articles/428c15bccb6e6ff2f5209359a880db1145c200fd,7/17(水) 7:04
2024-07-17,17:08,domestic,国内,8,毎日新聞,公取委、VISA日本法人を立ち入り検査　独占禁止法違反の疑い,139,https://news.yahoo.co.jp/articles/5cb283c1de7645370dc5c5f9c7ecc65992aa0919,7/17(水) 13:00
2024-07-17,17:08,domestic,国内,9,日刊スポーツ,石丸伸二氏、４年後都知事選に出るなら「ダークホース？いや本命でしょ、大本命」生配信で宣言,133,https://news.yahoo.co.jp/articles/d32d7708e6513e158f147e61cea8da19b5dd9763,7/17(水) 16:29
2024-07-17,17:08,domestic,国内,10,東洋経済オンライン,「仕事、育児、家事を女性に押し付けている」。「リポビタンD」の広告が、性差別的だと物議。背後にある“男らしさ”の負の遺産とは？,119,https://news.yahoo.co.jp/articles/8be4a592615432d5bfbec09fbf52855fb908bbec,7/17(水) 13:02
2024-07-17,17:08,domestic,国内,11,スポニチアネックス,蓮舫氏、都知事選後の“蓮舫叩き”に「叩いていいよね、の空気が次世代の挑戦者を萎縮させないように…」,119,https://news.yahoo.co.jp/articles/12cde5e7266a6722eb99e1e462ec25b98b58ad66,7/17(水) 9:43
2024-07-17,17:08,domestic,国内,12,産経新聞,鍵握る維新対応、狭まる「兵庫知事降ろし」包囲網　第三者の結論焦点に,114,https://news.yahoo.co.jp/articles/68189c3fa6ad5963b5d45d1c9172dc1828bf764a,7/16(火) 20:28
2024-07-17,17:08,domestic,国内,13,みんかぶマガジン,石丸・一夫多妻制案に「若者の暴動が起こる」批判! 蓮舫・大量シールに「質問意図がわからん」と当初他人事… 史上最悪都知事選の末路,110,https://news.yahoo.co.jp/articles/fe463f2b0f9c1efd4c03bee02d173d742c5ef0d8,7/17(水) 9:10
2024-07-17,17:08,domestic,国内,14,デイリー新潮,【疑惑の斎藤知事】会見で新たな“おねだり”が発覚　記者の追求に苦し過ぎる言い訳「壊れたテープレコーダー」に反省の色なし,100,https://news.yahoo.co.jp/articles/2dfd289844a39a96f03d11d5d47a641d94bad5a5,7/17(水) 10:15
2024-07-17,17:08,domestic,国内,15,TBS NEWS DIG Powered by JNN,【速報】サッカー日本代表 佐野海舟容疑者（23） 不同意性交の疑いで逮捕　東京・文京区のホテルで30代女性に性的暴行か,90,https://news.yahoo.co.jp/articles/7d0cdf1a6d000f21c554fb6fda41796da5d8cc38,7/17(水) 7:33
2024-07-17,17:08,domestic,国内,16,女性自身,「極めて不適切な内容」朝日新聞　波紋呼ぶ記者のSNSでの“蓮舫批判”を謝罪…本人には厳重注意,90,https://news.yahoo.co.jp/articles/e2b76e47eb9633a2b819b7b6cd0dbcbde3478c1f,7/16(火) 19:42
2024-07-17,17:08,domestic,国内,17,デイリー新潮,紀子妃の弟が取締役の会社が「1億5000万円超の金銭トラブル」　役員大量解任の異常事態も,88,https://news.yahoo.co.jp/articles/7b0c247bfb1b2af8c0f49c0492d4791fc50d463d,7/17(水) 11:41
2024-07-17,17:08,domestic,国内,18,関西テレビ,橋下徹氏が「兵庫県・斎藤知事は辞めるべき」と明言　維新の「事実の解明が先」という姿勢にも反対の見解示す　元幹部職員の「疑惑告発」問題　告発が「嘘八百」ではなく職員が死亡した“事実の重さ”を指摘,87,https://news.yahoo.co.jp/articles/94d4e41ef94275937b6f5cbae0b8a67505c6e81a,7/17(水) 15:13
2024-07-17,17:08,domestic,国内,19,FNNプライムオンライン,「兵庫県・斎藤知事は辞めるべき」橋下徹氏が明言　維新の「事実の解明が先」姿勢にも反対　告発が「嘘八百」ではなく職員が死亡した“事実の重さ”指摘,84,https://news.yahoo.co.jp/articles/450371340a60fa5550d5620ca5170a5b59f57a5b,7/17(水) 16:03
2024-07-17,17:08,domestic,国内,20,FNNプライムオンライン（フジテレビ系）,サッカー日本代表の佐野海舟容疑者（23）が女性に性的暴行加えた疑いで逮捕…知人の男2人と30代女性に　今月鹿島からドイツに移籍発表,80,https://news.yahoo.co.jp/articles/42f86eaa8ae1bae3cea344873f286ba1c66576d2,7/17(水) 5:49
2024-07-17,17:08,domestic,国内,21,産経新聞,激辛チップスに潜む危険性　昨年は米で死亡事故も　水を飲むのは逆効果　有効なのは乳製品,79,https://news.yahoo.co.jp/articles/00354cbe6f19abfcc39d25f7d3aee818cc842ac8,7/16(火) 17:06
2024-07-17,17:08,domestic,国内,22,日刊スポーツ,三浦瑠麗氏が蓮舫氏に語りかける「休息を取った後に…」「彼らに報いる方法はあります」Ｘに私見,75,https://news.yahoo.co.jp/articles/b8451b4cd07f8e19a8fee619ef7098aa0ba87cf6,7/17(水) 10:22
2024-07-17,17:08,domestic,国内,23,デイリースポーツ,石丸伸二氏　自民党との連携は総裁の座確約なら「ありです」　現状では首長に意欲,69,https://news.yahoo.co.jp/articles/d0b9e1fc343d2cc36ce7fbfd578568ac0f828839,7/17(水) 15:52
2024-07-17,17:08,domestic,国内,24,現代ビジネス,【旭川女子高生殺人事件】内田梨瑚被告と旭川警察の「まさかの密接交際」に新たな疑惑…！「不倫警部補」の同僚が「飲み会の事実」を「口止め工作」か,67,https://news.yahoo.co.jp/articles/fb93126ec380931b9fe0f74de8c98c4a5a1508d2,7/17(水) 7:04
2024-07-17,17:08,domestic,国内,25,現代ビジネス,「夫はクマに殺された」「葬儀で顔は包帯グルグル巻き」…県が「クマ被害とは断定せず」と発表した「血も涙もない理由」,63,https://news.yahoo.co.jp/articles/d21e0a86192333540d9964490be66f39f75bc1e4,7/17(水) 6:04
2024-07-17,17:08,domestic,国内,26,朝日新聞デジタル,「すぐ辞職を」　兵庫の斎藤知事に片山元鳥取県知事が伝えたい理由,61,https://news.yahoo.co.jp/articles/578633eadd1f496a0701028b44bd391cd0f75848,7/17(水) 15:00
2024-07-17,17:08,domestic,国内,27,集英社オンライン,〈県警も注目〉「兵庫県知事はパワハラどころでない」元同僚男性が告発「局長のＡさんは知事らを諫めるために命を絶った」知事は会見で辞職を否定も…,59,https://news.yahoo.co.jp/articles/b5c9110b6b6b4891c3f1cb6b68b39ae4e9b8f0e7,7/16(火) 19:02
2024-07-17,17:08,domestic,国内,28,CBCテレビ,新型コロナが感染拡大の兆し　感染力強い変異株「KP.3」が流行中　冷房使う夏でも「10センチ開けっ放しに」,59,https://news.yahoo.co.jp/articles/03897404d78c27175d1641481e1ac6ee14dfa27e,7/16(火) 19:31
2024-07-17,17:08,domestic,国内,29,文春オンライン,ラーメン屋に来た“自称グルメのヤバい客”が突然「この店のラーメンはまずい！」と連呼…そのとき、店主のプロレスラーが取った“思わぬ対応”,59,https://news.yahoo.co.jp/articles/36826c2ae5fad7e822dec2f3db6aacb3ef63e423,7/17(水) 11:12
2024-07-17,17:08,domestic,国内,30,スポーツ報知,松本人志側からのミヤネ屋への抗議に読売テレビ「公平・中立な報道に努めています」,59,https://news.yahoo.co.jp/articles/1aef327c58ecd3cd97e31d2d862b2b98e910c52f,7/17(水) 5:25
2024-07-17,17:08,domestic,国内,31,デイリースポーツ,蓮舫氏　山の日制定提唱の与党議員を「背後に色々な団体」と指摘「そういうことなんですね」　納得と絶賛の声殺到,58,https://news.yahoo.co.jp/articles/b9d5845a66c1384d48748e0b48ad1cc2d7ad7385,7/16(火) 18:47
2024-07-17,17:08,domestic,国内,32,CBCテレビ,「死んでやる」60代男が市役所で自分の腹部を刺し放火か　2年ほど前から納税めぐるトラブル　愛知 高浜市役所,54,https://news.yahoo.co.jp/articles/7adb2013debd024a6c21a786ba1777543238f08f,7/16(火) 18:28
2024-07-17,17:08,domestic,国内,33,弁護士ドットコムニュース,石丸伸二氏の「一夫多妻制」発言が波紋、SNSでは批判の嵐　導入したら予想されるこれだけの「リスク」,52,https://news.yahoo.co.jp/articles/120ccd71a9e3087e1fb8ff5af26b91341fcf0f0e,7/17(水) 10:48
2024-07-17,17:08,domestic,国内,34,SmartFLASH,米軍なら「懲役250年」113人処分の海自、大物OBが憤る“劣化”の理由,52,https://news.yahoo.co.jp/articles/469f0eb2668d9eaabaee47d669a8cb87c7077f36,7/17(水) 14:50
2024-07-17,17:08,domestic,国内,35,テレビ朝日系（ANN）,傘・傘・傘の祇園祭　突然の大雨に大混乱…私有地の進入も　「海の日」各地で荒天,47,https://news.yahoo.co.jp/articles/43445e853ce9d7a1fc989f965c81d42e9d8a8592,7/17(水) 7:16
2024-07-17,17:08,domestic,国内,36,SmartFLASH,“パワハラ疑惑” 兵庫県知事に「もう一緒にやっていけない」自民党 “2度めの手のひら返し”…現職市長が明かす力関係とは,45,https://news.yahoo.co.jp/articles/bf54548a3db5c8cfa7d88c3fe2d1aa54fc63d037,7/17(水) 14:30
2024-07-17,17:08,domestic,国内,37,現代ビジネス,「駆除のお礼はタオル」「発砲許可が遅すぎる」…猟友会vs.警察の生々しすぎる「緊急告発」,44,https://news.yahoo.co.jp/articles/ecd99b47c1ab8fe2368652da7f7da0f1703bc0fe,7/17(水) 6:04
2024-07-17,17:08,domestic,国内,38,FNNプライムオンライン,「座らせる気ないでしょ?」ベンチの上に道路規制ポール設置など“意地悪ベンチ”新宿区で相次ぐワケ…繁華街が近いこと?「眠れないと苦情が…」,44,https://news.yahoo.co.jp/articles/a3e2e4e3178e8ba44089ab5553dc7f911c971118,7/17(水) 7:13
2024-07-17,17:08,domestic,国内,39,TBS NEWS DIG Powered by JNN,【速報】旧優生保護法訴訟で政府「除斥期間」主張取り下げ調整　岸田総理が表明へ,44,https://news.yahoo.co.jp/articles/ba883444cfafc05e4290f44d7b1648aea8a18d18,7/17(水) 8:58
2024-07-17,17:08,domestic,国内,40,デイリー新潮,枝野幸男氏の立民代表戦出馬報道に「膝カックンされたような衝撃」…政治アナリストはあまりに旧態依然とした手法にも唖然,43,https://news.yahoo.co.jp/articles/149cc6c6a167ff37b016ceb361b2740c558b43fc,7/17(水) 10:41
