scrp_date,scrp_time,genre_en,genre_jp,rank,media_jp,title,comment,link,date_original
2025-07-27,10:37,sports,スポーツ,1,Full-Count,大谷翔平、豪快38号でリーグトップ独走　7戦6発の量産…10本目の先頭打者弾に敵地騒然,299,https://news.yahoo.co.jp/articles/2e0e2e3c6a533ce10d6ad114acaf0dc58195a7e6,7/27(日) 8:16
2025-07-27,10:37,sports,スポーツ,2,東スポWEB,井上尚弥に世界的コーチが皮肉「日本でしか試合をしない」「審判によって勝敗は左右される」,123,https://news.yahoo.co.jp/articles/c5eee2933a0546d4a289f31cddf78cf86b818e30,7/27(日) 7:16
2025-07-27,10:37,sports,スポーツ,3,Full-Count,世界最速左腕チャップマンがNPB入り熱望「日本でプレーしたい」　37歳も剛速球に自信,84,https://news.yahoo.co.jp/articles/96c54db637e20267615656367a14d0c860cb54e7,7/27(日) 7:01
2025-07-27,10:37,sports,スポーツ,4,デイリースポーツ,上原浩治氏　オールスターでの両投げ披露に疑問「僕は真剣勝負を見てみたい」　エンタメ要素には理解「エンタメとして１試合やれば」,80,https://news.yahoo.co.jp/articles/58fe8dfb01a0608020095e56c4b33dcb98676e80,7/27(日) 9:55
2025-07-27,10:37,sports,スポーツ,5,東スポWEB,【Ｆ１】角田裕毅〝大躍進〟の理由はメキース代表の英断　「唯一残ってた」フェルスタッペン用パーツ投入を指令,80,https://news.yahoo.co.jp/articles/7aa712809b2580ecfde50722cdd4d7882aee2586,7/27(日) 5:16
2025-07-27,10:37,sports,スポーツ,6,DAZN News,レッドブルのメキース新代表「リスクを冒して新フロアを入れた」4度王者のストックを使用…予選P7の角田裕毅を労う「クルー全員の努力が報われた」｜F1,71,https://news.yahoo.co.jp/articles/4ca87b243c8a3f5081e18c20595f855aa871ba13,7/27(日) 9:00
2025-07-27,10:37,sports,スポーツ,7,デイリースポーツ,ＤｅＮＡ・藤浪晋太郎　日本球界“復帰戦”で１回をわずか５球で無失点　ボール球なく安定、三者凡退で交代　最速１５６キロに拍手喝采,70,https://news.yahoo.co.jp/articles/253c108228b8de9767940bc15b51913a0d4c61cb,7/26(土) 18:05
2025-07-27,10:37,sports,スポーツ,8,スポーツ報知,全校２４人中２３人が野球部員…創部８年目の未来富山が初聖地、監督は元ヤクルト内野手の長男,62,https://news.yahoo.co.jp/articles/f26d482b54c258b1746a82e0ce9a9abcd8735738,7/27(日) 6:15
2025-07-27,10:37,sports,スポーツ,9,デイリースポーツ,大谷翔平　同点機で３球三振　エルボーガードを装着し忘れる珍事も　相手左腕＆ベンチに頭を下げる,60,https://news.yahoo.co.jp/articles/a502f0143beaec8be9467f32684b171378b80659,7/27(日) 9:27
2025-07-27,10:37,sports,スポーツ,10,TBS NEWS DIG Powered by JNN,【広島】逆転負けの惨敗 4連敗で最多借金8...7月3勝13敗3分の大失速 ファビアン11号ソロで先制も森下が7回に緊急降板 中﨑がリチャード、坂本に痛打,58,https://news.yahoo.co.jp/articles/fe24a0c21b8fcfb933edf38eb02bb8b8fc97c3cb,7/26(土) 21:09
2025-07-27,10:37,sports,スポーツ,11,ベースボールキング,DeNA、初回にまさかの内野陣“お見合い”でフライがポトリ…館山氏「牧選手、宮崎選手などがもっとリーダーシップをとってほしい」と喝,58,https://news.yahoo.co.jp/articles/c40a00959739f4c8642cb2a1421bd375404c6df7,7/27(日) 8:32
2025-07-27,10:37,sports,スポーツ,12,デイリースポーツ,森下緊急降板から暗転…広島が対巨人マツダ連勝ストップ　４連敗で借金８　新井監督「選手の勝ちたい気持ちは伝わってきた」,57,https://news.yahoo.co.jp/articles/2a0f56dd509cadfc06c3d71656fcf3b4154a00de,7/27(日) 8:00
2025-07-27,10:37,sports,スポーツ,13,スポーツ報知,ジャッジ、右肘負傷で１０日間のＩＬ入り　今季初欠場でブーン監督発表　１３年ぶり３冠王に黄信号,54,https://news.yahoo.co.jp/articles/c7a55e3b778e286c2d013792459e09683d4946b1,7/27(日) 6:22
2025-07-27,10:37,sports,スポーツ,14,デイリースポーツ,ＢＤ欠場波紋の飯田将成　ＳＡＴＯＲＵにＢＤ外での対戦申し込みも「断られました」　他団体での試合も決定目前で消滅明かす「圧力かかっちゃって」,45,https://news.yahoo.co.jp/articles/5268956fa6fec9fea9875147b86cb95ad230e5e0,7/26(土) 20:24
2025-07-27,10:37,sports,スポーツ,15,ベースボールキング,山崎隆造氏、広島・末包の起用法に「進化を求めるには失敗も多い中で」…「出し続けることで大きく成長してくれる」,45,https://news.yahoo.co.jp/articles/fa0c2306683a175595fb0aac9f39cfb511c9beb6,7/27(日) 8:00
2025-07-27,10:37,sports,スポーツ,16,ABEMA TIMES,「お客さんに対して失礼」元若乃花、幕内力士が土俵上で見せた振る舞いに苦言 あえて投げかけた“厳しい言葉”「これはアカン」同調の声,43,https://news.yahoo.co.jp/articles/2ad3b8eb05f071605791a0d5f0c78803a638325c,7/27(日) 7:02
2025-07-27,10:37,sports,スポーツ,17,日刊スポーツ,【阪神】やっぱり猛虎は強い！後半戦初戦で完封勝利　投打ガッチリで２位巨人と10差,42,https://news.yahoo.co.jp/articles/2f0267c3c7f02e15caf1ff3d6b3697aa357e887c,7/27(日) 9:06
2025-07-27,10:37,sports,スポーツ,18,デイリースポーツ,大谷翔平　２試合ぶりの３８号アーチ！ナ・リーグキングへ２位と２本差　ここ７戦で６発絶好調　敵地がどよめく,41,https://news.yahoo.co.jp/articles/b1d1a777b03227edfd80c855f2fe08b92693b9b6,7/27(日) 8:17
2025-07-27,10:37,sports,スポーツ,19,TBS NEWS DIG Powered by JNN,【DeNA】今季16度目の零敗で借金2 初回に拙守から大山にV打許す ケイ6回2失点6敗目 佐藤輝に被弾 わずか4安打 桑原猛打賞,40,https://news.yahoo.co.jp/articles/4edb42c17749d5ab0d05626fe218fa65723a4430,7/26(土) 20:42
2025-07-27,10:37,sports,スポーツ,20,スポーツ報知,大谷翔平、３８号の豪快先頭弾から３打席連続の空振り三振…７戦６発でシーズン５８・６本ペース,39,https://news.yahoo.co.jp/articles/f147c3ef81bcb89cf29ee467451de9ec0de7d647,7/27(日) 10:16
2025-07-27,10:37,sports,スポーツ,21,THE ANSWER,100m高校新の16歳・清水空跳、世界陸上代表入りどうなる？　「10秒00」で標準突破＆今季日本最速も他選手の動向次第,39,https://news.yahoo.co.jp/articles/8ef3dd2ccc124e6aeeef697e9404cbb29b335aa8,7/27(日) 4:43
2025-07-27,10:37,sports,スポーツ,22,スポーツ報知,【高校野球】大阪桐蔭が“大阪２強”対決制して決勝進出　履正社に２年連続のコールド勝利,38,https://news.yahoo.co.jp/articles/95fb4e84384701553fc62747ad54577d74158970,7/26(土) 15:53
2025-07-27,10:37,sports,スポーツ,23,ENCOUNT,「これは酷すぎ」「こんなの許しちゃあかん」　祭りでいきなり襲撃されたジョリーにネットも憤り…一般人にも被害出る事件に,38,https://news.yahoo.co.jp/articles/5874c93f299bcfeca53b3bd40f962227293a21f8,7/27(日) 7:10
2025-07-27,10:37,sports,スポーツ,24,THE ANSWER,陸上インターハイで衝撃の100m日本高校新誕生！　“桐生超え”2年生・清水空跳10秒00に会場騒然「自分でも衝撃。伝説を作った」,37,https://news.yahoo.co.jp/articles/7bc5cd2e2a909d8524597cff1556f3f4c3569f69,7/26(土) 18:07
2025-07-27,10:37,sports,スポーツ,25,中日スポーツ,【中日・井上監督語録】７回無死一塁で山本は強行も併殺「手堅く送るかも考えた」「ダブルはないな、という方をチョイスした」,36,https://news.yahoo.co.jp/articles/b18d294a5c52ed3d9ac01aa3e85b5494cd9907af,7/27(日) 5:45
2025-07-27,10:37,sports,スポーツ,26,サンケイスポーツ,ヤクルト、青柳晃洋と契約合意＆近日中に正式に誕生　投手陣のテコ入れへ重要なピース,34,https://news.yahoo.co.jp/articles/1739fb0bbbc4bea438582dd359520358f630e4f9,7/27(日) 2:00
2025-07-27,10:37,sports,スポーツ,27,RONSPO,「三浦監督は内野守備の意思疎通を徹底していたのか」横浜DeNAまさかの内野フライ“お見合い”と完封した阪神の才木－坂本バッテリー新配球…両球団に10.5ゲーム差がついた理由とは？,34,https://news.yahoo.co.jp/articles/5189fa3fabac350eb4a9810a11c9251c772aa054,7/27(日) 7:59
2025-07-27,10:37,sports,スポーツ,28,Full-Count,大谷翔平38号に放送席唖然「あそこに打てる選手は少ない」　衝撃の着弾地点「奥深くへ」,33,https://news.yahoo.co.jp/articles/f8cfb3a489fce28ee163b54cb2d5a000861d5557,7/27(日) 8:56
2025-07-27,10:37,sports,スポーツ,29,日刊スポーツ,前西武GMの渡辺久信氏が失速する古巣に激励の喝「９月までに勝負できる位置にいてほしい」,32,https://news.yahoo.co.jp/articles/0814ad33f57834da271d1c987e5c2136d952e708,7/27(日) 10:04
2025-07-27,10:37,sports,スポーツ,30,スポーツ報知,藤浪晋太郎、ＤｅＮＡ移籍後の初登板に「サンモニ」ご意見番の上原浩治氏は「５球だと判断しづらいですね」,32,https://news.yahoo.co.jp/articles/038720c4cabf46889dd2d8c60c7bc4c3cde8d77b,7/27(日) 9:55
2025-07-27,10:37,sports,スポーツ,31,スポニチアネックス,大谷翔平　2戦ぶり38号！苦手左腕から7月9発目と量産しMLB最多に1本差　今季10本目の先頭打者弾,31,https://news.yahoo.co.jp/articles/99877cdf0105fe14a613589f6989ad284b5af1bc,7/27(日) 8:17
2025-07-27,10:37,sports,スポーツ,32,Full-Count,元アイドルの始球式に気づいた“違和感”　10年ぶり降臨、ショーパン姿に「時代を感じる」,30,https://news.yahoo.co.jp/articles/d690071ba71e7441c637d93faf46def0631fc78d,7/27(日) 7:50
2025-07-27,10:37,sports,スポーツ,33,Full-Count,大谷翔平に豪快HR被弾「悪夢のよう」　指揮官は呆然…敵軍ファンイライラ「なんてこった」,30,https://news.yahoo.co.jp/articles/b7daa2a686e20618b71d4a9a22fc73e42664df11,7/27(日) 9:02
2025-07-27,10:37,sports,スポーツ,34,TopNews,F1公式「久々に最高の予選を見せたユウキに脱帽」！角田裕毅が新フロアで0.9秒短縮、フェルスタッペンに0.381秒差【F1ベルギーGP予選】,30,https://news.yahoo.co.jp/articles/70b7470d1dac40ec4031b29598bac38348685e36,7/27(日) 3:38
2025-07-27,10:37,sports,スポーツ,35,サンケイスポーツ,巨人・阿部監督「阪神に何とか一泡…」　シン・メークドラマへ〝切り札〟バシバシ　スタメン起用のリチャード勝ち越し二塁打＆代打で坂本が二塁打,30,https://news.yahoo.co.jp/articles/6aaee96c1c7fa1f2feec7df66287582c7250d0ce,7/27(日) 7:30
2025-07-27,10:37,sports,スポーツ,36,スポニチアネックス,中止一転…神戸・三木谷会長がバルサ戦開催の経緯説明「着金なかった」も「いろんな人が協力してくれた」,30,https://news.yahoo.co.jp/articles/577d319170dd91fc170755a8aa046a78de8c8f10,7/26(土) 19:25
2025-07-27,10:37,sports,スポーツ,37,スポーツ報知,大谷翔平が３８号先頭弾から２打席連続三振…チャンスで肘当て忘れる珍ハプニングも,29,https://news.yahoo.co.jp/articles/59c2062460befa4e46b6e052dd3bf7412284de26,7/27(日) 9:26
2025-07-27,10:37,sports,スポーツ,38,TBS NEWS DIG Powered by JNN,【中日】ヤクルトに逆転負け 7連勝後の3連敗で借金7...初回 細川の適時打で先制も髙橋宏が6回に同点打を浴び粘れず 藤嶋が7回に赤羽に痛打,29,https://news.yahoo.co.jp/articles/fda27dd85f7bdffd9a85a2ac9c296d1b1f0c3d29,7/26(土) 21:10
2025-07-27,10:37,sports,スポーツ,39,東スポWEB,【Ｆ１】角田裕毅　スプリントでローソンに完敗…11位撃沈で悲観論「どんどん離されてて悲しい」,29,https://news.yahoo.co.jp/articles/e9c3bdcaa5b58a3e05e49fd22fb4b952f6aef5f4,7/26(土) 19:56
2025-07-27,10:37,sports,スポーツ,40,オートスポーツweb,角田裕毅 予選7番手「新フロアのおかげで本来の場所に戻れた」直前の仕様変更にすぐさま適応、移籍後最高位を達成,29,https://news.yahoo.co.jp/articles/a3b1fce0972415cc9adbcc5a11496b4e9ddca709,7/27(日) 6:36
