scrp_date,scrp_time,genre_en,genre_jp,rank,media_jp,title,comment,link,date_original
2025-04-10,13:09,business,経済,1,TBS NEWS DIG Powered by JNN,日経平均株価 一時2800円超上昇 “トランプ関税”「90日間停止」受けて　NY市場ダウ平均も過去最大の上げ幅を記録,296,https://news.yahoo.co.jp/articles/d955df5d5714f75cf2d76806d2f084176fc439ad,4/10(木) 9:05
2025-04-10,13:09,business,経済,2,ロイター,日経平均が3万4000円を回復、米相互関税停止を好感　米中リスクはくすぶる,184,https://news.yahoo.co.jp/articles/466248bca8078d5f91490af115f5f435d4482903,4/10(木) 10:37
2025-04-10,13:09,business,経済,3,帝国データバンク,2月のカレーライス物価、1食407円　初の400円突破　5年間で5割高、コメ・野菜の値上がりが家計直撃,152,https://news.yahoo.co.jp/articles/d37d2d977358b2950730c6d5a9be9e2518849026,4/10(木) 10:01
2025-04-10,13:09,business,経済,4,ファイナンシャルフィールド,運転中「一時停止」の標識に従って停まったのに、罰金「7000円」取られた！ 何が問題だったの？「一時停止違反」のルールや罰則を解説,130,https://news.yahoo.co.jp/articles/6d394cb67d065d56d58100047f47b453d8db4e4b,4/10(木) 11:31
2025-04-10,13:09,business,経済,5,TBS NEWS DIG Powered by JNN,"雑誌「小学8年生」の付録が人気…“ガラケー”でプログラミングを学ぶ!?【THE TIME,】",128,https://news.yahoo.co.jp/articles/13c09e6eea8a2778962cc7814e995f8dd5b9be4e,4/10(木) 9:19
2025-04-10,13:09,business,経済,6,関西テレビ,「皆さんにも責任がある」社長の言葉に従業員が怒り心頭　ミュゼ給与未払い問題　相次ぐ脱毛業界の倒産,112,https://news.yahoo.co.jp/articles/55888756470f244c031b537f63d60b9f01328676,4/9(水) 19:40
2025-04-10,13:09,business,経済,7,現代ビジネス,《コメ高騰》作況指数は嘘、「投機筋」も「インバウンド」も”言い訳”…実態に合わない農水省の説明に対する「疑念」,95,https://news.yahoo.co.jp/articles/77c8e77c532e9ff1ba42b277c3446d4fa3a33ea4,4/10(木) 7:03
2025-04-10,13:09,business,経済,8,テレビ朝日系（ANN）,コメ価格13週連続上昇の中…トランプ関税が飛び火　米通商代表「日本市場参入を拡大」,68,https://news.yahoo.co.jp/articles/3b9ecf3a4c1b62aebf12014f0ae895e50553be8b,4/10(木) 11:39
2025-04-10,13:09,business,経済,9,読売新聞オンライン,ＮＹ円相場、一時１ドル＝１４８円台…「相互関税」９０日間停止発表後１時間程度で３円以上円安に,67,https://news.yahoo.co.jp/articles/9d82b2b7efea59c1bec528ce253f4bc4b31571ff,4/10(木) 3:52
2025-04-10,13:09,business,経済,10,乗りものニュース,「お支払いをお願いします」ETC障害による未払い“計92万件” 無視は「不正通行」になる、これだけの理由 NEXCO中日本が改めて要請,64,https://news.yahoo.co.jp/articles/16e99d0f4fb9f6dd6c311b58b8b9c8e561ed81a5,4/10(木) 7:12
2025-04-10,13:09,business,経済,11,ダイヤモンド・オンライン,「日本は米に700％関税」トランプ氏はデタラメだと反発する日本人が知らない事実,55,https://news.yahoo.co.jp/articles/87829a8a3b474cd465ee4327ca0f988006cc92b1,4/10(木) 4:02
2025-04-10,13:09,business,経済,12,共同通信,日鉄の買収計画に懸念表明　トランプ大統領、USスチール,55,https://news.yahoo.co.jp/articles/4a5f997e07236d70d7d0067ee81a48b934a07777,4/10(木) 6:49
2025-04-10,13:09,business,経済,13,THE GOLD ONLINE（ゴールドオンライン）,"若い女性と結婚したい65歳元高校教師「自分の生きた証をこの地球上に残す」…年金月12万円、生涯現役、婚活100戦100敗、結婚相談所で撃沈した""酷なひと言""【FPの助言】",52,https://news.yahoo.co.jp/articles/8914f07da296758be63c652a0adb8f8f90e1e5fb,4/10(木) 10:32
2025-04-10,13:09,business,経済,14,読売新聞オンライン,トランプ政権「相互関税」が全面発動、中国は報復関税８４％に引き上げ…世界経済に「深刻な打撃」懸念,47,https://news.yahoo.co.jp/articles/6fb1f1a4d565148eccecfd0941e8940540b449f3,4/10(木) 0:01
2025-04-10,13:09,business,経済,15,読売新聞オンライン,アメリカの日本への相互関税、２４％から１０％に…トランプ氏が上乗せ分９０日間停止発表,43,https://news.yahoo.co.jp/articles/e0c00cda0b923b60ed442903ba1d526dd44f266b,4/10(木) 10:15
2025-04-10,13:09,business,経済,16,テレビ朝日系（ANN）,【速報】日経平均株価　終値3万1714円（前日比1298円安）　　関税めぐる不透明感や円高影響,42,https://news.yahoo.co.jp/articles/aa8705de561dfdc9e70298ef203723256396410c,4/9(水) 15:37
2025-04-10,13:09,business,経済,17,時事通信,〔NY外為〕円、一時143円台に上昇＝半年ぶり高値（9日朝）,41,https://news.yahoo.co.jp/articles/89b76918203a54fa7d582cd317fa4991b8a031e4,4/9(水) 22:00
2025-04-10,13:09,business,経済,18,読売新聞オンライン,一時１ドル＝１４３円台、半年ぶり円高水準…米「相互関税」への懸念で１日で約２円の円高に,40,https://news.yahoo.co.jp/articles/7af420834af52794abe67f85de2d4e686a8cc17c,4/9(水) 21:25
2025-04-10,13:09,business,経済,19,税理士ドットコム,愛人からの贈与で「10年間で1億円貯まった」けれど無申告・・・このまま申告しないと逮捕される？,38,https://news.yahoo.co.jp/articles/0758d07fa6093fc43cd0a8840c4e207e204caffc,4/10(木) 11:40
2025-04-10,13:09,business,経済,20,Merkmal,「不正が許せない」 ついに中央線グリーン車で“赤ランプ狩り”発生？ SNSで広がる困惑の声、もはや「グリーン車警察」か？ 自力救済が可視化する制度設計の限界とは,36,https://news.yahoo.co.jp/articles/7352ddbf461147cc17df6990a63eaccdfafe94f2,4/10(木) 11:51
2025-04-10,13:09,business,経済,21,TBS NEWS DIG Powered by JNN,日経平均株価が一時1700円以上下落 “トランプ関税”発動で貿易戦争過熱の懸念か,35,https://news.yahoo.co.jp/articles/3b886b274a6438d738555bbc966ee55ae0436e61,4/9(水) 13:29
2025-04-10,13:09,business,経済,22,ニュースイッチ,中国で新エネルギー車販売不振…マツダ、第2弾のSUVで起死回生なるか,33,https://news.yahoo.co.jp/articles/04ca558c27be6c0334b861d78b16e81995e57424,4/10(木) 11:20
2025-04-10,13:09,business,経済,23,みんかぶマガジン,トランプについて「相性は合うと思う」勘違い石破総理の残念さ…「一体どこの評論家なのか」鬼の関税に何もできない我が国のリーダーに絶望,31,https://news.yahoo.co.jp/articles/b4e9d8a367fa537bbdef3d2a87271720eee826ab,4/10(木) 9:10
2025-04-10,13:09,business,経済,24,TBS NEWS DIG Powered by JNN,備蓄米の追加放出へ　再来週には10万トンの入札　7月まで毎月放出,31,https://news.yahoo.co.jp/articles/862868a145ee2e2bc83cdfcb4ca1b3d91714e7e4,4/9(水) 16:16
2025-04-10,13:09,business,経済,25,関西テレビ,初公開！万博海外パビリオン　アメリカ　目玉は55年前にも来た「月の石」【大阪・関西万博】,29,https://news.yahoo.co.jp/articles/2acc773e1d733ac56af2b89f2f410d1a55ed53ad,4/9(水) 18:13
2025-04-10,13:09,business,経済,26,時事通信,ガソリン、過去2番目の高水準　1．4円上昇、186．3円に　経産省,29,https://news.yahoo.co.jp/articles/9d0b420d87106e172416ce79c4c94228f8eadd2d,4/9(水) 14:19
2025-04-10,13:09,business,経済,27,マネーポストWEB,【使われない郵便ポスト】全体の4分の1は「1日1通も投函されていない」状態…“いくら値上げをしても赤字を垂れ流す”日本郵便の構造的問題,29,https://news.yahoo.co.jp/articles/0a7f1e65d9ca55a7656f42f367692a871e387723,4/10(木) 7:16
2025-04-10,13:09,business,経済,28,共同通信,鴻海、日本で複数EV発売へ　日系メーカーと協業も,26,https://news.yahoo.co.jp/articles/dc414368584db1851c2a598b472c9fdfd32ae37d,4/9(水) 16:25
2025-04-10,13:09,business,経済,29,FNNプライムオンライン,橋下徹氏「万博開催自体が“起死回生”パビリオン残さずカジノ切り替えがレガシー」元大阪市長だが「僕は言っただけ。その後皆さん本当大変だった」,25,https://news.yahoo.co.jp/articles/1024c7e104027f207e75db871315f122eec332e3,4/9(水) 18:33
2025-04-10,13:09,business,経済,30,ABEMA TIMES,「ジブリ風」「ドラゴンボール風」SNSで生成画像が流行中 著作権に関して弁護士が指摘,25,https://news.yahoo.co.jp/articles/9c36c732edf5eb8b3fcf6ee4cc6bff93ea495f58,4/10(木) 7:02
2025-04-10,13:09,business,経済,31,THE GOLD ONLINE（ゴールドオンライン）,かっこつけるんじゃなかった…年金月23万円・65歳元会社員「人生最後の奉公、お金は重要じゃない」とキメキメで再就職を決めたが…日本年金機構からの〈年金停止通知〉に悶絶,23,https://news.yahoo.co.jp/articles/2e9eb18b39adcd66f85d01ab95d7da90b4c71683,4/10(木) 9:02
2025-04-10,13:09,business,経済,32,Webikeプラス,スズキが39年ぶりに「S」ロゴマークを変更！ デジタル表示に合わせて”少し細め”に ユニフォームもチェンジだ,23,https://news.yahoo.co.jp/articles/4d7432753e31a62ce1b26d8c681a76667e20bbe7,4/10(木) 11:40
2025-04-10,13:09,business,経済,33,東洋経済オンライン,町田駅、小田急で「新宿に次ぐナンバー2」の求心力　いつの間にか乗降数3位に…だがJR横浜線・神奈中バスとの乗り換えや買い物客で一日中にぎわう,22,https://news.yahoo.co.jp/articles/975e8617332e27fdb8c97aef862912aff03efea3,4/10(木) 4:32
2025-04-10,13:09,business,経済,34,ITmedia ビジネスオンライン,「売る米がない……」米屋の倒産、2年連続で増加　米価高騰に転嫁追い付かず,21,https://news.yahoo.co.jp/articles/e4750899e09cb8a808b9c385371b9d7fb24c5054,4/10(木) 8:10
2025-04-10,13:09,business,経済,35,プレジデントオンライン,会社はボロボロだけど、クルマは一流…「ホンダに見捨てられた日産」に台湾・ホンハイ社が熱視線を送るワケ,21,https://news.yahoo.co.jp/articles/c0d0cb2a70e8589ded2ffac747f6fd563cfac91f,4/10(木) 7:17
2025-04-10,13:09,business,経済,36,ダイヤモンド・オンライン,「外国人材の給料が高すぎる」と怒る人が目をつぶる「日本人の能力不足」という大問題,21,https://news.yahoo.co.jp/articles/ec440cd4e05ed758022826542c8d58ef664ff349,4/10(木) 8:02
2025-04-10,13:09,business,経済,37,THE GOLD ONLINE（ゴールドオンライン）,《プロレスラー川田利明》ベンツを売って保険も解約…3年以内に8割以上が消えるラーメン屋経営で、金を溶かしながら15年続けてきた「たった一つの理由」,20,https://news.yahoo.co.jp/articles/bc47fe804b1d4e78279714880cf39430d6b85a28,4/10(木) 11:32
2025-04-10,13:09,business,経済,38,読売新聞オンライン,アメリカの追加関税に中国「過ちに過ちを重ね、中国の権益を侵害」…報復関税８４％発動へ,19,https://news.yahoo.co.jp/articles/faeb1dc44429710b3c8440ce92261491495504d1,4/10(木) 10:39
2025-04-10,13:09,business,経済,39,ニュースイッチ,原材料価格が高騰…ホンダ、小型ミニバン「フリード」値上げ,19,https://news.yahoo.co.jp/articles/50488ff9f0b082071fd0a5a1ddedc97aa03e2ebd,4/10(木) 9:10
2025-04-10,13:09,business,経済,40,ダイヤモンド・オンライン,頭がいい人ほどよく使う、「たった4文字」の言葉とは？,19,https://news.yahoo.co.jp/articles/0962710fea2e0b04ce96a9ee7a79c32378e2f014,4/10(木) 6:51
