scrp_date,scrp_time,genre_en,genre_jp,rank,media_jp,title,comment,link,date_original
2025-03-09,03:07,business,経済,1,みんかぶマガジン,橋下徹氏、維新・前原氏批判の泉房穂氏を罵倒「テメー」「ボケッ」繰り返される大阪増税…冷静に考えて正しいのはどちらか,71,https://news.yahoo.co.jp/articles/c63190554b7c9fa91c5af20c24a0c1ae702ad84e,3/8(土) 9:10
2025-03-09,03:07,business,経済,2,Bloomberg,ナスダック取引所、26年下期にも24時間体制に－国外からの需要に応え,41,https://news.yahoo.co.jp/articles/6a6d38b4800c0b628db8c5f4fc5a6a2f3a8d66cc,3/8(土) 6:11
2025-03-09,03:07,business,経済,3,東洋経済オンライン,「演技のトーンが違いすぎ」「作品に集中できない」などの声も…。フジ月9『119エマージェンシーコール』でゲスト声優多用に生じた“違和感”の背景,40,https://news.yahoo.co.jp/articles/70cf2942a5b929a2152d10e1658d5a082a0f161b,3/8(土) 6:41
2025-03-09,03:07,business,経済,4,産経新聞,「赤字路線存続を」JR株を買う沿線自治体　〝モノ言う株主〟提案をJRは聞き入れるのか,35,https://news.yahoo.co.jp/articles/fbb183cc45bf3835f774df1f83855c5a0a4cf54a,3/8(土) 18:07
2025-03-09,03:07,business,経済,5,ロイター,中国、カナダの農産物・食品に報復関税　最大100％,30,https://news.yahoo.co.jp/articles/836b2300ab5d40a6a24f58530020109151cb5446,3/8(土) 10:44
2025-03-09,03:07,business,経済,6,TBS NEWS DIG Powered by JNN,新興「トライアル」が老舗「西友」を買収、小売業の「主役」変わるか【播摩卓士の経済コラム】,28,https://news.yahoo.co.jp/articles/cd00f5dbd112f27f3b26258a0121c10729582cf6,3/8(土) 14:02
2025-03-09,03:07,business,経済,7,Merkmal,日本のせいにするなよ？ 「アメ車」が日本で売れない5つの理由 トランプの批判は的外れ？,24,https://news.yahoo.co.jp/articles/7397e9a4a9773aab97837de86c4fb72c75b712dc,3/8(土) 8:51
2025-03-09,03:07,business,経済,8,鉄道コム,敦賀駅はなぜ「不便な構造」になった？　「対面接続」断念した理由とは,24,https://news.yahoo.co.jp/articles/ca18961178b0feb2293ddbdeeb38744911c75624,3/8(土) 13:35
2025-03-09,03:07,business,経済,9,読売新聞オンライン,ネットに抜かれ「テレビ離れ」、地方の民放の対策は…サーモン陸上養殖・地元中小企業支援・系列局内で再編,22,https://news.yahoo.co.jp/articles/a652d605294ff3e42a5f62e290d430c913d39b65,3/8(土) 11:01
2025-03-09,03:07,business,経済,10,毎日新聞,アップル幹部に聞く「iPhone 16e」発売の理由と隠れた新技術,22,https://news.yahoo.co.jp/articles/0b122df1c13cc8a6c51364e90d1fb89f0e1f1669,3/8(土) 9:30
2025-03-09,03:07,business,経済,11,ファイナンシャルフィールド,5万円のスニーカーを「投資になるから」と買う夫。下駄箱を圧迫しているのですが「プレミア価格になる」と聞き入れてもらえません。本当にそれほど儲かるのでしょうか…？,20,https://news.yahoo.co.jp/articles/32b58c9fcb62d9e891f1f4c42e7d9f83db10e9ad,3/8(土) 14:10
2025-03-09,03:07,business,経済,12,日刊ゲンダイDIGITAL,備蓄米放出でもコメ高騰は抑えられない！「コシヒカリ」応札集中確実…得をするのは自民の“大票田”のみ【上位10品目リスト付き】,19,https://news.yahoo.co.jp/articles/cb84bb926b5bc05761055828d273c4b42aa307b5,3/8(土) 9:06
2025-03-09,03:07,business,経済,13,集英社オンライン,「#Ｄヲタのディズニー離れ問題」は本当だったのか？ 過去最高益を記録したディズニーランドが目指した“ウォルトの理想からの脱却”とは,19,https://news.yahoo.co.jp/articles/ed1ae326a96f63efe9f1dc183007872e13afffd9,3/8(土) 12:01
2025-03-09,03:07,business,経済,14,ベストカーWeb,日産はいつもの日産だった 日産ホンダ経営統合計画の破談と今後,19,https://news.yahoo.co.jp/articles/78942e7498e8d364d8493441930b8752cc35c2b0,3/8(土) 23:00
2025-03-09,03:07,business,経済,15,くるまのニュース,レンタカーで「コッソリ喫煙」が大迷惑すぎる!? バレてないのは「自分だけ」の実態とは タバコは「嫌な臭い」という根本的事実,19,https://news.yahoo.co.jp/articles/a507b96a66eb22c1005895363475bf35ddb31807,3/8(土) 18:10
2025-03-09,03:07,business,経済,16,Merkmal,「夜行列車消滅 ＝ 正常な進化」は本当か？ 新幹線礼賛論に異議あり！ 鉄道オタクに決定的に欠けた「利用者視点」とは,17,https://news.yahoo.co.jp/articles/29f22b55064b72e469477e1b0a585e53fb797fb8,3/8(土) 5:51
2025-03-09,03:07,business,経済,17,マネーポストWEB,《キャッシュレス決済の落とし穴》「常に数十万円が財布に入っているような錯覚に陥る」…便利さの裏に潜むムダ遣い、ポイント還元の誘い文句から余計な出費も,17,https://news.yahoo.co.jp/articles/d6544ecd089fc17d6ce4fdb8f2b714c1a1abcd7c,3/8(土) 15:16
2025-03-09,03:07,business,経済,18,ベストカーWeb,値段がバグってるよね!!! RAV4級のトヨタ製EVがまさかの225万円ってどういうこと?,16,https://news.yahoo.co.jp/articles/a498ccbaf10089870fae68bd5da8c30542dbd77e,3/8(土) 20:00
2025-03-09,03:07,business,経済,19,MotorFan,ホンダ シビックが売れないのはトヨタ プリウスのせい!? 400万円級の国産ハイブリッドハッチバック対決,16,https://news.yahoo.co.jp/articles/44b472243681be11e3695a007752fb69b6f4a440,3/8(土) 14:45
2025-03-09,03:07,business,経済,20,ファイナンシャルフィールド,8年ほど乗った「アルファード」を、子どもが生まれる長男夫婦に譲りたいです。査定で「130万円」の値が付きましたが、贈与税はかかるのでしょうか？,16,https://news.yahoo.co.jp/articles/f5dc54337a07288aa686b999d0331dfd5e5c25d4,3/8(土) 13:30
2025-03-09,03:07,business,経済,21,東洋経済オンライン,「この世が終わった」のを知らないのは日本だけ、そして資本主義、民主主義が終わりバブルは崩壊する,15,https://news.yahoo.co.jp/articles/7cd1fb5b32a4f5abeb5a51ce26144ed3492183de,3/8(土) 6:32
2025-03-09,03:07,business,経済,22,FNNプライムオンライン（フジテレビ系）,コメ価格見通し指数低下　高騰落ち着くとの見方,15,https://news.yahoo.co.jp/articles/e386a51ca045656cd5e61d5964b3b90df59e7bfd,3/8(土) 7:58
2025-03-09,03:07,business,経済,23,読売新聞オンライン,三菱ＵＦＪ銀行、「卵子凍結」費用を補助へ…手薄だった出産前サポート導入,15,https://news.yahoo.co.jp/articles/2a392759097c85b42df65da8dece6e5958ad4000,3/8(土) 5:01
2025-03-09,03:07,business,経済,24,THE GOLD ONLINE（ゴールドオンライン）,"お父さん、ひどい！財産7,000万円はすべて長男と「尽くしてくれている」嫁に…久しぶりに帰省した〈48歳・薬剤師の長女〉が85歳父のひと言に膝から崩れ落ちたワケ【弁護士の助言】",14,https://news.yahoo.co.jp/articles/8391437e7d542d577e70eb034aaf6dc8e4b3a348,3/8(土) 10:02
2025-03-09,03:07,business,経済,25,ベストカーWeb,園バスの運転士も不足で通園不可能の危機に! バス事業者とは異なる事情が深すぎた……,14,https://news.yahoo.co.jp/articles/48be444bf031144447bac510f387cee2ccd9f423,3/8(土) 11:00
2025-03-09,03:07,business,経済,26,ダイヤモンド・オンライン,マツダが発売直後の「CX-60」に大幅改良を迫られる異常事態に…新モデル試乗で分かった「改良の真価」,13,https://news.yahoo.co.jp/articles/99be3200260a705ce2712ef5c7d71df972799b7c,3/8(土) 12:02
2025-03-09,03:07,business,経済,27,NEWSポストセブン,“156センチ、ぷるるんダンサー”の女性が恵比寿ガーデンプレイスであられもない姿に…施設側が回答「あまりにも品がない」　弁護士の見解は,13,https://news.yahoo.co.jp/articles/c82f0c4463cf04735ced5c772f73498d128d62de,3/8(土) 7:15
2025-03-09,03:07,business,経済,28,読売新聞オンライン,「空港でスニーカー認めて」エア・ドゥ労組が要求…荷物運搬で走る機会多く,13,https://news.yahoo.co.jp/articles/661808bd02a150aaf7e9af1a5dc99dc8881545c0,3/8(土) 7:21
2025-03-09,03:07,business,経済,29,日刊ゲンダイDIGITAL,短期滞在ビザ緩和で「右も左も中国人」に？ 国内観光業者にも広がる危機感と疑心暗鬼【変容するインバウンド】#5,13,https://news.yahoo.co.jp/articles/b2595cc50988f6f8807ea576b323aff0ba1b64bf,3/8(土) 9:06
2025-03-09,03:07,business,経済,30,乗りものニュース,日本列島につきまとう「超あやしいロシア軍艦」が不審な動き 沖縄に“超接近”も 自衛隊が警戒監視,12,https://news.yahoo.co.jp/articles/ed8e24ae1d2ef20c195141185d4d98b842cb4c23,3/8(土) 16:12
2025-03-09,03:07,business,経済,31,VAGUE,スーパーカーブーム世代は覚えてる!? 黄色い「パンテーラ」がオークションに登場 2万キロ未満の極上車は1991年式の最終モデル,11,https://news.yahoo.co.jp/articles/375e828f5cdcaf6e5f23f49395442ca73950fe04,3/8(土) 21:10
2025-03-09,03:07,business,経済,32,ファイナンシャルフィールド,日銀が「0.5％」の追加利上げを発表！ 変動金利で借りてる場合「返済額」はいきなり増えてしまう？「5年ルール・125％ルール」についても解説,11,https://news.yahoo.co.jp/articles/82184789ec956ecce6a725032af8a0e62a560417,3/8(土) 14:10
2025-03-09,03:07,business,経済,33,集英社オンライン,コメの次はコーヒー豆が歴史的高騰「コーヒー1杯1000円という時代が来ても不思議ではない」原因と今後の展望は？,11,https://news.yahoo.co.jp/articles/827aae35509d4d9859855acd673cd3a900db3e30,3/8(土) 13:02
2025-03-09,03:07,business,経済,34,みんかぶマガジン,下がる日経平均…資産3億円投資家が指摘する「今、投資家がやるべきではないこと」トランプ相場の期待外れ,10,https://news.yahoo.co.jp/articles/8e74d5931734df7739ddedb5f0c66e05ebb2d567,3/8(土) 17:10
2025-03-09,03:07,business,経済,35,ダイヤモンド・オンライン,「赤と青どっちがいい？」と聞かれたとき、ダメ管理職は「色」を答える。じゃあ、一流の管理職は？,10,https://news.yahoo.co.jp/articles/9fa4b427305e5b26bb1c3a42aff3af3354120002,3/8(土) 4:11
2025-03-09,03:07,business,経済,36,ダイヤモンド・オンライン,AI「トップ100大学」中国49校で日本は“ゼロ”、在米トップ研究者の半数も中国出身者,10,https://news.yahoo.co.jp/articles/71d94f3322e9b10d31d49116537263c78767f3da,3/8(土) 8:02
2025-03-09,03:07,business,経済,37,ファイナンシャルフィールド,銀行に貯金「1000万円」を預けていますが、利息にも税金がかかりますか？確定申告が必要なのでしょうか...？,10,https://news.yahoo.co.jp/articles/2fc938779ef81e66a8b201a3a61921165fe993f9,3/8(土) 8:30
2025-03-09,03:07,business,経済,38,ファイナンシャルフィールド,スーパーで「冷凍食品」を買おうとしたらほとんどが値上がりしていて驚きました……なんでこんなに高くなっているのでしょうか？,10,https://news.yahoo.co.jp/articles/6048b5f4759863876d1af635973bff9c6f89f1d6,3/8(土) 11:20
2025-03-09,03:07,business,経済,39,テレビ朝日系（ANN）,養育費受け取り3割未満　制度変更へ スマホで支援も,10,https://news.yahoo.co.jp/articles/8388fd1b59e8b5216c1337104ae88ef7d867cb3c,3/8(土) 12:13
2025-03-09,03:07,business,経済,40,現代ビジネス,日本人はいよいよ「絶滅」するのか、多くの人が直視していない「この国の厳しい現実」,10,https://news.yahoo.co.jp/articles/2fc0df853d8a914d05799654976d64f2cb49728f,3/8(土) 6:01
