scrp_date,scrp_time,genre_en,genre_jp,rank,media_jp,title,comment,link,date_original
2024-07-05,23:06,business,経済,1,ニューズウィーク日本版,マイナンバー制度はゼロから見直すべき…任意取得という「根幹」が揺らぎ、取り返しのつかないリスクが,80,https://news.yahoo.co.jp/articles/132e78a760fb165711741749605a7372c4698eb5,7/5(金) 18:01
2024-07-05,23:06,business,経済,2,時事通信,漏えい情報拡散なら法的措置　KADOKAWAが警告,76,https://news.yahoo.co.jp/articles/3faee354ce127d860f9e746ca0f60ed4f1d3e758,7/5(金) 10:39
2024-07-05,23:06,business,経済,3,TBS NEWS DIG Powered by JNN,【速報】日経平均株価が取引時間中の史上最高値を更新,75,https://news.yahoo.co.jp/articles/0f8a3d549bb1c096d8fad49fd1343cea61975923,7/5(金) 9:05
2024-07-05,23:06,business,経済,4,みんかぶマガジン,開成→東大医学部のトップエリート「東大医学部は、医師にならない人が日本一多い医学部」年収10億円もいる華麗なる東大医学部卒業生たち,52,https://news.yahoo.co.jp/articles/b97ee4946fdac1833514eab6c915563ef35fe331,7/5(金) 17:10
2024-07-05,23:06,business,経済,5,マネーポストWEB,「なぜ東京大学には女性が少ないのか？」異色キャンペーンの波紋続く　根底に女性差別があるという見方に対して東大OGが「問題をすり替えている」と批判する理由,50,https://news.yahoo.co.jp/articles/82c68841e682d53ca4a91e5d5e698bd49a93ee19,7/5(金) 16:16
2024-07-05,23:06,business,経済,6,東洋経済オンライン,池上彰が「国公立大学の無償化」を提言する理由　“Fラン”大学は「淘汰」されるが専門職大学は「増加」と予測,47,https://news.yahoo.co.jp/articles/098b7d4f6eef48c4dae992f3c311abed02895f91,7/5(金) 19:32
2024-07-05,23:06,business,経済,7,プレジデントオンライン,「少子化はむしろ好都合」エミン・ユルマズ断言「人口減の日本は経済成長を遂げ、中国インドが没落する」,32,https://news.yahoo.co.jp/articles/289e335638d9fa06e12c3092f8efffc81107bdfd,7/5(金) 18:17
2024-07-05,23:06,business,経済,8,共同通信,ドコモ、銀行業参入に意欲　新社長「年度内に方向性」,31,https://news.yahoo.co.jp/articles/3eb47ef56befb3c5b1aadefa0273da4efa5b2a52,7/5(金) 5:03
2024-07-05,23:06,business,経済,9,Bloomberg,ハンガリー首相がモスクワ訪問、プーチン氏と会談－ＥＵ首脳ら非難,27,https://news.yahoo.co.jp/articles/eae6bf7a4432886b78193441c0872c456c09e7ce,7/5(金) 20:42
2024-07-05,23:06,business,経済,10,プレジデントオンライン,日本に豊田章男氏がいたのは幸運だった…「EV化の真実」を主張し続けた豊田氏が筆者に明かした「真意」,24,https://news.yahoo.co.jp/articles/beadbc5b109c0a83fd20813ff02671bde0efd236,7/5(金) 8:17
2024-07-05,23:06,business,経済,11,読売新聞オンライン,ソニーが録画用ブルーレイディスク生産終了へ、光ディスクの記録メディアから完全撤退「市場が縮小」,23,https://news.yahoo.co.jp/articles/866a996184d3b9bca13a74aff29a3d3b737b217a,7/5(金) 18:13
2024-07-05,23:06,business,経済,12,WEB CARTOP,長澤まさみさんを起用したCMもヒット！　ハッキリいって中国メーカーのBYDは日本で確実に成功に向かっていた,22,https://news.yahoo.co.jp/articles/776c281a43b31de446049f018994491d3b9575bd,7/5(金) 13:10
2024-07-05,23:06,business,経済,13,マネーポストWEB,民泊禁止のマンションで“観光客らしき外国人”の頻繁な出入りに戸惑う住人たち　ゴミ置き場は荒れ、エントランスはホテルのロビー状態,22,https://news.yahoo.co.jp/articles/6c9e8a629a25e6756e005e9cd0c44bc2b8d6a574,7/5(金) 15:15
2024-07-05,23:06,business,経済,14,共同通信,トヨタ子会社社長が謝罪　下請法違反「申し訳ない」,22,https://news.yahoo.co.jp/articles/126744660d731ddee1d7b39f6c02f6e59fa5e0c4,7/5(金) 18:49
2024-07-05,23:06,business,経済,15,ファイナンシャルフィールド,【入院中の食費】大部屋に30日間入院し、高額療養費制度を使っても請求額は20万円でした。病院の食事に「1食400円」は高いでしょうか？,20,https://news.yahoo.co.jp/articles/362fa385c2a8d57d561b14b2eadbf498a9e3eccf,7/5(金) 18:10
2024-07-05,23:06,business,経済,16,WEB CARTOP,「うっせーな」とか言わないで！　対策は十分してるけど「トラック」が「騒音」から逃れられないワケ,18,https://news.yahoo.co.jp/articles/959a3cdfcb94087141e9685cca02ea6f8ca69953,7/5(金) 20:11
2024-07-05,23:06,business,経済,17,ABEMA TIMES,経済同友会・新浪代表「株価に実体経済が追いついていない」,17,https://news.yahoo.co.jp/articles/f2140ece7c40d3854130649397fda867d7f33c60,7/5(金) 8:02
2024-07-05,23:06,business,経済,18,テレビ朝日系（ANN）,ウナギ完全養殖「生産コスト20分の1」 1匹あたり約1800円　水産庁,17,https://news.yahoo.co.jp/articles/e1ffa699bca54455e207fbb93b0a800f5f44f974,7/5(金) 9:13
2024-07-05,23:06,business,経済,19,ダイヤモンド・オンライン,新紙幣の「隠れた狙い」はタンス預金のあぶり出し！福沢諭吉も真っ青な「税金」「裏ガネ」の未来とは？,15,https://news.yahoo.co.jp/articles/24755c344ee73b7e08c7d6fa5f270ca717556be8,7/5(金) 12:36
2024-07-05,23:06,business,経済,20,朝日新聞デジタル,生活「苦しい」59.6%、子ども・高齢者世帯で急増　厚労省調査,15,https://news.yahoo.co.jp/articles/01c332a7a00a7bb8f884d4af7b8e33c3ffea49e9,7/5(金) 17:30
2024-07-05,23:06,business,経済,21,テレビ朝日系（ANN）,高齢化団地の上下階「セット貸し」が満室　家賃5万円台で若い世代呼び込む,14,https://news.yahoo.co.jp/articles/80caae3b54f8bdc1b1b4993c564fcd073dccf632,7/5(金) 11:33
2024-07-05,23:06,business,経済,22,マネーポストWEB,大阪のマンションで“家賃が突然2倍に”大騒動　民泊需要を狙って中国系不動産会社が一棟買い、着々とリフォーム進み、住民は続々退去,14,https://news.yahoo.co.jp/articles/b517d4c8e4b2a93e4e94809389490dac6d1238f5,7/5(金) 7:15
2024-07-05,23:06,business,経済,23,乗りものニュース,「エンジン多けりゃ速いんじゃない？」実は双発にしたけど無理だった！ それでも“使えた機体”とは？,14,https://news.yahoo.co.jp/articles/c5e284fee06bf7b30e9fff121a86996d28ae278d,7/5(金) 16:12
2024-07-05,23:06,business,経済,24,Merkmal,昼間の交通事故を防ぐ！ 「デイライト」は日本で義務化されるか？ そもそもなぜ基準が二つあるのか,14,https://news.yahoo.co.jp/articles/9a8aa893f6556334a985e3f002a9da4a70ea6e2f,7/5(金) 14:10
2024-07-05,23:06,business,経済,25,日テレNEWS NNN,トヨタ系列会社に下請法違反で勧告　不当に部品返品　公取委,14,https://news.yahoo.co.jp/articles/e0af7093ef31a498ee051f7768e238cf4fbdbe50,7/5(金) 21:34
2024-07-05,23:06,business,経済,26,Webikeプラス,衝撃、モトGPが850cc化で市販車ベースのSBKより遅くなる？　レース転換期が到来！,13,https://news.yahoo.co.jp/articles/dbf29b0068f564fd82cdd38e3fe4aa67b66b83a2,7/5(金) 18:40
2024-07-05,23:06,business,経済,27,プレジデントオンライン,イェール大名誉教授「筆記テストと偏差値は個性を潰す」…今すぐ日本の学校教育を改革すべきワケとは,12,https://news.yahoo.co.jp/articles/318fd3586391e6795d2ca359800b0057493b7433,7/5(金) 9:17
2024-07-05,23:06,business,経済,28,京都新聞,「京都の良質な地下水を損なう」　北陸新幹線小浜ルート、銭湯文化伝える若手社長が危機感,12,https://news.yahoo.co.jp/articles/4a26c26d8666b4e930337d3decfa50a8751beca7,7/5(金) 10:30
2024-07-05,23:06,business,経済,29,読売新聞オンライン,人工シラスウナギの大量生産「商業化の道筋見えてきた」…生産コスト１匹４万円から１８００円に下げる,11,https://news.yahoo.co.jp/articles/be097f87c93939fb4d05c42f970394f821af6b92,7/5(金) 18:44
2024-07-05,23:06,business,経済,30,乗りものニュース,「オイ違う車両挟まってるぞ」明らかに取って付けた扉… なぜ国鉄・JRは一時期“魔改造電車”ばかりだったの？,11,https://news.yahoo.co.jp/articles/fa8d9d4bc60e0f49f51884e7a5b6e9cfc4f99c52,7/5(金) 7:12
2024-07-05,23:06,business,経済,31,くるまのニュース,全長3.6mの新型「スポーツカー」発表！ レトロデザインに斬新「タテ出しマフラー」採用した小さなスポーツカー「ペッレ」登場！,11,https://news.yahoo.co.jp/articles/2038940188568f94df6d57d9355859f7fb13f139,7/5(金) 21:25
2024-07-05,23:06,business,経済,32,テレビ朝日系（ANN）,トヨタ　型式指定めぐる調査完了　新たな不正は確認されず,10,https://news.yahoo.co.jp/articles/d67e7bf2f8b37e23007ef25cfab39bdcc382631e,7/5(金) 21:44
2024-07-05,23:06,business,経済,33,乗りものニュース,JR東西がタッグを組む！ 在来線車両の装置などを共通化 「垣根を超えて連携を深めたい」,10,https://news.yahoo.co.jp/articles/63333aeb9fb0b8400ebb0d370d4a14526ba04809,7/5(金) 15:18
2024-07-05,23:06,business,経済,34,共同通信,企業倒産、10年ぶりの高水準　上半期22％増、物価高響く,10,https://news.yahoo.co.jp/articles/8aca744d4d5dcb0cd514c97f554f1d2a1a807eb8,7/5(金) 15:01
2024-07-05,23:06,business,経済,35,東海テレビ,型式指定の認証巡る不正…トヨタ自動車「問題の7車種以外では確認されず」国交省に新たな不正なしと報告,10,https://news.yahoo.co.jp/articles/d5b8a7e7c64cdd99cd731ae631096d1b11f33ceb,7/5(金) 21:16
2024-07-05,23:06,business,経済,36,TBS NEWS DIG Powered by JNN,トヨタ系列の車体製造会社が下請法違反で謝罪,10,https://news.yahoo.co.jp/articles/101a3c8bcc86d538e87bbe0afd9a9e41554075e8,7/5(金) 21:12
2024-07-05,23:06,business,経済,37,Bloomberg,ビットコイン急落、２月以来の安値-政治やマウントゴックス巡るリスク,9,https://news.yahoo.co.jp/articles/de664c8cc091da6b415fa49b5f403b7b4a7dc8c5,7/5(金) 12:18
2024-07-05,23:06,business,経済,38,ベストカーWeb,N-BOX超えの[軽販売1位]に!! スライドドア採用の[スペーシア]はリッター25km超! 首位にも納得のデキ,9,https://news.yahoo.co.jp/articles/fd6bc7a2a7c0358cadf0aa20215b24fe0d392440,7/5(金) 20:00
2024-07-05,23:06,business,経済,39,読売新聞オンライン,西武ＨＤ、軽井沢や箱根のリゾート開発に７００億円投資…コロナ後の観光需要の高まりに期待,9,https://news.yahoo.co.jp/articles/c05b13d2a0809edf040e8b07ad36dd50ff49d548,7/5(金) 21:23
2024-07-05,23:06,business,経済,40,ダイヤモンド・ザイ,NISAで大人気の「オルカン」の基本と投資初心者が勘違いしやすい“3つの罠”を解説！ 全世界株型とはいえ、6割は米国株でリスクも高め、円高では急落の可能性も,9,https://news.yahoo.co.jp/articles/8ea4f4dc7d8a302082ae025ef39ed38982c52e8b,7/5(金) 21:21
