scrp_date,scrp_time,genre_en,genre_jp,rank,media_jp,title,comment,link,date_original
2024-05-03,17:22,TTL,総合,1,TBS NEWS DIG Powered by JNN,岸田総理“外遊ラッシュ” フランスでマクロン大統領と会談後、ブラジルに到着　今夜ルラ大統領と会談へ,486,https://news.yahoo.co.jp/articles/6a8330b5a96c6b47b8369d4316ddfd7c805d08c4,5/3(金) 11:46
2024-05-03,17:22,TTL,総合,2,テレビ朝日系（ANN）,富士山“目隠し”騒動　別のコンビニに外国人観光客集結…撮影スポット化で車の妨げに,355,https://news.yahoo.co.jp/articles/4827b8fde6825a78965f2956770f3b2c2e8cc6c4,5/3(金) 14:12
2024-05-03,17:22,TTL,総合,3,読売新聞オンライン,「落選狙い」人気保育所だけ申し込み、育休給付延長目的の申請続出…厚労省が審査厳格化へ,292,https://news.yahoo.co.jp/articles/4b6560dc857ab98328822cfeab8118fc1d3d3fc9,5/3(金) 11:46
2024-05-03,17:22,TTL,総合,4,TBS NEWS DIG Powered by JNN,【広島】今季5度目の完封負けで借金2...7安打 小園が3安打 2度先頭打者で出塁も 8回1死二・三塁でも得点できず アドゥワ6回2失点,152,https://news.yahoo.co.jp/articles/89a1ca22f30c2bd4db778be2a980adf009aa427a,5/3(金) 16:46
2024-05-03,17:22,TTL,総合,5,共同通信,マシュマロ喉に詰まり重体　沖縄・石垣の学童クラブ,146,https://news.yahoo.co.jp/articles/ba8e4ce62f7f5f3b3dfdf8155bc056c516373d4c,5/2(木) 20:35
2024-05-03,17:22,TTL,総合,6,読売テレビ,【GWのナゼ】みどりの窓口に長蛇の列！続々廃止の背景にコロナ&人手不足…外国人観光客急増で大混雑　ＳＮＳ上で「1時間並んだ」「ＧＷ恐るべし」,133,https://news.yahoo.co.jp/articles/324aa40e7ff4a42a97ead9d34b87153f61953e1d,5/3(金) 8:00
2024-05-03,17:22,TTL,総合,7,TBS NEWS DIG Powered by JNN,「日本は外国人嫌い」バイデン大統領発言に米政府高官が釈明 「言いたかったのは“アメリカは移民の国だ”ということ」,130,https://news.yahoo.co.jp/articles/438e54e5e7db0eff5295766bae9507a3fae3c6f3,5/3(金) 4:04
2024-05-03,17:22,TTL,総合,8,ファイナンシャルフィールド,友人と熱海に行くため車を出しました。ガソリン代を「半分払うよ」と言われましたが、普通「全額」出しますよね？ 車を出したのはこちらなので、正直モヤモヤします…,128,https://news.yahoo.co.jp/articles/79ed940ddb6f9eba5f369085bb0302f5c2473145,5/3(金) 13:40
2024-05-03,17:22,TTL,総合,9,AERA dot.,「勤め先や親に言うぞ」悪質ロードサービス激増　パンク修理22万円、レッカー移動15万円「レスキュー商法」の闇,125,https://news.yahoo.co.jp/articles/e834b9c953510e780ce6b6ee89f6e36c003bff65,5/3(金) 10:06
2024-05-03,17:22,TTL,総合,10,スポーツ報知,【広島】アドゥワ誠、今季最長６回２失点の粘投も３勝目ならず…序盤の失点で主導権を渡す,124,https://news.yahoo.co.jp/articles/a2191caf96285580992c504fe5310fc6ddb71f7a,5/3(金) 16:06
2024-05-03,17:22,TTL,総合,11,デイリースポーツ,大谷翔平が真美子夫人の手を取ってエスコート　仲睦まじくコンサート会場入り　左手薬指に指輪がキラリ,124,https://news.yahoo.co.jp/articles/9b8adc2ec960de2900cb0b982e9ed896651e85ba,5/3(金) 12:43
2024-05-03,17:22,TTL,総合,12,テレビ朝日系（ANN）,熱海、人気復活…地価13％↑「一気に若い人に切り替わった」　バブル期リゾマンも人気,123,https://news.yahoo.co.jp/articles/64b877c2d288b779af8ab6f25f775fac89f05f82,5/3(金) 13:42
2024-05-03,17:22,TTL,総合,13,現代ビジネス,小室圭さん「金銭トラブル」の1年後から…宮内庁が「潰瘍性大腸炎の薬」を年間1500万円も購入している「衝撃すぎる理由」,120,https://news.yahoo.co.jp/articles/1a0f09f9a04ca8f02088860f0eb765c128400ad7,5/3(金) 7:33
2024-05-03,17:22,TTL,総合,14,日テレNEWS NNN,GW後半　新幹線や空の便は下りのピーク　高速道路は渋滞続く,118,https://news.yahoo.co.jp/articles/cf7f73900fcded02ba431c9732530d4bb49e35d2,5/3(金) 11:54
2024-05-03,17:22,TTL,総合,15,読売新聞オンライン,北陸新幹線延伸、特急料金不要の「新快速」に注目…敦賀駅で乗り継ぎ「安い方がいい」「急がなければ気にならない」,115,https://news.yahoo.co.jp/articles/18ea38fd3a4a26bf76990f18d3f150e4072a084a,5/3(金) 16:00
2024-05-03,17:22,TTL,総合,16,Full-Count,大谷翔平、真美子夫人と球団イベント参加　左手薬指に指輪…夫婦そろって“黒コーデ”,112,https://news.yahoo.co.jp/articles/4896b9ab5a79b99d6c6d949e775267d290c2d8ae,5/3(金) 9:33
2024-05-03,17:22,TTL,総合,17,朝日新聞デジタル,34年ぶり1ドル160円再来　バブル最盛期は円安が歓迎された,112,https://news.yahoo.co.jp/articles/f674b329b25c44a9fdaf94d043dbde61efa805d8,5/3(金) 8:00
2024-05-03,17:22,TTL,総合,18,カナロコ by 神奈川新聞,「痴漢です」なぜ声上げづらい？　助け得られず事情聴取で疲弊、被害女性の複雑な心境,111,https://news.yahoo.co.jp/articles/bfc45b3f0a5738339f1f92a73123ced79051dc9f,5/3(金) 5:40
2024-05-03,17:22,TTL,総合,19,デイリー新潮,「稽古は週に3日で、相撲部屋の体を成していない」「弟子の悪質アルハラも」　二所ノ関部屋で何が起きているのか,107,https://news.yahoo.co.jp/articles/d5f15ae905f71daf121463adbb22ccdd1490f8c8,5/3(金) 11:07
2024-05-03,17:22,TTL,総合,20,中日スポーツ,中日・メヒアは4イニングを5安打3失点で降板、3回にヤクルト・村上から本塁打を浴びる,102,https://news.yahoo.co.jp/articles/520538d21c23933660e0f9882237315ba5cb9c5c,5/3(金) 15:45
2024-05-03,17:22,TTL,総合,21,関西テレビ,【速報】世界初「歯が生える薬」の治験開始「虫歯」で「永久歯」失っても安心の未来訪れる可能性,100,https://news.yahoo.co.jp/articles/b6f7eb9bc88b7cebbee9538c441e8444c004845c,5/3(金) 2:00
2024-05-03,17:22,TTL,総合,22,中日スポーツ,えっいまさら？杉田水脈議員『コスプレおばさん』と「そもそも投稿していませんし…」と主張、ネットは「なんで嘘つく？」と総ツッコミ,98,https://news.yahoo.co.jp/articles/f0555c505f6c4ed84c8ed6f26af959cf5f2fc85a,5/3(金) 16:49
2024-05-03,17:22,TTL,総合,23,デイリースポーツ,打てない広島　早くも５度目の完封負け　引き分け試合含めて２６戦中８戦が無得点の貧打ぶり,98,https://news.yahoo.co.jp/articles/c50300c72b9747b104a414964790a364b168ded9,5/3(金) 16:48
2024-05-03,17:22,TTL,総合,24,スポニチアネックス,TBSの皆川玲奈アナが妊娠発表　産休へ「覚悟を持って挑みたい」これまで結婚発表なし,93,https://news.yahoo.co.jp/articles/f63eb7138dc56eedb504c32e661a0fa8aa9f86d4,5/3(金) 14:01
2024-05-03,17:22,TTL,総合,25,弁護士ドットコムニュース,新幹線の迷惑な「酔っ払い客」たち…隣席の女性に絡み、注意されれば「アホか」と暴言　「禁酒車両がほしい」の声も,90,https://news.yahoo.co.jp/articles/d03dd492ea58223cf329e230f65cbf28d20ee32c,5/3(金) 8:55
2024-05-03,17:22,TTL,総合,26,まいどなニュース,枯れたミントを畑に捨てたら…3年後に「地獄絵図」、 繁殖力に地主も後悔「土の総入れ替えしかない」,88,https://news.yahoo.co.jp/articles/33a5f4fb83b7b49db62320f5bffa820da2de363d,5/3(金) 7:10
2024-05-03,17:22,TTL,総合,27,関西テレビ,【速報】24トンの「大型トラック」にはねられ「歩行者」が死亡  身元わからず警察が特定急ぐ,81,https://news.yahoo.co.jp/articles/23b89c4ce7bbc8ef39f6efdd40740303de728afd,5/3(金) 16:09
2024-05-03,17:22,TTL,総合,28,くるまのニュース,国民ブチギレ!? なぜ「13年」で”自動車税”高くなるのか 軽自動車は20%加算も!? 「やってらんない税」「税金安くしろよ」の声上がる 理不尽な重課措置の仕組みとは,78,https://news.yahoo.co.jp/articles/ccb1281fceb53cafbb6de472963cbcbfc07ecccc,5/3(金) 12:00
2024-05-03,17:22,TTL,総合,29,Yahoo!ニュース オリジナル 特集,高校時代から意識した大衆性、かつ深化もさせたい――大森元貴の突発性難聴を越えて進むMrs. GREEN APPLEの理想像 #なぜ話題,78,https://news.yahoo.co.jp/articles/0c77f9ae1581ae08feac410027905049deeeebd2,5/3(金) 15:00
2024-05-03,17:22,TTL,総合,30,中日スポーツ,「頂き女子りりちゃん」、獄中日記を更新「理不尽人生全部飲みこんで、私絶対幸せなっちゃうから」「判決聞いたあの日からずっと放心状態」,77,https://news.yahoo.co.jp/articles/87355e26b610a7c5d5616bebef90bda7179a52ff,5/3(金) 16:38
2024-05-03,17:22,TTL,総合,31,共同通信,円上昇、一時152円台　3週間ぶり高値、介入警戒,76,https://news.yahoo.co.jp/articles/d6362be777ff27b4eeaef38a88080d6f789ff7d5,5/3(金) 11:35
2024-05-03,17:22,TTL,総合,32,FORZA STYLE,「あんたら、何やってんだ！」長蛇の列もお構いなしの高齢グループに怒鳴る客。減り続けるみどりの窓口で今、リアルに起こっていること,75,https://news.yahoo.co.jp/articles/8ba148b8f9bb3ee18706faa42bb01ec1d57f295d,5/3(金) 10:46
2024-05-03,17:22,TTL,総合,33,ベースボールキング,オリックス、今季初4連敗で借金3…直近6戦で4度目の零敗、東は援護なく2敗目,74,https://news.yahoo.co.jp/articles/0deb417658215b4b32d0978b94e2dcfb05acff6b,5/3(金) 16:05
2024-05-03,17:22,TTL,総合,34,TBS NEWS DIG Powered by JNN,各地で憲法集会　憲法改正めぐり岸田総理「選択肢を示すことは政治の責任」,73,https://news.yahoo.co.jp/articles/8b23baefba64f00769be6bcf73272aea32f0476a,5/3(金) 15:06
2024-05-03,17:22,TTL,総合,35,読売新聞オンライン,円相場乱高下、財務省は介入に「ノーコメント」貫く…投機筋との攻防は長期化の可能性も,73,https://news.yahoo.co.jp/articles/43c2143751a304ab69aa9137cb61eba49088b82c,5/3(金) 8:34
2024-05-03,17:22,TTL,総合,36,ＡＦＰ＝時事,レールゆがむ猛暑、ドラえもんで雨乞い タイ,68,https://news.yahoo.co.jp/articles/e85e67e6643705ec45384dfa9273b59764e0896e,5/3(金) 11:13
2024-05-03,17:22,TTL,総合,37,TBS NEWS DIG Powered by JNN,「女が働き、男は遊んで暮らす?」中国にある「女性の国」に行ってみた,67,https://news.yahoo.co.jp/articles/ee521f50f3397e43ac51d6d309742c9e1c131d22,5/3(金) 7:02
2024-05-03,17:22,TTL,総合,38,TBS NEWS DIG Powered by JNN,「ディズニーが3万円超」歴史的円安の中、GWをアメリカで過ごした人から驚きの声　円が再び乱高下“不意打ち”3兆円規模市場介入か　秋以降に値上げラッシュ?【news23】,67,https://news.yahoo.co.jp/articles/b8c1d82bddf050fb79c0ec26eed69264d7b549c0,5/3(金) 13:44
2024-05-03,17:22,TTL,総合,39,メ〜テレ（名古屋テレビ）,車が炎上し3人が死傷　うち2人は小さな子ども　愛知県半田市,66,https://news.yahoo.co.jp/articles/77212fd53ef5cb4a524debdcb4810cd05df74a0c,5/3(金) 6:02
2024-05-03,17:22,TTL,総合,40,集英社オンライン,〈ユーチューバー炎上〉“浴槽いっぱいに牛丼”動画は何がオモシロイのか？「食べ物粗末にするな」の批判多数も、擁護派からは「YouTubeくらいはコンプラを気にしないでほしい」の声も。街の100人の“生”の声は？,65,https://news.yahoo.co.jp/articles/0e6a8cb84a7db47220fc69ea9c694a52e885cb01,5/3(金) 16:01
