scrp_date,scrp_time,genre_en,genre_jp,rank,media_jp,title,comment,link,date_original
2024-05-03,04:14,TTL,総合,1,Bloomberg,日本は「排外主義的」と米大統領が批判－移民受け入れに消極的と指摘,463,https://news.yahoo.co.jp/articles/e69d131f08103c6bb220d77f31622232d7525c50,5/2(木) 11:19
2024-05-03,04:14,TTL,総合,2,ABEMA TIMES,新卒で入った会社を1日で辞めた男性を直撃「配属ガチャに不信感」「自分の希望は全く考慮されていない」 “退職代行サービス”の利用も急増,339,https://news.yahoo.co.jp/articles/890273b7baddbead2ae5b655e448ba307625bb64,5/2(木) 7:22
2024-05-03,04:14,TTL,総合,3,共同通信,マシュマロ喉に詰まり重体　沖縄・石垣の学童クラブ,338,https://news.yahoo.co.jp/articles/ba8e4ce62f7f5f3b3dfdf8155bc056c516373d4c,5/2(木) 20:35
2024-05-03,04:14,TTL,総合,4,AERA dot.,「駅で名刺配り200枚」「飲み会不参加なら死刑」…1カ月で会社を辞めた新社会人の“現場”で起きたこと,201,https://news.yahoo.co.jp/articles/23f307cffda60850da32837cb9ab000cb1721164,5/2(木) 7:31
2024-05-03,04:14,TTL,総合,5,TBS NEWS DIG Powered by JNN,萩生田前政調会長・世耕元経産大臣を不起訴　東京地検特捜部　自民党「裏金」事件めぐり刑事告発,137,https://news.yahoo.co.jp/articles/9179d7ee8d456a906f2613198afc57911e95b0fc,5/2(木) 16:27
2024-05-03,04:14,TTL,総合,6,SmartFLASH,「今度はなんて言い訳する」太陽光発電がハッキングされて不正送金…再エネ年1万円負担増であふれる河野太郎氏への憤慨,132,https://news.yahoo.co.jp/articles/0b461d05200418cb5ef5dda0b2539358b46d8960,5/2(木) 16:36
2024-05-03,04:14,TTL,総合,7,TBS NEWS DIG Powered by JNN,政府・日銀　追加で3兆円規模の「覆面介入」か,132,https://news.yahoo.co.jp/articles/a4994fd5b00ab948638cdbf531dda260859a136a,5/2(木) 18:13
2024-05-03,04:14,TTL,総合,8,東洋経済オンライン,「日本は貧乏な人が行く国」訪日観光客の素直な見方、「安くてコスパがいい」日本が陥っているワナ,131,https://news.yahoo.co.jp/articles/67c7d58e3dde0e023b81818cf8f4cd6e76c448de,5/2(木) 10:32
2024-05-03,04:14,TTL,総合,9,ABEMA TIMES,藤井聡太叡王が“八冠”陥落のピンチ 初のシリーズ連敗、同学年の伊藤匠七段に敗れ1勝2敗に／将棋・叡王戦五番勝負第3局,101,https://news.yahoo.co.jp/articles/424526c3023652cc067efdb2b5a0d72e8b6ff491,5/2(木) 18:44
2024-05-03,04:14,TTL,総合,10,共同通信,改憲論議急ぐ必要ない65％　共同通信憲法世論調査,96,https://news.yahoo.co.jp/articles/992fbe98c936ac4210d62a3fd8c6a19f58ef7ee4,5/2(木) 6:03
2024-05-03,04:14,TTL,総合,11,ABEMA TIMES,GWの中3日、学校も休みにすべき？ 連休制度導入の市に「悲鳴」と「賞賛」,86,https://news.yahoo.co.jp/articles/5fce31c07c2e3b5ad7ab73997bf8081cb3c16418,5/2(木) 8:01
2024-05-03,04:14,TTL,総合,12,BSS山陰放送,「ふざけてるな　マジでなんなん?」人気の「サンライズ出雲」切符、フリマサイトで高額転売　乗り鉄怒り　JR西日本「やめていただきたい」,83,https://news.yahoo.co.jp/articles/ce8e5a1c5d09379b4bcaf0012f3b254f64c41f4c,5/2(木) 6:48
2024-05-03,04:14,TTL,総合,13,関西テレビ,【カメムシ大量発生】31倍増の「異常襲来」で注意報発表 夏にさらなる増加の予想「桃」などに被害,83,https://news.yahoo.co.jp/articles/7990b1b96d653bfc136dbeb75b96787696139441,5/2(木) 15:49
2024-05-03,04:14,TTL,総合,14,ENCOUNT,観光して駐車場に戻ったら…「自分の車がとんでもないことに」　ネット衝撃「ビタづけすぎやろ」,82,https://news.yahoo.co.jp/articles/f4e2e6c432a121aa1d33c6db3cf4c325674de1d2,5/2(木) 9:10
2024-05-03,04:14,TTL,総合,15,スポニチアネックス,これで71歳！？小柳ルミ子　衝撃“すっぴん”姿に称賛の声「なんて奇麗な肌なんでしょう」,81,https://news.yahoo.co.jp/articles/89f2a81ca06c4269e676fb6346a15fc66d2206b2,5/2(木) 16:41
2024-05-03,04:14,TTL,総合,16,読売新聞オンライン,ＮＹ円が急騰し一時１ドル＝１５３円台、１時間足らずで約４円の円高に…為替介入の可能性も,77,https://news.yahoo.co.jp/articles/3b114b04bd07ad317c8c7fa52886a60eba30bffb,5/2(木) 6:00
2024-05-03,04:14,TTL,総合,17,現代ビジネス,ネーミングライツは応募ゼロ、利用日数激減で「すぐ破産する？」…「札幌ドーム」批判の「誤解」を解く,75,https://news.yahoo.co.jp/articles/a18e265835212c215e0763b253eebe78dc0da2c4,5/2(木) 7:04
2024-05-03,04:14,TTL,総合,18,読売新聞オンライン,トラブル相次ぐ看護学生の「お礼奉公」、系列病院が不採用なら奨学金返還義務？…訴訟に発展,74,https://news.yahoo.co.jp/articles/892aa59bce49fb14d871cf9984c1089bcc654a86,5/2(木) 13:54
2024-05-03,04:14,TTL,総合,19,西スポWEB OTTO！,「事実確認とはいえ見なきゃ良かった」ソフトバンク選手も激怒、ユニフォーム捨てる〝愚行〟YouTuberに批判の声「こんなこと言わすなよ」「どんな神経で」,74,https://news.yahoo.co.jp/articles/87862584d075ccb27792ba8681412bd4222a34ec,5/2(木) 22:50
2024-05-03,04:14,TTL,総合,20,西スポWEB OTTO！,「全ての球場を出禁にしろ」ソフトバンク始球式登場YouTuberが贈られたユニフォーム捨てるドッキリ公開で波紋「何が面白いの?」「非常に不快です」,74,https://news.yahoo.co.jp/articles/824670030dc50c086a1bc22a72bfdd0c9bec9e05,5/2(木) 13:07
2024-05-03,04:14,TTL,総合,21,くるまのニュース,コンビニは「前向き駐車」すべき？ なぜ「バック駐車」は推奨されない？ “納得の理由”と守らなかった際の「悪影響」とは,68,https://news.yahoo.co.jp/articles/bcfe05765c45ef57688db40d839eac04a986b873,5/2(木) 17:10
2024-05-03,04:14,TTL,総合,22,産経新聞,政府・日銀が為替介入の戦略転換か　余力十分も無駄には出来ず…大型連休も投機筋と神経戦,65,https://news.yahoo.co.jp/articles/ec65ec9f814a40c71eb8c79e6eeec9cffe22bb44,5/2(木) 19:36
2024-05-03,04:14,TTL,総合,23,プレジデントオンライン,なぜ自民も、維新も、小池氏も勝てなかったのか…衆院3補選が示す「自民にすり寄る野党勢力」の終わり,64,https://news.yahoo.co.jp/articles/5ea01000954dd48d148cd800c1c0b4713407f43a,5/2(木) 17:46
2024-05-03,04:14,TTL,総合,24,日刊スポーツ,カブス今永昇太がデビューから無傷の５勝目　７回３安打無失点７Ｋ快投　防御率トップの0・78,64,https://news.yahoo.co.jp/articles/3823310afbc3a9a81153936148de71139811970a,5/2(木) 10:48
2024-05-03,04:14,TTL,総合,25,朝日新聞デジタル,円急騰153円台、市場に驚き　FOMC「無難に通過後」為替介入か,63,https://news.yahoo.co.jp/articles/1345c86db7cbc2e04d2884a05689beff6b4976f7,5/2(木) 11:38
2024-05-03,04:14,TTL,総合,26,産経新聞,米「露軍が化学兵器使用」断定、ウクライナ侵略で　軍需産業など２８０団体・個人に制裁,63,https://news.yahoo.co.jp/articles/79f001a4004e1d63ddecf4c5b7bdf80804064607,5/2(木) 8:03
2024-05-03,04:14,TTL,総合,27,毎日新聞,1ドル157円台半ば→一時153円台に急騰　NY市場,60,https://news.yahoo.co.jp/articles/0bf8a3409e1eb9bd30c0234fd238090fd41f15a5,5/2(木) 5:55
2024-05-03,04:14,TTL,総合,28,Full-Count,大谷翔平、今季初のスタメン外　開幕から連続先発は32でストップ…山本由伸が先発登板,59,https://news.yahoo.co.jp/articles/1b5bffcac89b3f05c0e8b3159112664e16dfa65e,5/2(木) 6:41
2024-05-03,04:14,TTL,総合,29,毎日新聞,岸田首相、生成AIの国際的枠組みの設立表明　安全な活用を主導,58,https://news.yahoo.co.jp/articles/bafa9f23f962122008721bad77102783c1ea7630,5/2(木) 18:14
2024-05-03,04:14,TTL,総合,30,現代ビジネス,二階俊博の「長男」と「三男」が「まさかの後継争い」開始...そして地元が恐れる「ヤバすぎる悪魔合体」,57,https://news.yahoo.co.jp/articles/8977b57fdc863d4e57828bc3b4bf43f970a07439,5/2(木) 7:33
2024-05-03,04:14,TTL,総合,31,まいどなニュース,選手本人から苦言も…ユーチューバーが始球式ユニフォームを川に捨て批判殺到「失礼すぎる」「ファンとして悲しい」,57,https://news.yahoo.co.jp/articles/4fefd3313bb84eeaa483c18125a5445c0c806f81,5/2(木) 18:29
2024-05-03,04:14,TTL,総合,32,スポニチアネックス,「漫画村」星野ロミ氏、賠償金17億円を支払う？誹謗中傷の裁判で「50億以上の収入になる」と驚きの試算,54,https://news.yahoo.co.jp/articles/08a9904dc967ad1ff8a9bede7d8ff2cf81791255,5/2(木) 21:37
2024-05-03,04:14,TTL,総合,33,朝日新聞デジタル,ピアニストのフジコ・ヘミングさん死去　「ラ・カンパネラ」で旋風,53,https://news.yahoo.co.jp/articles/302b97190728ba63c14af1b838d2e5b66647266c,5/2(木) 7:00
2024-05-03,04:14,TTL,総合,34,毎日新聞,日仏首脳会談、円滑化協定交渉入りへ　海洋秩序の維持・強化図る,52,https://news.yahoo.co.jp/articles/139f36d7d5fec9c9ff26e244735f8926ccf43e0c,5/2(木) 22:43
2024-05-03,04:14,TTL,総合,35,日刊ゲンダイDIGITAL,悠仁さま「オックスフォード大進学説」を検証…皇族がいきなり海外の大学に入学した例はゼロだが…,51,https://news.yahoo.co.jp/articles/874d48bb55ce0c6c41e9d445ecfd5c5390fca989,5/2(木) 9:06
2024-05-03,04:14,TTL,総合,36,SmartFLASH,「野球をバカにされている」「絶対に移転するべき」築地市場跡地の再開発めぐり、プロ野球ファンから寄せられた賛否,50,https://news.yahoo.co.jp/articles/d3477d08f0ecc87ee44c4b52773ae875ba74ec84,5/2(木) 16:05
2024-05-03,04:14,TTL,総合,37,AERA dot.,巨人、築地新球場の使用は一時的？　“最高の立地”誇る東京Dの場所「手放せない」と指摘も,50,https://news.yahoo.co.jp/articles/cf851631b41f5c992d7062a17bacead963bf05c3,5/2(木) 18:01
2024-05-03,04:14,TTL,総合,38,RKB毎日放送,介護職員と看護師5人が入院患者に「性的虐待」・・・陰部を直接もむ・わいせつな声かけも　国立大牟田病院が会見で謝罪,49,https://news.yahoo.co.jp/articles/ea3647f01f504311de3ad731d68ff01a15bd63f4,5/2(木) 16:33
2024-05-03,04:14,TTL,総合,39,スポニチアネックス,昭和の名優の二世俳優、若山耀人容疑者の逮捕に衝撃…多くの子役見てきたが「ここまでの転落人生は稀」,48,https://news.yahoo.co.jp/articles/f5e02c0518ace6dff069f864cb6f28476fe830c5,5/2(木) 16:05
2024-05-03,04:14,TTL,総合,40,TBS NEWS DIG Powered by JNN,外国人向け「二重価格」はアリ? 円安でインバウンド増加　一杯5500円ラーメンに観光客「とても安い」 日本人は1100円割安の海鮮バイキング店も【news23】,47,https://news.yahoo.co.jp/articles/9316eebfd2967891e69384e4b19df82fcdb6e444,5/2(木) 12:12
