scrp_date,scrp_time,genre_en,genre_jp,rank,media_jp,title,comment,link,date_original
2025-02-28,07:07,world,国際,1,Wedge（ウェッジ）,停戦交渉で虚無感広がるウクライナ国民、米国の支援ないと戦えない…トランプ・プーチン交渉で〝居場所〟失うゼレンスキー,58,https://news.yahoo.co.jp/articles/4ab4cacd89d2c69d5069057ba5f7964c1e1872b3,2/28(金) 5:02
2025-02-28,07:07,world,国際,2,毎日新聞,トランプ氏、しらを切る　ゼレンスキー氏への「独裁者」発言,52,https://news.yahoo.co.jp/articles/11290ce601717dece63c888e70d4c467e006436c,2/28(金) 5:53
2025-02-28,07:07,world,国際,3,TBS NEWS DIG Powered by JNN,トランプ氏　ゼレンスキー大統領への“独裁者”批判めぐり「そんなこと言ったかな？そんな発言をしたとは信じられない」,43,https://news.yahoo.co.jp/articles/d24f351092d48c7e7c711e5acc03340b49c78c7f,2/28(金) 5:24
2025-02-28,07:07,world,国際,4,FNNプライムオンライン（フジテレビ系）,「そんな事言ったか?」トランプ大統領が「独裁者」呼ばわり　ゼレンスキー大統領への態度軟化…ウクライナとの合意「防御策になる」,34,https://news.yahoo.co.jp/articles/c151c80aacabb39c3125a7db7b1feea4d2eab157,2/28(金) 6:13
2025-02-28,07:07,world,国際,5,ＡＦＰ＝時事,北朝鮮、ロシアに追加派兵 韓国情報機関,34,https://news.yahoo.co.jp/articles/aab87b506dab345b574dddb83b676ef5665e6055,2/27(木) 16:40
2025-02-28,07:07,world,国際,6,ニューズウィーク日本版,日本の大学「中国人急増」の、日本人が知らない深刻な問題,29,https://news.yahoo.co.jp/articles/3af7a4fc005ae4f4d2b1acdc545ab3ae8304786e,2/27(木) 18:03
2025-02-28,07:07,world,国際,7,共同通信,BTSにキス疑い、出頭を要請　韓国警察、日本人の50代の女に,25,https://news.yahoo.co.jp/articles/54cf7edc6880688f733a630bda6efca54589f0fb,2/27(木) 23:44
2025-02-28,07:07,world,国際,8,中央日報日本語版,血を吐いてから４８時間後に死亡…コウモリを食べて１カ月で５３人が死亡＝コンゴ,22,https://news.yahoo.co.jp/articles/0a3eecc2972de36bac8033e1a5cf2756ed3728ef,2/27(木) 9:09
2025-02-28,07:07,world,国際,9,共同通信,北朝鮮が仮想通貨窃取　2000億円超、核開発原資か,19,https://news.yahoo.co.jp/articles/6070f559d6e8b0e0f47d72923c64422acb758ecc,2/27(木) 11:12
2025-02-28,07:07,world,国際,10,デイリー新潮,バンコクのスーパーでは「チョコモナカジャンボが500円超」…「円安バーツ高」で一変した「タイ旅行」の実態,17,https://news.yahoo.co.jp/articles/1a965eebf525eaec816c7151acad81900967d3ae,2/28(金) 6:11
2025-02-28,07:07,world,国際,11,産経新聞,「ドイツは移民を吸収する能力が限界に達している」「政策是正しなければ」駐日大使初会見,17,https://news.yahoo.co.jp/articles/1fdf127aa9f12ed1a56b5038c2f11046b44fd809,2/27(木) 7:00
2025-02-28,07:07,world,国際,12,時事通信,米大統領、中国に追加関税10％上乗せへ　3月4日、カナダとメキシコは25％,17,https://news.yahoo.co.jp/articles/1b9b2df099764b8714bb036fef6fe9fa767760eb,2/27(木) 23:11
2025-02-28,07:07,world,国際,13,BBC News,「アメリカに利益もたらす」鉱物資源協定、ウクライナの将来の安全保証せず,17,https://news.yahoo.co.jp/articles/e948e8b5168f1d3ece1bfc29d6a57e5eddde526b,2/27(木) 16:52
2025-02-28,07:07,world,国際,14,テレビ朝日系（ANN）,ロシア「愛国者」にプーチン大統領への不満広がる　トランプ大統領にすり寄ったと批判,16,https://news.yahoo.co.jp/articles/b51c1be17b8383e35fdf58e1f4fd559391bfc217,2/27(木) 22:47
2025-02-28,07:07,world,国際,15,現代ビジネス,ロシアの肩を持ち、ウクライナを猛批判…！ゼレンスキーを独裁者呼ばわりし、ウソをつきまくるトランプの「意図」,16,https://news.yahoo.co.jp/articles/f1e5a232528a066906645229e16c8357f83e0c01,2/27(木) 7:01
2025-02-28,07:07,world,国際,16,時事通信,ジーン・ハックマンさん、自宅で死亡　「フレンチ・コネクション」、95歳,16,https://news.yahoo.co.jp/articles/ca45b29dda5387ca9e790f9b81258beca9cdd695,2/27(木) 18:07
2025-02-28,07:07,world,国際,17,時事通信,ポーランド外相、トランプ米政権を批判　「ロシアに生命線与える」,15,https://news.yahoo.co.jp/articles/fc359c7f3f0b366b2e06f1ff992e6c5e34c1a3f8,2/27(木) 19:10
2025-02-28,07:07,world,国際,18,中央日報日本語版,トランプ大統領「ＥＵは米国をねじ伏せるため結成された」…初の閣議で露骨に非難,13,https://news.yahoo.co.jp/articles/0f44dd11f56a95b8c7784cba474f194bef2994e0,2/27(木) 14:17
2025-02-28,07:07,world,国際,19,KOREA WAVE,「点滴や注射の針、洗って再利用」…韓国・病院職員の内部告発に衝撃,13,https://news.yahoo.co.jp/articles/2cd195bd7f635933e2399e9863e588e944d1aff5,2/28(金) 5:03
2025-02-28,07:07,world,国際,20,JBpress,日本人は感情的な報道に惑わされるな！トランプがウクライナも欧州も見捨てないと米専門家が考えるこれだけの証拠,13,https://news.yahoo.co.jp/articles/c789f1b45ccb5f5724aa849991dcb0694a7fd119,2/27(木) 11:26
2025-02-28,07:07,world,国際,21,ハフポスト日本版,インドでバスを待っていた26歳の女性がレイプされる。警察が容疑者の行方を捜査,13,https://news.yahoo.co.jp/articles/b030862c2c1439fd09c4746259acf20990857e65,2/27(木) 19:31
2025-02-28,07:07,world,国際,22,TBS NEWS DIG Powered by JNN,トランプ大統領　ロシア掌握のウクライナ領土返還を交渉する考え示す,12,https://news.yahoo.co.jp/articles/554d2cf787a1ff17e5458561fed9761d016ad88a,2/28(金) 6:01
2025-02-28,07:07,world,国際,23,産経新聞,「ロシアのオリガルヒはとてもいい人」トランプ氏、7億円の米永住権ゴールドカード販売も,12,https://news.yahoo.co.jp/articles/ce5c0d2045d032cb4a2dfc033a2ffa63706abc56,2/27(木) 16:28
2025-02-28,07:07,world,国際,24,TBS NEWS DIG Powered by JNN,中国への追加関税を20％に引き上げへ　トランプ大統領が表明“合成麻薬の流入止まるまで関税をかけ続ける”,12,https://news.yahoo.co.jp/articles/4eec9d6a3a80f8119f679cd8a9620bb08d194b02,2/28(金) 5:45
2025-02-28,07:07,world,国際,25,読売新聞オンライン,ウクライナに平和維持部隊、ロシア外相「紛争をあおり立てる」…「プーチン氏が賛同」としたトランプ氏主張を打ち消し,12,https://news.yahoo.co.jp/articles/e3f8375c206df7ed84927142b54f855354478792,2/27(木) 20:43
2025-02-28,07:07,world,国際,26,テレビ朝日系（ANN）,トランプ大統領　ウクライナの安全保障は「ヨーロッパにやってもらう」,11,https://news.yahoo.co.jp/articles/34fc65778d9ae48d9c387e83a27d313e8e7c5792,2/27(木) 7:15
2025-02-28,07:07,world,国際,27,テレビ朝日系（ANN）,盗難カードで購入の宝くじ8000万円当選　被害者は窃盗犯に折半希望と連絡呼びかけ,11,https://news.yahoo.co.jp/articles/373de2b552a32c0f82299be480ab3005932bb4e1,2/28(金) 2:44
2025-02-28,07:07,world,国際,28,ロイター,プーチン氏、米ロ関係改善に対する欧州の妨害警告,11,https://news.yahoo.co.jp/articles/877c532213cdd7c47238f77e106434712966a6a1,2/28(金) 3:43
2025-02-28,07:07,world,国際,29,FNNプライムオンライン（フジテレビ系）,“元徴用工”遺族が韓国政府の解決策受け入れ「財団」より賠償金受け取る　三菱重工業への直接賠償訴訟も取り下げか,11,https://news.yahoo.co.jp/articles/75a21c4cf55e441f71b892bc4658f789f243e895,2/27(木) 18:25
2025-02-28,07:07,world,国際,30,毎日新聞,BTSのジンさんに無理やりキス　50代日本人女性に出頭要請,10,https://news.yahoo.co.jp/articles/18aff627fbe85f095ee1a4424b205b342edc6ee9,2/28(金) 6:47
2025-02-28,07:07,world,国際,31,ニューズウィーク日本版,ウクライナ和平交渉で「無視」され、ロシアの脅威に怯え始めた欧州…軽武装・経済優先の重いツケ,10,https://news.yahoo.co.jp/articles/eb189eb4ba3c481a9ea157b3445d716b8610f406,2/27(木) 19:40
2025-02-28,07:07,world,国際,32,CNN.co.jp,トランプ氏、関税政策めぐる米紙社説の正しい指摘にかみつく,10,https://news.yahoo.co.jp/articles/c2de98486752db3da66abca523fcb12cafb44508,2/27(木) 12:50
2025-02-28,07:07,world,国際,33,中央社フォーカス台湾,日本戸籍に「台湾」表記可能へ  日本の超党派議連「人権に関わる」,10,https://news.yahoo.co.jp/articles/d2b126e6cef973fc89c6104929c80b91727db52f,2/27(木) 14:51
2025-02-28,07:07,world,国際,34,ニューズウィーク日本版,プーチンの最終目標が見えた----トランプが非難する『選挙を経ていない独裁者』、ゼレンスキーの孤立,10,https://news.yahoo.co.jp/articles/39c0680be6b5bb044aa9689e5c6120c24cc0fef3,2/27(木) 18:38
2025-02-28,07:07,world,国際,35,ロイター,ＥＵ「不当な障壁に断固対応」、トランプ氏の25％関税賦課意向に,10,https://news.yahoo.co.jp/articles/032fbad1c7ccb00f57ea3c073433af44018a9435,2/27(木) 7:52
2025-02-28,07:07,world,国際,36,TBS NEWS DIG Powered by JNN,“ウクライナの安全保障 ヨーロッパにやってもらう”トランプ氏　侵攻終結に向けた交渉「ロシア側も譲歩しなくてはならない」,10,https://news.yahoo.co.jp/articles/d35ba314cb36880b29446e2d4dfbd0b591ffcad2,2/27(木) 23:57
2025-02-28,07:07,world,国際,37,時事通信,トランプ氏「独裁者と呼んだか」　ゼレンスキー氏と会談控え,9,https://news.yahoo.co.jp/articles/18934c7e284a4968e5e288b0a43799122036d570,2/28(金) 5:30
2025-02-28,07:07,world,国際,38,CNN.co.jp,イスラエル情報筋、ガザ・エジプト境界からの撤退を否定,9,https://news.yahoo.co.jp/articles/3a5a766c22cff7282d5ea6d7f2226778916e55cc,2/27(木) 20:30
2025-02-28,07:07,world,国際,39,TBS NEWS DIG Powered by JNN,ポーランド外相会見　ウクライナ平和維持活動への自国軍の派遣に消極的　NATO加盟は「支持したい」,9,https://news.yahoo.co.jp/articles/0d4729c431d47346c8136567e595e7b0de0fad45,2/27(木) 20:45
2025-02-28,07:07,world,国際,40,ＡＦＰ＝時事,EUは米国を「だますため」に設立された トランプ氏,9,https://news.yahoo.co.jp/articles/6bc2759e6af857262469ad81f6002351de936c4d,2/27(木) 8:52
