scrp_date,scrp_time,genre_en,genre_jp,rank,media_jp,title,comment,link,date_original
2024-01-01,13:23,life,ライフ,1,Hint-Pot,「日本は2030年の世界だよ」　ドイツ人夫婦が驚いた日本の便利さ　日本の“当たり前”に感じた近未来の姿とは,96,https://news.yahoo.co.jp/articles/8c2bbe4bc0655fd88071cdb2e4664952ee24ad50,1/1(月) 9:10
2024-01-01,13:23,life,ライフ,2,Hint-Pot,お正月にやってはいけない言い伝え　「元日に掃除をしてはいけない」のはなぜ？,58,https://news.yahoo.co.jp/articles/f36c40d66d24aefe8d6b4b797fa0cb638a473560,1/1(月) 10:28
2024-01-01,13:23,life,ライフ,3,Hint-Pot,おせち料理の「食べ順」　正月太りを回避する理想的な食べ方とは　栄養士が解説,55,https://news.yahoo.co.jp/articles/2e216c3b462e0b51ef279b244387726201e63715,1/1(月) 7:10
2024-01-01,13:23,life,ライフ,4,弁護士ドットコムニュース,親に強制没収されたお年玉、子どもは「お母さん銀行」に権利を主張できるのか？,37,https://news.yahoo.co.jp/articles/e01cd55b9c41f69ecac13df7a6d2bde15c2de356,1/1(月) 8:00
2024-01-01,13:23,life,ライフ,5,まいどなニュース,取り分けたのに「ぐちゃぐちゃやん（笑）」→じゃあ職場のお土産に買ってこないで！ 銘菓を巡る苦悩に共感の声「めちゃくちゃ分かる」,36,https://news.yahoo.co.jp/articles/94a47e8dffeaf819544a7b5d6a5eb36b728bf6b2,1/1(月) 11:30
2024-01-01,13:23,life,ライフ,6,ファイナンシャルフィールド,燃費改善のためにエンジンブレーキの使用を心がけています。なにかデメリットはありますか？,33,https://news.yahoo.co.jp/articles/419cd7da0adda37aa920f3b99656608e603b1e3f,1/1(月) 12:04
2024-01-01,13:23,life,ライフ,7,読売新聞オンライン,臓器移植見送り、東大・京大・東北大で昨年６０件超…提供集中で「対応できる限界超え」,30,https://news.yahoo.co.jp/articles/9ef2f617d993ae5a6b56d8b0be28e8c66ff85a7b,1/1(月) 5:00
2024-01-01,13:23,life,ライフ,8,まいどなニュース,「４cm÷５mm＝８」は間違い？　子どものテストで賛否…これって正解では？【2023年、もやもやが残る先生の採点】,27,https://news.yahoo.co.jp/articles/94f2787d02c480467e6269a97a874516907e3e8a,2023/12/31(日) 18:50
2024-01-01,13:23,life,ライフ,9,まいどなニュース,Z世代の7割「日本社会の未来に希望を感じない」、6割「一生独身でも気にならない」、5割「将来子どもはほしくない」【2023年…若者たちの価値観】,27,https://news.yahoo.co.jp/articles/13425b5e5acc39bc9581c1a5681edb4be1e98fa4,2023/12/31(日) 19:40
2024-01-01,13:23,life,ライフ,10,AERA dot.,餅と白米、太りやすいのはどっち？　栄養士の答えは？　太りにくい餅の食べ方を解説,26,https://news.yahoo.co.jp/articles/653c238a379bf5f5f3b9bb18f2ffe86b5f8ccb38,1/1(月) 8:32
2024-01-01,13:23,life,ライフ,11,弁護士ドットコムニュース,ワンナイト「同窓会不倫」の代償は？ 慰謝料200万円請求された男性「借金を抱えて支払えません」,22,https://news.yahoo.co.jp/articles/2d1fab50f03d6775e8396037ce4d342f2e2eafd1,1/1(月) 7:56
2024-01-01,13:23,life,ライフ,12,kufura,「お年玉」令和の相場はいくら？何歳まであげる？本音はやめたい!? 年齢別のお年玉金額を500人に大調査,19,https://news.yahoo.co.jp/articles/97fa16627cf9b3d90518c80499d31c2662d923ee,2023/12/31(日) 22:10
2024-01-01,13:23,life,ライフ,13,まいどなニュース,なぜ新幹線ひかりが九州に!? JR熊本駅でのまさかの光景が話題に…見られた人はラッキーかも,18,https://news.yahoo.co.jp/articles/6ac1b30ee292c562a26523fb76428ca7b310aca3,1/1(月) 10:40
2024-01-01,13:23,life,ライフ,14,ファイナンシャルフィールド,車のナンバーを好きな数字にしたいのですが、追加料金は発生しますか？人気ナンバーについても教えてください！,18,https://news.yahoo.co.jp/articles/806af187002e452bc89276b45906339ac5c70ca9,1/1(月) 11:40
2024-01-01,13:23,life,ライフ,15,webマガジン mi-mollet,「事務職では成長できない！」後輩の転職にショック... 35歳、楽な仕事の繰り返しから抜け出すべき？,15,https://news.yahoo.co.jp/articles/330eb57dd121b088fc15c5c82b6df65c9d54fd16,1/1(月) 8:32
2024-01-01,13:23,life,ライフ,16,オトナンサー,ファミレス、カフェ…　“元日”休みの「飲食店」増加　その理由は？　飲食店コンサルタントに聞く,14,https://news.yahoo.co.jp/articles/44e3c36638307a0ecb2a15fddf84a516ba58d9a6,1/1(月) 12:10
2024-01-01,13:23,life,ライフ,17,プレジデントオンライン,餅を食べる親に「気をつけて」と声をかけるな…高齢医療のプロが警告する「餅を喉に詰まらせやすい瞬間」,14,https://news.yahoo.co.jp/articles/3370d37018fa11facc5b4aeb89b906fb007eefc8,1/1(月) 9:17
2024-01-01,13:23,life,ライフ,18,プレジデントオンライン,"なぜ小学校で""暴れる子""が増えているのか…子供の自己コントロール力を低下させる「叱れない」という大問題",14,https://news.yahoo.co.jp/articles/5cbd637a60c597963d1ea320274799518ef3ad63,2023/12/31(日) 15:17
2024-01-01,13:23,life,ライフ,19,ねとらぼ,【東京都民が選ぶ】かっこいいと思う「燃費が25km/L以上のトヨタの車」ランキング！　第2位は「プリウス」、1位は？,13,https://news.yahoo.co.jp/articles/b9fc8d3ac33d9033f9e978cec67d97b5840e70fd,1/1(月) 11:00
2024-01-01,13:23,life,ライフ,20,ファイナンシャルフィールド,奨学金の返済に絶望しています……。返済が遅れている人はいないのでしょうか？,12,https://news.yahoo.co.jp/articles/31cc82844ec27a526587c165f663342b4ea43e5d,1/1(月) 12:20
2024-01-01,13:23,life,ライフ,21,まいどなニュース,「毎日ワクワク、飽きないです」チョコボールを1日1個開封し続ける30代男性　金のエンゼル求め3500日超,12,https://news.yahoo.co.jp/articles/a7b7fecedaf1b0f01d029deabd92869469dddc7a,1/1(月) 11:10
2024-01-01,13:23,life,ライフ,22,THE GOLD ONLINE（ゴールドオンライン）,"老人ホームの若輩者「私たちには時期尚早でした」…年金36万円の70歳夫婦、3,000万円支払って高齢施設入居も、5ヵ月で“3階建ての家”にさっさと帰還のワケ【CFPが解説】",12,https://news.yahoo.co.jp/articles/6cbd63d600557525653cabbae4359dcbe96471f2,1/1(月) 11:32
2024-01-01,13:23,life,ライフ,23,ねとらぼ,【関東の社会人が選ぶ】今後発展していきそうな「GMARCH・関関同立の大学」ランキング！　同率1位は「明治大学」、もう1校は？,12,https://news.yahoo.co.jp/articles/618cb1ff4a3d647e1769e14807719c3b6645c1f1,1/1(月) 9:45
2024-01-01,13:23,life,ライフ,24,デイリー新潮,インフルエンザワクチンがアルツハイマーのリスクを下げる？　発症リスクを40％下げたという研究も,12,https://news.yahoo.co.jp/articles/1732e90a72d89781978f4be89c5e8d4d0657f72a,1/1(月) 11:06
2024-01-01,13:23,life,ライフ,25,まいどなニュース,脂っこい料理が苦手になる年齢は40歳前後が分かれ目…苦手になってきた食べ物の2位は「サーロインステーキ」,12,https://news.yahoo.co.jp/articles/b0c1149e763319eabb745c84d4994824ff92237f,1/1(月) 10:00
2024-01-01,13:23,life,ライフ,26,ALL REVIEWS,後の世代に借金のツケを回さない。国を憂うる必読の正論である。―河村 小百合『日本銀行 我が国に迫る危機』橋爪 大三郎による書評,11,https://news.yahoo.co.jp/articles/c4bdae6e3b020ea0db01aa5a7fe3ec01276e73fa,1/1(月) 6:00
2024-01-01,13:23,life,ライフ,27,ウォーカープラス,【セルフレジのトラブル】投入口に小銭をぶちまける親に「ちょっと待った！」シールや折り鶴とか入ってるから、賠償請求されたら大変！【作者に聞く】,11,https://news.yahoo.co.jp/articles/ad3f7c2fefb485d583040bc2ca7e2e41f41a735b,1/1(月) 11:00
2024-01-01,13:23,life,ライフ,28,AERA dot.,初詣で「やってはいけない」3つのこと　うっかりやってしまいがち！,10,https://news.yahoo.co.jp/articles/7615c60e1dce1c3011ac69df33fd70b2972895c1,1/1(月) 7:32
2024-01-01,13:23,life,ライフ,29,クーリエ・ジャポン,全身タトゥーの女性が“陰部”の施術を打ち明ける　「想像を超えた痛みだった…」,10,https://news.yahoo.co.jp/articles/c4f674ee25727cd6d36c269f64e41580d9e0c3f7,1/1(月) 0:05
2024-01-01,13:23,life,ライフ,30,ねとらぼ,【都民が選ぶ】企業からの評価が高いと思うGMARCHと関関同立の大学ランキング！　2位は「青山学院大学」と「中央大学」、1位は？,10,https://news.yahoo.co.jp/articles/3130e0a18788a8c9b2d26a307ad7467d872a7a93,1/1(月) 8:30
2024-01-01,13:23,life,ライフ,31,ねとらぼ,「中央線」で住みやすい駅ランキング！　2位は「武蔵境駅」、1位は？,9,https://news.yahoo.co.jp/articles/9860ae88743821f9925afea61dfa4b268b3fb4c0,1/1(月) 12:30
2024-01-01,13:23,life,ライフ,32,現代ビジネス,大活躍の大谷翔平が、絶対に言わない「まさかの言葉」があった…！,9,https://news.yahoo.co.jp/articles/975a09f9a3cc76aef63ec0571e188529b3a6389b,1/1(月) 6:04
2024-01-01,13:23,life,ライフ,33,ファイナンシャルフィールド,ついに始まった奨学金の返済……。返済が何ヶ月遅れたらブラックリストに入りますか？,9,https://news.yahoo.co.jp/articles/cea1ff5a2d137a01665c873cdb8aa98b61e4efb1,1/1(月) 11:30
2024-01-01,13:23,life,ライフ,34,kufura,「初詣行くor行かない」あなたはどっち？行かない人の理由は？男女500人に聞いた！,9,https://news.yahoo.co.jp/articles/8cf5276cdd8c1ccd2359b0610cce1300fe2b6c88,1/1(月) 11:10
2024-01-01,13:23,life,ライフ,35,ほ・とせなNEWS,4歳の娘「かぞくかいぎがしたい」まさかの議題に父親「最検討事項！」　投稿すると…多くの意見が寄せられる！,9,https://news.yahoo.co.jp/articles/68160c03472c17fb901328f50dbf2fa29745fe1c,2023/12/31(日) 20:30
2024-01-01,13:23,life,ライフ,36,FNNプライムオンライン,産婦人科医に密着! 外来に緊急手術… 長時間勤務と隣り合わせの実態 “医師の働き方改革”実現性は? 密着で見えた課題,9,https://news.yahoo.co.jp/articles/823b6e2c9b6e26bd7b4f5ad8e4bdf1d09b00f28a,1/1(月) 10:02
2024-01-01,13:23,life,ライフ,37,ねとらぼ,【都民が選ぶ】満足度が高い「食べ放題系チェーン」ランキング！　2位は「牛角食べ放題専門店」、1位は？,8,https://news.yahoo.co.jp/articles/1a3ebe5451b32d8a2aa7a7e1794d815cf6ec8b4a,1/1(月) 12:00
2024-01-01,13:23,life,ライフ,38,All About,「正月三が日」の6大タブー知っていますか？ 掃除や料理にまつわるNGに幸せのヒントがつまっていた,8,https://news.yahoo.co.jp/articles/c1e9bfc42b24570c277c1e09a00a9fc71422d067,2023/12/31(日) 21:15
2024-01-01,13:23,life,ライフ,39,共同通信,NHK紅白歌合戦は紅組が勝利,8,https://news.yahoo.co.jp/articles/30b0d68b26964da39f3e93d9f324c3033ba901c6,2023/12/31(日) 23:46
2024-01-01,13:23,life,ライフ,40,FORZA STYLE,妻が第三子を妊娠。天国から地獄に突き落とされた、ある男の告白。,8,https://news.yahoo.co.jp/articles/9e52c757b1c9e22611542bfd280e611de1ad6faf,1/1(月) 8:12
