scrp_date,scrp_time,genre_en,genre_jp,rank,media_jp,title,comment,link,date_original
2024-03-21,17:21,life,ライフ,1,まいどなニュース,旅館荒らした神戸大学バドサークル、新歓イベントの出展取り消し 存続危機に,119,https://news.yahoo.co.jp/articles/49fa6de5ee610f28f2decc13e38806dd9056fe7f,3/21(木) 7:41
2024-03-21,17:21,life,ライフ,2,FNNプライムオンライン,ベテランも迷う交通ルール　右?左?本線への「合流」ウインカーはどっち?　“出し間違い”が事故につながることも,114,https://news.yahoo.co.jp/articles/d798833684cf02e58ee5afd88f2326614aa6c28f,3/21(木) 9:02
2024-03-21,17:21,life,ライフ,3,産経新聞,過度なハイレグ、ローライズ「不可」　埼玉県公園協会が水着撮影会に「細かすぎる」手引き,86,https://news.yahoo.co.jp/articles/7d1c1b12f2e72454c27b5e613d5caedf293cb0c8,3/21(木) 14:30
2024-03-21,17:21,life,ライフ,4,読売新聞オンライン,女性医師が初の８万人超、２２年末時点で全体の２３・６％に…今後もさらに増加の見込み,84,https://news.yahoo.co.jp/articles/699bd5047b14c6a5a634cf5a092b69ead37ac618,3/21(木) 7:24
2024-03-21,17:21,life,ライフ,5,週刊SPA!,「絶対に結婚できない人」の特徴…女性から愛されない男性が“必ず言うセリフ”,38,https://news.yahoo.co.jp/articles/4572ac81fc1191ff454b81d19a44e39a8e590c50,3/21(木) 9:01
2024-03-21,17:21,life,ライフ,6,現代ビジネス,ダウン症のある娘の「しゃべり方」を指摘されたとき、さりげなく反論してくれた友だちの存在,34,https://news.yahoo.co.jp/articles/ee079ed2e20ab88027de1c706dc8f097bba32850,3/21(木) 7:03
2024-03-21,17:21,life,ライフ,7,FORZA STYLE,「オジサン、登山用リュックで出勤はないでしょう。」ダサオジのバックパック選びは、どこで間違えるのか？,30,https://news.yahoo.co.jp/articles/cb0b860870643d1aafff21b7ef9e6f7d58574ed9,3/21(木) 7:02
2024-03-21,17:21,life,ライフ,8,共同通信,オリジナル脚本のドラマ放送　日本テレビ、漫画原作の代わりに,25,https://news.yahoo.co.jp/articles/af123d29df19184b380956ef6b2f61bc684302d5,3/21(木) 16:21
2024-03-21,17:21,life,ライフ,9,まいどなニュース,喫煙者がタバコを吸う目的…「かっこいいから」「コミュニケーションの一環として」「習慣だから」を超えた1位は？,25,https://news.yahoo.co.jp/articles/f5478c4c9273d06eab867fc412284a723149636b,3/21(木) 16:00
2024-03-21,17:21,life,ライフ,10,産経新聞,埼玉県立高校共学化問題大詰め　別学は差別的か、意見聴取ではほぼ「反対」,24,https://news.yahoo.co.jp/articles/f2fc7c2ea605f14d12fe23be78f530af3d663bb7,3/21(木) 12:40
2024-03-21,17:21,life,ライフ,11,サンキュ！,入学前に買わなくて正解だった！結局卒業まで使わなかったもの,24,https://news.yahoo.co.jp/articles/f8f9fdc353b9f41f2a1d6ee8add83c7b51097bf3,3/21(木) 7:15
2024-03-21,17:21,life,ライフ,12,まいどなニュース,約7割の日本人が「自国は衰退している」と感じている…2016年と比べて1.7倍に増加,24,https://news.yahoo.co.jp/articles/393a8d0ae1ac1d6320bc5373bb7038eba14f3e1e,3/20(水) 20:30
2024-03-21,17:21,life,ライフ,13,ワールドジェットスポーツマガジン,忘れないで！【猪苗代湖ボート事故】利用“禁止”区域ではない場所で“浮かんでいた”だけなのに、「そんな“場所”に 浮いていた方が“悪い”」と 非難されて 心を痛める 被害者家族,20,https://news.yahoo.co.jp/articles/a0b3836502e93528b370ee648334c155cc6da02e,3/20(水) 19:48
2024-03-21,17:21,life,ライフ,14,FNNプライムオンライン,「舞妓パパラッチ」・のれんで手を拭く・無断トイレ侵入…京都・祇園で外国人観光客が“迷惑行為”　私道の立ち入り禁止へ,19,https://news.yahoo.co.jp/articles/bf237e957da23738138f3e19130fe0dfbd7fe67b,3/21(木) 16:32
2024-03-21,17:21,life,ライフ,15,まいどなニュース,「おっぱいが大きい人の聴診は嬉しいですか？」小学生みたいな質問への医師の回答が「マジですごい分かる」と反響,19,https://news.yahoo.co.jp/articles/893f580e258bafe894af2ffbca0e72cedc4daf15,3/20(水) 20:00
2024-03-21,17:21,life,ライフ,16,まいどなニュース,東京在住の大学生、北海道・稚内駅で「先週も来てました？」　その真相は…「駅員さんの驚いた表情が目に浮かぶ」「これは依存症」,16,https://news.yahoo.co.jp/articles/dbad1c97e2b4e8b3430d07255e13f4fd1f443dab,3/21(木) 7:10
2024-03-21,17:21,life,ライフ,17,CHANTO WEB,「卒業式の予行練習」なぜ何回もやるの？教師も「静かに！」「声を大きく」と厳しい指導はしたくない【元校長に聞いた】,16,https://news.yahoo.co.jp/articles/d5a6a54abe6cb25426294b2deb4649207556d1ee,3/21(木) 6:32
2024-03-21,17:21,life,ライフ,18,現代ビジネス,「会社に行かないと、1日はこんなに長いのか」60代男性が定年後、一気に気が滅入ったワケ,15,https://news.yahoo.co.jp/articles/8f5dce93635ae369839e335b3be6ba82cb4a0c57,3/21(木) 8:03
2024-03-21,17:21,life,ライフ,19,まいどなニュース,「孤独のグルメ」を見ながら5歳児がぽつり「ごろうさんって…」　可愛すぎる発想に「ほんとに涙出た」「心温まります」と反響,14,https://news.yahoo.co.jp/articles/cc22a48c68afb6d81ed1295b1e5364a2a42279ef,3/21(木) 15:20
2024-03-21,17:21,life,ライフ,20,ねとらぼ,「え、お前そんなことできるの」2年たって知った洗面台の新機能　「私も数年間知らなかった」と共感する声,13,https://news.yahoo.co.jp/articles/5fabb5c0de5c7f3d6d6c57756218c6113af8fc53,3/20(水) 20:30
2024-03-21,17:21,life,ライフ,21,THE GOLD ONLINE（ゴールドオンライン）,"この先、不安しかない…〈退職金3,000万円〉〈貯金1,500万円〉の64歳・元エリートサラリーマンに忍び寄る「老後破綻」と「年金問題」【CFPの助言】",12,https://news.yahoo.co.jp/articles/497e042cdc927bdd269d255f4390bc8ad6a6dc5e,3/21(木) 11:02
2024-03-21,17:21,life,ライフ,22,よろず～ニュース,自炊で「アホみたいな料理」作った→自己責任だから「怒られないので良い」　自炊のメリットが共感呼ぶ,12,https://news.yahoo.co.jp/articles/24831e2128fce0783f5e8c2cc3fee6253f912a8c,3/21(木) 12:09
2024-03-21,17:21,life,ライフ,23,まいどなニュース,「リアル書店」と「ネット書店」の違いとは！？たとえた漫画に反響、共感の声「わかりみが過ぎる」「俺を買えと主張してくる本は当たり」,12,https://news.yahoo.co.jp/articles/b7b352da88f8226664decf54be671eae23e408c8,3/21(木) 11:05
2024-03-21,17:21,life,ライフ,24,HugKum,「ち」は「ti」それとも「chi」？複雑な「ローマ字のつづり方」を見直す動きが出ています【知って得する日本語ウンチク塾】,11,https://news.yahoo.co.jp/articles/4848e08565b2ec33b942c14285182f9ad828e09c,3/20(水) 21:20
2024-03-21,17:21,life,ライフ,25,ねとらぼ,1週間約4500円で暮らす共働き夫婦の作り置き　112万再生された美味しそうな品々に「素晴らしいです」「見てるだけで楽しい」,10,https://news.yahoo.co.jp/articles/f76b51dd94172f7d4c4d9e211a078d5f90dfd6f7,3/21(木) 12:30
2024-03-21,17:21,life,ライフ,26,週刊女性PRIME,どす黒い肌に血便…「明日病院に行かなければ離婚する」夫の言葉で発覚した大腸がん,10,https://news.yahoo.co.jp/articles/bc8c235c06e42ad1a5489f53a744846c5266cd71,3/21(木) 6:02
2024-03-21,17:21,life,ライフ,27,歴史人,旧式砲ながら転生して仇敵M4シャーマンを撃破！【38式15cm榴弾砲】,10,https://news.yahoo.co.jp/articles/0f11dd279cbb1b95eefb00527e547bf3d5546534,3/21(木) 11:30
2024-03-21,17:21,life,ライフ,28,Hint-Pot,「『また休むのかよ』と思われても…」　藤本美貴さんの風邪との向き合い方に称賛の声,9,https://news.yahoo.co.jp/articles/0666e345027a9fb19ba6bd0d950794e825071a67,3/21(木) 7:11
2024-03-21,17:21,life,ライフ,29,Hint-Pot,「日本で感動したのは他者へのリスペクト」　初訪日のノルウェー人　特別に見えた日本のマナーとは,9,https://news.yahoo.co.jp/articles/4a2cebbccdc3b4357bb46220675d55e84f5f37ef,3/21(木) 8:10
2024-03-21,17:21,life,ライフ,30,GOETHE,消費税は18％まで上がる？ 進むインフレと老後2000万円問題に備えて50代からできること,8,https://news.yahoo.co.jp/articles/87ae3412bb49ca22e7e258d3374c34d7d8c5bb26,3/21(木) 16:30
2024-03-21,17:21,life,ライフ,31,毎日新聞,加計学園獣医学部「目玉」の四国枠　24年度合格、上限の半数,8,https://news.yahoo.co.jp/articles/80b8f51e07e0a41fcd165e9c8a0cee0c7e1ec282,3/21(木) 16:10
2024-03-21,17:21,life,ライフ,32,現代ビジネス,相手から愛されていると思い込む「40代女性の精神構造」…解雇したくてもできない「苦しいワケ」,8,https://news.yahoo.co.jp/articles/414d2b8a7ccbd9702e3daa54adb99224be8fdc27,3/21(木) 12:33
2024-03-21,17:21,life,ライフ,33,THE GOLD ONLINE（ゴールドオンライン）,うっ嘘だろ！「59歳11ヵ月の退職がおトク」を信じた月収52万円・定年前の大卒サラリーマン、まさかの結果に悲鳴,7,https://news.yahoo.co.jp/articles/84bb707fda54c22d60bdfcab5fd246bdaddf6d04,3/21(木) 5:02
2024-03-21,17:21,life,ライフ,34,KURU KURA（くるくら）,日本で「ライドシェア」が解禁される区域が判明！ なぜ東京・神奈川・愛知・京都に決まった？,7,https://news.yahoo.co.jp/articles/e51d142a10c2ade8c14988fe17d7aca7966c63c9,3/21(木) 12:12
2024-03-21,17:21,life,ライフ,35,まいどなニュース,「夫の弁当を作りません」レシピ公開で人気のインスタグラマーの告白が再生回数670万回超え→真意を聞くと…,7,https://news.yahoo.co.jp/articles/0239b4480bf200ba89f42f6d1612f5bc01abf085,3/21(木) 11:20
2024-03-21,17:21,life,ライフ,36,弁護士ドットコムニュース,「実印」は差し押さえ禁止→「金印」を作れば「税務署」は手出しできないってホント？,7,https://news.yahoo.co.jp/articles/4c4a838d21d6bf216877ebb5b7bd21c46f2d2eef,3/21(木) 10:29
2024-03-21,17:21,life,ライフ,37,日刊ゲンダイDIGITAL,ドジャース解雇！なぜ水原一平通訳の借金は6.8億円までに？ 「ギャンブル依存症」の本当の怖さ,7,https://news.yahoo.co.jp/articles/c10fd92407ee41c58c083180dad2d4218b71c9af,3/21(木) 13:12
2024-03-21,17:21,life,ライフ,38,ほ・とせなNEWS,障がいのある兄妹を育てる父親、自身も昨年難病に　SNSの発信を通して「孤独から大きな励みになった」　発信に込めた“願い”に迫る,7,https://news.yahoo.co.jp/articles/83c9c04b903c57cc39f22bdcc1ffbe6c2880fd1d,3/21(木) 11:30
2024-03-21,17:21,life,ライフ,39,ねとらぼ,靴下の片方が次々と行方不明に……　途方に暮れる姿に世界中から共感の声「わかる」「神経衰弱ゲームよりシンドい」【海外】,7,https://news.yahoo.co.jp/articles/e368785cb17882432851443b97f15f46be6167d4,3/21(木) 11:38
2024-03-21,17:21,life,ライフ,40,サンキュ！,【ドン・キホーテ】「買わなきゃ損！」1カ月以上毎日取り換えられるのに激安なキッチンアイテム,6,https://news.yahoo.co.jp/articles/6e4dbb805a245d8dabb70080fc2248801fd90403,3/21(木) 14:37
