scrp_date,scrp_time,genre_en,genre_jp,rank,media_jp,title,comment,link,date_original
2025-09-19,11:34,sports,スポーツ,1,毎日新聞,ロッテ益田投手、ロッカー殴り骨折　250セーブ目前に…全治数カ月,579,https://news.yahoo.co.jp/articles/af63fda50c435c48ea914e6a56d74cdf7e59859c,9/19(金) 5:30
2025-09-19,11:34,sports,スポーツ,2,週刊女性PRIME,「勝利チームに失礼すぎる」五輪を逃したロコ・ソラーレの過剰な敗北報道、関係者が憂う人気の“行く末”,185,https://news.yahoo.co.jp/articles/a79d4566eb37419bd4088c71eaed5d1fbe214a0e,9/19(金) 6:01
2025-09-19,11:34,sports,スポーツ,3,まるスポ,DeNAが発表したCS座席図に批判の声が続出  ビジター応援席をウィング席に限定し、「これは酷すぎる」などとベイスターズファンから多くの苦言も,155,https://news.yahoo.co.jp/articles/b260654b49bbc61e64feee884caab46453c7e599,9/19(金) 8:04
2025-09-19,11:34,sports,スポーツ,4,スポーツ報知,ドジャース一筋１８年のカーショーが今季限りの引退を発表　日本時間２０日の本拠ジャイアンツ戦に先発登板,142,https://news.yahoo.co.jp/articles/3073c29f9cb1144da6f29957ae0d92fb4d6612d1,9/19(金) 5:04
2025-09-19,11:34,sports,スポーツ,5,FRIDAY,【全文】妻子持ちであることを隠して…ヤクルト「期待の星」投手が不倫相手とドロ沼″妊娠トラブル″,100,https://news.yahoo.co.jp/articles/30b991d9e8dcc2b24ae830eb8c793ef7cab3b9df,9/19(金) 7:00
2025-09-19,11:34,sports,スポーツ,6,中日スポーツ,DeNA、CSの本拠地座席図に非難噴出「リスペクトがなさすぎ」「ファンだけど流石にやり過ぎ」ビジター応援エリアを上層ウィングエリアに限定,99,https://news.yahoo.co.jp/articles/f175b40cf00126d3e4112f14ad120e5b4fe6b8b7,9/18(木) 18:38
2025-09-19,11:34,sports,スポーツ,7,デイリースポーツ,ドジャース　カーショーが引退会見で涙「彼らの目を見るのがつらい」と声震わせる　大谷翔平ら選手＆首脳陣が続々会見場に集結　功労者の思いを受け止める,82,https://news.yahoo.co.jp/articles/7b9eb40734b433762bd8f1af19a7d7558a3b3ac9,9/19(金) 9:36
2025-09-19,11:34,sports,スポーツ,8,中日スポーツ,カーショー電撃引退発表、大谷翔平と心を通わせた濃厚な２年…”因縁”からリスペクトへ、大谷の大記録でカーショーの取った行動,72,https://news.yahoo.co.jp/articles/92e8646defb0843ae55f81636831424959a5c88a,9/19(金) 6:04
2025-09-19,11:34,sports,スポーツ,9,Full-Count,大谷翔平がトップ陥落　1132億円“最高額男”が急浮上…50号到達も3位転落のワケ,66,https://news.yahoo.co.jp/articles/55288eceb1c3388caf80d951b11303fe29d66c2c,9/19(金) 8:50
2025-09-19,11:34,sports,スポーツ,10,Yahoo!ニュース オリジナル THE PAGE,【ヤフコメで話題】「ロコ・ソラーレ偏重の報道に疑問の声」「フォルティウスの活躍にも注目を」 - カーリング日本代表選考後のメディア報道に議論,63,https://news.yahoo.co.jp/articles/138d8c94553d735e747f00a7ca1824a88590390b,9/19(金) 10:35
2025-09-19,11:34,sports,スポーツ,11,フットボールチャンネル,「史上最高の蜂蜜組誕生か」韓国メディア、最新のFIFAランキング発表で韓国代表は“ポット2が安泰”と強調「歴代初のことだ」,61,https://news.yahoo.co.jp/articles/cb8f98c088e99911852bacc48131bc0d918e783f,9/19(金) 8:36
2025-09-19,11:34,sports,スポーツ,12,TBS NEWS DIG Powered by JNN,【中日】逆転負け ワースト借金16 DeNA戦で借金”9”...涌井が9回2死無走者から筒香に痛恨3ラン被弾 救援陣も失点 ボスラーが一時 逆転打も,58,https://news.yahoo.co.jp/articles/bf6ff66064309eb394d740d9ada7c027534bfb7a,9/18(木) 21:14
2025-09-19,11:34,sports,スポーツ,13,サンケイスポーツ,巨人・阿部慎之助監督「あれじゃ捕手が何人いても（いつか）死人が出るよ…」　岸田は途中交代,57,https://news.yahoo.co.jp/articles/131e1aaffdeac39753400eadab4d1a97c84198e8,9/19(金) 5:30
2025-09-19,11:34,sports,スポーツ,14,日刊スポーツ,【ソフトバンク】連覇へ大前進！新庄ハムとの直接対決制し５連勝Ｍ７　対日本ハム勝ち越しも決定,54,https://news.yahoo.co.jp/articles/25e80d8c80dcee4df3a3d25aad09032d5e3b1da8,9/18(木) 21:47
2025-09-19,11:34,sports,スポーツ,15,デイリースポーツ,日本ハム、Ｖ霞む痛恨逆転負け　新庄采配裏目、３番手古林が同点被弾、４番手田中が決勝押し出し四球　直接対決敗れ鷹と４・５差　指揮官「いい試合」も,48,https://news.yahoo.co.jp/articles/d9c5d04c126f99cde1b3a942554ef6b83ae8a495,9/18(木) 21:51
2025-09-19,11:34,sports,スポーツ,16,週刊ベースボールONLINE,廣岡達朗コラム「今の人たちは連帯責任とは何かを知らない　昔の鬼軍曹が懐かしい」,44,https://news.yahoo.co.jp/articles/6589be880bf376cab0d1e61250386c8223ff69d7,9/19(金) 11:01
2025-09-19,11:34,sports,スポーツ,17,デイリースポーツ,ＤＨ制導入でセのドラフトどう変わる？スカウト陣に新たな視点　選手の将来性が広がる可能性,42,https://news.yahoo.co.jp/articles/0ccf7422ef53190b3b1dfcaee2afed694856db2a,9/19(金) 10:00
2025-09-19,11:34,sports,スポーツ,18,中日スポーツ,【中日・井上監督語録】言ったんだけどな。山井をマウンドへ行かせて「一発だけは絶対打たれるな、ダメだぞ」って伝えさせたんだけどな,41,https://news.yahoo.co.jp/articles/b5ec3069b4ffe0daf98d62d6008cbcf3637558c6,9/19(金) 5:45
2025-09-19,11:34,sports,スポーツ,19,スポーツ報知,佐々木朗希がマイナーで初の救援登板へ　指揮官明言…ＰＳの起爆剤へ適性チェック,41,https://news.yahoo.co.jp/articles/2af007c4ba3f6ea3a9c13513fa8451406f36ca67,9/19(金) 8:26
2025-09-19,11:34,sports,スポーツ,20,Full-Count,大谷翔平に歓声の裏で…「またか」　続く“12”にため息と混乱「明らかに異常」,40,https://news.yahoo.co.jp/articles/afd522f8cd4890480ccc48d83f235749224d3b97,9/19(金) 5:27
2025-09-19,11:34,sports,スポーツ,21,RONSPO,那須川天心vs井上拓真のWBC世界バンタム級王座決定戦が11月実現でついに合意！IBF世界同級王座決定戦は日本バンタム級王者の増田陸にチャンス！,38,https://news.yahoo.co.jp/articles/ee9327fada92d6fb10d3dde5d5097ee983fdb22a,9/19(金) 6:05
2025-09-19,11:34,sports,スポーツ,22,西スポWEB OTTO！,ソフトバンク栗原陵矢、起死回生の同点7号ソロ　優勝マジック9での日本ハム直接対決で大仕事　サイクル安打に王手,38,https://news.yahoo.co.jp/articles/17c482acede380858a7ff29ab228bb700fb288d0,9/18(木) 21:36
2025-09-19,11:34,sports,スポーツ,23,スポニチアネックス,シュワバー追走だ！大谷翔平が2戦連発で51号！3年連続本塁打王へライバルに2本差　本拠ファン総立ち,38,https://news.yahoo.co.jp/articles/1d8e355f79e8f0c2c6880accb522bde0fff7cf25,9/18(木) 13:07
2025-09-19,11:34,sports,スポーツ,24,中日スポーツ,【与田剛の目】DeNAにだけ勝てない…中日が4年間も抜け出せない根深い理由　元監督が明かした改善点に光明は？,38,https://news.yahoo.co.jp/articles/825fb16b94ca5c086a7c68309bbdc2ff9b42847e,9/19(金) 5:45
2025-09-19,11:34,sports,スポーツ,25,サンケイスポーツ,虎のソナタ　もったいない！？ガラガラのマツダ　年中満員御礼の甲子園ではチケット入手困難,37,https://news.yahoo.co.jp/articles/9f4b4eac585060491ce4c5bf5e7a4059a79c50d2,9/19(金) 11:00
2025-09-19,11:34,sports,スポーツ,26,ベースボールキング,セ・パともに3割打者は1人ずつ…異例の首位打者争いに江本孟紀氏「この低次元ではダメだね。もっとレベルを上げてほしいです」と喝,37,https://news.yahoo.co.jp/articles/608fc6a52dd8ce36c4d8f48961b31e005e9023ff,9/19(金) 6:30
2025-09-19,11:34,sports,スポーツ,27,文春オンライン,「2年生の対外試合がなくなってもいいんか？」中井哲之監督の“あるまじき発言”はなぜ当初問題視されなかったか《広陵高校の“闇”を問う》,36,https://news.yahoo.co.jp/articles/6c4a2131c3208e53d0175ea982a73aff50fcc813,9/19(金) 6:12
2025-09-19,11:34,sports,スポーツ,28,スポニチアネックス,巨人・阿部監督「あれじゃキャッチャーが何人いても死人が出るよ」　森田に呆れ顔,36,https://news.yahoo.co.jp/articles/bd53698a8e7d5408c5c811221c385eb60ed10840,9/18(木) 21:41
2025-09-19,11:34,sports,スポーツ,29,THE ANSWER,陸上界激震の裏で…絶妙に“禁断のウワサ”に触れた織田裕二が「全方位に配慮し、核心を突き…」絶賛の嵐,35,https://news.yahoo.co.jp/articles/d0be8ae8d4516b9c4276ea172d0052f1cf8ebcf8,9/19(金) 10:11
2025-09-19,11:34,sports,スポーツ,30,スポーツ報知,【巨人】４勝目狙い先発の森田駿哉、初回、内山に適時二塁打浴びる,35,https://news.yahoo.co.jp/articles/3117c05bb38e972693f871574d74a2fd5dd3b846,9/18(木) 18:25
2025-09-19,11:34,sports,スポーツ,31,デイリースポーツ,痛恨敗戦も日本ハム・新庄監督受け止める「いい試合だった」同点被弾の古林は「ボール悪くなかった」４・５差で残り１０試合「全力で１０勝って気持ちで」,35,https://news.yahoo.co.jp/articles/a35e2452a29f40e822ec59d576eb0eb2ee5557cc,9/18(木) 22:00
2025-09-19,11:34,sports,スポーツ,32,東スポWEB,【日本ハム】逆転負けでリーグ優勝絶望的…　ＣＳファイナルの「鷹狩り」に横たわる２大不安要素,35,https://news.yahoo.co.jp/articles/422ba616f526a44aa8cc20c389090bcc26b0fc16,9/19(金) 5:16
2025-09-19,11:34,sports,スポーツ,33,TBS NEWS DIG Powered by JNN,【広島】阪神との最終戦は完敗 借金13で絶望的CS...高は森下に先制2ラン被弾し5回3失点2敗目 救援陣も4失点 代打・秋山が6回満塁で不発,34,https://news.yahoo.co.jp/articles/072951699681038286a1e4fdbf6af51f377697ce,9/18(木) 21:10
2025-09-19,11:34,sports,スポーツ,34,サンケイスポーツ,カーショーが今季限りで現役引退…ドジャース一筋18年　20日がRS最後のマウンド　勝率は200勝以上の投手でトップ,34,https://news.yahoo.co.jp/articles/62717296dc78965652b4fca205778872a540e517,9/19(金) 5:11
2025-09-19,11:34,sports,スポーツ,35,スポニチアネックス,カーショー涙の引退会見「納得できている」　通算222勝のレジェンドが決断　大谷翔平ら仲間が見守る,33,https://news.yahoo.co.jp/articles/db688c2268ff4b08ad7e98e347de39ee515f13c1,9/19(金) 9:31
2025-09-19,11:34,sports,スポーツ,36,J-CASTニュース,巨人・阿部監督「来季続投」決定、SNSでG党紛糾...「辞めさせる理由ない」「本当に続投でいいんか？」,33,https://news.yahoo.co.jp/articles/c80cef633d283fb7cde9064c7dc6bd579c3292e2,9/18(木) 12:00
2025-09-19,11:34,sports,スポーツ,37,RONSPO,「噂は噂に過ぎない」角田裕毅が今日開幕アゼルバイジャンGPを前に怒りを浮かべて「来季ハジャー昇格内定」の報道を一蹴…「自分のできることに集中するだけだ」,33,https://news.yahoo.co.jp/articles/01345f533bd9f9bc88e434c4f22345f319909438,9/19(金) 6:45
2025-09-19,11:34,sports,スポーツ,38,Full-Count,大谷翔平、2戦連発51号　シュワーバーの前で豪快弾…トップに2本差、本拠地熱狂,31,https://news.yahoo.co.jp/articles/f88822d58c8ed07b20778ddd4ffd973360a2f2b9,9/18(木) 13:06
2025-09-19,11:34,sports,スポーツ,39,中日スポーツ,中日・井上監督「同じことを繰り返したらアカンでしょ」2戦連続被弾にボヤき　涌井「何もありません」,30,https://news.yahoo.co.jp/articles/e87fdd6220b7873299863827b3f2ad6c5959744d,9/19(金) 5:45
2025-09-19,11:34,sports,スポーツ,40,デイリースポーツ,巨人・阿部監督が森田に苦言「サインが見えないらしいから。キャッチャーが何人いても死人が出るよ」　二回にはサイン違いで投球が岸田の体直撃,30,https://news.yahoo.co.jp/articles/a461819015553a973a68b74090f7094428a4bd6c,9/18(木) 21:17
