scrp_date,scrp_time,genre_en,genre_jp,rank,media_jp,title,comment,link,date_original
2025-09-19,19:08,TTL,総合,1,TBS NEWS DIG Powered by JNN,【独自】小泉進次郎農水大臣「2030年度までに平均賃金100万円増」 自民党総裁選の公約が判明,1097,https://news.yahoo.co.jp/articles/ec2dd1cc52e52fc023574125755a8a1145c12eea,9/19(金) 11:19
2025-09-19,19:08,TTL,総合,2,産経新聞,「顔が濃い方」「逆に白い方」自民・高市氏、総裁選出馬記者会見で司会者の発言に2度謝罪,851,https://news.yahoo.co.jp/articles/1bbe247fc4e4728e59a1d81d95b4e94a2c651dea,9/19(金) 17:01
2025-09-19,19:08,TTL,総合,3,TBS NEWS DIG Powered by JNN,【速報】高市前経済安全保障担当大臣が自民党総裁選の政策を発表 「給付付き税額控除」の制度設計に着手することなど掲げる,497,https://news.yahoo.co.jp/articles/123b26d695ebdcad207c1bd574142048771b1cdb,9/19(金) 15:04
2025-09-19,19:08,TTL,総合,4,FNNプライムオンライン（フジテレビ系）,市役所職員100人弱が通勤手当不正受給か…1671万円返金　バス通勤手当受け取り徒歩通勤も　東京・八王子市,455,https://news.yahoo.co.jp/articles/df5f248f3d95b6696eba861aac03ca59e461b39d,9/19(金) 15:33
2025-09-19,19:08,TTL,総合,5,共同通信,時速125キロで逆走、懲役9年　飲酒死亡事故の中国籍19歳,420,https://news.yahoo.co.jp/articles/eaa6d9b5207455fc290cb806751bfe37641ff7cb,9/19(金) 11:28
2025-09-19,19:08,TTL,総合,6,毎日新聞,ロッテ益田投手、ロッカー殴り骨折　250セーブ目前に…全治数カ月,281,https://news.yahoo.co.jp/articles/af63fda50c435c48ea914e6a56d74cdf7e59859c,9/19(金) 5:30
2025-09-19,19:08,TTL,総合,7,日テレNEWS NNN,林家ぺーさんとパー子さんが住むマンションで火事　パー子さんが煙吸い搬送、ほか2人ケガ…いずれも軽傷,278,https://news.yahoo.co.jp/articles/5a8969d8ae39d26d2ae40b5264e4d7e7b2704b01,9/19(金) 15:45
2025-09-19,19:08,TTL,総合,8,読売新聞オンライン,首相指名選挙、立憲民主「野党一本化」模索…日本維新・国民民主は連携に消極姿勢,274,https://news.yahoo.co.jp/articles/5ff3b98baf01bd5cfd5c9e5b4a36d845b0d2430c,9/19(金) 8:18
2025-09-19,19:08,TTL,総合,9,日刊スポーツ,首相報酬4000万円「低い」自民党総裁選候補が指摘　真意説明「上場企業の社長は億もらって」,267,https://news.yahoo.co.jp/articles/a33ac31f6972d64494c09781430925e66c873a31,9/19(金) 8:10
2025-09-19,19:08,TTL,総合,10,カナロコ by 神奈川新聞,【自民総裁選】河野太郎氏、小泉農相を支持の意向　周囲に伝える,262,https://news.yahoo.co.jp/articles/30f43c705d609017803f384931c797c4d3925a3d,9/18(木) 21:10
2025-09-19,19:08,TTL,総合,11,読売新聞オンライン,日銀の植田総裁が記者会見、ＥＴＦ売却完了には「１００年以上かかる」,246,https://news.yahoo.co.jp/articles/f7a03fc297b92d91c069b5c9f53376fe41afbe76,9/19(金) 16:19
2025-09-19,19:08,TTL,総合,12,朝日新聞,日銀がETF売却を決定、年間3300億円ずつ　追加利上げは見送り,244,https://news.yahoo.co.jp/articles/0151d8b980e867693ca763e6a4cc885f81a5644e,9/19(金) 12:56
2025-09-19,19:08,TTL,総合,13,日刊スポーツ,74歳大物ミュージシャン、BABYMETALめぐり炎上の湯川れい子さんに「全く同じ意見」,197,https://news.yahoo.co.jp/articles/f9c517035ef8eff01ab0ad4397ac22c1f6916cd6,9/19(金) 12:00
2025-09-19,19:08,TTL,総合,14,FASHIONSNAP,ユニクロのキャッシュレス決済サービス「UNIQLO Pay」がサービス終了,191,https://news.yahoo.co.jp/articles/d18717677e2cdbfe425e41cff48d4579604e5411,9/19(金) 17:21
2025-09-19,19:08,TTL,総合,15,女性自身,「教育と指導で終わりですか？」参政党・初鹿野議員の“歳費返納撤回”問題　神谷代表の謝罪にジャーナリストが“20文字”で苦言,189,https://news.yahoo.co.jp/articles/82e41190f51a5a67ac81ab83ebaaa74b2d4f39b3,9/19(金) 17:55
2025-09-19,19:08,TTL,総合,16,弁護士ドットコムニュース,スシローに続き「はま寿司」でも学生バイトら労組結成　団交で「賃金計算15分→1分単位化」実現へ,182,https://news.yahoo.co.jp/articles/66b61589b2de3657e8b6200ebd26945556b92ae3,9/19(金) 14:07
2025-09-19,19:08,TTL,総合,17,週刊SPA!,「美味しんぼの海原雄山か」人気ラーメン店で女性客に知識マウント、店主に追い出された50代男性の末路,182,https://news.yahoo.co.jp/articles/3e42f98cc7120e2fc24b9d6547b751375f2e38a3,9/19(金) 15:53
2025-09-19,19:08,TTL,総合,18,FNNプライムオンライン,パワハラ疑惑のJ3高知・秋田豊監督が辞意表明「伝え方をブラッシュアップしないといけない」,167,https://news.yahoo.co.jp/articles/e1006e3ee8e935094f08e29b1a330eadd05c68bd,9/19(金) 15:15
2025-09-19,19:08,TTL,総合,19,読売テレビ,【速報】“紀州のドン・ファン”遺言書「全財産を市に寄付」は二審も“有効”判決　親族らの訴えを棄却　大阪高裁,165,https://news.yahoo.co.jp/articles/16959bb5b25841ebe28558fab413b57026ba26b8,9/19(金) 13:32
2025-09-19,19:08,TTL,総合,20,日刊スポーツ,高市早苗氏が「経歴詐称疑惑」問う不規則質問に「私の名誉にかかわる」と全否定　総裁選政策会見,164,https://news.yahoo.co.jp/articles/b056558de4728c3d48e8cb991fb590d0a98defde,9/19(金) 17:44
2025-09-19,19:08,TTL,総合,21,スポニチアネックス,へずまりゅう氏を「応援するやつはお茄子」と奈良市議が投稿「奈良市にお茄子が8000人いた」とも,158,https://news.yahoo.co.jp/articles/ddfeaaa3a858db65057fc5dda84684c89faf44ed,9/19(金) 17:55
2025-09-19,19:08,TTL,総合,22,毎日新聞,回収率減、擦り減る調査員のメンタル　岐路を迎える国勢調査,153,https://news.yahoo.co.jp/articles/e18c1e78beb929468218bc91d848abc7ff23c0d5,9/19(金) 6:30
2025-09-19,19:08,TTL,総合,23,日刊スポーツ,へずまりゅう氏緊急報告「これ以上は身の危険を感じるので…本当に危険です」,151,https://news.yahoo.co.jp/articles/f303a678beca400698c8283cc686e92007f55f98,9/19(金) 14:16
2025-09-19,19:08,TTL,総合,24,プレジデントオンライン,"やっぱり「愛子天皇」しかない…専門家が懸念「学究優先の紀子妃流""帝王学""で次代天皇はつとまるのか」",150,https://news.yahoo.co.jp/articles/c6b345de4d6ace94395225d1985b7bbc34020396,9/19(金) 18:16
2025-09-19,19:08,TTL,総合,25,ピンズバNEWS,「笑いそうになってる松尾さん」チョコプラ、失言に丸刈り謝罪も炎上継続で…フジNo.1番組への懸念続々,150,https://news.yahoo.co.jp/articles/45f24392c10a0a21ba7452287a42a36f4c1be903,9/19(金) 12:01
2025-09-19,19:08,TTL,総合,26,テレ東BIZ,日銀ETF売却方針　株価一時4万5000円割れ,149,https://news.yahoo.co.jp/articles/ec64ed5c55db62e9e37d68829be56afa1a1e14e6,9/19(金) 15:34
2025-09-19,19:08,TTL,総合,27,テレビ静岡NEWS,学歴詐称の田久保市長に対し新たな刑事告発　今度は背任容疑　「市に対して本来全く不要であった市議選で財産上の損害を与えた」「市長としての職務上の任務に背いて不正な利益を得た」と指摘,149,https://news.yahoo.co.jp/articles/237dfd6d10dd6f8169476994d906cf396be971d5,9/19(金) 13:56
2025-09-19,19:08,TTL,総合,28,プレジデントオンライン,コメが「5キロ2000円台」に戻ることはもうない…生産量が上がっても値段が下がらない事態を招いた農水省の過ち,145,https://news.yahoo.co.jp/articles/1a152ece5c6e6616beb4d0e16c7a71b1d323f3dc,9/19(金) 16:16
2025-09-19,19:08,TTL,総合,29,J-CASTニュース,大炎上のヒカル、ファン離れに複雑胸中...「めっちゃごめんっていう思い」と「こんなことくらいで離れんなよ」,141,https://news.yahoo.co.jp/articles/e6ac5192db4f224f771adf99db4450551b3823a9,9/19(金) 14:33
2025-09-19,19:08,TTL,総合,30,プレジデントオンライン,だから予約殺到で「43年待ち」に…1日200個しか作れない「神戸牛コロッケ」に懸けた精肉店主の執念,140,https://news.yahoo.co.jp/articles/9b5e6029d3d71d3100dd16462e39ce590f19fb00,9/19(金) 8:16
2025-09-19,19:08,TTL,総合,31,SmartFLASH,小泉孝太郎、バラエティ出演ラッシュに「うんざりする」視聴者の不満続出…“クズキャラ” トークも使い回しで薄れる新鮮味,139,https://news.yahoo.co.jp/articles/43766424199cdd369b9c72149d6cc7feb6e5c2ad,9/19(金) 17:45
2025-09-19,19:08,TTL,総合,32,女性自身,《また有吉弘行に噛みついていた！》ATSUSHIそっくり芸人　深夜の反撃投稿に起きていた“異変”,132,https://news.yahoo.co.jp/articles/2b297e9f5139a97d395e05ac85b08c842b1851db,9/19(金) 14:10
2025-09-19,19:08,TTL,総合,33,デイリースポーツ,田崎史郎氏　麻生太郎氏が推す総裁の名前「ギリギリまで引っ張って…」　進次郞氏へ「火中の栗は拾わねえな」と発言の真意も解説,124,https://news.yahoo.co.jp/articles/380bb1b51ba46e0bfd8b38eef6a1896dcb0f6577,9/19(金) 13:59
2025-09-19,19:08,TTL,総合,34,プレジデントオンライン,悠仁さまのために「愛子天皇」は実現すべきだ…19歳の成年皇族の門出に影を落とす母・紀子さまの気になる行動,123,https://news.yahoo.co.jp/articles/2b9a697c1d7402101a15654644c7e3a4e294cbf3,9/19(金) 16:16
2025-09-19,19:08,TTL,総合,35,FNNプライムオンライン（フジテレビ系）,中谷防衛相が沖縄での抗議活動に異例の呼びかけ「抗議は良識を持ってやってほしい」妨害行為で訓練の変更も,120,https://news.yahoo.co.jp/articles/f84143d697e688d99f94351001e38cef0e6aae78,9/19(金) 11:48
2025-09-19,19:08,TTL,総合,36,デイリー新潮,宮内庁内から「ポニーテールはどうする」の声　「紀子さま」もついに触れた「小室弁護士一家の帰国」,117,https://news.yahoo.co.jp/articles/a5aeff558d8418918908cf37754155e00956083e,9/19(金) 6:00
2025-09-19,19:08,TTL,総合,37,AERA DIGITAL,女性に抱きつき逮捕され、大手メディアを懲戒解雇に　困難極めた再就職と「前科者の社会復帰をどう支えるか」の重い問い,110,https://news.yahoo.co.jp/articles/251f0ed05a92f6c929f19848a4c69ef6c69aae84,9/19(金) 7:31
2025-09-19,19:08,TTL,総合,38,デイリースポーツ,中日・中田翔引退試合に膨大な数の花届く　弟分のソフトＢ・秋広からは真っ赤なバラのスタンド「パパへ　これからは僕がご飯奢ります」巨人・坂本、ＤｅＮＡ藤浪らからも,109,https://news.yahoo.co.jp/articles/225de625b1edc0209f422208c2d57956e5c3cabb,9/19(金) 14:17
2025-09-19,19:08,TTL,総合,39,朝日新聞,橋の死亡事故、管理公社「モニター見逃した」駐停車禁止に車27分,109,https://news.yahoo.co.jp/articles/0fa7c50f50eec8fd977b568880b2bde9f77ae647,9/19(金) 6:00
2025-09-19,19:08,TTL,総合,40,オリコン,相川七瀬、離婚を報告「私たちは夫婦を卒業し、家族は新しい形で仲良く元気に暮らしています」【報告全文】,108,https://news.yahoo.co.jp/articles/4a6f2251553a8a3abf236e712618b5e0c0b8986a,9/19(金) 13:31
