scrp_date,scrp_time,genre_en,genre_jp,rank,media_jp,title,comment,link,date_original
2025-09-19,20:06,domestic,国内,1,TBS NEWS DIG Powered by JNN,【独自】小泉進次郎農水大臣「2030年度までに平均賃金100万円増」 自民党総裁選の公約が判明,1008,https://news.yahoo.co.jp/articles/ec2dd1cc52e52fc023574125755a8a1145c12eea,9/19(金) 11:19
2025-09-19,20:06,domestic,国内,2,産経新聞,「顔が濃い方」「逆に白い方」自民・高市氏、総裁選出馬記者会見で司会者の発言に2度謝罪,847,https://news.yahoo.co.jp/articles/1bbe247fc4e4728e59a1d81d95b4e94a2c651dea,9/19(金) 17:01
2025-09-19,20:06,domestic,国内,3,FNNプライムオンライン（フジテレビ系）,市役所職員100人弱が通勤手当不正受給か…1671万円返金　バス通勤手当受け取り徒歩通勤も　東京・八王子市,602,https://news.yahoo.co.jp/articles/df5f248f3d95b6696eba861aac03ca59e461b39d,9/19(金) 15:33
2025-09-19,20:06,domestic,国内,4,TBS NEWS DIG Powered by JNN,【速報】高市前経済安全保障担当大臣が自民党総裁選の政策を発表 「給付付き税額控除」の制度設計に着手することなど掲げる,423,https://news.yahoo.co.jp/articles/123b26d695ebdcad207c1bd574142048771b1cdb,9/19(金) 15:04
2025-09-19,20:06,domestic,国内,5,共同通信,時速125キロで逆走、懲役9年　飲酒死亡事故の中国籍19歳,376,https://news.yahoo.co.jp/articles/eaa6d9b5207455fc290cb806751bfe37641ff7cb,9/19(金) 11:28
2025-09-19,20:06,domestic,国内,6,読売新聞オンライン,首相指名選挙、立憲民主「野党一本化」模索…日本維新・国民民主は連携に消極姿勢,252,https://news.yahoo.co.jp/articles/5ff3b98baf01bd5cfd5c9e5b4a36d845b0d2430c,9/19(金) 8:18
2025-09-19,20:06,domestic,国内,7,日刊スポーツ,首相報酬4000万円「低い」自民党総裁選候補が指摘　真意説明「上場企業の社長は億もらって」,248,https://news.yahoo.co.jp/articles/a33ac31f6972d64494c09781430925e66c873a31,9/19(金) 8:10
2025-09-19,20:06,domestic,国内,8,日テレNEWS NNN,林家ぺーさんとパー子さんが住むマンションで火事　パー子さんが煙吸い搬送、ほか2人ケガ…いずれも軽傷,219,https://news.yahoo.co.jp/articles/5a8969d8ae39d26d2ae40b5264e4d7e7b2704b01,9/19(金) 15:45
2025-09-19,20:06,domestic,国内,9,FNNプライムオンライン（フジテレビ系）,立憲・野田代表　就任1年を前に党勢拡大へ決意「我々が与党になれるよう、まずは比較第一党」,183,https://news.yahoo.co.jp/articles/8e71ed7676821d6d0e12198bdf3cdf6e9b2c4942,9/19(金) 15:24
2025-09-19,20:06,domestic,国内,10,女性自身,「教育と指導で終わりですか？」参政党・初鹿野議員の“歳費返納撤回”問題　神谷代表の謝罪にジャーナリストが“20文字”で苦言,168,https://news.yahoo.co.jp/articles/82e41190f51a5a67ac81ab83ebaaa74b2d4f39b3,9/19(金) 17:55
2025-09-19,20:06,domestic,国内,11,日刊スポーツ,高市早苗氏が「経歴詐称疑惑」問う不規則質問に「私の名誉にかかわる」と全否定　総裁選政策会見,166,https://news.yahoo.co.jp/articles/b056558de4728c3d48e8cb991fb590d0a98defde,9/19(金) 17:44
2025-09-19,20:06,domestic,国内,12,弁護士ドットコムニュース,スシローに続き「はま寿司」でも学生バイトら労組結成　団交で「賃金計算15分→1分単位化」実現へ,163,https://news.yahoo.co.jp/articles/66b61589b2de3657e8b6200ebd26945556b92ae3,9/19(金) 14:07
2025-09-19,20:06,domestic,国内,13,プレジデントオンライン,"やっぱり「愛子天皇」しかない…専門家が懸念「学究優先の紀子妃流""帝王学""で次代天皇はつとまるのか」",157,https://news.yahoo.co.jp/articles/c6b345de4d6ace94395225d1985b7bbc34020396,9/19(金) 18:16
2025-09-19,20:06,domestic,国内,14,毎日新聞,回収率減、擦り減る調査員のメンタル　岐路を迎える国勢調査,145,https://news.yahoo.co.jp/articles/e18c1e78beb929468218bc91d848abc7ff23c0d5,9/19(金) 6:30
2025-09-19,20:06,domestic,国内,15,日刊スポーツ,へずまりゅう氏緊急報告「これ以上は身の危険を感じるので…本当に危険です」,139,https://news.yahoo.co.jp/articles/f303a678beca400698c8283cc686e92007f55f98,9/19(金) 14:16
2025-09-19,20:06,domestic,国内,16,プレジデントオンライン,コメが「5キロ2000円台」に戻ることはもうない…生産量が上がっても値段が下がらない事態を招いた農水省の過ち,130,https://news.yahoo.co.jp/articles/1a152ece5c6e6616beb4d0e16c7a71b1d323f3dc,9/19(金) 16:16
2025-09-19,20:06,domestic,国内,17,TBS NEWS DIG Powered by JNN,黄川田仁志衆院議員　高市氏の総裁選出馬会見での自身の発言を陳謝,123,https://news.yahoo.co.jp/articles/82eb1e1f13dcbddf1fb31bd61d3d81f89323cdef,9/19(金) 19:12
2025-09-19,20:06,domestic,国内,18,FNNプライムオンライン（フジテレビ系）,【続報】林家パー子さん自宅火災で煙吸い病院搬送…3人ケガも命に別状なし「仏壇に火をつけようと…」パー子さん証言,121,https://news.yahoo.co.jp/articles/cfb24a27236d3626f2da8c04cae7bc5cb0e876d2,9/19(金) 16:33
2025-09-19,20:06,domestic,国内,19,プレジデントオンライン,悠仁さまのために「愛子天皇」は実現すべきだ…19歳の成年皇族の門出に影を落とす母・紀子さまの気になる行動,113,https://news.yahoo.co.jp/articles/2b9a697c1d7402101a15654644c7e3a4e294cbf3,9/19(金) 16:16
2025-09-19,20:06,domestic,国内,20,弁護士JPニュース,はま寿司「1分遅刻で14分間分の賃金切り捨て」問題が改善へ…学生アルバイトらが新労組結成で会見 団体交渉で一部是正勝ち取る,111,https://news.yahoo.co.jp/articles/bf103fa2b7449618f4a28fbb28fe6c3486549b46,9/19(金) 18:31
2025-09-19,20:06,domestic,国内,21,デイリー新潮,宮内庁内から「ポニーテールはどうする」の声　「紀子さま」もついに触れた「小室弁護士一家の帰国」,111,https://news.yahoo.co.jp/articles/a5aeff558d8418918908cf37754155e00956083e,9/19(金) 6:00
2025-09-19,20:06,domestic,国内,22,FNNプライムオンライン（フジテレビ系）,中谷防衛相が沖縄での抗議活動に異例の呼びかけ「抗議は良識を持ってやってほしい」妨害行為で訓練の変更も,109,https://news.yahoo.co.jp/articles/f84143d697e688d99f94351001e38cef0e6aae78,9/19(金) 11:48
2025-09-19,20:06,domestic,国内,23,スポニチアネックス,維新・吉村洋文代表“自民党新総裁にふさわしい人”聞かれ真っ先に挙げた2人「改革派だと思ってる」,109,https://news.yahoo.co.jp/articles/2f55bb375eae9e5697e36e76a397ba06acf63a0e,9/19(金) 17:57
2025-09-19,20:06,domestic,国内,24,デイリースポーツ,田崎史郎氏　麻生太郎氏が推す総裁の名前「ギリギリまで引っ張って…」　進次郞氏へ「火中の栗は拾わねえな」と発言の真意も解説,107,https://news.yahoo.co.jp/articles/380bb1b51ba46e0bfd8b38eef6a1896dcb0f6577,9/19(金) 13:59
2025-09-19,20:06,domestic,国内,25,朝日新聞,橋の死亡事故、管理公社「モニター見逃した」駐停車禁止に車27分,102,https://news.yahoo.co.jp/articles/0fa7c50f50eec8fd977b568880b2bde9f77ae647,9/19(金) 6:00
2025-09-19,20:06,domestic,国内,26,AERA DIGITAL,女性に抱きつき逮捕され、大手メディアを懲戒解雇に　困難極めた再就職と「前科者の社会復帰をどう支えるか」の重い問い,102,https://news.yahoo.co.jp/articles/251f0ed05a92f6c929f19848a4c69ef6c69aae84,9/19(金) 7:31
2025-09-19,20:06,domestic,国内,27,共同通信,消費税減税は即効性ないと高市氏,91,https://news.yahoo.co.jp/articles/150bb529402017bf6eb33f162d6f30bc63657682,9/19(金) 15:36
2025-09-19,20:06,domestic,国内,28,FNNプライムオンライン（フジテレビ系）,林家ペー・パー子さん自宅マンションで火災「仏壇に火をつけようと…」パー子さん証言　逃げ遅れなし,88,https://news.yahoo.co.jp/articles/b5575ec423c86247cf1b066515f18c0d89b15dbb,9/19(金) 15:21
2025-09-19,20:06,domestic,国内,29,ABEMA TIMES,「高市、高い位置に日本を」「政府専用機を縛っているのは誰？」「男系の皇統をお守りするために皇室典範を改正」高市早苗氏が“笑顔で”出馬会見,80,https://news.yahoo.co.jp/articles/90e1000f07a90a7169006ed007966222327dbbf4,9/19(金) 16:33
2025-09-19,20:06,domestic,国内,30,共同通信,高市氏、連立拡大を検討　税額控除、外国人政策を強化,77,https://news.yahoo.co.jp/articles/76faf6ef147bf4527c57ceeb906042d4005d98d9,9/19(金) 18:18
2025-09-19,20:06,domestic,国内,31,スポニチアネックス,高市早苗氏「私の名誉にかかわります」　出馬会見で不規則発言の記者へきっぱり「弱みなど握られていない」,76,https://news.yahoo.co.jp/articles/b896a074a703ae14f959d526a5075d321c31bfe8,9/19(金) 16:23
2025-09-19,20:06,domestic,国内,32,日刊スポーツ,ひろゆき氏、自民党が減税しないワケを解説「政治家は自分の支持している基盤に対し…」,70,https://news.yahoo.co.jp/articles/c0f9e120eb010df257bf138bbfdcb57daeb4eddf,9/19(金) 17:52
2025-09-19,20:06,domestic,国内,33,J-CASTニュース,口頭注意のへずまりゅう市議、今度は「政務活動費使いません」　課題指摘され「勉強になります」,70,https://news.yahoo.co.jp/articles/58139ee722d98e1072a8b30fdc9415d99aeac512,9/19(金) 10:48
2025-09-19,20:06,domestic,国内,34,FNNプライムオンライン,宮城・村井知事が「土葬墓地」検討を撤回　外国人労働者と多文化共生の行方は,66,https://news.yahoo.co.jp/articles/5ccae48011f30b52624109a0863385653c29e4a7,9/19(金) 14:12
2025-09-19,20:06,domestic,国内,35,プレジデントオンライン,小泉進次郎でも林芳正でもない…永田町通の気鋭の国際政治学者「トランプ、習近平と戦える唯一の新総裁名」,65,https://news.yahoo.co.jp/articles/c7d8e242b355f478493b92cb618644c1b13c21dc,9/19(金) 11:16
2025-09-19,20:06,domestic,国内,36,共同通信,和牛にシマウマ模様で虫よけ効果　日本人連続のイグ・ノーベル賞,63,https://news.yahoo.co.jp/articles/5eb587f8b0ffe21e10f68cf4a3ed8c8b2502ca16,9/19(金) 7:00
2025-09-19,20:06,domestic,国内,37,デイリースポーツ,【ポスト石破】金子恵美氏　小泉進次郎陣営が凄い事態と　支持に入りそうな超大物たちの名前「麻生派の人が」「岸田さんも」旧派閥で巨大化と,58,https://news.yahoo.co.jp/articles/3c5fcf4ce3e4afaee57c957fb2ce3a10917bde05,9/18(木) 22:15
2025-09-19,20:06,domestic,国内,38,FNNプライムオンライン（フジテレビ系）,維新が「副首都」指定要件を公表　吉村代表「副首都ぐらいで連立するのかという議論は心外」,58,https://news.yahoo.co.jp/articles/64d4ae252459fb716dddf5d9ca347180fa1aca6b,9/19(金) 17:03
2025-09-19,20:06,domestic,国内,39,朝日新聞,赤字ローカル線、芸備線めぐるJR広島支社長の発言に沿線自治体反発,57,https://news.yahoo.co.jp/articles/44343c6395b90aee8d14c837078b182617917507,9/19(金) 18:30
2025-09-19,20:06,domestic,国内,40,弁護士JPニュース,生活保護基準引き下げ、名古屋高裁も「違法」それでも解決への見通し立たず…原告側は国への不信感強める,55,https://news.yahoo.co.jp/articles/b676fc66294bfe10c8f3cc986e739de9aafad406,9/19(金) 19:04
