scrp_date,scrp_time,genre_en,genre_jp,rank,media_jp,title,comment,link,date_original
2024-08-17,15:07,domestic,国内,1,テレビ朝日系（ANN）,自民党総裁選「世代交代」求める動き…“２人の４０代議員”目指すものは？,402,https://news.yahoo.co.jp/articles/97c7e42a75cb3293a06a14b2877dd4851f553f59,8/17(土) 11:32
2024-08-17,15:07,domestic,国内,2,時事通信,「勝ち馬」探し、麻生氏苦慮　河野・茂木氏が支援期待　自民党総裁選,306,https://news.yahoo.co.jp/articles/64e7fa8e8bc71c924f28cf3f2aa7ecff416b9341,8/17(土) 4:33
2024-08-17,15:07,domestic,国内,3,時事通信,週当たりの授業数、削減を　小中教員の負担減、事例周知へ　文科省,280,https://news.yahoo.co.jp/articles/ff4bd0f11d5d21e333f14eb38c7276dc03d292e7,8/17(土) 7:09
2024-08-17,15:07,domestic,国内,4,中日スポーツ,倉田真由美さん、「地震予知できないのに、意味ないどころか社会や経済を止める動きが出て損失だけが残る」南海トラフ臨時情報に私見,270,https://news.yahoo.co.jp/articles/e460c0e0d3b5626b7e674c54b37ce1e2caaed709,8/17(土) 8:00
2024-08-17,15:07,domestic,国内,5,時事通信,小林氏、19日に出馬表明　林官房長官、立候補の意向　自民総裁選、上川外相も検討,241,https://news.yahoo.co.jp/articles/dd1bfafcce7f91748ba3320ed37d0b64cd9b06a1,8/17(土) 4:39
2024-08-17,15:07,domestic,国内,6,デイリースポーツ,石丸伸二氏は「中身ちょっと言われると切り返せない」中野信子氏が辛らつ分析「仮面かぶって演技　結構ツラい」山口真由氏は心配,230,https://news.yahoo.co.jp/articles/8b0c989262c15b67d5d69d31e31ef461e1d1ee9c,8/17(土) 10:09
2024-08-17,15:07,domestic,国内,7,読売新聞オンライン,東北道の逆走事故、８１歳男「オートバイとぶつかった」…ひき逃げ事件として捜査,213,https://news.yahoo.co.jp/articles/329f1b1d09b3f2fccd9b4ce56758cb8df0b137c1,8/16(金) 21:54
2024-08-17,15:07,domestic,国内,8,産経新聞,＜独自＞自民総裁選、小林鷹之氏が１９日にも出馬表明　４９歳　中堅・若手から待望論,204,https://news.yahoo.co.jp/articles/9c424117b04d0f7ee36e33139ffecfe18f9edfb4,8/16(金) 20:55
2024-08-17,15:07,domestic,国内,9,女性自身,次の自民党総裁になってほしい議員ランキング！3位小泉進次郎、2位高市早苗を抑えた1位は？,193,https://news.yahoo.co.jp/articles/2346f335fa58d968956c40e0fb343cd69a1be12e,8/17(土) 6:00
2024-08-17,15:07,domestic,国内,10,デイリースポーツ,猪瀬直樹氏　新幹線の計画運休に疑問「決定早すぎ」ＪＲ批判「独占企業で胡座かいてる」もネット「結果論乙」「早くないと意味ない」,155,https://news.yahoo.co.jp/articles/e6f83272fe09b0077feee2370944085747fcf329,8/17(土) 0:19
2024-08-17,15:07,domestic,国内,11,共同通信,防衛費初の8兆円台要求へ　25年度予算、過去最大,144,https://news.yahoo.co.jp/articles/4538f74bba4d8da5ab6ebd24a5d81be1c720aed1,8/17(土) 6:04
2024-08-17,15:07,domestic,国内,12,デイリー新潮,「私はいたって元気です！」県議が驚愕した斎藤兵庫県知事の無神経発言　最側近の総務部長を更迭　9月議会もやる気満々,104,https://news.yahoo.co.jp/articles/184ca840ebf78516c76b342fee09b276cdac5974,8/17(土) 11:05
2024-08-17,15:07,domestic,国内,13,毎日新聞,加藤勝信元官房長官「総裁選に向けて動きたい」　出馬検討を表明,101,https://news.yahoo.co.jp/articles/91fe008eafc92e158f0fad950d2d7b9a88ccf25d,8/16(金) 20:21
2024-08-17,15:07,domestic,国内,14,読売新聞オンライン,シャインマスカット１９００房「一瞬でなくなった」…被害額１４０万円、山梨県警が窃盗事件で捜査,99,https://news.yahoo.co.jp/articles/2adc987089168c434286105908dd7583ed2ec860,8/16(金) 16:17
2024-08-17,15:07,domestic,国内,15,共同通信,中国、独自の海水採取を要求　原発処理水放出1年、政府間協議,89,https://news.yahoo.co.jp/articles/2cab89d2e0e02f6cb84a59aba0a77c233042564e,8/16(金) 16:49
2024-08-17,15:07,domestic,国内,16,tenki.jp,九州～関東は猛暑予想　関東内陸は40℃前後の危険な暑さに　熱中症厳重警戒,86,https://news.yahoo.co.jp/articles/80e546e25450bd80904bb240feb1820f10b49c2a,8/17(土) 11:34
2024-08-17,15:07,domestic,国内,17,現代ビジネス,フリーアナの”体臭騒動”は異常すぎる…そもそもズレている日本人の「体臭への意識」,72,https://news.yahoo.co.jp/articles/228405337139e5a80201aa12929d2e85ba340076,8/17(土) 8:05
2024-08-17,15:07,domestic,国内,18,テレビ朝日系（ANN）,東京・港区赤坂の飲食店で赤痢菌による食中毒　都内の発生は2000年統計開始以来初,71,https://news.yahoo.co.jp/articles/b43ed9781442b64f8b1b221dbd909d9f134844be,8/16(金) 23:59
2024-08-17,15:07,domestic,国内,19,FNNプライムオンライン（フジテレビ系）,台風7号の影響でさらに混雑…お盆休みのUターンラッシュがピークに　東海道新幹線の上りは午前中ほぼ満席　空の便は90パーセント近い予約率,67,https://news.yahoo.co.jp/articles/ee5760cfee312417d104cab48a67ee701704b785,8/17(土) 12:22
2024-08-17,15:07,domestic,国内,20,FNNプライムオンライン（フジテレビ系）,関東の東の海上自転車並みの速度で進む…台風7号日本から離れつつも東北では大雨・暴風に警戒,62,https://news.yahoo.co.jp/articles/cdea0555e5df40a1403569fdaa761891dcae90ad,8/17(土) 7:49
2024-08-17,15:07,domestic,国内,21,tenki.jp,非常に強い台風7号　今夜にかけ関東に最接近　沿岸部中心に暴風・大雨・高波に警戒,57,https://news.yahoo.co.jp/articles/5604e71c9a718d326c827c96917d2f4c464a166c,8/16(金) 16:19
2024-08-17,15:07,domestic,国内,22,現代ビジネス,21歳ジョッキーが前代未聞「競馬場に車で侵入」事件後に急逝…JRAが絶対に明かさない「同乗者」の真相,57,https://news.yahoo.co.jp/articles/26e1db322fce2f621b18211d45e6328a8745c08b,8/17(土) 9:04
2024-08-17,15:07,domestic,国内,23,デイリー新潮,佳子さまの“お相手”として注目される「名門華族」子息のプロフィール　「1歳年上でメガバンク勤務」【スクープその後】,56,https://news.yahoo.co.jp/articles/ae2bdaece11a5ef9df2fcc2ef47885dd6fb3c27d,8/17(土) 6:06
2024-08-17,15:07,domestic,国内,24,tenki.jp,今日17日　台風7号は次第に東へ　関東や東北の太平洋側　影響いつまで,55,https://news.yahoo.co.jp/articles/61630b6d26eab63df9e07632d816035b6858b87a,8/17(土) 6:16
2024-08-17,15:07,domestic,国内,25,tenki.jp,台風7号　明日未明にかけてさらに発達　関東・東北は警戒いつまで　夜間の停電に備え,55,https://news.yahoo.co.jp/articles/5bd609ac9f9011d3a6875294c6682a678f4b88b6,8/16(金) 18:21
2024-08-17,15:07,domestic,国内,26,中日スポーツ,杉村太蔵さん、総裁選、期待の集まる石破茂氏に「推薦人の20人『あなたを総理にしたい』って人が集まっていない、これは…」とチクリ,51,https://news.yahoo.co.jp/articles/70ce10cda4f77aa6e18810cca43d12a43a9193e7,8/17(土) 12:54
2024-08-17,15:07,domestic,国内,27,FRIDAY,【プレイバック’14】「身体の中を見たかった」同級生を殺害した女子高生 凶行直前の〝シグナル〟,50,https://news.yahoo.co.jp/articles/7f44c978959725734dc1c6b18b2e07f7f2ba08d6,8/17(土) 14:00
2024-08-17,15:07,domestic,国内,28,読売新聞オンライン,台風７号、強風で閉まったドアで中指切断など負傷者も…１７日は「フェーン現象」で猛暑に,48,https://news.yahoo.co.jp/articles/564fcd8ab6a88d1253cf71ee626c0585df7b7b9b,8/16(金) 20:59
2024-08-17,15:07,domestic,国内,29,ダイヤモンド・オンライン,廃校での女性の制服撮影会は「性的だからアウト」？公共施設の活用が物議を醸しやすい根深い事情,46,https://news.yahoo.co.jp/articles/865fab1768b7ec7e90514072e8e162bfd2728589,8/17(土) 8:02
2024-08-17,15:07,domestic,国内,30,みんかぶマガジン,島根・丸山知事「カイロ大首席卒業の小池都知事に分からないわけがない」人口問題巡り小池百合子VS全国知事会の世紀のバトルが勃発,39,https://news.yahoo.co.jp/articles/5ac7907d1e4db9bda8896828475202d76b59a323,8/17(土) 9:10
2024-08-17,15:07,domestic,国内,31,ダイヤモンド・オンライン,「南海トラフ巨大地震」の恐怖を煽る政府、絶対に“口に出せない”本当の狙いとは？,36,https://news.yahoo.co.jp/articles/9c97f115307c5df13724b1a55c594dda420ce9fe,8/17(土) 6:16
2024-08-17,15:07,domestic,国内,32,集英社オンライン,〈セクシー首相誕生か〉小泉進次郎に自民党内から総裁選出馬への期待の声が続々。菅義偉前首相、さらにあの大物がバックアップなら一躍、総裁選の本命にも？,36,https://news.yahoo.co.jp/articles/455631804fa11a8e1e60eef946fe5526dbb94577,8/17(土) 8:02
2024-08-17,15:07,domestic,国内,33,日テレNEWS NNN,東北道で逆走の車と大型バイクが衝突　車走り去るも約1時間後に発見　警察が81歳男性から事情聞く,35,https://news.yahoo.co.jp/articles/ccbbdf4445d79cbde307f2d6a228f61b00250c9d,8/17(土) 4:01
2024-08-17,15:07,domestic,国内,34,ABEMA TIMES,“路上ライブ”は騒音？心地よいBGM？是非を考える 賛成派「性癖のようなもの。誰もいなくてもやる」 反対派「独特な空気感が苦手。SNS告知は『犯罪予告』だ」,35,https://news.yahoo.co.jp/articles/ee76909c0857122e3ec9df4b5351524d7cbbe0c5,8/17(土) 13:45
2024-08-17,15:07,domestic,国内,35,日刊スポーツ,「首相は怒って…」岩田明子氏、岸田首相に総裁選不出馬を電撃表明させる契機となった人物に言及,34,https://news.yahoo.co.jp/articles/3ad22914ccffa14c28efc1418165dee2f0d7afa6,8/17(土) 11:19
2024-08-17,15:07,domestic,国内,36,現代ビジネス,電撃引退本当のヤバすぎる理由…高笑いする岸田文雄がキングメーカーとして「麻生の座を取りにいく」で議員は戦々恐々,33,https://news.yahoo.co.jp/articles/34a14fdcd1f7b00b0be304b922e658a036719c49,8/16(金) 18:10
2024-08-17,15:07,domestic,国内,37,テレビ朝日系（ANN）,神奈川・茨城などで4人けが　台風7号による強風被害,30,https://news.yahoo.co.jp/articles/61e99824c660c5a866018b7fea8edf6fba5dc5c3,8/17(土) 12:16
2024-08-17,15:07,domestic,国内,38,東洋経済オンライン,「またここや…」なぜか何度も自死が起きる“恐怖のマンション”　月130軒の家を片付ける業者が語った“奇妙なゴミ屋敷”,30,https://news.yahoo.co.jp/articles/6b76aa4a6e091c29ec177d913b30d58edc7c814c,8/17(土) 10:02
2024-08-17,15:07,domestic,国内,39,ABEMA TIMES,エルメスパトロール？高級ブランドに魅せられる人たち「担当のいない店で『日本に在庫はない』と言われたが担当のいる店では『ある』と…」マウントと批判の声も？,27,https://news.yahoo.co.jp/articles/c32890151df39791b02c496b35f3c39cb41e65ff,8/17(土) 11:01
2024-08-17,15:07,domestic,国内,40,読売新聞オンライン,保護した男性を警察署に連れて行く途中、ミニパトカー内で容体が急変…搬送先の病院で死亡,25,https://news.yahoo.co.jp/articles/a5e38766ab892fc7c35057f09dfef9991f1387bb,8/17(土) 13:07
