scrp_date,scrp_time,genre_en,genre_jp,rank,media_jp,title,comment,link,date_original
2024-06-28,15:08,sports,スポーツ,1,Full-Count,大谷翔平の“ライバル2人”に緊急事態　試合終了とともに負傷…フィリーズ悲鳴,141,https://news.yahoo.co.jp/articles/3f55ce4272fe5fe2267bdc1c1188d1ab42afdc64,6/28(金) 10:51
2024-06-28,15:08,sports,スポーツ,2,デイリースポーツ,広島、助っ人・レイノルズとの契約解除　今季加入も左肩手術で今季復帰見込まれず　１軍出場わずか２試合,105,https://news.yahoo.co.jp/articles/593078c6e8aa429450c7d4576cdd1ec72bfc3ecd,6/28(金) 13:55
2024-06-28,15:08,sports,スポーツ,3,デイリースポーツ,池添と富田が粗暴な行為で騎乗停止に　高圧的絡みスマホ画面割られ口論に　池添は開催日４日間、富田は２日間,100,https://news.yahoo.co.jp/articles/e6d4ec67f7c840a835e8d89874c310c4b487fdef,6/28(金) 14:02
2024-06-28,15:08,sports,スポーツ,4,Full-Count,広島、レイノルズと契約解除　球団発表…左肩手術で今季絶望、出場わずか2試合で無安打,86,https://news.yahoo.co.jp/articles/e3701caa8a47d7f70dc50ded336c116b697d7cdf,6/28(金) 13:32
2024-06-28,15:08,sports,スポーツ,5,スポニチアネックス,【NBA】日本代表・富永啓生　ドラフト指名されず…パリ五輪からNBA入り目指す,81,https://news.yahoo.co.jp/articles/fce9021bcccd2367dd5fe7cb4a92e06aa033547f,6/28(金) 7:27
2024-06-28,15:08,sports,スポーツ,6,日刊スポーツ,池添謙一、富田暁が騎乗停止　互いに粗暴な行為に及んだため／JRA発表,78,https://news.yahoo.co.jp/articles/07efc370c15b6ff249d1e80aac52a717263cf5b5,6/28(金) 14:18
2024-06-28,15:08,sports,スポーツ,7,J-CASTニュース,韓国は笑い、日本は泣いた...サッカーW杯アジア最終予選　「死の組」回避で本選出場に「自信満々」地元メディア,77,https://news.yahoo.co.jp/articles/2da7c84aa210bde32a3305dd26272a1d7af43875,6/28(金) 12:15
2024-06-28,15:08,sports,スポーツ,8,Full-Count,進化する阪神21歳、“チーム4冠”の躍動　不振の打線を灯す光「もう外せないでしょ」,74,https://news.yahoo.co.jp/articles/73a0a7efae92fa7fbed740b7e47c37e645503569,6/28(金) 11:35
2024-06-28,15:08,sports,スポーツ,9,FRIDAY,「頼れる壁がなくなった」…中田翔の二軍降格で中日が直面する「内部崩壊＆令和の米騒動」再来の危機,71,https://news.yahoo.co.jp/articles/aed5081d511b9446b09dd42d9291c8a1374f4ba4,6/28(金) 9:00
2024-06-28,15:08,sports,スポーツ,10,FOOTBALL ZONE,日本が「死の組に向かった」　W杯最終予選グループ分けで韓国楽観ムード「B組はまだマシ」,67,https://news.yahoo.co.jp/articles/b29ad1fc8532c0be77221b8aaa7c82393ecacb7b,6/28(金) 9:30
2024-06-28,15:08,sports,スポーツ,11,フットボールチャンネル,「韓国は笑い日本と中国は泣く」韓国紙は中東だらけで楽観視？サッカー日本代表のC組と比較し「最高としか言えない」,65,https://news.yahoo.co.jp/articles/0d11030988583485102e8033a4c4d3810b57196e,6/28(金) 8:37
2024-06-28,15:08,sports,スポーツ,12,FRIDAY,古巣・西武に「覇気が感じられない」と喝！清原和博 球場入りする姿から溢れ出す「ハンパないオーラ」,61,https://news.yahoo.co.jp/articles/fcde8478a772ba4d267976f4871a55efc44dc581,6/28(金) 9:00
2024-06-28,15:08,sports,スポーツ,13,サンケイスポーツ,阪神・野口恭佑が初昇格へ　ノイジーが２度目の抹消,61,https://news.yahoo.co.jp/articles/2c40746267e9bbf514c387a59a3ac53c49e05aec,6/28(金) 7:30
2024-06-28,15:08,sports,スポーツ,14,中日スポーツ,中日・木下拓哉が1軍に合流、2軍では6試合に出場、4割2分9厘、8打点、1本塁打と復調気配を見せる,61,https://news.yahoo.co.jp/articles/c2353f9f41edc310e1b82e7be0540a45fcd590b8,6/28(金) 13:12
2024-06-28,15:08,sports,スポーツ,15,週刊ベースボールONLINE,廣岡達朗コラム「負け続ける西武が腹立たしい　佐々木朗希は次の登板まで何日休むのか」,59,https://news.yahoo.co.jp/articles/a21d761b12d3e240ae3d0f4b3f09c59ab4e2eb5e,6/28(金) 11:00
2024-06-28,15:08,sports,スポーツ,16,デイリー新潮,佐々木朗希は今オフ、ポスティングを強行しても満足な交渉ができる状況にない…体力問題だけではないFA市場の事情,58,https://news.yahoo.co.jp/articles/71823af8b5bfca172396aa0355bab23a680b2f82,6/28(金) 6:11
2024-06-28,15:08,sports,スポーツ,17,スポニチアネックス,池添謙一と富田暁　「互いに粗暴な行為」で今週から騎乗停止に　池添は開催4日間、富田は開催2日間,52,https://news.yahoo.co.jp/articles/06d2c04509a7f9061054b159df63b36a01d053ac,6/28(金) 14:03
2024-06-28,15:08,sports,スポーツ,18,日刊ゲンダイDIGITAL,女子プロの所属契約にまで協会が口出し…昨年末に全会員へ送り付けた文書の衝撃の中身【女子ツアーの裏で蠢く火種と禍根】#7,51,https://news.yahoo.co.jp/articles/a64c94a7fe4d827d51dd98b06449e8a7fb2eede8,6/28(金) 8:52
2024-06-28,15:08,sports,スポーツ,19,日刊ゲンダイDIGITAL,どうするドジャース？ 佐々木朗希の獲得に暗雲…他29球団は怒り心頭、さらに膨らむ恨み憎しみ,51,https://news.yahoo.co.jp/articles/c069f279f388227fb5eed4886cbc1caa71e656ca,6/28(金) 11:50
2024-06-28,15:08,sports,スポーツ,20,サンケイスポーツ,池添謙一、富田暁騎手が騎乗停止　函館競馬場の調整ルーム内で互いに粗暴行為,48,https://news.yahoo.co.jp/articles/ce28905c40b71c64d222b93daa4c96f322bdcc71,6/28(金) 14:25
2024-06-28,15:08,sports,スポーツ,21,スポニチアネックス,「何してんのよ…」「悲しくなる」池添謙一と富田暁「互いに粗暴な行為」で騎乗停止に競馬ファンもショック,47,https://news.yahoo.co.jp/articles/1c5a217cf2545ed370c877d6d72e8441a3f9b4de,6/28(金) 14:44
2024-06-28,15:08,sports,スポーツ,22,Full-Count,米白熱…大谷翔平vsジャッジ“論争”　偉業に期待、識者「可能性が高いのはショウヘイ」,42,https://news.yahoo.co.jp/articles/65f49c9c4f44d702d8e728040ec4fbf9e994b356,6/28(金) 14:08
2024-06-28,15:08,sports,スポーツ,23,デイリースポーツ,阪神・野口が初の１軍昇格へ　ノイジーが今季２度目の降格,42,https://news.yahoo.co.jp/articles/aaf172467ccc82b1868bbfd5d914366268f60965,6/28(金) 9:51
2024-06-28,15:08,sports,スポーツ,24,フットボールチャンネル,「韓国が羨ましい」韓国メディアがサッカー日本代表のW杯最終予選抽選結果に有頂天「組分けも実力のうち」「B組は最高の組」,42,https://news.yahoo.co.jp/articles/dc8b48b12e28c1d33cf1f20293551ee170c06437,6/28(金) 9:43
2024-06-28,15:08,sports,スポーツ,25,FOOTBALL ZONE,日本は「死の組」「最も厳しい」　韓国見解、母国のW杯最終予選は“楽観”「最高の組み合わせ」,41,https://news.yahoo.co.jp/articles/d5d77d662987b7e11a496b212059fff9ecf74ab8,6/28(金) 12:01
2024-06-28,15:08,sports,スポーツ,26,ベースボールキング,混戦セ・リーグ！山﨑武司氏「飛び抜けているチームがない」、「大型連勝してくると…」,39,https://news.yahoo.co.jp/articles/862a4ce57412bdd7a91a4e9dc13e52ed1ab0a298,6/28(金) 10:00
2024-06-28,15:08,sports,スポーツ,27,Full-Count,27歳内野手がNPB球団と契約か　米報道…3Aでリーグトップの打率.335、2年連続20発,39,https://news.yahoo.co.jp/articles/ecba6e0477dae63870d34b6c262833705568a094,6/28(金) 6:44
2024-06-28,15:08,sports,スポーツ,28,SOCCER DIGEST Web,森保ジャパン、W杯最終予選の相手が決定！ 豪州、サウジ、バーレーン、中国、インドネシアと対戦！,38,https://news.yahoo.co.jp/articles/f0cbea43ce460116fcd3cbcc6cad3e90951041f3,6/27(木) 16:34
2024-06-28,15:08,sports,スポーツ,29,東スポWEB,【陸上】ドルーリー朱瑛里　勇気ある告白で盗撮行為減少も法制化を望む声「まだ性的な画が…」,37,https://news.yahoo.co.jp/articles/151aebcb3bb08721cbd6676a998808e6fac22780,6/28(金) 5:16
2024-06-28,15:08,sports,スポーツ,30,NEWSポストセブン,《距離感》安藤美姫と16歳教え子の“手つなぎ”報道に「顧問弁護士と対応を審議中」とフィギュアインストラクター協会が回答,37,https://news.yahoo.co.jp/articles/7ecf4065080c5ee1c1d50f32f6681df69bb9e5bc,6/27(木) 17:45
2024-06-28,15:08,sports,スポーツ,31,スポーツ報知,【巨人】 トレード加入の若林楽人が１軍合流　俊足とパンチ力魅力の２６歳,36,https://news.yahoo.co.jp/articles/e73f4b64239222e7f259cbf579c24ed80c8ff308,6/28(金) 14:23
2024-06-28,15:08,sports,スポーツ,32,デイリースポーツ,巨人・井上が４回３失点で降板　佐野に勝ち越し２ラン被弾　阿部監督の表情も険しく,36,https://news.yahoo.co.jp/articles/e3a7e2dbab629585013e35db3648feffd3cc7ab9,6/27(木) 19:33
2024-06-28,15:08,sports,スポーツ,33,スポーツ報知,【阪神】大山悠輔、初回１死一、三塁の好機で打席に立つも併殺打　クリーンアップに快音出ず,35,https://news.yahoo.co.jp/articles/82580f0d1539a00e40e945b6ec7c6073002d3c56,6/27(木) 18:34
2024-06-28,15:08,sports,スポーツ,34,SOCCER DIGEST Web,「組分けも実力のうち」「日本は韓国が羨ましい」W杯最終予選の抽選結果に韓国メディアは意気揚々！豪州＆サウジと同組の森保Jは「快適でない」,35,https://news.yahoo.co.jp/articles/073df6ec2835ced6e8185dd95eb7ab4d0821a6d5,6/28(金) 6:39
2024-06-28,15:08,sports,スポーツ,35,東スポWEB,【Ｆ１】ストロール長期契約で〝アストンマーティン・ホンダ〟不安募る「茶番劇を容認するのか」,34,https://news.yahoo.co.jp/articles/4d3b6ba9d5356f0d8e9dfb52b01312c8437e0d73,6/28(金) 5:16
2024-06-28,15:08,sports,スポーツ,36,CoCoKARAnext,練習は常に個別で、ジャンプも禁止！ 220cmの中国バスケの超新星は全てが規格外「他の選手が怪我をする恐れがある」,34,https://news.yahoo.co.jp/articles/8ab3f12434bfba1c99d4a1b4f5ebcb8f8f8e966a,6/28(金) 11:02
2024-06-28,15:08,sports,スポーツ,37,Full-Count,大谷翔平に立ちはだかる“ジャッジの壁”　2位浮上も…固い1位の座「全ての打者を置き去り」,34,https://news.yahoo.co.jp/articles/1172d3a119ba8a75ccdcc40d014ae3c8f0610e87,6/28(金) 8:22
2024-06-28,15:08,sports,スポーツ,38,Number Web,暴走族ヘッドの説教、女性警官が取り調べで涙…“札付きのワル”愛甲猛はなぜ甲子園のスターになれたのか？「野球がなければ間違いなくソッチの道に」,34,https://news.yahoo.co.jp/articles/19669855c0fdcbf2448c35168d0a10e83a197d48,6/28(金) 11:06
2024-06-28,15:08,sports,スポーツ,39,日刊ゲンダイDIGITAL,金銭トラブル退団ヤクルト畠山コーチ「若かりし頃の愚行録」…酒浸りでデーゲームに朝帰り、練習サボって風呂,33,https://news.yahoo.co.jp/articles/1dbe3ab7634c4e42587c44720235aa913903051a,6/28(金) 9:06
2024-06-28,15:08,sports,スポーツ,40,共同通信,神8―1中（27日）　阪神・村上が3勝目,30,https://news.yahoo.co.jp/articles/a42890313c687670ae977aae8f2f199bf7957a3f,6/27(木) 21:08
