scrp_date,scrp_time,genre_en,genre_jp,rank,media_jp,title,comment,link,date_original
2024-10-17,16:07,sports,スポーツ,1阪神・大山はFA宣言するのか　移籍決断すれば争奪戦必至、「広島が有力候補」の声もAERA dot.10/17(木) 13:02222件/時,AERA dot.,阪神・大山はFA宣言するのか　移籍決断すれば争奪戦必至、「広島が有力候補」の声も,222,https://news.yahoo.co.jp/articles/6b7b09b8ee73fc1a9c12267a25bfacb20328f86e,10/17(木) 13:02
2024-10-17,16:07,sports,スポーツ,2大谷翔平、PO2号は3ラン　7戦ぶり豪快弾に敵地も沈黙、得点圏打率は驚異の.833Full-Count10/17(木) 11:46182件/時,Full-Count,大谷翔平、PO2号は3ラン　7戦ぶり豪快弾に敵地も沈黙、得点圏打率は驚異の.833,182,https://news.yahoo.co.jp/articles/2b84bfdf1157f1368ddbedae5427de32120116ee,10/17(木) 11:46
2024-10-17,16:07,sports,スポーツ,33ランで勝利貢献の大谷翔平　試合終了約15分で帰路に　前日会見では「睡眠がパフォーマンスの中で大事」スポニチアネックス10/17(木) 12:59120件/時,スポニチアネックス,3ランで勝利貢献の大谷翔平　試合終了約15分で帰路に　前日会見では「睡眠がパフォーマンスの中で大事」,120,https://news.yahoo.co.jp/articles/7dc3e39c523b0b216c15441199bda3d708803e7c,10/17(木) 12:59
2024-10-17,16:07,sports,スポーツ,4巨人まさかの完封負け　初戦黒星で１勝１敗に　２番増田大、３番オコエ不発　力投の戸郷を援護できずデイリースポーツ10/16(水) 21:07109件/時,デイリースポーツ,巨人まさかの完封負け　初戦黒星で１勝１敗に　２番増田大、３番オコエ不発　力投の戸郷を援護できず,109,https://news.yahoo.co.jp/articles/9793d899c9c65a440c2ec77836c79bf96cd33c0c,10/16(水) 21:07
2024-10-17,16:07,sports,スポーツ,5DeNAに暗雲…伊藤光が左ふくらはぎ肉離れで抹消へ　三浦監督明言、東妻純平を登録Full-Count10/17(木) 15:14101件/時,Full-Count,DeNAに暗雲…伊藤光が左ふくらはぎ肉離れで抹消へ　三浦監督明言、東妻純平を登録,101,https://news.yahoo.co.jp/articles/ce7db79b6d968a18ac3620ef3401230d10079444,10/17(木) 15:14
2024-10-17,16:07,sports,スポーツ,6中日に帰還？ 井上新体制で注目集める在野の有力者でコーチ就任が考えられる「3人」とはCoCoKARAnext10/17(木) 11:3269件/時,CoCoKARAnext,中日に帰還？ 井上新体制で注目集める在野の有力者でコーチ就任が考えられる「3人」とは,69,https://news.yahoo.co.jp/articles/eda81e99f2f548f1e66c0be0933cee44a31e52c2,10/17(木) 11:32
2024-10-17,16:07,sports,スポーツ,7【楽天】「怖くて行けない」不条理なトップダウン体質を他球団首脳も警戒東スポWEB10/17(木) 6:1669件/時,東スポWEB,【楽天】「怖くて行けない」不条理なトップダウン体質を他球団首脳も警戒,69,https://news.yahoo.co.jp/articles/9e907020a238d9f037c90b3707a54537351d28a0,10/17(木) 6:16
2024-10-17,16:07,sports,スポーツ,8ドジャース、シリーズ２勝１敗で勝ち越す　大谷翔平２号３ラン２階席上段弾スポーツ報知10/17(木) 12:2168件/時,スポーツ報知,ドジャース、シリーズ２勝１敗で勝ち越す　大谷翔平２号３ラン２階席上段弾,68,https://news.yahoo.co.jp/articles/41bf28bd21231302de88880869f45cfdc769957c,10/17(木) 12:21
2024-10-17,16:07,sports,スポーツ,9ベッツ、大谷翔平の特大3ランに「走者なしで打てないなんて誰が気にする？」…「最高の選手、20打席だけ人間だった」中日スポーツ10/17(木) 14:1465件/時,中日スポーツ,ベッツ、大谷翔平の特大3ランに「走者なしで打てないなんて誰が気にする？」…「最高の選手、20打席だけ人間だった」,65,https://news.yahoo.co.jp/articles/a3dbfec21ef0f9eac174abbaeb04c70d8b57e417,10/17(木) 14:14
2024-10-17,16:07,sports,スポーツ,10大谷翔平、7戦ぶり豪快3ラン　ポストシーズン2本目　飛距離121メートル弾で敵地NYの大ブーイング静めるデイリースポーツ10/17(木) 11:4762件/時,デイリースポーツ,大谷翔平、7戦ぶり豪快3ラン　ポストシーズン2本目　飛距離121メートル弾で敵地NYの大ブーイング静める,62,https://news.yahoo.co.jp/articles/c7a6c25071badc7bb50b15e8fe8055af9704e577,10/17(木) 11:47
2024-10-17,16:07,sports,スポーツ,11久保建英でも、堂安律でも、谷口彰悟でもない…城彰二が「心配になるレベル」と厳しく指摘した森保ジャパンの“意外な選手”とは？《W杯アジア最終予選》文春オンライン10/17(木) 11:1259件/時,文春オンライン,久保建英でも、堂安律でも、谷口彰悟でもない…城彰二が「心配になるレベル」と厳しく指摘した森保ジャパンの“意外な選手”とは？《W杯アジア最終予選》,59,https://news.yahoo.co.jp/articles/8668623c338f978921de804ddd50d93ca5531a88,10/17(木) 11:12
2024-10-17,16:07,sports,スポーツ,12大谷翔平、豪快2号3ランで完勝貢献　得点圏打率.833…2勝1敗で第4戦は由伸先発Full-Count10/17(木) 12:2058件/時,Full-Count,大谷翔平、豪快2号3ランで完勝貢献　得点圏打率.833…2勝1敗で第4戦は由伸先発,58,https://news.yahoo.co.jp/articles/fbbbeb9e5d2a5fa0d71fad82a8c19e17ae06eabb,10/17(木) 12:20
2024-10-17,16:07,sports,スポーツ,13巨人、レギュラーシーズンで好相性のDeNA・ケイを攻略できず…5回まで無得点中日スポーツ10/16(水) 20:0755件/時,中日スポーツ,巨人、レギュラーシーズンで好相性のDeNA・ケイを攻略できず…5回まで無得点,55,https://news.yahoo.co.jp/articles/704ab06e25df9fc5059e9e8eb6921e7d83bd0007,10/16(水) 20:07
2024-10-17,16:07,sports,スポーツ,14【DeNA】巨人に初戦快勝し１勝１敗タイに戻す　歴代キャプテン佐野先制弾＆筒香適時打日刊スポーツ10/16(水) 21:0555件/時,日刊スポーツ,【DeNA】巨人に初戦快勝し１勝１敗タイに戻す　歴代キャプテン佐野先制弾＆筒香適時打,55,https://news.yahoo.co.jp/articles/8d02cc13137de30623ed7f8e6a452ad5301754d5,10/16(水) 21:05
2024-10-17,16:07,sports,スポーツ,15「明らかに非紳士的行為で見ていて不愉快」川淵三郎のPK時の水かけに関する投稿に町田OB鄭大世が反応「典型的な『出る杭打ち』」SOCCER DIGEST Web10/16(水) 17:4753件/時,SOCCER DIGEST Web,「明らかに非紳士的行為で見ていて不愉快」川淵三郎のPK時の水かけに関する投稿に町田OB鄭大世が反応「典型的な『出る杭打ち』」,53,https://news.yahoo.co.jp/articles/645beb60cc49f8ae1895a80660ffea0ab329e957,10/16(水) 17:47
2024-10-17,16:07,sports,スポーツ,16楽天・森井社長が監督交代経緯を説明「現状の否定よりもよりいいものを」デイリースポーツ10/17(木) 10:2453件/時,デイリースポーツ,楽天・森井社長が監督交代経緯を説明「現状の否定よりもよりいいものを」,53,https://news.yahoo.co.jp/articles/85ed0e362b1cb6db187ad6cc666dcdb50f8f0032,10/17(木) 10:24
2024-10-17,16:07,sports,スポーツ,17【巨人】初戦ＤｅＮＡに完封負けで１勝１敗のタイに　戸郷翔征は７回途中２失点の粘投も打線が沈黙スポーツ報知10/16(水) 21:0551件/時,スポーツ報知,【巨人】初戦ＤｅＮＡに完封負けで１勝１敗のタイに　戸郷翔征は７回途中２失点の粘投も打線が沈黙,51,https://news.yahoo.co.jp/articles/e52672b84e1c8e0a37c581a9a0ede54e19cf8021,10/16(水) 21:05
2024-10-17,16:07,sports,スポーツ,18大谷翔平、豪快2号は「帳尻合わせ」　米記者はボヤキ…得点圏8割超えも拭えぬ“疑念”Full-Count10/17(木) 14:5950件/時,Full-Count,大谷翔平、豪快2号は「帳尻合わせ」　米記者はボヤキ…得点圏8割超えも拭えぬ“疑念”,50,https://news.yahoo.co.jp/articles/ee02cae26da7fa6225e65ed87dc4340c97beef76,10/17(木) 14:59
2024-10-17,16:07,sports,スポーツ,19井上尚弥対グッドマン戦を〝阻止〟へ　対戦熱望のアフマダリエフ陣営が「ＷＢＡに要求した」東スポWEB10/17(木) 12:3249件/時,東スポWEB,井上尚弥対グッドマン戦を〝阻止〟へ　対戦熱望のアフマダリエフ陣営が「ＷＢＡに要求した」,49,https://news.yahoo.co.jp/articles/f51adf452bf3886f3ae5af2160028860dec08431,10/17(木) 12:32
2024-10-17,16:07,sports,スポーツ,20【楽天】森井誠之球団社長、三木肇新監督に期待「現状の否定というよりは、よりいいものを」日刊スポーツ10/17(木) 14:2049件/時,日刊スポーツ,【楽天】森井誠之球団社長、三木肇新監督に期待「現状の否定というよりは、よりいいものを」,49,https://news.yahoo.co.jp/articles/7f8d6eb0991793cce35223045200b487aedeaaa3,10/17(木) 14:20
2024-10-17,16:07,sports,スポーツ,21楽天・三木新監督が就任会見「自分自身も想像を超えた覚悟」デイリースポーツ10/17(木) 9:5748件/時,デイリースポーツ,楽天・三木新監督が就任会見「自分自身も想像を超えた覚悟」,48,https://news.yahoo.co.jp/articles/43a7901b9622fdd0c549b47507d3fa61a61ad55c,10/17(木) 9:57
2024-10-17,16:07,sports,スポーツ,22魔裟斗がキック出身の那須川天心のタイトル戦を見て思ったこと「天心って意外と…」スポニチアネックス10/17(木) 14:0846件/時,スポニチアネックス,魔裟斗がキック出身の那須川天心のタイトル戦を見て思ったこと「天心って意外と…」,46,https://news.yahoo.co.jp/articles/2143b6dc278fd760baf5c4454be4cab89e5aaef2,10/17(木) 14:08
2024-10-17,16:07,sports,スポーツ,23大谷翔平、8回に特大3ラン 7戦ぶりポストシーズン2号中日スポーツ10/17(木) 11:4946件/時,中日スポーツ,大谷翔平、8回に特大3ラン 7戦ぶりポストシーズン2号,46,https://news.yahoo.co.jp/articles/bac915fc468fcb97e1c082f77752814d1813a139,10/17(木) 11:49
2024-10-17,16:07,sports,スポーツ,24「中国がクソみたいなサッカーをするとは思わなかった」インドネシア代表の韓国人監督が、“超守備的戦術”を非難！「７：３で優勢だった」SOCCER DIGEST Web10/17(木) 6:4445件/時,SOCCER DIGEST Web,「中国がクソみたいなサッカーをするとは思わなかった」インドネシア代表の韓国人監督が、“超守備的戦術”を非難！「７：３で優勢だった」,45,https://news.yahoo.co.jp/articles/42813e804f174e40351e2a0738f35d24752f2684,10/17(木) 6:44
2024-10-17,16:07,sports,スポーツ,25完封負けの巨人・阿部監督　実戦感覚の問いに「それは言い訳になっちゃうからね」増田大、オコエ起用にも言及デイリースポーツ10/16(水) 21:2644件/時,デイリースポーツ,完封負けの巨人・阿部監督　実戦感覚の問いに「それは言い訳になっちゃうからね」増田大、オコエ起用にも言及,44,https://news.yahoo.co.jp/articles/236c7f4303a0410d21ecad00e4377aa4c89c3db7,10/16(水) 21:26
2024-10-17,16:07,sports,スポーツ,26楽天・森井球団社長　わずか1年で解任…今江前監督に「感謝」も「よりいいものを」交代の経緯説明スポニチアネックス10/17(木) 11:1143件/時,スポニチアネックス,楽天・森井球団社長　わずか1年で解任…今江前監督に「感謝」も「よりいいものを」交代の経緯説明,43,https://news.yahoo.co.jp/articles/3daf502cf1fffb744bb5a4408b2fc115a2431d61,10/17(木) 11:11
2024-10-17,16:07,sports,スポーツ,27ソフトバンク左腕対策でダウンズ先発起用か！？第1戦のヒーロー川瀬は「悩ましい」「活躍しそう」スポニチアネックス10/17(木) 14:5141件/時,スポニチアネックス,ソフトバンク左腕対策でダウンズ先発起用か！？第1戦のヒーロー川瀬は「悩ましい」「活躍しそう」,41,https://news.yahoo.co.jp/articles/0e95c951e9c00ddd485adfe644473ea2db19dbf7,10/17(木) 14:51
2024-10-17,16:07,sports,スポーツ,28現ドラ移籍も…1年で戦力外は「意味わからん」　“清宮キラー”を惜しむ声「悲しい」Full-Count10/17(木) 7:4038件/時,Full-Count,現ドラ移籍も…1年で戦力外は「意味わからん」　“清宮キラー”を惜しむ声「悲しい」,38,https://news.yahoo.co.jp/articles/024ee4758cb9d95b3215dead8230a9c21c3e8674,10/17(木) 7:40
2024-10-17,16:07,sports,スポーツ,29大谷翔平、２球連続で自打球の珍事に苦笑い　第４打席も空振り三振でＰＳの走者なしは２５打席無安打にスポーツ報知10/17(木) 11:1038件/時,スポーツ報知,大谷翔平、２球連続で自打球の珍事に苦笑い　第４打席も空振り三振でＰＳの走者なしは２５打席無安打に,38,https://news.yahoo.co.jp/articles/37611cc28ecc159a967713066218c63d6bed09c8,10/17(木) 11:10
2024-10-17,16:07,sports,スポーツ,30ニューヨークで「最上階まで飛ばしたぞ…」　大谷特大3ラン、速度187キロで米記者にも広がる衝撃THE ANSWER10/17(木) 12:0138件/時,THE ANSWER,ニューヨークで「最上階まで飛ばしたぞ…」　大谷特大3ラン、速度187キロで米記者にも広がる衝撃,38,https://news.yahoo.co.jp/articles/7c4caf77bc345b4eed7210739d7a03a1c3bef3d3,10/17(木) 12:01
2024-10-17,16:07,sports,スポーツ,31巨人・オコエ瑠偉、ピンチ救うスライディングキャッチ　DeNAへの流れ食い止める好プレーにG党大歓声中日スポーツ10/16(水) 20:4435件/時,中日スポーツ,巨人・オコエ瑠偉、ピンチ救うスライディングキャッチ　DeNAへの流れ食い止める好プレーにG党大歓声,35,https://news.yahoo.co.jp/articles/3900886ff0e20f808d9ece979f56ff4ff9b5ea24,10/16(水) 20:44
2024-10-17,16:07,sports,スポーツ,32巨人・戸郷翔征、ヒヤヒヤの初回無失点　DeNA・牧にあわやホームランの当たり【セCS】中日スポーツ10/16(水) 18:3135件/時,中日スポーツ,巨人・戸郷翔征、ヒヤヒヤの初回無失点　DeNA・牧にあわやホームランの当たり【セCS】,35,https://news.yahoo.co.jp/articles/e6fe454551b2a32bbe53a8b4836f7b54cf4ebcaa,10/16(水) 18:31
2024-10-17,16:07,sports,スポーツ,33【巨人】2戦連続ホームランの秋広優人が東京ドームに　宮崎から急きょ帰京か日テレNEWS NNN10/17(木) 13:2734件/時,日テレNEWS NNN,【巨人】2戦連続ホームランの秋広優人が東京ドームに　宮崎から急きょ帰京か,34,https://news.yahoo.co.jp/articles/21ac894558b33425427cd916f75e2c7aeb42ccaa,10/17(木) 13:27
2024-10-17,16:07,sports,スポーツ,34ソフトバンクが快勝でアドバンテージ含め2勝　今季最多勝の伊藤大海ら日本ハム投手陣を攻略　3発含む2桁安打で王者の貫禄西スポWEB OTTO！10/16(水) 20:4033件/時,西スポWEB OTTO！,ソフトバンクが快勝でアドバンテージ含め2勝　今季最多勝の伊藤大海ら日本ハム投手陣を攻略　3発含む2桁安打で王者の貫禄,33,https://news.yahoo.co.jp/articles/838b18ff151b59f52206e9d6c100be67e8f7a54c,10/16(水) 20:40
2024-10-17,16:07,sports,スポーツ,35【巨人】戸郷翔征７回途中２失点で無念の降板　１死一、三塁のピンチで交代日刊スポーツ10/16(水) 20:3833件/時,日刊スポーツ,【巨人】戸郷翔征７回途中２失点で無念の降板　１死一、三塁のピンチで交代,33,https://news.yahoo.co.jp/articles/c72a7038ffec282c9708d42c5ceed8491800b736,10/16(水) 20:38
2024-10-17,16:07,sports,スポーツ,36投手2冠の日本ハム・伊藤大海　ファーストS温存策も実らず…6回途中4失点でマウンド降りるスポニチアネックス10/16(水) 19:5632件/時,スポニチアネックス,投手2冠の日本ハム・伊藤大海　ファーストS温存策も実らず…6回途中4失点でマウンド降りる,32,https://news.yahoo.co.jp/articles/9d73b9ea76c302545609e3bc2b7f3cb59d1a4b33,10/16(水) 19:56
2024-10-17,16:07,sports,スポーツ,37ソフトB山川穂高が下半身醜聞の超逆風からの面目躍如！4打数2安打1どすこいで王会長の期待に応える【2024年 CSベンチ裏情報】日刊ゲンダイDIGITAL10/17(木) 11:3232件/時,日刊ゲンダイDIGITAL,ソフトB山川穂高が下半身醜聞の超逆風からの面目躍如！4打数2安打1どすこいで王会長の期待に応える【2024年 CSベンチ裏情報】,32,https://news.yahoo.co.jp/articles/53780ef96cee3797805603ea8eafab898a5b0c7e,10/17(木) 11:32
2024-10-17,16:07,sports,スポーツ,38伊藤雅雪氏「契約は契約」　カシメロ体重超過も…陣営反省している様子もないため厳しい意見を明かすスポニチアネックス10/17(木) 6:3031件/時,スポニチアネックス,伊藤雅雪氏「契約は契約」　カシメロ体重超過も…陣営反省している様子もないため厳しい意見を明かす,31,https://news.yahoo.co.jp/articles/d15bd0515cde56bf4e62a1e4cfe74b040c036800,10/17(木) 6:30
2024-10-17,16:07,sports,スポーツ,39「日本はそれほど強くなかった」埼スタで取材していた豪州人記者が語った森保Jのリアルな評価。「最も危険だった日本の選手」にはまさかの回答SOCCER DIGEST Web10/17(木) 5:3131件/時,SOCCER DIGEST Web,「日本はそれほど強くなかった」埼スタで取材していた豪州人記者が語った森保Jのリアルな評価。「最も危険だった日本の選手」にはまさかの回答,31,https://news.yahoo.co.jp/articles/e5336d6185a8c6be6b6bd991c8bd94f2a5b40595,10/17(木) 5:31
2024-10-17,16:07,sports,スポーツ,40サッカー日本代表に膨らむ疑問――新陳代謝が進まぬチームをよしとする森保監督の言葉に萎えたwebスポルティーバ10/17(木) 9:4531件/時,webスポルティーバ,サッカー日本代表に膨らむ疑問――新陳代謝が進まぬチームをよしとする森保監督の言葉に萎えた,31,https://news.yahoo.co.jp/articles/931e518e1255bd91c750de9ff6a66848ab4ffdef,10/17(木) 9:45
