scrp_date,scrp_time,genre_en,genre_jp,rank,media_jp,title,comment,link,date_original
2025-08-28,12:22,sports,スポーツ,1,週刊女性PRIME,WBC独占配信のNetflixに“大爆死”の予感…450億円の算段も拭えない“スポンサー撤退ドミノ”の可能性,203,https://news.yahoo.co.jp/articles/ea611c7763fd7d33dacff12c8a18b97a391763c1,8/28(木) 6:01
2025-08-28,12:22,sports,スポーツ,2,週刊女性PRIME,高野連、沖尚応援団の“伝統芸能”に禁止令「暴行には甘いくせに…」“間違いだらけ”の謎対応に募る批判,99,https://news.yahoo.co.jp/articles/5ffb375ea0f14c37abba3afa0d1dd7612b5101fc,8/27(水) 20:01
2025-08-28,12:22,sports,スポーツ,3,東スポWEB,【巨人】「あれはコリジョンだよ」　後味悪いクロスプレー敗戦に不満噴出…甲斐拓也は骨折離脱,71,https://news.yahoo.co.jp/articles/94b43846def61318b4d3b1b20db8f492ad19f372,8/28(木) 5:16
2025-08-28,12:22,sports,スポーツ,4,THE DIGEST,「日本からのビッグネームだけに残念なニュースだ」３Aで苦闘する佐々木朗希に現地メディアから厳しい見解「プレーオフ前の復帰は難しい」,69,https://news.yahoo.co.jp/articles/4ba752b49fff4056bbc6d890ff0f381c37a65f36,8/28(木) 10:24
2025-08-28,12:22,sports,スポーツ,5,Yahoo!ニュース オリジナル THE PAGE,【ヤフコメで話題】「CS制度の見直しを求める声」「勝率5割未満の出場に違和感」 - クライマックスシリーズの公平性に議論,59,https://news.yahoo.co.jp/articles/266e2022d77770075228075706f94da2c62124df,8/28(木) 9:07
2025-08-28,12:22,sports,スポーツ,6,中日スポーツ,ベースカバーの怠り見逃さず…がら空きの三塁へ進み盗塁の間に本塁突入 中日・田中が具現化した“井上スタイル”,50,https://news.yahoo.co.jp/articles/c98cb3d481b49fbaeeab059a83b395a4b03f1a60,8/28(木) 11:20
2025-08-28,12:22,sports,スポーツ,7,日刊スポーツ,【阪神】強すぎるわ！今季最多の貯金29で貯金独占、15ゲーム差の２位巨人以下は借金の珍事,47,https://news.yahoo.co.jp/articles/ba6f1ae8989370b4ce2430095cbabdad4e0ef02b,8/28(木) 8:35
2025-08-28,12:22,sports,スポーツ,8,日刊スポーツ,【巨人】３連敗…08年の球団史上最大の逆転優勝の13差のデッドラインをさらに超える15差,46,https://news.yahoo.co.jp/articles/1d7cb4c13f2a7ac9cf75dd043aff4432c70e1358,8/28(木) 9:01
2025-08-28,12:22,sports,スポーツ,9,中日スポーツ,巨人・阿部監督、「流れの中だったら何でもいいみたいなので…」コリジョン巡り審判と話し込んだ2分間の中身明かす,41,https://news.yahoo.co.jp/articles/8a3d2ddd610b38adffed77f4dcac22d73d79be43,8/28(木) 10:37
2025-08-28,12:22,sports,スポーツ,10,ゴルフのニュース,「マスターズが韓国オープンを無視した」――母国メディアが日本と香港の選出に恨み節,39,https://news.yahoo.co.jp/articles/f8305f4ba950b76ba3ffaf1c53545434d8c2fdf4,8/28(木) 11:55
2025-08-28,12:22,sports,スポーツ,11,デイリースポーツ,巨人３連敗　阿部監督が試合後、審判にラストプレーの判定を確認　九回絶好機でリチャードが痛恨併殺　コリジョンなしに「交錯してたからね」,39,https://news.yahoo.co.jp/articles/22808174a5d1a466a42f66b3d3a597ef1ae6fbff,8/27(水) 21:59
2025-08-28,12:22,sports,スポーツ,12,日刊スポーツ,日大アメフト部員１人だけの申し立て門前払い、関東学連が「仲裁合意せず手続き応じない」と発表,38,https://news.yahoo.co.jp/articles/473cc9b392949cbfbe5cee07615304105d34cdac,8/28(木) 10:25
2025-08-28,12:22,sports,スポーツ,13,webスポルティーバ,【プロ野球】DH制導入によって野球はどう変わる？ 小笠原道大が危惧する「醍醐味が失われる」,38,https://news.yahoo.co.jp/articles/804f874b500e79986a38f5960ad341de57536f4c,8/28(木) 10:00
2025-08-28,12:22,sports,スポーツ,14,日刊スポーツ,【DeNA】阪神に連敗…気が付けば４位広島と１差、５位中日と２・５差　３位争いが大混戦,38,https://news.yahoo.co.jp/articles/cefcaeb19a6d4a2e29909e649cb81f5bb33e4cdd,8/28(木) 8:12
2025-08-28,12:22,sports,スポーツ,15,CBCテレビ,中日ドラフト26人中「今年活躍は岡林だけ…」阪神は21人残存！過去10年間を徹底比較して分かった育成格差とは？,37,https://news.yahoo.co.jp/articles/a434a31268d95319b3b9a4f76b775d48af97e494,8/28(木) 6:10
2025-08-28,12:22,sports,スポーツ,16,デイリースポーツ,阪神　早川太貴のプロ初勝利で坂本が絶叫！岩崎が普段見せない優しい笑み　先輩達の人柄と思いがにじんだ１勝,36,https://news.yahoo.co.jp/articles/1b6ce669ed1c12faa140bdb188e8db6b7bcae4b3,8/28(木) 8:37
2025-08-28,12:22,sports,スポーツ,17,サンケイスポーツ,阪神・近本、今季ワーストの24打席連続無安打,35,https://news.yahoo.co.jp/articles/1df423bde525d7aaea4d7c3690cbbe8b688ba7ab,8/28(木) 7:30
2025-08-28,12:22,sports,スポーツ,18,中日スポーツ,巨人・阿部監督の7月2日退場時は球審だった山本責任審判、「あの時は抗議」も今回は「確認です」退場処分は下さず「甲子園の時とは全然違う対応だった」,35,https://news.yahoo.co.jp/articles/1896a647f5d475a242efefc9833f20c53612ed85,8/28(木) 11:03
2025-08-28,12:22,sports,スポーツ,19,TBS NEWS DIG Powered by JNN,【DeNA】3年連続阪神戦負け越し 連敗で借金6 東7回2失点も7敗目 大山にV打許す 筒香7年ぶり3戦連続弾は空砲 3安打1得点,35,https://news.yahoo.co.jp/articles/2ae9447609da51b7ed3d8f508dfe0df2cb39cfd1,8/27(水) 20:59
2025-08-28,12:22,sports,スポーツ,20,Number Web,ドゥーハン、ロッシ、そしてマルケス…最強時代を築いた“強くて速すぎる”ライダーと、NSR500〜GP25に至る名車の系譜,33,https://news.yahoo.co.jp/articles/b96b762601be77daf312608d7d8d6d779811750b,8/28(木) 11:01
2025-08-28,12:22,sports,スポーツ,21,TBS NEWS DIG Powered by JNN,【巨人】痛恨3連敗で借金生活転落...阪神と15G差 森田5回途中3失点KO、大瀬良に2安打許す 浅野が2点適時打も、9回リチャード併殺打で試合終了,33,https://news.yahoo.co.jp/articles/8a1d38020d8ac2fe585bd0f4a0e690a591684b64,8/27(水) 21:58
2025-08-28,12:22,sports,スポーツ,22,日刊スポーツ,【巨人】９回本塁憤死…阿部監督、試合後に審判団にコリジョンの説明求める　Ｘでもトレンド入り,32,https://news.yahoo.co.jp/articles/d1161feb8c9ec24f0528cd93fe56277afde7f8f2,8/28(木) 8:40
2025-08-28,12:22,sports,スポーツ,23,スポニチアネックス,阪神　育成出身の早川太貴が5回無失点で初先発初勝利、マジック減らしに大貢献,32,https://news.yahoo.co.jp/articles/bd01e43d78cdd10d5fa906f96257bfed09cd1c1e,8/27(水) 21:00
2025-08-28,12:22,sports,スポーツ,24,デイリースポーツ,ロバーツ監督、大谷翔平の問題点を指摘「低めを追いかける傾向が強くなってる」　直近5戦打率・111,31,https://news.yahoo.co.jp/articles/adc0f549de96c0dacc1ac3a8249027af7d1df0e7,8/28(木) 8:34
2025-08-28,12:22,sports,スポーツ,25,SOCCER DIGEST Web,「クソみたい試合だ」「史上最悪の敗戦」マンUが４部クラブに衝撃の敗北でサポーターは憤慨！「選手全員を入れ替えろ」「アモリムよ、もう出ていけ」,31,https://news.yahoo.co.jp/articles/075897785dd2f33619c71470ce358c4532e0ddb0,8/28(木) 7:31
2025-08-28,12:22,sports,スポーツ,26,THE DIGEST,Netflixの26年WBC日本独占配信を米誌が懸念「最適な市場かもしれないが…」　前回大会から５倍も急騰した150億円前後の放映権料,30,https://news.yahoo.co.jp/articles/052615a7b7039f7fe426cae0f08f7d37c4dd1269,8/27(水) 18:31
2025-08-28,12:22,sports,スポーツ,27,Full-Count,巨人21歳が2軍で無双状態「ヤバさに気づいて」　圧倒する“3”「無敵になってない？」,30,https://news.yahoo.co.jp/articles/e4e53de39e3e5c947035df8e4b27ad62cd034766,8/28(木) 7:20
2025-08-28,12:22,sports,スポーツ,28,東スポWEB,角田裕毅オランダＧＰで緊急更迭論が再燃「このレースが彼のＦ１人生に終止符を打つのか」＝ポルトガル報道,30,https://news.yahoo.co.jp/articles/adf82c1179ef453ace315ea490746f89b53aa4ab,8/28(木) 5:16
2025-08-28,12:22,sports,スポーツ,29,J-CASTニュース,「差別よりひどい誹謗中傷」ぱんちゃん璃奈SNS投稿が物議...元ボクシング日本王者が怒り「卑怯な悪口で人間性を疑う」,29,https://news.yahoo.co.jp/articles/c41f344f06bed1a818561f32746a17bb8668c47b,8/28(木) 11:47
2025-08-28,12:22,sports,スポーツ,30,デイリースポーツ,日大アメフトの仲裁申し立てには「応じず」関東学生アメフト連盟が発表「成熟した紛争であることは考え難い」,29,https://news.yahoo.co.jp/articles/ac7e3ead7d685c469da6bdce181a8130948c1428,8/28(木) 10:06
2025-08-28,12:22,sports,スポーツ,31,スポーティングニュース日本版,マンチェスター・ユナイテッドはアモリム監督を解任するのか？ 4部グリムズビーに屈辱の敗戦でカラバオカップ敗退,29,https://news.yahoo.co.jp/articles/007f977798012e00422cb2390cbec8468322ea57,8/28(木) 6:54
2025-08-28,12:22,sports,スポーツ,32,サンケイスポーツ,巨人、借金「1」に　阿部慎之助監督、九回クロスプレーの判定「確認」5分も3連敗「明日切り替えて頑張ります」,29,https://news.yahoo.co.jp/articles/5e3b4daa0d519240b796d12efa200f19acff37bf,8/28(木) 7:30
2025-08-28,12:22,sports,スポーツ,33,TBS NEWS DIG Powered by JNN,【巨人27日スタメン】丸がベンチ 泉口1番＆浅野2番 中山3番ライト キャベッジ5番 リチャード6番 吉川7番 先発・森田、捕手は岸田,29,https://news.yahoo.co.jp/articles/505558bee2cd977c12b2097377719782424117af,8/27(水) 17:31
2025-08-28,12:22,sports,スポーツ,34,デイリースポーツ,大谷翔平に７４９日ぶり勝利投手の権利！復帰後最長の５回１失点＆最多９Ｋ　カーブが効果的に決まる　打者では逆転劇の起点に,28,https://news.yahoo.co.jp/articles/0f931ba6b7fe882551af2a038df50875d8ab0737,8/28(木) 10:58
2025-08-28,12:22,sports,スポーツ,35,ゴルフダイジェスト・オンライン（GDO）,「逃げたくない。必死に生きてる」渋野日向子は米国で仕切り直し,28,https://news.yahoo.co.jp/articles/7427c02ab4ee2e26ac84621417f070426c2e6ad0,8/28(木) 10:20
2025-08-28,12:22,sports,スポーツ,36,スポーツ報知,大谷翔平が２回まで５Ｋの奪三振ショー　２四球＆２暴投でピンチも１６１・４キロマーク,28,https://news.yahoo.co.jp/articles/35cb90d7fc3bffd11e09a08cfad517b4d6bf51f6,8/28(木) 10:08
2025-08-28,12:22,sports,スポーツ,37,サンケイスポーツ,DeNA・筒香嘉智、3戦連発も首位阪神に7連敗　三浦監督「打線がゴウ（筒香）に頼っているところがある。つながらない」,28,https://news.yahoo.co.jp/articles/42d3a1bcb40b83e15357f010375cee219785f146,8/28(木) 7:30
2025-08-28,12:22,sports,スポーツ,38,スポーツ報知,「流れの中だったら何でもいいと確認取れた」巨人・阿部監督、判定後に審判団と会話　本塁憤死で試合終了,27,https://news.yahoo.co.jp/articles/96872590bb51354a25795a4aaff80acbcb7809f2,8/28(木) 5:10
2025-08-28,12:22,sports,スポーツ,39,THE DIGEST,大谷翔平が復帰後最多87球で毎回９奪三振の好投！ ５回２安打１失点で勝利投手の権利　自身749日ぶりの白星なるか,27,https://news.yahoo.co.jp/articles/f630ede19d6684f0a15181fbb953c996de696f47,8/28(木) 11:12
2025-08-28,12:22,sports,スポーツ,40,THE DIGEST,「活躍は期待できない」リハビリ登板で苦戦中の佐々木朗希に「信頼性への疑問が高まっている」米誌が指摘,27,https://news.yahoo.co.jp/articles/ac918005b646a0a931bbcbdcc4ab6177a3cde6ff,8/28(木) 7:00
