scrp_date,scrp_time,genre_en,genre_jp,rank,media_jp,title,comment,link,date_original
2024-08-24,17:07,world,国際,1,テレビ朝日系（ANN）,米不足の日本にタイ米を　「美味しさ多くの人に知ってもらうチャンス」販路拡大狙う企業も,649,https://news.yahoo.co.jp/articles/c236f059bb6fb4de2746b437196327985066ffd3,8/24(土) 12:24
2024-08-24,17:07,world,国際,2,時事通信,「核汚染水」の呼称今も　中国で広がる風評被害　処理水放出1年,159,https://news.yahoo.co.jp/articles/3c80b7a3e9b547ebcce9c81e4004718dfa990673,8/24(土) 7:15
2024-08-24,17:07,world,国際,3,ニューズウィーク日本版,日本にキレるロシアには大人の対応を,57,https://news.yahoo.co.jp/articles/65ead7f6944afddb616cd76b796d1817dc2d8b5f,8/24(土) 15:07
2024-08-24,17:07,world,国際,4,共同通信,ケネディ・ジュニア氏兄弟ら批判　「裏切りで悲しい結末」,53,https://news.yahoo.co.jp/articles/4a5c2ae524655746442450ecd21b4e1bb5b16786,8/24(土) 15:58
2024-08-24,17:07,world,国際,5,共同通信,人格攻撃をやめ、政策批判を　側近らがトランプ氏に要求,53,https://news.yahoo.co.jp/articles/a19fb76b900572b25b9f2190d2ac390709b97758,8/24(土) 15:24
2024-08-24,17:07,world,国際,6,現代ビジネス,隣の仲間は眼球が飛び出し、自身も手りゅう弾で腎臓を負傷…！ロシア軍唯一の日本人義勇兵が明かす「最激戦地・アウディーイウカ」で体験した「地獄の突撃作戦」,49,https://news.yahoo.co.jp/articles/58db684df1171bff7ebe03f23b90eb43e890147b,8/24(土) 7:05
2024-08-24,17:07,world,国際,7,ＡＦＰ＝時事,京都国際が甲子園優勝、韓国大統領が祝辞 ネットでは中傷も,47,https://news.yahoo.co.jp/articles/9c7ca3c523cccf15de9685d8760d834c2f43ee2c,8/24(土) 11:58
2024-08-24,17:07,world,国際,8,時事通信,ハリス氏中傷を連続投稿　トランプ氏、敵対心あらわ　米大統領選,42,https://news.yahoo.co.jp/articles/d9fabb14029fd914d1877097088bd43e1e9f55e5,8/23(金) 18:57
2024-08-24,17:07,world,国際,9,共同通信,イスラエル軍一部撤収容認　ガザ境界、米大統領が要求,34,https://news.yahoo.co.jp/articles/61427f95e98ca6d5f6bcea551b42148582346218,8/24(土) 6:03
2024-08-24,17:07,world,国際,10,FNNプライムオンライン,「追い払っても来る」中国の夏の風物詩!?スーパーで涼む人殺到に店員悲鳴…素足で寝そべる客や椅子やゴザ持ち込む強者も,33,https://news.yahoo.co.jp/articles/a26c0cb4b83030548bfc7089c95e62225eabe37b,8/24(土) 16:32
2024-08-24,17:07,world,国際,11,毎日新聞,トランプ氏、接戦州の共和知事と関係「修復」を演出　中傷から一転,33,https://news.yahoo.co.jp/articles/0b53b442ab28bcd4efd470a6c6abf3eb3d31a3ae,8/24(土) 10:27
2024-08-24,17:07,world,国際,12,読売新聞オンライン,ロシアのウクライナ侵略開始から２年半、終結見えず…ゼレンスキー氏「我々は占領者を追い出す」,30,https://news.yahoo.co.jp/articles/4f949919ec5b9966bd0096713c660146c70c81a0,8/24(土) 0:00
2024-08-24,17:07,world,国際,13,時事通信,無所属ケネディ氏が撤退　トランプ氏支持を表明　米大統領選,30,https://news.yahoo.co.jp/articles/7fd067d65960a32b69e80ce343ae780229194488,8/24(土) 5:06
2024-08-24,17:07,world,国際,14,現代ビジネス,「中国人のマナーが悪い」印象は老人のせいだった…”迷惑老人”であふれる中国の絶望的な状況,26,https://news.yahoo.co.jp/articles/42a67e9f61e8498d5c27aa115afa18e705598160,8/24(土) 8:00
2024-08-24,17:07,world,国際,15,共同通信,ハリス副大統領演説、視聴率勝利　トランプ氏を50万人上回る,23,https://news.yahoo.co.jp/articles/4a82d8605691fc26069d5ebb2c426ca1e526815a,8/24(土) 16:11
2024-08-24,17:07,world,国際,16,BBC News,インド首相がウクライナ訪問、平和実現を支援する「用意ある」とゼレンスキー氏に伝える,22,https://news.yahoo.co.jp/articles/1fce1b7790ccda7714b28cdb1ad172622143a648,8/24(土) 15:11
2024-08-24,17:07,world,国際,17,ハンギョレ新聞,韓国外交部「日帝の国権侵奪は源泉無効」…光復会の公開書簡に返答,18,https://news.yahoo.co.jp/articles/ab05fadd432bcbff48cccbfb0514720836f9446d,8/24(土) 9:39
2024-08-24,17:07,world,国際,18,中央日報日本語版,韓国外交部、光復会に「韓日強制併合は無効」…公式立場を再確認,18,https://news.yahoo.co.jp/articles/2c814e7af2448e39d8eb97918b86e33b04673808,8/24(土) 11:23
2024-08-24,17:07,world,国際,19,読売新聞オンライン,米大統領選「第３の候補」ケネディ氏が撤退へ…トランプ氏支持を表明、激戦州の情勢に影響か,17,https://news.yahoo.co.jp/articles/43b13b99abb0ecdfafe78dfe37897d1b3cc89012,8/24(土) 5:29
2024-08-24,17:07,world,国際,20,ダイヤモンド・オンライン,「イスラム教徒、やめました」礼拝を欠かさなかった30代イラン人男性が心変わり！その根深い事情とは,17,https://news.yahoo.co.jp/articles/30fd40f8819e00e107d2066caf7a90eeb1235cad,8/24(土) 7:02
2024-08-24,17:07,world,国際,21,時事通信,強い指導者像を演出　ガザ情勢では慎重に独自色　ハリス氏・米大統領選,16,https://news.yahoo.co.jp/articles/ac403b865042a23405ec168a13b38935c9d9542f,8/23(金) 20:33
2024-08-24,17:07,world,国際,22,FNNプライムオンライン（フジテレビ系）,「黒人男性が日本人を妊娠させたら1000万円」アメリカの迷惑YouTuberターシャ・Kがデマ拡散…間違い指摘も「ナンミョーホーレンゲキョー!」,16,https://news.yahoo.co.jp/articles/c506eba85929bc176d6d6423938c5066e6c07e84,8/23(金) 20:37
2024-08-24,17:07,world,国際,23,FNNプライムオンライン,福島第一原発の処理水放出から1年…“核汚染水”と批判を続ける中国政府　 一方で日系の回転寿司店は大行列,16,https://news.yahoo.co.jp/articles/f3fe6bb2a6ea56ad11bc761c3416a30e0d62f017,8/24(土) 14:22
2024-08-24,17:07,world,国際,24,BBC News,【米大統領選2024】ケネディー氏撤退しトランプ候補支持　民主党はハリス氏で盛り上がるも接戦続く,16,https://news.yahoo.co.jp/articles/3b7bcb060d7db6e95bf986a226dd098b2fee64ec,8/24(土) 14:02
2024-08-24,17:07,world,国際,25,BBC News,【米大統領選2024】無所属ケネディー氏が撤退、トランプ候補を支持,15,https://news.yahoo.co.jp/articles/e9ae634750d4d7844836363b0a2d8474ef033be8,8/24(土) 14:14
2024-08-24,17:07,world,国際,26,JBpress,プーチンが動揺、ウクライナ軍の「SNS」「クラウドファンディング」「市販ドローン」による三位一体攻勢,12,https://news.yahoo.co.jp/articles/efdce0e0d59b8b6c0e0cb54a0b1e4e543ddf614e,8/24(土) 10:51
2024-08-24,17:07,world,国際,27,毎日新聞,ケネディ氏、「選挙運動の中止」発表　トランプ氏を支持　米大統領選,12,https://news.yahoo.co.jp/articles/5f5249a3013a736524adab032fe39a353ab922b8,8/24(土) 4:54
2024-08-24,17:07,world,国際,28,TBS NEWS DIG Powered by JNN,「重要な問題で意見一致」ケネディ氏が撤退しトランプ前大統領支持を表明　米大統領選挙,11,https://news.yahoo.co.jp/articles/c36ac292109ed6c7ee5471db433415f11d2bdfa4,8/24(土) 12:33
2024-08-24,17:07,world,国際,29,ABEMA TIMES,“処理水放出”で日本産海産物の輸入禁止の中国 再開のめど立たず 市民の態度には変化も,11,https://news.yahoo.co.jp/articles/f29599cdf9fb2cc5cbb8ddf3b357b7f9581c9ca8,8/24(土) 13:09
2024-08-24,17:07,world,国際,30,ニューズウィーク日本版,メーガン妃とヘンリー王子の「偽ロイヤル・ツアー」が政治道具に...イギリス王室の「二層構造化」とは？,11,https://news.yahoo.co.jp/articles/d8a4cc6f66b6dd780b1b21381d2a2e898f61c10b,8/24(土) 9:09
2024-08-24,17:07,world,国際,31,FNNプライムオンライン（フジテレビ系）,ケネディ氏がトランプ氏支持に回りアメリカ大統領選の選挙集会に登場…トランプ氏「私たちは国のために正しいことをする」と共闘をアピール,11,https://news.yahoo.co.jp/articles/634928eafec9ed1c70ddfac864d17e1c06902f42,8/24(土) 13:28
2024-08-24,17:07,world,国際,32,ハンギョレ新聞,【社説】汚染水放出１年、「怪談」主張する大統領室は日本の代弁者か,11,https://news.yahoo.co.jp/articles/6bb85155cd44394ab7429d6c76206b3d8c0e372f,8/24(土) 8:14
2024-08-24,17:07,world,国際,33,Forbes JAPAN,繰り返される中国経済の「挫折パターン」各経済指標が景気後退を示唆,10,https://news.yahoo.co.jp/articles/6716e891912946057dd02beb114de9f63c058106,8/24(土) 10:00
2024-08-24,17:07,world,国際,34,ハンギョレ新聞,尹大統領、京都国際高校の甲子園優勝に「野球通じて韓日がもっと近づいてほしい」,10,https://news.yahoo.co.jp/articles/8a1d9ad58f693f475ae6ed0df0e2ba29aa2444e6,8/24(土) 7:19
2024-08-24,17:07,world,国際,35,TBS NEWS DIG Powered by JNN,中国「日本が世界に危険を転嫁した」 処理水放出1年で日本を改めて非難,10,https://news.yahoo.co.jp/articles/e43a633cd66c547ae0756837037ce6a7aafcd42d,8/23(金) 18:26
2024-08-24,17:07,world,国際,36,FNNプライムオンライン（フジテレビ系）,「金返せ!」遅刻して飛行機乗れず空港職員に殴りかかる男…ベルトコンベヤーで大暴れし「外国人に媚びている!」悪態　中国,10,https://news.yahoo.co.jp/articles/5af1fac798514fa936cb1d8834a9affdfc0e3c17,8/23(金) 19:58
2024-08-24,17:07,world,国際,37,ハフポスト日本版,生放送でパニック発作になった気象予報士⇒「申し訳ない」と謝るも、同僚の“一言”に称賛広がる,10,https://news.yahoo.co.jp/articles/64abd45e0eb532e96f7ca2a1bc724053a84ba306,8/24(土) 11:04
2024-08-24,17:07,world,国際,38,AERA dot.,ヘンリー王子とメ―ガンさんがコロンビア訪問　「大成功」の夢から覚めるか？！,10,https://news.yahoo.co.jp/articles/0fbef489edcdaa51c2b0ac9dde1fdf7da179d7fe,8/24(土) 11:32
2024-08-24,17:07,world,国際,39,時事通信,日銀の利上げ路線継続、適切　米欧と景気サイクルに違い　シンクタンク所長,9,https://news.yahoo.co.jp/articles/bb1540a0a240ed571eed8d9cbde9d5a78f0b6145,8/24(土) 15:47
2024-08-24,17:07,world,国際,40,時事通信,国連特別報告者を入国禁止　「人道犯罪隠蔽」と非難も　アフガン,9,https://news.yahoo.co.jp/articles/e9e2a07f97e94428089554c954d38cc77c7f6903,8/24(土) 13:34
