scrp_date,scrp_time,genre_en,genre_jp,rank,media_jp,title,comment,link,date_original
2024-11-08,07:06,TTL,総合,1日産自動車、世界で9千人削減　三菱自株も一部売却、純利益93%減朝日新聞デジタル11/7(木) 17:04294件/時,朝日新聞デジタル,日産自動車、世界で9千人削減　三菱自株も一部売却、純利益93%減,294,https://news.yahoo.co.jp/articles/7c58d7bbe5d9c12b80d06fc8ef0a99dbd11df56c,11/7(木) 17:04
2024-11-08,07:06,TTL,総合,2巨人がＤｅＮＡに敗れたＣＳアドバンテージ制度の見直しを提言　元ヤクルト監督の高田繁氏　「５ゲーム以上離したら２つ出すべき」　優勝の重み訴えるデイリースポーツ11/7(木) 17:18243件/時,デイリースポーツ,巨人がＤｅＮＡに敗れたＣＳアドバンテージ制度の見直しを提言　元ヤクルト監督の高田繁氏　「５ゲーム以上離したら２つ出すべき」　優勝の重み訴える,243,https://news.yahoo.co.jp/articles/557cd4a27c09f16d37b8d0440bde6c657b332f54,11/7(木) 17:18
2024-11-08,07:06,TTL,総合,34:34“ぶつかりおじさんに殴られた”　都内の駅で被害訴え相次ぐ…トラブル多発の背景は日テレNEWS NNN11/7(木) 19:51224件/時,日テレNEWS NNN,“ぶつかりおじさんに殴られた”　都内の駅で被害訴え相次ぐ…トラブル多発の背景は,224,https://news.yahoo.co.jp/articles/03e1150744b4bde3b646502a6bdbe681f4cadea7,11/7(木) 19:51
2024-11-08,07:06,TTL,総合,41:05“ルフィ”強盗事件の実行役リーダーに無期懲役の判決　東京・狛江市など6つの事件に関与 裁判長「償いは何ができるのかずっと考え続けてほしい」 東京地裁立川支部TBS NEWS DIG Powered by JNN11/7(木) 15:00202件/時,TBS NEWS DIG Powered by JNN,“ルフィ”強盗事件の実行役リーダーに無期懲役の判決　東京・狛江市など6つの事件に関与 裁判長「償いは何ができるのかずっと考え続けてほしい」 東京地裁立川支部,202,https://news.yahoo.co.jp/articles/59998f7d477cd167d992ea455b0f8daa1fddc1c7,11/7(木) 15:00
2024-11-08,07:06,TTL,総合,5衆院選大敗で執行部批判相次ぐ　自民、2千万円支給を問題視共同通信11/7(木) 18:17193件/時,共同通信,衆院選大敗で執行部批判相次ぐ　自民、2千万円支給を問題視,193,https://news.yahoo.co.jp/articles/4a1992a42d5f3cb29934b349b32749492039a39a,11/7(木) 18:17
2024-11-08,07:06,TTL,総合,6シャトレーゼの菓子にカメムシ混入　包装段階での「偶発的事故」会社が謝罪産経新聞11/7(木) 19:59187件/時,産経新聞,シャトレーゼの菓子にカメムシ混入　包装段階での「偶発的事故」会社が謝罪,187,https://news.yahoo.co.jp/articles/14f6a6221525bf4a4ffd8814f0719ad509568484,11/7(木) 19:59
2024-11-08,07:06,TTL,総合,71:00金属バットで襲いかかってきた男に警察官が2発発砲　富山県南砺市北日本放送11/7(木) 9:39173件/時,北日本放送,金属バットで襲いかかってきた男に警察官が2発発砲　富山県南砺市,173,https://news.yahoo.co.jp/articles/9f7d0cb7817fcc350010f3119aecc954e37dbb0b,11/7(木) 9:39
2024-11-08,07:06,TTL,総合,8【スクープ】齋藤元彦事件「優勝パレード協賛金キックバック疑惑」渦中の信金理事長が実名告発「前知事を陥れようとする思惑が…」現代ビジネス11/8(金) 6:05162件/時,現代ビジネス,【スクープ】齋藤元彦事件「優勝パレード協賛金キックバック疑惑」渦中の信金理事長が実名告発「前知事を陥れようとする思惑が…」,162,https://news.yahoo.co.jp/articles/82a1e62a56dce4081c86e56a234ada030ab9b9bc,11/8(金) 6:05
2024-11-08,07:06,TTL,総合,9「偏向報道」「情けない」米大統領選トランプ氏圧勝も予想外した日本メディア“ハリス推し”の背景とはSmartFLASH11/7(木) 20:40143件/時,SmartFLASH,「偏向報道」「情けない」米大統領選トランプ氏圧勝も予想外した日本メディア“ハリス推し”の背景とは,143,https://news.yahoo.co.jp/articles/79af9b29d206952fbf09b9698e94047ed47aa141,11/7(木) 20:40
2024-11-08,07:06,TTL,総合,10「まるでトカゲのシッポ切り」フジテレビが“LA大谷翔平担当記者”の名前を封印　局内からは不満の声も女性自身11/8(金) 6:00140件/時,女性自身,「まるでトカゲのシッポ切り」フジテレビが“LA大谷翔平担当記者”の名前を封印　局内からは不満の声も,140,https://news.yahoo.co.jp/articles/909d450904c2d208227afd1b6d20c86e52516604,11/8(金) 6:00
2024-11-08,07:06,TTL,総合,11国民が持ち上げられ、相変わらず「立憲下げ」勢が多いが…「政権の担い手」へ期待背負った野党の主役は立憲民主党だJBpress11/7(木) 11:41137件/時,JBpress,国民が持ち上げられ、相変わらず「立憲下げ」勢が多いが…「政権の担い手」へ期待背負った野党の主役は立憲民主党だ,137,https://news.yahoo.co.jp/articles/d57e49b6249a92efea8b08340c4218acc6163a55,11/7(木) 11:41
2024-11-08,07:06,TTL,総合,12厚生年金、年収問わず加入へ共同通信11/8(金) 6:12129件/時,共同通信,厚生年金、年収問わず加入へ,129,https://news.yahoo.co.jp/articles/76a34906f24b4b251192e759b80d08ef34d3e46e,11/8(金) 6:12
2024-11-08,07:06,TTL,総合,13「ゴチ」で初の年越し！日テレ大みそか特番発表　4年連続ナイナイMC「笑ってはいけない」今年も復活なしスポニチアネックス11/7(木) 21:00123件/時,スポニチアネックス,「ゴチ」で初の年越し！日テレ大みそか特番発表　4年連続ナイナイMC「笑ってはいけない」今年も復活なし,123,https://news.yahoo.co.jp/articles/65a692f825f5059e3de2adc90bb2cee21169bc1a,11/7(木) 21:00
2024-11-08,07:06,TTL,総合,14石破茂首相はトランプ氏と「ゴルフ外交」できるのか　高校時代ゴルフ部の腕前も最近は距離産経新聞11/7(木) 16:30110件/時,産経新聞,石破茂首相はトランプ氏と「ゴルフ外交」できるのか　高校時代ゴルフ部の腕前も最近は距離,110,https://news.yahoo.co.jp/articles/6cc01c14e95b4897d597eda16e149cf091c842c6,11/7(木) 16:30
2024-11-08,07:06,TTL,総合,154:05“またトラ”で日本経済どうなる──株価、輸出産業、ビットコインは？　専門家「やりたい放題」「1期目よりもっと派手に」日テレNEWS NNN11/7(木) 10:10104件/時,日テレNEWS NNN,“またトラ”で日本経済どうなる──株価、輸出産業、ビットコインは？　専門家「やりたい放題」「1期目よりもっと派手に」,104,https://news.yahoo.co.jp/articles/6aeb8de923b80d81b3edffbbc09e4ddc567c237d,11/7(木) 10:10
2024-11-08,07:06,TTL,総合,16完敗の民主、放心　都市型偏重、労働者に背　「青い壁」総崩れ・米大統領選時事通信11/7(木) 20:34102件/時,時事通信,完敗の民主、放心　都市型偏重、労働者に背　「青い壁」総崩れ・米大統領選,102,https://news.yahoo.co.jp/articles/983f33beb091aac4d64afddc4f7f31e94ff63cfd,11/7(木) 20:34
2024-11-08,07:06,TTL,総合,17佳子さま　接遇は満点も…ファッションライターが指摘する園遊会での「残念な着付け」女性自身11/8(金) 6:0099件/時,女性自身,佳子さま　接遇は満点も…ファッションライターが指摘する園遊会での「残念な着付け」,99,https://news.yahoo.co.jp/articles/7293441045db7a2d0daba028a9bbe919e0f4cce7,11/8(金) 6:00
2024-11-08,07:06,TTL,総合,18日本人はこのまま「絶滅」してしまうのか、総人口が2000人になる「衝撃すぎる未来」現代ビジネス11/8(金) 6:0597件/時,現代ビジネス,日本人はこのまま「絶滅」してしまうのか、総人口が2000人になる「衝撃すぎる未来」,97,https://news.yahoo.co.jp/articles/cdbb3642d6376d549db7fa212e445113a6350d39,11/8(金) 6:05
2024-11-08,07:06,TTL,総合,1952歳・アンミカ、30年ぶりパリコレ復帰発表「うれしいです」　64カラット4700万円のエメラルド着用オリコン11/7(木) 21:1297件/時,オリコン,52歳・アンミカ、30年ぶりパリコレ復帰発表「うれしいです」　64カラット4700万円のエメラルド着用,97,https://news.yahoo.co.jp/articles/d4d5ea250c0d11f9eb07561136a75c330288e237,11/7(木) 21:12
2024-11-08,07:06,TTL,総合,20石破首相、トランプ氏と電話会談日テレNEWS NNN11/7(木) 10:2095件/時,日テレNEWS NNN,石破首相、トランプ氏と電話会談,95,https://news.yahoo.co.jp/articles/fbc1b6e6389ab6c79e89b8e001b7c1bedba2006f,11/7(木) 10:20
2024-11-08,07:06,TTL,総合,211:01グアム発成田行きの航空機内で26人が体調不良訴える　集団食中毒かテレビ朝日系（ANN）11/7(木) 20:5588件/時,テレビ朝日系（ANN）,グアム発成田行きの航空機内で26人が体調不良訴える　集団食中毒か,88,https://news.yahoo.co.jp/articles/f8a8d9daf7432f92341b934cdc56ba157ed2a28c,11/7(木) 20:55
2024-11-08,07:06,TTL,総合,"22「5年で済むと思った」""ルフィ""連続強盗実行役の永田被告に無期懲役の判決　広島の強盗傷害事件　裁判で語った手口と後悔RCC中国放送11/8(金) 5:0184件/時",RCC中国放送,"「5年で済むと思った」""ルフィ""連続強盗実行役の永田被告に無期懲役の判決　広島の強盗傷害事件　裁判で語った手口と後悔",84,https://news.yahoo.co.jp/articles/144ea6f750a3b8e7f5e9d5ff3e3fae407e8ba973,11/8(金) 5:01
2024-11-08,07:06,TTL,総合,23なぜハリス氏はトランプ氏に敗れたのか…「唯一無二」に打ち勝てず、多様性に忌避感も読売新聞オンライン11/7(木) 9:2483件/時,読売新聞オンライン,なぜハリス氏はトランプ氏に敗れたのか…「唯一無二」に打ち勝てず、多様性に忌避感も,83,https://news.yahoo.co.jp/articles/315cb6973751b75305132aeb98b37015a8c85299,11/7(木) 9:24
2024-11-08,07:06,TTL,総合,24【独自】厚生年金、年収問わずパート加入　「106万円の壁」撤廃へ、負担増も共同通信11/8(金) 6:1382件/時,共同通信,【独自】厚生年金、年収問わずパート加入　「106万円の壁」撤廃へ、負担増も,82,https://news.yahoo.co.jp/articles/67c38563ade220b0ecd09478c9e3f89eca7fe20f,11/8(金) 6:13
2024-11-08,07:06,TTL,総合,25出川哲朗、キャッシュレス決済のため現金使えず「日本で日本円が使えませんって、心の底からＷＨＹ？ってなって」スポーツ報知11/8(金) 4:0081件/時,スポーツ報知,出川哲朗、キャッシュレス決済のため現金使えず「日本で日本円が使えませんって、心の底からＷＨＹ？ってなって」,81,https://news.yahoo.co.jp/articles/fb2772e31a2ddd22b07fd49f183b5cad33c183f4,11/8(金) 4:00
2024-11-08,07:06,TTL,総合,260:58JALとユナイテッド航空の国際線の機内で集団食中毒のような症状　修学旅行中の高校生ら少なくとも27人が症状を訴えるTBS NEWS DIG Powered by JNN11/7(木) 20:0477件/時,TBS NEWS DIG Powered by JNN,JALとユナイテッド航空の国際線の機内で集団食中毒のような症状　修学旅行中の高校生ら少なくとも27人が症状を訴える,77,https://news.yahoo.co.jp/articles/18d2a7bdd26ed6dd44fcca0744f414285f374aa2,11/7(木) 20:04
2024-11-08,07:06,TTL,総合,27ＭＬＢ球団元社長が仰天発言「佐々木朗希はドジャースを希望しているので他球団は引いてください」東スポWEB11/7(木) 12:2673件/時,東スポWEB,ＭＬＢ球団元社長が仰天発言「佐々木朗希はドジャースを希望しているので他球団は引いてください」,73,https://news.yahoo.co.jp/articles/39f64a613f732a09cafb95d33e389d6e10378cd5,11/7(木) 12:26
2024-11-08,07:06,TTL,総合,28「農家に失礼やん」橋本環奈『おむすび』ヒロインの農作業シーンが “つまらなさそう” 不機嫌表情に視聴者が激オコ！SmartFLASH11/7(木) 20:1571件/時,SmartFLASH,「農家に失礼やん」橋本環奈『おむすび』ヒロインの農作業シーンが “つまらなさそう” 不機嫌表情に視聴者が激オコ！,71,https://news.yahoo.co.jp/articles/b11db12a500afcc7d3163ae350a94aaac8c6e95e,11/7(木) 20:15
2024-11-08,07:06,TTL,総合,29「迷惑外国人は日本から出ていけ！」と怒る日本人が知らない“迷惑行為が起きる根因”　電車内でダンスする動画が大炎上…なぜ多発する？東洋経済オンライン11/8(金) 6:2169件/時,東洋経済オンライン,「迷惑外国人は日本から出ていけ！」と怒る日本人が知らない“迷惑行為が起きる根因”　電車内でダンスする動画が大炎上…なぜ多発する？,69,https://news.yahoo.co.jp/articles/633d65a6d2bbb9519ac928369413e7a98c2752bd,11/8(金) 6:21
2024-11-08,07:06,TTL,総合,30高田繁氏のCS「2勝アドバンテージ」案　SNSでも紛糾「変動するのは当然」「そんなことするなら…」スポニチアネックス11/7(木) 17:5669件/時,スポニチアネックス,高田繁氏のCS「2勝アドバンテージ」案　SNSでも紛糾「変動するのは当然」「そんなことするなら…」,69,https://news.yahoo.co.jp/articles/6eafd6a0d6aa60a6cd5c67396d8cd071b76e0b78,11/7(木) 17:56
2024-11-08,07:06,TTL,総合,31ハリス氏の敗因探る民主党　理念先行型の争点設定が不発、バイデン氏を糾弾の声も産経新聞11/7(木) 8:5768件/時,産経新聞,ハリス氏の敗因探る民主党　理念先行型の争点設定が不発、バイデン氏を糾弾の声も,68,https://news.yahoo.co.jp/articles/eb03f81f6b1c35420d70c16c629d9b55da7e6a12,11/7(木) 8:57
2024-11-08,07:06,TTL,総合,32【独自】カメムシ“丸々1匹”がお菓子に混入　口に入れて“異物感”に気づく…メーカー「2週間以内に原因報告」とするも連絡無くFNNプライムオンライン11/7(木) 7:1367件/時,FNNプライムオンライン,【独自】カメムシ“丸々1匹”がお菓子に混入　口に入れて“異物感”に気づく…メーカー「2週間以内に原因報告」とするも連絡無く,67,https://news.yahoo.co.jp/articles/aaada6fda0c38bea5f6d7e602526035acc37ba76,11/7(木) 7:13
2024-11-08,07:06,TTL,総合,33民家の庭から水、リニア工事中断　JR東海、東京・町田共同通信11/7(木) 12:3367件/時,共同通信,民家の庭から水、リニア工事中断　JR東海、東京・町田,67,https://news.yahoo.co.jp/articles/850fc41812223c636a3373b101d2fb68610677d0,11/7(木) 12:33
2024-11-08,07:06,TTL,総合,34米FRB、0.25％利下げ　インフレ沈静化と判断毎日新聞11/8(金) 4:0367件/時,毎日新聞,米FRB、0.25％利下げ　インフレ沈静化と判断,67,https://news.yahoo.co.jp/articles/17e62296eb8e2b7206c3eb0311ab0bb54e45b89c,11/8(金) 4:03
2024-11-08,07:06,TTL,総合,35井上尚弥を執拗に挑発するカシメロ「イノウエが私を恐れている理由を知っている」＝現地報道東スポWEB11/8(金) 5:1666件/時,東スポWEB,井上尚弥を執拗に挑発するカシメロ「イノウエが私を恐れている理由を知っている」＝現地報道,66,https://news.yahoo.co.jp/articles/7bcb61453523a46a4bbb7f97d6b0e7f5752a476a,11/8(金) 5:16
2024-11-08,07:06,TTL,総合,3616歳未満のSNS利用禁止へ オーストラリアＡＦＰ＝時事11/7(木) 11:0765件/時,ＡＦＰ＝時事,16歳未満のSNS利用禁止へ オーストラリア,65,https://news.yahoo.co.jp/articles/4ec5f65a5fb04f45ee66b8d3ef2152371c203603,11/7(木) 11:07
2024-11-08,07:06,TTL,総合,37【Ｆ１】フェルスタッペン陣営が昇格争いで角田裕毅よりもローソン支持を表明「理にかなっている」東スポWEB11/7(木) 18:2663件/時,東スポWEB,【Ｆ１】フェルスタッペン陣営が昇格争いで角田裕毅よりもローソン支持を表明「理にかなっている」,63,https://news.yahoo.co.jp/articles/6ff2dce7c24acb668c441e63e8e9e89c81088792,11/7(木) 18:26
2024-11-08,07:06,TTL,総合,38高級ホテルのスイートルームで親族など21人が大宴会　注意した従業員に「ぶっ殺すぞ」　東京・六本木テレビ朝日系（ANN）11/7(木) 10:5562件/時,テレビ朝日系（ANN）,高級ホテルのスイートルームで親族など21人が大宴会　注意した従業員に「ぶっ殺すぞ」　東京・六本木,62,https://news.yahoo.co.jp/articles/48fc79a25b139e4fc6140c52401b566159077185,11/7(木) 10:55
2024-11-08,07:06,TTL,総合,39【Ｆ１】「コラピントがペレスの代役としてレッドブルに加入」昇格争いで英専門メディア報道東スポWEB11/8(金) 5:1661件/時,東スポWEB,【Ｆ１】「コラピントがペレスの代役としてレッドブルに加入」昇格争いで英専門メディア報道,61,https://news.yahoo.co.jp/articles/24027b53fb9d01e983536bc9fe6b42e5079cc4a6,11/8(金) 5:16
2024-11-08,07:06,TTL,総合,40れいわ幹事長、公職選挙法違反の指摘に反論　「当選祝賀会」ではなく「慰労会」主張「誤解を生んでいる」スポニチアネックス11/7(木) 11:3160件/時,スポニチアネックス,れいわ幹事長、公職選挙法違反の指摘に反論　「当選祝賀会」ではなく「慰労会」主張「誤解を生んでいる」,60,https://news.yahoo.co.jp/articles/7fc418a71dd0bc198b6971c0244963b9f709ab4c,11/7(木) 11:31
