scrp_date,scrp_time,genre_en,genre_jp,rank,media_jp,title,comment,link,date_original
2024-02-18,18:17,business,経済,1,時事通信,コンニャク粉から「マグロの刺し身」　魚の代替食品広がる,128,https://news.yahoo.co.jp/articles/69a341b8d8d2dfdb259d3df706601be39ba95486,2/18(日) 10:05
2024-02-18,18:17,business,経済,2,テレビ朝日系（ANN）,日本の祭り存続危機…どう伝統守る？ 千年の歴史が途絶えた黒石寺蘇民祭から考える,80,https://news.yahoo.co.jp/articles/77e43bbfbfa7aa0284f72e176b47fd9fd3c73227,2/18(日) 11:40
2024-02-18,18:17,business,経済,3,読売新聞オンライン,選挙での「ディープフェイク」に歯止め、ＩＴ２０社が生成ＡＩ偽情報対策で合意…ＯＰ技術研究組合も支持,55,https://news.yahoo.co.jp/articles/f97706837fbd4aee027ff7a1e0a1591a211c15d6,2/17(土) 21:32
2024-02-18,18:17,business,経済,4,ダイヤモンド・オンライン,「ラーメン1杯1000円超え」はありか？大衆店廃業ラッシュの中、値上げに向き合う消費者の“審判”,49,https://news.yahoo.co.jp/articles/2438d39320e4b8b7d803989c52b57a346d9b74d1,2/18(日) 9:02
2024-02-18,18:17,business,経済,5,Merkmal,「叫ぶ、走り回る、飛び跳ねる」 公共交通機関の“障がい者”に向けられる冷たい視線！ 今必要なのは、迅速な支援・啓発である,44,https://news.yahoo.co.jp/articles/dc6b2f564bf558af9bc9d55fafc46d5b986aee8d,2/18(日) 17:31
2024-02-18,18:17,business,経済,6,ファイナンシャルフィールド,「いつまでもうだつが上がらない」と妻から三行半を突きつけられました…50代で年収「500万円」はそんなに少ないのでしょうか？,40,https://news.yahoo.co.jp/articles/c301c554c58cab764b9e19fb75b9cbab5d6977ab,2/18(日) 17:20
2024-02-18,18:17,business,経済,7,J-CASTニュース,「老害化」は若者にも起きる　変化を好まない、間違いを認めない、人の話を聞かない...性格の影響大,33,https://news.yahoo.co.jp/articles/22ab9880ef636afafc714b69bbf0d4673c7fb993,2/18(日) 14:00
2024-02-18,18:17,business,経済,8,乗りものニュース,「途中で合流しないで！」NEXCO呼びかけ 「ファスナー合流」が“本線”でも重要になるケースとは 渋滞は減らせる！,31,https://news.yahoo.co.jp/articles/e551ef89633952c2a5f00f63a3ad42060aaff8e8,2/18(日) 16:12
2024-02-18,18:17,business,経済,9,プレジデントオンライン,「アマゾンへの対抗ではない」から続いている…ヨドバシカメラが100円の電球を送料無料で即日配達する理由,31,https://news.yahoo.co.jp/articles/fabd5a38ed27c7b11c93a0736ea2f746a8e49b2b,2/18(日) 15:17
2024-02-18,18:17,business,経済,10,みんかぶマガジン,例年医学部100名以上、東大30名程度合格！スパルタ教育で子供を東大・医学部に押し込める東京の名門「管理型教育学校」,30,https://news.yahoo.co.jp/articles/5e3c03616a94559860baad8720421bc383e41d29,2/18(日) 17:10
2024-02-18,18:17,business,経済,11,日刊ゲンダイDIGITAL,迫る史上最高値更新…新NISA高配当銘柄の注意点 “あおぞら銀ショック”が初心者を襲う,30,https://news.yahoo.co.jp/articles/2f7c48438bfad7b0fb2f8367fa3c178aff045881,2/18(日) 13:58
2024-02-18,18:17,business,経済,12,産経新聞,北陸新幹線延伸　見えない全線開業時期　敦賀ー新大阪は未着工,29,https://news.yahoo.co.jp/articles/390a14dfc4cacca617060e73a2d8d873e6609011,2/18(日) 17:20
2024-02-18,18:17,business,経済,13,読売新聞オンライン,トンネル列車火災で生き残った使命感…「あずきバー」の井村屋会長、たどり着いた先は「全社員の活躍と幸せ重視」,29,https://news.yahoo.co.jp/articles/66bc0ecba0ca128e1c401e4efc8854be2d0a939e,2/18(日) 12:00
2024-02-18,18:17,business,経済,14,ファイナンシャルフィールド,体調不良で欠勤。翌日「有休」を申請したのですが、会社に「事後の申請は認めない」と言われました。これって普通なんですか？ 諦めるしかないのでしょうか…？,27,https://news.yahoo.co.jp/articles/19180b2afacf5b32341d8220880462adb4e23e8e,2/18(日) 13:50
2024-02-18,18:17,business,経済,15,産経新聞,北陸新幹線延伸　東京と直通も関西との交流後退に懸念,25,https://news.yahoo.co.jp/articles/d1638a40a7de21cb90c01259c6002add36e6a7c3,2/18(日) 17:20
2024-02-18,18:17,business,経済,16,ファイナンシャルフィールド,26歳男性です。年収「300万円」という理由で彼女の親から結婚を反対されています…平均より少ないのでしょうか？,24,https://news.yahoo.co.jp/articles/98fc564e00f7b217eb66d61db018324d7bbdf0f0,2/18(日) 10:20
2024-02-18,18:17,business,経済,17,現代ビジネス,すでに「移民国家」になりつつある日本、外国人労働者は地方を救うか,22,https://news.yahoo.co.jp/articles/d3b6d8111d2ba4c7fa72de48cfbbe4440158ff24,2/18(日) 6:19
2024-02-18,18:17,business,経済,18,乗りものニュース,「F-35の部品をイスラエルに送るな！」オランダ司法が政府に命令 アメリカへの影響は？,20,https://news.yahoo.co.jp/articles/f2b2f648a207d47a1751bbcf7e1d5c37aa0461a6,2/18(日) 17:12
2024-02-18,18:17,business,経済,19,週刊SPA!,大手ゲームメーカー7社で分かれた明暗。『桃鉄』コナミは過去最高、『FF』頼みのスクエニetc.,20,https://news.yahoo.co.jp/articles/14897f7fd44e3b34d415fc892049d7e3130718ba,2/18(日) 8:53
2024-02-18,18:17,business,経済,20,毎日新聞,日銀が金融正常化へ「GOサイン」でも円安が当面続くワケ,17,https://news.yahoo.co.jp/articles/f71036818378e968169395c1b2252a464ab1d686,2/18(日) 9:30
2024-02-18,18:17,business,経済,21,ファイナンシャルフィールド,【宅配便まで値上げ…】大手が次々と発表。2024年4月からどれくらい値段が上がるの？,16,https://news.yahoo.co.jp/articles/5d4a0c89a87a35086800916293765e405f8f53e7,2/18(日) 15:20
2024-02-18,18:17,business,経済,22,乗りものニュース,京成バス「現金100円区間を廃止！」海浜幕張駅の周辺 ICカードを使うと損する珍現象が消滅へ,15,https://news.yahoo.co.jp/articles/2def0a3b09852c81855770c0f007cf51046b350b,2/18(日) 15:42
2024-02-18,18:17,business,経済,23,36Kr Japan,日本の輸入EV販売台数、24年1月は1186台　中国BYDが2割占める,14,https://news.yahoo.co.jp/articles/ea4a648bfe73cdbf72ab2bc8d9dea6bec107f992,2/18(日) 8:04
2024-02-18,18:17,business,経済,24,まいどなニュース,「後続車が怒るかも」と焦らないで！　「交差点の右折が怖い」解消へ　手順、待つ場所、優先順位をおさらい,14,https://news.yahoo.co.jp/articles/8aaf3faf8176792b80187d393667d8645aad606c,2/18(日) 11:50
2024-02-18,18:17,business,経済,25,現代ビジネス,実は日本では物価・賃金の好循環は起きていない～春闘ではなく中小企業を見なければ賃金の実態は解らない,14,https://news.yahoo.co.jp/articles/8c4f60f604cf51138c9c4a300b4f100390d0a0dd,2/18(日) 6:04
2024-02-18,18:17,business,経済,26,J-CASTニュース,学歴フィルターはいまも存在するのか？　「縛りは緩く」かつての就活とは様変わり...識者が指摘,13,https://news.yahoo.co.jp/articles/0ea123ceb35dbcc91f507d22ac6fbd35893e4f6e,2/18(日) 12:00
2024-02-18,18:17,business,経済,27,乗りものニュース,「あれ、さっきまで確かに『埼玉』だったんだが…」 地図がおかしな「県境密集地帯」を貫く道路が、ある意味スゴイ件,13,https://news.yahoo.co.jp/articles/2b30dfcb369f550bf13f6e27d110aa45997fc2da,2/18(日) 12:12
2024-02-18,18:17,business,経済,28,ファイナンシャルフィールド,職場では日曜出勤だと、平日に「振替休日」を取得します。平日休みだと「損」している気がするのですが、違法ではないのでしょうか？「休みの価値」に変わりはありませんか？,13,https://news.yahoo.co.jp/articles/71efffffbe364fe60c152fe460d54afeb03adab9,2/18(日) 13:40
2024-02-18,18:17,business,経済,29,LIMO,【厚生年金】月15万円と思っていたら年金支給日に「30万円」も振り込まれた！使っていいの？,13,https://news.yahoo.co.jp/articles/81c8ecda181e563ed5705bda68e9ccf1b07e39fe,2/18(日) 14:41
2024-02-18,18:17,business,経済,30,Merkmal,年間50億円！ 羽越本線「村上～鶴岡」が大赤字を垂れ流し続ける根本理由,12,https://news.yahoo.co.jp/articles/175b6735df075d10be95e7f73590c36565d178ac,2/18(日) 6:11
2024-02-18,18:17,business,経済,31,Bloomberg,英米、ウクライナにＡＩ搭載無人機の供与目指す－関係者,11,https://news.yahoo.co.jp/articles/8711385466c3ab5eeb0264023cb96bc3b5ed9456,2/18(日) 14:45
2024-02-18,18:17,business,経済,32,FNNプライムオンライン,同僚の悪ふざけで転落　天橋立「股のぞき」で50代男性が15メートル落下　落下事故での救助要請は初,11,https://news.yahoo.co.jp/articles/608a7f2e979dc7d04a8b44a56e33c52879a7c255,2/18(日) 11:13
2024-02-18,18:17,business,経済,33,VAGUE,10年ぶりのフルモデルチェンジで4代目に進化！ 新型ミニ3ドアに登場した「ミニクーパーE」ってどんなクルマ？,11,https://news.yahoo.co.jp/articles/5941900a45a4731e8bad05589e2e01de693e6fa2,2/18(日) 8:30
2024-02-18,18:17,business,経済,34,WEB CARTOP,うぉぉぉ聞いただけで血が沸き立つ！　男の魂をゆさぶるクルマの「グレード名」,10,https://news.yahoo.co.jp/articles/98ac8c657e8a6a8d9514bf376c5352e69130fa0d,2/18(日) 17:30
2024-02-18,18:17,business,経済,35,みんかぶマガジン,早く知った人からマジで得するドルコスト平均法…投資初心者でも、バカでも、複利の効果で着実に資産形成できる,10,https://news.yahoo.co.jp/articles/eca6d433766f324c90cf25d079185f0124d54e03,2/18(日) 9:10
2024-02-18,18:17,business,経済,36,ファイナンシャルフィールド,上司に「定時になったらタイムカードを切れ」と言われます。その後も働いているのですが、これって「違法」ですよね？ 拒否しても大丈夫ですか？,10,https://news.yahoo.co.jp/articles/d40c7d52db5cb40a262b0e8e1f14419bf87d9872,2/18(日) 11:20
2024-02-18,18:17,business,経済,37,プレジデントオンライン,世界では「推しの子」と「鬼滅の刃」どちらが人気なのか…海外にいる2000万人のアニメファンが下した評価,10,https://news.yahoo.co.jp/articles/424520af8ed87ef37c4f5dd569ff530e1627c8b1,2/18(日) 7:17
2024-02-18,18:17,business,経済,38,くるまのニュース,圏央道直結の「茂原一宮道路」3月に延伸！ 外房目指す無料BP、“サーフィンの聖地”も便利に！,9,https://news.yahoo.co.jp/articles/fb88a6e09e187f35a2299ecbaf581d5f709b7ecf,2/18(日) 17:10
2024-02-18,18:17,business,経済,39,WWDJAPAN.com,ワークマン、子供服200億円・肌着500億円の売上計画ぶち上げ,9,https://news.yahoo.co.jp/articles/b4da4ba04c58a974e1e8c931060b37b14ab3d2a3,2/18(日) 16:00
2024-02-18,18:17,business,経済,40,読売新聞オンライン,世界３位の自動車市場インドでＥＶ普及本格化…中国勢の存在感薄く、スズキやテスラ参入へ,9,https://news.yahoo.co.jp/articles/c4baddbd4a5e725d3e8b5a4535aaf461ae42384d,2/18(日) 14:47
