scrp_date,scrp_time,genre_en,genre_jp,rank,media_jp,title,comment,link,date_original
2024-04-12,16:20,world,国際,1,FNNプライムオンライン（フジテレビ系）,大谷選手になりすまして銀行に電話も…不正送金24億5000万円で元通訳の水原一平氏が銀行詐欺容疑で訴追　大谷選手は被害者,318,https://news.yahoo.co.jp/articles/6496311e4d1dc807929a1fd337dfea9aa11f2731,4/12(金) 6:09
2024-04-12,16:20,world,国際,2,TBS NEWS DIG Powered by JNN,【速報】米・連邦検察が水原一平容疑者を銀行詐欺容疑で訴追　大谷翔平選手の口座からの送金額は約24億5000万円　現地12日にも出廷,221,https://news.yahoo.co.jp/articles/bc5a4c33fa522e3cc4d4ff7be6c905891d262e8c,4/12(金) 2:49
2024-04-12,16:20,world,国際,3,時事通信,岸田首相演説に高評価　米議会、総立ち拍手も,123,https://news.yahoo.co.jp/articles/1160014d1a7fb365aa583c0e4bb734182dce4458,4/12(金) 7:06
2024-04-12,16:20,world,国際,4,日テレNEWS NNN,韓国総選挙で野党圧勝　尹大統領「国政を刷新する」…日韓関係に影響は？＜中継＞,45,https://news.yahoo.co.jp/articles/53b1dd6b2f3ba76a3de8af27736379478655530e,4/11(木) 17:43
2024-04-12,16:20,world,国際,5,産経新聞,中国が日米首脳会談に反発「中国を中傷、攻撃」　台湾言及も「粗暴な内政干渉」と主張,44,https://news.yahoo.co.jp/articles/0539f1b71b265a4d1b39811dd510267ab96c620a,4/11(木) 18:22
2024-04-12,16:20,world,国際,6,毎日新聞,水原一平容疑者、大谷翔平選手の資金で4900万円分野球カード購入,44,https://news.yahoo.co.jp/articles/8952ab8600eb82cb5fcdaa926c4934264be1afa7,4/12(金) 5:57
2024-04-12,16:20,world,国際,7,読売新聞オンライン,前妻殺害で無罪評決のＯ・Ｊ・シンプソン氏死去、７６歳…アメフトの元スーパースター,34,https://news.yahoo.co.jp/articles/05d4ebdc1f1f00f789d0ebc93dce15bde01ad41a,4/12(金) 0:31
2024-04-12,16:20,world,国際,8,読売新聞オンライン,ミャンマー東部で戦闘激化、武装勢力が主要都市制圧…劣勢の国軍関係者６００人以上投降,32,https://news.yahoo.co.jp/articles/7b929c20faf07fffbf753fdca8b7e96980d8a349,4/12(金) 7:53
2024-04-12,16:20,world,国際,9,クーリエ・ジャポン,仏紙「不気味な“人口減少実験室”ニッポンでいま起きていること」,29,https://news.yahoo.co.jp/articles/5e02db52407097acd1cc15f8be87a56ef5ea7d3d,4/12(金) 9:45
2024-04-12,16:20,world,国際,10,ニューズウィーク日本版,SNSで起きた『大吉原展』炎上、当事者の東京芸大美術館は本当に無自覚だったのか?,28,https://news.yahoo.co.jp/articles/00987db74f5d86762b8f5747675841cace44f59f,4/12(金) 15:30
2024-04-12,16:20,world,国際,11,BBC News,ヴェトナムの巨額銀行詐欺で死刑判決　不動産業の女性被告に,19,https://news.yahoo.co.jp/articles/a359efcca8ae6bf3bf7e866ca7c9a807ed6a2d7d,4/12(金) 11:58
2024-04-12,16:20,world,国際,12,JBpress,「親日派」尹錫悦大統領はどこで間違えた、韓国与党が想定以上の惨敗,17,https://news.yahoo.co.jp/articles/aa6ba3c031337256fd66bbd9396c53bbabc83df0,4/12(金) 6:02
2024-04-12,16:20,world,国際,13,Forbes JAPAN,ロシア軍、ウクライナ東部チャシウヤールに照準　守備隊は「戦車の罠」仕掛ける,16,https://news.yahoo.co.jp/articles/4946a75cf2f50515f4b0d749905ec4d45756c4a5,4/12(金) 12:30
2024-04-12,16:20,world,国際,14,中央日報日本語版,バイデン大統領の横で「中国は同盟国」…岸田首相、失言ハプニング,16,https://news.yahoo.co.jp/articles/739b501dbf005b0a32c3f554aa91318d8502f333,4/12(金) 7:53
2024-04-12,16:20,world,国際,15,ハンギョレ新聞,「中国抑制」に向けて日本の軍事大国化・米日の軍事一体化が加速,15,https://news.yahoo.co.jp/articles/481f9489254d5d4395259126922ca9f22acfab46,4/12(金) 13:59
2024-04-12,16:20,world,国際,16,共同通信,「帝国の慰安婦」著者に無罪判決　韓国高裁、差し戻し審で,13,https://news.yahoo.co.jp/articles/c3c9a3bfc6db4c3e57171cfee7643e7823a99de0,4/12(金) 15:40
2024-04-12,16:20,world,国際,17,テレビ朝日系（ANN）,米連邦検察が水原容疑者を“銀行詐欺”の罪で訴追　被害額は約24億5000万円にのぼる,12,https://news.yahoo.co.jp/articles/a908c5451984160281fd8b90e66c61e53b3dc233,4/12(金) 7:56
2024-04-12,16:20,world,国際,18,FNNプライムオンライン（フジテレビ系）,【速報】ドジャース大谷選手の元通訳・水原一平氏を訴追　24億5000万円以上不正送金の容疑,12,https://news.yahoo.co.jp/articles/29581678dbf47df99dc53fc1cee7eed14f29d6c1,4/12(金) 3:39
2024-04-12,16:20,world,国際,19,The News Lens Japan,それでも日韓関係への影響は限定的…予想通り惨敗の韓国・尹政権,12,https://news.yahoo.co.jp/articles/160c7c574e5161ba81d3ed6cab2fe24d2937dca7,4/12(金) 11:51
2024-04-12,16:20,world,国際,20,The News Lens Japan,中国で百日咳が急増、死者13人の報告も WHO「乳児の死亡原因で大きな割合」,12,https://news.yahoo.co.jp/articles/006016c4ec7098ff859e217ce78b65b065bb6cf9,4/12(金) 11:51
2024-04-12,16:20,world,国際,21,中央日報日本語版,「イタリア、Ｇ７首脳会議にアルゼン・エジプトなど８カ国招待」,11,https://news.yahoo.co.jp/articles/3f88c29e46cd28aa6383f561731d773462a9abd6,4/12(金) 15:07
2024-04-12,16:20,world,国際,22,ニューズウィーク日本版,トランプ支持者は「ヒトラー宥和政策」よりひどい…「プーチンは西側に粘り勝ち、帝国拡大を狙っている」,11,https://news.yahoo.co.jp/articles/0fa29aac5bb51e650e5aa0377eb67e44abbe8758,4/12(金) 6:20
2024-04-12,16:20,world,国際,23,中央日報日本語版,ＰＣＡ「韓国政府、メイソンに３２０３万ドル賠償」判決,11,https://news.yahoo.co.jp/articles/3c4d2542262e8f8f4ba0e4cef6e28878be103f8f,4/12(金) 14:54
2024-04-12,16:20,world,国際,24,中央日報日本語版,「おばあさんかと思った」　長距離徒歩の旅で老けてしまった２０代の中国女性,10,https://news.yahoo.co.jp/articles/442ebd6cd6ff8c702ce3b72daa0043413ea867ae,4/12(金) 15:29
2024-04-12,16:20,world,国際,25,ブラジル日報,《ブラジル》車買ったその日に転落死＝母を驚かせようと運転焦り,10,https://news.yahoo.co.jp/articles/ec37b85c638d654db412ebc222263668670c7599,4/12(金) 7:54
2024-04-12,16:20,world,国際,26,産経新聞,英国で中国からの偽造切手が大量に流通　国内から「中国共産党が仕掛ける経済戦争」と反発の声,10,https://news.yahoo.co.jp/articles/3b1cf2ceb9e80d0dfd33188439fbe3d96b5fe415,4/12(金) 9:14
2024-04-12,16:20,world,国際,27,BBC News,大谷選手の口座から24億円超を不正送金の疑い　水原元通訳を米検察が訴追,10,https://news.yahoo.co.jp/articles/69811303a477420a0563a6ecf2ef01d4c9cf9f4c,4/12(金) 14:17
2024-04-12,16:20,world,国際,28,テレビ朝日系（ANN）,大谷選手は潔白…連邦検察が”被害者”と断定　「24億円盗んだ」元通訳・水原氏を訴追,10,https://news.yahoo.co.jp/articles/619c817fe080e516358a36a951a9c1eddc064941,4/12(金) 12:06
2024-04-12,16:20,world,国際,29,TBS NEWS DIG Powered by JNN,約24億5000万円を送金か　元通訳・水原一平容疑者を銀行詐欺の容疑で訴追　大谷翔平氏のファン「本当に残念」,9,https://news.yahoo.co.jp/articles/53431609b692027d45e104944a703c8555d0eee5,4/12(金) 16:04
2024-04-12,16:20,world,国際,30,ABEMA TIMES,アメリカ欧州軍の司令官が警告「ウクライナの砲弾間もなく枯渇、敗北も」,9,https://news.yahoo.co.jp/articles/3743ef4b59395a63c67dd23c3eb94c0a12ee6164,4/11(木) 23:33
2024-04-12,16:20,world,国際,31,BBC News,キーウ近郊の主要発電所、ロシアの攻撃で破壊される　ウクライナ最大規模の電力供給源,9,https://news.yahoo.co.jp/articles/f1c8ff3c420db2eae57bb913fa4bc20ffa0f7a8d,4/12(金) 11:51
2024-04-12,16:20,world,国際,32,BUSINESS INSIDER JAPAN,ガソリン式の草刈り機等を規制する自治体が増加中…ブロワーの排出量は小型車並み（海外）,9,https://news.yahoo.co.jp/articles/6b03357086e8fee9a6523b38edd1fe756e0a297b,4/12(金) 8:10
2024-04-12,16:20,world,国際,33,ハフポスト日本版,日本が安い海外旅行先に？ 東京が世界4位。SNSで話題になったある画像とは,9,https://news.yahoo.co.jp/articles/43275f2137d463ce7f1d1e9b1ec59e3a2ecbc067,4/11(木) 16:30
2024-04-12,16:20,world,国際,34,ロイター,米財務省高官が中国の「ただ乗り」批判、途上国向け融資削減で,9,https://news.yahoo.co.jp/articles/f0fba6ef1629cba3808f5d201f2e7c7ee3138fa5,4/12(金) 14:25
2024-04-12,16:20,world,国際,35,TBS NEWS DIG Powered by JNN,イスラエル国防相「イランの報復攻撃には“適切な対応”必要」,8,https://news.yahoo.co.jp/articles/c1e5958ee5ba4b90741f8645d08fc924d2a51408,4/12(金) 12:27
2024-04-12,16:20,world,国際,36,ロイター,英特殊部隊がウクライナで活動とロシア主張、「紛争に直接関与」,8,https://news.yahoo.co.jp/articles/8fd1ef96285c419bcda0af21016a1b6afc8749cd,4/12(金) 11:18
2024-04-12,16:20,world,国際,37,中央日報日本語版,韓国、浦項海岸で鵜２００羽余りが大量死…原因調査へ,7,https://news.yahoo.co.jp/articles/85a24365ca37637bd2fc481939913f9cd5ffab83,4/12(金) 14:58
2024-04-12,16:20,world,国際,38,ロイター,米上院銀行委員長、バイデン氏に中国製ＥＶの恒久的な排除要請,7,https://news.yahoo.co.jp/articles/eafa16d0fdb037b953a01fdd60b06aed187ae67d,4/12(金) 11:55
2024-04-12,16:20,world,国際,39,テレビ朝日系（ANN）,米連邦検察が水原氏を銀行詐欺の罪で訴追　被害額は24億5000万円に,7,https://news.yahoo.co.jp/articles/ba876b987af4c8571bf18df58eb5cbb19efad800,4/12(金) 5:02
2024-04-12,16:20,world,国際,40,テレビ朝日系（ANN）,「知らなかった」という大谷翔平選手の主張は正確　元通訳の水原一平氏を数百万ドル盗んだ疑いで近く訴追へ,7,https://news.yahoo.co.jp/articles/01d350686dff952fe801a99803fd20a4fb978da2,4/11(木) 16:36
