scrp_date,scrp_time,genre_en,genre_jp,rank,media_jp,title,comment,link,date_original
2025-04-12,03:10,TTL,総合,1,TBS NEWS DIG Powered by JNN,【速報】林官房長官「新たな給付金や減税を検討している事実はない」,455,https://news.yahoo.co.jp/articles/5da2f7f2041e1de1e3b6be44d23d709ff78320dd,4/11(金) 16:59
2025-04-12,03:10,TTL,総合,2,Daiichi-TV（静岡第一テレビ）,広末涼子容疑者　取り調べ不十分と捜査関係者　１０日間の勾留が認められる　傷害容疑で逮捕（静岡）,409,https://news.yahoo.co.jp/articles/a8b67a33af493c8dd9d3fe308accf10cd3590ae5,4/11(金) 19:30
2025-04-12,03:10,TTL,総合,3,SmartFLASH,石橋貴明　15歳少女を“局部呼び”で泣かせ若手女優に次々“セクハラ行為”…地上波の「不適切場面」がネットで噴出,388,https://news.yahoo.co.jp/articles/0607ad0e1e1c5610830fb4c7acbec51d36c763a2,4/11(金) 19:55
2025-04-12,03:10,TTL,総合,4,毎日新聞,高知空港に緊急着陸の米軍機　2週間過ぎるも離陸せず市民団体抗議,346,https://news.yahoo.co.jp/articles/2b7d96ae09a20971b21802f1494fd78e551f0f49,4/11(金) 16:10
2025-04-12,03:10,TTL,総合,5,テレビ朝日系（ANN）,自民幹事長「下げる話だけでは国民に迷惑」与野党から「消費減税」求める声に,331,https://news.yahoo.co.jp/articles/7c8da6fdeca41ac2274d5f36ff73cebcffdc02fa,4/11(金) 19:35
2025-04-12,03:10,TTL,総合,6,TBS NEWS DIG Powered by JNN,中国・対米関税125%　トランプ関税145%に報復措置　貿易戦争激化　「大統領ではあるがやり過ぎ」アメリカ国内商売の現場から悲鳴の声,282,https://news.yahoo.co.jp/articles/9f5aa66e335d61c6450e5b84f78384231db971e9,4/11(金) 17:10
2025-04-12,03:10,TTL,総合,7,デイリースポーツ,巨人　１０失点の戸郷は２軍降格が決定　阿部監督が明言「示しがつかない」あえて続投させた理由も説明,268,https://news.yahoo.co.jp/articles/bb5430a5eb0457ac799e211d31b9887a743d7bb5,4/11(金) 21:21
2025-04-12,03:10,TTL,総合,8,女性自身,「＃八代亜紀さんの尊厳を守れ」“私的写真”封入アルバムに止まらぬファンの怒り…販売元は「受けて立つ所存」と徹底抗戦,241,https://news.yahoo.co.jp/articles/aef56c4c1c4f5670c122d2960f718c5f3cfb286c,4/11(金) 15:20
2025-04-12,03:10,TTL,総合,9,テレビ朝日系（ANN）,物価高対策…減税？現金給付？　“バラマキ”批判も与野党競う　トランプ関税も理由に,217,https://news.yahoo.co.jp/articles/6ad116803af5a5dc15a2985cb75a61f708d9664a,4/11(金) 10:54
2025-04-12,03:10,TTL,総合,10,TKUテレビ熊本,独自）「同情するなら血をくれ」八代広域消防幹部職員が掲示板に不適切表現で献血呼びかけ【熊本】,216,https://news.yahoo.co.jp/articles/c5d648fbbd72fe51f219945b11a7df70eae91698,4/11(金) 19:37
2025-04-12,03:10,TTL,総合,11,ＡＦＰ＝時事,中国、米に125%の報復関税も「これ以上は無視する」,195,https://news.yahoo.co.jp/articles/ff604e12fa637f514fbd470f096cb693b2853db6,4/11(金) 19:58
2025-04-12,03:10,TTL,総合,12,共同通信,BPO「月曜から夜ふかし」審議　不適切編集、放送倫理違反の疑い,193,https://news.yahoo.co.jp/articles/18d081499a6f5f6be72d47aa3a89527ff60476ba,4/11(金) 19:56
2025-04-12,03:10,TTL,総合,13,東スポWEB,【巨人】エース戸郷翔征が自己ワースト１０失点ＫＯに涙目　阿部監督は笑顔でマウンドへ,178,https://news.yahoo.co.jp/articles/98808dab5692384db6722dc7b3b9ced4e77676ee,4/11(金) 20:16
2025-04-12,03:10,TTL,総合,14,Daiichi-TV（静岡第一テレビ）,静岡市から車で1時間「コストコ南アルプス倉庫店」オープン　1週間並んだ人も（山梨・南アルプス市）,168,https://news.yahoo.co.jp/articles/dbf1b9330de88d5ecb9392fcf431cea581ae9b59,4/11(金) 18:16
2025-04-12,03:10,TTL,総合,15,デイリースポーツ,吉村洋文知事「万博」批判ネガティブ報道→「特に東京のメディアが徹底的に」　万博幼児トイレ批判にも,166,https://news.yahoo.co.jp/articles/ccfe9c7ce16e2e5aed91a1c4cad2a0de7ba134e3,4/11(金) 20:32
2025-04-12,03:10,TTL,総合,16,デイリースポーツ,巨人・戸郷が悪夢の１０失点大炎上で３戦連続のＫＯ　阿部監督、１０失点でもベンチ立たず騒然→球数１０６球でバッテリーごと交代,147,https://news.yahoo.co.jp/articles/34d0c326f6c8d2872f5c3a809d34af0a2c35837a,4/11(金) 19:37
2025-04-12,03:10,TTL,総合,17,共同通信,偽警官？いや本物でした　岩手県警が注意情報を訂正,138,https://news.yahoo.co.jp/articles/8068804dacf488b35b73b7f61ca6d570632f19f8,4/11(金) 20:58
2025-04-12,03:10,TTL,総合,18,福島テレビ,入学翌日の小1児童がバスに置き去り…近くの店舗に助け求める＜福島県会津坂下町＞,131,https://news.yahoo.co.jp/articles/9714ef9e80c39da550265147c9a420af0b2db256,4/11(金) 18:58
2025-04-12,03:10,TTL,総合,19,FNNプライムオンライン（フジテレビ系）,国民・玉木代表が若者減税法案めぐり「誤ったメッセージ与えてはならない」　批判受け氷河期世代などすべての現役世代への気配り強調,122,https://news.yahoo.co.jp/articles/2f5bd8433267288d2a3d075389b4f2d566e8cb33,4/11(金) 14:22
2025-04-12,03:10,TTL,総合,20,UTYテレビ山梨,「待ちに待ってました」コストコ　予定より2時間半早くオープン　懸念された交通渋滞は混乱見られず,121,https://news.yahoo.co.jp/articles/293866c1388ab8921efc6d90007480c2a27927dd,4/11(金) 4:36
2025-04-12,03:10,TTL,総合,21,TBS NEWS DIG Powered by JNN,消費税の軽減税率0％に引き下げで5兆円の減収　消費税減税求める声高まるも加藤財務大臣「適当でないとの考えに変更ない」,118,https://news.yahoo.co.jp/articles/c0464df3317de6ec84505d1eb37eb3e8e4ed1cdf,4/11(金) 11:55
2025-04-12,03:10,TTL,総合,22,千葉日報オンライン,【速報】特支児童をごみ箱に入れて蹴る、転ばせてけが　30代の女性教諭が体罰、校長に虚偽報告も　市教委謝罪　千葉・松戸市,117,https://news.yahoo.co.jp/articles/5d7d3be39047eee2b231aadb9b05a92348c3c42d,4/11(金) 11:30
2025-04-12,03:10,TTL,総合,23,日刊スポーツ,【中日】井上監督、怒り隠さず「オレも我慢をしてきたけど…」打順や選手起用の変更を示唆,115,https://news.yahoo.co.jp/articles/ac175c60ffc6c2ea01669cbef17c48b3ba39a321,4/11(金) 22:53
2025-04-12,03:10,TTL,総合,24,産経新聞,万博「こども用トイレ」一部に仕切りなし異例の「中国式」　男子も女子も一緒、SNS賛否,112,https://news.yahoo.co.jp/articles/e9100e7b7aced5c4d46d89547a98a78513e9b885,4/11(金) 7:00
2025-04-12,03:10,TTL,総合,25,時事通信,ガソリン値下げ、5月中に　自民幹事長、前倒し目指す,112,https://news.yahoo.co.jp/articles/597d1f5a3afb5691f9fa6d768c718c28ec1f139e,4/11(金) 18:55
2025-04-12,03:10,TTL,総合,26,TBS NEWS DIG Powered by JNN,公明・斉藤代表　現金給付の財源「赤字国債の検討もあり得る」,104,https://news.yahoo.co.jp/articles/0b01a27d74a26065967b87370031aa17c93ddf9d,4/11(金) 13:00
2025-04-12,03:10,TTL,総合,27,47NEWS,「あなたの年金申請は認められません」うつ病女性の涙　精神・発達障害で不支給が２倍増？ナゾを追った,102,https://news.yahoo.co.jp/articles/b44bb28452ec3cfbf3a9241c8743c48c049609d0,4/11(金) 9:02
2025-04-12,03:10,TTL,総合,28,週刊金曜日,日本クルド文化協会がヘイト繰り返す渡辺賢一氏を提訴「平和的生存権の侵害許すな」,99,https://news.yahoo.co.jp/articles/45074fdb597df0db3847455c41b537e4a27a010b,4/11(金) 9:10
2025-04-12,03:10,TTL,総合,29,信濃毎日新聞デジタル,「歩くしかないお年寄りは困る…」戸惑う住民　町になくてはならないスーパーが突然閉店　「さらに補助金出せない」行政も支援断念…生鮮食料品取り扱いは1店のみに,98,https://news.yahoo.co.jp/articles/95dfb344f3b2188dc666e2cb1b15ce841c192f57,4/11(金) 6:30
2025-04-12,03:10,TTL,総合,30,TOSテレビ大分,広末涼子出演予定の大分市の音楽イベント中止決定　傷害事件の逮捕受け　当初は代役検討も,97,https://news.yahoo.co.jp/articles/270cc0146ad2c0d97f995365e7f93cc90351a4d7,4/11(金) 18:31
2025-04-12,03:10,TTL,総合,31,日刊スポーツ,「就職氷河期を裏切るなんてとんでもない」国民・榛葉幹事長「若者減税法案」のSNS炎上で釈明,95,https://news.yahoo.co.jp/articles/4f67983bba55b11eb0799fd1ccddf6c8b3c008b2,4/11(金) 17:44
2025-04-12,03:10,TTL,総合,32,スポニチアネックス,前澤友作氏、政府の“3～4万円”給付案に持論「またお金ばらまくみたいだけど」「どうせ資金使うなら…」,87,https://news.yahoo.co.jp/articles/df0a52fbfa2f7f18f5bbea1af51c8686e4187bf1,4/11(金) 15:12
2025-04-12,03:10,TTL,総合,33,共同通信,兵庫県、文春の情報源調査を依頼　第三者委に「報道自由に無理解」,85,https://news.yahoo.co.jp/articles/1696ac5c649df81884349e5f46a744bbd6809a3e,4/11(金) 14:33
2025-04-12,03:10,TTL,総合,34,時事通信,東京株、一時1900円超安　米関税で世界経済減速懸念　円高重し、半年ぶり142円台,84,https://news.yahoo.co.jp/articles/77ef8d3443194e602be812a103b76eb0bb4f7f6b,4/11(金) 9:07
2025-04-12,03:10,TTL,総合,35,デイリー新潮,六本木のアミューズメントカジノで「ポーカーの負け代250万円」が支払えなくなった客が警察に駆け込んだ　店側は取材に「無銭飲食と同じ。必ず払ってもらう」,84,https://news.yahoo.co.jp/articles/4dbe67f306da9027377cc8f7877d63024e9e299d,4/11(金) 12:16
2025-04-12,03:10,TTL,総合,36,テレビ朝日系（ANN）,自民幹事長「下げる話だけでは国民に迷惑」　与野党から「消費減税」求める声に,84,https://news.yahoo.co.jp/articles/f8e6846da135a021b681b56ca7b400167079eb4b,4/11(金) 19:16
2025-04-12,03:10,TTL,総合,37,FNNプライムオンライン（フジテレビ系）,【速報】“日本三大料亭”「金田中」社長・岡副真吾容疑者（63）を覚醒剤と大麻所持の疑いで逮捕　自宅を家宅捜索、違法薬物など押収,82,https://news.yahoo.co.jp/articles/67fb88c0e7c5195851f3ad1a1f4c7d74526849b3,4/11(金) 10:07
2025-04-12,03:10,TTL,総合,38,共同通信,米大統領、防衛費増含め対日交渉　安保条約は不公平と重ねて不満,82,https://news.yahoo.co.jp/articles/5208586397526ba6d9446bbe2b1ca1195a0d8945,4/11(金) 4:34
2025-04-12,03:10,TTL,総合,39,日刊スポーツ,大谷翔平サイン入り実使用ユニホーム１億円で販売へ　23日から大丸東京で抽選申し込み開始,82,https://news.yahoo.co.jp/articles/5ad892a426395e96300490072b6da0e3ad775ae4,4/11(金) 16:15
2025-04-12,03:10,TTL,総合,40,TBS NEWS DIG Powered by JNN,【中日】逆転負け...“鬼門甲子園”で11連敗 今季最多タイ借金3 髙橋宏4回5失点KOで2敗目 初回に4失点 上林2ランも、打線は12三振,81,https://news.yahoo.co.jp/articles/baeb0cf1ee7ee5a94a76183829e560d02dc9bd31,4/11(金) 21:18
