scrp_date,scrp_time,genre_en,genre_jp,rank,media_jp,title,comment,link,date_original
2025-12-30,09:37,domestic,国内,1,日刊スポーツ,橋下徹氏「高市さんの存立危機事態発言は何の抑止力も生まれなかった」中国軍台湾包囲演習に私見,416,https://news.yahoo.co.jp/articles/b6df7deae21a46ed81ee09d5fe249494222c6a48,12/30(火) 6:15
2025-12-30,09:37,domestic,国内,2,テレビ朝日系（ANN）,人口7人瀬戸内海の島　中国人が土地購入、島民の不安高まる　買い戻すためクラファン,223,https://news.yahoo.co.jp/articles/5586b2616ae4e99b904c2f827c18aebb5d2bb2fc,12/29(月) 13:45
2025-12-30,09:37,domestic,国内,3,スポニチアネックス,橋下徹氏　中国の軍事演習、日本政府に「で、日本は何をする？国内だけで威勢のいい口だけ番長が最悪…」,222,https://news.yahoo.co.jp/articles/79a22efca05ebfd17c0606053de1de0fce92b113,12/29(月) 12:18
2025-12-30,09:37,domestic,国内,4,TBS NEWS DIG Powered by JNN,日本海側を中心に雷を伴った雪や雨　太平洋側はすっきりと晴れ　きょうは冷え込み和らぐも…大みそか・三が日は「真冬の寒さ」に,212,https://news.yahoo.co.jp/articles/c9f14afd76e9ac0ea086cc315054ae4b82d09806,12/30(火) 6:05
2025-12-30,09:37,domestic,国内,5,日テレNEWS NNN,高田馬場エステ店女性店長刺傷　中国籍の男（35）を殺人未遂の疑いで逮捕　8月から複数回来店　エステ料金支払いでトラブルか,211,https://news.yahoo.co.jp/articles/37c889aa5078fa7ff8ab063b050d4b541cde89ba,12/30(火) 3:12
2025-12-30,09:37,domestic,国内,6,共同通信,肘近くまで腕巻き込まれ　エスカレーター、救出かなわず,203,https://news.yahoo.co.jp/articles/b5d08fd54a6a94768acdc1dfe0e345af477236b9,12/29(月) 21:35
2025-12-30,09:37,domestic,国内,7,毎日新聞,お年玉に「えっ、これだけ?」がっかりした子どもをしからないで,150,https://news.yahoo.co.jp/articles/7c3dc7f3a9601ab4f00d4e30d3b022bc7d31cc1d,12/29(月) 10:00
2025-12-30,09:37,domestic,国内,8,日刊スポーツ,竹田恒泰氏、中国軍“台湾包囲演習”にぴしゃり「これでは世界から尊敬される国にはなれません」,146,https://news.yahoo.co.jp/articles/a96eb66e7b7759a2b97c07af9a673eadaa0628eb,12/30(火) 8:19
2025-12-30,09:37,domestic,国内,9,Yahoo!ニュース オリジナル 特集,環境破壊や土砂災害、景観の悪化――全国に乱立するメガソーラー、なぜ中止にならない？,113,https://news.yahoo.co.jp/articles/27a2fa31b63ae108e7bf23c80505e34c0bfa5256,12/29(月) 15:02
2025-12-30,09:37,domestic,国内,10,日テレNEWS NNN,【速報】高田馬場・エステ店女性刺傷事件で30代中国籍の男を逮捕,111,https://news.yahoo.co.jp/articles/afa30e5c128707f0171c4a9a4e0ace2a0513fc55,12/30(火) 1:07
2025-12-30,09:37,domestic,国内,11,TBS NEWS DIG Powered by JNN,「開かずの扉」はなぜ開いたのか? 森友文書17万ページ“奇跡の開示”の舞台裏　石破前総理・加藤前財務大臣らが証言【報道の日2025】,102,https://news.yahoo.co.jp/articles/a1c94727fa28d9421b0ed1deb70ca8b32e20fc17,12/30(火) 6:30
2025-12-30,09:37,domestic,国内,12,文春オンライン,《「移民が押し寄せる」と誤情報が拡散》マンション高騰も犯罪も「外国人のせい」？　データと現実から見えた本当の論点,98,https://news.yahoo.co.jp/articles/5bb714066a6fc598b4d5111b0028f4ec00e7bac3,12/30(火) 6:21
2025-12-30,09:37,domestic,国内,13,毎日新聞,副首都はどこがいい？　名古屋、横浜、福岡、京都……それぞれの思惑,95,https://news.yahoo.co.jp/articles/61e2f6cea21371faf6d1aaf73141b7fac03e9ff1,12/29(月) 14:01
2025-12-30,09:37,domestic,国内,14,東洋経済オンライン,日本が“唯一の例外”…。『アバター』最新作が“世界で好調”！なのに「日本では出足が鈍い」背景。世界歴代1位＆3位シリーズは洋画不況を覆すか,89,https://news.yahoo.co.jp/articles/b9f365e60ec39d88f3b9944dbade2563356e0fdd,12/30(火) 8:00
2025-12-30,09:37,domestic,国内,15,集英社オンライン,岩屋毅前外相「ハニートラップにかかっている」とのネットの中傷へ思うこと… “高市台湾発言”への見解は「正直、適切でない答弁をしている」,75,https://news.yahoo.co.jp/articles/11e8c4eaf4a478310469817637ea1391007cd55e,12/29(月) 10:00
2025-12-30,09:37,domestic,国内,16,CBCテレビ,「娘の顔が分からない」 5回目のワクチン接種後に起きた“異変” 震えが止まらず発熱・記憶障害も… 当然とされた医療従事者の接種【“ワクチン後遺症”を考える シリーズ8】,68,https://news.yahoo.co.jp/articles/7320138757d9337b41ff19d4ae0be7bf24fffac0,12/30(火) 7:45
2025-12-30,09:37,domestic,国内,17,テレビ朝日系（ANN）,校長室で飲酒…女性校長（57）を処分“酒がなくなった”,68,https://news.yahoo.co.jp/articles/cab07d49f5982f03864d90e2d648ce304a588b72,12/29(月) 19:39
2025-12-30,09:37,domestic,国内,18,共同通信,複数事故も監視員常駐せず　5歳男児死亡のスキー場,62,https://news.yahoo.co.jp/articles/07eb579397c93cdd3f5588ad5314150172a77a66,12/29(月) 18:13
2025-12-30,09:37,domestic,国内,19,デイリースポーツ,橋下徹「国内だけで威勢のいい口だけ番長が最悪」　中国軍が台湾周辺での軍事演習発表「で、日本は何をする？」,60,https://news.yahoo.co.jp/articles/54f4e132c822129040f0f72278e417340c361fef,12/29(月) 11:47
2025-12-30,09:37,domestic,国内,20,集英社オンライン,「石破内閣は80点かな」岩屋毅前外相が自己採点…“日本人ファースト”の盛り上がりには「人間にファーストもセカンドもない！」と違和感も,58,https://news.yahoo.co.jp/articles/ec1d995066590d0e0978b15b8bd275b5939ef412,12/29(月) 10:00
2025-12-30,09:37,domestic,国内,21,TBS NEWS DIG Powered by JNN,【速報・独自】逃走中の中国籍の30代男を確保　東京・新宿区高田馬場で女性（30代）が男に刺される　警視庁,56,https://news.yahoo.co.jp/articles/1f53af39f7f90c25b6a9359f1dc36940f9f63737,12/29(月) 23:59
2025-12-30,09:37,domestic,国内,22,産経新聞,尖閣周辺の中国海警船航行、過去最多の年間356日に　11管本部長「予断許さぬ」,56,https://news.yahoo.co.jp/articles/dc4fe194a082fcdc40e3e56bd44534a3484c2e70,12/30(火) 7:10
2025-12-30,09:37,domestic,国内,23,西日本新聞,「憩いの場を奪わないで」町が入浴施設〝廃止方針〟も波紋…　「説明が足りない」などの声も　「苦渋の決断」設備の改修費に6億円　福岡県篠栗町,54,https://news.yahoo.co.jp/articles/7ea62b933ffd6f35c40186100625e317891b8a17,12/30(火) 7:30
2025-12-30,09:37,domestic,国内,24,日刊スポーツ,中国駐日大使、Ｘで中国軍の台湾包囲軍事演習の正当性主張も“矛盾”へのツッコミ続出,53,https://news.yahoo.co.jp/articles/b0bc5a1fb836bfe763ebcbaa32f4d50a8580886c,12/30(火) 7:26
2025-12-30,09:37,domestic,国内,25,デイリースポーツ,【高市自民】ネット荒れる「露骨すぎる」「尖閣の真横！」「流石にやりすぎ」　中国軍の軍事演習海域の地図ヤバい→台湾島の東西南北を包囲→日本もギリギリ「なぜここ」「ついでに尖閣」「日本は何もできない」,50,https://news.yahoo.co.jp/articles/d8ce724624e2e787a150d19c89a45f351bcf2d95,12/29(月) 14:07
2025-12-30,09:37,domestic,国内,26,日刊スポーツ,山尾志桜里氏、「覚醒した」との声に思い記す「私が明確に対中強硬派に転じたのは…」,49,https://news.yahoo.co.jp/articles/999c04fea2cb5baba1bcd72b1ad5725fd3ef2702,12/30(火) 7:25
2025-12-30,09:37,domestic,国内,27,TBS NEWS DIG Powered by JNN,「踏み外すと土台から崩れる」”極秘”外交文書からひもとく対中国外交の核心　台湾・北朝鮮・人権・・・細川元総理が明かす日中首脳会談の舞台裏,45,https://news.yahoo.co.jp/articles/e7c92216370afd471d8175743b3e490419ccdf37,12/30(火) 7:30
2025-12-30,09:37,domestic,国内,28,J-CASTニュース,荒れる会見...斎藤元彦知事は「真摯に受け止め」「適正、適法」ばかり　外では「斎藤辞めろ」の声、混乱の1年,40,https://news.yahoo.co.jp/articles/6bc56142f7c25b596e1f36c84b655b1de2f637f4,12/29(月) 16:00
2025-12-30,09:37,domestic,国内,29,スポニチアネックス,後藤謙次氏　高支持率の高市内閣を「バルーン政権」と表現　強力な柱がなく「一気に落ちる可能性が」,40,https://news.yahoo.co.jp/articles/233e1c8dc2eb9233f7322ff8b56c856699d621cf,12/29(月) 19:42
2025-12-30,09:37,domestic,国内,30,テレビ朝日系（ANN）,【速報】東京・高田馬場で女性刺され男が逃走　殺人未遂事件として捜査　警視庁,38,https://news.yahoo.co.jp/articles/932faa434c3d00930f5b3366fcd634906e51f306,12/29(月) 13:42
2025-12-30,09:37,domestic,国内,31,集英社オンライン,〈岩屋毅前外相インタビュー〉「排外的な主張が増えてきているのでは？」行き詰まったイスラム土葬墓地問題で橋渡し…「自治体任せにできない」と訴える理由,38,https://news.yahoo.co.jp/articles/0c8a77a66fd4b3d9180d0d662f7e6faa46e4c3ef,12/29(月) 10:00
2025-12-30,09:37,domestic,国内,32,時事通信,自民、「公明票」未練消えず　次期衆院選、維新と協力模索,37,https://news.yahoo.co.jp/articles/255518921c2714fab4409aa5b813ef15dd4251e7,12/30(火) 7:05
2025-12-30,09:37,domestic,国内,33,FRIDAY,【三菱UFJ貸金庫窃盗事件】女性被告の「銀行のお金には手をつけないポリシー」を“崩壊させたもの”,36,https://news.yahoo.co.jp/articles/87c3c02d527687a575c3639e7b8ec4844d71efd2,12/30(火) 8:00
2025-12-30,09:37,domestic,国内,34,プレジデントオンライン,"習近平を悩ませるのは「高市発言」だけではない…中国が読み切れない盟友・プーチンによる""裏切りシナリオ""",35,https://news.yahoo.co.jp/articles/cde97ae0de6ab09305b434bef9cba861b451999a,12/30(火) 7:15
2025-12-30,09:37,domestic,国内,35,TBS NEWS DIG Powered by JNN,「複数台の車が衝突」車9台が絡む事故 6人けがうち1人意識不明の重体　千葉・稲毛区,34,https://news.yahoo.co.jp/articles/86a2ee2c429ec2ba471c7d668f5e732e1d8b0a0a,12/29(月) 14:58
2025-12-30,09:37,domestic,国内,36,毎日新聞,30代女性が刺される　現場から男性逃走　東京・高田馬場,34,https://news.yahoo.co.jp/articles/7e3930cec53025bcf12bc49bb3338e93a2a383d2,12/29(月) 13:16
2025-12-30,09:37,domestic,国内,37,TBS NEWS DIG Powered by JNN,【速報】新宿区エステ店女性店長刺傷事件　逃走していた中国籍の男（35）を逮捕　料金の支払いをめぐる金銭トラブルがあったという情報も　警視庁,33,https://news.yahoo.co.jp/articles/fd5b802159696931612c4ad287942cfb50b9e9c2,12/30(火) 3:34
2025-12-30,09:37,domestic,国内,38,FNNプライムオンライン（フジテレビ系）,エステ店女性刺傷　中国人の男（35）逮捕　料金支払わないなど金銭トラブルも,32,https://news.yahoo.co.jp/articles/440f1caa319284dad7f23fd08abb905cdd4a0452,12/30(火) 6:09
2025-12-30,09:37,domestic,国内,39,産経新聞,米価維持へ先祖返り強めるコメ政策　減反の決まり文句「需要に応じた生産」食糧法に明記へ,30,https://news.yahoo.co.jp/articles/fcb01ed5e99b629806f15bfa1bd41b7dabf31cfa,12/29(月) 20:38
2025-12-30,09:37,domestic,国内,40,FNNプライムオンライン,最低賃金1000円台突入に歓迎と苦悩「これから先、不安しかない額」　引き上げでどう変わった?働く側・雇う側の本音　専門家はリスク指摘,29,https://news.yahoo.co.jp/articles/34c5aba4d974fa6e7bab320d62968c449f585d4b,12/29(月) 18:00
