scrp_date,scrp_time,genre_en,genre_jp,rank,media_jp,title,comment,link,date_original
2025-08-30,05:08,world,国際,1,ＡＦＰ＝時事,「南京事件」描く映画、中国で大ヒット 残虐描写を多くの子どもが鑑賞,33,https://news.yahoo.co.jp/articles/cab0e8937aa6e06f561f6977dcb26979a4251ffc,8/29(金) 15:51
2025-08-30,05:08,world,国際,2,TBS NEWS DIG Powered by JNN,【速報】韓国前大統領の妻を起訴　あっせん収賄罪など　尹錫悦氏の妻・金建希被告　大統領経験者と配偶者がともに起訴は初,33,https://news.yahoo.co.jp/articles/2b87ab0eafb10ab804563f2e8c7514da4763fa0a,8/29(金) 11:21
2025-08-30,05:08,world,国際,3,毎日新聞,タイ・ペートンタン首相が失職　国境紛争巡る「不適切発言」で　憲法裁命令,29,https://news.yahoo.co.jp/articles/7d0adcb35d82795fa999f2d2008ede3191b5f9d5,8/29(金) 17:53
2025-08-30,05:08,world,国際,4,ニューズウィーク日本版,今後20年間、イギリスはロシアの脅威にさらされる――英シンクタンク,23,https://news.yahoo.co.jp/articles/1458341f7e8c4a9e83ef50f8ffed35a38c154be0,8/29(金) 21:58
2025-08-30,05:08,world,国際,5,産経新聞,トランプ氏、ロシアの大規模攻撃に不満　ウクライナに露領攻撃可能なミサイル売却へ,20,https://news.yahoo.co.jp/articles/3aba030782c5609754962b199022fc6053394620,8/29(金) 11:55
2025-08-30,05:08,world,国際,6,ロイター,ウクライナにロの大規模攻撃、米特使「トランプ氏の和平努力損なう」,19,https://news.yahoo.co.jp/articles/c1c8a32b31f3922b44862606bae207265dc57be2,8/29(金) 7:26
2025-08-30,05:08,world,国際,7,中央日報日本語版,「選挙惨敗、首相のせいではない」…深まる日本自民党の内紛,18,https://news.yahoo.co.jp/articles/00749b647db288c1948483542a374377042f799b,8/29(金) 15:22
2025-08-30,05:08,world,国際,8,FNNプライムオンライン（フジテレビ系）,新車EVが大量放置…中国で異変　値下げ競争が激化　経営難や倒産メーカーも　中国経済へのダメージ懸念,17,https://news.yahoo.co.jp/articles/c8dea8651c12fcb334147fc376de0d9d2a5920d8,8/29(金) 19:46
2025-08-30,05:08,world,国際,9,ロイター,プーチン氏、トランプ氏欺くことに　露ウ会談約束しなければ＝仏大統領,16,https://news.yahoo.co.jp/articles/a9fd331c8d463aff92f3aff5aca8050914bcf72e,8/30(土) 3:31
2025-08-30,05:08,world,国際,10,TBS NEWS DIG Powered by JNN,元通訳・水原受刑者の違法賭博事件　元締めの男に1年1日の拘禁刑,15,https://news.yahoo.co.jp/articles/6b80075d7830c244e28054561d4e140ec5d41690,8/30(土) 4:14
2025-08-30,05:08,world,国際,11,ロイター,再送-イランで死刑執行が大幅増、今年800人超＝国連機関,13,https://news.yahoo.co.jp/articles/803298852f2807f85c8ca8fdcdc373d5995b0d9d,8/30(土) 0:47
2025-08-30,05:08,world,国際,12,ハンギョレ新聞,「日本は原発回帰中…反対意見を言うのが徐々に難しく」,13,https://news.yahoo.co.jp/articles/d760921dce0fcbf897a0a6cdc21da99d82e9498a,8/29(金) 9:19
2025-08-30,05:08,world,国際,13,読売新聞オンライン,水原一平受刑者の賭博胴元に禁錮１年１日…最長１８年の禁錮刑の可能性も捜査協力で大幅減軽,13,https://news.yahoo.co.jp/articles/e7806beb5662d8be03744ea31f38d09bf536a635,8/30(土) 3:37
2025-08-30,05:08,world,国際,14,FNNプライムオンライン（フジテレビ系）,ゼレンスキー氏、ロシアとの首脳会談めぐり「9月1日まで待つ」,12,https://news.yahoo.co.jp/articles/d3ba22af59e7df87bbf5b9d29fb399c9c6658284,8/30(土) 1:48
2025-08-30,05:08,world,国際,15,中央日報日本語版,プーチンのための「愛国キャンプ」なのか…ロシアで子ども・青少年への軍事訓練に批判の声,12,https://news.yahoo.co.jp/articles/d438285c36cddf8435fa2c99055bd678e918b90a,8/29(金) 11:43
2025-08-30,05:08,world,国際,16,Yahoo!ニュース オリジナル THE PAGE,【ヤフコメで話題】「トランプ前大統領のウクライナ戦争への対応に疑問の声」「プーチン大統領との関係性を懸念する意見」 - トランプ前大統領のウクライナ戦争に対する姿勢が議論に,12,https://news.yahoo.co.jp/articles/fe8ffd601163ea14d08a6e8296b48cedaaeff4dc,8/29(金) 9:06
2025-08-30,05:08,world,国際,17,共同通信,ハリス前副大統領の警護打ち切り　トランプ氏が指示と報道,12,https://news.yahoo.co.jp/articles/9ca7f9da49ff5165ccea68f0e8e54ffce414d905,8/29(金) 22:51
2025-08-30,05:08,world,国際,18,日テレNEWS NNN,ハマスに拘束…イスラエル人の家族が来日　解放を訴え,11,https://news.yahoo.co.jp/articles/3addb618e0a94f60ff4d5bda73a181e87614e9dd,8/29(金) 20:24
2025-08-30,05:08,world,国際,19,AP通信,ロシアの石油インフラを攻撃　ウクライナが無人機で露空襲,11,https://news.yahoo.co.jp/articles/c40bd4eca8d2a961a62d19d7564088898251e889,8/29(金) 10:45
2025-08-30,05:08,world,国際,20,FNNプライムオンライン（フジテレビ系）,キーウ攻撃を受け「ゼレンスキー氏とプーチン氏の会談は行われないだろう」　ドイツの首相が見解　ヨーロッパ首脳らも相次いで攻撃を非難,10,https://news.yahoo.co.jp/articles/14cdddb57f63512031827ce7461a65e723a27557,8/29(金) 6:39
2025-08-30,05:08,world,国際,21,読売新聞オンライン,キーウへのロシア軍大規模攻撃、死者２３人に拡大…トランプ大統領も不満,10,https://news.yahoo.co.jp/articles/59aa74f5a51f403e4fdbee75e0f9d7595d498a0d,8/30(土) 0:17
2025-08-30,05:08,world,国際,22,時事通信,日本降伏文書を一般公開　米、戦後80年で特別展示,10,https://news.yahoo.co.jp/articles/037d59e55aa190f2ad848d9cec6d34786ab0a1df,8/29(金) 14:33
2025-08-30,05:08,world,国際,23,読売新聞オンライン,トランプ政権、国連の「人権審査」受けないと通知…専門家「人権侵害甚だしい国々に口実与える」,10,https://news.yahoo.co.jp/articles/84599b01c14144980177a205c8de5529000690a8,8/29(金) 21:31
2025-08-30,05:08,world,国際,24,FNNプライムオンライン（フジテレビ系）,トランプ氏、ハリス前副大統領の警護を打ち切り　CNN報道,9,https://news.yahoo.co.jp/articles/912ec25f34b8de1576d79d152e3eb13255e732aa,8/30(土) 2:36
2025-08-30,05:08,world,国際,25,BuzzFeed Japan,トランプ氏、ホワイトハウスの“模様替え”に批判の声続出→「“改装”ではなく、これは“破壊”」,9,https://news.yahoo.co.jp/articles/c7a553a0512e5a64736a7b0879bad9d052456137,8/29(金) 7:05
2025-08-30,05:08,world,国際,26,共同通信,トランプ氏はロシアに「不満」　キーウへの大規模攻撃巡り,9,https://news.yahoo.co.jp/articles/a3f3595d5d9a3c75761f43ff0f056b232461ba70,8/29(金) 5:15
2025-08-30,05:08,world,国際,27,テレビ朝日系（ANN）,観客の目前で…F16戦闘機が墜落炎上 ベテラン操縦士が死亡　航空ショーの訓練飛行中,9,https://news.yahoo.co.jp/articles/8f395fd927ed10725ba6b3aee83cf91c6681c169,8/29(金) 23:58
2025-08-30,05:08,world,国際,28,読売新聞オンライン,トランプ氏、就任１か月のＣＤＣ所長を解任…所長側「非科学的で無謀な指示を追認せずに標的とされた」,8,https://news.yahoo.co.jp/articles/846d3aaeb045775a11aa4c912734949a1bb0cabb,8/29(金) 18:45
2025-08-30,05:08,world,国際,29,東洋経済オンライン,ウクライナ和平はなぜ進まない？　トランプも手が出せない欧州に鳴り響く「不協和音」の正体,8,https://news.yahoo.co.jp/articles/1312038955e1ee4b7696df1ad293eb9418cc8b4d,8/29(金) 11:31
2025-08-30,05:08,world,国際,30,ロイター,トランプ氏、ハリス前米大統領の警護打ち切り＝当局者,8,https://news.yahoo.co.jp/articles/9e8fe6e80684273d6e5a4054082c7696b68380cd,8/30(土) 0:28
2025-08-30,05:08,world,国際,31,毎日新聞,「移民大国」豪州　31日に大規模反移民デモ計画　政府は強く批判,8,https://news.yahoo.co.jp/articles/c158ba537c2475b970b8451a20e68293b40a773f,8/29(金) 16:12
2025-08-30,05:08,world,国際,32,テレビ朝日系（ANN）,ガザ 物資求める市民に軍が毎日発砲　「飢餓ないは嘘」元配給所警備担当の男性が証言,8,https://news.yahoo.co.jp/articles/a963d9c148fa9ae41afffdb0cecb369f4a928847,8/29(金) 17:06
2025-08-30,05:08,world,国際,33,中央日報日本語版,トラックに追突されたが１８カ月の双子は無事だった…無残に潰れた現代車「アイオニック５」の奇跡＝米国,8,https://news.yahoo.co.jp/articles/5ca25349460ffe0d785bd6c5552849f36edb078e,8/29(金) 10:09
2025-08-30,05:08,world,国際,34,FNNプライムオンライン（フジテレビ系）,イスラエル軍がイエメンの親イラン武装勢力・フーシ派幹部を狙った大規模攻撃　幹部10人が集まったところを狙う,8,https://news.yahoo.co.jp/articles/2ce2ef7a5589a8d1faf95a8df25da88ac133f415,8/29(金) 7:27
2025-08-30,05:08,world,国際,35,ニューズウィーク日本版,ディズニー映画に「LGBT描写は困る...」米人気ラッパーの炎上発言に広がる波紋「子供と映画を見るのが怖い」,8,https://news.yahoo.co.jp/articles/6c25e0ccd65517c7901700534bd8e6e0dcc6fe57,8/29(金) 18:10
2025-08-30,05:08,world,国際,36,共同通信,中国の式典で中朝ロ首脳並ぶとロ大統領府,8,https://news.yahoo.co.jp/articles/1978cfc29db7554ee384b34d9bd160cc2871f737,8/29(金) 23:34
2025-08-30,05:08,world,国際,37,ロイター,ガザ戦争「大量虐殺」と明確に表現を、数百人の国連職員が書簡,8,https://news.yahoo.co.jp/articles/c0c8f5a52bddecd73a0a18958f6852d63e265fb2,8/29(金) 10:31
2025-08-30,05:08,world,国際,38,時事通信,ハリス前副大統領の警護解除　選挙戦争ったトランプ氏,8,https://news.yahoo.co.jp/articles/b56c013022a9a99b3bb1671ca07195bdd5caaca8,8/29(金) 22:37
2025-08-30,05:08,world,国際,39,FNNプライムオンライン,「携帯を渡せ!」離陸7分後に女が乗務員に暴行　苦情受けて“規則説明”中のスマホ撮影に怒ったか　座席に拘束し警察に連行　ロシア,8,https://news.yahoo.co.jp/articles/ff9a8b8d549c6259293f8b62a55f2d0780f68bb7,8/29(金) 7:12
2025-08-30,05:08,world,国際,40,ＡＦＰ＝時事,ゼレンスキー氏、欧州諸国にプーチン氏への圧力強化呼び掛け キーウ攻撃受け,8,https://news.yahoo.co.jp/articles/b0edfe9e9a545a48575bfb4a40f937de5e398e5f,8/29(金) 14:22
