scrp_date,scrp_time,genre_en,genre_jp,rank,media_jp,title,comment,link,date_original
2025-09-08,08:06,business,経済,1,共同通信,社員食堂の実質値下げを支援　政府検討、企業補助増へ,101,https://news.yahoo.co.jp/articles/dd7a1d9ffbbc43c07bd39eb207b8bffba4f0c5bc,9/7(日) 15:42
2025-09-08,08:06,business,経済,2,マネーポストWEB,《違法薬物での警察捜査に潔白主張》サントリーHD前会長・新浪剛史氏が見せた経済同友会への執着　“活動自粛するが代表幹事は辞めない”強気の態度を取った理由,68,https://news.yahoo.co.jp/articles/27ae49c2136604da794cdca513c5bc45035552a9,9/8(月) 7:15
2025-09-08,08:06,business,経済,3,ABEMA TIMES,購入者を焦らせる「在庫残り1個」「タイマー」表示、定期購入がデフォルト…不利な選択へ誘導する“ダークパターン”の実態 自衛するためには,49,https://news.yahoo.co.jp/articles/e27e8b3d1cacd26b6940e5af1468506238b95b18,9/7(日) 18:42
2025-09-08,08:06,business,経済,4,THE GOLD ONLINE（ゴールドオンライン）,「返さなくていい奨学金」のはずが…。“地元に5年縛られる契約”を蹴り、東京で「月10万円の返済地獄」のなか生きる23歳看護師の告白,41,https://news.yahoo.co.jp/articles/75ba9a722876762e454a464e3d97ea022ac365f9,9/7(日) 13:31
2025-09-08,08:06,business,経済,5,ダイヤモンド・オンライン,「ぶっちゃけ親ガチャで就職難易度は変わりますよね。大企業務めの親がいる子が有利じゃないですか」新卒就活における親ガチャを考える,39,https://news.yahoo.co.jp/articles/737fcafe56d950a0fc68ca0c352cb8e816560192,9/8(月) 6:45
2025-09-08,08:06,business,経済,6,ビジネス＋IT,カフェ王国・名古屋発「コメダ珈琲店」が強すぎる理由、スタバとは「全然違う」勝ち方,32,https://news.yahoo.co.jp/articles/fba57cb058166e14c0e2b48ca6d8c35dbfcc33d2,9/8(月) 7:20
2025-09-08,08:06,business,経済,7,東洋経済オンライン,【独自】JAL系の格安航空スプリング・ジャパン　「過去に飲酒問題を起こしたパイロット」を重用,31,https://news.yahoo.co.jp/articles/a3c5d2482087be4c120ba486a4addd172d80a7aa,9/8(月) 5:31
2025-09-08,08:06,business,経済,8,読売新聞オンライン,ゆるキャン経済効果４・９億円、乃木坂４６ロケ地で来場１・８５倍…静岡県「聖地巡礼」に商機,22,https://news.yahoo.co.jp/articles/7ef1ba062c2ff31b116d8bc0ba280e7c7d66823e,9/7(日) 12:33
2025-09-08,08:06,business,経済,9,プレジデントオンライン,このままではJR北海道は生き残れない…鉄道ジャーナリストが呆れ返った「あわや脱線トラブル」の顛末,22,https://news.yahoo.co.jp/articles/f0623e3e93306b788c2c42ee1208bf006ac21eec,9/7(日) 8:16
2025-09-08,08:06,business,経済,10,ビジネス＋IT,「書店ゼロの街」約3割の衝撃……逆転プランの現実味は？本屋が詰む“日本特有”制度,22,https://news.yahoo.co.jp/articles/9a8a518b4a50b6720d60f7d166de293db5f40754,9/8(月) 6:20
2025-09-08,08:06,business,経済,11,テレビ朝日系（ANN）,新米価格が高騰、農家は「コメ離れ」危惧　小泉農水大臣「冷静になって」,20,https://news.yahoo.co.jp/articles/2a4a8ad827d65596882a759461d959c9e9a38ad0,9/7(日) 11:31
2025-09-08,08:06,business,経済,12,マネーポストWEB,読売新聞“前代未聞の大誤報”はなぜ起こったか？　渡邉恒雄氏が亡くなったことの社内への影響「“独裁”との批判はあったが、それがチェック機能になっていた」との指摘も,19,https://news.yahoo.co.jp/articles/c8cb30a5d70c928d8ff1ccbbc22ac6bf5e526687,9/8(月) 7:15
2025-09-08,08:06,business,経済,13,MotorFan,「このBNR32は新車を超えている！」ワークスの技術力が注ぎ込まれた現代版チューンドGT-R,19,https://news.yahoo.co.jp/articles/01e3185f08847e7bf41d1fc25d5c38a5dc472c45,9/8(月) 6:30
2025-09-08,08:06,business,経済,14,ダイヤモンド・オンライン,「これだけはやめておけ」50代を過ぎたら絶対にやめるべき“食習慣”ベスト1,18,https://news.yahoo.co.jp/articles/c1babff593a2e9c00d340b543c1aceb0e3f529b6,9/8(月) 7:01
2025-09-08,08:06,business,経済,15,ダイヤモンド・オンライン,「日本のユニコーン企業に興味ある？」→ PayPal創業の伝説的投資家が言い放った“ぐうの音も出ない正論”,18,https://news.yahoo.co.jp/articles/68b5698ff438e2e6b5dc18840267b9debd7217b4,9/8(月) 6:01
2025-09-08,08:06,business,経済,16,Merkmal,軽自動車に「安全支援システム」が普及しないのはなぜか？ 国内最多2349万台でも、搭載率「4割未満」という現実,17,https://news.yahoo.co.jp/articles/d034764dc20f3f8745c2944614eb89448388da50,9/8(月) 6:01
2025-09-08,08:06,business,経済,17,集英社オンライン,「管理費を中国人オーナーが支払わない」「修繕積立金が３倍に爆増で生活激変」…マンション襲う「管理の崩壊」という時限爆弾,16,https://news.yahoo.co.jp/articles/5e52e1710de012d18af056ac58559df0a3511e8e,9/7(日) 10:01
2025-09-08,08:06,business,経済,18,ファイナンシャルフィールド,国家公務員をしている兄の夏のボーナスは70万円！ 私は30万円ほどしかもらえなかったけど、公務員ってやっぱり「高収入」なの？,15,https://news.yahoo.co.jp/articles/54f8f0a1befda47791e74eee5a90e49c87792a03,9/7(日) 13:30
2025-09-08,08:06,business,経済,19,ダイヤモンド・オンライン,日本人がどうしたって「アメリカ的なビジネスの論理」を息苦しく感じる決定的な“教育上の”理由,14,https://news.yahoo.co.jp/articles/f49b687d5911bec67fa9a9f56797463390fb495a,9/8(月) 6:20
2025-09-08,08:06,business,経済,20,NOSWEB,80年代の前奏曲として新時代の幕開けを告げたスペシャリティカー、初代「ホンダ プレリュード」｜名車図鑑,13,https://news.yahoo.co.jp/articles/407b6e43a630791dd9474211ca65f267078bcf3c,9/8(月) 7:05
2025-09-08,08:06,business,経済,21,読売新聞オンライン,賃貸物件の部屋でも、自分好みにＤＩＹ…床材敷き詰め「模様替え」人気,13,https://news.yahoo.co.jp/articles/43deeda32b5b18e05bea02fd38c7998ff8af205c,9/7(日) 13:00
2025-09-08,08:06,business,経済,22,まいどなニュース,「神宮前交差点に街路樹が1本もありません」暑すぎて死にそう…屋上緑化推進の都政「地上に木を植えて！」,13,https://news.yahoo.co.jp/articles/c5b32a6e5dcaa2ebc0797fa16d6bddf7c7bea696,9/7(日) 14:10
2025-09-08,08:06,business,経済,23,ダイヤモンド・オンライン,「正直、しんどい…」職場の上司に言われると“やる気を無くす言葉”ワースト1,12,https://news.yahoo.co.jp/articles/a2d2d1f590d9c7b5dd47a1b664c60903b750d41a,9/8(月) 6:25
2025-09-08,08:06,business,経済,24,ダイヤモンド・オンライン,【失礼な人あるある】「他人の善意を当然だと思っている人」に対するトドメの一言とは？,12,https://news.yahoo.co.jp/articles/7b107009854a7b4a603e37a6a538f1d3795bb165,9/8(月) 6:35
2025-09-08,08:06,business,経済,25,MotorFan,日産Z33「フェアレディZ」がマイナーチェンジし280ps→294psへパワーアップ！05年に332.85万円で登場【今日は何の日？9月8日】,12,https://news.yahoo.co.jp/articles/d6d7a350763413e286c2177b718b15f1366844ee,9/8(月) 5:00
2025-09-08,08:06,business,経済,26,ベストカーWeb,思い込みで危険! 意外と見逃しがちな「うっかり交通違反」5選 【罰則解説付き】,11,https://news.yahoo.co.jp/articles/3dc23b5516ac40fd75665aaed551ceb3c9e7f2a0,9/8(月) 7:00
2025-09-08,08:06,business,経済,27,J-CASTニュース,アメ車の輸入このままでは増えない　日本向けに車種絞り込み仕様改める...メーカーがやるべきこと,11,https://news.yahoo.co.jp/articles/6081730cc61fe2b29acdf58d30b6905d47e552d4,9/7(日) 13:00
2025-09-08,08:06,business,経済,28,ダイヤモンド・オンライン,「最悪死にます…」猛暑の車中に絶対「置きっ放しNG」な毎日使っているものとは？,11,https://news.yahoo.co.jp/articles/502fb98e91e7a1551b3231a1babf67c7d2515fba,9/8(月) 6:01
2025-09-08,08:06,business,経済,29,東洋経済オンライン,京都に進出、JR東海「ホテル拡大戦略」の深慮遠謀　既存ホテルを買い取り「マリオット」ブランドに,11,https://news.yahoo.co.jp/articles/13fc580204fa5b6142b8d001b9f382c0d48a436e,9/8(月) 4:31
2025-09-08,08:06,business,経済,30,ダイヤモンド・オンライン,従業員の不満投稿が多い「ブラック企業」ランキング2025上半期【航空・鉄道ワースト3】3位はJR西日本と名鉄、1位と2位は？,10,https://news.yahoo.co.jp/articles/9ca3a031404e485607566a8b23881fc5cd83adac,9/8(月) 7:01
2025-09-08,08:06,business,経済,31,読売新聞オンライン,銀行の「昼休業」広がる…人手不足と来店客減でも店舗網維持狙う,10,https://news.yahoo.co.jp/articles/f9342a2cb41a6994bc356b2de867592efebf75d7,9/8(月) 0:00
2025-09-08,08:06,business,経済,32,THE GOLD ONLINE（ゴールドオンライン）,母（90歳）が亡くなる前に気づいて本当によかった…次男、危機一髪。二束三文の実家の「登記簿」から判明した「子のいない長男夫婦」の怖すぎる本音【FPが解説】,10,https://news.yahoo.co.jp/articles/32a50602e8c7401ec31f45f05ab1371aa0da8c57,9/7(日) 10:31
2025-09-08,08:06,business,経済,33,文春オンライン,雪の日に足を滑らせ、重たいソファが体の上に…還暦間近で失職→“タイミーさん”になった60代男性が体験したスキマバイトの危険な実情,9,https://news.yahoo.co.jp/articles/b24f089160ecc53d50ee8c193c8f4bce07a362f0,9/8(月) 7:12
2025-09-08,08:06,business,経済,34,東洋経済オンライン,5年で資産1億円達成のkenmo氏 「いま注目の10銘柄」。東証改革で“中小型株ブーム”が到来？,9,https://news.yahoo.co.jp/articles/f3b979938d8d64c395d5562aaf6dc8dff4805c51,9/8(月) 6:31
2025-09-08,08:06,business,経済,35,TBS CROSS DIG with Bloomberg,【皆がリッチではない】648兆円に達する70歳以上の「高齢者マネー」　資産保有状況に大きな格差,9,https://news.yahoo.co.jp/articles/6a7360eeeab947404123186ccce0ce9904bce9b2,9/7(日) 18:01
2025-09-08,08:06,business,経済,36,みんかぶマガジン,日本人の格差は開いていない！“格差の実態”が見えていない本当の理由,9,https://news.yahoo.co.jp/articles/e7e986fc384429c0653c324c789e4c454cad6e66,9/7(日) 12:10
2025-09-08,08:06,business,経済,37,乗りものニュース,JR北海道が「新型特急電車」を導入へ 札幌圏の車両が大変貌！ 置き換え対象は？,8,https://news.yahoo.co.jp/articles/8bbf3625003792eb117e0984b664cfaba436f27c,9/8(月) 7:12
2025-09-08,08:06,business,経済,38,文春オンライン,経営コンサルを失職→還暦を過ぎて“タイミーさん”に…「必要なのはスマホのみ」のスキマバイトに60代が挑むとどうなる？,8,https://news.yahoo.co.jp/articles/bf328847828ce4b3ef7d69c5035f0e1e19d91f8b,9/8(月) 7:12
2025-09-08,08:06,business,経済,39,まいどなニュース,【SNS型投資詐欺】「投資詐欺の情報を見かけたことがある」約6割　被害防止のための注意点は？,8,https://news.yahoo.co.jp/articles/fa832ca8b52284b718bb79d8d9f47f899f67dc37,9/7(日) 19:00
2025-09-08,08:06,business,経済,40,Bloomberg,ロシア、ウクライナ政府庁舎を攻撃－ゼレンスキー氏は仏大統領と協議,8,https://news.yahoo.co.jp/articles/a983f2ecd1c2b315aef2b4bbe63c994fa8ccf291,9/7(日) 15:11
