scrp_date,scrp_time,genre_en,genre_jp,rank,media_jp,title,comment,link,date_original
2025-08-12,11:39,business,経済,1,食品産業新聞社ニュースWEB,マクドナルド、ハッピーセット「ポケモン」で転売・混乱受け厳格な販売制限へ 公式アプリ退会処理も,552,https://news.yahoo.co.jp/articles/8413aca25a90cbe9f0f6743f8da44ffdb19b15b0,8/11(月) 20:38
2025-08-12,11:39,business,経済,2,FNNプライムオンライン（フジテレビ系）,【速報】日経平均株価が終値ベースの史上最高値を超え4万2200円台後半に,402,https://news.yahoo.co.jp/articles/6c1ac4293ba1da4f2c9dee8c20d289079fda2f52,8/12(火) 9:06
2025-08-12,11:39,business,経済,3,みんかぶマガジン,「国会質問が低レベル」の指摘があっても、フェミニストの私がなぜ参政党を肯定するのか…リベラルが無視した「取り残された層の不安」,183,https://news.yahoo.co.jp/articles/7a4ae97f572d4cabe8633a5ae22547dc31ab4cdc,8/12(火) 9:10
2025-08-12,11:39,business,経済,4,プレジデントオンライン,"「移民を排除する」は日本人の財布に直撃する…「値上げの無限ループ」を引き起こしている""真犯人""",130,https://news.yahoo.co.jp/articles/3f259be4503f849b801e25a3538960b2cd7132ce,8/12(火) 9:16
2025-08-12,11:39,business,経済,5,ベストカーWeb,トランプ大統領が何を根拠に「フォードF-150が日本で売れる!」そんなわけあるか!? 日本で売れるアメリカ車とは,107,https://news.yahoo.co.jp/articles/37eff36685cb1fa69118b4048e139eec916d84ec,8/12(火) 11:00
2025-08-12,11:39,business,経済,6,ITmedia ビジネスオンライン,「PARM」はなぜ売れ続ける？　原点は“2つのアイス”にあった,54,https://news.yahoo.co.jp/articles/b4612cda492057c932acb8352444662a61a6d9a5,8/12(火) 5:15
2025-08-12,11:39,business,経済,7,TBS NEWS DIG Powered by JNN,“ラーメン課”設立で経済効果1億7000万円　「地元食材を活かし、地域の魅力を発信」ご当地ラーメンの可能性【Nスタ解説】,44,https://news.yahoo.co.jp/articles/009319b3a875c03fb0a51286ff1b91227aa7d785,8/11(月) 21:17
2025-08-12,11:39,business,経済,8,ベストカーWeb,中国でEVトラックブームが過熱! 2028年には新車トラックの80％が電動化されるという予想も!?,38,https://news.yahoo.co.jp/articles/e840a20e6959621f40b7503fa318ab044e3f1369,8/12(火) 10:00
2025-08-12,11:39,business,経済,9,THE GOLD ONLINE（ゴールドオンライン）,信じられない…54歳母、絶句。世帯年収680万円・切り詰めて暮らす一家の〈希望の光〉東京有名私大→大手就職と「成功した次男」に祝杯も、ある日届いたLINE「衝撃の中身」,37,https://news.yahoo.co.jp/articles/0926ff2ee5555100faa17a832b54a11cc3d652c2,8/12(火) 10:01
2025-08-12,11:39,business,経済,10,FNNプライムオンライン,ポケモンカード騒動「対応不十分だった」マクドナルドが転売目的の大量購入や食品の放置や廃棄問題を謝罪　威圧的な客の大量購入断る方針,37,https://news.yahoo.co.jp/articles/defca555cb902add52f5211ee291eb51cd3728a6,8/12(火) 7:00
2025-08-12,11:39,business,経済,11,ITmedia ビジネスオンライン,セブンもファミマも取り組む「無人コンビニ」はなぜ、普及しないのか　実際に行って分かった「限界」,31,https://news.yahoo.co.jp/articles/0240fbcad0e0bd4c1f6e9ed6080865ccd4320f18,8/12(火) 5:55
2025-08-12,11:39,business,経済,12,マネーポストWEB,東大ほか有名大学の「卒業証書偽造」裏ビジネスに中国人業者が暗躍　利用者は中国での就職活動を有利に進める目的か、東大は「事実であれば遺憾」とコメント,31,https://news.yahoo.co.jp/articles/4eaead5227d8318c06b0a04c67d7832ad0000786,8/12(火) 7:15
2025-08-12,11:39,business,経済,13,ダイヤモンド・オンライン,従業員の不満投稿が多い「ブラック企業」ランキング2025上半期【ワースト3】3位は日産、超有名企業が1位に！,30,https://news.yahoo.co.jp/articles/c53021b28045513648f85024eed84ba5e391ad75,8/12(火) 7:01
2025-08-12,11:39,business,経済,14,朝日新聞,日経平均4万2800円台、一時最高値を更新　米関税の不透明感後退,30,https://news.yahoo.co.jp/articles/5c332cbc2bec5fe894b7bf73cd9c37431e4522f8,8/12(火) 9:15
2025-08-12,11:39,business,経済,15,TBS NEWS DIG Powered by JNN,マクドナルドがお詫びと対策を発表 モバイルオーダーやデリバリーを制限など　ハッピーセット×ポケカでの混乱めぐり,28,https://news.yahoo.co.jp/articles/a8adbf7e8f2cdb804e9907076e3af5c8ee3c4b24,8/12(火) 10:52
2025-08-12,11:39,business,経済,16,ベストカーWeb,なんとトヨタが米国で値上げ敢行!? 大胆な行動の背景に見えるモノ,24,https://news.yahoo.co.jp/articles/acd8152679dccd411cacdd962495902e6c9854ee,8/11(月) 19:00
2025-08-12,11:39,business,経済,17,ビジネス＋IT,ついに「不動産バブル崩壊」の中国、この先巻き返すのは「無理ゲーすぎる」苦しい事情,24,https://news.yahoo.co.jp/articles/ee776f5f54d8f55d88bc3882cc299ed2c480397d,8/12(火) 6:30
2025-08-12,11:39,business,経済,18,ビジネス＋IT,AIどころではない……2年後に人型ロボット「爆発的普及」で75％の雇用が終了,24,https://news.yahoo.co.jp/articles/c5b12bc95cc00e7f30f0dc4a27f57902a8aff960,8/12(火) 6:50
2025-08-12,11:39,business,経済,19,共同通信,小泉農相、韓国外相と会談,24,https://news.yahoo.co.jp/articles/1579f622f4b8cb14fae38e6e28a908be673e2608,8/11(月) 13:39
2025-08-12,11:39,business,経済,20,ダイヤモンド・オンライン,職場の出世しない人が、長期休暇の前に無意識に言いがちな「NGワード」とは？,23,https://news.yahoo.co.jp/articles/f89235706d7df807aa31865f053b16223dbeb1e6,8/12(火) 10:01
2025-08-12,11:39,business,経済,21,プレジデントオンライン,一時は固辞したが、「これならいける」と一言…稲盛和夫が「瀕死の巨大企業JALの再建」を引き受けた真意,19,https://news.yahoo.co.jp/articles/8c37d83da87e9061a8123965514fa130d4856b90,8/12(火) 8:16
2025-08-12,11:39,business,経済,22,LIMO,今後「専業主婦になりたい」女性は約2割。共働き増加も「共働き＝ゴール」ではない理由,18,https://news.yahoo.co.jp/articles/25b4c787466741f6af505958c309ebae796ec6f9,8/11(月) 15:21
2025-08-12,11:39,business,経済,23,朝日新聞,米政権、半導体の対中輸出に「上納金」　エヌビディアなどに要求へ,17,https://news.yahoo.co.jp/articles/e5455107ef0256176c4ae040cf46f9d8c670038c,8/12(火) 9:55
2025-08-12,11:39,business,経済,24,鉄道コム,九州新幹線、なぜ高架橋の上で「雨宿り」？ 運休時でも新幹線が動いた真相とは,16,https://news.yahoo.co.jp/articles/922b9ee0b00894f98c4669a704c1457c8d49910f,8/12(火) 10:35
2025-08-12,11:39,business,経済,25,ベストカーWeb,石破首相 ゴキブリ ハマグリ マヨネーズ……50代以上のおじさんしか知らない!? Z世代に伝えておきたい クルマに付けられたあだ名とは,16,https://news.yahoo.co.jp/articles/2848bfb6b362710a988e4c3f88ce4d51539775e7,8/12(火) 6:00
2025-08-12,11:39,business,経済,26,ベストカーWeb,人手不足と言われるけど…… 中高生の保護者107名に聞いた! 自動車整備士ってどんなイメージ!?,16,https://news.yahoo.co.jp/articles/542a1e6a77227b60b295512cf71d34dbdfcaea36,8/12(火) 10:00
2025-08-12,11:39,business,経済,27,NEWSポストセブン,《万博店舗スタッフが告発》人気韓国料理店で“すっぱい匂いのチャプチェ”提供か…料理長が書いた「始末書」が存在、運営会社は「食品衛生上の問題はなかった」「異常な臭いはなかった」と反論,14,https://news.yahoo.co.jp/articles/9db3a0620b5f25a7dcd2661e09a23ccfb563636d,8/12(火) 11:15
2025-08-12,11:39,business,経済,28,週刊SPA!,元メガバンク行員が暴露「銀行は外貨建て保険を売りたがっている」あなたの資産運用に潜む“危険な真実”,14,https://news.yahoo.co.jp/articles/c0e2fd5a27d3c4b79303e683649df570be9e2ecb,8/12(火) 8:53
2025-08-12,11:39,business,経済,29,Aviation Wire,日航機事故40年、FAAが逸脱修理指摘　ボーイング作業で強度低下,13,https://news.yahoo.co.jp/articles/edb59061d918618b0efebbe6d0fcddd821b31693,8/12(火) 10:15
2025-08-12,11:39,business,経済,30,TBS CROSS DIG with Bloomberg,クラゲ大量発生でフランスの原発4基停止、海洋熱波が引き金に,13,https://news.yahoo.co.jp/articles/840866b69ef66e12b6d3ab69d613d8672c2e2ef2,8/12(火) 2:33
2025-08-12,11:39,business,経済,31,ファイナンシャルフィールド,お盆は義実家に帰省予定。家族4人の新幹線代だけで「7万円」近くかかるのがイタイ！でも滞在するなら義実家にも「2万円」ほどお金を渡した方がいい…？,13,https://news.yahoo.co.jp/articles/63b5a7fe1327c5f84ea83a21900b4ccd0fea543d,8/11(月) 13:10
2025-08-12,11:39,business,経済,32,読売新聞オンライン,自動車関税引き下げ、９月中旬メドか…米財務省関係者「英国との合意では約５０日間かかった」,12,https://news.yahoo.co.jp/articles/40b6126711088f1ce56aa6d058fcf27e6ec45434,8/12(火) 10:49
2025-08-12,11:39,business,経済,33,ダイヤモンド・オンライン,「あなたの強みはなんですか？」に、なんと答える？…無能が言いがちな“最悪の答え”の中身,12,https://news.yahoo.co.jp/articles/e69fcd75e79cde4fb1b555f0fedc6ec90fcd8ef1,8/12(火) 6:35
2025-08-12,11:39,business,経済,34,ITmedia ビジネスオンライン,大阪万博の穴場？　「ロイヤルホスト」の会社がやっているビュッフェがすごかった　質とスピードを両立させる工夫とは,12,https://news.yahoo.co.jp/articles/8346bf48f5959e3565874581e1cd179998332ca2,8/12(火) 9:00
2025-08-12,11:39,business,経済,35,文春オンライン,「激混み電車」なのに改善の余地なし！ 「埼京線」がJRの混雑度トップに君臨し続ける納得の理由《2024年度・JR路線の混雑度ランキング》,11,https://news.yahoo.co.jp/articles/50de46af9562211fc3d48bacec1ac9b7910a8fdd,8/12(火) 11:12
2025-08-12,11:39,business,経済,36,産経新聞,男子中学生がなりたい職業「公務員」が初めてトップに　先行き不透明な経済状況が影響か,11,https://news.yahoo.co.jp/articles/0b66d7337411fb6ba20278988e871c037dcc84b9,8/12(火) 11:00
2025-08-12,11:39,business,経済,37,共同通信,米、対中関税一部停止11月10日まで延長,11,https://news.yahoo.co.jp/articles/e6c237cd2904753dc993cb718ff62ada29e715f6,8/12(火) 9:15
2025-08-12,11:39,business,経済,38,LIMO,【8月15日は年金支給日】年金「月20万円」から引かれる税金・社会保険料はいくら？東京都練馬区の単身世帯をモデルケースに試算！,11,https://news.yahoo.co.jp/articles/0f030b9576e6852a4ff756890270bcfaefeca679,8/11(月) 18:16
2025-08-12,11:39,business,経済,39,TBS CROSS DIG with Bloomberg,Z世代の7割が「将来に経済的な不安」　結婚、子育て、キャリア、資産形成…調理実習だけではない、家庭科の「ライフデザイン」教育,11,https://news.yahoo.co.jp/articles/f8c921ccbb0bf781f2b9d29c16050bda81bf74ce,8/12(火) 7:01
2025-08-12,11:39,business,経済,40,東洋経済オンライン,「年金だけ生活」は月6万7459円の赤字!?　　投資初心者でもできる“埋め合わせ戦略” 5つのステップで、老後の家計赤字を乗り切る,11,https://news.yahoo.co.jp/articles/6e6f463c1296145219b194b89342ac109b24cabf,8/12(火) 9:01
