scrp_date,scrp_time,genre_en,genre_jp,rank,media_jp,title,comment,link,date_original
2025-08-12,14:09,business,経済,1,食品産業新聞社ニュースWEB,マクドナルド、ハッピーセット「ポケモン」で転売・混乱受け厳格な販売制限へ 公式アプリ退会処理も,484,https://news.yahoo.co.jp/articles/8413aca25a90cbe9f0f6743f8da44ffdb19b15b0,8/11(月) 20:38
2025-08-12,14:09,business,経済,2,ベストカーWeb,トランプ大統領が何を根拠に「フォードF-150が日本で売れる!」そんなわけあるか!? 日本で売れるアメリカ車とは,262,https://news.yahoo.co.jp/articles/37eff36685cb1fa69118b4048e139eec916d84ec,8/12(火) 11:00
2025-08-12,14:09,business,経済,3,FNNプライムオンライン（フジテレビ系）,【速報】日経平均株価が終値ベースの史上最高値を超え4万2200円台後半に,229,https://news.yahoo.co.jp/articles/6c1ac4293ba1da4f2c9dee8c20d289079fda2f52,8/12(火) 9:06
2025-08-12,14:09,business,経済,4,みんかぶマガジン,「国会質問が低レベル」の指摘があっても、フェミニストの私がなぜ参政党を肯定するのか…リベラルが無視した「取り残された層の不安」,126,https://news.yahoo.co.jp/articles/7a4ae97f572d4cabe8633a5ae22547dc31ab4cdc,8/12(火) 9:10
2025-08-12,14:09,business,経済,5,プレジデントオンライン,"「移民を排除する」は日本人の財布に直撃する…「値上げの無限ループ」を引き起こしている""真犯人""",99,https://news.yahoo.co.jp/articles/3f259be4503f849b801e25a3538960b2cd7132ce,8/12(火) 9:16
2025-08-12,14:09,business,経済,6,ITmedia ビジネスオンライン,「PARM」はなぜ売れ続ける？　原点は“2つのアイス”にあった,84,https://news.yahoo.co.jp/articles/b4612cda492057c932acb8352444662a61a6d9a5,8/12(火) 5:15
2025-08-12,14:09,business,経済,7,ITmedia ビジネスオンライン,セブンもファミマも取り組む「無人コンビニ」はなぜ、普及しないのか　実際に行って分かった「限界」,64,https://news.yahoo.co.jp/articles/0240fbcad0e0bd4c1f6e9ed6080865ccd4320f18,8/12(火) 5:55
2025-08-12,14:09,business,経済,8,読売新聞オンライン,ハッピーセット、ポケカ転売目的で大量購入や食品廃棄…日本マクドナルドが謝罪・再発防止へ対策,58,https://news.yahoo.co.jp/articles/dce547cfc25c40e5953d0241f585cb39d105fd52,8/12(火) 12:49
2025-08-12,14:09,business,経済,9,TBS NEWS DIG Powered by JNN,“ラーメン課”設立で経済効果1億7000万円　「地元食材を活かし、地域の魅力を発信」ご当地ラーメンの可能性【Nスタ解説】,39,https://news.yahoo.co.jp/articles/009319b3a875c03fb0a51286ff1b91227aa7d785,8/11(月) 21:17
2025-08-12,14:09,business,経済,10,文春オンライン,「激混み電車」なのに改善の余地なし！ 「埼京線」がJRの混雑度トップに君臨し続ける納得の理由《2024年度・JR路線の混雑度ランキング》,38,https://news.yahoo.co.jp/articles/50de46af9562211fc3d48bacec1ac9b7910a8fdd,8/12(火) 11:12
2025-08-12,14:09,business,経済,11,テレビ朝日系（ANN）,中国産野菜が値下がり　米国に輸出されるはずが日本に　ニンニクは18％安,29,https://news.yahoo.co.jp/articles/424d4e70d29777ebd75a4b5c1da1146081d3177e,8/12(火) 11:33
2025-08-12,14:09,business,経済,12,ベストカーWeb,中国でEVトラックブームが過熱! 2028年には新車トラックの80％が電動化されるという予想も!?,29,https://news.yahoo.co.jp/articles/e840a20e6959621f40b7503fa318ab044e3f1369,8/12(火) 10:00
2025-08-12,14:09,business,経済,13,FNNプライムオンライン,ポケモンカード騒動「対応不十分だった」マクドナルドが転売目的の大量購入や食品の放置や廃棄問題を謝罪　威圧的な客の大量購入断る方針,27,https://news.yahoo.co.jp/articles/defca555cb902add52f5211ee291eb51cd3728a6,8/12(火) 7:00
2025-08-12,14:09,business,経済,14,東洋経済オンライン,坂本龍馬は英雄なのか、ヒトラーがいなければ戦争は起こらなかったか、浮世絵がなぜハゲ山だらけなのか……歴史の裏の裏まで見えてくる,27,https://news.yahoo.co.jp/articles/ca45407cefda3dd9bd1af9e11d01e8ab96250b18,8/12(火) 11:31
2025-08-12,14:09,business,経済,15,ベストカーWeb,こりゃあ売れるわな…安くて広くて流行ってて「カローラクロス」の買い得感がハンパない,27,https://news.yahoo.co.jp/articles/4f79fc1f4e38dbc116bf6750ee7a004d012cba3a,8/12(火) 11:30
2025-08-12,14:09,business,経済,16,NEWSポストセブン,《万博店舗スタッフが告発》人気韓国料理店で“すっぱい匂いのチャプチェ”提供か…料理長が書いた「始末書」が存在、運営会社は「食品衛生上の問題はなかった」「異常な臭いはなかった」と反論,25,https://news.yahoo.co.jp/articles/9db3a0620b5f25a7dcd2661e09a23ccfb563636d,8/12(火) 11:15
2025-08-12,14:09,business,経済,17,テレビ朝日系（ANN）,トランプ関税に「アジア団結」探る　小泉大臣、韓国に水産物輸入規制撤廃を要求,24,https://news.yahoo.co.jp/articles/fcbc478732d9ff7d292ab02cee3d2d46087572d9,8/12(火) 12:18
2025-08-12,14:09,business,経済,18,ベストカーWeb,なんとトヨタが米国で値上げ敢行!? 大胆な行動の背景に見えるモノ,24,https://news.yahoo.co.jp/articles/acd8152679dccd411cacdd962495902e6c9854ee,8/11(月) 19:00
2025-08-12,14:09,business,経済,19,ファイナンシャルフィールド,日本の「平均手取り」は1世帯あたり約450万円！平均を上回る世帯の割合は？中央値はどれくらい？,23,https://news.yahoo.co.jp/articles/b542090dfe19d090be12b1004deacbb73341aff0,8/12(火) 13:10
2025-08-12,14:09,business,経済,20,まいどなニュース,本体価格1200万円超えだと！…田んぼに農薬を散布するヘリコプターの価格が話題に,23,https://news.yahoo.co.jp/articles/496a33a1385706217886966954a7e2c99f227d7c,8/12(火) 12:20
2025-08-12,14:09,business,経済,21,TBS NEWS DIG Powered by JNN,マクドナルドがお詫びと対策を発表 モバイルオーダーやデリバリーを制限など　ハッピーセット×ポケカでの混乱めぐり,23,https://news.yahoo.co.jp/articles/a8adbf7e8f2cdb804e9907076e3af5c8ee3c4b24,8/12(火) 10:52
2025-08-12,14:09,business,経済,22,ダイヤモンド・オンライン,従業員の不満投稿が多い「ブラック企業」ランキング2025上半期【ワースト3】3位は日産、超有名企業が1位に！,23,https://news.yahoo.co.jp/articles/c53021b28045513648f85024eed84ba5e391ad75,8/12(火) 7:01
2025-08-12,14:09,business,経済,23,マネーポストWEB,東大ほか有名大学の「卒業証書偽造」裏ビジネスに中国人業者が暗躍　利用者は中国での就職活動を有利に進める目的か、東大は「事実であれば遺憾」とコメント,22,https://news.yahoo.co.jp/articles/4eaead5227d8318c06b0a04c67d7832ad0000786,8/12(火) 7:15
2025-08-12,14:09,business,経済,24,THE GOLD ONLINE（ゴールドオンライン）,信じられない…54歳母、絶句。世帯年収680万円・切り詰めて暮らす一家の〈希望の光〉東京有名私大→大手就職と「成功した次男」に祝杯も、ある日届いたLINE「衝撃の中身」,22,https://news.yahoo.co.jp/articles/0926ff2ee5555100faa17a832b54a11cc3d652c2,8/12(火) 10:01
2025-08-12,14:09,business,経済,25,ファイナンシャルフィールド,70代の母は貯蓄が「2000万円以上」あるのに、まだ働いています。「不安だから」といいますが、一人暮らしなら“貯蓄”と“年金”で生活できますよね？,22,https://news.yahoo.co.jp/articles/081000d4322f084e227c9c883ee5bbfb819a67b6,8/12(火) 11:40
2025-08-12,14:09,business,経済,26,ダイヤモンド・オンライン,職場の出世しない人が、長期休暇の前に無意識に言いがちな「NGワード」とは？,21,https://news.yahoo.co.jp/articles/f89235706d7df807aa31865f053b16223dbeb1e6,8/12(火) 10:01
2025-08-12,14:09,business,経済,27,ビジネス＋IT,AIどころではない……2年後に人型ロボット「爆発的普及」で75％の雇用が終了,19,https://news.yahoo.co.jp/articles/c5b12bc95cc00e7f30f0dc4a27f57902a8aff960,8/12(火) 6:50
2025-08-12,14:09,business,経済,28,朝日新聞,日経平均4万2800円台、一時最高値を更新　米関税の不透明感後退,19,https://news.yahoo.co.jp/articles/5c332cbc2bec5fe894b7bf73cd9c37431e4522f8,8/12(火) 9:15
2025-08-12,14:09,business,経済,29,ビジネス＋IT,ついに「不動産バブル崩壊」の中国、この先巻き返すのは「無理ゲーすぎる」苦しい事情,18,https://news.yahoo.co.jp/articles/ee776f5f54d8f55d88bc3882cc299ed2c480397d,8/12(火) 6:30
2025-08-12,14:09,business,経済,30,NRI研究員の時事解説,トランプ政権は中国向け半導体輸出再開の見返りにエヌビディアに売上げの15％の支払いを求める異例のディール,16,https://news.yahoo.co.jp/articles/8962fdffdc26b0fad3537141baea592a4483404a,8/12(火) 13:20
2025-08-12,14:09,business,経済,31,ファイナンシャルフィールド,高校生の塾代が「月7万円」で生活がギリギリ…。使える“教育費支援制度”はあるのでしょうか？,16,https://news.yahoo.co.jp/articles/965b569ed55cb7c326e41ce389d132d52fdbb8bd,8/12(火) 11:20
2025-08-12,14:09,business,経済,32,LIMO,今後「専業主婦になりたい」女性は約2割。共働き増加も「共働き＝ゴール」ではない理由,15,https://news.yahoo.co.jp/articles/25b4c787466741f6af505958c309ebae796ec6f9,8/11(月) 15:21
2025-08-12,14:09,business,経済,33,産経新聞,男子中学生がなりたい職業「公務員」が初めてトップに　先行き不透明な経済状況が影響か,14,https://news.yahoo.co.jp/articles/0b66d7337411fb6ba20278988e871c037dcc84b9,8/12(火) 11:00
2025-08-12,14:09,business,経済,34,鉄道コム,九州新幹線、なぜ高架橋の上で「雨宿り」？ 運休時でも新幹線が動いた真相とは,14,https://news.yahoo.co.jp/articles/922b9ee0b00894f98c4669a704c1457c8d49910f,8/12(火) 10:35
2025-08-12,14:09,business,経済,35,ファイナンシャルフィールド,私の年金、20万円以下って普通？ 平均的な受給額と老後に必要な生活費とは,13,https://news.yahoo.co.jp/articles/a4b78afaa3a86a15379d1303e86b4f670b1a5b42,8/12(火) 13:30
2025-08-12,14:09,business,経済,36,バイクのニュース,ダレノガレ明美「あなた達は乗れなくても私は乗れる」　大型バイクに乗る女性への偏見に威風堂々　初ツーリングで見せた女性ライダーの姿に反響,13,https://news.yahoo.co.jp/articles/ac03507cfad6b0ba02e9d869cd1329d10ff4e20b,8/12(火) 11:55
2025-08-12,14:09,business,経済,37,プレジデントオンライン,一時は固辞したが、「これならいける」と一言…稲盛和夫が「瀕死の巨大企業JALの再建」を引き受けた真意,13,https://news.yahoo.co.jp/articles/8c37d83da87e9061a8123965514fa130d4856b90,8/12(火) 8:16
2025-08-12,14:09,business,経済,38,読売新聞オンライン,自動車関税引き下げ、９月中旬メドか…米財務省関係者「英国との合意では約５０日間かかった」,13,https://news.yahoo.co.jp/articles/40b6126711088f1ce56aa6d058fcf27e6ec45434,8/12(火) 10:49
2025-08-12,14:09,business,経済,39,日テレNEWS NNN,日経平均、取引時間中の最高値を更新　“米関税”の懸念払拭【中継】,12,https://news.yahoo.co.jp/articles/895b30e84e76e6e6a7697be7181ed233d8c482c6,8/12(火) 11:49
2025-08-12,14:09,business,経済,40,日テレNEWS NNN,小泉農水相が韓国外相と会談　日本産水産物の輸入停止措置撤廃求める,12,https://news.yahoo.co.jp/articles/6c1f9ab8ba0835b62e4174aa36137201c39a2e43,8/11(月) 19:49
