scrp_date,scrp_time,genre_en,genre_jp,rank,media_jp,title,comment,link,date_original
2026-02-22,07:09,sports,スポーツ,1,東スポWEB,【フィギュア】ロシア不在で女子は１０年後退 「ワリエワの時代に戻りたい」と露メディア,100,https://news.yahoo.co.jp/articles/b28673cca9ab66338083a6076b8afd43e6273de0,2/21(土) 21:25
2026-02-22,07:09,sports,スポーツ,2,TBS NEWS DIG Powered by JNN,古野慧が史上初の決勝進出！スキークロス、日本勢初メダルなるか　準々決勝からわずか10分後と過酷レース【ミラノオリンピック】,55,https://news.yahoo.co.jp/articles/81ca91c8db4bd850c736e297108c6fa2b18d9825,2/21(土) 21:03
2026-02-22,07:09,sports,スポーツ,3,日刊スポーツ,【阪神】今季絶望か…石井大智ショック「大動脈」失ったチームの心臓どうなる…真価問われる１年,48,https://news.yahoo.co.jp/articles/e74a626061d66b314decdd494388bb4c43836730,2/21(土) 19:37
2026-02-22,07:09,sports,スポーツ,4,CoCoKARAnext,トランプ大統領の“罵倒”で変わった運命　米代表が語った政治的発言の代償「人生であんな批判を受けたことない」【冬季五輪】,38,https://news.yahoo.co.jp/articles/8db0e5ada968781451001d2032d26ba4ba7802c7,2/22(日) 6:01
2026-02-22,07:09,sports,スポーツ,5,日テレNEWS NNN,クロスカントリーに伝説誕生 クレボが金メダル“1大会6個” 完全制覇 『クレボステップ』さく裂 通算金メダル数は『11』に更新,37,https://news.yahoo.co.jp/articles/784e96e9db32aebab2dfbadbce4af58eaebd8d11,2/21(土) 21:08
2026-02-22,07:09,sports,スポーツ,6,時事通信,高木美帆、再び心燃やせるか　不振の日本、後進続かず―スピードスケート〔ミラノ・コルティナ五輪〕,36,https://news.yahoo.co.jp/articles/19562010c5606b5e99404ba5ed2d442d0d1c376c,2/21(土) 16:19
2026-02-22,07:09,sports,スポーツ,7,デイリースポーツ,メダルに０・０８秒及ばず　古野慧は悔し涙「取りきれず本当に悔しい」快挙の決勝進出も４位　欧州勢との激しい争いに敗れる,35,https://news.yahoo.co.jp/articles/963116061bcf1fede0af824482962f73d12660e2,2/21(土) 21:24
2026-02-22,07:09,sports,スポーツ,8,スポーツ報知,松井裕樹もＷＢＣ出場辞退　侍リリーフ３人目の異常事態　代役は金丸が最有力,35,https://news.yahoo.co.jp/articles/61d7dc126f552809d8bc0b3f07427ee56fde026c,2/22(日) 0:30
2026-02-22,07:09,sports,スポーツ,9,デイリースポーツ,阪神に激震　石井大智が「左アキレス腱断裂縫合術」受け退院　球団発表　長期離脱で辞退の侍ジャパン＆阪神ファンに「申し訳ない気持ちでいっぱい」,32,https://news.yahoo.co.jp/articles/a86b8b604cd9dbf46ce2a92ec3617290af0c5fbb,2/21(土) 12:01
2026-02-22,07:09,sports,スポーツ,10,スポニチアネックス,【Sスケート】男子マススタート　佐々木10位　蟻戸13位　大逃げ許しメダルならず「五輪で逃げが…」,31,https://news.yahoo.co.jp/articles/a1eb7fd66532f0e014092141c8fdc0c67ab7298b,2/22(日) 0:50
2026-02-22,07:09,sports,スポーツ,11,東スポWEB,【フィギュア】りくりゅうへの採点に…ロシアのペア女王が私見「重大なミスを犯したが影響しなかった」,30,https://news.yahoo.co.jp/articles/e424b83ef3c8bb2ca8491c50dd0220d2f91a5c8e,2/22(日) 6:50
2026-02-22,07:09,sports,スポーツ,12,朝日新聞,高木菜那さん「もう強くなくてもいいよ」妹の美帆を抱きしめる,30,https://news.yahoo.co.jp/articles/fdf709188e54237cb66b445ba977d63af450e02b,2/21(土) 11:13
2026-02-22,07:09,sports,スポーツ,13,GOAL,アルベロアのレアル・マドリー、全勝貫いていたラ・リーガで初黒星！90分の決勝弾でオサスナに敗北…バルサは首位奪還のチャンス,30,https://news.yahoo.co.jp/articles/2936fb77e077f0dcc69f2a9cc5928c0010c01702,2/22(日) 4:26
2026-02-22,07:09,sports,スポーツ,14,スポニチアネックス,高木美帆　自身の今後に言及　「その時に思う気持ちを大事にしようと。未定です」,28,https://news.yahoo.co.jp/articles/10894d2845fb5482b787a37c53eecf678f40d040,2/21(土) 18:48
2026-02-22,07:09,sports,スポーツ,15,スポーツ報知,オープン戦初試合の村上宗隆が中堅への大二塁打含む２安打２打点デビュー,27,https://news.yahoo.co.jp/articles/0b376e0f655043a61aa11cf3d89b78bc421c3e25,2/21(土) 7:04
2026-02-22,07:09,sports,スポーツ,16,サンケイスポーツ,50戦全勝のメイウェザー、3度目の引退から現役復帰へ「まだまだ記録を樹立する力がある」,27,https://news.yahoo.co.jp/articles/ac354fb9679e52217851b8fdf8e6c35345144b90,2/21(土) 11:00
2026-02-22,07:09,sports,スポーツ,17,RONSPO,え？本当？リュウは“ガチ”な日本の“アニオタ”だった…好きなトップ5にあげたのは『呪術廻戦』『チェンソーマン』…そしてあの人気作品の賛否ある“衝撃ラスト”に持論を展開,26,https://news.yahoo.co.jp/articles/b377087a6c11011c7be5e6c33be3407a9eb0a9ce,2/22(日) 6:10
2026-02-22,07:09,sports,スポーツ,18,東スポWEB,河村たかし氏　ミラノ五輪のメダル見てポツリ「よう噛んどるがや」〝かじり騒動〟も回顧,26,https://news.yahoo.co.jp/articles/4578e4d9a4cc9126352e9eb7fce998f71fa0a80f,2/21(土) 23:40
2026-02-22,07:09,sports,スポーツ,19,THE ANSWER,アリサ・リウの髪が「何かに似てると思ったら…」　“既視感”の正体が続々「そうとしか思えない」,26,https://news.yahoo.co.jp/articles/3321825d7103d3f4352c664e8a500406708f075e,2/22(日) 3:41
2026-02-22,07:09,sports,スポーツ,20,スポーツ報知,【五輪】スキークロス・古野慧が０・０８秒届かず４位　初メダルの快挙まであと一歩、日本人過去最高順位も悔し泣き「最後取り切れなかったのが悔しい」…小さい頃はＢＭＸと二刀流,25,https://news.yahoo.co.jp/articles/72bd6a73eca7e9e759d94f68a15e07d9f56961e9,2/21(土) 21:24
2026-02-22,07:09,sports,スポーツ,21,THE DIGEST,フィギュア、エキシビション１時間前　リストに名前ない日本女子「探してしまった」「好成績なのに残念」【冬季五輪】,24,https://news.yahoo.co.jp/articles/0fbbc7ba6cfeb7f81a42a04a0842774108007e38,2/22(日) 2:47
2026-02-22,07:09,sports,スポーツ,22,東スポWEB,【フィギュア】「最も偏見が少ないのは日本の審判」 米解析専門サイトが驚きの採点データを発表,23,https://news.yahoo.co.jp/articles/2fda1357be6e0137400138c57060842d4838650f,2/22(日) 4:45
2026-02-22,07:09,sports,スポーツ,23,スポニチアネックス,【スキークロス】大快挙まであと数十センチ…古野慧　惜しくもメダル届かず号泣4位　日本人初決勝魂の滑走,23,https://news.yahoo.co.jp/articles/7edba52bc41ccce20cfd5350a55da61cc2aba844,2/21(土) 21:21
2026-02-22,07:09,sports,スポーツ,24,スポーツ報知,安藤美姫さん　ライバルと「バチバチ」だった現役時代「更衣室にいれなくて」「女子の空気はすごいのよ」,23,https://news.yahoo.co.jp/articles/f1a3f9d7467597dc15696822e65154501c58451e,2/21(土) 7:12
2026-02-22,07:09,sports,スポーツ,25,TBS NEWS DIG Powered by JNN,古野慧はメダルまであとわずか...「本当に悔しい」と涙、過酷レース乗り越え日本人過去最高4位【ミラノオリンピック】,23,https://news.yahoo.co.jp/articles/190faa0aaa119956e2398c7066460b46fceeb526,2/21(土) 21:21
2026-02-22,07:09,sports,スポーツ,26,THE ANSWER,五輪エキシビで違和感「出るの？」　18歳にネット意見様々「ダンスの切れが凄い」「なんで」,23,https://news.yahoo.co.jp/articles/27118967e5d909331acb9b59a22de5fff52d0d2f,2/22(日) 5:21
2026-02-22,07:09,sports,スポーツ,27,読売新聞オンライン,今夏の甲子園、ひとまず「９回制」で決着…暑さ対策の７回制導入は「性急過ぎる」,22,https://news.yahoo.co.jp/articles/64d484959ed212ba4295ea92ec473147f83bf94f,2/21(土) 17:55
2026-02-22,07:09,sports,スポーツ,28,日刊スポーツ,アリサ・リュウ、ネイサン・チェン…なぜ約６％のアジア系が米国フィギュア界を席巻しているのか,22,https://news.yahoo.co.jp/articles/0a9b81040fc79ed9e1848157e1435299ab56405a,2/21(土) 19:18
2026-02-22,07:09,sports,スポーツ,29,THE ANSWER,銀メダル坂本花織を「日本のキム・ヨナ」とも表現　韓国メディアが指摘、五輪金は「最後まで…」,21,https://news.yahoo.co.jp/articles/e21f144fd89eab1d87267d17aa68edb49170a974,2/21(土) 17:33
2026-02-22,07:09,sports,スポーツ,30,日テレNEWS NNN,笑顔はじける中井亜美の演技に会場わく　氷上で横になりキュートなポーズ　赤い衣装で華麗に舞いファンの心をつかむ　〈フィギュアスケート/エキシビション〉,21,https://news.yahoo.co.jp/articles/53828ea6197402b7958add37ed31ea700bc764e5,2/22(日) 4:41
2026-02-22,07:09,sports,スポーツ,31,J-CASTニュース,坂本花織が「日本のキム・ヨナ」になれなかった理由...最後のパズルは埋まらず「金メダルに縁がなかった」韓国メディア,21,https://news.yahoo.co.jp/articles/d1517497c81e144743fa8a01146687fcd73441a4,2/21(土) 14:15
2026-02-22,07:09,sports,スポーツ,32,デイリースポーツ,フィギュア中井亜美の首傾げたポーズに「電撃走りました」４８歳人気男性アナが生放送で告白「大ファンになっちゃって」,20,https://news.yahoo.co.jp/articles/ff97bf2ddd142ac58cb3c158f8f1831f106d1387,2/21(土) 12:59
2026-02-22,07:09,sports,スポーツ,33,文春オンライン,マー君との「人間力の差」が話題に…楽天・前田健太（37）の“40万円超焼肉パーティー”が浮き彫りにした「後輩に慕われるベテラン」の絶対条件,20,https://news.yahoo.co.jp/articles/8a1a21da67f6daf7a715c8cb63b9e7defc5ab5d0,2/21(土) 7:12
2026-02-22,07:09,sports,スポーツ,34,東スポWEB,【カーリング】ロコ・ソラーレ　世界選手権への〝巨大補強〟に期待沸騰「小穴さんは凄すぎる」,20,https://news.yahoo.co.jp/articles/8be1f2975372e2e8c40f1ab28a80a53620fd44b6,2/21(土) 23:25
2026-02-22,07:09,sports,スポーツ,35,スポーツ報知,坂本花織の引退後の進路が「驚き」「珍しい…」「目指すの！？」「泣く」ネット関心「テレビ局が放っておかないだろうな」の声,20,https://news.yahoo.co.jp/articles/8a8eccf52143bed286c41a7b6125bdd0fdf6436b,2/21(土) 12:55
2026-02-22,07:09,sports,スポーツ,36,東スポWEB,【フィギュア】「日本のキム・ヨナを超えた！」中井亜美の快挙に韓国メディアも大注目,20,https://news.yahoo.co.jp/articles/f9ad4c1e59c63f29f50a56eaa6721d57ff6908c8,2/21(土) 22:20
2026-02-22,07:09,sports,スポーツ,37,東スポWEB,【フィギュア】4位・千葉百音 エキシビション出られず…ペトロシャン参加で波紋「5位以降出すのに？」,20,https://news.yahoo.co.jp/articles/ff8137caa020e289d83bcbe92680b42748a96836,2/22(日) 4:15
2026-02-22,07:09,sports,スポーツ,38,東スポWEB,【フィギュア】プルシェンコ氏　銅・中井亜美にも激辛評価「残りのジャンプは好きになれなかった」,19,https://news.yahoo.co.jp/articles/f1a72872a14c5f2516008e623e57187770d028ec,2/21(土) 11:15
2026-02-22,07:09,sports,スポーツ,39,東スポWEB,【フィギュア】「ＩＳＵよ、女子シングルで本当にこんなものが見たいのか？」露メディアが問題提起,19,https://news.yahoo.co.jp/articles/a579656c6317a81fece3d7e58b5fc5abd4cc05a7,2/21(土) 7:50
2026-02-22,07:09,sports,スポーツ,40,THE ANSWER,明らかになったフィギュアエキシビ滑走順に騒然　冒頭降臨のビッグネームに「粋な演出」「これは4時起きで見なきゃ！」,19,https://news.yahoo.co.jp/articles/d3f359392990b15f24b6cb03c439047f80356b3f,2/21(土) 17:31
