scrp_date,scrp_time,genre_en,genre_jp,rank,media_jp,title,comment,link,date_original
2025-11-22,13:09,life,ライフ,1,女子SPA！,空前の「麻辣湯ブーム」の明暗は？大注目の3つの理由と“唯一のネック”,209,https://news.yahoo.co.jp/articles/31e51406b7dfea6f1219121b7d5faf0f4b3579eb,11/22(土) 8:46
2025-11-22,13:09,life,ライフ,2,FORZA STYLE,「お腹が張るので席を譲ってください！」新幹線で妊婦から懇願された49歳会社員。高リスクな「マタ旅」に自業自得の声【専門家解説】,110,https://news.yahoo.co.jp/articles/b0ae5ef6c956b53d17cb53e66f216525a8483643,11/22(土) 6:48
2025-11-22,13:09,life,ライフ,3,マイナビニュース,「ラブブおじ」に「若者言葉おじ」......パーカーよりも痛い、銀座で見た“若作りおじさん達”,104,https://news.yahoo.co.jp/articles/6191d025c5d3a511203890c7b6c18253d0f11b1e,11/22(土) 11:31
2025-11-22,13:09,life,ライフ,4,THE GOLD ONLINE（ゴールドオンライン）,「ちゃんと食べてる？」月収21万円で東京一人暮らしの24歳息子が心配で…母が“こっそり上京”→アパートで見た“異様な部屋”,50,https://news.yahoo.co.jp/articles/adb92972cd8eb5e5de2a62817a769eb8e056b6bc,11/22(土) 12:00
2025-11-22,13:09,life,ライフ,5,ワールドジェットスポーツマガジン,日本の「優良中古車」が海外に“どんどん”流出し、良質なクルマが日本からなくなる!?　アメリカでは“右ハンドル車”の走行が 法律で禁止されている！「25年ルール」を知っていますか？,43,https://news.yahoo.co.jp/articles/313bbd0e779474d0e565a9f5a4ddc4bfe576c0da,11/22(土) 10:20
2025-11-22,13:09,life,ライフ,6,AERA DIGITAL,高校生たちが語るSNSの「言葉」への本音　「文末の『。』がめっちゃ怖い」「悪口なのか、冗談なのかわからない」,34,https://news.yahoo.co.jp/articles/3819a4c929b20572b6b57a64614603f46ddef5ea,11/22(土) 11:00
2025-11-22,13:09,life,ライフ,7,FORZA STYLE,「ディズニー最高！」39度のインフル妻と子を置き去りに『夢の国』へ。家族旅行を台無しにした夫の狂気の是非【専門家助言】,31,https://news.yahoo.co.jp/articles/d913b3a7852191db4329a3fea450c09fa11096c5,11/22(土) 6:45
2025-11-22,13:09,life,ライフ,8,FORZA STYLE,「子どもって金のなる木だよね」町内で孤立する「放置子3兄弟の親」の発言にア然。物価高対策「児童手当2万上乗せ」への不納得感【専門家解説】,29,https://news.yahoo.co.jp/articles/3f120d1378f2d20fac7a9bd255addf626ea3ae6c,11/21(金) 21:03
2025-11-22,13:09,life,ライフ,9,ねとらぼ,夫にぬいぐるみの洗濯を頼んだら「脱水します」と送られてきて……妻「泣いた」　とんでもない光景が1400万表示「目が死んでやがる」,24,https://news.yahoo.co.jp/articles/51588aed5ca3f35763f8c7fd5581854cc29a8450,11/22(土) 8:30
2025-11-22,13:09,life,ライフ,10,ハフポスト日本版,真っ白いカラスを京都で発見。カァカァと鳴く様子に「なんてかわいいの」「神様の使い」と反響続々,19,https://news.yahoo.co.jp/articles/a4e53e3d207347cd07f07a58ac7f9807a4a5253a,11/22(土) 10:13
2025-11-22,13:09,life,ライフ,11,ENCOUNT,「やっと買えた」ラーメン一筋20年、念願のフェラーリに感慨　「ウン千万円」現金一括の成功秘話,18,https://news.yahoo.co.jp/articles/0b550208aad5dc889d0f05ac46137d94a1b1cbd9,11/22(土) 9:20
2025-11-22,13:09,life,ライフ,12,ENCOUNT,料理研究家「熊、すげえウマい」に反響殺到　スパイス焼きなどレシピ紹介に「気になるw」「食べてみたい」,18,https://news.yahoo.co.jp/articles/1de43a35bc0afd8550a25d155214a85163624969,11/22(土) 11:45
2025-11-22,13:09,life,ライフ,13,まいどなニュース,「お昼休みなし」「休憩なしで働いた」これって違法ですよね？【社労士が解説】,16,https://news.yahoo.co.jp/articles/3bd92b151edfa0daf49500de33f5ca4b19e03cc6,11/22(土) 7:30
2025-11-22,13:09,life,ライフ,14,ファイナンシャルフィールド,母が「月2000円台」の格安SIMを友人に勧められたそうです。なぜそんなに安いのですか？,16,https://news.yahoo.co.jp/articles/ca0ccc042294183e9778e294bd19a8a4167b9290,11/22(土) 11:20
2025-11-22,13:09,life,ライフ,15,withnews,不登校でも、オンライン学習で出席扱い　当事者の6割「知らない」　母の訴え「生きた制度に」,16,https://news.yahoo.co.jp/articles/b33df384e4c54839d32d561534bd6dda32bab990,11/22(土) 7:00
2025-11-22,13:09,life,ライフ,16,All About,高速道路でスピード違反はNGだけど「遅い分には問題ないでしょ？」弁護士YouTuberに聞く,16,https://news.yahoo.co.jp/articles/30a04d19e5bfc8df97f5d01260f0398dd5f90e2d,11/22(土) 8:50
2025-11-22,13:09,life,ライフ,17,女性セブンプラス,《股の部分が下がった位置に》佳子さま斬新な「サロペット姿」でご公務「仏語で“汚れた”」の意味もおしゃれな着こなし,16,https://news.yahoo.co.jp/articles/b87febfa4e044e3b506a845fae15d5754b198469,11/21(金) 17:00
2025-11-22,13:09,life,ライフ,18,THE GOLD ONLINE（ゴールドオンライン）,「あんなに懐いていたのに…」父、困惑。76歳祖母を慕っていた小4息子が“お正月に帰りたくない”と訴えた〈本当の理由〉,15,https://news.yahoo.co.jp/articles/617af4dbe5ce7ef904d0425db15db87794bbb853,11/22(土) 9:00
2025-11-22,13:09,life,ライフ,19,THE GOLD ONLINE（ゴールドオンライン）,"なにかの間違いでは…ヒートショックで夫を亡くした貯金1,500万円の67歳妻、年金事務所で知った「遺族年金の盲点」に涙【CFPの助言】",15,https://news.yahoo.co.jp/articles/e4d79b9338389214b4f519efd89106e394e27028,11/22(土) 11:00
2025-11-22,13:09,life,ライフ,20,産経新聞,母介護で学校行けず読み書き計算できなかった青年　夜間中学から定時制進学で簿記３級取得,14,https://news.yahoo.co.jp/articles/04219b6ee46cb91ebae9feeb07c3724439c26eb3,11/22(土) 9:00
2025-11-22,13:09,life,ライフ,21,BRAVO MOUNTAIN,全国イチのラーメン民「山形」出身ライターが選ぶ、絶対行きたい名店「庄内・琴系」の2店!,13,https://news.yahoo.co.jp/articles/3c854d77a276bf897b619345687756bacea929b3,11/22(土) 12:12
2025-11-22,13:09,life,ライフ,22,プレジデントオンライン,定年後10年たつのに「次の社長はあいつ」の会話しかできない…痛すぎる高齢者にならないポイント3つ,13,https://news.yahoo.co.jp/articles/5d7bc754c292448cf77a2d977e94c88007e4e889,11/22(土) 10:15
2025-11-22,13:09,life,ライフ,23,FORZA STYLE,「ちょっと待って…」久々の営みが暴走した夜。レス10年の47歳夫婦に起きたまさかの妊娠に子どもたちが吐いた毒【専門家助言】,13,https://news.yahoo.co.jp/articles/103ed7c2edeed407a835ca30547319d84bb3323b,11/21(金) 21:18
2025-11-22,13:09,life,ライフ,24,THE GOLD ONLINE（ゴールドオンライン）,だって、寂しかったから…〈年収850万円〉九州に単身赴任の52歳夫。3ヵ月ぶりの帰宅で目撃した、50歳妻「夫の知らない別の顔」に絶句,12,https://news.yahoo.co.jp/articles/5fffb5a1f1b7dc20612a21ee86be08ae1d481440,11/22(土) 5:00
2025-11-22,13:09,life,ライフ,25,文春オンライン,「スナック菓子1袋」で1万円を請求…『葬儀の高額トラブル』はなぜ起こる？ 元バンドマンの“ヘビメタ葬儀社長”が明かす「驚愕の実態」,11,https://news.yahoo.co.jp/articles/fa20f0676f3c30cb53948cc009245531e5aa5b1d,11/22(土) 11:12
2025-11-22,13:09,life,ライフ,26,FRaU,男性の家事育児は当たり前？東大生が聞いた、「男女平等世界一」の国・アイスランドのリアルな姿,11,https://news.yahoo.co.jp/articles/ccfab6eb1b72b6c9d7b8fc080a4601c256faabd4,11/22(土) 7:01
2025-11-22,13:09,life,ライフ,27,LIMO,「トップは4です！」マニュアル車、今乗れますか？現役教習指導員が教える「操作が難しいマニュアル車」の教習風景がもはやコントで爆笑！,11,https://news.yahoo.co.jp/articles/31b924512d2e539e0745636dd6ae8f810ffa79c3,11/22(土) 6:35
2025-11-22,13:09,life,ライフ,28,LIMO,長野県松本駅の到着を知らせる名物アナウンスが終了　終幕を惜しむ光景に「寂しい」「こんな日が来るとは…」,11,https://news.yahoo.co.jp/articles/e77ba12c83b1ac9bf419b49ba9bd1c50efdf2a19,11/22(土) 11:00
2025-11-22,13:09,life,ライフ,29,週刊女性PRIME,ミャクミャク旅立ち式典「到底足りない！」“激シブ応募内容”にファン悲鳴、運営が答えた条件理由,11,https://news.yahoo.co.jp/articles/e0de5131935e92896ed8eae1f25c015405491c49,11/22(土) 11:00
2025-11-22,13:09,life,ライフ,30,ダイヤモンド教育ラボ,「東京一工でもワンチャンある」は嘘？　国公立の大学群別難易度を実感しやすいイメージで解説,10,https://news.yahoo.co.jp/articles/47a4c14016c811069f2fc1f85f51e5d6efea2080,11/22(土) 12:00
2025-11-22,13:09,life,ライフ,31,ねとらぼ,パパに肩車される、幼い弟とお兄ちゃん→大人になって……「ちょっと待って」　同じポーズで撮った“現在の姿”に「やばい泣ける」【海外】,10,https://news.yahoo.co.jp/articles/b62e34453552cbf73861a3648d15c51c4bc5745f,11/22(土) 12:15
2025-11-22,13:09,life,ライフ,32,まいどなニュース,借金やホス狂いには無縁だけど…湯水のごとくオタ活に浪費する風俗嬢たち「品切れになるまでガチャ回す」【オタ活風俗嬢に取材】,10,https://news.yahoo.co.jp/articles/121e56e6a2498f5bab065d425c18100613cf034d,11/22(土) 6:30
2025-11-22,13:09,life,ライフ,33,ライフハッカー・ジャパン,「スマホは80％充電で止めたほうがいい」は本当なのか？,10,https://news.yahoo.co.jp/articles/c231229681a7b486fb9406df6c1ba363348f98b1,11/22(土) 9:21
2025-11-22,13:09,life,ライフ,34,たまひよONLINE,手術後の合併症で脳梗塞になった3歳の長男。脳のMRI画像を見た父は「元の千歳は戻ってこない」ことをさとり【クルーゾン症候群】,9,https://news.yahoo.co.jp/articles/4d7c2403e75fd6568d6fa4981153844afb277677,11/22(土) 11:55
2025-11-22,13:09,life,ライフ,35,Hint-Pot,「日本応援が豪快すぎて尊敬する」　台湾外相が「今夜は私のおごり」　日本産ホタテを囲む姿に感謝の声が続々,9,https://news.yahoo.co.jp/articles/3672cc62213909249c1d2e9c8648b2460194a1b3,11/21(金) 20:11
2025-11-22,13:09,life,ライフ,36,ダイヤモンド・オンライン,「学力一発勝負の一般入試」は勉強ができる人以外を大学から弾きすぎている？ 大学受験は一体どこに向かっているのか,9,https://news.yahoo.co.jp/articles/9a9c922d0f5558be96f7a47bda6a0124c19706d5,11/22(土) 6:20
2025-11-22,13:09,life,ライフ,37,ハフポスト日本版,自転車で車道を「逆走」⇨青切符を交付された。反則金はいくら支払うことになる？【クイズ】,8,https://news.yahoo.co.jp/articles/a98a901f8c8cd99f7cbd469fcaf68b6bae5e7076,11/22(土) 6:30
2025-11-22,13:09,life,ライフ,38,ねとらぼ,エミレーツ航空に搭乗中、CAもスマホを取り出し……　撮らずにはいられなかった“衝撃の光景”に「鳥肌立ちました」,8,https://news.yahoo.co.jp/articles/247549c09d44d9369955cd0f50a0994e2ecc14bc,11/21(金) 19:40
2025-11-22,13:09,life,ライフ,39,弁護士ドットコムニュース,隣家の「もみじの枝」が自宅の屋根に接触した！　勝手に切っても問題ない？,8,https://news.yahoo.co.jp/articles/10dd59592a3d408af88293066075821f89a4faa4,11/22(土) 9:11
2025-11-22,13:09,life,ライフ,40,デイリースポーツ,ヒトはなぜビタミンＣを体内で作れないのか→ほとんどの哺乳類は自分の体内で合成できるのに,8,https://news.yahoo.co.jp/articles/5e636335a9698d87f87685bfd7d5eacdd27b7c99,11/22(土) 11:00
