scrp_date,scrp_time,genre_en,genre_jp,rank,media_jp,title,comment,link,date_original
2025-10-16,11:35,domestic,国内,1,産経新聞,立民・安住氏　会見で玉木氏を「玉木」と呼び捨てるも言い直す　維新・藤田氏は「君」付け,677,https://news.yahoo.co.jp/articles/48324a749e00743c56de8202219c7693643e9a06,10/16(木) 7:00
2025-10-16,11:35,domestic,国内,2,FNNプライムオンライン,「二枚舌みたいで残念だなと」国民・玉木代表が「維新+自民」の動きに不快感「出し抜いたり、だましたりするみたいな…」,576,https://news.yahoo.co.jp/articles/20121e15a87efef771ea5772014e8978c7cd0e62,10/16(木) 7:48
2025-10-16,11:35,domestic,国内,3,読売新聞オンライン,高市総裁、維新・吉村代表と連立視野に政策協議に入ることで一致…首相指名への協力要請,445,https://news.yahoo.co.jp/articles/b490d4cc38c372977425b79876909352e81a84a1,10/15(水) 19:26
2025-10-16,11:35,domestic,国内,4,読売新聞オンライン,高市総裁、維新と「基本政策はほぼ一致」…玉木氏は連立政権入り打診に応じない姿勢,353,https://news.yahoo.co.jp/articles/5dd8a398ca94c1e869c2e075b7af252274c3b0cc,10/15(水) 21:27
2025-10-16,11:35,domestic,国内,5,FNNプライムオンライン（フジテレビ系）,自民と維新が連立政権も視野にきょう政策協議を本格化へ　維新・立憲・国民3党連携きのうは基本政策一致に至らず,303,https://news.yahoo.co.jp/articles/442d7dcdd9170290266e17ca5728ad568b9ebfc6,10/16(木) 6:18
2025-10-16,11:35,domestic,国内,6,テレビ朝日系（ANN）,維新が連立視野に自民と政策協議　合意なら高市に投票へ　玉木氏「最初から言ってよ」,294,https://news.yahoo.co.jp/articles/55b00fdc444d6b1697165b3367a45a182498df0c,10/16(木) 10:33
2025-10-16,11:35,domestic,国内,7,FNNプライムオンライン（フジテレビ系）,「二枚舌みたいで残念だ」国民・玉木代表が維新の自民との連立に向けた動きに不快感　きょうは公明党と党首会談へ,289,https://news.yahoo.co.jp/articles/9410a07ceb6334dadd4ae65ab4aa84726f72632e,10/16(木) 6:27
2025-10-16,11:35,domestic,国内,8,TBS NEWS DIG Powered by JNN,維新・吉村代表　自民と政策協議まとまれば「高市早苗」に投票　総理大臣指名選挙,280,https://news.yahoo.co.jp/articles/e509488229800322f6d40a9aa5e52be8a25e5dee,10/15(水) 20:01
2025-10-16,11:35,domestic,国内,9,時事通信,夫婦別姓に否定的「9割超」　政府パブコメ、組織投稿疑う声,258,https://news.yahoo.co.jp/articles/777ccc76bbfb17198e60eba82c57e1894605d771,10/15(水) 17:18
2025-10-16,11:35,domestic,国内,10,毎日新聞,公明・斉藤氏、維新をけん制か　「数合わせでない協議を望む」,251,https://news.yahoo.co.jp/articles/c1efa9a88701d1198f7bf5bc3be477234e9ca42d,10/15(水) 21:58
2025-10-16,11:35,domestic,国内,11,デイリー新潮,なぜか女性の識者は「高市早苗氏」に手厳しいが…選挙のプロが「むしろ高市さんを応援する女性は少なくないのでは」と指摘する理由,225,https://news.yahoo.co.jp/articles/e8d76ff7d1add722cb1e049f56041f7b03343944,10/16(木) 6:12
2025-10-16,11:35,domestic,国内,12,日刊スポーツ,国民・玉木雄一郎代表「二枚舌」維新に不満爆発「自民と握ると決まってた…結局連立まっしぐら」,224,https://news.yahoo.co.jp/articles/e6f9da74920f5bd4a303e570d8b8cc5d70adc99c,10/16(木) 9:34
2025-10-16,11:35,domestic,国内,13,デイリースポーツ,「維新は二度と身を切る改革などと口にするな」法政大教授→裏金をため込んだ政治家を大量に抱える自民党とくっつくということ,220,https://news.yahoo.co.jp/articles/dd27e113180e8edae29e052acdb142cbe1f4b1aa,10/16(木) 9:46
2025-10-16,11:35,domestic,国内,14,週刊金曜日,スリランカ人の難民認定と在留資格求める控訴を棄却　なぜ「家族」の実態認めないのか,219,https://news.yahoo.co.jp/articles/a06326d4edeec4c918278897fdc2f35cd4a76661,10/16(木) 9:10
2025-10-16,11:35,domestic,国内,15,毎日新聞,「二枚舌みたいで残念」　国民・玉木氏、自民と合意の維新に恨み節,200,https://news.yahoo.co.jp/articles/a5844298362913a0fb649bd7d085122af3a56b6d,10/16(木) 9:06
2025-10-16,11:35,domestic,国内,16,週刊金曜日,今夏以降、外国人の「強制送還」が急増　日本生まれ児童も送還の異常事態,186,https://news.yahoo.co.jp/articles/bf6735c7396bc8c6607948929b15241efdcb4761,10/16(木) 11:10
2025-10-16,11:35,domestic,国内,17,産経新聞,首相指名で怪文書　立民・有田氏が「自民造反26人」拡散、名指しの国光氏「あり得ない」,177,https://news.yahoo.co.jp/articles/4c749bb9c60266b0cd60a4efc818857236d40a89,10/16(木) 7:00
2025-10-16,11:35,domestic,国内,18,よろず～ニュース,社民・福島党首　維新、国民民主に呼びかけ「自民党の延命に手を貸さないで」“高市首相”阻止へ「立場は一貫」,172,https://news.yahoo.co.jp/articles/82e4b2f6ab52e00e731e375194a18a9a8f208b12,10/15(水) 19:20
2025-10-16,11:35,domestic,国内,19,産経新聞,立民・野田代表「失礼過ぎるのでは」　国民・玉木氏の蓮舫氏巡る「黒歴史」発言に不快感,170,https://news.yahoo.co.jp/articles/8eeff0012b089878e81fa9f11aae6f0d8ec4ca54,10/16(木) 7:00
2025-10-16,11:35,domestic,国内,20,デイリースポーツ,杉村太蔵氏の「数合わせ」指摘に立憲・野田代表「数合わせじゃないでしょう！」首班指名で激論,169,https://news.yahoo.co.jp/articles/3d9fb4db4b176fdc3be7a731b4038591e6ee55b1,10/16(木) 10:08
2025-10-16,11:35,domestic,国内,21,日刊スポーツ,落語家の立川志らく、立民幹事長の「きれいごと」発言に「そんな党に日本を任せられるわけがない」,166,https://news.yahoo.co.jp/articles/89df3c4a8c6f1c87081feaa96c0af9bb854be559,10/16(木) 9:55
2025-10-16,11:35,domestic,国内,22,FNNプライムオンライン（フジテレビ系）,【速報】高市総裁が玉木氏に首班指名で協力要請「非常に基本政策が近い」　所得税控除拡大への協議体設置提案,163,https://news.yahoo.co.jp/articles/c3c445eb2c544ea22f89fda971a48ebca1eefb23,10/15(水) 15:42
2025-10-16,11:35,domestic,国内,23,日刊スポーツ,国民・玉木雄一郎代表「立民の安住幹事長は行儀が悪い」野党３党首会談の最初の“一致点”を告白,161,https://news.yahoo.co.jp/articles/12d291461c803a972ea8c001ec97b7aab097df9b,10/16(木) 10:51
2025-10-16,11:35,domestic,国内,24,産経新聞,維新、連立入りの政策協議後押しの声相次ぐ　慎重意見は少数　両院議員総会,161,https://news.yahoo.co.jp/articles/3ba2f46bc90e31d7c3f7fb5a3e4402b5cf5e6add,10/16(木) 10:25
2025-10-16,11:35,domestic,国内,25,ABEMA TIMES,立憲・安住幹事長「政策実現の話ばっかり持ち上げてワイドショー出してんでしょ玉木くん」「何が大義かを見つけて。しつこく言われてイヤかもしれないけど」立・国・維党首会談についてコメント,159,https://news.yahoo.co.jp/articles/d0f04f5acb2a3a12db83ab3922e65a19f713b97c,10/15(水) 11:54
2025-10-16,11:35,domestic,国内,26,J-CASTニュース,「下がれよ、安月給」「殺すぞ！」撮り鉄が駅員に罵声　近鉄は後日警察に相談「今後は躊躇せず通報」,158,https://news.yahoo.co.jp/articles/f476249f1d5c50946b05452fdfe0824ad68d75ec,10/15(水) 18:29
2025-10-16,11:35,domestic,国内,27,テレビ朝日系（ANN）,自民 N党斉藤氏と参院会派を結成　多数派形成にむけた動き,156,https://news.yahoo.co.jp/articles/3e64b11df91c566e8593672a8de9d4d474534381,10/15(水) 20:17
2025-10-16,11:35,domestic,国内,28,AERA DIGITAL,自民・維新の連携で「高市総理」は決定的か　まだ残る「離党」「造反」の可能性,146,https://news.yahoo.co.jp/articles/ea7b99952de5bab669264da1e062a3766610e833,10/16(木) 8:01
2025-10-16,11:35,domestic,国内,29,日刊スポーツ,野田佳彦代表の生出演で女性タレント直球質問「なんで総理大臣に名乗り出なかったのかな」,143,https://news.yahoo.co.jp/articles/5c1a973b2ba4b313b2be4edcfeffacdb80b23715,10/16(木) 9:35
2025-10-16,11:35,domestic,国内,30,デイリースポーツ,杉村太蔵氏、立憲・野田代表へ注文　安住幹事長は「もう少しお行儀良くされた方が」「感じ悪い」,143,https://news.yahoo.co.jp/articles/4907ba3b149b289b5657874be2df6ef8c1140618,10/16(木) 10:23
2025-10-16,11:35,domestic,国内,31,デイリースポーツ,立憲野田代表　「まさか３党首会談の後に吉村代表と高市総裁が」想定外の動きと認める→維新内に多様な意見、首班指名は簡単ではない,141,https://news.yahoo.co.jp/articles/874205648bb0e2faf0f0d2002adc16a3debd80e8,10/16(木) 10:39
2025-10-16,11:35,domestic,国内,32,日刊スポーツ,立民・安住幹事長「高市さんの方が1歩先」国民・玉木代表主張に「自民補完勢力のままいくのか」,139,https://news.yahoo.co.jp/articles/ee4f4be37ffb23fdc284ec332f68a6d8292937f8,10/16(木) 9:41
2025-10-16,11:35,domestic,国内,33,テレビ朝日系（ANN）,野党3党首 基本政策折り合わず　立憲・維新・国民　協議継続へ,138,https://news.yahoo.co.jp/articles/d3d786e72386843b34f1600d7ba8784fbfdf77e5,10/15(水) 17:39
2025-10-16,11:35,domestic,国内,34,スポーツ報知,「まさか吉村さんが上京されて…予想していませんでした」…「自民」高市早苗総裁と「維新」吉村洋文代表「会談」を巡り「モーニングショー」生出演「立民」野田佳彦代表が明かす,131,https://news.yahoo.co.jp/articles/453842a03452588e7e448a86f08afb4c794211ae,10/16(木) 9:33
2025-10-16,11:35,domestic,国内,35,プレジデントオンライン,そりゃ子供が生まれないわけだ…大人になっても自立しない「子供部屋おじさん」が世界中で蔓延する理由,130,https://news.yahoo.co.jp/articles/5ae6c9f300cec9febd8a24038e6e664be7000c39,10/16(木) 10:16
2025-10-16,11:35,domestic,国内,36,時事通信,玉木氏、自維連立なら参加せず,127,https://news.yahoo.co.jp/articles/fb4e1b5e2ee7c499303a4b206695c9ac7d1db8e1,10/15(水) 22:46
2025-10-16,11:35,domestic,国内,37,プレジデントオンライン,「ぼったくり商店街」呼ばわりに日本人店主は頭を抱えている…「大阪庶民の台所」が一気に評判を落とした背景,121,https://news.yahoo.co.jp/articles/656c99b6d6d2630c4ff1d9aeafd469ab44b14267,10/16(木) 9:16
2025-10-16,11:35,domestic,国内,38,スポニチアネックス,立民・辻元清美氏が国民・玉木代表へメッセージ　民主党政権では失敗も「人って学ぶじゃない？」,118,https://news.yahoo.co.jp/articles/ff100ccfb660f01fb0c7e126faca59e608ac9329,10/15(水) 21:46
2025-10-16,11:35,domestic,国内,39,産経新聞,「JICA解体デモ、ネトウヨはロシアに利用される」　平将明デジタル相が報道を基に発言,116,https://news.yahoo.co.jp/articles/16203c594a5715b4c374a480bb5714581f4e29f9,10/16(木) 7:00
2025-10-16,11:35,domestic,国内,40,文春オンライン,【ラブホ密会】小川晶・前橋市長は「男から何度蹴り倒されても、しぶとく立ち上がる子」同級生の証言…千葉の少林少女が弁護士を目指すまで,108,https://news.yahoo.co.jp/articles/8c57951dcb89d44fd4566686e37794ac98573c84,10/16(木) 7:12
