scrp_date,scrp_time,genre_en,genre_jp,rank,media_jp,title,comment,link,date_original
2024-01-25,16:18,TTL,総合,1,読売テレビ,【速報】青葉被告に死刑判決　完全責任能力ありと認める　36人殺害の京都アニメーション放火殺人事件,1236,https://news.yahoo.co.jp/articles/94f79293162fc97557dcfc5867a3d9fd5635b22a,1/25(木) 13:41
2024-01-25,16:18,TTL,総合,2,文春オンライン,《契約更改で大モメ中》ロッテ・佐々木朗希（22）がプロ野球選手会を脱退していた！《関係者は「若手で加入していないのは彼だけ」》,593,https://news.yahoo.co.jp/articles/8a9b571b178437ddd688666d125d23555017668f,1/25(木) 7:12
2024-01-25,16:18,TTL,総合,3,OBS大分放送,“大谷グローブ”子どもたちに届かず…市役所展示で物議 「勝手に展示するな」「市長の私物のように感じる」批判殺到　大分・別府市,565,https://news.yahoo.co.jp/articles/546a34a1d2fe6e837b4d905b1f7b2e9242344486,1/24(水) 16:27
2024-01-25,16:18,TTL,総合,4,MBSニュース,【速報】「残虐非道の限り　苦痛は筆舌に尽くしがたい」青葉真司被告に死刑判決　36人死亡の京アニ裁判「心神喪失、耗弱の状態ではなかった」責任能力認める,472,https://news.yahoo.co.jp/articles/e64ffe6c49def6decb76e8e7afcd863a954f9066,1/25(木) 11:01
2024-01-25,16:18,TTL,総合,5,東洋経済オンライン,港区女子の投稿で波紋「高級すし店」どんな場所か 身だしなみや注文の仕方など気を付けたい点,432,https://news.yahoo.co.jp/articles/76447d16f337d4b203f1d748c831349e33596748,1/25(木) 9:41
2024-01-25,16:18,TTL,総合,6,TBS NEWS DIG Powered by JNN,日大アメフト部「廃部」先月15日付け　80年以上の歴史に幕,381,https://news.yahoo.co.jp/articles/756ec5e3b1be590574a935ab4a3333b0e6498c9c,1/25(木) 14:20
2024-01-25,16:18,TTL,総合,7,スポニチアネックス,北村弁護士、羽田“ペット犠牲”を解説　「日本は遅れてる」の声に反論　「さすが」「おっしゃる通りです」,344,https://news.yahoo.co.jp/articles/7c656a5f123cfa68af49315980ae9a09c977a160,1/25(木) 11:17
2024-01-25,16:18,TTL,総合,8,スポーツ報知,「めざまし８」、週刊文春「松本人志」第４弾報道を伝える…谷原章介「今度は実名、顔出し、新証言です」,301,https://news.yahoo.co.jp/articles/319b96b95353a45352eca4e08d02126bbbe5a72f,1/25(木) 9:04
2024-01-25,16:18,TTL,総合,9,読売新聞オンライン,東京都がミサイル攻撃に備え「地下シェルター」…麻布十番駅に整備方針、長期避難も視野,271,https://news.yahoo.co.jp/articles/20979db65c4b2665d53884ea0247aa2eac51db19,1/25(木) 5:00
2024-01-25,16:18,TTL,総合,10,電ファミニコゲーマー,株式会社ポケモン、類似の他社ゲームについて「ポケモンのいかなる利用も許諾しておりません」との声明を発表。知的財産権の侵害行為に対しては調査の上、適切な対応を取るとの姿勢を示す,232,https://news.yahoo.co.jp/articles/572aec341e5f420f9a3a3ecdb62ae7bbfe9dc555,1/25(木) 13:01
2024-01-25,16:18,TTL,総合,11,デイリー新潮,松本人志は「気持ち悪い」で批判殺到、相方の浜田雅功はスルー…同じ女性問題で世間の反応がこうも違うのは何故か,194,https://news.yahoo.co.jp/articles/0673d0336aec72a9b7baad2c899231c26482eb67,1/25(木) 10:55
2024-01-25,16:18,TTL,総合,12,時事通信,都心マンション、初の1億円超え　23年平均価格、超高額物件押し上げ,173,https://news.yahoo.co.jp/articles/1981826f14fd3e27853eb9f0693b2a82f961c3d7,1/25(木) 14:03
2024-01-25,16:18,TTL,総合,13,日刊ゲンダイDIGITAL,松本人志に対し被害女性が実名告白で…「ダウンタウン」解散必至、浜田雅功“ピン活動”の青写真,164,https://news.yahoo.co.jp/articles/914a36f44b66f6fab98eb359ebf24dd5a834c8ad,1/25(木) 13:55
2024-01-25,16:18,TTL,総合,14,FNNプライムオンライン（フジテレビ系）,【速報】自民党森山派が解散を決定　立件されていない派閥で初の解散　25年の歴史に幕,142,https://news.yahoo.co.jp/articles/b637b13d517d3f11e6952de33e7ba389dfd41095,1/25(木) 12:13
2024-01-25,16:18,TTL,総合,15,スポニチアネックス,清原博弁護士　松本人志巡る実名告発の文春報道に見解「既に裁判…女性としては言い分が正しいと確信を」,125,https://news.yahoo.co.jp/articles/06cc2e5408dab662c6c68dd8c257cd9f5fd77bab,1/25(木) 15:38
2024-01-25,16:18,TTL,総合,16,ダイヤモンド・オンライン,「あおり運転」狙われやすい人、ウインカーが原因かも…守るべき“たった1つのルール”とは？,115,https://news.yahoo.co.jp/articles/9edc4b951a9575bf44355af4b67b2ba239ddd006,1/25(木) 5:56
2024-01-25,16:18,TTL,総合,17,日刊ゲンダイDIGITAL,ソフトバンク王会長“大炎上”《老害》呼ばわりの悲哀…FA山川獲得、和田プロテクト騒動めぐりSNS罵詈雑言,108,https://news.yahoo.co.jp/articles/c9f441b1c44685fef428970939f24c7abd5db1f7,1/25(木) 14:48
2024-01-25,16:18,TTL,総合,18,読売テレビ,【速報】「6時間動かず」「不安はトイレ」「飲み物ない」大雪の名神高速で立ち往生中の女性が語る,107,https://news.yahoo.co.jp/articles/c71fefbd9183016f0a91c266ba24b646a8ded341,1/24(水) 16:25
2024-01-25,16:18,TTL,総合,19,デイリースポーツ,完封目前で後半ロスタイムに失点　矢面のＧＫ鈴木彩艶にＳＮＳ擁護の声も「ザイオン叩かれてるけどＧＫの責任じゃねーべさ」,104,https://news.yahoo.co.jp/articles/4b04f68827e62c1c36c52867d641aa0b2dc60dc3,1/24(水) 23:22
2024-01-25,16:18,TTL,総合,20,日刊スポーツ,ひろゆき氏、櫻井よしこ氏の戦争発言へ“アンサー”「自分で戦争に行かないように、おいらも」,102,https://news.yahoo.co.jp/articles/81906064a91c402344a4ec2c727ee9aa4f550110,1/25(木) 9:21
2024-01-25,16:18,TTL,総合,21,共同通信,福島第1、年度内デブリ採取断念　延期3回目、10月開始に変更,100,https://news.yahoo.co.jp/articles/5110c10d051b5dc1c5d60a3c5ce9fe9c3d3f1f4b,1/25(木) 11:07
2024-01-25,16:18,TTL,総合,22,日刊スポーツ,玉川徹氏、文春松本人志報道めぐる「書き得」論争に反論「組織としてやるとは考えにくい」,99,https://news.yahoo.co.jp/articles/ad18bb49a87a886483147cf806b3f3f72f4b6613,1/25(木) 10:59
2024-01-25,16:18,TTL,総合,23,日刊スポーツ,ひろゆき氏、京アニ事件に私見「『死刑だから助けなくていい』という判断があってもいいような」,97,https://news.yahoo.co.jp/articles/8f37c30ef3337cc58feef85a2829c405f0e20841,1/25(木) 15:39
2024-01-25,16:18,TTL,総合,24,京都新聞,京アニ事件きょう判決　遺族男性はむなしさ覚悟「極刑でも息子の笑顔は帰ってこない」,97,https://news.yahoo.co.jp/articles/f635e057a68d53715ec28f4eb54dec71e19ad9c8,1/25(木) 7:02
2024-01-25,16:18,TTL,総合,25,ABEMA TIMES,“空飛ぶバイク”の開発会社が破産… 元社員が明かす開発の実態「見た目を重視して高コストになってしまった」「自転車操業だった。頂いていたお金をどんどん使って、あとがなくなりつつあった」,95,https://news.yahoo.co.jp/articles/2ced6f3f897ce4423d61bd246850db1242f15bab,1/25(木) 7:00
2024-01-25,16:18,TTL,総合,26,日刊ゲンダイDIGITAL,岸田首相まさかのニヤニヤ答弁 避難所の環境改善問われ「全力で取り組む」連発するだけの軽さ,91,https://news.yahoo.co.jp/articles/06d89d6169aada9f01e9672cad7df3fb4f997c45,1/25(木) 13:55
2024-01-25,16:18,TTL,総合,27,女性自身,秋篠宮さま　地方ご公務日程短縮の異例決断…秘めた体調異変の紀子さまへのご配慮,84,https://news.yahoo.co.jp/articles/33316083e7b48175127df9f608fd7261bcf54d2f,1/25(木) 6:04
2024-01-25,16:18,TTL,総合,28,スポーツ報知,巨人・秋広優人、２度の遅刻猛省　「信頼取り戻せるよう」キャンプに持っていくものとは？,82,https://news.yahoo.co.jp/articles/41ec2e37fe6f9b6876d8326378829dc3b4b588d5,1/25(木) 5:00
2024-01-25,16:18,TTL,総合,29,日刊スポーツ,立民・小川淳也氏、自民政治刷新本部に「薄汚れた手で部屋を綺麗にしますという資格はあるのか」,81,https://news.yahoo.co.jp/articles/84fc9fe1e4b7443257022a464a933a47a918db45,1/25(木) 15:36
2024-01-25,16:18,TTL,総合,30,日刊スポーツ,【アジア杯】日本、上田綺世ほぼハットトリック！インドネシアに３－１快勝、Ｄ組２位で決勝Ｔ進出,80,https://news.yahoo.co.jp/articles/c5369a61e3df536acc76b0bff9817f8a7db1df43,1/24(水) 22:27
2024-01-25,16:18,TTL,総合,31,くるまのニュース,「救急車呼んで…」7700円かかる？ 「入院しない救急搬送」で料金徴収決定！ 本当に救急車が必要な場面とは,79,https://news.yahoo.co.jp/articles/c66596ca72d30b5d8ab40efaf14d2493e0b79a0e,1/25(木) 9:10
2024-01-25,16:18,TTL,総合,32,テレビ朝日系（ANN）,自民・安倍派幹部への離党勧告処分求める声に反発も　岸田総理は難しい判断に,78,https://news.yahoo.co.jp/articles/98673c25144546707524ec88b04787338eee5cc6,1/24(水) 20:51
2024-01-25,16:18,TTL,総合,33,産経新聞,「子供たちに渡すのが先」　大谷翔平寄贈グラブ、配送前に市役所展示で波紋　大分県別府市,77,https://news.yahoo.co.jp/articles/71ebea33e3f7ad20dffce01929522899effa5022,1/25(木) 14:23
2024-01-25,16:18,TTL,総合,34,スポニチアネックス,京アニ事件、被告に死刑判決　清原博弁護士「やむを得ない」見解も…社会の問題指摘「孤立防げたんじゃ」,75,https://news.yahoo.co.jp/articles/856782b1f80bd195256a00681032a993e777cb6f,1/25(木) 15:10
2024-01-25,16:18,TTL,総合,35,オリコン,松本人志、あす26日放送『人志松本の酒のツマミになる話』出演へ　番組公式Xには出演シーンの動画も,75,https://news.yahoo.co.jp/articles/94ca24a8a9396fa7cfd00efbabb75b5535863421,1/25(木) 14:31
2024-01-25,16:18,TTL,総合,36,毎日新聞,自民・茂木氏、安倍派幹部に「けじめの付け方、自ら提案を」と要求,73,https://news.yahoo.co.jp/articles/0692a8a45652ef568d894f4e4918624ea023fe53,1/25(木) 14:31
2024-01-25,16:18,TTL,総合,37,スポニチアネックス,若新雄純氏、週刊誌報道を謝罪「本当にごめんなさい」　16歳少女との交際報道認める　自殺未遂も状況説明,70,https://news.yahoo.co.jp/articles/891fce14f69605e301c4edfe2c15e0bddb4824ee,1/25(木) 10:02
2024-01-25,16:18,TTL,総合,38,産経新聞,小沢一郎氏「これで邪魔者を消せると」　自民・茂木敏充氏が安倍派幹部に離党勧告検討報道,68,https://news.yahoo.co.jp/articles/8f4f9c84e32cd44b2e47a8894908ae92aa64cf7b,1/25(木) 13:07
2024-01-25,16:18,TTL,総合,39,CBCテレビ,「食事はアメを舐めてしのいでいる」 立ち往生は9時間以上に…　午後8時過ぎても状況変わらず 「いつまで待てばいいの…」 名神高速・関ヶ原IC付近で立ち往生続く,67,https://news.yahoo.co.jp/articles/d282c2ab1dd438bd8970e8a332da0600430d70f2,1/24(水) 20:57
2024-01-25,16:18,TTL,総合,40,SmartFLASH,【リニア】JR東海の“堪忍袋の緒”が切れた！川勝知事「デタラメ理論」に異例の会見で「事務方からどう伝えられているのか」,66,https://news.yahoo.co.jp/articles/016398daeea476e082362596fac86e5f01853df2,1/25(木) 15:45
