scrp_date,scrp_time,genre_en,genre_jp,rank,media_jp,title,comment,link,date_original
2025-12-26,07:07,business,経済,1,共同通信,物価上昇に負けないベアを　首相、経団連で要請,149,https://news.yahoo.co.jp/articles/555f36363e117f728e084fd8afa07d3a1a77599d,12/25(木) 15:25
2025-12-26,07:07,business,経済,2,東洋経済オンライン,【中国】「日本批判の報道が連日」「国営TV局が高市首相の風刺アニメ作成」　悪化する《対日感情》…現地で見た“実態”とは,77,https://news.yahoo.co.jp/articles/863f76b17fd1e01e8e9fb6ae1e7c10551be28655,12/26(金) 6:40
2025-12-26,07:07,business,経済,3,東洋経済オンライン,「汚すぎる」「食べ物を粗末にしてる」と批判の声が…。大食い系YouTuberに「食べ物を吐いた」疑惑が浮上→活動休止。ここまで燃えた理由とは？,69,https://news.yahoo.co.jp/articles/6003140f75bb866e8553da8f30ddd5a6a68f84c3,12/26(金) 5:16
2025-12-26,07:07,business,経済,4,朝日新聞,就活日程の見直し検討へ　政府、29年春入社から　日程の前倒し案も,52,https://news.yahoo.co.jp/articles/dd3b62979e12fee45b721176ecb654e31e7e3999,12/26(金) 5:00
2025-12-26,07:07,business,経済,5,みんかぶマガジン,1泊5000円台！「中国人観光客激減に日本人歓喜」…宿泊税は根拠失う「もはやホテルいじめだ」日本国民への増税,47,https://news.yahoo.co.jp/articles/5707d44d5d428171d28988e1a86d01b148dbe4fe,12/25(木) 9:10
2025-12-26,07:07,business,経済,6,文春オンライン,《社長が深く猛省＆3カ月報酬カット》社員に「頭悪すぎる」取締役に「ハゲ」…オイシックス髙島宏平社長（52）のセクハラ・パワハラを告発！,31,https://news.yahoo.co.jp/articles/f89395afa79e1a0fcb76f011084652be9f11dc58,12/25(木) 14:27
2025-12-26,07:07,business,経済,7,FNNプライムオンライン（フジテレビ系）,「混んでて来られなかった」中国人が減り日本人が増えた観光地　箱根・奈良で異変　夕方に閉店…宿に「空き枠」メニューも変更,28,https://news.yahoo.co.jp/articles/361e24def838c856b966c9320120ff76256a36ae,12/25(木) 19:06
2025-12-26,07:07,business,経済,8,東洋経済オンライン,JR南武線「ワンマン化で遅延増」汚名返上なるか　停車時間や折り返しなど26年春に「一部見直し」　南武線だけ目立つ遅延、特有の事情がある？,27,https://news.yahoo.co.jp/articles/3b846c85c0025bf3673cecf66d5b9a897f0e7e4e,12/26(金) 4:30
2025-12-26,07:07,business,経済,9,文春オンライン,「エヌビディア時価総額が日本のGDPよりも大きい異常」エミン・ユルマズ氏が警告する“AIバブル崩壊”の足音,26,https://news.yahoo.co.jp/articles/3b140de34be1597273c86f7577fcbf9fd68f9e4d,12/26(金) 6:21
2025-12-26,07:07,business,経済,10,ファイナンシャルフィールド,【給付金】結局「1人4万円」＋「子ども1人2万円」もらえるんですか？わが家は“住民税非課税世帯”ではないですが、対象になりますか？ いつ頃支給されるでしょうか？,21,https://news.yahoo.co.jp/articles/35ee688919842f3c7410bdf0ea3c92e935e7ef84,12/25(木) 13:30
2025-12-26,07:07,business,経済,11,東洋経済オンライン,「違和感しかない」「死者への冒涜だ」　人気番組で《みのもんたさんがAIでよみがえる》感動演出も、“AI復活”がここまで嫌悪されるワケ,20,https://news.yahoo.co.jp/articles/e85341710ebf5c20a5f4a80e1952bcbc2bc9db2e,12/26(金) 6:46
2025-12-26,07:07,business,経済,12,読売新聞オンライン,「にゃんこ」や「呪術廻戦」も、百貨店がアニメや漫画・ゲームのショップ展開に注力…すでに「キャラクターの聖地」も,19,https://news.yahoo.co.jp/articles/79d1b0d77d26d6bbdccfd95495f1f9d1e55fb9a6,12/25(木) 14:00
2025-12-26,07:07,business,経済,13,ファイナンシャルフィールド,婚活中の30代女性です。友人に「同年代で“年収800万円以上”の相手を求めるのは厳しいよ」と言われました…都内で生活していくならこれくらい必要だと思うのですが、条件を変えたほうがいいでしょうか…？,17,https://news.yahoo.co.jp/articles/01f4c429323374965c21a08d9d0b2a9a6f0d51bd,12/25(木) 7:20
2025-12-26,07:07,business,経済,14,東洋経済オンライン,経営陣は法的責任問われる可能性も…今も世界で10億台以上稼動、サポート終了した「Windows 10」使い続けるリスク,16,https://news.yahoo.co.jp/articles/0548d06508132b409f61d4aeb26046a944d52707,12/26(金) 6:00
2025-12-26,07:07,business,経済,15,THE GOLD ONLINE（ゴールドオンライン）,な、なにやってんだ…年収350万円の50歳父、上京した大学生息子から届いた「大企業内定」の吉報がクリスマスに一変。両親を凍らせた「戦慄のひと言」【FPが解説】,16,https://news.yahoo.co.jp/articles/648e5ad927457ec718fee4f9b8b5a88f4ba397a3,12/25(木) 10:30
2025-12-26,07:07,business,経済,16,ITmedia ビジネスオンライン,なぜ、ハーゲンダッツは「12月でも売り上げが落ちない」のか？　41年続く”冬の女王”の販売戦略,16,https://news.yahoo.co.jp/articles/c608685ced56c81b5626662e79638c6ae52c9008,12/25(木) 7:40
2025-12-26,07:07,business,経済,17,TBS NEWS DIG Powered by JNN,予算気にしながらのクリスマス どうなる?物価高…来年度予算案は過去最大122.3兆円→4分の1は“借金”返済 「自分の代で終わらせたい」の声も【news23】,16,https://news.yahoo.co.jp/articles/3bbd6cd64f99926ec4b8bae1f25916e7921a964d,12/25(木) 15:47
2025-12-26,07:07,business,経済,18,FNNプライムオンライン（フジテレビ系）,東京・お台場のテーマパーク「イマーシブ・フォート東京」来年2月で営業終了　「刀」森岡毅CEO「挑戦してきたが苦渋の決断」,14,https://news.yahoo.co.jp/articles/6600fc7748ea0ff0b315b36cbd7d614a973edaed,12/25(木) 21:36
2025-12-26,07:07,business,経済,19,中部経済新聞,「ＲＡＶ４」生産停止,14,https://news.yahoo.co.jp/articles/16c9e8cbb6123ae9154bf1ff66bf5eff8d0748f4,12/25(木) 9:45
2025-12-26,07:07,business,経済,20,シェアーズカフェ・オンライン,塾講師が言えない学力の「残酷な真実」 受験産業の闇と親がすべきこと （蓮池林太郎 医師）,13,https://news.yahoo.co.jp/articles/cfe494ef887c1756b03a138d8c3e587cb7254541,12/26(金) 6:30
2025-12-26,07:07,business,経済,21,Finasee,世帯年収2000万円、タワマン住み、愛車はボルボ…パワーカップル姉との格差に悩む35歳教師の葛藤「世の中やっぱりお金なんですかね」,13,https://news.yahoo.co.jp/articles/eec9b1fc5d6cd2ed857140a5a726642d0b7b659c,12/25(木) 19:50
2025-12-26,07:07,business,経済,22,ファイナンシャルフィールド,2027年から「iDeCo」の“拠出限度額”が大幅引き上げに！ 毎月の掛金を「2万3000円→6万2000円」に増額すると、「節税効果」が10年で“90万円以上”も増える!?,13,https://news.yahoo.co.jp/articles/5d8696de1f450ad2055b5738abecf3aa9d2e331c,12/25(木) 13:40
2025-12-26,07:07,business,経済,23,Yahoo!ニュース オリジナル THE PAGE,【ヤフコメで話題】「マイナ保険証の不具合時に10割負担は妥当か」「制度運用や周知の課題」 - 医療現場の混乱と患者負担に意見集まる,13,https://news.yahoo.co.jp/articles/73187096bb36ad09a91ed181f48b68f3bdb25875,12/25(木) 15:09
2025-12-26,07:07,business,経済,24,FNNプライムオンライン（フジテレビ系）,大手スーパー「ロピア」に行政処分　“優越的地位の乱用”納入業者へ約4億3300万円の返金含む改善計画を認定　公正取引委員会,12,https://news.yahoo.co.jp/articles/b49620fc9dd67d2bda7d29941b77b3a097da0845,12/25(木) 20:51
2025-12-26,07:07,business,経済,25,WEB CARTOP,日本の軽自動車が世界を席巻する日も遠くない！　いま海外がKカーに注目するワケ,11,https://news.yahoo.co.jp/articles/192dac1e42c5dacdca995bfe91930335d39db54e,12/26(金) 6:32
2025-12-26,07:07,business,経済,26,Bloomberg,中国の銀ファンドが急落、熱狂「持続不可能」と運用側がブレーキかけ,11,https://news.yahoo.co.jp/articles/907077c851dccead77ef3e6f570cc13c118fb2d7,12/26(金) 0:38
2025-12-26,07:07,business,経済,27,共同通信,11月の宿泊者、5772万人　中国は前年比微減、観光庁,11,https://news.yahoo.co.jp/articles/7c3f2842843a8d51d73ced87371d42d8c8b45ab2,12/25(木) 21:18
2025-12-26,07:07,business,経済,28,Impress Watch,神戸三宮の新バスターミナル名称は「バスタ神戸三宮」,11,https://news.yahoo.co.jp/articles/b44a633dcb3c09907202dc2318e72cbaaa34f8a9,12/25(木) 14:01
2025-12-26,07:07,business,経済,29,共同通信,農水省、コメ「需要に応じ生産」　食糧法に明記へ,11,https://news.yahoo.co.jp/articles/63d4448e7e0cd231733b22599d3c2d6bf6430b42,12/25(木) 17:19
2025-12-26,07:07,business,経済,30,読売新聞オンライン,もち米高騰で「正月食材」の餅やみりんが値上がり…コメ不足しわ寄せに主婦「鏡餅を小さくしてやりくり」,11,https://news.yahoo.co.jp/articles/f13694ff4e5899c828739754ed2d1e68ef9b4fa0,12/25(木) 15:00
2025-12-26,07:07,business,経済,31,週刊SPA!,就職氷河期支援の熱意はどこへいった？厚労省の特設サイトもひっそりと名称変更,11,https://news.yahoo.co.jp/articles/1cfca6f16fc6f4597432a967376f8f9081b8f96d,12/25(木) 15:52
2025-12-26,07:07,business,経済,32,東洋経済オンライン,「トイレを連想」「衛生面が気になる」との声も…。おしゃれドーナツ店「I'm donut？」が陳列方法めぐり炎上、その要因と取るべき対策,10,https://news.yahoo.co.jp/articles/96f09a4c7a9c5675a319b8a5ba9782eb964ad903,12/26(金) 6:30
2025-12-26,07:07,business,経済,33,鉄道コム,JR九州、鹿児島本線新駅の名称を「JR貝塚」に決定　投票案では「ゲートウェイ」も上位に,10,https://news.yahoo.co.jp/articles/b9ca505f4c3f4c24a4d9370cb3d12be8c92c429b,12/25(木) 16:09
2025-12-26,07:07,business,経済,34,共同通信,日銀総裁、利上げを続ける方針表明,10,https://news.yahoo.co.jp/articles/5136f87d2c37dac0b453a0f4ba1b7c221a3622db,12/25(木) 13:36
2025-12-26,07:07,business,経済,35,文春オンライン,「中国の対応は、それなりに抑制的」伝説の投資コンサルタントは“日中新冷戦”をどう見たか？「2010年のレアアース停止に比べると…」,10,https://news.yahoo.co.jp/articles/38082d79375f8d6997f2bd1e83ed1a81f051ac2e,12/25(木) 11:12
2025-12-26,07:07,business,経済,36,FNNプライムオンライン（フジテレビ系）,来年夏「骨太の方針」に向けた議論開始　高市首相からの指示に城内経済財政担当相「民間議員とよく相談して参りたい」,10,https://news.yahoo.co.jp/articles/3923a47946cf8a13158413423b1d968c973a1f35,12/25(木) 21:01
2025-12-26,07:07,business,経済,37,TBS NEWS DIG Powered by JNN,日銀　植田総裁「引き続き緩和度合い調整」,10,https://news.yahoo.co.jp/articles/e3e55bf9d72c4dca24cbc0e97503956e71ddb75d,12/25(木) 15:42
2025-12-26,07:07,business,経済,38,シェアーズカフェ・オンライン,3次会でも「仕事のうち」？ 初の労災認定から考える、飲み会セクハラと会社の責任 （李怜香 社会保険労務士）,9,https://news.yahoo.co.jp/articles/92e217df39699c88beed805ae499d9687f60b431,12/26(金) 6:30
2025-12-26,07:07,business,経済,39,Finasee,資産運用「ネットと対面」どちらの満足度が高いのか―調査から分かった結果は意外？ それとも納得？,9,https://news.yahoo.co.jp/articles/e258cda493bbdbf94caa945815a426aaf9061adf,12/25(木) 17:30
2025-12-26,07:07,business,経済,40,ねとらぼ,イオンの4104円クリスマスケーキに「サイズ違い」発覚……　誤って“箱の大きさ”をカタログに掲載　「深くお詫び」返金実施,9,https://news.yahoo.co.jp/articles/2c59647d23bad16c2157a4621d6c4ad7782a2f7a,12/25(木) 17:04
