scrp_date,scrp_time,genre_en,genre_jp,rank,media_jp,title,comment,link,date_original
2025-05-11,12:26,sports,スポーツ,1,デイリー新潮,今年も打てない！中日の“極貧打線”　球団関係者が嘆く「監督交代」だけでは解消できない「根深い問題」,174,https://news.yahoo.co.jp/articles/4c1987ce5d58ef801a455fc726d2a0fb422f1bdf,5/11(日) 11:12
2025-05-11,12:26,sports,スポーツ,2,THE ANSWER,悩める佐々木朗希の現状にロバーツ監督が懸念　「心配なのは球速よりも…」奪三振0降板、マイナー行きは否定,115,https://news.yahoo.co.jp/articles/4ecae87feca4b34c7fb25634b2d2ab8b3c2783a0,5/11(日) 7:39
2025-05-11,12:26,sports,スポーツ,3,中日スポーツ,佐々木朗希、明らかな球速低下『並の投手』に、屈辱の三振ゼロ…番記者は「カットボールなど必要」と指摘、タフさ問われる1年に,103,https://news.yahoo.co.jp/articles/d2e49ef598a7476b16b726434473fc3b626b8e56,5/10(土) 13:11
2025-05-11,12:26,sports,スポーツ,4,Full-Count,止まらぬジャッジ、2打席連発13号＆14号　大谷引き離しMLB単独トップ…敵地騒然,95,https://news.yahoo.co.jp/articles/407fe1d71a436b34cc9b42282b2f1b332a8c4269,5/11(日) 6:43
2025-05-11,12:26,sports,スポーツ,5,文春オンライン,イチローの「4367本」でも王貞治の「868本」でもない…現代野球で最も破るのが難しい“アンタッチャブルレコード”とは,86,https://news.yahoo.co.jp/articles/1bc3ef0773120d5af68c05cae6f4e098d87db0aa,5/11(日) 11:22
2025-05-11,12:26,sports,スポーツ,6,ベースボールキング,巨人・坂本、再昇格後初の無安打…谷繁氏「ピッチャーから見て、今の状態の坂本は…」,69,https://news.yahoo.co.jp/articles/944efb7d09684b6e5cf5321106c2bff05862e8c1,5/11(日) 9:00
2025-05-11,12:26,sports,スポーツ,7,文春オンライン,なぜ読売ジャイアンツで「大投手」は育たないのか　「伝説の名投手たち」が弱小球団でばかり生まれる“悲しすぎる理由”,65,https://news.yahoo.co.jp/articles/c4c520717998e38811658a586368edc60238d2aa,5/11(日) 11:22
2025-05-11,12:26,sports,スポーツ,8,中日スポーツ,佐々木朗希、4イニング3分の0、メジャー自己ワーストの5失点で降板、2番手のバンダが満塁弾を浴び同点に追い付かれる,61,https://news.yahoo.co.jp/articles/ba479e6300a7d73c1b63e39628b785d77f5f3c84,5/10(土) 12:34
2025-05-11,12:26,sports,スポーツ,9,デイリースポーツ,大谷翔平＆ベッツが…好機で初球を打って凡退　わずか５球で攻撃終了　四回１死一、二塁の好機もコンフォルトらが生かせず,57,https://news.yahoo.co.jp/articles/97fc1ffae87e048311ee79940ade1cdd48da6841,5/11(日) 10:22
2025-05-11,12:26,sports,スポーツ,10,中日スポーツ,【福留孝介の目】初回本塁アウトの岡林勇希に準備不足指摘「あのアウトでこの試合のリズムがなくなった」,55,https://news.yahoo.co.jp/articles/462759d4d088afac26b2cfc4a47f903c61ba1951,5/11(日) 5:45
2025-05-11,12:26,sports,スポーツ,11,Full-Count,大谷翔平、乱打戦の9回“確信”勝ち越し3ラン　両手上げ大喜び…2試合連発でMLBトップ12号,53,https://news.yahoo.co.jp/articles/52d352c76c47d4807a623ecb7a93c1934933f59c,5/10(土) 13:49
2025-05-11,12:26,sports,スポーツ,12,Full-Count,復活目指す元阪神の新人王に「目から涙」　2軍で打率.309…再起の夢つなぐ打棒,43,https://news.yahoo.co.jp/articles/9219e25156c9a4ff2d3785247f0c5d416ad53da4,5/11(日) 6:40
2025-05-11,12:26,sports,スポーツ,13,東スポWEB,「カス、カス！」長州力が〝WJ崩壊〟書いた記者を40分罵倒 「おまえラッキーだったな」の真意は…,43,https://news.yahoo.co.jp/articles/3721d1298ed5aad5205c9edfbfbfe93df4caa45c,5/11(日) 10:02
2025-05-11,12:26,sports,スポーツ,14,週刊ベースボールONLINE,バウアーより安定感が上？　今オフに争奪戦の可能性の「助っ人左腕」は,40,https://news.yahoo.co.jp/articles/546f75a30079ec63956de0954e240786962b7c7b,5/11(日) 11:01
2025-05-11,12:26,sports,スポーツ,15,デイリースポーツ,レイエスまで！？日本ハムが全員参加のバント練習　シーズン中では異例　新庄監督が田中賢介ＳＡに指導依頼「メンタル的な要素が」,36,https://news.yahoo.co.jp/articles/213855575bb3766aff0a260adbdb47ecb112230c,5/11(日) 10:15
2025-05-11,12:26,sports,スポーツ,16,中日スポーツ,初回の攻防が全てに…竜は逃しトラはもぎ取った1点 中野のジャッジに走塁の鉄則詰まる『判断材料は事前に』,33,https://news.yahoo.co.jp/articles/89627c0f342773950adcff4c24840d984ef928be,5/11(日) 11:39
2025-05-11,12:26,sports,スポーツ,17,TBS NEWS DIG Powered by JNN,【DeNA】広島に逆転負け...3位浮上逃す 初回5球で先制など3点リードも、6回森原が末包にV打献上で2敗目 9回には伊勢が痛恨失点,33,https://news.yahoo.co.jp/articles/f4e540f8c921fc45731c5b642e7246330ea9899f,5/10(土) 16:51
2025-05-11,12:26,sports,スポーツ,18,ベースボールキング,巨人、岡本離脱後4番打者に安打なし…谷繁氏「阿部監督も頭が痛いですね」,33,https://news.yahoo.co.jp/articles/6432a15cf367ac877632e6cc3c6fcc29c7fd5a67,5/11(日) 8:00
2025-05-11,12:26,sports,スポーツ,19,デイリースポーツ,あの頃の瓜田純士にＳＮＳ騒然「ビジュいい」朝倉未来も驚き「歌舞伎町時代に舞い戻った」　緊迫の額ぶつけメンチ切り合い、７月大阪で悪魔王子戦か,32,https://news.yahoo.co.jp/articles/1ebad901cdef7f0e5be2e39e596ec47fdc76910b,5/11(日) 7:00
2025-05-11,12:26,sports,スポーツ,20,Full-Count,5回までに衝撃19失点「マイナー以下だ」　“弱小球団”が絶望の「3日で53失点」…米激怒「地獄」,31,https://news.yahoo.co.jp/articles/eaed5922821ad42d9086522bcb450dce7e72b239,5/11(日) 11:09
2025-05-11,12:26,sports,スポーツ,21,CoCoKARAnext,ACLEでの“サウジ勢優遇”は「無視できない」 公平性欠くアジアの戦いに英紙が苦言「圧倒的支配が懸念を呼んでいる」,31,https://news.yahoo.co.jp/articles/c86d526cc3cf5b81654478d29ad4f373003c5498,5/11(日) 11:02
2025-05-11,12:26,sports,スポーツ,22,THE DIGEST,佐々木朗希、プロ初の中５日登板は４回0/3、５失点で降板。初回２被弾３失点...粘投も５回を投げ切れず、２番手が満塁弾浴び同点に,31,https://news.yahoo.co.jp/articles/73ac760c7cafef5c6ce4b84cae3320becd3646c0,5/10(土) 12:26
2025-05-11,12:26,sports,スポーツ,23,スポニチアネックス,確信バンザイ弾！大谷翔平が9回に決勝3ラン　2戦連発12号でついにMLBトップタイ浮上　乱打戦制す,30,https://news.yahoo.co.jp/articles/386fea4a18e7db36810e5560dfe386e48f2ea04e,5/10(土) 13:49
2025-05-11,12:26,sports,スポーツ,24,THE ANSWER,井上尚弥、止まらぬ衝撃の「100」　3度階級上がっているのに…「明らかに異常や」気づいたX騒然,30,https://news.yahoo.co.jp/articles/c276b15dbed5228dce759e0150e9460a6733d58b,5/11(日) 10:33
2025-05-11,12:26,sports,スポーツ,25,Number Web,「善戦カルデナスの戦い方がハマった理由」は井上尚弥側にあった…元3階級王者が指摘する井上“今後の課題”「アフマダリエフとどう戦うか」,29,https://news.yahoo.co.jp/articles/40279d831e6864c2df3cd215820e674d01b8f230,5/11(日) 11:11
2025-05-11,12:26,sports,スポーツ,26,中日スポーツ,ロッテ、2試合連続零封負けで今季最多の借金7　先発・西野は1球に泣く…満塁本塁打を被弾,29,https://news.yahoo.co.jp/articles/2761f2d173331dea71ea927d8ddef16c2a1c8725,5/10(土) 21:15
2025-05-11,12:26,sports,スポーツ,27,Full-Count,最下位ロッテが5選手入れ替え　澤村、田村ら抹消…DeNAは森原が2軍へ、11日の公示,28,https://news.yahoo.co.jp/articles/ba05786a72687f45b9645b029ca59ea3f7462848,5/11(日) 12:05
2025-05-11,12:26,sports,スポーツ,28,中日スポーツ,落合博満さん「慣れるしかない」プロ初の中5日登板で不調だった佐々木朗希にビシッと指摘、中畑清さんも「言い訳にはできない」,28,https://news.yahoo.co.jp/articles/ec67564d2cbda964370e9b74754d8a835535df1a,5/11(日) 11:41
2025-05-11,12:26,sports,スポーツ,29,ベースボールキング,ドジャース、元CY賞右腕バーンズに苦戦し完封負け　大谷翔平は今季最長の8試合連続安打含む2出塁,28,https://news.yahoo.co.jp/articles/4d369db9419b2b08a8a6177e4c8d099945b2df1c,5/11(日) 11:28
2025-05-11,12:26,sports,スポーツ,30,スポニチアネックス,ロッテ　2戦連続7度目の零敗で3年ぶり借金7　西野が満弾被弾「甘く入った」　吉井監督も苦言,28,https://news.yahoo.co.jp/articles/03bbd96bbd27765658e9cd35ea4c82945f7c81fe,5/11(日) 5:30
2025-05-11,12:26,sports,スポーツ,31,デイリースポーツ,落合博満氏が巨人に提言　岡本和真の代役４番は「４番目の選手だと割り切らないといけない」負傷したプレーの改善策も言及,28,https://news.yahoo.co.jp/articles/0aae287088b86a7911a7cd71ebecaa9181526ce1,5/11(日) 9:16
2025-05-11,12:26,sports,スポーツ,32,TBS NEWS DIG Powered by JNN,菅野智之、チームトップ4勝目！メジャー自己最長8回途中1失点の快投、防御率2.72　オリオールズは連敗5でストップ,27,https://news.yahoo.co.jp/articles/17c877af13b4d6d7cbc5de727338c3966a842c3a,5/10(土) 13:35
2025-05-11,12:26,sports,スポーツ,33,日テレNEWS NNN,巨人の4番には誰が？　阿部監督「ちょっと考えるわ」　ここまで3試合4番がノーヒット,26,https://news.yahoo.co.jp/articles/e4cf592d16918de5d6ec5d05b28d57ad6238a02f,5/11(日) 12:02
2025-05-11,12:26,sports,スポーツ,34,TBS NEWS DIG Powered by JNN,【中日】今季7度目の零敗で借金3...阪神村上にマダックス献上 2回以降二塁踏めず 髙橋宏7回2失点も援護なくリーグワースト4敗目,26,https://news.yahoo.co.jp/articles/246c8da54b8445ec785c3c816533c9572aa37c82,5/10(土) 16:28
2025-05-11,12:26,sports,スポーツ,35,THE DIGEST,９回土壇場で飛び出した確信弾！ 大谷翔平、二転三転の乱打戦で勝ち越し12号３ラン！,26,https://news.yahoo.co.jp/articles/2ad67d2d5826c919f55c1cca7eed3d80c067c405,5/10(土) 13:52
2025-05-11,12:26,sports,スポーツ,36,DAZN News,元日本代表・小林祐希がJFLの環境を赤裸々に告白「お遊び感覚で週末だけ試合をやっている人もいる」,25,https://news.yahoo.co.jp/articles/39c5173754298f79acd63cac863980c1d67eb551,5/11(日) 8:10
2025-05-11,12:26,sports,スポーツ,37,TBS NEWS DIG Powered by JNN,【巨人10日スタメン】キャベッジ来日初4番 吉川3番 岸田5番 増田陸6番ファースト 坂本7番 浅野8番センター 先発・グリフィン,25,https://news.yahoo.co.jp/articles/c16b287ea6c7d78d8e1244919badbaffc6eee65a,5/10(土) 17:17
2025-05-11,12:26,sports,スポーツ,38,ベースボールキング,阪神・村上頌樹が98球マダックス達成！田尾安志氏「昨季の11敗は考えられない数字…」「一昨年のようなボールになってきた」,25,https://news.yahoo.co.jp/articles/f1431d583a601bc1e47ee205a0cbf2e6dda89f91,5/11(日) 8:40
2025-05-11,12:26,sports,スポーツ,39,THE DIGEST,「弱点がバレたのか？」韓国の至宝キム・ヘソンの“緊急停止→スタメン落ち”に母国メディアが危機感！「３連続三振はいずれも…」,25,https://news.yahoo.co.jp/articles/faa7fc02198be4fcef1375a58f1f100646d89ff7,5/11(日) 4:11
2025-05-11,12:26,sports,スポーツ,40,Full-Count,佐々木朗希の「マイナー降格は考えているか？」　5失点翌日…ロバーツ監督へ飛んだ質問,24,https://news.yahoo.co.jp/articles/963fb15276e329138d874fe8d66a50b0ae6ded48,5/11(日) 9:05
