scrp_date,scrp_time,genre_en,genre_jp,rank,media_jp,title,comment,link,date_original
2024-02-19,11:24,life,ライフ,1,まいどなニュース,シュレッダーにネクタイ巻き込まれ「滅多に焦らない課長が飛んできた」→その行動に絶賛の声「とっさに動ける人えらい」,56,https://news.yahoo.co.jp/articles/a0089dd16bd43bb5fadc1ddb776912b3fabda652,2/19(月) 6:57
2024-02-19,11:24,life,ライフ,2,まいどなニュース,シビックに「バーカ！」「犯人は現場に現れる」張り込んだ友人が翌日、現場で見たものは,41,https://news.yahoo.co.jp/articles/a4c8ab35a5e5fac033e1f269ee1d97071ef488a1,2/19(月) 6:40
2024-02-19,11:24,life,ライフ,3,弁護士ドットコムニュース,会社の飲み会で幹事がクレカで払ったら、上司が「ポイントは横領」と指摘…法的にはどうなる？,27,https://news.yahoo.co.jp/articles/c3e83e7749d1542fa77b7a07ca2489b30e2a8df9,2/19(月) 10:24
2024-02-19,11:24,life,ライフ,4,婦人公論.jp,金八先生以後に生じた「学校＝悪という構図」「学校が良いサービスを提供して当たり前という考え方」…工藤勇一校長が指摘する＜近年の教育現場が抱える問題点＞とは,26,https://news.yahoo.co.jp/articles/a0de487be6047b1673c66cdc6f5e2c97d8fe72b5,2/19(月) 6:31
2024-02-19,11:24,life,ライフ,5,よろず～ニュース,「古いけど必要」学歴社会、社会人の7割近くが「賛成」世代ギャップ顕著　年代上がると学歴意識が低下傾向,25,https://news.yahoo.co.jp/articles/4097dada4e93d76844c8d4bec77375b255fefa79,2/19(月) 10:30
2024-02-19,11:24,life,ライフ,6,FORZA STYLE,「ガイジンのお友達は、いつお国に帰るの？」日本は単一国家と信じる祖母に、孫がブチ切れ！「ドロ沼家庭戦争の悲惨すぎる顛末」,25,https://news.yahoo.co.jp/articles/23ca53194cb63fbaf57666f318521bb113889c30,2/19(月) 7:09
2024-02-19,11:24,life,ライフ,7,FNNプライムオンライン,30代でも“ソフト老害”の加害者に　放送作家・鈴木おさむ氏提唱で話題　「MJS」で表される行動パターンに注意,23,https://news.yahoo.co.jp/articles/631531de8a27aa07b28e87fb218efe8cf80c9937,2/19(月) 10:32
2024-02-19,11:24,life,ライフ,8,日刊ゲンダイDIGITAL,梅毒急増のなぜ（6）20～30代女性の高校時代の性意識…「草食」世代ではなかったのか,23,https://news.yahoo.co.jp/articles/c3fc3a61cb0118d10986a653a7cf817f9f8c559b,2/19(月) 9:06
2024-02-19,11:24,life,ライフ,9,フィガロジャポン,「マウントバッテン＝ウィンザー」と呼ばないで！？ハリー王子夫妻、子どもたちの名字を変更,21,https://news.yahoo.co.jp/articles/9b09970440d0b353330dfe684bc2390b5b6770ec,2/19(月) 8:03
2024-02-19,11:24,life,ライフ,10,ファイナンシャルフィールド,30歳で実家暮らし、恋人から「1人暮らししてほしい」と言われました。「貯金ができて経済的」だと思うのですが、自立のためにも実家を出るべきでしょうか…？,19,https://news.yahoo.co.jp/articles/eff4ffeb56ed0a2084b22a33f5c4232f31fcae00,2/18(日) 13:40
2024-02-19,11:24,life,ライフ,11,FORZA STYLE,もう春です、さすがにダウンジャケットは絶対NG！ 季節感皆無のモコモコオジサンにならないための鉄則。,16,https://news.yahoo.co.jp/articles/8a950f907dc17c4b930cf540afe205962a8f1ce4,2/19(月) 7:02
2024-02-19,11:24,life,ライフ,12,日刊ゲンダイDIGITAL,米国9万人調査 トランスジェンダーの5割が「差別を恐れて引っ越し検討」,15,https://news.yahoo.co.jp/articles/3bb53a68254a2635e68f07b40cac55abbb252be9,2/19(月) 9:06
2024-02-19,11:24,life,ライフ,13,まいどなニュース,「藝大、藝大、東大」衝撃学歴のきょうだい、母親の懸命子育て…中高生時代は「全員好きなことに没頭」,14,https://news.yahoo.co.jp/articles/63e72cd308fc4e07009152712f8b275c0ede0f03,2/19(月) 7:07
2024-02-19,11:24,life,ライフ,14,週刊女性PRIME,歩く百億円・88歳現役社長の “いつだって今がいちばん若い” 健康法に「膣のケア・テレビと会話」,14,https://news.yahoo.co.jp/articles/c05c33d050fa7b33836c0dd95916a431281be1cf,2/18(日) 17:02
2024-02-19,11:24,life,ライフ,15,ファイナンシャルフィールド,【食べ放題の罰金問題】食べ放題のお店で、かなりの量を残してしまい「罰金」を請求されました…支払うべきでしょうか？,12,https://news.yahoo.co.jp/articles/663c2c7a66ff93c1a8d1b85b5492e5d188580c37,2/18(日) 12:11
2024-02-19,11:24,life,ライフ,16,Fav-Log by ITmedia,メルカリで「空き瓶」が高値で売れるのはなぜ？　広報さんに聞いてみた　出品時の注意点も紹介,12,https://news.yahoo.co.jp/articles/ab6d2e73e6444406715bd781fd336f86f05614da,2/18(日) 11:50
2024-02-19,11:24,life,ライフ,17,ハフポスト日本版,知ってた？ゆで卵を茹でずに作る方法。農水省の投稿に「私の常識が音を立てて崩れていく」と反響,12,https://news.yahoo.co.jp/articles/b128fc9b370c843ea2119f8919d2c03b601addbb,2/18(日) 12:11
2024-02-19,11:24,life,ライフ,18,よろず～ニュース,不倫・浮気をする理由は？男女で大きな違い　女性は「相手を好きになった」が1位　男性は欲望重視が顕著,11,https://news.yahoo.co.jp/articles/eac43488204d167983e430f90a1ca544f46ff0c6,2/18(日) 11:20
2024-02-19,11:24,life,ライフ,19,FORZA STYLE,電車の中でドン引きされてるかも…オジサンが出勤前に「絶対チェック」習慣にすべきポイント3つ。,11,https://news.yahoo.co.jp/articles/ac336cc5b73c36c8fe8a47bcc6bd86fc566df7db,2/19(月) 6:57
2024-02-19,11:24,life,ライフ,20,FORZA STYLE,お父さん、わかっているようでわかってないでしょう？今更聞けない！ワイシャツの正しいサイズ感。,10,https://news.yahoo.co.jp/articles/1d7d6d3ec9aa8e45de6f0652bcbf1f5aeca6c6e2,2/19(月) 7:02
2024-02-19,11:24,life,ライフ,21,ハルメク365,「グレイヘア」で老けて見える人若く見える人の違いは？?成功する口紅の色は？【プロ解説】,10,https://news.yahoo.co.jp/articles/6ebc19f9c5cac200def82cd9bd826a3e53ff2c72,2/18(日) 23:15
2024-02-19,11:24,life,ライフ,22,まいどなニュース,「三」をクリックって？…わかりやすさ最優先「ナイスな発案者がいるな」　あえてIT用語使わない、理由を聞いた,10,https://news.yahoo.co.jp/articles/7a733756cb7ac6b85cf792eaf58a7232df7fa0a5,2/19(月) 6:52
2024-02-19,11:24,life,ライフ,23,まいどなニュース,「北海道には6つあるけど、奈良県にはゼロのものなーんだ？」　ヒントは「滋賀県もゼロ」,10,https://news.yahoo.co.jp/articles/ca895005486bba12d7a2457b1a0feb0033e50a80,2/18(日) 18:00
2024-02-19,11:24,life,ライフ,24,NEWSポストセブン,除夜の鐘、盆踊りにも中止要求　恒例行事への「苦情」にどう向き合うべきか,9,https://news.yahoo.co.jp/articles/a3c1a69c95fb089f56a72390c02b0c3e09a45701,2/18(日) 16:15
2024-02-19,11:24,life,ライフ,25,現代ビジネス,森保ジャパンと通底。パリ五輪決定の女子バスケ日本代表「怒らない監督」の涙の意味,9,https://news.yahoo.co.jp/articles/76fb59ad09f76393189bccab890133b31cb12941,2/19(月) 7:03
2024-02-19,11:24,life,ライフ,26,マイナビ子育て,12人産んだ母「あなたは何様ですか？って」すべてを背負いすぎるママたちに伝えたい「子育てに手遅れはない」,9,https://news.yahoo.co.jp/articles/99fe65ac9c68dc4eec381180064a114a941691f0,2/18(日) 11:30
2024-02-19,11:24,life,ライフ,27,Hint-Pot,フライパンで作る濃厚グラタン　オーブン不要のレシピが話題　「これは作ってみたい1品」,8,https://news.yahoo.co.jp/articles/308a6630bcfddb765ac6b761f49b50dce89ba8a4,2/19(月) 10:15
2024-02-19,11:24,life,ライフ,28,週刊SPA!,貧困家庭から東大合格「塾通いは認められず、参考書を買うカネもない」,8,https://news.yahoo.co.jp/articles/7bce914d31bda385f6fee96147aabba96d3277ee,2/18(日) 15:55
2024-02-19,11:24,life,ライフ,29,Hint-Pot,「日本人はゴミをどうしているんだ？」　外国人プロ野球選手の素朴な疑問　街の美しさに感激,8,https://news.yahoo.co.jp/articles/13834a4209892f6fb3bc1fb95d76ed0f80f17a1c,2/18(日) 17:08
2024-02-19,11:24,life,ライフ,30,女子SPA！,42歳で乳がん発覚、悩み抜いて抗がん剤治療を選択したワケ。医師に「やっぱり怖い」と伝えると,8,https://news.yahoo.co.jp/articles/3123a784fb8611833dddf9e8a36c2c693c4c01e0,2/19(月) 8:47
2024-02-19,11:24,life,ライフ,31,BRAVO MOUNTAIN,「阪神電鉄武庫川線」わずか1.7km!　短距離支線の沿線をあえて河川敷から外れて歩く【関西鉄道路線周辺曼荼羅】,8,https://news.yahoo.co.jp/articles/98b95148d0ebfe1e5d5a890b70025b5ea967dab5,2/19(月) 8:09
2024-02-19,11:24,life,ライフ,32,THE GOLD ONLINE（ゴールドオンライン）,「大変！年金が振り込まれてないわ」「えっ⁉」年金46万円（2ヵ月分）の66歳夫婦、偶数月15日の悲劇…年金が振り込まれない単純な理由,8,https://news.yahoo.co.jp/articles/e47d9312dde586b66d60f38236b4ab838b6a49d7,2/19(月) 5:02
2024-02-19,11:24,life,ライフ,33,現代ビジネス,なぜ「事務的ミスの積み重ね」と述べれば、裏金が許されるのか？話題書『事務に踊る人々』を読む,8,https://news.yahoo.co.jp/articles/08230d2cbc990340bce77057c7ea304c9cf8ab40,2/19(月) 9:03
2024-02-19,11:24,life,ライフ,34,ファイナンシャルフィールド,4月から社会人になる娘が家賃「12万円」の物件に契約すると言っています…初任給「20万円」に対し、高すぎますよね？,8,https://news.yahoo.co.jp/articles/ea3680bda10ed1f73431a4fe16fc8c41724eff2e,2/18(日) 11:20
2024-02-19,11:24,life,ライフ,35,FORZA STYLE,このスニーカーはFORZA男子にブッ刺さる!? 90年代に一世を風靡した「ノースウェーブ」が帰ってきた！,8,https://news.yahoo.co.jp/articles/780fcd3e1ef5712c35bf71883ee58ff270b68ee6,2/18(日) 19:02
2024-02-19,11:24,life,ライフ,36,Lmaga.jp,大阪・梅田の迷宮地下街に潜む…「ＤＴタワー」ってどこやねん！？,8,https://news.yahoo.co.jp/articles/d70d8bde1cdd87dff00a3fe81147ff326a135e4b,2/19(月) 7:00
2024-02-19,11:24,life,ライフ,37,ねとらぼ,【近畿地方の50～60代が選ぶ】地元での評価が高いと思う「関関同立・産近甲龍の大学」ランキング！　第2位は「近畿大学」、1位は？,7,https://news.yahoo.co.jp/articles/bacb3425de823a02afa7b990154a207266be1bca,2/19(月) 10:35
2024-02-19,11:24,life,ライフ,38,ねとらぼ,【関東在住者に聞いた】「関関同立・産近甲龍」で字面がかっこいい大学ランキング！　2位は「立命館大学」、1位は？,7,https://news.yahoo.co.jp/articles/0806d6a1d252f6b6ac02e709afdbbeba05b57ccd,2/19(月) 9:35
2024-02-19,11:24,life,ライフ,39,まいどなニュース,安倍元首相のような外交上の親友になれるか　政府の「もしトラ」戦略　日米の貿易摩擦激化の恐れ,7,https://news.yahoo.co.jp/articles/6d1376ead8e3905beb79774579d8a94a0f5a6f2d,2/18(日) 20:00
2024-02-19,11:24,life,ライフ,40,FORZA STYLE,「子ども貯金の12万円をキャバクラで散々だと…！」ゲス行為に激怒したサレ妻の「究極の選択」,7,https://news.yahoo.co.jp/articles/3df83a7edd9f5ce6c5375801878110db8fc28f85,2/19(月) 7:22
