scrp_date,scrp_time,genre_en,genre_jp,rank,media_jp,title,comment,link,date_original
2025-01-25,10:33,TTL,総合,1,スポーツ報知,「メディアもスポンサーも週刊文春やネットの声をうのみ…この集団制裁感」…「ウェークアップ」でタレントが明かしたフジテレビ「問題」への「違和感」,532,https://news.yahoo.co.jp/articles/e30c633439a3e3e97d0b23d750e040bea99f4a52,1/25(土) 9:02
2025-01-25,10:33,TTL,総合,2,ABEMA TIMES,石破総理が施政方針演説「NISAやiDeCoの充実など“資産運用立国”の取り組みを強化」「トクリュウに対し、仮装身分捜査等により検挙を徹底」「楽しい日本を目指す」,468,https://news.yahoo.co.jp/articles/3360a12117bd13327f4083ba89242c64d58bd336,1/24(金) 14:41
2025-01-25,10:33,TTL,総合,3,Full-Count,水原被告、吐露したお財布状況「低賃金」　大谷から報酬、最高年俸7700万円も「凄くストレス」,327,https://news.yahoo.co.jp/articles/51516c463a8a4fb1d7cc23dcf860bf983d99c123,1/25(土) 6:55
2025-01-25,10:33,TTL,総合,4,弁護士JPニュース,兵庫県・竹内元県議の“虚偽の事実”をネット上に流布した面々…「死者の名誉毀損」で問われるべき“法的責任”とは,310,https://news.yahoo.co.jp/articles/c707a9a87ccf4b4d8c932bd33f759da90b6d7006,1/25(土) 9:30
2025-01-25,10:33,TTL,総合,5,朝日新聞デジタル,フジテレビが27日に臨時取締役会を開催　港社長らの進退協議へ,309,https://news.yahoo.co.jp/articles/03043e269eeb81f206e384103927dba45e70cc7a,1/24(金) 21:25
2025-01-25,10:33,TTL,総合,6,ビジネス＋IT,松本人志とは次元が違う「中居正広問題を絶対許すな」元経済誌編集長が憤る理由,285,https://news.yahoo.co.jp/articles/a6bb7c16073b5708d36a5776c0a2747e9fdde0c0,1/25(土) 8:10
2025-01-25,10:33,TTL,総合,7,TBS NEWS DIG Powered by JNN,さいたま市在住のクルド人の小6女子児童、在留資格を失ったことを受け公立小学校から除籍　教育委員会が謝罪,251,https://news.yahoo.co.jp/articles/28c2fae77878fd1626459febc91870252cf27134,1/24(金) 19:04
2025-01-25,10:33,TTL,総合,8,モデルプレス,元フジテレビ渡邊渚、弾ける笑顔の最新ビジュアルを独占公開,241,https://news.yahoo.co.jp/articles/f94093ff4504449ff3b55aa4f07b0c5ca7f301fc,1/24(金) 18:03
2025-01-25,10:33,TTL,総合,9,共同通信,出生数、初の70万人割れへ　24年、1～11月は66万人,211,https://news.yahoo.co.jp/articles/cee51610810221fd6f8401e2a7f263d8320d1186,1/24(金) 15:37
2025-01-25,10:33,TTL,総合,10,HTB北海道ニュース,【迷惑】公園で勢いよくスキーで階段を滑り降りる外国人らしき人物　記者の取材に無言で立ち去る　札幌,191,https://news.yahoo.co.jp/articles/96e7d0ba7037953b1b0f94b70f38d77e1b7c38c5,1/24(金) 18:44
2025-01-25,10:33,TTL,総合,11,共同通信,フジ、港浩一社長の進退議論へ　27日に臨時取締役会,187,https://news.yahoo.co.jp/articles/d0da2f52cdc747c6027b2a83066d02ab74f0bbb0,1/24(金) 17:00
2025-01-25,10:33,TTL,総合,12,産経新聞,＜独自＞「年収103万円の壁」150万円上限に引き上げ　政府・与党が調整,186,https://news.yahoo.co.jp/articles/278e47508033b8b1ca6f479e0d543cacad6c2242,1/24(金) 16:40
2025-01-25,10:33,TTL,総合,13,スポーツ報知,中居正広氏問題、被害女性の代理人がコメント「ご本人は、同じような被害で苦しむ女性の力になれればと努力」…現状を説明,183,https://news.yahoo.co.jp/articles/c3760093b32aa4722d4497d3b044a6399648c385,1/24(金) 15:00
2025-01-25,10:33,TTL,総合,14,デイリー新潮,「文書の余計な一言が傷口を広げました」…電撃引退「中居正広」の“致命的な失敗”を危機管理の専門家が指摘する,180,https://news.yahoo.co.jp/articles/71108a15d3667df87a9c4b174f085c3ace451a0b,1/25(土) 9:11
2025-01-25,10:33,TTL,総合,15,Full-Count,減刑求める水原被告、過酷だった“大谷翔平の隣”「著しく低賃金」「長期休暇は年末年始の4日」,174,https://news.yahoo.co.jp/articles/87ce1f0323369674ec1d9ac35923c40325385e1b,1/24(金) 13:11
2025-01-25,10:33,TTL,総合,16,TBS NEWS DIG Powered by JNN,フジテレビ　社長以外の出席者を入れ替え“やり直し会見”へ　社員らは日枝氏の出席を要求も参加予定なし【news23】,171,https://news.yahoo.co.jp/articles/7276738b9e39f4e23ff6a2a55f068d97699f235d,1/25(土) 1:21
2025-01-25,10:33,TTL,総合,17,THE ANSWER,水原被告の新発言「妻も働けず…」「極めて薄給」　大谷サポートで睡眠、夫婦の時間も犠牲と主張,169,https://news.yahoo.co.jp/articles/d97bb83d89ed1eda63de006dc40890c1c13fd092,1/25(土) 4:13
2025-01-25,10:33,TTL,総合,18,毎日新聞,30年放置の元キノコ工場が廃虚に　異臭も、ずさんな対応に憤る住民,167,https://news.yahoo.co.jp/articles/0b3167365339277a2f74fa61f3214e0354478a60,1/25(土) 6:45
2025-01-25,10:33,TTL,総合,19,CHANTO WEB,33歳差カップル「将来ある若者のそばに私がいていいのか」25歳の彼に悩んだ58歳の女性「シワも増えれば白髪も増える」,166,https://news.yahoo.co.jp/articles/035589dcd72e087ced59860bbb80970c7ec1e461,1/25(土) 6:32
2025-01-25,10:33,TTL,総合,20,ABEMA TIMES,村上総務大臣「天下りという事実はない」「総務省職員の再就職については、フジテレビが自らの判断で採用した」 フジ第三者委員会設置の決定を受けコメント,152,https://news.yahoo.co.jp/articles/554ab4d163706b6b56c1f8c6659bbe1f391f7e0a,1/24(金) 10:57
2025-01-25,10:33,TTL,総合,21,スポニチアネックス,水原被告の判事への手紙　大谷の送迎や婚前契約など私生活も対応「24時間365日待機。眠れないことも」,144,https://news.yahoo.co.jp/articles/a5a1ff6268fe582491b7e9fbd68cc53cb0f98797,1/25(土) 9:30
2025-01-25,10:33,TTL,総合,22,まいどなニュース,フジテレビ退社→PTSD公表の渡邊渚アナへいわれなき中傷　エールも多数「あなたは何も悪くない」「負けないで」,131,https://news.yahoo.co.jp/articles/7f394dc027bab68ab4f8f61e84a2efa7cfb5b520,1/24(金) 19:58
2025-01-25,10:33,TTL,総合,23,時事通信,家計・企業の負担増も　追加利上げ、影響は一長一短　日銀,130,https://news.yahoo.co.jp/articles/e3555f01035f01642303a9cb2df2ed62de86281c,1/25(土) 7:06
2025-01-25,10:33,TTL,総合,24,現代ビジネス,「何もわからないにもかかわらず、ここぞとばかりに言いたい放題している方もいます」...《芸能界引退》中居正広の素顔を知る地元・辻堂の仲間が語った「違和感」,129,https://news.yahoo.co.jp/articles/8c439e7d8aa209f1a8d12cb5eaf00f0891ae707b,1/25(土) 7:04
2025-01-25,10:33,TTL,総合,25,日刊スポーツ,中居氏引退に桐谷美玲が言及「芸能界全体が“そういうところなんでしょ”って思われて…」,128,https://news.yahoo.co.jp/articles/df0097926ab6ae0e2cd880ce788c6670abf8fbb6,1/25(土) 7:57
2025-01-25,10:33,TTL,総合,26,日刊ゲンダイDIGITAL,なかやまきんに君〈もう見飽きた〉のネガティブな声…フジテレビ「ACラッシュ」でタレント離れの地獄絵図,128,https://news.yahoo.co.jp/articles/da86d8109a9c6ed171c3fd6c569af1be6a1d66fb,1/25(土) 9:06
2025-01-25,10:33,TTL,総合,27,共同通信,備蓄米放出へ準備、流通不足で初　政府、買い戻し条件に売り出し,127,https://news.yahoo.co.jp/articles/6e2947da1ed40f97423281169e1fc8f8f2212783,1/24(金) 11:51
2025-01-25,10:33,TTL,総合,28,TBS NEWS DIG Powered by JNN,【独自】“なぜ、相談してくれなかったのか？” フジテレビ 中居氏の問題をコンプライアンス担当に共有せずか　室長が社員説明会で発言,126,https://news.yahoo.co.jp/articles/86829c0a5dc6c03d9f10899cd80a85e032c5a14c,1/24(金) 13:52
2025-01-25,10:33,TTL,総合,29,文春オンライン,“公開処刑”でも際立っていた中居正広の「感情のわからなさ」 何も語らないことによって彼が“守ろうとしたもの”とは,125,https://news.yahoo.co.jp/articles/1eba52590b51de2ec2dfe15f907ab6911b59e485,1/25(土) 7:12
2025-01-25,10:33,TTL,総合,30,毎日新聞,中国・深圳の日本人男児刺殺　被告に死刑判決　異例の即日判決,125,https://news.yahoo.co.jp/articles/1a2caffd07a68f05d123170756229ad8348ee856,1/24(金) 20:01
2025-01-25,10:33,TTL,総合,31,みんかぶマガジン,“中居くん”は引退した、フジテレビ、あなたはどうする？「最後にトドメを刺した社長会見」ACを垂れ流してほとぼりが冷めるのを待つのか,121,https://news.yahoo.co.jp/articles/d05533c1100551f078a4c95405f153a38194482d,1/25(土) 9:10
2025-01-25,10:33,TTL,総合,32,デイリースポーツ,「ウェークアップ」山崎怜奈「いかに愚行か認識を」中居氏問題、被害女性やアナへの誹謗中傷「自分が見えてる範囲だけでジャッジ」,112,https://news.yahoo.co.jp/articles/f994d8eeaef656943ebe8d82dabd339ac1518521,1/25(土) 10:03
2025-01-25,10:33,TTL,総合,33,日刊スポーツ,井上尚弥４回KO防衛！韓国の日本人キラー下す　４団体統一王者としてＶ３　延期、挑戦者変更乗り越え,101,https://news.yahoo.co.jp/articles/a8fd2ff5cf8afd4814b417043e7fc582dd36d71b,1/24(金) 20:35
2025-01-25,10:33,TTL,総合,34,共同通信,トランプ氏なら「侵攻起きず」　プーチン大統領、対話に意欲,98,https://news.yahoo.co.jp/articles/8997d648cff51ef8509282c310ec0e7f9c9247f1,1/25(土) 0:30
2025-01-25,10:33,TTL,総合,35,時事通信,野党「メッセージ伝わらず」　施政方針、議場反応薄く,92,https://news.yahoo.co.jp/articles/c1da7b42a77b1738ef19f11f5a5d47847426f308,1/24(金) 18:59
2025-01-25,10:33,TTL,総合,36,日刊スポーツ,日テレ、フジ社長・会長「笑いながら回答」報道を訂正「news zero」で佐藤梨那アナ謝罪,90,https://news.yahoo.co.jp/articles/6f658b5255c27716ba8bca05daf5a56e3f950fa9,1/25(土) 9:50
2025-01-25,10:33,TTL,総合,37,日刊ゲンダイDIGITAL,万博駅伝なぜ出ない？青学大名将の「名指し批判」に反論できない実業団監督のホンネ,90,https://news.yahoo.co.jp/articles/c66cf2b91cad84941e686df711a46b5f47345e09,1/25(土) 9:06
2025-01-25,10:33,TTL,総合,38,日刊ゲンダイDIGITAL,GACKTや要潤も物申した！ 中居正広の芸能界引退に広がる「陰謀論」のナゼ,89,https://news.yahoo.co.jp/articles/665746917c2ee3c7e7a3d0bb870b7510476c3e41,1/25(土) 9:06
2025-01-25,10:33,TTL,総合,39,スポーツ報知,田崎史郎氏、「ウェークアップ」で石破茂首相「施政方針演説」に断…「言葉がつまらないんですね」,88,https://news.yahoo.co.jp/articles/8bcf7de5685d77b3a7d4c5d32ac0856d2e9018f9,1/25(土) 9:37
2025-01-25,10:33,TTL,総合,40,デイリー新潮,「会議室に呼ばれ鍵を閉められ…」「A氏に多目的トイレに連れ込まれた社員も」　フジテレビ元社員女性が告発する「パワハラ、セクハラが横行する社風」,87,https://news.yahoo.co.jp/articles/142eaa69392eeafd8470a577d3717c66ef68f01a,1/25(土) 6:08
