scrp_date,scrp_time,genre_en,genre_jp,rank,media_jp,title,comment,link,date_original
2024-11-10,11:29,world,国際,1アメリカの「民主主義」に危機…トランプ氏、大統領選圧勝も「事実を事実と認めない」国民が増加 分断を招く“フィルターバブル”の影響もABEMA TIMES11/10(日) 7:02184件/時,ABEMA TIMES,アメリカの「民主主義」に危機…トランプ氏、大統領選圧勝も「事実を事実と認めない」国民が増加 分断を招く“フィルターバブル”の影響も,184,https://news.yahoo.co.jp/articles/449c8d23e60cfef44f6c8a838b62b52c120dcb16,11/10(日) 7:02
2024-11-10,11:29,world,国際,2人種差別メッセージ、全米で相次ぐ　大統領選後、FBIが捜査時事通信11/9(土) 20:39130件/時,時事通信,人種差別メッセージ、全米で相次ぐ　大統領選後、FBIが捜査,130,https://news.yahoo.co.jp/articles/5a55f5c6a73b2b419a22790514421820eb6ad714,11/9(土) 20:39
2024-11-10,11:29,world,国際,3ホテルが日本人の宿泊拒否？　　SNSには称賛の声　中国時事通信11/9(土) 20:3876件/時,時事通信,ホテルが日本人の宿泊拒否？　　SNSには称賛の声　中国,76,https://news.yahoo.co.jp/articles/8d9e9ff62b2b2bfe25d3b3bf45a8603a107c4c41,11/9(土) 20:38
2024-11-10,11:29,world,国際,4ハリス氏支持の芸能人落胆　「労働者置き去り」で裏目か　米大統領選時事通信11/9(土) 13:3273件/時,時事通信,ハリス氏支持の芸能人落胆　「労働者置き去り」で裏目か　米大統領選,73,https://news.yahoo.co.jp/articles/4f2143f93d8764213f8157702b1ee14d6c88bcbb,11/9(土) 13:32
2024-11-10,11:29,world,国際,5「タダで行為できます」「動画撮影させて」と男子大学生を各地で集め…SNSで過激投稿のイギリス人女性（25）、国外での活動を計画も「観光ビザ」が取り消しにNEWSポストセブン11/10(日) 7:1560件/時,NEWSポストセブン,「タダで行為できます」「動画撮影させて」と男子大学生を各地で集め…SNSで過激投稿のイギリス人女性（25）、国外での活動を計画も「観光ビザ」が取り消しに,60,https://news.yahoo.co.jp/articles/c9222cdc754dac8754788eeb4400cd489e249744,11/10(日) 7:15
2024-11-10,11:29,world,国際,6“ヒップアタック”にもひるまず「通りたいなら料金払って!」“関所女”が仁王立ち…公道で“通行料”を要求　中国・貴州省FNNプライムオンライン11/10(日) 10:1355件/時,FNNプライムオンライン,“ヒップアタック”にもひるまず「通りたいなら料金払って!」“関所女”が仁王立ち…公道で“通行料”を要求　中国・貴州省,55,https://news.yahoo.co.jp/articles/a68dd0056dee498fb3b62c0c33bbb33a91986815,11/10(日) 10:13
2024-11-10,11:29,world,国際,7ロシア国民がいまだにプーチンを支持する「本当の理由」…「クレイジーな男」が熟知する《大衆の不安》とは？現代ビジネス11/10(日) 8:0438件/時,現代ビジネス,ロシア国民がいまだにプーチンを支持する「本当の理由」…「クレイジーな男」が熟知する《大衆の不安》とは？,38,https://news.yahoo.co.jp/articles/59388425749941cca6e37b9fbef59315311808b9,11/10(日) 8:04
2024-11-10,11:29,world,国際,8「ネズミがギョーザを食べている」…１４３年伝統の中国点心食堂で衝撃動画中央日報日本語版11/10(日) 10:5633件/時,中央日報日本語版,「ネズミがギョーザを食べている」…１４３年伝統の中国点心食堂で衝撃動画,33,https://news.yahoo.co.jp/articles/920c0a4950e640e8689745bd4912101e218ce08c,11/10(日) 10:56
2024-11-10,11:29,world,国際,9習近平、「トランプ再登場」にボー然…！電話会談はなく「電報を送っただけ」のセコい対応に込められた中国の困惑と戦々恐々現代ビジネス11/10(日) 6:0533件/時,現代ビジネス,習近平、「トランプ再登場」にボー然…！電話会談はなく「電報を送っただけ」のセコい対応に込められた中国の困惑と戦々恐々,33,https://news.yahoo.co.jp/articles/113e2a505c5ef70580824fab76a6c36edd5be407,11/10(日) 6:05
2024-11-10,11:29,world,国際,10女性票取りこぼし、民主誤算　中絶争点化は空振り　米大統領選時事通信11/10(日) 7:0929件/時,時事通信,女性票取りこぼし、民主誤算　中絶争点化は空振り　米大統領選,29,https://news.yahoo.co.jp/articles/c79c8de4907912dfb3e66b83a76ee6e3d93d870e,11/10(日) 7:09
2024-11-10,11:29,world,国際,11これはあまりにも危険！…韓国10代が「日本刀」練習、近くに見物人・安全装置なしKOREA WAVE11/10(日) 7:0326件/時,KOREA WAVE,これはあまりにも危険！…韓国10代が「日本刀」練習、近くに見物人・安全装置なし,26,https://news.yahoo.co.jp/articles/2ac7fc25910d478d4d473164db4f7470fa766573,11/10(日) 7:03
2024-11-10,11:29,world,国際,12「少女像にキス」迷惑ユーチューバー、次は「身の危険感じる」110番通報…被害確認されずKOREA WAVE11/10(日) 11:0322件/時,KOREA WAVE,「少女像にキス」迷惑ユーチューバー、次は「身の危険感じる」110番通報…被害確認されず,22,https://news.yahoo.co.jp/articles/597a5e592d93da826dcb0d21ebb478063a1409e2,11/10(日) 11:03
2024-11-10,11:29,world,国際,137年間自宅で保護していた野生リスが、通報を受け安楽死。ネットでは「動物に罪はない」「かわいそう」（アメリカ）BuzzFeed Japan11/10(日) 6:0022件/時,BuzzFeed Japan,7年間自宅で保護していた野生リスが、通報を受け安楽死。ネットでは「動物に罪はない」「かわいそう」（アメリカ）,22,https://news.yahoo.co.jp/articles/7940e34ab5ef75f11182f05aab1fd9478b79dc7b,11/10(日) 6:00
2024-11-10,11:29,world,国際,14メーガン妃は王室を信頼しなかった…「恩を仇で返される」【スタッフ証言】ニューズウィーク日本版11/10(日) 9:3322件/時,ニューズウィーク日本版,メーガン妃は王室を信頼しなかった…「恩を仇で返される」【スタッフ証言】,22,https://news.yahoo.co.jp/articles/f33fccbdfaee704eadc13b8cadeca8f2acf01c73,11/10(日) 9:33
2024-11-10,11:29,world,国際,15関東大震災時の虐殺、浮島丸事件…〝蒸し返すは我にあり〟の国民性　韓国で始まった新たな「反日」の瀬踏み夕刊フジ11/9(土) 17:0018件/時,夕刊フジ,関東大震災時の虐殺、浮島丸事件…〝蒸し返すは我にあり〟の国民性　韓国で始まった新たな「反日」の瀬踏み,18,https://news.yahoo.co.jp/articles/fcfc3056ff0111e88ea05e00796b24bc1c9ab0b1,11/9(土) 17:00
2024-11-10,11:29,world,国際,16激戦州で相次ぎ敗北のハリス氏、アラブ票失う…ウクライナ支援は争点ならず読売新聞オンライン11/10(日) 10:3117件/時,読売新聞オンライン,激戦州で相次ぎ敗北のハリス氏、アラブ票失う…ウクライナ支援は争点ならず,17,https://news.yahoo.co.jp/articles/88baac6ff39d1fc8f5ca7e84aff5bc67bf3d70b6,11/10(日) 10:31
2024-11-10,11:29,world,国際,17ハリケーン調査で「トランプ氏支持の家は無視」と指示　米、職員解雇毎日新聞11/10(日) 9:3317件/時,毎日新聞,ハリケーン調査で「トランプ氏支持の家は無視」と指示　米、職員解雇,17,https://news.yahoo.co.jp/articles/492235f831406cac475ad7b123de3df6217fde12,11/10(日) 9:33
2024-11-10,11:29,world,国際,18ロシア軍、東部のクラホベ─ポクロウシク軸に集中　トランプ当選で戦争は新局面にForbes JAPAN11/10(日) 9:0016件/時,Forbes JAPAN,ロシア軍、東部のクラホベ─ポクロウシク軸に集中　トランプ当選で戦争は新局面に,16,https://news.yahoo.co.jp/articles/5a378bae82a90b2c7441ca24acb690f05cd77065,11/10(日) 9:00
2024-11-10,11:29,world,国際,19クリミア奪還「非現実的」　トランプ氏の元顧問共同通信11/10(日) 6:2815件/時,共同通信,クリミア奪還「非現実的」　トランプ氏の元顧問,15,https://news.yahoo.co.jp/articles/a20edb42027769736b598e3704ec4c8183ea1274,11/10(日) 6:28
2024-11-10,11:29,world,国際,20「ぶっ殺すぞ!」ライドシェア車内で泥酔客が大暴れ　首つかんで頭わしづかみ何度もビンタ…警察への通報止めようと暴挙　中国FNNプライムオンライン11/9(土) 13:3214件/時,FNNプライムオンライン,「ぶっ殺すぞ!」ライドシェア車内で泥酔客が大暴れ　首つかんで頭わしづかみ何度もビンタ…警察への通報止めようと暴挙　中国,14,https://news.yahoo.co.jp/articles/5f0bf09a171ea103eb9c714f9c03b0ba77bf213c,11/9(土) 13:32
2024-11-10,11:29,world,国際,21アメリカ・トランプ次期大統領 ニッキー・ヘイリー元国連大使とマイク・ポンぺオ前国務長官は閣僚などに起用しない方針 SNSで表明TBS NEWS DIG Powered by JNN11/10(日) 9:4514件/時,TBS NEWS DIG Powered by JNN,アメリカ・トランプ次期大統領 ニッキー・ヘイリー元国連大使とマイク・ポンぺオ前国務長官は閣僚などに起用しない方針 SNSで表明,14,https://news.yahoo.co.jp/articles/4fdbdd73de70aaf1911dddc0a318ac1f9a80bcac,11/10(日) 9:45
2024-11-10,11:29,world,国際,22トランプ次期大統領に備える中国、インドや日本に外交攻勢…イーロン・マスク氏にも働きかけ読売新聞オンライン11/10(日) 10:0913件/時,読売新聞オンライン,トランプ次期大統領に備える中国、インドや日本に外交攻勢…イーロン・マスク氏にも働きかけ,13,https://news.yahoo.co.jp/articles/b662b66a70546ae4a71bf1e7c752cf3776a06a92,11/10(日) 10:09
2024-11-10,11:29,world,国際,23トランプ氏復帰で不透明感　米FRBへ介入の恐れ　インフレ再燃に警戒も〔深層探訪〕時事通信11/10(日) 7:0013件/時,時事通信,トランプ氏復帰で不透明感　米FRBへ介入の恐れ　インフレ再燃に警戒も〔深層探訪〕,13,https://news.yahoo.co.jp/articles/684f0f16a99f5ff7c20c432789e84c6cfb14c9fd,11/10(日) 7:00
2024-11-10,11:29,world,国際,24韓国初の「超小型群集衛星」本格稼働へ…高精度映像で安全保障・災害対応強化KOREA WAVE11/10(日) 9:039件/時,KOREA WAVE,韓国初の「超小型群集衛星」本格稼働へ…高精度映像で安全保障・災害対応強化,9,https://news.yahoo.co.jp/articles/d99c7bf9f09e4bbdd1bdc3525e7a70ed5037ca62,11/10(日) 9:03
2024-11-10,11:29,world,国際,25トランプ氏、自身の最多得票数を更新　ネバダ州でも勝利確実毎日新聞11/9(土) 16:589件/時,毎日新聞,トランプ氏、自身の最多得票数を更新　ネバダ州でも勝利確実,9,https://news.yahoo.co.jp/articles/0b1c70856f7a013734d63be7b503426bda2b7b07,11/9(土) 16:58
2024-11-10,11:29,world,国際,26“バイデン氏がもっと早く撤退していれば” 民主党重鎮が大統領選の敗因を指摘ABEMA TIMES11/9(土) 15:129件/時,ABEMA TIMES,“バイデン氏がもっと早く撤退していれば” 民主党重鎮が大統領選の敗因を指摘,9,https://news.yahoo.co.jp/articles/f7a726919f5c44e23164c41500d529286a2e4b3e,11/9(土) 15:12
2024-11-10,11:29,world,国際,27「石破首相は中国に厳しいか」…「関税男」トランプ次期政権、対中強硬エスカレートで貿易戦争は必至読売新聞オンライン11/10(日) 5:019件/時,読売新聞オンライン,「石破首相は中国に厳しいか」…「関税男」トランプ次期政権、対中強硬エスカレートで貿易戦争は必至,9,https://news.yahoo.co.jp/articles/08a2d18062a62d1021077b891271393d9264015c,11/10(日) 5:01
2024-11-10,11:29,world,国際,28トランプ氏、ネバダ州も勝利　共和党候補で20年ぶり　米メディア時事通信11/9(土) 22:359件/時,時事通信,トランプ氏、ネバダ州も勝利　共和党候補で20年ぶり　米メディア,9,https://news.yahoo.co.jp/articles/166a8ffbc65fae6b1ee536b8ac366e1b92afbfa9,11/9(土) 22:35
2024-11-10,11:29,world,国際,29韓国合同参謀本部「北朝鮮がＧＰＳ妨害挑発…韓国の船舶と民間航空機に障害」中央日報日本語版11/10(日) 9:078件/時,中央日報日本語版,韓国合同参謀本部「北朝鮮がＧＰＳ妨害挑発…韓国の船舶と民間航空機に障害」,8,https://news.yahoo.co.jp/articles/e928e22d85d2f638a0b33ed60e44b9c57c323ba0,11/10(日) 9:07
2024-11-10,11:29,world,国際,30米国の現、次期大統領13日会談　政権移行が本格化共同通信11/10(日) 3:138件/時,共同通信,米国の現、次期大統領13日会談　政権移行が本格化,8,https://news.yahoo.co.jp/articles/01e36199d41484dd08024734661283407ed33213,11/10(日) 3:13
2024-11-10,11:29,world,国際,31【社説】「弱肉強食のジャングル」露骨化するトランプ２期の国際秩序中央日報日本語版11/10(日) 9:548件/時,中央日報日本語版,【社説】「弱肉強食のジャングル」露骨化するトランプ２期の国際秩序,8,https://news.yahoo.co.jp/articles/88b2f6970bdd070fd7e6fec262f37970eb7380c8,11/10(日) 9:54
2024-11-10,11:29,world,国際,320:57トランプ次期大統領とウクライナ・ゼレンスキー大統領の電話会談にイーロン・マスク氏が同席　米メディア報道FNNプライムオンライン（フジテレビ系）11/10(日) 6:287件/時,FNNプライムオンライン（フジテレビ系）,トランプ次期大統領とウクライナ・ゼレンスキー大統領の電話会談にイーロン・マスク氏が同席　米メディア報道,7,https://news.yahoo.co.jp/articles/29545a1a93dd4c53ef0752e9a47fcb4443746cc4,11/10(日) 6:28
2024-11-10,11:29,world,国際,33トランプ氏勝利、影響注視　気候対策や輸入車高関税　日本企業時事通信11/10(日) 7:087件/時,時事通信,トランプ氏勝利、影響注視　気候対策や輸入車高関税　日本企業,7,https://news.yahoo.co.jp/articles/a7da469bdef82edea394c5fb4bbf51791ec4f775,11/10(日) 7:08
2024-11-10,11:29,world,国際,34日本に「朝鮮半島・台湾」のダブル有事も　北朝鮮とロシアの軍事的連携　中国含め隣国が〝非民主主義国〟の危険地域で高まるリスク夕刊フジ11/9(土) 17:007件/時,夕刊フジ,日本に「朝鮮半島・台湾」のダブル有事も　北朝鮮とロシアの軍事的連携　中国含め隣国が〝非民主主義国〟の危険地域で高まるリスク,7,https://news.yahoo.co.jp/articles/e24506325ebd4ca28ebb5e917becfa34ac1b9d93,11/9(土) 17:00
2024-11-10,11:29,world,国際,35安倍氏はトランプ氏と「ゴルフ外交」…ゴルフしない石破氏が不安な日本中央日報日本語版11/9(土) 13:567件/時,中央日報日本語版,安倍氏はトランプ氏と「ゴルフ外交」…ゴルフしない石破氏が不安な日本,7,https://news.yahoo.co.jp/articles/de8067b26a7fdf1b93f7f54bb083dc854da0781c,11/9(土) 13:56
2024-11-10,11:29,world,国際,36南北境界地域の悲痛な叫び、龍山の沈黙【記者手帳】ハンギョレ新聞11/10(日) 8:396件/時,ハンギョレ新聞,南北境界地域の悲痛な叫び、龍山の沈黙【記者手帳】,6,https://news.yahoo.co.jp/articles/d280f618e79e1f8e9a8e2ba0dcf04c16c05686de,11/10(日) 8:39
2024-11-10,11:29,world,国際,37宇宙から帰還のＮＡＳＡ飛行士、地球への再順応の苦労語る　「座るのがきつい」CNN.co.jp11/9(土) 15:506件/時,CNN.co.jp,宇宙から帰還のＮＡＳＡ飛行士、地球への再順応の苦労語る　「座るのがきつい」,6,https://news.yahoo.co.jp/articles/a16dd7c7411491f52ff10c27dc4710614e7dbb13,11/9(土) 15:50
2024-11-10,11:29,world,国際,38トランプ氏、総得票数も勝利なら20年ぶり　強硬派ライトハイザー氏に通商代表打診と報道産経新聞11/9(土) 13:286件/時,産経新聞,トランプ氏、総得票数も勝利なら20年ぶり　強硬派ライトハイザー氏に通商代表打診と報道,6,https://news.yahoo.co.jp/articles/23490a4dfc8c39f001f04ff4167009a50afc9aca,11/9(土) 13:28
2024-11-10,11:29,world,国際,39英政府、次期戦闘機開発続行の方針固める共同通信11/9(土) 20:556件/時,共同通信,英政府、次期戦闘機開発続行の方針固める,6,https://news.yahoo.co.jp/articles/b0e3f068184b4b9d4f9c5c657eaf90e6e104dd8c,11/9(土) 20:55
2024-11-10,11:29,world,国際,40駅で自爆テロか 26人死亡 反政府過激派が犯行声明 パキスタンABEMA TIMES11/9(土) 19:066件/時,ABEMA TIMES,駅で自爆テロか 26人死亡 反政府過激派が犯行声明 パキスタン,6,https://news.yahoo.co.jp/articles/9705a27ee9f9bac36186a1079b6901ad639e10fd,11/9(土) 19:06
