scrp_date,scrp_time,genre_en,genre_jp,rank,media_jp,title,comment,link,date_original
2024-11-10,06:06,domestic,国内,1前職の斎藤氏、再選へ猛追　兵庫県知事選情勢共同通信11/9(土) 17:45506件/時,共同通信,前職の斎藤氏、再選へ猛追　兵庫県知事選情勢,506,https://news.yahoo.co.jp/articles/2d315aa49860abf79094293db29c65b98ee7e87b,11/9(土) 17:45
2024-11-10,06:06,domestic,国内,2「30歳越えたら子宮摘出」日本保守党代表・百田尚樹氏の“人権無視提言”に「相当ヤバいね」「恐ろしい」批判集まるSmartFLASH11/9(土) 18:55425件/時,SmartFLASH,「30歳越えたら子宮摘出」日本保守党代表・百田尚樹氏の“人権無視提言”に「相当ヤバいね」「恐ろしい」批判集まる,425,https://news.yahoo.co.jp/articles/22d672b990da7640b39be86c60e4eef486105057,11/9(土) 18:55
2024-11-10,06:06,domestic,国内,3百田氏「30超えたら子宮摘出」　保守党代表、SFとして発言共同通信11/9(土) 22:44197件/時,共同通信,百田氏「30超えたら子宮摘出」　保守党代表、SFとして発言,197,https://news.yahoo.co.jp/articles/d8854e417b2aea4224956c10f0f9a4f2d564efad,11/9(土) 22:44
2024-11-10,06:06,domestic,国内,4日本保守党・百田尚樹氏「30超えたら子宮摘出」「SFとして」発言朝日新聞デジタル11/9(土) 19:41163件/時,朝日新聞デジタル,日本保守党・百田尚樹氏「30超えたら子宮摘出」「SFとして」発言,163,https://news.yahoo.co.jp/articles/b80ba47fcdb7eb0d68117fe09a782a98f4f185a4,11/9(土) 19:41
2024-11-10,06:06,domestic,国内,5国民民主、強気の姿勢　政権維持へ協議「綱渡り」時事通信11/9(土) 7:06156件/時,時事通信,国民民主、強気の姿勢　政権維持へ協議「綱渡り」,156,https://news.yahoo.co.jp/articles/54871b2b81925914b10565ccf0106e45f09a43c0,11/9(土) 7:06
2024-11-10,06:06,domestic,国内,6国交相ポストが公明の指定席に　経験者ゼロの自民「固定化よくない」と不満産経新聞11/9(土) 17:41155件/時,産経新聞,国交相ポストが公明の指定席に　経験者ゼロの自民「固定化よくない」と不満,155,https://news.yahoo.co.jp/articles/e4af4a6de41bc1693483af05aee0f2eea341d2e1,11/9(土) 17:41
2024-11-10,06:06,domestic,国内,7闇バイト「受け子」の後悔　借金300万円「危ない橋」で懲役3年　指示役消え「悔しい」産経新聞11/9(土) 19:00137件/時,産経新聞,闇バイト「受け子」の後悔　借金300万円「危ない橋」で懲役3年　指示役消え「悔しい」,137,https://news.yahoo.co.jp/articles/50a01ea6470258b9beb87efa325842eecb68a442,11/9(土) 19:00
2024-11-10,06:06,domestic,国内,8日本保守党・百田尚樹代表「30超えたら子宮摘出」　「小説家のSF」と前置きして8日配信番組で発言スポニチアネックス11/10(日) 4:44135件/時,スポニチアネックス,日本保守党・百田尚樹代表「30超えたら子宮摘出」　「小説家のSF」と前置きして8日配信番組で発言,135,https://news.yahoo.co.jp/articles/9184c00abfa10da71c52738857b5437cd4bc7499,11/10(日) 4:44
2024-11-10,06:06,domestic,国内,9防衛増税、与党に慎重論　衆院選大敗、野党は反対共同通信11/9(土) 16:0789件/時,共同通信,防衛増税、与党に慎重論　衆院選大敗、野党は反対,89,https://news.yahoo.co.jp/articles/2f089c1b3c91fe1654e0242c51ed2e502a5022ad,11/9(土) 16:07
2024-11-10,06:06,domestic,国内,10国民民主「１０３万円の壁引き上げ」吹き飛ばす石破政権の秘策　高橋洋一氏が指摘「酷いよな」キーとなる重要ポストはデイリースポーツ11/9(土) 20:1675件/時,デイリースポーツ,国民民主「１０３万円の壁引き上げ」吹き飛ばす石破政権の秘策　高橋洋一氏が指摘「酷いよな」キーとなる重要ポストは,75,https://news.yahoo.co.jp/articles/61dddbdcc54a6bd4ea66e8d9f38212e422adf24b,11/9(土) 20:16
2024-11-10,06:06,domestic,国内,115人で予約で中に21人…1泊100万「グランドハイアット東京」スイートルームで大暴れした韓国籍兄弟を逮捕　100万相当の備品も破壊、部屋は13日間使用不能に　六本木FNNプライムオンライン11/9(土) 15:3270件/時,FNNプライムオンライン,5人で予約で中に21人…1泊100万「グランドハイアット東京」スイートルームで大暴れした韓国籍兄弟を逮捕　100万相当の備品も破壊、部屋は13日間使用不能に　六本木,70,https://news.yahoo.co.jp/articles/b5a59ce0354ae04a354158c22d708ff7e0e3d752,11/9(土) 15:32
2024-11-10,06:06,domestic,国内,12「農家＝時給9.9円」に待った！ 広告代理店→24歳で農業の道へ 「農協に頼らず儲ける戦略」とは？ABEMA TIMES11/9(土) 9:4261件/時,ABEMA TIMES,「農家＝時給9.9円」に待った！ 広告代理店→24歳で農業の道へ 「農協に頼らず儲ける戦略」とは？,61,https://news.yahoo.co.jp/articles/d4fb752d9e7f3f30d7827850837877b2d044c7b1,11/9(土) 9:42
2024-11-10,06:06,domestic,国内,13茨城の消防署で性被害か　複数女性訴え、県警捜査共同通信11/9(土) 16:3453件/時,共同通信,茨城の消防署で性被害か　複数女性訴え、県警捜査,53,https://news.yahoo.co.jp/articles/a1b0133864fc404ca261a2d0393be168f32a6789,11/9(土) 16:34
2024-11-10,06:06,domestic,国内,148:29松本人志さん、訴え“取り下げ”ナゼ──「負けるリスク」回避？　「活動再開」示唆に20代は　専門家に聞く…復帰へのポイント日テレNEWS NNN11/9(土) 13:4348件/時,日テレNEWS NNN,松本人志さん、訴え“取り下げ”ナゼ──「負けるリスク」回避？　「活動再開」示唆に20代は　専門家に聞く…復帰へのポイント,48,https://news.yahoo.co.jp/articles/685f71fb58e610bb35eaa9697b28006218349a1e,11/9(土) 13:43
2024-11-10,06:06,domestic,国内,15高市早苗氏「自民が分裂してたら立憲内閣」政権譲らない　憶測呼んだ自民会議欠席を説明デイリースポーツ11/9(土) 22:2243件/時,デイリースポーツ,高市早苗氏「自民が分裂してたら立憲内閣」政権譲らない　憶測呼んだ自民会議欠席を説明,43,https://news.yahoo.co.jp/articles/dca5acdf04a86586db9fd03e1205002c478949c1,11/9(土) 22:22
2024-11-10,06:06,domestic,国内,16前兵庫県副知事が語る「告発文書は、齋藤県政転覆のためだった」…キックバック、パワハラ内部告発、そして百条委員会の「深層」現代ビジネス11/9(土) 6:0540件/時,現代ビジネス,前兵庫県副知事が語る「告発文書は、齋藤県政転覆のためだった」…キックバック、パワハラ内部告発、そして百条委員会の「深層」,40,https://news.yahoo.co.jp/articles/b7855c5f4e5f0c5ea2fc2692d57bc3c3f0f7fb29,11/9(土) 6:05
2024-11-10,06:06,domestic,国内,17旧ビッグモーター「おわび」500円クオカード報道に批判噴出「0が2つ足りない」「怒りが増す」スポニチアネックス11/9(土) 12:2440件/時,スポニチアネックス,旧ビッグモーター「おわび」500円クオカード報道に批判噴出「0が2つ足りない」「怒りが増す」,40,https://news.yahoo.co.jp/articles/cca0944c43ab42314214812ad533546b89331ee1,11/9(土) 12:24
2024-11-10,06:06,domestic,国内,18〈盗撮動画4000本〉「ショーツは脱いでしまいましょうか？」リラクゼーション店オーナーを不同意わいせつと盗撮容疑で逮捕「夢うつつになるほどテクニシャンだったのですが…」被害女性が詳細告白集英社オンライン11/9(土) 18:3239件/時,集英社オンライン,〈盗撮動画4000本〉「ショーツは脱いでしまいましょうか？」リラクゼーション店オーナーを不同意わいせつと盗撮容疑で逮捕「夢うつつになるほどテクニシャンだったのですが…」被害女性が詳細告白,39,https://news.yahoo.co.jp/articles/e4557ba2e04dd2b33b57b68ce32f9ec2221b22f1,11/9(土) 18:32
2024-11-10,06:06,domestic,国内,193:00オンラインカジノが社会問題化 「幸せが崩壊」 闇バイトにも…テレビ朝日系（ANN）11/9(土) 12:2938件/時,テレビ朝日系（ANN）,オンラインカジノが社会問題化 「幸せが崩壊」 闇バイトにも…,38,https://news.yahoo.co.jp/articles/e121cf70f0fce5cb0e3c0b1081c1e9f9823eb9a3,11/9(土) 12:29
2024-11-10,06:06,domestic,国内,20兵庫県知事選、前職斎藤氏が再選へ猛追共同通信11/9(土) 17:3538件/時,共同通信,兵庫県知事選、前職斎藤氏が再選へ猛追,38,https://news.yahoo.co.jp/articles/d4edf5e7cf52b0c9c9af67449d4d282928712e61,11/9(土) 17:35
2024-11-10,06:06,domestic,国内,21橋下徹氏　無効票発生が濃厚の首相指名選挙に猛反対→提言「そうなってくると二大政党制に」　ＭＣ石井アナも「面白い！」デイリースポーツ11/9(土) 14:4637件/時,デイリースポーツ,橋下徹氏　無効票発生が濃厚の首相指名選挙に猛反対→提言「そうなってくると二大政党制に」　ＭＣ石井アナも「面白い！」,37,https://news.yahoo.co.jp/articles/a021f67fcf869385b2bf7648779cad12d41fcfc4,11/9(土) 14:46
2024-11-10,06:06,domestic,国内,22つばさの党・黒川敦彦被告 「憲法違反」国を提訴「裏金事件は在宅起訴、私たちは６か月勾留」よろず～ニュース11/9(土) 13:2037件/時,よろず～ニュース,つばさの党・黒川敦彦被告 「憲法違反」国を提訴「裏金事件は在宅起訴、私たちは６か月勾留」,37,https://news.yahoo.co.jp/articles/15ff0c337123745b190c9d7899122a59f838dac7,11/9(土) 13:20
2024-11-10,06:06,domestic,国内,23兵庫知事選、激しい選挙戦続く　自民の支持先3候補に…構図は？毎日新聞11/9(土) 21:0936件/時,毎日新聞,兵庫知事選、激しい選挙戦続く　自民の支持先3候補に…構図は？,36,https://news.yahoo.co.jp/articles/c0a4e0de7b85e214e755858472b4d76e8717e91d,11/9(土) 21:09
2024-11-10,06:06,domestic,国内,24公明、新代表に斉藤鉄夫氏を選出　多くの中堅が落選、逆風下の再始動毎日新聞11/9(土) 16:3335件/時,毎日新聞,公明、新代表に斉藤鉄夫氏を選出　多くの中堅が落選、逆風下の再始動,35,https://news.yahoo.co.jp/articles/978a72bceca1dbc69d9e5bb26eee876bb4217ce8,11/9(土) 16:33
2024-11-10,06:06,domestic,国内,251:50鹿児島・与論町に大雨特別警報発表…土砂崩れや道路冠水などの被害相次ぐ　奄美地方や沖縄では夜遅くにかけ非常に激しい雨が降る恐れもFNNプライムオンライン（フジテレビ系）11/9(土) 12:0734件/時,FNNプライムオンライン（フジテレビ系）,鹿児島・与論町に大雨特別警報発表…土砂崩れや道路冠水などの被害相次ぐ　奄美地方や沖縄では夜遅くにかけ非常に激しい雨が降る恐れも,34,https://news.yahoo.co.jp/articles/e638bcf8911b90f05fc1b2842aedfeade680cf6e,11/9(土) 12:07
2024-11-10,06:06,domestic,国内,26公明新体制、代表に斉藤氏　竹谷代行、女性活躍推進へ共同通信11/9(土) 13:3032件/時,共同通信,公明新体制、代表に斉藤氏　竹谷代行、女性活躍推進へ,32,https://news.yahoo.co.jp/articles/ddad87f4b15fbbb29588dfc03fa4c0a2051a9cd3,11/9(土) 13:30
2024-11-10,06:06,domestic,国内,271:37奄美地方や沖縄本島北部で猛烈な雨　身の安全確保を日テレNEWS NNN11/9(土) 5:5330件/時,日テレNEWS NNN,奄美地方や沖縄本島北部で猛烈な雨　身の安全確保を,30,https://news.yahoo.co.jp/articles/e7a31d47b7a535dca94da9425a19d1b348bf9b82,11/9(土) 5:53
2024-11-10,06:06,domestic,国内,28「社長の周りにいる女は全員売春婦」“紀州のドン・ファン殺人公判”地元&夫の会社で出演セクシービデオを見られ…須藤早貴（28）が法廷で爆弾発言をした理由文春オンライン11/9(土) 12:2730件/時,文春オンライン,「社長の周りにいる女は全員売春婦」“紀州のドン・ファン殺人公判”地元&夫の会社で出演セクシービデオを見られ…須藤早貴（28）が法廷で爆弾発言をした理由,30,https://news.yahoo.co.jp/articles/2d528807ede782b864e26536986e1dff3620492f,11/9(土) 12:27
2024-11-10,06:06,domestic,国内,29シャトルランの音は「悪夢」　高校生が新たなメロディーを文科省に提案したら高校生新聞オンライン11/9(土) 18:0330件/時,高校生新聞オンライン,シャトルランの音は「悪夢」　高校生が新たなメロディーを文科省に提案したら,30,https://news.yahoo.co.jp/articles/27dc1c072238a2d95b292bceb08a0b70336d4b18,11/9(土) 18:03
2024-11-10,06:06,domestic,国内,30日本保守党・百田尚樹代表 フォロワー64万人の個人Ｘを封印「国政政党になるやろから、ここらが潮時」よろず～ニュース11/9(土) 17:1528件/時,よろず～ニュース,日本保守党・百田尚樹代表 フォロワー64万人の個人Ｘを封印「国政政党になるやろから、ここらが潮時」,28,https://news.yahoo.co.jp/articles/424ec602d0041815d5b67fea7f6e364880706ad2,11/9(土) 17:15
2024-11-10,06:06,domestic,国内,31公明党代表に斉藤国交相、代表代行に竹谷氏共同通信11/9(土) 13:5027件/時,共同通信,公明党代表に斉藤国交相、代表代行に竹谷氏,27,https://news.yahoo.co.jp/articles/9f6edaae56c91b818e22737333cde75816d35433,11/9(土) 13:50
2024-11-10,06:06,domestic,国内,321:13厚生年金加入の収入要件「106万の壁」撤廃の方向で調整　厚労省日テレNEWS NNN11/9(土) 12:1627件/時,日テレNEWS NNN,厚生年金加入の収入要件「106万の壁」撤廃の方向で調整　厚労省,27,https://news.yahoo.co.jp/articles/9f136480b1a678b95dab6502a33430fa2eab78d0,11/9(土) 12:16
2024-11-10,06:06,domestic,国内,33国民・榛葉幹事長 国会での定例会見2週連続荒れる 記者たしなめる「遅く来てですね…」よろず～ニュース11/9(土) 7:2026件/時,よろず～ニュース,国民・榛葉幹事長 国会での定例会見2週連続荒れる 記者たしなめる「遅く来てですね…」,26,https://news.yahoo.co.jp/articles/6e6b08814d5903505f542e6b952074f39af2ba3e,11/9(土) 7:20
2024-11-10,06:06,domestic,国内,34対トランプ　石破首相が「安倍さんと同じ事できない、必要ないと割り切ってる」首相取材した青山氏明かす　東野「ヘソ曲げんとやって」　正義のミカタデイリースポーツ11/9(土) 18:0026件/時,デイリースポーツ,対トランプ　石破首相が「安倍さんと同じ事できない、必要ないと割り切ってる」首相取材した青山氏明かす　東野「ヘソ曲げんとやって」　正義のミカタ,26,https://news.yahoo.co.jp/articles/92bcac11e58aa56f29d8a2af515ab1cf98c97a3b,11/9(土) 18:00
2024-11-10,06:06,domestic,国内,35自民高市氏、結束呼びかけ　「分裂なら立民内閣に」共同通信11/9(土) 20:1626件/時,共同通信,自民高市氏、結束呼びかけ　「分裂なら立民内閣に」,26,https://news.yahoo.co.jp/articles/93972593f8b70d5eb65b9d7a3383485a10cdaeb9,11/9(土) 20:16
2024-11-10,06:06,domestic,国内,36厚生年金要件、「週20時間」のみに　「106万円の壁」解消へ　厚労省時事通信11/9(土) 7:0725件/時,時事通信,厚生年金要件、「週20時間」のみに　「106万円の壁」解消へ　厚労省,25,https://news.yahoo.co.jp/articles/f4744562c0192b4949a87bfb54ada288ae28bb7c,11/9(土) 7:07
2024-11-10,06:06,domestic,国内,37「洋画は見ない…」日本の“洋画離れ”に起きた異変。不振だったディズニーは様々な施策が成果出す東洋経済オンライン11/9(土) 10:0223件/時,東洋経済オンライン,「洋画は見ない…」日本の“洋画離れ”に起きた異変。不振だったディズニーは様々な施策が成果出す,23,https://news.yahoo.co.jp/articles/57759b4ca32c3fa4caece926504333dfb6b5061e,11/9(土) 10:02
2024-11-10,06:06,domestic,国内,38地方税減収に自治体から不安の声　「年収の壁」引き上げ巡る試算に共同通信11/9(土) 16:2322件/時,共同通信,地方税減収に自治体から不安の声　「年収の壁」引き上げ巡る試算に,22,https://news.yahoo.co.jp/articles/6f5b41ea5d5d2638a80863ab2fe11027116d88d9,11/9(土) 16:23
2024-11-10,06:06,domestic,国内,39インドネシアで大規模な火山の噴火、日本への津波の影響を調査　気象庁日テレNEWS NNN11/9(土) 7:4021件/時,日テレNEWS NNN,インドネシアで大規模な火山の噴火、日本への津波の影響を調査　気象庁,21,https://news.yahoo.co.jp/articles/967d5514889e1b0d7ed9949c18e0c94ffe99565c,11/9(土) 7:40
2024-11-10,06:06,domestic,国内,40維新「次の代表誰？」カンテレ調査で事実上２位に意外な名前　１位はド本命、橋下氏も「やっぱり」デイリースポーツ11/9(土) 19:2921件/時,デイリースポーツ,維新「次の代表誰？」カンテレ調査で事実上２位に意外な名前　１位はド本命、橋下氏も「やっぱり」,21,https://news.yahoo.co.jp/articles/039b2d5d2d5b05cea263eba8abbaa25c0f8c5620,11/9(土) 19:29
