scrp_date,scrp_time,genre_en,genre_jp,rank,media_jp,title,comment,link,date_original
2024-03-03,18:17,TTL,総合,1,TBS NEWS DIG Powered by JNN,“小泉進次郎というカード”自民内で増す存在感　小泉純一郎元総理がそれでも“待った”をかける理由,333,https://news.yahoo.co.jp/articles/8a773ee9c4ea4a0be4594f603785908e6849c4b9,3/3(日) 7:02
2024-03-03,18:17,TTL,総合,2,神戸新聞NEXT,スキー場でスノボ客が死亡　40代くらいの男性、大会で滑走中に転倒　兵庫・ハチ北高原,287,https://news.yahoo.co.jp/articles/41e9793a1f9e795d4a0d94da37c3e9b02f189298,3/3(日) 16:18
2024-03-03,18:17,TTL,総合,3,デイリースポーツ,「サンジャポ」お相手を語らない大谷翔平「アメリカ人からするとおかしい」東大大学院准教授が指摘「ここまで隠すのは…」,283,https://news.yahoo.co.jp/articles/9292bae708e108cffceeb599741a2d92f0a1fdf4,3/3(日) 11:07
2024-03-03,18:17,TTL,総合,4,福島民友新聞,私は震災の「被害者」であり「加害者」です――〝東電社員〟という十字架を背負って　#知り続ける,244,https://news.yahoo.co.jp/articles/37403cdfac9dd0f9cf030e8ede619cf47c1bdc43,3/3(日) 14:00
2024-03-03,18:17,TTL,総合,5,デイリースポーツ,東京マラソン　機能不全のペースメーカーへの言及相次ぐ　西山は「遅かった。予想外」鈴木も「大丈夫？と」新谷は「あ、ヤバい、と」　陸連・高岡ＳＤは「レースは生もの。その中での対応が必要」,230,https://news.yahoo.co.jp/articles/7c99eb7b3c49abcb9e5569f13b4ad44d48bbe733,3/3(日) 14:13
2024-03-03,18:17,TTL,総合,6,朝日新聞デジタル,LINEのマルハラ、漫画が影響？　句読点研究の調査と異質な出版社,193,https://news.yahoo.co.jp/articles/299f31a6b36f073a26e47a39de995535a27cf738,3/3(日) 8:00
2024-03-03,18:17,TTL,総合,7,47NEWS,「お金を渡すと、彼の機嫌は良くなった」２６歳の女は、８２歳の男性をなぜ刺したのか　知的障害、ＡＤＨＤ、ＤＶ…搾取され続けた日々、裁判員は「やるせない」と表現した,179,https://news.yahoo.co.jp/articles/f211969445261173a45c9b434801aa5eddfa5f4a,3/3(日) 10:32
2024-03-03,18:17,TTL,総合,8,朝日新聞デジタル,輪島市で職員の約8割「過労死ライン」超え　被災自治体の過酷な実態,159,https://news.yahoo.co.jp/articles/f7dff5d02e154da721495c7c55b8d59416edfaed,3/3(日) 9:33
2024-03-03,18:17,TTL,総合,9,スポーツ報知,和田アキ子、「おまかせ」で大谷翔平「奥様」コメントを謝罪…スタジオ凍り付く「すみません」,159,https://news.yahoo.co.jp/articles/4874a1cd5cf4c37ce702b9b19e16077e62c2b9cd,3/3(日) 12:05
2024-03-03,18:17,TTL,総合,10,毎日新聞,新型の犯罪集団トクリュウ　人違いの傷害事件、統制のない恐ろしさ,140,https://news.yahoo.co.jp/articles/afd1f8fbf1118421366dd3a4b65db6b4ae807d9b,3/3(日) 6:30
2024-03-03,18:17,TTL,総合,11,スポニチアネックス,井上咲楽が自己ベストの3時間26分06秒で東京マラソン完走「辛さが楽しかった」,121,https://news.yahoo.co.jp/articles/ab6caa8bee22e451d8a1913eb347a11b7090f19f,3/3(日) 12:53
2024-03-03,18:17,TTL,総合,12,共同通信,政府「デフレ脱却」表明を検討　賃上げや物価見極め判断,108,https://news.yahoo.co.jp/articles/293d607ef68d65e12ce11d0d5b08e7e44b55b655,3/2(土) 21:00
2024-03-03,18:17,TTL,総合,13,オリコン,NEWS加藤シゲアキが結婚　SMILE-UP.では堂本剛、中丸雄一に続く今年3人目の“ラッシュ”に反響,106,https://news.yahoo.co.jp/articles/52ca98a72a6a354c4230228b5216b01412dd6230,3/3(日) 12:46
2024-03-03,18:17,TTL,総合,14,仙台放送,【速報】パトカーに発見され逃走中に４台と衝突　乗用車を盗んだ疑いで１６歳高校生ら少年２人逮捕＜仙台＞,105,https://news.yahoo.co.jp/articles/d73eadc2867be63353049ad3e01225e7b925a9ca,3/3(日) 0:14
2024-03-03,18:17,TTL,総合,15,スポーツ報知,ＮＥＷＳ・加藤シゲアキ、結婚を発表「さらなる高みを目指す所存」お相手は一般女性　メンバー初の既婚者に,95,https://news.yahoo.co.jp/articles/b5b33e53a2b3f4a9ef6971678b3fcf4006535cd4,3/3(日) 12:10
2024-03-03,18:17,TTL,総合,16,デイリー新潮,松本人志問題で今さら的外れな発言…和田アキ子と「アッコにおまかせ！」に訪れる危機,93,https://news.yahoo.co.jp/articles/34427e79eb7751543a4ab9ce2879fb4f71c56454,3/3(日) 7:10
2024-03-03,18:17,TTL,総合,17,47NEWS,歴代首相４人輩出の「保守王国」群馬に異変、何が起きた？　前橋市長選で現職完敗、衝撃の背景探る,92,https://news.yahoo.co.jp/articles/99db9857d84d1b8c6f23fcf96c58532912f286c1,3/3(日) 11:02
2024-03-03,18:17,TTL,総合,18,スポニチアネックス,「小中学校入学式の撮影カメラマン」をXで募集に批判殺到　投稿削除も不安の声　「怖い」「説明を」,91,https://news.yahoo.co.jp/articles/a84330003b496ac8cfdc796658deab0bd1495e6b,3/3(日) 14:47
2024-03-03,18:17,TTL,総合,19,マネーポストWEB,「女子中高の一部がトランスジェンダー生徒の受け入れ検討」報道に女子校OGたちの不安　「生徒は未成熟」「女子校の意義は大事にして」,90,https://news.yahoo.co.jp/articles/29649368a0f76fc208c5dd3383b6fe5e9a307026,3/3(日) 16:15
2024-03-03,18:17,TTL,総合,20,千葉日報オンライン,「かなり心配」「長時間、横揺れ」千葉県内、相次ぐ地震　東方沖震源20回、南部7回　県民に不安広がる　県は注意呼び掛け,89,https://news.yahoo.co.jp/articles/6839e4db424a50a6da09b5e39b4d10e4d3d22785,3/2(土) 20:11
2024-03-03,18:17,TTL,総合,21,日刊ゲンダイDIGITAL,性加害報道のサッカー伊東純也が、週刊新潮をスルーして女性だけを訴えたのはなぜか（元木昌彦）,87,https://news.yahoo.co.jp/articles/1311dbb291851da2b9f6484875b36c088d388b36,3/3(日) 9:06
2024-03-03,18:17,TTL,総合,22,日刊スポーツ,日本クルド文化協会「日本人死ね」発言は「病院に行け」だと改めて釈明と謝罪　発言者は事務局長,85,https://news.yahoo.co.jp/articles/03535b31439d1385c1cb2527465bca24977004fb,3/2(土) 18:34
2024-03-03,18:17,TTL,総合,23,日刊ゲンダイDIGITAL,誰も言わないけど…「ブラタモリ」終了の本当の理由は「面白くなくなったから」 質の低下は民放の旅番組みたい,83,https://news.yahoo.co.jp/articles/5f696e327535c2874060cadc10d2d66f47d3409b,3/3(日) 9:06
2024-03-03,18:17,TTL,総合,24,スポニチアネックス,【東京マラソン】男子のパリ3枠目は大迫傑！2大会連続五輪マラソン代表に　西山雄介、41秒及ばず悔し涙,82,https://news.yahoo.co.jp/articles/8e79db406dc0a882f5b848ee215c8f8beab88ce2,3/3(日) 11:16
2024-03-03,18:17,TTL,総合,25,毎日新聞,トランプ氏、3州制して8戦全勝　5日のスーパーチューズデーに弾み,81,https://news.yahoo.co.jp/articles/0ca4aa8e2f06471c85e2b66bab00bb067fcdae10,3/3(日) 10:01
2024-03-03,18:17,TTL,総合,26,THE ANSWER,F1角田裕毅を「未熟」と指摘　前を譲られた同僚、一触即発の出来事も「彼はイライラしていた」,79,https://news.yahoo.co.jp/articles/df15571d3387b22f5dd73448c2e4617786a29fce,3/3(日) 16:33
2024-03-03,18:17,TTL,総合,27,SmartFLASH,「オワコンフィールド」札幌ドーム、命名権半額ディスカウントでも応募ゼロ「自業自得」「殿様商売」ファンも冷淡,79,https://news.yahoo.co.jp/articles/eb7f876480991e29b9f7da270ea36149910ebad5,3/3(日) 6:01
2024-03-03,18:17,TTL,総合,28,オリコン,なこなこカップル、結婚を発表　『TGC』ステージでサプライズ　“公開プロポーズ”も,76,https://news.yahoo.co.jp/articles/3ddffed9ee40c96e5a45fe78dee23ebd3a1b9101,3/2(土) 19:11
2024-03-03,18:17,TTL,総合,29,時事通信,政治改革「自民に発言権ない」　立民代表,73,https://news.yahoo.co.jp/articles/f38d0acef50b4f017032a3d9bf7b551e71640b0c,3/3(日) 17:24
2024-03-03,18:17,TTL,総合,30,デイリースポーツ,今田耕司　岐阜・町長のセクハラ認定「９９」に厳しすぎる項目の存在指摘「別に、ねえ」女子アナきっぱり拒絶,73,https://news.yahoo.co.jp/articles/7c8a407103bb702713d9d47a724e01da71648f03,3/3(日) 14:54
2024-03-03,18:17,TTL,総合,31,東スポWEB,【Ｆ１】ＲＢ角田裕毅と同僚リカルドに内紛騒動が勃発「確執が爆発」と海外メディア一斉報道,71,https://news.yahoo.co.jp/articles/059c178e4af3e879950c2f2e67c41c6fd5bcd640,3/3(日) 17:16
2024-03-03,18:17,TTL,総合,32,SmartFLASH,竹中平蔵氏「5年で1000万円、政治家の不記載にガタガタ言うな」であふれる憤激「ならば国民も脱税を」,70,https://news.yahoo.co.jp/articles/d377151249c73d34fc75dccdd66128567b7097cc,3/3(日) 17:45
2024-03-03,18:17,TTL,総合,33,NEWSポストセブン,大谷翔平の「年下」結婚相手がオープンになる可能性は？　松井秀喜「妻の似顔絵公開のみ」との共通点、大きく異なる点とは,69,https://news.yahoo.co.jp/articles/e5ab16ed2b2eb1a32f58f8d45ca1467b1c497112,3/3(日) 7:15
2024-03-03,18:17,TTL,総合,34,ＡＦＰ＝時事,独、ウクライナ支援協議内容がロシアに漏えい ショルツ政権に激震,69,https://news.yahoo.co.jp/articles/401f5f1aaf0f4f934d434e5abaa09cd705902263,3/3(日) 10:28
2024-03-03,18:17,TTL,総合,35,スポニチアネックス,“鬼のマナー講師”平林都氏、一番態度が悪かったユーチューバーは誰？ヒントに「分かっちゃう」の声,68,https://news.yahoo.co.jp/articles/1e6c3ff99ca6d8bde17588405180749a481efe95,3/3(日) 15:38
2024-03-03,18:17,TTL,総合,36,食品新聞,ココア、機能性表示食品が拡大　健康価値に支持　一過性で終わった過去と異なり定着化の兆し,67,https://news.yahoo.co.jp/articles/328d57657c9c5845ea47fdc99b0eb5ad9c6a3d4b,3/3(日) 12:30
2024-03-03,18:17,TTL,総合,37,TBS NEWS DIG Powered by JNN,【阪神】大逆転負け...オープン戦5戦全敗 及川が7回一挙5失点 大山待望の初安打含む2安打2打点も実らず 先発・才木は4回無失点,67,https://news.yahoo.co.jp/articles/c36bac85521df84d2c570840491e706bcf6dba4f,3/3(日) 15:19
2024-03-03,18:17,TTL,総合,38,日刊スポーツ,TBS良原安美アナ「不適切にもほどがあります」広瀬めぐみ議員“不倫疑惑報道”にぴしゃり,66,https://news.yahoo.co.jp/articles/6883a1beb1ac4221b001615e0e93aea0e4fdeb8b,3/3(日) 14:44
2024-03-03,18:17,TTL,総合,39,SmartFLASH,「無法地帯」フェイスブックの「ひろゆき詐欺」「ホリエモン詐欺」で3000万円被害…ひろゆきも「なんとかならんの？」と苦言,65,https://news.yahoo.co.jp/articles/c23511bfd1f8bd39597a739300b325890930896d,3/3(日) 17:00
2024-03-03,18:17,TTL,総合,40,TBS NEWS DIG Powered by JNN,日本人トップの西山雄介「オリンピックに行きたかった」設定記録に届かず悔し涙、中盤で転倒のアクシデントも【東京マラソン】,64,https://news.yahoo.co.jp/articles/9b57b668e7835b4e5dc042910f8a8ef09ff4a8b8,3/3(日) 11:16
