scrp_date,scrp_time,genre_en,genre_jp,rank,media_jp,title,comment,link,date_original
2025-11-18,22:16,sports,スポーツ,1,FOOTBALL ZONE,日本代表、ボリビアに3発快勝　森保監督通算100試合目を飾る…鎌田、町野、中村がゴール,212,https://news.yahoo.co.jp/articles/bd77260c17959ef94e0aedd97d0d021e90691bd9,11/18(火) 21:06
2025-11-18,22:16,sports,スポーツ,2,SOCCER DIGEST Web,「ソン・フンミンが日本人ならW杯優勝以上の存在だ」「日本サッカーを学ぶ必要がある」森保Jが３－０圧勝締め！韓国ファンの反応は…,146,https://news.yahoo.co.jp/articles/46201bc7ac448dc18d3922babede467a56d105d0,11/18(火) 21:09
2025-11-18,22:16,sports,スポーツ,3,AERA DIGITAL,日本ハム・伏見が阪神にトレード移籍の衝撃　他球団から「放出して大丈夫なのか」と驚きの声,94,https://news.yahoo.co.jp/articles/aaf2477355dc43bbcb33a53c6994c81176717c67,11/18(火) 21:30
2025-11-18,22:16,sports,スポーツ,4,SOCCER DIGEST Web,「先発が７人も変わったのに！」難敵ボリビアに３発快勝の森保ジャパンに韓国メディアも興味津々！「ホン・ミョンボは56分もかかったが…」,86,https://news.yahoo.co.jp/articles/92debe525de97433eaf51945c06b1590f7291bca,11/18(火) 21:20
2025-11-18,22:16,sports,スポーツ,5,スポーツ報知,森保ジャパン、２０２５年はボリビアを破って３連勝締め！鎌田、町野、中村の３得点で快勝…国際親善試合,77,https://news.yahoo.co.jp/articles/cffa6e5d0f954df97dd08a53e16a1642230284e7,11/18(火) 21:06
2025-11-18,22:16,sports,スポーツ,6,SOCCER DIGEST Web,「日本つえぇ…」「安心して見れた」南米勢に３発完勝！ 森保ジャパンのボリビア撃破に称賛の声続々「めちゃくちゃいい試合」,75,https://news.yahoo.co.jp/articles/2ea311e43923d2dd7ccf0e293580f08e655681b1,11/18(火) 21:14
2025-11-18,22:16,sports,スポーツ,7,J-CASTニュース,プロ野球・巨人、山瀬慎之助捕手が契約更改を保留か？　SNSでの「意味深ポスト」にファン動揺,64,https://news.yahoo.co.jp/articles/aa2376bc2f4923898d4c28de267be84c168b1a44,11/18(火) 11:45
2025-11-18,22:16,sports,スポーツ,8,GOAL,韓国代表がガーナを撃破！ 日本代表と同じ相手に連勝を決める,58,https://news.yahoo.co.jp/articles/9cbf08473de10d6ca52dcd02f3f84163c432ce30,11/18(火) 21:54
2025-11-18,22:16,sports,スポーツ,9,東スポWEB,「代打、代走しか使わないならトレードしろ」ドジャースのキム・ヘソンの来季を韓国メディア悲観,53,https://news.yahoo.co.jp/articles/549127d33900af7b489ce3b673f213a4c59b13b0,11/18(火) 13:50
2025-11-18,22:16,sports,スポーツ,10,スポーツ報知,【阪神】大山悠輔が現状維持３・４億円で更改　リーグＶに喜びも「自分、何やってんだ」来季５年契約の２年目,49,https://news.yahoo.co.jp/articles/fdd4c10a66c7bfcc3f1d58a5bcb3719a9f13e1ba,11/18(火) 13:15
2025-11-18,22:16,sports,スポーツ,11,SOCCER DIGEST Web,森保ジャパンがボリビアに３－０快勝！ 開始４分に鎌田が先制弾、途中出場の町野＆中村も鮮烈ゴール！ 年内ラストマッチを勝利で締めくくる,44,https://news.yahoo.co.jp/articles/0ab15d6cd042c19e3356423e2aa3dec4e262b255,11/18(火) 21:06
2025-11-18,22:16,sports,スポーツ,12,ABEMA TIMES,朝乃山、“激勝”に水を差す女性の奇声 “待ったなし”直後に携帯の着信音も…「電話は酷い」「奇声だらけやな」ファン愕然,43,https://news.yahoo.co.jp/articles/8de30df7e587aae14c1e2ecbf104ffa5eaecfb42,11/18(火) 21:09
2025-11-18,22:16,sports,スポーツ,13,GOAL,中村敬斗が圧巻の美技披露、途中出場から1ゴール1アシスト！ 日本がボリビアを3-0で圧倒,43,https://news.yahoo.co.jp/articles/978e991b601406da9974eccdc39c1b48e0d20736,11/18(火) 20:54
2025-11-18,22:16,sports,スポーツ,14,スポニチアネックス,江川卓大先輩の天然ツッコミが面白すぎる！　斎藤雅樹氏タジタジ「甲子園も出ないで何で巨人に…」,42,https://news.yahoo.co.jp/articles/97c31838f9a661ff9f2e0029601890b4cf0d285d,11/18(火) 18:52
2025-11-18,22:16,sports,スポーツ,15,スポニチアネックス,フル出場の主将・遠藤 「クラブであまり試合に出ていないんですけど…」と苦笑いも存在感抜群,39,https://news.yahoo.co.jp/articles/a64dcdf8ad188b55484cecb8db464142dbf0e08a,11/18(火) 21:23
2025-11-18,22:16,sports,スポーツ,16,ENCOUNT,「子供連れてて揉め事するなんて言語道断」“アンパンマンミュージアム”で親同士が喧嘩…ノッコン寺田が苦言,38,https://news.yahoo.co.jp/articles/90bd0594f915e5ce128e2a8221051631d97c7c9a,11/18(火) 9:02
2025-11-18,22:16,sports,スポーツ,17,FOOTBALL ZONE,中村敬斗が「たった1人で4人を翻弄」　ボリビア人記者も唖然のスーパーゴール,37,https://news.yahoo.co.jp/articles/d07722a626563f9945f4a073edca4ff9b27cccf5,11/18(火) 21:30
2025-11-18,22:16,sports,スポーツ,18,GOAL,ボリビア戦で先制弾の鎌田大地、改めて決意表明「僕たちの目標はW杯優勝」,36,https://news.yahoo.co.jp/articles/2e847dd7e078f90f5894b20071e124567255d87c,11/18(火) 21:19
2025-11-18,22:16,sports,スポーツ,19,スポーツ報知,【採点＆寸評】日本が３―０で圧勝、南米の難敵一蹴で年内最終戦勝利締め　高評価は得点者だけじゃなく…,36,https://news.yahoo.co.jp/articles/0bd1d5f5eb41e9a5828eb78a40fd79bb28e6ea95,11/18(火) 21:13
2025-11-18,22:16,sports,スポーツ,20,東スポWEB,【ＭＬＢ】Ａ・ロッド氏　殿堂入りは薬物事件で絶望的「得票率35％前後のドロ沼だ」＝米報道,34,https://news.yahoo.co.jp/articles/1163db9f92f3a1226288bd91399781205809ae8e,11/18(火) 19:45
2025-11-18,22:16,sports,スポーツ,21,スポーツ報知,ボリビア戦は新国立競技場の日本代表戦で最少の入場者…５万３５０８人,33,https://news.yahoo.co.jp/articles/6776e620048c2c07091d93f807e66f3afc1c27ce,11/18(火) 21:11
2025-11-18,22:16,sports,スポーツ,22,ゲキサカ,通算100試合目の森保J、ボリビアに3発快勝!! 11月無失点で劇的ブラジル戦から3連勝,32,https://news.yahoo.co.jp/articles/080205943a3a9cf6099636ad1f18d36d16b16b54,11/18(火) 21:07
2025-11-18,22:16,sports,スポーツ,23,馬トク報知,【ＪＲＡ】来年のジャパンＣから優勝馬の獲得総額が最大１２億８５００万円に　褒賞金の見直し発表,31,https://news.yahoo.co.jp/articles/66754f150ffa533fc34e5034f89996b8189cd2df,11/18(火) 17:29
2025-11-18,22:16,sports,スポーツ,24,フットボールチャンネル,【結果速報】サッカー日本代表が3ゴール快勝！ “ジョーカー”中村敬斗が止められない！ ボリビア代表を撃破,30,https://news.yahoo.co.jp/articles/95e0b6afdcdb2c57a8bccfb95bc8d3b2b41f2fe3,11/18(火) 21:06
2025-11-18,22:16,sports,スポーツ,25,中日スポーツ,山本由伸の言ってない”名言”は誰の言葉か、園田通訳「僕ではない」…”名言”が広まった理由、体現した「負けは選択肢にない」,30,https://news.yahoo.co.jp/articles/7bbe52d2a58fd21694c15ecd02a0b0e203df8669,11/18(火) 11:58
2025-11-18,22:16,sports,スポーツ,26,フットボールチャンネル,格が違う！ 快勝のサッカー日本代表、鎌田大地、中村敬斗の評価は？【ボリビア戦どこよりも早い採点／国際親善試合】,29,https://news.yahoo.co.jp/articles/1685df0a69cd8dd868811b12558ab23551dd4cce,11/18(火) 21:30
2025-11-18,22:16,sports,スポーツ,27,集英社オンライン,「まるでぼったくり居酒屋」WBCのチケット手数料が最大3300円！「チケットよりも手数料が高い券種も」,28,https://news.yahoo.co.jp/articles/85ea90e553c402f99ea35be82fc3df6194e79ac2,11/18(火) 18:00
2025-11-18,22:16,sports,スポーツ,28,スポニチアネックス,武田一浩氏　来春WBCの侍ジャパン2連覇に“黄信号”！？「MLB組が全員出られないと勝てない」,28,https://news.yahoo.co.jp/articles/b12cac2303100beeab9955b0c3ad9af2ef4f39e7,11/18(火) 20:39
2025-11-18,22:16,sports,スポーツ,29,SOCCER DIGEST Web,「ソックス短すぎ」「レガース入れてるの？」中村敬斗の独特すぎるスタイルが話題！ 完璧コントロールからのゴールも「シュートが上手すぎる男」,27,https://news.yahoo.co.jp/articles/1ce9ada7928e90f00d3f0b47b65c7dfabcef5441,11/18(火) 21:31
2025-11-18,22:16,sports,スポーツ,30,FOOTBALL ZONE,日本代表、ボリビア戦のスタメン発表　遠藤が先発復帰…森保監督の通算100試合目、年内ラストマッチ,27,https://news.yahoo.co.jp/articles/d1705280c4ac5b657032b3aeb95b006eef509080,11/18(火) 18:15
2025-11-18,22:16,sports,スポーツ,31,サンケイスポーツ,大谷翔平らWBC出場がドジャース3連覇『最大の懸念』…地元紙　日本の位置づけ「国民的行事」　3選手の出場回避「文化的に厳しい」,27,https://news.yahoo.co.jp/articles/6f83859515ddaab90bdba0b323a4d2061b27ff62,11/18(火) 10:18
2025-11-18,22:16,sports,スポーツ,32,デイリースポーツ,森保ジャパン１００試合目　前半４分に電光石火の先制劇　鎌田が鮮やか先制弾　久保のクロスに胸トラップから左足一閃,27,https://news.yahoo.co.jp/articles/3a4c39c2e6594b36e3f34381195f613cc4bcc854,11/18(火) 19:23
2025-11-18,22:16,sports,スポーツ,33,東スポWEB,ドジャースのレポーター・ワトソンさん明かす「将来は子供がほしい」「ヨシノブと買い物に行くの」,26,https://news.yahoo.co.jp/articles/f1602bd6d028eeae8f52af7d7ce985004355546b,11/18(火) 16:40
2025-11-18,22:16,sports,スポーツ,34,GOAL,日本代表、開始4分で電光石火の先制弾！ 久保のクロスから鎌田大地が左足で決める,26,https://news.yahoo.co.jp/articles/1d5ce416379321588c70e2a04788ff9eb8443029,11/18(火) 19:24
2025-11-18,22:16,sports,スポーツ,35,CoCoKARAnext,埋まらないレッドブルのドライバー“格差”をOB解説者が懸念　マシン開発の妨げなど深刻な問題と指摘「データ取得が事実上不可能だ」,26,https://news.yahoo.co.jp/articles/2b1ed68e1520660e87b5821e4151235490efeb88,11/18(火) 18:31
2025-11-18,22:16,sports,スポーツ,36,週刊女性PRIME,最年長JリーガーにW不倫疑惑《お風呂覗きたいんですが笑》LINE流出も…慰謝料トラブルを直撃,26,https://news.yahoo.co.jp/articles/3cda05d0fee7309713df5bb7f4bdb267be5c92f2,11/18(火) 8:00
2025-11-18,22:16,sports,スポーツ,37,デイリースポーツ,阪神・糸原は１５００万減の５５００万円でサイン　６１試合の出場で打率・２０３、４打点　「悔しい思い」　球団からは代打として期待の言葉,25,https://news.yahoo.co.jp/articles/135839629951dacada7e6ccb76b87c36c3a73122,11/18(火) 11:52
2025-11-18,22:16,sports,スポーツ,38,Full-Count,大谷翔平から“失われた”敬意　遺恨残る宿敵との死球禍…ド軍実況が代弁「一線を越えた」,25,https://news.yahoo.co.jp/articles/3bc7dd63e2217fc6a4b1153ba07c14e56e88340c,11/18(火) 20:41
2025-11-18,22:16,sports,スポーツ,39,CoCoKARAnext,阿部巨人　オフの補強第2弾にX注目　“人材の宝庫”SBから加入「ポテンシャルは高いはず」「期待するしかないな」,25,https://news.yahoo.co.jp/articles/a8a5eb968d15f4721760799be80aac9e45bdfdce,11/18(火) 16:44
2025-11-18,22:16,sports,スポーツ,40,スポニチアネックス,敵将が森保Jに白旗「ペース握られた」3失点完敗に「日本は強度が高く、私たちはうまくいかなかった」,24,https://news.yahoo.co.jp/articles/843096f4b462a97be2a19b80e6a70f0c50623758,11/18(火) 21:44
