scrp_date,scrp_time,genre_en,genre_jp,rank,media_jp,title,comment,link,date_original
2025-03-24,21:13,business,経済,1,食品新聞,「サトウのごはん」一部終売も　コメ不足で需要急伸、供給追い付かず　業界に影響広がる,462,https://news.yahoo.co.jp/articles/2a86d0fdbbbe7bab6cbf842061e29ac371bcbaeb,3/24(月) 16:58
2025-03-24,21:13,business,経済,2,朝日新聞,ガソリン補助金は4月以降も継続　政府、物価高対策で水準も維持,432,https://news.yahoo.co.jp/articles/d6a2ef5e5d7bb57a3f202270d291f5df08e3aa87,3/24(月) 19:05
2025-03-24,21:13,business,経済,3,ロイター,マルハニチロ、社名を「ウミオス」に　26年3月の変更を決議,313,https://news.yahoo.co.jp/articles/2d2cba30543edf415aa32114a4fc316b057158c5,3/24(月) 15:52
2025-03-24,21:13,business,経済,4,TBS NEWS DIG Powered by JNN,スターバックスできょうから順次紙のストローを廃止　環境配慮のプラスチック製ストローに切り替え,189,https://news.yahoo.co.jp/articles/e217e7cf594da07a73a7d4a4c87c4bd6175cc546,3/24(月) 13:45
2025-03-24,21:13,business,経済,5,ITmedia ビジネスオンライン,ロッテ「チョコパイ」過去最高の売り上げ　40年以上も売れ続けているワケ,146,https://news.yahoo.co.jp/articles/fc33e55883ec150b4a32ce21c90f42d16e907c49,3/24(月) 6:10
2025-03-24,21:13,business,経済,6,東洋経済オンライン,「チョコザップ」大量出店を阻んだ“2つの誤算”、トレーニングマシンの故障率上げたビジネスモデルの盲点,126,https://news.yahoo.co.jp/articles/164f7ac87096cf4a4e9cdef1ac0d2e5c7571082e,3/24(月) 5:02
2025-03-24,21:13,business,経済,7,FNNプライムオンライン,「急増するスマホ注文にモヤモヤ」飲食店は客のギガに“タダ乗り”?「月末はいつも通信制限カツカツ」店側にはメリットもSNSには不満の声も,103,https://news.yahoo.co.jp/articles/a8fde5efbbf7ac1a9e6456d1d7b4cb7a3c767d42,3/24(月) 18:12
2025-03-24,21:13,business,経済,8,くるまのニュース,カーナビ受信料徴収に批判の声続々！ NHKは「放送をスクランブル化すれば良い」「放送法が今の時代にそぐわない」の声も！ 警察捜査車両のカーナビ38台がNHK受信料「未払い」、みんなの反響は？,102,https://news.yahoo.co.jp/articles/1d412117c5588f0b7f943ae13cbc1f6507e324cf,3/24(月) 9:10
2025-03-24,21:13,business,経済,9,ABCニュース,「まさにステルス増税」　4月使用分から電気代の負担増　一般的な世帯で年間2352円⇗　「再エネ賦課金」引き上げで,76,https://news.yahoo.co.jp/articles/c7a28c4c09bed77151f375399fc0f762afb7b4dc,3/24(月) 18:19
2025-03-24,21:13,business,経済,10,J-CASTニュース,「AIに奪われる職業」10年前の予想が大外れと話題に　編集者は悲鳴「1人で何でもできてしまう時代」,75,https://news.yahoo.co.jp/articles/534e3d81c3229eb2f23c7da5a3ae10d5972d5ed2,3/24(月) 12:10
2025-03-24,21:13,business,経済,11,日本農業新聞,米1杯50円は高いのか　適正価格 考える契機に　木之内農園会長・木之内均氏,53,https://news.yahoo.co.jp/articles/b417bc8bda513116efdcfb9e8d57c48cfe4a6723,3/24(月) 16:40
2025-03-24,21:13,business,経済,12,マネーポストWEB,チケット転売対策強化で「ライブに行けなくなった」一部ファンたちの恨み節　「現場に入れず応援する意欲がなくなった」「一人で推し活する“ソロ活勢”が不利」…余儀なくされる“戦略変更”,46,https://news.yahoo.co.jp/articles/9263d44b43e3134e0cf0128ea83c7d6482e590fa,3/24(月) 15:15
2025-03-24,21:13,business,経済,13,TBS NEWS DIG Powered by JNN,コメの平均価格5キロ4172円　11週連続の値上がり,42,https://news.yahoo.co.jp/articles/de9ab82f06ad2737a2b8fca3d3b4e0f6be809410,3/24(月) 20:30
2025-03-24,21:13,business,経済,14,ダイヤモンド・オンライン,氷河期世代の平均年収が、逃げ切り世代より「84万円」少ない上に、税・社会保険料の負担増でさらに「手取り減」の悲劇,39,https://news.yahoo.co.jp/articles/e8f40955c91d041bb887d539c1f0bed438923e22,3/24(月) 6:02
2025-03-24,21:13,business,経済,15,テレビ朝日系（ANN）,花見に異変…新人の場所取りパワハラ？　代行業者「依頼どんどん」　令和の花見模様,39,https://news.yahoo.co.jp/articles/0def12aeb289dacfb011d7c7d5d0d4977c4f3ef4,3/24(月) 12:32
2025-03-24,21:13,business,経済,16,産経新聞,再エネ賦課金の国民負担、累積23兆円　子育て予算5年分に相当　廃止提案に政府「推進」,34,https://news.yahoo.co.jp/articles/154c2da8bb848cd20cbf2010808fb226bd67291e,3/24(月) 7:00
2025-03-24,21:13,business,経済,17,くるまのニュース,大ヒット「シエンタ」対抗馬はいつ登場!? 苦戦の日産に足りないのは「コンパクトミニバン」だ！ 日産「新型セレナ“ミニ”」に期待大！,28,https://news.yahoo.co.jp/articles/5496a91e544556abee259a4a04899aac714e1fae,3/24(月) 19:10
2025-03-24,21:13,business,経済,18,FNNプライムオンライン（フジテレビ系）,備蓄米放出方針もまだコメ高騰…11週連続で最高値更新　2024年の2倍の高値続く,28,https://news.yahoo.co.jp/articles/56da34ae2303846cc96398256cc88ba8075bbbb1,3/24(月) 18:17
2025-03-24,21:13,business,経済,19,ベストカーWeb,[ランドクルーザー300]がとうとうマイチェン!! 盗難抑止力がマシマシになるも受注再開はならず!!!,26,https://news.yahoo.co.jp/articles/da1979d789003125341a0ddd53d64f707747a702,3/24(月) 20:00
2025-03-24,21:13,business,経済,20,テレビ朝日系（ANN）,「5年食べられるコメ」に注文殺到！家庭でできる“コメ防衛策”,24,https://news.yahoo.co.jp/articles/b5c428026b72d6aad54ea7d108b9cc786e14dd13,3/24(月) 19:39
2025-03-24,21:13,business,経済,21,朝日新聞,ロードサービスでトラブル相次ぐ2社を公表　高額請求業者に注意,24,https://news.yahoo.co.jp/articles/cf18f89a8bdcd4942c337a1afa90cc276d73f320,3/24(月) 18:15
2025-03-24,21:13,business,経済,22,東洋経済オンライン,「さすがにフェイク画像でしょ」→まさかの「事実でした」…《「すき家」のネズミ混入事件》で浮き彫りになった、“絶対にマズい”2つの致命的なミス,23,https://news.yahoo.co.jp/articles/2e1f194f0232ac9a9731008450d48d622a91aa61,3/24(月) 11:51
2025-03-24,21:13,business,経済,23,Bloomberg,みそ汁にネズミ混入でゼンショー株が急落、売り上げに影響の可能性,23,https://news.yahoo.co.jp/articles/8e3b6fe4441a36567cf3c7ec8aeadaf0eb0fcf47,3/24(月) 9:47
2025-03-24,21:13,business,経済,24,乗りものニュース,狭軌新幹線ぜひ一考でしょ！ 北陸新幹線の「敦賀から先」 地下水問題など回避する策はある？,22,https://news.yahoo.co.jp/articles/90ec85c25a8024585f6dd1438b71477c93fc1c95,3/24(月) 7:12
2025-03-24,21:13,business,経済,25,ベストカーWeb,嘘だろ [日本製鉄]の米国への訴訟は日本全体の[イメージダウン]になるってホントかよ!?,21,https://news.yahoo.co.jp/articles/0685182f6056591b7b57aabf6c4b1df93598b0d8,3/24(月) 17:00
2025-03-24,21:13,business,経済,26,TBS NEWS DIG Powered by JNN,大阪・関西万博の開幕まであと20日…参加国が自前で建設するパビリオンの7割が“未完成”,21,https://news.yahoo.co.jp/articles/d0d6499f191d03ec83264c27e7162e78a2cc5fb4,3/24(月) 16:48
2025-03-24,21:13,business,経済,27,マネーポストWEB,【法律相談】自宅マンションで父の葬儀を執り行いたいが管理会社からは「遠慮してほしい」と連絡　弁護士は「断念する理由はありません」と回答、その根拠は何か,21,https://news.yahoo.co.jp/articles/483840ffcd551c8431fb012c482abfb9204e142e,3/24(月) 15:15
2025-03-24,21:13,business,経済,28,乗りものニュース,車線の真ん中を時速30キロで走り続ける原付。君は「キープレフト」の意味を知っているか←知っててわざと？ なぜなのか,21,https://news.yahoo.co.jp/articles/91851950ca60cb3742e4b6f918b64ed195b183c3,3/24(月) 9:42
2025-03-24,21:13,business,経済,29,WEB CARTOP,「事故れば実名報道」「カスハラも横行」！　給料上げただけじゃ解決しない路線バスの運転士不足問題,21,https://news.yahoo.co.jp/articles/e007dde0905a33340de33f05a76b93c381820d91,3/24(月) 6:31
2025-03-24,21:13,business,経済,30,MBSニュース,石破総理「ミャクミャクが最近愛おしくてたまらない」開幕まであと20日　万博成功に向け超党派の議員連盟が総会,20,https://news.yahoo.co.jp/articles/34bb9dec57a34a2ea37c323b870d8e3eaefc030b,3/24(月) 20:51
2025-03-24,21:13,business,経済,31,ファイナンシャルフィールド,年金が「増えるなら」受け取り時期を遅らせてもいいかなと考えています。寿命を考えると「何歳から」受給がよいのでしょう？,20,https://news.yahoo.co.jp/articles/4efe7b322e07d65c3c98c1c75b4179f525faa8fd,3/24(月) 14:30
2025-03-24,21:13,business,経済,32,乗りものニュース,80年ぶりの帰国！ 国内現存ゼロの「激レア日の丸戦車」里帰り成功 ボロボロだけど「3年後には動かします」,20,https://news.yahoo.co.jp/articles/a35a3c44a2b2114c9b03457ea038a665ad184b21,3/24(月) 16:42
2025-03-24,21:13,business,経済,33,東洋経済オンライン,【日本は有事に弾薬を確保できる？】ウクライナ侵攻が露わにした防衛産業の「サプライチェーン危機」。ロシアは武器の「買い戻し」も,20,https://news.yahoo.co.jp/articles/67455cc4cce3e36c72e65c2bb11cc2dc63933fac,3/24(月) 14:02
2025-03-24,21:13,business,経済,34,Merkmal,鉄道オタクはなぜ「経営者」気取りなのか？ ネットが歪める鉄道愛の現在地！ 穏健派オタクは大迷惑？ その知識を社会の資産にする方法とは,19,https://news.yahoo.co.jp/articles/5856f18bba1a5c4ab76fa7049a30f18c1d5d006e,3/24(月) 5:51
2025-03-24,21:13,business,経済,35,朝日新聞,伸び悩むアウトバウンド、新しいパスポート取得に補助　2億円規模,17,https://news.yahoo.co.jp/articles/53ebd2d8138644f943cc8c7749e7dee98b85c160,3/24(月) 20:04
2025-03-24,21:13,business,経済,36,現代ビジネス,日本の若者の「建築業界離れ」がかなり深刻に…「労働時間は長く賃金も低い」厳しい実態,17,https://news.yahoo.co.jp/articles/6bde591140c325afcb834d765880b9c2a1068727,3/24(月) 7:01
2025-03-24,21:13,business,経済,37,LIMO,年金だけでは不安…「65歳以上・リタイア夫婦世帯の生活」食費は月約7.6万円、年金と貯蓄の平均額はいくらか,17,https://news.yahoo.co.jp/articles/28d8df3c87e6ba969fbe82b8463d84c08ab98c37,3/24(月) 14:42
2025-03-24,21:13,business,経済,38,くるまのニュース,満タン後の「継ぎ足し給油」が「絶対NG」な理由とは!? 実はほかにも「危険すぎる行為」多数…ガソリンスタンドで「細心の注意」必要なワケ,17,https://news.yahoo.co.jp/articles/c69b549759ebdd5692d4128e6a9490143fbca5b2,3/24(月) 12:40
2025-03-24,21:13,business,経済,39,BUSINESS INSIDER JAPAN,「何も悪いことはしていない」イーロン・マスク、テスラに対する憎悪と破壊行為にショックを受けたと語る（海外）,16,https://news.yahoo.co.jp/articles/e6d04bf0584ee07b6a0b5d497b90b7724b777ae1,3/24(月) 11:10
2025-03-24,21:13,business,経済,40,Bloomberg,米ウクライナ高官が和平協議、エネルギー焦点－米ロもサウジで交渉へ,16,https://news.yahoo.co.jp/articles/27fa0f1e1123d60329b881b235a4e3ebe60f7bb7,3/24(月) 0:21
