scrp_date,scrp_time,genre_en,genre_jp,rank,media_jp,title,comment,link,date_original
2024-04-28,19:19,TTL,総合,1,西スポWEB OTTO！,いつまで続く…西武がパスボールで延長戦15連敗、ワースト更新　10~12回の絶好機生かせず、先発・隅田知一郎の力投フイ,378,https://news.yahoo.co.jp/articles/80c11ab2b6dcd1aab4f06d8dfe8b9a770aa25459,4/28(日) 17:36
2024-04-28,19:19,TTL,総合,2,共同通信,皇位継承に「危機感」72％　女性天皇容認は90％,365,https://news.yahoo.co.jp/articles/721a1954fe120be842b4ed530937bfaa93465384,4/28(日) 5:11
2024-04-28,19:19,TTL,総合,3,WEB CARTOP,モペットの「無免」「ノーヘル」「歩道走行」など取り締まりが話題！　同じペダル付きの乗りものだけど「アシスト自転車」とは何が違う？,321,https://news.yahoo.co.jp/articles/c1a23098a39b9013d04419629f206e3eff869d53,4/28(日) 15:10
2024-04-28,19:19,TTL,総合,4,FRIDAY,何の罪もないキムタクを降ろして…マクドナルドが「Number_i」をCM採用もファン大荒れの訳,251,https://news.yahoo.co.jp/articles/9fae5046a3c2a88a9f702a4deb1fe135ae7abde9,4/28(日) 16:00
2024-04-28,19:19,TTL,総合,5,時事通信,中国、戻らぬ海外客　日本人はビザが足かせに,247,https://news.yahoo.co.jp/articles/74434dab005f15db0489629eac73e91f50303d70,4/28(日) 7:21
2024-04-28,19:19,TTL,総合,6,スポニチアネックス,岸田首相「30年ぶりに経済の明るい兆し」投稿にツッコミ続々　「むしろ地獄」「お先真っ暗」と怒りの声,200,https://news.yahoo.co.jp/articles/5b7bef841707e2af06c1b7b1e51a6bd298936f78,4/27(土) 21:25
2024-04-28,19:19,TTL,総合,7,現代ビジネス,日ハムの「値下げ要求」を突っぱねて「値上げ」した…？札幌ドーム叩きの「勘違い」と「嘘」を暴く！,190,https://news.yahoo.co.jp/articles/a343690e6d3fb293f6c9055defbd20340011872c,4/28(日) 7:33
2024-04-28,19:19,TTL,総合,8,まいどなニュース,ゆたぼん「学校で何学んできたんや」風呂にチーズ牛丼200人前詰めた炎上動画に苦言「重みが違う」「大人が高校生に説教されてる」,189,https://news.yahoo.co.jp/articles/3c2c8efbdf1aad11284371f7776a8da22dfbe6b4,4/28(日) 17:23
2024-04-28,19:19,TTL,総合,9,みんかぶマガジン,都知事選に30人候補を擁立するNHK党・立花孝志を直撃！なぜ東京都知事選で30人もの候補者を擁立するのか…立花孝志「我々は選挙を通じてお金儲けします」,173,https://news.yahoo.co.jp/articles/87f26d25460d9087b12151ca435bc58dc5a65e76,4/28(日) 17:10
2024-04-28,19:19,TTL,総合,10,デイリースポーツ,西武が延長戦で１５連敗　２リーグ制後のプロ野球ワーストをさらに更新　延長十二回２死満塁で決勝捕逸の古市がうなだれる,162,https://news.yahoo.co.jp/articles/032d9cbd6649abcd890c4e7f0a08ebe53724285f,4/28(日) 17:47
2024-04-28,19:19,TTL,総合,11,デイリースポーツ,ヤクルト、痛恨逆転負け　中継ぎがリード守れず　甲子園の風にも泣かされ、カード負け越し　借金５,161,https://news.yahoo.co.jp/articles/69982a692ed1fa4469d79965c2814f05b6810ce6,4/28(日) 17:25
2024-04-28,19:19,TTL,総合,12,デイリースポーツ,中日、痛恨のスコアレスドロー　再三のサヨナラ機もあと一本が出ず　今季初先発の高橋宏は７回３安打０封,161,https://news.yahoo.co.jp/articles/e300fe0bb256b54671f32e597535c1c80aecc86b,4/28(日) 17:35
2024-04-28,19:19,TTL,総合,13,読売新聞オンライン,群馬のココイチＦＣ新社長は２２歳アルバイト…８年目の抜擢「働くみんなに寄り添う存在に」,160,https://news.yahoo.co.jp/articles/5984723fe434b3d8ed06658a03019b0a901e5cbb,4/28(日) 11:43
2024-04-28,19:19,TTL,総合,14,スポニチアネックス,中日、ベンチ入り野手総動員も“スコアレスドロー”　立浪監督「高橋宏に勝ちを付けられなくて残念」,149,https://news.yahoo.co.jp/articles/c7af880050a4f879543c3064a1369eb26977de20,4/28(日) 18:08
2024-04-28,19:19,TTL,総合,15,時事通信,衆院3補選、投票進む　夜に結果判明、政権へ影響,149,https://news.yahoo.co.jp/articles/4d903006d53c16a42d010889cdb76662ab65db2a,4/28(日) 7:07
2024-04-28,19:19,TTL,総合,16,J-CASTニュース,浴槽に大量の「牛丼」を...人気YouTuber「チーズ牛丼風呂」ドッキリに物議　「おもんないし酷い」,149,https://news.yahoo.co.jp/articles/a05edd2027f4a42a9a0e71d0d0532530bb3ba447,4/28(日) 16:42
2024-04-28,19:19,TTL,総合,17,FNNプライムオンライン（フジテレビ系）,アベノミクスのブレーン、本田悦朗氏が強調「今利上げする理由はない」,148,https://news.yahoo.co.jp/articles/d1a2f1f19bb3213cf1aee87565982610d929854f,4/28(日) 14:57
2024-04-28,19:19,TTL,総合,18,CHANTO WEB,公立小中高の授業時間、5分短縮されても「現場の負担増える」　専門家に聞く、本当に必要な教育改革とは　#令和に働く,147,https://news.yahoo.co.jp/articles/605fa79d5cd14d976a1917caf71d8d374e156d68,4/28(日) 18:02
2024-04-28,19:19,TTL,総合,19,時事通信,為替介入のタイミング焦点　34年ぶり円安、1日で3円急落,139,https://news.yahoo.co.jp/articles/806339acae04ab0f1fb431b31dfc240ee01aee18,4/28(日) 7:16
2024-04-28,19:19,TTL,総合,20,デイリースポーツ,ＤｅＮＡ、２連敗でカード負け越し　勝ち越し機に牧が痛恨の併殺打　救援陣が勝ち越し許す,133,https://news.yahoo.co.jp/articles/8d0522aa8ef532aec03f3adcafbf2dee937253a7,4/28(日) 17:23
2024-04-28,19:19,TTL,総合,21,TBS NEWS DIG Powered by JNN,【ヤクルト】逆転負け 今季ワーストタイ借金5...大西が7回2死無走者から3連打 大山の決勝打は左翼サンタナの前に サンタナ2打点も,131,https://news.yahoo.co.jp/articles/369b51a711e4bb67c29292b4ea1488333eabec07,4/28(日) 17:52
2024-04-28,19:19,TTL,総合,22,読売新聞オンライン,投機的な円売り・ドル買いで一時、１ドル＝１５８円４０銭台…３０日からのＦＯＭＣ次第で円安加速か,124,https://news.yahoo.co.jp/articles/256acb23b107eb192e7168cb06f25236338a7dcb,4/27(土) 19:59
2024-04-28,19:19,TTL,総合,23,TBS NEWS DIG Powered by JNN,【広島】今季3度目の引き分け...スコアレス・ドロー 3度のサヨナラ負けの危機を凌ぐ 森浦は11回1死満塁で踏ん張る 打線は6安打,124,https://news.yahoo.co.jp/articles/025091c4529f8ac6f5c0c38119a6089471743381,4/28(日) 17:35
2024-04-28,19:19,TTL,総合,24,スポニチアネックス,【天皇賞・春】テーオーロイヤルG1初制覇！重賞3連勝で長距離の頂点へ　菱田「一番うれしい」,120,https://news.yahoo.co.jp/articles/152a3f288e67dd092c06eaa9302aba739764c6cc,4/28(日) 15:46
2024-04-28,19:19,TTL,総合,25,テレビ朝日系（ANN）,都内のカプセルホテル代は1万2000円超えも　宿泊料金高騰のGW,120,https://news.yahoo.co.jp/articles/1f79aaf7989d2b5990f8bd96fa033380ac0e70f0,4/27(土) 22:30
2024-04-28,19:19,TTL,総合,26,Bloomberg,日本は何をしているのか、円急落でも動かない当局にトレーダーら疑問,119,https://news.yahoo.co.jp/articles/1d6a25e43fa20a6213956dae9ab515c23bc5925e,4/28(日) 18:35
2024-04-28,19:19,TTL,総合,27,スポーツ報知,【日本ハム】今季初の１点差負けで新庄政権初の貯金「５」逃す　今季最多３失策＆最少１安打,118,https://news.yahoo.co.jp/articles/9196eeb1762ffe2fe1d0104d5586a013ced5c509,4/28(日) 16:37
2024-04-28,19:19,TTL,総合,28,スポニチアネックス,西武・松井稼頭央監督はサヨナラ捕逸を責めず「こちらの責任」2連敗で借金ワースト8,117,https://news.yahoo.co.jp/articles/d47a9e75a580e88a9408fa81b008e37854c1d978,4/28(日) 18:37
2024-04-28,19:19,TTL,総合,29,TBS NEWS DIG Powered by JNN,【中日】今季3度目のドロー、髙橋宏7回無失点＆救援陣0封リレーも...再三のサヨナラ機に凡退、打線決定力に欠く,116,https://news.yahoo.co.jp/articles/90026ee18f7fb19945e1c427da407513618e957c,4/28(日) 17:35
2024-04-28,19:19,TTL,総合,30,山陰中央新報,衆院補選 島根1区　舌戦に幕、一票に命運　錦織候補「政治改革 先頭に立つ」　亀井候補「島根から政治変えて」,113,https://news.yahoo.co.jp/articles/ec1d4d26bd0c30b74461d5678641859b77306cbe,4/28(日) 6:45
2024-04-28,19:19,TTL,総合,31,ファイナンシャルフィールド,小さいお店で「クレジットカード決済」って迷惑なんですか？ 手数料で売上が減ってしまうと聞いたのですが、現金払いにするべきでしょうか…？,113,https://news.yahoo.co.jp/articles/2cec7a7a0be2476c3f8083af00372d9b005ba5c2,4/28(日) 13:40
2024-04-28,19:19,TTL,総合,32,新潟ニュースNST,“国民年金”納付「5年延長」に賛否の声…負担増で現役世代の年金受給額は「払えと言われたら払うけど…」,103,https://news.yahoo.co.jp/articles/14717e68542b3ce29c625bdcf318ffd1bb4b5521,4/28(日) 17:01
2024-04-28,19:19,TTL,総合,33,TBS NEWS DIG Powered by JNN,【阪神】逆転勝ち 2連勝で4カード連続勝ち越し 今季最多貯金5！大山が7回に決勝打 スタメン糸原が適時打＆3安打 先発・才木は3失点,103,https://news.yahoo.co.jp/articles/30f5abba5ca9d3806f35e0d3a7057f4646b62b7b,4/28(日) 17:20
2024-04-28,19:19,TTL,総合,34,中日スポーツ,中日、終盤に連続で満塁のチャンスつくるもあと一本出ず…広島とスコアレスドロー,99,https://news.yahoo.co.jp/articles/2ca89da9f5cf846c6de7ddbe2eab9a8a0f579b8a,4/28(日) 17:39
2024-04-28,19:19,TTL,総合,35,共同通信,就活「オワハラ」が巧妙化　「後付け推薦状」要求も,96,https://news.yahoo.co.jp/articles/fe0cfd8c1599d58948634b8749d7249407f27cae,4/28(日) 16:28
2024-04-28,19:19,TTL,総合,36,TBS NEWS DIG Powered by JNN,【DeNA】今季ワーストタイ借金3...上茶谷が勝ち越し打許す、三浦監督「ボールが高かったかな」 大貫5回2失点、打線わずか3安打,95,https://news.yahoo.co.jp/articles/d34e7fbd7b8d7559943deb11a08901d559deb24c,4/28(日) 17:20
2024-04-28,19:19,TTL,総合,37,スポニチアネックス,「チーズ牛丼200人前」を浴槽に詰める動画で大炎上…がーどまん声明「僕は被害者です」「6人で食べた」,94,https://news.yahoo.co.jp/articles/6e49142bf4c3628d64bd629ef69f45650ae1cadf,4/28(日) 18:29
2024-04-28,19:19,TTL,総合,38,千葉日報オンライン,「貴重な経験、とても楽しい」　空港の最前線で働く軽度知的障害の25歳　職場の多様化へ周囲の支え　#令和に働く,89,https://news.yahoo.co.jp/articles/92ec40acb15ca00d62508351b41d291efbcf042c,4/28(日) 16:00
2024-04-28,19:19,TTL,総合,39,産経新聞,他陣営の演説に横付けして大音量、「選挙妨害」批判相次ぐ　衆院３補選２８日投開票,88,https://news.yahoo.co.jp/articles/32b07f76dd9baefe0666a0f6929b400c952f874b,4/27(土) 19:53
2024-04-28,19:19,TTL,総合,40,FNNプライムオンライン,親の世話になりたくないーー高齢の両親に介護されるいらだち　難病と闘う落水洋介の葛藤 #病とともに ＃ザ・ノンフィクション #ydocs,88,https://news.yahoo.co.jp/articles/1d62fcf535574e192c3a59740fcd814bcf288ffc,4/28(日) 14:00
