scrp_date,scrp_time,genre_en,genre_jp,rank,media_jp,title,comment,link,date_original
2025-11-24,02:06,TTL,総合,1,共同通信,首相は中国に真意説明を　立民・野田代表、関係改善に向け,1131,https://news.yahoo.co.jp/articles/24244eeec9c340161d5dbf2886dba1885591070c,11/23(日) 15:52
2025-11-24,02:06,TTL,総合,2,時事通信,中国外相、日本を名指し批判　「軍国主義の復活許さず」,699,https://news.yahoo.co.jp/articles/3aedb6254badc10fbc892c5de3d9628686b9d153,11/23(日) 14:46
2025-11-24,02:06,TTL,総合,3,スポニチアネックス,石破茂前首相　おこめ券配布に異議「その原資は何ですか？国民の税金でしょう？」,556,https://news.yahoo.co.jp/articles/31f7b08b33e0a0348085a0a7a7ba11b809408e8e,11/23(日) 16:55
2025-11-24,02:06,TTL,総合,4,スポニチアネックス,立民・岡田克也氏　「存立危機事態」答弁引き出した質問への批判に反論「全く理解できない」,474,https://news.yahoo.co.jp/articles/306652a949f27d9aacadaa30b8aa8ff10b489b0e,11/23(日) 19:44
2025-11-24,02:06,TTL,総合,5,毎日新聞,高市内閣支持65％横ばい　高支持率を維持　毎日新聞世論調査,354,https://news.yahoo.co.jp/articles/de8f2025b5f55beae0d0781dd6f88be96b26632d,11/23(日) 15:47
2025-11-24,02:06,TTL,総合,6,読売新聞オンライン,石破前首相、自公の連立解消「正しいとは思っていない」「進み過ぎる時に『待った』をしてくれた」,352,https://news.yahoo.co.jp/articles/c002dc682f4d781a6634d400b12d5f8097ce9d78,11/23(日) 11:00
2025-11-24,02:06,TTL,総合,7,ITmedia Mobile,サイゼリヤの“注文アプリ”が賛否を呼ぶ理由──「使いやすい」「紙メニュー前提」など多様な意見,337,https://news.yahoo.co.jp/articles/583e095d024dca59b54c34873e9837fa06068817,11/23(日) 19:41
2025-11-24,02:06,TTL,総合,8,読売新聞オンライン,中国大使館「敗戦国に軍事行動取れる」とＸに投稿、外務省反論「国連の旧敵国条項の死文化に中国も賛成」,309,https://news.yahoo.co.jp/articles/7e638df5c3d37c3a4fce8149677489dd40881bc9,11/23(日) 20:33
2025-11-24,02:06,TTL,総合,9,時事通信,日中首脳、接触見送り　高市氏、重要鉱物の安定供給訴え　G20,296,https://news.yahoo.co.jp/articles/a70f1697301d4d61078bdb59a05d3c73e18180cf,11/23(日) 21:33
2025-11-24,02:06,TTL,総合,10,FNNプライムオンライン（フジテレビ系）,「日本はすでに代償を払った」　中国国営メディアが論評　SNSで話題に,270,https://news.yahoo.co.jp/articles/40ec03ea18c1ed31bdf429dc8f29d3215cb13eb0,11/23(日) 23:45
2025-11-24,02:06,TTL,総合,11,FNNプライムオンライン（フジテレビ系）,中国・王毅外相「日本の軍国主義の復活を決して許さない」名指しで日本批判,269,https://news.yahoo.co.jp/articles/dab5f6ace8af2f5655b696dc7de760b776e17c25,11/23(日) 16:42
2025-11-24,02:06,TTL,総合,12,ABEMA TIMES,“台湾有事”中国が反発…石破前総理の見解は「外交は世の中からボロクソ言われても国益のために守らなきゃいけないことがある」「どうすれば台湾有事にならないかを考えるべき」,207,https://news.yahoo.co.jp/articles/0fd7c9926ce40608a9938d70e3c37fc60ade63dc,11/23(日) 16:06
2025-11-24,02:06,TTL,総合,13,毎日新聞,中国の王毅外相、高市首相の台湾巡る答弁は「レッドラインを越えた」,186,https://news.yahoo.co.jp/articles/5bf25d8789a66b574ca0152988bb546a4bc11ae9,11/23(日) 18:05
2025-11-24,02:06,TTL,総合,14,ABEMA TIMES,「日本はすでに代価を支払った」中国SNSで1位に,166,https://news.yahoo.co.jp/articles/c28992254b4d49365b271a2e3a1e2e63d8e1cc51,11/23(日) 11:36
2025-11-24,02:06,TTL,総合,15,まいどなニュース,斎藤元彦・兵庫県知事、大学での「講演」予定に波紋　法学部長がコメント「教授会は承認せず」「利用されているようで不愉快」,163,https://news.yahoo.co.jp/articles/3f12cdad62be24322bf467fa7945bb0ab7b08984,11/23(日) 17:15
2025-11-24,02:06,TTL,総合,16,日刊スポーツ,「報道特集」高市首相の台湾有事発言は「百害あって一利なし」小泉政権の元外務審議官が批判,162,https://news.yahoo.co.jp/articles/f53220248eb08554235f900a15377f52df488112,11/23(日) 13:59
2025-11-24,02:06,TTL,総合,17,産経新聞,問われるNHKの存在意義　受信料「未収」に法的強化、「公平負担」の大義も番組批判続く,159,https://news.yahoo.co.jp/articles/d972cadcc122f5c1471b19ed0f0fe16f5fddb072,11/23(日) 19:00
2025-11-24,02:06,TTL,総合,18,スポニチアネックス,高市首相の台湾有事発言は「百害あって一利なし」　元外務審議官がバッサリ「外交上何のプラスもない」,158,https://news.yahoo.co.jp/articles/b5903672d7b2ae59cdc424587088ef7048481ae7,11/23(日) 21:07
2025-11-24,02:06,TTL,総合,19,読売新聞オンライン,香港政府「日本で中国人襲撃する事件増加」、青少年交流事業の参加取りやめ報道…中国に追随の動き,157,https://news.yahoo.co.jp/articles/278bb98316451f87aa5a29feead5c3db0688c736,11/23(日) 23:39
2025-11-24,02:06,TTL,総合,20,TBS NEWS DIG Powered by JNN,G20今夜閉幕「かなりのスピードで関係強化。高市総理ならでは」初日は笑顔の積極外交も日中接触は未だ実現せず,156,https://news.yahoo.co.jp/articles/c789b0a778a2be55b3262fedfbc44e6b5e6d880e,11/23(日) 18:20
2025-11-24,02:06,TTL,総合,21,毎日新聞,「タコ山」「箱型ブランコ」の次はジャングルジム？　姿消す公園遊具,146,https://news.yahoo.co.jp/articles/bb7cb86c0b541cca1e7bc50d9bcedc2f54dfd8ca,11/23(日) 7:30
2025-11-24,02:06,TTL,総合,22,TBS NEWS DIG Powered by JNN,安青錦が逆転で初賜杯！豊昇龍を優勝決定戦で撃破、ウクライナ出身力士で初、大関に前進【大相撲九州場所】,139,https://news.yahoo.co.jp/articles/11322e2437a4421e3dfa1030d698d4eb03925655,11/23(日) 17:40
2025-11-24,02:06,TTL,総合,23,産経新聞,チャイナリスクの不安と現実　中国人ツアー2千人予約取り消し、キャンセル料免除要求も,139,https://news.yahoo.co.jp/articles/24080d4cbc629fefe65573ff158bda51516d1960,11/23(日) 14:47
2025-11-24,02:06,TTL,総合,24,テレビ朝日系（ANN）,中国“渡航自粛”よびかけ　観光地は…　観光客からは冷静な声も,138,https://news.yahoo.co.jp/articles/7e45608b5b13b5b3cec4298c3e77cf73c4b9ac84,11/23(日) 18:59
2025-11-24,02:06,TTL,総合,25,テレビ朝日系（ANN）,3連休 紅葉ピーク箱根大混雑　人気スポット1時間待ち行列　大渋滞「1km進むのに80分」,131,https://news.yahoo.co.jp/articles/3541fa8a41b1e59041157442b230e3a4407f3da8,11/23(日) 12:09
2025-11-24,02:06,TTL,総合,26,プレジデントオンライン,やっぱり進次郎のほうがマシ…「コメの値下げは無理」と言い張る農水大臣に、高市首相が命じるべき「5つの策」,130,https://news.yahoo.co.jp/articles/82aae8666bda674347889e705058be973a212664,11/23(日) 12:15
2025-11-24,02:06,TTL,総合,27,NEWSポストセブン,【中国人観光客減少への本音】「高市さんはもう少し言い方を考えて」vs.「正直このまま来なくていい」消えた訪日客に浅草の人々が賛否、着物レンタル業者は“売上2〜3割減”見込みも,122,https://news.yahoo.co.jp/articles/f8879616b4476803c431bf4b7f828c7a661b5feb,11/23(日) 11:15
2025-11-24,02:06,TTL,総合,28,TBS NEWS DIG Powered by JNN,高市総理の台湾有事めぐる答弁 中国・王毅外相が批判「レッドライン越えた」,121,https://news.yahoo.co.jp/articles/4f364ef68b6100256a19ef9c6d55d67c084f83e5,11/24(月) 0:55
2025-11-24,02:06,TTL,総合,29,読売新聞オンライン,「加熱式たばこ」の受動喫煙、「紙巻き」同様の対策強化を検討へ…厚労省の専門委が議論スタート,115,https://news.yahoo.co.jp/articles/fe28989bd06b7c4bf753e4d3bb44b02d6b56e9ed,11/23(日) 5:00
2025-11-24,02:06,TTL,総合,30,FNNプライムオンライン,“おこめ券”は家計を救う!? 米の高騰続く中…消費者からは歓迎・困惑の声「米しか買えない…」,114,https://news.yahoo.co.jp/articles/60d8c3ee0d1620a77bbfba0e2eac9f5822eb4fc6,11/23(日) 20:57
2025-11-24,02:06,TTL,総合,31,毎日新聞,子ども1人2万円給付、評価「する」「しない」拮抗　毎日新聞世論調査,111,https://news.yahoo.co.jp/articles/82bfcffc6fb4996190eaeae19254414e0323f975,11/23(日) 21:14
2025-11-24,02:06,TTL,総合,32,日刊スポーツ,ラサール石井氏、小泉進次郎防衛相の「愛国心」言及をうけ「真の愛国は、戦争を起こさない事」,108,https://news.yahoo.co.jp/articles/f747675027e394722f1ebc2afc854926ee5d3898,11/23(日) 8:48
2025-11-24,02:06,TTL,総合,33,デイリースポーツ,巨人イベントに清原和博氏が登場「もう何十年ぶりでしょうか」東京ドーム沸く　松井秀喜氏も笑顔「メジャー時代に激励に来てくれたんです」秘話も明かす,107,https://news.yahoo.co.jp/articles/b2673af3a38cab714c3c6ac7afb12bb25767f67b,11/23(日) 19:52
2025-11-24,02:06,TTL,総合,34,日刊スポーツ,ウクライナ出身の安青錦が初V「選んだ道に間違いなかった」ロシア軍事侵攻で徴兵対象目前に来日,104,https://news.yahoo.co.jp/articles/4dab202df179731b151e5bdd7d004f7ecfa61f5a,11/23(日) 20:27
2025-11-24,02:06,TTL,総合,35,FNNプライムオンライン（フジテレビ系）,中国・王毅外相 日本を名指しで批判　「軍国主義の復活を決して許さない」,101,https://news.yahoo.co.jp/articles/7183d83af9c7bccfebec16e0883ec77db8c7811c,11/24(月) 1:18
2025-11-24,02:06,TTL,総合,36,中日スポーツ,米山隆一議員、台湾有事質問の岡田克也氏への非難に”反論”　「高市氏も過去に質問」の事実挙げ「『国会でするな』と言う保守の方は筋違い」と苦言,101,https://news.yahoo.co.jp/articles/0b3374af31238e408eb5c38da0463b118e60090e,11/23(日) 20:26
2025-11-24,02:06,TTL,総合,37,クーリエ・ジャポン,英紙　日本のポピュリスト政治家は「外国人観光客への怒り」を都合よく利用している,99,https://news.yahoo.co.jp/articles/b4156604c74f05f19a808746aeac295573df3279,11/23(日) 19:33
2025-11-24,02:06,TTL,総合,38,デイリースポーツ,杉村太蔵氏　「オレは富裕層だと言う気はないけど、うちにまで子供手当が４万円くる」→２１兆円の経済対策を批判「正気の沙汰とは思えない」,97,https://news.yahoo.co.jp/articles/ef225b674ec73ee14accbd753a2c778358ebb26d,11/23(日) 10:58
2025-11-24,02:06,TTL,総合,39,日刊スポーツ,竹中平蔵氏に「外資の手先みたいなことを言わないで」、賃上げ論議で須田慎一郎氏がツッコミ,96,https://news.yahoo.co.jp/articles/54b70a34908d81da56004378127fd46215687af3,11/23(日) 22:35
2025-11-24,02:06,TTL,総合,40,HTB北海道ニュース,由仁町の国道２７４号で乗用車同士の事故　　３人が病院に運ばれ　２人が死亡,93,https://news.yahoo.co.jp/articles/e30ba66d4623a914256756805f097ed95c2d6208,11/23(日) 22:17
