scrp_date,scrp_time,genre_en,genre_jp,rank,media_jp,title,comment,link,date_original
2024-03-08,03:22,business,経済,1,東京商工リサーチ,フィットネスクラブの倒産が急増、過去最多を更新中 　サービスの差別化で競争激化、投資とコスト増も負担,198,https://news.yahoo.co.jp/articles/a16282301fe8e20c5a42bcbf8e2d6166760f01f3,3/7(木) 13:49
2024-03-08,03:22,business,経済,2,テレビ朝日系（ANN）,ビジネスホテル1泊2万円も…「都内に泊まれない」出張族の悲鳴　宿泊費を節約する方法,194,https://news.yahoo.co.jp/articles/3e53ba193f9819a30b75d42d5e681751c1970b1a,3/7(木) 13:12
2024-03-08,03:22,business,経済,3,TBS NEWS DIG Powered by JNN,【2024年賃上げ】外食大手・ゼンショーHDが平均12.2%の賃上げ　3年間の賃上げ率は計27.2%,79,https://news.yahoo.co.jp/articles/4b7013d100dd840c1ea5d06ace9ba897a25c5d1a,3/7(木) 18:08
2024-03-08,03:22,business,経済,4,TBS NEWS DIG Powered by JNN,日経平均終値492円安の3万9598円　一時4万400円台まで上昇後急落,60,https://news.yahoo.co.jp/articles/54e33559d71d70ecda3db6eeecfa8da81def878b,3/7(木) 15:16
2024-03-08,03:22,business,経済,5,TBS NEWS DIG Powered by JNN,3月7日は「サウナの日」、サ活も“タイパ”重視に?…餃子、カラオケ、商談の場にも【Nスタ解説】,55,https://news.yahoo.co.jp/articles/d85c8bec07e595bebc8e8381a05e472d8a22b635,3/7(木) 20:16
2024-03-08,03:22,business,経済,6,共同通信,東証、午前終値3万9731円　円高嫌気、一時400円超安,53,https://news.yahoo.co.jp/articles/30573cb6cc698a1b2a6bc3e4b410ca1982a7e8d3,3/7(木) 9:43
2024-03-08,03:22,business,経済,7,テレビ朝日系（ANN）,春闘　大企業で大幅賃上げの妥結相次ぐ,51,https://news.yahoo.co.jp/articles/f6beb6a6deeaf9c9331cf75a5b3dc0a12027bde6,3/7(木) 22:46
2024-03-08,03:22,business,経済,8,テレビ朝日系（ANN）,クッキーとビスケット、何が違う？焼き方やバターではない“日本だけの定義”が！,43,https://news.yahoo.co.jp/articles/49557c5dd53aed736b9d0679ca5fa74af7a89069,3/7(木) 18:40
2024-03-08,03:22,business,経済,9,週刊SPA!,加熱する撮り鉄に駅員が本音「自分たちの行動が趣味の範囲を狭めている」。一方、撮り鉄側の“言い分”とは,35,https://news.yahoo.co.jp/articles/85b7e34ab6664f8b6609eafb8185d2e8cebc7c78,3/7(木) 15:53
2024-03-08,03:22,business,経済,10,読売新聞オンライン,日経平均の午前終値、３５９円安の３万９７３１円…一時は最高値の４万４００円台に上昇,34,https://news.yahoo.co.jp/articles/d5a589869caa3cbf4508e44814fdcd8ec282d795,3/7(木) 9:09
2024-03-08,03:22,business,経済,11,時事通信,トランプ2．0、日本企業備えは　保護主義加速、脱炭素逆行も　米大統領選,31,https://news.yahoo.co.jp/articles/4afb1928eb732eec8212e733a10507a8790ca923,3/7(木) 7:06
2024-03-08,03:22,business,経済,12,プレジデントオンライン,なぜ日本人の賃金は「韓国以下」に落ちたのか…変化を嫌い、競争を避ける「日本のダメすぎる2大悪習」,28,https://news.yahoo.co.jp/articles/6491ae733ea87393d1647cd3f1f202c43d0ee125,3/7(木) 7:17
2024-03-08,03:22,business,経済,13,FNNプライムオンライン,日本三景・天橋立『股のぞき』に大きく黄色の注意書き　同僚の悪ふざけで50代男性転落する事故発生　観光客は微妙な反応,27,https://news.yahoo.co.jp/articles/1846916b9fd24f4d4b6b9526ffeda3646abc7112,3/7(木) 19:24
2024-03-08,03:22,business,経済,14,時事通信,日産の下請法違反「極めて遺憾」　経営トップ自ら説明を　日商会頭,26,https://news.yahoo.co.jp/articles/625cb8a1d00e52d3f6628bc871290893659361b0,3/7(木) 19:44
2024-03-08,03:22,business,経済,15,Bloomberg,ＮＹ市地下鉄に州兵を配備へ、相次ぐ暴力事件に対応－ホークル知事,19,https://news.yahoo.co.jp/articles/f8a9f351f909674158ed53f17e9a90142103fd4c,3/7(木) 6:32
2024-03-08,03:22,business,経済,16,乗りものニュース,異例の“ダイヤ白紙大改正”＆18年ぶりの新車導入 東海道本線「静岡区間」大変貌へ,18,https://news.yahoo.co.jp/articles/4e3d0ac62494c3c952c941626a87e50d92a6c24e,3/7(木) 15:12
2024-03-08,03:22,business,経済,17,くるまのニュース,唐沢寿明も欲しい!? ホンダが新型「美麗スポーティセダン」発表！ 斬新「声で話せる機能」に“和製スーパーカー”「NSX」オーナーも絶賛… 新型「アコード」544万円から発売,18,https://news.yahoo.co.jp/articles/9476a20e19713c40276d50bb1d98d585c3de56af,3/7(木) 21:10
2024-03-08,03:22,business,経済,18,読売新聞オンライン,キリンＨＤ、直接契約で目黒蓮さんを広告に起用…旧ジャニーズへの対応「変更ない」,17,https://news.yahoo.co.jp/articles/2dcd2c3bbb37fb9527a4e09ff9316fc1e21d9822,3/7(木) 13:57
2024-03-08,03:22,business,経済,19,マネーポストWEB,【世帯年収1700万円でも…】都内パワーカップルの意外と質素な生活　「贅沢はコンビニのつまみで公園飲み」「妻に『庶民感覚に寄せてくれる？』とお願い」,15,https://news.yahoo.co.jp/articles/45b7d90fdddedcce7dda6c612270cbf053012608,3/7(木) 15:15
2024-03-08,03:22,business,経済,20,毎日新聞,欧州中銀が政策金利据え置き、4会合連続　インフレ再加速を懸念,15,https://news.yahoo.co.jp/articles/34f42a7cdb3b07a05bea0a8cfbb1f22bc340f163,3/7(木) 22:19
2024-03-08,03:22,business,経済,21,ダイヤモンド・オンライン,「小池百合子首相」説が急浮上、悪夢の連立政権誕生シナリオの現実味,15,https://news.yahoo.co.jp/articles/d3fe54daf012e4de5638eea44926a0dc18aa8b51,3/7(木) 12:02
2024-03-08,03:22,business,経済,22,乗りものニュース,関東の高速道路「ノーマルタイヤ禁止」予告！ 大雪警戒で外環・横横・圏央道…立ち往生起こしたら「監査します」,15,https://news.yahoo.co.jp/articles/60a3b60fc67df082bd5b6245f3a962fc7869039b,3/7(木) 18:42
2024-03-08,03:22,business,経済,23,ライフハッカー・ジャパン,ジェフ・ベゾスはなぜ「PowerPoint使用禁止」を命じたのか。その背景にあるAmazonの哲学,15,https://news.yahoo.co.jp/articles/2a1730be7cf23f0b0ee8d1002940604f54229109,3/7(木) 21:21
2024-03-08,03:22,business,経済,24,AMP［アンプ］,未婚男女の43％が「結婚したい」と回答　未婚女性の66％が結婚相手に「自分より収入が高い」ことを重視,14,https://news.yahoo.co.jp/articles/10d5615379aa564abb9e5ff982ccfe13b454c012,3/7(木) 16:59
2024-03-08,03:22,business,経済,25,乗りものニュース,英空母が「タイムスリップしないで！」と心配される!? 北極圏で遭遇した特別な現象とは,13,https://news.yahoo.co.jp/articles/3b5f508eb7e2f911b17f5be35034a0be7c4b09c7,3/7(木) 17:42
2024-03-08,03:22,business,経済,26,乗りものニュース,ロシア海軍の「最新哨戒艦」を撃沈？猛威を振るう「無人自爆モーターボート」 黒海艦隊の損害相次ぐ,13,https://news.yahoo.co.jp/articles/8553a7702794d0c8d8504698744586a8e8944d8f,3/7(木) 11:42
2024-03-08,03:22,business,経済,27,読売新聞オンライン,日経平均、一時５００円超下落…３万９５００円台で推移,12,https://news.yahoo.co.jp/articles/4e313bf058135cce3a18b09ea683051e68172804,3/7(木) 14:41
2024-03-08,03:22,business,経済,28,OneNews,都心から広がるカーシェア文化。東京在住のZ世代は半数が車を「いらない」と回答,12,https://news.yahoo.co.jp/articles/132c58f7fca581202c51cf78c38106cae7fc88d6,3/7(木) 18:00
2024-03-08,03:22,business,経済,29,時事通信,日経平均、史上最高値上回る＝東京株式,11,https://news.yahoo.co.jp/articles/fe724a1f7d3c304adc52fe1a2ef75c1c1c617ae0,3/7(木) 9:30
2024-03-08,03:22,business,経済,30,日刊ゲンダイDIGITAL,「裏金議員に課税しろ」“税金一揆”いよいよ現実に、市民有志が国税庁に怒りの申し入れ,11,https://news.yahoo.co.jp/articles/a576c8fb5208da82e8bb39c6c26ebb0dc022885f,3/7(木) 14:45
2024-03-08,03:22,business,経済,31,ロイター,午後３時のドルは1カ月ぶり安値148円半ば、日銀政策修正にらみ円高,10,https://news.yahoo.co.jp/articles/f1c26b4ef8a3e98fb7ba8a952604b661113db5f9,3/7(木) 16:08
2024-03-08,03:22,business,経済,32,MBSニュース,【トケマッチ】３００万円分を預けた人「率直にだまされた裏切られた」容疑者出国前に組織的に一斉売却か　時計業界の被害者「各都道府県を探していきたい」,9,https://news.yahoo.co.jp/articles/d0b94acfd7e23e979e9ce65eb61c8c38adecdc46,3/7(木) 18:00
2024-03-08,03:22,business,経済,33,東洋経済オンライン,「チェルシー終売」嘆き悲しむ人が多い本当の理由　長寿商品との突然の別れ、しかも「メルカリで高額転売！」はあまりに悲しい,9,https://news.yahoo.co.jp/articles/e688998e42c5f6b3f0bc8c2d1599a4866103294f,3/7(木) 16:32
2024-03-08,03:22,business,経済,34,ロイター,中国、不動産の事前販売資金で業者支援を＝人民銀行前総裁,9,https://news.yahoo.co.jp/articles/c65b6e3aa62174f8104d35c602ce60b19922f265,3/7(木) 16:37
2024-03-08,03:22,business,経済,35,J-CASTニュース,伊藤忠が必須化した男性育休取得　「夫婦同時にとるか」「交代か」大議論　「交代」圧倒的に多かった理由は？　専門家に聞く（1）,9,https://news.yahoo.co.jp/articles/55a5ddd271021a780f0bbc65a81e1c985e7a6065,3/7(木) 18:16
2024-03-08,03:22,business,経済,36,家電 Watch,サクラを家の蓄電池に　V2H電池残量の謎、そして屋根のソーラーパネル全交換!,9,https://news.yahoo.co.jp/articles/e21a4b5c67ddb72cbf3ff76f02aca2a90ef7f0b0,3/7(木) 8:07
2024-03-08,03:22,business,経済,37,現代ビジネス,ここにきて、日本の中古車が世界で「ひとり勝ち」するかもしれない…！専門家が着目する「自動車産業」の新たな価値,9,https://news.yahoo.co.jp/articles/27e5c79f91945bf24ce664473aef02407bed8108,3/7(木) 7:03
2024-03-08,03:22,business,経済,38,TBS NEWS DIG Powered by JNN,アマゾンやグーグルがシェア7割のテレビOS「優越的な地位の可能性」　公正取引委員会,9,https://news.yahoo.co.jp/articles/1d215d87855ea3c3b75d77b22cc9bcab1f266da3,3/7(木) 21:33
2024-03-08,03:22,business,経済,39,AMP［アンプ］,Indeed、「女性の仕事と子育ての両立に関する調査」を実施　正社員ワーママの約3人に2人が「将来的なキャリアプランの見通しが持てない」と回答,9,https://news.yahoo.co.jp/articles/4f7726f486743a617e1af7db628f55df51a64ecc,3/7(木) 18:29
2024-03-08,03:22,business,経済,40,LIMO,【バブルの再来？】銀行で「5G投資信託」を投資先にすすめられました。初心者ですが、思い切って集中投資しちゃってもいいでしょうか？,8,https://news.yahoo.co.jp/articles/9c9da5fec9862c8275655e615d6c5579ff9e4efe,3/7(木) 20:47
