scrp_date,scrp_time,genre_en,genre_jp,rank,media_jp,title,comment,link,date_original
2026-01-12,09:41,life,ライフ,1,LASISA,【衝撃】保有率急落…20歳の「免許離れ」が止まらない！「金欠」と並ぶ「車を買わない理由」1位は？,166,https://news.yahoo.co.jp/articles/12300b35e337ece0b972a595e6c88677fe319b23,1/12(月) 8:15
2026-01-12,09:41,life,ライフ,2,FORZA STYLE,「あんな小さい子がママと離れた席じゃ可哀想」新幹線指定席で隣客が「交替してあげれば？」30代会社員「ふざけんなよ」【専門家助言】,163,https://news.yahoo.co.jp/articles/b1d4129bda1121d8761b35c3812933190724c426,1/12(月) 6:30
2026-01-12,09:41,life,ライフ,3,THE GOLD ONLINE（ゴールドオンライン）,10円のもやしで腹を満たすことばかり考えている⋯「年金月16万円」都内72歳男性が直面する老後安泰の崩壊、物価高に潰される残酷な現実「50年働いた結果がこれか」,102,https://news.yahoo.co.jp/articles/59a092d5d0063d08ace6d38d05ea3533a71e2ce4,1/12(月) 5:00
2026-01-12,09:41,life,ライフ,4,THE GOLD ONLINE（ゴールドオンライン）,"振袖に30万円もかけるなんて…「有名私大生・自慢の一人娘」がまさかの成人式拒否！〈世帯年収1,500万円〉50代夫婦が戸惑ったワケ",65,https://news.yahoo.co.jp/articles/3575feeffff5f670ffd00d1458a31fa207c8e3ae,1/12(月) 5:00
2026-01-12,09:41,life,ライフ,5,THE GOLD ONLINE（ゴールドオンライン）,「手取り32万円」45歳男性、冬のボーナスを見て愕然…日本中で「真面目に働く中流層」が次々と貧困化していく現実,45,https://news.yahoo.co.jp/articles/d07dd27d88f8bfbe79b803127753aa8d29ba26d3,1/11(日) 14:00
2026-01-12,09:41,life,ライフ,6,THE GOLD ONLINE（ゴールドオンライン）,親が死んだらどうするんだ…「年金月20万円」88歳父から「月5万円の小遣い」をもらい、のほほんと暮らす63歳息子。ある日チラ見した「預金通帳」に顔面蒼白のワケ,38,https://news.yahoo.co.jp/articles/0993ab28480e4131365be0f994e8701dc9bb7efb,1/12(月) 8:00
2026-01-12,09:41,life,ライフ,7,Hint-Pot,「私はこれで痴漢に遭わなくなった」　受験生を救う「痴漢抑止バッジ」　無料配布の効果とおそるべき痴漢被害の実態とは,37,https://news.yahoo.co.jp/articles/7dc2c43ad9c4a650ceb789a75087a6b667532cf2,1/12(月) 8:05
2026-01-12,09:41,life,ライフ,8,毎日新聞,「拡散スピードが桁違い」校内の暴行動画が波紋　大人がすべきことは,37,https://news.yahoo.co.jp/articles/6b3275661e4f2398c17d7764c1250faf9cdf6c68,1/11(日) 9:38
2026-01-12,09:41,life,ライフ,9,毎日新聞,珍しい冬眠中のクマ観察ツアー　関心高く「満席」相次ぐ　盛岡,32,https://news.yahoo.co.jp/articles/ac503da3ba7d0b82381d2475e3e75575aa2f7d6d,1/11(日) 14:15
2026-01-12,09:41,life,ライフ,10,プレジデントオンライン,「医師＝将来安泰」ではない…奈良県立医科大学学長が保護者全員に「10ページに及ぶ長い手紙」を綴る切実な理由,28,https://news.yahoo.co.jp/articles/6f2c1cbf4d1f91cffa8b447d4f278610db679351,1/12(月) 8:15
2026-01-12,09:41,life,ライフ,11,プレジデントオンライン,"「すべての出来事に意味がある」は呪いの言葉…6年間ヒキコモリだった芸人の人生を変えた""魔法の5文字""",27,https://news.yahoo.co.jp/articles/a9a2192662d0da74758659cdec805969b677d0fd,1/12(月) 7:15
2026-01-12,09:41,life,ライフ,12,産経新聞,激戦必至、早稲田など難関私大の共通テスト利用方式が出願増の見通し　マーチ、関関同立も　入試最前線2026,25,https://news.yahoo.co.jp/articles/f6bced1ed33d21905c7922c2e810b154198edb61,1/12(月) 8:10
2026-01-12,09:41,life,ライフ,13,週刊女性PRIME,「さいたまスーパーアリーナ」の大規模改修工事で休館で起こる“会場争奪戦”と“地域経済”への影響,24,https://news.yahoo.co.jp/articles/643a149f96be8f697588614ec37bf4ae158defc5,1/12(月) 9:00
2026-01-12,09:41,life,ライフ,14,ウォーカープラス,「加害生徒にも未来がある」なぜ、学校は加害者を擁護するのか？教育とは何かを問う！議論は「どちらかの勝利」ではなく問題提起【著者に聞く】,24,https://news.yahoo.co.jp/articles/754200a3dfb20e62042af688f46c5562da238e09,1/12(月) 9:00
2026-01-12,09:41,life,ライフ,15,ENCOUNT,大盛況の「東京オートサロン」、一部来場者のマナー違反でゲート閉鎖に　上がる嘆きの声「運営の方本当に大変そう」,23,https://news.yahoo.co.jp/articles/d6c54d08a843717c7253ec438e358f489ac06ab0,1/11(日) 16:39
2026-01-12,09:41,life,ライフ,16,ENCOUNT,ノーマルタイヤのミニバン、雪道で立ち往生に絶句　外国人運転手が30キロ先でチェーン購入の救助劇,21,https://news.yahoo.co.jp/articles/862499d54532fad5a5154fa9e90f234ab8f8447c,1/12(月) 9:10
2026-01-12,09:41,life,ライフ,17,ENCOUNT,ディズニーで2区画占有する車が「マナー違反」と物議→実はキャストの誘導　運営側「状況により案内することも」,19,https://news.yahoo.co.jp/articles/8d62842c0067c27902a7cd9957ee3237dace1edf,1/11(日) 12:11
2026-01-12,09:41,life,ライフ,18,まいどなニュース,女性教師がメスシリンダーにコンドーム装着「根元まで巻きおろして」中高一貫の女子高生が受けた性教育「どれだけ私たちのこと考えて…」【漫画】,19,https://news.yahoo.co.jp/articles/c5c8af4ad093f3f1cbcc7db66ca7fbd8c86f370b,1/12(月) 7:30
2026-01-12,09:41,life,ライフ,19,プレジデントオンライン,唐揚げにレモンを勝手にかける人はやっぱり嫌われる…「感じがいい人」と「感じが悪い人」の決定的違い,18,https://news.yahoo.co.jp/articles/66657ed699f7cb6b70a5662a04804e75c0df5056,1/12(月) 7:15
2026-01-12,09:41,life,ライフ,20,TOKYO FM＋,婚約指輪が「一番欲しくなかったブランド」…喜ぶべきなのに涙が止まらない…このモヤモヤをどう解消する？ 悩む相談者へのアドバイス続々,18,https://news.yahoo.co.jp/articles/27459f499aa4c9a93b585c11d55414cfa8f75a8f,1/12(月) 6:50
2026-01-12,09:41,life,ライフ,21,ダイヤモンド・オンライン,「学歴フィルター」のボーダーは上がった？ 下がった？ 学歴は今でも就職活動の重要ポイントなのか,18,https://news.yahoo.co.jp/articles/a0153ba9ac534223bdf00a98c2aa85a10c227811,1/12(月) 7:10
2026-01-12,09:41,life,ライフ,22,オトナンサー,スーパー銭湯スタッフが「ご遠慮ください」と注意喚起　利用客の“迷惑行為”に「出禁とかすればいいのに」,17,https://news.yahoo.co.jp/articles/211efd752726d9f01be8879479b3ef52ef45f1c1,1/11(日) 19:15
2026-01-12,09:41,life,ライフ,23,文春オンライン,日本一小さい市にある“ナゾの駅”「蕨」には何がある？,17,https://news.yahoo.co.jp/articles/23b872b80d12707dd0eb8553027fc219a5ade020,1/12(月) 6:12
2026-01-12,09:41,life,ライフ,24,オトナンサー,不倫経験のある既婚男女に質問「”浮気”相手は特別な存在？」→男性の半数を占めた《生々しい本音》,15,https://news.yahoo.co.jp/articles/ad638e4630b8d0250ab954e65b31d0c4998d3c28,1/11(日) 21:15
2026-01-12,09:41,life,ライフ,25,トラベル Watch,JR西日本、新幹線も乗り放題「WESTERポイント全線フリーきっぷ」明日利用開始。春休みの旅行にも使える,15,https://news.yahoo.co.jp/articles/9e8192d6c298e0b793c46113ce659f8e69137619,1/12(月) 6:00
2026-01-12,09:41,life,ライフ,26,LASISA,若者の7割「恋人なし」でも…実は過半数が「欲しい」。2026年「マチアプ」カオスマップが暴く“恋愛離れ”の正体,15,https://news.yahoo.co.jp/articles/98027887947bde5c2266f6a09a11330472c64c83,1/11(日) 21:15
2026-01-12,09:41,life,ライフ,27,ファイナンシャルフィールド,体調不良でホテルを「当日キャンセル」…スタッフの人が「特別にキャンセル料なし」にしてくれたので、お礼を“SNSに投稿”したら批判殺到！ いったいナゼ？ トラブルを避けるポイントとは,15,https://news.yahoo.co.jp/articles/2dde519cd007adc3e46eea68038d488377890393,1/11(日) 13:50
2026-01-12,09:41,life,ライフ,28,女子SPA！,「鉄オタは採用試験で必ず落とされる説」→現役乗務員に真相を聞いてみると“ほっこりエピソード”が,15,https://news.yahoo.co.jp/articles/bd13cacb61f3b8ef4e15a132fd3c99b56f2e4a89,1/11(日) 15:47
2026-01-12,09:41,life,ライフ,29,NEWSポストセブン,《続く高級ダウンブーム》「ワケアリ」をおしゃれに着こなす人たち　メルカリで中古品買って”汚れにファンデ”塗る人や”におっても洗わない”人も,13,https://news.yahoo.co.jp/articles/a7651f6217e2af6532abdbae5940aa124ff6bbe9,1/12(月) 7:15
2026-01-12,09:41,life,ライフ,30,まいどなニュース,金婚迎えた両親に200万円の豪華クルーズ旅行プレゼント→父の死後に思わぬ税務署の指摘…一体なぜ？【税理士が解説】,11,https://news.yahoo.co.jp/articles/b7a43a8005c05b56cccef4828e8c7c040a7419ce,1/11(日) 16:00
2026-01-12,09:41,life,ライフ,31,ウォーカープラス,【103万円の壁】時給が上がったのに「働けない」？ 待遇改善が現場の首を絞める“逆転現象”の正体【作者に聞く】,11,https://news.yahoo.co.jp/articles/35db62d5a19e3a8bd4ddb375a28abd3e7a0c548b,1/12(月) 3:37
2026-01-12,09:41,life,ライフ,32,AERA DIGITAL,「なぜ介護といえば“娘か嫁”なのか」　仕事を辞め実家に戻り介護する妹をよそに、兄は海外旅行,11,https://news.yahoo.co.jp/articles/ca2f38b65609315659f6cdf56a90d9acb6887b40,1/11(日) 16:30
2026-01-12,09:41,life,ライフ,33,FNNプライムオンライン,厳しさ増す地方の病院経営　JA新潟厚生連は改革進めるも…収支均衡見通せない病院は最悪“廃止”を検討,11,https://news.yahoo.co.jp/articles/df2fe63010a9420a3419f4b918bff5c1df117a0f,1/11(日) 19:00
2026-01-12,09:41,life,ライフ,34,ウィメンズヘルス,菓子パン等で大腸がん「リスク」45%増？ 若者に急増、米研究が警告,11,https://news.yahoo.co.jp/articles/8b6853fc798205c272fb582cdaaa8e0cc4de6d91,1/11(日) 19:03
2026-01-12,09:41,life,ライフ,35,オトナンサー,「成人の日」式典後、20歳が「19歳」同級生に酒飲ませた…“傷害罪”に該当するケースも　飲食店が大迷惑を被るワケ,11,https://news.yahoo.co.jp/articles/19c8f1e79f3c27c4c2b0f7231a0b9093f709e934,1/12(月) 6:15
2026-01-12,09:41,life,ライフ,36,まいどなニュース,繰り越した銀行通帳、安易に捨ててはダメ！多額の出費につながるケースも【元銀行員が解説】,10,https://news.yahoo.co.jp/articles/934ba8dc30e39b5a4e429b72c17d25af84165a71,1/12(月) 8:30
2026-01-12,09:41,life,ライフ,37,まいどなニュース,「お子さんはまだ？」 土足で踏み込んでくる知人　夫が放った「確実に話そらす返し」が秀逸すぎる！【漫画】,10,https://news.yahoo.co.jp/articles/10095d8a57a5e9857c166e016fdceb18b39edc38,1/12(月) 8:00
2026-01-12,09:41,life,ライフ,38,ファイナンシャルフィールド,40代の先輩は「ランチがおにぎり2個」…20代の自分より「高収入」だと思ったのですが、意外と“年収は上がらない”のでしょうか？ 年代別の平均年収と「節約の理由」を確認,10,https://news.yahoo.co.jp/articles/900e9108f3c66b9c05c9e9ca101518d811d1dfa6,1/11(日) 14:10
2026-01-12,09:41,life,ライフ,39,LASISA,「フルネームなんて怖くて出せない」戸建てでも“表札を出さない家”が急増中！「配達員は困る」「Googleマップが怖い」賛否の声,10,https://news.yahoo.co.jp/articles/f31e717904a204617fb068f1b43f70660c873dd6,1/11(日) 11:15
2026-01-12,09:41,life,ライフ,40,LIMO,大阪旅行でご当地グルメを食べようと思ったのに…「ホテルの朝食あるある」に思わず共感してしまう,10,https://news.yahoo.co.jp/articles/99d7cdfdc51320dd24c6f218163eac8f6b3a0f3c,1/12(月) 6:31
