scrp_date,scrp_time,genre_en,genre_jp,rank,media_jp,title,comment,link,date_original
2026-01-12,08:08,world,国際,1,週プレNEWS,中国が日本に仕掛ける経済制裁「限日令」。生き残りをかけた日本が進めるべき産業戦略とは？,97,https://news.yahoo.co.jp/articles/536ae20df096f86db7423e708f4ad130ad7f8368,1/12(月) 6:30
2026-01-12,08:08,world,国際,2,日テレNEWS NNN,【解説】「力こそ正義」トランプ大統領の思惑は……ベネズエラへの軍事攻撃　政権内から異論も,79,https://news.yahoo.co.jp/articles/7f4df3e88ea351b9942b90205d5ddfa7dfbf876c,1/11(日) 19:44
2026-01-12,08:08,world,国際,3,ロイター,インタビュー：日中関係悪化の長期化懸念、衆院選「風頼み」の候補は苦戦＝石破前首相,70,https://news.yahoo.co.jp/articles/857052d2ef6beb78c3e17b01902c065ac0953d97,1/12(月) 7:12
2026-01-12,08:08,world,国際,4,ハンギョレ新聞,日本人の５７%「韓国との防衛協力、米国に次いで日本の安全に役立つ」,52,https://news.yahoo.co.jp/articles/27a02baae2a78d07cc78ef5e721fc7c1720a2800,1/12(月) 7:19
2026-01-12,08:08,world,国際,5,TBS NEWS DIG Powered by JNN,中国が“日本狙い撃ち”の輸出規制…「あらゆる物に入っている」レアアース対象なら日本経済はどうなる?【サンデーモーニング】,48,https://news.yahoo.co.jp/articles/00442fa567d687444a4ba9693041538e9087af45,1/11(日) 15:17
2026-01-12,08:08,world,国際,6,ロイター,吉村・維新の会代表、冒頭解散「驚きない」　高市氏とのやり取り明かす,43,https://news.yahoo.co.jp/articles/894b31e4016e5697688cbf912e84593dd23332d0,1/11(日) 9:50
2026-01-12,08:08,world,国際,7,時事通信,キューバ大統領「指図受けない」　トランプ氏要求に反発,42,https://news.yahoo.co.jp/articles/7f60220911b707bdfb9b59763d441bb4d6954cb6,1/12(月) 6:45
2026-01-12,08:08,world,国際,8,文春オンライン,女子高生の映像に「琉球を中国に返して」と“ウソの字幕”が加えられ…SNSに蔓延する「中国産フェイク動画」の“あまりにも粗悪な実態”,40,https://news.yahoo.co.jp/articles/60ba06b9025f91bee4a28d543fd53ce3409b2e45,1/11(日) 17:12
2026-01-12,08:08,world,国際,9,ハンギョレ新聞,「限日令」で日本から韓国へと航路を変えた中国のクルーズ船…仁川港の入港２倍に,37,https://news.yahoo.co.jp/articles/f3208b7d2c19db3153d70dfdb81e772f3b014c08,1/12(月) 6:49
2026-01-12,08:08,world,国際,10,CNN.co.jp,トランプ氏、グリーンランド領有へ「強硬手段」も　穏当な取引できなければ,34,https://news.yahoo.co.jp/articles/3efb6f64e8cd255b4b3748958494b1abb2b2d461,1/11(日) 14:23
2026-01-12,08:08,world,国際,11,Wedge（ウェッジ）,「戦争を終わらせる」と言ってたトランプがなぜ？トランプのベネズエラ攻撃への狙いと誤算、次なる一手はあるのか,33,https://news.yahoo.co.jp/articles/07b7429c3e88b7de88e27f0794275a1f919ffcd3,1/12(月) 5:00
2026-01-12,08:08,world,国際,12,Wedge（ウェッジ）,中国に遅れをとれば取り返しがつかない！米議会が見せた危機感、超党派の年次報告書が示した軍事・技術・経済力急伸への懸念,31,https://news.yahoo.co.jp/articles/a2bede720aa3bbc91c0e9e442e0d15cde8f8c8b5,1/12(月) 5:00
2026-01-12,08:08,world,国際,13,読売新聞オンライン,トランプ大統領「手遅れになる前に取引することを強く提案する」「キューバには石油も資金も一切渡さない」,29,https://news.yahoo.co.jp/articles/1c90427b9634a3943e21fbe09e2a9bfdecae531d,1/12(月) 0:40
2026-01-12,08:08,world,国際,14,テレビ朝日系（ANN）,「ハメネイ師が避難準備か」憶測広がる　年末年始に輸送機が“金運んだ”情報も,29,https://news.yahoo.co.jp/articles/4164df30b342f4851262c296f52b0e1e8490cb10,1/11(日) 22:00
2026-01-12,08:08,world,国際,15,日テレNEWS NNN,トランプ大統領、キューバに警告「手遅れになる前に取引を」,27,https://news.yahoo.co.jp/articles/00215c37648beb9a15a3c94085a34b0881d22036,1/12(月) 6:13
2026-01-12,08:08,world,国際,16,ＡＦＰ＝時事,移民取り締まりへの抗議、全米規模に ICE発砲で女性死亡,24,https://news.yahoo.co.jp/articles/58fffd776e28feb211d8c45b593055cd52451455,1/11(日) 11:31
2026-01-12,08:08,world,国際,17,ハフポスト日本版,米ICEに射殺された女性の妻が声明を発表「太陽のような存在だった」。3児の母で子どもを学校に送った後に射殺される,23,https://news.yahoo.co.jp/articles/385232c9ba8201ebb5b507f404f6bddbb3a4cdb1,1/11(日) 20:40
2026-01-12,08:08,world,国際,18,KOREA WAVE,北朝鮮が公開した無人機は中国の「Skywalker Titan 2160」…「軍需品ではない」,21,https://news.yahoo.co.jp/articles/a1ec25ad9bfd0acc8ca0541fb3223a41a7863b29,1/12(月) 7:03
2026-01-12,08:08,world,国際,19,中央日報日本語版,「グリーンランドに中ロの船舶がうじゃうじゃ？」…北欧、トランプ氏に突きつけた反論の証拠,20,https://news.yahoo.co.jp/articles/19d986f03a62ee3e8611c9e71a3953da90d5d255,1/12(月) 7:25
2026-01-12,08:08,world,国際,20,テレビ朝日系（ANN）,【中国レアアース規制か】軍民両用品7品目で“輸出管理の厳格化”産業に打撃懸念は,20,https://news.yahoo.co.jp/articles/1d0e55691a1b91b99c174db8ea84f9309e2656dd,1/11(日) 22:13
2026-01-12,08:08,world,国際,21,ハフポスト日本版,トランプ大統領は「一線越えた」「地球規模の気候変動対策に打撃」。米国の、IPCCなど66の国際機関・条約の脱退に批判相次ぐ,17,https://news.yahoo.co.jp/articles/143646a5f9338b5cdf5e20e24d473e356d200273,1/11(日) 16:03
2026-01-12,08:08,world,国際,22,TBS NEWS DIG Powered by JNN,“帝国主義の復権”か... アメリカ・ロシア・中国の「力による現状変更」で世界が直面するリスクとは【サンデーモーニング】,16,https://news.yahoo.co.jp/articles/21a530de6131fb17d8108f05c688cef0b800f695,1/11(日) 15:30
2026-01-12,08:08,world,国際,23,KOREA WAVE,少量のハンドクリームはマナー違反？…韓国「香りにこだわるカフェ」が香りNGで客に退店要求,15,https://news.yahoo.co.jp/articles/dbce055b24e67c5dd45054a7667df7afed133bce,1/12(月) 7:12
2026-01-12,08:08,world,国際,24,ハフポスト日本版,トランプの“ヒトラー風”雑誌表紙に反響。「原油の口ひげ」でベネズエラ攻撃を批判,14,https://news.yahoo.co.jp/articles/c2d62ef62a142a682ca13f34d755c85cb8f81753,1/12(月) 7:01
2026-01-12,08:08,world,国際,25,中央日報日本語版,韓国の1人当たりGDP、22年ぶりに台湾に逆転許す…今年はさらに格差拡大か,14,https://news.yahoo.co.jp/articles/891c8651fd2ca77750a8236ea54753d345286631,1/12(月) 6:52
2026-01-12,08:08,world,国際,26,FNNプライムオンライン（フジテレビ系）,イラン当局に国連事務総長が非難の声明「暴力と過剰な武力行使に衝撃」　当局の鎮圧で多数の死傷,14,https://news.yahoo.co.jp/articles/a94043f94d964d0347ebd33f226e3ff5c35143c5,1/12(月) 5:54
2026-01-12,08:08,world,国際,27,文春オンライン,なぜ中国のプロパガンダは「低クオリティのゴミ動画」ばかりなのか？ “沖縄は中国領土”フェイク動画の背景に潜む「身も蓋もない現場事情」,13,https://news.yahoo.co.jp/articles/3d74bf076dd92b93d3255b4375df18311fee42c9,1/11(日) 17:12
2026-01-12,08:08,world,国際,28,共同通信,キューバに代わって米軍が守るとトランプ氏,13,https://news.yahoo.co.jp/articles/93dd37f672a8a3951cda1faca5b72c8605446e55,1/11(日) 22:16
2026-01-12,08:08,world,国際,29,共同通信,トランプ氏、キューバに圧力強化　「手遅れになる前に取引を」勧告,13,https://news.yahoo.co.jp/articles/206efaece90e1d11f89e24d0463ac61d805f1ff4,1/12(月) 3:08
2026-01-12,08:08,world,国際,30,クーリエ・ジャポン,マドゥロ自慢のロシア製防空システムはなぜあれほど“ポンコツ”だったのか,12,https://news.yahoo.co.jp/articles/4518d4165a4eceab48d50d604fbbdae8626e4952,1/11(日) 12:45
2026-01-12,08:08,world,国際,31,産経新聞,トランプ氏、グリーンランド領有意向の背景とは…中露、北極圏に伸ばす触手　希土類も注目,12,https://news.yahoo.co.jp/articles/8f67d0cec13b42b3d864c8ddbaaf435f2dc14077,1/11(日) 20:00
2026-01-12,08:08,world,国際,32,TBS NEWS DIG Powered by JNN,移民当局職員の発砲めぐり全米各地で抗議活動・大規模デモも予定、トランプ政権の強硬な移民政策の是非問う声広がる,12,https://news.yahoo.co.jp/articles/7c0bd98a9a3d63914502b01f341ba1371b9b3fe6,1/12(月) 6:07
2026-01-12,08:08,world,国際,33,共同通信,欧州、グリーンランドへ派兵協議　中国やロシアから防衛と報道,12,https://news.yahoo.co.jp/articles/d8b0370159a73bfd1008a2495ed0065b3b42746b,1/11(日) 11:09
2026-01-12,08:08,world,国際,34,AP通信,北が韓国のドローン撃墜と発表　「必ず代償を払わされる」と警告,11,https://news.yahoo.co.jp/articles/d88b8793ef7d7f55a789cb2545156185eb2bcc25,1/11(日) 15:20
2026-01-12,08:08,world,国際,35,テレビ朝日系（ANN）,米がイランの非軍事施設も標的検討か　反政府メディア報道“デモ犠牲者推定2000人超”,11,https://news.yahoo.co.jp/articles/e4b34afcdf0a9935ee270217719442541ac8b4a9,1/11(日) 18:52
2026-01-12,08:08,world,国際,36,中央日報日本語版,イランのデモ激化で62人死亡…経済難に怒る民心が飛び出した,11,https://news.yahoo.co.jp/articles/7862f1917837c0ca0676b7a2217bc587b7c42e33,1/11(日) 11:20
2026-01-12,08:08,world,国際,37,毎日新聞,＜1分で解説＞中国のレアアース輸出規制、日本企業に影響は,11,https://news.yahoo.co.jp/articles/40c72272d17838df1df77c81a3bff6107743ec20,1/11(日) 13:30
2026-01-12,08:08,world,国際,38,時事通信,キューバに取引要求　トランプ氏「手遅れになる前に」,11,https://news.yahoo.co.jp/articles/7887de56b9ddfa0f21473746df3d1a2d220ff3a4,1/11(日) 22:23
2026-01-12,08:08,world,国際,39,TBS NEWS DIG Powered by JNN,「脅威の客観的兆候あれば行動」イラン国会議長 先制攻撃の可能性示唆、反政府デモ拡大 米が軍事介入辞さない構え,11,https://news.yahoo.co.jp/articles/eabdeb0bbc18194517060a04f3e11775bb318fa8,1/12(月) 1:25
2026-01-12,08:08,world,国際,40,テレビ朝日系（ANN）,【移民捜査官が女性射殺】全米史上最大の抗議活動“分断加速”過剰な捜査と政権非難,10,https://news.yahoo.co.jp/articles/2128aeb8d7aeb29f8bb42d68912656060765cf0a,1/11(日) 22:24
