scrp_date,scrp_time,genre_en,genre_jp,rank,media_jp,title,comment,link,date_original
2024-02-26,18:19,life,ライフ,1,弁護士ドットコムニュース,業績悪化でオフィス移転、トイレが「男女共用」…困惑する女性たち、便座が上がっていると「絶望しかない」,177,https://news.yahoo.co.jp/articles/0a2b8f497f2175551b180cb52707cdef133df807,2/26(月) 10:25
2024-02-26,18:19,life,ライフ,2,nippon.com,『セクシー田中さん』ドラマの原作改変、悲劇の背景を考える,34,https://news.yahoo.co.jp/articles/5fa1de119d862a756b001cb2b7565348a856e0ea,2/26(月) 15:28
2024-02-26,18:19,life,ライフ,3,まいどなニュース,働く人の心を蝕むパワハラ標語、堂々と掲示する企業にびっくり「社員全員深海魚みたいな顔色」,26,https://news.yahoo.co.jp/articles/9db7225280559a1249e930638b081eb7788d93d8,2/26(月) 6:50
2024-02-26,18:19,life,ライフ,4,まいどなニュース,ひとめぼれ買いされ飼育放棄された「猫」の治療費4ヶ月で100万円超！←「大変アピールですか？」最期まで愛せないなら飼わないで！,22,https://news.yahoo.co.jp/articles/80233baa649adec5ff3ef49347e6eede3d6bfe62,2/26(月) 7:35
2024-02-26,18:19,life,ライフ,5,まいどなニュース,人を雇うのは難しい！「大学卒」「パソコンを使える」…条件満たす人口割合が驚愕の事実,21,https://news.yahoo.co.jp/articles/3423e7e3834b6b805b008bb5de4fbbf779d8068c,2/26(月) 7:10
2024-02-26,18:19,life,ライフ,6,婦人公論.jp,開業医は儲かる？資金繰り、スタッフの雇用、大学病院の医師との違いは…。ヤンデル先生が読む『開業医の正体』,16,https://news.yahoo.co.jp/articles/c707cb8697b06acd1e0ac8e8545ed4a59afab717,2/26(月) 6:32
2024-02-26,18:19,life,ライフ,7,yoi,水原希子さん、幼少期の葛藤から「毎日泣くほどつらかった」モデル時代の挫折を告白,15,https://news.yahoo.co.jp/articles/edb752b8c59da8118cd738f28ddc53e0f2b7e707,2/25(日) 20:00
2024-02-26,18:19,life,ライフ,8,歴史人,なぜアメリカは「民主主義の兵器工場」となり、護衛空母を量産したのか？,13,https://news.yahoo.co.jp/articles/622da3e0dc41b7272fd4433db2ada4ff9e7da464,2/26(月) 16:30
2024-02-26,18:19,life,ライフ,9,プレジデントオンライン,最高時速約1700kmで人間も建物、海、地面も吹っ飛ぶ…地球が自転を急停止させた瞬間に起こる科学現象,13,https://news.yahoo.co.jp/articles/f4efb12c06ee4ab9c7190c5bce84cb7b183a5e45,2/26(月) 11:17
2024-02-26,18:19,life,ライフ,10,with online,「家事代行」はなぜ普及しない？ 実際に使ってみて分かったメリット・デメリット,13,https://news.yahoo.co.jp/articles/b3f2e525505cd65993614e6a462bdaa8e95ffc21,2/26(月) 11:20
2024-02-26,18:19,life,ライフ,11,まいどなニュース,背後から突然、目隠しされ…聴覚障害の女性が語る性被害の絶望「体の一部である補聴器外れて何も聞こえなくなった」,12,https://news.yahoo.co.jp/articles/64f3003acaa757526c2b26dce178742866d21862,2/26(月) 7:00
2024-02-26,18:19,life,ライフ,12,ダイヤモンド教育ラボ,難関大合格者は、3年で4218時間も勉強！一刻も早く勉強し始めるべき7つの理由,12,https://news.yahoo.co.jp/articles/021cab4c652f0c9d9c9a1f306d663099c1e4dc76,2/26(月) 14:27
2024-02-26,18:19,life,ライフ,13,介護ポストセブン,認知症を患う親の介護施設問題「認知症＜可＞の施設から入所を断られた」事例と対処法を専門家が解説,12,https://news.yahoo.co.jp/articles/c0ca35995896cb961cbe615f985919bd2d95b90f,2/26(月) 16:10
2024-02-26,18:19,life,ライフ,14,with online,ついに慶應経済学部も推薦導入！ 大学一般入試の枠が減り続ける今、中学受験に挑む親子の選択が激変!?,12,https://news.yahoo.co.jp/articles/014484cf92ae1397be9827e15f16d9fbc80823a2,2/26(月) 11:10
2024-02-26,18:19,life,ライフ,15,ラジトピ　ラジオ関西トピックス,関西人のソウルフード？　『粉もの』おかずに白ご飯　「量的に無理」←なし派からは現実的な意見も,11,https://news.yahoo.co.jp/articles/694575818a5b8db0cd7dd29b77ba732a41c5989f,2/26(月) 18:00
2024-02-26,18:19,life,ライフ,16,THE GOLD ONLINE（ゴールドオンライン）,「年金繰下げ」の落とし穴…70歳からの受給で「月6万円増」のはずが…71歳おひとりさま男性「結局手取りが減った」の大失敗【CFPが解説】,11,https://news.yahoo.co.jp/articles/63c80f78500daff0b994e779affa4a31ddd9749a,2/26(月) 11:32
2024-02-26,18:19,life,ライフ,17,まいどなニュース,社会人の7割弱「学歴社会に賛成」と回答…「適応力の判断材料になる」「学歴のために頑張った経験がある」,11,https://news.yahoo.co.jp/articles/bf46d3a4e8a0bd625b4f0b04cc3665eae97ad3b1,2/25(日) 20:50
2024-02-26,18:19,life,ライフ,18,LIMO,会社の同僚に送った業務連絡LINEでうっかりミス　「あまりにも高貴な誤変換」に笑ってしまう,9,https://news.yahoo.co.jp/articles/9e3a90aff88c3646c634a38bfab0add9f2e47441,2/26(月) 17:22
2024-02-26,18:19,life,ライフ,19,まいどなニュース,おばあさん「家まで送ってくれませんか？」→「いいよ、乗って乗って！」優しさと感謝の詰まった話にSNS感動　実は「沖縄ではよく聞く話」ですと,9,https://news.yahoo.co.jp/articles/5569558208cd66cfacaf6a3582392b298542d26a,2/26(月) 17:10
2024-02-26,18:19,life,ライフ,20,ウォーカープラス,上司に「了解しました」はNG！「承知しました、だろ？」言い直せと言われたが…本音が言葉になって現れた!?【作者に聞く】,9,https://news.yahoo.co.jp/articles/8f5c6de65b391579ea0a9a8279d4b5a181078869,2/26(月) 10:00
2024-02-26,18:19,life,ライフ,21,Pen Online,“二重に絡み合う”観覧車！惑星にヒントを得た斬新デザインの新名所、ソウルに誕生へ,9,https://news.yahoo.co.jp/articles/1f59e2b731d5934d78788fb94d4c02d90a07188c,2/26(月) 13:04
2024-02-26,18:19,life,ライフ,22,現代ビジネス,医療ミス訴訟は「圧倒的に患者が不利」だって…？ 「医者で弁護士」が語る「ヤバい医者」から身を守る７つの方法,8,https://news.yahoo.co.jp/articles/c1e600b5eda40426a140e6764c02079fa845bf5e,2/26(月) 7:03
2024-02-26,18:19,life,ライフ,23,ねとらぼ,【関東在住者が選ぶ】一番おいしいと思う「定食チェーン」ランキング！　2位は「やよい軒」、1位は？,7,https://news.yahoo.co.jp/articles/36baefe2541a88d3a5dae2d4c8345e70ee99c7b8,2/26(月) 17:30
2024-02-26,18:19,life,ライフ,24,Hint-Pot,祖母の“ど直球”結婚理由「顔がいいから」　102歳で亡くなった祖父は「今でも通用するイケメン」,7,https://news.yahoo.co.jp/articles/c92ed6d7cd2777217b6a60df81d35098809dbaa1,2/26(月) 17:07
2024-02-26,18:19,life,ライフ,25,ねとらぼ,10人目妊娠中の妻、出張に行く夫から突然「疲れた時は冷凍庫を開けて」とLINEがとどき……　優しいサプライズが140万再生,7,https://news.yahoo.co.jp/articles/e7be97cee64871e5c2459686739100910d9d5a90,2/25(日) 22:00
2024-02-26,18:19,life,ライフ,26,Hint-Pot,「なんといっても揺れない」　“日本の裏側”からやってきた外国人が心を奪われた乗り物とは,7,https://news.yahoo.co.jp/articles/18c88a595bec3dd12e70d9871382609ae7c29707,2/26(月) 8:10
2024-02-26,18:19,life,ライフ,27,AERA dot.,ローカル線を残すには？　「『公』が支えない鉄道は日本だけ」専門家に聞く必要なこと,7,https://news.yahoo.co.jp/articles/015486e54da1edfabca132a85ee106aea3ed57bc,2/26(月) 16:31
2024-02-26,18:19,life,ライフ,28,ラジトピ　ラジオ関西トピックス,弁当や寿司でおなじみ「魚型の醤油容器」　名前はなんていう？　なぜ魚のカタチ？　開発元に聞いてみた,7,https://news.yahoo.co.jp/articles/a9d1052ab399410180cd97e0d077090c216ddec6,2/26(月) 8:30
2024-02-26,18:19,life,ライフ,29,Hint-Pot,「スイスにはないなんて…」　日本でなじみのスイーツ　中欧生まれの男の子が生まれて初めて食べたら…反応が話題に,7,https://news.yahoo.co.jp/articles/2b40d89ae2a6be04cc2e824cf9d90401f7fedec9,2/26(月) 13:20
2024-02-26,18:19,life,ライフ,30,ファイナンシャルフィールド,毎日30分のゆっくりシャワーでリラックスしています。ガス代・水道代はどのくらいになるでしょうか？,6,https://news.yahoo.co.jp/articles/615dff12352af731636f71f72f4f1e9537419945,2/25(日) 18:50
2024-02-26,18:19,life,ライフ,31,THE GOLD ONLINE（ゴールドオンライン）,仕事内容は“ほぼ同じ”でも、月収は「約5万円」違う…看護師と准看護師の「給与格差」に隠された理由【医師が解説】,6,https://news.yahoo.co.jp/articles/4678ecb1929c155781faead66f7bf2daac72c990,2/26(月) 11:02
2024-02-26,18:19,life,ライフ,32,産経新聞,高齢化、コロナ禍、災害…苦境にあえぐ日本の伝統工芸　「総裁」佳子さまのご活動に期待も,6,https://news.yahoo.co.jp/articles/8c11d2a7ea87f3cf4f8e0bb7cc72618001714ad3,2/26(月) 8:10
2024-02-26,18:19,life,ライフ,33,よろず～ニュース,大河『光る君へ』藤原道長と倫子の結婚話 倫子の父・源雅信が喜ばなかった意外な理由　識者が語る,6,https://news.yahoo.co.jp/articles/081589f24e3c8c398d2901922f46de994cda2b22,2/26(月) 14:00
2024-02-26,18:19,life,ライフ,34,8760 by postseven,【コンビニ飯を調査】太りにくいのはどっち？ホットドッグと焼きそばパン、ビーフカレーと焼肉弁当…管理栄養士がジャッジ,6,https://news.yahoo.co.jp/articles/3c856f6fd53f799aeb70e4595022ecb9082618fa,2/26(月) 16:00
2024-02-26,18:19,life,ライフ,35,AERA dot.,「お金をたくさん集められる政治家ほど良い政治ができる？　アップデートなき政治家脳」稲垣えみ子,5,https://news.yahoo.co.jp/articles/01c25c15db8ab86de744347a2df7fa28f83a0cce,2/26(月) 17:32
2024-02-26,18:19,life,ライフ,36,まいどなニュース,飼い主さんが猫を「触診した結果→可愛い」という診断に！？　「医師免許いりませんね」「正しい診断」,5,https://news.yahoo.co.jp/articles/55d7ef6257e07956b419d9654bf65cf35343527f,2/26(月) 17:40
2024-02-26,18:19,life,ライフ,37,まいどなニュース,猫ミームそっくり猫見つかる 「はぁ？」って言いそう「めちゃくちゃ似てる」 どんな猫？投稿主に聞いた,5,https://news.yahoo.co.jp/articles/62179ad091b3cde317111fd61addb1bf70faba53,2/26(月) 16:04
2024-02-26,18:19,life,ライフ,38,歴史人,【ここまで変わった！日本中世史】「源平合戦」は存在しなかった!?　国を揺るがした戦乱の真相,5,https://news.yahoo.co.jp/articles/e1181f9bba92aea97ed0f043bf0e60585513480b,2/26(月) 16:30
2024-02-26,18:19,life,ライフ,39,LASISA,羽生結弦のオリジナルフォトブック！今年も「雪肌精みやび」から「凛」と「華」2種類の“ゆづ”,5,https://news.yahoo.co.jp/articles/9cd969923c88c912936f39ba9759b7d561f435c8,2/26(月) 14:10
2024-02-26,18:19,life,ライフ,40,まいどなニュース,タヌキ顔でしっぽはキツネ　左目を失った元野犬　ハンデ負けずに第二の犬生を目指しています,5,https://news.yahoo.co.jp/articles/6279e39bcd3197f0e1c9b51601005cd4d731c78d,2/26(月) 15:30
