scrp_date,scrp_time,genre_en,genre_jp,rank,media_jp,title,comment,link,date_original
2024-03-12,15:23,sports,スポーツ,1,東スポWEB,【春場所】伯桜鵬　連勝後に２日連続の注意　問われる宮城野親方の〝指導力〟,89,https://news.yahoo.co.jp/articles/6afd7cc3242a5f5a9d91afb24c1668a84c2bf380,3/12(火) 6:16
2024-03-12,15:23,sports,スポーツ,2,Full-Count,ロッテ、藤原恭大の右膝骨折を発表　自打球で途中交代…プロ6年目は厳しいスタート,74,https://news.yahoo.co.jp/articles/e6209a5d999eea419a22166f6a9f15700df184d4,3/12(火) 11:32
2024-03-12,15:23,sports,スポーツ,3,SOCCER DIGEST Web,「無い。何があっても無い」北澤豪がフランスW杯直前の岡田監督からのメンバー落ち宣告を激白！,63,https://news.yahoo.co.jp/articles/e368b339763dd8292594365b3322ea0708478e2a,3/12(火) 7:41
2024-03-12,15:23,sports,スポーツ,4,FRIDAY,弟子の不祥事で部屋閉鎖の宮城野親方　貴乃花親方よりキツい“締め出し”で早まる「相撲界を去る日」,54,https://news.yahoo.co.jp/articles/06283bd84d479fc0ed51a7a7a02193d690d2eccd,3/12(火) 8:00
2024-03-12,15:23,sports,スポーツ,5,日刊ゲンダイDIGITAL,元横綱・白鵬の凄まじい嫌われっぷり…理事長どころか理事すら絶望的の自業自得,51,https://news.yahoo.co.jp/articles/9be5621a71cb34c6c1758e51577824374238c2f1,3/12(火) 9:06
2024-03-12,15:23,sports,スポーツ,6,サンケイスポーツ,セ・パ両リーグがエスコン問題受け球場ルール改正　本塁からバックネットまで１４メートル未満はＮＧなど,48,https://news.yahoo.co.jp/articles/1d42733eafaf75baf36faee9766b57ec8212533a,3/12(火) 7:30
2024-03-12,15:23,sports,スポーツ,7,東スポWEB,Ｊ１浦和〝暴徒化問題〟公開シンポジウムで…違和感を覚えたサポーターからの「指摘」,46,https://news.yahoo.co.jp/articles/655f4337fc433572dd8ed830b951c9732a6a10b3,3/12(火) 7:16
2024-03-12,15:23,sports,スポーツ,8,RONSPO,ボクシング界は許さない！逮捕されたヒロキングの問題を所属ジム亀田大毅会長が謝罪＆活動自粛表明もJBCは厳罰処分検討へ,43,https://news.yahoo.co.jp/articles/8b077e2b7547e07dc8a13c53204882e111db38fe,3/12(火) 11:01
2024-03-12,15:23,sports,スポーツ,9,NEWSポストセブン,阿部慎之助氏と原辰徳氏、巨人「新旧監督の不穏な隔たり」原・前監督はキャンプに姿を現さず“野球以外のこと”に没頭,43,https://news.yahoo.co.jp/articles/64cbaad519d7fc7d3a4e81ff319c06934661a379,3/12(火) 7:15
2024-03-12,15:23,sports,スポーツ,10,デイリースポーツ,ロッテ痛恨　藤原恭大が右膝骨折で開幕絶望的　１０日に自打球直撃　１８年ドラ１、飛躍期待の６年目,39,https://news.yahoo.co.jp/articles/b51b8136ffd3ffe24daed630b2f8dec845d6bd35,3/12(火) 11:37
2024-03-12,15:23,sports,スポーツ,11,東スポWEB,シントトロイデン鈴木彩艶　海外メディアそろって酷評「責任はキャッチングミス」,36,https://news.yahoo.co.jp/articles/7d0779880944d1b1ec036ad8bb94d17cbfc07dcd,3/11(月) 17:56
2024-03-12,15:23,sports,スポーツ,12,日刊ゲンダイDIGITAL,岡田阪神に問題山積…湯浅の二軍落ちでくすぶる「内紛の火種」「パッとしない新人投手」「優勝ボケ」,36,https://news.yahoo.co.jp/articles/42b9432acfd932f14b9c734f77a566d369464795,3/12(火) 9:06
2024-03-12,15:23,sports,スポーツ,13,J-CASTニュース,"佐々木朗希「メジャー挑戦」には何が""足りない""のか　「まだまだ未完成」指摘の要因",35,https://news.yahoo.co.jp/articles/b345f4164f8448229b8a0cb8d11d1c6ee6a77167,3/12(火) 12:26
2024-03-12,15:23,sports,スポーツ,14,ABEMA TIMES,批判殺到！「退場させろ」「ありえねえだろ」倒れた相手を蹴りつける超問題シーン　審判がブチギレ！ファンも呆れた危険行為に問答無用でイエローカード2枚出し,35,https://news.yahoo.co.jp/articles/0d72118dd168c5bf56a7a1f1eeaecfedb9470225,3/12(火) 7:06
2024-03-12,15:23,sports,スポーツ,15,デイリースポーツ,タレントからのＢＤ批判に怒りの投稿　例えの訂正受けＢＤ選手が謝罪「生意気な口聞いて申し訳ございませんでした」,29,https://news.yahoo.co.jp/articles/2f5a5184d14818baf84fda13f1601d2a58576eaa,3/11(月) 15:47
2024-03-12,15:23,sports,スポーツ,16,NEWSポストセブン,《大谷翔平結婚》「お母さんにそっくり」お相手年下女性の“家族思いな素顔”「将来の夢はお母さん」「尊敬する人は兄」,27,https://news.yahoo.co.jp/articles/aa6d1c6c84d894617372bd2171ecb2a174c756e8,3/12(火) 7:15
2024-03-12,15:23,sports,スポーツ,17,中日スポーツ,ヤクルトに大誤算…小川泰弘コンディション不良で今後のスケジュール白紙、中日との開幕戦登板は厳しい状況に,26,https://news.yahoo.co.jp/articles/27ee61b5347eca29e4ebe34ffe5d360d0ee89dab,3/12(火) 14:33
2024-03-12,15:23,sports,スポーツ,18,スポニチアネックス,パリ五輪マラソン代表争い決着　MGCの改善点は…ペースメーカーも物議　補欠選出方法も一考必要か,26,https://news.yahoo.co.jp/articles/53ca9e642126939ffb627cd7d435a3b238716855,3/12(火) 11:55
2024-03-12,15:23,sports,スポーツ,19,スポニチアネックス,楽天　山田遥楓が支配下登録　新天地の楽天でも持ち前の明るさでムードメーカー！1軍活躍に期待,25,https://news.yahoo.co.jp/articles/eefc9dd2164b6118c3eaddff1332993d219f64fe,3/12(火) 9:53
2024-03-12,15:23,sports,スポーツ,20,SOCCER DIGEST Web,「逆にうれしかった」北澤豪はW杯メンバー落選直後、タクシー運転手の鋭い意見になぜ喜んだ？,25,https://news.yahoo.co.jp/articles/c423b98a28e12735ed0315b3d1bbe5fd8f734706,3/12(火) 13:10
2024-03-12,15:23,sports,スポーツ,21,THE ANSWER,卓球日本まで飲み込んだインドの猛威、中国メディアも再び警戒「特殊な打法は軽視すべきでない」,24,https://news.yahoo.co.jp/articles/f53c8b9313ad6b04fe2f576689c627006cfb374d,3/12(火) 9:16
2024-03-12,15:23,sports,スポーツ,22,FOOTBALL ZONE,W杯予選・日本×北朝鮮の平壌開催が正式決定　2011年11月以来13年ぶりの平壌で公式戦へ,24,https://news.yahoo.co.jp/articles/a40e822d30f0aa6b07ea397b4ed01eac85498ec6,3/11(月) 18:36
2024-03-12,15:23,sports,スポーツ,23,スポニチアネックス,森保ジャパン　26日敵地・北朝鮮戦が平壌開催で決定!北朝鮮での試合は13年ぶり＆過去4戦未勝利,23,https://news.yahoo.co.jp/articles/c91bcb6a7bc4b8ac288339b10c13375a86111a5f,3/11(月) 18:54
2024-03-12,15:23,sports,スポーツ,24,サンケイスポーツ,東大に甲子園４強左腕…国学院久我山高・松本慎之介さんが合格,22,https://news.yahoo.co.jp/articles/a15e9b0da79769b041fd2407a4690d61447176c2,3/12(火) 14:10
2024-03-12,15:23,sports,スポーツ,25,CoCoKARAnext,やはりただものではなかった？ 打率4割超えと快進撃続く巨人ドラ3佐々木俊輔に「適任な打順」は？「三方よし」と言われる理由とは,22,https://news.yahoo.co.jp/articles/3c0157ae00101d0cb4d5cc9686bcbb5efd0346ff,3/12(火) 13:12
2024-03-12,15:23,sports,スポーツ,26,Full-Count,ダルビッシュ、2年ぶり4度目の開幕投手に決定　山本由伸は第2戦デビュー…MLB発表,21,https://news.yahoo.co.jp/articles/6edf5525311ff949940c7a8a5553903a835bf374,3/12(火) 1:00
2024-03-12,15:23,sports,スポーツ,27,CoCoKARAnext,OP戦打率1割と低調…巨人新助っ人オドーアへの「疑念」は阿部新体制の“目玉構想”の不安材料に,21,https://news.yahoo.co.jp/articles/a3d2d71ef4bea95bbd4e0175ea73a3e74f41724c,3/12(火) 6:05
2024-03-12,15:23,sports,スポーツ,28,スポニチアネックス,肥後光また受難…前相撲で土俵下に落下し救急搬送　今場所から土俵下常駐の救命士が初出動,21,https://news.yahoo.co.jp/articles/27642e6e12754628eb0c31b9ca87c2d544cf83e7,3/12(火) 12:03
2024-03-12,15:23,sports,スポーツ,29,FITNESS LOVE,「悪いのは洋服じゃなくて私の体型」　46歳で奮起し3カ月で10kg減→50歳でボディコンテスト活躍中,21,https://news.yahoo.co.jp/articles/1606036e0727ceb8d0cc90a7c76d6e9e61927ffd,3/12(火) 7:10
2024-03-12,15:23,sports,スポーツ,30,スポニチアネックス,元NPB審判員　「岡田ルール」MLB導入は映像による判定検証拡大が要因　今後新たな「逆輸入」あり得る,20,https://news.yahoo.co.jp/articles/0c73eb9698b8f58e4948f1537e8e797a6c35fc00,3/12(火) 2:30
2024-03-12,15:23,sports,スポーツ,31,デイリースポーツ,放映権高騰化のサッカー　北朝鮮戦はテレビ中継ある？ファンがやきもき「お金なら自民党にある！」「俺も少しなら払える」２６日に平壌開催が正式決定,20,https://news.yahoo.co.jp/articles/fe330c61da897bbccd49162a593334e7596a6907,3/11(月) 19:15
2024-03-12,15:23,sports,スポーツ,32,スポニチアネックス,KWORLD3ジムの亀田大毅会長　所属選手の逮捕を謝罪「深くお詫び申し上げます」,19,https://news.yahoo.co.jp/articles/0cf6aea4c849eddb5a16291d5947d08c3273063a,3/12(火) 13:43
2024-03-12,15:23,sports,スポーツ,33,FOOTBALL ZONE,鈴木彩艶は「呼ばないとダメ」　日本代表OBが見た3月シリーズで起用すべきGKは？【見解】,19,https://news.yahoo.co.jp/articles/1e7ac4b757b46038701e269af56c835e2db4aec4,3/12(火) 6:50
2024-03-12,15:23,sports,スポーツ,34,TopNews,マルコ、今後について「“上司”と話をする」　レッドブルF1の騒動終結を訴えるホーナー代表、オーストラリアGPでの同行を拒否か？,19,https://news.yahoo.co.jp/articles/4ca279d6a632a4921aa9571cda87da2058f0a01c,3/12(火) 12:02
2024-03-12,15:23,sports,スポーツ,35,中日スポーツ,宮城野部屋、複数力士が引退の意向…苦悩の玉垣親方「残る者、残らない者を含めて私がそこまで踏み込めない」【大相撲】,19,https://news.yahoo.co.jp/articles/244aa82b0beb162de1859d7af0788ac2866cdad8,3/11(月) 19:10
2024-03-12,15:23,sports,スポーツ,36,CoCoKARAnext,【巨人】トレード敢行で注目集める「第3捕手の扱い」　実り多きといわれる理由とは,19,https://news.yahoo.co.jp/articles/1f2df1fcafb25983388e937051e3a393b9d4b305,3/12(火) 11:51
2024-03-12,15:23,sports,スポーツ,37,デイリースポーツ,阪神２軍　若虎打線がソフトバンクの和田から４得点　ドラ３山田が２安打　井上が先制適時二塁打を含む３安打,18,https://news.yahoo.co.jp/articles/f9276678c960206379a955c39955c4aeaabd3ac1,3/12(火) 14:25
2024-03-12,15:23,sports,スポーツ,38,中日スポーツ,中日・高橋周平、OP戦初打席で右前にヒット 木下の右前打で本塁へ執念ヘッスラ！先制点もぎ取る,18,https://news.yahoo.co.jp/articles/8cb22d091cf9f0356c33e912fef91ccf5be6a972,3/12(火) 13:35
2024-03-12,15:23,sports,スポーツ,39,産経新聞,オープン戦9戦全敗に虎党やきもき　攻守に不安露呈の岡田阪神は本当に大丈夫なのか　「鬼筆」越後屋のトラ漫遊記,18,https://news.yahoo.co.jp/articles/ad8c2d572e75d7f89ac61442d5373eed6c547b27,3/12(火) 12:54
2024-03-12,15:23,sports,スポーツ,40,SOCCER DIGEST Web,またしても帰化選手を大量招集！ イバンコビッチ新政権が発足した中国代表に地元メディアは「行ける！」「大胆な決断を下した」と特大の期待,18,https://news.yahoo.co.jp/articles/10fee99c73b6ada6cc9d8decb89884087bccf088,3/12(火) 6:10
