scrp_date,scrp_time,genre_en,genre_jp,rank,media_jp,title,comment,link,date_original
2026-01-29,10:39,business,経済,1,読売新聞オンライン,ＮＹ市場で一時１ドル＝１５４円台に…ベッセント米財務長官、為替介入「絶対にしていない」発言で円売り・ドル買い広がる,124,https://news.yahoo.co.jp/articles/44168ca9545a32dd2ca73672044a507d1dae2034,1/29(木) 5:01
2026-01-29,10:39,business,経済,2,FNNプライムオンライン（フジテレビ系）,【解説】1ドル152円台に…円高どこまで進む?　日米協調介入のハードル高く…本格的反転は困難か,70,https://news.yahoo.co.jp/articles/7525668ad807b9e6d8d08b2e4357ec6c56417287,1/28(水) 17:33
2026-01-29,10:39,business,経済,3,テレビ朝日系（ANN）,フジテレビ、社員が情報漏洩　取材情報などを外部に… 懲戒解雇,66,https://news.yahoo.co.jp/articles/46c785f796973bed507b114cd6c42c2370bec243,1/28(水) 15:14
2026-01-29,10:39,business,経済,4,ダイヤモンド・オンライン,「消費税ゼロ」に世界が失望…政治家の人気取りで日本人が背負わされる“大きすぎる代償”,48,https://news.yahoo.co.jp/articles/0364afe16f52f25bcd94d24e59123abedbddad93,1/29(木) 6:00
2026-01-29,10:39,business,経済,5,ベストカーWeb,ようやく動いた自転車規制！　113違反の衝撃!!　「ながらスマホ」「右側通行」は徹底取締りできるのか,43,https://news.yahoo.co.jp/articles/2549f26cd39ce224df48a9d95fbfed55072f5474,1/29(木) 8:00
2026-01-29,10:39,business,経済,6,ファイナンシャルフィールド,生活保護受給中ですが月1万5000円の風呂・プール付きジムに通おうと思っています。毎日通えば光熱費を抑えられると思うのですが実際に節約効果はありますか？,39,https://news.yahoo.co.jp/articles/204f0d0214ce86341775ac56a70bd2f9591609d4,1/28(水) 17:10
2026-01-29,10:39,business,経済,7,読売新聞オンライン,全日空の国際線ダイヤ「週単位」など柔軟に設定へ、訪日客の増減に対応…現在は夏と冬の２種類,37,https://news.yahoo.co.jp/articles/6dd4a248cbea02521caf4514f4248ae220d12015,1/29(木) 5:00
2026-01-29,10:39,business,経済,8,マネーポストWEB,《元社員が内実告発》故障続発の「国産EVバス」、実態は中国メーカーが製造　「一部の工程を日本でやれば国産にできる」と強引に解釈、心臓部の重要な仕様変更も公にせず,37,https://news.yahoo.co.jp/articles/1137ba32870cac93d6037d81f4c1a013ca3e370d,1/29(木) 7:15
2026-01-29,10:39,business,経済,9,プレジデントオンライン,"習近平の大誤算で「爆買い消滅」…お金を使わなくなった中国人観光客が向かう""日本生まれの格安店""の名前",35,https://news.yahoo.co.jp/articles/7a84e3e878c89e1ce54dc4c66d11665cda12d98f,1/29(木) 6:15
2026-01-29,10:39,business,経済,10,テレビ朝日系（ANN）,【速報】ガソリン価格11週ぶりに上昇　イラン情勢の緊迫化で原油価格が高騰　円安も影響,34,https://news.yahoo.co.jp/articles/e1c5ca21834cca34bfaf47c34ee243049e5b27d8,1/28(水) 14:41
2026-01-29,10:39,business,経済,11,THE GOLD ONLINE（ゴールドオンライン）,「同年代の奴らより稼いでいる」と豪語した〈年収500万円〉25歳男性がハマったカード返済地獄。月11万返して元金5万しか減らず…“利息を払うマシーン”と化したワケ,32,https://news.yahoo.co.jp/articles/08aabf7e5b6e5fbc391955f5c50d6ad3b9d68411,1/29(木) 7:00
2026-01-29,10:39,business,経済,12,プレジデントオンライン,日本車が「遅れているから」ではない…技術は世界一なのに「完全自動運転」に踏み込まない日本らしい理由,31,https://news.yahoo.co.jp/articles/405907e60c53647522902414bcf9a48e88df068e,1/29(木) 8:15
2026-01-29,10:39,business,経済,13,共同通信,金価格、初の2万8千円突破　関税懸念で安全資産需要,27,https://news.yahoo.co.jp/articles/08e1619e678a3ace914b3ab53b8115397c57dc3e,1/28(水) 13:38
2026-01-29,10:39,business,経済,14,週プレNEWS,気が付けば新車販売台数国内2位！　スズキ「進撃」の秘密を解剖する,26,https://news.yahoo.co.jp/articles/a32b43cf4979bab2dd61369938307a856a755ac6,1/29(木) 7:34
2026-01-29,10:39,business,経済,15,ニューズウィーク日本版,日経の「高市政権の消費税減税はポピュリズム」批判は的外れ,26,https://news.yahoo.co.jp/articles/e9f92c4fc69a6d61bd50c02eab8efbd831978cea,1/28(水) 16:08
2026-01-29,10:39,business,経済,16,ITmedia ビジネスオンライン,インバウンドが押し寄せ、富裕層だけが旅行を楽しむ一方で……　庶民の「旅行離れ」まだまだ続きそうだと断言できるワケ,26,https://news.yahoo.co.jp/articles/1a4a90714c15989fa0712f66ab55c1e0644b1f46,1/29(木) 5:55
2026-01-29,10:39,business,経済,17,テレビ朝日系（ANN）,【速報】金価格　初の2万9000円超え　最高値更新　3万円の節目近づく,24,https://news.yahoo.co.jp/articles/93e1dd35a96139dfa0384e4ec79b2d7bf9a4d100,1/29(木) 9:57
2026-01-29,10:39,business,経済,18,文春オンライン,マック、モス、KFCに次ぐ4位もバーガーキングに奪われ…落日ロッテリアをゼッテリアにしたゼンショー新社長は東大→財務省のエリートだった,24,https://news.yahoo.co.jp/articles/7bf597c3ae694007adcd01c671be2724c170422a,1/29(木) 7:12
2026-01-29,10:39,business,経済,19,ロイター,金現物が5400ドル突破、最高値更新　地政学的不透明感受け,22,https://news.yahoo.co.jp/articles/8e349fd216b63a1c1c8e60ba70687f2d3f0cfc62,1/29(木) 7:56
2026-01-29,10:39,business,経済,20,ロイター,ＦＲＢが金利据え置き、インフレ「やや高止まり」　労働市場は安定,21,https://news.yahoo.co.jp/articles/79e1e8b745234bd56089f3e484cd316707387a9f,1/29(木) 4:11
2026-01-29,10:39,business,経済,21,週刊SPA!,“マイレージ改悪”が客離れを招いた「いきなり！ステーキ」の今。すき焼きに海鮮など、「脱ステーキ」を模索するも道半ば,20,https://news.yahoo.co.jp/articles/93a5c6347baac354d2f35b23a0f0c29f6a20dc14,1/29(木) 8:52
2026-01-29,10:39,business,経済,22,東洋経済オンライン,中国シャオミのEVで新たに2件の車両火災。責任の所在不明でも株価は一段安、4カ月で「11兆円」の時価総額消失,18,https://news.yahoo.co.jp/articles/c939211054231743d2ac229ab9eb666c61b1b84a,1/29(木) 6:00
2026-01-29,10:39,business,経済,23,ファイナンシャルフィールド,高校無償化を前提に私立を選んだのに、初年度100万円近い出費…。私立高校にかかる自己負担額を解説,17,https://news.yahoo.co.jp/articles/35512e4b609b6671044fc1efe7291493db3a8348,1/29(木) 8:20
2026-01-29,10:39,business,経済,24,プレジデントオンライン,日本車「大復活のシナリオ」が見えてきた…清水和夫が「あと5年、生き残れば必ず勝てる」と断言する理由,16,https://news.yahoo.co.jp/articles/0a5d65eb4ace7d3e0e0b9ab7d49173fe7fed521b,1/29(木) 8:20
2026-01-29,10:39,business,経済,25,読売新聞オンライン,米ＧＭ、ＥＶ不振で５０８０億円の最終赤字…ＣＥＯ「投資継続するが規模は小さくなる」,16,https://news.yahoo.co.jp/articles/913ff2fd639024627d0eb4eaea997e05a346773d,1/28(水) 10:42
2026-01-29,10:39,business,経済,26,ロイター,Ｓ＆Ｐ５００、初の7000台　ＡＩへの楽観的な見方が支援,16,https://news.yahoo.co.jp/articles/b77cfcf0581ddb6397c2eb370ca06a5f39eb00e7,1/28(水) 23:56
2026-01-29,10:39,business,経済,27,MotorFan,トヨタ 新型RAV4 vs 日産 エクストレイル、最上級グレード対決! 同じ490万円を支払うなら、どちらを買うべき? 【新型RAV4 徹底比較】,15,https://news.yahoo.co.jp/articles/c0de4b53aa1ee1377da481c4d53b0d91afc1a8b7,1/29(木) 8:03
2026-01-29,10:39,business,経済,28,共同通信,米長官「欧州諸国に失望」　インドとのFTA妥結で,15,https://news.yahoo.co.jp/articles/f6e05e480ccab3c5111cb71058ffecda19f2631e,1/29(木) 9:11
2026-01-29,10:39,business,経済,29,ニューズウィーク日本版,高市首相が「説明していない」解散の真の狙い…解散なしでは「身動きが取れなくなる」可能性高かった,14,https://news.yahoo.co.jp/articles/145d7ceef8886b4b931246281dc18bf5d96a530d,1/28(水) 19:20
2026-01-29,10:39,business,経済,30,税理士ドットコム,すしざんまい、「一番マグロ」史上最高値5.1億円は「仕入」か「広告費」か？ 税理士が解説,14,https://news.yahoo.co.jp/articles/49b2c10c64252a88b2d14e2d1d51c93d7c48fa19,1/28(水) 17:32
2026-01-29,10:39,business,経済,31,Forbes JAPAN,金価格、史上最高値「5300ドル」を突破 背景はドル安とFRB独立性の懸念,14,https://news.yahoo.co.jp/articles/6b39088ae2a0a036b01001d2dbbf270491cfa211,1/29(木) 9:00
2026-01-29,10:39,business,経済,32,ダイヤモンド・オンライン,「もう期待しない」若手社員が“静かに退職”していく職場の特徴【あなたの違和感は正しい】,13,https://news.yahoo.co.jp/articles/11e913175cf09d484785a4174a022f1ef4bf69b3,1/29(木) 7:25
2026-01-29,10:39,business,経済,33,FNNプライムオンライン（フジテレビ系）,アメリカ・トランプ大統領“ドル安”容認発言で円高加速　一時1ドル152円台前半に,13,https://news.yahoo.co.jp/articles/14c52478f57a1336e0e7acea12d542294b6410da,1/28(水) 23:45
2026-01-29,10:39,business,経済,34,ファイナンシャルフィールド,年収500万円だと「婚活は不利」と言われました…平均年収程度と思っていましたが、みんなもっと稼いでいるんでしょうか？,13,https://news.yahoo.co.jp/articles/80a426a5a4cd11c3f92af6543377346d5dcb6943,1/28(水) 17:50
2026-01-29,10:39,business,経済,35,THE GOLD ONLINE（ゴールドオンライン）,"タワマンを売っただけなのに…父から相続したマンションを即売却。〈40歳女性〉に追徴課税1,500万円が課されたワケ【相続の専門家が解説】",12,https://news.yahoo.co.jp/articles/6567fefacd96f38a6a05c20c9a058c74c247fd51,1/29(木) 8:00
2026-01-29,10:39,business,経済,36,AMP［アンプ］,Z世代が選ぶのは「映える旅」より「迷惑をかけない旅」──観光公害時代の新しい旅行観,12,https://news.yahoo.co.jp/articles/d1110d96031dd7fbe6809e3137e02a2941d294a2,1/28(水) 12:06
2026-01-29,10:39,business,経済,37,Bloomberg,円は153円台半ば、米財務長官発言で売り－自民優勢報道で債券下落へ,12,https://news.yahoo.co.jp/articles/f4977690ec6487c69b180f95e370466ebd2eca31,1/29(木) 7:51
2026-01-29,10:39,business,経済,38,東洋経済オンライン,「高齢者に投資は向かない」は大間違い？　“つみたて王子”が「60代からでも投資すべき」と言い切るワケ,11,https://news.yahoo.co.jp/articles/a60f2181f72cd1d7e5d75a694b6b1175d73ce4de,1/29(木) 8:16
2026-01-29,10:39,business,経済,39,ファイナンシャルフィールド,節水のためにお風呂のお湯を「3日間」使い回していたら、水道代は少し減ったもののガス代はあまり変わりません。本当に節約になっているのでしょうか…？,11,https://news.yahoo.co.jp/articles/25d509d737ec16e802e04f125d892091bb943357,1/29(木) 8:50
2026-01-29,10:39,business,経済,40,プレジデントオンライン,「借金は悪」と信じる人は貧乏になる…元国税専門官が「住宅ローンの繰り上げ返済は絶対NG」と断言するワケ,10,https://news.yahoo.co.jp/articles/109ee89c01fc83eb796327f3e2d495081ff8e681,1/29(木) 7:15
