scrp_date,scrp_time,genre_en,genre_jp,rank,media_jp,title,comment,link,date_original
2025-08-15,14:09,business,経済,1,みんかぶマガジン,広陵暴行騒動、なぜ大手メディアは沈黙したのか…「朝日、毎日は主催返上せよ」高校野球、2つの深刻な矛盾“聖域的イベントの功罪”,89,https://news.yahoo.co.jp/articles/9c73e70ceb33e48ffb4277f939c5b24cf7d19724,8/15(金) 9:10
2025-08-15,14:09,business,経済,2,ダイヤモンド・オンライン,マクドナルドのハッピーセット「ポケモンカード」転売騒動で経営のプロが抱いた『強烈な違和感』の正体,86,https://news.yahoo.co.jp/articles/4d6a287baf8036fe67f13d7ee09949714e347ff3,8/15(金) 6:01
2025-08-15,14:09,business,経済,3,東洋経済オンライン,"「シンプルに犯罪では」「なぜ加害者ではなく被害者が転校に？」などの声も…広陵高校「開幕後に辞退」暴力事件を生んだ“真因""",71,https://news.yahoo.co.jp/articles/ff1f68b9cf383f232ebb4c087f31a535b8ce4396,8/15(金) 8:26
2025-08-15,14:09,business,経済,4,TBS NEWS DIG Powered by JNN,4-6月期のGDP年率プラス1.0% 5四半期連続のプラス トランプ関税影響も 「輸出」がプラス成長を支える,56,https://news.yahoo.co.jp/articles/4efda8e852bd90557864f5cb60ef593f0fed84c5,8/15(金) 8:54
2025-08-15,14:09,business,経済,5,ファイナンシャルフィールド,市営住宅の駐車場に「新型アルファード」が！「600万」以上する車に乗っていても市営住宅に住み続けられるの？,41,https://news.yahoo.co.jp/articles/fbcfbb96622ef94f167f3ba13774744e20b15906,8/14(木) 14:20
2025-08-15,14:09,business,経済,6,プレジデントオンライン,"ドイツの「エアコン普及率」は3%、イギリスは5%…""環境優等生の欧州""が酷暑で支払う大きすぎる代償",39,https://news.yahoo.co.jp/articles/19e4fbd9a210b8ddd3d4af359728977ef9f6a92e,8/15(金) 8:16
2025-08-15,14:09,business,経済,7,産経新聞,「ポケモン」のハッピーセット、第2弾は購入制限3個に　マクドナルド転売対策を強化,34,https://news.yahoo.co.jp/articles/bc6c4c5917357ec576922e5bceded4cdd7b79106,8/15(金) 7:00
2025-08-15,14:09,business,経済,8,ベストカーWeb,2040年までにエンジン車廃止のはずが……電動化戦略を軌道修正!? ホンダが直面する問題点と解決策,31,https://news.yahoo.co.jp/articles/57be1e7ca0856505ad76e3ab96eb2e1cdfbca565,8/15(金) 10:00
2025-08-15,14:09,business,経済,9,くるまのニュース,高速SA「1台も入れさせません！」 NEXCO異例の「完全“封鎖”作戦」実施！ 花火“タダで見物客”殺到で「SA満車」「大渋滞」に発展… 中央道「諏訪湖SA」15日午後“全面閉鎖”へ,27,https://news.yahoo.co.jp/articles/5e3e1bd113e2fe92ce61022445c00a45c80b52f2,8/15(金) 12:20
2025-08-15,14:09,business,経済,10,ABEMA TIMES,“転勤辞令で転職検討”は甘え？ 元キーエンス営業トップ「時代どうこうではなく、言われたことをやるのは当たり前」 働き方改革の影で管理職も“罰ゲーム”化？,25,https://news.yahoo.co.jp/articles/bf1ff164262795d7b19a1def606c7378c79ec89d,8/15(金) 12:06
2025-08-15,14:09,business,経済,11,36Kr Japan,中国の中流階級は不景気で消えるのか？広がる「逆戻り貧困」のリアル【人気記事再掲】,24,https://news.yahoo.co.jp/articles/1ec1f886e5d458e3b28bb9107e68408493180e60,8/15(金) 11:30
2025-08-15,14:09,business,経済,12,プレジデントオンライン,「賃上げ5%」はまやかし…大手メディアが報じない「実際は2%しか上がらず、生活が楽にならない」カラクリ,24,https://news.yahoo.co.jp/articles/f081a3b319ba3fbe50db0b988020390718b66a89,8/15(金) 11:16
2025-08-15,14:09,business,経済,13,鉄道コム,「同じ顔」でも「別人です！」 JRで活躍する「211系顔」の電車たち,22,https://news.yahoo.co.jp/articles/1d4b57d1014d5fb0dd3bb0d9328c2d8affc85e3c,8/15(金) 12:05
2025-08-15,14:09,business,経済,14,帝国データバンク,アニメ制作市場、2024年は3621億円　過去最高を更新　元請制作の6割が「業績悪化」、アニメーター不足が顕在化,21,https://news.yahoo.co.jp/articles/bee9936ea8eb662345ea3c8d2af9c284ed6e4b8d,8/15(金) 10:00
2025-08-15,14:09,business,経済,15,ファイナンシャルフィールド,「毎日タクシーなんて乗れるか！」と免許返納に応じない父。車を処分すれば「年50万円」の維持費が不要になるはずですが、実際“タクシー・マイカー”のどちらがお得でしょうか？,20,https://news.yahoo.co.jp/articles/333ce78d6a9470f61353c945f944589344e2b739,8/15(金) 13:30
2025-08-15,14:09,business,経済,16,ダイヤモンド・オンライン,ウソでしょ…相続税が10年でゼロ→2000万円に爆増！お金持ちだけじゃない、庶民も襲う“増税トリプルパンチ”の正体,20,https://news.yahoo.co.jp/articles/fbfe8d131f6673f112f12d1198f59d368bbab245,8/15(金) 6:01
2025-08-15,14:09,business,経済,17,産経新聞,介護分野での外国人人材、3割が給与に不満　半数以上が介護以外に転職　職場環境充実求む,18,https://news.yahoo.co.jp/articles/419a89ccfef19a0048c94f487bad1d9000cbafa0,8/15(金) 7:00
2025-08-15,14:09,business,経済,18,Bloomberg,電通グループ、従業員約3400人を削減へ－海外事業の不振で,17,https://news.yahoo.co.jp/articles/fde13c777f956d610359dd8fada4faa2a83b543c,8/14(木) 15:54
2025-08-15,14:09,business,経済,19,ファイナンシャルフィールド,国家公務員の「給与」が4年連続引き上げ！ そもそも国家公務員の給与ってどのように決まっているの？,15,https://news.yahoo.co.jp/articles/cdf7019224c1cd7a879b6f74989577a5845add16,8/15(金) 13:40
2025-08-15,14:09,business,経済,20,FNNプライムオンライン（フジテレビ系）,「ポケモン」ハッピーセット販売開始…3セットまでの購入制限　転売目的の大量購入が問題に　マクドナルドが対策,15,https://news.yahoo.co.jp/articles/84b93d5469326e2d7817612454550d08b5b38eeb,8/15(金) 9:46
2025-08-15,14:09,business,経済,21,ビジネス＋IT,昭和世代には「理解不能」…？ホラーが若者に流行している「令和過ぎる」背景とは,15,https://news.yahoo.co.jp/articles/e9e02e778f8b7665a1f2b8c86cea4ea96de27459,8/15(金) 7:40
2025-08-15,14:09,business,経済,22,36Kr Japan,中国新興EV7月販売：零跑汽車が5万台でトップ独走、シャオミも急伸,15,https://news.yahoo.co.jp/articles/6b6428a7da915c84f0ab7fcd02c43f4ef905a37a,8/15(金) 8:30
2025-08-15,14:09,business,経済,23,LIMO,【首都圏版】2025年度の最低賃金は「1100円超え」へ。過去最大の引上げが見込まれる,13,https://news.yahoo.co.jp/articles/413e64455ed2bc54f97ad310afad7705dc8ad7a4,8/15(金) 12:06
2025-08-15,14:09,business,経済,24,ファイナンシャルフィールド,年収750万円・部長職の50代です。“年収のピーク”はもう過ぎた？まだ上がる可能性はある？,13,https://news.yahoo.co.jp/articles/a06672e4ad0734b75950933b6e645587e9052ab2,8/15(金) 11:32
2025-08-15,14:09,business,経済,25,乗りものニュース,低い・狭い・後席は壊滅的 「実用性ないクルマが1台くらいあっても」で生まれたセダンの顛末,13,https://news.yahoo.co.jp/articles/52c7f22778adcada12fa47de745fe2d3a0751397,8/15(金) 10:42
2025-08-15,14:09,business,経済,26,Bloomberg,ベッセント財務長官は日本に利上げ求めると言っていない－赤沢再生相,13,https://news.yahoo.co.jp/articles/60f3a83f81b84331dbf5c56bc3c086f0d3de5b7f,8/15(金) 10:49
2025-08-15,14:09,business,経済,27,鉄道コム,見分けるポイントは「車体断面」　山手線の車両にシレッと混ざる「年齢サバ読み車両」,13,https://news.yahoo.co.jp/articles/079556bf163233b96b2919514ac9c84339f61be2,8/15(金) 10:35
2025-08-15,14:09,business,経済,28,東洋経済オンライン,《8月15日には米軍の最後の空襲もあったのに…》日本の終戦記念日は、なぜ8月15日になったのか　戦後80年が経ったからこそできる「慰霊」を考える,13,https://news.yahoo.co.jp/articles/b37367d737047018083532d78de01a64fef7c40b,8/15(金) 11:31
2025-08-15,14:09,business,経済,29,テレビ朝日系（ANN）,建設業の倒産が過去10年で最多　資材高騰や人手不足が原因　今年上半期,13,https://news.yahoo.co.jp/articles/37a10c448363d21ff591aa6b72b901cfaaef2d12,8/15(金) 10:08
2025-08-15,14:09,business,経済,30,ダイヤモンド・オンライン,ローソン駐車場「有料車中泊」の理想と現実…クルマでのお手軽!?宿泊の課題を車中泊経験者の筆者が徹底分析,12,https://news.yahoo.co.jp/articles/5769209bc0069e84c1ea45834b6da5f2c78bccc1,8/15(金) 11:31
2025-08-15,14:09,business,経済,31,ロイター,金融政策手法は「日銀が判断」、米長官発言に言及せず＝加藤財務相,12,https://news.yahoo.co.jp/articles/08e782af232e771ea4c1d6f4cdcd3e8d7ef31687,8/15(金) 11:33
2025-08-15,14:09,business,経済,32,共同通信,米7月卸売物価3.3％上昇,12,https://news.yahoo.co.jp/articles/e883ba176cf92b851c98860ff0f68be816f5f9d7,8/14(木) 21:53
2025-08-15,14:09,business,経済,33,ファイナンシャルフィールド,共働き世帯の年収で「1000万円」の家庭は日本で何％？共働きで一番多い年収は？,12,https://news.yahoo.co.jp/articles/0435bbbe40866f646b855fbe33aaa0d55a7dd728,8/14(木) 18:50
2025-08-15,14:09,business,経済,34,プレジデントオンライン,"「15%に引き下げ」でも日本の自動車業界は安心できない…トランプ大統領が交渉を蒸し返す""決定的タイミング""",12,https://news.yahoo.co.jp/articles/f6bbf7f900bf360aecb5056c7717c923a89d0729,8/15(金) 9:16
2025-08-15,14:09,business,経済,35,TBS NEWS DIG Powered by JNN,不漁続きのサバが日本海で異例の大漁！食卓の見方の今後は？価格はどうなる？,12,https://news.yahoo.co.jp/articles/7fc1a01e17df8514ee25373a190bbbc7b13f411e,8/14(木) 19:42
2025-08-15,14:09,business,経済,36,集英社オンライン,〈LINEオープンチャットに潜入〉 素人にビミョーな「築古物件」を買わせるインフルエンサーの正体…マンション爆騰で食い物にされる「家を買えない若者」たち,12,https://news.yahoo.co.jp/articles/393616585952eea72ea4c6dbea4b492ea7158727,8/15(金) 11:01
2025-08-15,14:09,business,経済,37,ベストカーWeb,冠水してたら走っちゃダメ! どうしても走り抜ける必要がある時は…「ゆっくり」と!,12,https://news.yahoo.co.jp/articles/0b05b5c6618c6c4c1528fe4a6b3f84494833819b,8/15(金) 12:00
2025-08-15,14:09,business,経済,38,ロイター,ベセント米財務長官、日本に利上げ求めていない＝赤沢経済財政相,12,https://news.yahoo.co.jp/articles/f432dee69a941b568b0710193e2c8369020856e7,8/15(金) 11:30
2025-08-15,14:09,business,経済,39,プレジデントオンライン,"ロシアの造船会社「もう修理できない」…「ソ連の切り札」と呼ばれたロシア海軍""最後の空母""の哀れな結末",11,https://news.yahoo.co.jp/articles/445bce39df23b935cbc42565b4269b1d476533c7,8/14(木) 17:16
2025-08-15,14:09,business,経済,40,乗りものニュース,「またあの車種だ！」荒い運転、やけにノロい運転… 車種ごとに「運転特性の違い」はあるのか？ 実は“当然”のこと？,11,https://news.yahoo.co.jp/articles/d7064a2cda9c8e88cd2d837537b20da54d831251,8/15(金) 9:42
