scrp_date,scrp_time,genre_en,genre_jp,rank,media_jp,title,comment,link,date_original
2024-03-02,07:17,domestic,国内,1,共同通信,「子ども、ほしくない」半数超　ロート製薬調査、4年目で初,359,https://news.yahoo.co.jp/articles/4ad61261fac9d733916ab302e7e23b7888e99b39,3/1(金) 16:41
2024-03-02,07:17,domestic,国内,2,毎日新聞,政倫審、攻め手欠いた野党　森氏招致要求も立ちはだかる「数の論理」,305,https://news.yahoo.co.jp/articles/f3d47eeb97ceff2d1df06408f8673fc96a68ed10,3/1(金) 20:46
2024-03-02,07:17,domestic,国内,3,毎日新聞,「会計一切関わらず」　安倍派の4氏、政倫審でいずれも関与否定,203,https://news.yahoo.co.jp/articles/d090e44e867269a7cc535421cf367117a6afabf5,3/1(金) 19:58
2024-03-02,07:17,domestic,国内,4,産経新聞,立民・山井氏が衆院でフィリバスター、２時間５４分の新記録　不記載の５１人読み上げ,179,https://news.yahoo.co.jp/articles/38307a7caff89fc541cdb4c556dab4d55ea35ab8,3/1(金) 16:51
2024-03-02,07:17,domestic,国内,5,毎日新聞,「会計一切関わらず」　安倍派の西村、松野両氏　政倫審で関与否定,161,https://news.yahoo.co.jp/articles/f8da7268c7e556da6c7d22197728510c980b9d85,3/1(金) 11:53
2024-03-02,07:17,domestic,国内,6,共同通信,医療ミスで胃に人工肛門と提訴　成田赤十字病院側に賠償求める,97,https://news.yahoo.co.jp/articles/0b43bc5aa7475d6d64378ba44c4cbd7d7d75efb3,3/1(金) 18:31
2024-03-02,07:17,domestic,国内,7,FNNプライムオンライン（フジテレビ系）,【速報】立憲民主党　鈴木財務相の不信任決議案提出,94,https://news.yahoo.co.jp/articles/22e207b9a23cf7a2d900fed162e98128b96a7ebb,3/1(金) 20:13
2024-03-02,07:17,domestic,国内,8,TBS NEWS DIG Powered by JNN,【速報】衆・本会議　鈴木財務大臣の不信任決議案　与党などの反対多数で否決,92,https://news.yahoo.co.jp/articles/58f638b3509aee94195afe92adce1378fc81cdf8,3/1(金) 23:27
2024-03-02,07:17,domestic,国内,9,集英社オンライン,〈エッフェル広瀬議員・赤ベンツ不倫〉まさかの「おとがめナシ」「会見もナシ」地元岩手では大ブーイング「5分置きくらいにお電話を受けご批判などをいただきました」事務所が直撃に回答,86,https://news.yahoo.co.jp/articles/49bb8bc85042b0abc245bea7908f48abd67e1f46,3/1(金) 21:44
2024-03-02,07:17,domestic,国内,10,TBS NEWS DIG Powered by JNN,千葉東方沖・震度5弱程度の地震発生のおそれ「家具の固定などの備えを」地震調査委員会臨時会合,84,https://news.yahoo.co.jp/articles/af0079d9a8f1e668c80246fa2dd41cbacfb2760c,3/1(金) 19:42
2024-03-02,07:17,domestic,国内,11,TBS NEWS DIG Powered by JNN,【速報】安倍派の現金キックバック「一度やめる方針決めた」　西村前経済産業大臣が明らかに,77,https://news.yahoo.co.jp/articles/287655f42aeaca8bbaffeed91ff334c15b046401,3/1(金) 9:58
2024-03-02,07:17,domestic,国内,12,TBS NEWS DIG Powered by JNN,【速報】安倍派・松野前官房長官　キックバックの現金845万円を議員会館事務所で保管,74,https://news.yahoo.co.jp/articles/7a377f1af51d527a6e87198777b3d52248528c9c,3/1(金) 11:36
2024-03-02,07:17,domestic,国内,13,デイリー新潮,松下新平議員を籠絡した元美人秘書を詐欺で逮捕！　妻の母親は「娘は再三注意していた」,67,https://news.yahoo.co.jp/articles/ec9007fa350416b882f3b8ec620d521bc562724a,3/2(土) 6:09
2024-03-02,07:17,domestic,国内,14,TBS NEWS DIG Powered by JNN,千葉県で最大震度4のやや強い地震　千葉県・一宮町、睦沢町、長生村、白子町、長南町、千葉若葉区、いすみ市,66,https://news.yahoo.co.jp/articles/11234200f4575fd68ec1f8eb88b60cb215a0054b,3/2(土) 1:53
2024-03-02,07:17,domestic,国内,15,CBCテレビ,「1つのワクチンで これだけの論文が出るのは人類史上初めて」 新型コロナワクチンに “ワクチン問題研究会”の医師らが持つ疑問【大石が深掘り解説】,65,https://news.yahoo.co.jp/articles/325a93d59522f97847d2c33ecd4f1a3305a1a9ec,3/2(土) 6:14
2024-03-02,07:17,domestic,国内,16,TBS NEWS DIG Powered by JNN,「私は関係ない」容疑否認…東京・足立区の夫婦遺棄事件 フィリピン国籍の男女を殺人容疑などで再逮捕 警視庁,65,https://news.yahoo.co.jp/articles/53730129f1ce310e60b16790ebb8caec55d7670a,3/1(金) 9:32
2024-03-02,07:17,domestic,国内,17,FNNプライムオンライン（フジテレビ系）,【瞬間映像】危険な“ドリフト走行”で街頭に激突　一歩間違えれば“大事故”に　静岡・浜松市,46,https://news.yahoo.co.jp/articles/f28bd46de09d7308dfbbd914cda63b8058ebfe80,3/1(金) 19:39
2024-03-02,07:17,domestic,国内,18,共同通信,給食死亡事故、大分県に賠償命令　特別支援「見守り義務背いた」,46,https://news.yahoo.co.jp/articles/fb3bb0d08f92fc5f22a8caf40c693cf7761bd2bf,3/1(金) 13:42
2024-03-02,07:17,domestic,国内,19,弁護士ドットコムニュース,警察署内でスマホ撮影→止めようとした警察官の行為は「暴行だ」　東京弁護士会が警告,40,https://news.yahoo.co.jp/articles/b419044e543be1ecdeb0226bd02f25d149bfee18,3/1(金) 17:37
2024-03-02,07:17,domestic,国内,20,プレジデントオンライン,「AO・推薦で入った奴はバカ」一般受験以外は評価しない人の言い分…スタンフォード合格の高校球児にモヤる訳,40,https://news.yahoo.co.jp/articles/23e60f5bb89be5c3069d44ecd7a6cc772c97bfa3,3/1(金) 11:17
2024-03-02,07:17,domestic,国内,21,朝日新聞デジタル,2024年問題対策で最終便を大幅繰り上げ　西鉄バス「苦渋の決断」,34,https://news.yahoo.co.jp/articles/24377f938bbaae4057337f5b124e20c3a1ee05c0,3/1(金) 13:49
2024-03-02,07:17,domestic,国内,22,読売新聞オンライン,給食詰まらせ死亡、「太平燕」のウズラの卵を使用中止・「よくかむ」指導徹底…対応分かれる,33,https://news.yahoo.co.jp/articles/f1a1aa614bfab1a600af282df6f941b396ca8415,3/1(金) 11:12
2024-03-02,07:17,domestic,国内,23,FRIDAY,「ミャクミャクがPRに使えない！」開催まで1年…大阪万博公式キャラが浸透しない「深刻な理由」,33,https://news.yahoo.co.jp/articles/6b789a35721dea4e27e023c272f727fa137f27e3,3/1(金) 15:00
2024-03-02,07:17,domestic,国内,24,よろず～ニュース,れいわ大石晃子共同代表が〝1人牛歩〟「私以外やってへんやんけ！」「野党は体を張るべき」小野寺予算委員長の解任決議案採決,32,https://news.yahoo.co.jp/articles/1a061d913e47454b301764ec9ddf7d6faf741f81,3/1(金) 19:48
2024-03-02,07:17,domestic,国内,25,SmartFLASH,「とにかく評判が悪い」逮捕の「元五輪柔道代表」丸山顕志容疑者、次男優勝の舞台で起きていた“異変”,31,https://news.yahoo.co.jp/articles/d147e6a1807a252b89b7ac0f8e4927361b11b5b9,3/2(土) 6:05
2024-03-02,07:17,domestic,国内,26,SmartFLASH,「電撃結婚」大谷翔平のおばを直撃！「ありがとうございました」声色からにじみ出る喜び,30,https://news.yahoo.co.jp/articles/bb319965bca4c4cfe0af5a2223e346b28d39e34a,3/2(土) 6:00
2024-03-02,07:17,domestic,国内,27,FNNプライムオンライン（フジテレビ系）,中島健人さんら“サプライズ”登場　被災地の卒業式でプレゼント　能登半島地震から2カ月,29,https://news.yahoo.co.jp/articles/85e852ba0e8f723db71f1f23d7248329cba0eb61,3/1(金) 18:27
2024-03-02,07:17,domestic,国内,28,プレジデントオンライン,"あまりのリスクに""まともな男性""は恋愛市場から去り問題男性が残る…「不同意性交罪」が引き起こす皮肉な現象",28,https://news.yahoo.co.jp/articles/565399f742ca2855e74b57246a8c1dc1ea43c582,3/1(金) 11:17
2024-03-02,07:17,domestic,国内,29,よろず～ニュース,国民・榛葉幹事長「こんな昭和の政治をやっていると…」衆院本会議での立民の審議引き延ばしに苦言,28,https://news.yahoo.co.jp/articles/ab38694ce4a14df3a587f2654c82125d7c31ad65,3/1(金) 16:52
2024-03-02,07:17,domestic,国内,30,47NEWS,「それって陰謀論じゃないですか？」闇の国家「ディープステート」を信じる著名人一人一人に会ってみたら…どうなった？,28,https://news.yahoo.co.jp/articles/eac20c1c31ef637d92843e73165c06dccee3f9f8,3/1(金) 10:02
2024-03-02,07:17,domestic,国内,31,TBS NEWS DIG Powered by JNN,【速報】衆・本会議　小野寺予算委員長の解任決議案　与党などの反対多数で否決,28,https://news.yahoo.co.jp/articles/bf7a54b1e0e8f53a0a25a36b76f2b77455af4b04,3/1(金) 17:00
2024-03-02,07:17,domestic,国内,32,毎日新聞,千葉県東方沖で地震多発　27日から震度1以上16回　数年間隔で観測,28,https://news.yahoo.co.jp/articles/bab877ebbf6195c56eaef7c7f74603d4dc8fce90,3/1(金) 9:12
2024-03-02,07:17,domestic,国内,33,日テレNEWS NNN,手術中の女性患者をペン型カメラで盗撮か　看護師の男を逮捕　山梨,28,https://news.yahoo.co.jp/articles/d062d3b4abe5d479dec03e936928d366a4a22677,3/1(金) 21:14
2024-03-02,07:17,domestic,国内,34,毎日新聞,「売名行為」と言われても　被災者に届けた演奏300回　日本フィルの13年 ＃知り続ける,27,https://news.yahoo.co.jp/articles/49bed3a048adee0ea1c2e2dce17af32fae93286a,3/1(金) 11:05
2024-03-02,07:17,domestic,国内,35,CBCテレビ,「あやちゃんをおうちに呼んであげる…看護師の衣装を持ってきてもらおうかな」三重県でもセクハラ疑惑浮上　26歳県議が54歳県議から,27,https://news.yahoo.co.jp/articles/3ff048face9ab9d882b697ea53420547c201633d,3/1(金) 21:32
2024-03-02,07:17,domestic,国内,36,FNNプライムオンライン（フジテレビ系）,【速報】立憲が予算委員長解任決議案を提出　1日採決方針に反発,27,https://news.yahoo.co.jp/articles/433e6cae795ae9a6a94c4015c9c2f59bb39f0b99,3/1(金) 8:48
2024-03-02,07:17,domestic,国内,37,中日スポーツ,紀藤正樹弁護士、旧ジャニーズが性加害訴えた43人に補償しないとの発表に私見「どこかで詳細を公表して」,26,https://news.yahoo.co.jp/articles/1bf328af8296b1e166a641824264277fe6c28cbb,3/1(金) 21:50
2024-03-02,07:17,domestic,国内,38,夕刊フジ,〝初の女性共産党委員長〟の予言は的中したが…ネットで「女スターリン」田村智子氏は怖い人か　垣間見た「民主集中制」,25,https://news.yahoo.co.jp/articles/3e054b83526f8016488d9f6771cbd4f51351105d,3/1(金) 17:00
2024-03-02,07:17,domestic,国内,39,共同通信,能登地震の倒壊家屋、元日のまま　「一歩一歩進むしかない」,25,https://news.yahoo.co.jp/articles/00157e252547e068b42e9ade19eb42e97357b359,3/1(金) 11:47
2024-03-02,07:17,domestic,国内,40,共同通信,「第10波」ピーク越えた可能性　コロナ、感染者3週連続減,24,https://news.yahoo.co.jp/articles/be06aa986939640520483038ab005edb6a5954fe,3/1(金) 15:56
