scrp_date,scrp_time,genre_en,genre_jp,rank,media_jp,title,comment,link,date_original
2025-03-16,10:34,TTL,総合,1,スポニチアネックス,フジ梅津弥英子アナ　橋下徹氏に即ツッコミ、“国民が1万、2万で四苦八苦”に「100円、200円です」,411,https://news.yahoo.co.jp/articles/86441c24e930678e00b48fc26507ef39ed2ee820,3/16(日) 8:41
2025-03-16,10:34,TTL,総合,2,信濃毎日新聞デジタル,「あり得ない」高校生の親憤り　山間地のバス、減便のはずが、まさか廃止とは…「高くても通勤通学の時間だけは…」　地域住民に広がる不安の声,376,https://news.yahoo.co.jp/articles/cf9f0e7270732db058af6a38684a6d21a5000c9e,3/16(日) 6:30
2025-03-16,10:34,TTL,総合,3,時事通信,石破首相窮地、政局不透明に　商品券配布、苦しい釈明　野党、退陣要求のタイミング熟慮〔深層探訪〕,351,https://news.yahoo.co.jp/articles/0d08515ab0a7ee4c86b69641c91ea2418522725c,3/16(日) 7:00
2025-03-16,10:34,TTL,総合,4,毎日新聞,名門国立小、担任がいじめアンケ報告せず　被害男児は内部進学を断念,254,https://news.yahoo.co.jp/articles/5a77a0949fd20e9f5d477f8a40f65cd665e12c20,3/16(日) 5:30
2025-03-16,10:34,TTL,総合,5,弁護士ドットコムニュース,九州の男尊女卑やゆ「さす九」の情報募集した結果…女性「九州を脱出した」男性「不愉快だ」「九州男児は女性に優しい」,243,https://news.yahoo.co.jp/articles/deab6ac4b243c0c431199360d8377aebeaab8216,3/16(日) 8:32
2025-03-16,10:34,TTL,総合,6,TNCテレビ西日本,【続報】４歳男児が死亡　博多駅近くのホテル　父親が寝かしつけて買い物に出た後に転落か　防犯カメラに男児が１人で部屋を出る様子　愛知県名古屋市から2人で旅行中　福岡市,171,https://news.yahoo.co.jp/articles/44b8ce3bdbf7a11322598dc408d6967c131196c4,3/15(土) 16:30
2025-03-16,10:34,TTL,総合,7,産経新聞,石破茂首相、地方行脚本格化も…商品券配布問題が暗い影「ひたすら誠心誠意努力」,167,https://news.yahoo.co.jp/articles/ed7bfff36bf3426d535876dc4d3b59c4b02de91c,3/15(土) 19:15
2025-03-16,10:34,TTL,総合,8,読売新聞オンライン,生活保護の窓口「恫喝・罵声は日常茶飯事」「高飛車な態度で対応」…部長席はついたてで囲われる,161,https://news.yahoo.co.jp/articles/5fd028ec8de48be4804a781bd1f1b9197f99a007,3/15(土) 18:49
2025-03-16,10:34,TTL,総合,9,スポニチアネックス,国民民主・玉木雄一郎代表　石破首相の商品券問題「“財源がない”などと言いながら10万円をポンと」,158,https://news.yahoo.co.jp/articles/cd760e65cd7d4d1db25c4ab8962433c91f27a6c0,3/16(日) 9:45
2025-03-16,10:34,TTL,総合,10,日刊スポーツ,ひろゆき氏「石破首相はもうあちら側に行かれてしまった」商品券問題に「任期まで続けるのは…」,149,https://news.yahoo.co.jp/articles/57b50bf8e3752df7f3021edc4a959c914f990d7a,3/16(日) 9:26
2025-03-16,10:34,TTL,総合,11,読売新聞オンライン,トランプ米大統領、フーシへの大規模攻撃命じる,145,https://news.yahoo.co.jp/articles/e2233c7da0e61078ad2f2ac35f62285228528e4b,3/16(日) 6:14
2025-03-16,10:34,TTL,総合,12,集英社オンライン,「夫婦別姓とかどうでもいい」前のめりな小泉進次郎らに対し、ネットには冷ややかな声も… “選択制”なのに反対派が多い理由とは,144,https://news.yahoo.co.jp/articles/4e3be784a5a16324c2a239e5eb982e50979a4f4a,3/16(日) 10:02
2025-03-16,10:34,TTL,総合,13,TBS NEWS DIG Powered by JNN,頭の傷の深さ1cmまで達する　NHK党・立花孝志党首がナタで切りつけられた事件　頭など3か所に切り傷30歳男を殺人未遂容疑で現行犯逮捕　警視庁,139,https://news.yahoo.co.jp/articles/6d37cbe37236bbd786cfd22a430040e8bb5d90d6,3/15(土) 11:53
2025-03-16,10:34,TTL,総合,14,日刊スポーツ,佐々木麟太郎が公式戦１号含む２発　リーグ戦17試合目「ダイガクハツホームラン」実況アナ絶叫,137,https://news.yahoo.co.jp/articles/81267c0a12ff0fe92204d70fd9c9079ae2cf0529,3/16(日) 8:52
2025-03-16,10:34,TTL,総合,15,MBSニュース,「過料取るなら吸える場所を用意して！」夜間に喫煙所を利用できず嘆くスモーカー　大阪市のタバコ事情に変化？全域で『路上喫煙禁止』となって1か月,131,https://news.yahoo.co.jp/articles/818760e2b30ee2ba4f03a3953ea7c997f2fe6f9c,3/15(土) 11:01
2025-03-16,10:34,TTL,総合,16,ENCOUNT,遺族まで攻撃するのか…斎藤元彦知事が言及した「元県民局長PC公開」は法律上「無理筋」【西脇亨輔弁護士】,127,https://news.yahoo.co.jp/articles/3e9547fb24b66afe2021763a843fa7c685c09b82,3/16(日) 10:07
2025-03-16,10:34,TTL,総合,17,クーリエ・ジャポン,世界のZ世代の男性の半数以上が「いまのフェミニズムは行き過ぎている」と回答　若い男性が口に出せないホンネ,125,https://news.yahoo.co.jp/articles/3bf434132613d831dca6a49ae260f2dade882f4e,3/16(日) 9:30
2025-03-16,10:34,TTL,総合,18,スポニチアネックス,人気ユーチューバーでモデルの古川優香　結婚と第1子妊娠を発表　お相手は元ユーチューバーの実業家,123,https://news.yahoo.co.jp/articles/f91a217f67f81d42aca786a919864237889ec6f4,3/15(土) 20:27
2025-03-16,10:34,TTL,総合,19,産経新聞,内閣不信任案「早ければ今」と国民玉木氏　10万円配布は「不信招いた首相自らに処分を」,117,https://news.yahoo.co.jp/articles/98585abf8d5e6f99c4aed920456229e371a073cb,3/16(日) 7:30
2025-03-16,10:34,TTL,総合,20,Merkmal,EVアンチが、3月発表「トヨタ新型EV」をなぜか批判しない根本理由,113,https://news.yahoo.co.jp/articles/a91bd56d942cdf4fa8a76f4e65797e44c72fdce6,3/16(日) 8:50
2025-03-16,10:34,TTL,総合,21,現代ビジネス,「政治家の”課税逃れ”を是正しないと日本は衰退する」元国税調査官が嘆く、上級国民に許されたズルい節税,112,https://news.yahoo.co.jp/articles/abf0fea8e63448336ddf2739355a6cefa67a12ae,3/16(日) 8:31
2025-03-16,10:34,TTL,総合,22,スポニチアネックス,ヒカル、YouTube広告収益が「信じられんぐらい減ってる」と吐露「これだけじゃ食っていけない…」,110,https://news.yahoo.co.jp/articles/dfe6f292c121a92b02d7d36d8c856c0cbf4e37ba,3/15(土) 18:31
2025-03-16,10:34,TTL,総合,23,テレビ朝日系（ANN）,兵庫・斎藤知事めぐる問題　第三者委員会が19日にも調査報告書を提出へ,110,https://news.yahoo.co.jp/articles/07aa6473727299187426ceb7c292651282bb67cb,3/16(日) 9:13
2025-03-16,10:34,TTL,総合,24,スポニチアネックス,フジ「日曜報道」ゲスト2議員にネット「倫理観問うのは…」「どう見ても」,98,https://news.yahoo.co.jp/articles/56dd16a069a7761ea25a91f0542085fc2c7aa3d4,3/16(日) 9:16
2025-03-16,10:34,TTL,総合,25,弁護士ドットコムニュース,たばこ休憩はズルい？ 非喫煙者は「不公平」とモヤモヤ　法的には？,97,https://news.yahoo.co.jp/articles/4e464bd37c04352e59eaac21c7829e6f38f450a3,3/16(日) 8:22
2025-03-16,10:34,TTL,総合,26,産経新聞,「現行法は熟知しています」兵庫問題を大阪で語る千葉県知事選候補者、N党立花氏の目論見,96,https://news.yahoo.co.jp/articles/e6b497b5e1b1b168ddc281d2d4af039229b8b727,3/16(日) 8:13
2025-03-16,10:34,TTL,総合,27,ダイヤモンド・オンライン,「教員の労働時間をとにかく減らせ」子ども不在の文科省「学校業務仕分け」がもたらす教育格差,95,https://news.yahoo.co.jp/articles/067e25b72ce745cf3367d679041c8bf69e79185d,3/16(日) 8:32
2025-03-16,10:34,TTL,総合,28,デイリースポーツ,石破首相　１０万円商品券→全員に突き返され見解「そういう目で見られることをキッパリお断りされた」国会で説明　やましい金？に「間違っても私は」,95,https://news.yahoo.co.jp/articles/f991af4b9f105dd60a5e9254943e49323bb3b140,3/15(土) 20:03
2025-03-16,10:34,TTL,総合,29,共同通信,38道府県60市町村を伴走支援　地方創生で石破首相表明,93,https://news.yahoo.co.jp/articles/054ed394e1c6191479b275337d18f108bb1689e7,3/15(土) 17:37
2025-03-16,10:34,TTL,総合,30,中央日報日本語版,万里の長城で尻出し撮影…日本人男女、一時拘束後に追放,92,https://news.yahoo.co.jp/articles/04dbeead10a9206da81f32c2706b97abb6ce40a4,3/16(日) 9:45
2025-03-16,10:34,TTL,総合,31,毎日新聞,献体の「SNS発信禁止」、解剖学会などが指針　ピース写真炎上で,92,https://news.yahoo.co.jp/articles/2fb4bc1ba7cae00f6ebb357dd130b47e238f33d5,3/16(日) 5:00
2025-03-16,10:34,TTL,総合,32,北海道ニュースUHB,高速道路を”時速144キロで爆走”　「オービスが光りました」と自ら警察に出頭　北海道に旅行に来ていた26歳中国人“ビジネスアナリスト”を逮捕　北海道・江別市,92,https://news.yahoo.co.jp/articles/51c1673551d5c8c12627c841d9df49d41edf4c3c,3/16(日) 8:48
2025-03-16,10:34,TTL,総合,33,スポニチアネックス,巨人・阿部監督「何もできなかった選手たくさんいると思う」「戸郷にはいいお薬」　ドジャースに完敗,91,https://news.yahoo.co.jp/articles/2f8a0fe1aeb63f567c850ade5d024fffb0f3c302,3/15(土) 21:38
2025-03-16,10:34,TTL,総合,34,マグミクス,「ガンダムのアタマのバルカンはバルカンじゃない←せいかい」…何をいっているのか？,89,https://news.yahoo.co.jp/articles/231e10e4927c4bdfe1c282a23792c1f32614db6c,3/16(日) 7:25
2025-03-16,10:34,TTL,総合,35,ABEMA TIMES,国家公務員を地方自治体に派遣 “伴走支援” 地方創生の新制度を発表,89,https://news.yahoo.co.jp/articles/c219dd7c7b70438e380ce9f7ad645008204f80b0,3/16(日) 9:17
2025-03-16,10:34,TTL,総合,36,文春オンライン,「四肢がなく両胸が抉り取られたほか、内臓もなくなっていた」島根の陽キャ女子大生（19）を無惨に殺害した元バンドマンが撮影していた「残酷すぎる」57枚の写真,84,https://news.yahoo.co.jp/articles/27a29418d2dca91857de1d49651062364be362a3,3/16(日) 7:12
2025-03-16,10:34,TTL,総合,37,オトナンサー,【賛否】子どもの「忘れ物」学校に届けるのは過保護？　SNS「なんとかなる」相次ぐも「かわいそう」「物による」声も,83,https://news.yahoo.co.jp/articles/379b81f060f47dafb6d94b9a43898a9a3e526040,3/16(日) 9:10
2025-03-16,10:34,TTL,総合,38,よろず～ニュース,立民・米山隆一氏、国民・玉木雄一郎氏ら名指しして「陰謀論」に警鐘「財務省解体デモ」に「暴力の徒」指摘,81,https://news.yahoo.co.jp/articles/87ce5bdfcc7e88180f259bd81ab22eeca126b3ce,3/15(土) 17:35
2025-03-16,10:34,TTL,総合,39,現代ビジネス,《高田馬場・女性ライバー刺殺》高野容疑者のあだ名は「ウーチャカ」…旧友が語る、スーファミに熱中していた「サブカル少年の素顔」,80,https://news.yahoo.co.jp/articles/0cc2099babb449605a02de5f190da185b5f7dad9,3/16(日) 7:01
2025-03-16,10:34,TTL,総合,40,テレビ朝日系（ANN）,立花氏襲撃事件　直前に「閃光手りゅう弾」使用,80,https://news.yahoo.co.jp/articles/1085c3dcb7e7f91f16179547c99e5dc0e4e635cc,3/15(土) 15:15
