scrp_date,scrp_time,genre_en,genre_jp,rank,media_jp,title,comment,link,date_original
2024-10-19,09:29,world,国際,1「いつになったら日本人学校を排除できるのか」…深圳男児刺殺１か月、中国のＳＮＳに今も反日書き込み読売新聞オンライン10/18(金) 21:13146件/時,読売新聞オンライン,「いつになったら日本人学校を排除できるのか」…深圳男児刺殺１か月、中国のＳＮＳに今も反日書き込み,146,https://news.yahoo.co.jp/articles/8d7e2b35f5676edca6f3c0183436a1f2b339b17b,10/18(金) 21:13
2024-10-19,09:29,world,国際,2減少する中国赴任希望　日系企業、人材確保に懸念　男児刺殺1カ月時事通信10/19(土) 7:3142件/時,時事通信,減少する中国赴任希望　日系企業、人材確保に懸念　男児刺殺1カ月,42,https://news.yahoo.co.jp/articles/4c1a6fbd78e887a8b63a4641ac47e4765384bd51,10/19(土) 7:31
2024-10-19,09:29,world,国際,3ロシアは北朝鮮兵を“使い捨て”に　ウクライナ外相が批判テレビ朝日系（ANN）10/19(土) 8:2737件/時,テレビ朝日系（ANN）,ロシアは北朝鮮兵を“使い捨て”に　ウクライナ外相が批判,37,https://news.yahoo.co.jp/articles/2bfdd72c19e21330fcf2f4cac8a0f77159a89562,10/19(土) 8:27
2024-10-19,09:29,world,国際,4「持ち込み禁止」に逆ギレ…韓国・女性客がビアホールで「つまみをまき散らす」嫌がらせKOREA WAVE10/19(土) 6:0336件/時,KOREA WAVE,「持ち込み禁止」に逆ギレ…韓国・女性客がビアホールで「つまみをまき散らす」嫌がらせ,36,https://news.yahoo.co.jp/articles/f0a07af8d32e1ae5084ddf1a496c071108a545c8,10/19(土) 6:03
2024-10-19,09:29,world,国際,5北朝鮮がロシアに1万2000人の派兵 韓国メディアが報じるABEMA TIMES10/18(金) 18:2428件/時,ABEMA TIMES,北朝鮮がロシアに1万2000人の派兵 韓国メディアが報じる,28,https://news.yahoo.co.jp/articles/c8c914e53bf179524d0878de34e2cb01841602b6,10/18(金) 18:24
2024-10-19,09:29,world,国際,6仏外相「亡命に法的問題」　反捕鯨活動家の申請巡り共同通信10/19(土) 5:5728件/時,共同通信,仏外相「亡命に法的問題」　反捕鯨活動家の申請巡り,28,https://news.yahoo.co.jp/articles/09fa538b73d85e1d2a9b0c12ee50c2d9e6fdb218,10/19(土) 5:57
2024-10-19,09:29,world,国際,7ハマス最高指導者後任、ガザ地区外から選出か　シンワル氏殺害受けロイター10/19(土) 8:0525件/時,ロイター,ハマス最高指導者後任、ガザ地区外から選出か　シンワル氏殺害受け,25,https://news.yahoo.co.jp/articles/dc464a908fee0e10575959592e8105f91dd103e9,10/19(土) 8:05
2024-10-19,09:29,world,国際,8金正恩氏、韓国との「悪縁断絶」　人民軍指揮所で臨戦態勢を指示共同通信10/18(金) 9:4423件/時,共同通信,金正恩氏、韓国との「悪縁断絶」　人民軍指揮所で臨戦態勢を指示,23,https://news.yahoo.co.jp/articles/6ebf7b83981a26e91ae7cdb9338faf4fd116665c,10/18(金) 9:44
2024-10-19,09:29,world,国際,9議会襲撃犯を収容日系人に例え　トランプ氏、「不当な拘束」訴え時事通信10/19(土) 7:5021件/時,時事通信,議会襲撃犯を収容日系人に例え　トランプ氏、「不当な拘束」訴え,21,https://news.yahoo.co.jp/articles/30d36dbee35dba1677f7fcdd1942df2f4ec3a861,10/19(土) 7:50
2024-10-19,09:29,world,国際,10ハマス、最高指導者シンワル氏の死亡を確認ロイター10/18(金) 22:2221件/時,ロイター,ハマス、最高指導者シンワル氏の死亡を確認,21,https://news.yahoo.co.jp/articles/241bdc23782914e3118c8d73db3c8e94bd1114ec,10/18(金) 22:22
2024-10-19,09:29,world,国際,111:31「カンフーの達人か?」路上で男性2人がケンカ　バイクですれ違う際に接触が原因で殴り合いに発展　中国・湖南省FNNプライムオンライン（フジテレビ系）10/18(金) 19:5521件/時,FNNプライムオンライン（フジテレビ系）,「カンフーの達人か?」路上で男性2人がケンカ　バイクですれ違う際に接触が原因で殴り合いに発展　中国・湖南省,21,https://news.yahoo.co.jp/articles/71c427c5b19d82b98151fd8d8740c0204a8149fe,10/18(金) 19:55
2024-10-19,09:29,world,国際,12北朝鮮兵「使い捨て要員」　ウクライナ外相が主張共同通信10/19(土) 6:4621件/時,共同通信,北朝鮮兵「使い捨て要員」　ウクライナ外相が主張,21,https://news.yahoo.co.jp/articles/cba242c6021169315bdc79734fef4bf5b67f4249,10/19(土) 6:46
2024-10-19,09:29,world,国際,13「男性は遊んで、女性は働く」中国奥地の“ナゾの村”　立山特派員がみた不思議な家族のカタチ【クレイジージャーニー】TBS NEWS DIG Powered by JNN10/19(土) 6:0220件/時,TBS NEWS DIG Powered by JNN,「男性は遊んで、女性は働く」中国奥地の“ナゾの村”　立山特派員がみた不思議な家族のカタチ【クレイジージャーニー】,20,https://news.yahoo.co.jp/articles/1a9d9093be5125139945fda65bc3ed62a7a1f91a,10/19(土) 6:02
2024-10-19,09:29,world,国際,14中国外務省が西田敏行さんに哀悼の意　「両国人民が好きだった」産経新聞10/18(金) 17:2519件/時,産経新聞,中国外務省が西田敏行さんに哀悼の意　「両国人民が好きだった」,19,https://news.yahoo.co.jp/articles/37c06a6efd92115b61d295b310d2ba43f3d5f107,10/18(金) 17:25
2024-10-19,09:29,world,国際,15開業3カ月で5回も無銭飲食されたソウルの飲食店…映像公開したそのうち1回は「テニスラケットの女性」の食い逃げKOREA WAVE10/19(土) 7:0318件/時,KOREA WAVE,開業3カ月で5回も無銭飲食されたソウルの飲食店…映像公開したそのうち1回は「テニスラケットの女性」の食い逃げ,18,https://news.yahoo.co.jp/articles/1c9e1cb8d5bb117e99f419cdfa23802a09484029,10/19(土) 7:03
2024-10-19,09:29,world,国際,16「日系人の強制収容と同じ」　トランプ氏、議会襲撃犯の扱いで共同通信10/19(土) 8:4817件/時,共同通信,「日系人の強制収容と同じ」　トランプ氏、議会襲撃犯の扱いで,17,https://news.yahoo.co.jp/articles/8c22c747f645ecb2490da07d016f3b030b436a2e,10/19(土) 8:48
2024-10-19,09:29,world,国際,17トランプ氏、ゼレンスキー大統領に「戦争を始めるべきではなかった」「負け戦」読売新聞オンライン10/18(金) 17:1316件/時,読売新聞オンライン,トランプ氏、ゼレンスキー大統領に「戦争を始めるべきではなかった」「負け戦」,16,https://news.yahoo.co.jp/articles/d850c250f06f4a42acf1c707af4d4089bcf6be02,10/18(金) 17:13
2024-10-19,09:29,world,国際,18ロシア、ウクライナの核武装容認せず＝プーチン大統領ロイター10/19(土) 3:2615件/時,ロイター,ロシア、ウクライナの核武装容認せず＝プーチン大統領,15,https://news.yahoo.co.jp/articles/b77db645816ccbac61dd2d10ff769e0bf39149b7,10/19(土) 3:26
2024-10-19,09:29,world,国際,19「平壌で韓国軍の無人機を発見」と北朝鮮発表テレビ朝日系（ANN）10/19(土) 8:0815件/時,テレビ朝日系（ANN）,「平壌で韓国軍の無人機を発見」と北朝鮮発表,15,https://news.yahoo.co.jp/articles/577232e27744f08d9a4ac5c3a0d9e59f4e70ba89,10/19(土) 8:08
2024-10-19,09:29,world,国際,20北朝鮮がロシアの侵攻に「参戦」　1万2000人の派兵決定か共同通信10/18(金) 18:5414件/時,共同通信,北朝鮮がロシアの侵攻に「参戦」　1万2000人の派兵決定か,14,https://news.yahoo.co.jp/articles/db92e0b2412779ce65097d3177b91bd185b60fe7,10/18(金) 18:54
2024-10-19,09:29,world,国際,21韓国国情院「北朝鮮、ウクライナ参戦決定…特殊部隊など１万２千人派兵」ハンギョレ新聞10/19(土) 8:0913件/時,ハンギョレ新聞,韓国国情院「北朝鮮、ウクライナ参戦決定…特殊部隊など１万２千人派兵」,13,https://news.yahoo.co.jp/articles/ad05a7ff2c45cf8ec7fadc53236cf6e4a6974ff9,10/19(土) 8:09
2024-10-19,09:29,world,国際,22米74歳死刑囚、薬物注射で静脈見つからず死刑失敗　カテーテルに切り替え来月再執行産経新聞10/18(金) 11:0812件/時,産経新聞,米74歳死刑囚、薬物注射で静脈見つからず死刑失敗　カテーテルに切り替え来月再執行,12,https://news.yahoo.co.jp/articles/b833ee02758ed7c667889bf6cfafa885e15ff300,10/18(金) 11:08
2024-10-19,09:29,world,国際,23ハン・ガン「ノーベル賞」スウェーデン大使館に抗議…韓国の恥ずべき保守団体ハンギョレ新聞10/18(金) 9:4912件/時,ハンギョレ新聞,ハン・ガン「ノーベル賞」スウェーデン大使館に抗議…韓国の恥ずべき保守団体,12,https://news.yahoo.co.jp/articles/70ffc194ea30744d808881d53d3bea61977f9ff5,10/18(金) 9:49
2024-10-19,09:29,world,国際,24「中国に毅然とした態度を」京大・藤井教授　「日本人学校男児死亡事件」から1カ月　いまも詳しい情報なし関西テレビ10/18(金) 18:2412件/時,関西テレビ,「中国に毅然とした態度を」京大・藤井教授　「日本人学校男児死亡事件」から1カ月　いまも詳しい情報なし,12,https://news.yahoo.co.jp/articles/46c4ff1cd6521a4a9ceb801f22972d4d8a1c7329,10/18(金) 18:24
2024-10-19,09:29,world,国際,25殺害のシンワル氏、ドローンに棒投げる「最期の姿」…イスラエル歩兵らが偶然に発見読売新聞オンライン10/18(金) 23:4212件/時,読売新聞オンライン,殺害のシンワル氏、ドローンに棒投げる「最期の姿」…イスラエル歩兵らが偶然に発見,12,https://news.yahoo.co.jp/articles/e21d9d6ad315065d0f5a8f36b94c2a120bf472a5,10/18(金) 23:42
2024-10-19,09:29,world,国際,26トランプ氏 「議会乱入事件の受刑者 第二次世界大戦時の日系アメリカ人強制収容と同様」ポッドキャスト番組で発言TBS NEWS DIG Powered by JNN10/19(土) 3:3012件/時,TBS NEWS DIG Powered by JNN,トランプ氏 「議会乱入事件の受刑者 第二次世界大戦時の日系アメリカ人強制収容と同様」ポッドキャスト番組で発言,12,https://news.yahoo.co.jp/articles/2cf47b39a4d80c83b016567c485d39d11e0a2483,10/19(土) 3:30
2024-10-19,09:29,world,国際,27韓国国家情報院「北朝鮮特殊部隊１５００人がウクライナの戦場に移動中」ハンギョレ新聞10/19(土) 7:2411件/時,ハンギョレ新聞,韓国国家情報院「北朝鮮特殊部隊１５００人がウクライナの戦場に移動中」,11,https://news.yahoo.co.jp/articles/8e26cd1d2a642970b91d2969b3891a88bfa6bf03,10/19(土) 7:24
2024-10-19,09:29,world,国際,281:07北朝鮮がロシアに特殊部隊派遣し「参戦開始」韓国国情院テレビ朝日系（ANN）10/18(金) 20:5411件/時,テレビ朝日系（ANN）,北朝鮮がロシアに特殊部隊派遣し「参戦開始」韓国国情院,11,https://news.yahoo.co.jp/articles/d34be5a656c4bb29c9330df89d7d215c77352296,10/18(金) 20:54
2024-10-19,09:29,world,国際,29米メタ、食事クーポンで歯磨き粉買った従業員ら解雇　メディアが報道BBC News10/18(金) 16:3211件/時,BBC News,米メタ、食事クーポンで歯磨き粉買った従業員ら解雇　メディアが報道,11,https://news.yahoo.co.jp/articles/d2da1cdd481d8ac09a8800961c902177a8638424,10/18(金) 16:32
2024-10-19,09:29,world,国際,30最高指導者の殺害にバイデン米大統領は「正義の措置」…イスラム教シーア派組織「ヒズボラ」とは？〈池上彰氏が解説〉文春オンライン10/19(土) 7:1211件/時,文春オンライン,最高指導者の殺害にバイデン米大統領は「正義の措置」…イスラム教シーア派組織「ヒズボラ」とは？〈池上彰氏が解説〉,11,https://news.yahoo.co.jp/articles/da07f1a4da1fedf618f7c52b6c9f13cf4ab4fc93,10/19(土) 7:12
2024-10-19,09:29,world,国際,31中東停戦期待遠のく、ヒズボラ「対イスラエル戦は新段階に」ロイター10/19(土) 4:3711件/時,ロイター,中東停戦期待遠のく、ヒズボラ「対イスラエル戦は新段階に」,11,https://news.yahoo.co.jp/articles/d7ff8d0a8bdac18ab102e6eaf99610511ab49131,10/19(土) 4:37
2024-10-19,09:29,world,国際,32韓国大統領府、北朝鮮の派兵「座視せず」共同通信10/18(金) 18:0711件/時,共同通信,韓国大統領府、北朝鮮の派兵「座視せず」,11,https://news.yahoo.co.jp/articles/88ab0412f2a73eb544044bdcc0619ecfbb982ea5,10/18(金) 18:07
2024-10-19,09:29,world,国際,33アングル：豪が子どものＳＮＳ利用禁止を計画、「孤立」懸念する声もロイター10/19(土) 8:0910件/時,ロイター,アングル：豪が子どものＳＮＳ利用禁止を計画、「孤立」懸念する声も,10,https://news.yahoo.co.jp/articles/5afafa21cb1c5c01cdb8a1a449d66c14ae1f197d,10/19(土) 8:09
2024-10-19,09:29,world,国際,34北朝鮮が1万2千人派兵決定と韓国情報機関共同通信10/18(金) 18:0210件/時,共同通信,北朝鮮が1万2千人派兵決定と韓国情報機関,10,https://news.yahoo.co.jp/articles/e78a56479031fc2d9aae46d9c7c751144b0a714a,10/18(金) 18:02
2024-10-19,09:29,world,国際,35欧州で小包が出火する事件相次ぐ ロシア関与の可能施があるとみて捜査テレビ朝日系（ANN）10/19(土) 3:4410件/時,テレビ朝日系（ANN）,欧州で小包が出火する事件相次ぐ ロシア関与の可能施があるとみて捜査,10,https://news.yahoo.co.jp/articles/0692590f6a8a416111976fc1597c9652b686be8a,10/19(土) 3:44
2024-10-19,09:29,world,国際,36【図解】減少する中国赴任希望＝日系企業、人材確保に懸念―男児刺殺1カ月時事通信10/19(土) 7:3110件/時,時事通信,【図解】減少する中国赴任希望＝日系企業、人材確保に懸念―男児刺殺1カ月,10,https://news.yahoo.co.jp/articles/6549e17d20525f16374ad603a8e68dfdffa6d533,10/19(土) 7:31
2024-10-19,09:29,world,国際,37ロシアに着いた北朝鮮の特殊部隊、顔立ち似ている地域住民を偽装した身分証渡され…戦線投入へ訓練中か読売新聞オンライン10/19(土) 6:5110件/時,読売新聞オンライン,ロシアに着いた北朝鮮の特殊部隊、顔立ち似ている地域住民を偽装した身分証渡され…戦線投入へ訓練中か,10,https://news.yahoo.co.jp/articles/c18a73b088ac1d5dcb63ea32b675ee081c17355a,10/19(土) 6:51
2024-10-19,09:29,world,国際,38金正恩総書記「つまらぬ同族意識と非現実的な統一の認識を払拭した」…道路・鉄道爆破に言及　北朝鮮メディアFNNプライムオンライン（フジテレビ系）10/18(金) 12:079件/時,FNNプライムオンライン（フジテレビ系）,金正恩総書記「つまらぬ同族意識と非現実的な統一の認識を払拭した」…道路・鉄道爆破に言及　北朝鮮メディア,9,https://news.yahoo.co.jp/articles/0def6872ae255d8ec84447d0d5905bd2c448eb38,10/18(金) 12:07
2024-10-19,09:29,world,国際,39【解説】 イスラエル軍はどのようにシンワル氏を見つけ殺害したのかBBC News10/18(金) 15:179件/時,BBC News,【解説】 イスラエル軍はどのようにシンワル氏を見つけ殺害したのか,9,https://news.yahoo.co.jp/articles/5f9dec20c5272e67fc300bc0d066799cd0daea94,10/18(金) 15:17
2024-10-19,09:29,world,国際,40ＮＡＴＯへの即時・無条件の加盟招待を訴えるゼレンスキー氏、５項目の「勝利計画」公表…米独は慎重姿勢崩さず読売新聞オンライン10/19(土) 8:069件/時,読売新聞オンライン,ＮＡＴＯへの即時・無条件の加盟招待を訴えるゼレンスキー氏、５項目の「勝利計画」公表…米独は慎重姿勢崩さず,9,https://news.yahoo.co.jp/articles/6b776176d3e2e5a8eebc3b3573325b8ee02e9aff,10/19(土) 8:06
