scrp_date,scrp_time,genre_en,genre_jp,rank,media_jp,title,comment,link,date_original
2024-10-19,20:06,business,経済,1パチンコ・パチスロ「大規模な規則改正」で業界に激震。低迷が続くパチンコの復活はあるのか週刊SPA!10/19(土) 8:26192件/時,週刊SPA!,パチンコ・パチスロ「大規模な規則改正」で業界に激震。低迷が続くパチンコの復活はあるのか,192,https://news.yahoo.co.jp/articles/c96040e4e1751610a7d09a9854f75b1970ac9abd,10/19(土) 8:26
2024-10-19,20:06,business,経済,2福岡県筑前町が全町民3万850人に新米5kg配布へ…物価高騰に直面する家計を応援読売新聞オンライン10/19(土) 13:19125件/時,読売新聞オンライン,福岡県筑前町が全町民3万850人に新米5kg配布へ…物価高騰に直面する家計を応援,125,https://news.yahoo.co.jp/articles/1f03ad746775cd35a1682c2fb88c6a1afef7ad84,10/19(土) 13:19
2024-10-19,20:06,business,経済,3コストコとイケアはなぜ時給が高いのか？　日本企業の「人手不足」はただの言い訳に過ぎないITmedia ビジネスオンライン10/19(土) 6:1594件/時,ITmedia ビジネスオンライン,コストコとイケアはなぜ時給が高いのか？　日本企業の「人手不足」はただの言い訳に過ぎない,94,https://news.yahoo.co.jp/articles/ef20a0ca1afa464e1f99237c63baab5330bcbacd,10/19(土) 6:15
2024-10-19,20:06,business,経済,4最低賃金1500円で地方企業が廃業?　首相「公約」に危惧の声毎日新聞10/19(土) 5:0066件/時,毎日新聞,最低賃金1500円で地方企業が廃業?　首相「公約」に危惧の声,66,https://news.yahoo.co.jp/articles/06a2cd86abe118ded65ea383e3f49995fc1f2a56,10/19(土) 5:00
2024-10-19,20:06,business,経済,5車でコンビニに寄った際、5分程度だったので「エンジン」をかけたままお店に入りました。友人から「6000円の罰金になるよ」と言われたのですが、本当でしょうか…？ファイナンシャルフィールド10/19(土) 13:4053件/時,ファイナンシャルフィールド,車でコンビニに寄った際、5分程度だったので「エンジン」をかけたままお店に入りました。友人から「6000円の罰金になるよ」と言われたのですが、本当でしょうか…？,53,https://news.yahoo.co.jp/articles/f27296f4023f97705af43169671d4ef7b8472a26,10/19(土) 13:40
2024-10-19,20:06,business,経済,6《元阪神球団社長が激白》岡田監督退任の「真相」となくなった“後継・鳥谷監督”　藤川新監督誕生の裏で繰り広げられた親会社と球団の主導権争いマネーポストWEB10/19(土) 11:1552件/時,マネーポストWEB,《元阪神球団社長が激白》岡田監督退任の「真相」となくなった“後継・鳥谷監督”　藤川新監督誕生の裏で繰り広げられた親会社と球団の主導権争い,52,https://news.yahoo.co.jp/articles/1bbdc8671f58d0594a3769da74766c13bb3f2baa,10/19(土) 11:15
2024-10-19,20:06,business,経済,7元セクシー女優は“普通の仕事”に転職できる？5年前に退会したはずの転職エージェントから“まさかの連絡”が週刊SPA!10/19(土) 15:5447件/時,週刊SPA!,元セクシー女優は“普通の仕事”に転職できる？5年前に退会したはずの転職エージェントから“まさかの連絡”が,47,https://news.yahoo.co.jp/articles/dff534ab20871bd8596359b042f318c5bd6e8197,10/19(土) 15:54
2024-10-19,20:06,business,経済,8頼むからヤメてくれ！　トラックドライバーが頭を悩ませる乗用車の運転ダントツ1位は「速度が安定しない」だったWEB CARTOP10/18(金) 20:1046件/時,WEB CARTOP,頼むからヤメてくれ！　トラックドライバーが頭を悩ませる乗用車の運転ダントツ1位は「速度が安定しない」だった,46,https://news.yahoo.co.jp/articles/b950086b84b703ed313435a6757e8d3d7fdf6642,10/18(金) 20:10
2024-10-19,20:06,business,経済,9長く乗りたいなら[ソリオ]を激推し!! 1番人気の[ルーミー]よりオススメするワケベストカーWeb10/19(土) 19:0037件/時,ベストカーWeb,長く乗りたいなら[ソリオ]を激推し!! 1番人気の[ルーミー]よりオススメするワケ,37,https://news.yahoo.co.jp/articles/96edb73a6ecaafcc5f9d87b09e5da5e4401a5809,10/19(土) 19:00
2024-10-19,20:06,business,経済,101:06「最低賃金上げないことで、ダメな企業補助してる」　新浪代表幹事が政府に注文テレビ朝日系（ANN）10/19(土) 9:2433件/時,テレビ朝日系（ANN）,「最低賃金上げないことで、ダメな企業補助してる」　新浪代表幹事が政府に注文,33,https://news.yahoo.co.jp/articles/ab9e7885a5f317cde1bdd6c09dbfddc7a06f0e17,10/19(土) 9:24
2024-10-19,20:06,business,経済,11次のパンデミックに備え　ワクチン国内製造の動き始まる【WBS】テレ東BIZ10/19(土) 16:0032件/時,テレ東BIZ,次のパンデミックに備え　ワクチン国内製造の動き始まる【WBS】,32,https://news.yahoo.co.jp/articles/742df678ea70186b5988b98bfc242443b3fddb87,10/19(土) 16:00
2024-10-19,20:06,business,経済,12【独自】三菱ＵＦＪとＫＤＤＩ、証券・銀行の資本関係を見直しへ…「カブコム」「じぶん」完全子会社化読売新聞オンライン10/19(土) 13:3030件/時,読売新聞オンライン,【独自】三菱ＵＦＪとＫＤＤＩ、証券・銀行の資本関係を見直しへ…「カブコム」「じぶん」完全子会社化,30,https://news.yahoo.co.jp/articles/419e0eeb1635b94ff29714d6661e960f3ee0f378,10/19(土) 13:30
2024-10-19,20:06,business,経済,13阪急で起こった「十三駅撮り鉄救援車事件」　その原因を「撮り鉄目線」で考える鉄道コム10/19(土) 10:3526件/時,鉄道コム,阪急で起こった「十三駅撮り鉄救援車事件」　その原因を「撮り鉄目線」で考える,26,https://news.yahoo.co.jp/articles/28e5a9011c5e41f35d6cd7216ae3cc4a61fcf49a,10/19(土) 10:35
2024-10-19,20:06,business,経済,14ディーラーで「ヴォクシー」の商談をしています。15万円のコーティングを提案されているのですが、必要でしょうか？ カー用品店で「1万円」も出せばコーティング剤は買えると思うのですが、それだけの“メリット”はあるのでしょうか？ファイナンシャルフィールド10/19(土) 13:3024件/時,ファイナンシャルフィールド,ディーラーで「ヴォクシー」の商談をしています。15万円のコーティングを提案されているのですが、必要でしょうか？ カー用品店で「1万円」も出せばコーティング剤は買えると思うのですが、それだけの“メリット”はあるのでしょうか？,24,https://news.yahoo.co.jp/articles/801dfc8e7446e2ee2a99ca01e9643fefcb90592b,10/19(土) 13:30
2024-10-19,20:06,business,経済,15「女性の性被害が多い」 SNSで話題の「東京・水元公園」は本当に危険なのか？ 葛飾区の治安データから読み解く、SNSの危うさと真実とはMerkmal10/19(土) 6:1124件/時,Merkmal,「女性の性被害が多い」 SNSで話題の「東京・水元公園」は本当に危険なのか？ 葛飾区の治安データから読み解く、SNSの危うさと真実とは,24,https://news.yahoo.co.jp/articles/f4514510b2b46e62221f7a93b5185a51033358b2,10/19(土) 6:11
2024-10-19,20:06,business,経済,16石破首相「自己否定」で取り逃がした票はあまりに大きい!?選挙対策の“豹変”は逆効果ダイヤモンド・オンライン10/19(土) 7:3222件/時,ダイヤモンド・オンライン,石破首相「自己否定」で取り逃がした票はあまりに大きい!?選挙対策の“豹変”は逆効果,22,https://news.yahoo.co.jp/articles/ecca5c7586b3ce1dacc64b7e34c8561cc234ca2c,10/19(土) 7:32
2024-10-19,20:06,business,経済,17「北欧メーカー」がいつの間にやら「中国企業」に SAABのクルマ“涙の消滅劇” いま中古車高騰！乗りものニュース10/19(土) 18:1221件/時,乗りものニュース,「北欧メーカー」がいつの間にやら「中国企業」に SAABのクルマ“涙の消滅劇” いま中古車高騰！,21,https://news.yahoo.co.jp/articles/df1302156717efee4683db4ffba9dc6aeb87ef55,10/19(土) 18:12
2024-10-19,20:06,business,経済,181:15巧妙…でも日本語がおかしい　偽メール多発でヤマト運輸が消費者に注意呼びかけテレビ朝日系（ANN）10/19(土) 9:2120件/時,テレビ朝日系（ANN）,巧妙…でも日本語がおかしい　偽メール多発でヤマト運輸が消費者に注意呼びかけ,20,https://news.yahoo.co.jp/articles/57c0554c0c8f996fb1eb3446a39aa67a77876166,10/19(土) 9:21
2024-10-19,20:06,business,経済,19NHKスペシャル「ジャニー喜多川 “アイドル帝国”の実像」20日夜AV Watch10/19(土) 17:0119件/時,AV Watch,NHKスペシャル「ジャニー喜多川 “アイドル帝国”の実像」20日夜,19,https://news.yahoo.co.jp/articles/ce0334be73ee5c3dc3a634dfd1ad4b840ccd8cec,10/19(土) 17:01
2024-10-19,20:06,business,経済,20定年直後に世界一周はダメ…退職金の延命のために絶対行ってはいけない場所、手を出してはいけない商品プレジデントオンライン10/19(土) 15:1717件/時,プレジデントオンライン,定年直後に世界一周はダメ…退職金の延命のために絶対行ってはいけない場所、手を出してはいけない商品,17,https://news.yahoo.co.jp/articles/1476eba6f809c447ec3c0ec14ed7e3ce4a22bbf8,10/19(土) 15:17
2024-10-19,20:06,business,経済,21ロシア軍が「とてつもない数」の戦車を失う？ ウクライナ軍の撃破報告が“大台”に到達  驚愕の数字とは乗りものニュース10/19(土) 11:4217件/時,乗りものニュース,ロシア軍が「とてつもない数」の戦車を失う？ ウクライナ軍の撃破報告が“大台”に到達  驚愕の数字とは,17,https://news.yahoo.co.jp/articles/6efd1f0d3a851d57a2dc526811ae39a8dffa8913,10/19(土) 11:42
2024-10-19,20:06,business,経済,22資産5億円以上の「超富裕層」は9万世帯　13年から増加中　野村総研調査AERA dot.10/19(土) 17:2617件/時,AERA dot.,資産5億円以上の「超富裕層」は9万世帯　13年から増加中　野村総研調査,17,https://news.yahoo.co.jp/articles/c0e8f970716b4f887231dd8197c0bad9001457c6,10/19(土) 17:26
2024-10-19,20:06,business,経済,23“最低賃金1500円”巡り「払わぬ経営者は失格」　同友会・新浪氏毎日新聞10/18(金) 20:2816件/時,毎日新聞,“最低賃金1500円”巡り「払わぬ経営者は失格」　同友会・新浪氏,16,https://news.yahoo.co.jp/articles/f05d103084e9842f80bb4b335237b60da6e072ab,10/18(金) 20:28
2024-10-19,20:06,business,経済,24F-35戦闘機「全部同じじゃないですか!?」「よく見ろ！全然違う」タミヤ担当者が激白、最もキット化し難かったタイプは？乗りものニュース10/19(土) 19:1215件/時,乗りものニュース,F-35戦闘機「全部同じじゃないですか!?」「よく見ろ！全然違う」タミヤ担当者が激白、最もキット化し難かったタイプは？,15,https://news.yahoo.co.jp/articles/41bdfe895e5baa832ac68972bbe99197fa9d900d,10/19(土) 19:12
2024-10-19,20:06,business,経済,2560歳で定年を迎えた後に、再雇用で働くか迷っています。再雇用で働くメリットはありますか？ファイナンシャルフィールド10/19(土) 17:1014件/時,ファイナンシャルフィールド,60歳で定年を迎えた後に、再雇用で働くか迷っています。再雇用で働くメリットはありますか？,14,https://news.yahoo.co.jp/articles/6237af6d3f1e7f13f54f4a4c6e104db512c6405e,10/19(土) 17:10
2024-10-19,20:06,business,経済,26【解説】“最低賃金1500円”めぐり「払えない企業は駄目」「物事自体が矛盾している」経済界の異なる意見を読み解く日テレNEWS NNN10/19(土) 7:0013件/時,日テレNEWS NNN,【解説】“最低賃金1500円”めぐり「払えない企業は駄目」「物事自体が矛盾している」経済界の異なる意見を読み解く,13,https://news.yahoo.co.jp/articles/3b661308e0d67efddc2dee1d335ba46eb498f4bb,10/19(土) 7:00
2024-10-19,20:06,business,経済,27年金ってギャンブルだな…年金月12万円、“趣味に生きる”62歳サラリーマンが「年金の繰上げ受給」を選択して大後悔したワケ【CFPの助言】THE GOLD ONLINE（ゴールドオンライン）10/19(土) 11:0213件/時,THE GOLD ONLINE（ゴールドオンライン）,年金ってギャンブルだな…年金月12万円、“趣味に生きる”62歳サラリーマンが「年金の繰上げ受給」を選択して大後悔したワケ【CFPの助言】,13,https://news.yahoo.co.jp/articles/51538f1b2af9882ab9e1bdd6c600dd167f43b36b,10/19(土) 11:02
2024-10-19,20:06,business,経済,28もうクルマから降りたくない！　1990年代にオーナーを陶酔させた「唯一無二」のインテリアの国産車7台WEB CARTOP10/19(土) 17:4013件/時,WEB CARTOP,もうクルマから降りたくない！　1990年代にオーナーを陶酔させた「唯一無二」のインテリアの国産車7台,13,https://news.yahoo.co.jp/articles/b94ebd789a62240f1cee96beb02bf43e9348edff,10/19(土) 17:40
2024-10-19,20:06,business,経済,29トヨタ新型「ハイエース!?」に反響殺到！ 「カッコ良い」「室内広くて車中泊イケそう」「デカすぎ」の声！ 特許庁公表で“市販化”の期待高まる「グローバルハイエース」に熱視線！くるまのニュース10/19(土) 17:1012件/時,くるまのニュース,トヨタ新型「ハイエース!?」に反響殺到！ 「カッコ良い」「室内広くて車中泊イケそう」「デカすぎ」の声！ 特許庁公表で“市販化”の期待高まる「グローバルハイエース」に熱視線！,12,https://news.yahoo.co.jp/articles/e801dc36fb0ab0405ec3b54c2dbf552a02fe8dfb,10/19(土) 17:10
2024-10-19,20:06,business,経済,30いまさら聞けない、なぜ日本で「人手不足」が深刻化しているのか現代ビジネス10/19(土) 6:2012件/時,現代ビジネス,いまさら聞けない、なぜ日本で「人手不足」が深刻化しているのか,12,https://news.yahoo.co.jp/articles/e94568df9ee0c2e39f09ce7a6c30422f63a85845,10/19(土) 6:20
2024-10-19,20:06,business,経済,31「株式投資はインフレ対策」楽観論に潜む“先入観のワナ”に注意を　人口減少下で日本の消費は伸びるのかAERA dot.10/19(土) 16:3212件/時,AERA dot.,「株式投資はインフレ対策」楽観論に潜む“先入観のワナ”に注意を　人口減少下で日本の消費は伸びるのか,12,https://news.yahoo.co.jp/articles/73ee803e1f36960614b5827576a2ad65c95033b8,10/19(土) 16:32
2024-10-19,20:06,business,経済,32【元首相補佐官が分析】10・27総選挙が「自民・公明連立の曲がり角」になる理由　25年間の選挙協力関係が機能停止する可能性もマネーポストWEB10/19(土) 11:1511件/時,マネーポストWEB,【元首相補佐官が分析】10・27総選挙が「自民・公明連立の曲がり角」になる理由　25年間の選挙協力関係が機能停止する可能性も,11,https://news.yahoo.co.jp/articles/e5c9fc4af01484f2ffad85e58472d360bf31518b,10/19(土) 11:15
2024-10-19,20:06,business,経済,33米でサブスクの複雑な解約禁止に、契約時と同じ数の手順での解約義務付け読売新聞オンライン10/19(土) 19:3110件/時,読売新聞オンライン,米でサブスクの複雑な解約禁止に、契約時と同じ数の手順での解約義務付け,10,https://news.yahoo.co.jp/articles/1e6e980cf85e9190f19b2e85ea92c5284b97b00a,10/19(土) 19:31
2024-10-19,20:06,business,経済,34日産「スカイライン“SUV”」がスゴイ！ 大排気量「V6エンジン」＆“FR”採用の流麗ボディ！ “レザー×ウッド”の豪華内装もステキな「クロスオーバー」とは？くるまのニュース10/19(土) 18:1010件/時,くるまのニュース,日産「スカイライン“SUV”」がスゴイ！ 大排気量「V6エンジン」＆“FR”採用の流麗ボディ！ “レザー×ウッド”の豪華内装もステキな「クロスオーバー」とは？,10,https://news.yahoo.co.jp/articles/683f0de19a7c04e6015a4e608599cd49f5d97e9c,10/19(土) 18:10
2024-10-19,20:06,business,経済,35かつてサラリーマンにとって欠かせないツールだった「名刺」の現在地　「なくても仕事はできる」「個人情報が流出するのは怖い」マネーポストWEB10/19(土) 16:1510件/時,マネーポストWEB,かつてサラリーマンにとって欠かせないツールだった「名刺」の現在地　「なくても仕事はできる」「個人情報が流出するのは怖い」,10,https://news.yahoo.co.jp/articles/2f7388b1eebb6166e5a32cfe399c49da36723a36,10/19(土) 16:15
2024-10-19,20:06,business,経済,36「今でもラーメンは430円」「地元密着型」のスガキヤ。低価格を維持してこられた理由と、こんなにもある”強さの秘訣”東洋経済オンライン10/19(土) 6:3210件/時,東洋経済オンライン,「今でもラーメンは430円」「地元密着型」のスガキヤ。低価格を維持してこられた理由と、こんなにもある”強さの秘訣”,10,https://news.yahoo.co.jp/articles/39b09df3478d342739a5a4511a7405b0fb2478e5,10/19(土) 6:32
2024-10-19,20:06,business,経済,37「貯金ができない」と嘆いているのに趣味のゲームにお金を使い続ける20代息子。今どきの若い世代はそういう方が多いのでしょうか？ファイナンシャルフィールド10/19(土) 15:2010件/時,ファイナンシャルフィールド,「貯金ができない」と嘆いているのに趣味のゲームにお金を使い続ける20代息子。今どきの若い世代はそういう方が多いのでしょうか？,10,https://news.yahoo.co.jp/articles/518644b0107c80e492cdced9e68bff236f91ba00,10/19(土) 15:20
2024-10-19,20:06,business,経済,38最賃払えない企業は退出を　1500円目標で新浪氏共同通信10/18(金) 23:4210件/時,共同通信,最賃払えない企業は退出を　1500円目標で新浪氏,10,https://news.yahoo.co.jp/articles/e05885877e1d58ca625e2b33f1ad2138ab8764dd,10/18(金) 23:42
2024-10-19,20:06,business,経済,39韓国、トルコの電気バスも日本上陸　最新技術の展示イベント　東京時事通信10/19(土) 18:569件/時,時事通信,韓国、トルコの電気バスも日本上陸　最新技術の展示イベント　東京,9,https://news.yahoo.co.jp/articles/c810e2ccee77180e65e1b4031fe8f8379fcb2aae,10/19(土) 18:56
2024-10-19,20:06,business,経済,40スバル新型「フォレスター」国内モデルの発表時期が明らかに！ 初の本格ハイブリッド搭載で燃費向上も！ どんなモデルで登場する？くるまのニュース10/19(土) 13:109件/時,くるまのニュース,スバル新型「フォレスター」国内モデルの発表時期が明らかに！ 初の本格ハイブリッド搭載で燃費向上も！ どんなモデルで登場する？,9,https://news.yahoo.co.jp/articles/b282b4ea2090db76da9a02244dae06568b0e78b7,10/19(土) 13:10
