scrp_date,scrp_time,genre_en,genre_jp,rank,media_jp,title,comment,link,date_original
2025-07-09,19:08,TTL,総合,1,読売新聞オンライン,小学６年の女子児童ら、下着脱ぎ体操服１枚で男子児童と授業受けさせられる…冷やかされた子も,1495,https://news.yahoo.co.jp/articles/3e300733e00472428aeb7cbf7bea1cdcca2a74c3,7/9(水) 16:00
2025-07-09,19:08,TTL,総合,2,MBSニュース,【速報】自民・鶴保参院議員が陳謝撤回「運良く、などと思った発言ではありません」　記者会見で離党は否定「配慮が足りないと言われれば全くその通り」,484,https://news.yahoo.co.jp/articles/f57b51605ec35e541f842aaeec47e4bdfef8f653,7/9(水) 11:00
2025-07-09,19:08,TTL,総合,3,女性自身,「差別的で無理！」人気女性アーティスト（32）が参政党への“違和感”をインスタで告白…新憲法案にも苦言,411,https://news.yahoo.co.jp/articles/6b836348a1681ac70aeb35c5d6adeabf6579ff4e,7/9(水) 18:35
2025-07-09,19:08,TTL,総合,4,日テレNEWS NNN,自民・鶴保庸介参院議員に厳重注意「運のいいことに能登で地震があった」発言で,338,https://news.yahoo.co.jp/articles/3c7955b901691ea8bd236681345265a4a6a089eb,7/9(水) 14:24
2025-07-09,19:08,TTL,総合,5,朝日新聞,消防団員、個人報酬を受け取れず　現金で「上納」させる不正が相次ぐ,307,https://news.yahoo.co.jp/articles/7fd936b0e8a7a0bb1a67d6ea2dd7035ae12344e0,7/9(水) 11:34
2025-07-09,19:08,TTL,総合,6,日テレNEWS NNN,石破首相がアナウンサーをどう喝？　“誤情報”拡散で「パワハラ総理」→実際は？　「悪質な切り取り」の声も【それって本当？】,302,https://news.yahoo.co.jp/articles/f0bd7fb26993e0df4bfa8a0244efcb90c6d15d34,7/9(水) 9:55
2025-07-09,19:08,TTL,総合,7,文春オンライン,参政党・神谷代表の妻の会社に多額の政治資金が支払われていた　神谷氏本人に「講師料」の支出も《党の回答は…》,269,https://news.yahoo.co.jp/articles/076d7c21e4b6162ab711a8fc0fcd2665be31aec3,7/9(水) 16:13
2025-07-09,19:08,TTL,総合,8,スポニチアネックス,藤浪　日本球界復帰へ　新天地はNPB濃厚　近日中に帰国も,224,https://news.yahoo.co.jp/articles/a3cdff5acc4ffc9921cbcd1e57dd1d483029c33c,7/9(水) 2:00
2025-07-09,19:08,TTL,総合,9,日刊スポーツ,【参院選】山尾志桜里氏がＸ削除「小５男子が…女性天皇と選択的夫婦別姓」ツッコミ殺到していた,218,https://news.yahoo.co.jp/articles/a95064ba0bdb18a3a8cd692e7c1f1be77ea961db,7/9(水) 17:47
2025-07-09,19:08,TTL,総合,10,日刊スポーツ,Ｎ党立花孝志氏「斎藤さん、いい人」市民は「斎藤辞めろ」コール　斎藤知事の定例会見周辺は騒然,211,https://news.yahoo.co.jp/articles/6d49328f3c4a8e708de6cedc0972edb603bce2ed,7/9(水) 18:23
2025-07-09,19:08,TTL,総合,11,MRO北陸放送,能登の被災地「許せない」「非常識」 自民・鶴保氏の“運の良いことに地震”発言で,208,https://news.yahoo.co.jp/articles/3fdf73377b6461876081a43b08d11e11a32a613c,7/9(水) 12:57
2025-07-09,19:08,TTL,総合,12,スポニチアネックス,参政党・神谷代表　高齢女性発言あらためて釈明「高齢出産を指していない」　説明も記事化され「悪意ある」,196,https://news.yahoo.co.jp/articles/ecd35c3b7ec3c15770af04ed1aa7054cdca7c936,7/9(水) 18:06
2025-07-09,19:08,TTL,総合,13,SmartFLASH,フジテレビ“検証番組”が視聴率1％の大惨事、YouTubeもわずか9万回再生…世間はもう見捨てたのか？,193,https://news.yahoo.co.jp/articles/02f770b3fa897bd8510885c9b6fcfe02043ff0eb,7/9(水) 17:45
2025-07-09,19:08,TTL,総合,14,ロイター,トランプ氏、医薬品に200％関税も　半導体関税なども近く発表へ,193,https://news.yahoo.co.jp/articles/40ba3b46f59e1b5b84eb4b3717f31610fd6b424f,7/9(水) 5:57
2025-07-09,19:08,TTL,総合,15,毎日新聞,東京選挙区で参政党新人に殺害予告　国民民主新人も「追尾」被害,193,https://news.yahoo.co.jp/articles/7be1cbf13557daad125379b365e635a98316ad57,7/9(水) 18:01
2025-07-09,19:08,TTL,総合,16,産経新聞,参院選埼玉　自民、立民優勢、残る2議席を公明、共産、国民民主、参政が争う構図に,186,https://news.yahoo.co.jp/articles/ce3f0022045fc2b96b839cc8c832fac74218fc4c,7/9(水) 14:38
2025-07-09,19:08,TTL,総合,17,テレビ静岡NEWS,学歴詐称で辞意表明の田久保市長　決裁滞るも市役所にいまだ姿見せず「午前中は行けません」と電話したきり登庁時間伝えず　前日には職員に対する謝罪の場を設け「市政に混乱がないようにしっかり努めたい」と約束,185,https://news.yahoo.co.jp/articles/df6069d47e5bdec4e429388df274e86557931157,7/9(水) 14:07
2025-07-09,19:08,TTL,総合,18,東洋経済オンライン,「参政党の支持者は頭が悪い」と言う人もいるが…支持されるのには理由がある！参政党人気「理解できない」人が見誤る熱狂の“本質”,183,https://news.yahoo.co.jp/articles/e974d730f717e8c4e0332c2997063be57792826f,7/9(水) 7:02
2025-07-09,19:08,TTL,総合,19,読売新聞オンライン,「普通の子」の母は知る、娘が風俗店で働かされていたと…「若者に高額な借金を負わせるやり方は許せない」,182,https://news.yahoo.co.jp/articles/6bb5c229526961faca21b6d2946245d850a30976,7/9(水) 9:00
2025-07-09,19:08,TTL,総合,20,時事通信,石破政権、参院選への影響懸念　米関税交渉、立民代表が批判,178,https://news.yahoo.co.jp/articles/1f7ff5a8a4e58e854f3070ba4cf3f1a2749c8190,7/9(水) 7:05
2025-07-09,19:08,TTL,総合,21,RSK山陽放送,「セミが鳴いていない!?」空梅雨と急激な暑さで羽化に失敗か「35℃を超えるとあまり鳴かなくなる」,173,https://news.yahoo.co.jp/articles/e1fee5773b74363dfe3c36b74a60fb921c9ff763,7/9(水) 11:02
2025-07-09,19:08,TTL,総合,22,集英社オンライン,参政党の設立メンバーが分析「叩けば叩くほど逆効果」「これから記録的な大躍進」…反ワク、陰謀論は「初期段階にすぎない」,169,https://news.yahoo.co.jp/articles/ad32312ad089fe3c5991e174d8af73c11dd802e1,7/9(水) 11:02
2025-07-09,19:08,TTL,総合,23,ITmedia ビジネスオンライン,なぜラーメン二郎は信者を生むのか　支配と服従がもたらす“中毒性”の正体,166,https://news.yahoo.co.jp/articles/04e10c7a7ad2f7648948f59a54ee193a537ac1ef,7/9(水) 8:07
2025-07-09,19:08,TTL,総合,24,CoCoKARAnext,「帰ってきて1球団だけ、藤浪が心を許せる球団があると思う」日本球界復帰に現実味？　球界OBが剛腕の注目の移籍先を考察「下手したらクローザーやらせる」,160,https://news.yahoo.co.jp/articles/1ca35bf4ae2517d195f3e8a7cf7162a5536f7612,7/9(水) 12:38
2025-07-09,19:08,TTL,総合,25,デイリースポーツ,ゆりやん　式典で声出さず顔芸連発　主演「極悪女王」受賞、ステージ上で大暴れ,155,https://news.yahoo.co.jp/articles/ab068ffcb62e26280bf91d03644b3612707cd50e,7/9(水) 18:26
2025-07-09,19:08,TTL,総合,26,日刊スポーツ,ひろゆき氏、鶴保庸介氏の不適切発言に「これで受かったら和歌山県民はマジで人非人だな、、、」,149,https://news.yahoo.co.jp/articles/8857d5fb21a75a6afddd96c31d1f83b6cbf0aa50,7/9(水) 15:35
2025-07-09,19:08,TTL,総合,27,日刊スポーツ,自民が失言の鶴保庸介氏を厳重注意“火消し”急ぐも収束見通し立たず、参院選全体への影響懸念も,148,https://news.yahoo.co.jp/articles/f01f30099f46ba74abaddc2d4f63675795e777c9,7/9(水) 17:35
2025-07-09,19:08,TTL,総合,28,J-CASTニュース,藤浪晋太郎に阪神復帰「待望論」、日本復帰報道に虎党反応...「頼むぞフロント」「藤浪は阪神でこそ輝く」,148,https://news.yahoo.co.jp/articles/7ace205489a5f5b3b303176cf12626e072ba1153,7/9(水) 11:21
2025-07-09,19:08,TTL,総合,29,テレビ静岡NEWS,学歴詐称で辞意表明の田久保市長　決裁が溜まる中で午後3時に登庁　午前中に職員が「話したいことがあるため来てほしい」と伝えたものの…市政の混乱続く　本人は前日に「しっかり努めたい」と話したばかり,140,https://news.yahoo.co.jp/articles/88960853d381d655d9d8a2e3ca69c120c4fd08e6,7/9(水) 17:07
2025-07-09,19:08,TTL,総合,30,静岡朝日テレビ,「あいつうざいです」LINEのやりとりに容疑者の男が逆上か　浜松市・ガールズバー2人殺人事件,138,https://news.yahoo.co.jp/articles/a82727ad861decf2d936133016052f70a7911a56,7/9(水) 11:50
2025-07-09,19:08,TTL,総合,31,MBSニュース,【速報】元県民局長の死去から1年　斎藤知事は「あらためてお悔やみを申し上げたい」「漏えいについては、人事課からお話しさせていただいている」,138,https://news.yahoo.co.jp/articles/dafa34f2a080648675787e70d84de65b5258ebe5,7/9(水) 15:29
2025-07-09,19:08,TTL,総合,32,日テレNEWS NNN,共産党「若い層に届いていない」支持者高齢化…“老舗政党”の課題は？　れいわ新選組 相次ぐ“新興政党”で埋没の危機…流れ取り戻せるか？【 #政党フカボリ ⑥】,137,https://news.yahoo.co.jp/articles/34c8829df44763ad92f2884c184fe141535eb4a3,7/9(水) 16:09
2025-07-09,19:08,TTL,総合,33,共同通信,両陛下、元横綱3人と懇談　モンゴル、朝青龍「感無量です」,132,https://news.yahoo.co.jp/articles/eba4cb9bd39bd377f45dbbc9f8e3ece3915bfcca,7/9(水) 15:41
2025-07-09,19:08,TTL,総合,34,まいどなニュース,スシローで、客の手がブラリ「気持ち悪い…迷惑」　注意もできず「絶対つらい」「隣の列でこれ見ました！」,119,https://news.yahoo.co.jp/articles/ec6a923f5a80b46ff45cabec9f824be103ee3f53,7/9(水) 7:20
2025-07-09,19:08,TTL,総合,35,デイリー新潮,「参政党の神谷さんは陰謀論に染まり切っている」　元党員が証言　「勉強会で語る”歴史の真実”は陰謀史観そのもの」,119,https://news.yahoo.co.jp/articles/fa2e122ac5fbdf08965ab93070a1f54ef650237f,7/9(水) 12:04
2025-07-09,19:08,TTL,総合,36,読売テレビ,【速報】女子高校生が高齢男性が運転する軽自動車にはねられ意識不明の重体　登校中か　和歌山市,115,https://news.yahoo.co.jp/articles/d712f76af95c094bca2a4dfe190fee2ca5e5f0a5,7/9(水) 10:12
2025-07-09,19:08,TTL,総合,37,プレジデントオンライン,「若者にお金がないから」ではない…日本人から「結婚して子育てする」という選択肢が消えていく3つの原因,112,https://news.yahoo.co.jp/articles/0cd210ffbe8df18f0c563f4fe425767823057e52,7/9(水) 18:17
2025-07-09,19:08,TTL,総合,38,産経新聞,「入管を爆破せよ」送還のクルド男性、搭乗時に大声上げるも最後は涙「アベマに出すぎた」　「移民」と日本人,110,https://news.yahoo.co.jp/articles/45cdee29cbc4cf6547d6099add1befb5a04b5d42,7/9(水) 7:00
2025-07-09,19:08,TTL,総合,39,時事通信,自民・鶴保氏「運良く能登地震あった」　発言を陳謝・撤回【25参院選】,108,https://news.yahoo.co.jp/articles/fd8d90f43f5727e9aa753220b1cb9f755a4129eb,7/8(火) 22:24
2025-07-09,19:08,TTL,総合,40,TBS NEWS DIG Powered by JNN,【中日9日スタメン】村松はベンチ 辻本2番セカンド クリーンナップは上林 細川 ボスラー 山本7番ショート 先発高橋宏斗 捕手は石伊,108,https://news.yahoo.co.jp/articles/0cc92d1a34d75eee812182fc9ebb320bb98b5533,7/9(水) 17:11
