scrp_date,scrp_time,genre_en,genre_jp,rank,media_jp,title,comment,link,date_original
2025-11-09,16:07,business,経済,1,東京商工リサーチ,"2025年の「ハンバーガー店」倒産が年間最多を更新　2,000円超の高級品と手頃な大手チェーン店の二極化が進行",157,https://news.yahoo.co.jp/articles/5db48e38c88f3f994a403586a627087d799deef1,11/9(日) 7:02
2025-11-09,16:07,business,経済,2,週刊SPA!,「残クレで車を買う人は情弱」元ディーラー営業マンが明かす“残価設定型ローン”の落とし穴。銀行ローンの差額は50万円以上,86,https://news.yahoo.co.jp/articles/f7a26ea98fa39c5644fd3d52ffb2df5104566117,11/9(日) 8:55
2025-11-09,16:07,business,経済,3,日テレNEWS NNN,関税、半導体…自動車各社に2つの重荷　今後の反転は？　各社の決算から読み解く,74,https://news.yahoo.co.jp/articles/3e6a9b9ed92d5bd3b131a31ee0d14b977f4c1d9d,11/9(日) 14:30
2025-11-09,16:07,business,経済,4,TBS NEWS DIG Powered by JNN,"なぜ?50年前に“撤退”した「カップライス」が“令和の新定番”に【THE TIME,】",65,https://news.yahoo.co.jp/articles/e7c2c24b611d5c2088c5e864fe0d97e1ea285f2e,11/9(日) 8:00
2025-11-09,16:07,business,経済,5,みんかぶマガジン,高市政権の経済政策は結局、何を狙ったものなのか…物価高騰下でサナエノミクスが発動されれば、円安・物価上昇の悪循環を招くリスクがあるとの見方は根強い,50,https://news.yahoo.co.jp/articles/8bd682949c71ad980d88c6f50337009502360e45,11/9(日) 12:10
2025-11-09,16:07,business,経済,6,マネーポストWEB,世界中で進行する右傾化・保守化の根本にある問題　人手不足解消のために、日本が参考にしたいドイツやオーストラリアの移民受け入れ策を大前研一氏が解説,44,https://news.yahoo.co.jp/articles/0ec9f083929fb4d418621efc52c46f5efa481742,11/9(日) 7:15
2025-11-09,16:07,business,経済,7,THE GOLD ONLINE（ゴールドオンライン）,トヨタを猛追するBYD、2030年には販売台数「1000万台」で並ぶ？…日本の“絶対王者”が揺らぐ可能性,42,https://news.yahoo.co.jp/articles/a1ea10db938834697c2b6a9806900ef832285bc1,11/9(日) 13:00
2025-11-09,16:07,business,経済,8,ファイナンシャルフィールド,「独身税は罰金」という未婚の兄。「独身・子どもがいないと損」と聞きますが、本当ですか？“引かれる金額”の目安も確認,35,https://news.yahoo.co.jp/articles/267da93a9660094e4dce5b9a85ad1bdfcfdd8ac8,11/9(日) 13:50
2025-11-09,16:07,business,経済,9,プレジデントオンライン,あんなに「EV嫌い」だったのに…ガソリン車を愛するモータージャーナリストが「EV推し」に転向したワケ,34,https://news.yahoo.co.jp/articles/80be230ca7bf5a16f3bd8b0a39daa2d262850e66,11/8(土) 16:15
2025-11-09,16:07,business,経済,10,産経新聞,「迷惑民泊」に住民ＮＯ　大阪市が一転、設置申請終了の波紋　業者は懸命のイメージ回復策,33,https://news.yahoo.co.jp/articles/65eba750a5424571787c1ee084fd2ad86304e602,11/9(日) 11:18
2025-11-09,16:07,business,経済,11,東洋経済オンライン,日本人の4分の3が「学歴フィルター」で不遇に？　日本を“活発な学力社会”に変える《人事制度改革》の処方箋,32,https://news.yahoo.co.jp/articles/7553320d1826018b6a4d25c2667fdd7d13132de0,11/9(日) 8:00
2025-11-09,16:07,business,経済,12,ファイナンシャルフィールド,ガソリン税「暫定税率」が年内廃止!? 今後は「ガソリンより軽油」が高くなる？ 三菱「デリカD：5」の場合、ガソリン車と比べどれだけ節約できるかも試算,31,https://news.yahoo.co.jp/articles/e0b0a6f3e0c64e96c835e930c917c8f9295114a1,11/9(日) 13:20
2025-11-09,16:07,business,経済,13,東洋経済オンライン,「早慶までなら努力でいける」MARCH以上の大学進学者がいない家庭に育った彼が8浪で慶應薬学部に合格するまで,31,https://news.yahoo.co.jp/articles/124e8a3f2c67a46be05220b35024e1758c7a78c2,11/9(日) 5:46
2025-11-09,16:07,business,経済,14,Merkmal,都営大江戸線4km延伸は「誰得」なのか？ バス限界＆人口減少を無視？ “黒字化40年”試算を考える,28,https://news.yahoo.co.jp/articles/2dba13b4a2c497ac1e8f4b6b6d100cf74e909c35,11/9(日) 5:51
2025-11-09,16:07,business,経済,15,THE GOLD ONLINE（ゴールドオンライン）,"じゃあ行ってくるよ…年収1,400万円・1億円超えタワマン居住の52歳部長。今日も妻に内緒で向かう「秘密の出勤先」",28,https://news.yahoo.co.jp/articles/271441944bfa3d857b6ba2817908f8bf3131ddab,11/9(日) 10:00
2025-11-09,16:07,business,経済,16,THE GOLD ONLINE（ゴールドオンライン）,"AIに仕事を奪われた…都内名門私大卒、米国留学でITを猛勉強、年収2,000万円のはずが、現実は年収400万円の平凡会社員。「職を選べない」20代エリートの敗北",26,https://news.yahoo.co.jp/articles/56f6106d5783187d213e0174eed3c7fe1fd9e878,11/9(日) 10:30
2025-11-09,16:07,business,経済,17,ファイナンシャルフィールド,【G1】天皇賞で「100万円」当たった！ 宝くじと同じで“税金は払わなくてもいい”ですよね？ 馬券を「20万円分」購入したケースで確認,25,https://news.yahoo.co.jp/articles/c59805ee0342bf3ad63bc790c764b15e3c13b02b,11/9(日) 14:30
2025-11-09,16:07,business,経済,18,みんかぶマガジン,日経平均株価5万円超え→4万5000円も？著名投資家が警鐘を鳴らす「高市ラリー」の反転シナリオ,25,https://news.yahoo.co.jp/articles/c35aeeab6cf8eb8efedf2fded914e31172527f65,11/9(日) 12:10
2025-11-09,16:07,business,経済,19,Car Watch,トヨタ、新型ハイエースとなるのか？　突然展示されたハイエースコンセプト,19,https://news.yahoo.co.jp/articles/e04341a3e9c66790c592cf27c38525e26c68b930,11/9(日) 13:48
2025-11-09,16:07,business,経済,20,ファイナンシャルフィールド,共働き「月収30万円」のわが家は、貯蓄が「100万円」しかありません…お金が貯まらないのは“夫婦別財布”のせいですか？ 家計には悪影響でしょうか…？,17,https://news.yahoo.co.jp/articles/719eb832741690c4dd6d14c3b1bc57ef7359ea0e,11/9(日) 14:20
2025-11-09,16:07,business,経済,21,MotorFan,最近のクルマが昔より大きく見えるのってなんで？,15,https://news.yahoo.co.jp/articles/e773ddd66144164251ab09da084bf463ac85cd56,11/9(日) 9:10
2025-11-09,16:07,business,経済,22,NEWSポストセブン,《葛飾区の南北移動問題に新展開》縦断する貨物線に路面電車を走らせるのではなく”バスでの旅客化”を目指すことになった理由,14,https://news.yahoo.co.jp/articles/fc6b7c8ecd3ea3dbd1a13f1462b283f7a649c099,11/9(日) 7:15
2025-11-09,16:07,business,経済,23,WEB CARTOP,イマドキの若者からしたら「冗談でしょ？」　昭和のクルマに大マジで採用されていた装備4選,13,https://news.yahoo.co.jp/articles/e06a62c0700d06d0dfe6141202548fef6b9e30d5,11/9(日) 11:50
2025-11-09,16:07,business,経済,24,ダイヤモンド・オンライン,トヨタ以外は負け？決算を見れば一発で分かる、トヨタと日産の「大きすぎる差」,12,https://news.yahoo.co.jp/articles/fc1a0582657e226f5f3b05f1e0d66744fc286f29,11/9(日) 6:00
2025-11-09,16:07,business,経済,25,ファイナンシャルフィールド,東京から大阪への年末帰省、手軽に新幹線を予約できると聞いて「LINEからEX」を試してみたら“クレカ払い”不可！ “約1万5000円”の支払いなら「スマートEX」を使ったほうがよい？,12,https://news.yahoo.co.jp/articles/5eb1cff8707da27887cbf09b416663fac99da2de,11/9(日) 13:50
2025-11-09,16:07,business,経済,26,ダイヤモンド・オンライン,「オッサン、邪魔なんだよ！」レア車両「ドクターイエロー」を撮っていたら若者に怒鳴られた…言い返す？黙っておく？,12,https://news.yahoo.co.jp/articles/a23df479dd5001431955118c6d2edd5f502f396c,11/9(日) 6:30
2025-11-09,16:07,business,経済,27,ダイヤモンド・オンライン,「発達障害だからって許されると思うなよ」と、密かに思ってる人に伝えたいこと,11,https://news.yahoo.co.jp/articles/4f6e2fcc3e263c1860c126a155fa1242a26a1b21,11/9(日) 7:25
2025-11-09,16:07,business,経済,28,THE GOLD ONLINE（ゴールドオンライン）,賃金上昇・ブラック企業減少・非効率企業の淘汰…意外に多い、日本の「労働者の不足」のメリット【経済評論家が解説】,11,https://news.yahoo.co.jp/articles/e4d0c2fe54caab4279d9cfc2fe3e3682ecdf4683,11/9(日) 5:00
2025-11-09,16:07,business,経済,29,ダイヤモンド・オンライン,マツダ「ロードスター」760万円でも倍率47.5倍の大人気！「RX-7」や「アイコニックSP」とのすみ分けは？役員に直撃,11,https://news.yahoo.co.jp/articles/041a12df0a326e69798b78436adcbfaefb1a1ae0,11/9(日) 11:30
2025-11-09,16:07,business,経済,30,LIMO,「1年で約10万人増加！精神障害者保健福祉手帳、所持者は154万人超！」どんな支援が受けられる？精神障がい者の雇用も増えている？,10,https://news.yahoo.co.jp/articles/99ffebb2e1ef091eabf1fcb31170986e793e865c,11/9(日) 11:55
2025-11-09,16:07,business,経済,31,ITmedia ビジネスオンライン,欧州家電市場から脱落する日本メーカー──主役は韓国・中国製に,10,https://news.yahoo.co.jp/articles/bc2c1d42236b6ec21fcdcb50549bd90ec7dbcda3,11/8(土) 17:51
2025-11-09,16:07,business,経済,32,ファイナンシャルフィールド,「新幹線の指定席」に座ったら、“隣の大荷物”で窮屈！ 自由席に避難したいですが、指定席券のほうが“料金が高い”ですよね？ 勝手に移動しても問題ないでしょうか？,10,https://news.yahoo.co.jp/articles/620489a7fb4b0bfe97375052988769dfce62a5e4,11/9(日) 14:10
2025-11-09,16:07,business,経済,33,乗りものニュース,重さ約200キロ！ 自衛隊がクマ対策で「デカい箱罠」を運ぶ様子が公開される 軽トラから降ろすのも一苦労!?,10,https://news.yahoo.co.jp/articles/db504f32072d839bd3f1356743b648a424165c28,11/9(日) 7:12
2025-11-09,16:07,business,経済,34,THE GOLD ONLINE（ゴールドオンライン）,「兄はすぐ売ればいいって言ったけど…」亡父の相続で“見覚えのないファンド名”に戸惑った姉弟。5年後、“明暗”が分かれた理由,9,https://news.yahoo.co.jp/articles/47070183ee70e2489b83fd8cae0debbd72c11449,11/9(日) 8:00
2025-11-09,16:07,business,経済,35,ベストカーWeb,ミニバンなのに加速感ハンパねぇ!!　ホンダ オデッセイのEVばりの加速感を体感せよ!!,9,https://news.yahoo.co.jp/articles/7298c89fc430d2b4b020e2e190a6d0fca7a051d4,11/9(日) 10:05
2025-11-09,16:07,business,経済,36,MotorFan,攻撃ヘリは時代遅れなのか？ ドローン時代に適応した新たな能力に生き残りをかける,9,https://news.yahoo.co.jp/articles/e6d5641da3a4feb015b4c0a3faa3810d97a9cd10,11/9(日) 9:18
2025-11-09,16:07,business,経済,37,Merkmal,率直に問う もはや自転車は「免許制」にすべきか？ 氾濫する“無秩序リスク”を考える,9,https://news.yahoo.co.jp/articles/f68f2c811c0ae0b77591f92749e4cd023352f70a,11/9(日) 9:50
2025-11-09,16:07,business,経済,38,ファイナンシャルフィールド,先日「マイナ免許証」に切り替え、「iPhoneマイナ」の搭載も完了！ でも「マイナンバーカード」を家に置いたまま車を運転すると「罰金3000円」の可能性があるって本当!?,8,https://news.yahoo.co.jp/articles/dcef179ad5989b12f3bb101de5eb65d3f139b99f,11/9(日) 14:40
2025-11-09,16:07,business,経済,39,マネーポストWEB,飲み会の「二次会離れ」がすっかり定着　コロナ禍が明けても物価高騰で「一次会と合わせて8000円払うのはキツイ…」、一次会早めスタートで21時には帰路に,8,https://news.yahoo.co.jp/articles/fe40fa8cd8ea0672c3e11558e60c5d5a0313f563,11/8(土) 16:15
2025-11-09,16:07,business,経済,40,プレジデントオンライン,「醤油は黒い」って誰が決めたの?…世界で大ヒット「透明な醤油」を生み出した素人社長のむちゃぶり,8,https://news.yahoo.co.jp/articles/b66620fad73135ce2ca87a6ae99adc9eb924b270,11/9(日) 7:20
