scrp_date,scrp_time,genre_en,genre_jp,rank,media_jp,title,comment,link,date_original
2025-11-09,10:35,domestic,国内,1,日刊スポーツ,北村晴男氏、立民女性議員の質問に「こんなレベルの低い質問が延々と行われているとは。驚きだ」,622,https://news.yahoo.co.jp/articles/d4a5f28edcde605b766c854a865c81f3ce12a8af,11/9(日) 8:06
2025-11-09,10:35,domestic,国内,2,日刊スポーツ,共産党議員が主張「２日前通告ルールなるものは存在しない」高市首相「午前３時問題」巡り異論,590,https://news.yahoo.co.jp/articles/d000a1981fa0a5a3acb354907435015d0f11dfa0,11/9(日) 7:13
2025-11-09,10:35,domestic,国内,3,日刊スポーツ,元TBSの立民議員「デマを飛ばすな」参政党・神谷宗幣代表を批判　「報道特集」の内容に触れ,467,https://news.yahoo.co.jp/articles/a0702f14643b25667fcd97b830d05ab6832cc8b1,11/9(日) 9:00
2025-11-09,10:35,domestic,国内,4,日刊スポーツ,「仕事大好き人間の高市総理だって午前３時に出勤なんてしたいわけありません」自民側近が苦情,306,https://news.yahoo.co.jp/articles/33b890e172bda9e3741346f3b6bb30eb1480102f,11/9(日) 9:22
2025-11-09,10:35,domestic,国内,5,日刊スポーツ,古舘伊知郎、高市内閣「支持率82％」に「おかしい。これは支持率じゃありません」,300,https://news.yahoo.co.jp/articles/cd04a08bb256df9159badd49cfb941ced625a112,11/9(日) 6:25
2025-11-09,10:35,domestic,国内,6,日刊スポーツ,小沢一郎氏、高市氏の今後「最大の敵」に８文字で言及「野党でも自民党内の反対勢力でもなく…」,286,https://news.yahoo.co.jp/articles/af099959f26bc28fe8ee192bfc1e6d84cab57cae,11/9(日) 7:32
2025-11-09,10:35,domestic,国内,7,共同通信,首相の存立危機発言は「危険」　立民野田氏、国会で追及へ,284,https://news.yahoo.co.jp/articles/fe0ee24ab6945ecccb7e5127bffb1cfb10be3105,11/8(土) 18:32
2025-11-09,10:35,domestic,国内,8,朝日新聞,性別変更の外観要件、高裁が違憲判断,274,https://news.yahoo.co.jp/articles/c02307e87fa5151509cca27219dbe97f9c308b3a,11/9(日) 5:00
2025-11-09,10:35,domestic,国内,9,スポニチアネックス,立民議員「高市総理は本当に危険だ」　台湾有事巡る答弁を連続投稿で批判「勇ましさは浅ましさ」,242,https://news.yahoo.co.jp/articles/633a830df35f8b56568f3b6ece102f3ac8275bec,11/8(土) 16:23
2025-11-09,10:35,domestic,国内,10,関西テレビ,NHK党の立花孝志党首を逮捕　死亡した竹内英明元県議の名誉を棄損した疑い　兵庫県警,240,https://news.yahoo.co.jp/articles/f177a849198f05d25e24e2e740a1662f6721d2be,11/9(日) 9:31
2025-11-09,10:35,domestic,国内,11,デイリースポーツ,【高市自民】ネット大荒れ「質問のレベル低すぎ」「ネチネチしつこい」国会予算委→１分で終わる週刊誌ネタで延々質問続けた立憲女性議員　大臣謝罪も許さず説教→総理も詰問「時間の無駄」「うんざり」「簡潔に」賞賛意見は見当たらず,208,https://news.yahoo.co.jp/articles/072ed374ce54484ff5950a7afaf4463ba8ae8d8c,11/8(土) 18:25
2025-11-09,10:35,domestic,国内,12,日刊スポーツ,玉木雄一郎代表「国民民主は守っている」質問の事前通告申し合わせ　高市首相の午前３時出勤問題,206,https://news.yahoo.co.jp/articles/5347a9c86d099db205c9723c2947d7238d192b34,11/9(日) 9:00
2025-11-09,10:35,domestic,国内,13,日刊スポーツ,北方領土対岸で「外国に近い」発言　高市政権の北方担当相に立民から猛批判「論外。辞職すべき」,205,https://news.yahoo.co.jp/articles/f07fb698088324d3ec6ea4f2ca4d28805001533e,11/9(日) 9:42
2025-11-09,10:35,domestic,国内,14,TBS NEWS DIG Powered by JNN,【速報】立花孝志NHK党党首を元兵庫県議への名誉毀損容疑で逮捕　兵庫県警,193,https://news.yahoo.co.jp/articles/0cde17150bf889c299c5404af86d10806d406875,11/9(日) 9:37
2025-11-09,10:35,domestic,国内,15,デイリースポーツ,【高市自民】高市ＡＭ３時出勤の原因→質問通告ルール期限３０時間以上も遅れる政党　首相補佐官が暴露→【悲報】予算委で午前３時批判した政党に巨大ブーメランが直撃,185,https://news.yahoo.co.jp/articles/deca4e7b99df2c8f8d9fda7515bab477f9a4732f,11/8(土) 21:23
2025-11-09,10:35,domestic,国内,16,スポーツ報知,膳場貴子アナ、高市首相の財政関連の国会答弁に「なかなか実現たやすくないなと思うんですけど…」,171,https://news.yahoo.co.jp/articles/c1546c0ad41be28e366ae28770af4313be8f2d4b,11/9(日) 8:39
2025-11-09,10:35,domestic,国内,17,MBSニュース,【速報】NHK党党首・立花孝志容疑者を名誉毀損の疑いで逮捕　兵庫県警,164,https://news.yahoo.co.jp/articles/65d32639cc1f6294a2f4bf52435070537f4b5cce,11/9(日) 9:32
2025-11-09,10:35,domestic,国内,18,デイリースポーツ,【高市自民】批判された高市ＡＭ３時出勤の原因→質問通告２日前ルール守らない「野党２党」の名前　省庁も迷惑　外務副大臣が暴露「ルール守って論点明確に」「役人のせいにしないで」,163,https://news.yahoo.co.jp/articles/9ccfa016b9e50701a1c221610a585c45e1914f1b,11/8(土) 14:51
2025-11-09,10:35,domestic,国内,19,FNNプライムオンライン（フジテレビ系）,NHK党の立花孝志党首を逮捕　死亡した竹内英明元県議の名誉を棄損した疑い　兵庫県警,158,https://news.yahoo.co.jp/articles/b8c4f088df69bce86c5c9ed1b77c31c293aad97b,11/9(日) 9:39
2025-11-09,10:35,domestic,国内,20,産経新聞,外免切替厳格化で合格率56ポイント急落　ひき逃げ中国人「日本語わからぬと言えばいい」　「移民」と日本人,158,https://news.yahoo.co.jp/articles/298535e3e903e35368493193e66e3a98c12cfa9c,11/9(日) 7:00
2025-11-09,10:35,domestic,国内,21,プレジデントオンライン,韓国語学科に入れないから妥協で日本語を学ぶ…欧州の大学で起きている日本文化ボロ負けという不都合な真実,146,https://news.yahoo.co.jp/articles/6f027b6ad4d3fcd122566278dcb2438794f962cc,11/9(日) 8:15
2025-11-09,10:35,domestic,国内,22,スポニチアネックス,高市首相未明の出勤は野党に原因？　立民議員が続々反論　そもそも日程的に…「与党側の国会運営こそ問題」,138,https://news.yahoo.co.jp/articles/2e19fda0835a3f6a5f2ccca1422a099be5a2de6d,11/8(土) 22:41
2025-11-09,10:35,domestic,国内,23,文春オンライン,「永田町での権勢拡大が自己目的化してしまった」“維新の創業者”橋下徹が“馬場イズム”からの方針転換にエール,138,https://news.yahoo.co.jp/articles/6dec387e34519ea962646050b7bcdab446a224cd,11/9(日) 8:42
2025-11-09,10:35,domestic,国内,24,産経新聞,伊東市長選出馬予定のNHK党・立花氏、田久保前市長を観光大使に「数字持っている」,133,https://news.yahoo.co.jp/articles/075f11052c6232e64329123394158560bf89b17a,11/9(日) 7:00
2025-11-09,10:35,domestic,国内,25,産経新聞,高市首相、異例の「官僚レク」なしで国会答弁　3時出勤「宿舎のファクスが詰まったから」,129,https://news.yahoo.co.jp/articles/22960a530e7a049c64bfe30a1719044ebdb8ed23,11/9(日) 7:00
2025-11-09,10:35,domestic,国内,26,デイリースポーツ,【高市自民】国民裏目　石破前首相、２万円給付やめたに「えっ！？じゃあどうするの？」聞こえ良い野党の消費減税が支持され無理→結果おこめ券？←いまココ　石破氏「あの２万円、間違ってたと思いませんよ」,120,https://news.yahoo.co.jp/articles/fb2ee8fc912941764ef6a8eee8123641732b6358,11/8(土) 20:54
2025-11-09,10:35,domestic,国内,27,FNNプライムオンライン（フジテレビ系）,国民・玉木代表が「おこめ券」構想に苦言「大臣代わるたび方向性変わる。備蓄米放出は何だったんだ」,113,https://news.yahoo.co.jp/articles/138dc9d4f793336fc2b0abe1ea59b664f7ba6d92,11/9(日) 9:54
2025-11-09,10:35,domestic,国内,28,毎日新聞,立花孝志・NHK党首を名誉毀損容疑で逮捕　元兵庫県議への中傷で,104,https://news.yahoo.co.jp/articles/4334ed30495b92407dc4e55b248ce627d8c30b79,11/9(日) 9:34
2025-11-09,10:35,domestic,国内,29,日テレNEWS NNN,【速報】NHK党・党首の立花孝志容疑者（58）を名誉毀損容疑で逮捕　兵庫県警,82,https://news.yahoo.co.jp/articles/da15564a89df306b54059360191e15093695ef9d,11/9(日) 9:44
2025-11-09,10:35,domestic,国内,30,集英社オンライン,「クマに襲われたら頭蓋骨は粉々、顔も半分なくなる」“お前のところにクマ送る”発言の佐竹前秋田県知事独白40分「擁護派からの電話なんて切って当たり前」「知事時代、2300頭は駆除した」,81,https://news.yahoo.co.jp/articles/b8e76b5d70accdd8576f9a9e309873ac04bc8486,11/8(土) 11:00
2025-11-09,10:35,domestic,国内,31,デイリースポーツ,「コイツ態度デカい…」ケンカ腰会見ＴＶ全面謝罪の維新・藤田代表　ＶＳ橋下さんにもケンカ売ったら皆認めると東野番組で煽られ　速攻で橋下氏が反応　公開バトルか,78,https://news.yahoo.co.jp/articles/2d18c04a8ae755bc59b8104866220c6828ccfb2d,11/8(土) 19:56
2025-11-09,10:35,domestic,国内,32,女性自身,高市首相　“午前3時”からの勉強会が波紋…野党時代には鳩山内閣を「官僚に深夜残業を強いている」と糾弾の過去,76,https://news.yahoo.co.jp/articles/fdf86b790d9984a7380a3771f37aaf9acde7d60e,11/8(土) 11:00
2025-11-09,10:35,domestic,国内,33,ABEMA TIMES,医療費削減の重要項目「OTC類似薬の保険適用除外」は実現可能か 薬代高騰への不安も ひろゆき氏「始まってしまえばジェネリックによって安くなる」,72,https://news.yahoo.co.jp/articles/2bd974bea59bb0ec77dd8c776510805b77a2e890,11/9(日) 9:30
2025-11-09,10:35,domestic,国内,34,日刊スポーツ,田久保真紀前市長「私の誤った学歴が市の広報誌に掲載され…」失職後初のＸ更新で「深くお詫び」,66,https://news.yahoo.co.jp/articles/c32930c44eaa3636a248778ac152c450f89757ee,11/8(土) 20:23
2025-11-09,10:35,domestic,国内,35,集英社オンライン,「ロータリーがゴミだらけ」早稲田祭後の惨状が拡散、清掃に目覚めた理由「早大生がポイ捨てしたゴミを小学生が拾ってるって聞いて…」,65,https://news.yahoo.co.jp/articles/bdd6af028a0698613bd486973cc5d3d21177db1f,11/8(土) 13:00
2025-11-09,10:35,domestic,国内,36,日刊スポーツ,石破茂前首相が「鳥取応援団」自民女性議員の投稿リポスト「サゲ」発言の宮崎謙介氏は鳥取訪問へ,65,https://news.yahoo.co.jp/articles/d8b6e7863e53fdfb3679045f9f5b12cf5bf64775,11/9(日) 8:36
2025-11-09,10:35,domestic,国内,37,北海道新聞,高支持率の高市内閣　自民内に早期解散論「来年1月ベスト」　公明離脱で慎重論も,60,https://news.yahoo.co.jp/articles/3ffb42150763b169ea5be3285409a3bbaaed8b0e,11/9(日) 6:00
2025-11-09,10:35,domestic,国内,38,スポーツ報知,橋下徹氏、高市首相の午前３時の勉強会に「ものすごい熱量が伝わってきますが、国会システムがあまりに非生産的、前近代的」,60,https://news.yahoo.co.jp/articles/d7e16d573d8d543e70fec9300cdaa61f1879e998,11/9(日) 7:54
2025-11-09,10:35,domestic,国内,39,読売テレビ,【独自解説】「サナエノミクス」で暮らしはどう変わる？『くらし応援3点セット』の先に“解散論”？,59,https://news.yahoo.co.jp/articles/ea2e6abc5d4365bb993ba31eb85f90a9aba54a7b,11/8(土) 11:00
2025-11-09,10:35,domestic,国内,40,時事通信,立民「高市カラー」に照準　高支持率に攻め手欠く　強気首相答弁に懸念も〔深層探訪〕,59,https://news.yahoo.co.jp/articles/d9b480d5d7e1c0963467d9122896da24f638421b,11/9(日) 7:00
