scrp_date,scrp_time,genre_en,genre_jp,rank,media_jp,title,comment,link,date_original
2025-06-08,14:08,TTL,総合,1,スポニチアネックス,鶴瓶ら芸能界の友人に連絡か　中居氏が被害女性に不信感,449,https://news.yahoo.co.jp/articles/4401279376c61f6f4fa299c06a7f85c8020bed48,6/8(日) 8:20
2025-06-08,14:08,TTL,総合,2,スポニチアネックス,岸田文雄前首相　フジ報道番組に生出演、コメの適正価格聞かれ「日々生活する国民が判断して…」,281,https://news.yahoo.co.jp/articles/7c04a536a2e363dcfbaa48ca1ebb0a93865b2d7d,6/8(日) 12:30
2025-06-08,14:08,TTL,総合,3,デイリー新潮,「物流が止まっているのに、小泉さんは何を言ってるのか」　備蓄米が届かない背景にドライバー、精米工場の不足　「最初に備蓄米を買ったのはなんだったんだ」,276,https://news.yahoo.co.jp/articles/589e60edf56284221adb4c79f822fd9c9603b8d6,6/8(日) 6:08
2025-06-08,14:08,TTL,総合,4,日刊スポーツ,サンモニ膳場貴子「コメ卸業者がやり玉に」小泉進次郎農相の発言踏まえ「今、問われるのは…」,263,https://news.yahoo.co.jp/articles/08681ae9f79ddeb9589a018a6e57e6d93ecb4849,6/8(日) 13:23
2025-06-08,14:08,TTL,総合,5,テレビ朝日系（ANN）,備蓄米効果？コメの価格に異変　業者も驚き「正直こんな経験ない」,257,https://news.yahoo.co.jp/articles/48e3050ec59a96e4fa2e32abc3c094bac54d9519,6/7(土) 22:30
2025-06-08,14:08,TTL,総合,6,日刊スポーツ,ビートたけし、小泉進次郎農相の改革に持論「郵政民営化と同じ。日本の農業を米国に売り渡す」,213,https://news.yahoo.co.jp/articles/e0ea79c4a732d00914f044c55a2f397ad4a9c996,6/8(日) 12:39
2025-06-08,14:08,TTL,総合,7,日刊スポーツ,岸田文雄前首相に「誤りだったのでは？」指摘　コメ価格上昇も備蓄米放出しなかった判断問われ…,195,https://news.yahoo.co.jp/articles/70039bd421051d6190fd0ef6c3b418496525c67e,6/8(日) 11:00
2025-06-08,14:08,TTL,総合,8,ダイヤモンド・オンライン,「白鵬いじめが酷すぎる」耳を疑った“誓約書への署名”…白鵬に直撃取材した記者が語る“知られざる姿”,189,https://news.yahoo.co.jp/articles/fc10f0a0829f5650c2f20241ae76eb8859c4e041,6/8(日) 10:02
2025-06-08,14:08,TTL,総合,9,RKB毎日放送,立民・原口氏「古古古米はニワトリさんが一番食べている。人間さまは食べていない」備蓄米めぐり連合佐賀の参院選決起集会で,179,https://news.yahoo.co.jp/articles/aff0069d4edc4898bed120c4cf86c3b8652ba91b,6/7(土) 17:13
2025-06-08,14:08,TTL,総合,10,テレビ朝日系（ANN）,「主食のコメを外国に頼ってはいけない」自民・森山幹事長　輸入に否定的見解,159,https://news.yahoo.co.jp/articles/d0d99907cc6281f3810e2530bd7b217d6e81fc28,6/8(日) 6:28
2025-06-08,14:08,TTL,総合,11,オリコン,俳優・岡田龍太郎、司法試験に合格　久しぶりのSNS更新で衝撃報告　『仮面ライダーゼロワン』不破さん／仮面ライダーバルカン役で人気,158,https://news.yahoo.co.jp/articles/391ebf390f567eb659ed44541e7888889228f1d6,6/8(日) 10:49
2025-06-08,14:08,TTL,総合,12,TBS NEWS DIG Powered by JNN,【速報】石破総理「群馬と聞くと怖い人がたくさんいそう」と発言　その後「差別の意識は全くない」と釈明,158,https://news.yahoo.co.jp/articles/c4b1402800aeef8b1712a4d3d89c78e807ff5478,6/7(土) 16:27
2025-06-08,14:08,TTL,総合,13,SmartFLASH,渡邊渚さん　“怒りに満ちた手記”に広がる共感、“会見なし”松本人志・中居正広騒動で浮き彫りになった「二次加害」の恐怖,157,https://news.yahoo.co.jp/articles/4549a1d37b5e153cc75ca72a714208eea5a20e2b,6/7(土) 20:21
2025-06-08,14:08,TTL,総合,14,MRT宮崎放送,えびの市でパラグライダーが着陸失敗　男性1人が死亡　着陸する場所から100メートルほど北の畑に,157,https://news.yahoo.co.jp/articles/b080f4f4845deedd1a164a924396929189d49e41,6/8(日) 9:13
2025-06-08,14:08,TTL,総合,15,読売新聞オンライン,ファミレスに車で突っ込んだ女「店を壊すつもりだった」…警察駆け付けた直後に発進し３人負傷,153,https://news.yahoo.co.jp/articles/43111e4188db078b8a49062d4096f7ee197957e9,6/7(土) 21:29
2025-06-08,14:08,TTL,総合,16,佐賀ニュース サガテレビ,「本当のことを言ってはいけないのか」備蓄米で原口一博議員【佐賀市】,140,https://news.yahoo.co.jp/articles/b9160329769129f085d3a975752bbdbbb8691995,6/7(土) 19:35
2025-06-08,14:08,TTL,総合,17,スポニチアネックス,橋下徹氏　自公、国民民主の日本郵便への公的支援650億円案に異論「どこまで公が支援するんですか」,138,https://news.yahoo.co.jp/articles/7ddc16a3dec0c612185adfb824af5bf46a2898d1,6/8(日) 12:57
2025-06-08,14:08,TTL,総合,18,スポニチアネックス,【陸上】45歳の末續慎吾、11秒08で涙「人生でこんなに悔しいことが…」　世界陸上への道を絶たれ,138,https://news.yahoo.co.jp/articles/8c52b3b00e483f8aaa28d1d7c6d785c3e76226b6,6/8(日) 11:46
2025-06-08,14:08,TTL,総合,19,スポニチアネックス,岸田文雄前首相　自身の政権時にコメ価格が1・8倍「経緯を今1度しっかりと検証していくことが大事」,137,https://news.yahoo.co.jp/articles/5fb6a4a1fdceb191a59d911362e428697692b71c,6/8(日) 10:25
2025-06-08,14:08,TTL,総合,20,FNNプライムオンライン,「夢の国で喧嘩しないで」上海ディズニーランドで乱闘騒ぎ　写真撮影に“子供映り込み”巡りカップルが3人家族に激高…女が女児を突き飛ばし警察出動,132,https://news.yahoo.co.jp/articles/b95588f73a30c5329a0c71e679dbb0431edc24b6,6/8(日) 13:02
2025-06-08,14:08,TTL,総合,21,スポニチアネックス,野口健氏　埼玉・小学生ひき逃げ事件、逮捕の同乗者が不起訴に「何故に不起訴になったのか明確に…」,126,https://news.yahoo.co.jp/articles/634ec19a6431d7a74842d931f5ba22611c06b435,6/8(日) 13:18
2025-06-08,14:08,TTL,総合,22,テレビ朝日系（ANN）,埼玉・三郷市の飲酒ひき逃げ　同乗の中国籍男性を不起訴処分,124,https://news.yahoo.co.jp/articles/b612e25f3681c275f1408d3b6f44eed410809caf,6/8(日) 9:32
2025-06-08,14:08,TTL,総合,23,スポニチアネックス,フィフィ　埼玉・三郷の小学生ひき逃げ事件、逮捕の同乗者が不起訴に私見「運転者と共に逃走し…」,124,https://news.yahoo.co.jp/articles/d60c14599ebb2a289bbae22629955b908a2151ad,6/8(日) 8:24
2025-06-08,14:08,TTL,総合,24,ABEMA TIMES,引きこもりの自立支援をうたう“引き出し屋”強引に連れ出し施設に閉じ込める悪質業者も 人権侵害を受けた当事者と悩む母親の葛藤,124,https://news.yahoo.co.jp/articles/26bdeccb11c60a63f717f97532829a9b4470d4e0,6/8(日) 11:02
2025-06-08,14:08,TTL,総合,25,FRIDAY,石丸伸二氏の新党『再生の道』が事前調査で「獲得議席ゼロ」予測の衝撃…候補者から洩れる「戸惑い」,121,https://news.yahoo.co.jp/articles/3f7b26b86e760ffeafafd1780993ea54f2f0592b,6/8(日) 12:00
2025-06-08,14:08,TTL,総合,26,デイリースポーツ,【お米に暴言全文】立憲・原口一博氏「古古古米はニワトリさんが一番食べてる。人間様は食べてない」演説で小泉米酷評「恐ろしいでしょ？」※キリトリなし発言ママ,119,https://news.yahoo.co.jp/articles/afd43f37babfb60c0c27a26231e689817d9b7602,6/7(土) 17:36
2025-06-08,14:08,TTL,総合,27,CHANTO WEB,《オナラ1日500回》中2で突然起きた異変「授業中もつねに恐怖だった」IBS（過敏性腸症候群）の女性に訪れた転機,115,https://news.yahoo.co.jp/articles/13b5772bcf76630d84108b39a39fd745d85b6ea8,6/8(日) 6:32
2025-06-08,14:08,TTL,総合,28,日刊スポーツ,ノジマオンライン、Switch2転売したアカウントを利用停止に「ナイス」、「最高」応援相次ぐ,110,https://news.yahoo.co.jp/articles/6b56ac269497c06f4ec0da66935d3cfaa230464b,6/7(土) 18:46
2025-06-08,14:08,TTL,総合,29,神戸新聞NEXT,兵庫県知事選の分断、SNSで深まる溝　意見異なる相手に心ない投稿相次ぐ　顔写真さらされる事例も,108,https://news.yahoo.co.jp/articles/ec5447bffbe8ff32133ba38e6c38dfb210195a07,6/8(日) 9:00
2025-06-08,14:08,TTL,総合,30,Number Web,菅野智之35歳「オリオールズで過ごすのは明日が最後かも」トレード“ほぼ確実”の心境を語った「全てを受け入れる覚悟」「絶対、今が全盛期だと思う」,104,https://news.yahoo.co.jp/articles/a7f11fed320363269b9f3ef8647f3193307ca6f2,6/8(日) 11:06
2025-06-08,14:08,TTL,総合,31,デイリースポーツ,小泉進次郎大臣が説　お米買い溜め業者「コメ抱えてる人いる。出してもらう」　ホリエモンと緊急対談→「ＪＡ以外に流れ高騰」と大臣見方　いま犯人探しみたいになって諸説あるとも,100,https://news.yahoo.co.jp/articles/fcc0d1fbb41d11b68131899bd597f4550d651c87,6/7(土) 20:56
2025-06-08,14:08,TTL,総合,32,Full-Count,巨人がヘルナンデスを抹消…打率.218と低迷　首位・阪神は漆原が1軍昇格、8日の公示,99,https://news.yahoo.co.jp/articles/2b2a8d984bcad55c02c58d3c1ce925306ebabd7d,6/8(日) 12:03
2025-06-08,14:08,TTL,総合,33,ダイヤモンド・オンライン,「2000円のために徹夜？」古古米を笑う人が、なぜか毎年すすんで並ぶ「タイパ最悪の行列」とは,98,https://news.yahoo.co.jp/articles/b92563e12416b71d5530ba08f64e8eb5b61ea146,6/8(日) 12:02
2025-06-08,14:08,TTL,総合,34,婦人公論.jp,中学生の息子をいじめた生徒相手に裁判を起こすも「一方的な追及で精神的に追い詰められた」と訴え返され…５年以上に及ぶ＜訴訟合戦の結末＞とは,96,https://news.yahoo.co.jp/articles/00c500e416d0e76f359083ee2299aa8a2c0fa08d,6/8(日) 12:32
2025-06-08,14:08,TTL,総合,35,日刊スポーツ,堀江貴文氏　Switch2転売に持論「転売ヤー批判とかやめてほしい、感情論で邪魔すんな」のワケ,96,https://news.yahoo.co.jp/articles/442406cb4849e05fbb59955d6697f3aed469c1a5,6/8(日) 6:26
2025-06-08,14:08,TTL,総合,36,毎日新聞,砂川・一家5人死傷事故10年　唯一生存の次女を「そっと見守って」,92,https://news.yahoo.co.jp/articles/aa908e5a645ab7d2e87e2654cbbe7f89fad29540,6/8(日) 9:37
2025-06-08,14:08,TTL,総合,37,スポニチアネックス,和田アキ子　米5キロ2000円台実現に「こんな急に…。じゃあ今まで何だったの？」「またこの秋に…」,91,https://news.yahoo.co.jp/articles/0d2284450100105a3683171802f6c7a6f8ec9d22,6/8(日) 12:30
2025-06-08,14:08,TTL,総合,38,時事通信,自民幹事長、コメ輸入拡大に難色,91,https://news.yahoo.co.jp/articles/66e83999a222ca422a765e3cc8989027d60dec54,6/7(土) 16:46
2025-06-08,14:08,TTL,総合,39,新潟ニュースNST,【続報】パラグライダーの大会で事故　東京から参加の62歳女性が死亡　死因は溺死　新潟・南魚沼市,89,https://news.yahoo.co.jp/articles/b38a8daae76128d5ad84ab90ef29d3164b1893a3,6/8(日) 6:36
2025-06-08,14:08,TTL,総合,40,日刊スポーツ,岸田文雄前首相、コメ政策めぐり「検証が必要」を連発　自身政権では政府備蓄米放出せず,88,https://news.yahoo.co.jp/articles/f4629787f61fb60d3725c1f7316a75d660584a44,6/8(日) 11:55
