scrp_date,scrp_time,genre_en,genre_jp,rank,media_jp,title,comment,link,date_original
2025-09-14,12:20,TTL,総合,1,AERA DIGITAL,インバウンド増で浅草・下町コミュニティーが崩壊の危機　小さな戸建てが1億円　住民が「デメリットしかない」と嘆く理由,535,https://news.yahoo.co.jp/articles/5356203614311519176d264f074c1c4972f4fba7,9/14(日) 8:31
2025-09-14,12:20,TTL,総合,2,ABEMA TIMES,大谷翔平、5試合ぶり49号　今季のチーム最長となる138.4メートル特大弾　2年連続50発、史上6人目偉業へ王手,370,https://news.yahoo.co.jp/articles/cb30ce064cd696827a6421b450a6dfde3ab54eae,9/14(日) 10:54
2025-09-14,12:20,TTL,総合,3,時事通信,野党、早期衆院解散を警戒　総裁選注視、共闘は難航必至,338,https://news.yahoo.co.jp/articles/ae9b07b9eb281c66119e96dcf18f473920bbdffa,9/14(日) 7:04
2025-09-14,12:20,TTL,総合,4,東スポWEB,【カーリング】ロコ・ソラーレ五輪出場消滅…競技関係者は不安な表情「露出が減ってしまうのでは」,316,https://news.yahoo.co.jp/articles/bb630c5127cf640d13738fcf4a875c436518b2c2,9/14(日) 5:16
2025-09-14,12:20,TTL,総合,5,日刊スポーツ,小沢一郎氏が警鐘「操り人形をトップに据え周りが好き放題やる、そんな政治になるとしたら…」,251,https://news.yahoo.co.jp/articles/354df0429f7223a1804f5905534772d4d0419af7,9/14(日) 9:56
2025-09-14,12:20,TTL,総合,6,時事通信,「ホームタウン」改称を検討　騒動収まらず、4市と協議へ　政府,226,https://news.yahoo.co.jp/articles/8c7abcb49da8cb36f6b5c26cc866b6f54e2dbba2,9/14(日) 7:05
2025-09-14,12:20,TTL,総合,7,RBC琉球放送,【写真】オートバイが電柱に衝突し男子高校生が死亡　後続車の運転手「バイクが電柱に向かっていった」　警察が事故原因調べる,221,https://news.yahoo.co.jp/articles/8c09ef4d201447922033dc4ba1d2e29d8dcfdf8d,9/14(日) 9:50
2025-09-14,12:20,TTL,総合,8,共同通信,政府、女性トイレ行列解消へ本腰　設置基準数策定進推で格差是正へ,212,https://news.yahoo.co.jp/articles/1c97aa521b639f69c74b39cda24efafc485ca71b,9/13(土) 16:18
2025-09-14,12:20,TTL,総合,9,TBS NEWS DIG Powered by JNN,小泉農水大臣「私がやるしかないだろうという強い決意だ」　地元支援者らに自民党総裁選への出馬の意向を伝える,202,https://news.yahoo.co.jp/articles/ce0ff7b778857d4132c8240757a1f9730af7d7c6,9/13(土) 12:44
2025-09-14,12:20,TTL,総合,10,TBS NEWS DIG Powered by JNN,女子マラソン 小林香菜が涙の7位入賞！「もうどうなってもいいと思った」サバイバルレース乗り越え日本勢3大会ぶり【東京世界陸上】,177,https://news.yahoo.co.jp/articles/2de9dec206c0f0e5b20ac6ca9735c13096280cf7,9/14(日) 9:58
2025-09-14,12:20,TTL,総合,11,日刊スポーツ,古舘伊知郎が警鐘「中国人がガンガン日本の土地を買ってるって、最近のことのように言うなよ」,174,https://news.yahoo.co.jp/articles/4d9770881569968e3b7a6efb24d599b58779ebb8,9/14(日) 6:00
2025-09-14,12:20,TTL,総合,12,日刊スポーツ,へずまりゅう氏“恫喝疑惑”巡り「辞職勧告されるか不安でしたが弁護士に相談しました。結論…」,162,https://news.yahoo.co.jp/articles/6be7653a370d7b81ba6c90ab41353ca77edca515,9/14(日) 5:00
2025-09-14,12:20,TTL,総合,13,FNNプライムオンライン（フジテレビ系）,エチオピア国籍の男「仕事の相談に行ったが、状況変わらなくて刺した」会社役員の男性を刺して殺害しようとした疑いで逮捕　東京・赤坂,151,https://news.yahoo.co.jp/articles/7cd7e3d464a5d0e8477475ffec52c04989f7f1b3,9/14(日) 11:12
2025-09-14,12:20,TTL,総合,14,読売新聞オンライン,ドラッグストアでベトナム人の万引き相次ぐ、被害額平均10万円超で日本人の12倍…化粧品など母国に運搬か,145,https://news.yahoo.co.jp/articles/26757b997b48403ebc40b0c773ff0c7ae4acbd43,9/14(日) 11:21
2025-09-14,12:20,TTL,総合,15,みんかぶマガジン,小泉進次郎が出馬意向→総理が変わっても国民の生活は良くならない…病んでいるのは自民党全体の「バラマキ＆増税」経済政策,140,https://news.yahoo.co.jp/articles/807695719951c7adc4a81a06f670ac8eb21251dd,9/14(日) 9:10
2025-09-14,12:20,TTL,総合,16,デイリー新潮,「江頭2：50」がまた“大失態”　全く笑えない…「豚肉成分入りポテチ」事件が起きた理由,139,https://news.yahoo.co.jp/articles/f4261e7e9817c91366041532ae9f83e1e8bd97be,9/14(日) 11:12
2025-09-14,12:20,TTL,総合,17,日刊スポーツ,ラサール石井氏、杉田水脈氏を批判　安倍晋三元首相70年談話に「足りないものは沢山ある」,137,https://news.yahoo.co.jp/articles/7ef7785ee000624f99360c4a80aa13023be6853d,9/14(日) 8:24
2025-09-14,12:20,TTL,総合,18,SmartFLASH,「いじめられっ子やろ」発言の千原せいじ、トークショーも中止で“謝っても地獄、謝らなくても地獄”の窮地,126,https://news.yahoo.co.jp/articles/4c3e1ef4f1e7d0f7b026081672b4944ed7822cf6,9/14(日) 12:00
2025-09-14,12:20,TTL,総合,19,あいテレビ,「お昼ごはん、何が食べたい?」と聞かれたら…どう答える?地雷ワードと神ワード　共働き世帯増も、家庭内の役割は変わらず?,126,https://news.yahoo.co.jp/articles/c77946f2bd2a80a426dd4df1b7c62b7d871694df,9/14(日) 6:01
2025-09-14,12:20,TTL,総合,20,女性自身,《成年式の投稿が約25万いいね》悠仁さま　単独で宮内庁インスタに登場も…際立つ愛子さまの“国民的人気”,121,https://news.yahoo.co.jp/articles/af0874421aac5dfa9c685ec417a5f9f72e34b26e,9/14(日) 6:00
2025-09-14,12:20,TTL,総合,21,FORZA STYLE,「ディズニー行ったことないとか悲惨」で仲間外れに。「体験格差」を振りかざすママ友たちの狂気【専門家解説】,120,https://news.yahoo.co.jp/articles/3febf18fc3dc210082a922b3d1d7a649ba7c3198,9/14(日) 7:03
2025-09-14,12:20,TTL,総合,22,スポニチアネックス,へずまりゅう氏　恫喝疑惑を弁護士に相談　市長に「どのツラ下げて！」怒鳴り質問で辞任勧告危機,119,https://news.yahoo.co.jp/articles/807de415b015f0d069a9c88dfa2a4233309c0f4f,9/13(土) 21:29
2025-09-14,12:20,TTL,総合,23,ENCOUNT,SMAPファン激怒　斎藤元彦知事の元ボランティア多田ひとみ氏「ビストロSMAPの料理はシェフが」発信に感じるもの,118,https://news.yahoo.co.jp/articles/90da975c73d3c830d62caf536ec477ac644c6602,9/14(日) 11:15
2025-09-14,12:20,TTL,総合,24,文春オンライン,《来日4日後に“射殺”》「3000万人のパキスタン人を日本に送ったら」参政党・神谷代表と対談も…銃撃された米31歳保守活動家が語っていたこと,114,https://news.yahoo.co.jp/articles/1967219cc9c22cf4f2f8bb8bcab00e298e30b90f,9/14(日) 11:12
2025-09-14,12:20,TTL,総合,25,日刊スポーツ,「コテコテ保守とガチガチ左は勘弁」立民・安住幹事長が党立ち位置言及「穏健中道リベラルに軸」,112,https://news.yahoo.co.jp/articles/980aea67a173f7d5032665d54d9caa41379983c2,9/14(日) 11:34
2025-09-14,12:20,TTL,総合,26,スポニチアネックス,【世界陸上】小林香菜「自分もコテンパンにされるだろうと…」涙の7位入賞！「練習信じて頑張った」,112,https://news.yahoo.co.jp/articles/a6ee8070adf9d96df8eb8ea328ec42b38c399553,9/14(日) 10:26
2025-09-14,12:20,TTL,総合,27,共同通信,立民、首相指名で野田代表への投票呼びかけ,110,https://news.yahoo.co.jp/articles/023e64ba99299c651d5cf87adb66fb79752fb4ef,9/14(日) 10:21
2025-09-14,12:20,TTL,総合,28,ITmedia ビジネスオンライン,退職率が2年で10.3％→6.5％に　QBハウスが「理美容業界の深刻な人手不足」に挑むワケ,108,https://news.yahoo.co.jp/articles/17ac7b0c7a057419c1a6bfd7ad0e30e059272dff,9/14(日) 6:00
2025-09-14,12:20,TTL,総合,29,NEWSポストセブン,「性器に電気を流された」「監房に7人、レイプは日常茶飯事」ドバイ“地獄の刑務所”に収監されたイギリス人女性容疑者（23）の過酷な環境《アラビア語の裁判で終身刑》,102,https://news.yahoo.co.jp/articles/16cb7f7e1292ab008ad11c3398d1754ac6ccb218,9/14(日) 11:15
2025-09-14,12:20,TTL,総合,30,東洋経済オンライン,わずか(？)5万円で人気アトラクション12種類に「ほぼ待ち時間無し」で乗れる…富士急ハイランド「5万円パス」が示すテーマパークの“変容”,101,https://news.yahoo.co.jp/articles/c2ed573e7fca64d5d4ec09ede9fac19d749710ed,9/14(日) 5:31
2025-09-14,12:20,TTL,総合,31,デイリー新潮,小室夫妻も愛子さまもご欠席で「人数的にはややさみしさ」も…　悠仁さまが成年式で見せた“意外なお姿”,92,https://news.yahoo.co.jp/articles/d6bfe2e0c48aced741dd5fc6c056eb4eb131e6ef,9/14(日) 10:51
2025-09-14,12:20,TTL,総合,32,TBS NEWS DIG Powered by JNN,男子100m予選、日本勢3人は全員無念の敗退...国立ため息、サニブラウン組7着「後半失速してしまった」【東京世界陸上】,89,https://news.yahoo.co.jp/articles/9de7e54e0dfbd94d865a8ca39472034736fceab7,9/13(土) 21:24
2025-09-14,12:20,TTL,総合,33,THE ANSWER,大谷衝撃49号なのに嘆き続出「何故いつも…」「相変わらず」　敵地騒然の一発でも喜べない声,84,https://news.yahoo.co.jp/articles/db8de774ebb404a667bfd8bc62461d406837e21e,9/14(日) 11:18
2025-09-14,12:20,TTL,総合,34,HBCニュース北海道,SNSで知り合った30代女性との“初デート”車のドアを開けようとした女性を無視し急発進　逃走していた36歳の男を傷害容疑で逮捕　札幌市東区,83,https://news.yahoo.co.jp/articles/f72d10bb1efffa1bf138a5f28989b459a888f23a,9/14(日) 9:08
2025-09-14,12:20,TTL,総合,35,ねとらぼ,54歳の新婚妻、“娘の同級生”と21歳差でゴールインしていた……　大激怒＆反対した相手の親も折れた夫の“本気の決断”に出演者衝撃「こんな男いない」,83,https://news.yahoo.co.jp/articles/8c8e1a6cfc16b60605a91cdfabb28eb1125854fb,9/14(日) 8:45
2025-09-14,12:20,TTL,総合,36,Number Web,藤川球児監督のコメントは本当に“つまらない”のか？ 阪神・佐藤輝明に苦言の岡田彰布と比較…「そこは自分の責任」発言に隠された“藤川の手腕”,83,https://news.yahoo.co.jp/articles/59996b05e97e43e252bb667269670b33d72965b3,9/14(日) 11:05
2025-09-14,12:20,TTL,総合,37,FNNプライムオンライン（フジテレビ系）,「今の時代に精神論は通用しない」陸自“最強”レンジャー育成教育を見直しへ　市街戦対応や射撃訓練の増加案も,82,https://news.yahoo.co.jp/articles/cf6be533dc95f60fb458d764fbd32b7a2a8506ff,9/13(土) 16:00
2025-09-14,12:20,TTL,総合,38,デイリースポーツ,大谷翔平、5戦ぶり49号特大ソロ　エース右腕から138メートルアーチに敵地どよめく　キング争い2差追走　史上6人目の快挙に王手,82,https://news.yahoo.co.jp/articles/cdcfed41865067a7b54a114e6884fd288559a684,9/14(日) 10:55
2025-09-14,12:20,TTL,総合,39,AERA DIGITAL,紀子さま59歳のお誕生日　にじむ「初孫」へのお気持ち、小室眞子さんファミリーとの関係が変化？,81,https://news.yahoo.co.jp/articles/2314632c1d717b4e8369a2e4b2f53dfdda3b32fa,9/14(日) 9:31
2025-09-14,12:20,TTL,総合,40,毎日新聞,小林氏、小泉氏との論戦期待　政策「おのずと違い出る」　総裁選巡り,81,https://news.yahoo.co.jp/articles/1a4ba8eaf03b3dbfbcbe5816c2013b6f056e672b,9/13(土) 17:30
