scrp_date,scrp_time,genre_en,genre_jp,rank,media_jp,title,comment,link,date_original
2024-02-08,10:15,TTL,総合,1,TBS NEWS DIG Powered by JNN,隠れ増税?子育て支援金“500円弱”徴収　「事実上の増税」と批判も→岸田総理「増税ではありません」【Nスタ解説】,771,https://news.yahoo.co.jp/articles/c944f59a6d4525753f5bc3a24de7f48574d2743a,2/7(水) 20:42
2024-02-08,10:15,TTL,総合,2,日テレNEWS NNN,かんだ犬の「飼い主」を取材…「絶対、逃げ出せない状態だと」　公園で犬に襲われ子ども含む12人ケガ　群馬・伊勢崎市,738,https://news.yahoo.co.jp/articles/4ab1c8d2f17301a0ae96daf161a6f52436de0beb,2/8(木) 5:02
2024-02-08,10:15,TTL,総合,3,ABEMA TIMES,大雪で飲食店予約「ドタキャン」 被害1兆6000億円…法的措置は可能？  「ネガティブな印象がつくので言いにくい」悩む店主、損害防ぐ対策は,360,https://news.yahoo.co.jp/articles/91cf97c0cec8e128546743746c42cfee4f150ee7,2/8(木) 8:25
2024-02-08,10:15,TTL,総合,4,TBS NEWS DIG Powered by JNN,【速報】2023年の経常収支　20兆6295億円の黒字,333,https://news.yahoo.co.jp/articles/522301cdbc83ebd9a75f35cd29e619a5851b4aa3,2/8(木) 8:57
2024-02-08,10:15,TTL,総合,5,時事通信,二階氏へ2年で10億円　自民本部から政策活動費,321,https://news.yahoo.co.jp/articles/ab40c82fa1a42770e769157ca8f763087de6e77d,2/7(水) 12:31
2024-02-08,10:15,TTL,総合,6,スポーツ報知,メッシ、ゴール阻まれる…香港では欠場、返金騒動　国立では途中出場もスタンドは空席目立つ,293,https://news.yahoo.co.jp/articles/e6d8096e6db5cb43e5163717152f07c07fcfa0bb,2/8(木) 5:30
2024-02-08,10:15,TTL,総合,7,THE ANSWER,ワリエワ、禁止薬物は「祖父のイチゴのデザート」原因か　CAS発表「祖父の主張以外に証拠なし」,205,https://news.yahoo.co.jp/articles/4b2f6073ebf43b1f3425820bbac52b87c842e8f0,2/8(木) 5:48
2024-02-08,10:15,TTL,総合,8,デイリー新潮,【続報】伊東純也「性加害問題」で急遽登場した「第3の弁護士」のメチャクチャな論理,189,https://news.yahoo.co.jp/articles/d1e893b28ddbba5ea5f511bb96ff04d526349f3a,2/8(木) 6:10
2024-02-08,10:15,TTL,総合,9,THE ANSWER,韓国撃破した相手選手の喜びすぎ行為　韓国メディア指摘「ゴールによじ登って国旗を…」【アジア杯】,185,https://news.yahoo.co.jp/articles/9e1b1c0b7158ecfde19065d36c558754ea44cf80,2/8(木) 8:13
2024-02-08,10:15,TTL,総合,10,福島中央テレビ,【速報】福島第一原発の汚染水浄化装置から放射性物質含む水が漏洩　漏れたのは約５．５トン２２０億ベクレルと試算【福島県】,175,https://news.yahoo.co.jp/articles/4afcfa1335d66563f2ab35019b13fd4a0de41843,2/7(水) 18:36
2024-02-08,10:15,TTL,総合,11,週刊SPA!,松本人志、伊東純也スキャンダルの裏で何が…？現役週刊誌記者が明かす「性加害報道」のウラ事情,168,https://news.yahoo.co.jp/articles/8c339650c3b85c9a30d38660df31dd34418b6b32,2/8(木) 8:50
2024-02-08,10:15,TTL,総合,12,女性自身,佳子さま　ご就職からまもなく3年でも未だ出勤の目撃情報ナシ…勤務先・全日本ろうあ連盟の「答え」,168,https://news.yahoo.co.jp/articles/95f9b4f3ac593f17fa58545bd125c698d917ac10,2/8(木) 6:04
2024-02-08,10:15,TTL,総合,13,日刊ゲンダイDIGITAL,自民・萩生田光一前政調会長「裏金2700万円」に…見苦しすぎる「言い訳」連発の理由,162,https://news.yahoo.co.jp/articles/9c286b949c1ce24da6d644feec8f2456acedb98d,2/8(木) 9:06
2024-02-08,10:15,TTL,総合,14,デイリースポーツ,山田邦子、ミス日本審査員の金子恵美氏へ「不倫した女性はミス日本にそぐわないわけですか？」,161,https://news.yahoo.co.jp/articles/47d78376b2af6f709c169f753df97edafe1d0967,2/7(水) 15:15
2024-02-08,10:15,TTL,総合,15,KSB瀬戸内海放送,「手術なしでも性別変更を」トランスジェンダー当事者の申し立てを認める　岡山家裁津山支部,159,https://news.yahoo.co.jp/articles/6288b4f339412643beb2cfc04220d9e18b9ff970,2/7(水) 15:14
2024-02-08,10:15,TTL,総合,16,SmartFLASH,「原作者に会いたくない派」シナリオ作家協会の炎上動画は何が問題だったのか…出演した脚本家が指摘「言葉足らずに感じた」,133,https://news.yahoo.co.jp/articles/a8eeaa772b0cbda2d6ea2e92936cf3909a974ed2,2/8(木) 6:02
2024-02-08,10:15,TTL,総合,17,朝日新聞デジタル,「桐島聡」名乗った男の遺体を火葬　遺族は引き取りを拒否,126,https://news.yahoo.co.jp/articles/cbacfff861f8a2c5724c364f6e034d4aa73c9148,2/7(水) 19:45
2024-02-08,10:15,TTL,総合,18,ロイター,ネタニヤフ氏、ハマスの休戦案を拒否　米国務長官「なお交渉余地」,114,https://news.yahoo.co.jp/articles/badb6c6ed410536ad0a69361ae0932141e3c6809,2/8(木) 4:38
2024-02-08,10:15,TTL,総合,19,まいどなニュース,炊き出しボランティアのマナーにあぜん…300食分を調理途中で放置、切りかけの食材、調理器具も洗わず　被災地からの訴えが話題に,113,https://news.yahoo.co.jp/articles/5b3ab238f09bc23c51eb220588875af126c85e2d,2/7(水) 19:50
2024-02-08,10:15,TTL,総合,20,TBS NEWS DIG Powered by JNN,「犬に噛まれた」　2つの公園付近で体長約1メートル30センチの四国犬に小学生らが次々噛まれる　12人がけが　群馬・伊勢崎市,110,https://news.yahoo.co.jp/articles/2ebbfe0f9940267a403a255594bd5e6d6f2edbf6,2/7(水) 17:36
2024-02-08,10:15,TTL,総合,21,時事通信,ヤクルト、中国法人で800人削減　従業員の2割、販売不振で,110,https://news.yahoo.co.jp/articles/da8a4e829e77e0454602439bf7211f0d6020d5fb,2/8(木) 7:09
2024-02-08,10:15,TTL,総合,22,ABEMA TIMES,義理チョコ離れが鮮明に バレンタイン「職場の人に」渡すが過去最低 日本生命アンケート調査,96,https://news.yahoo.co.jp/articles/c1f28fb8e4169a7eba74af437b35e2eb2d23b43a,2/7(水) 14:18
2024-02-08,10:15,TTL,総合,23,読売新聞オンライン,犯罪被害者の継続的な支援制度創設、改正法案を提出へ…同一弁護士が事件直後から一貫して対応,94,https://news.yahoo.co.jp/articles/d41f1e745b9f987fb8e816d2ed33090d841845f0,2/8(木) 5:06
2024-02-08,10:15,TTL,総合,24,AERA dot.,「差別発言を『節』と呼ぶのはもうやめて　批判と反論の重要性」小島慶子,90,https://news.yahoo.co.jp/articles/65354b9b6ef1b08f2fb694d01a1e0ece8ab089f8,2/8(木) 7:32
2024-02-08,10:15,TTL,総合,25,プレジデントオンライン,なぜ「セクシー田中さん」の改変プロセスを説明しないのか…日テレの「冷たすぎるコメント」がもつ本当の意味,89,https://news.yahoo.co.jp/articles/b6ab094e31cae46986468c17456fd4270ccf7e8a,2/8(木) 9:17
2024-02-08,10:15,TTL,総合,26,HBCニュース北海道,赤信号で飛び出した中学生死亡、はねた車の72歳の“無罪”確定…１審判決「自殺の可能性否定できず、予見、回避できない」に対し「前方不注意、90キロ前後で走行の過失」指摘の検察控訴せず,84,https://news.yahoo.co.jp/articles/f78c67c4dc4e7bfdf3bb13e0735b41bb670b014b,2/8(木) 7:40
2024-02-08,10:15,TTL,総合,27,ロイター,アップル、折りたたみ式ｉＰｈｏｎｅを開発中＝報道,78,https://news.yahoo.co.jp/articles/e74e63684ae63e7aa964480ef89fe0e2ad2479da,2/8(木) 0:04
2024-02-08,10:15,TTL,総合,28,FNNプライムオンライン（フジテレビ系）,「悔やみきれない」生後4カ月の息子死亡　保育所次々落選…両親「誰もが安全な保育を」うつぶせ寝?保育施設は謝罪,76,https://news.yahoo.co.jp/articles/386e3052be6d361312932daac0aff7d16766295f,2/7(水) 17:54
2024-02-08,10:15,TTL,総合,29,現代ビジネス,「これはでっち上げです！」…伊東純也問題で注目のX氏がはじめて明かす「あの日の夜、起きていたこと」,74,https://news.yahoo.co.jp/articles/6a80c77741ed485d0ddabb1c335e102552564822,2/8(木) 8:04
2024-02-08,10:15,TTL,総合,30,THE DIGEST,「傲慢だ」「ふざけているのか！」メッシの途中出場に中国メディアが激怒！「間違いなく日本が好きなのだ」,72,https://news.yahoo.co.jp/articles/7d623f3ec5f8ab73a757f3c8422a574374c5a9f2,2/8(木) 5:40
2024-02-08,10:15,TTL,総合,31,日刊スポーツ,堀江貴文氏、ミス日本不倫報道に怒り「１人週刊文春できるくらいネタ知ってる。だけど書かない」,70,https://news.yahoo.co.jp/articles/040281a90389644403ed718bbe8bec9154f90f70,2/7(水) 15:58
2024-02-08,10:15,TTL,総合,32,現代ビジネス,芸能事務所社長の証言メモ、X氏の肉声…伊東純也問題で新たに明らかとなった「事件の核心」,69,https://news.yahoo.co.jp/articles/ee80294acd8ba9510d83f91ccae62605e57a895f,2/8(木) 8:04
2024-02-08,10:15,TTL,総合,33,Merkmal,三重交通キャラ“性的イメージ”大炎上は全く問題ない！ 「表現の自由」を長年取材したルポライターが騒動の本質を問う,68,https://news.yahoo.co.jp/articles/686eb74fa4b9db58c549f9b383d1ff003495e62c,2/8(木) 5:41
2024-02-08,10:15,TTL,総合,34,共同通信,万博国負担1649億円に　宣伝費など追加,67,https://news.yahoo.co.jp/articles/0ce53f43ae8e81bde3ca1bc4e548b0ed74f11f5d,2/7(水) 20:01
2024-02-08,10:15,TTL,総合,35,スポーツ報知,岩田明子氏、「めざまし８」で旧統一教会と「政策協定」署名報道の盛山正仁文科相に見解…「選挙にそれだけ必死だった」,65,https://news.yahoo.co.jp/articles/0f482135d1503b9692b20b47c59bd79af2006268,2/8(木) 9:12
2024-02-08,10:15,TTL,総合,36,オリコン,松本人志の活動休止に伴い『酒のツマミになる話』に番組名変更　“真ん中の席”に座るのは千鳥・大悟,65,https://news.yahoo.co.jp/articles/3bb8fb2311ef641b595d50bd8bd949847a60c8cc,2/8(木) 4:00
2024-02-08,10:15,TTL,総合,37,THE ANSWER,「日本が勝てる気しない」　V2王手カタールの執念に日本ファン嘆き「イランに勝ってても負ける」【アジア杯】,64,https://news.yahoo.co.jp/articles/d51695700f942225aa0f0499501f32dcf643488e,2/8(木) 5:43
2024-02-08,10:15,TTL,総合,38,時事通信,NY株、最高値更新　ハイテク銘柄買われる,62,https://news.yahoo.co.jp/articles/8f718719f68a48844a7b1ad16ec43bf007c62d0d,2/8(木) 6:28
2024-02-08,10:15,TTL,総合,39,FNNプライムオンライン（フジテレビ系）,【速報】国民民主がガソリン税トリガー条項の協議離脱を正式決定,62,https://news.yahoo.co.jp/articles/687b4981b9c350e99f36b2a0255cd5eada13f097,2/7(水) 13:19
2024-02-08,10:15,TTL,総合,40,時事通信,小池都知事、台湾と交流強化確認　正副総統と面会、中国は反発,60,https://news.yahoo.co.jp/articles/00bfd259e0667aaf48c385f061a30aab399acd86,2/7(水) 20:46
