scrp_date,scrp_time,genre_en,genre_jp,rank,media_jp,title,comment,link,date_original
2025-04-30,17:10,TTL,総合,1,スポニチアネックス,TBS　「オールスター感謝際'25春」に反省　江頭2:50“大暴れ”「判断の想像力が欠けていた」,863,https://news.yahoo.co.jp/articles/a0fa76eb4e604cc5d7d53a43878e99ec2469403e,4/30(水) 15:14
2025-04-30,17:10,TTL,総合,2,ＢＳＮ新潟放送,123億円…「ガソリンの暫定税率廃止による減収は飲み込めるものではない」新潟県知事,484,https://news.yahoo.co.jp/articles/ef15fc6cd725fd1d10d7bafbbd4d64f052924261,4/30(水) 12:02
2025-04-30,17:10,TTL,総合,3,関西テレビ,【速報】吉村知事　万博来場者数「関係者含んで発表」は「内訳示していれば問題ない。水増しではない」,438,https://news.yahoo.co.jp/articles/4ff16856d4e68bfc6242242e93e9dd60de80c6ce,4/30(水) 14:35
2025-04-30,17:10,TTL,総合,4,時事通信,備蓄米、落札価格420円下落　3回目の10万トン、6事業者参加,244,https://news.yahoo.co.jp/articles/6cc92e3eb8cac133c8387c545479dfb7aa1d274d,4/30(水) 10:35
2025-04-30,17:10,TTL,総合,5,テレビ朝日系（ANN）,京都「1泊6万円」…ホテル代高騰「クレージー」　車中泊に殺到 1台3850円,226,https://news.yahoo.co.jp/articles/8fb9a1c890f89d31e6715954722fcc8bd49f0d2e,4/30(水) 12:16
2025-04-30,17:10,TTL,総合,6,NBC長崎放送,「スマホをカーナビ代わり」は違反?手持ち操作で一発免停のケースも…ホルダー固定はOK?警察に聞いた,214,https://news.yahoo.co.jp/articles/7a3309177bd05ded66f4206b25400c5797f2f8d2,4/30(水) 6:32
2025-04-30,17:10,TTL,総合,7,毎日新聞,国民民主、選択的夫婦別姓で独自法案提出へ　内容は「これから作業」,199,https://news.yahoo.co.jp/articles/d397b599bd9c8b873f29b733a2045777145f4b22,4/30(水) 15:02
2025-04-30,17:10,TTL,総合,8,共同通信,中国、新たなパンダ貸与に前向き　日本との共同保護「歓迎」,194,https://news.yahoo.co.jp/articles/09fac7d985c5f4c66d21666129eff9d60a68beb6,4/29(火) 18:27
2025-04-30,17:10,TTL,総合,9,スポニチアネックス,玉木雄一郎氏　日本経済復活へ“働きがい改革”提唱　「残業減らそうみたいな話だけど、私はむしろ…」,185,https://news.yahoo.co.jp/articles/5486788385e7a8e7d8015cfe7fbc4bdb0ed15e92,4/30(水) 16:25
2025-04-30,17:10,TTL,総合,10,デイリー新潮,消費減税で「日本の信頼がなくなる」　自民党内部でも分裂が　一方、賛成派は「トランプとディールがしやすくなる」,184,https://news.yahoo.co.jp/articles/aa8e2cfc26241791ce21a0c2ffa496cbd6a5c0d4,4/30(水) 6:08
2025-04-30,17:10,TTL,総合,11,産経新聞,首刺され男性死亡、血まみれで刃物所持の男逮捕　飲食料金支払い巡り刺したか　大阪・豊中,183,https://news.yahoo.co.jp/articles/b771ef29d00954113ca42ae1eea5d46f6d9bce01,4/30(水) 9:22
2025-04-30,17:10,TTL,総合,12,京都新聞,「もう廃車だろう」駐車場に水が流れ込む　京都市中心部の国道1号で大規模冠水　住民は悲鳴,182,https://news.yahoo.co.jp/articles/57e9305f915da09a35c2892ba163df748fd74985,4/30(水) 9:36
2025-04-30,17:10,TTL,総合,13,Yahoo!ニュース オリジナル 特集,コロナ後もマスク外せず――「素顔ギャップ」「恋愛」に戸惑う若者の本音 #今つらいあなたへ,181,https://news.yahoo.co.jp/articles/d291de179e099b2f7b67ad23d2647620b3dcc34f,4/29(火) 19:00
2025-04-30,17:10,TTL,総合,14,47NEWS,「女性は採用してもどうせ辞める」「社内清掃は女性の仕事」…今も根強いアンコンシャスバイアス　解消を目指す石破首相お膝元の鳥取県、行政主導の聞き取りに当事者が求める心構えとは,163,https://news.yahoo.co.jp/articles/e9923f3f853c3fc907cf4104b5e210630ec7e3f8,4/30(水) 9:32
2025-04-30,17:10,TTL,総合,15,共同通信,捕虜の女性記者、遺体に拷問痕跡　ロシア、返還時に眼球や脳摘出か,161,https://news.yahoo.co.jp/articles/c2bd5b108238eb3d9059c65247255f2c18254480,4/30(水) 7:31
2025-04-30,17:10,TTL,総合,16,Full-Count,大谷翔平「幸せな寝不足」　長女誕生から10日…“疲労”も笑顔、名前は非公表,154,https://news.yahoo.co.jp/articles/c8cdeb1eb3bcb2e4f69078fa3283032b07285d32,4/30(水) 14:11
2025-04-30,17:10,TTL,総合,17,FNNプライムオンライン（フジテレビ系）,辻元氏「党が割れるからとかそういう理由で審議拒否はやめて」立憲民主党が選択的夫婦別姓の導入に向け民法改正案を衆院に提出,144,https://news.yahoo.co.jp/articles/a2609735b26c526ac791c6654e3ea6b2eac9db1e,4/30(水) 15:09
2025-04-30,17:10,TTL,総合,18,スポニチアネックス,崖っぷちアイドル　友人の窮状訴え「お米我慢してるって」　ひろゆき氏「日本ってそんな貧しいの？」,143,https://news.yahoo.co.jp/articles/b138b8746576d5cf0824dd825e0568ec3d1cd1b6,4/30(水) 15:32
2025-04-30,17:10,TTL,総合,19,女性自身,「痛いほどよく分かる」前澤友作氏　日本経済低迷の理由は”日本人の意地悪さ“説に私見,136,https://news.yahoo.co.jp/articles/abc366c2cd4f6410c6711097e45b7f07559a22e5,4/30(水) 16:18
2025-04-30,17:10,TTL,総合,20,女性自身,田中圭　元女優妻は“15歳年下”との不倫報道に激しい嫌悪感…永野芽郁に慰謝料請求も辞さない姿勢,127,https://news.yahoo.co.jp/articles/f309fe776eddbb73c3be9a3072b8547b74ed0f32,4/30(水) 6:00
2025-04-30,17:10,TTL,総合,21,TBS NEWS DIG Powered by JNN,【速報】女子高校生殺人事件 逮捕された男（25） 新たな供述「制服着た女子高校生を包丁で殺した」と容疑認める 「殺害する女性を探していた」「自分は社会の底辺にいる」とも供述,119,https://news.yahoo.co.jp/articles/4e0bf684c2116d63c90afd0a3594e6eab54dde24,4/30(水) 10:21
2025-04-30,17:10,TTL,総合,22,読売新聞オンライン,東北道逆走１３人死傷、栃木県などが黒磯板室ＩＣの対策検討…緊急で電光掲示板の「標識車」を配置,118,https://news.yahoo.co.jp/articles/e96293e3f49025a14e9bc2a22c1d8a65f1a83efa,4/30(水) 7:49
2025-04-30,17:10,TTL,総合,23,チューリップテレビ,「強いトラウマとうつ状態」産婦人科医が証言…中2から続く父からの性的暴行に「いや、限界だ」裁判で明かされた被害者の叫び　富山地裁,114,https://news.yahoo.co.jp/articles/f1ab3e760c3f913751d388411cca5b58053372a4,4/30(水) 12:36
2025-04-30,17:10,TTL,総合,24,TBS NEWS DIG Powered by JNN,備蓄米 放出のうち約2%しかスーパーや飲食店に流通せず　卸売業者への引き渡しは全体の約1割　今月中旬時点,108,https://news.yahoo.co.jp/articles/b35db9ff13f50c916af96dc95ef301537f564f26,4/30(水) 16:19
2025-04-30,17:10,TTL,総合,25,BSS山陰放送,平日に“家族旅行で学校を休む”のはアリ?ナシ?　「全く問題ない」「周囲に迷惑がかかる」賛否論争　教育委員会に聞いてみると… 「ラーケーション」導入、GW中日を休みにする自治体も,108,https://news.yahoo.co.jp/articles/dfa240f5298c0e54b3edb0adca4ad9f3f22e5900,4/30(水) 6:04
2025-04-30,17:10,TTL,総合,26,共同通信,自公、連休後に減税協議へ　西田氏「食品税率も検討」,108,https://news.yahoo.co.jp/articles/392dd42c359d062f650dd460574e43e4510b014c,4/30(水) 15:20
2025-04-30,17:10,TTL,総合,27,MBSニュース,“未払いの飲食代”でトラブルか…飲食店経営の男性が刺され死亡　５２歳男逮捕　死亡男性は支払い求めて部屋を訪問　大阪・豊中市,106,https://news.yahoo.co.jp/articles/dcbee3f9096c6438da8979a3efcc4e03b166ac6a,4/30(水) 11:30
2025-04-30,17:10,TTL,総合,28,TBS NEWS DIG Powered by JNN,大谷翔平 待望の“パパ初アーチ”！父親リストから復帰8試合目で豪快7号、昨季“50-50”達成のマーリンズ戦でまたもメモリアルHR,101,https://news.yahoo.co.jp/articles/7d466c248dd9c859ed7931ac8907a4ade7641343,4/30(水) 11:19
2025-04-30,17:10,TTL,総合,29,東海テレビ,ガソリン等の暫定税率廃止で税収減少幅が“全国最大”に 愛知県の大村知事が国に代替財源の確保求める,101,https://news.yahoo.co.jp/articles/16a161620ce40b3e3f3ee23907496b181824cd21,4/30(水) 11:55
2025-04-30,17:10,TTL,総合,30,共同通信,富山知事「自治体減収に考慮を」　暫定税率廃止や消費減税巡り,100,https://news.yahoo.co.jp/articles/71cbcef9b16e4d37f15af26f19c4adfc20860532,4/30(水) 16:19
2025-04-30,17:10,TTL,総合,31,朝日新聞,フジテレビの取材パス没収、独禁法違反の疑い　野球機構を公取委調査,99,https://news.yahoo.co.jp/articles/6645391f9c18f3bd87a02184a2fc1dfbb6920584,4/30(水) 5:00
2025-04-30,17:10,TTL,総合,32,マネーポストWEB,デビュー間近のパチンコ新機能「ラッキートリガー3.0プラス」の2つの特徴　大当たり時の獲得期待出玉が大きく、パチスロのようなゲーム性が可能に,98,https://news.yahoo.co.jp/articles/630e756065a81bca7878726b73f5a4071a0ad32f,4/30(水) 16:16
2025-04-30,17:10,TTL,総合,33,スポニチアネックス,声優・高野麻里佳　「生命・身体に危害を加える」悪質な脅迫メールで被害届提出　イベント出演延期・辞退へ,92,https://news.yahoo.co.jp/articles/ab031f6d147f2e1b35ebf94c0d8f39bd94ae0655,4/30(水) 12:15
2025-04-30,17:10,TTL,総合,34,デイリースポーツ,「ロンハー」騒然「１０代で汚い芸能界見すぎた」→爆弾発言の美人タレント「もう嘘は付きたくない」　食レポも嘘はイヤ「意地でも言わない！」,89,https://news.yahoo.co.jp/articles/acac9338908ae7d01646e3d0fd1b330fef2fb1f0,4/30(水) 11:59
2025-04-30,17:10,TTL,総合,35,みんかぶマガジン,「頭じゃなくて米価を下げろ」農水相謝罪に猛ツッコミ！1年で2倍近い異常状況に国民はいつまで耐えられるか,85,https://news.yahoo.co.jp/articles/d51b8de33916b79441f59584987e020a8beb13ec,4/30(水) 9:10
2025-04-30,17:10,TTL,総合,36,HBCニュース北海道,速報　原子力規制委　北電泊原発3号機の審査書案了承　再稼働に向けた新規制基準の適合審査　事実上の「合格」,84,https://news.yahoo.co.jp/articles/92fbab36ea5b9349a85c0946acc44e886b3728d8,4/30(水) 11:40
2025-04-30,17:10,TTL,総合,37,中京テレビＮＥＷＳ,ガソリン等の暫定税率廃止で税収減少幅「全国最大」に　「代替財源の確保が前提」知事が国に求める　愛知県,80,https://news.yahoo.co.jp/articles/35e036a1c3c72ca5c008a5387298aa4714d4b47b,4/30(水) 16:24
2025-04-30,17:10,TTL,総合,38,TBS NEWS DIG Powered by JNN,「水道水で食中毒」14人が下痢や腹痛などの症状を訴え　「カンピロバクター」を検出　群馬・神流町,80,https://news.yahoo.co.jp/articles/ba0a82c69c5ae4abd7e7c28681117c25f22d1bdc,4/29(火) 17:19
2025-04-30,17:10,TTL,総合,39,デイリー新潮,「心神喪失で無罪」の可能性も…　北九州マック中3殺傷「平原政徳」近隣住民が明かした“資産家の坊っちゃん”としての顔　「仕事せんでも生きていける」,79,https://news.yahoo.co.jp/articles/0fddf52cf07f4ca15ef33ed72c03655205066425,4/30(水) 5:50
2025-04-30,17:10,TTL,総合,40,テレビ朝日系（ANN）,ふるさと納税のコメ返礼トラブル「確保が不可能」　減量か“複雑返金”迫られる,78,https://news.yahoo.co.jp/articles/0cbb1abcc7d302162a245ac1b9fb3e8299797b5c,4/30(水) 11:57
