scrp_date,scrp_time,genre_en,genre_jp,rank,media_jp,title,comment,link,date_original
2025-04-30,09:34,business,経済,1,東洋経済オンライン,ついに立憲民主も...夏の参院選対策の「消費税減税」、“一時的”はまやかし、本当に消費者に恩恵はあるのか？より有効な負担軽減の方策とは,141,https://news.yahoo.co.jp/articles/6d933c5530a62c641e0426f5ca7b926acc733a44,4/30(水) 8:32
2025-04-30,09:34,business,経済,2,日テレNEWS NNN,「備蓄米」中小スーパーになぜ届かない？　出荷はまだ24％…遅れている理由は　専門家「即効性がない」【#みんなのギモン】,141,https://news.yahoo.co.jp/articles/a8c5a53cd12a2b204797c63e189bfe1cb002c2c3,4/29(火) 10:24
2025-04-30,09:34,business,経済,3,Wedge（ウェッジ）,ついに韓国にも抜かれる日本の漁業…大差をつけられる養殖業、外国や海水温上昇のせいにするのはもうやめよう,71,https://news.yahoo.co.jp/articles/0b6151b472696348afa016901f656e9115359b30,4/30(水) 5:02
2025-04-30,09:34,business,経済,4,みんかぶマガジン,「頭じゃなくて米価を下げろ」農水相謝罪に猛ツッコミ！1年で2倍近い異常状況に国民はいつまで耐えられるか,67,https://news.yahoo.co.jp/articles/d51b8de33916b79441f59584987e020a8beb13ec,4/30(水) 9:10
2025-04-30,09:34,business,経済,5,東洋経済オンライン,「タトゥーが入ってる女将の店なんて不味そう」「この恥が！」《ギャル女将》トチョニカペペさん(25)が、中傷されても“創業80年の店”を継いだワケ,67,https://news.yahoo.co.jp/articles/57d616e03559d7612975182a9826fa8b1b1bcd6e,4/30(水) 7:17
2025-04-30,09:34,business,経済,6,日経ビジネス,すき家、ネズミ混入で3月客数は前年比1％減　8カ月ぶりの痛恨,57,https://news.yahoo.co.jp/articles/c7ec244669ed8661a013f856ed47cc5897e5053c,4/30(水) 6:00
2025-04-30,09:34,business,経済,7,FNNプライムオンライン（フジテレビ系）,米価格高騰も「もうからない」の悲鳴…約70年続く米農家三代目の本音「重労働。担い手不足で農家の数が単純に減ってしまう」　千葉・旭市,57,https://news.yahoo.co.jp/articles/4fbf19f7c9f1df116614fd69295f22deea271470,4/29(火) 18:34
2025-04-30,09:34,business,経済,8,Bloomberg,トランプ政権、アマゾンを「敵対的」と非難－関税費用を表示の報道で,50,https://news.yahoo.co.jp/articles/0117d42e5d2518546e1cb145f5de576a740d713e,4/29(火) 23:01
2025-04-30,09:34,business,経済,9,マネーポストWEB,トランプ関税交渉カードに米国産のコメ輸入拡大案　「外圧を利用した方が国産米にとっても長期的な安定供給に繋がる」との指摘、輸入米増加が改革を進める好機に,47,https://news.yahoo.co.jp/articles/2f4d32800cf4419b8e210fc6568a2f87f96776ff,4/29(火) 16:02
2025-04-30,09:34,business,経済,10,ねとらぼ,「なんとかして」　ワークマンの話題騒然“不審者パーカー”、高額転売に怒りの声……　「どうにかならないのか」,43,https://news.yahoo.co.jp/articles/59655a69cf3ceb10128b6141091a8171174008e1,4/30(水) 8:00
2025-04-30,09:34,business,経済,11,産経新聞,争奪過熱の任天堂スイッチ2、行き渡るのは1年以上先か　応募条件厳しく予約権プラチナ化,39,https://news.yahoo.co.jp/articles/298a4bf0b0e8b07d8fe9019f61dbe90f6d2627fb,4/29(火) 17:01
2025-04-30,09:34,business,経済,12,日経BizGate,剛力彩芽さんがSDGsを発信したい理由とは？　「姪っ子の未来を思って」　サステナビリティーのおもしろさ、楽しさをラジオで,36,https://news.yahoo.co.jp/articles/10809e55e80db84f2a8ea31a104dd5676a295c36,4/29(火) 11:04
2025-04-30,09:34,business,経済,13,ダイヤモンド・オンライン,「並ばない万博」以前の問題だろ！ガラガラなのにバスに乗れない“謎システム”にため息が出る…,32,https://news.yahoo.co.jp/articles/21a04c0aec4ccaf79b665f220c8fd4e9262a22d2,4/30(水) 6:02
2025-04-30,09:34,business,経済,14,BUSINESS INSIDER JAPAN,アメリカ車はガラケーならぬ「ガラ・カー」。世界で苦戦も、本国では最高の理由,29,https://news.yahoo.co.jp/articles/e8211a7a8e04793f7e62212bd7656c34640a7703,4/30(水) 7:00
2025-04-30,09:34,business,経済,15,共同通信,日本企業に米国での車生産望むとトランプ氏,28,https://news.yahoo.co.jp/articles/143a589f2d57e19b6611871345d754e0917b01ed,4/30(水) 8:02
2025-04-30,09:34,business,経済,16,共同通信,FRBは良い仕事をしていないとトランプ氏,27,https://news.yahoo.co.jp/articles/7986f511067b570731bb551d9cba896a28b95421,4/30(水) 7:46
2025-04-30,09:34,business,経済,17,ねとらぼ,焼き肉店アルバイトが厨房で“ケーキ食べ捨て”……　SNSで動画拡散、運営会社が謝罪「不適切な行為」,24,https://news.yahoo.co.jp/articles/1bbf055150323ddfb0959d0ebf0786c3d179b859,4/29(火) 18:08
2025-04-30,09:34,business,経済,18,ダイヤモンド・オンライン,「アルファードと同じ土俵では戦わない」マツダCX-80が「スライドドアなし」SUVにこだわる納得のワケ,23,https://news.yahoo.co.jp/articles/627f29063df85ed40903da45ad6386b151bf2699,4/30(水) 6:02
2025-04-30,09:34,business,経済,19,Bloomberg,飛び交う罵声、米共和党議員の集会が大荒れ－トランプ氏への怒り噴出,23,https://news.yahoo.co.jp/articles/cd1dea47d4d395eeedb3daad2932472d685f9894,4/29(火) 6:16
2025-04-30,09:34,business,経済,20,Forbes JAPAN,トランプによる「ドル破壊」は日本の2025年も巻き添えにする,22,https://news.yahoo.co.jp/articles/ebc80f70aee3bf905943be3957b857b73e11da25,4/30(水) 8:00
2025-04-30,09:34,business,経済,21,東洋経済オンライン,“東京ドーム4個分”の都有地が未処分・・・臨海副都心の誤算　構想が動き出して40年、巨大な「人工海上都市」プロジェクトは失敗だったのか,20,https://news.yahoo.co.jp/articles/ecdbec4371e88324309f9f4cda8e20f069ea966a,4/30(水) 5:41
2025-04-30,09:34,business,経済,22,ABEMA TIMES,農水大臣がインドネシアの農業相らと会談 乳製品の輸出解禁など要請,20,https://news.yahoo.co.jp/articles/f4d52045f2b130896896e24a5f47c4ab36afa352,4/30(水) 7:32
2025-04-30,09:34,business,経済,23,ファイナンシャルフィールド,共働きで世帯年収「800万円」ですが、貯金がなかなか増えません。食費・住宅費・保険…… 何に使いすぎている？ 貯金できない原因はどこにあるのでしょうか？,17,https://news.yahoo.co.jp/articles/7e90aa1150ba11a143373b74c72a765cd05f636b,4/30(水) 8:30
2025-04-30,09:34,business,経済,24,ダイヤモンド・オンライン,感じのいい人が「間違いを指摘する時」にさりげなく使う“2文字の言葉”とは？,17,https://news.yahoo.co.jp/articles/7e5a4f6efab874b1200009960a0848d3fc550ab1,4/30(水) 7:01
2025-04-30,09:34,business,経済,25,毎日新聞,トランプ氏、自動車部品の25％関税を一部免除へ　今後2年間,16,https://news.yahoo.co.jp/articles/2343b588a8d397e449c3c71f5b01f7ae0ec8b46d,4/30(水) 7:43
2025-04-30,09:34,business,経済,26,Bloomberg,トランプ氏、中国が関税コスト吸収と予想-米消費者への打撃軽減見込む,15,https://news.yahoo.co.jp/articles/6fe5268caf7c7916ed0df5ae480badde12d38492,4/30(水) 6:50
2025-04-30,09:34,business,経済,27,マネーポストWEB,西郷真央が海外メジャーVで早くも賞金2億円到達！　女子ゴルフ「大きすぎる日米マネー格差」でトップ選手流出に歯止めがかからない,15,https://news.yahoo.co.jp/articles/28af6e13ef2d5bc3c638f46f36b1c08c413f2ec4,4/30(水) 7:15
2025-04-30,09:34,business,経済,28,マネーポストWEB,「ここは居酒屋じゃない！」新幹線の飲酒マナー問題　酔客の声や態度が迷惑でも逃げ場がない…「乗務員が理不尽に怒鳴りつけられていた」カスハラの温床にも,15,https://news.yahoo.co.jp/articles/4b1acc2fad1d416cc847c596d4dbb9f38f75be56,4/29(火) 15:15
2025-04-30,09:34,business,経済,29,帝国データバンク,飲食料品値上げ、前年超え　10月までに1万4千品目、今夏も値上げラッシュ続く,14,https://news.yahoo.co.jp/articles/8219fd669861a5c08d77b5ddaeebc8237463b860,4/30(水) 9:00
2025-04-30,09:34,business,経済,30,読売新聞オンライン,路線バス「キャッシュレス決済のみ」、現金の利用率は４％に…完全化なら年８６億円効果,14,https://news.yahoo.co.jp/articles/84d5ef159d556f4e937a3be2511100c971718683,4/29(火) 23:08
2025-04-30,09:34,business,経済,31,共同通信,関税収入は減税の財源に充てられると米長官,13,https://news.yahoo.co.jp/articles/d4e41539c8d0c42290db65bc6d41356964af2041,4/29(火) 22:00
2025-04-30,09:34,business,経済,32,共同通信,遠隔地のコメ価格、抑制に期待　江藤農相、備蓄米放出で,13,https://news.yahoo.co.jp/articles/10ffe051738c62642990789ce2897ad58b23b75e,4/29(火) 19:17
2025-04-30,09:34,business,経済,33,読売新聞オンライン,米国産の自動車部品の割合８５％で無関税に…米商務長官,13,https://news.yahoo.co.jp/articles/ade71e807127ee5ea981f587210c46e5debb8c29,4/30(水) 6:57
2025-04-30,09:34,business,経済,34,毎日新聞,チャットGPTでデザイン作成5日→半日　福島の企業「元に戻れぬ」,12,https://news.yahoo.co.jp/articles/c7a3c4b60d239bc81b79aee57a677c348740c223,4/29(火) 12:15
2025-04-30,09:34,business,経済,35,ABCニュース,【深掘り】放出しても放出しても価格下がらず　食卓にも届かず　備蓄米効果ははたしてあるのか？　「農水省はコメの価格を下げたくなかった」元農水官僚の専門家が徹底解説,12,https://news.yahoo.co.jp/articles/17bfa22a700a646d6b85e3b93bd3b3e4054ede5a,4/29(火) 14:15
2025-04-30,09:34,business,経済,36,共同通信,政府、造船分野で対米協力検討　関税交渉、パッケージで提示,12,https://news.yahoo.co.jp/articles/1bda1d6145f4d1ef71dec8e00dbb70f3bd2a8c9c,4/29(火) 17:36
2025-04-30,09:34,business,経済,37,FNNプライムオンライン,『消費税減税』野党はほぼ一致　党内対立の自民党「石破さんは減税したい」と橋下氏　周りの反対派抑え「消費税減税言わないと石破さんらしくない」,12,https://news.yahoo.co.jp/articles/7f7281d6add09549ff8181bc82fb39ddfbd1fd46,4/29(火) 19:02
2025-04-30,09:34,business,経済,38,週刊SPA!,ラーメン店の廃業が急増！神座、山岡家…「有名ラーメンチェーン」の業績を比較,11,https://news.yahoo.co.jp/articles/e90692bdc6f8c5637996311101866f1d19bba287,4/30(水) 8:54
2025-04-30,09:34,business,経済,39,テレビ朝日系（ANN）,農水大臣 牛肉輸出や乳製品の早期解禁要請　“有望市場”インドネシア訪問,11,https://news.yahoo.co.jp/articles/665c17617aa0415d7bdc07aa7b183ecb6223d9f0,4/30(水) 1:50
2025-04-30,09:34,business,経済,40,共同通信,関税費用表示は「敵対的」　米政権、アマゾンを非難,11,https://news.yahoo.co.jp/articles/4048279e31daa78f168f8070458ad03b1f371961,4/30(水) 5:52
