scrp_date,scrp_time,genre_en,genre_jp,rank,media_jp,title,comment,link,date_original
2025-06-15,16:07,world,国際,1,読売新聞オンライン,イスラエル最先端のミサイル迎撃システム、崩れて商都で７３人死傷…住民「生き残っただけ幸運」,227,https://news.yahoo.co.jp/articles/ec05428c54d0832006a33fb9a5c02ed46f27e92c,6/15(日) 9:12
2025-06-15,16:07,world,国際,2,毎日新聞,イスラエルが「世界最大」のガス田攻撃　イランもミサイルで反撃,160,https://news.yahoo.co.jp/articles/cee9bad33befa1f0f677ef9750c3375b9a7fa62c,6/15(日) 6:32
2025-06-15,16:07,world,国際,3,読売新聞オンライン,ワシントンＤＣで軍事パレード、３４年ぶり…全米約２０００か所で「反トランプ」集会も,107,https://news.yahoo.co.jp/articles/b4a4e10bba9e900612f81995e6493050856f0e1c,6/15(日) 7:32
2025-06-15,16:07,world,国際,4,BBC News,米ミネソタで州議会議員と家族が襲われる　議員2人が死傷、それぞれの家族も死傷,82,https://news.yahoo.co.jp/articles/9108da8bd044b46d0f048dabd5a70d5297168fae,6/15(日) 12:41
2025-06-15,16:07,world,国際,5,共同通信,15日の米イラン核協議中止　攻撃下の交渉「無意味」,62,https://news.yahoo.co.jp/articles/3109c2876e17a3529b2a64ce561e4aaf61bfe5c8,6/14(土) 22:17
2025-06-15,16:07,world,国際,6,毎日新聞,急きょ搭乗のインド機が墜落　悲劇は空港から家族写真送った直後に,59,https://news.yahoo.co.jp/articles/90830185b84e7c0b94a9427b016c8a0b51f77aad,6/15(日) 6:30
2025-06-15,16:07,world,国際,7,中央日報日本語版,イランの報復にイスラエルで被害続出…米国、地上軍と海軍を投入へ,45,https://news.yahoo.co.jp/articles/a2f504791774a86750e3ffe32427d80b52747284,6/15(日) 9:14
2025-06-15,16:07,world,国際,8,日テレNEWS NNN,トランプ大統領「イランへの攻撃にアメリカは一切関わっていない」,44,https://news.yahoo.co.jp/articles/ff9b9483a4707b4e7a056ac5fc8682a23551b8dd,6/15(日) 15:11
2025-06-15,16:07,world,国際,9,読売新聞オンライン,ＬＡ抗議デモ、リトルトーキョーに深刻な打撃…暴徒による破壊や盗難「夜は雰囲気が一変」,44,https://news.yahoo.co.jp/articles/6637fb94a73bc08513b716cf57f5a2c71d7588d9,6/14(土) 18:55
2025-06-15,16:07,world,国際,10,CNN.co.jp,「王はいらない」　トランプ氏誕生日の軍事パレードに抗議、数百万人がデモ参加へ,42,https://news.yahoo.co.jp/articles/7baa65df95c7c55583817682a9dd0803eda76395,6/14(土) 18:17
2025-06-15,16:07,world,国際,11,TBS NEWS DIG Powered by JNN,イスラエルがイラン核施設を“先制攻撃” イランも100発以上の弾道ミサイルで報復　全面戦争の懸念【サンデーモーニング】,32,https://news.yahoo.co.jp/articles/e8a7c5eb790a389eafa2833c91e61a7475fe475b,6/15(日) 14:48
2025-06-15,16:07,world,国際,12,TBS NEWS DIG Powered by JNN,トランプ氏、LAのデモ隊非難し60年ぶりに州兵投入 暴動の発端は“突然拘束される恐怖”【サンデーモーニング】,31,https://news.yahoo.co.jp/articles/3f7dc9b507b3a70e9830d3a432f9d48b780dfac4,6/15(日) 14:20
2025-06-15,16:07,world,国際,13,TBS NEWS DIG Powered by JNN,イラン　イスラエルへの「報復攻撃」開始　イスラエルも攻撃続ける　応酬激化のおそれ　こうしたなか、国連安保理が緊急会合　イラン・イスラエル互いに非難,30,https://news.yahoo.co.jp/articles/d05aecbe7a266548f75859ff2dc8c57685648edb,6/14(土) 17:48
2025-06-15,16:07,world,国際,14,毎日新聞,イスラエルで子ども含む10人が死亡　イラン報復で衝突エスカレート,30,https://news.yahoo.co.jp/articles/13ee1be03670eda982a75091e633717f0e6f17a9,6/15(日) 14:49
2025-06-15,16:07,world,国際,15,時事通信,米ロ首脳、イラン情勢協議　電話会談、緊張緩和に向け,29,https://news.yahoo.co.jp/articles/a4e21e30e5ef9e803e2f78c09fd639367341b479,6/15(日) 1:20
2025-06-15,16:07,world,国際,16,中央日報日本語版,駆逐艦横転関連で幹部が北朝鮮メディアから消えた…懲役や処刑の可能性,29,https://news.yahoo.co.jp/articles/dc8902d9d6b06507d655e2e7506b27b7c220dc1e,6/15(日) 12:59
2025-06-15,16:07,world,国際,17,共同通信,インド墜落、機長「推力なし」　離陸直後、管制官に伝達,27,https://news.yahoo.co.jp/articles/0999f873825d32b73b9c193c21bd5cf5fc7702d9,6/14(土) 18:21
2025-06-15,16:07,world,国際,18,テレビ朝日系（ANN）,米ミネソタ州で州議会議員標的の連続銃撃事件　2人死亡,27,https://news.yahoo.co.jp/articles/1cb629a873fba6d3e8f426375c71a9e6523fae29,6/15(日) 3:02
2025-06-15,16:07,world,国際,19,Forbes JAPAN,独裁判所「刑務所内での大麻OK」判決──なぜそんなことに？,24,https://news.yahoo.co.jp/articles/c990a42d61b2c584a649265d7bbb860a3a644a75,6/15(日) 13:00
2025-06-15,16:07,world,国際,20,ロイター,英、中東に戦闘機を移動　地域の安全保障支援へ＝スターマー首相,23,https://news.yahoo.co.jp/articles/199e7b97d1b7c5fccfe875507c19ff737a127f0a,6/15(日) 13:34
2025-06-15,16:07,world,国際,21,ニューズウィーク日本版,ハルキウに過去最大の攻撃、市内が「巨大爆炎」に包まれた瞬間映像…ロシアの報復で40回以上の爆発,22,https://news.yahoo.co.jp/articles/e96c912d619b75bfa5ffc427175b604d82bc1e9c,6/15(日) 7:11
2025-06-15,16:07,world,国際,22,時事通信,米商務長官、社名変更や工場閉鎖に介入　USスチール「黄金株」　日鉄,22,https://news.yahoo.co.jp/articles/5703266df4392951d36cc991344a43250cf01741,6/15(日) 14:28
2025-06-15,16:07,world,国際,23,ＡＦＰ＝時事,イスラエル軍、イラン国防省本部・核関連施設を攻撃,21,https://news.yahoo.co.jp/articles/146b2af1f0626339df4bb418bd8c09aea78e005a,6/15(日) 15:34
2025-06-15,16:07,world,国際,24,読売新聞オンライン,イラン軍高官と核開発要人を相次ぎ「狙い撃ち」…イスラエル「モサド」暗躍の指摘も,21,https://news.yahoo.co.jp/articles/b539cd703a51f71116667f064b1cd9dc98ef244a,6/14(土) 20:46
2025-06-15,16:07,world,国際,25,ニューズウィーク日本版,メーガン妃とキャサリン妃は本当は「2人で泣き崩れていた」...メーガン妃証言の矛盾とは？,20,https://news.yahoo.co.jp/articles/8ec102c0202c2370ce35a40147e58678854827b4,6/15(日) 9:27
2025-06-15,16:07,world,国際,26,NEWSポストセブン,金髪美女インフルエンサー（26）が “性的暴力を助長する”と批判殺到の「ふれあい動物園」企画直前にアカウント停止《1000人以上の男性と関係を持つ企画で話題に》,20,https://news.yahoo.co.jp/articles/eba9f5d82ec88114ae9882363a7513e86e05b7f4,6/15(日) 7:15
2025-06-15,16:07,world,国際,27,AERA DIGITAL,デヴィッド・ベッカム氏に英王室が「ナイト」の称号　ヘンリー王子が激怒したワケ,18,https://news.yahoo.co.jp/articles/d89cbe3bc9d82591cada0b12449efd10b1821796,6/15(日) 11:32
2025-06-15,16:07,world,国際,28,TBS NEWS DIG Powered by JNN,アメリカ・ラトニック商務長官 USスチールの「黄金株」拒否権行使の内容説明、大統領の同意なしに「本社移転や社名変更など不可能に」,18,https://news.yahoo.co.jp/articles/593563c1d13ab37111f771fd840c7f12b13eed0d,6/15(日) 2:24
2025-06-15,16:07,world,国際,29,KOREA WAVE,韓国チキン店・配達アプリで注文したら「アプリ手数料も出せ」…店内で食べた客に追加料金請求,17,https://news.yahoo.co.jp/articles/de557f0606a11b98b9fc3b165ad3ac934004ee9e,6/15(日) 15:03
2025-06-15,16:07,world,国際,30,ハフポスト日本版,墜落したエア・インディアの機長が最後に残した音声が明らかに。救援を要請していた,17,https://news.yahoo.co.jp/articles/4a904550704ccd08897cd76b463c079c0adac610,6/14(土) 17:00
2025-06-15,16:07,world,国際,31,ＡＦＰ＝時事,イスラエル・イラン軍事衝突で支援減少を懸念 ゼレンスキー氏<br />,17,https://news.yahoo.co.jp/articles/1ae27c12b4ed0229607ef81167d2dc12c638e432,6/15(日) 12:13
2025-06-15,16:07,world,国際,32,KOREA WAVE,金正恩総書記より「一段高い場所」に立った娘…高まる「象徴的地位」、再注目の「後継者説」,17,https://news.yahoo.co.jp/articles/56ed84fcb934aa290efce83d63f10521215a1b92,6/15(日) 11:03
2025-06-15,16:07,world,国際,33,FNNプライムオンライン（フジテレビ系）,トランプ米大統領に抗議　ロサンゼルスでも「ノー・キングス」掲げデモ　全米2000カ所で呼びかけ,16,https://news.yahoo.co.jp/articles/7b9c0f14abbf5554610921a8de4d4f5741b214e4,6/15(日) 8:37
2025-06-15,16:07,world,国際,34,中央日報日本語版,「渋滞で乗り遅れたが神に感謝」…１０分差でインド旅客機墜落事故回避した女性,16,https://news.yahoo.co.jp/articles/d28f836fc2d32bec187ee383fd3d9ec4f0b50b81,6/15(日) 11:00
2025-06-15,16:07,world,国際,35,毎日新聞,イランとイスラエル、「交戦状態」に　石油施設標的で世界経済に影響も,15,https://news.yahoo.co.jp/articles/22f46670fa71b71e6f613799a241250660beeb0f,6/15(日) 15:50
2025-06-15,16:07,world,国際,36,日テレNEWS NNN,中国人女性「武力統一」支持発言で相次ぎ台湾退去に　台湾で生まれた中国出身2世、中台対立で感じる恐怖・不安,15,https://news.yahoo.co.jp/articles/611264717d42a1980364eade7685b619d6f89e4e,6/14(土) 18:18
2025-06-15,16:07,world,国際,37,ＡＦＰ＝時事,イランの攻撃で8人死亡、130人超負傷 イスラエル,15,https://news.yahoo.co.jp/articles/5febeed26c14d182e5d58d85126383d65f6dd8bb,6/15(日) 13:52
2025-06-15,16:07,world,国際,38,クーリエ・ジャポン,6歳で女性器切除されたインフルエンサーが伝える「女性器再建のプロセス」,15,https://news.yahoo.co.jp/articles/d9153f0a14a33dc64c3973b998aa93de15b418d9,6/15(日) 13:50
2025-06-15,16:07,world,国際,39,共同通信,全米でトランプ氏に抗議デモ　「王はいらない」最大規模,15,https://news.yahoo.co.jp/articles/58c10b1bbdc8ff061ef172c5c2f3149ff0cfdabb,6/15(日) 7:09
2025-06-15,16:07,world,国際,40,JBpress,【最悪の事態】イスラエルが看過できなかったイランの「ウラン濃縮」、このままなら5カ月で核兵器級22個分を製造,14,https://news.yahoo.co.jp/articles/f0df0ea2de6ec7a2d54a0b38c9850db319da85a7,6/15(日) 7:02
