scrp_date,scrp_time,genre_en,genre_jp,rank,media_jp,title,comment,link,date_original
2025-06-15,12:33,local,地域,1,tbc東北放送,線路内にカメラ持った人「撮り鉄」か　カシオペアなど一時運転見合わせ1100人に影響　宮城,620,https://news.yahoo.co.jp/articles/1e1edd0d771e193c214f51db84301feae2d44641,6/15(日) 11:19
2025-06-15,12:33,local,地域,2,南日本新聞,2万円は「食費にかかる1年間の消費税負担額だ」自民・森山幹事長、首相表明の参院選公約「国民一律給付」根拠を説明,335,https://news.yahoo.co.jp/articles/d0c88a1c1408d56fc42356245eac2fd7a9ccb481,6/15(日) 7:02
2025-06-15,12:33,local,地域,3,北海道新聞,鳥インフルにシャチ　霧多布岬の野生ラッコ受難続く　明治の法律で保護捕獲などできず,249,https://news.yahoo.co.jp/articles/234e1482f939c048692e6dc86f1c84a5458c1f99,6/15(日) 6:01
2025-06-15,12:33,local,地域,4,TNCテレビ西日本,“タクシー無賃乗車”で24歳中国籍の女を逮捕　財布やスマホ持たず　「怒鳴って料金支払わない」と通報　福岡,224,https://news.yahoo.co.jp/articles/98d2e545d639921487418c5ed248973a78ed0339,6/15(日) 8:00
2025-06-15,12:33,local,地域,5,神戸新聞NEXT,【独自】元県民局長の私的情報、兵庫県職員「運んだだけ」　立花氏と接触認める　演説で実名挙げられ,174,https://news.yahoo.co.jp/articles/dee3fa80543b9fbf0228ee65ff15ace6ca8ad771,6/15(日) 5:15
2025-06-15,12:33,local,地域,6,京都新聞,京都で横行、条例無視の「違反自販機」　なのに市は罰金28年科さない謎対応、順守者「ずるい」と不満,120,https://news.yahoo.co.jp/articles/a04b86a9e58b7f462a5e52cea90f20b6996a502c,6/15(日) 10:32
2025-06-15,12:33,local,地域,7,HBCニュース北海道,バイクは車体が大破　前輪と後輪バラバラに「単独事故でけがをしている」左カーブ曲がりきれず…50代くらい男性ライダー転倒　右足の痛み訴え病院搬送　北海道小樽市,76,https://news.yahoo.co.jp/articles/befa06c64924229ad23c7b361deb94c11d8dcc40,6/15(日) 11:27
2025-06-15,12:33,local,地域,8,千葉日報オンライン,【速報】路上で男性の胸を包丁で刺す　殺人未遂容疑でミャンマー人の男逮捕　被害者は病院で死亡確認　野田,73,https://news.yahoo.co.jp/articles/390ceb23e018f2ac5dc89cd729a08d7fc227a637,6/15(日) 11:46
2025-06-15,12:33,local,地域,9,MBSニュース,軽乗用車の前方が大破　１７歳女性が『無免許運転』５人が重軽傷の事故…電柱に衝突し田んぼに転落　奈良・橿原市,67,https://news.yahoo.co.jp/articles/347f0271d385c0c8d5a43dabd843f609a2b3f780,6/14(土) 18:15
2025-06-15,12:33,local,地域,10,新潟ニュースNST,県が管理する太陽光発電所の銅線約3000kg(時価約540万円相当)を盗んだ疑い　ベトナム人とカンボジア人の男2人を逮捕　新潟,56,https://news.yahoo.co.jp/articles/f673655d3fb59eba1393e365f7380031e8b6ffb6,6/15(日) 9:46
2025-06-15,12:33,local,地域,11,福島民友新聞,首を絞めたら乳児が急変、途中で思いとどまったか...　殺人未遂疑いの父親,31,https://news.yahoo.co.jp/articles/42fa8adc0f6f8e3fa58c5e23e5a2b13ca05be9ff,6/15(日) 8:27
2025-06-15,12:33,local,地域,12,読売テレビ,【衝撃】「オレは綾野剛だ」大阪・ミナミの“地面師グループ”の1人はあの人気ドラマを視聴していた！　『土地が人を狂わせる』14.5億円の被害…詐欺の巧妙な手口とは―,27,https://news.yahoo.co.jp/articles/c5939c878afd54353fce1cf9731f0ad1f66573ef,6/15(日) 9:00
2025-06-15,12:33,local,地域,13,千葉日報オンライン,【速報】千葉県内1330軒停電,23,https://news.yahoo.co.jp/articles/40e100079155402e5ce25631698c305d054a6c65,6/15(日) 10:16
2025-06-15,12:33,local,地域,14,千葉日報オンライン,エアコン修理業者から現金脅し取った疑い　「悪い友だちがいっぱいいるんだぞ」と難癖か　柏署が2人逮捕,22,https://news.yahoo.co.jp/articles/e5feaad5fcdcb04163505633ee35fa449fe61135,6/15(日) 12:01
2025-06-15,12:33,local,地域,15,関西テレビ,誕生日に悲劇…無免許運転の車が衝突　同乗の26歳女性が死亡　居眠り運転か？　大阪・柏原市,22,https://news.yahoo.co.jp/articles/027d1bdf7c4718bf9d88cb592893d876bed6ff67,6/14(土) 23:46
2025-06-15,12:33,local,地域,16,カナロコ by 神奈川新聞,神奈川・松田町の町道　酒気帯び運転で歩行者６人に追突、２人けが　容疑の男を現行犯逮捕,21,https://news.yahoo.co.jp/articles/8f1e3c37019a130837503774c5db55af30cb2348,6/15(日) 11:21
2025-06-15,12:33,local,地域,17,静岡新聞DIGITAL,身寄りのない高齢者、転院できず苦慮　身元保証前提の慣習課題　静岡県内救急病院,21,https://news.yahoo.co.jp/articles/5f7887a78f4de1ec932b79d12bdd4fa0f241b248,6/15(日) 9:58
2025-06-15,12:33,local,地域,18,読売テレビ,【速報】万博14日（土）一般来場者は13万人　この週末は雨の予報も…ゲート前には朝から長蛇の列　南港・ATCのシャトルバス新路線が15日運行開始,21,https://news.yahoo.co.jp/articles/efcd47f543a2ef986e1beb9c3d4ce2cd118e812f,6/15(日) 9:55
2025-06-15,12:33,local,地域,19,日本海テレビ,軽自動車2台が正面衝突　子どもを含む4人を搬送　島根県松江市,21,https://news.yahoo.co.jp/articles/968aa953d60f33ff069da0363ba1455e4d20628b,6/14(土) 19:29
2025-06-15,12:33,local,地域,20,北海道新聞,マンホールカード、1枚6万円での売買も　自治体困惑「配布はマチに来てもらうため」　法的には問題なし,19,https://news.yahoo.co.jp/articles/9c7e1a1cbc25e5a6cf3d32bc2877bdb3b110bc53,6/15(日) 10:16
2025-06-15,12:33,local,地域,21,新潟ニュースNST,報酬は現金6万円…貯金口座のキャッシュカードを有償で譲り渡した疑い　ベトナム国籍の技能実習生の男(21)を逮捕　新潟・阿賀野市,17,https://news.yahoo.co.jp/articles/763b4bbf8d45a9cb5ab586027fc287bc0a003f22,6/15(日) 11:28
2025-06-15,12:33,local,地域,22,MBSニュース,【速報】万博東ゲート前はきょうも長蛇の列…レジオネラ属菌で中止続く「水上ショー」対策も指針値下回らず…再開はいつ？,17,https://news.yahoo.co.jp/articles/a46aafc0ab0a3e5dc001092b2811d1b5877e3182,6/15(日) 8:47
2025-06-15,12:33,local,地域,23,北海道ニュースUHB,ワゴン車と耕運機に挟まれた男性（48）の遺体発見_耕運機は“バックギア”の状態…ワゴン車に積み込もうとして事故に遭ったか_一人暮らしで目撃者なし…配達員が発見〈北海道・伊達市〉,17,https://news.yahoo.co.jp/articles/b3d93fa33182c477a926a830e4680c72a34e669f,6/15(日) 8:42
2025-06-15,12:33,local,地域,24,MBSニュース,当時10歳の娘とはもう連絡取れず「取り返しがつかないことを」無期懲役、服役は4度目...リスナーが受刑者の『刑務所ラジオ』年に1度のリクエストに重ねる思い,17,https://news.yahoo.co.jp/articles/25f0a35ab42bda49cd0c214c9b21cac3152244a0,6/15(日) 11:10
2025-06-15,12:33,local,地域,25,STVニュース北海道,「お前の働いている会社に行く」 LINEで知人女性を脅迫 男（50）を逮捕 北海道旭川市,16,https://news.yahoo.co.jp/articles/75ba025b8b95c55717812a345462761c6f911e7f,6/15(日) 10:24
2025-06-15,12:33,local,地域,26,TNCテレビ西日本,赤信号で対向車線に停車…“飲酒運転”19歳の男を逮捕　未成年2人も飲酒状態で同乗　「きのうから全く飲んでいない」と否認　福岡,15,https://news.yahoo.co.jp/articles/b0432f58095c163bdbada5911a6736e7dd1aeaad,6/15(日) 8:24
2025-06-15,12:33,local,地域,27,河北新報,「安値備蓄米が農家の経営を圧迫」小泉農相に意見書送付へ　コメどころ秋田・大潟の村議会,15,https://news.yahoo.co.jp/articles/0cfa996e6d0f8737e26940e8e4d65afbab4331dd,6/14(土) 13:33
2025-06-15,12:33,local,地域,28,チューリップテレビ,試供品の日焼け止めクリーム盗んだ疑い　自称・公務員の女を逮捕　容疑を認める　富山,14,https://news.yahoo.co.jp/articles/b0c8c9d4b9b07743c4fab34ce062630ddb00a6a8,6/15(日) 9:58
2025-06-15,12:33,local,地域,29,静岡放送（SBS）,「元旦那に殴られた」女性が110番通報 元妻の顔を殴った暴行の疑いで25歳男逮捕=静岡・御殿場警察署,14,https://news.yahoo.co.jp/articles/d23a62236b28f458dbc438cfe2b6234bb6daca07,6/15(日) 10:32
2025-06-15,12:33,local,地域,30,千葉日報オンライン,【続報】拳銃の使用「適切だったとみている」と旭署　急発進車に警察官が発砲　逃走の男か「撃たれた」と出頭、現場から24キロ離れた山武署に　千葉,14,https://news.yahoo.co.jp/articles/bb1bcf839e7d4e4549b2e72be50313553d921063,6/14(土) 15:12
2025-06-15,12:33,local,地域,31,北海道ニュースUHB,77歳の女を逮捕したのは“70代の女性警備員”_スーパーで”トートバッグにハンカチを乗せ”不審な行動…すると惣菜2点(918円)をバッグの中に_女の所持金は1万8000円〈札幌市〉,13,https://news.yahoo.co.jp/articles/bdcc4d27ebc9c2ad79ba6044d4125ed73f1ab386,6/15(日) 8:52
2025-06-15,12:33,local,地域,32,大分合同新聞,【問う 時速194km交通死亡事故】法のジレンマ①　危険運転罪の運用「一般感覚と大きなギャップ」,13,https://news.yahoo.co.jp/articles/4eec7e2c97df03a9029127d66e6091df34013c27,6/15(日) 7:02
2025-06-15,12:33,local,地域,33,RKB毎日放送,「きのうから全くお酒を飲んでいない」19歳の男を酒気帯び運転疑いで逮捕　車にはほかに20歳以下の2人も乗車,13,https://news.yahoo.co.jp/articles/70a391e7b83f84860c874cbf32af3eaa45a5d057,6/15(日) 8:17
2025-06-15,12:33,local,地域,34,RKB毎日放送,「お酒が体に残っている感覚はありませんでした」「給油口」開いたまま走行　酒気帯び運転疑いで53歳男逮捕,12,https://news.yahoo.co.jp/articles/9a242f7e5119c8e1e7aeedc9a944b3412ae87a30,6/15(日) 7:34
2025-06-15,12:33,local,地域,35,RKB毎日放送,「アルコールを口にしていません」酒気帯び運転疑いで43歳男逮捕,11,https://news.yahoo.co.jp/articles/e4b9cdb6c2b657bbb3cd4220d006cd66b534edc3,6/15(日) 10:28
2025-06-15,12:33,local,地域,36,静岡新聞DIGITAL,男性警官を懲戒免職処分　不同意わいせつなどの疑い　静岡県警、被害者保護重視し公表せず,11,https://news.yahoo.co.jp/articles/2b2029a2b7d8fbe2fe6453f11c903267ab5fe1e9,6/15(日) 8:35
2025-06-15,12:33,local,地域,37,埼玉新聞,中学校の給食費、無償化の方針　埼玉・久喜　市長が明らかに　小学校の市費を中学校に振り替え、財源を確保,11,https://news.yahoo.co.jp/articles/4b3879f7092dc1dd18c9eeedfef13aac7c32935a,6/15(日) 9:44
2025-06-15,12:33,local,地域,38,新潟ニュースNST,スーパーマーケットで肉団子など3点を万引き　無職の男（60）を現行犯逮捕　従業員が犯行の瞬間を目撃　新潟・秋葉区,11,https://news.yahoo.co.jp/articles/2b142c7e714a0d7d2974e033c1030e2b6cc564d9,6/15(日) 9:38
2025-06-15,12:33,local,地域,39,釧路新聞電子版,退官予定自衛官がバス運転体験　北海道釧路市,11,https://news.yahoo.co.jp/articles/9e577e7e5e57238e5709cb95e945d8e7381c80b6,6/15(日) 9:01
2025-06-15,12:33,local,地域,40,広島テレビ　ニュース,随意契約の備蓄米　スーパーのフジが広島県内全店舗で販売,10,https://news.yahoo.co.jp/articles/839a9e2419dc421c75bae75169c060ead92186b3,6/15(日) 11:54
