scrp_date,scrp_time,genre_en,genre_jp,rank,media_jp,title,comment,link,date_original
2025-03-30,23:06,business,経済,1,朝日新聞,「令和の百姓一揆」　農家が所得補償求め、都心をトラクターでデモ,329,https://news.yahoo.co.jp/articles/e90e687131a9289657b1ed48c8d5653beb6ef882,3/30(日) 20:00
2025-03-30,23:06,business,経済,2,ダイヤモンド・オンライン,こりゃトヨタも抜かれるわ…テスラを超えた「BYD」を軽く見る日本人を待ち受ける「受け入れがたい未来」,82,https://news.yahoo.co.jp/articles/e0b3f653204b872840120b2d723ef53ebc3269c1,3/30(日) 8:02
2025-03-30,23:06,business,経済,3,ファイナンシャルフィールド,議員が「新幹線の車内販売の炭酸水が160円もして高い」と発信し炎上！ 理由は国会議員は「新幹線のグリーン車がタダ」だから？ 特権とされる「特殊乗車券」について解説,69,https://news.yahoo.co.jp/articles/69c67461ea61ccb36f9d221ec7aa452911f8c692,3/30(日) 13:30
2025-03-30,23:06,business,経済,4,共同通信,すき家、31日から一時閉店　混入防止でひび割れ処置,56,https://news.yahoo.co.jp/articles/6fe5349fad69b05643f77daad28acdd16eb58a6b,3/30(日) 21:59
2025-03-30,23:06,business,経済,5,ファイナンシャルフィールド,夫がガソリンを入れるためだけに「コストコの会員」になっています。会費が「年4840円」と考えるとあまりお得ではないように感じますが、元は取れているのでしょうか？,44,https://news.yahoo.co.jp/articles/15220fb6e517e06d11f33627715b9d5a431fb13b,3/30(日) 13:40
2025-03-30,23:06,business,経済,6,マネーポストWEB,石破政権、支持率20％台の“絶体絶命”でも内閣不信任案が出ない異常事態　「立憲民主党が石破総理を守っている」状況の先に見える「年金増税」,41,https://news.yahoo.co.jp/articles/d69eef8417dcf4b5ac9066038f863f7c70170a26,3/30(日) 7:15
2025-03-30,23:06,business,経済,7,ITmedia ビジネスオンライン,ポッカサッポロ「コーン茶」、前年比2倍の伸び　若い女性になぜ売れる？,40,https://news.yahoo.co.jp/articles/1735d6173df554f378f2b9ec64c62fa1aac864a2,3/30(日) 15:52
2025-03-30,23:06,business,経済,8,共同通信,短期在留に農地取得を認めず　政府、外国人対象に要件厳格化,36,https://news.yahoo.co.jp/articles/5fb061e4fd4ef1500074836d21ac8c06febca919,3/30(日) 17:05
2025-03-30,23:06,business,経済,9,産経新聞,道路に太陽光パネル促進法案が衆院可決　反対した保守党　国会「脱炭素原理主義に汚染」,32,https://news.yahoo.co.jp/articles/5629bf06f80680514873c04ac095a5fb47bd0521,3/30(日) 7:00
2025-03-30,23:06,business,経済,10,プレジデントオンライン,ヒット作はコナン、ハイキュー!!、ガンダム…「観客動員数5000万人減」の映画館がアニメばかりになった理由,31,https://news.yahoo.co.jp/articles/823dfa8111110844182b18e94ebddf7786efcf52,3/30(日) 18:17
2025-03-30,23:06,business,経済,11,Merkmal,率直に言う EVアンチは単なる「中国嫌い」である,25,https://news.yahoo.co.jp/articles/dd4f62e553fc18daaecfa056f3a1bf806b66a0e7,3/30(日) 8:50
2025-03-30,23:06,business,経済,12,ファイナンシャルフィールド,引っ越しのため、新居前に停車していたら「緑のおじさん」に駐車違反切符を切られた！「自宅前・荷物の積み下ろし」でも罰金になるの？ 駐車監視員に切符を切られた場合の“効力”とは？,25,https://news.yahoo.co.jp/articles/d9ca4790787f9267c16259a53f5e2bf84e771629,3/30(日) 16:10
2025-03-30,23:06,business,経済,13,共同通信,車価格上昇「全く気にしない」　トランプ氏、NBC報道,25,https://news.yahoo.co.jp/articles/5edf5540903cf558361c6950fa90aca2e80f058b,3/30(日) 12:22
2025-03-30,23:06,business,経済,14,ITmedia ビジネスオンライン,富士通、新卒一括採用を廃止　新卒入社者の年収は550万円～700万円に,23,https://news.yahoo.co.jp/articles/254611cab232bf495337ffd427a6247d3c409318,3/30(日) 19:18
2025-03-30,23:06,business,経済,15,関西テレビ,大阪市内モーニング最安値は『250円』倒産相次ぐ喫茶店 経営苦しくても続ける理由「笑顔が売り上げ」,23,https://news.yahoo.co.jp/articles/5dc4404ee1b2612c837e7f76f5dc593b52398275,3/30(日) 8:00
2025-03-30,23:06,business,経済,16,共同通信,トラクター30台、東京を行進　農家が所得補償求めデモ,22,https://news.yahoo.co.jp/articles/fe00822f4e5cfa8daa3ffbfb15451bfa770df6da,3/30(日) 18:08
2025-03-30,23:06,business,経済,17,ファイナンシャルフィールド,子ども名義で作った銀行口座に貯めてきた「100万円」。そのまま子どもにあげるのは問題ないですよね？,22,https://news.yahoo.co.jp/articles/5a25434fa519a6499d666df3e3a1d322aec3294f,3/30(日) 19:11
2025-03-30,23:06,business,経済,18,ファイナンシャルフィールド,免許取り立ての娘が「軽自動車だから軽油だと思った」とパニックで帰宅！ 誤った油種を入れてしまうと、修理に「50万円」以上かかる場合も!? 対処法を解説,21,https://news.yahoo.co.jp/articles/45878a70c20450dded54f7990d5ee12f828f1338,3/30(日) 13:40
2025-03-30,23:06,business,経済,19,東洋経済オンライン,「ネズミの次はゴキブリかよ…」すき家《全店一時閉店》も、今すぐすべき“2つのこと”ーー10年前に「やらかすも完全復活した」マクドナルドの成功例に学ぶ,21,https://news.yahoo.co.jp/articles/b870bf7a6d118086b76a4440f2cf852bf9db8e0a,3/30(日) 10:56
2025-03-30,23:06,business,経済,20,東洋経済オンライン,「予約したいのにできない」「値段が高すぎる…」中には7万円超えのすし屋も　“超高額”、“予約困難店”が増え続ける根本的な理由,19,https://news.yahoo.co.jp/articles/6008e799ce3be0f71de4b2560a8577fe79fa957f,3/30(日) 11:32
2025-03-30,23:06,business,経済,21,テレビ朝日系（ANN）,値上げ前にビール、ティッシュまとめ買い　高騰にスーパー苦悩「商売難しい」,19,https://news.yahoo.co.jp/articles/b88be0f0ad22151c5f0315a95d6af2ed294f20dd,3/30(日) 12:06
2025-03-30,23:06,business,経済,22,くるまのニュース,春先は要注意!? 運転中にガラスが「ビシッ！」危険な「飛び石」なぜ起きる？ 思わぬ出費で「最悪」「悲しい」の声も…対策どうすればいいのか,19,https://news.yahoo.co.jp/articles/915b2163cf656474bb0e49a067229a6ad16efeec,3/30(日) 9:10
2025-03-30,23:06,business,経済,23,ITmedia ビジネスオンライン,日本のIT職の給与「中国・香港の半分以下」　問われる経営陣の決断力,18,https://news.yahoo.co.jp/articles/514b0e3c1d782609e263f3d8249bdff67e762583,3/30(日) 19:07
2025-03-30,23:06,business,経済,24,Merkmal,山陰新幹線、ついに現実路線へ？ 中速鉄道の夜明け！ 新大阪～舞鶴1時間短縮、在来線活用と新線建設のハイブリッド、この鉄道でなぜ地域は活性化するのか？,18,https://news.yahoo.co.jp/articles/79df113d0d4af338425e5b4ab2824ee55e567a98,3/30(日) 5:51
2025-03-30,23:06,business,経済,25,WEB CARTOP,「どんなボロ車でも買い取ります」ってホント？　なんか怪しい謳い文句の業者って大丈夫なのか,17,https://news.yahoo.co.jp/articles/5c415ac86d5df3d3c8d9078348c153fc63760020,3/30(日) 17:30
2025-03-30,23:06,business,経済,26,現代ビジネス,これから日本は「経済成長」できるのか…移民を受け入れた国と消極的な日本の「大きな差」,17,https://news.yahoo.co.jp/articles/fa87368783f7fb0736dd113c4e6ee5f4b4b932d7,3/30(日) 7:03
2025-03-30,23:06,business,経済,27,関西テレビ,「とりあえず払っときます」でこっそり5000ポイントゲット　これってどうなの？出張で得た分は違法？,16,https://news.yahoo.co.jp/articles/b503621f9050ec14e3d9703aa27c78c720a921ee,3/30(日) 8:00
2025-03-30,23:06,business,経済,28,ファイナンシャルフィールド,友人に「軽自動車を買いたい！」と話したところ、「なるべく4月に買った方がいいよ」と言われました。4月に買うとなにか「特典」でもあるのでしょうか？,16,https://news.yahoo.co.jp/articles/85b0ee3a3e0aa01f49ac32843478a5760445e7ac,3/30(日) 15:40
2025-03-30,23:06,business,経済,29,テレビ朝日系（ANN）,大阪・関西万博「空飛ぶクルマ」のデモ飛行　日本航空・住友商事が断念で調整,16,https://news.yahoo.co.jp/articles/3a0b55b5825be7f4b8d7d95a2ab52bbc84e68d52,3/30(日) 16:36
2025-03-30,23:06,business,経済,30,くるまのニュース,マツダが「小さな高級セダン」を公開へ！ 全長4.5m“ちょうどいいサイズ”に画期的「1.8リッターV6エンジン」搭載！ 美しすぎる“5ナンバーセダン”「ユーノス500」を披露,15,https://news.yahoo.co.jp/articles/23ceae9887e99e34ecad6719995f2561877e2a14,3/30(日) 19:10
2025-03-30,23:06,business,経済,31,ベストカーWeb,5L・V8エンジンが最高!! レクサス[RC/RC F]の最終モデルが秋頃登場!!,14,https://news.yahoo.co.jp/articles/b48e3a12150f5f8b5e965cd8d2086e6032e92a20,3/30(日) 22:00
2025-03-30,23:06,business,経済,32,FNNプライムオンライン,週明けも株価大幅下落?トランプ関税で暗雲漂う景気の先行き　「値上げの春」で強まる食品インフレ,14,https://news.yahoo.co.jp/articles/b96acf70c3d0dbc6745c4d7a126cffc07cdf88a5,3/30(日) 19:02
2025-03-30,23:06,business,経済,33,ファイナンシャルフィールド,もうすぐ開幕する「大阪万博」に行ってみたいです。4人家族だと「交通費」もばかにならないのですが、「新幹線以外」でなるべく安く行く方法はありませんか？,14,https://news.yahoo.co.jp/articles/06a74875a2a49e80c7a4b5a49f11251e4c38fed7,3/30(日) 14:00
2025-03-30,23:06,business,経済,34,FNNプライムオンライン,みんなの代わりに「とりあえず払っときます」と“5000ポイントゲット”「幹事特権」で『ポイ活』したら法的問題はあるのか,14,https://news.yahoo.co.jp/articles/b9a4e8a7f80cf97ffa01750fe1c835ab8dae7209,3/30(日) 16:04
2025-03-30,23:06,business,経済,35,共同通信,中国の国有大手4行が資本増強　計10兆円、公的資金を注入,13,https://news.yahoo.co.jp/articles/b2b44b2d853fc3309587fe9ec0bf615ed3af8280,3/30(日) 21:56
2025-03-30,23:06,business,経済,36,マネーポストWEB,「これは常習犯だな…」多国籍ファンが集うK-POPアーティストのライブ会場で目撃された“外国人の盗撮手口”　注意をすると「日本語わからない」、ライブが終わると即退散で通報できず,13,https://news.yahoo.co.jp/articles/315996a7e8b388eeab99a082b501a91b0b297b49,3/30(日) 16:15
2025-03-30,23:06,business,経済,37,みんかぶマガジン,米商務長官「テスラ株を買え」マスク氏支える“異例の推薦”に世界驚愕…独の販売数は前年比71％減,12,https://news.yahoo.co.jp/articles/0a5dcdf454617620602a6735b5da26686c3b39a9,3/30(日) 9:10
2025-03-30,23:06,business,経済,38,くるまのニュース,茨城県警「過積載許さん！」徹底取締りに反響多数「他県も見習って」「正義がある」圏央道や国道4号で“不正残土運搬”指導も,11,https://news.yahoo.co.jp/articles/7cdd91c66256ddcceb6d8cbbf36458ec66d15d65,3/30(日) 13:30
2025-03-30,23:06,business,経済,39,電波新聞デジタル,マイナカードでチケット不正転売防止へ　デジタル庁が大規模ライブで実証,11,https://news.yahoo.co.jp/articles/e0c9f252d6ab0d2ffbc512f2df3e070306ac2161,3/30(日) 19:41
2025-03-30,23:06,business,経済,40,MotorFan,ヤマハの3本柱「YZF-R」「XSR」「MT」に新たな展開を見た！【モーターサイクルショー2025】,11,https://news.yahoo.co.jp/articles/8d247d14470ca56241c73891ba6ea937a4c6b735,3/30(日) 8:21
