scrp_date,scrp_time,genre_en,genre_jp,rank,media_jp,title,comment,link,date_original
2024-04-03,15:23,business,経済,1,日刊ゲンダイDIGITAL,裏金処分の線引き「500万円」が裏目…大荒れ自民党が3つに“分裂”、怒りの矛先が岸田首相に,200,https://news.yahoo.co.jp/articles/10743911913df417af9a52a220cd52847c9e9256,4/3(水) 14:03
2024-04-03,15:23,business,経済,2,集英社オンライン,長崎ちゃんぽん「リンガーハット」が値上げで客離れ…フードコート依存からロードサイド型への転換に光はあるのか,140,https://news.yahoo.co.jp/articles/50ef8c9899bd418b21bab6b5306c6b5633f9cd6d,4/3(水) 8:03
2024-04-03,15:23,business,経済,3,ファイナンシャルフィールド,年収400万円で「ハリアー」の新車を買うのは無謀ですか？ ローンで買いたいのですが、毎月の家賃「8万円」もあるし厳しいでしょうか…？,85,https://news.yahoo.co.jp/articles/667cfc01283333544928034a45a64e2326c95858,4/3(水) 13:40
2024-04-03,15:23,business,経済,4,日刊ゲンダイDIGITAL,大阪万博「玉川徹氏は禁止」…吉村府知事オラオラ発言で大炎上→詭弁屁理屈で釈明の何サマ,85,https://news.yahoo.co.jp/articles/6942934cfbf9986e7230d14d34570ef8b54ba413,4/3(水) 9:06
2024-04-03,15:23,business,経済,5,ファイナンシャルフィールド,隣に住む50代男性が「生活保護」を受けながらパチンコに通っています。問題にならないのでしょうか？,81,https://news.yahoo.co.jp/articles/c39b3955ed17c4c6c058c90fa0493d984ad9d254,4/3(水) 11:20
2024-04-03,15:23,business,経済,6,ファイナンシャルフィールド,たばこを20歳から「1日1箱」吸っています。同僚に「吸わなかったらベンツを買えるのに」と言われたのですが、本当に買えるものなのでしょうか？ 現在50歳で、喫煙歴は30年になります,74,https://news.yahoo.co.jp/articles/1718d00a91bb1da07e1f1430460773e3f6ee94d7,4/3(水) 14:10
2024-04-03,15:23,business,経済,7,日刊ゲンダイDIGITAL,川勝平太・静岡県知事が突如辞意…「リニア反対派」の退場で波紋広がる,64,https://news.yahoo.co.jp/articles/0294989cf10675bb8b51b0dc808a33e47211cbb3,4/3(水) 12:56
2024-04-03,15:23,business,経済,8,ダイヤモンド・オンライン,役員室に入る前に2回ノックしたら「ノックは4回が常識だ！」と叱られた。それって正しい？【大人の言い換え力検定】,62,https://news.yahoo.co.jp/articles/51f9bfabd3d3e637aacebd43fa2a20bbd91c58b1,4/3(水) 13:02
2024-04-03,15:23,business,経済,9,日刊ゲンダイDIGITAL,維新馬場代表に“おもろないねん”の大合唱 吉村知事「万博出禁」発言に寒すぎフォローで火に油,61,https://news.yahoo.co.jp/articles/a16f31ba17a5754ad722ab8db40d3523dc596a49,4/3(水) 11:28
2024-04-03,15:23,business,経済,10,Merkmal,「これは返金レベル」 1回数万円の“鉄道撮影会”で起きた失態に、ファンの不満爆発？ 落胆と満足の境界はどこにあるのか,55,https://news.yahoo.co.jp/articles/df5438a6115d2cbd28e80d6233e541910b97c59e,4/3(水) 11:51
2024-04-03,15:23,business,経済,11,WEB CARTOP,クルマは「エンジンパワー」だけみても速い遅いはわからない！　見るべきは車重をパワーで割った数字だった,38,https://news.yahoo.co.jp/articles/14f235693424fdcaf2023c6b2408cdcde209add5,4/3(水) 10:10
2024-04-03,15:23,business,経済,12,日テレNEWS NNN,旬の“春キャベツ”が高値　仕入れ値が倍に　小さいまま生育止まり…,37,https://news.yahoo.co.jp/articles/938979bd346355dcb7a924b80c9714ff341930fb,4/2(火) 21:55
2024-04-03,15:23,business,経済,13,ファイナンシャルフィールド,友人が高速道路で「ガソリン切れになり」罰金を支払ったそうです…なぜ「罰金」が発生するのでしょうか？,35,https://news.yahoo.co.jp/articles/079c534dd9143b3662971f684c597a93367328f4,4/3(水) 14:20
2024-04-03,15:23,business,経済,14,東洋経済オンライン,私もあなたも実は「スライサー」かもしれない　一緒にいると「モヤモヤ」その理由を考えてみた,33,https://news.yahoo.co.jp/articles/72aa5b75be7cde113f1416c9cb0975fe1e832f91,4/3(水) 5:21
2024-04-03,15:23,business,経済,15,現代ビジネス,日本は確実に「二極化」が進行する…そして東京が破綻を迎える日がやってくる,31,https://news.yahoo.co.jp/articles/0c47db0f90e67d5b26a7aab4287f759b57671584,4/3(水) 6:05
2024-04-03,15:23,business,経済,16,くるまのニュース,フロントガラスの「着色フィルム」車検で拒否される!? ギラギラや透明など多様なカーフィルムの現状… 専門店の見解は？,26,https://news.yahoo.co.jp/articles/4adc98e0c1635e4540062e98d372e3c0f89325bd,4/3(水) 9:10
2024-04-03,15:23,business,経済,17,ベストカーWeb,完全に新型フリード意識してるやん!! シエンタ5月にマイチェン!! 大画面化＆スマホがキーになる機能で大勝負に,24,https://news.yahoo.co.jp/articles/f3f0f97b11731a28af9c31df197aaa170e2790b6,4/3(水) 11:00
2024-04-03,15:23,business,経済,18,Merkmal,子どもは「車のスピード」を認識できない？ 事故の75%が横断歩道で発生、4月春の全国交通安全運動で考える,22,https://news.yahoo.co.jp/articles/9e1ce58cf7aef15fcc635dad58d44cb97244b2b3,4/3(水) 14:11
2024-04-03,15:23,business,経済,19,くるまのニュース,スズキ斬新「ジムニー5ドア」発売！ 3ドアは“2年ぶり”改良!? 話題のカクカクSUV反響は？ 正規店で5ドア対応は可能？,21,https://news.yahoo.co.jp/articles/26929766f3ad372ee1983dd99353adc948eabdd7,4/3(水) 14:10
2024-04-03,15:23,business,経済,20,ダイヤモンド・オンライン,「大阪勤務なんて聞いてない」「会社にダマされた！」激怒する新入社員、どう対処すべき？【社労士がアンサー】,21,https://news.yahoo.co.jp/articles/8ea162c782e4818ae7dcf6420d1a07aece7ac9ae,4/3(水) 8:02
2024-04-03,15:23,business,経済,21,ファイナンシャルフィールド,まだ20代で健康そのものですが、親に「生命保険に加入しろ」と言われます。「年収300万円」で保険料が負担なのですが、若いうちから入ったほうが良いのでしょうか…？,20,https://news.yahoo.co.jp/articles/6c85be7b0ea1856972b972754e059a6ef255546e,4/3(水) 14:10
2024-04-03,15:23,business,経済,22,プレジデントオンライン,自ら仕掛けたBEV戦争で中国に吞み込まれる…モーターショーに出られないほど弱体化した欧州メーカーの苦悩,20,https://news.yahoo.co.jp/articles/cde8c8bb42b77bf0bd7f175b5d0879f47b19a176,4/3(水) 8:17
2024-04-03,15:23,business,経済,23,THE GOLD ONLINE（ゴールドオンライン）,世帯年収「500万円台」でも…日本の家族が悶絶する「住宅ローン返済額」,20,https://news.yahoo.co.jp/articles/153595aaa750d9360f29b3914dfd90a930ca9e8e,4/2(火) 21:24
2024-04-03,15:23,business,経済,24,東洋経済オンライン,二階氏「不出馬表明」という“したかかな戦略”　裏金問題は処分対象外で「事実上の無罪放免」,19,https://news.yahoo.co.jp/articles/fe1c919484547320d45fce2df4e14431fbf28d87,4/3(水) 8:02
2024-04-03,15:23,business,経済,25,Bloomberg,自民党が下村・西村氏に党員資格停止処分、萩生田氏は役職停止－報道,18,https://news.yahoo.co.jp/articles/b6c71c3e5e87f00bb56de64f8d6f1c5ea9329676,4/3(水) 8:08
2024-04-03,15:23,business,経済,26,乗りものニュース,新幹線で「爆速」360km/h運転目指す！青函トンネル高速化で「貨物新幹線」案も  JR北海道が明らかに,18,https://news.yahoo.co.jp/articles/11779541efc4434287462b9b622690b9f682c7a4,4/3(水) 7:12
2024-04-03,15:23,business,経済,27,鉄道コム,JR東、キハ40系20両をタイ国鉄へ譲渡,17,https://news.yahoo.co.jp/articles/e46ebbd1434cac9e84166d0d69e3ad5045e80b13,4/3(水) 14:34
2024-04-03,15:23,business,経済,28,MotorFan,【自動車ブランド議論】なぜクルマ好きは性能ではなく物語(ブランド)を買うのか？日本人がブランドを育てられない理由は？,17,https://news.yahoo.co.jp/articles/5000ee044beb9c37a26b60b8d0f91ac435cc4bf6,4/3(水) 11:36
2024-04-03,15:23,business,経済,29,THE GOLD ONLINE（ゴールドオンライン）,"肩で風切る40代〈年収1,000万円超〉の勝ち組部長…「役員も夢じゃない」はずが、まさかの転落に呆然「なにかの間違いでは」",17,https://news.yahoo.co.jp/articles/0079d5fabec205df6c6db7379bb63ad0544d2219,4/3(水) 11:02
2024-04-03,15:23,business,経済,30,東洋経済オンライン,専門医がいない航空自衛隊に戦闘機開発はできない　やる気のある医官が次々に辞める自衛隊の内情,17,https://news.yahoo.co.jp/articles/da11138d8dc60f80600894774d620d479cd26066,4/3(水) 11:32
2024-04-03,15:23,business,経済,31,LIMO,【おひとりさま】実は、多いです。50歳代「貯蓄ゼロ（非保有）」世帯割合は何パーセント？,16,https://news.yahoo.co.jp/articles/bfb7d0c237298510a38148d301a585294d832817,4/3(水) 14:02
2024-04-03,15:23,business,経済,32,J-CASTニュース,KFC「チキン詰め放題」エイプリルフール投稿は「度を超えている」のか　批判殺到で広報謝罪「誤解を招く形となってしまった」,16,https://news.yahoo.co.jp/articles/d293187624abd13b9b0db7c919b103574ca8dcba,4/2(火) 18:38
2024-04-03,15:23,business,経済,33,共同通信,小林製薬が採用活動休止,15,https://news.yahoo.co.jp/articles/43a0661a19ae52a84f94986a49749838b2483851,4/3(水) 9:30
2024-04-03,15:23,business,経済,34,テレビ朝日系（ANN）,松屋が一部メニュー100円値上げ　「牛めし」は据え置き,15,https://news.yahoo.co.jp/articles/97138296278f2a582e4c09b65848d64636ac30d2,4/2(火) 19:25
2024-04-03,15:23,business,経済,35,くるまのニュース,日産「新型 R36 GT-R」登場へ 「R35生産終了」で次期型に注目!? 「800万円以下で欲しい人」多い！ 期待するコトは「デザイン・性能」どっち？,15,https://news.yahoo.co.jp/articles/8b6fd7ccc57da1241f1fb0490b9bda55a68b2913,4/3(水) 7:10
2024-04-03,15:23,business,経済,36,現代ビジネス,多くの人が意外と知らない「マイナス金利解除」でも円安が止まらない「根本的な理由」,15,https://news.yahoo.co.jp/articles/755e0071f438d26398ebb89f1c2ec20932e7b024,4/3(水) 7:03
2024-04-03,15:23,business,経済,37,弁護士ドットコムニュース,"京王バスの""ビジネスネーム導入""に反響「すべてのサービス業に取り入れて」　乗務員のプライバシー保護の観点",15,https://news.yahoo.co.jp/articles/634276cfe0c51e14fe335a8e684ae28fd2f54e93,4/3(水) 11:54
2024-04-03,15:23,business,経済,38,Nosweb.jp,初代シーマ。バンパーが大きいだけの見せかけの3ナンバーボディへの不満。バブルを象徴する「本当の」3ナンバーカー,15,https://news.yahoo.co.jp/articles/58b9659e37542e33a4d40bf7a113e20069f04e68,4/3(水) 5:55
2024-04-03,15:23,business,経済,39,バイクのニュース,サイドスタンドはバイクに乗る前、跨ったあと？ 払うのはどちらが正しいのか？,15,https://news.yahoo.co.jp/articles/21f79e87c99c8ae1a500f92cbae6a7f0342fb004,4/3(水) 9:10
2024-04-03,15:23,business,経済,40,乗りものニュース,ロシア戦車が大爆発 砲塔が「とんでもない高さ」まで吹き飛ぶ 衝撃の映像公開 ウクライナ国防省,15,https://news.yahoo.co.jp/articles/39a1c5f19e4e3c547cd2a5588b2f855ca9f62b2b,4/3(水) 11:42
