scrp_date,scrp_time,genre_en,genre_jp,rank,media_jp,title,comment,link,date_original
2025-07-07,08:07,world,国際,1,ハンギョレ新聞,「７月大災害説を鎮めなければ日本旅行需要が急減」…５千億円以上の損失予想,87,https://news.yahoo.co.jp/articles/b8a0581328946735e0149cd40f9b29eebf8e1a76,7/7(月) 7:19
2025-07-07,08:07,world,国際,2,中央日報日本語版,トランプ関税圧迫に…「同盟国であっても言うべきことは言わなければいけない」譲らない石破氏,65,https://news.yahoo.co.jp/articles/56f4fb6bff86fe5009c94c50bf716f8e032df7d4,7/7(月) 6:47
2025-07-07,08:07,world,国際,3,ABEMA TIMES,2mgで致死量「フェンタニル」中毒者だらけの“ゾンビタウン”とは？在米日本人「処方された薬に入ってる」「警察は見て見ぬフリ」,50,https://news.yahoo.co.jp/articles/468d36571ca46c1eeb33f3037834e94597b4d5ae,7/6(日) 11:01
2025-07-07,08:07,world,国際,4,読売新聞オンライン,中国の副首相、万博で来日へ…自民・森山幹事長がパンダの貸与要請,39,https://news.yahoo.co.jp/articles/73053323de6e7753371e93bfb017fe8474046daa,7/6(日) 23:17
2025-07-07,08:07,world,国際,5,共同通信,中国の何副首相、万博で来日へ　自民森山氏、パンダ貸与要請,35,https://news.yahoo.co.jp/articles/bcd1b57b2d8e583986af8775fce45338d576d282,7/6(日) 18:28
2025-07-07,08:07,world,国際,6,KOREA WAVE,「99％水」のガソリン販売、続出する「車停止」被害…韓国のセルフスタンド、驚きの燃料分析結果,26,https://news.yahoo.co.jp/articles/65658a042af6b1d6afbb71f0cb1f7f497b5c3891,7/7(月) 5:03
2025-07-07,08:07,world,国際,7,毎日新聞,なぜ私は力士になれないのか　「特例」求め、稽古続けるユダヤ人,20,https://news.yahoo.co.jp/articles/33a067692374e9225f4cf36568adbb9ac16c3b70,7/6(日) 11:00
2025-07-07,08:07,world,国際,8,日テレNEWS NNN,米テキサス州で大規模洪水　43人死亡、20人以上が行方不明,17,https://news.yahoo.co.jp/articles/2e23b8431317c209cf9ec27f98f84d2c11f595c1,7/6(日) 8:32
2025-07-07,08:07,world,国際,9,毎日新聞,＜1分で解説＞マスク氏新党「アメリカ党」なぜ結成？　何を目指す？,17,https://news.yahoo.co.jp/articles/555a0fc9ae287fa756b9d942f2ac1e6f78c658f7,7/6(日) 15:37
2025-07-07,08:07,world,国際,10,文春オンライン,「いったいどうなっているのか…」上空から降ってきた道路がそのまま突き刺さっている“異様な光景”…四国の国道から見えたナゾの建造物の正体とは？,16,https://news.yahoo.co.jp/articles/80f626564c4cbbcd38aa64c72c307d19f479da82,7/7(月) 6:22
2025-07-07,08:07,world,国際,11,クーリエ・ジャポン,英紙「海外勢から死守すべき、必要不可欠な技術を日本は守れるのか」,15,https://news.yahoo.co.jp/articles/ef2f557305c717ab6495acabcffb161d1e0314c6,7/7(月) 6:50
2025-07-07,08:07,world,国際,12,共同通信,イエメン沖で貨物船襲撃　フーシ派か、浸水情報も,14,https://news.yahoo.co.jp/articles/372719829b36616f0fe8f1c2ccc9ce53680b97f5,7/7(月) 6:37
2025-07-07,08:07,world,国際,13,クーリエ・ジャポン,世界的歴史家が警鐘「トランプが一線を超えた後、“アメリカ帝国”は衰退する」,13,https://news.yahoo.co.jp/articles/443ad2a86c3a700e6fccb1e0b2bf60560575f0a6,7/6(日) 14:00
2025-07-07,08:07,world,国際,14,中央日報日本語版,山脈を越えた東風、さらに熱くなる…ソウル、あす３６度の猛暑,12,https://news.yahoo.co.jp/articles/360c4217116a7711eb20b30250dd4cdc726c7aed,7/7(月) 6:44
2025-07-07,08:07,world,国際,15,KOREA WAVE,「前回間違えたから無料にして」…韓国で広がる“配達物乞い”詐欺に飲食店が悲鳴,12,https://news.yahoo.co.jp/articles/198e100918a9ea3a4dc11ee2c5b1358ad881ea5f,7/7(月) 6:03
2025-07-07,08:07,world,国際,16,毎日新聞,朴正熙銅像、韓国で急増中　賛否の根にある「日本」の存在,11,https://news.yahoo.co.jp/articles/955752694c8fb10ef461a726b45f0286eb945d4a,7/7(月) 7:35
2025-07-07,08:07,world,国際,17,中央日報日本語版,韓国政府、米国に「自動車運搬船入港手数料…中国にだけ課し韓国は除外を」,11,https://news.yahoo.co.jp/articles/4480b4a609af7d06017cb4d9e8553e11ac138194,7/7(月) 7:05
2025-07-07,08:07,world,国際,18,読売新聞オンライン,米テキサス洪水の死者６７人に、３０人以上が行方不明…当局「警告する時間なかった」,11,https://news.yahoo.co.jp/articles/377b45e9000e163b84130a3240c1ac95fe8354cc,7/6(日) 12:23
2025-07-07,08:07,world,国際,19,FNNプライムオンライン（フジテレビ系）,「対米貿易が少ない約100カ国に8月1日から関税引き上げを通知」　アメリカ・ベッセント財務長官が表明　日本は中に含まれない見通し,11,https://news.yahoo.co.jp/articles/ed0ef03d0c11382ef558bffc84e8c73c7a9081e5,7/7(月) 6:04
2025-07-07,08:07,world,国際,20,ロイター,マスク氏新党結成「ばかげている」、トランプ氏が一蹴,10,https://news.yahoo.co.jp/articles/fb26c453f006d648b798e8f8d9e508c8b8aa8da9,7/7(月) 7:30
2025-07-07,08:07,world,国際,21,読売新聞オンライン,尹錫悦前大統領の逮捕状、韓国検察が請求…特殊公務執行妨害などの容疑で２回事情聴取,10,https://news.yahoo.co.jp/articles/431b4346a3282d514bcbd8b8f399f69323907a5c,7/6(日) 19:28
2025-07-07,08:07,world,国際,22,Wedge（ウェッジ）,戦争というギャンブル、サイコロを降ったイラン、イスラエル、米国…三者とも敗者となる可能性も,9,https://news.yahoo.co.jp/articles/167ffbe96c98ae1aa057fdf7114848c936db3c11,7/7(月) 5:02
2025-07-07,08:07,world,国際,23,週プレNEWS,【モーリーの考察】トランプが決断した「イラン攻撃」は熱狂の呼び水になるか、それとも泥沼への入り口か？,8,https://news.yahoo.co.jp/articles/c514b37e38e61e6f76554e07802cd471a2aff71d,7/7(月) 6:00
2025-07-07,08:07,world,国際,24,クーリエ・ジャポン,ロシアでは「中国がいちばんクールな国」に─中国人の子守を雇うロシア人たち,8,https://news.yahoo.co.jp/articles/6302b07cc0ae9428dce1216a3efb56c65a2b5989,7/6(日) 13:50
2025-07-07,08:07,world,国際,25,テレビ朝日系（ANN）,ベッセント財務長官　貿易の少ない国に対し10％関税,8,https://news.yahoo.co.jp/articles/69190676682938bba0eb58132184cfe754bb3360,7/7(月) 5:55
2025-07-07,08:07,world,国際,26,毎日新聞,ドイツ政府、ウクライナ支援用に米国からパトリオット購入を検討,7,https://news.yahoo.co.jp/articles/f4bec9acbccdca87bdafc85e00a6d042390614cd,7/6(日) 18:19
2025-07-07,08:07,world,国際,27,テレビ朝日系（ANN）,ロシアにラオスの部隊を派遣か　ロシアがアジア、アフリカや北朝鮮の戦闘員多用　ウクライナメディア報道,7,https://news.yahoo.co.jp/articles/98c0c1625c681065a9afe0de4b3ba741b7008f56,7/6(日) 13:33
2025-07-07,08:07,world,国際,28,KOREA WAVE,名門・ソウル大で親が成績クレーム「うちの子にCはありえない」…保護者“暴走”で浮かび上がる過干渉問題,7,https://news.yahoo.co.jp/articles/448f86f07fab52d214b58015c7384473490dc3cf,7/7(月) 4:03
2025-07-07,08:07,world,国際,29,ダイヤモンド・オンライン,「ポスト・トゥルース」批判を受けた最初の大統領、実はトランプじゃなかった,7,https://news.yahoo.co.jp/articles/135083f99ef9b82f19becad27c66a3405c1dcca2,7/7(月) 6:32
2025-07-07,08:07,world,国際,30,中央日報日本語版,耐えに耐えたが結局…昨年の廃業者初の１００万人超え、半数が小売り・飲食店＝韓国,7,https://news.yahoo.co.jp/articles/773be3a775e1437cf5bbdfbe1ecf4155bb714219,7/7(月) 6:42
2025-07-07,08:07,world,国際,31,ＡＦＰ＝時事,石破首相、トランプ大統領との関税交渉「安易に妥協しない」,7,https://news.yahoo.co.jp/articles/9a4fdfa3bd31603a0e699ed06f9a82f69e746c6f,7/6(日) 15:49
2025-07-07,08:07,world,国際,32,BUSINESS INSIDER JAPAN,世界平和度指数ランキング・トップ10 [2025年版]（海外）,6,https://news.yahoo.co.jp/articles/12df2abf6ff9dfa6a2f648ab5b3297598e930766,7/7(月) 7:10
2025-07-07,08:07,world,国際,33,ロイター,米、複数の通商合意に近づく　近日発表へ＝ベセント財務長官,6,https://news.yahoo.co.jp/articles/7bd63098194fd2cd23296495928aecaf08e6da21,7/7(月) 7:05
2025-07-07,08:07,world,国際,34,TBS NEWS DIG Powered by JNN,食料求める市民へ銃撃…カフェ攻撃では30人以上死亡　イスラエルの攻撃続くガザ　トランプ氏が停戦迫るも【サンデーモーニング】,6,https://news.yahoo.co.jp/articles/1ba1435dfe9f6a2ff58a1ac008ac1427fc1f4d58,7/6(日) 15:47
2025-07-07,08:07,world,国際,35,中央日報日本語版,スイスの国境都市、フランス人のプール利用禁止…「下着で泳ぐなど非常識」,6,https://news.yahoo.co.jp/articles/845fc2587f0507ed3d733b3527fac2087104aa47,7/6(日) 12:51
2025-07-07,08:07,world,国際,36,AERA DIGITAL,イギリス皇太子夫妻に17歳でがんで亡くなった女性の家族から贈り物　感動の裏でメーガンさんは……,6,https://news.yahoo.co.jp/articles/cb76fb12793e309cd4f7249e45b13ae14635ba01,7/6(日) 11:32
2025-07-07,08:07,world,国際,37,NEWSポストセブン,《芸舞妓を自宅前までつきまとって動画を回して…》京都祇園で横行するYouTuberによる“ビジネス”「防犯ブザーを携帯する人も」複数の被害報告,6,https://news.yahoo.co.jp/articles/6cc4a0073129afa5d703a35014db05048702fa26,7/6(日) 10:58
2025-07-07,08:07,world,国際,38,TBS NEWS DIG Powered by JNN,「事実上の最後通告」“トランプ関税”交渉期限迫る…最大70％の可能性も　圧力の背景には「参議院選挙」【サンデーモーニング】,6,https://news.yahoo.co.jp/articles/818ca4d556697559fbd273e1ab3fb7846df7e1bc,7/6(日) 16:34
2025-07-07,08:07,world,国際,39,CNN.co.jp,地球は太陽から最も遠くにあるのに、こんな暑いのはなぜ？,6,https://news.yahoo.co.jp/articles/87508fdd4a06cfeacfd9b7f40efbb6724e577853,7/6(日) 14:58
2025-07-07,08:07,world,国際,40,CNN.co.jp,【分析】米テスラのサイバートラックが大失敗に終わった理由,6,https://news.yahoo.co.jp/articles/688b33bb5e0bd78d18350b44889217034580627b,7/6(日) 14:29
