scrp_date,scrp_time,genre_en,genre_jp,rank,media_jp,title,comment,link,date_original
2025-03-03,06:06,business,経済,1,共同通信,コメ価格5キロ4000円に迫る　備蓄米発表後も1.9倍,151,https://news.yahoo.co.jp/articles/4313b4229cc00de95cb74780637f4ab5647668bb,3/2(日) 16:49
2025-03-03,06:06,business,経済,2,朝日新聞,郵便局網に「財政支援」検討　自民党議連、年650億円規模,85,https://news.yahoo.co.jp/articles/132df01cec90b29195ef02376ab2f0d2a67bd773,3/3(月) 5:00
2025-03-03,06:06,business,経済,3,集英社オンライン,日本のほとんどのタワマンがいずれ中国人所有になる…相続税がなく膨張する中国人マネーが“占領”「日本人は一生賃貸」の地獄絵図,51,https://news.yahoo.co.jp/articles/a827c9ae795d4aa7894657f6969150acea8a2d7e,3/2(日) 10:02
2025-03-03,06:06,business,経済,4,産経新聞,100円稼ぐのに1万円超の費用　鉄道の赤字ローカル線、都市部の黒字で穴埋めは限界,42,https://news.yahoo.co.jp/articles/60cea8288f20dd5abefd4012dd3055dddf54a7fb,3/2(日) 18:00
2025-03-03,06:06,business,経済,5,集英社オンライン,「初任給30万円は一部のエリートだけ」氷河期世代からの不満にZ世代が反論…世代間での分断が進む「コロナ世代もリーマン世代もキツい」,41,https://news.yahoo.co.jp/articles/6a50e7564bb119a21b9e83ff0161930dc9672e4d,3/2(日) 9:02
2025-03-03,06:06,business,経済,6,TBS NEWS DIG Powered by JNN,「上にも下にも踏まれている」“就職氷河期”世代 「初任給30万円時代」の裏でつづく苦悩【風をよむ・サンデーモーニング】,38,https://news.yahoo.co.jp/articles/5ed7ca9d2b70db7b5ec203da5b04bfa511aeec06,3/2(日) 16:14
2025-03-03,06:06,business,経済,7,集英社オンライン,”爆益”ホテル業界も賃金は上がらず…国民には恩恵ナシの石破政権「貧乏日本人排除のインバウンド政策」が鬼すぎる,31,https://news.yahoo.co.jp/articles/8c3514dc6c5cab3dad0520be1a351fc34750e7ef,3/2(日) 10:02
2025-03-03,06:06,business,経済,8,読売新聞オンライン,地方空港の駐車場案内板に並ぶ「満」、入れない車の列…深刻な混雑の原因はインバウンドのほかにも,27,https://news.yahoo.co.jp/articles/c7f0180b992a6040f42a8d9d5f4e3eec986e9cb2,3/2(日) 11:28
2025-03-03,06:06,business,経済,9,産経新聞,「日本一高い」長野ガソリン小売価格に異変、県問題視、カルテル疑惑浮上後じわり順位下落,24,https://news.yahoo.co.jp/articles/3f8689de31cf9f2e232825df012491e44b8038ec,3/2(日) 12:07
2025-03-03,06:06,business,経済,10,Bloomberg,英首相、欧州首脳に新たな現実直視訴えへ－ゼレンスキー氏と会談後,19,https://news.yahoo.co.jp/articles/2bae002459bd17179a24afe79bbf34dbdeaa106d,3/2(日) 9:24
2025-03-03,06:06,business,経済,11,ダイヤモンド・オンライン,インバウンドがあぜんとする…日本の美しい景観をブチ壊す「最悪の戦犯」とは？,18,https://news.yahoo.co.jp/articles/38d4f918592a932ec6eae869a5b2dada2ee656b1,3/2(日) 7:02
2025-03-03,06:06,business,経済,12,NRI研究員の時事解説,トランプ、ゼレンスキー会談は予想外の決裂,17,https://news.yahoo.co.jp/articles/b26561c0f0bc8fa3f2c1085787232b65650e379d,3/3(月) 5:02
2025-03-03,06:06,business,経済,13,マネーポストWEB,【コメ転売の現場】中国人向けSNSを通じて“転売ヤー”に接触　中国人カップルは「どこから来た？」と質問、「同胞を助けるためにやっている」と語る飲食店主も,17,https://news.yahoo.co.jp/articles/e033604368b6efa26507b6dcb1be37243b63a9d2,3/2(日) 16:02
2025-03-03,06:06,business,経済,14,Nosweb.jp,だから20インチなんよ！,16,https://news.yahoo.co.jp/articles/7a4cb7299e3b4a3686e2938000fb3b5b47a4e78e,3/2(日) 20:02
2025-03-03,06:06,business,経済,15,くるまのニュース,全長5m！ 日産の最上級「ラグジュアリー・クーペ」に大反響！「日産らしい！」「でも贅沢すぎない!?」の声も！ 4500cc“V8エンジン”搭載した超豪華クーペ「トライエックスコンセプト」とは,16,https://news.yahoo.co.jp/articles/00891918d88e37980a1cac15dbd6ee651bf462c7,3/2(日) 20:10
2025-03-03,06:06,business,経済,16,現代ビジネス,停電でも電気が復旧しなくなる…「技術者不足」の悲惨すぎる未来,15,https://news.yahoo.co.jp/articles/7117e4068004b3fdc179d16499ab3e7e3257cd7f,3/2(日) 23:01
2025-03-03,06:06,business,経済,17,LIMO,厚生年金「月額15万円以上の人」は何パーセントいる？難しい？年金見込額が少ない人は何からすべきか,15,https://news.yahoo.co.jp/articles/f59432c05f406f7747bdfb2c5fb56af8370829b4,3/2(日) 18:12
2025-03-03,06:06,business,経済,18,THE GOLD ONLINE（ゴールドオンライン）,享年68歳、真面目だった元会社員の夫が零した「衝撃の事実」に妻、戦慄。遺族年金8万円・貯金200万円で「一体どうやって生きていけば」,14,https://news.yahoo.co.jp/articles/6ea07a9ef61198ad2882952954990ef8339b8b72,3/2(日) 8:02
2025-03-03,06:06,business,経済,19,Merkmal,「のぞみ」現行ダイヤで、静岡・浜松停車の「ひかり」に置き換えられる？ リニア名古屋開業前でも可能か？,14,https://news.yahoo.co.jp/articles/83ebb2f57c68d6b40752c0c2048f1983ae470297,3/2(日) 8:51
2025-03-03,06:06,business,経済,20,ITmedia ビジネスオンライン,“もんで食べる”アヲハタの冷凍フルーツ、じわり人気　「ジャム以外」に注力する狙いは？,13,https://news.yahoo.co.jp/articles/812d300dbb035c8e05112387fa0eb77d4ea260e1,3/2(日) 8:05
2025-03-03,06:06,business,経済,21,Merkmal,「軍事マニア」はなぜ劣化したのか？ ミリタリー記事が「スーパーカー記事」に酷似する構造的理由！ 性能至上主義＆批評不在がもたらす「思考停止」のワナとは,13,https://news.yahoo.co.jp/articles/19e93118fa532358b51524419185eeaf7281fa37,3/2(日) 20:51
2025-03-03,06:06,business,経済,22,THE GOLD ONLINE（ゴールドオンライン）,銀行員「心苦しいですが、ご対応できません」…年金260万円・85歳母の財布でカネに糸目つけず「この世の真理を探す」自称“研究者”59歳長男が、肝を冷やした最悪の宣告【FPの助言】,12,https://news.yahoo.co.jp/articles/9d8ac6761554b2591d236e2e44d8019d1b15a507,3/2(日) 10:32
2025-03-03,06:06,business,経済,23,バイクのニュース,いま大人気なのに!!　なぜか激減した「アメリカン」　かつて大型から原付まで存在していた!?,11,https://news.yahoo.co.jp/articles/53be66dc090ca86648a2e85e2f4481892f2655ff,3/2(日) 18:15
2025-03-03,06:06,business,経済,24,プレジデントオンライン,大阪万博閉幕後に起きる建物の処理という大問題…35年前の花博「いのちの塔」は閉鎖・放置で雨漏りがひどい,11,https://news.yahoo.co.jp/articles/95ad91649e346b03da6bc85bb5b2059a225cd68d,3/2(日) 9:17
2025-03-03,06:06,business,経済,25,食品産業新聞社ニュースWEB,レトルトカレー戦国時代、パイオニアの「ボンカレー」が“個人消費”で攻める理由,11,https://news.yahoo.co.jp/articles/2a92afc9042fec231286486bcbdf5ca09000b00f,3/2(日) 7:40
2025-03-03,06:06,business,経済,26,Bloomberg,仮想通貨が上昇、戦略準備進めるとトランプ氏発表－ＢＴＣ以外も含む,10,https://news.yahoo.co.jp/articles/126aaf982eeec5274b6a4d8592e28cb283c9e304,3/3(月) 3:02
2025-03-03,06:06,business,経済,27,毎日新聞,頭にサクランボ、金髪、ゴスロリ、同性も　進化する「ひな人形」,10,https://news.yahoo.co.jp/articles/98b33a2704049477285ea9497065067fb4e0a4ee,3/2(日) 12:30
2025-03-03,06:06,business,経済,28,MotorFan,超大型輸送機C-17を自衛隊に!? はたしてC-17は日本にとって必要な輸送機なのか？,10,https://news.yahoo.co.jp/articles/70aa9f650fa0e557141b69cf5f0486292578f22c,3/2(日) 7:11
2025-03-03,06:06,business,経済,29,MotorFan,ホンダ「アスコットイノーバ」が198.5万円～バブル真っ最中に登場…多兄弟ゆえに散る【今日は何の日？3月3日】,9,https://news.yahoo.co.jp/articles/26c6f24ea11b52ac1ca991eb6929daee670afe68,3/3(月) 5:00
2025-03-03,06:06,business,経済,30,ベストカーWeb,トヨタ[アルテッツァジータ]が令和でも劣らないんじゃないか問題,9,https://news.yahoo.co.jp/articles/51c120d78fb0c0cb6bdba124b9a948f1021f7c4c,3/2(日) 21:00
2025-03-03,06:06,business,経済,31,VAGUE,受注再開へ向けての朗報！ “予約殺到”のスズキ「ジムニーノマド」日本仕様の供給台数を拡大か!? なぜ“驚異的な人気“を獲得した？,9,https://news.yahoo.co.jp/articles/fbf8202787cb60b409549999e8a3497490bc42d0,3/2(日) 9:10
2025-03-03,06:06,business,経済,32,現代ビジネス,終身雇用はもはや崩壊、退職金もなくなる…衰退ニッポンがこれから直面する「大変化」,9,https://news.yahoo.co.jp/articles/f92a16ae24d39f062b305932654d8c8c69617de4,3/2(日) 7:01
2025-03-03,06:06,business,経済,33,乗りものニュース,巨大空港にニュータウンが出現!? 進む香港国際空港の「大改造」 新名所になるか,8,https://news.yahoo.co.jp/articles/6ed04453b913713c126f3517d9f786681f2fa362,3/2(日) 14:12
2025-03-03,06:06,business,経済,34,ファイナンシャルフィールド,同じタイミングで定年する友人は年金「20万円」もらえるそうです。一人でそれだけの年金受給できるのは、現役時代の稼ぎがよかったのでしょうか？,8,https://news.yahoo.co.jp/articles/d63813370b44ccf80b0c77531620821657873743,3/2(日) 11:30
2025-03-03,06:06,business,経済,35,プレジデントオンライン,卒業式の服を買いに来た親子の会話に衝撃を受けた…子ども服のナルミヤ・インターナショナル復活の背景,8,https://news.yahoo.co.jp/articles/326ecc373b92ce8bca91211dee478f8ec255db4e,3/2(日) 7:17
2025-03-03,06:06,business,経済,36,Merkmal,「50万円必要です」 中古車業界にはびこる闇？ 事故車や“起こし屋”の手口… 元ディーラーが語る「保証の落とし穴」とは,8,https://news.yahoo.co.jp/articles/009e458dc0b9a45c85891644a40b4dfb9d90fba1,3/2(日) 17:51
2025-03-03,06:06,business,経済,37,マネーポストWEB,「食器は買うものではない？」キャンペーンでもらえる“おまけ食器”愛用者たちの価値観　「貧乏くさい」と言われてショック！それでも使い続ける理由,8,https://news.yahoo.co.jp/articles/6ef45aee1d1f088000ca79bb60f9dfaae1c99ca7,3/2(日) 15:15
2025-03-03,06:06,business,経済,38,みんかぶマガジン,東芝、オムロン、資生堂…リストラ連鎖が止まらない！インフレ環境下で企業を苦しめている賃上げ圧力,8,https://news.yahoo.co.jp/articles/128099bdc843460fe5844ec067da1c5cb8b597fe,3/2(日) 17:10
2025-03-03,06:06,business,経済,39,東洋経済オンライン,「地方がどんどん壊される」本当の“原因”は何なのか　「海外資本に飲み込まれ…」「大金を投じて集客ゼロ…」日本の観光業界が抱える“残念すぎる現実”,8,https://news.yahoo.co.jp/articles/34a71994c56f07aef59e0071428ea878ed29295e,3/2(日) 6:02
2025-03-03,06:06,business,経済,40,ツギノジダイ,ガソリンスタンドをお酒も楽しめる空間に　経営難の家業を継いだ3代目が打った需要減への一手,8,https://news.yahoo.co.jp/articles/53a6b88af839ac7585198190078143d910d38605,3/2(日) 13:00
