scrp_date,scrp_time,genre_en,genre_jp,rank,media_jp,title,comment,link,date_original
2025-05-15,18:08,TTL,総合,1,TBS NEWS DIG Powered by JNN,【速報】林官房長官「消費税の減税、適当ではない」　自民党では消費税減税の勉強会始まる,441,https://news.yahoo.co.jp/articles/d6a171b040c467760ec744689371952d12d7b2b1,5/15(木) 16:16
2025-05-15,18:08,TTL,総合,2,産経新聞,山尾志桜里氏「女系天皇の排除は間違い」とX投稿　擁立の国民民主は男系男子の継承主張,387,https://news.yahoo.co.jp/articles/03bc423791332fe3d7582eedb0ea2ba7bbaabc0f,5/15(木) 17:00
2025-05-15,18:08,TTL,総合,3,スポニチアネックス,杉村太蔵　消費税減税にあらためて反対の姿勢を示し「困ってない人にも減税する必要があるのか」,362,https://news.yahoo.co.jp/articles/03736ba7c2fd62ba1e2df6f4868f0ad179538f98,5/15(木) 10:32
2025-05-15,18:08,TTL,総合,4,毎日新聞,漫画の災害予言→旅行中止相次ぐ　作者たつき諒さん「前向き」の真意,325,https://news.yahoo.co.jp/articles/fe2fe296414a695f6e3d71c410f2cc841c260486,5/15(木) 6:00
2025-05-15,18:08,TTL,総合,5,デイリー新潮,“靖国神社は閉店すべき”　過激ポストを繰り返す中国人男性「徐浩予氏」が熱海市長を目指す理由　「選挙に出ることは問題ありません！」,281,https://news.yahoo.co.jp/articles/e8ca88141e44ed5692765649266db48d2b5114b1,5/15(木) 5:50
2025-05-15,18:08,TTL,総合,6,FNNプライムオンライン（フジテレビ系）,【独自】岡﨑彩咲陽さん（20）行方不明後にも神奈川県警内で「刑事部捜査一課」に情報共有無し　県警内部の連携に“不備”か,249,https://news.yahoo.co.jp/articles/55cf9197955a2455e4d71ce14999dbc6dc28b012,5/15(木) 11:39
2025-05-15,18:08,TTL,総合,7,中京テレビＮＥＷＳ,“手を振って出発”直後の墜落　墜落機パイロットは29歳と31歳　事故数分前の映像から分かることは…　愛知・犬山市 自衛隊機墜落事故,244,https://news.yahoo.co.jp/articles/e8267a2fe350e75ab7a9363f6d9a7f2cc9204ce8,5/15(木) 16:49
2025-05-15,18:08,TTL,総合,8,日刊スポーツ,立花孝志氏「名称変更のおしらせ」NHKから国民を守る党は「NHK党」に　公式HPも,226,https://news.yahoo.co.jp/articles/fb6f827f430b86ebe216ea6ea625733cb9c66c7d,5/15(木) 13:16
2025-05-15,18:08,TTL,総合,9,中日スポーツ,大阪・吉村洋文知事、『食料品の軽減税率0％』自民・高市氏に賛同「贅沢品に食品の消費税分を」「問題が多い」反応さまざま,213,https://news.yahoo.co.jp/articles/aeaf6896a179c2a597530109198acbd18ae60d41,5/15(木) 17:18
2025-05-15,18:08,TTL,総合,10,スポニチアネックス,立花孝志氏「NHKから国民を守る党」名称変更のおしらせ「【NHK党】に変更しました！」,205,https://news.yahoo.co.jp/articles/e1ffc34b369b33e51c2a0f067966718ebcc1bf36,5/15(木) 15:55
2025-05-15,18:08,TTL,総合,11,テレビ朝日系（ANN）,備蓄米「国がもうけてどうすんだ」と自民党政調会長　5キロ3000円台で探してみたら,171,https://news.yahoo.co.jp/articles/d5c5ba5bb36e507a30a220dd32f93526b7027a42,5/15(木) 12:39
2025-05-15,18:08,TTL,総合,12,みんかぶマガジン,「それでもお米は高いと感じますか？」JA全農新聞広告に「買い占めたお前が言うな」の声…自己改革を後回しに「ご理解ご協力」求める,170,https://news.yahoo.co.jp/articles/1fb8dbf3b517a4a2ce0b0c25f6090557444a443f,5/15(木) 9:10
2025-05-15,18:08,TTL,総合,13,読売テレビ,【速報】斎藤知事「消費者庁の見解受け止めていくことが重要」消費者相の公益通報解釈の否定答弁受け,169,https://news.yahoo.co.jp/articles/2bdd8e1b69e4ce7e08aa7d63842247a48f6b5335,5/15(木) 14:37
2025-05-15,18:08,TTL,総合,14,中央日報日本語版,「中国人客はマナーがないのでお断り」…物議かもした日本の焼き鳥店が廃業,162,https://news.yahoo.co.jp/articles/6ef7c3376cc3c4e85814a67f6b4584432ffcf818,5/15(木) 16:12
2025-05-15,18:08,TTL,総合,15,MBSニュース,【速報】すき家で迷惑行為　16歳少女2人を書類送検　共用ピッチャーに”直接口をつけてお茶を飲む”威力業務妨害容疑　すき家は「到底許容できない」,162,https://news.yahoo.co.jp/articles/2ef35be98faa41b9692efc0ccd17bae0b1250770,5/15(木) 16:01
2025-05-15,18:08,TTL,総合,16,産経新聞,埼玉・大野知事が難民申請繰り返す外国人に初言及「これで生活の糧を得ている方々もいる」　「移民」と日本人,160,https://news.yahoo.co.jp/articles/6576c977b1f018ebb1b0323dc34c71b00f05c0c2,5/15(木) 7:00
2025-05-15,18:08,TTL,総合,17,スポニチアネックス,西内まりや　芸能界引退を発表「身内があるトラブルを起こしている事が発覚」「新しい人生を歩きたい」,156,https://news.yahoo.co.jp/articles/3e4ee5408797a51ee8e3f33e265d42422e63750c,5/15(木) 17:06
2025-05-15,18:08,TTL,総合,18,ABCニュース,【速報】「それはないと思います」　斎藤元彦兵庫県知事がN国党・立花氏から選挙応援を求められていることについて答える,152,https://news.yahoo.co.jp/articles/d28d3723a50c0024a864fb0d264d225f39e75cb3,5/15(木) 15:34
2025-05-15,18:08,TTL,総合,19,Full-Count,IL入りの佐々木朗希「悔しい」　痛み抱え2試合登板「迷惑かかる」…昨季も同様の症状、手術は否定,150,https://news.yahoo.co.jp/articles/613679ff0e48232868bd4ada62128db0e450f414,5/15(木) 9:17
2025-05-15,18:08,TTL,総合,20,テレビ朝日系（ANN）,消費減税「相当大きな問題がある」　自民税調幹部が会合,141,https://news.yahoo.co.jp/articles/72352f6854cde7c91f37d5b0b550d227af9ef465,5/15(木) 17:20
2025-05-15,18:08,TTL,総合,21,朝日新聞,火垂るの墓、国内でもネトフリ配信へ　海外絶賛、響いた戦争のリアル,137,https://news.yahoo.co.jp/articles/3f99a7e55a65c6201b458177f90e71fd6ba66e01,5/15(木) 8:00
2025-05-15,18:08,TTL,総合,22,スポーツ報知,西内まりやが５月いっぱいで芸能界引退「身内があるトラブルを」「新しい人生を歩きたいと考えるように」…自身のＳＮＳで発表,136,https://news.yahoo.co.jp/articles/7c1f8ca8386b1c5a9d448c2a9ffbec2625c2052e,5/15(木) 17:06
2025-05-15,18:08,TTL,総合,23,毎日新聞,「米国産日本車」逆輸入案が浮上　トランプ関税撤廃へ米国の軟化狙う,132,https://news.yahoo.co.jp/articles/76073738946b1564780294b6bcdedca86f74a85c,5/14(水) 20:00
2025-05-15,18:08,TTL,総合,24,読売テレビ,【速報】路線バス「急ブレーキで複数人ケガ」乗客12人が首の痛みなど訴え1歳男児含む7人搬送　神戸市垂水区,132,https://news.yahoo.co.jp/articles/6d02e8d2178fa3ab3939f7490e85ed74f5fa971d,5/15(木) 9:52
2025-05-15,18:08,TTL,総合,25,毎日新聞,備蓄米4回目は10万トン放出へ　6月以降も毎月同量で調整,131,https://news.yahoo.co.jp/articles/922f4f98a7386b95bc6ac1672410b2fa747944aa,5/14(水) 20:55
2025-05-15,18:08,TTL,総合,26,日刊スポーツ,立民米山隆一氏、参院選で立民兵庫県連推薦の泉房穂氏を次々批判「『やる気』で捻出できたら…」,126,https://news.yahoo.co.jp/articles/faddd59145ab5a032413e53ee284722a4dbb3219,5/15(木) 11:59
2025-05-15,18:08,TTL,総合,27,読売新聞オンライン,京都府警２警官を盗撮容疑で書類送検…中京署の女子トイレにカメラ、下鴨署管内では女性警察官被害か,121,https://news.yahoo.co.jp/articles/5210ea6b5904eacf47a5acee33efbf91266b5ac0,5/15(木) 6:41
2025-05-15,18:08,TTL,総合,28,週プレNEWS,なぜ国はガソリン「暫定税率」を手放さないのか？　元官僚も問題視する自動車にかかる多数の税金,114,https://news.yahoo.co.jp/articles/a6e17ea409467da0254ed2be57cd177a69111c7d,5/15(木) 7:00
2025-05-15,18:08,TTL,総合,29,集英社オンライン,〈兵庫県が刑事告発〉「外部通報を徹底的に潰すとの宣言だ」斎藤知事が作った「もうひとつの第三者委」狙いは文春の“情報源”のあぶり出しか？〈県は“報道への圧力”を否定〉,114,https://news.yahoo.co.jp/articles/e911dd90f19bfd522af85f1ba666502d2e8e4b4a,5/15(木) 12:06
2025-05-15,18:08,TTL,総合,30,TBS NEWS DIG Powered by JNN,自衛隊機の墜落事故、航空自衛隊が搭乗者2人の氏名を公表,113,https://news.yahoo.co.jp/articles/b915781af4bf3a62a27d853892ceb4ef01649860,5/15(木) 9:49
2025-05-15,18:08,TTL,総合,31,スポニチアネックス,橋下徹氏　斎藤元彦兵庫県知事に「自分への疑惑告発文書については必死に止めようとしたのに…」,112,https://news.yahoo.co.jp/articles/21f8b938e764820c68efbb535d211a3d31529dda,5/15(木) 16:44
2025-05-15,18:08,TTL,総合,32,時事通信,安易な消費減税に反対　連合会長、立国けん制,111,https://news.yahoo.co.jp/articles/7d0f075b87a179298b92bd464076f56abc94c4a7,5/15(木) 17:45
2025-05-15,18:08,TTL,総合,33,スポニチアネックス,ますおか増田　病院での呼び出し方に疑問「なんであれフルネームで…」本名を表明するリスクも懸念,108,https://news.yahoo.co.jp/articles/6ec7565d741bffdfee8dde87a555f2d6f6c1d4b8,5/15(木) 13:23
2025-05-15,18:08,TTL,総合,34,産経新聞,＜独自＞8月の広島平和式典、台湾にも開催伝える「通知」送付へ　当初は対象外も見直し,106,https://news.yahoo.co.jp/articles/064ddfd5501ffe5796925efbd78af67f670af675,5/15(木) 14:11
2025-05-15,18:08,TTL,総合,35,ロイター,ウクライナ直接協議、プーチン氏出席せず　トランプ氏も見送り,105,https://news.yahoo.co.jp/articles/fa3e8c6aff67332c2930beb7120eac0dcacba73d,5/15(木) 5:53
2025-05-15,18:08,TTL,総合,36,TBS NEWS DIG Powered by JNN,【巨人15日スタメン】キャベッジ4番ライト ヘルナンデス2番センター 浅野8番レフト リチャード5番 増田陸6番 先発山﨑 捕手は甲斐,104,https://news.yahoo.co.jp/articles/c03ede3eaf74875eec4a816e2cb0e14c3e602775,5/15(木) 17:29
2025-05-15,18:08,TTL,総合,37,デイリースポーツ,佐々木朗希　長期離脱も　右肩故障で負傷者リスト入り　無期限ノースローで状態判断へ,102,https://news.yahoo.co.jp/articles/c931a2bf885cbd507f51d8eac5d1211819cf7046,5/15(木) 2:00
2025-05-15,18:08,TTL,総合,38,産経新聞,マクドナルドでLサイズ超える大きさ「グランドポテト」「グランドコーク」　6年ぶり復活,99,https://news.yahoo.co.jp/articles/1c9ea68d76dcf010107af1913f44df353ce487a5,5/15(木) 14:12
2025-05-15,18:08,TTL,総合,39,デイリースポーツ,快挙！日本ハム・宮西が８８０試合連続救援登板の日本記録！見事に西川を二ゴロに仕留める　新庄監督が花束を手渡す,98,https://news.yahoo.co.jp/articles/2238e74a0f06472ea8e47b8eb120e6effb2138e3,5/15(木) 15:19
2025-05-15,18:08,TTL,総合,40,朝日新聞,安倍元首相銃撃の初公判、10月28日を提示　来年1月にも判決か,95,https://news.yahoo.co.jp/articles/49e0a9777dda34deda16f68be262cbbc5f70ad13,5/14(水) 19:00
