scrp_date,scrp_time,genre_en,genre_jp,rank,media_jp,title,comment,link,date_original
2025-09-16,13:08,business,経済,1,TBS NEWS DIG Powered by JNN,【速報】日経平均株価　史上初の4万5000円突破　連日最高値を更新,302,https://news.yahoo.co.jp/articles/8c117ba38d3c918bf57a6f568649aa8d8c843834,9/16(火) 9:09
2025-09-16,13:08,business,経済,2,ロイター,消費税率引き下げることは適当でない＝加藤財務相,262,https://news.yahoo.co.jp/articles/e1616b2f3e3b7e498e03a9f69f8b58a7c245594c,9/16(火) 11:25
2025-09-16,13:08,business,経済,3,Bloomberg,「ラブブ」人気失速、ポップマート株下落－時価総額２兆円弱吹き飛ぶ,257,https://news.yahoo.co.jp/articles/028a12c524aa82e04c53c84c8384c4d7fef3666a,9/15(月) 18:19
2025-09-16,13:08,business,経済,4,みんかぶマガジン,遙洋子、伊東市長問題で「女性のリーダーはボコボコにされる」発言に元リク女性ライターが憤怒…「むしろ女性差別を助長する」4つの大問題,176,https://news.yahoo.co.jp/articles/870c0a4114e91c384b72713e2b7b5ed0e00f5541,9/16(火) 9:10
2025-09-16,13:08,business,経済,5,産経新聞,学生マンションの多くが食事付き、シアタールームやプールも　様変わりする令和の下宿事情,164,https://news.yahoo.co.jp/articles/12bf1db484d7710b631f0afa1b70ca557fb3353f,9/16(火) 7:00
2025-09-16,13:08,business,経済,6,朝日新聞,米自動車関税引き下げ、午後1時1分に発効　27.5%から15%に,105,https://news.yahoo.co.jp/articles/36972b0633055d5926599fddfac71e9eaabbabf1,9/16(火) 0:07
2025-09-16,13:08,business,経済,7,Bloomberg,米軍、ベネズエラからの麻薬輸送船を再び攻撃－トランプ大統領,88,https://news.yahoo.co.jp/articles/0901a28f731cd90cd52ae6986d85d7df49b9fe93,9/16(火) 5:35
2025-09-16,13:08,business,経済,8,プレジデントオンライン,このままでは外国人が増えるほど国力が下がっていく…国民の税金が未納保険料の穴埋めに使われる大問題,62,https://news.yahoo.co.jp/articles/c7c118569a43d3288ad03e5d41ad202eb5e0bd24,9/16(火) 7:16
2025-09-16,13:08,business,経済,9,産経新聞,黒字化の裏にある「万博倒産」の悲劇、未払いで業者も憤怒「責任は万博協会や行政にも」　無策の果て－万博未払い問題㊦,54,https://news.yahoo.co.jp/articles/78a5b977d8c9678013b61fd5faef10f2b567aa31,9/16(火) 7:00
2025-09-16,13:08,business,経済,10,THE GOLD ONLINE（ゴールドオンライン）,「死ぬまで働きます」50年ローンで都内に狭小住宅を買ったが…月収31万円・退職金見込み額ゼロ、30代夫婦が途方に暮れた〈65歳時点の残債額〉【FPの助言】,53,https://news.yahoo.co.jp/articles/eea895ff6e497c710b275d6c85cad070989fb67a,9/16(火) 5:01
2025-09-16,13:08,business,経済,11,テレビ朝日系（ANN）,農家も困惑！JAと民間業者“過熱する新米争奪戦”,49,https://news.yahoo.co.jp/articles/aaddcc3ada589b18f2ebd8565a90d4e3c1702f06,9/15(月) 19:22
2025-09-16,13:08,business,経済,12,サンデー毎日×週刊エコノミストOnline,参政党の研究　減税や反ワクチンで広がった参政党支持　新首相が連立入り打診の可能性,49,https://news.yahoo.co.jp/articles/42e2b46a0deb2d12400deb987b23a1f6ba193f09,9/16(火) 10:01
2025-09-16,13:08,business,経済,13,ダイヤモンド・オンライン,大衆酒場「庄や」の店舗数が激減！めちゃ美味しいのに客が来ない残念すぎる理由,44,https://news.yahoo.co.jp/articles/7c495a7d7ee91049b8e8cdb5b3b053f92cbd9308,9/16(火) 11:01
2025-09-16,13:08,business,経済,14,THE GOLD ONLINE（ゴールドオンライン）,"「わたしだけ何ももらえなかった…」長女の積怨。貯蓄7,000万円・年金月30万円・73歳父「孫への愛」が生んだ〈思わぬ事態〉【CFPの助言】",42,https://news.yahoo.co.jp/articles/a94663710f076bbef1638cf78317dd6151eed1ad,9/16(火) 10:01
2025-09-16,13:08,business,経済,15,プレジデントオンライン,なぜ阪神は史上最速で優勝できたのか…球団社長がインタビューで語った「ほぼ赤字の遊園地事業」で得た教訓,40,https://news.yahoo.co.jp/articles/f1a88205cb85219b63a5d7145095d15aeaacc563,9/16(火) 7:16
2025-09-16,13:08,business,経済,16,読売新聞オンライン,中国の輸出企業にトランプ関税の逆風…鉱工業生産の伸び率、２か月連続で縮小,31,https://news.yahoo.co.jp/articles/ca683bc416b5e5eb90b9c1b5b1814b4003596420,9/15(月) 12:41
2025-09-16,13:08,business,経済,17,プレジデントオンライン,取引先に着けていくのはロレックスか、アップルウォッチか…キーエンス元営業マンが出した「腕時計の結論」,30,https://news.yahoo.co.jp/articles/d7a6ea765f0cefe4f91d9882b5b76bdfcd2ee530,9/16(火) 9:35
2025-09-16,13:08,business,経済,18,LIMO,国家公務員と地方公務員「平均年収」はどちらが高いと思う？給与水準が最も高い地方自治体「ランキング」も紹介！,30,https://news.yahoo.co.jp/articles/53bd4d1c69abee4c7961849d74762fa10b6b3cf5,9/16(火) 11:11
2025-09-16,13:08,business,経済,19,ロイター,中国、エヌビディアが独禁法違反と指摘　調査継続,26,https://news.yahoo.co.jp/articles/0a1930791c3a213ab69354f5b9da54af1d2f4ee1,9/15(月) 18:53
2025-09-16,13:08,business,経済,20,Yahoo!ニュース オリジナル THE PAGE,【ヤフコメで話題】「転売ヤーによる買い占めで本来のファンが入手困難に」「流行や人気商品が転売目的で消費される現状に疑問」 - 転売ヤー問題が社会で議論に,26,https://news.yahoo.co.jp/articles/14f27093e0b9fa065759d2f86fc8ba7265387f38,9/16(火) 10:29
2025-09-16,13:08,business,経済,21,ベストカーWeb,どう変わった!? どう変わらなかった!? 長距離ドライバーが感じた「2024年問題」の現在地,25,https://news.yahoo.co.jp/articles/91cc36981dc5f74b20362c2e21192495b2413e11,9/16(火) 10:00
2025-09-16,13:08,business,経済,22,ベストカーWeb,バカッ速! おじさんにお薦めしたいのはガソリン車を置いてきぼりにする快速ハイブリッド! もう純ガソリン車に戻れない!?,24,https://news.yahoo.co.jp/articles/e6306e48d3f27b3bf346e9a5f5d48adc56d28d2f,9/16(火) 11:00
2025-09-16,13:08,business,経済,23,webCG,オヤジ世代は感涙!?　新型「ホンダ・プレリュード」にまつわるアレやコレ,24,https://news.yahoo.co.jp/articles/c922492ceebde5a40139a4c950f3da40f607baf1,9/16(火) 10:32
2025-09-16,13:08,business,経済,24,共同通信,加藤財務相「自民党まとまるため役割熟慮」,19,https://news.yahoo.co.jp/articles/6aa3e3415eae0d45c1552b62f43b38c01d4cbc17,9/16(火) 11:47
2025-09-16,13:08,business,経済,25,FNNプライムオンライン,「撮り鉄」が住宅敷地に侵入、庭木を切断…再三注意してもマナー違反　「115系」湘南色や横須賀色など「懐かしの車体カラー列車」の運行予定表を掲載中止に,19,https://news.yahoo.co.jp/articles/6a5083bf74547c648144d8ce771804edd6fa99e1,9/15(月) 13:46
2025-09-16,13:08,business,経済,26,TBS NEWS DIG Powered by JNN,なぜ中国発「ラブブ」は世界を席巻したのか? 2000万円以上の高値も…ポップマートの巧みな4つの戦略,19,https://news.yahoo.co.jp/articles/5ddecde4259a1ab7be0bde8e0c89673d1c53d133,9/16(火) 7:31
2025-09-16,13:08,business,経済,27,Merkmal,あなたの「クルマ愛」、本当に健全？ 匿名空間で暴走する「口うるさい自動車ファン」の正体,18,https://news.yahoo.co.jp/articles/807e1d7ad4aea4696e845630f6e5b1278a969b4b,9/16(火) 11:51
2025-09-16,13:08,business,経済,28,集英社オンライン,男性のムラ社会の制度やルールのまま女性に活躍を促すとどうなるか…女性の管理職比率の上昇だけを目指すことが招く悲劇,18,https://news.yahoo.co.jp/articles/c59f9fce2027a424c89339efec4a2335f140315c,9/16(火) 7:01
2025-09-16,13:08,business,経済,29,デイリー新潮,本マグロに次いで2番目に高級なのに“知名度が低すぎるマグロ”とは？　ついに“改名して再デビュー”が議論される事態に,18,https://news.yahoo.co.jp/articles/5f1fe01ae9535aebc653fb2a2779ad29cde89aa8,9/16(火) 6:10
2025-09-16,13:08,business,経済,30,プレジデントオンライン,きっかけは若手の「何気ない一言」だった…大阪王将が冷凍餃子の絶対王者・味の素を超えて日本一になったワケ,17,https://news.yahoo.co.jp/articles/4a0bd480dbe09a0c9329eadaf515181ccdb4469f,9/16(火) 9:16
2025-09-16,13:08,business,経済,31,THE GOLD ONLINE（ゴールドオンライン）,お金は増えた、でも、何もやる気が起きないし…年金「月25万円」70歳男性の衝撃告白、年金の「繰下げ受給」に潜む罠,17,https://news.yahoo.co.jp/articles/9960739befd9854768f6b951c3a3c2a19906864e,9/16(火) 5:01
2025-09-16,13:08,business,経済,32,くるまのニュース,人気絶頂のトヨタ「アルファード」残価設定ローンで買って大丈夫？ 維持できない人が続出!? “背伸びして”高級車を購入するときの注意点とは？,16,https://news.yahoo.co.jp/articles/8bdedbebe98ec5af6398a07ab08117759c1e0d84,9/16(火) 11:45
2025-09-16,13:08,business,経済,33,まいどなニュース,“正社員不足を感じている”企業……特に深刻な業界は？　「残業規制で就労時間減った」「猛暑で作業効率悪く」,15,https://news.yahoo.co.jp/articles/ff1113ff0c8de8a405ca2a6ccee71014ed3d32e6,9/16(火) 7:05
2025-09-16,13:08,business,経済,34,マネーポストWEB,自販機事業で苦境に陥るコカ・コーラBJH　直近決算の大赤字転落は「良い赤字」なのか、「ダメな赤字」なのか,15,https://news.yahoo.co.jp/articles/71f82aa40f6400be9bf13495e2ca82cbd09f52c4,9/16(火) 7:15
2025-09-16,13:08,business,経済,35,ベストカーWeb,トヨタから「ミドシップ4WD」のスーパースポーツ級の新型車登場か!! 車名はまさかの「セリカ」で2028年にデビュー!?,15,https://news.yahoo.co.jp/articles/90ab328e91193e6f5a06cbc53f0d01768bc0ffa1,9/16(火) 6:00
2025-09-16,13:08,business,経済,36,Yahoo!ニュース オリジナル THE PAGE,【ヤフコメで話題】「ラブブの人気は一過性との声」「日本では定着しなかった印象」 - 中国発キャラクター『ラブブ』のブームと今後に注目,15,https://news.yahoo.co.jp/articles/d9f7e207a434c147877682b80b93864c1e2c969c,9/16(火) 9:02
2025-09-16,13:08,business,経済,37,マネーポストWEB,東京メトロ有楽町線「城北エリアの駅」の人口増減に明暗　「東池袋」「要町」が再評価される一方、沿線ワーストに沈んだ駅も,15,https://news.yahoo.co.jp/articles/6a3a5c69911916f15a530996c037a5cdcd6c3129,9/16(火) 11:15
2025-09-16,13:08,business,経済,38,THE GOLD ONLINE（ゴールドオンライン）,暗号資産課税、2026年度に転機か…分離課税導入で「富裕層マネー」呼び込む可能性,15,https://news.yahoo.co.jp/articles/735f99e129abcb9a9d5126c81934f01ebcc00ba0,9/16(火) 10:01
2025-09-16,13:08,business,経済,39,THE GOLD ONLINE（ゴールドオンライン）,ファミリー向けは平均家賃100万円超え、半数は「港区」に集中…データが示す東京23区「高級賃貸」のリアル,14,https://news.yahoo.co.jp/articles/72f112db596fdf8fc06357c09266df6ad787ad12,9/16(火) 10:01
2025-09-16,13:08,business,経済,40,テレビ朝日系（ANN）,エノキ　どこから切るべき？　キノコの季節　“あの線”は何？,14,https://news.yahoo.co.jp/articles/e91a38794234712389c85345d7e9d74c0aa62066,9/15(月) 19:10
