scrp_date,scrp_time,genre_en,genre_jp,rank,media_jp,title,comment,link,date_original
2025-09-12,08:07,TTL,総合,1,産経新聞,＜独自＞自民・小泉進次郎農水相が総裁選出馬へ、来週表明　推薦人20人確保にめど,506,https://news.yahoo.co.jp/articles/db79e591d2253f53f885c32a5c95fee41882062f,9/12(金) 0:13
2025-09-12,08:07,TTL,総合,2,TBS NEWS DIG Powered by JNN,「赤ちゃんにはなるべくあなたの母乳を」牛乳パックの“広告”に賛否　50年続く表現めぐりSNSで様々な意見,357,https://news.yahoo.co.jp/articles/d246c0c44c1ff9e28fba0d0246fe942268dd6f5b,9/11(木) 20:37
2025-09-12,08:07,TTL,総合,3,デイリー新潮,田久保市長、斎藤知事、石破首相…「潔く辞めないトップ」が増えているのはナゼか　変化する日本人の「引き際の美学」に迫る,331,https://news.yahoo.co.jp/articles/07b9421941d19714c6448de51eb52ba9b51f4ef1,9/12(金) 6:12
2025-09-12,08:07,TTL,総合,4,朝日新聞,郵便物の不配4000通、日本郵便公表せず　差出人が気づけない恐れ,285,https://news.yahoo.co.jp/articles/1972cba5397947ba8439ef01cbf17041e0f1009e,9/12(金) 5:00
2025-09-12,08:07,TTL,総合,5,TBS NEWS DIG Powered by JNN,「市民に信を問う」“学歴詐称”疑惑で不信任決議を受けた静岡・伊東市の田久保市長、議会解散を選択　「伊東市がどうなっても関係ない」市民からは怒りの声【news23】,280,https://news.yahoo.co.jp/articles/91a7fc07f0ccc27849a77423dbd1d5dae4df47a6,9/11(木) 11:42
2025-09-12,08:07,TTL,総合,6,女性セブンプラス,中居正広、巨額訴訟が飛び火する可能性も囁かれる中で浮上する「福祉活動による社会貢献」での復帰　知人が携わる施設に訪問する具体的計画も,223,https://news.yahoo.co.jp/articles/d192ebefc82409b02efc9283c64904eaf8dec5de,9/12(金) 7:00
2025-09-12,08:07,TTL,総合,7,スポニチアネックス,柴田淳「総理が辞任して、ここまで日本全体が悲しんだことある？？」,207,https://news.yahoo.co.jp/articles/ffd419b5878b5edcea3f2a0ec884c72cd98d208a,9/11(木) 20:22
2025-09-12,08:07,TTL,総合,8,産経新聞,「最後なんだから思いっきり」辻元氏、石破首相「戦後80年見解」　反対ある中で福島氏も,175,https://news.yahoo.co.jp/articles/009d065af0d57f4fc3e557822235744431a890c5,9/12(金) 7:00
2025-09-12,08:07,TTL,総合,9,FNNプライムオンライン（フジテレビ系）,バンクシーの新作わずか数日で撤去「デモ参加者に裁判官が小づち振り上げる」“問題作”バリケードで隠し黒塗りに　イギリス,170,https://news.yahoo.co.jp/articles/f3b3de390810286f38811aac059d69b9352e00fa,9/11(木) 19:00
2025-09-12,08:07,TTL,総合,10,ENCOUNT,佐川急便、配達員のエレベーター“占拠”が物議　「ドライバーの身勝手な対応」本社謝罪,162,https://news.yahoo.co.jp/articles/81221f3c09384405b70df0eeeab431151ac1d4ea,9/11(木) 17:38
2025-09-12,08:07,TTL,総合,11,デイリー新潮,新浪剛史氏「ハワイ女性トラブル」の現場となった「2億円コンドミニアム」の疑惑　本人が社長時代のローソンが購入、当時から“会社施設の私物化”との指摘が,160,https://news.yahoo.co.jp/articles/3fa74060621f37c10bf998463fbb1e008a38c01e,9/12(金) 6:13
2025-09-12,08:07,TTL,総合,12,東洋経済オンライン,中国で実家を出ず“親から給料を貰う”《専業子供》が流行る“深刻な事情”。親から家事の報酬で“月8万円”得る「33歳女性」などにリアルを聞いた,145,https://news.yahoo.co.jp/articles/8aa5ae40f6fe2b10d3b2d4cb9420be656b39e99e,9/12(金) 5:31
2025-09-12,08:07,TTL,総合,13,日刊スポーツ,小室眞子さんに母・紀子さまがメッセージ「よいタイミングで日本を訪れて」米国での孫誕生を喜ぶ,145,https://news.yahoo.co.jp/articles/221706cb924be754d10a29766e80dcf2d0e7992d,9/12(金) 6:30
2025-09-12,08:07,TTL,総合,14,デイリースポーツ,遙洋子、伊東市長問題で「女性のリーダーはボコボコにされる」発言　杉村太蔵氏は「女性男性関係ない」,137,https://news.yahoo.co.jp/articles/a0bd9163811e7b24b1f58959906436fd6f967956,9/11(木) 11:04
2025-09-12,08:07,TTL,総合,15,毎日新聞,小林鷹之氏、自民総裁選へ出馬意向を表明　近く正式会見を調整,133,https://news.yahoo.co.jp/articles/623715cb06eadc92c7c33be6473aa2cc12c236a2,9/11(木) 16:54
2025-09-12,08:07,TTL,総合,16,ねとらぼ,ラーメン魁力屋、「クエン酸」入りラーメンを客に誤提供……　「深くお詫び」と謝罪　人気チェーンの“混入事案”相次ぐ,132,https://news.yahoo.co.jp/articles/c73d782e9ce6195ebbbbaac9aa2e5d300583d3d4,9/11(木) 19:45
2025-09-12,08:07,TTL,総合,17,読売新聞オンライン,小泉進次郎氏、総裁選出馬の意向固める…高市早苗氏は岸田前首相に「出馬する方向で考えている」,114,https://news.yahoo.co.jp/articles/ba01727b29cb505d291913f099e821d84f93cfe7,9/12(金) 5:00
2025-09-12,08:07,TTL,総合,18,デイリースポーツ,【ポスト石破】Ｘ大荒れ「高市首相なら連立解消するのか」「高市潰し」　公明代表「連立組めない」で騒然→「一般論」釈明もコメ殺到「高市さんの何がまずい」「いい発言」「口挟んでるだろｗ」,113,https://news.yahoo.co.jp/articles/ac9e5d8e1eb98f22b6844e84832ea7b565526023,9/11(木) 18:35
2025-09-12,08:07,TTL,総合,19,スポニチアネックス,橋幸夫さん通夜に参列で物議の“そっくり”芸人が再び謝罪「心から反省」　ATSUSHIにも謝罪,110,https://news.yahoo.co.jp/articles/a04172d3d7642762a9b6670c3b24ecfb14790fb9,9/12(金) 6:33
2025-09-12,08:07,TTL,総合,20,テレビ朝日系（ANN）,サンマ豊漁も“早く食べて”　「かなり安い」なのに…なぜ？,105,https://news.yahoo.co.jp/articles/a3480d2c3fe1ebb192da7561ded015424d81c838,9/11(木) 18:05
2025-09-12,08:07,TTL,総合,21,RONSPO,残留にまた赤信号？！角田裕毅の不振影響で従業員への年末ボーナス減額の可能性が出てきてレッドブル内で不満爆発の危機,102,https://news.yahoo.co.jp/articles/010cb999514f39b1f6887bd2966b22a0b573dab8,9/12(金) 5:57
2025-09-12,08:07,TTL,総合,22,共同通信,首相、物価高対策の精査を指示　補正予算念頭、小野寺政調会長に,101,https://news.yahoo.co.jp/articles/950b2b22a738854d2a991ffb5edc3e5ff91c6813,9/11(木) 12:08
2025-09-12,08:07,TTL,総合,23,オトナンサー,【高速バス】1人利用時、隣席も予約→乗車直前に片方キャンセル…“相席ブロック”横行に弁護士「偽計業務妨害罪の可能性」,94,https://news.yahoo.co.jp/articles/1d2896b6037560d237ca4ec3c3449ec573b318ab,9/12(金) 7:10
2025-09-12,08:07,TTL,総合,24,J-CASTニュース,「マジでこのラーメンきつい」「全部が微妙」登録者数65.6万人のYouTuber、「みそきん」実店舗を酷評,92,https://news.yahoo.co.jp/articles/a601fb0b581d2683fc256cdeac0431e0dc2f52b9,9/11(木) 13:55
2025-09-12,08:07,TTL,総合,25,中日スポーツ,ヤクルト・村上宗隆、連続死球に大きな叫び、怒りの表情も…一塁ベース上でボスラーの声掛けに応じる,92,https://news.yahoo.co.jp/articles/30730014ff41c7aad318b6e0ee7075099edff6cc,9/11(木) 21:20
2025-09-12,08:07,TTL,総合,26,東洋経済オンライン,高市氏との一騎打ちのはずがナゼ？　永田町に広がり始めたまさかの「進次郎不出馬」説の深層,90,https://news.yahoo.co.jp/articles/efd9b7d2074d42db095a5c719a96039f762a59ca,9/11(木) 12:31
2025-09-12,08:07,TTL,総合,27,日刊スポーツ,「SNS重視の政治」疑問視、立民・安住淳幹事長が力説「間違ってる」「私はおかしいと思う」,89,https://news.yahoo.co.jp/articles/123a82068c1af01157340e4b03f79233711f60c9,9/12(金) 5:10
2025-09-12,08:07,TTL,総合,28,SOCCER DIGEST Web,たとえポット2でも森保ジャパンに恩恵なし？ 「アルゼンチン、日本、ノルウェー、イタリア」2026年W杯“死の組”予想,86,https://news.yahoo.co.jp/articles/0a98ecae1ff9862d3cbb093e37b799639426d55f,9/12(金) 5:50
2025-09-12,08:07,TTL,総合,29,ABCニュース,【独自】またもや大阪府警に「家宅捜索中に暴行」疑惑　“事件と無関係”男性が「捜査4課員に顔をひざ蹴りされた」　全治1カ月のけがで刑事告訴、府警が受理し捜査へ,82,https://news.yahoo.co.jp/articles/ef0f6ff2a85a115329d96618479890e7084eb094,9/11(木) 11:45
2025-09-12,08:07,TTL,総合,30,日刊スポーツ,粗品が告白、宮迫博之とのバトルの背景にあった伏線回収　元相方の蛍原徹「笑うしかないわ」,81,https://news.yahoo.co.jp/articles/65d7b3cecd26fc8ceba673e285c4944008c6b1a4,9/12(金) 6:29
2025-09-12,08:07,TTL,総合,31,女性自身,「不快すぎた」有吉弘行　恒例番組での野呂佳代への“体型いじり”が波紋…おなじみの“毒舌芸”に拒否感抱く人が増えてきたワケ【識者が解説】,72,https://news.yahoo.co.jp/articles/4cb74ebc4f2d7e66535a83f6b2b1f9d2be9826b6,9/11(木) 16:00
2025-09-12,08:07,TTL,総合,32,産経新聞,「自民のライバルはうちだけ」立民・新幹事長の安住淳氏が自負　SNS偏重は「おかしい」,71,https://news.yahoo.co.jp/articles/db8e1b564b3815f14811a0d9ea90fb24d1f494bd,9/12(金) 7:00
2025-09-12,08:07,TTL,総合,33,NEWSポストセブン,《大谷翔平、結婚2年目の試練》信頼する代理人が提訴され強いショックを受けた真美子さん　育児に戸惑い、チームの夫人会も不参加で孤独感,70,https://news.yahoo.co.jp/articles/1320beea898a6cb5d17dfc343eb5bf33c863346e,9/12(金) 7:15
2025-09-12,08:07,TTL,総合,34,AERA DIGITAL,高市早苗氏と小泉進次郎氏の一騎打ちの公算も、自民党総裁選は3週間後　浮上するのは困ったときの？,69,https://news.yahoo.co.jp/articles/61ed5762788e2fcb86e3a2e2a868bd5a6abeb1ae,9/12(金) 7:31
2025-09-12,08:07,TTL,総合,35,読売新聞オンライン,無人販売所で９０円支払い不足、防犯カメラで発覚した町議が議員辞職「間違えて支払ったが責任を」,67,https://news.yahoo.co.jp/articles/b6133a0a68db3c84f29c2ccb137b9d7eeb11b5b1,9/12(金) 7:36
2025-09-12,08:07,TTL,総合,36,STVニュース北海道,北海道警巡査部長が飲酒事故 「道路ではない」立件見送り,67,https://news.yahoo.co.jp/articles/454f65c4d019846c4beb5ea3bd300b51d49cd99a,9/12(金) 6:57
2025-09-12,08:07,TTL,総合,37,中国新聞デジタル,夫のギャンブルで水道料金の支払いが滞納、困窮し子ども4人は児童相談所へ…　8歳娘の首を絞め、殺人未遂罪となった40歳母親　裁判員裁判で生活実態が明らかに,67,https://news.yahoo.co.jp/articles/826bb23638acea135ab1d9737879810a51df8b64,9/11(木) 8:03
2025-09-12,08:07,TTL,総合,38,毎日新聞,風邪やインフルで抗菌薬処方は原則NG　保険請求「認めない」方針,66,https://news.yahoo.co.jp/articles/5899524ff83607235a091629bc003b28d70b5311,9/11(木) 19:21
2025-09-12,08:07,TTL,総合,39,TBS NEWS DIG Powered by JNN,「ハラミ」はいつから主役級? 人気の裏に焼肉店の苦労…プロ直伝・お家焼肉のコツを紹介【Nスタ解説】,65,https://news.yahoo.co.jp/articles/0b5f76d00368f94e76e765a955660b8f189b6c0b,9/11(木) 20:14
2025-09-12,08:07,TTL,総合,40,テレビ静岡NEWS,袴田巖さんが再審無罪判決後の検事総長談話めぐり国を提訴　「無罪を言い渡された者を犯人呼ばわりすることは名誉毀損にあたる」　慰謝料など710万円の支払いとホームページ上での謝罪広告の掲載求める,65,https://news.yahoo.co.jp/articles/de81641250b7ebfbed543ed3c8be2e868123f2c8,9/11(木) 13:04
