scrp_date,scrp_time,genre_en,genre_jp,rank,media_jp,title,comment,link,date_original
2024-09-15,12:11,life,ライフ,1,弁護士ドットコムニュース,「何が気に食わないんだ塾の迎えだぞ！」大量の違法駐車に困惑　バリケードなどで対抗してもいい？,113,https://news.yahoo.co.jp/articles/1c638b07c1254ca523685303edcc8d30bbd7f785,9/15(日) 8:48
2024-09-15,12:11,life,ライフ,2,日刊ゲンダイDIGITAL,四面楚歌なのに辞任拒否…斎藤元彦兵庫県知事「逃げない理屈」を考えてみた（元木昌彦）,95,https://news.yahoo.co.jp/articles/45304ee05f467a2ec74a6fbcc94370ae8a7c138d,9/15(日) 9:06
2024-09-15,12:11,life,ライフ,3,日刊ゲンダイDIGITAL,「辞職してすべて終わり」が正義なのか？ 斎藤元彦・兵庫県知事の選択が焦点に【「表と裏」の法律知識】,83,https://news.yahoo.co.jp/articles/914002965530b257c97fe882d5257461d61479f0,9/15(日) 9:06
2024-09-15,12:11,life,ライフ,4,週刊SPA!,5年間毎日「知らない人の家に泊まり続ける男」。旅生活を維持する“YouTube収益の収支”も告白,63,https://news.yahoo.co.jp/articles/9e4eecb23fa08ead0ee75796a5d6884205d11912,9/15(日) 8:55
2024-09-15,12:11,life,ライフ,5,Pen Online,機内で隣の男性が大股開き…スペースを奪われた女性の投稿に共感の声続々「自分も同じ状況に陥った」,56,https://news.yahoo.co.jp/articles/931ca3d521f4e3eec5eb142a82eeb1195c77d920,9/15(日) 11:11
2024-09-15,12:11,life,ライフ,6,webマガジン mi-mollet,ブラジャーやショーツの「透け」はどれくらい気になる？一番透けにくい下着の色と形をプロが紹介！【40代下着の悩み】,53,https://news.yahoo.co.jp/articles/6000359c12db3c1bade914a92dbeb6515a21cb62,9/15(日) 8:02
2024-09-15,12:11,life,ライフ,7,週刊女性PRIME,「児童虐待だろ」子ども向けの“花魁”写真撮影が物議、フォトスタジオのあきれた言い分,50,https://news.yahoo.co.jp/articles/d16fb6aba84885ab7bc795efd851831a72be7107,9/15(日) 11:02
2024-09-15,12:11,life,ライフ,8,ファイナンシャルフィールド,彼氏に「お金がないから結婚できない」と言われましたが、結婚式を挙げなければそんなにお金はかからないですよね。結婚資金ってどのくらい必要でしょうか？,39,https://news.yahoo.co.jp/articles/9f5126f7dfe9405779c341a417f343853993d798,9/15(日) 10:10
2024-09-15,12:11,life,ライフ,9,ファイナンシャルフィールド,キッチンの「換気扇」をつけっぱなしにして旅行に行ってしまいました。いくら電気代を無駄にしたでしょうか？,35,https://news.yahoo.co.jp/articles/45fef6054bda9a6121c0bf4bf8cccb24475b07d2,9/15(日) 11:10
2024-09-15,12:11,life,ライフ,10,NEWSポストセブン,驚愕の粘り腰を発揮する斎藤知事を見ていて得られた4つの気づき,34,https://news.yahoo.co.jp/articles/f648efed27932026f3ec6ff6d8cbcc7627896546,9/14(土) 16:15
2024-09-15,12:11,life,ライフ,11,ファイナンシャルフィールド,夢だった「美容師」デビューを果たした娘。ただ、朝から晩まで働いて「月給18万円」らしいです…普通なのでしょうか？,31,https://news.yahoo.co.jp/articles/518396dc6423e839246512bd14dc97a16f27c9d0,9/15(日) 11:30
2024-09-15,12:11,life,ライフ,12,読売新聞オンライン,臓器を摘出する医師の派遣を拡充へ…人員不足による受け入れ断念相次ぎ日本移植学会が方針,29,https://news.yahoo.co.jp/articles/af527514bf01bd30ed165707d3c6f28f77b364dc,9/15(日) 5:01
2024-09-15,12:11,life,ライフ,13,日刊ゲンダイDIGITAL,今どきの「50代」元気なさすぎ…は偶然か必然か？ 自民党総裁選には候補者ゼロ,28,https://news.yahoo.co.jp/articles/9449ed3a0c7bd2999b43d896ee18aba358035600,9/15(日) 9:06
2024-09-15,12:11,life,ライフ,14,現代ビジネス,「食のブラックボックス化」は現代の病…外食、ウーバー…食べている料理に何が入っているかわからない」現象が起きている,27,https://news.yahoo.co.jp/articles/01e4c0cc9061a2f1a87db4250fe15f43d492a469,9/15(日) 10:00
2024-09-15,12:11,life,ライフ,15,産経新聞,12歳の少年が見た昭和52年「人の命は地球より重い」と言ったほうがカッコいいとは思うが　プレイバック「昭和100年」,25,https://news.yahoo.co.jp/articles/ed13fb0b2b3ad9106f1d7a5c85aaf315389e6dd0,9/15(日) 9:35
2024-09-15,12:11,life,ライフ,16,FORZA STYLE,「怖くてその場にしゃがみ込み…」既婚者合コン【常連主婦】が忘れていた「人を見たら鬼と思え」の教訓。,25,https://news.yahoo.co.jp/articles/bcea19b78bd8e287c2ff109d3a120624458b82ce,9/15(日) 9:52
2024-09-15,12:11,life,ライフ,17,Yahoo!ニュース オリジナル 特集,再び自殺を図る人を半分に──救急から引き継いで支援する精神科チーム #今つらいあなたへ,24,https://news.yahoo.co.jp/articles/e05f614efd6e17f7c02aa5f067e80f2a87fa903c,9/14(土) 16:30
2024-09-15,12:11,life,ライフ,18,AERA dot.,「スーパー総選挙」1位は埼玉発祥「ヤオコー」　なぜ埼玉生まれのスーパーは強いのか,24,https://news.yahoo.co.jp/articles/919e6962e9f40e917bf60826594040c806912d15,9/15(日) 9:32
2024-09-15,12:11,life,ライフ,19,Hint-Pot,「おいしいと思えなくて」　フランス人が初訪日で苦手を克服した日本の食べ物とは,24,https://news.yahoo.co.jp/articles/4b21a289a07f53ea054b871ed47b8efee388be65,9/15(日) 6:10
2024-09-15,12:11,life,ライフ,20,ファイナンシャルフィールド,友人に「スマホ代が月9000円」と言ったら、高すぎると言われた！ 友人は「1000円」らしいですが、なぜこんなに差があるのでしょうか？ 会社を変える必要がありますか…？,23,https://news.yahoo.co.jp/articles/b05dfa7927fdd81a2859d0fbb91763fb837e9fec,9/14(土) 14:10
2024-09-15,12:11,life,ライフ,21,現代ビジネス,小学校3年生から英語を習う日本人は遅すぎる…「オランダ、中国、韓国」の英語教育に学ぶこと,21,https://news.yahoo.co.jp/articles/2f785a4753734073b81fa10cf42ac3b1d92faabc,9/15(日) 11:00
2024-09-15,12:11,life,ライフ,22,THE GOLD ONLINE（ゴールドオンライン）,"税務調査官「もうわかりました、これで結構です」…時価1億円の土地を相続→9,000万円と申告した59歳サラリーマンが〈追徴課税〉を逃れた驚きの理由【税理士の助言】",21,https://news.yahoo.co.jp/articles/c10f532d8ebcb26566f81ff22294be5381f905b5,9/15(日) 11:02
2024-09-15,12:11,life,ライフ,23,FORZA STYLE,妻が小3の息子にもう生理を教えています。これは虐待ではないでしょうか。,21,https://news.yahoo.co.jp/articles/f77151ae4cfee0d3c3d86c4ea00956be78fced80,9/15(日) 7:18
2024-09-15,12:11,life,ライフ,24,ファイナンシャルフィールド,実家で「子どもの頃の財布」を発見！「伊藤博文」の1000円札が入っているけど、まだ使える？ 銀行で交換は可能なの？,19,https://news.yahoo.co.jp/articles/4cfa7ef5f73228db06ecddb28afc71ccb532d5ca,9/15(日) 11:30
2024-09-15,12:11,life,ライフ,25,ねとらぼ,「なんじゃこりゃ」　ハードオフでジャンク品発見→“思わず目を疑う”値札に「正直過ぎて草生える」,19,https://news.yahoo.co.jp/articles/62a1193b4e933b5a0dd17d4e4ee160f231c1ed1b,9/15(日) 8:30
2024-09-15,12:11,life,ライフ,26,ファイナンシャルフィールド,よくテレビで「金箔」入りの料理を見かけますが、なぜ食べても大丈夫なんですか？純金との違いは？,18,https://news.yahoo.co.jp/articles/7405426df16222b512f81167f40cfe0a0b539373,9/15(日) 10:40
2024-09-15,12:11,life,ライフ,27,ラジトピ　ラジオ関西トピックス,デートの服装選び　女性の本音　若手女性芸人が代弁「それでも女は『服がない！』ってなるのよ！」,18,https://news.yahoo.co.jp/articles/1be59ef0345fb95c66d384f479581fece2f09856,9/15(日) 7:00
2024-09-15,12:11,life,ライフ,28,ファイナンシャルフィールド,ランチ代を「ブラックカード」で支払っていたパート勤務の友人。ブラックカードを持つメリットはあるのでしょうか？,18,https://news.yahoo.co.jp/articles/7e1a963f56d9a0d29f71c8b42bdab0cf3abec6aa,9/14(土) 15:10
2024-09-15,12:11,life,ライフ,29,よろず～ニュース,猫好き男性に聞いた「好きな猫種」3位はマンチカン、2位はアメリカンショートヘア　1位は親しみのある存在,16,https://news.yahoo.co.jp/articles/a3998f8201fcec603e18bd47358a12fab884ec12,9/15(日) 11:30
2024-09-15,12:11,life,ライフ,30,オトナンサー,【ホテル】朝食バイキングで「食べ物」なかなか補充されず…“返金請求”できる？　弁護士に聞く,15,https://news.yahoo.co.jp/articles/40f438bb1bc33b8ea223a17834ba25a7008c00b2,9/15(日) 7:10
2024-09-15,12:11,life,ライフ,31,現代ビジネス,テレビではカットされる「元気すぎる高齢タレント」の「衝撃的な真実」,15,https://news.yahoo.co.jp/articles/82e9562f34b9998a70daad88749d2ae84887978f,9/15(日) 7:05
2024-09-15,12:11,life,ライフ,32,読売新聞（ヨミドクター）,介護職員　不足の理由　2040年度にはどのくらい足りなくなるの？,14,https://news.yahoo.co.jp/articles/0376a2deb829de6b86ebfb236884aa22bf13044f,9/14(土) 20:10
2024-09-15,12:11,life,ライフ,33,ファイナンシャルフィールド,27歳の息子は、定時で帰宅して「映画」など観ています。私の頃は「24時間戦えますか？」と言われていたのですが、今は“ワークライフバランス”というのが重視されるのでしょうか？,14,https://news.yahoo.co.jp/articles/39616ee40bfa950ebfbaee8e21ffc7f9f9e35fca,9/14(土) 13:50
2024-09-15,12:11,life,ライフ,34,FORZA STYLE,「あんた、離婚はフツーって、ムリしてない？」息子がバツ2、子持ちの女性を連れてきた時、67歳の母親を襲った眩暈がするような価値観のバグ,14,https://news.yahoo.co.jp/articles/19079b3f0612b44b570039c0f2aba57c750724f3,9/15(日) 9:46
2024-09-15,12:11,life,ライフ,35,ファイナンシャルフィールド,「保育園」に通う3歳の娘は保育料を払っていますが、「幼稚園」に通う3歳の友人の子どもは無償化になっているそうです。同じ3歳なのになぜですか？,14,https://news.yahoo.co.jp/articles/1539f352027a3f62a1b40368c6f33805dd374cd5,9/14(土) 19:10
2024-09-15,12:11,life,ライフ,36,ねとらぼ,【30代に聞いた】子どもを進学させたい「東京都の私立大学」ランキング！　2位は「慶應義塾大学」、1位は？,14,https://news.yahoo.co.jp/articles/9968941e608d1ea9a6342a7f4e8645ab6942c4f3,9/15(日) 8:50
2024-09-15,12:11,life,ライフ,37,Lmaga.jp,開業２００日前「神戸アリーナ」がほぼ完成、予約状況も順調,14,https://news.yahoo.co.jp/articles/fd3ff6818ced50dd0fcf0ebe4b2f5ac9779920fe,9/15(日) 8:00
2024-09-15,12:11,life,ライフ,38,まいどなニュース,「ヴィレヴァンはいつでも君の味方だよ」大幅赤字と店舗閉鎖で窮地のサブカル聖地、全店舗をまわる愛好者が語る「人生を救ってくれた居場所」への思い,13,https://news.yahoo.co.jp/articles/0ba42d342d23c15fddfe4fd16e5e60f71fc62b8a,9/15(日) 7:30
2024-09-15,12:11,life,ライフ,39,現代ビジネス,嫁の不妊で暴走する姑！衣服を脱がされての受胎儀式に、真冬の妊活滝行…キレた嫁が取った「まさかの行動」,12,https://news.yahoo.co.jp/articles/4443acc59e1603b7f467fec340723e0afbc4f42a,9/15(日) 8:35
2024-09-15,12:11,life,ライフ,40,ファイナンシャルフィールド,子どもが3人だと「所得制限なし」で「大学無償化」の恩恵を受けられると聞きました。年収700万円ですが、“大学進学費用”は貯めなくて問題ないでしょうか…？,12,https://news.yahoo.co.jp/articles/d4d49090480bc5673fba55e42febf300158ec897,9/14(土) 13:30
