scrp_date,scrp_time,genre_en,genre_jp,rank,media_jp,title,comment,link,date_original
2024-09-15,15:08,local,地域,1,神戸新聞NEXT,兵庫県議会の全議員の辞職要求に「公務を一日一日やっていく」　斎藤知事、改めて辞職否定,425,https://news.yahoo.co.jp/articles/ecf280101f3fe36dabbc16af26aec0285b23e946,9/14(土) 20:04
2024-09-15,15:08,local,地域,2,STVニュース北海道,「まずいコメの産地」から躍進！　北海道米が全国に認められるようになったワケ　コメ高騰続くなか今年の収穫は？,95,https://news.yahoo.co.jp/articles/a53c3e4c35f91e8d1d10a6c820697e8351699b81,9/15(日) 9:15
2024-09-15,15:08,local,地域,3,MRO北陸放送,秋篠宮妃紀子さま 被災地で健康診断の準備を手伝われる　石川県珠洲市を視察,57,https://news.yahoo.co.jp/articles/1fd01f2d15a1ffd3fd415a36762c5f727265996b,9/15(日) 13:02
2024-09-15,15:08,local,地域,4,MRO北陸放送,"""字が書けない""少女「罪悪感で学校にいけない」講演で訴えた心の内…プロ並みのミシン技で前向きに生きる",56,https://news.yahoo.co.jp/articles/fe90770c740465930a8ada19120d9c3976902a44,9/15(日) 9:02
2024-09-15,15:08,local,地域,5,TNCテレビ西日本,車３台が絡む事故で運転席が大破　１９歳男性が死亡　同乗の１５歳女子高校生も病院搬送　「追い越し禁止」の県道で対向車線にはみ出したか　福岡・筑紫野市,51,https://news.yahoo.co.jp/articles/b2291228d7a2350086c10d095452c6380e65ff1d,9/15(日) 10:35
2024-09-15,15:08,local,地域,6,中京テレビＮＥＷＳ,「性行為がしたかった」…男子高校生（18）を強要未遂の疑いで逮捕　女性（16）に「性交に応じなければ写真を拡散する」と脅迫か　三重,34,https://news.yahoo.co.jp/articles/b0af7d02a16e1fc308a12f3768502867b8985d74,9/15(日) 2:07
2024-09-15,15:08,local,地域,7,テレビ金沢,秋篠宮妃紀子さま　石川・珠洲市の結核予防検診会場を視察,34,https://news.yahoo.co.jp/articles/6ea51c899f04c9739ca326912a168d0e9ca747cd,9/15(日) 12:32
2024-09-15,15:08,local,地域,8,HBCニュース北海道,速報　道央自動車道で、札幌⇒新千歳空港の高速バスが炎上…乗客と乗員13人は避難してけがなし、恵庭IC⇔北広島ICが約７時間通行止めに　走行中にエンジン付近から出火,32,https://news.yahoo.co.jp/articles/844035e125b7092b1493d0f3ed3bc09b682555f8,9/14(土) 17:29
2024-09-15,15:08,local,地域,9,関西テレビ,男性に因縁つけ「マセラティ」を不正契約させた疑い　逮捕された男「預かって乗っていただけ」,32,https://news.yahoo.co.jp/articles/67bb3f1f0b205ad10ab21abacb93757c036d077d,9/15(日) 12:41
2024-09-15,15:08,local,地域,10,琉球新報,安和のダンプ台数1日1100超に急増　6月の事故前は600台　辺野古新基地　沖縄,27,https://news.yahoo.co.jp/articles/7303f4d586956e2020c0da347ad92ca75a0a047b,9/15(日) 14:00
2024-09-15,15:08,local,地域,11,ABCニュース,バイクに追突した車が逃走　５０歳男性重傷　ドラレコなどから行方追う　神戸淡路鳴門自動車道,24,https://news.yahoo.co.jp/articles/7cc2773041c2e852dbc0ee83389b916d4dba62a1,9/15(日) 12:49
2024-09-15,15:08,local,地域,12,HBCニュース北海道,缶入りアルコールを手に「酒を飲みながら車を運転している男がいる」目撃したドライバ―が通報　呼気検査で基準値２倍超、50歳の男「納得がいかない」,24,https://news.yahoo.co.jp/articles/b5df1c62d14d6dcc9e9d71feafa214ce22b494f3,9/15(日) 9:33
2024-09-15,15:08,local,地域,13,九州朝日放送,軽ワゴン車と貨物車が正面衝突　１９歳男性が死亡,22,https://news.yahoo.co.jp/articles/38094d379989ded5926561ea1b13b3671200bce0,9/15(日) 12:45
2024-09-15,15:08,local,地域,14,UTYテレビ山梨,市長選の期日前投票所で選挙権のない10代の男子生徒に投票用紙を誤って交付　男子生徒は投票　山梨・甲斐市,20,https://news.yahoo.co.jp/articles/6c0c807924f5aa1b1b35909c0a1053e02313c77f,9/15(日) 12:44
2024-09-15,15:08,local,地域,15,RKB毎日放送,追い越し中に正面衝突　車3台絡む事故で男性が死亡,19,https://news.yahoo.co.jp/articles/59bd768882e74d601b11d9a48305fcf33f9e7ecf,9/15(日) 2:06
2024-09-15,15:08,local,地域,16,FBS福岡放送,タクシー運転手が飲酒運転の疑いで現行犯逮捕 信号停車の車に追突事故,19,https://news.yahoo.co.jp/articles/a3d6cc5e6afe8707da139f547690a9188a79ce55,9/15(日) 9:13
2024-09-15,15:08,local,地域,17,HBCニュース北海道,「お金がないと言っている」そば店でサバみそ煮と日本酒３杯“無銭飲食”所持金０円の70歳男「お金を持っていないことを言わずに飲み食いした」札幌市北区,18,https://news.yahoo.co.jp/articles/1440994d63f17123645c3e1d30e1c89d63dc596d,9/15(日) 11:09
2024-09-15,15:08,local,地域,18,佐賀ニュース サガテレビ,休暇中の警察官が取り押さえ 女性の下着や身体の撮影目的でスマホ向けた53歳男逮捕【佐賀県】,17,https://news.yahoo.co.jp/articles/80ec4c7e039e33c7af4f0df48cc993f17f752fb0,9/15(日) 13:56
2024-09-15,15:08,local,地域,19,南日本新聞,県内産米も順調に生育、購入制限や品切れもあるけれど…「買い急がないで」　新米の価格上昇予想にも農家は理解を求める「ここ1、2年が安すぎた」　鹿児島県内,17,https://news.yahoo.co.jp/articles/681ba3b1cba539178b59151ab94b99c4282a15b5,9/15(日) 11:23
2024-09-15,15:08,local,地域,20,TOSテレビ大分,globe KEIKO（５２）「ついに復活した最強の歌姫」わずか「２秒」の歌声が心掴む,15,https://news.yahoo.co.jp/articles/23ae49b8b3b81b5edbccb47554e3a773af35474b,9/14(土) 21:00
2024-09-15,15:08,local,地域,21,北海道ニュースUHB,「助かったのかな？」「熱い！」高速道路で突然の大型バス炎上…現場通りがかったドライバーも不安と心配 乗客・乗員13人は全員避難し無事 運転手が走行中に異変 北海道恵庭市,15,https://news.yahoo.co.jp/articles/f575d379b6ea333c04b7db1738b8a80dbd288543,9/14(土) 21:25
2024-09-15,15:08,local,地域,22,RKB毎日放送,本人が追突事故を通報するもろれつ回らず…タクシー運転手が酒気帯び運転の疑いで逮捕　福岡県内で2人が飲酒運転で逮捕,15,https://news.yahoo.co.jp/articles/f2284a4ba3b93ba001aeb318e0d2616e296e9575,9/15(日) 12:02
2024-09-15,15:08,local,地域,23,RBC琉球放送,有名ラッパーの下田ムトアリッキー容疑者が暴行容疑で逮捕　逮捕状を示される様子を自身のSNSでライブ配信　沖縄,14,https://news.yahoo.co.jp/articles/7872aa436ebfcc621c082d6d0e8ff55373d2e682,9/14(土) 22:34
2024-09-15,15:08,local,地域,24,MBSニュース,ペット火葬を業者が“強行”　民家の約20m先に建設された『火葬場』...営業条件の協議中に火葬が行われ周辺住民は不信感「傍若無人、やりたい放題」,13,https://news.yahoo.co.jp/articles/b7d9c1fb06dae7c6f7d8406bf3f3864b762199f9,9/15(日) 14:00
2024-09-15,15:08,local,地域,25,ＢＳＮ新潟放送,関東甲信では15日昼過ぎから16日にかけて“バケツをひっくり返したような”激しい雷雨か　“警報級大雨”の恐れも【16日午後9時までの雨風シミュレーション・15日午前11時半更新】,13,https://news.yahoo.co.jp/articles/4f1aa177d334d0a8cf76f8884bf8b62a75e21238,9/15(日) 11:53
2024-09-15,15:08,local,地域,26,カナロコ by 神奈川新聞,川崎の国道交差点で新聞配達のバイクと乗用車が事故、配達員が死亡,13,https://news.yahoo.co.jp/articles/dbf4fd0c515509c48af06b1994a0229af29a1ab3,9/15(日) 10:50
2024-09-15,15:08,local,地域,27,読売新聞オンライン,女性職員との会食で体触る、熊本市消防局副課長を戒告処分,13,https://news.yahoo.co.jp/articles/7cd4d9ea5b7c0ded1ab63e92bd67db12d593fc34,9/15(日) 13:08
2024-09-15,15:08,local,地域,28,北海道ニュースUHB,"「酒を飲みながら車を運転している」通報した目撃者が追跡…車内に""チューハイの缶""も 基準の2倍超アルコール検出し50歳男逮捕も否認 北海道札幌市",13,https://news.yahoo.co.jp/articles/0481c697f068044330678d0fb1e51971f3fa5893,9/15(日) 13:15
2024-09-15,15:08,local,地域,29,北海道新聞,「やばい」「降りましょう」　北海道・道央自動車道バス炎上　全員避難直後　何度も爆発音,13,https://news.yahoo.co.jp/articles/a39c465be314e01f3aa0a9ef85ca67550d219f39,9/14(土) 23:54
2024-09-15,15:08,local,地域,30,BSS山陰放送,「ウチの嫁」で炎上も…配偶者の呼び方にモヤモヤ　専門家「過去25年で大きく変化」　他人の配偶者はどう呼べばいい?「奥様・ご主人」も失礼?,12,https://news.yahoo.co.jp/articles/9f366935901485e89042ea4abc7e7e1149b4461a,9/15(日) 7:04
2024-09-15,15:08,local,地域,31,沖縄ニュースQAB,玉城知事訪米　国連事務次長と面談,12,https://news.yahoo.co.jp/articles/ac8ae0f250a946f93eb7eaf360b57922cd227d1c,9/15(日) 12:21
2024-09-15,15:08,local,地域,32,ABCニュース,アプリで知り合った相手から投資話　５０代男性が暗号資産１億２０００万円相当だまし取られる　兵庫,12,https://news.yahoo.co.jp/articles/09ddd246ae67f3de33154e2973c6a2813d4d571a,9/14(土) 16:31
2024-09-15,15:08,local,地域,33,千葉日報オンライン,警備員、巡回中に現金30万円盗む　千葉県内の高校職員室で　千葉北署、窃盗容疑で逮捕,11,https://news.yahoo.co.jp/articles/8fc38308de237a0c87914a700cbc5ba92fc7c714,9/15(日) 8:03
2024-09-15,15:08,local,地域,34,福島中央テレビ,バイクでツーリング中　カーブで標識に衝突　男性が重傷　福島,11,https://news.yahoo.co.jp/articles/37057b7f350ba0c3c1554946303f3e93ee7c8f85,9/15(日) 11:34
2024-09-15,15:08,local,地域,35,tbc東北放送,【速報】「はしご乗り」披露中　5メートルから消防団員の男性落下しけが　宮城・利府町,10,https://news.yahoo.co.jp/articles/8464b10814c0ea35a1128b8b5ad9709b84aa9b19,9/15(日) 12:02
2024-09-15,15:08,local,地域,36,TKUテレビ熊本,熊本市の路上で女性の胸を触った疑い 男逮捕,10,https://news.yahoo.co.jp/articles/c7cfabd804076dbe95af0df05e69f20f6e5c9c89,9/15(日) 12:41
2024-09-15,15:08,local,地域,37,九州朝日放送,タクシー運転手が“飲酒運転”　５４歳の男を現行犯逮捕,10,https://news.yahoo.co.jp/articles/ba85537d43cdfb39dba79b4723e968ec28d16dd2,9/15(日) 12:45
2024-09-15,15:08,local,地域,38,RKK熊本放送,熊本市で車同士が正面衝突　69歳女性が死亡,9,https://news.yahoo.co.jp/articles/38ddb0a2a7b7ac2db500c0a989ef770e4eb02d50,9/15(日) 11:58
2024-09-15,15:08,local,地域,39,長崎新聞,なぜ北にあるのに「西」？　佐世保西高の校名の理由…絡み合った場所と名付けの事情　長崎,9,https://news.yahoo.co.jp/articles/df9c4b14a97841f5eea5c839c0b6732d63abd2f6,9/15(日) 12:00
2024-09-15,15:08,local,地域,40,HBCニュース北海道,警察官を名乗る男から「あなたから口座を売却してもらったと供述」と電話、検察官を名乗る男「振り込まなければ、逮捕する」信じた50代女性が約38万詐取被害,9,https://news.yahoo.co.jp/articles/422d31a6586ac5303150776fb0e28fcdb353409d,9/15(日) 11:32
