scrp_date,scrp_time,genre_en,genre_jp,rank,media_jp,title,comment,link,date_original
2025-07-05,02:07,business,経済,1,共同通信,関税通知「よく分からず」　米大統領発言で赤沢氏,352,https://news.yahoo.co.jp/articles/0544b64f561d720a00d3b8bf210a327d7b7feb51,7/4(金) 18:51
2025-07-05,02:07,business,経済,2,TBS CROSS DIG with Bloomberg,離乳食の「口移し」に、乳児の「日光浴」　変わる子育ての“正解”　世代ごとの「育児観ギャップ」の乗り越え方,57,https://news.yahoo.co.jp/articles/4d0265e6ea2ca3da07a9279398ae07808de688dc,7/4(金) 8:13
2025-07-05,02:07,business,経済,3,共同通信,コメ価格、先安観強まる　備蓄米効果で指数の下落幅最大,48,https://news.yahoo.co.jp/articles/567ac3ba89946bf127195214bfe55236a259ced0,7/4(金) 10:47
2025-07-05,02:07,business,経済,4,テレビ朝日系（ANN）,日本の温泉“そのもの”を海外へ輸出する挑戦　成分を濃縮して輸送可能に,42,https://news.yahoo.co.jp/articles/8efd3ef338c736ce42353b93e1e90368939d607b,7/4(金) 11:32
2025-07-05,02:07,business,経済,5,FNNプライムオンライン（フジテレビ系）,企業の4割が50〜60代に“人材過剰感”　「本人のモチベーション低下」「生産性の低さ」「生産性に見合わない処遇水準の高さ」が主な理由,39,https://news.yahoo.co.jp/articles/d0bac20ccd008c988dfc32cd5a268efe6cbc0c68,7/5(土) 0:49
2025-07-05,02:07,business,経済,6,WWDJAPAN.com,「ローラ メルシエ」日本市場から撤退　10月末までに全店舗とECでの販売終了,34,https://news.yahoo.co.jp/articles/619441911925173be027cd83e78a69b00f23daa6,7/4(金) 11:40
2025-07-05,02:07,business,経済,7,ファイナンシャルフィールド,車体の大きい「レクサス LX」だとマンションの駐車場に停められないことが判明！ すでにお金を支払ってしまったのですが「返金」できるでしょうか？,24,https://news.yahoo.co.jp/articles/d97c36e335359fa678018636d808ed92ceae78c9,7/4(金) 11:10
2025-07-05,02:07,business,経済,8,MONEY PLUS,しまむら、三陽商会、アダストリア…明暗分かれたアパレル決算、しまむらだけが株価上昇した理由とは？,24,https://news.yahoo.co.jp/articles/cd3727fd58307d904824e1e69025afd734e81381,7/4(金) 7:30
2025-07-05,02:07,business,経済,9,WWDJAPAN.com,「ラブブ」旋風はビューティ業界にも広がるか？　コラボの行方に注目集まる,24,https://news.yahoo.co.jp/articles/eeb00613c87d2eb2d07130838e4a6e66e247a127,7/4(金) 15:00
2025-07-05,02:07,business,経済,10,共同通信,FGT試験設備、撤去完了　既に500億円投入,22,https://news.yahoo.co.jp/articles/2607eda4221c4171be42427b94a099442df67009,7/4(金) 20:36
2025-07-05,02:07,business,経済,11,LIMO,夏のボーナス「国家公務員」は前年比約5万円アップ「約70万円」に！石破総理は「返納後392万円」に…,21,https://news.yahoo.co.jp/articles/ecdec7e643697bee85dc0ad9459596650c5ac02a,7/4(金) 14:52
2025-07-05,02:07,business,経済,12,東洋経済オンライン,卒業ではなく除籍も「公職選挙法上は問題ない」と主張…《学歴詐称？》静岡県伊東市・田久保真紀市長の弁解が大問題である理由,19,https://news.yahoo.co.jp/articles/81e820659fefa9e07eb318b040db2e7f8c00d28f,7/4(金) 16:06
2025-07-05,02:07,business,経済,13,MotorFan,いまなら3ヵ月で納車可能。日産フェアレディZ（6MT）は”最後の純エンジンスポーツカー”が欲しい人に最高の一台,18,https://news.yahoo.co.jp/articles/93896a60ba9265dbc2c42686e15af4545b88a67d,7/4(金) 14:24
2025-07-05,02:07,business,経済,14,東洋経済オンライン,「日本車からテスラ、そしてサイバートラックへ」アメリカで起きているEVシフト加速の現実,18,https://news.yahoo.co.jp/articles/1c0cacec6b1cce9327dbb587d6e972e59896bd97,7/4(金) 14:02
2025-07-05,02:07,business,経済,15,ベストカーWeb,日産 新型エルグランドの発表は嬉しいけど…… 他にも「日産の本気」を見せてほしいクルマはある!!,18,https://news.yahoo.co.jp/articles/46532ed189e8006cfe5893bac2200d9665717c8a,7/4(金) 21:30
2025-07-05,02:07,business,経済,16,朝日新聞,守勢に立つ日本、期限前の訪米も立ち消えに　米側からの書簡は…,17,https://news.yahoo.co.jp/articles/f6b5188f2d66f56f7e7a2da7664d140976117eb5,7/4(金) 20:50
2025-07-05,02:07,business,経済,17,ファイナンシャルフィールド,15年前の「ミニバン」に乗り続け、自動車税は「年5万1700円」車検も毎回「20万円」超に！ 夫婦2人だけなら、もう“軽自動車”に乗りかえたほうがお得？ 維持費を比較,17,https://news.yahoo.co.jp/articles/0172de328e9ce88222fd49470406d0f1dac7b06d,7/4(金) 13:40
2025-07-05,02:07,business,経済,18,マネーポストWEB,【法律相談】「不審者扱いはひどい！」旅費節約のために公園の駐車場で車中泊しようとしたら警察から尋問を受け移動命令…　公園の利用規約に違反していなくてもダメなのか？弁護士が解説,16,https://news.yahoo.co.jp/articles/836d702b818d7514944f228583a689b52d3c8107,7/4(金) 16:15
2025-07-05,02:07,business,経済,19,東洋経済オンライン,「“教師だらけ”の児童盗撮グループ」に戦慄…全国で相次ぐ性暴力事件に《現役教師が吐露した本音》と危うさ,16,https://news.yahoo.co.jp/articles/8b3b1b4c8f1c569a73e1633d8db3f6d29ca79c5b,7/4(金) 17:11
2025-07-05,02:07,business,経済,20,ベストカーWeb,久々にトヨタからミドシップ復活か!! 新型セリカはMRの400馬力級スーパーカーに!? 予想全高約1.2mの低すぎデザインがカッコいい!,14,https://news.yahoo.co.jp/articles/aa7b4891be3ce52761788f5acac0711e3c6f2b2e,7/4(金) 20:00
2025-07-05,02:07,business,経済,21,東洋経済オンライン,もう「中小企業が潰れる」は通用しない！　“最低賃金の引き上げ”は減税よりも効果的な経済政策だ,14,https://news.yahoo.co.jp/articles/67df1f617705b6cfdf3609c6a614c2a1155e156f,7/4(金) 8:17
2025-07-05,02:07,business,経済,22,みんかぶマガジン,「参院選で政権交代も起こり得る」都議選で歴史的大敗の石破政権、岸田前首相からの発言…「立民との大連立も」想定される3つの末路「消費減税は否定」,14,https://news.yahoo.co.jp/articles/1cde62abf6ff9e7d1fc19456058e0ba3a752caa1,7/4(金) 9:10
2025-07-05,02:07,business,経済,23,テレビ朝日系（ANN）,“国債が売れない”５・２０ショックの波紋　財政赤字の先に潜む「時限爆弾」【数字でわかる今の日本】,14,https://news.yahoo.co.jp/articles/ee9add7400e7b29dad87d815c29d6ec9e444a09c,7/4(金) 9:12
2025-07-05,02:07,business,経済,24,ベストカーWeb,いったい彼らに何が起きた!? 人気軽自動車3モデルの販売台数が揃って前年比割れ!!,13,https://news.yahoo.co.jp/articles/73881d3110effc0f1a830f85ce8c818d84525d02,7/4(金) 21:00
2025-07-05,02:07,business,経済,25,LIMO,【年代別】みんなが「老後資金として貯めている額」はいくら？「5000万円以上」が50歳代では16.9%、60歳代以上では25.4%に。シニア世帯のリアルなマネー事情を深掘り,11,https://news.yahoo.co.jp/articles/da0a2fa09f3f2331e7bf8ac49649aac72de80637,7/4(金) 6:47
2025-07-05,02:07,business,経済,26,ファイナンシャルフィールド,日本は手取りが少なすぎる!? 年収1000万円のときの手取りはどれくらい？ 日本の「国民負担率」や諸外国の税率の特徴は？,11,https://news.yahoo.co.jp/articles/937229efe264faa3f9e30f6e8c010333119f2132,7/4(金) 18:50
2025-07-05,02:07,business,経済,27,くるまのニュース,なぜ…？「停止線のかなり手前」に止まるクルマの“謎”！「スペース空けすぎ…」「前に詰めて！」と気になるけど理由があった！ 一方で「信号が変わらなくなる」トラブルも!?,10,https://news.yahoo.co.jp/articles/4695b1f6e344e49262677cffe0a8e50afdd17397,7/4(金) 15:10
2025-07-05,02:07,business,経済,28,ベストカーWeb,アルファードPHEVはHVよりも183万円高い! いまや軽も250万円! そもそもなんで最近の新車価格は爆上がりしているのか?,10,https://news.yahoo.co.jp/articles/4fd606d4f2920353b4cd93c83a1ea9ed2e6c4be5,7/4(金) 18:30
2025-07-05,02:07,business,経済,29,毎日新聞,トランプ氏、最大70％関税を書簡で通知へ　早期合意できない国対象,10,https://news.yahoo.co.jp/articles/79247567bf2204cb48cd966d7e218edc38a57ad2,7/4(金) 15:19
2025-07-05,02:07,business,経済,30,共同通信,TSMC、熊本第2工場建設延期と米紙,9,https://news.yahoo.co.jp/articles/216a634a9cc784e07b10d0b4080fb0f5be4815a2,7/4(金) 19:04
2025-07-05,02:07,business,経済,31,共同通信,TSMC、熊本工場建設遅れか　米紙「米優先で同盟国犠牲」,9,https://news.yahoo.co.jp/articles/7b818051dff3741708e8a78930c9383f0a622c1a,7/4(金) 19:39
2025-07-05,02:07,business,経済,32,ファイナンシャルフィールド,「残業なんてコスパ悪い」と定時退社する息子。最近の若者は“残業”を嫌う傾向に？ コスパではかれない残業の“メリット”とは,9,https://news.yahoo.co.jp/articles/c243c46f1427b2b6e368ed4ed3acd17746d99105,7/4(金) 13:30
2025-07-05,02:07,business,経済,33,THE GOLD ONLINE（ゴールドオンライン）,手取り収入、夫婦合わせて「月48万円」だが…「日本人の暮らしぶり」厳しい現実,9,https://news.yahoo.co.jp/articles/6af3b897decf2e0c992e61790a2087366717ab51,7/4(金) 13:02
2025-07-05,02:07,business,経済,34,ダイヤモンド・オンライン,「あの人、たぶん出世するな」と思われる人の行動・ベスト1,8,https://news.yahoo.co.jp/articles/62741c6bccea5118a7aa619699cd490dc90357d6,7/4(金) 6:26
2025-07-05,02:07,business,経済,35,ENGINE WEB,最大航続距離は1200km！　新世代e-パワー搭載の日産キャシュカイ現る　日本では次期エルグランドに搭載予定,8,https://news.yahoo.co.jp/articles/49df927c0618e6d13936b53a495594088aceeb3c,7/4(金) 17:10
2025-07-05,02:07,business,経済,36,ビジネス＋IT,世界で進む原子力「３倍増」、電力需要爆増のAI時代に日本が下すべき「決断」とは,8,https://news.yahoo.co.jp/articles/7be2853891b0af9f672ddda5c91ae22942f62468,7/4(金) 6:50
2025-07-05,02:07,business,経済,37,読売新聞オンライン,トランプ氏、関税率「１０～７０％」…対象国に書簡送付へ,8,https://news.yahoo.co.jp/articles/13b166753d58011bd390a35effd86a0ed704186a,7/4(金) 15:06
2025-07-05,02:07,business,経済,38,Aviation Wire,保安検査、空港管理者が主体に　26年度から先行事例、年度内に行程表＝中間とりまとめ,8,https://news.yahoo.co.jp/articles/0839f154be8640b3be448b4ac53a4493ad1a061b,7/4(金) 16:38
2025-07-05,02:07,business,経済,39,読売新聞オンライン,関税率を通知する書簡、トランプ氏が４日から各国送付の考え…日本には３０％か３５％の可能性示唆,8,https://news.yahoo.co.jp/articles/5088a24fc3f72e7c0227d0ae1e9910664fd4a140,7/4(金) 10:16
2025-07-05,02:07,business,経済,40,共同通信,通知する米関税率10～70％とトランプ氏,8,https://news.yahoo.co.jp/articles/119fb3e7dc633403200e7f798521aa0ba738bf5d,7/4(金) 14:40
