scrp_date,scrp_time,genre_en,genre_jp,rank,media_jp,title,comment,link,date_original
2026-01-26,21:17,TTL,総合,1,日テレNEWS NNN,中国政府、春節前に日本への渡航自粛呼びかけ　経済的威圧の一環か,2094,https://news.yahoo.co.jp/articles/dca59ae7cd64979f12adb31826484f3e3cc8cef1,1/26(月) 19:15
2026-01-26,21:17,TTL,総合,2,女性自身,「国民生活ぶっ壊れてますよね？」れいわ・大石晃子氏　党首討論会で高市政権を猛批判「ルールを守って」制止を聞かずにネット騒然,665,https://news.yahoo.co.jp/articles/3d5d85e6dd09507cf563bde6ceee0fe90bf0c0b7,1/26(月) 18:42
2026-01-26,21:17,TTL,総合,3,女性自身,「民意ガン無視のファシスト」女性シンガー（31） 高市首相の衆議院解散へのコメントに賛否…昨年は参政党・さや氏を批判する楽曲も,391,https://news.yahoo.co.jp/articles/23c33cdd4d9eb6eb52ab9beb7696617caa1869ba,1/26(月) 19:45
2026-01-26,21:17,TTL,総合,4,ABEMA TIMES,れいわ・大石共同代表が「70秒オーバー」の大暴走 「今日、涙で目が腫れちゃってる」「全てがフィクション」…党首討論会で司会者無視 参政・神谷代表も呆れて？「2秒」凝視,382,https://news.yahoo.co.jp/articles/d126e1674d8e2edcc2e0e62b4963ac1cc056a5a5,1/26(月) 14:48
2026-01-26,21:17,TTL,総合,5,毎日新聞,高市首相「早くからプロポーズ」　選挙後の連立巡り、国民民主に秋波,344,https://news.yahoo.co.jp/articles/1bc9af3ef1dac14d978a9d3d187987ac1a35c2c8,1/26(月) 15:26
2026-01-26,21:17,TTL,総合,6,ABEMA TIMES,「共産党はなぜこんなに“凋落”してしまったのか？」「この20年、共産党が“端っこ”に座っているという記憶がない」記者からの厳しすぎる質問に田村委員長の回答は？,340,https://news.yahoo.co.jp/articles/b38875a529be9ac0a79565b9464ff282e9bf2396,1/26(月) 17:42
2026-01-26,21:17,TTL,総合,7,ABEMA TIMES,れいわ・大石共同代表の“暴走”に高市総理も「目を見開いて」ビックリ！ 司会者無視し「私は、子どもを戦争に送るために産んだんじゃない」党首討論会で主張止まらず,280,https://news.yahoo.co.jp/articles/60d2f2098e7ce50185415cad14246330e3906b29,1/26(月) 16:15
2026-01-26,21:17,TTL,総合,8,デイリースポーツ,【高市解散】高市首相が逃げ道ない約束「自民負けたら即刻、退陣します」党首討論の終了間際にブチ込む　野党５党首の前で「つまり自民維新で過半数取れなかったら」→総理辞めると,278,https://news.yahoo.co.jp/articles/9253935b21ff27eb988b52fb24b3338fed9fc984,1/26(月) 15:23
2026-01-26,21:17,TTL,総合,9,FNNプライムオンライン（フジテレビ系）,冬の富士山に“無謀登山”の中国人男性を命懸けの救助　「登山道閉鎖中」は認識　専門家「危ないどころか自殺行為」,258,https://news.yahoo.co.jp/articles/fd3a618ad4fda8b53c3be3a325420bb1f8e13f9d,1/26(月) 19:37
2026-01-26,21:17,TTL,総合,10,J-CASTニュース,公衆電話に大量ガーベラ、「チェンソーマン」余波か　NTT東日本は胸中複雑「配慮」求める,256,https://news.yahoo.co.jp/articles/3d80ee6ac755873055b09b32a926368fb4121fb8,1/26(月) 18:24
2026-01-26,21:17,TTL,総合,11,共同通信,X、70アカウントが組織的拡散　特徴共通、世論介入か,238,https://news.yahoo.co.jp/articles/d13f6d06e3f51085eb34b66c6f12bc7502318b44,1/26(月) 17:09
2026-01-26,21:17,TTL,総合,12,スポニチアネックス,モデル伊原葵　結婚を発表「We got married」　芸能界からも反響　辺見えみりらが祝福,236,https://news.yahoo.co.jp/articles/51e723737a747752ab8151f8de3da19633753357,1/26(月) 20:07
2026-01-26,21:17,TTL,総合,13,デイリースポーツ,【高市解散】ネット大荒れ「司会者ガン無視」「支離滅裂」「壊れてる」　党首討論→れいわ大石晃子代表が時間ルール無視で毎回演説　「質問時間要らないから言わせて！」→直後に超長い質問→司会者が何度も注意「時間泥棒」「大丈夫か？」,227,https://news.yahoo.co.jp/articles/3cb389bc7b80f73368d630546204d5cab0aa104d,1/26(月) 19:32
2026-01-26,21:17,TTL,総合,14,TBS NEWS DIG Powered by JNN,山本由伸らWBC代表メンバー10人を追加発表　岡本和真、村上宗隆らメジャー組選出、全30人まであと1人決まらず【一覧】,214,https://news.yahoo.co.jp/articles/5459d30d9d4f07ab620a22ac036c442259b2e9d7,1/26(月) 14:08
2026-01-26,21:17,TTL,総合,15,テレビ朝日系（ANN）,ANN世論調査　この時期の衆院選「よくない」6割,213,https://news.yahoo.co.jp/articles/0e8c9b110ef2f166d5b648ac1392c957f9879346,1/26(月) 5:50
2026-01-26,21:17,TTL,総合,16,東洋経済オンライン,連合がついに抗議書を提出、玉木・国民民主党“強気の105人擁立”がもたらす「党勢拡大」の危うい代償,212,https://news.yahoo.co.jp/articles/95c11ee9b3b179822448f52daf4e3c9fd0021b20,1/26(月) 15:30
2026-01-26,21:17,TTL,総合,17,ピンズバNEWS,【ナイトスクープ“ヤングケアラー”炎上】VTR「最後の7秒」と「せいやの振舞い」を元キー局Pが解説,212,https://news.yahoo.co.jp/articles/396e3675f3ea40fbca8b2fa98c48ac6ecce3671c,1/26(月) 14:15
2026-01-26,21:17,TTL,総合,18,産経新聞,「中道」の野田佳彦氏、統一教会関係者との写真報道に「全く記憶にない。調査する」,203,https://news.yahoo.co.jp/articles/4077647949d3ecd14276cb14de94bdea1a3af6b3,1/26(月) 10:32
2026-01-26,21:17,TTL,総合,19,日刊スポーツ,れいわ大石晃子氏、時間超過大暴走で「違う意味でMVP」「クセ強」「お笑い担当？」Ｘトレンド,194,https://news.yahoo.co.jp/articles/ecb429191ff4934b8afc1bffffa23fbcacd4bb02,1/26(月) 17:19
2026-01-26,21:17,TTL,総合,20,中国新聞デジタル,水筒でおなかを強打、内臓を損傷し緊急手術　各地で事故の報告、臓器を摘出したケースも,182,https://news.yahoo.co.jp/articles/375e177f938d756c2e108283a4ff80cfcb457268,1/26(月) 10:14
2026-01-26,21:17,TTL,総合,21,デイリースポーツ,【高市解散】党首討論、冒頭から荒れる　れいわ・大石晃子代表が時間ルール無視して強行発言　司会者が「ルール守って」４回制止も続行　「言わして」「私、泣き腫らして目腫れてるんです」,180,https://news.yahoo.co.jp/articles/75875066857f48e072e5f31f79140ec9bec6469a,1/26(月) 14:56
2026-01-26,21:17,TTL,総合,22,読売新聞オンライン,高市内閣の支持率６９％で高水準維持、衆院解散「評価しない」５２％…読売世論調査,176,https://news.yahoo.co.jp/articles/1bd1093ba1227440896e0866908be8c2afb801bc,1/25(日) 22:00
2026-01-26,21:17,TTL,総合,23,集英社オンライン,〈中道大混乱〉「池田大作先生の政治論を読ませて頂いた…」学会票にすがる野田代表と「原発について答えろ！」“共産・社民支持者”に詰められタジタジの立憲議員〈集会ルポ〉,175,https://news.yahoo.co.jp/articles/60930b504cf15d135d1780562cd780b9d0c3ae9c,1/26(月) 18:03
2026-01-26,21:17,TTL,総合,24,日刊スポーツ,れいわ大石晃子氏に「ルールを守って」日本記者クラブ党首討論の冒頭発言で持ち時間超え主張,168,https://news.yahoo.co.jp/articles/321f107f8d610ead069013d77cb0bcdc4adb5979,1/26(月) 14:31
2026-01-26,21:17,TTL,総合,25,AERA DIGITAL,新党「中道改革連合」の基本政策が「A判定」の理由　あえて“玉虫色”の文言で野党分裂を防ぎ高市政権を倒す覚悟をみた　古賀茂明,165,https://news.yahoo.co.jp/articles/db63a23521be3919dd53788109befd851b2fb2fc,1/26(月) 18:30
2026-01-26,21:17,TTL,総合,26,デイリースポーツ,【高市解散】すでに２３日に解散したが…れいわ大石氏「今すぐにでも解散をやめて」に高市総理「今からやめることはできません」,165,https://news.yahoo.co.jp/articles/8e82fe1b36cc56dabb27bf694a372b9bd3c23236,1/26(月) 16:30
2026-01-26,21:17,TTL,総合,27,産経新聞,「山本太郎代表が戻るまで戦い抜く、移民政策は反対だ」　れいわ新選組・高井崇志幹事長　衆院選2026　党首に聞く,159,https://news.yahoo.co.jp/articles/f9f6ef7c0675079b7b3177b95b6261cebec2d85c,1/26(月) 20:02
2026-01-26,21:17,TTL,総合,28,スポニチアネックス,ABCテレビ　探偵!ナイトスクープ“ヤングケアラー”炎上回に異例の声明　Tverも配信停止,153,https://news.yahoo.co.jp/articles/ecb7537d3166429641729f94b8c9a92de53d0987,1/25(日) 21:26
2026-01-26,21:17,TTL,総合,29,テレビ静岡NEWS,中国人男性が冬の富士山で無謀な登山　転倒し救助要請　登山歴は“初心者同然”　静岡県警が警鐘「スリップすると一瞬で滑落する可能性あり」　法律で冬場は登山道の通行が禁止となる中で,150,https://news.yahoo.co.jp/articles/feea7bdf4bfb8a293b8cd646bb321b7acabeae73,1/26(月) 19:46
2026-01-26,21:17,TTL,総合,30,NEWSポストセブン,ラブホ密会辞任の小川晶氏、前橋市長選に再選　オバ記者が気になったのは“やたら支持者とハグしていたこと”「地方の年配者は“オレに抱きついてきた”と勘違いしないかしら」,150,https://news.yahoo.co.jp/articles/4840676fd0eafa17f90f7757b5df6fd260fe1508,1/26(月) 16:15
2026-01-26,21:17,TTL,総合,31,FNNプライムオンライン（フジテレビ系）,政界引退の菅元首相「維新との約束、実行に移すこと忘れてはならない」　公明“離脱”「大変辛いことであった」と吐露,148,https://news.yahoo.co.jp/articles/daf5b2315ab9a4a1a6c93ce9fe1d9a76e85f84cb,1/26(月) 16:21
2026-01-26,21:17,TTL,総合,32,共同通信,首相、過半数割れで「即刻退陣」　裏金事件、みそぎ済まず,140,https://news.yahoo.co.jp/articles/b552d1ed12b8d16770d229bd804027fe947add90,1/26(月) 18:50
2026-01-26,21:17,TTL,総合,33,毎日新聞,「衆院選より予算成立を優先すべきだ」53％　毎日新聞世論調査,125,https://news.yahoo.co.jp/articles/14db2cc507c3c2e69b7142624ba725a6ba0f4d7c,1/26(月) 5:30
2026-01-26,21:17,TTL,総合,34,ABEMA TIMES,ダブル首長選は国保逃れなどの不祥事隠し？ 記者の直球質問に維新・藤田共同代表の答えは,122,https://news.yahoo.co.jp/articles/f539db8212799b1bc5ba44581463e520c31b0c76,1/26(月) 20:15
2026-01-26,21:17,TTL,総合,35,ABEMA TIMES,衆院選での“公明票”の行方は？創価学会関係者「立憲の過去を容認できないなどのわだかまりがあるのも事実」 ジャーナリスト「“割合”が焦点」,121,https://news.yahoo.co.jp/articles/682fbf9a5f3388d3a109821cd8fe02a4a6ae473d,1/26(月) 17:45
2026-01-26,21:17,TTL,総合,36,J-CASTニュース,「26年間も散々世話になってきた友人に」...小沢一郎氏、自民・麻生氏の「チュウカクレン」発言を批判,118,https://news.yahoo.co.jp/articles/dd264dcc455a237cd904fb8bf87834c0871bcccb,1/26(月) 11:45
2026-01-26,21:17,TTL,総合,37,日刊スポーツ,高市首相「与党で過半数割れば即刻退陣」と明言　支持率下落の不安問われ笑顔で「なりませ～ん」,116,https://news.yahoo.co.jp/articles/dbe5fba4c25a86dd4685ad4a0928a04e1f711030,1/26(月) 20:21
2026-01-26,21:17,TTL,総合,38,TBS NEWS DIG Powered by JNN,新宿・歌舞伎町の「トー横」周辺で少年少女32人を一斉補導　14歳の女子中学生が“オーバードーズ”で救急搬送　別の女子中学生は約600錠の睡眠導入剤所持も　警視庁,116,https://news.yahoo.co.jp/articles/88bb9a50d80a422b49e2ca9ac24373c2a2f3bac7,1/26(月) 12:16
2026-01-26,21:17,TTL,総合,39,女性自身,「非常識」と批判殺到…人気YouTuberが高速道路で“迷惑行為→逆ギレ”　昨年は道路陥没事故の不適切発言で大炎上,115,https://news.yahoo.co.jp/articles/74f3d451f8ab4d65bd910c5f9db54cbea3f0aaec,1/26(月) 17:35
2026-01-26,21:17,TTL,総合,40,日テレNEWS NNN,中道・野田代表、旧統一教会関係者との写真をめぐる報道に「全く覚えていない。調べたい」,113,https://news.yahoo.co.jp/articles/e0f99627aec6d18b8f581d4a396a1459b56efdb2,1/26(月) 18:28
