scrp_date,scrp_time,genre_en,genre_jp,rank,media_jp,title,comment,link,date_original
2024-10-05,14:06,world,国際,1イラン核施設「攻撃すべき」　反対のバイデン氏批判　トランプ氏時事通信10/5(土) 9:02143件/時,時事通信,イラン核施設「攻撃すべき」　反対のバイデン氏批判　トランプ氏,143,https://news.yahoo.co.jp/articles/c503ce18cad804d1671a5988a8bb2eccdf11e4ca,10/5(土) 9:02
2024-10-05,14:06,world,国際,2米大統領、イラン制裁検討　石油施設攻撃は支持せず共同通信10/5(土) 5:20104件/時,共同通信,米大統領、イラン制裁検討　石油施設攻撃は支持せず,104,https://news.yahoo.co.jp/articles/5cc27f36aa8f552f784e70284f2ef43cae835894,10/5(土) 5:20
2024-10-05,14:06,world,国際,39歳少女らにレイプ90件、男に終身刑42回 南アＡＦＰ＝時事10/5(土) 13:0443件/時,ＡＦＰ＝時事,9歳少女らにレイプ90件、男に終身刑42回 南ア,43,https://news.yahoo.co.jp/articles/2ecce01dc411e591a60bed4ab7d16c96b0970b77,10/5(土) 13:04
2024-10-05,14:06,world,国際,4レバノンに戦力配置案浮上　イラン、イスラエルけん制共同通信10/5(土) 5:2833件/時,共同通信,レバノンに戦力配置案浮上　イラン、イスラエルけん制,33,https://news.yahoo.co.jp/articles/ebab17255deff59ee14343fb27596fb7e0b4ce48,10/5(土) 5:28
2024-10-05,14:06,world,国際,5米副大統領候補バンス氏の「司会者への態度」がネットで物議。マイクが途中で切られる場面もBuzzFeed Japan10/5(土) 6:0132件/時,BuzzFeed Japan,米副大統領候補バンス氏の「司会者への態度」がネットで物議。マイクが途中で切られる場面も,32,https://news.yahoo.co.jp/articles/26aaca88d83f90a40a2e6db9a23f29d3c433ac07,10/5(土) 6:01
2024-10-05,14:06,world,国際,6イスラエル軍、ベイルートを重ねて空爆　国際空港近くで大爆発BBC News10/4(金) 14:0231件/時,BBC News,イスラエル軍、ベイルートを重ねて空爆　国際空港近くで大爆発,31,https://news.yahoo.co.jp/articles/f5d3b7c6dc641287693a075ae3661f19a4d99b3d,10/4(金) 14:02
2024-10-05,14:06,world,国際,7米、イスラエルからイラン核施設を標的にしないとの保証得られず　国務省高官が明かすCNN.co.jp10/5(土) 13:3029件/時,CNN.co.jp,米、イスラエルからイラン核施設を標的にしないとの保証得られず　国務省高官が明かす,29,https://news.yahoo.co.jp/articles/b5a60077d9cbcfc4e10636301f0fa3840560897e,10/5(土) 13:30
2024-10-05,14:06,world,国際,8反捕鯨団体創設者の身柄引き渡し、捕鯨問題ではない 岩屋外相ＡＦＰ＝時事10/5(土) 10:1025件/時,ＡＦＰ＝時事,反捕鯨団体創設者の身柄引き渡し、捕鯨問題ではない 岩屋外相,25,https://news.yahoo.co.jp/articles/0ba1b3907b2f818111ea75aaaddc1ee80d12aff0,10/5(土) 10:10
2024-10-05,14:06,world,国際,9石破氏提唱の“アジア版NATO”に海外から冷たい目　日米関係への悪影響、懸念も日テレNEWS NNN10/5(土) 0:5024件/時,日テレNEWS NNN,石破氏提唱の“アジア版NATO”に海外から冷たい目　日米関係への悪影響、懸念も,24,https://news.yahoo.co.jp/articles/619694765729f7ea8aa0bdcebe15b9cccb325dd5,10/5(土) 0:50
2024-10-05,14:06,world,国際,10「腕が触れたから」…４歳の子どもを鼻血が出るまで殴り、年配女性に噛みついた２０代女＝韓国中央日報日本語版10/4(金) 14:3123件/時,中央日報日本語版,「腕が触れたから」…４歳の子どもを鼻血が出るまで殴り、年配女性に噛みついた２０代女＝韓国,23,https://news.yahoo.co.jp/articles/d338179ac0753784a156a50cfcdd87cd1f093a83,10/4(金) 14:31
2024-10-05,14:06,world,国際,11バイデン大統領がサプライズでホワイトハウス記者会見に登場　大統領選が「平和に行われるか分からない」トランプ氏が敗れた場合、結果受け入れない可能性指摘TBS NEWS DIG Powered by JNN10/5(土) 7:3323件/時,TBS NEWS DIG Powered by JNN,バイデン大統領がサプライズでホワイトハウス記者会見に登場　大統領選が「平和に行われるか分からない」トランプ氏が敗れた場合、結果受け入れない可能性指摘,23,https://news.yahoo.co.jp/articles/85570aeac318aec85be9890a301d0ffbdaa663f2,10/5(土) 7:33
2024-10-05,14:06,world,国際,12ロシア軍、「世界最強の非核兵器」を使用か…ハルキウ州での「巨大爆発」動画を公開、ウクライナ側は否定ニューズウィーク日本版10/5(土) 13:0321件/時,ニューズウィーク日本版,ロシア軍、「世界最強の非核兵器」を使用か…ハルキウ州での「巨大爆発」動画を公開、ウクライナ側は否定,21,https://news.yahoo.co.jp/articles/c1cc3631152b13e77b002b23589701d92be41929,10/5(土) 13:03
2024-10-05,14:06,world,国際,131:01ハメネイ師「完全に合法で正当」　イスラエルへの大規模攻撃を正当化FNNプライムオンライン（フジテレビ系）10/5(土) 7:5521件/時,FNNプライムオンライン（フジテレビ系）,ハメネイ師「完全に合法で正当」　イスラエルへの大規模攻撃を正当化,21,https://news.yahoo.co.jp/articles/a4dc6b11a325f1e71d66b43ec2a351021235a92f,10/5(土) 7:55
2024-10-05,14:06,world,国際,141:10米トランプ前大統領、イランの核施設「攻撃すべき」　バイデン大統領はイラン石油施設の攻撃に否定的日テレNEWS NNN10/5(土) 11:4020件/時,日テレNEWS NNN,米トランプ前大統領、イランの核施設「攻撃すべき」　バイデン大統領はイラン石油施設の攻撃に否定的,20,https://news.yahoo.co.jp/articles/0550c9ed8e536825840ae813c975cae53a5baeeb,10/5(土) 11:40
2024-10-05,14:06,world,国際,15イスラエルがまた空襲爆撃…「ヒズボラの指導者後継者も死亡と推定」中央日報日本語版10/5(土) 12:3120件/時,中央日報日本語版,イスラエルがまた空襲爆撃…「ヒズボラの指導者後継者も死亡と推定」,20,https://news.yahoo.co.jp/articles/d34635409d873836c69714f9bac6e43799afe47c,10/5(土) 12:31
2024-10-05,14:06,world,国際,16イラン最高指導者、対イスラエル攻撃正当化　闘争強化呼びかけロイター10/4(金) 18:2019件/時,ロイター,イラン最高指導者、対イスラエル攻撃正当化　闘争強化呼びかけ,19,https://news.yahoo.co.jp/articles/49cb78e22140bfe6607979a1db3b04fd8dfcedd1,10/4(金) 18:20
2024-10-05,14:06,world,国際,17バイデン大統領　イスラエルによるイランの石油施設への報復攻撃は支持しない考え示すTBS NEWS DIG Powered by JNN10/5(土) 9:0718件/時,TBS NEWS DIG Powered by JNN,バイデン大統領　イスラエルによるイランの石油施設への報復攻撃は支持しない考え示す,18,https://news.yahoo.co.jp/articles/90ac28515cb3d13f71a72dae4e9afb68c73fb77c,10/5(土) 9:07
2024-10-05,14:06,world,国際,183:19民主党強かったが…「ヒスパニック票」に異変　移民の街に広がるトランプ氏支持TBS NEWS DIG Powered by JNN10/5(土) 11:5916件/時,TBS NEWS DIG Powered by JNN,民主党強かったが…「ヒスパニック票」に異変　移民の街に広がるトランプ氏支持,16,https://news.yahoo.co.jp/articles/defceaaeb08c35d037979aa4a11b47af922cf1e2,10/5(土) 11:59
2024-10-05,14:06,world,国際,19「トイレの床で数十人が寝ている」…中国人も驚く中国観光地の風景中央日報日本語版10/4(金) 16:2116件/時,中央日報日本語版,「トイレの床で数十人が寝ている」…中国人も驚く中国観光地の風景,16,https://news.yahoo.co.jp/articles/95ec6862d059cd76f0729a6a6f6280e518a8c9e4,10/4(金) 16:21
2024-10-05,14:06,world,国際,20北朝鮮に「核攻撃可能」…！自衛隊が米軍「爆撃機」守る「異様すぎる」光景に唖然現代ビジネス10/5(土) 6:4914件/時,現代ビジネス,北朝鮮に「核攻撃可能」…！自衛隊が米軍「爆撃機」守る「異様すぎる」光景に唖然,14,https://news.yahoo.co.jp/articles/6c5bef0acf138aa273a49be2a4bf5bf5b22e65a4,10/5(土) 6:49
2024-10-05,14:06,world,国際,21石破首相「日韓の緊密な連携、双方の利益に重要」中央日報日本語版10/5(土) 9:2114件/時,中央日報日本語版,石破首相「日韓の緊密な連携、双方の利益に重要」,14,https://news.yahoo.co.jp/articles/4bd7333fe8e80f3e053be85e845266c465fde7f5,10/5(土) 9:21
2024-10-05,14:06,world,国際,22このままだと「ドイツは全体主義」に向かってしまう…いま現地で起きている「経済と民主主義」の危機現代ビジネス10/5(土) 9:0013件/時,現代ビジネス,このままだと「ドイツは全体主義」に向かってしまう…いま現地で起きている「経済と民主主義」の危機,13,https://news.yahoo.co.jp/articles/e32897ceba84f15db9790a3ca2a1f267d189442c,10/5(土) 9:00
2024-10-05,14:06,world,国際,23トランプ氏、核施設を攻撃すべき　対イラン反撃で共同通信10/5(土) 10:0913件/時,共同通信,トランプ氏、核施設を攻撃すべき　対イラン反撃で,13,https://news.yahoo.co.jp/articles/6e4fda51afa1b1a6f5950ed659beab90e974f956,10/5(土) 10:09
2024-10-05,14:06,world,国際,242:29「かなり前に完成したけど、なぜか列車は駅に停まらない」中国の高速鉄道で“幽霊駅”が続々誕生　背景に“地方政府の甘い考え”TBS NEWS DIG Powered by JNN10/4(金) 16:2613件/時,TBS NEWS DIG Powered by JNN,「かなり前に完成したけど、なぜか列車は駅に停まらない」中国の高速鉄道で“幽霊駅”が続々誕生　背景に“地方政府の甘い考え”,13,https://news.yahoo.co.jp/articles/0c1deea5853c522192c650a4355c59906bc231f3,10/4(金) 16:26
2024-10-05,14:06,world,国際,25ザッカーバーグ氏、世界２位の富豪に　「２０００億ドルクラブ」の仲間入りCNN.co.jp10/5(土) 10:2512件/時,CNN.co.jp,ザッカーバーグ氏、世界２位の富豪に　「２０００億ドルクラブ」の仲間入り,12,https://news.yahoo.co.jp/articles/22644188e76e74f231bb03d7d6f19dcbe48fc2de,10/5(土) 10:25
2024-10-05,14:06,world,国際,26北朝鮮ハッカー組織、独軍需企業にハッキング攻撃…ＫＦ－２１技術流出か中央日報日本語版10/5(土) 11:1512件/時,中央日報日本語版,北朝鮮ハッカー組織、独軍需企業にハッキング攻撃…ＫＦ－２１技術流出か,12,https://news.yahoo.co.jp/articles/ec47bf5c7ae710ff46cd437472039a97d87a5128,10/5(土) 11:15
2024-10-05,14:06,world,国際,272:18ドアにはこびりついた息子の血　ハマスの攻撃から1年、立ち尽くすイスラエル住民ロイター10/4(金) 15:3912件/時,ロイター,ドアにはこびりついた息子の血　ハマスの攻撃から1年、立ち尽くすイスラエル住民,12,https://news.yahoo.co.jp/articles/5ab963c1a38796d4ebc0803f451e2d13bfaa9793,10/4(金) 15:39
2024-10-05,14:06,world,国際,281:073人乗る車が衝突し炎が…　危機迫る中、助けに来たのは？　中国・河北省日テレNEWS NNN10/5(土) 11:1111件/時,日テレNEWS NNN,3人乗る車が衝突し炎が…　危機迫る中、助けに来たのは？　中国・河北省,11,https://news.yahoo.co.jp/articles/a08bca654e5cea9792a137bf38859b26b565ccb4,10/5(土) 11:11
2024-10-05,14:06,world,国際,29イスラエル直接攻撃は「最低限の罰」共同通信10/4(金) 18:1211件/時,共同通信,イスラエル直接攻撃は「最低限の罰」,11,https://news.yahoo.co.jp/articles/abcce63b1b324f9fa3ddd299cb8c40cb8b34e8ec,10/4(金) 18:12
2024-10-05,14:06,world,国際,30メーガン妃は「ヒールを履いた独裁者」...いまなぜ再び非難を浴びているのか？ニューズウィーク日本版10/5(土) 9:5810件/時,ニューズウィーク日本版,メーガン妃は「ヒールを履いた独裁者」...いまなぜ再び非難を浴びているのか？,10,https://news.yahoo.co.jp/articles/6ea56d8f7b65f84feaa5f582d85ccfe6b7540255,10/5(土) 9:58
2024-10-05,14:06,world,国際,31イスラエルはイラン核施設を攻撃すべき トランプ氏ＡＦＰ＝時事10/5(土) 11:3410件/時,ＡＦＰ＝時事,イスラエルはイラン核施設を攻撃すべき トランプ氏,10,https://news.yahoo.co.jp/articles/8e232a2e4fef126be567af7400a828c8b30705da,10/5(土) 11:34
2024-10-05,14:06,world,国際,32ＮＡＴＯ軍事委員長、ウクライナが求める長射程兵器使用を支持「理にかなった方法だ」読売新聞オンライン10/5(土) 8:0610件/時,読売新聞オンライン,ＮＡＴＯ軍事委員長、ウクライナが求める長射程兵器使用を支持「理にかなった方法だ」,10,https://news.yahoo.co.jp/articles/df4135c122a0453de14c42c6c0bd1d762fca5328,10/5(土) 8:06
2024-10-05,14:06,world,国際,33＜サッカー＞韓国代表に大きな痛手…「太もも負傷」孫興慜、今月のＷ杯予選欠場中央日報日本語版10/5(土) 12:009件/時,中央日報日本語版,＜サッカー＞韓国代表に大きな痛手…「太もも負傷」孫興慜、今月のＷ杯予選欠場,9,https://news.yahoo.co.jp/articles/3b41a8e3b5afb0e9d124a212bfe2ddbc56658375,10/5(土) 12:00
2024-10-05,14:06,world,国際,341:12イランの最高指導者、イスラエルけん制「必要あれば再び合理的な措置」TBS NEWS DIG Powered by JNN10/5(土) 11:539件/時,TBS NEWS DIG Powered by JNN,イランの最高指導者、イスラエルけん制「必要あれば再び合理的な措置」,9,https://news.yahoo.co.jp/articles/28cc54c20e39019d2773a3e529f51e3d08de47c9,10/5(土) 11:53
2024-10-05,14:06,world,国際,35「ピアス・チャレンジ」で磁石誤飲 子ども5人病院で治療 チェコＡＦＰ＝時事10/5(土) 12:378件/時,ＡＦＰ＝時事,「ピアス・チャレンジ」で磁石誤飲 子ども5人病院で治療 チェコ,8,https://news.yahoo.co.jp/articles/0985829573bd05af65c0b39eed87a08b8fee77e1,10/5(土) 12:37
2024-10-05,14:06,world,国際,36韓国・昨年の廃業者100万人に迫る…なのに再起業支援が減少KOREA WAVE10/5(土) 13:038件/時,KOREA WAVE,韓国・昨年の廃業者100万人に迫る…なのに再起業支援が減少,8,https://news.yahoo.co.jp/articles/f7de1beb6e77e065aa9daa91fd23492aeab1b2c6,10/5(土) 13:03
2024-10-05,14:06,world,国際,37イスラエル軍がレバノンとシリア国境を空爆…避難民の主要な脱出経路が遮断、人道支援に影響懸念読売新聞オンライン10/5(土) 10:078件/時,読売新聞オンライン,イスラエル軍がレバノンとシリア国境を空爆…避難民の主要な脱出経路が遮断、人道支援に影響懸念,8,https://news.yahoo.co.jp/articles/031bb3d0a4c8fd4537551862be49ec937d725dfa,10/5(土) 10:07
2024-10-05,14:06,world,国際,38自衛隊機でレバノンから日本人ら16人退避　現地に残る選択した人もテレビ朝日系（ANN）10/5(土) 11:028件/時,テレビ朝日系（ANN）,自衛隊機でレバノンから日本人ら16人退避　現地に残る選択した人も,8,https://news.yahoo.co.jp/articles/317a8c13070bb0e429842d651215834ba29e158f,10/5(土) 11:02
2024-10-05,14:06,world,国際,390:57「北朝鮮に連絡事務所」検討　石破総理が家族会にも伝えるテレビ朝日系（ANN）10/4(金) 14:058件/時,テレビ朝日系（ANN）,「北朝鮮に連絡事務所」検討　石破総理が家族会にも伝える,8,https://news.yahoo.co.jp/articles/44cfcce2d6e7fafd293e4a1c0cb300f3779f1a11,10/4(金) 14:05
2024-10-05,14:06,world,国際,40ロシアによるウクライナへの長距離ドローン攻撃が激増　中国製も使い始めた可能性Forbes JAPAN10/5(土) 9:008件/時,Forbes JAPAN,ロシアによるウクライナへの長距離ドローン攻撃が激増　中国製も使い始めた可能性,8,https://news.yahoo.co.jp/articles/08d0af885914bbfaa0cefa61e1bc1cb46e6a056e,10/5(土) 9:00
