scrp_date,scrp_time,genre_en,genre_jp,rank,media_jp,title,comment,link,date_original
2025-09-18,11:33,sports,スポーツ,1,スポニチアネックス,ヤクルト・石川が来季も現役続行　46歳で25年目へ　球団幹部「200勝という目標を応援したい」,136,https://news.yahoo.co.jp/articles/5d530017bc86063c5c1a352c9e0e8f34c717f1d8,9/18(木) 5:00
2025-09-18,11:33,sports,スポーツ,2,RONSPO,井上尚弥に敗れたアフマダリエフの「ウォーミングアップの時間が足りなかった」の見苦しい“抗議”にJBCが「前日にゴングの時間は確認済み。進行に不備は一切なかった」との見解を示す,108,https://news.yahoo.co.jp/articles/71f387bbf1c5d3809bf2abf09376a6c887ef2891,9/18(木) 7:20
2025-09-18,11:33,sports,スポーツ,3,J-CASTニュース,井上尚弥は「フェザー級厳しい」、元世界王者・亀田和毅が持論...年末予定のピカソ戦もバッサリ「やる意味ない」,75,https://news.yahoo.co.jp/articles/10c3c9bf030c30e421769331c640c550dc560a23,9/17(水) 12:01
2025-09-18,11:33,sports,スポーツ,4,デイリースポーツ,巨人　岸田行倫の右上腕に１５０キロ直撃　負傷交代に神宮が騒然「骨とかじゃない」ポストシーズンへ避けたい正捕手の負傷離脱,74,https://news.yahoo.co.jp/articles/519d4fb1c81d661aa80a9d0c7386199344dd0bc8,9/18(木) 10:13
2025-09-18,11:33,sports,スポーツ,5,東スポWEB,【広島】今年もＢクラスか… チーム内から〝懺悔〟の弁「もっと練習しておいたほうがよかったのでは」,72,https://news.yahoo.co.jp/articles/050d0eebafa22fda12102c5370374162eb5812aa,9/18(木) 6:16
2025-09-18,11:33,sports,スポーツ,6,TBS NEWS DIG Powered by JNN,【中日】両リーグ最多24度目完封負け... 今季ワースト借金15 7回好機に3者三振 ボスラー痛恨失策 金丸7回自責0も援護なく 打線4安打,70,https://news.yahoo.co.jp/articles/c5b8dfc59787cc274cffc00817a4f0c842fbef38,9/17(水) 20:56
2025-09-18,11:33,sports,スポーツ,7,RONSPO,「まるでピエロ。ロバーツ監督は自分が何をしたかわかっているのか？」5回ノーノーの大谷翔平を交代させて逆転を許したドジャース指揮官の継投ミスに米SNSが大炎上,67,https://news.yahoo.co.jp/articles/537f437c9f73587073633c19c07ab8db1eeefbfb,9/18(木) 6:10
2025-09-18,11:33,sports,スポーツ,8,スポニチアネックス,巨人・岡本　頭部死球を受けヤクルト・奥川をにらみつける　神宮騒然　奥川は危険球退場,66,https://news.yahoo.co.jp/articles/5298e57bd1573dfa15057a68f94b8cb2e2a67284,9/17(水) 19:49
2025-09-18,11:33,sports,スポーツ,9,ベースボールキング,中日、7回に無死二塁の好機を作るも無得点…高木豊氏「バントという選択肢はなかったのか」,65,https://news.yahoo.co.jp/articles/29a4987d4e367be2fe9c742ea6e13b6f2c5db446,9/18(木) 6:50
2025-09-18,11:33,sports,スポーツ,10,共同通信,カーリーがドーピング容認大会へ　元世界陸上100m王者,64,https://news.yahoo.co.jp/articles/c792c79df41fb70769dd3ca29db784e3a429519e,9/18(木) 8:58
2025-09-18,11:33,sports,スポーツ,11,スポーツ報知,大谷翔平が史上６人目の２年連続５０号＆５回無安打投球も及ばず　ドジャース大逆転負け　遠のくフィリーズ,62,https://news.yahoo.co.jp/articles/47c117573e512a099dcb4e1c2bca7729a830e27f,9/17(水) 13:56
2025-09-18,11:33,sports,スポーツ,12,SOCCER DIGEST Web,J１町田の“観客動員１万人の常態化”はアクセス問題の限界を浮き彫りに。高まる駅近スタジアム構想の気運。ただ現実的には…,60,https://news.yahoo.co.jp/articles/062ef13492a4be440cce7066270dece9b9756997,9/18(木) 9:20
2025-09-18,11:33,sports,スポーツ,13,Full-Count,大谷翔平、2勝目消滅　5回ノーノーで降板も…救援が直後に6失点、本拠地大ブーイング,59,https://news.yahoo.co.jp/articles/091346cf4fa3fa61c966af4583122a092be330fe,9/17(水) 12:42
2025-09-18,11:33,sports,スポーツ,14,Full-Count,大谷翔平の50号直後…ド軍がまた“救援崩壊”　勝ち越し3ラン献上にド軍ベンチ沈黙,57,https://news.yahoo.co.jp/articles/496ec244b45f110ce8a7c15db521583d40feb075,9/17(水) 13:49
2025-09-18,11:33,sports,スポーツ,15,TBS NEWS DIG Powered by JNN,大谷翔平が史上6人目2年連続50号！MLB初“50本塁打－50K”のW快挙、2勝目消えるも二刀流劇場の特大弾、本拠地熱狂,57,https://news.yahoo.co.jp/articles/945f2a835997cd31b7ee1dda4bbce4b3653fa051,9/17(水) 13:24
2025-09-18,11:33,sports,スポーツ,16,Full-Count,巨人リチャードは「本格化する兆しが見えた」　HRよりも…専門家が絶賛した“2つの凡打”,57,https://news.yahoo.co.jp/articles/3f3c1766904d59bdb0f5225a551b4a2542948d34,9/18(木) 9:58
2025-09-18,11:33,sports,スポーツ,17,スポーツ報知,【巨人】阿部監督が来季続投　山口オーナーが明言「立て直してもらう」３年契約最終年にＶ奪回へ,56,https://news.yahoo.co.jp/articles/e3c1b5af69582f89a0398e8e06263bd8ac5f93a0,9/17(水) 15:31
2025-09-18,11:33,sports,スポーツ,18,共同通信,【独自】北朝鮮、アジア大会に参加希望　開幕1年、異例260人超選手団,55,https://news.yahoo.co.jp/articles/ee3d9b9750edb074a643511afdd79d923e34f237,9/17(水) 18:42
2025-09-18,11:33,sports,スポーツ,19,デイリースポーツ,ヤクルト・村上　メジャー移籍決定的　今季終了後にポスティング　ＣＳ消滅、球団も夢後押し「今、しゃべることはできないです」,53,https://news.yahoo.co.jp/articles/ed865b2a9ef2c946176c86d1b29041e14ec03e1b,9/18(木) 5:01
2025-09-18,11:33,sports,スポーツ,20,Full-Count,日本からド軍に届いた痛烈皮肉「エンゼルスじゃん」　大谷翔平は「1人で野球してない？」,52,https://news.yahoo.co.jp/articles/9bff113b8860aeb284c9845f4a0a6782b401b46c,9/18(木) 8:30
2025-09-18,11:33,sports,スポーツ,21,中日スポーツ,中日・金丸夢斗、7イニング4安打1失点（自責0）で降板　味方の援護なく今季3勝目はならず、7回にDeNA・東のスクイズで先制点献上,50,https://news.yahoo.co.jp/articles/2208de7f67b7c801da62b3103d936bbb642881d5,9/17(水) 20:22
2025-09-18,11:33,sports,スポーツ,22,中日スポーツ,大谷翔平5回ノーノーでも、2年連続50号でも…二刀流「50-50」でも…ドジャース負けた　救援陣ボロボロ、6回には一挙6失点、追いついた直後にも3ラン被弾,50,https://news.yahoo.co.jp/articles/9fed611b546fefd4ffb78e43ad93128abaa5c3fb,9/17(水) 13:56
2025-09-18,11:33,sports,スポーツ,23,デイリースポーツ,ＢＤ放送事故級の流血大乱闘　スタッフ悲鳴「セキュリティ呼んで！」控え室で“悪童”親友が大阪問題児喧嘩自慢を殴打し大もめ「お前一発で白目むかしたる」「戦争や」,49,https://news.yahoo.co.jp/articles/287cc853a3ccb10c676702bd6bf37407aaf77389,9/17(水) 22:57
2025-09-18,11:33,sports,スポーツ,24,THE ANSWER,陸上界激震の衝撃ニュース「嘘だろ」　100m超大物カーリーがドーピング容認大会参戦へ、「世界記録」に意欲,49,https://news.yahoo.co.jp/articles/5da5a2602e37ed891d65a554eee5facd22a1763d,9/18(木) 10:03
2025-09-18,11:33,sports,スポーツ,25,スポーツ報知,【ソフトバンク】モイネロは今季最少７４球で５回降板　１１―１と大量リード,49,https://news.yahoo.co.jp/articles/82024655f79c4293b45501ae73785aba2019b3e1,9/17(水) 20:17
2025-09-18,11:33,sports,スポーツ,26,文春オンライン,佐々木朗希が明かす、突如162kmに“球速アップ”した理由「自分の動画を見ていて“ひらめいた”」「美馬さんの引退がきっかけに」,48,https://news.yahoo.co.jp/articles/0569cd99b09429e001e3faae9d13717cf2253bb0,9/18(木) 7:12
2025-09-18,11:33,sports,スポーツ,27,Full-Count,大谷翔平、5回ノーノーで降板　5Kで2勝目の権利…MLB自己最速164キロ、防御率3.29,47,https://news.yahoo.co.jp/articles/dd461bddb4adfc3106fc1e4d91fb001a01a60d28,9/17(水) 12:31
2025-09-18,11:33,sports,スポーツ,28,デイリースポーツ,「昨夜、私が考えていたことは…」ロバーツ監督、崩壊状態の救援陣を語る「結果の前に自信必要」　前夜は大谷5回ノーノー快投降板後にまさかの逆転負け,46,https://news.yahoo.co.jp/articles/dacaa3401fee43ec6bf8c28f568ed49cf224fb71,9/18(木) 9:42
2025-09-18,11:33,sports,スポーツ,29,高校野球ドットコム,巨人・阿部監督が来季続投へ！日本ハム・新庄監督、西武・西口監督も続投示唆と報道,45,https://news.yahoo.co.jp/articles/cc4a17a68d4404af43fdf9c4439cc5344480efea,9/18(木) 8:00
2025-09-18,11:33,sports,スポーツ,30,東スポWEB,【Ｆ１】角田裕毅大ピンチ！　チームの契約判断時期がずれ込みアルピーヌ行き〝消滅〟も＝英メディア,45,https://news.yahoo.co.jp/articles/5aa086147e4d61c0990ee61ab7e2f94ba0aa2ec7,9/18(木) 5:16
2025-09-18,11:33,sports,スポーツ,31,TBS NEWS DIG Powered by JNN,大谷翔平“悲運”、5回ノーヒットの快投も...交代後わずか10分で2勝目消滅、救援陣2被弾の大崩壊で4点差ひっくり返される,43,https://news.yahoo.co.jp/articles/35fd6ee1ace27928651f450d4067463db4a457bd,9/17(水) 12:45
2025-09-18,11:33,sports,スポーツ,32,日刊スポーツ,大谷翔平、４回までノーヒットノーランの快投　160キロ超え連発で強力フィリーズ打線を圧倒,42,https://news.yahoo.co.jp/articles/05c7f54f5ceaf9d232ac634efdf98fb279767770,9/17(水) 12:40
2025-09-18,11:33,sports,スポーツ,33,スポーツ報知,大谷翔平、５回ノーヒットのまま降板　余力残した６８球　メジャー自己最速タイの１６３・７キロでシュワバー“圧投”,42,https://news.yahoo.co.jp/articles/4ef564422bb019a1c4d0e9e717c3230ccb7056f0,9/17(水) 12:31
2025-09-18,11:33,sports,スポーツ,34,THE DIGEST,大谷翔平、シュワーバーを見逃し三振斬り＆５回までノーヒット投球で降板！  ５K無失点で快投、今季２勝目なるか,40,https://news.yahoo.co.jp/articles/4ae57b59fc111acd5e3ffc304d160ca91152315e,9/17(水) 12:39
2025-09-18,11:33,sports,スポーツ,35,ABEMA TIMES,「さすがにヒドイ」大相撲観戦で残念な行為、憤りと落胆の声 取組直前の出来事に「力士に迷惑」「ガラ悪い」,40,https://news.yahoo.co.jp/articles/2559e3572b08e935cfa05d39092771967d6c3cf0,9/18(木) 10:21
2025-09-18,11:33,sports,スポーツ,36,サンケイスポーツ,ロバーツ監督、大谷翔平の降板判断に「続投させるつもりなかった」　5回〝ノーノー〟後に即逆転…大谷は「いける」と返答,39,https://news.yahoo.co.jp/articles/af52eadea561d048ea95babf48ea6a042736d826,9/17(水) 14:52
2025-09-18,11:33,sports,スポーツ,37,TBS NEWS DIG Powered by JNN,大谷翔平 5回ノーヒット、2勝目の権利を手に降板 8年目で初のフィリーズ戦で好投、ポストシーズンに向け大きな収穫,37,https://news.yahoo.co.jp/articles/eae4c435a0045e1a5983a852919e559646b8aa81,9/17(水) 12:34
2025-09-18,11:33,sports,スポーツ,38,東スポWEB,【世界陸上】〝疑惑の判定〟相次ぎ競技の人気低下に懸念の声「いずれ誰も見なくなる」,37,https://news.yahoo.co.jp/articles/194cd862dae34c1a4b471adf1b1347dfa66f3ef6,9/17(水) 18:20
2025-09-18,11:33,sports,スポーツ,39,THE ANSWER,完敗アフマダリエフ言い訳「準備の時間なかった」　前座4R決着の影響主張「能力発揮できず」,37,https://news.yahoo.co.jp/articles/091591d64d7b7ae7ba7e8e7ebd182a1b4bf2d7b8,9/17(水) 16:33
2025-09-18,11:33,sports,スポーツ,40,TBS NEWS DIG Powered by JNN,【日本ハム】悪夢サヨナラ負け...楽天戦3連敗 ソフトバンクと3.5ゲーム差 11回2死一塁 齋藤がボイトにV打献上 8回レイエス同点弾も,37,https://news.yahoo.co.jp/articles/e6562fc5d1a19bf7cfb2f36352a96fd60afdb342,9/17(水) 21:50
