scrp_date,scrp_time,genre_en,genre_jp,rank,media_jp,title,comment,link,date_original
2025-05-17,18:07,business,経済,1,読売新聞オンライン,日産が神奈川の追浜と湘南の２工場閉鎖へ…世界７工場削減計画、海外はメキシコや南アフリカなど,260,https://news.yahoo.co.jp/articles/e80939a9612c2a0eb12d1c4da0398222d32503c5,5/17(土) 5:00
2025-05-17,18:07,business,経済,2,マネーポストWEB,男性が女性にAEDを使用したら「不同意わいせつ」で訴えられるのか？弁護士が解説　「緊急でやむを得ない場合、罪に問われることはない」が「不必要な接触は避けましょう」,188,https://news.yahoo.co.jp/articles/2c5fc5571f64094c93d002556c91234acdd11d9f,5/17(土) 15:15
2025-05-17,18:07,business,経済,3,みんかぶマガジン,竹中平蔵「低所得者に減税しても効果は薄い」財務省より厚労省にデモした方がよっぽど社会のため！国民全体が被害者だ,159,https://news.yahoo.co.jp/articles/e0b4c966ba12bd27e3888aa96fa407e0b003e292,5/17(土) 9:10
2025-05-17,18:07,business,経済,4,朝日新聞,減り続ける備蓄米、放出続くも補充なし　7月には適正水準の3割に,112,https://news.yahoo.co.jp/articles/13f72da78f8b2a5a9163bbee38eb870527efeaae,5/17(土) 15:00
2025-05-17,18:07,business,経済,5,共同通信,ガソリン定額補助、22日開始　店頭価格5円引き下げ,82,https://news.yahoo.co.jp/articles/01f782556099fae15c03d34e68a891b9757d236c,5/17(土) 15:54
2025-05-17,18:07,business,経済,6,読売新聞オンライン,政府備蓄米の価格上乗せが拡大、卸売業者から小売り・外食へは６０ｋｇで７５９３円,79,https://news.yahoo.co.jp/articles/e9333276f75555d7b8c01e2c77988439b4c1992b,5/16(金) 19:56
2025-05-17,18:07,business,経済,7,TBS NEWS DIG Powered by JNN,"「紅茶人気が拡大中」なぜ?スタバでは「紅茶に特化した」新ショップも登場【THE TIME,】",49,https://news.yahoo.co.jp/articles/b994736ef439b00809c1c0ef90b7b72260479c71,5/17(土) 7:02
2025-05-17,18:07,business,経済,8,ファイナンシャルフィールド,来年4月から始まる「独身税」こと「子ども・子育て支援金制度」。一人あたりの徴収料はいくら？,47,https://news.yahoo.co.jp/articles/f2c9a44fc28bb68b1bf7183fb470ff35167c1855,5/17(土) 13:30
2025-05-17,18:07,business,経済,9,AERA DIGITAL,実は気づかぬところで備蓄米効果？　コメ先高感でせっせと買いだめすると高止まりを助長,44,https://news.yahoo.co.jp/articles/46a7f1bfd5bd64118a5759bc64e75cf3f0cbe0f4,5/17(土) 10:32
2025-05-17,18:07,business,経済,10,産経新聞,フジ親会社、ダルトンへの反対理由明かす　指摘の課題「事実誤認」役員候補「資格に疑義」,37,https://news.yahoo.co.jp/articles/37237486d005b7e7e13ad0b703c297f7204bea01,5/17(土) 7:00
2025-05-17,18:07,business,経済,11,テレ東プラス,「無印のコメ」で農家がピンチ！？「令和の米騒動」が招いた深刻な亀裂,35,https://news.yahoo.co.jp/articles/ce26919b422451c47debde27760cfc8e1e42b84f,5/17(土) 11:01
2025-05-17,18:07,business,経済,12,TBS NEWS DIG Powered by JNN,備蓄米あらたな入札方法“優先枠”を設けることでコメ価格は下がる?経費・利益を上乗せしていた卸売業者を通さない取引…スーパーと精米店からは懸念も【news23】,34,https://news.yahoo.co.jp/articles/d9b89aa28fb6a759f800ce3b5ac7ee41af31a150,5/17(土) 15:48
2025-05-17,18:07,business,経済,13,TBS NEWS DIG Powered by JNN,日産が神奈川の2工場閉鎖を検討　追浜工場と湘南工場（日産車体）　創業の地・神奈川から完成車工場消える可能性,33,https://news.yahoo.co.jp/articles/7752cd51ffa4dbdfabd5289961489592e6e517fb,5/17(土) 17:11
2025-05-17,18:07,business,経済,14,TBS NEWS DIG Powered by JNN,【独自】EV充電スタンド補助金にテスラ「スーパーチャージャー」追加案　トランプ関税めぐる日米交渉,29,https://news.yahoo.co.jp/articles/90ceebf3d8ad2cde15ee1a600184b5edde99fbe8,5/17(土) 13:44
2025-05-17,18:07,business,経済,15,マネーポストWEB,「普通のスマホにすればよかった…」シニア向けスマホの落とし穴　子供や孫に使い方を聞いても「わからない」、タップしただけでは反応しない機能に「イライラする」の声も,27,https://news.yahoo.co.jp/articles/1480163f919223cce8a3e960e6969ba47c427c5c,5/17(土) 16:15
2025-05-17,18:07,business,経済,16,毎日新聞,日産、追浜・湘南工場の閉鎖・休止を検討　過剰設備と人員を適正化,24,https://news.yahoo.co.jp/articles/38ea91a65ef26a854ee734cadf49acf91eb93078,5/17(土) 10:55
2025-05-17,18:07,business,経済,17,テレビ朝日系（ANN）,“卸を通さない優先枠も”備蓄米「新ルール」で流通改善する？,24,https://news.yahoo.co.jp/articles/addc3136e4862b9618a5e00c209b2ce1966772f3,5/16(金) 19:36
2025-05-17,18:07,business,経済,18,プレジデントオンライン,「コメを買えない人」が続出しているのに…高級タワマンに賃貸で暮らす「シン富裕層」が買っているもの,24,https://news.yahoo.co.jp/articles/9ac7525dae096ff110994b31402ab551578edb48,5/17(土) 7:17
2025-05-17,18:07,business,経済,19,ITmedia ビジネスオンライン,どうして日本人は“箱型”が好きなのか　ミニバンが売れ続ける日本市場の特異性,23,https://news.yahoo.co.jp/articles/76489f3594832ce2d44992142d8e89db156ef9b9,5/17(土) 9:10
2025-05-17,18:07,business,経済,20,FNNプライムオンライン,「ケチが日本を滅ぼす」京大・藤井教授は「今こそ減税必要」GDPマイナス成長でも減税消極的な自民幹事長に検討促す,23,https://news.yahoo.co.jp/articles/9275008aa80adbead586853606f78476bf3f479e,5/16(金) 19:28
2025-05-17,18:07,business,経済,21,JBpress,被害額は売却・買付で計3000億円以上、NISAブームに冷や水を浴びせた証券口座乗っ取り事件はなぜ起きたのか？,21,https://news.yahoo.co.jp/articles/cc8ffa39fd4249d3a67b0fe75743a7c013b33202,5/17(土) 17:21
2025-05-17,18:07,business,経済,22,ダイヤモンド・オンライン,「県庁も道州制も不要」国会発言の真意を村上総務相が激白、人口が半減する時代を見据えて議論を本格化すべき,21,https://news.yahoo.co.jp/articles/24330a34a2c06a35ecf56f32de9ca27edfc85bfb,5/17(土) 6:02
2025-05-17,18:07,business,経済,23,共同通信,取締役提案反対は「遺憾」　フジ大株主の米ファンド,20,https://news.yahoo.co.jp/articles/61a976fa64b24b769e7a2e42fe196b4b9da58558,5/17(土) 11:56
2025-05-17,18:07,business,経済,24,関西テレビ,「ケチが日本を滅ぼす」京大・藤井教授　GDPマイナス成長でも減税に消極的な自民幹事長に物申す,20,https://news.yahoo.co.jp/articles/30eee28fa80699ef7eeb8ac3bbe9af8706426315,5/16(金) 18:22
2025-05-17,18:07,business,経済,25,ニュースイッチ,万博効果が予想以上…大阪メトロ、運輸収入150億円超増,20,https://news.yahoo.co.jp/articles/4b8398699f41f97ec12c33b84e5aa617befe8d9e,5/17(土) 10:10
2025-05-17,18:07,business,経済,26,ファイナンシャルフィールド,【認識率26％】運転中の友人が「眠くなってきた」と、信号待ちで運転手を交代→実は違反で、反則金「1万2000円」取られるって本当!?“意外とやりがちな交通違反”もあわせて解説,19,https://news.yahoo.co.jp/articles/b33a7197d2286f8275a0cad15edd967e84983266,5/17(土) 13:40
2025-05-17,18:07,business,経済,27,マネーポストWEB,関東進出で話題の「資さんうどん」だけじゃない！九州北部の“3強”のひとつ「牧のうどん」ファンが語る「名前を聞いただけで食べたくなる」その魅力,18,https://news.yahoo.co.jp/articles/bf73ba376d8876e139e253192650d8a2cd151c14,5/17(土) 16:15
2025-05-17,18:07,business,経済,28,ファイナンシャルフィールド,引っ越したのに、旧住所に「住民税の納付書」が届きました。20万円納付する必要があるようですが、新住所との“二重請求”ではないですか？ 支払う必要はあるのでしょうか？,18,https://news.yahoo.co.jp/articles/3db382c33a5db3f0ba22f7d3a076109d29374c65,5/17(土) 13:30
2025-05-17,18:07,business,経済,29,ファイナンシャルフィールド,去年「部長」に昇進した友人は「年収1000万円」を超えたそうです。年収が1000万円を超える「給与所得者」はどのくらいいるのでしょうか？,18,https://news.yahoo.co.jp/articles/47a1f144446943f8ed2af5ad5794c53b63ff8a16,5/17(土) 13:50
2025-05-17,18:07,business,経済,30,テレビ朝日系（ANN）,日産　工場の削減計画に神奈川・追浜工場など国内2工場候補か　慎重に検討へ,17,https://news.yahoo.co.jp/articles/9576d93492b662e1fbe416a490bc9c6972ca1819,5/17(土) 15:18
2025-05-17,18:07,business,経済,31,共同通信,コメ主産地の東北で田植え最盛期　生産面積増も価格高騰に危機感,17,https://news.yahoo.co.jp/articles/a255d001340624777cc3b9835d3a5afe6a21a46d,5/17(土) 15:35
2025-05-17,18:07,business,経済,32,読売新聞オンライン,トランプ大統領「１５０か国が取引望んでいるが多くの国と直接交渉できない」…書簡で関税率を通知する考え,16,https://news.yahoo.co.jp/articles/71e503408cf5913963760594aee404e96c8f4cc7,5/17(土) 13:22
2025-05-17,18:07,business,経済,33,マネーポストWEB,深刻な人手不足に苦しむ物流業界は「外国人ドライバー」に熱視線　海外の運転免許証を日本のものに切り替える「外免切替」への期待と課題,16,https://news.yahoo.co.jp/articles/e34a51f90bdcccdbf0d2b503ec5b6f3832c08e90,5/17(土) 7:15
2025-05-17,18:07,business,経済,34,FNNプライムオンライン,【悲鳴】「60年農家してきて…ショック、ショック」84歳農家の米300kg盗難被害　米高騰で大食いの聖地“デカ盛り”店に異変も　備蓄米流通へ政府が新対策,16,https://news.yahoo.co.jp/articles/ff267b6f0d6a5e0e7ae814899f29366ef6fb3bd7,5/17(土) 10:13
2025-05-17,18:07,business,経済,35,ABEMA TIMES,「年収2000万円でも買えない」都心タワマンは“空中戦”に “住めない東京”今後の街づくり、水辺に可能性アリ？,16,https://news.yahoo.co.jp/articles/b2613bc80d266ec5305db86d0ec1b15731b6bfb1,5/17(土) 11:02
2025-05-17,18:07,business,経済,36,時事通信,クレハ、常務が辞任　女性社員へ不適切行為,16,https://news.yahoo.co.jp/articles/ddc923e319cffc3181189c8a1f2fb9eb8021b013,5/16(金) 19:32
2025-05-17,18:07,business,経済,37,東洋経済オンライン,日本とは大違い、欧州鉄道「大型荷物置き場」事情　新幹線は「荷物のトラブル」よく聞くが…欧州はスーツケースからスキーまで自由に置ける,16,https://news.yahoo.co.jp/articles/6d9011128a2b4719305c745a4ada95bcb99bc05a,5/17(土) 4:32
2025-05-17,18:07,business,経済,38,信濃毎日新聞デジタル,中小企業で“採用を諦める”動きか　全国水準の賃上げに追いつけない、応募者が集まらない…長野県では採用予定の企業が2年連続で減少,16,https://news.yahoo.co.jp/articles/84141544b3939753a5bb6ddf04080bd9e6940dd4,5/17(土) 6:02
2025-05-17,18:07,business,経済,39,鉄道コム,通勤電車の「一枚扉」なぜ見られなくなった？　大手私鉄では風前の灯火に,15,https://news.yahoo.co.jp/articles/bdd76d326c1924cc0d7e85feea27b500fcae3796,5/17(土) 12:05
2025-05-17,18:07,business,経済,40,テレビ朝日系（ANN）,コメ問題にスーパー業界トップ「備蓄米入札などに一部問題」,15,https://news.yahoo.co.jp/articles/f794d98313734525425e849e9bbdb9890c634954,5/16(金) 21:23
