scrp_date,scrp_time,genre_en,genre_jp,rank,media_jp,title,comment,link,date_original
2024-10-27,21:10,world,国際,1北朝鮮兵にビラ配布計画　ウクライナ「脱北の好機」共同通信10/27(日) 15:25103件/時,共同通信,北朝鮮兵にビラ配布計画　ウクライナ「脱北の好機」,103,https://news.yahoo.co.jp/articles/2041c48754cecdae4d55671afc41bf6a81e5e82c,10/27(日) 15:25
2024-10-27,21:10,world,国際,2少女像にキスしたユーチューバー、ソウルで通行人に暴行される中央日報日本語版10/27(日) 11:0563件/時,中央日報日本語版,少女像にキスしたユーチューバー、ソウルで通行人に暴行される,63,https://news.yahoo.co.jp/articles/05c49588057219ddf0ca15b16e7e96fab093d843,10/27(日) 11:05
2024-10-27,21:10,world,国際,3マスク氏、過去に不法就労　留学生資格で起業、報道共同通信10/26(土) 22:4544件/時,共同通信,マスク氏、過去に不法就労　留学生資格で起業、報道,44,https://news.yahoo.co.jp/articles/256289fc3d2e9a394e4c6cce746ff90477a2e747,10/26(土) 22:45
2024-10-27,21:10,world,国際,4ジョージアで議会選、親露・強権色強める与党「勝利」の公算　EU加盟遠のく産経新聞10/27(日) 11:0531件/時,産経新聞,ジョージアで議会選、親露・強権色強める与党「勝利」の公算　EU加盟遠のく,31,https://news.yahoo.co.jp/articles/c875fb1dd1b634d5f2f32da75e7f3dbc70bc4b8d,10/27(日) 11:05
2024-10-27,21:10,world,国際,5「命はいらない!」男が鉄パイプ振り回し大暴れ…無許可営業取り締まりに反撃　厳しすぎる「城管」にSNSでは同情の声も　中国FNNプライムオンライン10/27(日) 15:3230件/時,FNNプライムオンライン,「命はいらない!」男が鉄パイプ振り回し大暴れ…無許可営業取り締まりに反撃　厳しすぎる「城管」にSNSでは同情の声も　中国,30,https://news.yahoo.co.jp/articles/4f6b7bde467932ea7c122926d38718f157c3056b,10/27(日) 15:32
2024-10-27,21:10,world,国際,6トランプ氏がヒトラー肯定発言？で物議 舛添要一氏「ジェノサイドと経済政策は切り分けて評価を」ドイツ人コラムニスト「”いい面”にあえて注目する必要ない」ABEMA TIMES10/27(日) 11:5725件/時,ABEMA TIMES,トランプ氏がヒトラー肯定発言？で物議 舛添要一氏「ジェノサイドと経済政策は切り分けて評価を」ドイツ人コラムニスト「”いい面”にあえて注目する必要ない」,25,https://news.yahoo.co.jp/articles/2a5c49f7ea63741fc5de5dab4f801f8b42e60cf5,10/27(日) 11:57
2024-10-27,21:10,world,国際,7自民党過半数割れの見込みと速報　中国国営メディア共同通信10/27(日) 20:5122件/時,共同通信,自民党過半数割れの見込みと速報　中国国営メディア,22,https://news.yahoo.co.jp/articles/06e5f5551743ec79c9ff9a8a5ed6c0a6901d61ad,10/27(日) 20:51
2024-10-27,21:10,world,国際,8衆院選、自公過半数割れの公算　立民が伸長＝報道ロイター10/27(日) 20:2321件/時,ロイター,衆院選、自公過半数割れの公算　立民が伸長＝報道,21,https://news.yahoo.co.jp/articles/7ec117213b891a8bdd17462616e06a2086f728e9,10/27(日) 20:23
2024-10-27,21:10,world,国際,9北朝鮮、経験浅い兵を派遣か　身長低く体格がきゃしゃと米報道共同通信10/27(日) 20:4420件/時,共同通信,北朝鮮、経験浅い兵を派遣か　身長低く体格がきゃしゃと米報道,20,https://news.yahoo.co.jp/articles/f97a60bc85f7c1f4e9cd6edf1e1f0852f702e326,10/27(日) 20:44
2024-10-27,21:10,world,国際,10イラン、再報復を慎重判断　イスラエルへ「正当対応」共同通信10/27(日) 5:4420件/時,共同通信,イラン、再報復を慎重判断　イスラエルへ「正当対応」,20,https://news.yahoo.co.jp/articles/6d05146e67e55ef4a3c740b4e8197d61a913d54e,10/27(日) 5:44
2024-10-27,21:10,world,国際,112:16米大統領選　大接戦のカギ握る“若者の選択”の行方は日テレNEWS NNN10/27(日) 12:3119件/時,日テレNEWS NNN,米大統領選　大接戦のカギ握る“若者の選択”の行方は,19,https://news.yahoo.co.jp/articles/6a311fc2e802f139125145748d5ba7bf96e769e8,10/27(日) 12:31
2024-10-27,21:10,world,国際,12飼い犬のためにファーストクラス買ったが「乗務員の要請で移動して犬が死んだ」中央日報日本語版10/27(日) 12:1918件/時,中央日報日本語版,飼い犬のためにファーストクラス買ったが「乗務員の要請で移動して犬が死んだ」,18,https://news.yahoo.co.jp/articles/0d40ba83e8d44f326c7abc3792edef227200db77,10/27(日) 12:19
2024-10-27,21:10,world,国際,13ガザ北部「壊滅的」 WHO事務局長、病院襲撃を批判ＡＦＰ＝時事10/27(日) 16:1317件/時,ＡＦＰ＝時事,ガザ北部「壊滅的」 WHO事務局長、病院襲撃を批判,17,https://news.yahoo.co.jp/articles/7d2d4603241aa23d8d962bf58d35d89156c59f16,10/27(日) 16:13
2024-10-27,21:10,world,国際,14イラン最高指導者、再報復に言及せず共同通信10/27(日) 18:2514件/時,共同通信,イラン最高指導者、再報復に言及せず,14,https://news.yahoo.co.jp/articles/6c6a17e2cbbfd330009a57701ef77293a01bb718,10/27(日) 18:25
2024-10-27,21:10,world,国際,15中国が米国に抗議　台湾への武器売却に反発　対抗措置を示唆　「米中関係を破壊」産経新聞10/27(日) 13:0414件/時,産経新聞,中国が米国に抗議　台湾への武器売却に反発　対抗措置を示唆　「米中関係を破壊」,14,https://news.yahoo.co.jp/articles/f2ce7cc7753812ecd74d0fd22a2b283994812f12,10/27(日) 13:04
2024-10-27,21:10,world,国際,16中国、李克強前首相の追悼阻止　死去1年、地元安徽省に警察配置共同通信10/27(日) 19:2013件/時,共同通信,中国、李克強前首相の追悼阻止　死去1年、地元安徽省に警察配置,13,https://news.yahoo.co.jp/articles/1545221d5745ddd3a4e6a6853aede25ddc0b7cb2,10/27(日) 19:20
2024-10-27,21:10,world,国際,171:15マレーシア観光バス事故 衝突前に車内で不安の声テレビ朝日系（ANN）10/27(日) 6:3013件/時,テレビ朝日系（ANN）,マレーシア観光バス事故 衝突前に車内で不安の声,13,https://news.yahoo.co.jp/articles/fb8391b7d0a9ad35ab12e6b0b7160f9f47189fa5,10/27(日) 6:30
2024-10-27,21:10,world,国際,18イラン最高指導者・ハメネイ師「誇張も過小評価もせず」　イスラエル攻撃への具体的言及なしFNNプライムオンライン（フジテレビ系）10/27(日) 19:1913件/時,FNNプライムオンライン（フジテレビ系）,イラン最高指導者・ハメネイ師「誇張も過小評価もせず」　イスラエル攻撃への具体的言及なし,13,https://news.yahoo.co.jp/articles/b73ac2984d4e5dd63f61cb9f65e03e06bccbc838,10/27(日) 19:19
2024-10-27,21:10,world,国際,19ノーベル文学賞の本は売りません。韓国の大手書店の看板が話題に。いったいなぜ？ハフポスト日本版10/27(日) 17:0113件/時,ハフポスト日本版,ノーベル文学賞の本は売りません。韓国の大手書店の看板が話題に。いったいなぜ？,13,https://news.yahoo.co.jp/articles/938b76b71cf9b74d0d03bb354971557884112708,10/27(日) 17:01
2024-10-27,21:10,world,国際,20ウクライナ精鋭旅団、クルスク州で捕虜処刑のロ軍部隊を死地送りに　北朝鮮部隊も待ち構えるForbes JAPAN10/27(日) 9:0012件/時,Forbes JAPAN,ウクライナ精鋭旅団、クルスク州で捕虜処刑のロ軍部隊を死地送りに　北朝鮮部隊も待ち構える,12,https://news.yahoo.co.jp/articles/0c383beaee38d89d85e71a2673ad22cd8b8c9cd3,10/27(日) 9:00
2024-10-27,21:10,world,国際,21トランプ氏支持のイーロン・マスク氏、米国で過去に不法就労かABEMA TIMES10/27(日) 15:5712件/時,ABEMA TIMES,トランプ氏支持のイーロン・マスク氏、米国で過去に不法就労か,12,https://news.yahoo.co.jp/articles/25986030d9c58eafc7353df31da662e66f18b972,10/27(日) 15:57
2024-10-27,21:10,world,国際,22【速報】イスラエル中部でトラックがバス停に突っ込み35人けが、テロかTBS NEWS DIG Powered by JNN10/27(日) 18:5311件/時,TBS NEWS DIG Powered by JNN,【速報】イスラエル中部でトラックがバス停に突っ込み35人けが、テロか,11,https://news.yahoo.co.jp/articles/4c07ea0d26874601b11cba410785a0f475180823,10/27(日) 18:53
2024-10-27,21:10,world,国際,230:51北朝鮮兵にロシア軍部隊が戸惑い「どう扱えと」「中国人」　ウクライナが傍受テレビ朝日系（ANN）10/27(日) 9:1711件/時,テレビ朝日系（ANN）,北朝鮮兵にロシア軍部隊が戸惑い「どう扱えと」「中国人」　ウクライナが傍受,11,https://news.yahoo.co.jp/articles/946c3a5b0d5938baeefc2fa928c8e074e442f501,10/27(日) 9:17
2024-10-27,21:10,world,国際,24「メーガンは他の女性と異なる」と、メディアとファンを批判…ヘンリー王子の発言に再び注目が集まるニューズウィーク日本版10/27(日) 10:3311件/時,ニューズウィーク日本版,「メーガンは他の女性と異なる」と、メディアとファンを批判…ヘンリー王子の発言に再び注目が集まる,11,https://news.yahoo.co.jp/articles/b9eb207fe52b4685454157134ca79581d2b0c9f9,10/27(日) 10:33
2024-10-27,21:10,world,国際,250:31イーロン・マスク氏“過去に不法就労”とアメリカメディア　留学生ビザで入国も大学院入学せず起業FNNプライムオンライン（フジテレビ系）10/27(日) 18:1711件/時,FNNプライムオンライン（フジテレビ系）,イーロン・マスク氏“過去に不法就労”とアメリカメディア　留学生ビザで入国も大学院入学せず起業,11,https://news.yahoo.co.jp/articles/91e010d2b861bc1e72d4a9c69bf834a3ffec43b8,10/27(日) 18:17
2024-10-27,21:10,world,国際,26ウクライナ侵攻に「北朝鮮」が本格参戦　最強の特殊部隊「暴風軍団」が投入も…ロシア軍からの“食糧も与えられない”冷遇が発覚デイリー新潮10/27(日) 6:1310件/時,デイリー新潮,ウクライナ侵攻に「北朝鮮」が本格参戦　最強の特殊部隊「暴風軍団」が投入も…ロシア軍からの“食糧も与えられない”冷遇が発覚,10,https://news.yahoo.co.jp/articles/a979f05dd139eaa57f3849c2c27bcf2849972186,10/27(日) 6:13
2024-10-27,21:10,world,国際,27数センチ踏み外せば「滑落」…これがマッターホルン山頂部の足場、登頂アタック映像が「怖すぎる」と話題ニューズウィーク日本版10/27(日) 13:1010件/時,ニューズウィーク日本版,数センチ踏み外せば「滑落」…これがマッターホルン山頂部の足場、登頂アタック映像が「怖すぎる」と話題,10,https://news.yahoo.co.jp/articles/b30113dc15d1caad24002af01ae8a4f0e14713bb,10/27(日) 13:10
2024-10-27,21:10,world,国際,28韓国・ハワイの総領事館職員で女子トイレに違法カメラ…容疑の職員逮捕KOREA WAVE10/27(日) 18:0310件/時,KOREA WAVE,韓国・ハワイの総領事館職員で女子トイレに違法カメラ…容疑の職員逮捕,10,https://news.yahoo.co.jp/articles/9046c99d122415da854c92738eea79d33451e3ec,10/27(日) 18:03
2024-10-27,21:10,world,国際,29スト長期化、深まる混迷　日本企業に影響波及　米ボーイング時事通信10/27(日) 14:3210件/時,時事通信,スト長期化、深まる混迷　日本企業に影響波及　米ボーイング,10,https://news.yahoo.co.jp/articles/a0eb4ad69141b8c05e3fb4262ba03c6f8d336108,10/27(日) 14:32
2024-10-27,21:10,world,国際,301:20北朝鮮の兵士、数千人が露西部クルスク州に到着　米NYタイムズ報道日テレNEWS NNN10/27(日) 15:309件/時,日テレNEWS NNN,北朝鮮の兵士、数千人が露西部クルスク州に到着　米NYタイムズ報道,9,https://news.yahoo.co.jp/articles/ca8060af8ea36a8d53731ee6bb19075ac4b4d4b6,10/27(日) 15:30
2024-10-27,21:10,world,国際,311:22「運命をトランプ氏のような人に委ねないで」ミシェル・オバマ氏がハリス氏の応援演説テレビ朝日系（ANN）10/27(日) 10:279件/時,テレビ朝日系（ANN）,「運命をトランプ氏のような人に委ねないで」ミシェル・オバマ氏がハリス氏の応援演説,9,https://news.yahoo.co.jp/articles/1f7b02c83a0c80e0cdb7045809ab5d6f7a1b0fb7,10/27(日) 10:27
2024-10-27,21:10,world,国際,32国連事務総長が「深く憂慮」　イスラエルのイラン報復攻撃で声明毎日新聞10/27(日) 13:488件/時,毎日新聞,国連事務総長が「深く憂慮」　イスラエルのイラン報復攻撃で声明,8,https://news.yahoo.co.jp/articles/4ed7a856b734ecb29d5eee74b58408fcb39bd90b,10/27(日) 13:48
2024-10-27,21:10,world,国際,33ロシアではびこる「偽メード・イン・ジャパン」　制裁で輸入減少、ブランド力に便乗か産経新聞10/27(日) 11:058件/時,産経新聞,ロシアではびこる「偽メード・イン・ジャパン」　制裁で輸入減少、ブランド力に便乗か,8,https://news.yahoo.co.jp/articles/bc01b990b72a34e3d97d247be668b79efde32839,10/27(日) 11:05
2024-10-27,21:10,world,国際,34トラックテロか、30人超負傷　イスラエル、運転手射殺共同通信10/27(日) 18:368件/時,共同通信,トラックテロか、30人超負傷　イスラエル、運転手射殺,8,https://news.yahoo.co.jp/articles/77377d50cad5455f88a2a4cfd7ff1707680c4be4,10/27(日) 18:36
2024-10-27,21:10,world,国際,35イスラエル軍、イランが過去に核開発に使用していた施設を破壊か毎日新聞10/27(日) 18:438件/時,毎日新聞,イスラエル軍、イランが過去に核開発に使用していた施設を破壊か,8,https://news.yahoo.co.jp/articles/e0268914ec8dacd7cfb617c9ec662b4373fe6a56,10/27(日) 18:43
2024-10-27,21:10,world,国際,36韓国・高齢者世帯の年間所得、400万円近いのに…４割は貧困KOREA WAVE10/27(日) 16:038件/時,KOREA WAVE,韓国・高齢者世帯の年間所得、400万円近いのに…４割は貧困,8,https://news.yahoo.co.jp/articles/50b0d4ac0fa15bd4e5951e69c954aca0f7021fe3,10/27(日) 16:03
2024-10-27,21:10,world,国際,37イランに「深刻な打撃」とイスラエル首相共同通信10/27(日) 19:308件/時,共同通信,イランに「深刻な打撃」とイスラエル首相,8,https://news.yahoo.co.jp/articles/d69598a6b22784061da1e37e510ca39e9880fb55,10/27(日) 19:30
2024-10-27,21:10,world,国際,381:42イスラエル、イランの軍事施設を攻撃　兵士4人死亡日テレNEWS NNN10/27(日) 6:267件/時,日テレNEWS NNN,イスラエル、イランの軍事施設を攻撃　兵士4人死亡,7,https://news.yahoo.co.jp/articles/f9dc5eacf0a71c196c29ee413419328d82edcfa8,10/27(日) 6:26
2024-10-27,21:10,world,国際,39北朝鮮軍の装備は冷戦期の遺物…ロシアに最も有用なのは特攻隊員中央日報日本語版10/27(日) 13:227件/時,中央日報日本語版,北朝鮮軍の装備は冷戦期の遺物…ロシアに最も有用なのは特攻隊員,7,https://news.yahoo.co.jp/articles/db123dbb393a1dce85506d9c8c11191ed8a5f8aa,10/27(日) 13:22
2024-10-27,21:10,world,国際,40ミシェル・オバマ氏、ハリス氏応援 トランプ氏を痛烈批判ＡＦＰ＝時事10/27(日) 11:587件/時,ＡＦＰ＝時事,ミシェル・オバマ氏、ハリス氏応援 トランプ氏を痛烈批判,7,https://news.yahoo.co.jp/articles/7890bd01d66c10e41ba85ccf5c5e948b6197f184,10/27(日) 11:58
