scrp_date,scrp_time,genre_en,genre_jp,rank,media_jp,title,comment,link,date_original
2024-10-28,16:07,domestic,国内,1【速報】「痛恨の極み。原点に返る」自民・石破総裁が衆院選結果受け会見「国政に停滞は許されない」と辞任は否定FNNプライムオンライン（フジテレビ系）10/28(月) 14:171587件/時,FNNプライムオンライン（フジテレビ系）,【速報】「痛恨の極み。原点に返る」自民・石破総裁が衆院選結果受け会見「国政に停滞は許されない」と辞任は否定,1587,https://news.yahoo.co.jp/articles/9a47517d3102858d1bcc559ecce8fa46317f4023,10/28(月) 14:17
2024-10-28,16:07,domestic,国内,2【速報】小泉進次郎氏が自民党選対委員長を辞任　石破首相に辞表提出して受理されるFNNプライムオンライン（フジテレビ系）10/28(月) 12:191297件/時,FNNプライムオンライン（フジテレビ系）,【速報】小泉進次郎氏が自民党選対委員長を辞任　石破首相に辞表提出して受理される,1297,https://news.yahoo.co.jp/articles/5a044c44f9e434d37b6e7e90c3c49dfff41d8761,10/28(月) 12:19
2024-10-28,16:07,domestic,国内,3【速報】落選の公明・石井代表が辞任示唆「新体制構築含め相談。国会議員でないと困難伴う」FNNプライムオンライン（フジテレビ系）10/28(月) 11:39624件/時,FNNプライムオンライン（フジテレビ系）,【速報】落選の公明・石井代表が辞任示唆「新体制構築含め相談。国会議員でないと困難伴う」,624,https://news.yahoo.co.jp/articles/7bd4dcfaab2fe34d1221b83ec1a7b34c735499fc,10/28(月) 11:39
2024-10-28,16:07,domestic,国内,40:58【速報】指名手配の久保田陸斗容疑者（21）の身柄確保　千葉・市川の女性連れ去り強盗事件で髪色変えて逃走FNNプライムオンライン（フジテレビ系）10/28(月) 11:37434件/時,FNNプライムオンライン（フジテレビ系）,【速報】指名手配の久保田陸斗容疑者（21）の身柄確保　千葉・市川の女性連れ去り強盗事件で髪色変えて逃走,434,https://news.yahoo.co.jp/articles/9e9b8d3130136655f674ae716bd88e0c962d88f5,10/28(月) 11:37
2024-10-28,16:07,domestic,国内,5「政権交代」に現実味　立民代表、首相指名意欲共同通信10/28(月) 4:09413件/時,共同通信,「政権交代」に現実味　立民代表、首相指名意欲,413,https://news.yahoo.co.jp/articles/01cdc6873658c8238af73962b1de853744f9fa0b,10/28(月) 4:09
2024-10-28,16:07,domestic,国内,6【速報】衆院選の投票率は53.85%　前回比2.08ポイント減TBS NEWS DIG Powered by JNN10/28(月) 13:44397件/時,TBS NEWS DIG Powered by JNN,【速報】衆院選の投票率は53.85%　前回比2.08ポイント減,397,https://news.yahoo.co.jp/articles/db9639e1e71fd9c1bfa5ed3743aedf6c4591b7df,10/28(月) 13:44
2024-10-28,16:07,domestic,国内,7夫婦そろって「ただの人」丸川珠代元五輪相、夫とともに落選、ネットは「何で食べていくんだろ」「フリーアナで戻って来いよ」との声中日スポーツ10/28(月) 10:35354件/時,中日スポーツ,夫婦そろって「ただの人」丸川珠代元五輪相、夫とともに落選、ネットは「何で食べていくんだろ」「フリーアナで戻って来いよ」との声,354,https://news.yahoo.co.jp/articles/4ebc0f267c99d95802c5b1135d244a7284ded5b4,10/28(月) 10:35
2024-10-28,16:07,domestic,国内,81:50大物や現職閣僚が落選「最も冷たい風感じた」“裏金”議員は萩生田氏・西村氏当選も甘利氏・武田氏敗北…二階元幹事長の三男は比例復活できずFNNプライムオンライン（フジテレビ系）10/28(月) 6:36317件/時,FNNプライムオンライン（フジテレビ系）,大物や現職閣僚が落選「最も冷たい風感じた」“裏金”議員は萩生田氏・西村氏当選も甘利氏・武田氏敗北…二階元幹事長の三男は比例復活できず,317,https://news.yahoo.co.jp/articles/9571aa1155a8ddd9cb8d1ddd2e2f8b2d77e36897,10/28(月) 6:36
2024-10-28,16:07,domestic,国内,91:36衆院選 自民・公明が大敗 過半数割れ 立憲躍進テレビ朝日系（ANN）10/28(月) 6:19312件/時,テレビ朝日系（ANN）,衆院選 自民・公明が大敗 過半数割れ 立憲躍進,312,https://news.yahoo.co.jp/articles/bfa662b97eb41901f876993568511f68df098aa3,10/28(月) 6:19
2024-10-28,16:07,domestic,国内,10小泉選対委員長が辞任　石破首相、政権立て直し急ぐ【24衆院選】時事通信10/28(月) 4:33286件/時,時事通信,小泉選対委員長が辞任　石破首相、政権立て直し急ぐ【24衆院選】,286,https://news.yahoo.co.jp/articles/a0418db59e5d90a2ebb64669c0c52625489b9d75,10/28(月) 4:33
2024-10-28,16:07,domestic,国内,11N党立花氏を書類送検　つきまとい容疑　警視庁時事通信10/28(月) 14:19269件/時,時事通信,N党立花氏を書類送検　つきまとい容疑　警視庁,269,https://news.yahoo.co.jp/articles/b0ca9d9cd414508ae2fe125cf81f6b6fd83e8fa2,10/28(月) 14:19
2024-10-28,16:07,domestic,国内,12「ゲスすぎてひどい」フジテレビ特番 “裏金ランキング” に非難轟轟…出演者の石丸氏も「茶化しすぎ」とバッサリSmartFLASH10/28(月) 14:05268件/時,SmartFLASH,「ゲスすぎてひどい」フジテレビ特番 “裏金ランキング” に非難轟轟…出演者の石丸氏も「茶化しすぎ」とバッサリ,268,https://news.yahoo.co.jp/articles/52a7c592c826e52209819850ddedbcd3278cc047,10/28(月) 14:05
2024-10-28,16:07,domestic,国内,13石破自民が無惨なボロ負け、「誰も気づかなかった本当の原因」とは…麻生太郎の陰謀でも、高市早苗のクーデターでもなかった現代ビジネス10/28(月) 6:05256件/時,現代ビジネス,石破自民が無惨なボロ負け、「誰も気づかなかった本当の原因」とは…麻生太郎の陰謀でも、高市早苗のクーデターでもなかった,256,https://news.yahoo.co.jp/articles/46e71c670ab743230daff25a1410c97a3144b62a,10/28(月) 6:05
2024-10-28,16:07,domestic,国内,14【速報】石破総理が辞任を否定“政策実現に向け最大限努力”　衆院選で自公過半数割れの見通し 【衆議院選挙 2024】TBS NEWS DIG Powered by JNN10/27(日) 22:22244件/時,TBS NEWS DIG Powered by JNN,【速報】石破総理が辞任を否定“政策実現に向け最大限努力”　衆院選で自公過半数割れの見通し 【衆議院選挙 2024】,244,https://news.yahoo.co.jp/articles/bd16b59d598ba90c61880c5c0371b8f64f79cf48,10/27(日) 22:22
2024-10-28,16:07,domestic,国内,152:23自公過半数割れ　どうなる今後の政権運営…2つの焦点日テレNEWS NNN10/28(月) 11:46233件/時,日テレNEWS NNN,自公過半数割れ　どうなる今後の政権運営…2つの焦点,233,https://news.yahoo.co.jp/articles/5baf3fe35a8911e4fec8081459a2d7b4b1333ebc,10/28(月) 11:46
2024-10-28,16:07,domestic,国内,16衆院選、午後4時現在の投票率は24.32％　前回下回る毎日新聞10/27(日) 17:23232件/時,毎日新聞,衆院選、午後4時現在の投票率は24.32％　前回下回る,232,https://news.yahoo.co.jp/articles/37e32b1c197ec94c921044dbeca3a04ec161c6da,10/27(日) 17:23
2024-10-28,16:07,domestic,国内,17裏金候補、18勝28敗　丸川・下村氏ら落選　野党、競合区で勝率5割【24衆院選】時事通信10/28(月) 6:26217件/時,時事通信,裏金候補、18勝28敗　丸川・下村氏ら落選　野党、競合区で勝率5割【24衆院選】,217,https://news.yahoo.co.jp/articles/1d3d483fc73edcd536311f2e62c49b64c38815ff,10/28(月) 6:26
2024-10-28,16:07,domestic,国内,181:26与党過半数割れで石破総裁ら幹部の責任問う声もテレビ朝日系（ANN）10/28(月) 2:21207件/時,テレビ朝日系（ANN）,与党過半数割れで石破総裁ら幹部の責任問う声も,207,https://news.yahoo.co.jp/articles/e5139c3827b86c89283c9fd5d7acdd98f6dd43e9,10/28(月) 2:21
2024-10-28,16:07,domestic,国内,19国民、比例代表で候補不足　3議席が他党に【24衆院選】時事通信10/28(月) 8:08206件/時,時事通信,国民、比例代表で候補不足　3議席が他党に【24衆院選】,206,https://news.yahoo.co.jp/articles/f100558d6237d28be2863e43180d43617e642600,10/28(月) 8:08
2024-10-28,16:07,domestic,国内,20二階俊博氏の三男・伸康氏の落選が確実に　保守分裂の和歌山2区で敗れ、比例復活もならず産経新聞10/28(月) 1:54191件/時,産経新聞,二階俊博氏の三男・伸康氏の落選が確実に　保守分裂の和歌山2区で敗れ、比例復活もならず,191,https://news.yahoo.co.jp/articles/087404760a67bdc8ece314324d0e90a305cb968d,10/28(月) 1:54
2024-10-28,16:07,domestic,国内,21「ここまで議席が減るか…」。自民党が「驚くほどの惨敗」へ…そこで石破首相を襲う「まさかの事態」現代ビジネス10/27(日) 21:04168件/時,現代ビジネス,「ここまで議席が減るか…」。自民党が「驚くほどの惨敗」へ…そこで石破首相を襲う「まさかの事態」,168,https://news.yahoo.co.jp/articles/76b7e6075fa695b265ee1d5c332a098dfdf1c228,10/27(日) 21:04
2024-10-28,16:07,domestic,国内,220:35【速報】丸川珠代元五輪担当大臣の落選が確実　【衆議院選挙 2024】TBS NEWS DIG Powered by JNN10/27(日) 20:05163件/時,TBS NEWS DIG Powered by JNN,【速報】丸川珠代元五輪担当大臣の落選が確実　【衆議院選挙 2024】,163,https://news.yahoo.co.jp/articles/dac3542aba52bdcbe5c8e63fb961641377a95d9e,10/27(日) 20:05
2024-10-28,16:07,domestic,国内,"23石破政権""終了""へ…「戦後最短内閣か」自民大敗、党内から怒りの声続出""次の総理は茂木元幹事長説""鍵はやっぱり麻生みんかぶマガジン10/27(日) 20:00141件/時",みんかぶマガジン,"石破政権""終了""へ…「戦後最短内閣か」自民大敗、党内から怒りの声続出""次の総理は茂木元幹事長説""鍵はやっぱり麻生",141,https://news.yahoo.co.jp/articles/dc65e8454d6ac811ad6f52c89ee0ee1c37807161,10/27(日) 20:00
2024-10-28,16:07,domestic,国内,24田崎史郎氏、「モーニングショー」で「自公過半数割れ」解説…「大変な事態になる…相当厳しい国会運営、政権運営になる」スポーツ報知10/28(月) 8:46138件/時,スポーツ報知,田崎史郎氏、「モーニングショー」で「自公過半数割れ」解説…「大変な事態になる…相当厳しい国会運営、政権運営になる」,138,https://news.yahoo.co.jp/articles/05d7db9b49213d01dc406dabac2fd5d13c2b9d4f,10/28(月) 8:46
2024-10-28,16:07,domestic,国内,25日本保守党が国政政党に 衆院選「得票率2％獲得」で政党要件満たす 百田尚樹氏「急に怖くなってきたんやが」よろず～ニュース10/28(月) 13:16123件/時,よろず～ニュース,日本保守党が国政政党に 衆院選「得票率2％獲得」で政党要件満たす 百田尚樹氏「急に怖くなってきたんやが」,123,https://news.yahoo.co.jp/articles/026ebdc7510bb8f6b6cc9173da45bf12fa563cd3,10/28(月) 13:16
2024-10-28,16:07,domestic,国内,26石丸伸二氏が暴露、国民玉木氏の最終演説参加の経緯を明かし「一個人に批判の肩代わりさせんな」日刊スポーツ10/28(月) 12:25121件/時,日刊スポーツ,石丸伸二氏が暴露、国民玉木氏の最終演説参加の経緯を明かし「一個人に批判の肩代わりさせんな」,121,https://news.yahoo.co.jp/articles/83a2b2fbcc3ecdd5edc65b7c31bb460a69df82f4,10/28(月) 12:25
2024-10-28,16:07,domestic,国内,270:50衆議院選挙　自公で過半数割れの見通し【JNN議席予測】TBS NEWS DIG Powered by JNN10/27(日) 20:00121件/時,TBS NEWS DIG Powered by JNN,衆議院選挙　自公で過半数割れの見通し【JNN議席予測】,121,https://news.yahoo.co.jp/articles/ec51b05f848f82a490b9ee9a2b3c35045eff2a60,10/27(日) 20:00
2024-10-28,16:07,domestic,国内,28「てめぇ、逃げられると思うなよ」…特殊詐欺グループ「金持ち逃げ男性を集団暴行」衝撃のタトゥー写真FRIDAY10/28(月) 7:00119件/時,FRIDAY,「てめぇ、逃げられると思うなよ」…特殊詐欺グループ「金持ち逃げ男性を集団暴行」衝撃のタトゥー写真,119,https://news.yahoo.co.jp/articles/f282b912de6423b221b6d65a877eb19f326c0032,10/28(月) 7:00
2024-10-28,16:07,domestic,国内,29選挙特番の”裏金マーク”はやりすぎ？ 石丸伸二氏も「ちゃかしすぎ」「敬意が足りない」と苦言…低投票率にメディアの報道姿勢を批判する声も集英社オンライン10/28(月) 7:02119件/時,集英社オンライン,選挙特番の”裏金マーク”はやりすぎ？ 石丸伸二氏も「ちゃかしすぎ」「敬意が足りない」と苦言…低投票率にメディアの報道姿勢を批判する声も,119,https://news.yahoo.co.jp/articles/2141f111df45d0d457248b4a9f79896a95f886dc,10/28(月) 7:02
2024-10-28,16:07,domestic,国内,30高市氏「徹底的に党立て直しを」　自民執行部に、自身は当選確実共同通信10/27(日) 22:32114件/時,共同通信,高市氏「徹底的に党立て直しを」　自民執行部に、自身は当選確実,114,https://news.yahoo.co.jp/articles/24a8ae07f4b388429c4dbb513f8f663ba20c7efe,10/27(日) 22:32
2024-10-28,16:07,domestic,国内,31国民玉木雄一郎代表、怒りあらわの石丸伸二氏に謝罪「お願いしたことは事実」演説会の登壇巡り日刊スポーツ10/28(月) 15:29111件/時,日刊スポーツ,国民玉木雄一郎代表、怒りあらわの石丸伸二氏に謝罪「お願いしたことは事実」演説会の登壇巡り,111,https://news.yahoo.co.jp/articles/0305d79f0142c98855cfd29dd7284cefa1176d57,10/28(月) 15:29
2024-10-28,16:07,domestic,国内,32丸川珠代氏の落選　古巣テレ朝が放送開始３分で伝える「お助け下さいと涙の訴えは届きませんでした」選挙事務所も落胆デイリースポーツ10/27(日) 20:15108件/時,デイリースポーツ,丸川珠代氏の落選　古巣テレ朝が放送開始３分で伝える「お助け下さいと涙の訴えは届きませんでした」選挙事務所も落胆,108,https://news.yahoo.co.jp/articles/42410d450d0276427a48efc06c7cc8409fa3659b,10/27(日) 20:15
2024-10-28,16:07,domestic,国内,33まるで新聞の号外…「国民民主党」のビラに殺到した若者たち　人が集まりすぎて「パニック状態」旋風起こすENCOUNT10/28(月) 11:28108件/時,ENCOUNT,まるで新聞の号外…「国民民主党」のビラに殺到した若者たち　人が集まりすぎて「パニック状態」旋風起こす,108,https://news.yahoo.co.jp/articles/694a48f469eb05f87ea5ab1b207fff48e01cf199,10/28(月) 11:28
2024-10-28,16:07,domestic,国内,34【衆院選】萩生田光一氏、当確で「八王子市民」Ｘトレンド入り「恥ずかしい」「闇深い」の声日刊スポーツ10/28(月) 0:28104件/時,日刊スポーツ,【衆院選】萩生田光一氏、当確で「八王子市民」Ｘトレンド入り「恥ずかしい」「闇深い」の声,104,https://news.yahoo.co.jp/articles/4fe605fba4b55033885669fd68d6bb21a0f9068a,10/28(月) 0:28
2024-10-28,16:07,domestic,国内,35「維新、国民民主は政権協議に応じよ」　少数与党内閣なら国益損なう　藤川晋之助氏が指摘産経新聞10/28(月) 13:46101件/時,産経新聞,「維新、国民民主は政権協議に応じよ」　少数与党内閣なら国益損なう　藤川晋之助氏が指摘,101,https://news.yahoo.co.jp/articles/62c8fb86f13f656e5afbe6fca6bcc3f40622d50e,10/28(月) 13:46
2024-10-28,16:07,domestic,国内,36衆院選「投票率の低さ」がトレンド入り　「あきれる」「政治家だけでなく国民も終わってる」と嘆きの声続々スポニチアネックス10/27(日) 19:3799件/時,スポニチアネックス,衆院選「投票率の低さ」がトレンド入り　「あきれる」「政治家だけでなく国民も終わってる」と嘆きの声続々,99,https://news.yahoo.co.jp/articles/646643bca523cc312eed1e1cb4697d63e43163fd,10/27(日) 19:37
2024-10-28,16:07,domestic,国内,37薄氷勝利の萩生田氏、追加公認については「（自民党の）マニフェストもまだ見てないのでわかりません」と石破政権に恨み節…比例復活の有田氏は「これで終わりじゃない」集英社オンライン10/28(月) 11:4699件/時,集英社オンライン,薄氷勝利の萩生田氏、追加公認については「（自民党の）マニフェストもまだ見てないのでわかりません」と石破政権に恨み節…比例復活の有田氏は「これで終わりじゃない」,99,https://news.yahoo.co.jp/articles/4834807b5afad74531fd1176a4ca2b328d037ac3,10/28(月) 11:46
2024-10-28,16:07,domestic,国内,38維新・吉村共同代表　大阪全勝も議席減の衆院選「野党の中でひとり負け」代表選は「実施が筋」スポニチアネックス10/28(月) 13:3796件/時,スポニチアネックス,維新・吉村共同代表　大阪全勝も議席減の衆院選「野党の中でひとり負け」代表選は「実施が筋」,96,https://news.yahoo.co.jp/articles/428eb1fc3c62b2414fc0bc379c4c622bfd486841,10/28(月) 13:37
2024-10-28,16:07,domestic,国内,39国民躍進、連立参加は否定　玉木氏「政策実現が大切」【24衆院選】時事通信10/27(日) 23:3590件/時,時事通信,国民躍進、連立参加は否定　玉木氏「政策実現が大切」【24衆院選】,90,https://news.yahoo.co.jp/articles/ba9f376ce5459f95f9c86760783ba3bad32acb38,10/27(日) 23:35
2024-10-28,16:07,domestic,国内,40立憲民主党に敵失で勢い　躍進で歓喜の声も野田佳彦代表「笑っている場合じゃない」産経新聞10/27(日) 21:5387件/時,産経新聞,立憲民主党に敵失で勢い　躍進で歓喜の声も野田佳彦代表「笑っている場合じゃない」,87,https://news.yahoo.co.jp/articles/1fc99077d3a95d588d1f0e4f6d2ec2b405b9868a,10/27(日) 21:53
