scrp_date,scrp_time,genre_en,genre_jp,rank,media_jp,title,comment,link,date_original
2025-03-23,20:07,local,地域,1,中国新聞デジタル,【事故】パトカー追跡中の2人乗りバイクがトンネル外壁に衝突、男性1人死亡　広島市中区,395,https://news.yahoo.co.jp/articles/e427cc56bfde5da6569a7a1f2a0b7d1a9cb03ca9,3/23(日) 7:38
2025-03-23,20:07,local,地域,2,中京テレビＮＥＷＳ,名鉄犬山線の踏切で電車と車が接触する事故　車の運転手が死亡　電車の乗客らにけが人なし,162,https://news.yahoo.co.jp/articles/ba1c6c905aa12842c1e10699cb70e77bbeabf499,3/23(日) 17:13
2025-03-23,20:07,local,地域,3,あいテレビ,車いすに乗った女性がJR踏切内で列車にはねられ死亡 非常ボタンを押された形跡なし 愛媛・松山市,80,https://news.yahoo.co.jp/articles/45004e24f5e84f0bc49cfcebe7f784192a13146e,3/23(日) 10:25
2025-03-23,20:07,local,地域,4,ABCニュース,泣き叫ぶ様子の電話から知人が通報　女性遺体を山中に遺棄した疑いで逮捕の男　事件直前にコンビニ駐車場で合流か　徳島,79,https://news.yahoo.co.jp/articles/efe6865a43aadb1180803cf91633cf137a4b6966,3/23(日) 12:29
2025-03-23,20:07,local,地域,5,NBS長野放送,「今夏の参院選は自民対野党の一大決戦」立憲・杉尾秀哉県連代表　“野党連携”呼びかけへ,71,https://news.yahoo.co.jp/articles/6678860dba961174e3026f821516c638767b65fc,3/23(日) 18:39
2025-03-23,20:07,local,地域,6,新潟日報,“米騒動”受け出荷量確保に課題も…「2030年にコメ輸出8倍」政府目標拡大に、輸出に取り組む企業・生産者の思いは,48,https://news.yahoo.co.jp/articles/efc4ea60e13a4f83a22cac40341e837e564f559e,3/23(日) 14:02
2025-03-23,20:07,local,地域,7,新潟ニュースNST,「仕事のストレスを発散するために…」路上で下半身を露出して公然わいせつで逮捕された50代の県職員に停職6カ月の懲戒処分　新潟県,35,https://news.yahoo.co.jp/articles/f62c3f43c686ab3207118bfab38ed0e62497632f,3/23(日) 18:13
2025-03-23,20:07,local,地域,8,テレビ高知,【速報】全国トップを切って高知でサクラ開花発表　平年より1日遅く,29,https://news.yahoo.co.jp/articles/44f3353e6ffa8a0f936c2d755f039a5876ccc578,3/23(日) 14:24
2025-03-23,20:07,local,地域,9,中京テレビＮＥＷＳ,死亡バスの運転手に持病なく勤務前に約9時間の休憩 夜行バス事故運転手死亡 21人ケガ 三重・御浜町,29,https://news.yahoo.co.jp/articles/d20544d8a556f1ce7a8675b4050e99f140a033ee,3/23(日) 17:56
2025-03-23,20:07,local,地域,10,神戸新聞NEXT,兵庫県告発文書問題、第三者委報告書を読み解く(中)公益通報　「対応違法」百条委より踏み込む,28,https://news.yahoo.co.jp/articles/37aea896d507a1e3c80ee1f180cd0c430485389e,3/23(日) 10:30
2025-03-23,20:07,local,地域,11,テレビ高知,客が代行運転手の襟をつかみ押し倒すなどの暴行を加えた疑い　男（50）を逮捕　「服をつかんだが私は悪くない」と容疑を一部否認【高知】,26,https://news.yahoo.co.jp/articles/9565113ba27fd12712b204db9cdff230fe940c85,3/23(日) 19:26
2025-03-23,20:07,local,地域,12,チューリップテレビ,「解散命令請求は人権侵害」　旧統一教会が全国一斉に訴え　25日にも東京地裁が判断示すか　富山,26,https://news.yahoo.co.jp/articles/eab14909116ef189b9d04d8984b8d6d5ba2afd67,3/23(日) 18:06
2025-03-23,20:07,local,地域,13,YBS山梨放送,J3降格圏に…首位とのホーム戦はラストプレーに被弾 甲府が逆転負けで18位に 山梨,24,https://news.yahoo.co.jp/articles/7e82820a467e6c4cee848defffafa30a8b1f4e6d,3/23(日) 18:35
2025-03-23,20:07,local,地域,14,中京テレビＮＥＷＳ,巡査(22)逮捕「お酒に酔っていて私のしたことなのかどうか覚えていません」“置き引き”容疑  愛知・東警察署,22,https://news.yahoo.co.jp/articles/2d525fed2f602171e203bf3044da2d423fe3c388,3/23(日) 19:13
2025-03-23,20:07,local,地域,15,メ〜テレ（名古屋テレビ）,【速報】岐阜県郡上市でヘリコプターが墜落　操縦士と同乗者の男性2人が軽傷　個人所有の小型ヘリか,20,https://news.yahoo.co.jp/articles/d12b902b1d458927daa2ff22be48e65924c53368,3/23(日) 12:34
2025-03-23,20:07,local,地域,16,神戸新聞NEXT,万博の「関西パビリオン」完成　兵庫県ゾーンは時空を超える映像体験「ミライバス」,19,https://news.yahoo.co.jp/articles/d0ed2e43b8c17de21e8f7054dda112b731f3c46b,3/23(日) 18:56
2025-03-23,20:07,local,地域,17,中国新聞デジタル,落ちていたエアタグ持ち去った疑い　75歳男を逮捕　持ち主が発信情報確認し発覚,19,https://news.yahoo.co.jp/articles/4223218812046181b6496260ad8d37fb709ce083,3/23(日) 10:34
2025-03-23,20:07,local,地域,18,TSKさんいん中央テレビ,大手飲食チェーン「すき家」鳥取南吉方店で「みそ汁」の中にネズミ混入（鳥取市）,17,https://news.yahoo.co.jp/articles/6af0402f933dd2cf0279411ca79c67055b660962,3/23(日) 18:09
2025-03-23,20:07,local,地域,19,中京テレビＮＥＷＳ,【速報】観光バスが林に突っ込む 少なくとも21人ケガ 三重・御浜町 国道42号,17,https://news.yahoo.co.jp/articles/501269aea7de1d6bc7c960fb69611e2dc9e020e3,3/22(土) 21:48
2025-03-23,20:07,local,地域,20,北海道新聞,札幌駅前、バス乗り場分散「いつまで我慢」　再開発ビル開業延期で広がる不満,16,https://news.yahoo.co.jp/articles/3200bbefff732b088d39447477e1b0c48df553b0,3/23(日) 13:45
2025-03-23,20:07,local,地域,21,東海テレビ,事故につながる持病確認されず…道路脇の防風林に突っ込み死亡した大型バスの57歳運転手 経歴約20年のベテラン,16,https://news.yahoo.co.jp/articles/650255640b4e38b3b31a2c21c760a2e1c42afe95,3/23(日) 12:12
2025-03-23,20:07,local,地域,22,北海道ニュースUHB,【酔ったタクシー乗客が強盗致傷事件】31歳男が運転手を殴り助手席に置かれていた現金1万2000円を強奪→数百メートル先で通行人に絡んでいたところを逮捕される〈北海道・苫小牧市〉,16,https://news.yahoo.co.jp/articles/4ce61365253b11d2cd6e3e82ce9b3c7509263220,3/23(日) 18:23
2025-03-23,20:07,local,地域,23,中国新聞デジタル,公立病院経営に物価高や人材不足が直撃　病棟建て替えの中断や規模縮小も 「経営努力のみでは対応困難」国へ支援要望,16,https://news.yahoo.co.jp/articles/d6f9b8fe4c2910911a970e2724fb9c33951fe727,3/23(日) 11:31
2025-03-23,20:07,local,地域,24,山陰中央新報,松江生協病院　療養病棟を休止　４月から４０床、看護師不足が理由　「患者のことを思うと苦渋の判断」　島根県,16,https://news.yahoo.co.jp/articles/a3a83fda6245ec6470f2210988aa2749799049b1,3/23(日) 17:45
2025-03-23,20:07,local,地域,25,高知さんさんテレビ,【高知】徳島の山中への死体遺棄容疑で香美市・土佐山田郵便局の社員を逮捕　日本郵便四国支社が公表,15,https://news.yahoo.co.jp/articles/3f9ac7eb28fb5a64e2ef3df1840060f29e8d2702,3/23(日) 18:31
2025-03-23,20:07,local,地域,26,新潟日報,長岡市の女性職員、給与平均は男性職員平均の62・4％　市議会で話題に,14,https://news.yahoo.co.jp/articles/9612fd9e86c7db143c15de0cb303efff4e905e52,3/23(日) 15:02
2025-03-23,20:07,local,地域,27,TNCテレビ西日本,「朝５時に麦焼酎の緑茶割り一合飲んだ」　酒気帯び運転で７７歳男を逮捕　警察官が“赤ら顔”で運転している男を発見　呼気から基準値超のアルコール　「酒は残っていないと思った」容疑を否認　福岡・飯塚市,14,https://news.yahoo.co.jp/articles/dcfbf42c18b114d33236895029258a56fe887ec7,3/23(日) 15:18
2025-03-23,20:07,local,地域,28,琉球新報,沖縄のプールの水、またまた凍った！今回で3度目　子どもたちチェック、日課に　南城,13,https://news.yahoo.co.jp/articles/cf40fc012ce76e544ca90e0ab9060f95bfff0b63,3/23(日) 11:21
2025-03-23,20:07,local,地域,29,静岡朝日テレビ,静岡・下田市の道の駅で車を隣に駐車しトラブルに　お互いが相手の車を傷つけ男２人が逮捕,13,https://news.yahoo.co.jp/articles/1d761924bec8bf785b317881804b38085be817a9,3/23(日) 10:43
2025-03-23,20:07,local,地域,30,テレビ新広島,パトカー追跡中の2人乗りバイクが事故 インドネシア国籍の男性(22)が死亡,13,https://news.yahoo.co.jp/articles/3f0845adcbfbc8756e7d3e28230bfb54a60bbece,3/23(日) 12:12
2025-03-23,20:07,local,地域,31,Daiichi-TV（静岡第一テレビ）,【事故】緊急走行中のパトカーと停止中の車　サイドミラー同士が接触 けが人なし（静岡中央警察署）,12,https://news.yahoo.co.jp/articles/af18d186a534236d5dc549046c49e978be3e2b84,3/23(日) 17:37
2025-03-23,20:07,local,地域,32,静岡放送（SBS）,バイク運転の高校生が全身を強く打ち意識不明の重体　信号機のある交差点で軽乗用車と衝突=静岡市駿河区,12,https://news.yahoo.co.jp/articles/d621132544e0346066b2033e1a767d0dd6f81906,3/23(日) 15:46
2025-03-23,20:07,local,地域,33,日本海テレビ,牛丼チェーンでみそ汁にネズミ混入　会社は再発防止徹底を,11,https://news.yahoo.co.jp/articles/bff57359d31ea750b4b49d79ea5f1be48644c155,3/23(日) 19:47
2025-03-23,20:07,local,地域,34,静岡朝日テレビ,緊急走行中のパトカーが乗用車に接触する事故　運転の警察官「目測を誤ってしまった」　静岡市,11,https://news.yahoo.co.jp/articles/a78022103e7401f75d604f0c7ed40777e45fad0c,3/23(日) 19:25
2025-03-23,20:07,local,地域,35,BSS山陰放送,「将来日本で働きたい」アジア5か国の若者が通う“鳥取城北日本語学校”　高度人材育成から「介護」分野にシフト　卒業生の進路は?,11,https://news.yahoo.co.jp/articles/fb0c26207a851eed7d48dcb5b2bb346347952f98,3/23(日) 10:09
2025-03-23,20:07,local,地域,36,NBS長野放送,大型バイクの男性（63）死亡　国道カーブで車と衝突　バイクが対向車線にはみ出したか,11,https://news.yahoo.co.jp/articles/458b1a49eda9a44b6fb52f0a5ad664831a2035a1,3/23(日) 10:14
2025-03-23,20:07,local,地域,37,読売新聞オンライン,中学教諭が学校に不要物持ち込んだ生徒の腹殴って胸を押す…体罰に認定、剣道の練習中で生徒は防具を着用,11,https://news.yahoo.co.jp/articles/9a609f5e73b047e78133d14d304e3b29ee8995c1,3/23(日) 11:04
2025-03-23,20:07,local,地域,38,RKB毎日放送,パトロール中の警察官が不審な車を発見→追跡するも猛スピードで逃走し電柱に衝突→警察の発見時運転手はすでに立ち去る,10,https://news.yahoo.co.jp/articles/0f5e89865b61060019a8edffc76be240e3dd3a3b,3/23(日) 8:57
2025-03-23,20:07,local,地域,39,読売新聞オンライン,少年のオートバイが大きな排気音・高速度で走行、追跡した白バイと接触し転倒…左手首骨折などのけが,10,https://news.yahoo.co.jp/articles/572af1199c67602e37f829ecd8f9b42b6c9d3975,3/23(日) 11:07
2025-03-23,20:07,local,地域,40,神戸新聞NEXT,警察官名乗る男ら「身の潔白示すため」290万円振り込ませる　神戸の大学生の女性、詐欺被害,10,https://news.yahoo.co.jp/articles/71d5e90b31c67ba045779bddc0230589e5037671,3/23(日) 15:15
