scrp_date,scrp_time,genre_en,genre_jp,rank,media_jp,title,comment,link,date_original
2024-09-11,09:27,world,国際,1,テレビ朝日系（ANN）,英　刑務所パンク寸前で受刑者1700人釈放　増設が間に合わず,165,https://news.yahoo.co.jp/articles/bc5c5b67068122e3854262dba48c1d10548e14fd,9/11(水) 2:33
2024-09-11,09:27,world,国際,2,ハンギョレ新聞,「円明園から出て行け」…中国で日本人観光客へのヘイト事件相次ぐ,85,https://news.yahoo.co.jp/articles/5012cc4547d1f10ff0fa83a18cb562238e69561a,9/11(水) 7:24
2024-09-11,09:27,world,国際,3,CNN.co.jp,観光客が洞窟に落としたスナック菓子で「世界が一変」、米国立公園が注意喚起,54,https://news.yahoo.co.jp/articles/3eeeb584a7e217a53db9c3a21aefca61201c6937,9/10(火) 19:30
2024-09-11,09:27,world,国際,4,中央日報日本語版,「独島の日を国家記念日に」…韓国首相「紛争地域化は劣等な外交」,52,https://news.yahoo.co.jp/articles/dcca58531d2febbb1e87ca9b7a064d31597bfa45,9/11(水) 8:02
2024-09-11,09:27,world,国際,5,中央日報日本語版,韓国南部・慶南で相次ぎ少女像テロ…市民団体「被害者侮辱に対して厳罰を」,43,https://news.yahoo.co.jp/articles/31d7dd80f664f4c676f6f24e7843f33a7c00cca3,9/11(水) 7:32
2024-09-11,09:27,world,国際,6,共同通信,SNS子供使用の禁止法案提出へ　オーストラリア、14歳未満を軸,27,https://news.yahoo.co.jp/articles/85f0c09347f4956eb01094ff218d3aa5c9c33826,9/10(火) 10:32
2024-09-11,09:27,world,国際,7,クーリエ・ジャポン,米紙が報じる「日本のセブンイレブンは、米国の店舗とまるで違う」,22,https://news.yahoo.co.jp/articles/c0928f6fcc3582d026451eb24c7975d785f47100,9/11(水) 8:30
2024-09-11,09:27,world,国際,8,ロイター,ウクライナに供与の長距離兵器、使用制限解除「調整中」＝米大統領,21,https://news.yahoo.co.jp/articles/65e32b88eee55c38d70edcf1a17627a4dc8832f0,9/11(水) 7:04
2024-09-11,09:27,world,国際,9,ハフポスト日本版,「移民がペットを誘拐して食べている」と米共和党ヴァンス氏がSNSで主張。ネット陰謀論に議員らも同調,20,https://news.yahoo.co.jp/articles/31798c5615d50987917c3b06d8ff8fc78fa8107a,9/10(火) 20:20
2024-09-11,09:27,world,国際,10,Forbes JAPAN,中国軍による領空侵犯・領海進入に警戒強める自衛隊　台湾有事も念頭にした動きか,18,https://news.yahoo.co.jp/articles/b8d91cc0f5ca3b01ce1ec09fca36ff042d72f320,9/11(水) 8:15
2024-09-11,09:27,world,国際,11,時事通信,ベラルーシ、対日批判続ける　邦人拘束判明から1週間　プーチン政権に同調,18,https://news.yahoo.co.jp/articles/ade24c4bec6ea38d32ce5c0ee8e8f4c4aba84ce5,9/11(水) 7:07
2024-09-11,09:27,world,国際,12,WEB Voice,安倍元首相なきいま、日本にトランプ氏と対抗できる政治家はいるのか?,17,https://news.yahoo.co.jp/articles/234a6c8361c561d1ed7ca2cdcd8fd9a638ba648e,9/10(火) 11:50
2024-09-11,09:27,world,国際,13,現代ビジネス,石垣島で粛々と進む「日米軍事一体化」衝撃の裏側！美しきリゾート地「ミサイル要塞基地」に,16,https://news.yahoo.co.jp/articles/c70b955b95dcae04a0c93cbec8d98b0233151e6b,9/11(水) 6:49
2024-09-11,09:27,world,国際,14,時事通信,60万人以上が学校通えず　ガザ小中学校で新年度　国連,16,https://news.yahoo.co.jp/articles/ceacad8ac4edf755d9990053b70f439a2592cfd9,9/10(火) 13:32
2024-09-11,09:27,world,国際,15,産経新聞,モスクワ近郊に最大規模ドローン攻撃か　1人死亡、露国防省は東部で4集落制圧と主張,16,https://news.yahoo.co.jp/articles/cb2fb19a2a2dfc4e56b6e803fd808602b3c25c9c,9/10(火) 19:56
2024-09-11,09:27,world,国際,16,毎日新聞,出るかハリス氏決めゼリフ「アイム・スピーキング」 トランプ節対策,13,https://news.yahoo.co.jp/articles/eff97239aa613f0f5869c7e08512aef235cbd966,9/11(水) 5:00
2024-09-11,09:27,world,国際,17,読売新聞オンライン,モスクワ近郊など９州にウクライナ軍が「最大規模の無人機攻撃」…三つの国際空港が一時閉鎖,12,https://news.yahoo.co.jp/articles/517442b9cd306604a23e65c50f41e7ad66753d0f,9/10(火) 20:23
2024-09-11,09:27,world,国際,18,産経新聞,ハリス、トランプ両氏が直接対決へ　初討論会　支持率拮抗で相手の失速狙う,12,https://news.yahoo.co.jp/articles/4e291ea4b520d8a3f0d26f0cc90fa29e243dc027,9/11(水) 7:35
2024-09-11,09:27,world,国際,19,ロイター,台風11号直撃のベトナム、58人死亡・48人不明　橋が崩落し車8台流される,12,https://news.yahoo.co.jp/articles/61050f419651535a6ec4675f1b109cfb48b9a474,9/10(火) 13:05
2024-09-11,09:27,world,国際,20,読売新聞オンライン,昨夏更迭の中国前外相、出版社で「低レベルの職務」に左遷…米紙報道,12,https://news.yahoo.co.jp/articles/366bda5cf034012837d6c56e72a996390e83c094,9/11(水) 7:25
2024-09-11,09:27,world,国際,21,ロイター,米大統領候補、10日の討論会で初対決　会場付近は厳戒態勢,12,https://news.yahoo.co.jp/articles/6c9c58c1093ba9191cd2e6113bdecdfb9c02ae5f,9/10(火) 13:28
2024-09-11,09:27,world,国際,22,中央日報日本語版,月餅も茅台酒も売れない…不況の沼に落ちた中国経済,12,https://news.yahoo.co.jp/articles/bf4b74237f793cc479d980ec68a481d98b2afacc,9/11(水) 7:19
2024-09-11,09:27,world,国際,23,時事通信,ロシア海軍が9万人演習　中国参加、日米欧を威嚇,11,https://news.yahoo.co.jp/articles/52e821e42562f758d3a670364a9982f2fae34a86,9/10(火) 22:11
2024-09-11,09:27,world,国際,24,TBS NEWS DIG Powered by JNN,ロシア海軍 400隻以上参加の大規模演習を開始　中国海軍も参加,11,https://news.yahoo.co.jp/articles/15e71db009856e0f21494c7a360f7b379058032c,9/11(水) 5:59
2024-09-11,09:27,world,国際,25,テレビ朝日系（ANN）,イラン　ロシアへ短距離弾道ミサイル供与に対する欧州各国の制裁を非難,10,https://news.yahoo.co.jp/articles/2407bb38139220be17f2998049291a6ce3dc55f9,9/11(水) 8:00
2024-09-11,09:27,world,国際,26,Wedge（ウェッジ）,＜国民の70%が核保有を支持＞それでも韓国が核開発へ進まないいくつもの理由,10,https://news.yahoo.co.jp/articles/043d94af1c2d4a30f9881185bdafa56295641cfa,9/11(水) 5:02
2024-09-11,09:27,world,国際,27,現代ビジネス,ドイツはもうおしまいだ…フォルクスワーゲンが国内工場を閉鎖した「真の原因」,10,https://news.yahoo.co.jp/articles/56b0f88a804212365573634a37405e8050adcad2,9/10(火) 9:59
2024-09-11,09:27,world,国際,28,ハンギョレ新聞,韓国のコストコで売られた「米国産牛肉」から銃弾見つかる…検査せずに食卓へ,10,https://news.yahoo.co.jp/articles/303771af0d5f4be2a5aac0e69c6e0a06a4278d09,9/11(水) 7:49
2024-09-11,09:27,world,国際,29,文春オンライン,マイナス30度の川で洗濯、屋外トイレで伝染病が…“原始的すぎる”生活が続く北朝鮮の農村で不満が爆発中,10,https://news.yahoo.co.jp/articles/2b9c0a4e5243c9fa34fcca15169f4f174f93709b,9/11(水) 6:12
2024-09-11,09:27,world,国際,30,読売新聞オンライン,ＢＴＳのＳＵＧＡさん、電動スクーター飲酒運転で略式起訴…血中アルコール濃度が免許取り消し基準の３倍,10,https://news.yahoo.co.jp/articles/a7e09b00e60303c48a447f396a953f8d45371f65,9/11(水) 6:46
2024-09-11,09:27,world,国際,31,毎日新聞,どうする「即興の90分」　ハリス氏とトランプ氏、11日午前に初対決,10,https://news.yahoo.co.jp/articles/04fdaf208e3323de1f4bf957725c0b70202e81db,9/10(火) 19:16
2024-09-11,09:27,world,国際,32,中央日報日本語版,４兆３０００億ウォンのサムスン半導体技術…中国に持ち出した元役員を送検,9,https://news.yahoo.co.jp/articles/d543b3479ee6fdf59fc0958e004d5b1edd1e53f9,9/11(水) 8:31
2024-09-11,09:27,world,国際,33,クーリエ・ジャポン,「ラーメン1000円の壁」を米紙が取材したら、日本経済の問題が見えてきた,9,https://news.yahoo.co.jp/articles/69f8de3c4b47944bc5c44683ca270ae07571aa03,9/10(火) 19:00
2024-09-11,09:27,world,国際,34,Wedge（ウェッジ）,「ロシア人の４割は戦争に反対だ」それでも反対意見を封殺する「恐怖・貧困・プロパガンダ」によるプーチンの統治システム,9,https://news.yahoo.co.jp/articles/187332ad4f0f1575c7add022ad8b0a4a2b828fd3,9/11(水) 5:02
2024-09-11,09:27,world,国際,35,NEWSポストセブン,ロシアのプーチン大統領が北朝鮮の金正恩総書記に「24頭のロシア産名馬」を贈る　ウクライナ戦争への協力や首脳間親密化の狙いも,9,https://news.yahoo.co.jp/articles/28f9d3c11ae67cbe77697b10df2fe44c6a350228,9/11(水) 7:15
2024-09-11,09:27,world,国際,36,中央日報日本語版,「生後４５日の子犬、箱に入れて配送」目を疑わせた韓国ネット通販の掲示物,8,https://news.yahoo.co.jp/articles/999728d9fe5eeef50165442be5bbf4df8454389c,9/11(水) 8:31
2024-09-11,09:27,world,国際,37,KOREA WAVE,韓国原子力研究院、90％高純度ウラン抽出に成功…「濃縮」とは異なる概念,8,https://news.yahoo.co.jp/articles/12c29354ccd04dec3e02652d43aabf77ed6f45da,9/11(水) 8:03
2024-09-11,09:27,world,国際,38,TBS NEWS DIG Powered by JNN,イスラエル、ハマス最高指導者をガザから退避させることを提案　人質解放などの見返りに,8,https://news.yahoo.co.jp/articles/e58de938952dacf4c2a165a32d0da824e7cf4538,9/11(水) 8:05
2024-09-11,09:27,world,国際,39,現代ビジネス,水に浮かべば有罪！　45キロ以下なら魔女！　中世にはびこった魔女を見分ける理不尽な判定法,8,https://news.yahoo.co.jp/articles/7e85c195f08c5b64d4346a3ba5983966ad966596,9/11(水) 7:05
2024-09-11,09:27,world,国際,40,テレビ朝日系（ANN）,ウクライナがロシアに過去最大規模ドローン攻撃　女性1人死亡　ロシア側144機撃墜,8,https://news.yahoo.co.jp/articles/65351b974dd6988ba955ab59cc090e93b4528411,9/10(火) 20:11
