scrp_date,scrp_time,genre_en,genre_jp,rank,media_jp,title,comment,link,date_original
2024-06-18,15:27,TTL,総合,1,TBS NEWS DIG Powered by JNN,【速報】携帯契約の本人確認、マイナンバーカードの読み取り義務化へ　運転免許証などの券面確認は「廃止」,1402,https://news.yahoo.co.jp/articles/4abc10e3196b50c98c43ab19dd412ef1e5f031cf,6/18(火) 9:33
2024-06-18,15:27,TTL,総合,2,ABEMA TIMES,パパ30人、月収500万のパパ活女子が赤裸々告白「おぢはみんなちょろい」「“俺好みに染めてやった”と思わせる」,314,https://news.yahoo.co.jp/articles/09806910736d73a4badbe686b7c6c7516f9c5224,6/18(火) 6:51
2024-06-18,15:27,TTL,総合,3,中国新聞デジタル,中学校の上履きがスリッパ!?　災害時の避難が心配　疑問視する保護者に学校は「決まりだから」,238,https://news.yahoo.co.jp/articles/3e9599bdef3d2826a95f87101645f38d5091fd04,6/18(火) 10:01
2024-06-18,15:27,TTL,総合,4,AERA dot.,佐々木朗希がシーズンオフでトレードされる可能性は「ある」　メジャー強行突破が許されない理由,232,https://news.yahoo.co.jp/articles/2fa978cece10fe12278c824f7ff72eed6b0ea6a5,6/18(火) 14:11
2024-06-18,15:27,TTL,総合,5,スポニチアネックス,女性を「チラ見」だけで痴漢？　人気アイドルが呼びかけ「女性がみんなこんなこと思っていると思わないで」,217,https://news.yahoo.co.jp/articles/87dbd92396ea58672d117b828ccb208d022ce0f4,6/18(火) 9:55
2024-06-18,15:27,TTL,総合,6,毎日新聞,維新、規正法反対決定　旧文通費見直さぬ自民に反発、対応一転,206,https://news.yahoo.co.jp/articles/4fc6afed91f9aea22447a4c1d5a3589462150255,6/18(火) 9:59
2024-06-18,15:27,TTL,総合,7,毎日新聞,救急外来を1日2回受診も誤診　男子高校生が死亡　名古屋の日赤病院,206,https://news.yahoo.co.jp/articles/82d487ec8597f4fb11e4db71deb0e68c01035ffc,6/17(月) 18:19
2024-06-18,15:27,TTL,総合,8,読売新聞オンライン,長女の健診結果巡り市議「医師を辞めてしまえ」、小学校医が辞任…「言い過ぎたと反省している」,201,https://news.yahoo.co.jp/articles/0d7f055034ec3ab942990aefc64de914f7fc9665,6/17(月) 22:18
2024-06-18,15:27,TTL,総合,9,デイリー新潮,ほぼ無名、大した実績もなし、身の程知らず…石丸伸二氏に批判的な言説はなぜ炎上するのか【都知事選】,191,https://news.yahoo.co.jp/articles/c6bc3617e65176f7225cf73c90ba2e7590abc73e,6/18(火) 11:10
2024-06-18,15:27,TTL,総合,10,日刊スポーツ,蓮舫氏「本物の少子化対策」都知事選政策発表で小池百合子知事の肝いり政策にケンカ売る？,184,https://news.yahoo.co.jp/articles/0b3ca473daa1c5462dcec1f8429f93ef4e9979db,6/18(火) 14:29
2024-06-18,15:27,TTL,総合,11,毎日新聞,維新・遠藤氏　問責決議案に協力しない党は「恥かかせる」,174,https://news.yahoo.co.jp/articles/bb3170000a94d54199c524f9f7e403385e925f39,6/18(火) 14:13
2024-06-18,15:27,TTL,総合,12,中国新聞デジタル,大阪の次は福岡で公演…「推し」が来ない！　コンサートやライブの「広島飛ばし」なぜ？　実態を探った,168,https://news.yahoo.co.jp/articles/be8057f505cb31590cb00c65136fd19abd40b8c1,6/18(火) 7:00
2024-06-18,15:27,TTL,総合,13,中京テレビＮＥＷＳ,研修医が救急外来受診の10代男性に誤診断　適切な治療できず患者死亡　日赤名古屋第二病院,161,https://news.yahoo.co.jp/articles/b54f1445652c326372e47e28ca367b060a1dd164,6/17(月) 16:52
2024-06-18,15:27,TTL,総合,14,テレビ朝日系（ANN）,「馬鹿にしているのか」ヒグマ駆除　町と猟友会が交渉決裂「高校生のバイト以下」,160,https://news.yahoo.co.jp/articles/a9aac093d38ec891fd99368a0f04c8eaad711b8e,6/17(月) 17:33
2024-06-18,15:27,TTL,総合,15,HBCニュース北海道,【女子高校生殺害】被害者の女子高校生がコンビニで助けを求めるも、内田容疑者らは「この子はおかしくなっているので取り合わなくていい」旨の説明をし連れ去る　北海道旭川市,144,https://news.yahoo.co.jp/articles/f19dfec1307894ec38438ba0f52d1834f2083c92,6/18(火) 11:36
2024-06-18,15:27,TTL,総合,16,日テレNEWS NNN,【速報】横浜・鶴見駅近くの路上で自転車とトラックの事故　自転車に乗っていた小6男児が死亡,141,https://news.yahoo.co.jp/articles/cf882fb5ca0efec06d8274f6604659bf1e438e11,6/17(月) 23:00
2024-06-18,15:27,TTL,総合,17,FRIDAY,“制御不能”状態の『霜降り明星』粗品　宮迫＆キムタクに“言いたい放題”も「吉本が手放さないワケ」,135,https://news.yahoo.co.jp/articles/2ec58a8f3109a3b4ed645ac8a892c9575d537a84,6/18(火) 11:00
2024-06-18,15:27,TTL,総合,18,TBS NEWS DIG Powered by JNN,泥酔女性（20代）をビルに連れ込み2回性的暴行か　無職の男（35）を逮捕　警視庁,132,https://news.yahoo.co.jp/articles/8c9d86bed93ff6bc3199c2adb7513050f5bc5e48,6/18(火) 12:24
2024-06-18,15:27,TTL,総合,19,Full-Count,大谷翔平、左翼線二塁打で1か月ぶり3安打　ベッツ骨折の非常事態に1番で躍動…敵地騒然,120,https://news.yahoo.co.jp/articles/727b7bff86b759ebaca59b7630f86f0ba8b3ac3c,6/18(火) 11:08
2024-06-18,15:27,TTL,総合,20,JBpress,プーチンが4州割譲を求める最後通告、「完全勝利」目指すウクライナが迫られる「譲歩」の現実,120,https://news.yahoo.co.jp/articles/9f704cbd96f8e520ab10a38a8d8747b6183dc429,6/18(火) 11:51
2024-06-18,15:27,TTL,総合,21,デイリー新潮,「日本史上初」の関心を集めてしまう「悠仁さま」東大進学論争のいま,118,https://news.yahoo.co.jp/articles/322b7b2411cb32fc25975030166e932dc340a106,6/18(火) 6:00
2024-06-18,15:27,TTL,総合,22,日刊スポーツ,蓮舫氏「神宮外苑再開発は見直す」都知事選の政策発表会見で明言,117,https://news.yahoo.co.jp/articles/adec42726053239d8cd0b4da0fefcbebfd4e0eb5,6/18(火) 14:42
2024-06-18,15:27,TTL,総合,23,産経新聞,「シーズン１００敗」も現実味、親会社の株主総会も波乱含み…プロ野球西武の凋落,114,https://news.yahoo.co.jp/articles/f4a99ffee2aec6d7045022fd4de629697b2c9563,6/18(火) 12:15
2024-06-18,15:27,TTL,総合,24,文春オンライン,「小池百合子都知事を今朝、公職選挙法違反容疑で刑事告発しました」 元側近・小島敏郎氏が語る“7つの重大証拠”,109,https://news.yahoo.co.jp/articles/a9b365b277a263f7808fe0c7d7d815c77c88876d,6/18(火) 10:12
2024-06-18,15:27,TTL,総合,25,まいどなニュース,ツーリング中に声かけられて→旧車バイクサークルへの強引な勧誘　断っても「顔出しとかないと色々困るよ？」,106,https://news.yahoo.co.jp/articles/2cf6389cec79065264a7a1f5cc24108fa03c5424,6/18(火) 12:05
2024-06-18,15:27,TTL,総合,26,オリコン,13歳差夫婦　連れ子を抱えてハイリスクな高齢出産に踏み切った理由、そのとき20代夫の心情は？,105,https://news.yahoo.co.jp/articles/089b86f488f63407533eebecd29b7c65bf903038,6/18(火) 8:30
2024-06-18,15:27,TTL,総合,27,スポニチアネックス,木下優樹菜さん、自転車の最悪すぎるマナーに苦言　子連れパパの運転に衝撃「ハッキリ言うけど超迷惑なの」,104,https://news.yahoo.co.jp/articles/3f10fb7f86b52d7fcb90dab39f6b620203eed6ed,6/18(火) 14:12
2024-06-18,15:27,TTL,総合,28,ファイナンシャルフィールド,NHKを未契約ですが「契約のお知らせ」など届かないので受信料を払っていません。放置しておいても問題ないですか？,104,https://news.yahoo.co.jp/articles/535acfdfff4bb05c4235c2d0cb78d0618d8579cb,6/18(火) 13:50
2024-06-18,15:27,TTL,総合,29,現代ビジネス,岸田総理への恨みが大爆発…！菅前総理が岸田を潰すために選んだ「次の総理候補の名前」,102,https://news.yahoo.co.jp/articles/9f49608f09824576c8fd8dc40cb311fd6cab98ec,6/18(火) 6:34
2024-06-18,15:27,TTL,総合,30,ABEMA TIMES,「富士山が見えない」国立市・完成目前のマンション取り壊しへ…近隣住民が心境を吐露「みんな反対していた」「半分しか見えない…あれは反対する」,101,https://news.yahoo.co.jp/articles/49e4263182d4da72117e7367537be535b8d2db4a,6/18(火) 6:51
2024-06-18,15:27,TTL,総合,31,日経クロストレンド,「焼肉きんぐ」食べ放題でペヤングのなぜ　5万食突破、背景に危機感,100,https://news.yahoo.co.jp/articles/4015b7b4a87354bd6aaf66b9382c2180e36889c7,6/18(火) 6:00
2024-06-18,15:27,TTL,総合,32,SmartFLASH,ヒカキン「5000万円リザードン」が半額に！　「ポケモンカード」価格大暴落の原因を専門家に聞いた,91,https://news.yahoo.co.jp/articles/2fea29990288b7f465cf5ac63eb29fbd91fac1c8,6/17(月) 16:31
2024-06-18,15:27,TTL,総合,33,毎日新聞,運送会社がユーチューバー10人超抱える理由　人手不足でも採用拡大,86,https://news.yahoo.co.jp/articles/fc2279008d37593f12abd6c8389f187306d95831,6/18(火) 8:15
2024-06-18,15:27,TTL,総合,34,日刊ゲンダイDIGITAL,なぜセ球団は交流戦に弱いのか…19回でパ球団V15回の「決定的な違い」,85,https://news.yahoo.co.jp/articles/ee1a5770657b58cc07e09d8a5bbf72b21cd2d933,6/18(火) 9:06
2024-06-18,15:27,TTL,総合,35,J-CASTニュース,遠野なぎこ、アンチコメントで被害届提出を検討　「怯えて待っていればいい。証拠は揃っているのだから」,84,https://news.yahoo.co.jp/articles/42dc505aa51e4715e309f48f64e727db4938ddd3,6/18(火) 14:40
2024-06-18,15:27,TTL,総合,36,京都新聞,北陸新幹線の延伸「米原ルートにすべき」維新の馬場代表と教育の前原代表、政府与党に変更求める,84,https://news.yahoo.co.jp/articles/d49fefb8e60e77c47561e1de6f0e714b0cdd8203,6/18(火) 14:06
2024-06-18,15:27,TTL,総合,37,FNNプライムオンライン（フジテレビ系）,維新「怒り沸騰」も他党冷ややか…政治資金規正法改正案めぐり国会荒れ模様「維新なんて信用しちゃダメだった」,84,https://news.yahoo.co.jp/articles/02597d9cc02f74986e507976e340d9b3711ec7b7,6/18(火) 12:12
2024-06-18,15:27,TTL,総合,38,産経新聞,学歴詐称の疑いで小池百合子都知事の告発状を東京地検に提出　元側近の小島敏郎氏,83,https://news.yahoo.co.jp/articles/5818a07275ec3c7d1a535c3bd268ec1294ed4eff,6/18(火) 13:02
2024-06-18,15:27,TTL,総合,39,新潮社 フォーサイト,総裁選出馬に黄色信号　麻生副総裁の「岸田切り」に現実味,82,https://news.yahoo.co.jp/articles/d0a73a80ee0072e2867bde6b44af591f9c6cd2a2,6/18(火) 13:52
2024-06-18,15:27,TTL,総合,40,デイリー新潮,蓮舫氏が共産党お得意の”抱きつき戦法”に大苦戦「赤旗ではスター党員のような扱い」　一方、小池都知事は自民の”ステルス支援”にニンマリ,80,https://news.yahoo.co.jp/articles/7e2fe47fd2fddc0e7445756dea530c743dffe823,6/18(火) 6:13
