scrp_date,scrp_time,genre_en,genre_jp,rank,media_jp,title,comment,link,date_original
2025-08-29,11:35,domestic,国内,1,産経新聞,記者に苦言重ねる再生の道・石丸伸二氏に東京・望月衣塑子記者「大変衝撃」11分間の応酬,295,https://news.yahoo.co.jp/articles/69a77efe9995fa6e8f3ef9567cbb4b6ba18c7622,8/29(金) 7:00
2025-08-29,11:35,domestic,国内,2,FRIDAY,ガソリン暫定税率廃止で「新税検討」にSNSは大炎上　石破政権は「国民より財務省」の正体,214,https://news.yahoo.co.jp/articles/9a567aebfc9ad9ed4ec272bf9f663cee723b5dbf,8/29(金) 11:00
2025-08-29,11:35,domestic,国内,3,女性自身,「どうしても説教したいんだね」石丸伸二氏　退任会見冒頭での記者への“ネチネチ詰問”にネットから疑問続出,195,https://news.yahoo.co.jp/articles/78773eda1bc6d2b6a622af4fefcdebf68f4b55bf,8/28(木) 17:08
2025-08-29,11:35,domestic,国内,4,福祉新聞,低所得家庭、子1人5万円の給付を　議連と4団体が三原大臣に要望,175,https://news.yahoo.co.jp/articles/021abf0f0706266c7b891a490179962e8980b345,8/29(金) 10:00
2025-08-29,11:35,domestic,国内,5,集英社オンライン,「今は石破のままで」内閣支持率急上昇で“石破おろし”が失速、政権の存続を望む支持者の正体,174,https://news.yahoo.co.jp/articles/735f97b6a12271568191eb1e61f0b65a7e0c21ad,8/29(金) 7:01
2025-08-29,11:35,domestic,国内,6,共同通信,前倒し総裁選への出馬否定　岸田前首相,153,https://news.yahoo.co.jp/articles/3d62ecb5d141665655f1928ec3997c0713976cf2,8/28(木) 17:58
2025-08-29,11:35,domestic,国内,7,共同通信,【独自】首相個人の責任言及を回避　参院選総括素案、29日に提示,146,https://news.yahoo.co.jp/articles/1ba371f492bfbcaae2f2e8b0a03aa8c9e5599b5a,8/28(木) 21:00
2025-08-29,11:35,domestic,国内,8,Yahoo!ニュース オリジナル THE PAGE,【ヤフコメで話題】「石丸氏の記者会見での対応に賛否」「強い個性が支持と反発を呼ぶ」 - 元安芸高田市長・石丸伸二氏のメディア対応が話題に,120,https://news.yahoo.co.jp/articles/dab1f95cd7844bbd51a7723405b9bf710c46e7c3,8/29(金) 10:12
2025-08-29,11:35,domestic,国内,9,デイリー新潮,赤ちゃん抱っこの「小室眞子さん」初キャッチ　グズるわが子を即座にあやし…圭さんと3人で買い物へ,117,https://news.yahoo.co.jp/articles/8fa733619d8633cd3d102622bf874fed03e9907d,8/29(金) 6:11
2025-08-29,11:35,domestic,国内,10,日テレNEWS NNN,【解説】神戸女性刺殺　容疑者に「再犯を強く危惧」──3年前のストーカー事件、裁判官が指摘　今回は執行猶予中…なぜ防げない？,113,https://news.yahoo.co.jp/articles/869c17832ef951aeb607a66a039549fee498a714,8/29(金) 10:26
2025-08-29,11:35,domestic,国内,11,弁護士JPニュース,あいみょん「タトゥー炎上」過熱　“ひどすぎる”暴言・差別的発言の嵐…SNS投稿「匿名」でも逃れられない“法的リスク”とは,111,https://news.yahoo.co.jp/articles/8e99f3486fb9bbf54207951fb371c4215612f87c,8/29(金) 10:50
2025-08-29,11:35,domestic,国内,12,読売新聞オンライン,献血３９人分、不適切管理で使用不能に…搬送業者が車の駐車場所探し最大７時間遅れで届ける,103,https://news.yahoo.co.jp/articles/5c786aba514806ce6ab1d406324162fdb0b97e89,8/29(金) 5:00
2025-08-29,11:35,domestic,国内,13,日刊スポーツ,ひろゆき氏、自衛隊員巡り私見「国を守る軍人として何が違うんだろう？」台湾軍人優遇措置報道に,101,https://news.yahoo.co.jp/articles/e9edadfbb0c0a12de835027ffd4e67b747603ce1,8/29(金) 7:25
2025-08-29,11:35,domestic,国内,14,読売新聞オンライン,カムチャツカ地震で津波避難、対象の１割…６道県で８万人超,99,https://news.yahoo.co.jp/articles/147db4011d85c4d71648f4e57374a2447641b90a,8/29(金) 5:01
2025-08-29,11:35,domestic,国内,15,デイリースポーツ,【フジ】ネット騒然「中居くん１人でえぐい」中居氏問題の損害額公表「４５３億３５０３万６７０７円」に衝撃走る　港元社長らに５０億円訴訟「残りどう回収？」「５０億払えるの？」,98,https://news.yahoo.co.jp/articles/3b1dd790f6b6e8f7a1b7dc3f33c3f997d57fc00e,8/28(木) 18:16
2025-08-29,11:35,domestic,国内,16,弁護士JPニュース,客のギガに“タダ乗り”？　飲食店「スマホ注文」にモヤモヤ…店側に「通信料」請求することは可能か【弁護士解説】,97,https://news.yahoo.co.jp/articles/0583ccd9b9a3507ad55c41f6593bd024859f7530,8/29(金) 9:50
2025-08-29,11:35,domestic,国内,17,FNNプライムオンライン,水不足で異変…「幻の道」が山梨・河口湖に出現　本来は湖に浮かぶ“六角堂”に徒歩で　岩手・胆沢ダムは貯水率“過去最低”,92,https://news.yahoo.co.jp/articles/2628d1c4397203a03b9548721830634f44acb61f,8/29(金) 6:12
2025-08-29,11:35,domestic,国内,18,読売新聞オンライン,ストーカーへの警告に被害申告不要、規制法改正へ…対応を迅速化し事態のエスカレート防ぐ,92,https://news.yahoo.co.jp/articles/8dab4503645ce03d35916cc2a5282e0c099324fc,8/29(金) 5:01
2025-08-29,11:35,domestic,国内,19,TBS NEWS DIG Powered by JNN,自民党 “総裁選前倒し”「態度示さず」63% 「前倒しすべき」22%　全議員にアンケート,88,https://news.yahoo.co.jp/articles/53df298740ccd7cb50f1a3d9c7366d826ad8eaa7,8/28(木) 11:40
2025-08-29,11:35,domestic,国内,20,FNNプライムオンライン（フジテレビ系）,【速報】閣内からも“反旗”ののろし続々　小林環境副大臣「副大臣辞しても…」総裁選前倒し求める考え表明,87,https://news.yahoo.co.jp/articles/ed033201006392bde8f62f4cf2f82e795b61b958,8/29(金) 10:46
2025-08-29,11:35,domestic,国内,21,弁護士ドットコムニュース,甲子園増刊「表紙だけ女子」に感じるモヤモヤの正体　ジェンダー専門家が指摘する「性の商品化」への無自覚,84,https://news.yahoo.co.jp/articles/0607c1789f374dce786330a893f64f8702ef06f7,8/29(金) 10:23
2025-08-29,11:35,domestic,国内,22,産経新聞,トルコビザ免除停止求めた埼玉大野知事「豹変ではない」感謝状問題「どの方かわからない」　「移民」と日本人,75,https://news.yahoo.co.jp/articles/b632dfc4704b6a2b023287d8df95c23475e1b074,8/29(金) 7:00
2025-08-29,11:35,domestic,国内,23,Yahoo!ニュース オリジナル 特集,ハワイの別荘、推し活に散財……夏休みのSNSに表れる経済格差、女子学生たちはどう向き合う？ #今つらいあなたへ #SNSの功罪,75,https://news.yahoo.co.jp/articles/9d22187f30bf1bb58133b37a3739ba6c425bcbdb,8/28(木) 14:56
2025-08-29,11:35,domestic,国内,24,デイリー新潮,麻生太郎氏が次期首相として目をつける“女性候補”とは　ゴルフ仲間で「“あのオンナは酒が強いな”とご満悦」,73,https://news.yahoo.co.jp/articles/9da1083f7f0200c68ed18c859e21cda971d98acf,8/29(金) 6:08
2025-08-29,11:35,domestic,国内,25,CBCテレビ,飲酒で“死亡ひき逃げ” 被告の26歳男を殺人罪で追起訴  殺意もって車を蛇行させ約150m引きずったか  名古屋・緑区,73,https://news.yahoo.co.jp/articles/c183251dd1eb0ae07d35db56e3c5209ebe37bc18,8/28(木) 18:35
2025-08-29,11:35,domestic,国内,26,Yahoo!ニュース オリジナル THE PAGE,【ヤフコメで話題】「税収増や余剰金があるのに代替財源が必要なのか」「ガソリン税暫定税率廃止の財源論に疑問」 - ガソリン税暫定税率廃止と財源問題を巡る議論,72,https://news.yahoo.co.jp/articles/49df9c90d0afed983ff6972fd60e1b5c1f983f0c,8/29(金) 8:14
2025-08-29,11:35,domestic,国内,27,集英社オンライン,〈石丸氏が党離脱〉「都議選と参院選で全敗」と書いたメディアを名指しでガン詰め、女性記者には「ダブルスタンダードですね」自身は“円満卒業”を主張も周囲の反応は,70,https://news.yahoo.co.jp/articles/64d8c63a57e13652d6cdd137bada993621e46b20,8/28(木) 12:12
2025-08-29,11:35,domestic,国内,28,プレジデントオンライン,"「日本を売らない限り出国できそうにありません」…中国のハニートラップにかかった""エリート外交官""の最期",69,https://news.yahoo.co.jp/articles/d611d166704ce1c0d4b8bb439cc2696629d48ed6,8/29(金) 10:16
2025-08-29,11:35,domestic,国内,29,日刊スポーツ,鳩山由紀夫氏に長男・紀一郎氏が要請「中国政府の戦勝記念行事に出席する必要はありません」,69,https://news.yahoo.co.jp/articles/856599a3156e393fcbb85dafdfa23081a779018f,8/29(金) 7:23
2025-08-29,11:35,domestic,国内,30,読売新聞オンライン,２ｍ冠水したアンダーパスで１５分の救出劇…水につかった車から高齢女性救出、富山県警が６６歳男性に感謝状,67,https://news.yahoo.co.jp/articles/225c19e03c68614280d87edec6669850fcdbb544,8/29(金) 8:16
2025-08-29,11:35,domestic,国内,31,弁護士ドットコムニュース,10歳男児がスマホで「高額課金」、返金求めTiktokなど提訴　親の同意ない「未成年者の契約」取り消せる？,67,https://news.yahoo.co.jp/articles/b92a2927cb7ad97faf2b93a94e6cdc39ea74ccbf,8/29(金) 10:15
2025-08-29,11:35,domestic,国内,32,テレビ朝日系（ANN）,損害賠償50億円求める…払えない場合は　フジテレビ 前社長と元専務を提訴,62,https://news.yahoo.co.jp/articles/9f98089a076f8ed43986860cffc750554b2acfb9,8/29(金) 1:42
2025-08-29,11:35,domestic,国内,33,FNNプライムオンライン（フジテレビ系）,自民・麻生最高顧問が参政・神谷代表と会談　党運営などめぐり神谷氏が麻生氏に相談…神谷氏の知人通じて実現,58,https://news.yahoo.co.jp/articles/b0de189ce1f849d8acf3d8c7e0a8d4f720783d8d,8/28(木) 12:24
2025-08-29,11:35,domestic,国内,34,FNNプライムオンライン（フジテレビ系）,国民・鳩山議員が父・鳩山由紀夫元首相に「訪中取りやめを要請」　玉木代表も同調　鳩山元首相が「抗日戦争勝利80年行事」出席へ,55,https://news.yahoo.co.jp/articles/f0fd12a5815f868767a59a16a5af6badbf1b3f16,8/29(金) 11:00
2025-08-29,11:35,domestic,国内,35,弁護士ドットコムニュース,フジテレビ、訴訟手数料だけでも「1000万円超」になる？ 港元社長らに50億円賠償求め提訴,55,https://news.yahoo.co.jp/articles/00926aa902b519ea783dcda7a97e4c9d8fa4aeef,8/29(金) 10:28
2025-08-29,11:35,domestic,国内,36,時事通信,総裁選前倒し、副大臣・政務官に賛成の動き　自民、29日に参院選総括案,55,https://news.yahoo.co.jp/articles/9a466788edc5d5cffc4a0bc6af7047de511aa719,8/28(木) 19:20
2025-08-29,11:35,domestic,国内,37,TBS NEWS DIG Powered by JNN,小室圭さん・眞子さんが悠仁さまの「成年式」関連行事の出席を辞退　幼い子どもがいることなど理由,55,https://news.yahoo.co.jp/articles/9c3c2ff28c72055d7c860274ac8ebbb6109db092,8/29(金) 6:26
2025-08-29,11:35,domestic,国内,38,プレジデントオンライン,JAの高笑いが聞こえてくる…新米「5kg7800円」でもコメ増産を許さない自民党「小泉包囲網」のキーパーソン,53,https://news.yahoo.co.jp/articles/c779a6100eb1917ec2e1fb48c47c60fd1c14fa4c,8/29(金) 11:16
2025-08-29,11:35,domestic,国内,39,文春オンライン,〈「再生の道」代表退任へ〉石丸伸二氏は市長時代、安芸高田市に何を残していたか？【現地ルポ】,53,https://news.yahoo.co.jp/articles/96070ae1646a22866d58d05e1b257d44d647f2df,8/29(金) 6:12
2025-08-29,11:35,domestic,国内,40,Yahoo!ニュース オリジナル THE PAGE,【ヤフコメで話題】「JICAのホームタウン構想に移民政策との関連を懸念する声」「情報発信や説明責任を求める意見」 - JICAのアフリカ諸国との交流事業を巡る議論が活発化,52,https://news.yahoo.co.jp/articles/70b3bc40d712ee0addf51bd4509b64f59676353b,8/29(金) 10:17
