scrp_date,scrp_time,genre_en,genre_jp,rank,media_jp,title,comment,link,date_original
2025-01-12,11:32,business,経済,1,時事通信,初任給引き上げ、30万円台続々　人材獲得競争が激化　大手企業,665,https://news.yahoo.co.jp/articles/44be39ec55caea2a1a742faf9573ebb69390ffd1,1/12(日) 7:04
2025-01-12,11:32,business,経済,2,東京商工リサーチ,「焼肉店」倒産 過去最多45件 大手チェーンと競合、街の焼肉店が息切れ,329,https://news.yahoo.co.jp/articles/97b8b52e72326f503678416cd6479d42ede4a402,1/12(日) 7:03
2025-01-12,11:32,business,経済,3,ダイヤモンド・オンライン,職場にいる「雪が降っても出社する人」は出世する。その本当の理由,118,https://news.yahoo.co.jp/articles/302ec1e7041671bf06ba6dfeff7c53a2f5db1e06,1/12(日) 6:02
2025-01-12,11:32,business,経済,4,東洋経済オンライン,2浪で早稲田に合格も…「キラキラ大学生活」に憧れた彼女が見た現実。コンプレックス抱いた彼女の心の変化,105,https://news.yahoo.co.jp/articles/93e1e9cbe16b19f695d520d283c54be243d0e698,1/12(日) 5:32
2025-01-12,11:32,business,経済,5,デイリー新潮,「日本製鉄はさっさと900億円払って手を引いた方が」　“代償”として得られるものとは,89,https://news.yahoo.co.jp/articles/f10f85f7f003fe9366434e9cecfa21f96b6722d3,1/12(日) 6:09
2025-01-12,11:32,business,経済,6,THE GOLD ONLINE（ゴールドオンライン）,こんな生活いつまで続くのか…孫の「今日のご飯なに？」に年金月19万円・76歳夫婦の笑顔が曇る切実な理由,65,https://news.yahoo.co.jp/articles/de840054bd6f571b128a4dc1def90aa43c6052b7,1/12(日) 8:32
2025-01-12,11:32,business,経済,7,週刊SPA!,医学部在学中に年商1.5億円。令和の虎・青笹社長が医師の道を捨て、「動画編集教育ビジネス」を選んだワケ,65,https://news.yahoo.co.jp/articles/93b46c540c19075ad0ec3305b8f77e1216fde4f8,1/12(日) 8:53
2025-01-12,11:32,business,経済,8,乗りものニュース,護衛艦の居住区「個室化」「ネット使える」は急務!? 安全保障に直結するこれだけの理由 「任務から戻ったら浮気されてて…」,41,https://news.yahoo.co.jp/articles/95da178ddc46af39bd5e5b4555050a0ada8b7121,1/12(日) 9:42
2025-01-12,11:32,business,経済,9,現代ビジネス,”人手が全然足りない”地方の深刻実態…高齢者もどんどん働くようになる「日本の未来」,41,https://news.yahoo.co.jp/articles/c2383f38b94667bbbdd1678b72f0270c35889b9f,1/12(日) 8:04
2025-01-12,11:32,business,経済,10,THE GOLD ONLINE（ゴールドオンライン）,話が違うじゃない…20年間一緒に暮らしてきた亡き親友から「預金の全額を差し上げます」というメモを渡された73歳女性、相続発生後に“一銭”も受け取れなかったワケ【相続の専門家が解説】,40,https://news.yahoo.co.jp/articles/99fd74cc8c8942875f4d1046440c623f4ab3cb5d,1/12(日) 10:16
2025-01-12,11:32,business,経済,11,鉄道コム,関西本線の急行「かすが」が復活？　名古屋と伊賀を結ぶ「実証列車」が2月に運転,36,https://news.yahoo.co.jp/articles/1865f79899a0bc30af8299711dee16caa74848d2,1/12(日) 10:35
2025-01-12,11:32,business,経済,12,Merkmal,ローカル鉄道維持の敵は誰だ？ 千葉県「低輸送密度路線」を巡った経営学者が見た、鉄道活性化を阻む社会構造の正体,35,https://news.yahoo.co.jp/articles/4e5beea5ec42347d644e45759e0d4a406220f574,1/12(日) 6:11
2025-01-12,11:32,business,経済,13,東洋経済オンライン,年会費3～5万円のクレカ「じわり人気」の納得理由　高額年会費のカードを選ぶ人が増えている背景,31,https://news.yahoo.co.jp/articles/44f164291ed4d23e2a9f100fdf20bab78fbeca97,1/12(日) 7:32
2025-01-12,11:32,business,経済,14,FNNプライムオンライン,常勤運転士7人のうち3人が退職　熊本電鉄が運行本数約27パーセント減らす大幅減便へ　2月3日からダイヤ改正　慢性的な遅延改善に運行時間の延長も,30,https://news.yahoo.co.jp/articles/01f3fa76e55724b3e4d75732409b2476fbb40724,1/12(日) 11:02
2025-01-12,11:32,business,経済,15,乗りものニュース,昔「愛知の空の玄関」は「名古屋空港」でしたよね？ 今どうなっているのですか？→驚愕の転身を遂げ“バリバリ現役”だった！,29,https://news.yahoo.co.jp/articles/f8527906c0e620b64ac1e3ca63b392f7e2f76fdc,1/12(日) 7:12
2025-01-12,11:32,business,経済,16,MotorFan,自衛隊の大型輸送ヘリ「CH-47」で重機を空輸することは可能なのか？ 能登半島地震救援活動への批判について考えてみた,28,https://news.yahoo.co.jp/articles/db8c66875da7a9bd389b2c2a2c8fc9e4d7da8e00,1/12(日) 7:21
2025-01-12,11:32,business,経済,17,共同通信,日本製鉄の買収放棄期限、米当局が延長承認,27,https://news.yahoo.co.jp/articles/874f600813f5bc3dff6aebc39e94c8f37079cbd7,1/12(日) 10:45
2025-01-12,11:32,business,経済,18,プレジデントオンライン,自分の貯金額は絶対教えないのに、妻の貯蓄が激減でも知らん顔…「別財布夫」を改心させた妻の見事な戦略,27,https://news.yahoo.co.jp/articles/1b2cf1063e60acaa2a0ad7566db3e918b447dd86,1/12(日) 10:17
2025-01-12,11:32,business,経済,19,現代ビジネス,西友の”売却先”に大注目が集まる…ドンキ・イオンの時代から「スーパー戦国時代」へと突入する,22,https://news.yahoo.co.jp/articles/713deea002fa8d16ba8ec2001608ee5cc9ce7f66,1/12(日) 9:04
2025-01-12,11:32,business,経済,20,乗りものニュース,空自の次期戦闘機プロジェクト “金持ちの北朝鮮”登場で瓦解の危機!? 共同開発のジレンマ乗り切れるか,21,https://news.yahoo.co.jp/articles/9071aa8ff8fe44a958d1854f94530fca6c35d66a,1/12(日) 6:12
2025-01-12,11:32,business,経済,21,乗りものニュース,逆風の中国EV、日本は「まだまだ」？ BYD、新型SUVでさらに攻勢 TAS2025,21,https://news.yahoo.co.jp/articles/d4a3392d5747bec7d0db402b1995e4f9f19eba73,1/12(日) 7:42
2025-01-12,11:32,business,経済,22,THE GOLD ONLINE（ゴールドオンライン）,最低賃金引き上げが話題だが…「行き過ぎた弱者保護」に潜む、弱者を苦しめるリスク【経済評論家が解説】,21,https://news.yahoo.co.jp/articles/f6ec4933686fb46c3e2df34f80566bcee9684878,1/12(日) 9:02
2025-01-12,11:32,business,経済,23,現代ビジネス,自動車業界は「トヨタグループ」と「非トヨタグループ」に二分されるのか…「ホンダと日産」の統合交渉が握る「日本経済の未来」,20,https://news.yahoo.co.jp/articles/f0f7d67f38ca883d6864b384b70deac8f2670963,1/12(日) 7:04
2025-01-12,11:32,business,経済,24,ベストカーWeb,国産[軽BEV]大ピンチ!!?? [ヒョンデ]の新型[スモールBEV]がついに先行予約スタート!!,19,https://news.yahoo.co.jp/articles/f45e545eb90e04a126548b2e45eae00f4e470cdc,1/12(日) 8:00
2025-01-12,11:32,business,経済,25,ファイナンシャルフィールド,4月から社会人になります。実家から職場まで「往復3時間」かかるのですが、貯金するなら実家から通う方がよいですよね？,19,https://news.yahoo.co.jp/articles/841621f9cba3453ceaf78d569c368fcb71b274f6,1/11(土) 13:30
2025-01-12,11:32,business,経済,26,GQ JAPAN,新型トヨタ・アルファードの超快適な後席が、より快適に!? パナソニックの新提案はレクサスLMを超えた！,18,https://news.yahoo.co.jp/articles/f2abd870ecab8681efded97260e18921dfd6e3d2,1/12(日) 10:25
2025-01-12,11:32,business,経済,27,現代ビジネス,日本を襲うM9の「南海トラフ巨大地震」の恐怖…恐ろしい「30メートルの巨大津波」,18,https://news.yahoo.co.jp/articles/8f443f70cab5933cfec4e29fd4c38537c14a68fc,1/12(日) 6:49
2025-01-12,11:32,business,経済,28,帝国データバンク,コメ高値でも苦境　「コメ農家」の倒産・廃業、過去最多　前年比2割の急増,18,https://news.yahoo.co.jp/articles/d54ceab9c66f3fd2b295f44b1a770dacebbd36bd,1/12(日) 7:03
2025-01-12,11:32,business,経済,29,テレビ朝日系（ANN）,東京海上日動火災　初任給最大41万円に,18,https://news.yahoo.co.jp/articles/163f6d58ba87b8233de42992cc5ff254ff22c0de,1/12(日) 9:18
2025-01-12,11:32,business,経済,30,ロイター,再送-ＪＰモルガン、3月から週5日出勤を要請　社員から苦情殺到,16,https://news.yahoo.co.jp/articles/bf9433a02c4a2bbaacd966aaeb2dae00026c7e78,1/12(日) 7:54
2025-01-12,11:32,business,経済,31,WEB CARTOP,電制カットでイキってるなんてにわか確定!?　プロドライバーでも使ったほうが速いイマドキ電子デバイス事情,16,https://news.yahoo.co.jp/articles/fb74bc1fcadfad080aaf9a795b7f5705b52a9b62,1/12(日) 10:10
2025-01-12,11:32,business,経済,32,THE GOLD ONLINE（ゴールドオンライン）,老後資金が足りなくて…年金月22万円の67歳妹、仲良し・顔もそっくりの76歳姉を「実家から追い出すしかありません。」母の遺産を巡る〈醜すぎる争族〉の末路【CFPが解説】,15,https://news.yahoo.co.jp/articles/785f580414d660e8b69af769f423a3331bd8632b,1/12(日) 10:32
2025-01-12,11:32,business,経済,33,Aviation Wire,チェジュ航空の務安事故、衝突4分前から記録なし　フライトレコーダー解析,15,https://news.yahoo.co.jp/articles/eacc476d11ea731340dbc754deb9d567b5254ec8,1/12(日) 9:11
2025-01-12,11:32,business,経済,34,日刊ゲンダイDIGITAL,「ホープ軒」は千駄ヶ谷で開店50年…牛久保英昭社長に聞く「私の根底にあるのは『お客さんはタクシー運転手』」,15,https://news.yahoo.co.jp/articles/ff585add337ded443dd2d7ca6f9558c18521662f,1/12(日) 9:06
2025-01-12,11:32,business,経済,35,WEB CARTOP,自動車オーナーに朗報！　ついに自動車関連の「税金」見直しで負担が軽くなる可能性大!!,14,https://news.yahoo.co.jp/articles/2e5ed6e3bd46287ced31a30b85193840ecef5d4f,1/11(土) 13:10
2025-01-12,11:32,business,経済,36,ファイナンシャルフィールド,「103万円の壁の上限アップは実質的に意味がない」って本当ですか？ 主婦・独身・学生・親・子なし家庭の誰に一番メリットがあるのでしょうか？,14,https://news.yahoo.co.jp/articles/abe74114651d24cf1e491ead0a4d48060e204096,1/12(日) 8:30
2025-01-12,11:32,business,経済,37,週プレNEWS,ホンダ・日産の統合で始まる自動車業界の「大再編時代」。山積みの課題、実現の可能性は？,14,https://news.yahoo.co.jp/articles/19a94c75a6e18b8901927c0280afb6b2aa3bef46,1/12(日) 8:00
2025-01-12,11:32,business,経済,38,Car Watch,出力は400馬力以上？　2.0リッター4気筒ターボのミッドシップ4WD「GRヤリスMコンセプト」断面図披露 トヨタの公開開発はすごすぎる,13,https://news.yahoo.co.jp/articles/02bfd7b5bf32577f49c83bc2b977d0e0981c3993,1/12(日) 10:24
2025-01-12,11:32,business,経済,39,乗りものニュース,「埼玉‐群馬40km」の大規模国道バイパス“4車線化”が進行中 前橋で2月に車線切り替え,13,https://news.yahoo.co.jp/articles/1b7da5d4769d7685c84a6f5792e586d4a5984005,1/12(日) 8:12
2025-01-12,11:32,business,経済,40,LIMO,日本の平均年収は460万円。では「30歳代・40歳代・50歳代」の平均年収はいくら？,13,https://news.yahoo.co.jp/articles/23c55e1ca8f04a3f1d796b9db777ca202604e9a7,1/11(土) 20:02
