scrp_date,scrp_time,genre_en,genre_jp,rank,media_jp,title,comment,link,date_original
2025-04-13,00:06,business,経済,1,読売新聞オンライン,トランプ関税でアメリカの予想インフレ率は６・７％に上昇…４３年ぶりの高水準,179,https://news.yahoo.co.jp/articles/1ae6e6e8dd82ddd997ef5f4283a653166ac73689,4/12(土) 21:15
2025-04-13,00:06,business,経済,2,ABCニュース,【速報】万博　５カ国のパビリオンが開幕間に合わず　インド・チリなど,153,https://news.yahoo.co.jp/articles/7245a9e8ef8a4961f6b5466ed5c5cc4415b35355,4/12(土) 19:26
2025-04-13,00:06,business,経済,3,FNNプライムオンライン,「現金決済」客にお願いするコンビニ　キャッシュレス「決済手数料」が利益を減らす現実　“客を失いたくない”店側は苦慮,81,https://news.yahoo.co.jp/articles/f3bf32692cf87d3318e88554fcaf985146c4f083,4/12(土) 19:07
2025-04-13,00:06,business,経済,4,共同通信,米、相互関税からスマホを除外　消費者の反発回避が狙いか,77,https://news.yahoo.co.jp/articles/87733e0bf5425b21749bc929b9e4ebe97e29ee43,4/12(土) 23:31
2025-04-13,00:06,business,経済,5,関西テレビ,コンビニで「現金決済のお願い」　政府はキャッシュレス8割目標も「手数料がツライ」店悲鳴　新紙幣がカギ,68,https://news.yahoo.co.jp/articles/aa95d9a9c8aa8feb29ad8e95386de21f7875de6e,4/12(土) 8:00
2025-04-13,00:06,business,経済,6,共同通信,米、相互関税の対象からスマホなど除外,63,https://news.yahoo.co.jp/articles/7d18a1b0333af3d49f8efc8d02d722092f95f029,4/12(土) 23:26
2025-04-13,00:06,business,経済,7,読売新聞オンライン,メガバンクから消える一般職…一本化により三菱ＵＦＪ銀では平均６・５％昇給,63,https://news.yahoo.co.jp/articles/9b49a11032a77208f849e39a5bb12825530df353,4/12(土) 7:04
2025-04-13,00:06,business,経済,8,ねとらぼ,NewDaysのおにぎりから「金属片」……　19万個自主回収「申し訳ございません」運営謝罪,46,https://news.yahoo.co.jp/articles/7d4eb2d86fe58462b4b873bc4b0b3c7604326477,4/12(土) 7:00
2025-04-13,00:06,business,経済,9,ABEMA TIMES,累計利益100億円超の個人投資家・テスタが“トランプ関税”騒動に苦言「壮大な株価操作で世界がめちゃくちゃ。誰かが怒るべき」,40,https://news.yahoo.co.jp/articles/f1cddb7762e466a355684750e79ce92983df706f,4/12(土) 11:32
2025-04-13,00:06,business,経済,10,時事通信,米関税「地域一帯に影響」　不安募る自動車城下町　群馬県太田市,37,https://news.yahoo.co.jp/articles/051a2832a642f072acec2d14c9c3ac079af971fb,4/12(土) 7:07
2025-04-13,00:06,business,経済,11,みんかぶマガジン,「コメ不足」ではなく「政策不足」…責任を「転売ヤー・流通目詰まり」に押し付ける農水省に国民絶望,35,https://news.yahoo.co.jp/articles/302e0f568a1e5289efddb88921b8c424e179b653,4/12(土) 9:10
2025-04-13,00:06,business,経済,12,THE GOLD ONLINE（ゴールドオンライン）,"昨日も厚意のまかないを食べたのに…時給1,200円・44歳氷河期世代男性、荒れ果てたバイト先に狼狽。税務調査後に店主が夜逃げ「原因は俺」【税理士解説】",27,https://news.yahoo.co.jp/articles/2b4fb065c65ee9fbbe78ef5f37f64b6a14698322,4/12(土) 10:32
2025-04-13,00:06,business,経済,13,現代ビジネス,【新NISA】だから「おやめなさい」と言ったのに…トランプ相場「塩漬けか、撤退か」の最適解,26,https://news.yahoo.co.jp/articles/2052bbda800f82b3097da27909aa62bcf9ac7a77,4/12(土) 7:08
2025-04-13,00:06,business,経済,14,共同通信,トランプ関税で地銀が特別融資　取引先リスク把握急ぎ適切支援へ,22,https://news.yahoo.co.jp/articles/cb3f2addbb1045e455af1422d4764d8e1fdbd2ad,4/12(土) 16:11
2025-04-13,00:06,business,経済,15,週刊SPA!,“上げ底弁当”で物議のセブンが、それでもファミマ、ローソンより「1日あたり13万円」売り上げに差をつけられる理由,20,https://news.yahoo.co.jp/articles/84a6db15f7a89dfd9b50db6c412570bf01b1ffec,4/12(土) 8:53
2025-04-13,00:06,business,経済,16,テレビ朝日系（ANN）,大阪・関西万博「空飛ぶクルマ」　スカイドライブが初日のデモ飛行中止　悪天候で,19,https://news.yahoo.co.jp/articles/1e712632bd8d9ba1d4ea5e012352181cd1d9de0a,4/12(土) 23:31
2025-04-13,00:06,business,経済,17,ロイター,米国株式市場＝反発、ダウ619ドル高　波乱続くとの予想も,18,https://news.yahoo.co.jp/articles/4ea67e0869e41b3d85019e6b3c3de3dd5d336284,4/12(土) 6:21
2025-04-13,00:06,business,経済,18,THE GOLD ONLINE（ゴールドオンライン）,「日本の教育」は意外と高く評価されているが…たった一つ、とびぬけて“世界平均を超えてしまっていること”。財務省に改善を提言も一蹴,17,https://news.yahoo.co.jp/articles/1daf80b7a02ea3c2d88f0e1543ec20a4ab4aaa72,4/12(土) 14:02
2025-04-13,00:06,business,経済,19,Forbes JAPAN,テスラ・サイバートラックの不振鮮明、290億円相当が売れ残り,17,https://news.yahoo.co.jp/articles/683e966b43a4a2ecca47504c048dcdecb5356157,4/12(土) 12:00
2025-04-13,00:06,business,経済,20,ファイナンシャルフィールド,毎日車に乗るため、毎月ガソリン代が「4000円以上」かかって困っています！「暫定税率」が廃止されると聞いたのですが、もし本当に廃止された場合「ガソリン代」はいくらくらい安くなりますか？,14,https://news.yahoo.co.jp/articles/a3847887cb84a9281da4805974f1f88bcfde1b19,4/12(土) 13:10
2025-04-13,00:06,business,経済,21,プレジデントオンライン,ディズニー映画とは真逆の主人公だからいい…日本の評価はイマイチでも海外では大絶賛の「異世界アニメ」とは,14,https://news.yahoo.co.jp/articles/a1cbad6d541d7fab0f2e8637f0402190477f4a3e,4/12(土) 9:17
2025-04-13,00:06,business,経済,22,ファイナンシャルフィールド,東京のマンションの平均価格「1億円」超え！ 少しでも安く買うために「定期借地権付きマンション」を選択する人が増えている？,13,https://news.yahoo.co.jp/articles/412d97dbbdc239307af0d7efcddcd93f022a0a68,4/12(土) 12:20
2025-04-13,00:06,business,経済,23,ファイナンシャルフィールド,久しぶりに「ファミレス」へ行くと「ロボット」が配膳をしていて驚きました。例えば「時給1200円で人を雇う」場合と比べ、「配膳ロボット」を導入するとどのくらい「人件費の削減」になるのでしょうか？,13,https://news.yahoo.co.jp/articles/6e793cbd4f301918f956a67c027a364122b6da96,4/12(土) 11:30
2025-04-13,00:06,business,経済,24,Merkmal,西九州新幹線「佐賀県を通らないルート」実現可能か？ 有明海ルートで博多～長崎10分短縮…浮上した奇策の経済効果と課題とは,12,https://news.yahoo.co.jp/articles/9989f8002c601d8953bb74ec63536e8c2f8ed48d,4/12(土) 5:51
2025-04-13,00:06,business,経済,25,みんかぶマガジン,石破総理がトランプの更なる怒りを買う可能性…日本に残された‟交渉カード”を無視する日本政府の深い罪,11,https://news.yahoo.co.jp/articles/6cf03016f507c978aaa411549043a6c7d8cdd127,4/12(土) 12:10
2025-04-13,00:06,business,経済,26,ファイナンシャルフィールド,社会人2年目だけど、昇給は「5000円」だけ！ 給与って3年働いても「1.5万円」くらいしか増えないの？ 会社員の“昇給額の平均”について解説,11,https://news.yahoo.co.jp/articles/3a3fd8bcd73243ae5f02ae65fef91f78847fd522,4/12(土) 11:30
2025-04-13,00:06,business,経済,27,FNNプライムオンライン,「輸出しばらく見合わせる」「他の販路開拓する必要も」トランプ大統領の『相互関税』が発動　アメリカ市場に売り込もうとした矢先,10,https://news.yahoo.co.jp/articles/ad7c35240ff710afe6882b4484f47c386e82dcdd,4/12(土) 17:02
2025-04-13,00:06,business,経済,28,くるまのニュース,軽自動車を買おう！ でも「ターボ」って必要ですか？ 街乗りは「安いノンターボ車」で良くないですか？ だけど「パワー」は欲しい… 「新生活の軽選び」で考えるべきこととは,10,https://news.yahoo.co.jp/articles/509f2bad2f88d679296b94ca2b1cac44d745059b,4/12(土) 20:10
2025-04-13,00:06,business,経済,29,毎日新聞,トランプ関税で米国債売り、10年物金利4.49%に　9.11以来の上昇幅,10,https://news.yahoo.co.jp/articles/d14fc8c95d74836ef6295ea5a8f96e4467432ebb,4/12(土) 9:00
2025-04-13,00:06,business,経済,30,乗りものニュース,「不正通行にはならない」ETC障害で国交相、刑事責任に問われる可能性を否定 NEXCOは「お支払いを」 どういうことなのか？,10,https://news.yahoo.co.jp/articles/d5c210b4b7d6e10432cbc39ea0f0784ffddbf8e9,4/12(土) 7:42
2025-04-13,00:06,business,経済,31,THE GOLD ONLINE（ゴールドオンライン）,金は使ってナンボだろ！…「金融資産1億円」で早期退職した60歳元会社員、豪華リフォーム・外車・グルメ三昧の果て、わずか7年で“破産寸前へ転落”の末路,9,https://news.yahoo.co.jp/articles/ea8d45f7dc95572289c6245bc0113b1638e4b3ed,4/12(土) 10:32
2025-04-13,00:06,business,経済,32,読売新聞オンライン,「万博、日本経済にプラス」は43％、近畿の企業は58・8％…信用調査会社調べ,9,https://news.yahoo.co.jp/articles/e5ebcb9b9a601c0473fa99b3169c46a8ea641a5c,4/12(土) 11:51
2025-04-13,00:06,business,経済,33,ファイナンシャルフィールド,運転中に「横断歩道」で待っている歩行者に気づきませんでした。違反になった場合、違反金はどのくらいですか？,9,https://news.yahoo.co.jp/articles/82b257b1952e9f9adbc5e267a57c67eff0d826e1,4/12(土) 12:30
2025-04-13,00:06,business,経済,34,webCG,お値段は400万円から!?　新型「スバル・フォレスター」は本当にお得なのか,9,https://news.yahoo.co.jp/articles/75561c6e84adbdb52ff95ebd38eaa270bd235584,4/12(土) 6:01
2025-04-13,00:06,business,経済,35,マネーポストWEB,「旅行が好き」「広告が好き」といって旅行代理店や広告会社に入社した人たちの「こんなはずじゃなかった！」　「好き」だけで仕事を選ぶ落とし穴と、「好き」よりも大切なこと,8,https://news.yahoo.co.jp/articles/0ea201a635f3755fe0c211d23a29d8955d48b901,4/12(土) 16:15
2025-04-13,00:06,business,経済,36,TBS NEWS DIG Powered by JNN,急転直下の「相互関税」猶予、交渉トップの日本にチャンスあり【播摩卓士の経済コラム】,8,https://news.yahoo.co.jp/articles/04b81d541cd046f0adb284bb7d6d673ff6c7583c,4/12(土) 14:02
2025-04-13,00:06,business,経済,37,鉄道コム,「吸収合併」で「路線総延長」に変化！ 2025年度版大手私鉄「距離バトル」ランキング,8,https://news.yahoo.co.jp/articles/22d62569c3988d64266453a30e57122c913c4a1d,4/12(土) 12:05
2025-04-13,00:06,business,経済,38,テレビ朝日系（ANN）,ウエルシアとツルハが経営統合を発表　2年前倒し　売上高2兆3000億円,8,https://news.yahoo.co.jp/articles/0117f2dc5cb4362058d7d61aea1ed0c51d0916ed,4/12(土) 9:17
2025-04-13,00:06,business,経済,39,プレジデントオンライン,全財産7350万円が一瞬で2億2100万円に…20歳の投資家がスポーツくじを的中させられた納得の理由,8,https://news.yahoo.co.jp/articles/57b7803b038241248e79fc00a47571ce2ac5d235,4/12(土) 7:17
2025-04-13,00:06,business,経済,40,みんかぶマガジン,世帯年収1500万でも、今のマンション相場では都心湾岸エリアのタワマンは購入できない…郊外マンションも割高感ありで「住まい購入派」には厳しい現状,7,https://news.yahoo.co.jp/articles/1f893918bd45e256cc6d63e419412cad7a9965ca,4/12(土) 17:10
