scrp_date,scrp_time,genre_en,genre_jp,rank,media_jp,title,comment,link,date_original
2025-10-04,06:06,business,経済,1,テレビ朝日系（ANN）,住宅ローン変動金利1年で倍に…マイホーム苦悩 30代40代の相談急増「どうなるか不安」,147,https://news.yahoo.co.jp/articles/4507ae74431f7a80184beb294a8f80d3ce2251b0,10/3(金) 12:48
2025-10-04,06:06,business,経済,2,日テレNEWS NNN,【速報】日産自動車　横浜F・マリノスの筆頭株主であり続けると発表,84,https://news.yahoo.co.jp/articles/e3974fe225072d86c0601f84c017aea750888ff5,10/3(金) 19:35
2025-10-04,06:06,business,経済,3,朝日新聞,日産、横浜マリノスの経営権維持の方向「筆頭株主であり続ける」,69,https://news.yahoo.co.jp/articles/351a433676d618c5888c1bfa299b24a93e159d54,10/3(金) 20:33
2025-10-04,06:06,business,経済,4,東洋経済オンライン,「日テレの報道はやらせだ」「高市潰しの印象操作」と炎上…《外国人による奈良公園のシカ暴行》をめぐる“不毛な論争”がくり返されるワケ,48,https://news.yahoo.co.jp/articles/6c85c0aea5f8be1f682aa301b1e1c8c795234ef3,10/3(金) 16:31
2025-10-04,06:06,business,経済,5,日テレNEWS NNN,【速報】日経平均株価　6営業日ぶりに終値ベースで史上最高値を更新,48,https://news.yahoo.co.jp/articles/75e32df29aa621edd9c9d08490e7814cbcbebe7a,10/3(金) 15:35
2025-10-04,06:06,business,経済,6,みんかぶマガジン,まさか…衝撃の日テレ総裁選調査！どんだけ国民が騒いでも次の総理はこの人でほぼ確定「これじゃ立民」バラマキ高市vs増税封印の小泉,45,https://news.yahoo.co.jp/articles/6d699b6904b8d1fd1021a3f9bc9b39c75199baea,10/3(金) 9:10
2025-10-04,06:06,business,経済,7,TBS NEWS DIG Powered by JNN,日経平均株価　一時800円以上値上がり　ニューヨーク市場で主要な3指数の最高値受け,36,https://news.yahoo.co.jp/articles/f1c81e55ae37eb515ea532c9a1e4e735a830542d,10/3(金) 9:51
2025-10-04,06:06,business,経済,8,日テレNEWS NNN,【専門家に聞く】自民党総裁選　勝利結果でマーケットはどう動く？　今後のマーケットの行方は,33,https://news.yahoo.co.jp/articles/9a50c9a503c00bf224c060ece4acc993df125fda,10/3(金) 11:31
2025-10-04,06:06,business,経済,9,TBS NEWS DIG Powered by JNN,東京でも「運転手不足」深刻…都営バスが206便減便　地方では修学旅行にも影響　対策は?【Nスタ解説】,26,https://news.yahoo.co.jp/articles/dbf621f4bf3aa9fa0adc7e2d28c3bc4c25323e7b,10/3(金) 20:52
2025-10-04,06:06,business,経済,10,日テレNEWS NNN,【速報】アサヒグループHD、システム障害の原因は「ランサムウエアによる攻撃」,26,https://news.yahoo.co.jp/articles/c0f03ff1abd7ecedb21b967297a8199b2cd835e7,10/3(金) 17:44
2025-10-04,06:06,business,経済,11,Finasee,FIREしたはずの息子が突然「家にいさせてほしい」…資産6000万円、40歳で“子供部屋おじさん”に逆戻りした意外な理由,24,https://news.yahoo.co.jp/articles/6080d2c935448984abdf1811a59e50e13b54418e,10/3(金) 19:50
2025-10-04,06:06,business,経済,12,Bloomberg,トランプ氏、数千人の職員削減検討、民主に圧力－政府閉鎖2日目,23,https://news.yahoo.co.jp/articles/f50771d8572f8951dfd0365c67907b20b282532e,10/2(木) 22:46
2025-10-04,06:06,business,経済,13,乗りものニュース,関東の「鉄道廃止代替バス」も一部廃止へ 47.7km一挙廃止の大ナタ 運転手不足で 茨城,21,https://news.yahoo.co.jp/articles/918ce14c10b57ed886b8bb59d8d9716b6b66daf8,10/3(金) 8:12
2025-10-04,06:06,business,経済,14,TBS NEWS DIG Powered by JNN,今月利上げの可能性は？日銀　植田総裁が会見　利上げ時期について明言避ける,18,https://news.yahoo.co.jp/articles/f5036d00962ecc4756a5a043d42336e957b8a1aa,10/3(金) 20:25
2025-10-04,06:06,business,経済,15,トラベルボイス,訪日客の「免税制度廃止論」に観光関連17団体が提言書、国際競争力に大きく影響、「ショッピングツーリズム」の推進を,17,https://news.yahoo.co.jp/articles/4f4e21264a755f679df72cbeaba824f40dfe5545,10/3(金) 13:20
2025-10-04,06:06,business,経済,16,産経新聞,半年限りの「万博の華」パビリオン　大半が再利用決まらず　記憶継承へ早期計画が急務,16,https://news.yahoo.co.jp/articles/ec9a74284c687a90a8e830f5a0d6402c8fc2df46,10/3(金) 19:01
2025-10-04,06:06,business,経済,17,毎日新聞,京都市の宿泊税、引き上げ決定　26年3月1日分から最高1万円に,13,https://news.yahoo.co.jp/articles/f87e9a259a62893be6dfda7fa439e246f069580b,10/3(金) 20:03
2025-10-04,06:06,business,経済,18,日テレNEWS NNN,全国スーパーのコメ平均価格、依然4000円台続く…前週比で下落も,13,https://news.yahoo.co.jp/articles/6eb67b28660a5b3e85898908f3ecf5fd3eb836a6,10/3(金) 15:28
2025-10-04,06:06,business,経済,19,共同通信,コメ5キロ、平均3995円,13,https://news.yahoo.co.jp/articles/ddef0a2b21f814bb896355583c5ed22efa5f9ad7,10/3(金) 17:17
2025-10-04,06:06,business,経済,20,共同通信,芝浦電子へのTOB成立へ　台湾ヤゲオ、総額1089億円,12,https://news.yahoo.co.jp/articles/3491356b91078156d195e2556643ddabd9415f0a,10/3(金) 17:44
2025-10-04,06:06,business,経済,21,マネーポストWEB,もうお腹いっぱい？進化したiPhone 17の登場を素直に喜べないユーザーの声　「僕にはスペックがトゥーマッチ」「やっぱり値段が高すぎる」で古い機種を使い続ける選択,11,https://news.yahoo.co.jp/articles/17eb424d515423339be25d2b839ddc94bb59e0de,10/3(金) 15:15
2025-10-04,06:06,business,経済,22,共同通信,日産「マリノスの筆頭株主続ける」と表明,10,https://news.yahoo.co.jp/articles/20f32eeed9437fd034987012f5cfb5e55fcdf68c,10/3(金) 19:33
2025-10-04,06:06,business,経済,23,ファイナンシャルフィールド,質問「何歳まで生きたいですか？」への回答“中国・ベトナム76歳”だけど、日本は意外と短い？ 長生きよりも「健康で尊厳ある生活」を重視する傾向に…夫婦2人の“老後資金”も確認,10,https://news.yahoo.co.jp/articles/255f56f9f8486ff1eb71f1e2a4fe1953a1c0b8e0,10/3(金) 13:10
2025-10-04,06:06,business,経済,24,36Kr Japan,低品質・高価格の万博EVバス、1社独占で150台受注。なぜBYDは「蚊帳の外」だったのか？ーー後編,10,https://news.yahoo.co.jp/articles/cbc390772731e190dad41c1b939431cda9d575bd,10/3(金) 8:30
2025-10-04,06:06,business,経済,25,MBSニュース,【万博来場者】21日連続の20万人超　閉幕まで同ペースなら累計来場者数は2500万人超の見込み,10,https://news.yahoo.co.jp/articles/8e2fd2fb8c445160e14560b2ab43a805f66bdb3b,10/3(金) 10:23
2025-10-04,06:06,business,経済,26,Bloomberg,野田立民代表、与党との政策協議排除せず－現金給付案「丸のみ」なら,9,https://news.yahoo.co.jp/articles/cae80af4d9df0759ac1952a234b17608fd0923e1,10/3(金) 18:45
2025-10-04,06:06,business,経済,27,ニューズウィーク日本版,高市氏は立憲民主に近い政策を採用、小泉氏は石破路線を踏襲…自民党が「異例の事態」に陥った理由,9,https://news.yahoo.co.jp/articles/12699c94c6ec28e77b7ccea443ecca53453720eb,10/3(金) 19:40
2025-10-04,06:06,business,経済,28,読売新聞オンライン,スーパーのコメ平均価格、２週連続値下がり…依然４０００円台の高値続く,9,https://news.yahoo.co.jp/articles/e9ef8c1f01f52de67827f4d8810a230ab08faecc,10/3(金) 22:21
2025-10-04,06:06,business,経済,29,36Kr Japan,大阪・関西万博のEVバス、日本製だと偽り不具合多発！製造元の中国3社の実像ーー前編,9,https://news.yahoo.co.jp/articles/3d5b04d725b3732268d2fa45df74d5295d88145b,10/3(金) 8:20
2025-10-04,06:06,business,経済,30,FNNプライムオンライン,吉村知事「万博未使用チケット」松原市が“市のイベントで使える金券に交換”について「松原市の観光振興という側面からの取り組みだと思う」「大阪府に置き換えると税金で払い戻すことになると思うので難しいと思う」,8,https://news.yahoo.co.jp/articles/27d977130be9a1bc1d908360a8fff0324fe19ded,10/3(金) 15:54
2025-10-04,06:06,business,経済,31,MotorFan,新谷かおるの傑作バイクマンガ『ふたり鷹』完全版第2巻が発売！450ページ×雑誌掲載サイズの大ボリューム!!,8,https://news.yahoo.co.jp/articles/48b973702ed11b7e777ae9821bea5bd9d195a584,10/3(金) 19:40
2025-10-04,06:06,business,経済,32,TBS NEWS DIG Powered by JNN,最新のコメ平均価格「5キロ4211円」　2週連続下落も4000円台続く　“随意契約の備蓄米”販売延長などが価格下落に影響か,8,https://news.yahoo.co.jp/articles/e6e44121f565c039797246d2a8bbeed9361d874c,10/3(金) 12:52
2025-10-04,06:06,business,経済,33,AERA DIGITAL,ガソリン減税は、子どもに臨時でお小遣いを渡すようなもの　“短期の安堵と長期の備え”どう両立させるかが課題　田内学,8,https://news.yahoo.co.jp/articles/07696eb523684fe2f8225af5c6b9aa58058be4b8,10/3(金) 16:31
2025-10-04,06:06,business,経済,34,日テレNEWS NNN,全国スーパーのコメ平均価格　4週連続で4000円台続く…前週比35円下落も,8,https://news.yahoo.co.jp/articles/813edf0c1b69e087c408189b036a39006e70eda7,10/3(金) 20:30
2025-10-04,06:06,business,経済,35,TBS NEWS DIG Powered by JNN,意外?福岡が東京・大阪を抑え全国1位「お小遣いランキング」　物価・県民性が影響か【Nスタ解説】,8,https://news.yahoo.co.jp/articles/c5e9a4d6640d8361a7d3b0481218e409ff62bdff,10/3(金) 21:12
2025-10-04,06:06,business,経済,36,TBS CROSS DIG with Bloomberg,裕福な国は肉の消費減らせ-「食の未来」巡る論争、新ラウンドに突入,8,https://news.yahoo.co.jp/articles/80c2a935558569d286f6676092eb1c44ed0b2cd0,10/3(金) 16:32
2025-10-04,06:06,business,経済,37,鉄道コム,EF67形やEF500形などさらば　広島車両所の保存車両が解体へ、最後に撮影会の開催も,8,https://news.yahoo.co.jp/articles/09e8d06b1305bbe604cdf4f295d22bd281f76e97,10/3(金) 19:29
2025-10-04,06:06,business,経済,38,朝日新聞,コメ2週連続で値下がり、5キロ4211円に　作況指数は廃止承認,8,https://news.yahoo.co.jp/articles/7027d8a1132fcfa19785a081742fabf1cb3e4214,10/3(金) 16:49
2025-10-04,06:06,business,経済,39,時事通信,日産、「横浜F・マリノス」の筆頭株主継続,7,https://news.yahoo.co.jp/articles/55553232f7875fbd3f1531b6882f27fba86b4dac,10/3(金) 20:00
2025-10-04,06:06,business,経済,40,デイリー新潮,「ある条件」に当てはまらない限りは日銀の「年内利上げはない」とエコノミストが読む理由,7,https://news.yahoo.co.jp/articles/4c401b4d635b6d6638693da2e7fc0c5e959de114,10/3(金) 6:11
