scrp_date,scrp_time,genre_en,genre_jp,rank,media_jp,title,comment,link,date_original
2023-12-09,15:22,life,ライフ,1,日刊ゲンダイDIGITAL,《裕福な家庭への支援》か《Fラン大学救済策》か…岸田首相の大学無償化政策に国民憤慨,316,https://news.yahoo.co.jp/articles/8282ff6199a9e13e110b3c289b59a7ce2209f69e,12/9(土) 9:06
2023-12-09,15:22,life,ライフ,2,オトナンサー,道路で「ハト」「猫」をひき殺してしまった…“やむを得ず”でも罪に問われるの？　弁護士に聞いた,88,https://news.yahoo.co.jp/articles/448cdbe71ffe3f424fcbd388735756b8f75add61,12/9(土) 6:10
2023-12-09,15:22,life,ライフ,3,東京バーゲンマニア,くら寿司の無料ガリが大根に。ネット騒然の変更、広報に理由を聞くと...驚きの事実が判明。,49,https://news.yahoo.co.jp/articles/a3d58f86aa9cea3f1ae24da1b7b5b1ce5494e07a,12/8(金) 20:03
2023-12-09,15:22,life,ライフ,4,ファイナンシャルフィールド,姉の子どもに「任天堂スイッチ」をねだられています。4万円近くするのですが、クリスマスプレゼントにしては高くないですか？ 最近はこれが普通なのでしょうか…？,38,https://news.yahoo.co.jp/articles/ba4aad529f8d8a9b2c66e2508140960c38b84f99,12/9(土) 11:20
2023-12-09,15:22,life,ライフ,5,マイナビ子育て,息子と一緒に出たR-1グランプリ予選「私の後ろには、この子がいるんだぞ！」5児の母・芸人 竹田こもちこんぶさんインタビュー,38,https://news.yahoo.co.jp/articles/0f264e7797a44235da34148f77e76b877eb25235,12/9(土) 11:30
2023-12-09,15:22,life,ライフ,6,まいどなニュース,こんなショボい「盛り合わせ」があるか！ 衝撃のビジュアルで注目を集めた“詐欺ソーセージ”騒動　イベント運営の見解は,28,https://news.yahoo.co.jp/articles/e834267cbe3d64275f4ea98aa318123bd6bbd8b6,12/9(土) 7:00
2023-12-09,15:22,life,ライフ,7,THE GOLD ONLINE（ゴールドオンライン）,70代・女性受刑者「トマトやキュウリ1本ぐらいでここ（刑務所）に来ちゃった」――激増する“塀の中のおばあさん”,28,https://news.yahoo.co.jp/articles/0960fae84169d3579ad04a11293d5297ed636496,12/9(土) 12:32
2023-12-09,15:22,life,ライフ,8,日刊ゲンダイDIGITAL,岸田政権の少子化対策また的外れ…子ども3人世帯「大学無償化」に《不公平だ》と批判殺到,25,https://news.yahoo.co.jp/articles/4dd3f9ef373ba9b8a454fff98b8e0b237fb56f3a,12/8(金) 16:06
2023-12-09,15:22,life,ライフ,9,週刊SPA!,「若い女性が“男の色気”を感じてしまう中年男性」に共通している9つの特徴,23,https://news.yahoo.co.jp/articles/a4bb3a3665c69eb399b71bc442f8145914626e1f,12/8(金) 15:55
2023-12-09,15:22,life,ライフ,10,ファイナンシャルフィールド,始業時刻は「8時」ですが、「7時50分」には席についています。ぎりぎりだと上司に「遅くない？」と言われますし、タダ働きのように感じてしまうのですが、この10分は労働時間に含まれないのでしょうか？,23,https://news.yahoo.co.jp/articles/e45f04ae0cfb3c364b0b1e3b0b37ffd26a95bc93,12/9(土) 11:11
2023-12-09,15:22,life,ライフ,11,Hint-Pot,タイツに入っている台紙「そろそろおやめにしませんか」　取り出す際に伝線　女性の切実な悩みに共感の声,22,https://news.yahoo.co.jp/articles/48b1d3b487361e146a54d0067c93a9ea9635a96e,12/9(土) 9:10
2023-12-09,15:22,life,ライフ,12,プレジデントオンライン,"なぜ""たいして出世しなかった人""のほうが若く見えるのか…医師・和田秀樹「若々しい中高年の共通点」",22,https://news.yahoo.co.jp/articles/b7d58ca9271332fcb33c8a5a0d06e2c4165fcb5c,12/9(土) 13:17
2023-12-09,15:22,life,ライフ,13,日刊ゲンダイDIGITAL,食道がん公表のチバユウスケさん他界…飲酒後は唾液中の発がん物質濃度が10倍に【Dr.中川 がんサバイバーの知恵】,21,https://news.yahoo.co.jp/articles/b98160eebab396df0be85efd640060b04c1772d0,12/9(土) 9:06
2023-12-09,15:22,life,ライフ,14,食楽web,大手コンビニのコーヒーはどれが一番美味しい？ セブン・ファミマ・ローソンで飲み比べてみた！,20,https://news.yahoo.co.jp/articles/250d3a9fdadb355a164dedbf018ad83201e154c2,12/9(土) 11:04
2023-12-09,15:22,life,ライフ,15,BRAVO MOUNTAIN,実はウマい「外道魚」3選!　意外な絶品【実食レポ】,20,https://news.yahoo.co.jp/articles/dee7b9f0f10acbfbe478d1ca3e7465b3c9d09801,12/9(土) 12:12
2023-12-09,15:22,life,ライフ,16,ねとらぼ,やっちゃダメ！　ホテルスタッフによる客室での「NGマナー」解説が参考になる,19,https://news.yahoo.co.jp/articles/f37479f154452d31c0cc8a73f091769f69c4544f,12/9(土) 12:00
2023-12-09,15:22,life,ライフ,17,FORZA STYLE,「オジサン、その年でまだとんがり靴履いてるの……」女子にドン引きされない革靴の鉄則があった！,18,https://news.yahoo.co.jp/articles/bd4bd795f9984e467b484d600922841a0391939e,12/9(土) 8:36
2023-12-09,15:22,life,ライフ,18,産経新聞,ＫＡＤＯＫＡＷＡジェンダー本中止「伝統社会切り崩す人の不都合な真実」島田洋一氏,18,https://news.yahoo.co.jp/articles/f0f9afa0a180134b964f611be7ec75436ba05041,12/9(土) 8:23
2023-12-09,15:22,life,ライフ,19,Pen Online,低予算でもハイクオリティの『ゴジラ-1.0』が、米で大化けレベルのヒット…「ハリウッドはお手本にすべき」の声も,17,https://news.yahoo.co.jp/articles/2202ba0164bcf64f8f410d4c2b4b006bc2b5130e,12/9(土) 6:50
2023-12-09,15:22,life,ライフ,20,朝日新聞デジタル,【大学トレンド】国公立大で広がる年内入試、筑波大は入学者3割が「特別選抜」,16,https://news.yahoo.co.jp/articles/a9ce714a44df575973f280a19a1d4d671814f8c1,12/9(土) 12:06
2023-12-09,15:22,life,ライフ,21,ファイナンシャルフィールド,エアコンが壊れたのですが、「ファンヒーター」と新しい「エアコン」どっちを買うかで迷っています。初期コストはどちらがお得ですか？,13,https://news.yahoo.co.jp/articles/290ffb83e18cd7fc515f1bbfd9267220c3042183,12/9(土) 13:30
2023-12-09,15:22,life,ライフ,22,FNNプライムオンライン,「初めての方は気持ち悪がるが…」福島市の非公認キャラ「モモダゾイ」　正体は“桃の妖精” SNSフォロワー7000人超,12,https://news.yahoo.co.jp/articles/32a031bdc49cd256922860c9200d335e24254cbc,12/9(土) 11:22
2023-12-09,15:22,life,ライフ,23,ファイナンシャルフィールド,「聖徳太子」の1万円札を発見！ 当時の1万円を「今のお金」に換算するといくらになるの？ 昭和33年頃の物価についても確認,12,https://news.yahoo.co.jp/articles/adebf85190801f5f1cc48d9413917f6ca08f0657,12/9(土) 11:21
2023-12-09,15:22,life,ライフ,24,ほ・とせなNEWS,16歳で両足を切断後、モデルとして活躍　「障がい・健常は関係ない」前向きに生きる彼女のマインドに迫る,12,https://news.yahoo.co.jp/articles/ac495995120f708e58e88c0bbb4a798af8674d04,12/9(土) 11:30
2023-12-09,15:22,life,ライフ,25,AUTO BILD JAPAN Web,【トヨタの近未来EV戦略】トヨタが電気自動車攻勢を開始　2026年までに少なくとも6台の電気自動車を投入,11,https://news.yahoo.co.jp/articles/f9f3fc291d702bf20e67955cebc7063ae852a9af,12/9(土) 13:37
2023-12-09,15:22,life,ライフ,26,ねとらぼ,【牛丼チェーン】「豚汁がおいしいと思う牛丼チェーン」ランキング！　2位は「すき家」、1位は？,10,https://news.yahoo.co.jp/articles/5b34bf0dcaacd4dc7fc1538aea5c00e809f4a455,12/9(土) 14:20
2023-12-09,15:22,life,ライフ,27,THE GOLD ONLINE（ゴールドオンライン）,年収450万円の40歳会社員、乳がん罹患で「やっぱりがん保険はいらない」と確信も…3年後に大後悔する「衝撃の治療費」【CFPが解説】,10,https://news.yahoo.co.jp/articles/77a84a04c748e1a159fb4c4591114c61c012c353,12/9(土) 5:02
2023-12-09,15:22,life,ライフ,28,日刊ゲンダイDIGITAL,医学部に内部進学できるのはどんな学生か？「塾高」の進学枠もかつてより減少し…【慶応義塾の研究】,10,https://news.yahoo.co.jp/articles/56352885df9a09acd70d5d5b5423620cbf45b7d2,12/9(土) 9:06
2023-12-09,15:22,life,ライフ,29,ねとらぼ,「GMARCHの中で企業からの評価が高いと思う大学」ランキング！　第2位は「青山学院大学」、1位は？,10,https://news.yahoo.co.jp/articles/52fbb95c79ed873218e28b50e1a0602ea3e63fec,12/9(土) 9:50
2023-12-09,15:22,life,ライフ,30,Forbes JAPAN,フランス、ビーチや公園で喫煙禁止へ　世界各国で強まる禁煙への動き,10,https://news.yahoo.co.jp/articles/50d8cfba346389058c5109d93bd433faa3535cea,12/9(土) 10:00
2023-12-09,15:22,life,ライフ,31,Hint-Pot,ピンクの肉球がくっきり！　ねこをコピーした“ニャ拓”　見事な仕上がりに大反響　「芸術作品」,10,https://news.yahoo.co.jp/articles/c5f479b46b8e000091cd1709c92e032cfe1b6812,12/9(土) 7:11
2023-12-09,15:22,life,ライフ,32,まいどなニュース,【写メは死語？】10代男性の3人に1人「聞いたことがない」,9,https://news.yahoo.co.jp/articles/dfa75f17af93aaa4ac668d4ba925e5bdd5ee529b,12/9(土) 11:40
2023-12-09,15:22,life,ライフ,33,たまひよONLINE,「私無理かも…」妊娠8カ月で胎児が水頭症と診断、0歳でウエスト症候群・全盲を告知されながらも必死に向き合った母と息子の13年間【重心児育児体験談】,9,https://news.yahoo.co.jp/articles/e676343894267d1b1b3557048750195c0ddb93fe,12/9(土) 11:55
2023-12-09,15:22,life,ライフ,34,まいどなニュース,「B型男子の理解できない行動」　2位は「人の話を聞かない」、3位「言ったことを覚えていない」、1位は？,9,https://news.yahoo.co.jp/articles/09351578682967bb2f8f9508f3ddaf0faf3841ce,12/8(金) 19:30
2023-12-09,15:22,life,ライフ,35,ESSE-online,フライパンは「安いものを選ぶのが正解」のワケ。3つの判断基準でムダ買いをなくす,9,https://news.yahoo.co.jp/articles/f03c588b5bfe5cbcddf9420c44dad134c071b404,12/8(金) 16:02
2023-12-09,15:22,life,ライフ,36,ファイナンシャルフィールド,家業で営業用の車が必要です。事業用と自家用は自動車税が違うって本当ですか？,9,https://news.yahoo.co.jp/articles/45b72be1e88cdcf68b2b98c7ac5c923a66017ffd,12/9(土) 11:20
2023-12-09,15:22,life,ライフ,37,THE GOLD ONLINE（ゴールドオンライン）,"3,100万円で買ったマンション「隣人が最悪」だった…隣人の存在を“告知しなかった”仲介業者に「損害賠償請求」した結果【弁護士が判例解説】",9,https://news.yahoo.co.jp/articles/0a2e55d61c990d798dbc07d7c5622b767c5b4660,12/9(土) 11:02
2023-12-09,15:22,life,ライフ,38,25ans（ヴァンサンカン）,皇后雅子さま、60歳“還暦”に！「知性あふれる美貌」を10代から一挙プレイバック,9,https://news.yahoo.co.jp/articles/c8e990225f57b3ecda86304108e4195d789b724b,12/9(土) 10:10
2023-12-09,15:22,life,ライフ,39,ENGINE WEB,販売予定は月400台　激しい争奪戦は必至　ATのワゴンで復活したトヨタ・ランドクルーザー70の販売開始,9,https://news.yahoo.co.jp/articles/b128eb89d93d3c818a11a46a7fc04036c5bac3fd,12/9(土) 6:10
2023-12-09,15:22,life,ライフ,40,プレジデントオンライン,なぜ文系も理系も「東大現役合格」は現代文が得意なのか…教え子の偏差値を劇的に伸ばした「R80メソッド」とは,8,https://news.yahoo.co.jp/articles/60937eecce56fdd7b7b4d9cf1fc9087f2d4a5b4c,12/9(土) 9:17
