scrp_date,scrp_time,genre_en,genre_jp,rank,media_jp,title,comment,link,date_original
2025-03-14,16:07,sports,スポーツ,1,J-CASTニュース,「韓国のときより10倍すごいことに」フリーマンの発言が韓国で物議　「礼儀全くない」「韓国ファンに配慮ないのか？」,192,https://news.yahoo.co.jp/articles/cfdcd02dd4fd12bbea4a9a866ef477dcb7e686e2,3/14(金) 11:35
2025-03-14,16:07,sports,スポーツ,2,デイリースポーツ,元ＢＤ人気選手の料理人　化学調味料巡り論争の堀江貴文氏に噛みつく「そんだけ好きなら一生化学調味料食ってろ」,149,https://news.yahoo.co.jp/articles/7200dc9a84e33fbc8ca9fa5bc4fb8f8906b934bf,3/14(金) 12:15
2025-03-14,16:07,sports,スポーツ,3,スポニチアネックス,フィリーズ傘下・青柳がまたも1回持たず3失点KO降板　2者連続押し出し四球など1安打4四死球の大乱調,99,https://news.yahoo.co.jp/articles/e6dc94c2a0f0ad6bc346eb6a30e3406ec3c92329,3/14(金) 5:36
2025-03-14,16:07,sports,スポーツ,4,Full-Count,帰国した大谷翔平が会見「本当に楽しみ」　東京開幕戦へ意気込み「いいシリーズにしたい」,63,https://news.yahoo.co.jp/articles/028207458c0966be7e2140c30ab04f938a92788c,3/14(金) 14:15
2025-03-14,16:07,sports,スポーツ,5,TopNews,【F1オーストラリアGP：FP2タイム】角田裕毅4番手＆ハジャー6番手でレーシングブルズは3番目に速いチームへ！ローソン苦戦...最速はルクレール、ピアストリ母国で2番手,62,https://news.yahoo.co.jp/articles/373d8dc59ac109d94e4c4e0f6ce66bcd12edbba8,3/14(金) 15:32
2025-03-14,16:07,sports,スポーツ,6,TBS NEWS DIG Powered by JNN,今永昇太、メジャー1年目振り返り「こんなにユーモアがある人間だったのかな、、」とニヤリ　開幕戦へ「非常に光栄」,62,https://news.yahoo.co.jp/articles/a8ad9b1896e5575c645e3b282c0b560e27404224,3/14(金) 12:31
2025-03-14,16:07,sports,スポーツ,7,Full-Count,大谷翔平、チームホテルには宿泊せず　日本で特別対応…指揮官が明かす「賢明なこと」,54,https://news.yahoo.co.jp/articles/0c7c08267ec41acbeaa864b15ff894e4c34f1681,3/14(金) 7:44
2025-03-14,16:07,sports,スポーツ,8,Number Web,「今年の日本ハムは強いよ」「ロッテのAクラスもカタイ」NHK解説者の2025年パ・リーグ順位予想「Bクラス3チーム予想は…」「西武はかなり大変だと思う」,51,https://news.yahoo.co.jp/articles/b806e10672181d5e69292c159ad043d4eae1cd78,3/14(金) 11:06
2025-03-14,16:07,sports,スポーツ,9,Full-Count,ヤクルト、開幕投手に奥川恭伸　6年目にして初の大役…高津監督が球団Xで発表,49,https://news.yahoo.co.jp/articles/5ec166177edf2ba4314b8fe801af62638cb4e4b5,3/14(金) 8:45
2025-03-14,16:07,sports,スポーツ,10,TopNews,【FP2】角田裕毅4番手！レーシングブルズ快走！ルクレール最速、ピアストリ母国オーストラリアGPで2番手！,46,https://news.yahoo.co.jp/articles/60c6cf6824dea5d1b1156e244f1f60008583ed1a,3/14(金) 15:15
2025-03-14,16:07,sports,スポーツ,11,中日スポーツ,【中日】上林誠知また打った…オープン戦3発目は逆転2ラン、”2球”で2ホーマー開幕へ好調持続,43,https://news.yahoo.co.jp/articles/c8fdb262f4b3df9a0bd69edaefe10790d99ce933,3/14(金) 13:27
2025-03-14,16:07,sports,スポーツ,12,オートスポーツweb,【タイム結果】2025年F1第1戦オーストラリアGPフリー走行2回目,42,https://news.yahoo.co.jp/articles/c2b93bcf6556354e0b006462fa0787f84a0e51dd,3/14(金) 15:05
2025-03-14,16:07,sports,スポーツ,13,Number Web,「マー君は2ケタ勝てるよ」「巨人の投手力は全球団イチ」NHK解説者の2025年セ・リーグ順位予想「阪神とDeNAは差がない」「中日は5位予想、最下位は…」,42,https://news.yahoo.co.jp/articles/66d8974eb8ec7436891f8c9d6694d5576041188b,3/14(金) 11:06
2025-03-14,16:07,sports,スポーツ,14,SOCCER DIGEST Web,「日本がこれをするのか？」「アジア初の挑戦だ」森保ジャパンのW杯“ポット１狙い”に韓国メディアが驚き！「壮大な夢を抱いている」,42,https://news.yahoo.co.jp/articles/68dcd199f971cd1557688d94b83a287df572d3c3,3/14(金) 11:47
2025-03-14,16:07,sports,スポーツ,15,DAZN News,開幕戦オーストラリアGPのFP2で角田裕毅4番手！ルクレール最速、トップ6はマクラーレン、フェラーリ、レーシングブルズが占める｜F1,40,https://news.yahoo.co.jp/articles/f0f79401e3faec776c0dc2b522b2182171cf463a,3/14(金) 15:00
2025-03-14,16:07,sports,スポーツ,16,中日スポーツ,【中日】仲地礼亜は4イニング4失点と精彩欠く…リズムつくれず87球、開幕ローテへアピールできず,39,https://news.yahoo.co.jp/articles/5db4e07b0a6d871a2c501312370e81d6a95fcbc3,3/14(金) 14:39
2025-03-14,16:07,sports,スポーツ,17,中日スポーツ,ドジャース大谷翔平が凱旋も羽田空港到着ロビーは通らず…約500人のファン肩透かし 熱烈な男性ファン「熱い思いは球場で届けます」,36,https://news.yahoo.co.jp/articles/c332b1740e27ceeb0a4752246f9de0239a1fd475,3/13(木) 16:50
2025-03-14,16:07,sports,スポーツ,18,日刊ゲンダイDIGITAL,巨人は今季もDeNAサマサマ…“拾ってきた”戦力外左腕が開幕ローテ候補に急浮上,35,https://news.yahoo.co.jp/articles/5d5da9ebd374eb903ba8c05bcc0ffbc4533a45f7,3/14(金) 11:32
2025-03-14,16:07,sports,スポーツ,19,デイリースポーツ,広島・林が２戦連発、開幕１軍生き残りへ猛アピール,32,https://news.yahoo.co.jp/articles/c4de0fd5dd14108b4f1049f9b11cbcc2dec8b5ef,3/14(金) 15:24
2025-03-14,16:07,sports,スポーツ,20,スポニチアネックス,オリックス　オープン戦2勝7敗1分けに…森離脱の打線1得点止まり　守備も2失策がいずれも失点に直結,32,https://news.yahoo.co.jp/articles/cd9b92e2ed3402db51ba1d48c2d82f4339852d5a,3/14(金) 15:33
2025-03-14,16:07,sports,スポーツ,21,デイリースポーツ,「大トロ」「本場のラーメン」「コンビニ」来日したドジャース選手に緊急アンケ「日本でやりたい事、行きたい場所は？」,32,https://news.yahoo.co.jp/articles/6e791c1dd0c7bb0ec45e044fbe1ab64bf2c1232a,3/14(金) 13:46
2025-03-14,16:07,sports,スポーツ,22,高校野球ドットコム,12球団唯一の“捕手本塁打ゼロ”の阪神…注目される藤川新監督の起用法,30,https://news.yahoo.co.jp/articles/060d0990f588dcb9fd5372dde3507a1fc066ba54,3/14(金) 13:55
2025-03-14,16:07,sports,スポーツ,23,週刊女性PRIME,西武・佐藤龍世が寝坊で“懲罰”降格も同情ナシ、過去の有罪判決と「新庄監督を激怒させた怠慢プレー」,29,https://news.yahoo.co.jp/articles/e12b251d5462dde66f5a7e9f74ba42c14fd2caae,3/14(金) 6:32
2025-03-14,16:07,sports,スポーツ,24,デイリースポーツ,巨人　田中将大がカブス戦の登板予定が変更「予定が変わりました」故障などは否定「投げるコンディションではあります」,28,https://news.yahoo.co.jp/articles/ea2014fafba5522dc2f493ed22c211f120f2a4ff,3/14(金) 15:04
2025-03-14,16:07,sports,スポーツ,25,Number Web,「監督を辞めた今だから話せるけど…」立浪和義が“最後の試合前”に漏らした本音「志半ばなんだろうな、と」中日OBが語る“ホームランテラス設置”の効果,27,https://news.yahoo.co.jp/articles/ffc1997d6591b6a5c00f50fe48057f69a910a1b8,3/14(金) 11:06
2025-03-14,16:07,sports,スポーツ,26,TBS NEWS DIG Powered by JNN,【DeNA】楽天に完封勝ち！ 牧が初回にOP戦1号ソロのスミ1を先発・東、ドラ4若松、小園が3回無安打、9回をドラ2篠木が締める,26,https://news.yahoo.co.jp/articles/155519281532df887756bce813729b50b37b5336,3/14(金) 15:21
2025-03-14,16:07,sports,スポーツ,27,ABEMA TIMES,サボるなよ！！守備しないヴィニシウスにブチギレ！「舐めたプレーにキレていい」「めっちゃ怒ってたな」ベリンガムが魂のロケットスライディング→地面を叩いて激怒した瞬間,25,https://news.yahoo.co.jp/articles/c033292b2f528c62bffdc5b3595d4e0c28608338,3/14(金) 12:02
2025-03-14,16:07,sports,スポーツ,28,サンケイスポーツ,オリックスはまたも貧打に泣き、2連敗 森友哉も長期離脱決定で泣きっ面に蜂,24,https://news.yahoo.co.jp/articles/4aff500a6f603a1491b208aca3496db5544268d8,3/14(金) 15:39
2025-03-14,16:07,sports,スポーツ,29,サンケイスポーツ,ユーリ阿久井政悟、寺地拳四朗に敗れたレフェリーストップのタイミングについて「ストップに異論は別にないです」,24,https://news.yahoo.co.jp/articles/df4c5096dd6f0ae514c928c7a9213f1c90a97f1d,3/14(金) 15:10
2025-03-14,16:07,sports,スポーツ,30,デイリースポーツ,プロ野球選手会が謝罪「大変遺憾、深くお詫び」オンラインカジノ利用問題で声明「球団から一定の処分、否定するものではありません」統一的処分基準求める,24,https://news.yahoo.co.jp/articles/ecc6133730da8bf47c120cc6e5f5588ad1de26ce,3/13(木) 18:00
2025-03-14,16:07,sports,スポーツ,31,日刊スポーツ,【阪神】東京ドーム練習で木浪聖也が三塁守備を練習　佐藤輝明は右翼、森下翔太は左翼,24,https://news.yahoo.co.jp/articles/3a4d3f770e3c82ff6d8d39205b2bf32dcb3f70a9,3/14(金) 11:41
2025-03-14,16:07,sports,スポーツ,32,東スポ競馬,世界的名手・デットーリ騎手がまさかの破産申告「悲しく、恥ずかしい思い」＝英報道,24,https://news.yahoo.co.jp/articles/62a1c02a382e50f9957b42b7fd399fd1f0e23448,3/14(金) 7:35
2025-03-14,16:07,sports,スポーツ,33,motorsport.com 日本版,F1オーストラリアGP FP2速報｜角田裕毅が2日目以降楽しみな4番手！　最速はフェラーリのルクレール,23,https://news.yahoo.co.jp/articles/0a771546540deef5bc38355d441060016f61c264,3/14(金) 15:03
2025-03-14,16:07,sports,スポーツ,34,デイリースポーツ,阪神・佐藤輝が右翼で守備練習　フリー打撃ではカブス選手の前で柵越え連発,22,https://news.yahoo.co.jp/articles/552e0f564417373d297f1085d16aa4c694ab90a5,3/14(金) 14:55
2025-03-14,16:07,sports,スポーツ,35,イーファイト,ノッコン寺田、数千万の詐欺被害告白「ボブ・サップに勝って泣いて喜んでくれた人が…」“100％嘘”の声も,22,https://news.yahoo.co.jp/articles/923f166f9067da189f32d5437a37208aac7cb6a1,3/13(木) 22:55
2025-03-14,16:07,sports,スポーツ,36,日刊スポーツ,【巨人】田中将大、予定変更でカブス戦に登板せず「投げられるコンディションではあります」,22,https://news.yahoo.co.jp/articles/2bdb8a22e7625aadee5c0d5a8a9b56d24a92cfbe,3/14(金) 14:22
2025-03-14,16:07,sports,スポーツ,37,TopNews,【F1オーストラリアGP：FP1順位】赤旗2回！ノリス最速、ウィリアムズのサインツがまさかの2番手！新人ベアマンは大クラッシュ,21,https://news.yahoo.co.jp/articles/d72428275afe400fa05c676481272c05841ba538,3/14(金) 12:01
2025-03-14,16:07,sports,スポーツ,38,デイリースポーツ,岩田翔吉が初防衛に失敗　０－３の判定で敗れ王座陥落　レフェリーが間違って岩田の腕を上げるハプニングも,21,https://news.yahoo.co.jp/articles/02dfcfb9a21f70449e8929ad12ca47db7a634e5b,3/13(木) 19:16
2025-03-14,16:07,sports,スポーツ,39,スポニチアネックス,元日本王者がバッサリ「あれはダウンじゃない」　京口紘人の不運なダウンに言及「パンチで倒れてない」,20,https://news.yahoo.co.jp/articles/217abe9a708e90e58b131ec03006817e2d1e6e6f,3/14(金) 11:21
2025-03-14,16:07,sports,スポーツ,40,日刊スポーツ,クロフネ超えた！フォーエバーヤングが日本ダート史上最高レーティング獲得,20,https://news.yahoo.co.jp/articles/2f0ba37d8d18adc3a4764001ea5883e7199c61dc,3/14(金) 6:00
