scrp_date,scrp_time,genre_en,genre_jp,rank,media_jp,title,comment,link,date_original
2024-04-22,07:18,sports,スポーツ,1,デイリースポーツ,新たな偉業！大谷翔平、松井秀喜超えMLB通算176本塁打　日本人最多記録更新 「狙いにいく打席はない」　“確信歩き”の8戦38打席ぶり5号先制2ラン,334,https://news.yahoo.co.jp/articles/fcf1991009e4409f97fb3790c7722762602eac85,4/22(月) 5:47
2024-04-22,07:18,sports,スポーツ,2,Full-Count,大谷翔平、得点圏で0割台に「コントロールしないと」　満塁の絶好機で三振…指揮官が指摘,77,https://news.yahoo.co.jp/articles/163b98f0912d8b679cbd6e697d298013b301d9d1,4/21(日) 9:22
2024-04-22,07:18,sports,スポーツ,3,TBS NEWS DIG Powered by JNN,【中日】泥沼4連敗で首位陥落...佐藤輝に3ラン被弾後に雨天コールド、カリステ走塁失敗で好機作れず、無念の涙雨,61,https://news.yahoo.co.jp/articles/a43302911f299e051b5f493c57470433cefa5f99,4/21(日) 17:04
2024-04-22,07:18,sports,スポーツ,4,サッカーキング,主役はまたもベリンガム！　レアル・マドリード、劇的弾でバルサを破り今季エル・クラシコ3戦全勝,59,https://news.yahoo.co.jp/articles/851f4d08e16427bbc69c75db0a0dd79c8258e05f,4/22(月) 6:18
2024-04-22,07:18,sports,スポーツ,5,デイリースポーツ,暗黙の了解の境界線はどこ？ＤｅＮＡ・度会が６点リードで盗塁　牧も５点差で二盗　昔であれば報復死球対象の可能性,53,https://news.yahoo.co.jp/articles/80ea7d4191ac0566923673bc8e90c0e5bd7584a3,4/21(日) 19:38
2024-04-22,07:18,sports,スポーツ,6,中日スポーツ,中日、4連敗で首位陥落…6回阪神・佐藤輝に先制3ラン浴びた直後の7回表終了で降雨コールドに,49,https://news.yahoo.co.jp/articles/92fb2c3641b5b00410ac203e56140d614920c86d,4/21(日) 17:12
2024-04-22,07:18,sports,スポーツ,7,デイリースポーツ,西武が単独最下位転落　４カード連続の負け越し　今季３度目の完封負け　７回１失点の高橋光成を見殺しに,47,https://news.yahoo.co.jp/articles/2a57a5fc40adbd31de59607cb3816f6c35572545,4/21(日) 16:52
2024-04-22,07:18,sports,スポーツ,8,デイリースポーツ,首位陥落の中日　突然の降雨コールド宣告に立浪監督あ然　選手も納得できない表情　七回攻撃終了直後にコールド成立,46,https://news.yahoo.co.jp/articles/a914a9b231e6029c91d5520df133eff45cacae3c,4/21(日) 17:07
2024-04-22,07:18,sports,スポーツ,9,スポニチアネックス,西武　7人入れ替えも実らず3連敗…栗山、19年ぶり打撃不振で再調整,45,https://news.yahoo.co.jp/articles/fdaedde021cb3e50928d552bc336a08af034096d,4/22(月) 5:30
2024-04-22,07:18,sports,スポーツ,10,GOAL,レアル・マドリー、再びベリンガムが劇的弾決めてクラシコに逆転勝利！バルセロナに勝ち点11差をつけてラ・リーガ優勝をほぼ手中に,40,https://news.yahoo.co.jp/articles/8bd5f6e3a52dede4ec381739077a6d5f8ca98fdd,4/22(月) 6:02
2024-04-22,07:18,sports,スポーツ,11,ABEMA TIMES,大谷翔平、1安打3四球 リーグトップ33安打も満塁絶好機で空振り三振、悔しい表情 チームは今季初3連敗,40,https://news.yahoo.co.jp/articles/4897fb034cb1553a0337896cfe274578bf91add2,4/21(日) 8:26
2024-04-22,07:18,sports,スポーツ,12,ＡＦＰ＝時事,中国競泳23選手、東京五輪前に薬物陽性 処分なしで出場,37,https://news.yahoo.co.jp/articles/217b6d5d946c44087bd6d4c45320227f67bcc7cc,4/21(日) 10:31
2024-04-22,07:18,sports,スポーツ,13,東スポWEB,【Ｆ１】角田裕毅が無念リタイアで追突ハースの小松代表に批判殺到「嫌がらせの頻度が高すぎる」,36,https://news.yahoo.co.jp/articles/df5d7f428f0174e796b1baade29ebe8ce4c1c111,4/21(日) 17:36
2024-04-22,07:18,sports,スポーツ,14,デイリースポーツ,渡辺雄太「次に決めたチームで引退するまで」アメリカ再挑戦は「考えていない」帰国会見の一問一答,35,https://news.yahoo.co.jp/articles/1439af0633d721e74942575acf74c50121c79939,4/21(日) 18:21
2024-04-22,07:18,sports,スポーツ,15,デイリースポーツ,巨人　１死満塁からセーフティースクイズ敢行も先制できず　小林のバントは投前へ→本塁フォースアウト　吉川も凡退,35,https://news.yahoo.co.jp/articles/abc508b6242ca0a1944c3532d6a16044533faac9,4/21(日) 14:36
2024-04-22,07:18,sports,スポーツ,16,デイリー新潮,岡田阪神、主砲「大山悠輔」の状態はかなり深刻…積極的な戦力補強に動かなかったツケも出た序盤の戦いぶり,34,https://news.yahoo.co.jp/articles/f1ea826db4802f0cd5d4be0e9d4f30ff0d1f070d,4/21(日) 17:00
2024-04-22,07:18,sports,スポーツ,17,日刊スポーツ,ベリンガム後半追加タイムに決勝点！Rマドリードがバルサとの「エル・クラシコ」3－2で制す,32,https://news.yahoo.co.jp/articles/9f8f0e2f414553026761c41cf6d3faf2622a452e,4/22(月) 6:10
2024-04-22,07:18,sports,スポーツ,18,motorsport.com 日本版,マグヌッセン、角田との接触は”お互いに誤解”があったと説明「僕はできることは全てやったつもり」,31,https://news.yahoo.co.jp/articles/59974182c508c39cca53c090c7de886be0352dac,4/21(日) 21:38
2024-04-22,07:18,sports,スポーツ,19,中日スポーツ,エンゼルスのレンドン、左太もも痛で今季も「お決まり」の負傷者リスト…26年まで残る年俸58億円…「野球はビジネス」発言で話題に,31,https://news.yahoo.co.jp/articles/114a7e77fdd9d4fe79eb3ba71cc2387c52b2219b,4/22(月) 4:58
2024-04-22,07:18,sports,スポーツ,20,中日スポーツ,【中日】首位陥落…”前倒し”昇格も3戦1安打と待たれる岡林勇希の復活 片岡ヘッドは「まだ本来の彼の姿じゃない」,31,https://news.yahoo.co.jp/articles/b59246db4008c267ed9bd56f38a719f120ea0b6a,4/22(月) 5:45
2024-04-22,07:18,sports,スポーツ,21,THE DIGEST,「元NBAスター選手が言ってたよ。オオタニは有罪だって」大谷翔平を“悪人”に仕立て上げようとする米記者に非難の声が殺到！「お前は哀れだ」「もううんざり」,31,https://news.yahoo.co.jp/articles/0f6da91e03218f590e2025d7d322b19ca797efc4,4/21(日) 16:03
2024-04-22,07:18,sports,スポーツ,22,CoCoKARAnext,「オオタニは『有罪だ』って！」エ軍専門記者の投稿が波紋 大谷翔平を“悪役”にする指摘に反発の声「なぜ足を引っ張る」,31,https://news.yahoo.co.jp/articles/a67368bced00fd809697e069b96e85cbb5e0e380,4/22(月) 6:03
2024-04-22,07:18,sports,スポーツ,23,Full-Count,大谷翔平、打率.368でメジャー単独トップ浮上　本拠地大熱狂…松井超え特大弾＆投手強襲打,30,https://news.yahoo.co.jp/articles/755a37019c2e57157a0b39e9fe7745ac4ba982b9,4/22(月) 6:34
2024-04-22,07:18,sports,スポーツ,24,中日スポーツ,大谷翔平、7戦ぶり長打など5打席で4度出塁も満塁機で空振り三振…ドジャースは今季初の3連敗,29,https://news.yahoo.co.jp/articles/306ace9282876b60705e8985effd1894f3c66834,4/21(日) 8:29
2024-04-22,07:18,sports,スポーツ,25,中日スポーツ,楽天、先制も痛恨の走塁ミス… 辰己涼介がアウトカウント勘違いか、今江監督あぜん,29,https://news.yahoo.co.jp/articles/d52df3e9ec7a84ce9e59dd95e1be78df080682a0,4/21(日) 15:14
2024-04-22,07:18,sports,スポーツ,26,SOCCER DIGEST Web,町田のサッカーの何が悪いのか。守ってばかりじゃないか、シュートも少ないじゃないかと批判的な声もあるが…【コラム】,29,https://news.yahoo.co.jp/articles/6319b982ec825aa3dad8bfce69fbd5b21cf2421e,4/22(月) 5:30
2024-04-22,07:18,sports,スポーツ,27,Full-Count,大谷翔平、満塁での三振「もちろん反省」　得点圏で打率0割台と苦戦「切り替えて」,29,https://news.yahoo.co.jp/articles/d9eeeece313f7a7c9521abb4684cdb35eb96a0aa,4/21(日) 8:54
2024-04-22,07:18,sports,スポーツ,28,スポニチアネックス,中日が今季初の4連敗で13日ぶり首位陥落　立浪監督は先発の松葉を擁護「よく頑張ってくれた」,28,https://news.yahoo.co.jp/articles/ae0fd22e8256f1580c0e639a7ce41c38e084c224,4/22(月) 5:45
2024-04-22,07:18,sports,スポーツ,29,デイリースポーツ,中日ファンの悲痛な思い飛び交う　降雨コールド負けで首位陥落「遅らせてまで試合開始粘ったのならあと２イニングやらせて」「最初から雨予報」「キツイ週末」,28,https://news.yahoo.co.jp/articles/e14b00984641525217213edb39b2bf7481a2f980,4/21(日) 17:30
2024-04-22,07:18,sports,スポーツ,30,TBS NEWS DIG Powered by JNN,大谷翔平 MLB日本人最多の通算176号！ついに“ゴジラ超え” 8試合ぶり5号 38席ぶりの快音,27,https://news.yahoo.co.jp/articles/6e986a96b7c54be7665c7859ae3ac68596c75949,4/22(月) 5:47
2024-04-22,07:18,sports,スポーツ,31,THE ANSWER,ガルシア、無敗王者ヘイニーを衝撃撃破！　前日計量1.45kg大幅超過も…超大激戦判定勝ちに会場熱狂,27,https://news.yahoo.co.jp/articles/c7d71ebae48b33c369b64fe92019eff30499c6b6,4/21(日) 14:14
2024-04-22,07:18,sports,スポーツ,32,THE DIGEST,「いよいよ、その時が…」“トラウトの緊急トレード先は2チーム”と米メディア提言「近年のMLB史上最大級のディールになるだろう」,27,https://news.yahoo.co.jp/articles/8a584cfab93395cb797d7a4c26bf2b695691fa99,4/22(月) 5:30
2024-04-22,07:18,sports,スポーツ,33,ベースボールキング,得点力不足が露呈する巨人…仁志氏「チャンスはあるが打線の巡りが悪い」と指摘,26,https://news.yahoo.co.jp/articles/9f17a1fe56cc1d847c1aee108f05395b948856e1,4/22(月) 6:30
2024-04-22,07:18,sports,スポーツ,34,デイリースポーツ,「阪神園芸さんなら大丈夫」甲子園の阪神－中日戦は午後２時５３分開始　勝てば６連勝で今季初の首位　ファンの願いが届く,26,https://news.yahoo.co.jp/articles/63c6069d38b31a5c9decb19f21fa765cbb94af8a,4/21(日) 12:26
2024-04-22,07:18,sports,スポーツ,35,中日スポーツ,勝ちパターンの勝野まで投入…“ただの1敗”じゃ済まなくなった中日の敗戦 少しでも尾を引かない負け方も,26,https://news.yahoo.co.jp/articles/1d68028392aac8f4793ce84706bc846a73d5744c,4/21(日) 11:20
2024-04-22,07:18,sports,スポーツ,36,SOCCER DIGEST Web,またベリンガムがクラシコで劇的決勝弾！マドリーがバルサに逆転で３－２勝利！ 両軍の差は11ポイントに、リーガの優勝争いは事実上決着,26,https://news.yahoo.co.jp/articles/fecb8d987593c32201470b79f4414afa6bafb94e,4/22(月) 6:03
2024-04-22,07:18,sports,スポーツ,37,デイリースポーツ,ド軍は今季初の３連敗で貯金１に　大谷翔平は６戦連続安打も満塁絶好機に空振り三振　本拠地ため息　今季初４出塁＆３四球も７戦３６打席ノーアーチ,26,https://news.yahoo.co.jp/articles/ecc88f4a9e9b3c514173e38570c559ef0021e5e7,4/21(日) 8:27
2024-04-22,07:18,sports,スポーツ,38,ABEMA TIMES,大谷翔平、8試合ぶり5号ホームラン！松井秀喜氏を超えるメジャー通算176本目のメモリアルアーチ,26,https://news.yahoo.co.jp/articles/f8ea9ae5331c567e054067cbf044f840e094e982,4/22(月) 5:49
2024-04-22,07:18,sports,スポーツ,39,ゲキサカ,クラシコ主役はベリンガム!! AT劇的決勝弾で対バルサ2戦3発、R・マドリーが独走Vへ,25,https://news.yahoo.co.jp/articles/87a327c14c45cfcfcb2293003447813c6da7ab80,4/22(月) 6:10
2024-04-22,07:18,sports,スポーツ,40,TBS NEWS DIG Powered by JNN,【阪神】降雨コールドも6連勝 今季初の首位奪取！中日に今季初の同一カード3連勝 佐藤輝が値千金3号3ラン 才木が7回無失点2勝目,25,https://news.yahoo.co.jp/articles/4682bdc0af0657fe6d1e8a43369c5fd366c13d2f,4/21(日) 17:04
