scrp_date,scrp_time,genre_en,genre_jp,rank,media_jp,title,comment,link,date_original
2024-01-23,08:19,life,ライフ,1,まいどなニュース,沖縄出身俳優に「方言禁止記者会見」　TBSのバラエティ番組が物議　「方言札を知らないの？」「今すぐググって！」,56,https://news.yahoo.co.jp/articles/817d4906937b0b70efe671940ddf535aacb33cb6,1/23(火) 5:50
2024-01-23,08:19,life,ライフ,2,産経新聞,受験ＡＢＣ　志願者の６割は「Ｅ判定」　模試結果の見方を知らない人が多すぎる,49,https://news.yahoo.co.jp/articles/2b2b2a9cf2c3f33e1a945f678b631145223b223c,1/22(月) 9:00
2024-01-23,08:19,life,ライフ,3,THE GOLD ONLINE（ゴールドオンライン）,平均月収31万円「老後に希望なし」が6割…将来のために「自助努力さえできない」日本人の悲惨,43,https://news.yahoo.co.jp/articles/1cdf37fff0a3458f6c69344c88131014b65f9f34,1/23(火) 7:02
2024-01-23,08:19,life,ライフ,4,毎日新聞,学校の健康診断、着衣OK　体操服や下着など　文科省が通知,36,https://news.yahoo.co.jp/articles/2836855961dee5819cabb32e96cf4c628684db03,1/22(月) 16:52
2024-01-23,08:19,life,ライフ,5,まいどなニュース,「架空パーティー、特捜に質問された？」文春記者、立件免れた西村前経産相と〝直接対決〟3分間のやり取りに会場ピリつく,33,https://news.yahoo.co.jp/articles/b66c0069937e2ef588bff078151c03f7d48ba91d,1/22(月) 17:40
2024-01-23,08:19,life,ライフ,6,共同通信,ウクライナ出身の椎野さん　ミス日本グランプリ,33,https://news.yahoo.co.jp/articles/0682ae44e36f2bff2ce01177f9884eb91f7312ce,1/22(月) 16:28
2024-01-23,08:19,life,ライフ,7,LIMO,外国人の「品川」の覚え方が話題に　想像の斜め上を行く発想に「これ天才じゃない？」,27,https://news.yahoo.co.jp/articles/1e0c393125433a854d5faefd26f5a673c5cf09de,1/23(火) 5:17
2024-01-23,08:19,life,ライフ,8,ほ・とせなNEWS,「可哀想って言わないで…」子どもにハーネスをつける理由を発信する母親　「もっと認知されてほしい！」その思いに迫る,21,https://news.yahoo.co.jp/articles/8d536e16ecdf0d8131b737e89ce2f09430345e6a,1/22(月) 12:00
2024-01-23,08:19,life,ライフ,9,THE GOLD ONLINE（ゴールドオンライン）,"「ジジイ、はよせえ！」怒声を浴びながら時給1,200円でアルバイト…現役時代は年収1,200万円の67歳元勝ち組が“年金月20万円”で全然足りない、切実な理由【FPの助言】",20,https://news.yahoo.co.jp/articles/63ec216d63a0f22733f80f379bfb6677f73dc698,1/22(月) 11:32
2024-01-23,08:19,life,ライフ,10,よろず～ニュース,「遵守」を「ソンシュ」と読む後輩に間違い指摘したら猛反論！対応のポイントは「適当さ」,20,https://news.yahoo.co.jp/articles/f37c2e10550aa19e207129e6625b8b7c845457c5,1/22(月) 11:00
2024-01-23,08:19,life,ライフ,11,ほ・とせなNEWS,満員電車で…3歳の息子がまったく見えない！　「これ以上押さないで！」近くにいた親子の言動に「とても助かりました」,19,https://news.yahoo.co.jp/articles/e99c648def6b07cd47caa59993157884760ae403,1/22(月) 20:30
2024-01-23,08:19,life,ライフ,12,FORZA STYLE,「女の子にタクシー代を払うのは当たり前だろ…」カッコつけていた50代上司に欠けていたセクハラという視点。おごられた女性部下がXに投稿した「衝撃のひとこと」,16,https://news.yahoo.co.jp/articles/b3fd609a5fed170426cdea474066d3255500ac5c,1/23(火) 7:12
2024-01-23,08:19,life,ライフ,13,Hint-Pot,カレーのルーと粉の違い　栄養バランスが整う具材や付け合わせとは　栄養士に聞いた,12,https://news.yahoo.co.jp/articles/9ccc64df0bc74cea9209cda4fdda3cdc2809a3dc,1/22(月) 8:40
2024-01-23,08:19,life,ライフ,14,HugKum,なぜ、日本ではここまで韓流文化が人気？GDP13位、平均年収では日本を上回る韓国ソフトパワーの背景とは【親子で語る国際問題】,11,https://news.yahoo.co.jp/articles/4a8dca63eb65c0e1650faa545d5df627bac8c5b5,1/22(月) 21:30
2024-01-23,08:19,life,ライフ,15,大手小町（読売新聞）,行けたら行くって、来るの来ないの？行かなかったら「ふざけんな、待ってたのに」と友人にキレられた女性の是非を問う声続出,9,https://news.yahoo.co.jp/articles/e7df915aafaca3cd6431919b372b1e25484c4d42,1/22(月) 12:11
2024-01-23,08:19,life,ライフ,16,まいどなニュース,乗り継ぎ時間に勉強できる！駅のホームに設置された冷暖房、電源完備の自習室が「天才か」と話題　誕生の裏には社長の熱い思いがあった,9,https://news.yahoo.co.jp/articles/6478ae9cc34d5e9a834ca96fadd5c0b16b5c0120,1/22(月) 12:08
2024-01-23,08:19,life,ライフ,17,FORZA STYLE,「デザイン重視」「若いの時のまま、ではダメだった…」ダサいオジさんに共通する「間違ったコート選び」の癖を解説します。,8,https://news.yahoo.co.jp/articles/1657a078f4b973544272ec8e7c53e6b19f8524e8,1/23(火) 7:02
2024-01-23,08:19,life,ライフ,18,産経新聞,佳子さま、聴覚障害児保護者の会にご臨席　能登半島地震の被災者に手話でお見舞いも,8,https://news.yahoo.co.jp/articles/4e079b842d21606548e462088dba176ca478a17c,1/22(月) 21:39
2024-01-23,08:19,life,ライフ,19,現代ビジネス,全国に広がる海抜ゼロメートル地帯…人口が密集している「東京・下町」にあるリスク,8,https://news.yahoo.co.jp/articles/29a2a18333da32d8f243b67e85a9ed12d3d1cf2a,1/23(火) 7:04
2024-01-23,08:19,life,ライフ,20,まいどなニュース,「元日に用意されてたすき焼き」涙が出そうに　半壊した祖母の家で目にした光景…被災者の写真に「時が止まったまま」,7,https://news.yahoo.co.jp/articles/8abea4d1d1347f8d007e4ac100aee94b20f3f99c,1/23(火) 7:20
2024-01-23,08:19,life,ライフ,21,FNNプライムオンライン,マグニチュード9.3と最大26.5メートルの津波想定 北海道で危惧される巨大地震にどう備える?能登半島地震では発災の1分後に津波到達も,7,https://news.yahoo.co.jp/articles/e672b2f8b84a59f1763d72b31218de7075e07a55,1/22(月) 17:02
2024-01-23,08:19,life,ライフ,22,All About,共通テスト離れならぬ「共テスルー」がトレンドに!? 英語の“過去イチ長文化”に無理ゲーと受験生悲鳴,7,https://news.yahoo.co.jp/articles/206c254840504763dc0292c92ab69d0cf9180d49,1/22(月) 21:50
2024-01-23,08:19,life,ライフ,23,kufura,絶品！ペペロンチーノの美味しい作り方。にんにくの量、意外な隠し味…ここで差がつく,7,https://news.yahoo.co.jp/articles/4a2c9f8528cbb6c552c998d93f612a9abdb4eec5,1/22(月) 11:30
2024-01-23,08:19,life,ライフ,24,ハフポスト日本版,子どもの上履きを自動で洗える…業界初「靴洗い機」をハイアールが販売。販売日や予想価格は,6,https://news.yahoo.co.jp/articles/0b357ebb44cd8bcbb68ce8fb1622ff0f618a25db,1/23(火) 6:04
2024-01-23,08:19,life,ライフ,25,ねとらぼ,ジョージア大使「娘が一升瓶を運んでいます」謎の投稿が話題に　「これは力強い」「世界史上初の試み？」,6,https://news.yahoo.co.jp/articles/cfc7b31c718de99751bfcae4f4f60acac8d3b7af,1/22(月) 20:15
2024-01-23,08:19,life,ライフ,26,Hint-Pot,「異世界に来たようだ」　生魚をほぼ食べないフランス人　日本の寿司を初体験した驚きの感想とは,6,https://news.yahoo.co.jp/articles/5af89647f4fa2714ba1a07cf9ac919bdcb392071,1/22(月) 17:07
2024-01-23,08:19,life,ライフ,27,FNNプライムオンライン,「完全に終わった…」創業107年の老舗鮮魚店 老朽化に地震で“廃業”決断…「修復不可能だと…」,5,https://news.yahoo.co.jp/articles/68b8185612546168aa0e5d555cdfaa36b339aa20,1/23(火) 7:02
2024-01-23,08:19,life,ライフ,28,まいどなニュース,住宅ローンを利用予定している人の9割超「支払いに不安がある」…「固定金利」と「変動金利」どちらを選ぶ？,5,https://news.yahoo.co.jp/articles/6eb6be0884cbdb018e896a3cc255e4f4ab35035d,1/23(火) 6:50
2024-01-23,08:19,life,ライフ,29,現代ビジネス,SNSで人気の“イケメン双子”、大変だった中学受験…母が振り返る難関校合格までの道のり,5,https://news.yahoo.co.jp/articles/75c6e690fbc2ae8f7c0655764a30bfb63ac86ade,1/23(火) 7:03
2024-01-23,08:19,life,ライフ,30,ねとらぼ,神社の池に「鯉がバカンス中」の看板→通じる年代が限られる“言葉遊び”に「言われて気付いた…」SNSで反響,5,https://news.yahoo.co.jp/articles/f215839c7d5f3a6ec52a48ab1f1f684ce9dc699e,1/22(月) 20:05
2024-01-23,08:19,life,ライフ,31,ファイナンシャルフィールド,そばを食べるのが趣味です。老後は月2回くらい出掛けたいのですが、これって高望みでしょうか？,5,https://news.yahoo.co.jp/articles/b2473561849c96b1065de7ce71c9ab0a74ae100c,1/22(月) 19:20
2024-01-23,08:19,life,ライフ,32,AUTO BILD JAPAN Web,【クラッシュ、痛い！】絶句・・・新車のフェラーリ488が納車後たった3㎞でクラッシュ！痛すぎる・・・＠イギリス,5,https://news.yahoo.co.jp/articles/35b0ef6c17c265dc471fd58b1384ccbd9998d371,1/22(月) 9:20
2024-01-23,08:19,life,ライフ,33,ファイナンシャルフィールド,社会人になったら財布に1万円札を入れていないと恥ずかしいですか？ どのくらい入れていたらいいでしょうか？,5,https://news.yahoo.co.jp/articles/64739209c55913a1eb38fcea4e3262f3377d6471,1/22(月) 11:32
2024-01-23,08:19,life,ライフ,34,LIMO,息子の水筒が破損…　母親が用意した驚きの「代用品」に思わず笑ってしまう,5,https://news.yahoo.co.jp/articles/1dbc1babe5e65bf140d48c70bfbfdb05d8af979f,1/22(月) 17:22
2024-01-23,08:19,life,ライフ,35,サンキュ！,他のスーパーではもう買えない!?食費3万円台の主婦が「業務スーパーでしか買わない冷凍食材」3選,5,https://news.yahoo.co.jp/articles/ecd18898dc4fe15879e0c4932fbea9e604b66796,1/22(月) 21:32
2024-01-23,08:19,life,ライフ,36,FORZA STYLE,【女性管理職の悩み】ワキガとタバコのダブルコンボで臭すぎる部下。気がついていない本人にどう伝えるべきでしょうか？,5,https://news.yahoo.co.jp/articles/4846a621a0568b72a9d2660474d753f90a38f5f2,1/22(月) 20:02
2024-01-23,08:19,life,ライフ,37,ねとらぼ,初来日のコロンビア人父、新幹線を見て「衝撃だ」と感涙し……　少年のような反応に「こちらまで嬉しい」「日本に来てくれてありがとう」,5,https://news.yahoo.co.jp/articles/edc6d34a259db620f3503bb1d7d8fc8a687144b2,1/22(月) 22:00
2024-01-23,08:19,life,ライフ,38,ENGINE WEB,価格を超えた価値あるクルマは、こいつにトドメをさす！　清水草一が選んだのはフェラーリ458イタリア　これしかないでしょう！【『エンジン』アーカイブ蔵出しシリーズ　フェラーリ篇】,4,https://news.yahoo.co.jp/articles/4ca80021fd45a72b0a5c402cbffa03f6831c4933,1/23(火) 7:10
2024-01-23,08:19,life,ライフ,39,magacol,ショーツMサイズはNG！？【オバさん尻】まっしぐらを防ぐ、下着選びのポイント｜美ST,4,https://news.yahoo.co.jp/articles/0714abf2b4156f9468c45288b9c94d1b951a0306,1/23(火) 7:20
2024-01-23,08:19,life,ライフ,40,OTONA SALONE,ホノルルマラソンに挑戦して完走した梅宮アンナさん。涙があふれて…「私の人生で初めて、自分に惚れた瞬間でした」【私の30代、40代そして更年期の過ごし方】,4,https://news.yahoo.co.jp/articles/a6b4ccb7104de1e5504a9ca32eca144395ca69b9,1/23(火) 7:00
