scrp_date,scrp_time,genre_en,genre_jp,rank,media_jp,title,comment,link,date_original
2024-01-23,10:24,local,地域,1,RKB毎日放送,子宮頸がんワクチンめぐる一斉提訴から8年目にして健康被害を訴える女性たちを法廷で“尋問”「血を吐くような思いを10年」「科学的な裏付けは存在しない」対立する主張,130,https://news.yahoo.co.jp/articles/2e302a08f56f4a0547db46ff9bfc16e79829bf11,1/22(月) 13:38
2024-01-23,10:24,local,地域,2,KTNテレビ長崎,「全部オレが悪いんだ」真相は沈黙…”頭悪いね”発言の谷川弥一衆院議員が会見…今後は”政治家は引退も政治活動はやる”　自民党派閥の政治資金パーティー裏金事件受け議員辞職願を提出,38,https://news.yahoo.co.jp/articles/250bb486a153d7716ee059dbbd429c80c90ffddc,1/23(火) 7:02
2024-01-23,10:24,local,地域,3,MBSニュース,特殊詐欺グループの“指示役”六代目山口組「秋良連合会」傘下組員を逮捕…被害額5億円以上か…高齢者に息子装い現金詐取疑い,32,https://news.yahoo.co.jp/articles/c1e00ed204e05df132226d347141a16c95e7f4c8,1/23(火) 8:51
2024-01-23,10:24,local,地域,4,HTB北海道ニュース,コンビニで従業員の女性にカッターナイフ様のもの突きつけ現金奪う　男は逃走中,26,https://news.yahoo.co.jp/articles/3d6886155156e89b6ef8610009f509b429aefde8,1/23(火) 8:14
2024-01-23,10:24,local,地域,5,カナロコ by 神奈川新聞,業務用パソコンでソリティアなど６４時間、横浜市職員を停職２カ月　「ゲームやらないために階段昇降していた」,18,https://news.yahoo.co.jp/articles/e46b656cf804488ed3cece0ecd358e2e5376d74d,1/22(月) 13:51
2024-01-23,10:24,local,地域,6,京都新聞,京都で最大震度2の地震　震源は奈良県,17,https://news.yahoo.co.jp/articles/3ae19cef9abe3e7024acb87fc21dd62cdf50d7cd,1/23(火) 9:16
2024-01-23,10:24,local,地域,7,MBSニュース,運転手の勤務先を家宅捜索　高速道路で大型トラック突っ込み軽乗用車の夫婦死亡　運転手を釈放し任意での捜査継続　運転手「車内の荷物落ちてよそ見していた」,17,https://news.yahoo.co.jp/articles/2a85bcc30147768808e73c7809e5e06b0f18b5f5,1/22(月) 14:29
2024-01-23,10:24,local,地域,8,HOME広島ホームテレビ,初出勤で19時間遅刻　海上自衛隊員を懲戒処分　広島,15,https://news.yahoo.co.jp/articles/4f8a0931bea94a3e1373b4f2f73608c408783a03,1/22(月) 21:31
2024-01-23,10:24,local,地域,9,ＮＳＴ新潟総合テレビ,「早く開錠を！」 津波警報出ているのに…鍵を開けない・扉や窓破損も… “避難所運営”に混乱 行動見直しへ【新潟発】,14,https://news.yahoo.co.jp/articles/9e5408b87da616ce2fbd544ebc8e497a276a6f0d,1/22(月) 21:01
2024-01-23,10:24,local,地域,10,中国新聞デジタル,「ポスト岸田」林芳正官房長官、地元山口3区に「内憂」あり　長門市長選では支持候補敗北、3カ月後には美祢市長選,14,https://news.yahoo.co.jp/articles/bc6ff81e33c4788301f5be5d562d5b75be70bb18,1/23(火) 7:45
2024-01-23,10:24,local,地域,11,HBCニュース北海道,ガラス張りのエントランスに突っ込み、４人けがで搬送事故…逮捕⇒在宅捜査の70歳の女、ギアをパーキングに入れずに降車、ブレーキとアクセル踏み間違えて暴走か,14,https://news.yahoo.co.jp/articles/48b4b22f8efb5197e93c9851227c9d9bc770fdbf,1/23(火) 8:48
2024-01-23,10:24,local,地域,12,神戸新聞NEXT,橋の上でしゃがみすすり泣き、手元にはロープ…「自殺だ」　母の介護に悩む40代女性、尼崎の夫婦が救う,12,https://news.yahoo.co.jp/articles/e6c18f3a18a7e911f37424a67d4dfb78460d2d0e,1/22(月) 10:30
2024-01-23,10:24,local,地域,13,tbc東北放送,後ろから近づき81歳女性の手提げバッグなどを奪う　会社員の30歳の男逮捕「お金が無くなったから」　宮城・名取市,11,https://news.yahoo.co.jp/articles/f11a3aa5edc26c322463fe516ede7122c334951d,1/23(火) 8:28
2024-01-23,10:24,local,地域,14,ＫＹＴ鹿児島読売テレビ,いったい何が？バスの電光掲示板に「緊急事態発生！警察へ通報して下さい」,11,https://news.yahoo.co.jp/articles/5b37c0a56e415bafc4fe0f10ebab469a477408c2,1/22(月) 18:49
2024-01-23,10:24,local,地域,15,HBCニュース北海道,10歳未満の男児の体を、自宅で無理やり…児童相談所が通報、半年余りで逮捕の27歳の男「自分の欲を抑えられませんでした」 札幌市清田区,11,https://news.yahoo.co.jp/articles/db663dd44731b35071452ef27ab6aa6da8c929b8,1/23(火) 7:45
2024-01-23,10:24,local,地域,16,TUFテレビユー福島,青信号で横断歩道渡っていた富岡町職員の女性はねられ重傷　富岡町職員の41歳女を現行犯逮捕　過失運転傷害の疑い　福島,10,https://news.yahoo.co.jp/articles/a672448e9259e508a87b7296a896410c65394923,1/23(火) 9:48
2024-01-23,10:24,local,地域,17,読売テレビ,被害総額５億円超え「オレオレ詐欺グループ」20人以上取りまとめの受け子トップか　組員2人逮捕,10,https://news.yahoo.co.jp/articles/ade26232742d94e47e48e5fa7fdf7dbc52284a1b,1/23(火) 8:38
2024-01-23,10:24,local,地域,18,NBS長野放送,深刻な運転手不足で…路線バスが完全「日曜運休」11路線182本　利用者「免許返納したのできつい」「普段も1時間1本なのに」　必要な運転手99人に対し現状74人,10,https://news.yahoo.co.jp/articles/b6202afee29ac6b5e631d6d3bdf958f7e3fab30f,1/22(月) 22:17
2024-01-23,10:24,local,地域,19,あなたの静岡新聞,トラック側面の扉空いたまま走行？　死亡男性に衝突か　沼津の親子ひき逃げ事件,10,https://news.yahoo.co.jp/articles/f9ded864e06d28bf67ff63df01c17490e5a33379,1/23(火) 9:04
2024-01-23,10:24,local,地域,20,カナロコ by 神奈川新聞,ホテルで中３女子にわいせつ行為　三崎署、容疑で７５歳会社役員を逮捕,10,https://news.yahoo.co.jp/articles/b3b2a7efb4414c89a5cd9df4ff5c91de99604a99,1/22(月) 21:01
2024-01-23,10:24,local,地域,21,HBCニュース北海道,新千歳空港の旅客機接触事故　原因はスリップではなく、機体を押すトーイングカーがハンドルを切るのが早かった可能性高いことが判明,10,https://news.yahoo.co.jp/articles/e61395c45ec85cf9297c97976d6c01d360f7ae04,1/22(月) 19:31
2024-01-23,10:24,local,地域,22,関西テレビ,珠洲市内すべての小中学校『再開』　京都に避難の80代夫婦「1年間は辛抱しないと…」【能登半島地震】,9,https://news.yahoo.co.jp/articles/64e3b591a0d54e47f4da4cc778e72e945c5ede90,1/22(月) 17:20
2024-01-23,10:24,local,地域,23,関西テレビ,グループによる被害は5億円超か　「受け子」管理の暴力団組員ら逮捕,9,https://news.yahoo.co.jp/articles/91e7d7f37405551ec0ff0109b546f68dde2a652f,1/23(火) 0:53
2024-01-23,10:24,local,地域,24,沖縄タイムス,勤務中に郵便物の中身を盗んだ疑い　元郵便局員を逮捕　「今回が初めて」と容疑を認める　沖縄,8,https://news.yahoo.co.jp/articles/45cea28bb5d7081403b92c5b68ede708a2fd45d2,1/23(火) 7:47
2024-01-23,10:24,local,地域,25,HBCニュース北海道,新幹線の函館駅乗り入れ構想で中間報告　鉄道解説系ユーチューバー鐵坊主氏は「実現可能性は20～30％」 ３月に最終報告,8,https://news.yahoo.co.jp/articles/7d8a02c62f377c5f0e68d7220b3dcc663b0ab3e3,1/22(月) 19:31
2024-01-23,10:24,local,地域,26,神戸新聞NEXT,洗濯乾燥機搭載の移動式ランドリー車、被災者支援で珠洲市へ　兵庫・養父の運送会社が派遣、当面は無料開放,7,https://news.yahoo.co.jp/articles/7eccee6b32ba47cb5b34a1b592cd64b0861c5f32,1/23(火) 9:30
2024-01-23,10:24,local,地域,27,岐阜新聞Ｗｅｂ,イチゴ１粒１０万円超「大きくも味細やか」１６５グラムで最高クラス　岐阜・羽島市の観光農園,7,https://news.yahoo.co.jp/articles/02a78078895776fcc90860be3bff485e4876bef1,1/23(火) 9:16
2024-01-23,10:24,local,地域,28,テレビ新広島,石丸市長「どう喝」裁判　「一審判決は恣意的にどう喝発言の存在を認めず」控訴理由を明らかに　安芸高田市,7,https://news.yahoo.co.jp/articles/60586cfe8dc57050a41dd2101804575d23401e47,1/22(月) 17:27
2024-01-23,10:24,local,地域,29,テレビユー山形,法定最高速度60キロの国道を100キロ以上で走行 無職の男（54） 警察の再三の出頭要請応じず自宅にいたところを逮捕,7,https://news.yahoo.co.jp/articles/f3cefdb65d43bbc02a21596c6dc324ceb2cd4dcf,1/22(月) 13:32
2024-01-23,10:24,local,地域,30,HBCニュース北海道,シャッター開けた隙に押し入り、刃物で脅して現金約７万円奪う…30代、160～170センチ、上下黒の服装の男、逃走中　北海道旭川市永山のコンビニ,6,https://news.yahoo.co.jp/articles/43e12a0e45d7d170f2fb4ad4bb488431bacacd0b,1/23(火) 8:05
2024-01-23,10:24,local,地域,31,HBCニュース北海道,大型トラックの左後輪“ダブルタイヤ”２本とも脱落「ドンという音がして確認したら、外れていた」巻き込まれた人や車なし　北海道旭川市,6,https://news.yahoo.co.jp/articles/0475dbb906b9adaf25af62257a30601f31f45115,1/22(月) 20:57
2024-01-23,10:24,local,地域,32,京都新聞,京都府、24日未明から25日にかけ積雪や路面凍結など交通障害に注意呼びかけ,6,https://news.yahoo.co.jp/articles/6c77cff20bdf54e29858aedc3d0bbfe533d7211c,1/23(火) 8:51
2024-01-23,10:24,local,地域,33,FBS福岡放送,ビッグモーター小倉西港店の前に植樹　ツツジの苗木172本　4月までに小倉南店でも　北九州市,6,https://news.yahoo.co.jp/articles/c12cbe5344ef4f65c497340db95a44b9d53b6b3d,1/22(月) 16:15
2024-01-23,10:24,local,地域,34,ABCニュース,スタジオで靴下に包んだ小型カメラを使い着替え姿を盗撮か　元写真館経営者の４１歳男を逮捕　行事撮影で学校でもスカート内撮影　捜索時に２５００件以上の動画見つかる　京都,6,https://news.yahoo.co.jp/articles/cff09fffd041250303c604e5bca7c64e4a6953d1,1/22(月) 17:32
2024-01-23,10:24,local,地域,35,KSB瀬戸内海放送,中学校で弾道ミサイルを想定した訓練　 「戦争に向けた準備」として教員らによる抗議活動も　高松市,6,https://news.yahoo.co.jp/articles/bb5116a72247e1555e44b5957b45c49c8be59964,1/22(月) 18:13
2024-01-23,10:24,local,地域,36,埼玉新聞,男性遺体、公園の茂みに…近くに駐車場　剪定作業していた人が発見、「倒れている」と110番　あおむけの状態、身長180センチでリュックサック,6,https://news.yahoo.co.jp/articles/d3b675927e3f469d34ee05e3584b790446811619,1/23(火) 7:50
2024-01-23,10:24,local,地域,37,北海道ニュースUHB,タイヤ交換後“増し締め”もしたのに…「いきなり外れた」走行中のワゴン車から左前の1本脱落 北海道名寄市,6,https://news.yahoo.co.jp/articles/17969c2773f1f907d6291a1a734cb6aa606bc005,1/22(月) 11:42
2024-01-23,10:24,local,地域,38,MBSニュース,【速報】安倍元総理銃撃事件　山上徹也被告が公判前整理手続きに「出席」第二回の協議始まる　第一回の手続きは欠席,5,https://news.yahoo.co.jp/articles/3960c4e78470e4ac4d2617eeee36e21cc6df3f1f,1/23(火) 9:26
2024-01-23,10:24,local,地域,39,九州朝日放送,電話で暗証番号聞き出し　詐欺被害相次ぐ,5,https://news.yahoo.co.jp/articles/f45317da837989df685790c830f475961cb7d6f7,1/23(火) 9:15
2024-01-23,10:24,local,地域,40,伊勢新聞,コンビニで「金を出せ」　女、何も取らず逃走　四日市・三重,5,https://news.yahoo.co.jp/articles/397dd5aea0d20760a5ad7023893b1460573ca74f,1/23(火) 8:00
