scrp_date,scrp_time,genre_en,genre_jp,rank,media_jp,title,comment,link,date_original
2024-01-23,10:24,life,ライフ,1,まいどなニュース,TBS「歴史的背景の十分な検討ができておりませんでした」　沖縄出身俳優に「方言禁止」企画　バラエティ番組が「差別的」と物議,54,https://news.yahoo.co.jp/articles/817d4906937b0b70efe671940ddf535aacb33cb6,1/23(火) 5:50
2024-01-23,10:24,life,ライフ,2,日刊ゲンダイDIGITAL,3B、3Cと付き合ってはいけない…「カレーをスパイスから作る男」は嫌がられる理由,42,https://news.yahoo.co.jp/articles/8ced8d9592c1c90aab847ce4376b44c9b2b84a93,1/23(火) 9:06
2024-01-23,10:24,life,ライフ,3,産経新聞,受験ＡＢＣ　旧帝大なのに倍率１．０倍　全員合格の衝撃、隔年現象で反動も,39,https://news.yahoo.co.jp/articles/db9325a89fff9769b72e9b61dd5fea84263dba38,1/23(火) 8:45
2024-01-23,10:24,life,ライフ,4,毎日新聞,学校の健康診断、着衣OK　体操服や下着など　文科省が通知,34,https://news.yahoo.co.jp/articles/2836855961dee5819cabb32e96cf4c628684db03,1/22(月) 16:52
2024-01-23,10:24,life,ライフ,5,共同通信,ウクライナ出身の椎野さん　ミス日本グランプリ,33,https://news.yahoo.co.jp/articles/0682ae44e36f2bff2ce01177f9884eb91f7312ce,1/22(月) 16:28
2024-01-23,10:24,life,ライフ,6,THE GOLD ONLINE（ゴールドオンライン）,平均月収31万円「老後に希望なし」が6割…将来のために「自助努力さえできない」日本人の悲惨,32,https://news.yahoo.co.jp/articles/1cdf37fff0a3458f6c69344c88131014b65f9f34,1/23(火) 7:02
2024-01-23,10:24,life,ライフ,7,まいどなニュース,「架空パーティー、特捜に質問された？」文春記者、立件免れた西村前経産相と〝直接対決〟3分間のやり取りに会場ピリつく,29,https://news.yahoo.co.jp/articles/b66c0069937e2ef588bff078151c03f7d48ba91d,1/22(月) 17:40
2024-01-23,10:24,life,ライフ,8,まいどなニュース,「元日に用意されてたすき焼き」涙が出そうに　半壊した祖母の家で目にした光景…被災者の写真に「時が止まったまま」,29,https://news.yahoo.co.jp/articles/8abea4d1d1347f8d007e4ac100aee94b20f3f99c,1/23(火) 7:20
2024-01-23,10:24,life,ライフ,9,LIMO,外国人の「品川」の覚え方が話題に　想像の斜め上を行く発想に「これ天才じゃない？」,29,https://news.yahoo.co.jp/articles/1e0c393125433a854d5faefd26f5a673c5cf09de,1/23(火) 5:17
2024-01-23,10:24,life,ライフ,10,FORZA STYLE,「親の年金で暮らすモンスター化した兄が怖い…」今年のお正月も帰省できなかった40歳女性が、10年実家に帰っていない「誰にも言えない理由」,28,https://news.yahoo.co.jp/articles/8526f6cbe35d804cd2c4700d5be43f41ffc918b4,1/23(火) 8:02
2024-01-23,10:24,life,ライフ,11,ほ・とせなNEWS,満員電車で…3歳の息子がまったく見えない！　「これ以上押さないで！」近くにいた親子の言動に「とても助かりました」,27,https://news.yahoo.co.jp/articles/e99c648def6b07cd47caa59993157884760ae403,1/22(月) 20:30
2024-01-23,10:24,life,ライフ,12,ほ・とせなNEWS,「可哀想って言わないで…」子どもにハーネスをつける理由を発信する母親　「もっと認知されてほしい！」その思いに迫る,20,https://news.yahoo.co.jp/articles/8d536e16ecdf0d8131b737e89ce2f09430345e6a,1/22(月) 12:00
2024-01-23,10:24,life,ライフ,13,THE GOLD ONLINE（ゴールドオンライン）,"「ジジイ、はよせえ！」怒声を浴びながら時給1,200円でアルバイト…現役時代は年収1,200万円の67歳元勝ち組が“年金月20万円”で全然足りない、切実な理由【FPの助言】",19,https://news.yahoo.co.jp/articles/63ec216d63a0f22733f80f379bfb6677f73dc698,1/22(月) 11:32
2024-01-23,10:24,life,ライフ,14,女子SPA！,子ども2人を東大に合格させた母が「絶対に食卓に出さなかったメニュー」,16,https://news.yahoo.co.jp/articles/8cc3cab90c4efef0167b377aff79de786c44c82e,1/23(火) 8:47
2024-01-23,10:24,life,ライフ,15,よろず～ニュース,「遵守」を「ソンシュ」と読む後輩に間違い指摘したら猛反論！対応のポイントは「適当さ」,16,https://news.yahoo.co.jp/articles/f37c2e10550aa19e207129e6625b8b7c845457c5,1/22(月) 11:00
2024-01-23,10:24,life,ライフ,16,FORZA STYLE,「女の子にタクシー代を払うのは当たり前だろ…」カッコつけていた50代上司に欠けていたセクハラという視点。おごられた女性部下がXに投稿した「衝撃のひとこと」,13,https://news.yahoo.co.jp/articles/b3fd609a5fed170426cdea474066d3255500ac5c,1/23(火) 7:12
2024-01-23,10:24,life,ライフ,17,日刊ゲンダイDIGITAL,室内清掃作業は“下働き”そのもの…「あなたが4カ月ぶりの応募者です」だって【65歳アルバイトの現実 ラブホ清掃編】,12,https://news.yahoo.co.jp/articles/64ba4ee040391a6a96aa1f018201e2ead7d9e12b,1/23(火) 9:06
2024-01-23,10:24,life,ライフ,18,まいどなニュース,「放置子」はかわいそう？→「罪悪感を持つな、逃げろ」　元放置子の助言が衝撃！どうしたらいい？対応に困惑する親たちへ,12,https://news.yahoo.co.jp/articles/676fdaaa826f11633e4ce0e08a913707eecc6234,1/23(火) 7:50
2024-01-23,10:24,life,ライフ,19,ESSE-online,アメリカと日本でこんなに違う「休み方」。祝日は少なくても心と体を休める方法,10,https://news.yahoo.co.jp/articles/e0f59c4a67876b58bbd524e9888e804dee302eb3,1/22(月) 20:02
2024-01-23,10:24,life,ライフ,20,HugKum,なぜ、日本ではここまで韓流文化が人気？GDP13位、平均年収では日本を上回る韓国ソフトパワーの背景とは【親子で語る国際問題】,10,https://news.yahoo.co.jp/articles/4a8dca63eb65c0e1650faa545d5df627bac8c5b5,1/22(月) 21:30
2024-01-23,10:24,life,ライフ,21,AUTO BILD JAPAN Web,【放置プレー】17年間置き去りにされた「フェラーリ テスタロッサ」その無残な姿に涙涙　マラネロのスーパーカーは蘇るのか？,10,https://news.yahoo.co.jp/articles/2d4330f4f38740fc80b4b210a075fdfd75566422,1/23(火) 8:31
2024-01-23,10:24,life,ライフ,22,オリコン,『ダブルソフト』発売35周年で初のリニューアル、“食パン購買層の高齢化”に挑む国内最大手メーカーの矜持,9,https://news.yahoo.co.jp/articles/9f8e6287615448cb187dc9ee02a28711a19a936c,1/23(火) 9:10
2024-01-23,10:24,life,ライフ,23,現代ビジネス,全国に広がる海抜ゼロメートル地帯…人口が密集している「東京・下町」にあるリスク,9,https://news.yahoo.co.jp/articles/29a2a18333da32d8f243b67e85a9ed12d3d1cf2a,1/23(火) 7:04
2024-01-23,10:24,life,ライフ,24,まいどなニュース,3歳娘ママが夫にお願いした誕生日「町中華とシャトレーゼ」…その真意は？　「サイコーです」「確実に満足」,9,https://news.yahoo.co.jp/articles/40be891776a3a62add4e2353b2da984d12ea88e9,1/23(火) 7:40
2024-01-23,10:24,life,ライフ,25,ねとらぼ,外出中ママ、在宅パパからもらった報告LINEに「何を洗ったんやｗ」とツッコミの嵐　爆笑を呼んだ誤字が230万表示,9,https://news.yahoo.co.jp/articles/c85e12c5d8076ccd3eeef7ac584f5c5be73d127e,1/23(火) 7:30
2024-01-23,10:24,life,ライフ,26,大手小町（読売新聞）,行けたら行くって、来るの来ないの？行かなかったら「ふざけんな、待ってたのに」と友人にキレられた女性の是非を問う声続出,9,https://news.yahoo.co.jp/articles/e7df915aafaca3cd6431919b372b1e25484c4d42,1/22(月) 12:11
2024-01-23,10:24,life,ライフ,27,ねとらぼ,着物×フード付きワンピの令和コーデに「年配者には考えられない」「目から鱗」　290万再生の斬新な発想に各世代から反響,8,https://news.yahoo.co.jp/articles/bab06ed5976c07749dc18a6a8831083076e63391,1/23(火) 9:00
2024-01-23,10:24,life,ライフ,28,FORZA STYLE,「デザイン重視」「若い時のまま、ではダメだった…」ダサオジに共通する「間違ったアウター選び」の癖を解説します。,8,https://news.yahoo.co.jp/articles/1657a078f4b973544272ec8e7c53e6b19f8524e8,1/23(火) 7:02
2024-01-23,10:24,life,ライフ,29,まいどなニュース,乗り継ぎ時間に勉強できる！駅のホームに設置された冷暖房、電源完備の自習室が「天才か」と話題　誕生の裏には社長の熱い思いがあった,8,https://news.yahoo.co.jp/articles/6478ae9cc34d5e9a834ca96fadd5c0b16b5c0120,1/22(月) 12:08
2024-01-23,10:24,life,ライフ,30,ねとらぼ,【女性が選んだ】GMARCHと日東駒専の中で子どもを進学させたいと思う大学ランキング！　第2位は「明治大学」、1位は？,7,https://news.yahoo.co.jp/articles/f0e8e6fafc407ca7d9e0bfbcde2ecb63be1d2748,1/23(火) 9:35
2024-01-23,10:24,life,ライフ,31,まいどなニュース,よく使う冷凍野菜ランキング…3位「野菜ミックス」、2位「ほうれん草」、1位は洗うのが面倒くさい「あの野菜」,7,https://news.yahoo.co.jp/articles/7524a0949f4a0df6f1a623ae313919bb4e7ef96a,1/23(火) 8:05
2024-01-23,10:24,life,ライフ,32,産経新聞,佳子さま、聴覚障害児保護者の会にご臨席　能登半島地震の被災者に手話でお見舞いも,7,https://news.yahoo.co.jp/articles/4e079b842d21606548e462088dba176ca478a17c,1/22(月) 21:39
2024-01-23,10:24,life,ライフ,33,ENGINE WEB,価格を超えた価値あるクルマは、こいつにトドメをさす！　清水草一が選んだのはフェラーリ458イタリア　これしかないでしょう！【『エンジン』アーカイブ蔵出しシリーズ　フェラーリ篇】,7,https://news.yahoo.co.jp/articles/4ca80021fd45a72b0a5c402cbffa03f6831c4933,1/23(火) 7:10
2024-01-23,10:24,life,ライフ,34,現代ビジネス,SNSで人気の“イケメン双子”、大変だった中学受験…母が振り返る難関校合格までの道のり,7,https://news.yahoo.co.jp/articles/75c6e690fbc2ae8f7c0655764a30bfb63ac86ade,1/23(火) 7:03
2024-01-23,10:24,life,ライフ,35,Hint-Pot,新婚旅行の目的地は日本　ドイツ人夫婦が気に入ったラーメンの味「ポピュラーではないけど…」,7,https://news.yahoo.co.jp/articles/fe486754b89c2423b0001e0f935c0f9c8d406646,1/23(火) 8:10
2024-01-23,10:24,life,ライフ,36,FNNプライムオンライン,マグニチュード9.3と最大26.5メートルの津波想定 北海道で危惧される巨大地震にどう備える?能登半島地震では発災の1分後に津波到達も,7,https://news.yahoo.co.jp/articles/e672b2f8b84a59f1763d72b31218de7075e07a55,1/22(月) 17:02
2024-01-23,10:24,life,ライフ,37,プレジデントオンライン,"「幸福度の50%は遺伝、10%は環境で決まる」では残り40%は…心理学の研究が明かす驚きの""幸福度の円グラフ""",6,https://news.yahoo.co.jp/articles/1fabfb4a1ccafbda99f161a32bccad49b47d5922,1/23(火) 8:17
2024-01-23,10:24,life,ライフ,38,kufura,絶品！ペペロンチーノの美味しい作り方。にんにくの量、意外な隠し味…ここで差がつく,6,https://news.yahoo.co.jp/articles/4a2c9f8528cbb6c552c998d93f612a9abdb4eec5,1/22(月) 11:30
2024-01-23,10:24,life,ライフ,39,All About,共通テスト離れならぬ「共テスルー」がトレンドに!? 英語の“過去イチ長文化”に無理ゲーと受験生悲鳴,6,https://news.yahoo.co.jp/articles/206c254840504763dc0292c92ab69d0cf9180d49,1/22(月) 21:50
2024-01-23,10:24,life,ライフ,40,ねとらぼ,ジョージア大使「娘が一升瓶を運んでいます」謎の投稿が話題に　「これは力強い」「世界史上初の試み？」,6,https://news.yahoo.co.jp/articles/cfc7b31c718de99751bfcae4f4f60acac8d3b7af,1/22(月) 20:15
