scrp_date,scrp_time,genre_en,genre_jp,rank,media_jp,title,comment,link,date_original
2024-07-02,15:09,domestic,国内,1,みんかぶマガジン,無党派層で「石丸が蓮舫上回る」…一体何のバグ？ 全国紙記者困惑「一部の社で特定の候補者に投票したとする数字が高く現われた」,319,https://news.yahoo.co.jp/articles/2543a64be27c5cbbb1e4b7d9d5c1bbc372a7bfca,7/2(火) 9:10
2024-07-02,15:09,domestic,国内,2,共同通信,電動ボード摘発、2万件超　事故190件、死者なし,282,https://news.yahoo.co.jp/articles/60d558511188ea70756cd0b90273a45bee562b07,7/2(火) 12:11
2024-07-02,15:09,domestic,国内,3,SmartFLASH,「自民は負ける」小泉進次郎氏“危機感MAX”も党の支持率はやや回復...“ポスト岸田報道”にほくそ笑む党関係者の本音,210,https://news.yahoo.co.jp/articles/ea985dc0d87ace1304390308b68416a2f8abdc4f,7/2(火) 13:22
2024-07-02,15:09,domestic,国内,4,共同通信,スノーピークが6億円申告漏れ　韓国子会社に所得移転、国税指摘,180,https://news.yahoo.co.jp/articles/24a081f9613892087f74d64e510c6520463a9d4a,7/2(火) 12:44
2024-07-02,15:09,domestic,国内,5,みんかぶマガジン,「これは人種差別だ！」記者会見突入の元カイロ大副学部長…「小池さんのアラビア語の評価は」”発展途上国だから”、”独裁だから”、と勝手なことばかりいう日本人,176,https://news.yahoo.co.jp/articles/8d4ae9b2f149c06c2e5fa9caeacfe44b8a4a27b2,7/2(火) 12:10
2024-07-02,15:09,domestic,国内,6,デイリー新潮,「トンボ1本」が現実味　悠仁さまの国際会議デビュー報道で宮内庁の悩み,151,https://news.yahoo.co.jp/articles/4db18b3875df4bed1e230c06d7994a35f0814100,7/2(火) 6:02
2024-07-02,15:09,domestic,国内,7,時事通信,「就活に親が参戦」は当たり前？◆広がるオヤカク、正しい距離感とは【時事ドットコム取材班】＃令和の親＃令和の子,131,https://news.yahoo.co.jp/articles/f698a0f78ed9b67ccf5934fabfe1b210b2925972,7/2(火) 10:00
2024-07-02,15:09,domestic,国内,8,SmartFLASH,「死ぬまで働けと」自民・茂木幹事長「総理としてやりたい仕事ある」であげた「まさかの政策」にSNS総ズッコケ,130,https://news.yahoo.co.jp/articles/15350d362771c855b6265786533bf13406fa0586,7/1(月) 15:30
2024-07-02,15:09,domestic,国内,9,時事通信,サッカー伊東選手を書類送検　不起訴の公算　大阪府警,127,https://news.yahoo.co.jp/articles/e2e55faea10eb1d908959808bff4772366d627aa,7/2(火) 12:29
2024-07-02,15:09,domestic,国内,10,読売新聞オンライン,店を閉め「珠洲には仕事ない」と市外へ…被災後、奥能登の地域経済が弱体化,114,https://news.yahoo.co.jp/articles/0ad034e8add3df707ece75b57202b9a22334933d,7/2(火) 5:01
2024-07-02,15:09,domestic,国内,11,FNNプライムオンライン（フジテレビ系）,個人情報など大量公開か?サイバー攻撃受けたKADOKAWAがダウンロード控えるよう声明…SNSでは「ニコニコ超開示」など“やゆ”も,109,https://news.yahoo.co.jp/articles/ab6f5f20a6a1a1ebb699cb59aec87b9d00c695d0,7/2(火) 9:32
2024-07-02,15:09,domestic,国内,12,ハフポスト日本版,永住許可取り消し制度、国連の委員会が緊急の書簡「不均衡な影響を懸念」。日本政府に見直しや廃止措置への回答求める,97,https://news.yahoo.co.jp/articles/f0e200645280311121c5b6470202d0c23af69a7f,7/2(火) 12:02
2024-07-02,15:09,domestic,国内,13,AERA dot.,吉村知事につくか、馬場代表か　維新の顔2人に亀裂　「3度目の都構想より3度目の分裂の方が早そう」,88,https://news.yahoo.co.jp/articles/cf1c53365ef582f39506f159f89c00eaebd46828,7/2(火) 7:31
2024-07-02,15:09,domestic,国内,14,デイリー新潮,都知事選「暇空茜支持」表明で始まった不買運動を「怒涛のレスバ」で蹴散らした岩下の新生姜社長が激白「受注は倍増しましたが、体重が4キロ減りました」,86,https://news.yahoo.co.jp/articles/ff96a6b56f786d9c9dc91f4144d574e6cfbe35ed,7/2(火) 12:36
2024-07-02,15:09,domestic,国内,15,FNNプライムオンライン,小池氏は船と電車で“選挙戦”　蓮舫氏はイメチェン?犬と2ショットも　都知事選後半戦…注目候補の“戦略”に変化,84,https://news.yahoo.co.jp/articles/98843499f6c1dfbf8972cc544ed7228a725e1f10,7/2(火) 12:13
2024-07-02,15:09,domestic,国内,16,時事通信,小池氏を蓮舫、石丸両氏が追う　都知事選、終盤情勢,84,https://news.yahoo.co.jp/articles/fe8668ff5e8a5c6969de11491ce54c494f8eb62b,7/2(火) 7:05
2024-07-02,15:09,domestic,国内,17,集英社オンライン,〈警察官の胸をハサミで何度も…〉「ふざけんじゃねえよ」殺人未遂で逮捕された路上生活の女は公園からあぶれたトラブルメーカー。背景に再開発で苦境に立たされる「新宿の路上生活者事情」,80,https://news.yahoo.co.jp/articles/c60d25c2d26d5c58b96c63a6af45ca68dbcd9f6f,7/2(火) 11:01
2024-07-02,15:09,domestic,国内,18,テレビ朝日系（ANN）,“400万円”ピンクのベンチは高すぎる？　渋谷「都会のオアシス」再整備計画で物議,78,https://news.yahoo.co.jp/articles/d84f18cb3d4ceb4701c5309feda56accfa837f4b,7/2(火) 13:42
2024-07-02,15:09,domestic,国内,19,毎日新聞,「これ以上、心壊れぬように」札幌ホテル殺人、父が語った娘との生活,74,https://news.yahoo.co.jp/articles/2117e30aa470f9389322862de8a46a426ea24a43,7/1(月) 21:32
2024-07-02,15:09,domestic,国内,20,MRO北陸放送,「復興は失敗した」…住民が集団避難した集落で孤軍奮闘、起業家男性が目指す“元気な奥能登”,63,https://news.yahoo.co.jp/articles/21b57a4ecccf05678f2b87d88d6eca94acb140e0,7/1(月) 17:00
2024-07-02,15:09,domestic,国内,21,産経新聞,人あふれる三鷹駅構内　女性専用車両も解除…６月だけで９件、人身事故続出のＪＲ中央線,60,https://news.yahoo.co.jp/articles/33d4fd426ae431a68ccc6e13999aaaba2771f584,7/2(火) 13:15
2024-07-02,15:09,domestic,国内,22,デイリー新潮,小池知事再選は裏金問題で開き直る「萩生田」「丸川」の手柄…自民党の都議・区議から不満爆発「現場の苦労を知れ」「いい加減辞めて欲しい」,60,https://news.yahoo.co.jp/articles/2818c49b6b8f52e6dce57dd4075f4d43553e8353,7/2(火) 10:41
2024-07-02,15:09,domestic,国内,23,弁護士JPニュース,「外国人への生活保護支給反対」選挙ポスターが北区各所で破損される　“公職選挙法”違反の罰則は？,60,https://news.yahoo.co.jp/articles/6d30b08b4414e749b0f046e20c40c9babadb6a4c,7/2(火) 10:10
2024-07-02,15:09,domestic,国内,24,読売新聞オンライン,事情聴取中の男性に暴行、警部を訓戒処分…「態度に腹が立った」「申し訳ない」,60,https://news.yahoo.co.jp/articles/fc7995fb7f7e68abb0c1fef34dddd12274e461e8,7/2(火) 9:52
2024-07-02,15:09,domestic,国内,25,産経新聞,菅前首相と麻生副総裁、自民総裁選は首相経験者２人によるキングメーカー争いの様相,57,https://news.yahoo.co.jp/articles/9fc8a788b888e1943c1766cdb7a807963b42571f,7/2(火) 14:04
2024-07-02,15:09,domestic,国内,26,JBpress,都知事選の争点「少子化対策」が厄介な理由、他県との格差拡大で“東京一極集中”がますます加速する皮肉な事態も,56,https://news.yahoo.co.jp/articles/3aed3adda067c31b8e6a0919ced0147c803cc44f,7/2(火) 11:46
2024-07-02,15:09,domestic,国内,27,集英社オンライン,〈カオスすぎる東京都知事選〉ついに脱ぐ女性候補まで現れた！「やりすぎでは？」「選挙をバカにしていませんか？」と本人を直撃「そもそも公約あるんですか？」と聞いてみると…,52,https://news.yahoo.co.jp/articles/865e514d0c2742d3c582de7801eb70c344d7882f,7/1(月) 17:02
2024-07-02,15:09,domestic,国内,28,産経新聞,サッカー伊東純也選手、性加害問題で書類送検　告訴女性とともに不起訴の公算　大阪府警,51,https://news.yahoo.co.jp/articles/ab8bd42e674fc63217573654113eb73631872e4d,7/2(火) 14:18
2024-07-02,15:09,domestic,国内,29,TBS NEWS DIG Powered by JNN,娘から「首、拾った」と告げられた父親「警察に突き出すのは娘を裏切ること」札幌頭部切断事件で父・修被告が母の公判に出廷・証言【news23】,51,https://news.yahoo.co.jp/articles/fdf67c666daa9980f7a4aebc885570ba19cb4014,7/2(火) 10:59
2024-07-02,15:09,domestic,国内,30,CBCテレビ,マイナ保険証への切替えに大反響！？賛否の理由は？,50,https://news.yahoo.co.jp/articles/7455c1b1aac6840554b2d7c48608bbeadfe856c3,7/2(火) 12:11
2024-07-02,15:09,domestic,国内,31,産経新聞,都知事選で石丸伸二氏「あいにくの雨だ、これがいい」「同志諸君よ、作戦だ」　東京駅前,49,https://news.yahoo.co.jp/articles/89454e32a67ee35681d099a901d2897db5b246af,7/1(月) 16:19
2024-07-02,15:09,domestic,国内,32,ABEMA TIMES,「父を引き取り、死を悼みたい」オウム松本元死刑囚の次女が出廷し訴え 遺骨などの引き渡し巡る裁判,46,https://news.yahoo.co.jp/articles/a0d974b9fdac6b8f17098395e877fab9aa5120df,7/2(火) 14:12
2024-07-02,15:09,domestic,国内,33,デイリー新潮,法廷で再現されたグロすぎる死体損壊場面「カメラで撮影していると、瑠奈は眼球を手際良く切り抜いた」【ススキノ首切り裁判】,46,https://news.yahoo.co.jp/articles/5e47095712c0c2fbbda5a78d8704892f2de64451,7/2(火) 12:30
2024-07-02,15:09,domestic,国内,34,TBS NEWS DIG Powered by JNN,河野大臣、質問通告の「打ち直し」を問題視　「FAX利用」の見直しに前向きな姿勢示す,41,https://news.yahoo.co.jp/articles/4a7e041499ea31679591f6b81701bbd74669b93b,7/2(火) 14:44
2024-07-02,15:09,domestic,国内,35,ABEMA TIMES,「殺意があったのは間違いないだろう」別府市長が言及…遺族の懸命の訴えも「殺人罪」に変更されない背景 別府ひき逃げ事件,40,https://news.yahoo.co.jp/articles/30402a563cc7fc0ed0e0b1362ccfbe6880dfe05f,7/2(火) 6:50
2024-07-02,15:09,domestic,国内,36,デイリー新潮,父親が法廷で語った田村瑠奈被告の精神構造「死んだ瑠奈の身体をシンシアという人が借りている状態が10年以上続いていた」【ススキノ首切り裁判】,39,https://news.yahoo.co.jp/articles/0bfaed26241f39c1e5439b518a687cb22004bb4b,7/2(火) 12:31
2024-07-02,15:09,domestic,国内,37,SlowNews／スローニュース,「警察官に残業代を全額支払わない仕組みはおかしい」福島県警の元警察官が異例の提訴,39,https://news.yahoo.co.jp/articles/f0c6b6dd8aa9d2a3fcdfae34e22bf7ab32b38412,7/2(火) 7:03
2024-07-02,15:09,domestic,国内,38,プレジデントオンライン,「高学歴な人ほど人生は幸せ」はウソである…日本人が誤解している「最終学歴」の不都合な真実,38,https://news.yahoo.co.jp/articles/90d73e6f541359bce5080f8ac3883c0f18ce7fb6,7/2(火) 10:17
2024-07-02,15:09,domestic,国内,39,デイリー新潮,「安倍首相もできなかったことを」　岸田首相が起死回生の一手として狙っているサプライズとは,38,https://news.yahoo.co.jp/articles/4b8dd1f1b083c8ed71414b34d8f3a3fc0cb63931,7/2(火) 6:00
2024-07-02,15:09,domestic,国内,40,レスキューナウニュース,中央線(快速)で人身事故 運転見合わせ,35,https://news.yahoo.co.jp/articles/2cc7a74fae84b5addc64455ee6f40298b70563e5,7/2(火) 8:15
