scrp_date,scrp_time,genre_en,genre_jp,rank,media_jp,title,comment,link,date_original
2024-02-25,08:18,life,ライフ,1,現代ビジネス,「飲み物は水でいいです」客と飲食店のミスマッチが起きてしまうワケ,28,https://news.yahoo.co.jp/articles/1677e17519594b8c47a09ed9791201f288f5e34a,2/24(土) 10:03
2024-02-25,08:18,life,ライフ,2,まいどなニュース,「まさかわいせつなことされるとは」　7歳娘に運動教室の男「手なずけ」、口止めも,27,https://news.yahoo.co.jp/articles/271948f40900b88ca54578942a1e1e31ab93cacf,2/25(日) 7:00
2024-02-25,08:18,life,ライフ,3,大手小町（読売新聞）,明日暇？今暇？「先に用件を言え！」と言いたくなるような尋ねられ方をされたら、どう返事をするのが正解？,25,https://news.yahoo.co.jp/articles/684cb8db3fe872a0333f20336db27ee578bc6583,2/24(土) 17:10
2024-02-25,08:18,life,ライフ,4,Lmaga.jp,またも大人たちが買い占め？ ハッピーセット「星のカービィ」がわずか１日で販売終了,18,https://news.yahoo.co.jp/articles/ae900f267edb4471517547280d945ec9eee832dc,2/25(日) 6:30
2024-02-25,08:18,life,ライフ,5,文春オンライン,コロンビア大卒・国立大准教授の“ガチ物理エリート”はなぜギャルルックでTikTokに降臨したのか「よく言われますが、ギャルが何なのかわかってない（笑）」,17,https://news.yahoo.co.jp/articles/2104e1342697eded9b711526fd9de7e7f5b982d1,2/24(土) 11:12
2024-02-25,08:18,life,ライフ,6,プレジデントオンライン,全国に7つある「旧帝大」に序列はあるのか…北海道、東北、東京、名古屋、京都、大阪、九州の「政治的な位置付け」,16,https://news.yahoo.co.jp/articles/71bdd5ce2f7dae011fe283a62969d552fead87b4,2/24(土) 11:17
2024-02-25,08:18,life,ライフ,7,毎日新聞,愛知で公立中高一貫ブーム　私立関係者「生徒取られる」,14,https://news.yahoo.co.jp/articles/a0504abdc26d68e02f3a97f566f29ed702bce466,2/25(日) 7:00
2024-02-25,08:18,life,ライフ,8,FORZA STYLE,ダサオジはなぜ靴下で間違えるのか？　イケオジはみんな知っている「シンプルなルール」,14,https://news.yahoo.co.jp/articles/23cb27d1603f4f4df7c9e9d0e751e0831cf81034,2/24(土) 22:36
2024-02-25,08:18,life,ライフ,9,ほ・とせなNEWS,小4の息子に渡したおこづかい明細書　その内容に「こういう勉強小学校とかでして欲しい」「社会勉強になりますね」の声,13,https://news.yahoo.co.jp/articles/950de71fb72b83cbfe67f78aecc9ba03bcb03f90,2/24(土) 17:00
2024-02-25,08:18,life,ライフ,10,ファイナンシャルフィールド,手取り15万円の社会人です。この手取りで「ヴェルファイア」を購入するのは無謀でしょうか？,13,https://news.yahoo.co.jp/articles/eff73cfd7b972c3e5bfd5a34bd7afdbb5c757b80,2/24(土) 11:52
2024-02-25,08:18,life,ライフ,11,8760 by postseven,【天皇陛下が64歳に】天皇ご一家の仲むつまじい姿をプレイバック　愛子さまの陛下ゆずりのユーモアセンスも,12,https://news.yahoo.co.jp/articles/6ecef2e062e2a7cb3ae126e1e6a4abc69a4c9897,2/24(土) 19:00
2024-02-25,08:18,life,ライフ,12,ねとらぼ,妻「夕飯は勝手に食べてて」 → おかず1品だけの“中年男性の質素メシ”に「質素とは」「一品が逸品」とツッコミの声,10,https://news.yahoo.co.jp/articles/067f2c22498feda7cfd46175b974010570d030a1,2/24(土) 20:00
2024-02-25,08:18,life,ライフ,13,kufura,白だしって何？めんつゆとどう違うの？知っているようで意外と知らない「白だしの基礎知識」,10,https://news.yahoo.co.jp/articles/8cbef6c032e93597d5d793fb37f6b31fc41879c2,2/24(土) 11:10
2024-02-25,08:18,life,ライフ,14,KURU KURA（くるくら）,歩行者優先なのに。信号機のない横断歩道で2台に1台が一時停止しないのはなぜ？,9,https://news.yahoo.co.jp/articles/01c92a199b08faf49738998a8a2b8d824c152da4,2/24(土) 12:11
2024-02-25,08:18,life,ライフ,15,ねとらぼ,【70代が選ぶ】「GMARCHと日東駒専で優秀な学生が多いと思う大学」ランキング！　2位は「明治大学」、1位は？,9,https://news.yahoo.co.jp/articles/fba093b0dce2564ffc919cde793b9b2850725bd4,2/24(土) 19:40
2024-02-25,08:18,life,ライフ,16,レタスクラブ,37歳で大腸がんと診断。『痔だと思ったら大腸がんステージ4でした』著者に聞いた「絶望が決意に変わった瞬間」,9,https://news.yahoo.co.jp/articles/51dc4080ffb4b3ad1ef1d84e07a1f671756d3682,2/24(土) 21:00
2024-02-25,08:18,life,ライフ,17,FORZA STYLE,「たかがスウェット…はもう古い！」いまイケオジが、こぞって「綺麗にスウェット」を着こなしている理由。,9,https://news.yahoo.co.jp/articles/4e9d5257a5932b7fffb7d558e4a3cb5cb1fd71ce,2/24(土) 21:02
2024-02-25,08:18,life,ライフ,18,ELLE DIGITAL,女性＆ノンバイナリーが対象のテック業界就職フェアに男性が殺到「チャンスを奪わないで」参加者からは不満の声,8,https://news.yahoo.co.jp/articles/227128601a78e43275171a243a83903af1c90124,2/24(土) 21:20
2024-02-25,08:18,life,ライフ,19,まいどなニュース,「あ、メーカーさんなんだ～」海外駐在員の妻たちのマウント合戦…“駐妻問題”に海外勤務のベテランがアドバイス,8,https://news.yahoo.co.jp/articles/3692d91e1eb06a62b295a908f4cfa3fd37d8ede3,2/24(土) 18:32
2024-02-25,08:18,life,ライフ,20,ELLE DIGITAL,まだまだあった！ 日本では流行っているけれど、おしゃれパリジェンヌが絶対にしないこと,8,https://news.yahoo.co.jp/articles/532719e338d6ac2fa1a7c54b15fe7aa5cb1f1abe,2/24(土) 20:40
2024-02-25,08:18,life,ライフ,21,サンキュ！,テーブルに置かれていたのはパパへの「怪文書」!?お小遣いをほしい娘が用意した賢すぎる手紙に6万人がほっこり,8,https://news.yahoo.co.jp/articles/03bd9e76c904405fb6c1330d38a4d702279bbfac,2/24(土) 21:32
2024-02-25,08:18,life,ライフ,22,ファイナンシャルフィールド,パート先で休日に「今日シフト変われませんか？」などLINEが来ます。見なかったことにして無視しても問題ないでしょうか？ 休日に仕事のことをしたくないです…,8,https://news.yahoo.co.jp/articles/e02f1e12326bc43878aa6f2b829819c00d730aee,2/24(土) 13:40
2024-02-25,08:18,life,ライフ,23,NEWSポストセブン,妻を激怒させる「スイッチ」　昭和なジェンダー意識にご用心！,8,https://news.yahoo.co.jp/articles/b1ad44379142cde3b61f8567568cb9085e006388,2/24(土) 16:15
2024-02-25,08:18,life,ライフ,24,HugKum,トランプ氏はなぜアメリカでここまで人気がある？今までどんなことをした人？【親子で語る国際問題】,7,https://news.yahoo.co.jp/articles/a3786f1fc2199165812c6884dddd921531563c0a,2/24(土) 21:10
2024-02-25,08:18,life,ライフ,25,Book Bang,夢眠ねむ「全家庭の掲示板に貼るべき」　悪気なく相手をイラつかせる大人にも効く「言い換え図鑑」（レビュー）,7,https://news.yahoo.co.jp/articles/b840e30eb4b854e2a5ddb1aaf5a2d3cc8bcf787a,2/25(日) 6:00
2024-02-25,08:18,life,ライフ,26,産経新聞,恋愛も性交も縁がない　超草食男子が増えている　識者「若者の向き合い方は二極化」　Ｘに賛否「なんでも『学校』か」「教育の放棄」～私たちが子供いらないと思う理由,7,https://news.yahoo.co.jp/articles/bf7070b4485eb59a41688843f67eb7bad42f3b7a,2/24(土) 19:00
2024-02-25,08:18,life,ライフ,27,ファイナンシャルフィールド,知人が車検ごとに車を買い替えています。頻繁に買いすぎでは？ と思うのですが、メリットはあるのでしょうか…。,7,https://news.yahoo.co.jp/articles/2ce1269ac571844293656e27695e2e5678ffda9f,2/24(土) 14:00
2024-02-25,08:18,life,ライフ,28,週刊女性PRIME,排便事件は日常茶飯事、“殺すぞ”と追いかけられ、スタッフ・家族は精神崩壊寸前「認知症の“介護沼”」,7,https://news.yahoo.co.jp/articles/a11d075dce5b6b1a13396a1ebb2661884706ca15,2/25(日) 6:02
2024-02-25,08:18,life,ライフ,29,ねとらぼ,【40代が選んだ】ネームバリューが強いと思う「GMARCHの大学」ランキング！　2位は「明治大学」、1位は？,6,https://news.yahoo.co.jp/articles/8d324ec9106ddb31c742885d98ff438ee747e82c,2/25(日) 7:50
2024-02-25,08:18,life,ライフ,30,THE GOLD ONLINE（ゴールドオンライン）,"月1万5,000円に苦しめられ…東京に憧れた〈手取り月16万円〉23歳女性の悪夢「こんなはずじゃなかった」【FPが解説】",6,https://news.yahoo.co.jp/articles/a7809aa0f27877d64e6eaaf1947ce08693326077,2/24(土) 11:32
2024-02-25,08:18,life,ライフ,31,日刊ゲンダイDIGITAL,流行中の「溶連菌」は合併症に注意…ギランバレー症候群を発症するケースも,6,https://news.yahoo.co.jp/articles/51012d26441e3fe2683b214eecb20dd7bfdb3750,2/24(土) 9:06
2024-02-25,08:18,life,ライフ,32,よろず～ニュース,ゲーミングチェアが高くて買えない→3300円で代用成功！珍アイデアが反響「これは盲点」「原点回帰」,6,https://news.yahoo.co.jp/articles/2825347d10a1572c3297eb0cdbbbe18d6fa8cc2f,2/24(土) 14:10
2024-02-25,08:18,life,ライフ,33,現代ビジネス,「ひろゆきの妻」が夫に「なぜ炎上させるのか」聞いたら返ってきた、予想外すぎる答え,6,https://news.yahoo.co.jp/articles/23b4dac1c71ab10d60cd08deb9d9c585b8cb5862,2/24(土) 9:03
2024-02-25,08:18,life,ライフ,34,LIMO,ビリヤニを作ろうと購入したインド米　すべてが面倒になった結果「錬成されたもの」に思わず目を疑う,6,https://news.yahoo.co.jp/articles/67c7f3a757be3260a2c0b67adb713aa5a739b6a9,2/25(日) 5:17
2024-02-25,08:18,life,ライフ,35,TOKYO FM＋,財源は「1人500円弱」の支援金!? 所得によっては負担が増える人も…閣議決定された「少子化対策関連法案」の内容は？ 専門家が解説,5,https://news.yahoo.co.jp/articles/6babdd1eec1e95ad46ef82f5bedf4b0ad4a0edab,2/25(日) 7:40
2024-02-25,08:18,life,ライフ,36,ファイナンシャルフィールド,月給「23万円」の派遣社員ですが「月給24万円で無期雇用派遣にならないか」と打診されました。どうしたらいいですか？,5,https://news.yahoo.co.jp/articles/5ed0ba6d51c08fef87a340b5e947631a29f6ac85,2/24(土) 16:31
2024-02-25,08:18,life,ライフ,37,THE GOLD ONLINE（ゴールドオンライン）,"私大医学部なら「学費3,000万円前後」だが…なかには「6年間ずっとタダ」も。全国約80校に紛れた“特殊医学部”",5,https://news.yahoo.co.jp/articles/01490ad05b7e8fe8ec8b70ae635fc37beb5156b5,2/24(土) 9:02
2024-02-25,08:18,life,ライフ,38,中日スポーツ,藤井聡太棋王、伊藤匠七段に94手で勝利 両者の対戦成績は藤井棋王の8勝0敗1持将棋【棋王戦第2局】,5,https://news.yahoo.co.jp/articles/42c623ba57f28e7d00059171ebfc83c7a4e8c0c3,2/24(土) 18:35
2024-02-25,08:18,life,ライフ,39,まいどなニュース,「おにぎり、死す。」！？　ドイツのスーパーに売ってた日本食、ツッコミどころ満載で笑える「ご愁傷様でした…」,5,https://news.yahoo.co.jp/articles/5a98ba2b24315762dd33c158b4b0089440d86db3,2/24(土) 11:55
2024-02-25,08:18,life,ライフ,40,産経新聞,中学受験を終えた皆さん、次は大学受験　数学や物理は捨てても英語からは逃げられません　桜井信一の攻める中学受験,5,https://news.yahoo.co.jp/articles/f456f5a1124d7d58ac5943f029a67164268c2a15,2/24(土) 10:05
