scrp_date,scrp_time,genre_en,genre_jp,rank,media_jp,title,comment,link,date_original
2025-02-22,14:06,business,経済,1,みんかぶマガジン,農水省はウソばかり！「コメ転売」「自給率100％」米が高いのはおかみの農家いじめが原因…日本を滅ぼす自民党,169,https://news.yahoo.co.jp/articles/f298c795fcd49ed5f6e6610bf29cbf9aa343eba4,2/22(土) 9:10
2025-02-22,14:06,business,経済,2,ITmedia ビジネスオンライン,永谷園の「カップお茶づけ」が好調　開発担当者に聞く、“このタイミング”で発売したワケ,108,https://news.yahoo.co.jp/articles/2c58cb143075b07ed7374d85dea7c2db34645e48,2/22(土) 10:05
2025-02-22,14:06,business,経済,3,産経新聞,仏ゲームソフト「弥助」神社の内部破壊する映像が物議　実在の神社側「しかるべき対応」,80,https://news.yahoo.co.jp/articles/4a07f9fc2ffd32ddf3bd6cfe544a39df74faea63,2/21(金) 19:00
2025-02-22,14:06,business,経済,4,テレビ朝日系（ANN）,お得な輸入米の争奪戦激化　日本国内の農家は“トラクターデモ”所得補償訴え,73,https://news.yahoo.co.jp/articles/5a4addab7d39836a6b0c90f94b3fba83faded8c3,2/22(土) 11:46
2025-02-22,14:06,business,経済,5,信濃毎日新聞デジタル,予約が殺到、スキー場で愛犬にも“おもてなし”の一緒に泊まって遊べる宿　SNSで拡散しキャンセル待ちに,70,https://news.yahoo.co.jp/articles/bf4e222093518d89bf1f112fa737a02960fbae58,2/22(土) 6:10
2025-02-22,14:06,business,経済,6,Bloomberg,日産株急騰、菅氏らのグループがテスラの支援仰ぐ計画策定と報道,56,https://news.yahoo.co.jp/articles/6b99d7c6e9a27723cc324f35ff2500a53fe04327,2/21(金) 14:30
2025-02-22,14:06,business,経済,7,東洋経済オンライン,「わずか1年で店がドンドン閉店」「ドンキも新業態がコケる」…。パンパシが運営する渋谷の商業施設「道玄坂通」が大苦戦中。その中で“一人勝ち”する店の正体とは？,54,https://news.yahoo.co.jp/articles/c26461cd0958a08da593096b0b489c2bc91e89da,2/22(土) 7:21
2025-02-22,14:06,business,経済,8,くるまのニュース,買う気ゼロでも「タダで新車乗りたい！」迷惑客に「ありがたいのですが…」販売店のホンネとは？ 試乗で「性能フル発揮」暴走行為も…まるでスーパーの“試食コーナー”の実態,47,https://news.yahoo.co.jp/articles/eb92ec82ad50504ceb8bae6f4d81bf823ca4bff1,2/22(土) 12:10
2025-02-22,14:06,business,経済,9,日刊自動車新聞,ホンダ幹部、鴻海との提携を否定　日産へソフト供給狙う両社　目的重複で協業メリットなし,44,https://news.yahoo.co.jp/articles/f1878fd1ce9fd642e98e7833d8fb9c2b653d131e,2/22(土) 6:02
2025-02-22,14:06,business,経済,10,東洋経済オンライン,赤いきつねCM「グルメ漫画の表現内」なのか検証　リュウジ氏が言う「頬を染めて食うのはデフォルト」は本当か,42,https://news.yahoo.co.jp/articles/6c9df509fa4209ab7df3abdfe34f47054ced4b58,2/22(土) 6:02
2025-02-22,14:06,business,経済,11,ベストカーWeb,2024年に一番売れたコンパクトカーはノートe-POWERだった!! 売れてる理由と燃費が向上する新型の発売はいつ???,37,https://news.yahoo.co.jp/articles/01fe29352761b627b651e9fe0e8bd9c044d65345,2/22(土) 11:00
2025-02-22,14:06,business,経済,12,朝日新聞,トランプ氏、米テック企業に課税なら「関税」　カナダ・フランス念頭,33,https://news.yahoo.co.jp/articles/0f30b03da42cfed77bce70660a15046e0d4d05c5,2/22(土) 10:59
2025-02-22,14:06,business,経済,13,週刊SPA!,“店舗激減”ミニストップ。安売り戦略で迷走、個性の「店内調理」も今や武器になりえず…大手3社との差は開くばかり,29,https://news.yahoo.co.jp/articles/efe07c6820bf63bffdfb6f951942b714d29188da,2/22(土) 8:53
2025-02-22,14:06,business,経済,14,プレジデントオンライン,「つみたてNISAで長期投資なら儲かる」に根拠ゼロ…荻原博子が「投資のプロの話を真に受けるな」という理由,26,https://news.yahoo.co.jp/articles/531343bb64811dff202e1d882af1baaf50cc3420,2/21(金) 16:17
2025-02-22,14:06,business,経済,15,産経新聞,コメ値下がりへ３つのハードル　備蓄米放出で価格下落期待も「昨年並みには戻らない」,25,https://news.yahoo.co.jp/articles/24f5e169fcfd6d02043c97cf785fde92e7873582,2/22(土) 10:00
2025-02-22,14:06,business,経済,16,くるまのニュース,なぜ“教習所”で「車の“給油方法”」教えてくれない？ 教えない理由は？ 正しい“給油”ルールとは,25,https://news.yahoo.co.jp/articles/5be24d6c403b44fe2f37ce221217775cb97dbb43,2/22(土) 9:10
2025-02-22,14:06,business,経済,17,ファイナンシャルフィールド,【令和7年2月～3月支給開始】価格高騰重点支援給付金はいつ頃もらえる？支給対象となる世帯や支給額、支給時期などを詳しく解説,23,https://news.yahoo.co.jp/articles/bc382cd23de42d4aed2d3ffb8726677fdfb00e27,2/22(土) 13:40
2025-02-22,14:06,business,経済,18,ABEMA TIMES,消えた21万トン…備蓄米放出で本当に解決？“誰かが隠している”はフィクション？ 稼げる農家「縁故米が例年より増えている」,23,https://news.yahoo.co.jp/articles/691507dc357334df9a5f6f85e3df0e302a82f4f5,2/21(金) 19:27
2025-02-22,14:06,business,経済,19,ダイヤモンド・オンライン,賃金が上がるのになぜ日本経済は“ゼロ成長”？「価格転嫁」を奨励する大間違い,19,https://news.yahoo.co.jp/articles/c615ae515d888b03eae4b829d45c42b0fe367b6e,2/22(土) 6:32
2025-02-22,14:06,business,経済,20,プレジデントオンライン,「従業員の茶髪・ピアスOK」は本当にいい職場なのか…日本企業に蔓延る「多様性もどき」にモヤモヤする理由,19,https://news.yahoo.co.jp/articles/3f864c545b4369b502d217b4859b3a16cfca55ff,2/21(金) 18:17
2025-02-22,14:06,business,経済,21,乗りものニュース,世界で最も愛用されている戦闘機とは？ F-15「イーグル」は第3位！ なら1位は,18,https://news.yahoo.co.jp/articles/d20299e1b21b18bd27b4d98186500f362e9c8411,2/22(土) 11:42
2025-02-22,14:06,business,経済,22,ロイター,日産自株が一時12％超高、日本の元首相含むグループがテスラによる投資計画策定との報道で,17,https://news.yahoo.co.jp/articles/5ad0aa838b85029cd633160bcc02b3fbbbd30b80,2/21(金) 14:50
2025-02-22,14:06,business,経済,23,webCG,オーダーストップの「ジムニー ノマド」に代わる小型SUV選び,17,https://news.yahoo.co.jp/articles/a288e21797c7836fb3ce629cee49d9da49dd1249,2/22(土) 9:02
2025-02-22,14:06,business,経済,24,TBS NEWS DIG Powered by JNN,「非常に大きな問題」“トランプ関税”に日本商工会議所会頭が危機感,17,https://news.yahoo.co.jp/articles/09cedbf736dad5991434255a98fc322a8fbfd09d,2/21(金) 14:36
2025-02-22,14:06,business,経済,25,webCG,日産とホンダの経営統合破談と日産が決算会見で発表した新型車導入計画を分析する,17,https://news.yahoo.co.jp/articles/01892b1a536590c698d045bd7ad0cebd4e2ab160,2/22(土) 8:03
2025-02-22,14:06,business,経済,26,東洋経済オンライン,「授業料を無償化」したら、日本の教育が滅んでしまうと言える「4つの理由」,16,https://news.yahoo.co.jp/articles/9f8f27f3a25fbd2fcf220a56a7d8e93111150594,2/22(土) 6:32
2025-02-22,14:06,business,経済,27,現代ビジネス,有事の際に真っ先に飢え死にするのは「都会の人々」!?…故・森永卓郎さんが「農業の軽視は命の軽視」と政府を痛烈批判したワケ,16,https://news.yahoo.co.jp/articles/9efce447dbc16874cd63bf7beadd72c964aa3098,2/22(土) 7:01
2025-02-22,14:06,business,経済,28,ねとらぼ,“9年前に撮影したガソリン価格”に衝撃　もはや別世界線レベルで「夢の価格」「今では信じられない」と900万表示,15,https://news.yahoo.co.jp/articles/3614995950355c285457254db4d5e7f9febfbf2a,2/21(金) 19:50
2025-02-22,14:06,business,経済,29,時事通信,米テスラに日産への出資要請か,15,https://news.yahoo.co.jp/articles/ee209b0cb92bbd11c3f93afe81cd95f9126eb8f1,2/22(土) 6:00
2025-02-22,14:06,business,経済,30,マネーポストWEB,【大学2026年問題】定員充足率が初めて100％を下回り「大学全入時代」に新たな局面　「激減する18歳人口の奪い合い」の行き着く先,15,https://news.yahoo.co.jp/articles/72ea25cdfd7749f41f5c29f69d14f0df97979ee1,2/22(土) 7:16
2025-02-22,14:06,business,経済,31,みんかぶマガジン,トランプショック「なぜ世界一律関税から相互関税に変遷したのか」…第二次トランプ政権では早速目玉政策として採用,14,https://news.yahoo.co.jp/articles/1750aec4236cd83540240881ca5fa7d3e1f2bbe9,2/22(土) 12:10
2025-02-22,14:06,business,経済,32,乗りものニュース,「東北を縦断する本線」の“不通”解消へ！新たに快速も新設 電車から気動車に切り替え,14,https://news.yahoo.co.jp/articles/b30b9e5613668729388d39154d3ec6f2fbb01191,2/22(土) 8:42
2025-02-22,14:06,business,経済,33,東洋経済オンライン,「当時は広告も多かった」「勘違いしても仕方がない」との声も出ているが…。令和ロマン・くるま「謝罪対応」まで賢すぎたワケ,14,https://news.yahoo.co.jp/articles/6c0b337bccfa34c62e9417dcfe0b9e4eaa20cc05,2/22(土) 7:36
2025-02-22,14:06,business,経済,34,毎日新聞,FDA、福岡－新千歳線を新規運航　3月30日から毎日１往復,13,https://news.yahoo.co.jp/articles/61587a89579a9203abc992e27f83e33766150cae,2/22(土) 13:03
2025-02-22,14:06,business,経済,35,THE EV TIMES,結局EV普及のネックは「価格」！　補助金を抜きにした価格が下がらないと売れない,13,https://news.yahoo.co.jp/articles/1d2c15494c3dc3f1caefb44eca532a89bb8c1a9c,2/21(金) 21:02
2025-02-22,14:06,business,経済,36,Merkmal,あなたの“鉄道愛”は本物？ 「成熟した鉄道オタク」と「未熟な鉄道オタク」を見分ける6つのポイントとは,13,https://news.yahoo.co.jp/articles/1de376fdc6b196b56c8741bbbc8b0bc196571209,2/22(土) 8:50
2025-02-22,14:06,business,経済,37,産経新聞,アサヒビールが主力で7年ぶり新ブランド　苦み特徴「ザ・ビタリスト」4月15日発売,13,https://news.yahoo.co.jp/articles/2970f42a1ac03279dd00a1aa05f6d49b6e1824ca,2/21(金) 13:26
2025-02-22,14:06,business,経済,38,デイリー新潮,「石破首相は“ご破算は避けた”と言うが…」　日鉄を窮地に追いやるトランプの問題発言,13,https://news.yahoo.co.jp/articles/26cee85cbeac52900076c350ac4c17d2556160ee,2/22(土) 6:09
2025-02-22,14:06,business,経済,39,東洋経済オンライン,令和ロマンくるま「『違法ではない』という認識だった」　令和ロマンが浮き彫りに「オンカジ」政府責任は？　巧妙な広告戦略に問われる日本の法規制と対策,13,https://news.yahoo.co.jp/articles/66cf8142434ab73779b677ddbc3afb4c45ac7510,2/22(土) 12:02
2025-02-22,14:06,business,経済,40,ファイナンシャルフィールド,家族旅行のため「新幹線」を予約していたのですが、子どもの具合が悪くなり乗り遅れてしまいました…。やはり「切符の買い直し」が必要でしょうか？,12,https://news.yahoo.co.jp/articles/49c6d867d820fd1ac51511b5ab9b965b5e5208c7,2/22(土) 13:20
