scrp_date,scrp_time,genre_en,genre_jp,rank,media_jp,title,comment,link,date_original
2025-01-24,10:34,domestic,国内,1,東海テレビ,【速報】「内臓が出ている」と通報 通り魔か…朝の路上で男性が刃物のような物で切り付けられる 165cmくらいの男が逃走,702,https://news.yahoo.co.jp/articles/8d77fc0a809e4b37b68e79db8e0717d619eaada1,1/24(金) 8:37
2025-01-24,10:34,domestic,国内,2,TBS NEWS DIG Powered by JNN,【速報】港浩一社長が会見について「失敗だった。準備不足だった」フジテレビ社員向け説明会で謝罪　社員から200を超える質問寄せられる,324,https://news.yahoo.co.jp/articles/edef7beee0550977acbbed80132521406b0bbfaf,1/23(木) 18:32
2025-01-24,10:34,domestic,国内,3,現代ビジネス,フジテレビに訪れる「最悪の番組ラインナップ」…”中居正広騒動”に現場社員が漏らした本音,261,https://news.yahoo.co.jp/articles/6cdeea07d4b6e5635843d68a62f636eb991a4acf,1/24(金) 9:04
2025-01-24,10:34,domestic,国内,4,テレビ朝日系（ANN）,日本財団が「塀のない刑務所」を法務大臣に提言  スムーズな社会復帰めざし整備求める,184,https://news.yahoo.co.jp/articles/821df90da97129ec16b868c4f50538472134569f,1/23(木) 15:29
2025-01-24,10:34,domestic,国内,5,デイリー新潮,いまや大卒の就職率は「98.1％」で初任給「40万超」も…深刻な“若手不足”の一方で「氷河期世代」が全く報われないのはなぜか,131,https://news.yahoo.co.jp/articles/05d0276501d4c128d9b763d8dfd491a8318b6565,1/24(金) 6:10
2025-01-24,10:34,domestic,国内,6,デイリー新潮,自死した「兵庫県議」が漏らしていた「立花に恐怖を感じている」の意味　当の立花氏は「自ら命を絶つような人は政治家しちゃいかん」,106,https://news.yahoo.co.jp/articles/7d661184fcdc7210a5151287496aef2aabc366e2,1/23(木) 17:10
2025-01-24,10:34,domestic,国内,7,FRIDAY,「調査するとどんな“悪事”が出てくるか分からない」…スポンサーから見離されたフジテレビの存亡危機,83,https://news.yahoo.co.jp/articles/c935b6fd4c1a9fb9ce6ad466b46cf47a50003dde,1/24(金) 7:00
2025-01-24,10:34,domestic,国内,8,読売新聞オンライン,八丈島で「釣りをしていた親子が海に落ちた」…小４男児が岩場から転落、助けようとした父親も死亡,72,https://news.yahoo.co.jp/articles/07d93e7b9b063df6967d17cbaae0661617ba2d1b,1/23(木) 21:32
2025-01-24,10:34,domestic,国内,9,デイリー新潮,とにかく「ひとり暮らしをしたい」　悠仁さま「筑波大ライフ」へのお気持ちは,68,https://news.yahoo.co.jp/articles/27febcad9ca4009d7e434fcbf5d1006f94226daf,1/24(金) 6:00
2025-01-24,10:34,domestic,国内,10,よろず～ニュース,つばさの党・黒川敦彦氏“凸撃”やめる宣言！「政治団体Ｑ」立ち上げ千代田区長選出馬「訴えるものはＱ」,58,https://news.yahoo.co.jp/articles/95d67fdab10b1264f27456ceabb668cf404d0277,1/24(金) 6:50
2025-01-24,10:34,domestic,国内,11,毎日新聞,岸田前首相襲撃事件、被告が殺意を否認へ　2月4日に初公判,55,https://news.yahoo.co.jp/articles/5c233f3bb871f300a38e4a19ef28f45c5b0067be,1/23(木) 17:38
2025-01-24,10:34,domestic,国内,12,現代ビジネス,注文内容、住所など「1件500円」で客の個人情報を販売…！背景には「配達報酬減額」ウーバーイーツ配達員のあいだで広がる、ヤバすぎる「闇バイト」,52,https://news.yahoo.co.jp/articles/15407a39c4c2802d55bf1a46bd69e0aa5a602992,1/24(金) 7:04
2025-01-24,10:34,domestic,国内,13,TBS NEWS DIG Powered by JNN,【速報】行方不明のリゾートバイト女性 東京・大島の海岸で骨で見つかる　島に住む交際相手の男（45）を逮捕　死体損壊・遺棄容疑　警視庁,52,https://news.yahoo.co.jp/articles/a01fbd58c9fff18e8cc176a96bcb0673dd727775,1/24(金) 0:50
2025-01-24,10:34,domestic,国内,14,産経新聞,兵庫県警がSNSの誹謗中傷に警告　公式アカウントで発信　元県議死亡を受け,49,https://news.yahoo.co.jp/articles/5f4a0f83b8634bb373486c2168794a1510932959,1/24(金) 7:19
2025-01-24,10:34,domestic,国内,15,デイリー新潮,団塊ジュニアは“日本のガン”か？　年金にも頼れない「受難の世代」が長生きする“唯一の方法”とは,49,https://news.yahoo.co.jp/articles/3178d87351d2d5d0a8e7be2bc93e720efce1fdf4,1/24(金) 6:11
2025-01-24,10:34,domestic,国内,16,CBCテレビ,元TOKIO・山口達也さん（53）大好きだったお酒「絶対に飲まない」と誓った過去  アルコール依存症の苦しみ語る,47,https://news.yahoo.co.jp/articles/e860c7aad051290f3a7cf06215302b2165e8af17,1/24(金) 6:02
2025-01-24,10:34,domestic,国内,17,毎日新聞,都議会自民会派、不記載議員ら26人発表　幹事長経験者は公認見送り,46,https://news.yahoo.co.jp/articles/e7cf77011a6d6cc25a04a7e24e99a62f4f80082e,1/23(木) 13:31
2025-01-24,10:34,domestic,国内,18,プレジデントオンライン,トランプ大統領は本当に日本から米軍を引き上げるのか…「遠い国の戦争」に首を突っ込む米国の真の狙い,45,https://news.yahoo.co.jp/articles/43327d66a1ec4f2536db834a3a2e479d2b941f5a,1/24(金) 8:17
2025-01-24,10:34,domestic,国内,19,FNNプライムオンライン（フジテレビ系）,スリランカ人グループが乱闘騒ぎで8人逮捕…女性との交際トラブルか?空き瓶や角材で相手グループ殴る　東京・杉並区,43,https://news.yahoo.co.jp/articles/d43e1f47ad4c3b004439611aa3ef2afc6151df12,1/24(金) 0:40
2025-01-24,10:34,domestic,国内,20,TBS NEWS DIG Powered by JNN,フジテレビ“4時間半”の社員説明会で「子どもがいじめに…」や経営陣の退陣を涙ながらに訴える社員も　港社長が会見は「失敗した」 27日に再び会見へ【news23】,41,https://news.yahoo.co.jp/articles/85b93cdde7dd7f9128f37b0bb64cb152159bef72,1/24(金) 1:22
2025-01-24,10:34,domestic,国内,21,毎日新聞,闇バイトに雇われたふりの「仮装身分捜査」　識者が懸念する適用拡大,38,https://news.yahoo.co.jp/articles/aebeb8d3e0d88acc833dad0539478f6a4c59637a,1/23(木) 17:20
2025-01-24,10:34,domestic,国内,22,Book Bang,トイレ改修ができず、電灯さえつけられない…劣化していく「国立大学」の悲惨な姿を追うノンフィクション（レビュー）,37,https://news.yahoo.co.jp/articles/b52ecdfa1fb084c8c6cab1074724238b2be05127,1/24(金) 6:00
2025-01-24,10:34,domestic,国内,23,読売新聞オンライン,今年の受験生は「強気」…東大・京大・東京科学大など難関国立大が軒並み志望者増やす,36,https://news.yahoo.co.jp/articles/f846e8747ec686a248cd35b8cefac9dfe401a485,1/23(木) 22:15
2025-01-24,10:34,domestic,国内,24,FNNプライムオンライン（フジテレビ系）,中居正広氏が芸能界引退を表明「こんなお別れで、本当に、本当に、ごめんなさい。さようなら…」,36,https://news.yahoo.co.jp/articles/b00e0fca54cb555c6350839273b9bd35bef2a560,1/23(木) 12:13
2025-01-24,10:34,domestic,国内,25,現代ビジネス,選挙に勝ったのに存在感ゼロ…！「立憲民主党」が政権を奪取するために見直すべき「分配政策」,33,https://news.yahoo.co.jp/articles/885f0fd31976010a6808e0d7f26e3683b3744708,1/24(金) 7:04
2025-01-24,10:34,domestic,国内,26,MBSニュース,【中居正広さん】引退表明「ヅラの皆さん 一度でも、会いたかった」個人事務所も廃業へ　フジテレビは第三者委設置へ　CM降板の違約金・局の関与調査、今後の展開を経営コンサルタントに聞く,32,https://news.yahoo.co.jp/articles/59f65a2a4820e555d7743f74e5e74186c208ba6b,1/23(木) 19:04
2025-01-24,10:34,domestic,国内,27,メ〜テレ（名古屋テレビ）,【速報】岐阜市の路上で男性が腹部を切られた状態で倒れているのが見つかる　意識は有り　男は逃走,31,https://news.yahoo.co.jp/articles/c9f48fcd6196356c354f14e89ad92eb7b08e4aaf,1/24(金) 9:03
2025-01-24,10:34,domestic,国内,28,プレジデントオンライン,今国会で皇位継承問題の議論はどこまで進むか…皇室研究家が「何らかの進展が期待できる」と話す根拠,31,https://news.yahoo.co.jp/articles/efebb8b4c843f1a495242e5957686633889d329f,1/24(金) 9:17
2025-01-24,10:34,domestic,国内,29,プレジデントオンライン,「中居正広氏引退」の道づれになりたくない…民放キー局の「社内調査やります宣言」に透けて見える本音,28,https://news.yahoo.co.jp/articles/250d86d087a327bcc2751985ed08e1e42546fc4d,1/23(木) 22:17
2025-01-24,10:34,domestic,国内,30,産経新聞,斎藤知事の「パワハラ認定へ」報道は「裏が取れている」　民放が訂正に応じずと百条委員長,28,https://news.yahoo.co.jp/articles/48c08d173766e33c6419079d4e90bb423ef9cb9f,1/23(木) 15:11
2025-01-24,10:34,domestic,国内,31,TBS NEWS DIG Powered by JNN,【速報】フジテレビ港浩一社長「一般感覚の著しい欠如があった」社員向け説明会の内部映像を入手　「マスメディアとしてあり得ない形になった」と反省も,27,https://news.yahoo.co.jp/articles/01b43e902898c1aa1b5bc2170dc856119aca1de5,1/23(木) 22:05
2025-01-24,10:34,domestic,国内,32,TBS NEWS DIG Powered by JNN,【速報】林官房長官「調査状況等踏まえ適切に対応」 フジテレビの問題受け　内閣広報室が各省に広報啓発事業の有無を照会,26,https://news.yahoo.co.jp/articles/27760be01423cf7b5c13fac68da74a35f1b7ab1e,1/24(金) 10:02
2025-01-24,10:34,domestic,国内,33,ダイヤモンド・オンライン,中居正広トラブルでフジテレビが存亡の危機！松本人志なんか比じゃない「ギョーカイの闇」,26,https://news.yahoo.co.jp/articles/6a826c2079227222c5f06adf704e00e99d994d0b,1/23(木) 17:02
2025-01-24,10:34,domestic,国内,34,テレビ朝日系（ANN）,改修休館でマンボウ体調崩す　寂しさ原因か　人の顔写真を水槽に貼ったら回復,25,https://news.yahoo.co.jp/articles/3e44c6be916aa8b33913186d90cfd4d1174eaacd,1/24(金) 9:38
2025-01-24,10:34,domestic,国内,35,読売新聞オンライン,偽の警察手帳で刑事かたる…若者の学生証提示させた１７歳「職務質問したかった」,24,https://news.yahoo.co.jp/articles/60b4a2df8d2239938bd8be4c6c0d221dae55343f,1/24(金) 9:22
2025-01-24,10:34,domestic,国内,36,日テレNEWS NNN,“逃走の男、犯行の数十分前に現場”　長野駅前3人死傷事件,24,https://news.yahoo.co.jp/articles/78931f121202213244b13d1817e30bc810285a4f,1/24(金) 1:27
2025-01-24,10:34,domestic,国内,37,朝日新聞デジタル,児童が口にした「差別への恐れ」　朝鮮学校で大学生が模擬授業,24,https://news.yahoo.co.jp/articles/76da5ed4715926ab5ffecbb400ca2595d6c8729b,1/24(金) 8:00
2025-01-24,10:34,domestic,国内,38,プレジデントオンライン,"ラーメン店で逮捕された理由は3時間以上の「不退去」…居座った男性客が激怒した""餃子とラーメン""問題とは",22,https://news.yahoo.co.jp/articles/c19c5f2f094dfcea233085ae56de806c56e20ef3,1/23(木) 19:17
2025-01-24,10:34,domestic,国内,39,時事通信,立民、予算修正へ攻勢図る　「埋没」に危機感,22,https://news.yahoo.co.jp/articles/0c3c89c42ece34de38539807f6334fdc15905a57,1/24(金) 7:06
2025-01-24,10:34,domestic,国内,40,毎日新聞,リゾートバイトで伊豆大島に　遺体の女性、容疑者と交際トラブルか,21,https://news.yahoo.co.jp/articles/ea9a9409b0db5376e3e2e390fde261c85f39ef6f,1/24(金) 1:25
