scrp_date,scrp_time,genre_en,genre_jp,rank,media_jp,title,comment,link,date_original
2024-11-11,07:06,domestic,国内,1【独占スクープ】玉木雄一郎氏「高松観光大使」元グラドルと隠密不倫デート＆地元ホテルで逢瀬…取材には「家族との話し合いが終わっていない」SmartFLASH11/11(月) 6:00591件/時,SmartFLASH,【独占スクープ】玉木雄一郎氏「高松観光大使」元グラドルと隠密不倫デート＆地元ホテルで逢瀬…取材には「家族との話し合いが終わっていない」,591,https://news.yahoo.co.jp/articles/8b9902cddbe5b9d599955f738260c1d463078a5f,11/11(月) 6:00
2024-11-11,07:06,domestic,国内,2「サンモニ」識者　国民・玉木氏を「あるまじき」と猛批判　「自民党に利する行為は受け入れたくない」デイリースポーツ11/10(日) 20:13276件/時,デイリースポーツ,「サンモニ」識者　国民・玉木氏を「あるまじき」と猛批判　「自民党に利する行為は受け入れたくない」,276,https://news.yahoo.co.jp/articles/4940bd398ee26ee992c851a6ba528bfafad8410b,11/10(日) 20:13
2024-11-11,07:06,domestic,国内,3「暴動起きるんじゃないの」日産自動車「利益9割減」「9000人リストラ」でも社長は「年俸3億円死守」の不条理SmartFLASH11/10(日) 16:26226件/時,SmartFLASH,「暴動起きるんじゃないの」日産自動車「利益9割減」「9000人リストラ」でも社長は「年俸3億円死守」の不条理,226,https://news.yahoo.co.jp/articles/66fa0e86a75def7a9bae6a742cb32f4c7b2f0c7a,11/10(日) 16:26
2024-11-11,07:06,domestic,国内,4斎藤元彦氏「兵庫県知事返り咲き」あるか　報道も変化「県民冷ややか」から「猛追」へJ-CASTニュース11/10(日) 17:30160件/時,J-CASTニュース,斎藤元彦氏「兵庫県知事返り咲き」あるか　報道も変化「県民冷ややか」から「猛追」へ,160,https://news.yahoo.co.jp/articles/a9a3615cfa616d001c76af9e52cc7de05688966f,11/10(日) 17:30
2024-11-11,07:06,domestic,国内,5自民、不記載額返還求め寄付検討　裏金議員に「けじめ」要求毎日新聞11/10(日) 20:24148件/時,毎日新聞,自民、不記載額返還求め寄付検討　裏金議員に「けじめ」要求,148,https://news.yahoo.co.jp/articles/0b6d534b5c0f18303bbf497c2587407b28196025,11/10(日) 20:24
2024-11-11,07:06,domestic,国内,6維新、決選含め馬場氏支持　首相指名、立民に協力せず時事通信11/10(日) 20:14123件/時,時事通信,維新、決選含め馬場氏支持　首相指名、立民に協力せず,123,https://news.yahoo.co.jp/articles/a5ed1dd4cca6aefb9e9eb29998102c2cec3d11d5,11/10(日) 20:14
2024-11-11,07:06,domestic,国内,7社民・大椿副党首　兵庫県知事“出直し出馬”の斎藤元彦氏を糾弾「選挙に出てはならなかった」　維新を「製造責任者」と追及もデイリースポーツ11/10(日) 18:13102件/時,デイリースポーツ,社民・大椿副党首　兵庫県知事“出直し出馬”の斎藤元彦氏を糾弾「選挙に出てはならなかった」　維新を「製造責任者」と追及も,102,https://news.yahoo.co.jp/articles/94dba8092b79b5bfd5f76cd5308624846602514c,11/10(日) 18:13
2024-11-11,07:06,domestic,国内,8「マスコミもまた衆院選の敗者なのではないか」　政治部デスクの反省デイリー新潮11/11(月) 6:0084件/時,デイリー新潮,「マスコミもまた衆院選の敗者なのではないか」　政治部デスクの反省,84,https://news.yahoo.co.jp/articles/92300acf3eca51f7c661c4ab93163046183dc9ae,11/11(月) 6:00
2024-11-11,07:06,domestic,国内,9維新代表、政権への協力拒否　「是々非々横に置く」　特別国会11日召集時事通信11/10(日) 16:2181件/時,時事通信,維新代表、政権への協力拒否　「是々非々横に置く」　特別国会11日召集,81,https://news.yahoo.co.jp/articles/562221e761846df05b59f7c5adca58293f6e61bd,11/10(日) 16:21
2024-11-11,07:06,domestic,国内,10米ディズニー、約7万円の「新パス」導入で物議“夢の国”は富裕層のもの？「経済学的には正しい」「子どもが行けないと価値が下がる」ABEMA TIMES11/10(日) 12:0274件/時,ABEMA TIMES,米ディズニー、約7万円の「新パス」導入で物議“夢の国”は富裕層のもの？「経済学的には正しい」「子どもが行けないと価値が下がる」,74,https://news.yahoo.co.jp/articles/f265a2b978c1aa031a150713c8d17190b4c8d874,11/10(日) 12:02
2024-11-11,07:06,domestic,国内,11「サンジャポ」岸博幸氏が怒り「１０６万の壁」→「厚労省の悪乗り、マジで怒るべき」　「１０３万の壁」とは逆、収入増吹っ飛ぶ「ざっくり１０万円負担増」とデイリースポーツ11/10(日) 11:5172件/時,デイリースポーツ,「サンジャポ」岸博幸氏が怒り「１０６万の壁」→「厚労省の悪乗り、マジで怒るべき」　「１０３万の壁」とは逆、収入増吹っ飛ぶ「ざっくり１０万円負担増」と,72,https://news.yahoo.co.jp/articles/215834f12a3c0807d22636163cbadb4b722907f5,11/10(日) 11:51
2024-11-11,07:06,domestic,国内,12「１０６万の壁」ＴＶ３万人アンケで７割賛成の意外結果　「１０３万」と逆の負担増だが　自民政調会長でも懸念「本当に年金増えるか？」雇用やめるかもとデイリースポーツ11/10(日) 16:4570件/時,デイリースポーツ,「１０６万の壁」ＴＶ３万人アンケで７割賛成の意外結果　「１０３万」と逆の負担増だが　自民政調会長でも懸念「本当に年金増えるか？」雇用やめるかもと,70,https://news.yahoo.co.jp/articles/95a6266caef11147b76796d950fc1786cc82716f,11/10(日) 16:45
2024-11-11,07:06,domestic,国内,131:04「みんなヘトヘト」瀬戸大橋で走行中の列車が“立ち往生”約150人が車内に6時間…別の列車に乗り換え出発　架線切断の影響FNNプライムオンライン（フジテレビ系）11/10(日) 17:5554件/時,FNNプライムオンライン（フジテレビ系）,「みんなヘトヘト」瀬戸大橋で走行中の列車が“立ち往生”約150人が車内に6時間…別の列車に乗り換え出発　架線切断の影響,54,https://news.yahoo.co.jp/articles/98cb5cf78f2fb706013874a39a24a0c82d9f32ac,11/10(日) 17:55
2024-11-11,07:06,domestic,国内,14「30超えたら子宮摘出」発言の百田尚樹氏が謝罪「表現のドギツさ否めない」SFと前置きも炎上日刊スポーツ11/10(日) 13:3251件/時,日刊スポーツ,「30超えたら子宮摘出」発言の百田尚樹氏が謝罪「表現のドギツさ否めない」SFと前置きも炎上,51,https://news.yahoo.co.jp/articles/e14f5aa9e443e84d95991c1429c1e9e95c1b7a4a,11/10(日) 13:32
2024-11-11,07:06,domestic,国内,15「30超えたら子宮摘出」　日本保守党・百田代表が発言撤回、謝罪TBS NEWS DIG Powered by JNN11/10(日) 18:4847件/時,TBS NEWS DIG Powered by JNN,「30超えたら子宮摘出」　日本保守党・百田代表が発言撤回、謝罪,47,https://news.yahoo.co.jp/articles/b85bb03a2578174ee975c8bdbd69581d9fb90486,11/10(日) 18:48
2024-11-11,07:06,domestic,国内,16斎藤元彦氏　兵庫県知事選投開票まであと1週間　手応え問われ「まだ厳しいことに変わりありません」スポニチアネックス11/10(日) 16:5645件/時,スポニチアネックス,斎藤元彦氏　兵庫県知事選投開票まであと1週間　手応え問われ「まだ厳しいことに変わりありません」,45,https://news.yahoo.co.jp/articles/500fec5bf77c1276ee7bf565d49016b3169da15a,11/10(日) 16:56
2024-11-11,07:06,domestic,国内,17列車内でボディービル披露　JR山陰線をPR、山口共同通信11/10(日) 17:1745件/時,共同通信,列車内でボディービル披露　JR山陰線をPR、山口,45,https://news.yahoo.co.jp/articles/544bc76f717f57c7c0aae6053e48b909fd7b4bf2,11/10(日) 17:17
2024-11-11,07:06,domestic,国内,18日本保守党・百田尚樹代表が少子化対策で過激発言　批判続出に「私の表現のドギツさは否めない」J-CASTニュース11/10(日) 11:1544件/時,J-CASTニュース,日本保守党・百田尚樹代表が少子化対策で過激発言　批判続出に「私の表現のドギツさは否めない」,44,https://news.yahoo.co.jp/articles/a3a81c87b36cd658017f841bab4f8a5c17183f4a,11/10(日) 11:15
2024-11-11,07:06,domestic,国内,19カマラ・ハリス陣営にガガ、ビヨンセら「大金持ち」続々→敗北　安藤優子氏も「あれは逆効果でしたね」　テイラー・スウィフト影響絶大説もデイリースポーツ11/10(日) 10:4341件/時,デイリースポーツ,カマラ・ハリス陣営にガガ、ビヨンセら「大金持ち」続々→敗北　安藤優子氏も「あれは逆効果でしたね」　テイラー・スウィフト影響絶大説も,41,https://news.yahoo.co.jp/articles/d92f649d328897b337aa9117012bc7bb71cc4630,11/10(日) 10:43
2024-11-11,07:06,domestic,国内,20「30超えたら子宮摘出」百田尚樹氏、発言撤回「表現が下品で、不快な気持ちにさせてしまった」日刊スポーツ11/10(日) 21:1737件/時,日刊スポーツ,「30超えたら子宮摘出」百田尚樹氏、発言撤回「表現が下品で、不快な気持ちにさせてしまった」,37,https://news.yahoo.co.jp/articles/1c121724592851754c62fda0280eb06ff49521b0,11/10(日) 21:17
2024-11-11,07:06,domestic,国内,21百田尚樹氏が「子宮摘出」発言を「撤回し謝罪」スポニチアネックス11/11(月) 4:4334件/時,スポニチアネックス,百田尚樹氏が「子宮摘出」発言を「撤回し謝罪」,34,https://news.yahoo.co.jp/articles/ab8092445cad5d8cc038bd9c2d6431727b5a8b8e,11/11(月) 4:43
2024-11-11,07:06,domestic,国内,22兵庫県知事選　ラストサンデー　各陣営、大票田で声枯らす産経新聞11/10(日) 18:4133件/時,産経新聞,兵庫県知事選　ラストサンデー　各陣営、大票田で声枯らす,33,https://news.yahoo.co.jp/articles/e413f97ced77f66acc6ef5b41d5c5e722c5619fe,11/10(日) 18:41
2024-11-11,07:06,domestic,国内,23事故で意識不明だった男児死亡　名古屋、クレーン車と車が衝突共同通信11/10(日) 21:5833件/時,共同通信,事故で意識不明だった男児死亡　名古屋、クレーン車と車が衝突,33,https://news.yahoo.co.jp/articles/45562977bb88fad40fd0052738cfec181d9f08a5,11/10(日) 21:58
2024-11-11,07:06,domestic,国内,24有働由美子アナが国民・玉木代表に生直撃「これなら自民党と連立組んで大臣ポスト取って…」日刊スポーツ11/10(日) 22:1932件/時,日刊スポーツ,有働由美子アナが国民・玉木代表に生直撃「これなら自民党と連立組んで大臣ポスト取って…」,32,https://news.yahoo.co.jp/articles/db5dd1c60d8ce8263f88e190a8d03bc2967021a2,11/10(日) 22:19
2024-11-11,07:06,domestic,国内,25東京・三鷹の強盗未遂事件 新たに2人逮捕ABEMA TIMES11/10(日) 18:4231件/時,ABEMA TIMES,東京・三鷹の強盗未遂事件 新たに2人逮捕,31,https://news.yahoo.co.jp/articles/16bb50380517b2a517f2cbdcab608d2d32692a43,11/10(日) 18:42
2024-11-11,07:06,domestic,国内,26松本人志さん訴訟取り下げ「ワイドナショー」は触れず　Xは「テレビに出すな」「テレビで見たい」で激論J-CASTニュース11/10(日) 19:4729件/時,J-CASTニュース,松本人志さん訴訟取り下げ「ワイドナショー」は触れず　Xは「テレビに出すな」「テレビで見たい」で激論,29,https://news.yahoo.co.jp/articles/5ac59214e4ada2b16893440d825e08af7fb7f46a,11/10(日) 19:47
2024-11-11,07:06,domestic,国内,27LUUPへ賛否相次ぐ 「新しいものにすぐ反対」はユニコーン企業が生まれない日本の空気感？ 海外経営者「日本で叩かれることが海外では褒められる」ABEMA TIMES11/10(日) 7:3228件/時,ABEMA TIMES,LUUPへ賛否相次ぐ 「新しいものにすぐ反対」はユニコーン企業が生まれない日本の空気感？ 海外経営者「日本で叩かれることが海外では褒められる」,28,https://news.yahoo.co.jp/articles/16f7f115af53d807554b223e42d7f826e46f06a9,11/10(日) 7:32
2024-11-11,07:06,domestic,国内,28石破自民　国民民主の壁に悩む　11日特別国会　首相選出見通しも…年収「103万円の壁」見直し議論スポニチアネックス11/11(月) 4:4027件/時,スポニチアネックス,石破自民　国民民主の壁に悩む　11日特別国会　首相選出見通しも…年収「103万円の壁」見直し議論,27,https://news.yahoo.co.jp/articles/4ed11dfad833009ac59856893b274cd26bb08e78,11/11(月) 4:40
2024-11-11,07:06,domestic,国内,29不動産の専門家が「タワーマンション」への批判を「買えない人による負け犬の遠吠え」だと断言する訳FRIDAY11/10(日) 14:0026件/時,FRIDAY,不動産の専門家が「タワーマンション」への批判を「買えない人による負け犬の遠吠え」だと断言する訳,26,https://news.yahoo.co.jp/articles/bf1e29c549a1f18e41f7006716b16abb892e1a93,11/10(日) 14:00
2024-11-11,07:06,domestic,国内,30このままでは国民皆保険が壊れていく…金子勝「マイナ保険証は政治献金企業が儲かる究極の寄生システム」プレジデントオンライン11/10(日) 8:1725件/時,プレジデントオンライン,このままでは国民皆保険が壊れていく…金子勝「マイナ保険証は政治献金企業が儲かる究極の寄生システム」,25,https://news.yahoo.co.jp/articles/94edaa994705dd4e134c8e8d8172177c1421e1ad,11/10(日) 8:17
2024-11-11,07:06,domestic,国内,31なぜ1歳の娘まで…不倫相手の家から帰宅後に妻と娘を殺害した男が法廷で語った身勝手な動機「娘の顔が妻の顔に見え…」FNNプライムオンライン11/10(日) 11:0224件/時,FNNプライムオンライン,なぜ1歳の娘まで…不倫相手の家から帰宅後に妻と娘を殺害した男が法廷で語った身勝手な動機「娘の顔が妻の顔に見え…」,24,https://news.yahoo.co.jp/articles/ca784a39636a7475f9c329d667c38ffc1c4312d2,11/10(日) 11:02
2024-11-11,07:06,domestic,国内,320:40クレーン車と乗用車が衝突し男児が意識不明　乗用車が車線はみ出したか　名古屋メ〜テレ（名古屋テレビ）11/10(日) 21:5723件/時,メ〜テレ（名古屋テレビ）,クレーン車と乗用車が衝突し男児が意識不明　乗用車が車線はみ出したか　名古屋,23,https://news.yahoo.co.jp/articles/931098866d2471b3d0b947f54453be2950e4d866,11/10(日) 21:57
2024-11-11,07:06,domestic,国内,331:18パトカーに追跡されたあと、自転車をはね逃走、乗用車とも衝突…運転していた男は酒気帯び運転の疑いで警視庁が現行犯逮捕TBS NEWS DIG Powered by JNN11/10(日) 18:3522件/時,TBS NEWS DIG Powered by JNN,パトカーに追跡されたあと、自転車をはね逃走、乗用車とも衝突…運転していた男は酒気帯び運転の疑いで警視庁が現行犯逮捕,22,https://news.yahoo.co.jp/articles/eeacea9eba33fc767672c2f34d195e9aad937177,11/10(日) 18:35
2024-11-11,07:06,domestic,国内,34「ワイドナショー」安藤優子さん、米大統領選で圧勝のトランプ氏に私見「異様な空気感を作る特殊能力をお持ち」スポーツ報知11/10(日) 11:1421件/時,スポーツ報知,「ワイドナショー」安藤優子さん、米大統領選で圧勝のトランプ氏に私見「異様な空気感を作る特殊能力をお持ち」,21,https://news.yahoo.co.jp/articles/02448cd27905a83e17e7971211d7e310b54e957c,11/10(日) 11:14
2024-11-11,07:06,domestic,国内,35「30超えたら子宮摘出」日本保守党・百田尚樹代表が発言を撤回し謝罪「表現どぎつかった。SFで私の主張ではない」FNNプライムオンライン（フジテレビ系）11/10(日) 18:2521件/時,FNNプライムオンライン（フジテレビ系）,「30超えたら子宮摘出」日本保守党・百田尚樹代表が発言を撤回し謝罪「表現どぎつかった。SFで私の主張ではない」,21,https://news.yahoo.co.jp/articles/e1167016497305eca367da49a078861fef6b0e72,11/10(日) 18:25
2024-11-11,07:06,domestic,国内,36石破総理はトランプ氏と同じクリスチャン 舛添要一氏「二人はプロテスタントでカルヴァン主義」「宗教という“心”が通じ合えばゴルフどころの話ではない」ABEMA TIMES11/10(日) 17:4221件/時,ABEMA TIMES,石破総理はトランプ氏と同じクリスチャン 舛添要一氏「二人はプロテスタントでカルヴァン主義」「宗教という“心”が通じ合えばゴルフどころの話ではない」,21,https://news.yahoo.co.jp/articles/67ad66c2c80c1deeed1e718e616bff9715954a9a,11/10(日) 17:42
2024-11-11,07:06,domestic,国内,37国内初「恐竜学部」は何を学べるの？　入試倍率10倍、学部長「就職先は引く手あまた」高校生新聞オンライン11/10(日) 18:0020件/時,高校生新聞オンライン,国内初「恐竜学部」は何を学べるの？　入試倍率10倍、学部長「就職先は引く手あまた」,20,https://news.yahoo.co.jp/articles/dad5ce92529bcd4fd315ed3dbdd87d451da95154,11/10(日) 18:00
2024-11-11,07:06,domestic,国内,"381:20「無理しすぎてない？」 同僚の女性教師を心配しすぎたか？  51歳男性教師が下駄箱に""無記名""の栄養ドリンクを3回入れる…さらに""気遣う""メッセージを2回送信　不快にさせたとして""戒告""処分に　北海道教育委員会北海道ニュースUHB11/10(日) 13:3019件/時",北海道ニュースUHB,"「無理しすぎてない？」 同僚の女性教師を心配しすぎたか？  51歳男性教師が下駄箱に""無記名""の栄養ドリンクを3回入れる…さらに""気遣う""メッセージを2回送信　不快にさせたとして""戒告""処分に　北海道教育委員会",19,https://news.yahoo.co.jp/articles/5258f8a02d7f7c6c6d803b02d2901a4efed1a2c6,11/10(日) 13:30
2024-11-11,07:06,domestic,国内,391:05政治とカネ「けじめついていない」87％ ANN世論調査テレビ朝日系（ANN）11/11(月) 6:1518件/時,テレビ朝日系（ANN）,政治とカネ「けじめついていない」87％ ANN世論調査,18,https://news.yahoo.co.jp/articles/55930eed13d0c30ff3d6224e8cecee05195be05d,11/11(月) 6:15
2024-11-11,07:06,domestic,国内,40「負け組」を経験した母親が苦しむ「課金地獄」の正体…受験戦争がもたらす「厳しい現実」現代ビジネス11/11(月) 6:0918件/時,現代ビジネス,「負け組」を経験した母親が苦しむ「課金地獄」の正体…受験戦争がもたらす「厳しい現実」,18,https://news.yahoo.co.jp/articles/3369014f8e2b9c1dded94cd53a9856ea56205dfc,11/11(月) 6:09
