scrp_date,scrp_time,genre_en,genre_jp,rank,media_jp,title,comment,link,date_original
2025-02-10,12:11,domestic,国内,1,デイリー新潮,スーパーのコメが「5キロで5000円」の異常事態に…「新米が出回ればコメ問題は解決」と繰り返してきた「農水省」に批判殺到,696,https://news.yahoo.co.jp/articles/b207df0b7811cab30f73ccae9d6f31a301d0bd80,2/10(月) 6:12
2025-02-10,12:11,domestic,国内,2,よろず～ニュース,石破・トランプ会談を酷評　京大教授、対米150兆円投資は「保身」「売国」,213,https://news.yahoo.co.jp/articles/89c07a33ab2c3d990864a69cfb9fb87522c068a6,2/10(月) 7:50
2025-02-10,12:11,domestic,国内,3,ABEMA TIMES,山手線内回り 京浜東北線の線路利用で運転再開,179,https://news.yahoo.co.jp/articles/3495d222b014863001bef220a927a69fb2b1c6ab,2/10(月) 10:16
2025-02-10,12:11,domestic,国内,4,現代ビジネス,台湾人気女優の「訪日客死」で中国SNSが大炎上…「日本は超アブナイ国！」,168,https://news.yahoo.co.jp/articles/e7440f6514e26096aec9219743a580261d853333,2/10(月) 7:01
2025-02-10,12:11,domestic,国内,5,プレジデントオンライン,フジ以上の「マスゴミぶり」を晒しただけ…会見に群がる「自意識過剰のクレーマー記者」は次はどこを荒らすのか,161,https://news.yahoo.co.jp/articles/e31bf94570f27c2f9049ac9522dd14bb0c386551,2/10(月) 7:17
2025-02-10,12:11,domestic,国内,6,CNN.co.jp,映画「Ｌｏｖｅ　Ｌｅｔｔｅｒ」ロケ地の小樽市、観光客殺到でオーバーツーリズム深刻化,124,https://news.yahoo.co.jp/articles/a951088da81f8e118aefc0bef553be5a33bbcb9c,2/9(日) 17:00
2025-02-10,12:11,domestic,国内,7,集英社オンライン,〈多産DVの恐怖〉「お腹に子どもがいれば他の男は見向きもしない」と妊娠させられた女性、避妊具なしのムリヤリの性交渉で意思を奪われ…,111,https://news.yahoo.co.jp/articles/93a22bcca37581ad13c5c7ed3c6a4d2a8505a59c,2/9(日) 14:01
2025-02-10,12:11,domestic,国内,8,テレビ朝日系（ANN）,【速報】山手線内回り　京浜東北線の線路使い午前10時すぎに運転再開　JR東日本,92,https://news.yahoo.co.jp/articles/6764a3c937a71d209219b157dc9ee134b5879dfd,2/10(月) 10:08
2025-02-10,12:11,domestic,国内,9,読売新聞オンライン,陥没した穴で運転手の捜索、３０分で終了…手がかり見つからず,85,https://news.yahoo.co.jp/articles/be2a9772f76aa26a356ae57c7a07051c3023695e,2/9(日) 13:06
2025-02-10,12:11,domestic,国内,10,デイリー新潮,香川県ではついに「人」もうどんに…？　“うどん入浴剤”を発売した道の駅の挑戦,83,https://news.yahoo.co.jp/articles/82baf75083d2c038feb7169d7c52aeea81e1150d,2/10(月) 11:10
2025-02-10,12:11,domestic,国内,11,テレビ朝日系（ANN）,JR山手線内回りで運転見合わせ　信号トラブル　浜松町・新橋間で信号切り替わらず,83,https://news.yahoo.co.jp/articles/4bd29b606ddb5e221af16ecb30e29a765761756c,2/10(月) 8:13
2025-02-10,12:11,domestic,国内,12,デイリー新潮,コメ高騰で「台湾米」と「カルフォルニア米」が大人気という皮肉…備蓄米の放出が“効果薄”なら消費者の失望を買う結果に,71,https://news.yahoo.co.jp/articles/99f98e9781c5acb76b9eac4801e361a5b2fbcf94,2/10(月) 6:13
2025-02-10,12:11,domestic,国内,13,FRIDAY,女性派遣した風俗店数350…！悪質スカウトグループ幹部「５年間で70億円受け取り」狡猾な隠蔽手口,69,https://news.yahoo.co.jp/articles/0e1e40fbba0bf075f8618c079c21180ad106e74b,2/10(月) 11:00
2025-02-10,12:11,domestic,国内,14,スポニチアネックス,泉房穂氏　「食料品の消費税ゼロ」に向け「反対する政治家は落選させればいいだけだ。必ず法案を可決し…」,69,https://news.yahoo.co.jp/articles/a3ce572993c38d22bbde436ee9d18f12f362b0e5,2/10(月) 7:42
2025-02-10,12:11,domestic,国内,15,集英社オンライン,「365日のうち360日は万引きしてた」35歳から２年間“万引きファースト”だったクレプトマニア(窃盗症)が明かす驚愕の日々,66,https://news.yahoo.co.jp/articles/8752945a95bb0812aa0c69557f855b82cc0ec550,2/9(日) 15:02
2025-02-10,12:11,domestic,国内,16,フジテレビドキュメンタリー,「キッチンカーで稼ぎたい」成功の夢見る若者たちーー25歳が味わった甘くない現実と苦悩 #ザ・ノンフィクション #ydocs,62,https://news.yahoo.co.jp/articles/2566a938287972d0c7999bce744ddb61d45039b2,2/9(日) 14:00
2025-02-10,12:11,domestic,国内,17,日刊スポーツ,風間晋氏「期待値が低かったから結果を見て評価が高くなった」石破氏とトランプ氏の首脳会談,56,https://news.yahoo.co.jp/articles/a938cea2d5f395eabbd0cd2e8c6e9f6d38805237,2/10(月) 10:36
2025-02-10,12:11,domestic,国内,18,J-CASTニュース,鹿児島大の研究室「こんな形で名指しやめて」とインフルエンサーに抗議　Xで舌戦、外野からは殺害予告まで【追記あり】,47,https://news.yahoo.co.jp/articles/1bf83b2ca86362e5eefdb330751f68ead3489eed,2/9(日) 18:10
2025-02-10,12:11,domestic,国内,19,日刊スポーツ,若狭勝弁護士「ＰＲ会社社長が供述に協力的かどうかで行方が変わる」兵庫県知事選公選法違反疑惑,43,https://news.yahoo.co.jp/articles/de0065bff6fb65a3ac4569b897cefc6a4a3ddcf0,2/10(月) 10:09
2025-02-10,12:11,domestic,国内,20,FRIDAY,ガイドが訪日客を連れて来店するほど盛況…全国で初めて摘発された”インバウンド向け風俗”驚きの実態,41,https://news.yahoo.co.jp/articles/b9dec28a502a51f5c1ec9f51ce1ce69a777a7eb7,2/10(月) 11:00
2025-02-10,12:11,domestic,国内,21,日刊スポーツ,石原良純、なごやか石破＆トランプ会談に私見「逆に世界での日本の地盤沈下みたいなものを…」,38,https://news.yahoo.co.jp/articles/683fe6a21db79c58dbaddc7b58a57342e63083bb,2/10(月) 10:09
2025-02-10,12:11,domestic,国内,22,TBS NEWS DIG Powered by JNN,少数与党の国会　予算案に無駄?立憲民主は政府基金、約7.8兆円が「積み過ぎ」と試算【サンデーモーニング】,34,https://news.yahoo.co.jp/articles/469769ffd1c3bbd32f26e6d62992dc52a7d2cb21,2/9(日) 13:46
2025-02-10,12:11,domestic,国内,23,ABEMA TIMES,奈良は人が泊まらない！県議も「PRベタ」と嘆く宿泊者数・全国44位の現状どうする？“奈良LOVE”安藤美姫は「星空きれい」,32,https://news.yahoo.co.jp/articles/e6b9274dd95eb67ef56f7a7d9fe1d289e3d39cc0,2/10(月) 11:02
2025-02-10,12:11,domestic,国内,24,TBS NEWS DIG Powered by JNN,行方不明のトラック運転手について、穴の中での捜索を断念、別の箇所から下水道管の中を捜索へ　埼玉・八潮市の道路陥没事故,32,https://news.yahoo.co.jp/articles/04a495a387fbf8383821230c1225342b5d7692a0,2/10(月) 5:52
2025-02-10,12:11,domestic,国内,25,文春オンライン,胸部には電気コード、女の子の足首には9kgのダンベル…想像を絶する犯行で一家4人を殺害した中国人元死刑囚の正体,32,https://news.yahoo.co.jp/articles/0039650ce8e465182578496ebc1c1dd10a46fc41,2/10(月) 6:12
2025-02-10,12:11,domestic,国内,26,文春オンライン,〈“修羅の国”の二十歳〉「後期高齢者が優遇されすぎ」「金を稼ぎたい」…北九州で聞いた若者たちの“意外な将来観”とは,31,https://news.yahoo.co.jp/articles/8cb9d15ce7a0269d6efa3fd16fb4cad117a3dbf6,2/10(月) 11:12
2025-02-10,12:11,domestic,国内,27,時事通信,下水道管内の捜索検討　硫化水素など課題も　埼玉道路陥没,31,https://news.yahoo.co.jp/articles/be490fa9dd8ea1209417ec4c62e26aed9f3698ab,2/9(日) 20:02
2025-02-10,12:11,domestic,国内,28,ダイヤモンド・オンライン,「加齢臭！くせー！」「土下座すれば良いですかー？すいませーん」受験のストレスを教師にぶつける小学生の闇,31,https://news.yahoo.co.jp/articles/d10a384913b7f134138a0e6b8dfa4b140fbcb8a9,2/10(月) 6:32
2025-02-10,12:11,domestic,国内,29,テレビ朝日系（ANN）,“落選”二階氏の三男・伸康氏　参院選擁立へ,30,https://news.yahoo.co.jp/articles/004fb9b8fc4a2a1604e70c3165e702deb58f330b,2/10(月) 8:49
2025-02-10,12:11,domestic,国内,30,FRIDAY,【スーツと人間ドック代に100万円超】国民民主の新人議員が公開した「旧文通費」信じられない使途,28,https://news.yahoo.co.jp/articles/35edc0be38d9a1ddd7f254384b10e98110801bc2,2/10(月) 7:00
2025-02-10,12:11,domestic,国内,31,週刊金曜日,8党派女性議員の勉強会実施　選択的夫婦別姓とクオータ制実現向け超党派協力なるか,26,https://news.yahoo.co.jp/articles/f4582bf3b69217852247dd1d345836387d30d69b,2/10(月) 11:10
2025-02-10,12:11,domestic,国内,32,集英社オンライン,「反省しろ！」と雪まつり運営サイドをアイドルファンが批判、無料イベント突然の中止は行き過ぎた迷惑行為か,26,https://news.yahoo.co.jp/articles/062bfc3b2c1e8067b02d015ece5030e39a0965dc,2/9(日) 13:02
2025-02-10,12:11,domestic,国内,33,ダイヤモンド・オンライン,美智子さま巡る週刊誌「皇室論争」で、上皇陛下がとった「前代未聞の一手」とは？,26,https://news.yahoo.co.jp/articles/86d0d639282b52dcadcb0c4f8c609f0fc2050b86,2/10(月) 6:02
2025-02-10,12:11,domestic,国内,34,スポニチアネックス,「山手線内回り」トレンド入り　全線運転見合わせにネット「受験生、大丈夫？」「えっ右回り？左回り？」,25,https://news.yahoo.co.jp/articles/74b2ce85db0e6dec19fa8d59e33b8961b30c6796,2/10(月) 8:52
2025-02-10,12:11,domestic,国内,35,FRIDAY,【ビジホが一泊３万円】札幌市の「深刻なホテル不足＆宿泊費高騰」が改善されない「根本的な理由」,23,https://news.yahoo.co.jp/articles/b33c3b25d5c4eaad79a9ad805bb4fb7bb40550f8,2/10(月) 11:00
2025-02-10,12:11,domestic,国内,36,テレビ朝日系（ANN）,“最強＆最長”寒波で死者も　積雪3m超えで除雪車フル稼働も予算不足が深刻化,23,https://news.yahoo.co.jp/articles/b1d738cc381e6b5c209f4fc3c3cb086428b69343,2/9(日) 23:30
2025-02-10,12:11,domestic,国内,37,共同通信,16歳長男に懲役10～15年求刑,22,https://news.yahoo.co.jp/articles/b57aba8f8821a00dc9a2eec28ce68bac906cac64,2/10(月) 11:20
2025-02-10,12:11,domestic,国内,38,東洋経済オンライン,「最安2万円から、高くても3万8千円」「階段はほぼハシゴ、窓もない」…。西成で「家賃2万7千円」ほぼ廃墟ハウスに住んだ結果,21,https://news.yahoo.co.jp/articles/42fd3f40a7931797c91006628139419550feea17,2/10(月) 6:32
2025-02-10,12:11,domestic,国内,39,読売新聞オンライン,スキー中の韓国籍女性がコース脇の立ち木に衝突して死亡…北海道・ルスツリゾート,21,https://news.yahoo.co.jp/articles/5921a360bf5fb625ce05791267eba04d91b225e5,2/10(月) 9:52
2025-02-10,12:11,domestic,国内,40,読売新聞オンライン,沖縄県浦添市長選挙、松本哲治氏４選…玉城デニー知事を支える「オール沖縄」勢力は事実上の不戦敗,21,https://news.yahoo.co.jp/articles/23b9728dc11a4dc90f27b585b75265282257fa87,2/9(日) 23:10
