scrp_date,scrp_time,genre_en,genre_jp,rank,media_jp,title,comment,link,date_original
2024-11-14,11:29,world,国際,11:5035人死亡の車暴走事件に神経をとがらせる中国当局、市民が供えた花やろうそくを撤去ロイター11/14(木) 10:22162件/時,ロイター,35人死亡の車暴走事件に神経をとがらせる中国当局、市民が供えた花やろうそくを撤去,162,https://news.yahoo.co.jp/articles/f19c48e6ac2ae40d6535099634e2ca254b7dc41d,11/14(木) 10:22
2024-11-14,11:29,world,国際,2【独自】「日本人宿泊お断り」中国・ホテルの“宿泊拒否”動画が拡散…称賛の祝花が届く一方で「ヘイト教育とプロパガンダの結果」と否定的意見もFNNプライムオンライン11/14(木) 7:13113件/時,FNNプライムオンライン,【独自】「日本人宿泊お断り」中国・ホテルの“宿泊拒否”動画が拡散…称賛の祝花が届く一方で「ヘイト教育とプロパガンダの結果」と否定的意見も,113,https://news.yahoo.co.jp/articles/d4c0b00ab9e65de4e4b62f174ec6e6e255966ad6,11/14(木) 7:13
2024-11-14,11:29,world,国際,3米共和党「トリプルレッド」達成　大統領職と上下両院握る共同通信11/14(木) 6:2174件/時,共同通信,米共和党「トリプルレッド」達成　大統領職と上下両院握る,74,https://news.yahoo.co.jp/articles/25b22d31118ec3ad66c8bafe70b552b06fe1caa3,11/14(木) 6:21
2024-11-14,11:29,world,国際,4中国富裕層の日本移住が増える訳......日本の医療制度を利用するため彼らはやって来るニューズウィーク日本版11/14(木) 8:3064件/時,ニューズウィーク日本版,中国富裕層の日本移住が増える訳......日本の医療制度を利用するため彼らはやって来る,64,https://news.yahoo.co.jp/articles/009247a7d7bbc682dc016031eb67c88e7487276f,11/14(木) 8:30
2024-11-14,11:29,world,国際,51:32バイデン大統領とトランプ氏が政権移行に向け協議日テレNEWS NNN11/14(木) 5:4849件/時,日テレNEWS NNN,バイデン大統領とトランプ氏が政権移行に向け協議,49,https://news.yahoo.co.jp/articles/64e80a656933b56fd2d2a7556431d4bfa06d8cd9,11/14(木) 5:48
2024-11-14,11:29,world,国際,60:34車暴走事件も「中国は世界で最も安全」テレビ朝日系（ANN）11/14(木) 9:3747件/時,テレビ朝日系（ANN）,車暴走事件も「中国は世界で最も安全」,47,https://news.yahoo.co.jp/articles/356935b7fe4a983b592db4e459657a183b42cbdf,11/14(木) 9:37
2024-11-14,11:29,world,国際,7トランプ氏、軍幹部の粛清検討　私物化に懸念も　米報道時事通信11/13(水) 15:0140件/時,時事通信,トランプ氏、軍幹部の粛清検討　私物化に懸念も　米報道,40,https://news.yahoo.co.jp/articles/fe62ef3e7b7623017a86148e57c7feb52389bdcb,11/13(水) 15:01
2024-11-14,11:29,world,国際,8ゼレンスキー氏のオルバン氏への怒り　「子供が死に、家が壊されること分かっているか」　パリの窓産経新聞11/14(木) 7:3040件/時,産経新聞,ゼレンスキー氏のオルバン氏への怒り　「子供が死に、家が壊されること分かっているか」　パリの窓,40,https://news.yahoo.co.jp/articles/ebdea0f4eacad0213bb4677cd08df019f48fc424,11/14(木) 7:30
2024-11-14,11:29,world,国際,9ロシア、キーウにミサイル攻撃　8月以来初めてロイター11/13(水) 17:1437件/時,ロイター,ロシア、キーウにミサイル攻撃　8月以来初めて,37,https://news.yahoo.co.jp/articles/07e7ba2e39138c203436ceecb96657712492421d,11/13(水) 17:14
2024-11-14,11:29,world,国際,10トランプ氏、国防長官にＴＶ司会者ヘグセス氏指名へ　ＮＡＴＯに懐疑的ロイター11/13(水) 9:2424件/時,ロイター,トランプ氏、国防長官にＴＶ司会者ヘグセス氏指名へ　ＮＡＴＯに懐疑的,24,https://news.yahoo.co.jp/articles/9eef58bdf69159eb2319a3b4c465403ebe27b334,11/13(水) 9:24
2024-11-14,11:29,world,国際,11経済版「2プラス2」新設へ　米保護主義対抗で連携　日英時事通信11/13(水) 22:5023件/時,時事通信,経済版「2プラス2」新設へ　米保護主義対抗で連携　日英,23,https://news.yahoo.co.jp/articles/beff3e140984a2a8ca087ba2fa450507c471cf74,11/13(水) 22:50
2024-11-14,11:29,world,国際,12クルスク州でロ軍が車両30両超で連続突撃、ウクライナ軍第47旅団が10両撃破し撃退Forbes JAPAN11/14(木) 9:3022件/時,Forbes JAPAN,クルスク州でロ軍が車両30両超で連続突撃、ウクライナ軍第47旅団が10両撃破し撃退,22,https://news.yahoo.co.jp/articles/1e1ba8b26ca6fca903494cc784731fb1b99c83e9,11/14(木) 9:30
2024-11-14,11:29,world,国際,13トランプが《性格反対》の石破に心を開く「たった一つの可能性」…！ゴルフよりも重要視されている「2人の意外な共通点」現代ビジネス11/14(木) 6:3422件/時,現代ビジネス,トランプが《性格反対》の石破に心を開く「たった一つの可能性」…！ゴルフよりも重要視されている「2人の意外な共通点」,22,https://news.yahoo.co.jp/articles/36853166bee492540e78905d938ed71859cba781,11/14(木) 6:34
2024-11-14,11:29,world,国際,14韓国の慰安婦団体前代表、有罪確定共同通信11/14(木) 10:4420件/時,共同通信,韓国の慰安婦団体前代表、有罪確定,20,https://news.yahoo.co.jp/articles/f4639cf9bc175c8b1805590ca4539bfef0ccd2e8,11/14(木) 10:44
2024-11-14,11:29,world,国際,15韓国のどじょう汁のドジョウ、塩で殺さないで…世界的倫理学者の呼びかけハンギョレ新聞11/14(木) 9:3920件/時,ハンギョレ新聞,韓国のどじょう汁のドジョウ、塩で殺さないで…世界的倫理学者の呼びかけ,20,https://news.yahoo.co.jp/articles/44bc442ff33a1029ceb67fc7c24c1f4714a98d48,11/14(木) 9:39
2024-11-14,11:29,world,国際,16指導者の資質欠いたハリス氏　三権分立が空洞化するトランプ2.0　中岡望サンデー毎日×週刊エコノミストOnline11/14(木) 10:1919件/時,サンデー毎日×週刊エコノミストOnline,指導者の資質欠いたハリス氏　三権分立が空洞化するトランプ2.0　中岡望,19,https://news.yahoo.co.jp/articles/87538b735393f8b3d54c4c5fea62702ade661b52,11/14(木) 10:19
2024-11-14,11:29,world,国際,17文前大統領 「国際情勢の急変…対決主義の北朝鮮政策変えなければ韓国が排除される」ハンギョレ新聞11/14(木) 10:3918件/時,ハンギョレ新聞,文前大統領 「国際情勢の急変…対決主義の北朝鮮政策変えなければ韓国が排除される」,18,https://news.yahoo.co.jp/articles/d418bfbdf8dce5354b64a4521f4b13047f2fc943,11/14(木) 10:39
2024-11-14,11:29,world,国際,18マスク氏、NATO高官を「オーウェル的」と批判 小説「1984年」に言及ＡＦＰ＝時事11/14(木) 10:5818件/時,ＡＦＰ＝時事,マスク氏、NATO高官を「オーウェル的」と批判 小説「1984年」に言及,18,https://news.yahoo.co.jp/articles/02f8395c7dbaa8be0ddd8cca91b5bff929c00a3b,11/14(木) 10:58
2024-11-14,11:29,world,国際,19注文はコーヒー40杯＆パン類40個、配達員2人…「12杯とパン類すべて」と「28杯」に分けて激怒された韓国の店KOREA WAVE11/14(木) 7:0317件/時,KOREA WAVE,注文はコーヒー40杯＆パン類40個、配達員2人…「12杯とパン類すべて」と「28杯」に分けて激怒された韓国の店,17,https://news.yahoo.co.jp/articles/2fe0145ec8155d8583c4762d9d5ac8e3e5267481,11/14(木) 7:03
2024-11-14,11:29,world,国際,20ロシア・北朝鮮兵5万人集結…“死を恐れぬ”北朝鮮兵 自ら志願「捨て駒」でも戦う理由　専門家「金正恩にとっては大きな賭け」FNNプライムオンライン11/13(水) 16:2717件/時,FNNプライムオンライン,ロシア・北朝鮮兵5万人集結…“死を恐れぬ”北朝鮮兵 自ら志願「捨て駒」でも戦う理由　専門家「金正恩にとっては大きな賭け」,17,https://news.yahoo.co.jp/articles/ea41ff34ea624b8261ffbe5a74faa75fe2b5f6df,11/13(水) 16:27
2024-11-14,11:29,world,国際,21ロシア軍、クルスク反攻1週間で3個大隊分の車両失う　攻撃緩める気配なしForbes JAPAN11/14(木) 10:3016件/時,Forbes JAPAN,ロシア軍、クルスク反攻1週間で3個大隊分の車両失う　攻撃緩める気配なし,16,https://news.yahoo.co.jp/articles/9a0ab8d18c9c0d904b372e8756809aaed4fcb257,11/14(木) 10:30
2024-11-14,11:29,world,国際,22「２秒でクビにする」と名指しされた特別検察官、トランプ氏の大統領就任前に辞任へ読売新聞オンライン11/14(木) 10:0716件/時,読売新聞オンライン,「２秒でクビにする」と名指しされた特別検察官、トランプ氏の大統領就任前に辞任へ,16,https://news.yahoo.co.jp/articles/2abcedd29023c711231a84f176ffd9dd45307043,11/14(木) 10:07
2024-11-14,11:29,world,国際,231:07中国・車暴走で35人死亡　現場は封鎖され被害者を悼む市民らが献花TBS NEWS DIG Powered by JNN11/13(水) 11:5115件/時,TBS NEWS DIG Powered by JNN,中国・車暴走で35人死亡　現場は封鎖され被害者を悼む市民らが献花,15,https://news.yahoo.co.jp/articles/c311a03a048a5f7f2d7e9bf6bd01f6e15041086e,11/13(水) 11:51
2024-11-14,11:29,world,国際,24ハリス氏、テレビ出演前に司会者側に7700万円寄付　好意的インタビューとの関係は不明産経新聞11/13(水) 12:5914件/時,産経新聞,ハリス氏、テレビ出演前に司会者側に7700万円寄付　好意的インタビューとの関係は不明,14,https://news.yahoo.co.jp/articles/1630026a7b85956cd3c7757be52de1d53aab0a88,11/13(水) 12:59
2024-11-14,11:29,world,国際,25トランプが習近平に猛激怒！…鉄槌を下される中国経済の「致命傷は不可避」といえる「深刻な理由」現代ビジネス11/14(木) 7:3413件/時,現代ビジネス,トランプが習近平に猛激怒！…鉄槌を下される中国経済の「致命傷は不可避」といえる「深刻な理由」,13,https://news.yahoo.co.jp/articles/3c4688724633d420b609c6e020e3fea18e7f2fd1,11/14(木) 7:34
2024-11-14,11:29,world,国際,26トランプ政権で何が変わる…為替は一時円安から円高方向へ　かつて「シンゾウは『イシバだけはダメ』と」語った日本との安全保障は首相次第夕刊フジ11/13(水) 17:0013件/時,夕刊フジ,トランプ政権で何が変わる…為替は一時円安から円高方向へ　かつて「シンゾウは『イシバだけはダメ』と」語った日本との安全保障は首相次第,13,https://news.yahoo.co.jp/articles/1ff68c3f6164a8182cc0ce69f0b77490451840dc,11/13(水) 17:00
2024-11-14,11:29,world,国際,27トランプ再登板で早くも始まった「世界の大転換」…EUが「ロシア産」天然ガスから「米国産」に乗り換え、中国資本の企業にも「脱中国」の動きが！現代ビジネス11/14(木) 6:0913件/時,現代ビジネス,トランプ再登板で早くも始まった「世界の大転換」…EUが「ロシア産」天然ガスから「米国産」に乗り換え、中国資本の企業にも「脱中国」の動きが！,13,https://news.yahoo.co.jp/articles/ed1f8da9a79841d17cc20019f1f60aed14ee0fbc,11/14(木) 6:09
2024-11-14,11:29,world,国際,28韓国の5車線道路、信号無視・無謀横断で飛び出した自転車と衝突、それでも責任は自動車に？KOREA WAVE11/14(木) 6:0312件/時,KOREA WAVE,韓国の5車線道路、信号無視・無謀横断で飛び出した自転車と衝突、それでも責任は自動車に？,12,https://news.yahoo.co.jp/articles/3fdb08db13c06c43cd0522a84088b4e4f339dabe,11/14(木) 6:03
2024-11-14,11:29,world,国際,29英紙ガーディアン、X投稿停止　「有害」「マイナス面上回る」時事通信11/14(木) 7:5312件/時,時事通信,英紙ガーディアン、X投稿停止　「有害」「マイナス面上回る」,12,https://news.yahoo.co.jp/articles/509ff40c5f6b7735d150eaf12706e3864f7d579d,11/14(木) 7:53
2024-11-14,11:29,world,国際,30日帝時に韓国を離れた智光国師塔、１１３年ぶりに故郷に帰還中央日報日本語版11/14(木) 9:1212件/時,中央日報日本語版,日帝時に韓国を離れた智光国師塔、１１３年ぶりに故郷に帰還,12,https://news.yahoo.co.jp/articles/ea21902dc816a53fe6132521b6737c7bd697ce1c,11/14(木) 9:12
2024-11-14,11:29,world,国際,31「破滅的消費」で憂さ晴らし、経済事情で「即同棲」…アメリカ経済を苦境に陥れる“若者たちの抑圧”デイリー新潮11/14(木) 6:0112件/時,デイリー新潮,「破滅的消費」で憂さ晴らし、経済事情で「即同棲」…アメリカ経済を苦境に陥れる“若者たちの抑圧”,12,https://news.yahoo.co.jp/articles/2857e03bc09a696d2e68f47ce6b529198e344d92,11/14(木) 6:01
2024-11-14,11:29,world,国際,32米民主党州の知事ら、トランプ氏政策に対抗する連盟結成ロイター11/14(木) 10:3310件/時,ロイター,米民主党州の知事ら、トランプ氏政策に対抗する連盟結成,10,https://news.yahoo.co.jp/articles/2266c1fee1037909288054de0aabd316ae6590d7,11/14(木) 10:33
2024-11-14,11:29,world,国際,33トランプ氏、司法長官に「問題児」起用を表明　政敵への報復に懸念毎日新聞11/14(木) 9:4910件/時,毎日新聞,トランプ氏、司法長官に「問題児」起用を表明　政敵への報復に懸念,10,https://news.yahoo.co.jp/articles/dd0a0f8e48151e1227088e48265f30b47816a963,11/14(木) 9:49
2024-11-14,11:29,world,国際,34トランプ氏、3期目に意欲？　　「皆が求めれば」　米時事通信11/14(木) 8:4010件/時,時事通信,トランプ氏、3期目に意欲？　　「皆が求めれば」　米,10,https://news.yahoo.co.jp/articles/a3c1a8551ba30a9e259c5bb7f30471f653429815,11/14(木) 8:40
2024-11-14,11:29,world,国際,35全国で「尹退陣」教授時局宣言…週末には光化門で市民行進ハンギョレ新聞11/14(木) 9:0910件/時,ハンギョレ新聞,全国で「尹退陣」教授時局宣言…週末には光化門で市民行進,10,https://news.yahoo.co.jp/articles/246fa8694c21453096dc0b6b3930978c2f89eef4,11/14(木) 9:09
2024-11-14,11:29,world,国際,36全世界の証券市場襲った「トランプ・リスク」…なぜ韓国の打撃が最大だったのかハンギョレ新聞11/14(木) 8:099件/時,ハンギョレ新聞,全世界の証券市場襲った「トランプ・リスク」…なぜ韓国の打撃が最大だったのか,9,https://news.yahoo.co.jp/articles/5289035254d9b2190bdc71f34dda6bff4e8457e4,11/14(木) 8:09
2024-11-14,11:29,world,国際,37北朝鮮兵が「下品なビデオ」を見ている...ロシア軍参加で「ネットの自由」を得た兵士が見ていた動画とは？ニューズウィーク日本版11/13(水) 20:209件/時,ニューズウィーク日本版,北朝鮮兵が「下品なビデオ」を見ている...ロシア軍参加で「ネットの自由」を得た兵士が見ていた動画とは？,9,https://news.yahoo.co.jp/articles/4cfb367a8d5d564d1ff5c5d0ecf32d1cdb1ffb9b,11/13(水) 20:20
2024-11-14,11:29,world,国際,382:05日本が“対ロ制裁緩和？”　ロシアメディア報道　西側諸国の足並み乱す狙いかテレビ朝日系（ANN）11/13(水) 22:059件/時,テレビ朝日系（ANN）,日本が“対ロ制裁緩和？”　ロシアメディア報道　西側諸国の足並み乱す狙いか,9,https://news.yahoo.co.jp/articles/52f5433ab007ff356c03b74e673d70c87db42ca9,11/13(水) 22:05
2024-11-14,11:29,world,国際,39英・ガーディアン紙　「X」での記事投稿を取りやめ日テレNEWS NNN11/14(木) 9:599件/時,日テレNEWS NNN,英・ガーディアン紙　「X」での記事投稿を取りやめ,9,https://news.yahoo.co.jp/articles/c0720c242bf517c446209c59eff54b0c923fb37e,11/14(木) 9:59
2024-11-14,11:29,world,国際,40米特別検察官、トランプ氏就任前に辞任の意向　訴追取り下げも協議CNN.co.jp11/14(木) 10:178件/時,CNN.co.jp,米特別検察官、トランプ氏就任前に辞任の意向　訴追取り下げも協議,8,https://news.yahoo.co.jp/articles/116adf47a874ba8f5170d61e63336019a8a85375,11/14(木) 10:17
