scrp_date,scrp_time,genre_en,genre_jp,rank,media_jp,title,comment,link,date_original
2025-05-25,08:07,business,経済,1,FNNプライムオンライン（フジテレビ系）,小泉農水相「価格高騰が続くとコメ離れを起こす」コメ生産者らとの懇談で価格引き下げに理解求める,75,https://news.yahoo.co.jp/articles/42471286e834686b88a427ba125f926ce135a43c,5/24(土) 12:37
2025-05-25,08:07,business,経済,2,時事通信,巨額投資でこう着打開　日鉄、米国での成長に執念,52,https://news.yahoo.co.jp/articles/82813730ac81f73dda60fd765a101cac7cbd6d5c,5/25(日) 7:10
2025-05-25,08:07,business,経済,3,毎日新聞,揺れる「日産の街」　2工場閉鎖検討、従業員以外にも広がる不安,52,https://news.yahoo.co.jp/articles/7e0e32a21537d1b67a64656d5aaed7738bd46f68,5/24(土) 20:24
2025-05-25,08:07,business,経済,4,ダイヤモンド・オンライン,"【お米の値上がり】「5キロあたり4,400円」。数字に強い人はどう説明する？「すごい説明」の中身",35,https://news.yahoo.co.jp/articles/2b40746a152857982f3f16018ee59caf2cb283e0,5/25(日) 6:51
2025-05-25,08:07,business,経済,5,ダイヤモンド・オンライン,吉野家がぶちあげた「ラーメンで世界一」は茨の道だが勝機あり…一風堂でも日高屋でもない、戦略をマネすべき「有名飲食チェーン」とは？,33,https://news.yahoo.co.jp/articles/e345a56a1710adf9abbcb33ae286ebd2dca067b5,5/25(日) 6:32
2025-05-25,08:07,business,経済,6,FNNプライムオンライン（フジテレビ系）,小泉農水相「2000円の備蓄米を入れて高騰を抑え込んでいきたい」強調…高値の続くコメ価格について,32,https://news.yahoo.co.jp/articles/3d45fb609f96f6bff863af4edc6d0b6d00d97eff,5/24(土) 14:58
2025-05-25,08:07,business,経済,7,産経新聞,USスチール買収、日鉄の計画承認に傾いたトランプ氏　背景には高関税政策の限界も,29,https://news.yahoo.co.jp/articles/2dbde79ee533b553a6f2598abf73916a20222749,5/24(土) 16:47
2025-05-25,08:07,business,経済,8,産経新聞,万博の夜間退場巡り、海外勢が怒りの抗議　BIEの閉場時間延長案に飛びつけぬ運営事情,26,https://news.yahoo.co.jp/articles/92c0f43d6d1067ab15d4b66247bf620a931c2cce,5/25(日) 7:30
2025-05-25,08:07,business,経済,9,集英社オンライン,「ボーナスの給与化」で得するのは誰？　“初任給30万円時代”の到来にはカラクリも…「ローンの見直しとか大変そう」,25,https://news.yahoo.co.jp/articles/3a45c95b6be3caaa3f003a6d39915d681bda661c,5/24(土) 10:02
2025-05-25,08:07,business,経済,10,テレ東プラス,マイナンバーカード本格運用で浮き彫りになる光と影…医療現場の反発、救急の課題とは？,25,https://news.yahoo.co.jp/articles/6ae9887248721d3ee44c1bcea4c9a204ea4d3b61,5/24(土) 8:10
2025-05-25,08:07,business,経済,11,読売新聞オンライン,「コストコ南アルプス倉庫店」開業１か月で国内３７店舗中２番目の来客…想定の２倍超で弊害も,24,https://news.yahoo.co.jp/articles/c063f444abce2408c12a583a51593cad20195854,5/24(土) 20:45
2025-05-25,08:07,business,経済,12,MBSニュース,【速報】万博の1日の来場者数が「過去最多」23日の来場者は約13万9000人　ついに開幕日を超える　一方で2820万人想定のペースは下回る,21,https://news.yahoo.co.jp/articles/9f09b2177ce82c3ea4454b4dbd215be782603d26,5/24(土) 9:46
2025-05-25,08:07,business,経済,13,THE GOLD ONLINE（ゴールドオンライン）,何もしないで1日が終わります…資産運用で「資産1億円」を達成した68歳元会社員。人生勝ち組のはずが、潤沢な残高を見ても“心は空っぽ”の老後「時間が取り戻せたら」【FPの助言】,20,https://news.yahoo.co.jp/articles/0b7a42fd2b5577363430e388eabfe02a39a86d84,5/24(土) 10:02
2025-05-25,08:07,business,経済,14,東洋経済オンライン,6月末に「都内で大量閉店」の天下一品。久々に訪れると味は昔のまま…なのに、昨年にも多数の閉店が。一体なぜ「縮小」が続いているのか？,18,https://news.yahoo.co.jp/articles/b01d974cd7b824a820fa17800c1146076cb083f1,5/25(日) 7:47
2025-05-25,08:07,business,経済,15,TBS NEWS DIG Powered by JNN,コメ3000円台への引き下げが政権公約に、随意契約のインパクトとは【播摩卓士の経済コラム】,18,https://news.yahoo.co.jp/articles/17ada8ae3686bf33d12c7d8d90984ca67237b131,5/24(土) 14:02
2025-05-25,08:07,business,経済,16,MotorFan,中国自動車メーカーの“実力”とその“脅威”はホンモノか？ 日本勢は生き残れるか？,17,https://news.yahoo.co.jp/articles/c901a98fdd32d219d2f0818ad99795a2f86ffe10,5/25(日) 7:40
2025-05-25,08:07,business,経済,17,みんかぶマガジン,全国民への現金給付「自民党も一時検討」…待望する声もある一方で「なぜ効率が悪いのか」経済アナリスとが解説,17,https://news.yahoo.co.jp/articles/9df8a7de855c2727d562c5a7e14118e964ff4831,5/24(土) 9:10
2025-05-25,08:07,business,経済,18,ダイヤモンド・オンライン,職場で出世しない人は「職場みんなと仲良くする」。出世する人はどうしている？,16,https://news.yahoo.co.jp/articles/f80a2257e64c62ed6391d0a8b3c9d2f95229dbfb,5/25(日) 7:02
2025-05-25,08:07,business,経済,19,プレジデントオンライン,"「退職代行を使う人はカス」で大炎上…モームリに業界1位を奪われた、""元祖""創業者が明かす""敗北の理由""",16,https://news.yahoo.co.jp/articles/41111406b7039a4396fdef4b43ed8bc2c2d7d62a,5/24(土) 17:17
2025-05-25,08:07,business,経済,20,毎日新聞,トランプ関税の日米交渉、G7での合意を視野　赤沢氏が会談,16,https://news.yahoo.co.jp/articles/6c09ad4f8cb32351ce380f6e014cbb4b36ab7ba8,5/24(土) 7:13
2025-05-25,08:07,business,経済,21,MotorFan,レーザー砲、レールガン、無人戦闘艇…これが未来の自衛隊の装備だ！ 防衛装備展示会「DSEIジャパン」開催,15,https://news.yahoo.co.jp/articles/476e7c7434a0dfbaeab1d3c2012e88af82ff3e66,5/25(日) 7:10
2025-05-25,08:07,business,経済,22,毎日新聞,コメ農家、減反政策見直し要望　小泉農相面会で　備蓄米放出は歓迎,14,https://news.yahoo.co.jp/articles/4e08e74b45cfd0756cb2d3c61516c40305bebbd1,5/24(土) 19:53
2025-05-25,08:07,business,経済,23,マネーポストWEB,休日も仕事のLINEが来て「即レスが必須」、連絡を断ったら「社会人失格」と叱責する“ヤバい会社”　休日の業務連絡にはどこまで対応すべきなのか,13,https://news.yahoo.co.jp/articles/70d1798a69a5b23543f1303d91d7c87518220710,5/25(日) 7:15
2025-05-25,08:07,business,経済,24,共同通信,2千円備蓄米で「高騰抑えたい」　小泉農相、引き下げ意欲,13,https://news.yahoo.co.jp/articles/2749b0663ea1117dd61db2285684260d09b53ee3,5/24(土) 12:56
2025-05-25,08:07,business,経済,25,ファイナンシャルフィールド,国民全員に「5万円給付」の案が出たけど、「減税のほうがいい」という意見も！ 実際どんな違いがあるの？ それぞれのメリット・デメリットを解説,13,https://news.yahoo.co.jp/articles/c1e4f05f297dc62585ee1d5313ae9a1b65a98e9c,5/24(土) 11:31
2025-05-25,08:07,business,経済,26,毎日新聞,最後の切り札？新型スカイラインで日産は復活できるのか,13,https://news.yahoo.co.jp/articles/aa492d1bcbc2ab33eaaa9903eec13d8c464bd578,5/24(土) 9:30
2025-05-25,08:07,business,経済,27,ファイナンシャルフィールド,入院の際に「一番安い部屋は空いていない」とのことで「+4000円」の部屋になりました。空きがなかった場合でも「自己負担」なのでしょうか？,13,https://news.yahoo.co.jp/articles/c9c70b38217f2db24037ff597807d28c2dc90d57,5/24(土) 13:10
2025-05-25,08:07,business,経済,28,テレビ朝日系（ANN）,「5キロ2000円で店頭に」　備蓄米の輸送費「国が負担」　小泉農水大臣が表明,13,https://news.yahoo.co.jp/articles/459ecf83c01e49b2d02d51375ec133834e7b88b6,5/24(土) 10:52
2025-05-25,08:07,business,経済,29,Merkmal,日産「ノート」輸出は再建の救世主となるのか？ 国内10万台超えの絶対エース――円安追い風も、潜む保護主義とEV減速の現実,12,https://news.yahoo.co.jp/articles/5f34a75e15ccd74580fd4be12f07953f60c30566,5/25(日) 5:51
2025-05-25,08:07,business,経済,30,毎日新聞,車社会なのに…群馬でガソリンスタンドの廃業進む　ゼロの自治体も,12,https://news.yahoo.co.jp/articles/eaedb77318a349fa88e15573d0537f0f793ca355,5/24(土) 12:30
2025-05-25,08:07,business,経済,31,FNNプライムオンライン（フジテレビ系）,【速報】「家庭教師のトライ」運営のトライグループがホームページで謝罪…教材で「水俣病は遺伝する」と記述「不正確な表現となったことをお詫びの上訂正いたします」,12,https://news.yahoo.co.jp/articles/a5d646e584aaaf557d0bd58c4e0152f9ec2c5510,5/24(土) 17:57
2025-05-25,08:07,business,経済,32,Yahoo!ニュース オリジナル THE PAGE,「平成の米騒動」では不評だった「外国のコメ」、消費増えるインディカ米のいま ＃食の現在地,12,https://news.yahoo.co.jp/articles/241eea9e8423faabea046eadee0111f4da94228c,5/24(土) 9:50
2025-05-25,08:07,business,経済,33,ダイヤモンド・オンライン,「ちゃんとやっといて！」は頭が悪い。頭の良い人の「すごい言い換え」の中身,11,https://news.yahoo.co.jp/articles/39911c5533e5fd8c5248acf2d79d1782748b0b94,5/25(日) 6:41
2025-05-25,08:07,business,経済,34,共同通信,コメ生産縮小の転換に意欲示す　小泉農相「農政を抜本改革」,11,https://news.yahoo.co.jp/articles/8f85798f5d8c149c590d77d977b4b363613fa0af,5/24(土) 18:51
2025-05-25,08:07,business,経済,35,＆GP,雨の日にサイドミラーを見えなくする大迷惑な水滴…じつはアレって簡単に解消できるんです！【CARGoodsPress】,11,https://news.yahoo.co.jp/articles/5776343e078d764069cd07dddd1f9b2eced5c1ed,5/24(土) 19:00
2025-05-25,08:07,business,経済,36,テレビ朝日系（ANN）,備蓄米2000円で「コメ高騰抑えたい」小泉大臣 生産者、卸売り・小売業者に協力要請,10,https://news.yahoo.co.jp/articles/7c0d526de2d975b5ccb02aeb20340f258dc0fbcb,5/24(土) 18:22
2025-05-25,08:07,business,経済,37,ダイヤモンド・オンライン,ファーストクラスにはシャワールームも！超大型機が「やっぱり良いかも…」と言われる空の最新事情,10,https://news.yahoo.co.jp/articles/568ec74a9939f52994d2fad4f8469111701b6f82,5/25(日) 6:02
2025-05-25,08:07,business,経済,38,マネーポストWEB,江藤拓・前農水相の「コメを買ったことがない」失言を考える　「確かに地方には“食べ物をあげる文化”がある。でも立場を考えて発言すべき」の指摘,10,https://news.yahoo.co.jp/articles/d12759defdb586029c77245ea650479ad263d41e,5/24(土) 16:15
2025-05-25,08:07,business,経済,39,＆GP,スモールランプもナンバー灯も激変!? 光ムラのない白色光でダサいライトとはサヨナラ！【CARGoodsPress】,10,https://news.yahoo.co.jp/articles/b1987f598a6a5891a41d5b790759d68534263282,5/24(土) 20:20
2025-05-25,08:07,business,経済,40,ダイヤモンド・オンライン,【精神科医が教える】自分の悪口を言われていることがわかったとき、頭のいい人はどうする？,9,https://news.yahoo.co.jp/articles/acf7751af62c85abf6662e9a259260d9be7c54f0,5/25(日) 7:32
