scrp_date,scrp_time,genre_en,genre_jp,rank,media_jp,title,comment,link,date_original
2026-01-09,08:08,business,経済,1,読売新聞オンライン,ＡＮＡがドローン物流を全国で事業化へ…離島に医薬品、災害時は孤立地域へ食料を輸送,136,https://news.yahoo.co.jp/articles/ac68c1c17ac69ab218c7a8684f5f67805c404bea,1/9(金) 5:00
2026-01-09,08:08,business,経済,2,ITmedia ビジネスオンライン,「残クレアルファード」を笑えない日が来る？　スマホに住宅、今後も残クレが広がっていきそうな納得の理由,117,https://news.yahoo.co.jp/articles/442f7dd91451784ba121d9cfdaa5c5a5e8bc8169,1/9(金) 5:55
2026-01-09,08:08,business,経済,3,読売新聞オンライン,人口５００人の世界遺産「白川郷」に外国客１１１万人…受け入れ負担大きく観光協会「そろそろ限界」,86,https://news.yahoo.co.jp/articles/446be697cb96ee6ab09c90ec0d4e44060d651288,1/8(木) 16:11
2026-01-09,08:08,business,経済,4,読売新聞オンライン,ミニストップ、２６年２月期の最終利益が６０億円赤字の見通し…「おにぎり消費期限の表示不正」影響,67,https://news.yahoo.co.jp/articles/0c9938e8ad16593d242c0cc329d9bcb32d65ae24,1/8(木) 15:55
2026-01-09,08:08,business,経済,5,テレビ朝日系（ANN）,コメ価格“一転”値下がり　大量の在庫「売り切りたい…」,48,https://news.yahoo.co.jp/articles/ae4731fcaba56905ae98a295d6358d218e8f05c6,1/8(木) 18:36
2026-01-09,08:08,business,経済,6,産経新聞,「人手不足」で企業倒産、止まらず　過去最多ペース　人件費高騰が中小企業の経営を圧迫,40,https://news.yahoo.co.jp/articles/d29f0f71eb574975660f4c78d87e7b080f01bc0f,1/9(金) 7:00
2026-01-09,08:08,business,経済,7,テレビ朝日系（ANN）,「銀歯治療するほど赤字」　貴金属高騰で歯医者ピンチ　1本あたり3000円自腹,34,https://news.yahoo.co.jp/articles/d16b31dd1267e7e0a942fb5ec32516c1f89bd0e2,1/8(木) 12:36
2026-01-09,08:08,business,経済,8,朝日新聞,丹羽宇一郎さんが86歳で死去、民間初の元中国大使　伊藤忠の元社長,34,https://news.yahoo.co.jp/articles/1f363edc1eec4e48a07d2e2c968524ce726d9307,1/8(木) 18:02
2026-01-09,08:08,business,経済,9,ダイヤモンド・オンライン,なぜ日本の「年金給付額」はドイツより30％も少ないのか？比べてわかった決定的な違い,32,https://news.yahoo.co.jp/articles/0f3e429d81103b9bd8d7989740f1adf0d6b88c16,1/9(金) 7:00
2026-01-09,08:08,business,経済,10,プレジデントオンライン,"「日本はAIで完敗」は大間違い…エヌビディアもテスラもマネできない日本だけが持っている""最強の資産""",32,https://news.yahoo.co.jp/articles/e7dd0ed82da328981203eb50f72e58ff8d66d784,1/9(金) 7:15
2026-01-09,08:08,business,経済,11,東洋経済オンライン,ドン・キホーテが「ジャングル陳列」を捨てた？　30〜50代女性の本音“安くても汚い店は嫌”を受け……新業態で狙う全国400商業施設の“空白地帯”,31,https://news.yahoo.co.jp/articles/23d3ae00c87e4c8963311697a37d6e6b1acef12a,1/9(金) 5:30
2026-01-09,08:08,business,経済,12,プレジデントオンライン,習近平は台湾に手を出せない…トランプのベネズエラ政変は「台湾侵攻への青信号になりえない」根本理由,28,https://news.yahoo.co.jp/articles/8c94fb2dd5998f1d4232f633b995df4097e15dc7,1/8(木) 11:15
2026-01-09,08:08,business,経済,13,マネーポストWEB,《対談・池上彰氏×佐藤優氏》台湾有事答弁問題で憂慮すべき沖縄情勢　なぜメディアや官僚は「沖縄分離」という国家統合の危機に鈍感なのか,27,https://news.yahoo.co.jp/articles/5586c3d68761badcff1fefffa28097528df54763,1/9(金) 7:15
2026-01-09,08:08,business,経済,14,産経新聞,日本人患者後回しの懸念　大半が富裕層の中国人「医療ツーリズム」　経営難病院の頼みの綱,25,https://news.yahoo.co.jp/articles/8c653cd02cc1a9aa9246b5d0adaceb4a4ee577d2,1/8(木) 19:00
2026-01-09,08:08,business,経済,15,東洋経済オンライン,「暴力を振るう生徒以上にたちが悪い」「傍観者と言えるのか」などの声が…栃木「県立高校で暴行」周囲で“楽しく観戦”する生徒があんなにもいる理由,23,https://news.yahoo.co.jp/articles/611ce53f0dd0730383a996588a18ed78894c8481,1/9(金) 5:16
2026-01-09,08:08,business,経済,16,読売新聞オンライン,野村ＨＤ、６割程度だった定年後の給与水準を現役並みに…「働く意欲引き出す」「人材流出防ぐ」,23,https://news.yahoo.co.jp/articles/09d0626211c2735a036a0df6c2979a36621e7f97,1/8(木) 8:58
2026-01-09,08:08,business,経済,17,共同通信,中国大使、輸出規制の撤回要求拒否,22,https://news.yahoo.co.jp/articles/b23134884d4c94719d5ab48e2f88761adabd78b8,1/8(木) 19:45
2026-01-09,08:08,business,経済,18,Bloomberg,久光製薬が非公開化にかじ、今後予想される製薬業界「脱上場」の波,20,https://news.yahoo.co.jp/articles/b18b9925c9173dc9ddc84885f715773f6cc22cd6,1/8(木) 10:56
2026-01-09,08:08,business,経済,19,Bloomberg,インバウンド、26年は減少とJTBが予測－中国・香港客の訪日控えで,20,https://news.yahoo.co.jp/articles/4a5a1ab45a5cd0bf8744c8200ded2daf2d65b7cc,1/8(木) 16:47
2026-01-09,08:08,business,経済,20,文春オンライン,「通貨の堕落が資本主義を破壊する」エミン・ユルマズ氏が解説する“第二次大戦の真因”と“追い詰められた国家”の暴走,20,https://news.yahoo.co.jp/articles/94115b8c809e7849455e4406316eb9b5fa0a487f,1/9(金) 6:27
2026-01-09,08:08,business,経済,21,THE GOLD ONLINE（ゴールドオンライン）,"面接官が失笑。「年金月6.5万円」「月収50万円」「退職金3,000万円」の夫を失った、内助の功の62歳専業主婦…時給1,150円のパートも受からない〈無能の烙印〉【FPが解説】",18,https://news.yahoo.co.jp/articles/b903fcfcfc4d33cac07796c2eff38ab729e8c51c,1/8(木) 10:30
2026-01-09,08:08,business,経済,22,プレジデントオンライン,"「ケチな関西人は500円を払わない」を完全に覆した…京阪電車""プレミアムカー""が年10億円稼いだ勝因",17,https://news.yahoo.co.jp/articles/1f5c8620a782285f03a4fe77ee0e8862e2e938e9,1/8(木) 9:15
2026-01-09,08:08,business,経済,23,ITmedia ビジネスオンライン,クルマの正月飾りはなぜ廃れたのか　季節感が薄れた時代のクルマ文化,16,https://news.yahoo.co.jp/articles/9c10ed4b2d15c62eff12d391b364e738e88a21ba,1/9(金) 7:10
2026-01-09,08:08,business,経済,24,共同通信,中国、日本酒の通関遅延　食品も、首相答弁に報復か,16,https://news.yahoo.co.jp/articles/a0dbe91d47a6304a69cc1e9204db25b29ba26657,1/8(木) 23:10
2026-01-09,08:08,business,経済,25,ファイナンシャルフィールド,65歳まで働ける再雇用を断り、「年金＋週3日のパート」で暮らすと決めた夫。「月給20万円もいらないから、気楽に働きたい」と言いますが、健康保険や税金を考えると“損”にならないのか不安です。,15,https://news.yahoo.co.jp/articles/26615c2fb19b9aefe17b85fb16a18e19e77fec9d,1/9(金) 5:10
2026-01-09,08:08,business,経済,26,Bloomberg,中国で日本向け輸出許可申請の審査停止、防衛関連に限らず－WSJ,15,https://news.yahoo.co.jp/articles/e850986eee5ef6061415b2141af4331945f69385,1/9(金) 0:28
2026-01-09,08:08,business,経済,27,Bloomberg,ワーナー、パラマウントの修正買収案を拒否－Netflixより条件劣る,15,https://news.yahoo.co.jp/articles/60e1da672fc7071ff7c9040e4f2e4dfa4eb412c9,1/7(水) 22:56
2026-01-09,08:08,business,経済,28,共同通信,ベネズエラ原油、中国に取引認めると米長官,14,https://news.yahoo.co.jp/articles/2a65ff556948f792c3e24139d3d37c7948656f75,1/8(木) 23:47
2026-01-09,08:08,business,経済,29,Yahoo!ニュース オリジナル THE PAGE,【ヤフコメで話題】「国保と社会保険の負担格差」「制度の抜け道と公平性」 - 国民健康保険を巡る不信と制度改革論,13,https://news.yahoo.co.jp/articles/c6d0f3c902890e71dc1af6d16e6bdb6fa5987b49,1/8(木) 17:12
2026-01-09,08:08,business,経済,30,ファイナンシャルフィールド,年金を70歳まで繰り下げると本当に得するの？ 65歳・貯金600万円でも「5年間」受給を待つべきでしょうか？,12,https://news.yahoo.co.jp/articles/18fe9190aba5b1da73fdea4c3d8c5ada192d4016,1/8(木) 11:42
2026-01-09,08:08,business,経済,31,TBS NEWS DIG Powered by JNN,今年の訪日外国人数 前年比120万人減少の見通し 中国との関係悪化が背景,12,https://news.yahoo.co.jp/articles/2873a7f70d06b5b8ac3a1901fb1146c048feae7c,1/8(木) 17:26
2026-01-09,08:08,business,経済,32,Merkmal,「EV ＝ お得」は終焉か？ 28年重量税導入＆再浮上の走行距離税――環境優遇から受益者負担への冷徹転換,11,https://news.yahoo.co.jp/articles/45a92683038f68002d2c73dbc5d583a2106abc6d,1/9(金) 6:20
2026-01-09,08:08,business,経済,33,ITmedia ビジネスオンライン,新入社員研修、約3割が「意味ない」と回答　その理由は？,11,https://news.yahoo.co.jp/articles/7fe7c55c6c476b2ba4d38f1d88c2e905c6d361ab,1/9(金) 5:05
2026-01-09,08:08,business,経済,34,FNNプライムオンライン,核武装に“説得力”も…ベネズエラ軍事介入は対岸の火事ではない　日本企業は“特定国からの撤退”など最悪シナリオの備えを,11,https://news.yahoo.co.jp/articles/0337941e63e170bf920590710ce8aa6ab827f37c,1/8(木) 18:00
2026-01-09,08:08,business,経済,35,ダイヤモンド・オンライン,「筋トレ」「DJ」はもう古い？ カリスマ起業家が2026年におすすめしたい“意外すぎる趣味”とは？,11,https://news.yahoo.co.jp/articles/e39a77b86738fa05b57a3fbf96f2ea5f0cd7e060,1/9(金) 6:15
2026-01-09,08:08,business,経済,36,ファイナンシャルフィールド,大企業で働く“年収500万円”の娘から「クレカの審査に落ちた」と連絡が！ 勤続7年で収入も安定してるのに、いったいナゼ？ 問題ないはずが“審査に落ちる理由”とは,10,https://news.yahoo.co.jp/articles/952dee5ecbd07367848e001a0e5d7974744f8794,1/8(木) 14:10
2026-01-09,08:08,business,経済,37,東京商工リサーチ,2025年「訪問介護」倒産91件、3年連続で最多更新 「売上不振」が8割超、マイナス改定が重しに,10,https://news.yahoo.co.jp/articles/4dd6f7f3e895625f6f810a505c7da5f87f4d9820,1/8(木) 11:00
2026-01-09,08:08,business,経済,38,共同通信,米、中国の原油取引を容認　ベネズエラ巡る優位は強調,10,https://news.yahoo.co.jp/articles/178cbc0c2d4cf6b2304f578b876cfd72903ccbfb,1/9(金) 5:50
2026-01-09,08:08,business,経済,39,ロイター,中国外務省、ベネズエラ産原油の対米輸出に強く反発　「典型的な強圧的行為」,10,https://news.yahoo.co.jp/articles/a27972ab9748affaceeb007fbd5397b9317ddf05,1/8(木) 11:03
2026-01-09,08:08,business,経済,40,Bloomberg,キューバが次の標的か－トランプ政権、命綱のベネズエラ産石油手中に,10,https://news.yahoo.co.jp/articles/be97ad5ee1c0d190914985f88569990561e85baf,1/8(木) 18:03
