scrp_date,scrp_time,genre_en,genre_jp,rank,media_jp,title,comment,link,date_original
2026-01-09,15:13,domestic,国内,1,共同通信,パトカー追跡中のバイクが事故　大阪府の男性死亡、奈良,591,https://news.yahoo.co.jp/articles/4d6806bd80d8c6e95e393db60af37ad280470793,1/9(金) 9:01
2026-01-09,15:13,domestic,国内,2,日刊スポーツ,橋下徹氏、「スネ夫日本は『抗議』だけ」　中国が日中中間線付近の東シナ海ガス田で新たな採掘,287,https://news.yahoo.co.jp/articles/1f78dc85a3aaeacc4693f306095af92c231a5c6a,1/9(金) 11:02
2026-01-09,15:13,domestic,国内,3,朝日新聞,中学生とのわいせつ動画AV制作し販売容疑　芸能会社長を逮捕,177,https://news.yahoo.co.jp/articles/da1d9ae69fadf3e4af047a95b5c4a540fe010ebb,1/9(金) 5:00
2026-01-09,15:13,domestic,国内,4,共同通信,公明代表、与党復帰に意欲　「政策実現で再び力発揮」,170,https://news.yahoo.co.jp/articles/3f016a48839563f45fb41ec1a95ed596a1e5fd1f,1/8(木) 20:16
2026-01-09,15:13,domestic,国内,5,デイリースポーツ,Ｘ荒れる「中国大使って…」「国に帰れ」【高市自民】日中行事欠席の中国駐日大使→欠席日もＸで高市批判「反省して高市首相の誤った言論を撤回せよ」　「まだ言ってるのか」「総領事に謝罪させたら？」,147,https://news.yahoo.co.jp/articles/fc402392391c7eb29ce840b9e8edc5a66ced4b64,1/9(金) 11:13
2026-01-09,15:13,domestic,国内,6,共同通信,自衛官の自殺、国に賠償命令　パワハラ指摘、いじめは認めず,133,https://news.yahoo.co.jp/articles/503fd475e4b11cdb5c7d83d82283c10e9c809293,1/9(金) 10:54
2026-01-09,15:13,domestic,国内,7,産経新聞,川口クルド人ら視察妨害事件、さいたま地検が不起訴　県議ら「威迫されても泣き寝入りか」　「移民」と日本人,122,https://news.yahoo.co.jp/articles/3f5d51c25078d42d9c4fea0ec50b1d048437f5bd,1/9(金) 7:00
2026-01-09,15:13,domestic,国内,8,プレジデントオンライン,「愛子天皇」よりもよっぽど現実的…麻生太郎がゴリ押しする「悠仁さましか残らない皇室」を救う唯一の解決策,110,https://news.yahoo.co.jp/articles/c79eeec371867abca2753c09075ceae5fbc81439,1/9(金) 8:15
2026-01-09,15:13,domestic,国内,9,朝日新聞,トランプ政権の軍事攻撃に「NO!」　市民団体が大津で抗議集会,96,https://news.yahoo.co.jp/articles/c297be7a72eab448fba841e8376bdd911895c02c,1/9(金) 10:45
2026-01-09,15:13,domestic,国内,10,J-CASTニュース,「日本は圧倒的に不利」中国の対日嫌がらせ　レアアース輸出の規制強化「どんな理屈だって作れる」,88,https://news.yahoo.co.jp/articles/73d0a59acc1d587da3a0d264a261fcc1e35d5d36,1/8(木) 16:45
2026-01-09,15:13,domestic,国内,11,FNNプライムオンライン,「このままじゃマンションつぶれる」車離れでガラガラ…“金食い虫”と化した機械式駐車場　空き解消の“秘策”も制度の壁,85,https://news.yahoo.co.jp/articles/aba7d5f6130c18eacea2b1cb256d0d0814542d7c,1/8(木) 17:54
2026-01-09,15:13,domestic,国内,12,TBS NEWS DIG Powered by JNN,「中学生って言っちゃだめだよ」芸能関連会社元社長が15歳の女子中学生に不同意性交か 動画撮影などの疑いも… 別の女性との“わいせつ動画1700点”　警視庁,84,https://news.yahoo.co.jp/articles/2b1dc10c6ca24e6096a9b5b8f067a7a872a79e80,1/9(金) 5:00
2026-01-09,15:13,domestic,国内,13,ABEMA TIMES,米国の攻撃「詳細を把握していない、と言って国際法違反か明言を避けるのはなぜ？」問われた小泉進次郎防衛大臣の答えは,78,https://news.yahoo.co.jp/articles/04b36305c48272817f540830a30a9df489f03fed,1/9(金) 14:18
2026-01-09,15:13,domestic,国内,14,スポーツ報知,「報ステ」大越健介氏、米トランプ大統領について「国際社会からの信用の失墜、国内の分断もかつてなく深刻」と指摘,75,https://news.yahoo.co.jp/articles/34823bb241637aa4492fe93795088b460d519b25,1/8(木) 23:15
2026-01-09,15:13,domestic,国内,15,共同通信,首相の答弁、実態と乖離　支部から個人へ6千万円超,74,https://news.yahoo.co.jp/articles/07a55fc0eccf3bc38ad6e1e3b9fdc4ae03e5b684,1/8(木) 17:03
2026-01-09,15:13,domestic,国内,16,FNNプライムオンライン,「店に迷惑かけてやろうと」顔面タトゥーでコンビニ強盗致傷の被告（50）が接見で記者に語った反省の言葉,69,https://news.yahoo.co.jp/articles/2ba052c5ddbfbe0a8dec125f9a894a4606e4e023,1/9(金) 12:45
2026-01-09,15:13,domestic,国内,17,集英社オンライン,4月開始の“独身税”だけじゃなかった！ 生活をさらに苦しくする「税金」の正体…国民の手取りは静かに、しかし確実に削られていく,66,https://news.yahoo.co.jp/articles/e1120c4890480a79149ffc32aef31cb36c0f594c,1/9(金) 7:00
2026-01-09,15:13,domestic,国内,18,日刊スポーツ,報ステ大越健介氏「副作用途方もなく大きい」トランプ米大統領の独自路線「国際社会の信用失墜」,66,https://news.yahoo.co.jp/articles/dc66215cb360636400a877231678628118b2d73a,1/9(金) 9:39
2026-01-09,15:13,domestic,国内,19,スポーツ報知,「それ以外の国連機関なんていうものは、おまけだからなくていいんだ」…６６の国際機関「脱退」指示したトランプ大統領…「モーニングショー」玉川徹氏が「考え方」解説,63,https://news.yahoo.co.jp/articles/06da2eed7d8346304ef7f41137eac2e34ca045ba,1/9(金) 12:20
2026-01-09,15:13,domestic,国内,20,日刊スポーツ,ひろゆき氏「中国と日本でドンパチ始まらないか？」との質問に回答「ドンパチが始まることは…」,62,https://news.yahoo.co.jp/articles/cd0e6dd54725a4a34850c991e70cf35ebb2572bb,1/9(金) 7:10
2026-01-09,15:13,domestic,国内,21,読売新聞オンライン,米軍キャンプ瑞慶覧の一部が２０２６年度中にも日本に返還へ…県道の拡幅などに活用する構想,61,https://news.yahoo.co.jp/articles/5b40b3ed35da85de50a37bde7297dbaa0a74ee18,1/9(金) 5:01
2026-01-09,15:13,domestic,国内,22,日テレNEWS NNN,20代の男性刺され死亡　逮捕のベトナム人の男「殺そうと思った」―群馬・太田市,61,https://news.yahoo.co.jp/articles/ab33aef435cc8cd835f93c293930d2c0cfbe5ca4,1/8(木) 21:15
2026-01-09,15:13,domestic,国内,23,デイリー新潮,男が服を脱ぎ捨て、悪臭がただよい…　悠仁さま“一般参賀デビュー”の裏で起きていた珍事　「佳子さまは目が点に」,59,https://news.yahoo.co.jp/articles/200831fac58415d7f1923919312bbf08c34c7b6f,1/9(金) 10:40
2026-01-09,15:13,domestic,国内,24,毎日新聞,歌舞伎町でタイマン　10分決闘の末に相手死なす　容疑で26歳逮捕,55,https://news.yahoo.co.jp/articles/6a25fc94f4c975b29f7a9845aa0827cb2b99d274,1/8(木) 19:35
2026-01-09,15:13,domestic,国内,25,ABEMA TIMES,席狙われ…背後から圧、私物をどかす、空いた席に猛ダッシュ…熾烈な“フードコート戦争”に子育て世代が困惑「見張られている」「我慢しながら食べる感じ」,55,https://news.yahoo.co.jp/articles/84a5d09f4d60c5b86efcb050b1f5ecb7cfdce6f8,1/9(金) 11:30
2026-01-09,15:13,domestic,国内,26,関西テレビ,"【速報】維新・吉村代表「大事なことは『誰と組むか』より維新の公約。実現するために連立政権に入っている」改めて""国民民主の連立入り""は「連立合意の政策をともに進めるなら歓迎」",54,https://news.yahoo.co.jp/articles/62ea9c7cdcecd14e482cf7198f31b57d972504a9,1/9(金) 13:37
2026-01-09,15:13,domestic,国内,27,TBS NEWS DIG Powered by JNN,高市総理「スピード感を持って検討進める」 給付付き税額控除の制度設計めぐり,50,https://news.yahoo.co.jp/articles/643690b5ffc278c449136b3d201df5e7077a308f,1/9(金) 13:10
2026-01-09,15:13,domestic,国内,28,日刊スポーツ,今度は中学生の凄惨「いじめ暴行」動画拡散　無抵抗生徒を殴る蹴る　へずまりゅう氏対応に動く,50,https://news.yahoo.co.jp/articles/aa5a41f338c0a7340f0c18bf2df134a0c0700b70,1/9(金) 8:22
2026-01-09,15:13,domestic,国内,29,デイリー新潮,批判の集中砲火を浴びても“彼女たち”が市長の座にこだわる理由とは…「田久保眞紀氏」「小川晶氏」と高市首相との“決定的な違い”,46,https://news.yahoo.co.jp/articles/56fef346a2d212f14de6679775f3777c09419ce3,1/9(金) 11:02
2026-01-09,15:13,domestic,国内,30,読売新聞オンライン,高齢化で外国人の入居相次ぐ光が丘団地、小学校では日本語「個別」指導…校長「増加スピードに対応追いつかない」,46,https://news.yahoo.co.jp/articles/0bf6630467b69e4575572edbb6a0f2199a2303b8,1/9(金) 10:32
2026-01-09,15:13,domestic,国内,31,毎日新聞,なぜ外国人職員の採用やめる？　三重県の検討に撤回求める声広がる,46,https://news.yahoo.co.jp/articles/5cd169dc6c1d268b1e90e9b2691638d2b70a0ca5,1/8(木) 19:38
2026-01-09,15:13,domestic,国内,32,読売新聞オンライン,山梨の山火事、避難所で一夜過ごした住民「寒さと不安で震え止まらない」…火が集落まで１５０ｍに迫り「民家が心配」,44,https://news.yahoo.co.jp/articles/d11c3b2df93596a98f5cc37153a166c813a12d34,1/9(金) 12:34
2026-01-09,15:13,domestic,国内,33,弁護士ドットコムニュース,NHK党の立花孝志氏を名誉毀損で提訴　刑事「不起訴」でも民事で認められる可能性は？,44,https://news.yahoo.co.jp/articles/b13a9a3716d4010e267950c120c797cd32c0ebd5,1/9(金) 11:03
2026-01-09,15:13,domestic,国内,34,スポーツ報知,「ＴＨＥ　ＴＩＭＥ，」大分の中学校“暴行動画”で教師を名乗る視聴者の声紹介「学校だけではもう対応できません。限界です」,43,https://news.yahoo.co.jp/articles/7010b51ab2d4da87e0a8782c30813ee36dece986,1/9(金) 7:43
2026-01-09,15:13,domestic,国内,35,プレジデントオンライン,高市首相の122兆円予算には「バラマキ」と大騒ぎするのに…新聞・テレビが黙殺した片山財務大臣の正論,41,https://news.yahoo.co.jp/articles/2bb70634eaffddd45b99dce65c0853ae3e1396bc,1/9(金) 10:15
2026-01-09,15:13,domestic,国内,36,デイリー新潮,「心理的ハードルをどこまで下げられるか」に注目が　小室弁護士ファミリーの一時帰国は「2026年後半の可能性」,40,https://news.yahoo.co.jp/articles/e54afa7eeae3ff7b625854d86c9169521aadfa42,1/9(金) 5:50
2026-01-09,15:13,domestic,国内,37,関西テレビ,"【速報】維新・吉村代表”国民民主党の連立入り""「連立合意の政策に賛同なら歓迎です」一方「国民民主党が判断することで僕がどうこう言うことではない」とも",38,https://news.yahoo.co.jp/articles/367469a28c933ee5406f39b8bbc5edcc8fce1200,1/8(木) 15:22
2026-01-09,15:13,domestic,国内,38,集英社オンライン,「キモい」問題…男性に向けられる多様な「キモい」を考察する,38,https://news.yahoo.co.jp/articles/8ac8d9b39cd5c9d5a21c49ec19c2febb3571829a,1/9(金) 11:00
2026-01-09,15:13,domestic,国内,39,読売新聞オンライン,太平洋戦争激戦地テニアン島に日本兵の集団埋葬地…厚労省調査で発見、米側資料に「１４０人埋葬」,37,https://news.yahoo.co.jp/articles/897c0bc3321de512ae1c389c9833804a8c4d89d3,1/9(金) 5:01
2026-01-09,15:13,domestic,国内,40,TBS NEWS DIG Powered by JNN,「顔はAIで加工する」芸能関連会社元社長の男が女子中学生（15）とみだらな行為を撮影しアダルトビデオとして販売か　女性との“わいせつ動画1700点”押収　警視庁,37,https://news.yahoo.co.jp/articles/97a6c54cafdd6453a56be5686f2c14f8e7b171ca,1/9(金) 12:24
