scrp_date,scrp_time,genre_en,genre_jp,rank,media_jp,title,comment,link,date_original
2025-09-01,23:07,domestic,国内,1,日テレNEWS NNN,【独自】世田谷で韓国籍女性切りつけられ…死亡　逃走していた韓国籍男の身柄を東京・羽田空港で確保,658,https://news.yahoo.co.jp/articles/bf69e336aaf6f9e6e12d869302504246638ec24e,9/1(月) 17:55
2025-09-01,23:07,domestic,国内,2,J-CASTニュース,墓地でチューハイ飲み、卒塔婆振り回す...　外国人男性が「お墓荒らし」投稿、警察「映像把握し確認中」,230,https://news.yahoo.co.jp/articles/380e120fe8cd65c7672dbaeb7d915d2f3c7c229d,9/1(月) 18:38
2025-09-01,23:07,domestic,国内,3,集英社オンライン,〈ついに不信任案可決も〉「私にしかできないことがある」田久保市長は支持者に市議会解散の方針を伝達…“暗躍”する市長派ＶＳ反市長派 バトルの行方,218,https://news.yahoo.co.jp/articles/ce843ae82eff73c9a78dec27aed1c61d128535ed,9/1(月) 19:21
2025-09-01,23:07,domestic,国内,4,TBS NEWS DIG Powered by JNN,「いびきがうるさくて」同居する伯父の味噌汁に毒を混入させ殺害しようとしたか　男子高校生（18）逮捕　事件後にはJR千葉駅で女性2人にハンマーで暴行か　千葉県警,203,https://news.yahoo.co.jp/articles/b82fb2a78b58dea51b05e15e2cf1fb84fb9cd415,9/1(月) 17:08
2025-09-01,23:07,domestic,国内,5,共同通信,閣内の総裁選前倒し論を擁護　小泉農相「危機感から表明」,199,https://news.yahoo.co.jp/articles/62c7b248f718d61a1fb40a4a13e267262de21961,9/1(月) 17:18
2025-09-01,23:07,domestic,国内,6,産経新聞,「参政党に貸した理由説明を」共産支持者が堺市の施設に要求　小池晃氏「把握していない」,195,https://news.yahoo.co.jp/articles/930cfb1e5ea5bda6d4ead287b819788abf40a93f,9/1(月) 20:31
2025-09-01,23:07,domestic,国内,7,TBS NEWS DIG Powered by JNN,【速報】東京・世田谷区野沢で韓国籍の40歳の女性が首切られ死亡　切り付けたのは女性の交際相手の男か　男は逃走中　警視庁,184,https://news.yahoo.co.jp/articles/cefedcaa95bf77335397b0950fdd9f64253d2a6b,9/1(月) 14:15
2025-09-01,23:07,domestic,国内,8,テレビ朝日系（ANN）,“総裁選前倒し”に広がりか　石破内閣からも10人超が賛成,153,https://news.yahoo.co.jp/articles/4fd96b8e4938aa0a58bf3178715630e271a08108,9/1(月) 12:27
2025-09-01,23:07,domestic,国内,9,日刊スポーツ,石丸伸二氏「再生の道」代表選候補者は５人、参院選東京選挙区落選の吉田綾氏は回避／候補者詳細,142,https://news.yahoo.co.jp/articles/5a0778f4b80658b4fcaf64380058ea81fef1e78a,9/1(月) 20:46
2025-09-01,23:07,domestic,国内,10,読売新聞オンライン,自民党が２日両院議員総会、石破首相の責任に注目…森山幹事長が辞任なら他の党四役も同調の公算大,129,https://news.yahoo.co.jp/articles/30c25fa9be2aad750fffda3fe5f367278c6649db,9/1(月) 20:12
2025-09-01,23:07,domestic,国内,11,FNNプライムオンライン（フジテレビ系）,【速報】維新除名の石井章参院議員が議員辞職…秘書給与の不正受給疑いで強制捜査,120,https://news.yahoo.co.jp/articles/4124faefebaf7a926b904029e11e185a06df648a,9/1(月) 17:00
2025-09-01,23:07,domestic,国内,12,朝日新聞,万博海外11館で工事費「未払い」　米国や中国など　協会や国へ相談,115,https://news.yahoo.co.jp/articles/5f633ed704ccc5310a92b34475056b42ad161222,9/1(月) 18:30
2025-09-01,23:07,domestic,国内,13,プレジデントオンライン,小室圭・眞子夫妻だけでなく愛子さまも欠席か…9月6日悠仁さまの「成年式」をめぐる秋篠宮さまの深いお悩み,114,https://news.yahoo.co.jp/articles/3bddfd9cefaba95fa286ac182461dd29cc94977d,9/1(月) 16:16
2025-09-01,23:07,domestic,国内,14,産経新聞,地方で存在感増すユーチューバー議員、元迷惑系へずま氏は罵声浴びるも「期待裏切らない」,111,https://news.yahoo.co.jp/articles/25e3e95800aa212b55e89271e2361b867fac5d17,9/1(月) 8:11
2025-09-01,23:07,domestic,国内,15,ハフポスト日本版,関東大震災後の朝鮮人虐殺、「今を生きる私たちに知る責務」。歴史修正や排外主義が目立つ今だからこそ直視すべき「加害の歴史」,104,https://news.yahoo.co.jp/articles/01354207d6d8fbedc7de0fc0d88090bf2c8a0217,9/1(月) 18:56
2025-09-01,23:07,domestic,国内,16,FNNプライムオンライン（フジテレビ系）,「今も恐怖を」ボンネット飛び乗りフロントガラス蹴る泥酔状態の男…バイクにも跳び蹴り　緊急逮捕も「覚えていない」　神奈川・鎌倉市,100,https://news.yahoo.co.jp/articles/f5b2cbba5be0792f5d2d66702526fe18f0c1b614,9/1(月) 20:54
2025-09-01,23:07,domestic,国内,17,女性自身,「高貴な方にしか使えない」悠仁さま　NHK特番で判明した高校同級生に語られていた「ジョークの内容」に驚きの声,88,https://news.yahoo.co.jp/articles/18cca7b822eb81cb27fca60c4d90eaa08ba9a38f,9/1(月) 16:05
2025-09-01,23:07,domestic,国内,18,毎日新聞,NHK元中国人スタッフに1100万円の賠償命令　ラジオで不適切発言,83,https://news.yahoo.co.jp/articles/991f6ebb63c2017f09f7d53cba23e96681b34c83,9/1(月) 14:02
2025-09-01,23:07,domestic,国内,19,日刊スポーツ,ひろゆき氏、代表退任の石丸伸二氏に直言「実現はしてないじゃないですか」本音引き出す,81,https://news.yahoo.co.jp/articles/657e64c6bb99c329daaf37d6465c23a8828bfe69,9/1(月) 6:53
2025-09-01,23:07,domestic,国内,20,東海テレビ,ホームから線路内へ…駅で40代位の女性が列車にはねられる 左足の膝から下を切断する重傷 約1時間半運転見合わせ,79,https://news.yahoo.co.jp/articles/4a910780a799f831f894f2a32176cde07d0bffdb,9/1(月) 21:34
2025-09-01,23:07,domestic,国内,21,プレジデントオンライン,小泉進次郎氏の「備蓄米作戦」はもう限界…新米が想定を大きく上回る「5kg5000円超」になった構造的要因,78,https://news.yahoo.co.jp/articles/3352284427b73615b7be3b4bc1bef93ce38441a6,9/1(月) 9:16
2025-09-01,23:07,domestic,国内,22,日刊スポーツ,ハイヒールリンゴ、不信任決議可決の伊東市長にげんなり「見てられないですね、人として」,77,https://news.yahoo.co.jp/articles/60f9207a35d6ea6c906493b6360cf08bf9753693,9/1(月) 19:36
2025-09-01,23:07,domestic,国内,23,tenki.jp,全国250地点で猛暑日　9月最多更新　2日(火)は関東で再び40℃に迫る酷暑か,71,https://news.yahoo.co.jp/articles/47792b68f4b580c96fa7ca481e7c66203ed2507f,9/1(月) 16:53
2025-09-01,23:07,domestic,国内,24,FNNプライムオンライン（フジテレビ系）,知人間トラブルか?首切りつけられた40歳女性が死亡…男が逃走中で警視庁は殺人事件として捜査　東京・世田谷区,68,https://news.yahoo.co.jp/articles/56aac36c02ea987efa8dd05f5794732ce96d0994,9/1(月) 16:37
2025-09-01,23:07,domestic,国内,25,テレビ朝日系（ANN）,【独自】「血の雨が…」都内クマ襲撃の恐怖語る男性 9月「緊急銃猟」もハンター不安,62,https://news.yahoo.co.jp/articles/18a50121ce41dd31dd6dcb7feb5599a48a855244,8/31(日) 23:30
2025-09-01,23:07,domestic,国内,26,毎日新聞,生活保護バッシング　他人をたたいても,60,https://news.yahoo.co.jp/articles/3022ba838ec693f82591d491dc1362ff4254ee60,9/1(月) 7:35
2025-09-01,23:07,domestic,国内,27,東海テレビ,玄関や窓は施錠済み…アパートで30代位の女性と2歳から3歳位の男の子が死亡 女性は首を吊っていて無理心中か,59,https://news.yahoo.co.jp/articles/8ec81592192b3fbc6c92cd5f032142f3a7d92897,9/1(月) 19:33
2025-09-01,23:07,domestic,国内,28,読売新聞オンライン,政府、都道府県域またぐ「広域圏連携」の支援制度創設へ…「道州」単位で産業・観光など振興図る,59,https://news.yahoo.co.jp/articles/25940131fbcbcc531195531cc74a2b4fba49eabb,9/1(月) 5:00
2025-09-01,23:07,domestic,国内,29,プレジデントオンライン,なぜ現役世代が7兆円も搾り取られるのか…「延命ファースト」に突き進む日本人が忘れた「幸せな逝き方」,59,https://news.yahoo.co.jp/articles/f50f05bf39b43126eb0dafbec2933684f0749db0,9/1(月) 10:15
2025-09-01,23:07,domestic,国内,30,毎日新聞,参政党、地方で他党と連携拡大　自民が最多14議会　維新・立憲とも,58,https://news.yahoo.co.jp/articles/a2c029c633e0664c9c18e6edce524783e2779dd7,9/1(月) 5:00
2025-09-01,23:07,domestic,国内,31,スポニチアネックス,総裁選前倒し要求巡り…田崎史郎氏、石破首相“側近”の発言をピシャリ「政治センスが悪い。権力の乱用」,57,https://news.yahoo.co.jp/articles/6fc987f57b4f452978b1230cfccfe6bb4215e7fc,9/1(月) 20:08
2025-09-01,23:07,domestic,国内,32,デイリー新潮,「出席できるならそうしたかった」　悠仁さまの成年式に「欠席」　小室弁護士ファミリーの今後の帰国プラン,51,https://news.yahoo.co.jp/articles/5663dba0a66159f41652960aa5444e830f5b26ef,9/1(月) 6:00
2025-09-01,23:07,domestic,国内,33,読売新聞オンライン,「太陽にほえろ！」山さん役、露口茂さん死去…９３歳,51,https://news.yahoo.co.jp/articles/604b4471440e2a4a0d6d85a9b8765df3c99f8347,9/1(月) 15:44
2025-09-01,23:07,domestic,国内,34,FNNプライムオンライン,『総裁選の前倒し』が先が良いか? “森山幹事長の進退”もカギに 　石破首相と電話した鈴木哲夫氏が解説,49,https://news.yahoo.co.jp/articles/18355d69108cedb74cdc16f333898c68cac75aa2,9/1(月) 21:36
2025-09-01,23:07,domestic,国内,35,共同通信,伊東市長、市政停滞で四面楚歌に　住民、部下からも辞職要求,48,https://news.yahoo.co.jp/articles/4b04d1b13ca6ed327434eb80cd27fd04325ab102,9/1(月) 18:56
2025-09-01,23:07,domestic,国内,36,FNNプライムオンライン（フジテレビ系）,「野党共闘ますます必要な時代に」共産・小池氏　“終わった発言”立憲・枝野氏に「認識はずれ」と反論,48,https://news.yahoo.co.jp/articles/0d32e67772f6c3eb3a6d3cb470f947302c7fd9da,9/1(月) 20:09
2025-09-01,23:07,domestic,国内,37,日テレNEWS NNN,伊東市議会が不信任決議案可決、刑事告発も　学歴詐称疑惑の市長「ご意向は受け止めました」,47,https://news.yahoo.co.jp/articles/742b7b0c9bb969b9a0674791db608a724d8afe34,9/1(月) 22:32
2025-09-01,23:07,domestic,国内,38,毎日新聞,「死にたくねえなあ」と漏らし出撃した友　98歳元特攻兵が今語る理由,47,https://news.yahoo.co.jp/articles/28d2d7ca48b8e98bc8fd2124cab2b02b7db3d8ef,9/1(月) 8:45
2025-09-01,23:07,domestic,国内,39,共同通信,石井章氏が参院議員辞職　秘書給与詐取容疑で家宅捜索,47,https://news.yahoo.co.jp/articles/723218c37bc20260e849f7e9bb22954a4bd47574,9/1(月) 16:43
2025-09-01,23:07,domestic,国内,40,FNNプライムオンライン,「運転代行呼ぶとお金かかる」パトカーから停止求められるも逃走した酒気帯び運転の車が美容室に突っ込む…26歳女を現行犯逮捕　埼玉・上尾市,44,https://news.yahoo.co.jp/articles/e5ad014815e35b58f3185140785d8b6f4d5e710e,9/1(月) 7:51
