scrp_date,scrp_time,genre_en,genre_jp,rank,media_jp,title,comment,link,date_original
2024-03-19,13:21,life,ライフ,1,まいどなニュース,神戸大のサークルが旅館で迷惑行為？　胴上げして天井に大穴　破った障子から顔を出して撮影　大学当局「事実確認を始めた」,147,https://news.yahoo.co.jp/articles/17c3c72244def9dcd56426edf8580c78c6f1681b,3/19(火) 12:15
2024-03-19,13:21,life,ライフ,2,Hint-Pot,「本当にあった救急要請」　救急車の適正利用を呼びかけ　消防局の投稿に「許せない」の声,83,https://news.yahoo.co.jp/articles/3a58c88aeb4946b5473705cd480e3f0d18e1da7a,3/19(火) 7:10
2024-03-19,13:21,life,ライフ,3,産経新聞,邦題は「トランスジェンダーになりたい少女たち」　4月3日発売決定　出版社には賛否の声,50,https://news.yahoo.co.jp/articles/7ac24c8e659454962b9c3089fb5b43578e25ba2e,3/19(火) 8:10
2024-03-19,13:21,life,ライフ,4,まいどなニュース,「自宅に届いたレターパック」→品名にまさかの文字！　元バス運転手、ショックで動けず「これって法的に有効なの？」,43,https://news.yahoo.co.jp/articles/b4593ad953a4d5df624e585d352143d4003a4448,3/19(火) 8:10
2024-03-19,13:21,life,ライフ,5,AERA with Kids＋,繊細で刺激が苦手な「HSC」、発達障害や病気とどう違うの？　専門家に聞く、子どもとの接し方,42,https://news.yahoo.co.jp/articles/9a19c110f392d87c4fa0bd40ce0d05d916d67d82,3/19(火) 7:32
2024-03-19,13:21,life,ライフ,6,ファイナンシャルフィールド,妻の出産予定日に重要な会議があったのですが、妻が大切なので休みました。後日減給を言い渡されたのですが、これは仕方のないことでしょうか？,42,https://news.yahoo.co.jp/articles/2eefa17a1cda7a39a9a712a107fad15055b9bc12,3/19(火) 11:30
2024-03-19,13:21,life,ライフ,7,ピンズバNEWS,「楽天グループ専用ではありません。」楽天本社すぐの喫煙所張り紙がネットで話題に 不穏な公共エリア実態を当事者に聞いた,41,https://news.yahoo.co.jp/articles/2fff1992e1ed530be9ff1996ace0e386f5fc939f,3/19(火) 7:42
2024-03-19,13:21,life,ライフ,8,日刊ゲンダイDIGITAL,反ワクチン・反LGBT・反ウクライナがデモでごった煮に…主催者・佐藤和夫氏の節操なき人脈で“悪魔合体”（藤倉善郎）,38,https://news.yahoo.co.jp/articles/945a69c19a79f77979c28800dc5796fd986a4651,3/19(火) 9:06
2024-03-19,13:21,life,ライフ,9,THE GOLD ONLINE（ゴールドオンライン）,俺が主夫になろうか？月収33万円・30代の専業主婦世帯、妻、夫のひと言に激怒「ふざけるな！」,33,https://news.yahoo.co.jp/articles/2bc3a7651ab3f552f5c609ba1ed752095fc4a248,3/19(火) 7:02
2024-03-19,13:21,life,ライフ,10,ファイナンシャルフィールド,カフェでコーヒーを頼んだら、「業務スーパー」で買えるコーヒーを注がれました。これは詐欺ですか？　原価率はどうなっているのでしょうか。,32,https://news.yahoo.co.jp/articles/a753bea3a6d528769719fe86ec7d64844e3fb48a,3/19(火) 12:10
2024-03-19,13:21,life,ライフ,11,ファイナンシャルフィールド,新幹線で「窓側指定席」を予約したのに、「通路側」の人が「真ん中」の肘掛けを使っていました。この場合、「指定席代」を一部でも請求できるでしょうか…？,28,https://news.yahoo.co.jp/articles/dd6bc0910bbad21eed238fd472761492cc602192,3/18(月) 17:04
2024-03-19,13:21,life,ライフ,12,ねとらぼ,「この振り袖を探しています」　実家の片付けに失敗し、母の大事な思い出を捨ててしまった娘の後悔に涙と共感が寄せられる,21,https://news.yahoo.co.jp/articles/c90367f7f8a1a812f31f40071619951eb466f81b,3/19(火) 9:30
2024-03-19,13:21,life,ライフ,13,ピンズバNEWS,「ペットボトル飲料の共有」よりも絶対嫌なのは 10～30代男女が「親友でも“シェアは無理”なこと」【トップ3】,20,https://news.yahoo.co.jp/articles/9b131101c6850bdb2af8b150c2e6dc89497afb91,3/19(火) 11:31
2024-03-19,13:21,life,ライフ,14,ファイナンシャルフィールド,娘が「声優の専門学校に入る」と言っていますが不安です。実際、声優で収入を得られるまでにはどれだけの期間とお金がかかりますか？,19,https://news.yahoo.co.jp/articles/b5af4b4c39a760416d4e37a24e5404439cc44215,3/19(火) 12:30
2024-03-19,13:21,life,ライフ,15,ESSE-online,50代、結婚20年目で「婚礼タンス」の処分を決意。手放す際にかかった手間と費用,17,https://news.yahoo.co.jp/articles/f20f3be2b02cfdb1b82baf8447fd25fadd418b04,3/18(月) 16:01
2024-03-19,13:21,life,ライフ,16,週刊SPA!,女性から「なぜか交際を断られる」男性の特徴ワースト8。初対面でのNG行為は,17,https://news.yahoo.co.jp/articles/937e1838b66ac543908b4886134bdae5f0ee53a4,3/19(火) 8:52
2024-03-19,13:21,life,ライフ,17,Hint-Pot,「全然味が違う」　アメリカ人が日本のグルメを絶賛　6歳の男の子がハマったものとは,16,https://news.yahoo.co.jp/articles/32fa950b093efc9771efd69231d834780deb9cda,3/19(火) 8:10
2024-03-19,13:21,life,ライフ,18,ウォーカープラス,「子どもにセルフレジを体験させる母親にイラッ！」レジ待ちで長蛇の列なのに… 待たされる側の気持ちに共感の声【作者インタビュー】,15,https://news.yahoo.co.jp/articles/9a108ac23445b2b243aad6f952ded737d0d8b305,3/18(月) 14:45
2024-03-19,13:21,life,ライフ,19,まいどなニュース,「完全自動運転車に乗りたい」約6割　反対派「誤作動が怖い」「事故時の責任の所在」を超える1位は？,14,https://news.yahoo.co.jp/articles/801047164f7e8e90bf15fbfb209a296e09d0d6dd,3/19(火) 6:55
2024-03-19,13:21,life,ライフ,20,with online,友達は多いほうが良いの？いなきゃダメなの？「友達100人」の歌で、子どもから大切なことを教わった,13,https://news.yahoo.co.jp/articles/7ed510a20ac9a2cea6f163706ba18e952626a2d0,3/19(火) 11:51
2024-03-19,13:21,life,ライフ,21,まいどなニュース,高校球児が公園で素振り→おじさん「ちょっと教えたる」→実はあのレジェンド打者　球児の投稿話題「一生の思い出」,13,https://news.yahoo.co.jp/articles/3908be4b31b544d88dcd28056818cd5d09856acb,3/19(火) 7:45
2024-03-19,13:21,life,ライフ,22,デイリー新潮,「老後は1億円必要になる」専門家が指摘　背景にインフレと株高が,13,https://news.yahoo.co.jp/articles/7beb1e4547cbfee641884d55495febd75cfe44c5,3/19(火) 6:06
2024-03-19,13:21,life,ライフ,23,読売新聞オンライン,日韓の大学生ら、長崎県対馬市の海岸で漂着ごみ清掃…「世界中から集まっている印象」「多すぎる」,13,https://news.yahoo.co.jp/articles/37c6e088bb9e00c61a61ad34294a33a88f4b4328,3/19(火) 11:42
2024-03-19,13:21,life,ライフ,24,週刊SPA!,法律婚1回、事実婚2回の48歳男性が、“3度目の離婚”をした今思うこと「失敗ではなく経験」,13,https://news.yahoo.co.jp/articles/7ee2a8d670582c40fb37bcf727f996f679cf4ad8,3/19(火) 8:54
2024-03-19,13:21,life,ライフ,25,オリコン,母が心配になって見に行くと…わんこの添い寝で泣き止む2名の赤ちゃん「もう絶対自分の子だと思ってるｗｗ」「理想の子育て環境」,13,https://news.yahoo.co.jp/articles/6c071c8067fc913ed4d2e0205cbf26ebfe0579a2,3/19(火) 8:10
2024-03-19,13:21,life,ライフ,26,毎日新聞,生徒を盗撮したり、児童にわいせつしたり…教諭5人処分　東京,12,https://news.yahoo.co.jp/articles/4c08d41e0734da5410a37cdcff5fab6803a7c7de,3/19(火) 9:41
2024-03-19,13:21,life,ライフ,27,日刊ゲンダイDIGITAL,自民党“ハレンチ懇親会”が世界に大拡散…英BBC皮切りに比メディアは「恥」とバッサリ,12,https://news.yahoo.co.jp/articles/575ad1da6865f7fa84d5006c3ff4fe87615e1901,3/18(月) 14:26
2024-03-19,13:21,life,ライフ,28,FORZA STYLE,【離婚は普通の価値観、ムリしてない？】息子がバツ2、子持ちの女性を連れてきた時、67歳の女性に起きたこと。,12,https://news.yahoo.co.jp/articles/405e60efec7493619b15e5cde8e854d0fd2f54cd,3/19(火) 7:22
2024-03-19,13:21,life,ライフ,29,with online,正社員で総合職、15年以上勤務のベテラン社員が、コンビニのパートに「負けた」と感じた瞬間,12,https://news.yahoo.co.jp/articles/3cf8b46929f2229e0f9b0e7337168bb1ed4a9f85,3/19(火) 11:03
2024-03-19,13:21,life,ライフ,30,毎日新聞,私立高教諭、免許失効のまま半年授業　採用更新手続きで発覚　大阪,11,https://news.yahoo.co.jp/articles/8566ede4a6dab40598e120506e232e88fdc17e6f,3/19(火) 10:20
2024-03-19,13:21,life,ライフ,31,現代ビジネス,勉強嫌いの中学受験、サッカー好きな息子の「4年生で塾漬け」を見た親の行動,11,https://news.yahoo.co.jp/articles/dc49539188042ee1783ea80d466617a51f994a05,3/19(火) 7:03
2024-03-19,13:21,life,ライフ,32,ねとらぼ,「脳がバグる」「マジでビビった」　思わず目を疑う「明らかに平面にしか見えないビル」が目撃される,10,https://news.yahoo.co.jp/articles/67932d71c027a76868794cdeb7c9332d87b91c4a,3/19(火) 12:00
2024-03-19,13:21,life,ライフ,33,ねとらぼ,「今でもマクド」「マックって言うようになった」　マクドナルドの新生活CMで“マックかマクドか論争”盛り上がる,10,https://news.yahoo.co.jp/articles/aab39eaeaf3c710ac0d1c0a29a5a0205219b33ab,3/18(月) 20:30
2024-03-19,13:21,life,ライフ,34,現代ビジネス,二階堂ふみ「部屋に帰って号泣しました」ハリウッドで受けたカルチャーショックとは,10,https://news.yahoo.co.jp/articles/2b128deb51965267c86619f05e628c5b680bd770,3/19(火) 7:03
2024-03-19,13:21,life,ライフ,35,ファイナンシャルフィールド,母子家庭で「年収500万円」です。家計に余裕はないのですが、「大学無償化」の対象外って本当ですか？ 進学資金を準備できるか不安です…,9,https://news.yahoo.co.jp/articles/e8086f1f02804433b1a4545be4631c1e21668306,3/19(火) 11:10
2024-03-19,13:21,life,ライフ,36,ファイナンシャルフィールド,公園で「ポイ捨て禁止」の看板をよく見るけど、ポイ捨てする人が多い気がします…「罰金」は本当にあるんですか？,9,https://news.yahoo.co.jp/articles/1baeadb3b1d000d0b5635712233256e7b9497751,3/19(火) 11:02
2024-03-19,13:21,life,ライフ,37,プレジデントオンライン,なぜ学年ビリで不登校だった私は現役で東大に合格できたのか…短期間で成績が急上昇した魔法のノート術,9,https://news.yahoo.co.jp/articles/f17aa813ab01fec446efc93ebed54405cd42370f,3/19(火) 10:17
2024-03-19,13:21,life,ライフ,38,まいどなニュース,「痛いし、不便だけど…」歯列矯正中の30代女性、子どものときにしたかった！？　大人だからこそ「とてもいい」理由とは,9,https://news.yahoo.co.jp/articles/c3f27dca4eea581f0f98e1d9134f71d3fc038661,3/19(火) 7:10
2024-03-19,13:21,life,ライフ,39,現代ビジネス,放置すると人工透析も…健診結果に記された「HbA1c」の意味を知っているか,9,https://news.yahoo.co.jp/articles/c997d81c8af226c5b50bd15c8d3bf38df4ee5833,3/19(火) 9:03
2024-03-19,13:21,life,ライフ,40,ファイナンシャルフィールド,就職して一人暮らしを始めた私に、両親が仕送りをしてくれます。これって「過保護」ですよね…。どうすれば自立できるでしょうか。,9,https://news.yahoo.co.jp/articles/58a0699b8ea50bbf7904f0660923f56fe215a32f,3/19(火) 12:06
