scrp_date,scrp_time,genre_en,genre_jp,rank,media_jp,title,comment,link,date_original
2025-09-07,11:35,TTL,総合,1,Full-Count,山本由伸、あと1アウトでノーノー逃す　快挙目前、9回2死から被弾…降板も場内喝采,1331,https://news.yahoo.co.jp/articles/f44d31265a488869548b31b2687bc7e37808b30a,9/7(日) 10:52
2025-09-07,11:35,TTL,総合,2,デイリースポーツ,ドジャース　天国から地獄の２戦連続サヨナラ負け　山本由伸が九回２死から被弾でノーノー消滅→救援陣大炎上　スコットがまた…,568,https://news.yahoo.co.jp/articles/7e6fce61b015ce2d6c810754e51dc49454009d2b,9/7(日) 11:11
2025-09-07,11:35,TTL,総合,3,毎日新聞,「次の首相」石破氏1位、高市氏2位変わらず　参政神谷氏らの名前も,375,https://news.yahoo.co.jp/articles/35b7d5fe7e3dd63550dbe6d24af9386fb230088d,9/7(日) 7:00
2025-09-07,11:35,TTL,総合,4,日刊スポーツ,「ルールをねっていう」上原浩治氏、阪神優勝秒読みにCS改正を再指摘「17ゲームはちょっと」,342,https://news.yahoo.co.jp/articles/048314ab008740d579ee21da11af5f19bdc2e7be,9/7(日) 9:42
2025-09-07,11:35,TTL,総合,5,スポーツ報知,惜しい！　山本由伸があと１人でノーヒットノーラン逃す、９回２死でまさかの被弾　日本人３人目の快挙目前で,338,https://news.yahoo.co.jp/articles/5f0abfdfdff91587f4e255fbcbc233e1dd309fd3,9/7(日) 10:52
2025-09-07,11:35,TTL,総合,6,スポニチアネックス,あっ…山本由伸　ノーヒッターあと1人から被弾にファン騒然「西口した…」「それより試合が…」,330,https://news.yahoo.co.jp/articles/5587808c5508a3c61a5fdd72041e8bbdd4555c6c,9/7(日) 11:03
2025-09-07,11:35,TTL,総合,7,文春オンライン,「小学校で『タクボる』が流行」「ふるさと納税にも打撃」“学歴詐称”で窮地の伊東市・田久保眞紀市長がすがる“起死回生の陰謀論”とは,322,https://news.yahoo.co.jp/articles/1972f513afe04b8a36baed61ced5c39305262038,9/7(日) 7:12
2025-09-07,11:35,TTL,総合,8,デイリー新潮,「人間やめたい」「サーモン食べたい」獄中から届いた手紙…「頂き女子りりちゃん」の“今”,300,https://news.yahoo.co.jp/articles/61e35b77d4b361c00df375ab70a704d3ab54c4d6,9/7(日) 8:11
2025-09-07,11:35,TTL,総合,9,Full-Count,ド軍、9回2死から悪夢のサヨナラ負け　山本由伸の快投ぶち壊し…5連敗で9月“未勝利”,271,https://news.yahoo.co.jp/articles/0392e172154def6e946cce738f53cef99ce23793,9/7(日) 11:10
2025-09-07,11:35,TTL,総合,10,RKB毎日放送,寿司店でうどんの汁を服にこぼした子供を着替えさせた男性に「公共の場で裸にするのはおかしいだろう」と文句言い暴行か　43歳男を逮捕,234,https://news.yahoo.co.jp/articles/71697c60cc1ffdefe668406a8713b69b8639bc52,9/7(日) 9:08
2025-09-07,11:35,TTL,総合,11,産経新聞,＜独自＞菅義偉、小泉進次郎両氏が石破首相に退陣促す　自民党分裂回避へ自発的判断を要請,224,https://news.yahoo.co.jp/articles/4eaf3df418f200aaa83228fc1b74ce4a7b66ecc8,9/7(日) 0:59
2025-09-07,11:35,TTL,総合,12,デイリー新潮,「解散風を自ら吹かせるのは姑息」と石破首相に批判噴出　「解散を強行するなら、戦艦大和の沖縄特攻と同じ」,220,https://news.yahoo.co.jp/articles/52f5aa95baa7ae86e1c9e2e0547e8c7ae3ab2096,9/7(日) 6:08
2025-09-07,11:35,TTL,総合,13,時事通信,神奈川大、落書きおわびに彫像寄贈　独ケルン大聖堂が謝意,219,https://news.yahoo.co.jp/articles/4d727378eaadcd1cf2288875372efd87a6733ad8,9/7(日) 6:48
2025-09-07,11:35,TTL,総合,14,スポニチアネックス,ドジャース　痛恨のサヨナラ負けで泥沼5連敗　山本由伸が9回2死までノーノーも降板後にまさか…,202,https://news.yahoo.co.jp/articles/6091daa88a02e0f97adc385cce3c884a8d184829,9/7(日) 11:12
2025-09-07,11:35,TTL,総合,15,弁護士JPニュース,「八田與一」どこに潜伏？　悪質「ひき逃げ」後に“裸足”で逃走、情報提供“1万件超”も…行方不明のまま3年【未解決事件】,202,https://news.yahoo.co.jp/articles/bf2eddb34ea3a90cfccdafdf054590fa6166a31b,9/7(日) 10:00
2025-09-07,11:35,TTL,総合,16,THE ANSWER,山本由伸あと1死でノーノーの快投から一転…ドジャースまさかのサヨナラ負け、救援陣が逆転許す,184,https://news.yahoo.co.jp/articles/39ffffbe931344d60a42a1be5b38ae11759fcecd,9/7(日) 11:11
2025-09-07,11:35,TTL,総合,17,TeNYテレビ新潟,【特集】“赤字病院” 組織の維持がなければ「医療も展開できない」病院の経営とは≪新潟≫,176,https://news.yahoo.co.jp/articles/567c8793dc137787976927b277a0fdf2c066809d,9/6(土) 18:00
2025-09-07,11:35,TTL,総合,18,日刊スポーツ,ドジャースまさかの大逆転サヨナラ負けで５連敗　山本由伸への祝福ムードから一転の大大大悪夢,160,https://news.yahoo.co.jp/articles/615ed5dbd03713d316a9a4aad3e03adcd2d121fe,9/7(日) 11:15
2025-09-07,11:35,TTL,総合,19,毎日新聞,＜1分で解説＞スマホ大手、続々値上げ…なぜ値下げ競争から一転？,157,https://news.yahoo.co.jp/articles/267e92f510df012b0e64961bbb680389a36d7252,9/6(土) 15:17
2025-09-07,11:35,TTL,総合,20,共同通信,立民代表、解散論に大義なし　自民県連「壊滅する」,151,https://news.yahoo.co.jp/articles/3924b0ca3193301c1d7ae458d3b9ae6e3e118e9a,9/6(土) 14:55
2025-09-07,11:35,TTL,総合,21,東洋経済オンライン,「お金がなければ恋愛さえもできない…」日本の少子化が止まらない“本当の原因”,148,https://news.yahoo.co.jp/articles/0e598dd2c9db827a72a84079bb2a55aedc361bd0,9/7(日) 7:31
2025-09-07,11:35,TTL,総合,22,日刊スポーツ,橋下徹氏「僕ならやりますよ」石破首相が衆院解散なら？に「理解できる」45％のアンケ結果受け,145,https://news.yahoo.co.jp/articles/8b443b62f8cacbb1f9d09bba2190e8e6a62e5d66,9/7(日) 10:49
2025-09-07,11:35,TTL,総合,23,日刊スポーツ,サンモニ膳場貴子、自民党の「世の中との温度差、ズレは感じますよね」石破おろしめぐり言及,144,https://news.yahoo.co.jp/articles/6ab7e8379d1525c1c4fa143ffa27e1a46e51e3e8,9/7(日) 10:20
2025-09-07,11:35,TTL,総合,24,日刊スポーツ,膳場貴子「現行の制度だと皇室の維持すら難しくなってしまう」「拙速に結論を出せる問題では…」,137,https://news.yahoo.co.jp/articles/85c92957dd8ee953714727a3dde7e94141066fb1,9/7(日) 10:21
2025-09-07,11:35,TTL,総合,25,日刊スポーツ,上原浩治氏がセ・リーグの２位以下に喝　阪神最速Ｖ目前に「17ゲーム差はちょっと」,121,https://news.yahoo.co.jp/articles/a90ff315624808b4a0da41be716a369c45c815c5,9/7(日) 9:34
2025-09-07,11:35,TTL,総合,26,仙台放送,障がい者支援施設で入浴介助中に湯温50度前後　女性が重いやけど負い死亡〈宮城〉,120,https://news.yahoo.co.jp/articles/e4d6bbc2fcbe6855c3040335ecb72e93a77ca82c,9/6(土) 18:59
2025-09-07,11:35,TTL,総合,27,時事通信,「社食補助」拡大を議論へ　非課税限度額40年超据え置き　税制改正,119,https://news.yahoo.co.jp/articles/87153a4ec703e1be505992e4345bb4bac584d0e6,9/7(日) 7:13
2025-09-07,11:35,TTL,総合,28,プレジデントオンライン,このままではJR北海道は生き残れない…鉄道ジャーナリストが呆れ返った「あわや脱線トラブル」の顛末,118,https://news.yahoo.co.jp/articles/f0623e3e93306b788c2c42ee1208bf006ac21eec,9/7(日) 8:16
2025-09-07,11:35,TTL,総合,29,TBS NEWS DIG Powered by JNN,赤沢大臣が帰国　自動車関税引き下げの大統領令署名も「決着はついていない」協議の継続へ意欲　日米関税合意,114,https://news.yahoo.co.jp/articles/c5848cee1576af280ccea4a6f4f79836ac4e660c,9/6(土) 17:19
2025-09-07,11:35,TTL,総合,30,集英社オンライン,「管理費を中国人オーナーが支払わない」「修繕積立金が３倍に爆増で生活激変」…マンション襲う「管理の崩壊」という時限爆弾,112,https://news.yahoo.co.jp/articles/5e52e1710de012d18af056ac58559df0a3511e8e,9/7(日) 10:01
2025-09-07,11:35,TTL,総合,31,日刊スポーツ,自民幹部が困惑「正直びっくり」石破首相の衆院解散「理解できる」45％の番組アンケート結果に,109,https://news.yahoo.co.jp/articles/28b69a59a205ad06d52c8e519b50ec9999bfe606,9/7(日) 11:04
2025-09-07,11:35,TTL,総合,32,スポーツ報知,山本由伸がノーヒットノーランへあと１回、３アウト！　敵地騒然、８回で１０４球無安打無失点２四球,105,https://news.yahoo.co.jp/articles/659f8cf1b04b42fef562aaba030001f84656ccb3,9/7(日) 10:45
2025-09-07,11:35,TTL,総合,33,デイリースポーツ,ドジャース　衝撃サヨナラ負けにＮＨＫ解説「言葉が出ない…」ロバーツ監督の継投大誤算　悪夢の５連敗,97,https://news.yahoo.co.jp/articles/852f849b5d1de54173de6519e4fc4a24441bc5eb,9/7(日) 11:22
2025-09-07,11:35,TTL,総合,34,スポーツ報知,「世の中との温度差、ズレは感じます」…自民党「臨時総裁選」要求を巡り「サンモニ」膳場貴子アナが見解,97,https://news.yahoo.co.jp/articles/3ee3cfffa2ebfd475f08cf865e403a0f8d58a586,9/7(日) 8:51
2025-09-07,11:35,TTL,総合,35,ダイヤモンド・オンライン,「学歴って結局はただのペーパーテストの結果じゃないですか。地頭だったら負けてない人がFラン大にもいると思うんですよね」。学歴がもたらす本当の価値を考える,96,https://news.yahoo.co.jp/articles/c4e92d87692aba65187c13fb30b685531c86124d,9/7(日) 6:50
2025-09-07,11:35,TTL,総合,36,デイリースポーツ,タモリ　認知症について「兆候が全部ある」→冷蔵庫を開けたら何しに開けたんだろう？同級生も発症,95,https://news.yahoo.co.jp/articles/f8379c2b68442d4cd77cd065f1fd800c5a140f0e,9/7(日) 9:29
2025-09-07,11:35,TTL,総合,37,スポーツ報知,「警察の度重なるずさんな対応が結果的に１人の命を奪うことにつながった」…川崎ストーカー殺人事件「神奈川県警」謝罪を巡り「サンモニ」膳場貴子アナが見解,95,https://news.yahoo.co.jp/articles/8df9ee921f636cc12870da8dd8f4cb81e9c649bc,9/7(日) 9:00
2025-09-07,11:35,TTL,総合,38,読売新聞オンライン,道頓堀ダイブさせへん、戎橋を規制せよ…阪神がリーグＶ王手,95,https://news.yahoo.co.jp/articles/d7b1960ae86e8d75584207197ea37cd970d5aae9,9/7(日) 7:02
2025-09-07,11:35,TTL,総合,39,日刊スポーツ,ひろゆき氏が持論展開、介護職の給料が日本人の平均年収を超えないワケ「ふざけるなってなる」,91,https://news.yahoo.co.jp/articles/1c6cf61a9d77228d1d3aa5b21f6b60208c34165b,9/6(土) 13:30
2025-09-07,11:35,TTL,総合,40,デイリースポーツ,山本由伸　ノーノーの快挙逃す　九回２死からソロ本塁打を被弾→悪夢のサヨナラ負け　またスコットがサヨナラ打浴びる,89,https://news.yahoo.co.jp/articles/b68e4c89f19a5d0e3578231a3c42a259a825fe4a,9/7(日) 10:54
