scrp_date,scrp_time,genre_en,genre_jp,rank,media_jp,title,comment,link,date_original
2024-10-21,08:06,world,国際,1トランプ前大統領がマクドナルドでフライドポテトを揚げる　アルバイト体験に「私はハリス副大統領より15分間長くマクドナルドで働いた」TBS NEWS DIG Powered by JNN10/21(月) 5:25165件/時,TBS NEWS DIG Powered by JNN,トランプ前大統領がマクドナルドでフライドポテトを揚げる　アルバイト体験に「私はハリス副大統領より15分間長くマクドナルドで働いた」,165,https://news.yahoo.co.jp/articles/a995aab484246731ac89456fc588527f9721ac29,10/21(月) 5:25
2024-10-21,08:06,world,国際,2マスク氏、激戦州で「毎日1人に100万ドル」のお金配り　共和支援毎日新聞10/20(日) 16:5077件/時,毎日新聞,マスク氏、激戦州で「毎日1人に100万ドル」のお金配り　共和支援,77,https://news.yahoo.co.jp/articles/ffdc527ae02636f6dc1a57fee6248147e725bc05,10/20(日) 16:50
2024-10-21,08:06,world,国際,3「少女像」にキスの米国人ユーチューバー…韓国でなおも続ける「迷惑」配信KOREA WAVE10/21(月) 5:0347件/時,KOREA WAVE,「少女像」にキスの米国人ユーチューバー…韓国でなおも続ける「迷惑」配信,47,https://news.yahoo.co.jp/articles/01e85723ac1a0b7be22c0dcad18a6d911f5403c4,10/21(月) 5:03
2024-10-21,08:06,world,国際,4豪州の戦争記念館、韓国国旗前に「中国風」服…かの韓国学者「これを韓服だと？」抗議KOREA WAVE10/21(月) 4:0334件/時,KOREA WAVE,豪州の戦争記念館、韓国国旗前に「中国風」服…かの韓国学者「これを韓服だと？」抗議,34,https://news.yahoo.co.jp/articles/cd92f48fec9a08d7a7e0f1ab4eeb159568ea77ad,10/21(月) 4:03
2024-10-21,08:06,world,国際,5米警察、トランプ氏に傾斜鮮明　治安維持で強硬姿勢を評価共同通信10/20(日) 8:1628件/時,共同通信,米警察、トランプ氏に傾斜鮮明　治安維持で強硬姿勢を評価,28,https://news.yahoo.co.jp/articles/83b83ab99fec3210c1f1f5d8afd686a9b2098174,10/20(日) 8:16
2024-10-21,08:06,world,国際,6殺害されたハマス最高指導者の妻“バーキン”を手に地下トンネル逃走か　イスラエル軍がSNSに投稿FNNプライムオンライン（フジテレビ系）10/20(日) 20:4727件/時,FNNプライムオンライン（フジテレビ系）,殺害されたハマス最高指導者の妻“バーキン”を手に地下トンネル逃走か　イスラエル軍がSNSに投稿,27,https://news.yahoo.co.jp/articles/da3e078e929364baff0e4a2eeaa3babdc954f17d,10/20(日) 20:47
2024-10-21,08:06,world,国際,7北朝鮮兵の軍服サイズ調査　ロシア支給、派兵裏付け共同通信10/20(日) 16:3725件/時,共同通信,北朝鮮兵の軍服サイズ調査　ロシア支給、派兵裏付け,25,https://news.yahoo.co.jp/articles/3aa85ee31054d45b88752cc389ed5e22a103140b,10/20(日) 16:37
2024-10-21,08:06,world,国際,8ロシアの後方支援拠点に攻撃強化　ウクライナ、無人機施設や弾薬庫共同通信10/20(日) 16:1024件/時,共同通信,ロシアの後方支援拠点に攻撃強化　ウクライナ、無人機施設や弾薬庫,24,https://news.yahoo.co.jp/articles/bbeab59b0613141dfc111790a88c7fcf533d1648,10/20(日) 16:10
2024-10-21,08:06,world,国際,9ヒズボラ副指導者、イランに脱出　イスラエルの攻撃恐れ　報道時事通信10/20(日) 20:1421件/時,時事通信,ヒズボラ副指導者、イランに脱出　イスラエルの攻撃恐れ　報道,21,https://news.yahoo.co.jp/articles/d3bbb3d3311cfcf0c0cacee73232d3d5fbaf6f08,10/20(日) 20:14
2024-10-21,08:06,world,国際,10顔面踏みつけ「この野郎～!」“泥酔女”が無抵抗の男性に暴行…危険な運転注意され“逆ギレ”　中国・重慶市FNNプライムオンライン10/20(日) 10:1320件/時,FNNプライムオンライン,顔面踏みつけ「この野郎～!」“泥酔女”が無抵抗の男性に暴行…危険な運転注意され“逆ギレ”　中国・重慶市,20,https://news.yahoo.co.jp/articles/7704b49154502362116b9cbfa53892d3839a335a,10/20(日) 10:13
2024-10-21,08:06,world,国際,11トランプ氏がマクドナルドでバイト体験　ハリス氏の経験談は「ウソ」毎日新聞10/21(月) 7:0517件/時,毎日新聞,トランプ氏がマクドナルドでバイト体験　ハリス氏の経験談は「ウソ」,17,https://news.yahoo.co.jp/articles/4769669fde56a6d896c74d54845f22f5870f72ab,10/21(月) 7:05
2024-10-21,08:06,world,国際,12中国の「一帯一路」構想はもはやオワコンか…その「驚きの実態」が見えてきた現代ビジネス10/21(月) 7:3516件/時,現代ビジネス,中国の「一帯一路」構想はもはやオワコンか…その「驚きの実態」が見えてきた,16,https://news.yahoo.co.jp/articles/e34dcded75088d89355c8e30d18e8992d423106f,10/21(月) 7:35
2024-10-21,08:06,world,国際,13「まるでわいせつ映像…」 娘まで「胸も尻も丸見え」の過激ランジェリーを着せたハイディ・クルムの広告が物議ニューズウィーク日本版10/20(日) 21:0115件/時,ニューズウィーク日本版,「まるでわいせつ映像…」 娘まで「胸も尻も丸見え」の過激ランジェリーを着せたハイディ・クルムの広告が物議,15,https://news.yahoo.co.jp/articles/7a517404f9af1cfe66b53dfae0e081972538ffce,10/20(日) 21:01
2024-10-21,08:06,world,国際,14イスラエル各地で大規模デモ、人質奪還を要求CNN.co.jp10/20(日) 14:1514件/時,CNN.co.jp,イスラエル各地で大規模デモ、人質奪還を要求,14,https://news.yahoo.co.jp/articles/41871765132491fc9f67c6c66fcd77c57bb7a055,10/20(日) 14:15
2024-10-21,08:06,world,国際,15＜トランプの関税万能策は毒薬＞米国では年39万円の家計負担増、誰の利益になるのかWedge（ウェッジ）10/21(月) 5:0214件/時,Wedge（ウェッジ）,＜トランプの関税万能策は毒薬＞米国では年39万円の家計負担増、誰の利益になるのか,14,https://news.yahoo.co.jp/articles/343507c7b717cede820e5b7de52a127a2e5b0821,10/21(月) 5:02
2024-10-21,08:06,world,国際,16ロシアでBRICS首脳会議　22日から、世界の多数派アピール時事通信10/21(月) 7:0612件/時,時事通信,ロシアでBRICS首脳会議　22日から、世界の多数派アピール,12,https://news.yahoo.co.jp/articles/5708b216e2d0379506deead178ba8d400301dc51,10/21(月) 7:06
2024-10-21,08:06,world,国際,17国連の４度目の指摘…「日本は夫婦別姓を進める考えはありませんか」ハンギョレ新聞10/20(日) 9:0912件/時,ハンギョレ新聞,国連の４度目の指摘…「日本は夫婦別姓を進める考えはありませんか」,12,https://news.yahoo.co.jp/articles/a63e70ff3bdafd1756b621ae9b58b789965ffbcc,10/20(日) 9:09
2024-10-21,08:06,world,国際,18中国通販サイトの製品から再び「基準を超える量の重金属」検出…ソウル市が販売中止要請KOREA WAVE10/20(日) 14:0312件/時,KOREA WAVE,中国通販サイトの製品から再び「基準を超える量の重金属」検出…ソウル市が販売中止要請,12,https://news.yahoo.co.jp/articles/977bd334490d474d4890c26d587c29141d631781,10/20(日) 14:03
2024-10-21,08:06,world,国際,190:50モルドバ　大統領選挙とEU加盟めぐる国民投票始まる　ロシアによる選挙介入の懸念日テレNEWS NNN10/20(日) 13:3812件/時,日テレNEWS NNN,モルドバ　大統領選挙とEU加盟めぐる国民投票始まる　ロシアによる選挙介入の懸念,12,https://news.yahoo.co.jp/articles/aaab58e3daf651045ee57832f4b8bc2722e79dc7,10/20(日) 13:38
2024-10-21,08:06,world,国際,20イスラエル反撃計画流出か　米政府調査と下院議長共同通信10/21(月) 6:2112件/時,共同通信,イスラエル反撃計画流出か　米政府調査と下院議長,12,https://news.yahoo.co.jp/articles/fb78eeda9006cfe4bb127b4b9369aae6e2ec8e71,10/21(月) 6:21
2024-10-21,08:06,world,国際,21トランプ氏、台湾有事なら「中国に最大200％の関税」　軍事力は使用せず＝ＷＳＪロイター10/20(日) 8:2711件/時,ロイター,トランプ氏、台湾有事なら「中国に最大200％の関税」　軍事力は使用せず＝ＷＳＪ,11,https://news.yahoo.co.jp/articles/5a5216631a209655762543f52433ab480adef445,10/20(日) 8:27
2024-10-21,08:06,world,国際,22意識ない女性を暴行、ネットで生配信…韓国「卑劣極まりない」男性BJ逮捕KOREA WAVE10/20(日) 18:0311件/時,KOREA WAVE,意識ない女性を暴行、ネットで生配信…韓国「卑劣極まりない」男性BJ逮捕,11,https://news.yahoo.co.jp/articles/0e360e0d8e8a160990c1f6c8df586832a2bb7bb8,10/20(日) 18:03
2024-10-21,08:06,world,国際,23外信コラム　韓国か朝鮮かは悩ましい　NHKは「ハングル」、もっと気になるのは「日王」表記産経新聞10/20(日) 18:0011件/時,産経新聞,外信コラム　韓国か朝鮮かは悩ましい　NHKは「ハングル」、もっと気になるのは「日王」表記,11,https://news.yahoo.co.jp/articles/964b18d1d7155e028521b5e4e83da0d8c79bff86,10/20(日) 18:00
2024-10-21,08:06,world,国際,24いったいなぜ…「トヨタに学ぼう」日本車を絶賛する”ドイツのニュース番組”の不気味さ現代ビジネス10/20(日) 8:0011件/時,現代ビジネス,いったいなぜ…「トヨタに学ぼう」日本車を絶賛する”ドイツのニュース番組”の不気味さ,11,https://news.yahoo.co.jp/articles/2b6ee7c48ddd862ebddad9323b5825df570dce53,10/20(日) 8:00
2024-10-21,08:06,world,国際,25米・カナダ艦、台湾海峡を通過　中国をけん制共同通信10/21(月) 5:3811件/時,共同通信,米・カナダ艦、台湾海峡を通過　中国をけん制,11,https://news.yahoo.co.jp/articles/a79996f05d017d75941a214a4a39be2ed4267d04,10/21(月) 5:38
2024-10-21,08:06,world,国際,26【米国社会の分断は危険水域】大統領選後に第二の「南北戦争」勃発の可能性、その背景とは？Wedge（ウェッジ）10/21(月) 5:0211件/時,Wedge（ウェッジ）,【米国社会の分断は危険水域】大統領選後に第二の「南北戦争」勃発の可能性、その背景とは？,11,https://news.yahoo.co.jp/articles/12634b0b44436da77e35da23f6f8ea3f21b656a8,10/21(月) 5:02
2024-10-21,08:06,world,国際,273:55【米大統領選】トランプ氏激戦州すべて優勢か 中東票めぐり“ハリス降ろし”もテレビ朝日系（ANN）10/20(日) 23:3011件/時,テレビ朝日系（ANN）,【米大統領選】トランプ氏激戦州すべて優勢か 中東票めぐり“ハリス降ろし”も,11,https://news.yahoo.co.jp/articles/a792e74f939e8ec0b7346484f6d7805f5b7b028c,10/20(日) 23:30
2024-10-21,08:06,world,国際,28「少女像にキス」の米国人ユーチューバー…今度は韓国コンビニで度を越した行動中央日報日本語版10/20(日) 12:3010件/時,中央日報日本語版,「少女像にキス」の米国人ユーチューバー…今度は韓国コンビニで度を越した行動,10,https://news.yahoo.co.jp/articles/10f91b92cb4422773622a6933abc8f4b8fa3285d,10/20(日) 12:30
2024-10-21,08:06,world,国際,29北朝鮮派兵「明確な証拠」　ゼレンスキー氏が主張共同通信10/21(月) 6:0810件/時,共同通信,北朝鮮派兵「明確な証拠」　ゼレンスキー氏が主張,10,https://news.yahoo.co.jp/articles/f0771de405ea2f3b5193672604bea0b26ed4eb82,10/21(月) 6:08
2024-10-21,08:06,world,国際,30激戦州知事、マスク氏の報奨金に「深く懸念」　捜査の可能性にも言及毎日新聞10/21(月) 7:009件/時,毎日新聞,激戦州知事、マスク氏の報奨金に「深く懸念」　捜査の可能性にも言及,9,https://news.yahoo.co.jp/articles/41b3c94bc8385a9c39a8c41db3f2de9050cfedee,10/21(月) 7:00
2024-10-21,08:06,world,国際,31英経済紙が世界でも支給額の安い日本の年金制度を憂慮「評価はCレベル」クーリエ・ジャポン10/20(日) 10:309件/時,クーリエ・ジャポン,英経済紙が世界でも支給額の安い日本の年金制度を憂慮「評価はCレベル」,9,https://news.yahoo.co.jp/articles/a0154854dd5cd871dedadd53cb7860866e2b59c3,10/20(日) 10:30
2024-10-21,08:06,world,国際,3233:21【激戦州でトランプ氏優勢】ハリス氏が挽回躍起“黒人男性の支持不振”総力戦の行方はテレビ朝日系（ANN）10/20(日) 22:409件/時,テレビ朝日系（ANN）,【激戦州でトランプ氏優勢】ハリス氏が挽回躍起“黒人男性の支持不振”総力戦の行方は,9,https://news.yahoo.co.jp/articles/c379ef59a4273f8ae72d50dacfcae9669a96e0f7,10/20(日) 22:40
2024-10-21,08:06,world,国際,33試合の遠征中だった少年とプールで接触、ホテルの部屋で性的暴行。女が起訴内容を認める 米BuzzFeed Japan10/21(月) 6:009件/時,BuzzFeed Japan,試合の遠征中だった少年とプールで接触、ホテルの部屋で性的暴行。女が起訴内容を認める 米,9,https://news.yahoo.co.jp/articles/b22b6f511c2455e474cabe9a089907d81f5cd443,10/21(月) 6:00
2024-10-21,08:06,world,国際,34「トランプは残忍」ｖｓ「バイデンにも及ばない」…ネガティブ論戦が激化中央日報日本語版10/21(月) 7:338件/時,中央日報日本語版,「トランプは残忍」ｖｓ「バイデンにも及ばない」…ネガティブ論戦が激化,8,https://news.yahoo.co.jp/articles/4bd71b899d2369df49d13a2f18ea282538f5e673,10/21(月) 7:33
2024-10-21,08:06,world,国際,35ネタニヤフ首相自宅へのドローン襲撃翌日に…イスラエル、ヒズボラに報復空襲中央日報日本語版10/21(月) 7:378件/時,中央日報日本語版,ネタニヤフ首相自宅へのドローン襲撃翌日に…イスラエル、ヒズボラに報復空襲,8,https://news.yahoo.co.jp/articles/67c8c6a8b5c01ed48509760ba7661fea0f8f9c8f,10/21(月) 7:37
2024-10-21,08:06,world,国際,"36【緊急検証】難敵ヒズボラを""半壊""させ勢いに乗るイスラエル。しかし対イラン攻撃がエスカレートすれば、その結末は......イスラエルvsイラン「最悪の暴発シナリオ」週プレNEWS10/21(月) 7:158件/時",週プレNEWS,"【緊急検証】難敵ヒズボラを""半壊""させ勢いに乗るイスラエル。しかし対イラン攻撃がエスカレートすれば、その結末は......イスラエルvsイラン「最悪の暴発シナリオ」",8,https://news.yahoo.co.jp/articles/613eb7715ca749bbccaeb6282517b6415508d187,10/21(月) 7:15
2024-10-21,08:06,world,国際,371:03ガザ北部が空爆され死者・不明者87人…ハマス側「犠牲者の多くは女性や子ども」主張もイスラエル側「死者数は誇張されたもの」FNNプライムオンライン（フジテレビ系）10/21(月) 0:348件/時,FNNプライムオンライン（フジテレビ系）,ガザ北部が空爆され死者・不明者87人…ハマス側「犠牲者の多くは女性や子ども」主張もイスラエル側「死者数は誇張されたもの」,8,https://news.yahoo.co.jp/articles/32d437337e3f06302845b3b5dde0bee7dd9dfc53,10/21(月) 0:34
2024-10-21,08:06,world,国際,381:17イスラエル軍がガザ北部の住宅街などに空爆　70人以上が死亡との情報もTBS NEWS DIG Powered by JNN10/20(日) 18:148件/時,TBS NEWS DIG Powered by JNN,イスラエル軍がガザ北部の住宅街などに空爆　70人以上が死亡との情報も,8,https://news.yahoo.co.jp/articles/e51cde23c0685f95736da8d7f6cbb85705038ca9,10/20(日) 18:14
2024-10-21,08:06,world,国際,39レバノン首都、複数空爆　イスラエル軍「ヒズボラ資金源」共同通信10/21(月) 6:498件/時,共同通信,レバノン首都、複数空爆　イスラエル軍「ヒズボラ資金源」,8,https://news.yahoo.co.jp/articles/ec57eeaf67dee811d738b6e7aea261a320a76a6b,10/21(月) 6:49
2024-10-21,08:06,world,国際,40中国・習近平が広東省1500社を四川省に強制大移転？沿岸部から内陸へ重要産業の工場を移し戦争準備かJBpress10/20(日) 11:217件/時,JBpress,中国・習近平が広東省1500社を四川省に強制大移転？沿岸部から内陸へ重要産業の工場を移し戦争準備か,7,https://news.yahoo.co.jp/articles/d46c118f91d9483542bec88411dd1b85fe38453d,10/20(日) 11:21
