scrp_date,scrp_time,genre_en,genre_jp,rank,media_jp,title,comment,link,date_original
2025-05-09,15:11,domestic,国内,1,FNNプライムオンライン（フジテレビ系）,【速報】自民・西田昌司議員がひめゆり発言を一転撤回し謝罪「不適切だった」　沖縄県民や関係者に「お詫び」,827,https://news.yahoo.co.jp/articles/6d4d4d3fb6df9e683325682a4dc07780dd6861c5,5/9(金) 13:13
2025-05-09,15:11,domestic,国内,2,TBS NEWS DIG Powered by JNN,「教育熱心の度が過ぎると罪を犯すと示したかった」 東京メトロ南北線で乗客の男子大学生ら切りつけ現行犯逮捕の男（43）が動機について供述　警視庁,803,https://news.yahoo.co.jp/articles/32fa908bf028be700cbfa8cc49e9652f3537a356,5/9(金) 11:01
2025-05-09,15:11,domestic,国内,3,TBS NEWS DIG Powered by JNN,【独自】「楽天時代に先輩がやっているのを見て始めた」プロ野球 巨人・オコエ瑠偉選手　オンラインカジノ賭博疑いで書類送検　警視庁,562,https://news.yahoo.co.jp/articles/124a57bc81fd3a5af4297c2185fcd7caa49d60c9,5/9(金) 11:55
2025-05-09,15:11,domestic,国内,4,スポニチアネックス,「政府・自民　消費減税を見送る方針」トレンド急上昇！ネット「じゃあ何をしてくれるの」「それでいい」,462,https://news.yahoo.co.jp/articles/a05c59f209a00a45e4b33b4f618417e5616dbe76,5/9(金) 8:23
2025-05-09,15:11,domestic,国内,5,毎日新聞,東京・立川の小学校侵入　いじめ対応を巡るトラブルが背景か,328,https://news.yahoo.co.jp/articles/4bac2b8871328c73a60baede4d9104f64200b3d3,5/8(木) 18:55
2025-05-09,15:11,domestic,国内,6,TBS NEWS DIG Powered by JNN,消費税減税「慎重でなければならない」　岸田前総理,327,https://news.yahoo.co.jp/articles/7343df435763a7e71f232fa08299349a31279d11,5/9(金) 13:44
2025-05-09,15:11,domestic,国内,7,朝日新聞,国道交差点で2人死亡事故　歩行中の女性とバイクの男性　埼玉・越谷,296,https://news.yahoo.co.jp/articles/006f860b7fcd31f2aafd827c122f72e9aa913428,5/9(金) 8:24
2025-05-09,15:11,domestic,国内,8,テレビ朝日系（ANN）,消費税減税　林長官「税率引き下げは適当ではない」 自民幹部も否定的,294,https://news.yahoo.co.jp/articles/35842d9a344d14a6450ae7bb5d5f905b7c5294ad,5/9(金) 14:10
2025-05-09,15:11,domestic,国内,9,デイリースポーツ,古市憲寿氏、戸籍に「なんでただのデータベースに愛を持てるのか」ホリエモンも「戸籍なんか廃止でいい」,181,https://news.yahoo.co.jp/articles/456b18c9c1461c1fca6a58e6f6a2a83c1f53f47a,5/9(金) 12:57
2025-05-09,15:11,domestic,国内,10,産経新聞,国民民主・榛葉氏「不安で寝られない」外国人土地取得規制で政府は司令塔や海外事例答えず,179,https://news.yahoo.co.jp/articles/b6ce11c647411903d1aa249bbb59f0844507f307,5/9(金) 7:00
2025-05-09,15:11,domestic,国内,11,FNNプライムオンライン（フジテレビ系）,【速報】「子供が体育館に向かって逃げる姿と助けを求める声…」東京・立川市の小学校に男2人侵入した暴行事件で市教委が会見「児童の安全を全力で守って下さった教職員に感謝」,177,https://news.yahoo.co.jp/articles/fb183cf10fb8926d341f4ce9433c516d5f532caa,5/8(木) 16:02
2025-05-09,15:11,domestic,国内,12,毎日新聞,「防ぎようがない」　小学校侵入・暴行事件で浮かぶ学校防犯の難しさ,166,https://news.yahoo.co.jp/articles/33f669d65d33db998dfab30f58bd3ee719c2a312,5/9(金) 6:15
2025-05-09,15:11,domestic,国内,13,毎日新聞,自民・西田氏、「ひめゆり」発言を謝罪　「訂正、削除したい」,163,https://news.yahoo.co.jp/articles/c8991b8b8a18564aab69be2b76ed47beac70f1a6,5/9(金) 13:27
2025-05-09,15:11,domestic,国内,14,FNNプライムオンライン（フジテレビ系）,立憲・野田代表「自民は無策でいいのか」消費減税に否定的な姿勢を批判　他党の赤字国債案にも苦言,143,https://news.yahoo.co.jp/articles/80dc5b471f925d3936cf1d03cd75e2862b42a827,5/9(金) 13:02
2025-05-09,15:11,domestic,国内,15,日テレNEWS NNN,【速報】川崎20歳女性遺棄事件　行方不明女性への対応などで「検証チーム」設置　神奈川県警,142,https://news.yahoo.co.jp/articles/576b02086cb8b349ec7edc4cb5d8e12cf408f4d9,5/9(金) 10:06
2025-05-09,15:11,domestic,国内,16,時事通信,消費税減税見送り　経済対策で調整　政府・自民,121,https://news.yahoo.co.jp/articles/95261a34b176b30a3145813495401d90e4c0341f,5/9(金) 14:04
2025-05-09,15:11,domestic,国内,17,FNNプライムオンライン（フジテレビ系）,「そのうちドローンやヘリが尖閣諸島に着陸も」「『遺憾である』とか『厳重に抗議』だけでは済まない」中国の領空侵犯に自民部会で懸念　無人機対応の検討を求める意見,121,https://news.yahoo.co.jp/articles/b5112cd8d66e0d9ced1245f03751a27d4f1ab78a,5/9(金) 11:19
2025-05-09,15:11,domestic,国内,18,読売新聞オンライン,オートレースで３億６５００万円が的中、申告せず７７００万円脱税…無職の５１歳男が起訴事実認める,112,https://news.yahoo.co.jp/articles/e911e45b47ae1ac5a893567dfd9be6b24268f310,5/9(金) 7:57
2025-05-09,15:11,domestic,国内,19,FNNプライムオンライン（フジテレビ系）,「先生がやられて怖かった」児童ら語った“恐怖”　授業中の小学校教室に男2人が侵入し担任に暴行…2人は“児童の母親の友人”　東京・立川市,108,https://news.yahoo.co.jp/articles/113bfe9b9ed5f7700e2f405ae281b0cd1df53f24,5/8(木) 18:47
2025-05-09,15:11,domestic,国内,20,共同通信,マイナ保険証の期限切れ、31％　保団連調査、受診支障が大幅増,107,https://news.yahoo.co.jp/articles/86ea8202f085b17d2174943fa2e5cbdc25114b1c,5/8(木) 19:04
2025-05-09,15:11,domestic,国内,21,J-CASTニュース,斎藤元彦知事、消費者庁からの指摘は「アドバイス」との理解　法解釈が「国の公式見解と違う」と言われても,106,https://news.yahoo.co.jp/articles/dd0665b02e20474562f17c3a88933feb1e39d8cd,5/9(金) 14:25
2025-05-09,15:11,domestic,国内,22,よろず～ニュース,斎藤知事 消費者庁から「公式見解と異なる」指摘受けたことに「一般的な法解釈のアドバイス」会見で質問集中,96,https://news.yahoo.co.jp/articles/670b9bbc3976299449512ffc685ebec1e7eaf0c0,5/9(金) 7:10
2025-05-09,15:11,domestic,国内,23,TBS NEWS DIG Powered by JNN,【速報】石破総理「報道にあるような事実は全くない」 3000万円超の“闇献金疑惑”報道めぐり,96,https://news.yahoo.co.jp/articles/d1bf137a2501327f684c7b5b9eecd945e38762e8,5/8(木) 17:34
2025-05-09,15:11,domestic,国内,24,J-CASTニュース,「4億円振り込み」表明の与沢翼氏、急きょ帰国　「婚前契約」明かし「離婚時は1億円しか支払わない」主張,95,https://news.yahoo.co.jp/articles/cffbd32668a40768a97942d911ad39113ddccd04,5/9(金) 11:35
2025-05-09,15:11,domestic,国内,25,朝日新聞,羽田空港ビル運営会社、会長と社長が辞任　子会社に利益供与疑惑,81,https://news.yahoo.co.jp/articles/93a1a6e3691ba5a07e8312371c69ca649e1dbc4f,5/9(金) 10:25
2025-05-09,15:11,domestic,国内,26,FNNプライムオンライン（フジテレビ系）,「ひめゆりの塔」巡る西田氏の発言を自民・参院幹部が公明に陳謝「お詫びコメントするよう指導している」,79,https://news.yahoo.co.jp/articles/8079bb37fde9714dc9e517e277727701843fe157,5/9(金) 12:52
2025-05-09,15:11,domestic,国内,27,時事通信,手取り増へ消費・所得減税　国民民主が参院選公約案,78,https://news.yahoo.co.jp/articles/7f6c450e85b89c4061576db347008d08cf58189b,5/8(木) 16:47
2025-05-09,15:11,domestic,国内,28,共同通信,消費減税見送り、政府・自民調整　社会保障の代替財源確保困難,76,https://news.yahoo.co.jp/articles/974bd37e1bb26d25c02229ee23f5ad705569acbe,5/9(金) 10:30
2025-05-09,15:11,domestic,国内,29,TBS NEWS DIG Powered by JNN,【速報】東証元社員（27）と父親（58）に懲役1年6か月・執行猶予3年・罰金100万円の有罪判決　上場企業の未公開情報によるインサイダー取引事件　東京地裁,75,https://news.yahoo.co.jp/articles/a22c4c340f6f92e24bd0ae1637a28d6316b41e6a,5/9(金) 11:41
2025-05-09,15:11,domestic,国内,30,毎日新聞,コメ価格対策「危機感持って取り組む」　石破首相、消費者離れ危惧,68,https://news.yahoo.co.jp/articles/5a2c2b4f2185f8d5f40fad96898cdb9f764ec08d,5/8(木) 20:17
2025-05-09,15:11,domestic,国内,31,J-CASTニュース,社長が従業員を殴る蹴る...暴行動画がネット拡散　札幌の建設会社側「補償のため示談したい」、支援のバスケチームは契約解除,65,https://news.yahoo.co.jp/articles/4720655693b66af72abf01e6ad35dfe8fbbd30e1,5/8(木) 18:25
2025-05-09,15:11,domestic,国内,32,FNNプライムオンライン,「先生がやられたから逃げるしかなかった」小2授業中の教室に20代と40代の男が侵入し担任に暴行　逮捕の男2人は児童の母親の友人　東京・立川市立第三小学校,62,https://news.yahoo.co.jp/articles/307356bf7988bb1533267fa96da403545928a728,5/8(木) 19:52
2025-05-09,15:11,domestic,国内,33,TBS NEWS DIG Powered by JNN,「プラスとマイナスの面がある」“消費税減税” 石破総理が実施しない意向固める　財源問題などから,60,https://news.yahoo.co.jp/articles/148002257123b32b99833915f94ecc226703a219,5/9(金) 11:53
2025-05-09,15:11,domestic,国内,34,FNNプライムオンライン,児童の母親とタクシーで訪問、正門から侵入…授業中の小学校に男2人が侵入　教職員5人がけが　東京・立川市,59,https://news.yahoo.co.jp/articles/1301446bf6cc7c574bb536d8fa4b19d4e36366a0,5/9(金) 10:02
2025-05-09,15:11,domestic,国内,35,産経新聞,「右の人が入る法案許せるか」発言は北大教授　FBで「学術会議が右派にお墨付きは害」,57,https://news.yahoo.co.jp/articles/31cbc6992e521ba5e7180fc64352112180d45682,5/9(金) 7:00
2025-05-09,15:11,domestic,国内,36,ABEMA TIMES,永田町で吹き荒れる“消費税減税論” 財源はどこから？ 社会保障を圧迫？専門家「豊かな高齢者の年金は抑える議論も必要」,56,https://news.yahoo.co.jp/articles/7f7b496621cb4559f061a9f855ba11ed66ee29eb,5/9(金) 11:22
2025-05-09,15:11,domestic,国内,37,時事通信,在留カード偽造容疑、男2人再逮捕　プリンターで印刷、7千枚超販売か　警視庁,55,https://news.yahoo.co.jp/articles/e6b36974e12d9545995263e34fdb87c6a92ef15a,5/9(金) 14:28
2025-05-09,15:11,domestic,国内,38,読売新聞オンライン,立川小学校襲撃、男２人は瓶をたたきつけ椅子で担任殴る…児童間トラブルで面談した母親と来校,54,https://news.yahoo.co.jp/articles/0118caa564b91783a3feea805132498f5815eade,5/8(木) 20:33
2025-05-09,15:11,domestic,国内,39,プレジデントオンライン,なぜ少子化を女性のせいにしたがるのか…石破首相「少母化」「育児中のスキルアップを」発言で女性憤怒のワケ,54,https://news.yahoo.co.jp/articles/91089aae6fddaf01b5669fd7355c36ccfc4c9331,5/9(金) 10:17
2025-05-09,15:11,domestic,国内,40,時事通信,備蓄米の入札条件緩和検討　買い戻し「原則1年以内」見直し　政府,51,https://news.yahoo.co.jp/articles/1cb8e677d51050944362195edcbbae7b91b4d6a4,5/9(金) 12:33
