scrp_date,scrp_time,genre_en,genre_jp,rank,media_jp,title,comment,link,date_original
2024-10-30,07:06,world,国際,1国連「男系男子」のみを皇位継承者と規定する日本の皇室典範を改定するよう勧告テレビ朝日系（ANN）10/30(水) 1:5059件/時,テレビ朝日系（ANN）,国連「男系男子」のみを皇位継承者と規定する日本の皇室典範を改定するよう勧告,59,https://news.yahoo.co.jp/articles/84f3ab01f1296f4c3139d233260a7f47618fda6b,10/30(水) 1:50
2024-10-30,07:06,world,国際,2ネット通販でブーツを購入、届いた箱の中に生きたサソリを発見。購入者「おもちゃかと思ったら動いた」（海外）BuzzFeed Japan10/30(水) 6:0439件/時,BuzzFeed Japan,ネット通販でブーツを購入、届いた箱の中に生きたサソリを発見。購入者「おもちゃかと思ったら動いた」（海外）,39,https://news.yahoo.co.jp/articles/ec1fc26685e41466dbbed986f803cafeaba21a2d,10/30(水) 6:04
2024-10-30,07:06,world,国際,3韓国・修理中の小便器で用を足そうとした男児…注意したら、その親が逆ギレ「あんたには関係ない」KOREA WAVE10/30(水) 6:0328件/時,KOREA WAVE,韓国・修理中の小便器で用を足そうとした男児…注意したら、その親が逆ギレ「あんたには関係ない」,28,https://news.yahoo.co.jp/articles/2400ada73661b7f0f422762aea80aef60c7a9a7e,10/30(水) 6:03
2024-10-30,07:06,world,国際,4「ウクライナとの停戦は望むが領土は返さない！」…ゆがむロシア世論、巨額の国防費で“麻痺”した経済感覚Wedge（ウェッジ）10/30(水) 5:0227件/時,Wedge（ウェッジ）,「ウクライナとの停戦は望むが領土は返さない！」…ゆがむロシア世論、巨額の国防費で“麻痺”した経済感覚,27,https://news.yahoo.co.jp/articles/6d896e0ac8d456d9564fa54f58d3cf477a86dbab,10/30(水) 5:02
2024-10-30,07:06,world,国際,5女性差別撤廃委、皇室典範改正を勧告共同通信10/29(火) 22:2427件/時,共同通信,女性差別撤廃委、皇室典範改正を勧告,27,https://news.yahoo.co.jp/articles/898e86020c4a4837ec406b7f9f40e177b6e4e0fd,10/29(火) 22:24
2024-10-30,07:06,world,国際,6中国に巨大「豚ビル」　26階建ての養豚場「食いぶちは自分で保て」毎日新聞10/30(水) 5:0027件/時,毎日新聞,中国に巨大「豚ビル」　26階建ての養豚場「食いぶちは自分で保て」,27,https://news.yahoo.co.jp/articles/a22f5f5f8d0e20fa06fd3448ad2638c582d76a82,10/30(水) 5:00
2024-10-30,07:06,world,国際,7皇室典範改正を勧告　選択的夫婦別姓導入を　国連委時事通信10/29(火) 21:4226件/時,時事通信,皇室典範改正を勧告　選択的夫婦別姓導入を　国連委,26,https://news.yahoo.co.jp/articles/25432a23c956c55caf93d293bc39fa9f283ee03c,10/29(火) 21:42
2024-10-30,07:06,world,国際,8北朝鮮兵がウクライナ入りなら「反撃を」共同通信10/30(水) 5:4426件/時,共同通信,北朝鮮兵がウクライナ入りなら「反撃を」,26,https://news.yahoo.co.jp/articles/da02e07f318e57de5ab8ad77885eec3e317047de,10/30(水) 5:44
2024-10-30,07:06,world,国際,9ヒズボラ新指導者にカセム師　対イスラエルで「抵抗継続」　レバノン時事通信10/29(火) 17:4925件/時,時事通信,ヒズボラ新指導者にカセム師　対イスラエルで「抵抗継続」　レバノン,25,https://news.yahoo.co.jp/articles/30a58f0f04da98f1df323fa62f88c6fa1f0c1853,10/29(火) 17:49
2024-10-30,07:06,world,国際,10習近平はもうおしまいなのか…中国人民解放軍で「静かなクーデター」！粛清に反抗してとうとう制服組トップが軍を掌握現代ビジネス10/30(水) 6:0417件/時,現代ビジネス,習近平はもうおしまいなのか…中国人民解放軍で「静かなクーデター」！粛清に反抗してとうとう制服組トップが軍を掌握,17,https://news.yahoo.co.jp/articles/fd181d58d166141e04525b3c6d16a785c59859c0,10/30(水) 6:04
2024-10-30,07:06,world,国際,11女性立候補者の供託金減額を勧告　国連差別撤廃委、国会での平等を共同通信10/30(水) 4:3817件/時,共同通信,女性立候補者の供託金減額を勧告　国連差別撤廃委、国会での平等を,17,https://news.yahoo.co.jp/articles/060449a26db7cfecdc0c3d535517489da6a51123,10/30(水) 4:38
2024-10-30,07:06,world,国際,12ラスト1週間、互角でこう着　トランプ氏、土俵際で底力　失速ハリス氏、挽回に躍起・米大統領選時事通信10/29(火) 7:0717件/時,時事通信,ラスト1週間、互角でこう着　トランプ氏、土俵際で底力　失速ハリス氏、挽回に躍起・米大統領選,17,https://news.yahoo.co.jp/articles/db656197ac1f672a03fb67472aa111be4e06fc6b,10/29(火) 7:07
2024-10-30,07:06,world,国際,13米国連大使がイスラエル非難、「壊滅的なガザ人道危機に対応せず」ロイター10/30(水) 6:1915件/時,ロイター,米国連大使がイスラエル非難、「壊滅的なガザ人道危機に対応せず」,15,https://news.yahoo.co.jp/articles/54d2516f5227c41ddcb9344eceb1b42b56a39b49,10/30(水) 6:19
2024-10-30,07:06,world,国際,14また始まった韓国の「対日スリ寄り」に石破首相は騙される　サムスン電子の「日本に学べ」は「技術をいただいてしまえ」と同義夕刊フジ10/29(火) 17:0015件/時,夕刊フジ,また始まった韓国の「対日スリ寄り」に石破首相は騙される　サムスン電子の「日本に学べ」は「技術をいただいてしまえ」と同義,15,https://news.yahoo.co.jp/articles/8c8b9dabb7da491d7046dc61655a9bf2541384ec,10/29(火) 17:00
2024-10-30,07:06,world,国際,15韓国、北朝鮮参戦に「対応措置」　ウクライナと首脳会談、兵器も共同通信10/29(火) 21:5815件/時,共同通信,韓国、北朝鮮参戦に「対応措置」　ウクライナと首脳会談、兵器も,15,https://news.yahoo.co.jp/articles/bcc4f8448c61a1311be49d5d1dbf7e3d6f5aeb75,10/29(火) 21:58
2024-10-30,07:06,world,国際,16米トランプ集会での差別的発言　波紋広がり続ける　「プエルトリコはごみ島」テレビ朝日系（ANN）10/30(水) 4:3015件/時,テレビ朝日系（ANN）,米トランプ集会での差別的発言　波紋広がり続ける　「プエルトリコはごみ島」,15,https://news.yahoo.co.jp/articles/2dfe5f747455424919755ecb9ef27863977c8143,10/30(水) 4:30
2024-10-30,07:06,world,国際,172:35切りつけられ倒れる子ども達…北京のエリート校で無差別切りつけ5人ケガ「夜も眠れなくて」富裕層狙い?動機不明FNNプライムオンライン（フジテレビ系）10/29(火) 17:4715件/時,FNNプライムオンライン（フジテレビ系）,切りつけられ倒れる子ども達…北京のエリート校で無差別切りつけ5人ケガ「夜も眠れなくて」富裕層狙い?動機不明,15,https://news.yahoo.co.jp/articles/2463efed09a0ec3fed7314a0858a904457996b22,10/29(火) 17:47
2024-10-30,07:06,world,国際,18国連女子差別撤廃委、日本に皇室典範の改正を勧告…選択的夫婦別姓の導入も求める読売新聞オンライン10/30(水) 1:3613件/時,読売新聞オンライン,国連女子差別撤廃委、日本に皇室典範の改正を勧告…選択的夫婦別姓の導入も求める,13,https://news.yahoo.co.jp/articles/528b52075b45ac09e0142a5a401999ae8a115a97,10/30(水) 1:36
2024-10-30,07:06,world,国際,19世界がいよいよ「中国を見捨てる」？...デフレ習近平政権がとった「愚かすぎる対応」とは【アニメで解説】ニューズウィーク日本版10/29(火) 20:3113件/時,ニューズウィーク日本版,世界がいよいよ「中国を見捨てる」？...デフレ習近平政権がとった「愚かすぎる対応」とは【アニメで解説】,13,https://news.yahoo.co.jp/articles/c4839e30eac33b2029f19d79d9b23f225e35fde6,10/29(火) 20:31
2024-10-30,07:06,world,国際,20「地獄の門」砂漠に忽然と現れた“巨大な穴”50年以上燃え続けた炎がついに消える？テレビ朝日系（ANN）10/29(火) 20:1613件/時,テレビ朝日系（ANN）,「地獄の門」砂漠に忽然と現れた“巨大な穴”50年以上燃え続けた炎がついに消える？,13,https://news.yahoo.co.jp/articles/4a2fffc8b9aaffb90e99035576951a434c6b93d7,10/29(火) 20:16
2024-10-30,07:06,world,国際,21自民大敗、でも石破続投......なら、次の政局はいつ、どんな形で訪れるのか?ニューズウィーク日本版10/29(火) 11:0813件/時,ニューズウィーク日本版,自民大敗、でも石破続投......なら、次の政局はいつ、どんな形で訪れるのか?,13,https://news.yahoo.co.jp/articles/f37d45a912ded513021ac0b18511a17097e8406d,10/29(火) 11:08
2024-10-30,07:06,world,国際,22「うちの子は夜も眠れない」“無差別児童切りつけ”北京でも有数の富裕層集まるエリアで…逮捕の男（50）動機は不明　中国FNNプライムオンライン10/29(火) 21:0713件/時,FNNプライムオンライン,「うちの子は夜も眠れない」“無差別児童切りつけ”北京でも有数の富裕層集まるエリアで…逮捕の男（50）動機は不明　中国,13,https://news.yahoo.co.jp/articles/57204ee47327e371958adb0852f3e6d95bf0781a,10/29(火) 21:07
2024-10-30,07:06,world,国際,23飲食物に唾吐き小便を混ぜる姿に驚いたインド…「食の汚染、最大１０年まで懲役を検討」中央日報日本語版10/29(火) 10:4613件/時,中央日報日本語版,飲食物に唾吐き小便を混ぜる姿に驚いたインド…「食の汚染、最大１０年まで懲役を検討」,13,https://news.yahoo.co.jp/articles/6dbb72bd83dc6ef65461aad68b17806adc3ad6c7,10/29(火) 10:46
2024-10-30,07:06,world,国際,24韓国70代男性を死亡させた中学生の暴行…出回る衝撃映像KOREA WAVE10/29(火) 20:0312件/時,KOREA WAVE,韓国70代男性を死亡させた中学生の暴行…出回る衝撃映像,12,https://news.yahoo.co.jp/articles/ad0a2d33c620d5a4223fd25f6e0cd2021d795876,10/29(火) 20:03
2024-10-30,07:06,world,国際,25ブラジル「一帯一路」参加見送り　中国、目算外れる共同通信10/29(火) 21:2911件/時,共同通信,ブラジル「一帯一路」参加見送り　中国、目算外れる,11,https://news.yahoo.co.jp/articles/bd1893b1bf3676693271836a98aac141867a1bd9,10/29(火) 21:29
2024-10-30,07:06,world,国際,26オバマ氏、トランプ氏集会でのプエルトリコ差別発言を厳しく批判CNN.co.jp10/29(火) 17:3610件/時,CNN.co.jp,オバマ氏、トランプ氏集会でのプエルトリコ差別発言を厳しく批判,10,https://news.yahoo.co.jp/articles/5826357978268562281089942c16a22211cd7d43,10/29(火) 17:36
2024-10-30,07:06,world,国際,27韓国の病院・検査結果欄に「豚の脂肪」はひどすぎる…抗議すると医師逆ギレ「二度と来るな」KOREA WAVE10/30(水) 4:0210件/時,KOREA WAVE,韓国の病院・検査結果欄に「豚の脂肪」はひどすぎる…抗議すると医師逆ギレ「二度と来るな」,10,https://news.yahoo.co.jp/articles/a27eccfc8fdcf8fc4eac1b11d41f439eb0114b72,10/30(水) 4:02
2024-10-30,07:06,world,国際,28ウクライナは反撃すべき、北朝鮮軍が越境なら＝バイデン氏ロイター10/30(水) 4:5910件/時,ロイター,ウクライナは反撃すべき、北朝鮮軍が越境なら＝バイデン氏,10,https://news.yahoo.co.jp/articles/07c42ddc1b854746d2ef2ff4b6d8e19ca01abfd1,10/30(水) 4:59
2024-10-30,07:06,world,国際,29北朝鮮部隊がウクライナ入り　「少数」既に活動、前線に順次投入　米報道時事通信10/30(水) 5:139件/時,時事通信,北朝鮮部隊がウクライナ入り　「少数」既に活動、前線に順次投入　米報道,9,https://news.yahoo.co.jp/articles/7148253dbc68d158c6c4274dd090b8ddd029448b,10/30(水) 5:13
2024-10-30,07:06,world,国際,30モスクワで高層ビルより高い「糞水（ふんすい）」噴出！　屈辱動画がウクライナで拡散中ニューズウィーク日本版10/29(火) 21:029件/時,ニューズウィーク日本版,モスクワで高層ビルより高い「糞水（ふんすい）」噴出！　屈辱動画がウクライナで拡散中,9,https://news.yahoo.co.jp/articles/40db33dacc97ab62787379772b7ec6702cd86281,10/29(火) 21:02
2024-10-30,07:06,world,国際,31中古テスラ購入した中国人、充電できず牛で車両引くデモ中央日報日本語版10/29(火) 16:029件/時,中央日報日本語版,中古テスラ購入した中国人、充電できず牛で車両引くデモ,9,https://news.yahoo.co.jp/articles/03fbf2d5a3eb43ba67b8238fec4ee471031ddb78,10/29(火) 16:02
2024-10-30,07:06,world,国際,32韓国・刺し身店、同じ日に別々に来た2組の客、同じような「食中毒」クレーム…実はグル？KOREA WAVE10/30(水) 5:039件/時,KOREA WAVE,韓国・刺し身店、同じ日に別々に来た2組の客、同じような「食中毒」クレーム…実はグル？,9,https://news.yahoo.co.jp/articles/694cdd017b4a48ce9c7b88f0366cd0a04a439b12,10/30(水) 5:03
2024-10-30,07:06,world,国際,33国連、日本に選択的夫婦別姓導入を勧告共同通信10/29(火) 21:079件/時,共同通信,国連、日本に選択的夫婦別姓導入を勧告,9,https://news.yahoo.co.jp/articles/b35355e168c7d5c726ae6cb7af0227bb58ec66cc,10/29(火) 21:07
2024-10-30,07:06,world,国際,34【米大統領選2024】 どういう仕組みなのか簡単に説明BBC News10/29(火) 17:348件/時,BBC News,【米大統領選2024】 どういう仕組みなのか簡単に説明,8,https://news.yahoo.co.jp/articles/c75ae817c3bb6feba7771b3993eccfa74793f8c0,10/29(火) 17:34
2024-10-30,07:06,world,国際,35イスラエル、新たな戦力で反撃へ　イランが再び攻撃なら＝軍幹部ロイター10/30(水) 4:318件/時,ロイター,イスラエル、新たな戦力で反撃へ　イランが再び攻撃なら＝軍幹部,8,https://news.yahoo.co.jp/articles/b6fd0cf108aa7aab96ebd6354a10f5b5b7062e16,10/30(水) 4:31
2024-10-30,07:06,world,国際,360:49国連・女性差別撤廃委員会　選択的夫婦別姓の導入や皇室典範改正を勧告日テレNEWS NNN10/30(水) 0:068件/時,日テレNEWS NNN,国連・女性差別撤廃委員会　選択的夫婦別姓の導入や皇室典範改正を勧告,8,https://news.yahoo.co.jp/articles/ab9cd00d51aae834e95287165c9bd3bbb69280dc,10/30(水) 0:06
2024-10-30,07:06,world,国際,37トランプ氏、移民らの人間性を奪う発言を激化。「アメリカは貧しい国からの難民らの『捨て場所』になっている」ハフポスト日本版10/29(火) 7:408件/時,ハフポスト日本版,トランプ氏、移民らの人間性を奪う発言を激化。「アメリカは貧しい国からの難民らの『捨て場所』になっている」,8,https://news.yahoo.co.jp/articles/cdb065bdfaf6d84df75e9c5cd15b42597234c183,10/29(火) 7:40
2024-10-30,07:06,world,国際,38玉木国民民主代表、自公連立入り「全くない」　政策で協力求めるロイター10/29(火) 11:098件/時,ロイター,玉木国民民主代表、自公連立入り「全くない」　政策で協力求める,8,https://news.yahoo.co.jp/articles/471cb40fba4432141ffc3d0f9b15961c52a6f62f,10/29(火) 11:09
2024-10-30,07:06,world,国際,39夫婦同姓義務見直しに「何の行動もない」共同通信10/29(火) 21:358件/時,共同通信,夫婦同姓義務見直しに「何の行動もない」,8,https://news.yahoo.co.jp/articles/09dea908948c463a2a91d0e96625329c5b19b324,10/29(火) 21:35
2024-10-30,07:06,world,国際,40イスラエル国会、UNRWAの活動禁止へ 法案可決ＡＦＰ＝時事10/29(火) 9:317件/時,ＡＦＰ＝時事,イスラエル国会、UNRWAの活動禁止へ 法案可決,7,https://news.yahoo.co.jp/articles/425b9dbfeee185b73aafae0fd17e92777d9288c3,10/29(火) 9:31
