scrp_date,scrp_time,genre_en,genre_jp,rank,media_jp,title,comment,link,date_original
2024-10-12,11:26,business,経済,1ローソン、ファミマが増益　セブン苦戦で明暗　8月中間決算時事通信10/11(金) 19:32359件/時,時事通信,ローソン、ファミマが増益　セブン苦戦で明暗　8月中間決算,359,https://news.yahoo.co.jp/articles/9c6fd5499142bc780bb2ae5be9825a3851ac7d49,10/11(金) 19:32
2024-10-12,11:26,business,経済,2「損した気分」「松屋はやめて吉野家に行くか…」との声も。牛丼チェーンが導入し始めた「深夜料金」に不満の声が続出する“本質的な理由”　東洋経済オンライン10/12(土) 6:56206件/時,東洋経済オンライン,「損した気分」「松屋はやめて吉野家に行くか…」との声も。牛丼チェーンが導入し始めた「深夜料金」に不満の声が続出する“本質的な理由”,206,https://news.yahoo.co.jp/articles/1ebe7cafd049e35306d861c3d13334adef9f7802,10/12(土) 6:56
2024-10-12,11:26,business,経済,3日本郵便の顧客１５５万人超の情報流用、郵政民営化前の慣例継続か…同意得ず勧誘目的でリスト作成は保険業法違反読売新聞オンライン10/12(土) 7:2996件/時,読売新聞オンライン,日本郵便の顧客１５５万人超の情報流用、郵政民営化前の慣例継続か…同意得ず勧誘目的でリスト作成は保険業法違反,96,https://news.yahoo.co.jp/articles/5af7289706a12287f14496e58250637d5b2a6997,10/12(土) 7:29
2024-10-12,11:26,business,経済,4自転車の「注意義務違反」が11月から「犯罪」に　スマホを手に持って運転したら一発アウト！関西テレビ10/12(土) 8:0094件/時,関西テレビ,自転車の「注意義務違反」が11月から「犯罪」に　スマホを手に持って運転したら一発アウト！,94,https://news.yahoo.co.jp/articles/66ba925608636b6aaaeadce4c078fee4b90de9ca,10/12(土) 8:00
2024-10-12,11:26,business,経済,550議席減もある？自民「公認・非公認」騒動の末路、公明党も巻き込んで訳がわからない状態に東洋経済オンライン10/12(土) 8:0262件/時,東洋経済オンライン,50議席減もある？自民「公認・非公認」騒動の末路、公明党も巻き込んで訳がわからない状態に,62,https://news.yahoo.co.jp/articles/262ee7f3b1d801e740e49234fea36f241c510301,10/12(土) 8:02
2024-10-12,11:26,business,経済,6「5キロ4000円」の高級米を安く買い叩かれる…「初の品薄」に直面した魚沼の農家が農協に卸すのをやめた理由プレジデントオンライン10/12(土) 9:1746件/時,プレジデントオンライン,「5キロ4000円」の高級米を安く買い叩かれる…「初の品薄」に直面した魚沼の農家が農協に卸すのをやめた理由,46,https://news.yahoo.co.jp/articles/c6bf92b60d0f1411c63d7ea611874cc755d3eafd,10/12(土) 9:17
2024-10-12,11:26,business,経済,7「女性は運転が下手」は本当なのか!? トラック2200万件のデータを分析してわかった衝撃のジェンダーギャップとは?ベストカーWeb10/12(土) 10:0044件/時,ベストカーWeb,「女性は運転が下手」は本当なのか!? トラック2200万件のデータを分析してわかった衝撃のジェンダーギャップとは?,44,https://news.yahoo.co.jp/articles/438514e948af74665a4474f1e73ba68fa3cbcf35,10/12(土) 10:00
2024-10-12,11:26,business,経済,8「大阪生まれの在日3世」が、日本と韓国の「Z世代の学生どうし」の議論に驚いたワケ現代ビジネス10/12(土) 7:0543件/時,現代ビジネス,「大阪生まれの在日3世」が、日本と韓国の「Z世代の学生どうし」の議論に驚いたワケ,43,https://news.yahoo.co.jp/articles/22a8934dbac889bcb00ebdb084a3510b978f5ad7,10/12(土) 7:05
2024-10-12,11:26,business,経済,9ゆうちょ顧客155万人分の情報、かんぽ営業に流用　保険業法違反か朝日新聞デジタル10/11(金) 15:3038件/時,朝日新聞デジタル,ゆうちょ顧客155万人分の情報、かんぽ営業に流用　保険業法違反か,38,https://news.yahoo.co.jp/articles/273159397088758ae204da2c122e26e84f1665c4,10/11(金) 15:30
2024-10-12,11:26,business,経済,10石破新政権は「アベノミクスからの本格決別」果たせるのかダイヤモンド・オンライン10/12(土) 10:4636件/時,ダイヤモンド・オンライン,石破新政権は「アベノミクスからの本格決別」果たせるのか,36,https://news.yahoo.co.jp/articles/ef5cfe14e648c56a2d6828047092936b600abf77,10/12(土) 10:46
2024-10-12,11:26,business,経済,11裏金議員ら《非公認＝二重処罰》主張の呆れたご都合主義…改憲主張から一転「憲法を守れ」の身勝手日刊ゲンダイDIGITAL10/12(土) 9:0633件/時,日刊ゲンダイDIGITAL,裏金議員ら《非公認＝二重処罰》主張の呆れたご都合主義…改憲主張から一転「憲法を守れ」の身勝手,33,https://news.yahoo.co.jp/articles/501d231cfc00ccb5eba155ef4409983018572054,10/12(土) 9:06
2024-10-12,11:26,business,経済,12「なぜ狭い道ばかり……」グーグルマップが“変なルート”を案内するのには理由があった！ 人気ナンバーワン「無料地図アプリ」の泣き所とはVAGUE10/11(金) 12:1029件/時,VAGUE,「なぜ狭い道ばかり……」グーグルマップが“変なルート”を案内するのには理由があった！ 人気ナンバーワン「無料地図アプリ」の泣き所とは,29,https://news.yahoo.co.jp/articles/d26c09205cb40c87fa7004c4df6a78fc2815612c,10/11(金) 12:10
2024-10-12,11:26,business,経済,13石破内閣は思ったよりもしぶといかもしれない東洋経済オンライン10/12(土) 9:3228件/時,東洋経済オンライン,石破内閣は思ったよりもしぶといかもしれない,28,https://news.yahoo.co.jp/articles/378546db6aafe7061033c487b3ff46bdc85d03d5,10/12(土) 9:32
2024-10-12,11:26,business,経済,14「働かないおじさん」か、エリート管理職か…多くの50代会社員が直面する「深刻な危機」現代ビジネス10/12(土) 6:5522件/時,現代ビジネス,「働かないおじさん」か、エリート管理職か…多くの50代会社員が直面する「深刻な危機」,22,https://news.yahoo.co.jp/articles/f6d264e0ca00e39003765db6edb7bf69ce841fd7,10/12(土) 6:55
2024-10-12,11:26,business,経済,15ホンダ、中国・武漢でEV専用工場の開所式　年産能力12万台　840億円投じ中国事業てこ入れ日刊自動車新聞10/12(土) 10:1221件/時,日刊自動車新聞,ホンダ、中国・武漢でEV専用工場の開所式　年産能力12万台　840億円投じ中国事業てこ入れ,21,https://news.yahoo.co.jp/articles/f7f1ac6d2fd69caccfbb0eaeb19c31786d37fc4e,10/12(土) 10:12
2024-10-12,11:26,business,経済,16「東九州新幹線」は結局実現するのか？ TSMC進出で変わる九州の産業構造、3つのルートが示す地域経済発展のカギとはMerkmal10/12(土) 6:1120件/時,Merkmal,「東九州新幹線」は結局実現するのか？ TSMC進出で変わる九州の産業構造、3つのルートが示す地域経済発展のカギとは,20,https://news.yahoo.co.jp/articles/2095b59e772327c910694f08bfed7c15d609e40e,10/12(土) 6:11
2024-10-12,11:26,business,経済,17百貨店の顔だった「エレベーターガール」、彼女たちはいつその姿を消したのか？ 背後にあったさまざまな歴史とはMerkmal10/12(土) 9:4020件/時,Merkmal,百貨店の顔だった「エレベーターガール」、彼女たちはいつその姿を消したのか？ 背後にあったさまざまな歴史とは,20,https://news.yahoo.co.jp/articles/4c7fa7f09c3f5bbf995db491831353254a8f2c24,10/12(土) 9:40
2024-10-12,11:26,business,経済,18【マイナ保険証】資格情報は捨ててもいい？資格確認書と何が違う？よくあるギモンにお答えLIMO10/12(土) 5:1718件/時,LIMO,【マイナ保険証】資格情報は捨ててもいい？資格確認書と何が違う？よくあるギモンにお答え,18,https://news.yahoo.co.jp/articles/9a456caa893b60c2658c8062213ffa0a59ba89ec,10/12(土) 5:17
2024-10-12,11:26,business,経済,19石破首相「政策活動費」温存→“裏金隠し”に20億円実弾投入！党首討論で「衆院選に使う」明言の二枚舌日刊ゲンダイDIGITAL10/12(土) 9:0617件/時,日刊ゲンダイDIGITAL,石破首相「政策活動費」温存→“裏金隠し”に20億円実弾投入！党首討論で「衆院選に使う」明言の二枚舌,17,https://news.yahoo.co.jp/articles/4bb9dbc48390cfe3a8f186f2fa3d8752e81724e6,10/12(土) 9:06
2024-10-12,11:26,business,経済,20君…誰だっ!!!! 登場した頃の面影はどこにいったの いくらなんでも変わりすぎなクルマ10選【10年前の再録記事プレイバック】ベストカーWeb10/12(土) 9:0016件/時,ベストカーWeb,君…誰だっ!!!! 登場した頃の面影はどこにいったの いくらなんでも変わりすぎなクルマ10選【10年前の再録記事プレイバック】,16,https://news.yahoo.co.jp/articles/6760adbeddd6f0a053103750cacc0676253d471e,10/12(土) 9:00
2024-10-12,11:26,business,経済,21新NISAブームは「洗脳」だった？　「政府の欺瞞」に森永卓郎氏が警鐘［ノンフィクションベストセラー］Book Bang10/12(土) 6:0016件/時,Book Bang,新NISAブームは「洗脳」だった？　「政府の欺瞞」に森永卓郎氏が警鐘［ノンフィクションベストセラー］,16,https://news.yahoo.co.jp/articles/1002e000b3399b9829369a4784e467dfcabcc068,10/12(土) 6:00
2024-10-12,11:26,business,経済,22石破政権で変わる？原発支援で電気料金上がるか毎日新聞10/12(土) 9:3015件/時,毎日新聞,石破政権で変わる？原発支援で電気料金上がるか,15,https://news.yahoo.co.jp/articles/89a07e698705fa6822e2dfe12bfdd97a14d6a918,10/12(土) 9:30
2024-10-12,11:26,business,経済,23テスラ株、9％近く下落　自動運転実現に懐疑的見方共同通信10/12(土) 7:1815件/時,共同通信,テスラ株、9％近く下落　自動運転実現に懐疑的見方,15,https://news.yahoo.co.jp/articles/58e044a9fb4c2b54cc4ef26c3204d32361bdfd0a,10/12(土) 7:18
2024-10-12,11:26,business,経済,24高級ホテルでドライヤーやバスローブ、ハンガーなどの備品が盗まれる…旅行業界で「インバウンドの客よりも悪かった」と囁かれる客層とは？THE GOLD ONLINE（ゴールドオンライン）10/12(土) 5:0214件/時,THE GOLD ONLINE（ゴールドオンライン）,高級ホテルでドライヤーやバスローブ、ハンガーなどの備品が盗まれる…旅行業界で「インバウンドの客よりも悪かった」と囁かれる客層とは？,14,https://news.yahoo.co.jp/articles/09392736584431f079a0e2f8dea0d13ec6d4899f,10/12(土) 5:02
2024-10-12,11:26,business,経済,25女性の理系人材を増やせ！　カギは親の“認識”にあり【WBS】テレ東BIZ10/12(土) 9:5513件/時,テレ東BIZ,女性の理系人材を増やせ！　カギは親の“認識”にあり【WBS】,13,https://news.yahoo.co.jp/articles/809f94a49a230af4027787d3b349562fdb469acd,10/12(土) 9:55
2024-10-12,11:26,business,経済,26一人カフェで「トイレ離席時に荷物をどうするか」悩ましい問題　「仕方なく財布だけ持って行く」「店員の近くに席をとる」…それぞれの対処法マネーポストWEB10/11(金) 16:1513件/時,マネーポストWEB,一人カフェで「トイレ離席時に荷物をどうするか」悩ましい問題　「仕方なく財布だけ持って行く」「店員の近くに席をとる」…それぞれの対処法,13,https://news.yahoo.co.jp/articles/dac0b8ea61757542ad08d05bd8200bea4a96497a,10/11(金) 16:15
2024-10-12,11:26,business,経済,270:51トヨタ、再びF1へ　米チームと業務提携テレビ朝日系（ANN）10/12(土) 9:2413件/時,テレビ朝日系（ANN）,トヨタ、再びF1へ　米チームと業務提携,13,https://news.yahoo.co.jp/articles/14ac7f98f069638d96a751ac11be1b459eae9248,10/12(土) 9:24
2024-10-12,11:26,business,経済,28鈴鹿8耐のバニャイア参戦に現実味。加賀山就臣監督「今年もオファーしていた。マルケス兄弟を呼ぶのもいいかな」Webikeプラス10/12(土) 8:4012件/時,Webikeプラス,鈴鹿8耐のバニャイア参戦に現実味。加賀山就臣監督「今年もオファーしていた。マルケス兄弟を呼ぶのもいいかな」,12,https://news.yahoo.co.jp/articles/49a3b862b7c4f6672e6ab5bd31b0df76056f6308,10/12(土) 8:40
2024-10-12,11:26,business,経済,29ボーイング、従業員1.7万人削減　777Xは26年に納入延期、767Fは27年生産完了Aviation Wire10/12(土) 8:4012件/時,Aviation Wire,ボーイング、従業員1.7万人削減　777Xは26年に納入延期、767Fは27年生産完了,12,https://news.yahoo.co.jp/articles/68709c3cd623eb6e9fc10cbc62807ac84a01d311,10/12(土) 8:40
2024-10-12,11:26,business,経済,30ゼンショーによる買収から1年半、こんなに変わるとは…！　ロッテリア「490円モーニング」におったまげた朝東洋経済オンライン10/12(土) 6:0212件/時,東洋経済オンライン,ゼンショーによる買収から1年半、こんなに変わるとは…！　ロッテリア「490円モーニング」におったまげた朝,12,https://news.yahoo.co.jp/articles/6a199511e33bc85be2b095b295cee75c141a7c8e,10/12(土) 6:02
2024-10-12,11:26,business,経済,31無謀な「追い越し・逆走」当たり前!? 交通ルールを知らない「自転車」増加！ 「クルマvs自転車」とくに危ないシチュエーションとはくるまのニュース10/11(金) 20:2511件/時,くるまのニュース,無謀な「追い越し・逆走」当たり前!? 交通ルールを知らない「自転車」増加！ 「クルマvs自転車」とくに危ないシチュエーションとは,11,https://news.yahoo.co.jp/articles/d6f29dff87edc752bd9d726e4948d19be1f3169e,10/11(金) 20:25
2024-10-12,11:26,business,経済,32難航する羊蹄トンネル工事を視察　北海道新幹線の札幌延伸は見通せず朝日新聞デジタル10/12(土) 9:3011件/時,朝日新聞デジタル,難航する羊蹄トンネル工事を視察　北海道新幹線の札幌延伸は見通せず,11,https://news.yahoo.co.jp/articles/2e0f91ac6c4402ed54ca7b5e370bdf98e23d05cb,10/12(土) 9:30
2024-10-12,11:26,business,経済,3312席だけ！ 「豪華夜行バス」のパイオニア、運転も神ワザ!? “靴を脱ぐ”運転士の神髄を体感乗りものニュース10/12(土) 8:1211件/時,乗りものニュース,12席だけ！ 「豪華夜行バス」のパイオニア、運転も神ワザ!? “靴を脱ぐ”運転士の神髄を体感,11,https://news.yahoo.co.jp/articles/b757addda53b92cb1b6b074095c965deea12ff80,10/12(土) 8:12
2024-10-12,11:26,business,経済,34多くの人がいつでも「仕事を辞めてやる！」と言えない「社会に巣食う病理」現代ビジネス10/12(土) 6:5510件/時,現代ビジネス,多くの人がいつでも「仕事を辞めてやる！」と言えない「社会に巣食う病理」,10,https://news.yahoo.co.jp/articles/27f4e6b4c0e42979012796c9fd56c24362ace960,10/12(土) 6:55
2024-10-12,11:26,business,経済,35緩やかに縮小するヤマダデンキ。再び「売上2兆円」を目指すも、人口減少や家電の低価格化に抗えず週刊SPA!10/12(土) 8:5410件/時,週刊SPA!,緩やかに縮小するヤマダデンキ。再び「売上2兆円」を目指すも、人口減少や家電の低価格化に抗えず,10,https://news.yahoo.co.jp/articles/d304d8ea9ee67c22dd8ed31f0940b481bb270332,10/12(土) 8:54
2024-10-12,11:26,business,経済,36年収30万円か500万円か、超高齢ニッポンの「厳しい現実」現代ビジネス10/12(土) 6:1510件/時,現代ビジネス,年収30万円か500万円か、超高齢ニッポンの「厳しい現実」,10,https://news.yahoo.co.jp/articles/d818fd01baebed14ee6a0f2b29af708d469c780e,10/12(土) 6:15
2024-10-12,11:26,business,経済,37ミスチルの推し活仲間3人が起業「そんなしんどいなら辞めちゃえば」のひと言で看護師から経営者へ「事業所名はミスチルの名曲から」CHANTO WEB10/12(土) 6:3210件/時,CHANTO WEB,ミスチルの推し活仲間3人が起業「そんなしんどいなら辞めちゃえば」のひと言で看護師から経営者へ「事業所名はミスチルの名曲から」,10,https://news.yahoo.co.jp/articles/0e8d5096f29eca9750156ccfaa634959942d4afc,10/12(土) 6:32
2024-10-12,11:26,business,経済,38「あんた今しんどいやろ」患者に言われ号泣した看護師 こころを病みながら働く人が多すぎる現実「支えるには訪問看護しかないと」CHANTO WEB10/12(土) 6:329件/時,CHANTO WEB,「あんた今しんどいやろ」患者に言われ号泣した看護師 こころを病みながら働く人が多すぎる現実「支えるには訪問看護しかないと」,9,https://news.yahoo.co.jp/articles/809eecb093beeba6db7d7292b5afd84b40c75c16,10/12(土) 6:32
2024-10-12,11:26,business,経済,39全長1.9m！ スズキの斬新「１人乗り軽トラ」に大注目！ 実用的な“小さな商用車”なのに「スポーティ」！ めちゃ楽しそうな「スズカーゴ」とは！くるまのニュース10/12(土) 7:409件/時,くるまのニュース,全長1.9m！ スズキの斬新「１人乗り軽トラ」に大注目！ 実用的な“小さな商用車”なのに「スポーティ」！ めちゃ楽しそうな「スズカーゴ」とは！,9,https://news.yahoo.co.jp/articles/6cfa92036bd94c114f03a07fb7a8544b0002fa47,10/12(土) 7:40
2024-10-12,11:26,business,経済,40ライトオンがワールド傘下で再建、ジーンズの限界。自力再建は断念、今後も大量閉店が続く見通し東洋経済オンライン10/12(土) 7:329件/時,東洋経済オンライン,ライトオンがワールド傘下で再建、ジーンズの限界。自力再建は断念、今後も大量閉店が続く見通し,9,https://news.yahoo.co.jp/articles/538fbd0edcc5f48cae87f925d35def7fc71aa6cf,10/12(土) 7:32
