scrp_date,scrp_time,genre_en,genre_jp,rank,media_jp,title,comment,link,date_original
2025-10-10,23:07,TTL,総合,1,FNNプライムオンライン（フジテレビ系）,【速報】自公連立”解消”へ　注目の自公党首会談が終了　企業団体献金の規制強化で隔たり,1816,https://news.yahoo.co.jp/articles/4a0b47ba4c1af44be06c19365f604cd522b12069,10/10(金) 15:42
2025-10-10,23:07,TTL,総合,2,FNNプライムオンライン（フジテレビ系）,【速報】自民・高市総裁「一方的に。大変残念」公明党からの連立離脱の通告受けて,1496,https://news.yahoo.co.jp/articles/10a123430bfe9256635f44156b0e40e24200c692,10/10(金) 16:53
2025-10-10,23:07,TTL,総合,3,毎日新聞,前橋市長ホテル問題　相手の市職員男性、「事情説明書」を提出,1109,https://news.yahoo.co.jp/articles/def8dd904847cbbcbea949465b80879426142cbc,10/10(金) 16:03
2025-10-10,23:07,TTL,総合,4,時事通信,立民、公明取り込みへ働き掛け　国民民主、連立入り否定的,1006,https://news.yahoo.co.jp/articles/7b7c7547fe940b837a93c2a6bf0bdd792d724151,10/10(金) 16:40
2025-10-10,23:07,TTL,総合,5,ロイター,玉木国民代表「首相務める覚悟ある」、公明の連立離脱で,854,https://news.yahoo.co.jp/articles/2b8d0f71b3cbd60d5beeb1ceb7ef9c3c5e6fce7f,10/10(金) 17:35
2025-10-10,23:07,TTL,総合,6,FNNプライムオンライン（フジテレビ系）,【速報】自民との連立政権「一旦白紙」公明・斉藤代表…「政治とカネ問題への基本姿勢に意見の相違」と説明,711,https://news.yahoo.co.jp/articles/104c9fd0ce9d5de34302c3d695e5c1b53374653d,10/10(金) 16:03
2025-10-10,23:07,TTL,総合,7,女性自身,「無礼がすぎる」報ステ大越キャスター　高市早苗新総裁への生中継インタビューが物議,672,https://news.yahoo.co.jp/articles/3abc8b675ccea78bb482321c3b8ccdbdcffead3f,10/10(金) 19:15
2025-10-10,23:07,TTL,総合,8,デイリースポーツ,【高市自民】公明決裂→高市総裁が凄い形相で会見　怒り爆発　私が総裁だから離脱するのか！「一方的に離脱伝えられた」不満爆発,640,https://news.yahoo.co.jp/articles/3fc4c2cd13fe1efaafee1495d65ade456fc2939e,10/10(金) 17:13
2025-10-10,23:07,TTL,総合,9,毎日新聞,トランプ氏、ノーベル平和賞受賞ならず　八つの戦争解決と主張も,532,https://news.yahoo.co.jp/articles/4942550144564bef43f12a8d416f163b62cb4377,10/10(金) 18:01
2025-10-10,23:07,TTL,総合,10,集英社オンライン,「さらば自民党！」高市自民に公明が怒りの絶縁状をつきつけた本当の理由…政界再編で“高市総理”に黄色信号？,457,https://news.yahoo.co.jp/articles/08fbb86c0e26c8309c58e0a76e4da8fbb2f3896d,10/10(金) 20:57
2025-10-10,23:07,TTL,総合,11,時事通信,公明離脱で株先物が急落　「高市トレード」逆転か,449,https://news.yahoo.co.jp/articles/f1dd1c1750fc7fbeb7e2da62cb9c9c55d6f79eef,10/10(金) 17:05
2025-10-10,23:07,TTL,総合,12,ABEMA TIMES,森保ジャパン、南米パラグアイに2ー2ドロー　エース・上田綺世が出場5分で土壇場同点弾も3戦未勝利でブラジル戦へ,430,https://news.yahoo.co.jp/articles/5bc66eb4e873ac6454cc4941a9cb2baf73f3a05e,10/10(金) 21:18
2025-10-10,23:07,TTL,総合,13,毎日新聞,公明、連立離脱の見方強まる　閣外協力に転じる案が浮上,408,https://news.yahoo.co.jp/articles/e533044fc2216aa6f96287fae8f2bc829f4b7655,10/10(金) 5:00
2025-10-10,23:07,TTL,総合,14,スポーツ報知,公明党・斉藤鉄夫代表、ＮＨＫインタビューで「小泉総裁だったら離脱しなかったか？」と問われ「小泉さんが新総裁だったら…」,367,https://news.yahoo.co.jp/articles/2e21d694975148be976deeb4224cd5d60c80086c,10/10(金) 21:48
2025-10-10,23:07,TTL,総合,15,テレビ朝日系（ANN）,【独自】政府がアメリカ車の公用車導入を検討　日米関税交渉を踏まえて,331,https://news.yahoo.co.jp/articles/3404d2c1a6b4dc6bd62e5198538aa7c2949fbf1d,10/10(金) 10:31
2025-10-10,23:07,TTL,総合,16,デイリースポーツ,【高市自民】ネット騒然「石破の最後っ屁ｗ」「なんて日だ」　公明決裂で高市総裁が怒り会見→３０分後→石破首相が高市氏が反対する戦後８０年会見「最後にやりやがった」「ワロタ」　所感スピーチは流石の内容,326,https://news.yahoo.co.jp/articles/ef5461613136ec105b38d7290a9ca0067cbda0f6,10/10(金) 18:16
2025-10-10,23:07,TTL,総合,17,J-CASTニュース,「玉木雄一郎首相」野党が担ぎたがっている　でも本人は及び腰...代わりに名前が挙がった仰天の「候補者」,323,https://news.yahoo.co.jp/articles/657ac7c492e1cba5e22f40415e0473b3dfb96ec8,10/10(金) 19:30
2025-10-10,23:07,TTL,総合,18,FNNプライムオンライン（フジテレビ系）,立憲・野田代表が国民民主に再度ラブコール「基本政策の共有部分は確認できている。決して水と油ではない」自公連立”解消か”で注目の野党連立実現に向け,319,https://news.yahoo.co.jp/articles/2e9dea60e9167d50af15512d414dad1b97f54af4,10/10(金) 12:46
2025-10-10,23:07,TTL,総合,19,デイリースポーツ,【高市自民】自公終了→公明代表が衝撃の決裂ワード「とても首班指名で高市早苗と書けない」　自民１９６＜立憲維新国民２１０＝「玉木雄一郎首相」の可能性,312,https://news.yahoo.co.jp/articles/ebc70f635b55ba66f82e5c654cb566f74dcc71aa,10/10(金) 16:18
2025-10-10,23:07,TTL,総合,20,J-CASTニュース,議員会館に中国製ロボット掃除機はダメなのか　自民・小野田議員の主張に立憲・米山議員が異論,311,https://news.yahoo.co.jp/articles/469ec9676e1bad9ee9211632cd27caf858fb57d5,10/10(金) 13:45
2025-10-10,23:07,TTL,総合,21,デイリースポーツ,【高市自民】自公決裂　維新・吉村代表「玉木雄一郎首相」→ＴＶ衝撃発言「立憲と国民が本気でやるなら、僕も本気で」嵐の政権交代　維新は決選直前まで考える,296,https://news.yahoo.co.jp/articles/a9d44c375901be7a9770389e34295faab87f3922,10/10(金) 22:03
2025-10-10,23:07,TTL,総合,22,共同通信,公明、連立離脱の是非判断　高市、斉藤氏が午後会談,290,https://news.yahoo.co.jp/articles/7c9ade9b16ed44d04c0b27647a1ba61e157a0ee6,10/10(金) 9:54
2025-10-10,23:07,TTL,総合,23,日刊スポーツ,「内閣総理大臣務める覚悟あります」玉木雄一郎代表にＸ「野党に乗ったら終わり」「今じゃない」,289,https://news.yahoo.co.jp/articles/f854876dfb1c1f3ec73e6acd7876f35b193f47e7,10/10(金) 20:04
2025-10-10,23:07,TTL,総合,24,日刊スポーツ,玉木雄一郎代表「私には内閣総理大臣を務める覚悟があります」２連発！その後…立民提案にクギ,262,https://news.yahoo.co.jp/articles/b0f6e500dde4cddca7bdb1a4e6892a7f61ab7061,10/10(金) 19:23
2025-10-10,23:07,TTL,総合,25,スポーツ報知,「Ｎスタ」コメンテーター、公明党の連立離脱に私見「高市氏が新総裁になっていなかったら、ここまでにはなっていなかった」,214,https://news.yahoo.co.jp/articles/4eec6905c8a9e48559036b65b589185259477489,10/10(金) 16:39
2025-10-10,23:07,TTL,総合,26,デイリー新潮,自民党「初の女性総裁」誕生に“女性が眉をひそめる”のはナゼか…「高市早苗氏」に批判的な声が上がる理由を「女性活躍推進委員会の元理事」が解説,214,https://news.yahoo.co.jp/articles/da8cd4a0d80663df9c05e3de80751e6d8dc1a07d,10/10(金) 6:14
2025-10-10,23:07,TTL,総合,27,デイリースポーツ,【高市自民】自公決裂→自民から仕掛けた指摘も　田崎史郎氏、高市執行部は「麻生さん筆頭に公明嫌いの人ばっかり」　公明に火に油→ケンカ売る形になった懸念人物の幹部起用,195,https://news.yahoo.co.jp/articles/5700561d52553ba92b49835288a24c4a247e0e78,10/10(金) 21:17
2025-10-10,23:07,TTL,総合,28,時事通信,在留外国人、過去最多395万人　人口比3．2％に　鈴木法相,193,https://news.yahoo.co.jp/articles/3cce48665ea817b39941524cfa0dfbf3cc942473,10/10(金) 11:15
2025-10-10,23:07,TTL,総合,29,デイリースポーツ,杉村太蔵氏、公明党の本音を推察　もし本当に政治とカネ問題なら「じゃあなんで石破政権の時に言わなかった？」,191,https://news.yahoo.co.jp/articles/95ae72cae97e22fcb8fd17528c6a60d33ecff9ac,10/10(金) 14:46
2025-10-10,23:07,TTL,総合,30,スポーツ報知,「報ステ」大越健介キャスター、公明党の連立離脱報じ「日本の政治に激震が走っています」,179,https://news.yahoo.co.jp/articles/2c5a580f620df89b23f1d15f48bc1c53a7ea7682,10/10(金) 22:24
2025-10-10,23:07,TTL,総合,31,毎日新聞,石破首相、戦後80年所感を発表　歴史検証「惨禍繰り返さない」,177,https://news.yahoo.co.jp/articles/73760e4a5ea7507c4f7686ff91072cf7d8d6c377,10/10(金) 17:34
2025-10-10,23:07,TTL,総合,32,デイリースポーツ,【高市自民】自公決裂→公明代表が衝撃の選挙絶縁通告→自民が壊滅危機、次回選挙で大量落選か「自民候補は推薦しません」公明組織票を撤収,176,https://news.yahoo.co.jp/articles/8f3bac7f89d7a011e1e57d45b16445f990652888,10/10(金) 19:25
2025-10-10,23:07,TTL,総合,33,鉄道コム,JR東、SixTONESタイアップの発車メロディを使用中止 「安全面での懸念」が理由,166,https://news.yahoo.co.jp/articles/79bf5351182511a7ec16728769b118616f9493fc,10/10(金) 12:02
2025-10-10,23:07,TTL,総合,34,デイリースポーツ,【高市自民】自公決裂→公明代表が衝撃理由　ネットも荒れた高市総裁が党幹部にした人物も問題　重要政策でもない自民党の不祥事をかばうのはムリ！「もう限界」と,163,https://news.yahoo.co.jp/articles/9b1694fa265df2d167d5f53da8a4650ecfa36b9e,10/10(金) 17:34
2025-10-10,23:07,TTL,総合,35,読売新聞オンライン,「総総分離でしのぐしかない」公明の連立離脱でささやかれだした仰天シナリオ,162,https://news.yahoo.co.jp/articles/96d326a5a400d7726b43298470d3146fba12914e,10/10(金) 19:57
2025-10-10,23:07,TTL,総合,36,IAT岩手朝日テレビ,【速報】雫石町の林の中で70代男性の遺体　クマに襲われたか　前日からキノコ採りに出かけ帰宅せず【岩手】,160,https://news.yahoo.co.jp/articles/2566fcde9bcf1744e34f82a292599f5d7de8ef4e,10/10(金) 11:33
2025-10-10,23:07,TTL,総合,37,スポニチアネックス,人気ユーチューバー・ゆん　第2子男児出産を報告「無事に出産しました」夫・シルクロードともに喜び伝える,158,https://news.yahoo.co.jp/articles/e4fe5e6234c5dc50e60b37be9abfbceda5a8abd5,10/10(金) 19:00
2025-10-10,23:07,TTL,総合,38,読売新聞オンライン,前橋市の男性職員、小川市長の身辺探る動き知り「人目を気にせず話せる」ホテル提案…議会に経緯説明文書,152,https://news.yahoo.co.jp/articles/bd6a812cb9992def47ac26ce0645061ee6908ae6,10/10(金) 20:11
2025-10-10,23:07,TTL,総合,39,時事通信,高市氏「裏金」で板挟み　公明圧力、旧安倍派は反発,147,https://news.yahoo.co.jp/articles/b350b326d3ba823a161b2827c033b892b158e7ae,10/10(金) 7:03
2025-10-10,23:07,TTL,総合,40,MBSニュース,【速報】「ブレイキングダウン」出場の韓国籍格闘家ら逮捕　『金メダル』装い首から純金さげさせ３．５キロを密輸疑い,145,https://news.yahoo.co.jp/articles/00d7f1e339b3476639dbfb07ef46edf3a10e5a42,10/10(金) 11:30
