scrp_date,scrp_time,genre_en,genre_jp,rank,media_jp,title,comment,link,date_original
2025-05-14,14:08,world,国際,1,中央日報日本語版,パスポート要求後、宿泊を拒否した日本ホテルに損害賠償訴訟…宿泊客は永住資格を持つ在日コリアン３世,298,https://news.yahoo.co.jp/articles/244bbb51caf6b262bd118e50dcf53f0a900dbe53,5/14(水) 9:26
2025-05-14,14:08,world,国際,2,ロイター,ゼレンスキー氏、プーチン氏に直接会談迫る　「怖いのか」と挑発,176,https://news.yahoo.co.jp/articles/a354e08d187f78a2123ba3871480de7c3581650d,5/14(水) 8:29
2025-05-14,14:08,world,国際,3,KOREA WAVE,フランス旅行の韓国人女性、生配信中に浴びせられた衝撃の差別発言,53,https://news.yahoo.co.jp/articles/e2ddfb0cd70daab664387bdaad2f192ba5288f6d,5/14(水) 4:33
2025-05-14,14:08,world,国際,4,テレビ朝日系（ANN）,中国で拘束された日本人男性に懲役12年の有罪判決　スパイ活動を認定　詳細は公表なし,50,https://news.yahoo.co.jp/articles/7853b66feea9978921d335c3d173af91340aa33d,5/13(火) 20:34
2025-05-14,14:08,world,国際,5,日テレNEWS NNN,北京で幼稚園経営の日本人　拘束され強制退去に,34,https://news.yahoo.co.jp/articles/78cf00bd1ecbbcb5a2ab9c69901b063a2b8282ff,5/14(水) 9:31
2025-05-14,14:08,world,国際,6,中央日報日本語版,韓国海兵隊「日本の自衛隊と同じボートに乗らない…合同訓練の計画はない」,34,https://news.yahoo.co.jp/articles/8578dc6041beeafa96e83fd8b36754185a5fcd0d,5/14(水) 7:35
2025-05-14,14:08,world,国際,7,CNN.co.jp,トルコでのロシア・ウクライナ和平協議、プーチン氏が出席する場合のみ参加とゼレンスキー氏,33,https://news.yahoo.co.jp/articles/bb6357616ff2a536e38f65bd7fdc82d3985c55c4,5/14(水) 12:57
2025-05-14,14:08,world,国際,8,FNNプライムオンライン（フジテレビ系）,“世界一貧しい大統領”ホセ・ムヒカ元大統領（89）死去　南米ウルグアイ第40代大統領　収入の大半を貧しい人たちに寄付,32,https://news.yahoo.co.jp/articles/2ff152098b0e765346ee7512c73a18142f3c98c1,5/14(水) 4:58
2025-05-14,14:08,world,国際,9,読売新聞オンライン,ドバイに「トランプタワー」、カタールで高級ゴルフリゾート…米大統領親族企業が中東で大規模ビジネス,30,https://news.yahoo.co.jp/articles/b3d06755e7384da7dc8c2fcf2dbc3bd66c8c47e4,5/14(水) 9:27
2025-05-14,14:08,world,国際,10,JBpress,トランプ仲介によるウクライナ戦争“生煮え”停戦で世界はカオスか、今後起こり得る「5つの驚愕シナリオ」,25,https://news.yahoo.co.jp/articles/7e5d9fd7ea64047464402179a69c6639254e1ee0,5/14(水) 11:51
2025-05-14,14:08,world,国際,11,TBS NEWS DIG Powered by JNN,【速報】中国政府　アメリカへの報復関税引き下げを14日から実施と発表,25,https://news.yahoo.co.jp/articles/a8bccce51e4fe48ecb993c2f5c01c52828d53873,5/13(火) 23:48
2025-05-14,14:08,world,国際,12,中央日報日本語版,「生涯子なし」比率、韓国の２倍なのに…日本の出生率、はるかに高い,24,https://news.yahoo.co.jp/articles/249f522a9c39a138da9412691a02b10f55559ebf,5/14(水) 9:21
2025-05-14,14:08,world,国際,13,ロイター,プーチン氏との直接会談が和平への唯一の道、ゼレンスキー氏　トルコ協議巡り,20,https://news.yahoo.co.jp/articles/de760c202ae379f2ab765ed2302789551800e93e,5/13(火) 21:38
2025-05-14,14:08,world,国際,14,読売新聞オンライン,プーチン氏はトルコ入りせず？ロシアは直接協議に外相派遣…ゼレンスキー氏「交渉はプーチンと行うべきだ」,18,https://news.yahoo.co.jp/articles/aef2afa6f051a58c4f6cefed0bdeebd28375e301,5/14(水) 12:59
2025-05-14,14:08,world,国際,15,TBS NEWS DIG Powered by JNN,「決定権を持つのは彼だけ」ゼレンスキー大統領がプーチン大統領に会談応じるよう改めて要求　直接交渉めぐり,18,https://news.yahoo.co.jp/articles/9bce1872f387358a6db2ca217a610ea986e8e2ee,5/14(水) 12:01
2025-05-14,14:08,world,国際,16,ロイター,トランプ氏、サウジから88兆円投資の確約取り付け　過去最大規模21兆円の武器売却も発表,17,https://news.yahoo.co.jp/articles/cbc57a6a280bf2496a46b0dd2097829dc6303aa9,5/14(水) 11:38
2025-05-14,14:08,world,国際,17,時事通信,「日本は牛肉輸入解禁を」　中国の切り崩しになびかず　パラグアイ大統領,17,https://news.yahoo.co.jp/articles/c8190d1e6158c30aa8c379f1b328d35ae4d07fd5,5/14(水) 7:13
2025-05-14,14:08,world,国際,18,BBC News,マレーシア航空機撃墜、「ロシアに責任ある」と国連機関,14,https://news.yahoo.co.jp/articles/5b74730a3956b396f1ef434807f743f7454063ff,5/14(水) 12:51
2025-05-14,14:08,world,国際,19,ブラジル日報,《ブラジル》佳子さまのご来伯日程決定＝10日間で8都市巡る強行軍＝サンパウロ市、パラナ、南マットグロッソ州、首都、リオへ,14,https://news.yahoo.co.jp/articles/894e4a29de4528097a196357dfe125c6b732937a,5/14(水) 6:59
2025-05-14,14:08,world,国際,20,毎日新聞,トランプ氏、対シリア制裁を近く解除の方針　暫定大統領と初の面会へ,14,https://news.yahoo.co.jp/articles/a2a16aaa4e33edd2848be5c76c6597352968fb16,5/14(水) 2:36
2025-05-14,14:08,world,国際,21,CNN.co.jp,トランプ氏のカタール高級機受領、熱心な支持者さえ強い批判　「贈り物ではなく賄賂」,13,https://news.yahoo.co.jp/articles/7e68a2b002920187415e29498aea693be6ca85f9,5/14(水) 10:40
2025-05-14,14:08,world,国際,22,BBC News,ゼレンスキー氏、プーチン氏との直接会談実現のため「あらゆる手を尽くす」,13,https://news.yahoo.co.jp/articles/500c34762753fdcafe7995e786e0e96ddf98819e,5/14(水) 10:47
2025-05-14,14:08,world,国際,23,ロイター,ロシア経済は脆弱化の一途、スウェーデン研究所がＥＵに報告書,12,https://news.yahoo.co.jp/articles/55ca53e6b1194f7b6f82e767fd0ba95f4f5dea14,5/14(水) 9:26
2025-05-14,14:08,world,国際,24,JBpress,李在明はなぜ楽勝で韓国大統領になれるのか、疑惑まみれでもライバルの自滅で大統領選で圧勝濃厚なワケ,12,https://news.yahoo.co.jp/articles/b554d392198c454d616deaefa661a3a60a754a84,5/14(水) 11:51
2025-05-14,14:08,world,国際,25,ロイター,マレーシア航空機撃墜、ロシアに責任との認定拒否＝クレムリン,11,https://news.yahoo.co.jp/articles/dd47ffc85fd4b1c82fe7b68d46bb13432a4e24ef,5/14(水) 9:34
2025-05-14,14:08,world,国際,26,中央日報日本語版,安い中国戦闘機？　パキスタンで威力誇示…「台湾に警鐘を鳴らした」,11,https://news.yahoo.co.jp/articles/d4b2d540b5cce524afb1120a100ce080210f2607,5/14(水) 11:26
2025-05-14,14:08,world,国際,27,産経新聞,「プーチン氏としか会談しない」ウクライナ大統領がトルコ訪問へ　米は国務長官ら派遣,11,https://news.yahoo.co.jp/articles/384d6439047f0465d0c1ef79ae51a3feabe26352,5/14(水) 8:21
2025-05-14,14:08,world,国際,28,中央日報日本語版,「韓国原発との契約やめろ」　フランス、チェコ政府に圧迫…ＥＵ幹部まで動員,11,https://news.yahoo.co.jp/articles/56ce73ea326d395a5f0150f363111f97e16445b7,5/14(水) 7:24
2025-05-14,14:08,world,国際,29,時事通信,首脳会談提案「ロシア沈黙」　ウクライナ大統領、停戦無視も批判,11,https://news.yahoo.co.jp/articles/f893c2a522d31438faa39c9afc2854171687adc0,5/14(水) 7:08
2025-05-14,14:08,world,国際,30,ニューズウィーク日本版,iPhone泥棒から届いた「偽Appleメッセージ」...見抜いた被害者の返しが話題に,11,https://news.yahoo.co.jp/articles/3919568464995f6932e7cbffcbe4d465d85b784e,5/14(水) 10:00
2025-05-14,14:08,world,国際,31,文春オンライン,「泣いたのは初めてです…」“世界一貧しい大統領”ホセ・ムヒカの言葉に日本人通訳が嗚咽した日【訃報】,11,https://news.yahoo.co.jp/articles/4d16cb9be45ef2bb6c9d4ca6e14c68538c3cb346,5/14(水) 12:12
2025-05-14,14:08,world,国際,32,ＡＦＰ＝時事,「ナクバ」記念行事開催なら大学補助金取り消し イスラエル教育相,10,https://news.yahoo.co.jp/articles/97b5f492b76173ee65132115231a50f4e361ed22,5/14(水) 12:13
2025-05-14,14:08,world,国際,33,共同通信,対ロシア停戦実現へ首脳会談要求　ゼレンスキー氏が圧力、米は仲介,10,https://news.yahoo.co.jp/articles/44e83d4982b51d3dadd11ef3b9421439589308ea,5/14(水) 6:12
2025-05-14,14:08,world,国際,34,中央日報日本語版,大阪に到着した朝鮮通信使船…「平和の旗」再びはためく,10,https://news.yahoo.co.jp/articles/e9caea2b84b4246efbe0850d292574a92ac2dbd3,5/14(水) 9:52
2025-05-14,14:08,world,国際,35,CNN.co.jp,ケネディ保健福祉省長官、遊泳禁止の川で家族と水遊び　高濃度の病原菌も意に介さず,10,https://news.yahoo.co.jp/articles/6c1768d59438859eb3696de8ac36d7c9c2176789,5/14(水) 11:40
2025-05-14,14:08,world,国際,36,ロイター,トランプ氏の航空機譲り受け、与党議員からも懸念の声相次ぐ,10,https://news.yahoo.co.jp/articles/8dc2aac758cdbb8d5347526fb71c6eb9a066e7c2,5/14(水) 12:15
2025-05-14,14:08,world,国際,37,毎日新聞,軍事衝突の妥協点探ったインドとパキスタン　奏功した米の仲介,10,https://news.yahoo.co.jp/articles/688781e2cd0739ca02705d44a35a6d79cb339728,5/13(火) 16:49
2025-05-14,14:08,world,国際,38,毎日新聞,トランプ米大統領、中東の歴訪開始　巨額ディールで実績強調狙う,9,https://news.yahoo.co.jp/articles/06ffc3fc60b1db504d21efcd801449a9a5a59920,5/13(火) 18:18
2025-05-14,14:08,world,国際,39,TBS NEWS DIG Powered by JNN,トランプ大統領がサウジと“88兆円ディール”を締結　「新たな黄金時代だ」,9,https://news.yahoo.co.jp/articles/a01eb985b5798e5c208192ea3d8780158140ed6c,5/14(水) 8:59
2025-05-14,14:08,world,国際,40,ABEMA TIMES,トランプ大統領、サウジアラビアからの巨額投資などで合意,8,https://news.yahoo.co.jp/articles/4e83e13c31e85a3b37dfece447ee20589acd0e6b,5/14(水) 7:27
