scrp_date,scrp_time,genre_en,genre_jp,rank,media_jp,title,comment,link,date_original
2025-03-10,09:27,TTL,総合,1,日刊スポーツ,千原せいじ、大阪万博をバッサリ「ダダすべり」「誰も行かへん」「日本は超クソ貧乏」に賛同多数,379,https://news.yahoo.co.jp/articles/c5073addcf17d430b75c47df6a74dc22346c2c49,3/10(月) 6:33
2025-03-10,09:27,TTL,総合,2,産経新聞,「異常事態です」大阪公立2番手校で、まさかの倍率1倍割れ　寝屋川ショックに広がる波紋,252,https://news.yahoo.co.jp/articles/b231293e2d4be1266ebc90fb35bee05621ee041e,3/9(日) 19:15
2025-03-10,09:27,TTL,総合,3,産経新聞,「国民は政治信じていない」石破首相、自民党大会で強調　「勇気と真心持って真実語れ」,212,https://news.yahoo.co.jp/articles/a4b7c0eb8a5877a5186102e839a79fca7fda1f4f,3/10(月) 7:15
2025-03-10,09:27,TTL,総合,4,スポニチアネックス,千原せいじ、大阪万博の“不人気”に持論「誰も行かへんやろ」「日本は超クソ貧乏」,196,https://news.yahoo.co.jp/articles/84e4abc79ad4d17965dc7d6782ebf875d523bc31,3/9(日) 18:31
2025-03-10,09:27,TTL,総合,5,デイリースポーツ,"大谷翔平に""ヘッスラ”帰塁禁止令　左肩痛再発を防ぐため足からの帰塁を徹底　一塁コーチ「彼はあまりに貴重な選手」",182,https://news.yahoo.co.jp/articles/fae7239d517ce965a2a8ca71f98bbbfab5ea41a0,3/10(月) 8:37
2025-03-10,09:27,TTL,総合,6,文春オンライン,「トリプルボギー不倫」男性キャディ（29）のプロゴルファー妻が独占告白「大会に出場するのがしんどくて…」,177,https://news.yahoo.co.jp/articles/4a382bb4463c6b48e7d65e38a45448d75924e088,3/10(月) 6:12
2025-03-10,09:27,TTL,総合,7,FNNプライムオンライン（フジテレビ系）,小泉進次郎氏　選択的夫婦別姓「国会で法案審議を。党議拘束かけるべきでない」,148,https://news.yahoo.co.jp/articles/2d958526aabffdb3067554dbc5b18b30b714218f,3/9(日) 15:17
2025-03-10,09:27,TTL,総合,8,スポニチアネックス,国民民主・玉木代表　高額療養負担増、政府の方針一転に「凍結するなら、具体策を対案として出すべき」,137,https://news.yahoo.co.jp/articles/8d0002a0feb2162c73b6292492729d96dec8c0b0,3/10(月) 8:06
2025-03-10,09:27,TTL,総合,9,信濃毎日新聞デジタル,「職員減って人海戦術には限界が…」　県が管理する道路に増える穴　タイヤが落ち車破損、損賠賠償する事故増加　パンクやバイク転倒の恐れも,129,https://news.yahoo.co.jp/articles/1b756c735e6acdb00be75033b4047111ea5042c6,3/10(月) 6:03
2025-03-10,09:27,TTL,総合,10,オタク総研,生成AIをフル活用する「地上波アニメ」誕生に賛否両論　制作側は「待遇改善」繋がる試みと自信,126,https://news.yahoo.co.jp/articles/0af7d4e0589bc817ba14513bb840bf5ee05723e4,3/10(月) 7:11
2025-03-10,09:27,TTL,総合,11,デイリー新潮,秋篠宮さまの「バッシング」「いじめ的」発言がぶり返された「悠仁さま」初の会見,117,https://news.yahoo.co.jp/articles/4cd4ae5672a8099fda665273a0832035745b0d30,3/10(月) 6:01
2025-03-10,09:27,TTL,総合,12,南日本新聞,「ぶつかってでも進め」「下手だから渋滞につかまる」…バス運転手へのカスハラ深刻　事故リスク高まり危険は乗客にも,107,https://news.yahoo.co.jp/articles/0bca189de8536aa8924b284f70d644b98fe7d3a8,3/9(日) 20:33
2025-03-10,09:27,TTL,総合,13,FNNプライムオンライン（フジテレビ系）,連合・芳野会長　今国会で選択的夫婦別姓制度の実現を　自民党大会で訴え,104,https://news.yahoo.co.jp/articles/431e4ce60ece3cd49bcfa60a9cf72fad84660df7,3/9(日) 11:07
2025-03-10,09:27,TTL,総合,14,TBS NEWS DIG Powered by JNN,自民党大会　石破総理が夏の参院選の勝利に向け結束呼びかけ 「連合」芳野会長も来賓として出席,99,https://news.yahoo.co.jp/articles/4e4a650a1129501664d08864f6dcf4329f4caa9d,3/9(日) 11:37
2025-03-10,09:27,TTL,総合,15,スポニチアネックス,泉房穂氏　“維新院政”疑惑の橋下徹氏に参院選出馬のススメ　そのワケは「『政治的影響力』のある者が…」,97,https://news.yahoo.co.jp/articles/ae8d6e2130d0a8d79fa3926b267d55c8611506cb,3/10(月) 7:56
2025-03-10,09:27,TTL,総合,16,産経新聞,選択的夫婦別姓「国会で審議すべき」自民・小泉進次郎氏、党議拘束は「かけるべきでない」,94,https://news.yahoo.co.jp/articles/005de150067cb21ccbd7f05eba7f6dae1bebf3fa,3/10(月) 7:30
2025-03-10,09:27,TTL,総合,17,J-CASTニュース,元フジアナ渡邊渚、美脚すらり個性的デニムさすがの着こなし　「カッコいい」「何着ても似合います」,91,https://news.yahoo.co.jp/articles/53636393971ad68e8dcf817f24559a958509b51a,3/10(月) 8:00
2025-03-10,09:27,TTL,総合,18,産経新聞,自民・小林鷹之氏、高額療養費めぐる石破首相の対応に苦言　「政策の意思決定が二転三転」,88,https://news.yahoo.co.jp/articles/c66a6c89cad9e4efdfed73a62fbdec4e2e924c39,3/9(日) 13:43
2025-03-10,09:27,TTL,総合,19,現代ビジネス,国税局に税金相談をしたら嘘を言われた…元国税調査官が唖然、国民の税金を扱う巨大権力の「ずさんな実態」,84,https://news.yahoo.co.jp/articles/a898a592d5dbfbc546d42e2f8d780c76fe78656a,3/10(月) 7:01
2025-03-10,09:27,TTL,総合,20,NEWSポストセブン,財務省が約6000億円をいまも借りパク状態　自賠責保険積立金を2024年度も完済せず、”100年後に返す”で誰が納得するのか,81,https://news.yahoo.co.jp/articles/aefefecc6a5dfab7fead1a9677745ff492854b96,3/9(日) 16:15
2025-03-10,09:27,TTL,総合,21,オリコン,声優・細谷佳正、結婚を発表　『鉄血のオルフェンズ』『進撃の巨人』などで活躍【コメント全文】,80,https://news.yahoo.co.jp/articles/7167920e6e8d0bbbc121593b38e282281d835a2e,3/10(月) 8:42
2025-03-10,09:27,TTL,総合,22,プレジデントオンライン,「メイドインジャパンの敗北」を繰り返している…「売れる車がないのにプライドは高い」日産に残された最終手段,80,https://news.yahoo.co.jp/articles/94197a43c0c1b95f7532d009ea46aba207afeee0,3/10(月) 6:17
2025-03-10,09:27,TTL,総合,23,読売新聞オンライン,マスク氏、ウクライナ軍へ提供の衛星通信網スターリンク「接続を停止することはない」,78,https://news.yahoo.co.jp/articles/05a6f956cd5e37255d8a7aa40f03e4d3a011e4b5,3/10(月) 6:57
2025-03-10,09:27,TTL,総合,24,中日スポーツ,東ちづる、石破茂政権に憤慨「国民が耐え忍んで成立する国家というものがわかりません」Xで思いつづる,76,https://news.yahoo.co.jp/articles/aa28030776c786ab3523390ef99402bef95eca0b,3/9(日) 20:53
2025-03-10,09:27,TTL,総合,25,FRIDAY,「10万円欲しいの...」70歳の援助交際相手から250万円を詐取「おねだり女子大生」の卑劣ぶり,76,https://news.yahoo.co.jp/articles/812ddaddec64f3d2c14e669adbd8e44e2aa79d27,3/10(月) 8:00
2025-03-10,09:27,TTL,総合,26,ハンギョレ新聞,ドイツの少女像のそばに集まった２５０人…「今も繰り返される性暴力問題の象徴」,74,https://news.yahoo.co.jp/articles/51f5578cdc6de5ac3f39f6923ee78aabdcc42b60,3/10(月) 7:39
2025-03-10,09:27,TTL,総合,27,デイリースポーツ,不安定なペースメーカーが波紋　コース間違える痛恨ミス　加世田の指摘で気づき集団慌てて戻る　ペース上がらず、給水取り戻るなど機能せず,74,https://news.yahoo.co.jp/articles/51676c042caabaca6030ff9e9b84b12d49057197,3/9(日) 10:31
2025-03-10,09:27,TTL,総合,28,産経新聞,「素晴らしいスピーチ」「見出しが立たない」…　石破茂首相の自民党大会演説に割れる評価,70,https://news.yahoo.co.jp/articles/96ef1b7a7f6468750ebeb5736de13827427f831d,3/9(日) 14:24
2025-03-10,09:27,TTL,総合,29,Yahoo!ニュース オリジナル 特集,原発事故から14年。「放射線による死者はゼロ」健康被害を科学的に検証すると #知り続ける,67,https://news.yahoo.co.jp/articles/e933b14bb0a45e7b919b7251a8abdecfe4699269,3/9(日) 15:59
2025-03-10,09:27,TTL,総合,30,読売新聞オンライン,迷走の中野サンプラザ跡地、コスト高騰で再開発が白紙へ…野村不動産などに協定解除申し入れ方針,66,https://news.yahoo.co.jp/articles/cde650eae18c4cc1ee252fbf6aa2a73c8fcd1eb1,3/9(日) 17:41
2025-03-10,09:27,TTL,総合,31,中日スポーツ,ひろゆきさん、『8000万円の大豪邸未登記』自民・森山裕幹事長巡るスクープにツッコミ「日本の感覚に驚いた」「高めの一般家屋じゃね？」,66,https://news.yahoo.co.jp/articles/3e9e165238116b59fa4a37c20d0c3c0b4ac984e8,3/9(日) 21:02
2025-03-10,09:27,TTL,総合,32,ピンズバNEWS,「ちむどんどん超えてます」の声も…『おむすび』迫る最終回、視聴者が思い出す892日前の「15分悪夢」,66,https://news.yahoo.co.jp/articles/f3e0fedfd3db074f0be61be29a54bac941a44ef3,3/10(月) 5:21
2025-03-10,09:27,TTL,総合,33,スポニチアネックス,オリオールズ菅野　3回パーフェクト　OP戦3試合連続無失点で防御率0・00　開幕ローテ入りへ視界良好,65,https://news.yahoo.co.jp/articles/f1e962d8c5e4074b49415237a0f9d2dd14db989e,3/10(月) 2:58
2025-03-10,09:27,TTL,総合,34,TBS NEWS DIG Powered by JNN,石破総理、ことしの東京都議選・参院選に勝利するため「我が身を滅して総力を尽くす」と決意表明　きのうの自民党大会で　政権運営に与党内からも不満渦巻く,63,https://news.yahoo.co.jp/articles/66d9aff85e0dc571118814b9569ff5a6124154c5,3/10(月) 5:45
2025-03-10,09:27,TTL,総合,35,毎日新聞,2000円どころか「1000円の壁」　コメ高騰にあえぐラーメン店,62,https://news.yahoo.co.jp/articles/dcea1da109ca17cb76f5265d7ae68ced5359609c,3/9(日) 19:00
2025-03-10,09:27,TTL,総合,36,テレビ朝日系（ANN）,1月の実質賃金3カ月ぶりのマイナス　現金給与増も物価高騰に追い付かず　厚労省,61,https://news.yahoo.co.jp/articles/4a740a3dbb82da1257fde8c64a6ebee879ca7bc6,3/10(月) 8:30
2025-03-10,09:27,TTL,総合,37,デイリースポーツ,「べらぼう」花魁・小芝風花　課題は色気「年齢より若く見られる」ゆえの徹底したタバコや所作,61,https://news.yahoo.co.jp/articles/f42315e6cca7d1c0904fc9188a3d9ef09ec8e230,3/9(日) 20:45
2025-03-10,09:27,TTL,総合,38,ENCOUNT,「やめてくれマジで」箱根の雪道にノーマルタイヤ→立ち往生し渋滞　都内ナンバーの無謀運転に批判殺到「免停で」,60,https://news.yahoo.co.jp/articles/94be4bda67c0e7a380fe35e972a44a1aacdc932f,3/9(日) 18:10
2025-03-10,09:27,TTL,総合,39,J-CASTニュース,告発者つぶしは知事失格、橋下徹氏が兵庫・斎藤知事を断罪,60,https://news.yahoo.co.jp/articles/f36faf9b412740f2518dddf3dd696b02a5546b60,3/9(日) 15:15
2025-03-10,09:27,TTL,総合,40,デイリー新潮,ゼレンスキー大統領を逆恨みするトランプ大統領　ウクライナの次期トップは国民人気の高い「鉄の将軍」か,59,https://news.yahoo.co.jp/articles/972363ed7cdf88d04d93849dc4ff8ae828176450,3/10(月) 6:06
