scrp_date,scrp_time,genre_en,genre_jp,rank,media_jp,title,comment,link,date_original
2024-09-30,16:08,business,経済,1「市場の洗礼を浴びている」日経平均株価が一時2000円急落　石破新総裁の誕生受けTBS NEWS DIG Powered by JNN9/30(月) 9:06692件/時,TBS NEWS DIG Powered by JNN,「市場の洗礼を浴びている」日経平均株価が一時2000円急落　石破新総裁の誕生受け,692,https://news.yahoo.co.jp/articles/cb0410aea70ea08c226e3d561409ef5fc9aa6585,9/30(月) 9:06
2024-09-30,16:08,business,経済,2仕事は必要最低限　「静かな退職」に職場はどう向き合えばいいのか？ITmedia ビジネスオンライン9/30(月) 6:35134件/時,ITmedia ビジネスオンライン,仕事は必要最低限　「静かな退職」に職場はどう向き合えばいいのか？,134,https://news.yahoo.co.jp/articles/c040c9019513f507c039fc0f22c1ea9f69b09068,9/30(月) 6:35
2024-09-30,16:08,business,経済,3パスポート保有率17％ 「海外行きたいと思わない」Z世代が増加 若者の意識に変化テレビ朝日系（ANN）9/30(月) 13:32113件/時,テレビ朝日系（ANN）,パスポート保有率17％ 「海外行きたいと思わない」Z世代が増加 若者の意識に変化,113,https://news.yahoo.co.jp/articles/f60c2247deaab26fe6686389d5e978aa81ecf8aa,9/30(月) 13:32
2024-09-30,16:08,business,経済,4ハンドル奥に備わる「パドルシフト」使ってない人が多い!? AT車で“わざわざ変速”する必要ある？ 一体いつ使うものなのか？くるまのニュース9/30(月) 14:5081件/時,くるまのニュース,ハンドル奥に備わる「パドルシフト」使ってない人が多い!? AT車で“わざわざ変速”する必要ある？ 一体いつ使うものなのか？,81,https://news.yahoo.co.jp/articles/9fb9b27f8988074823d181c9ef49e04b95947a8c,9/30(月) 14:50
2024-09-30,16:08,business,経済,510月の食品値上げ2911品目、年内最大の値上げラッシュ　「酒類・飲料」が1年ぶり1千品目超、ハム・ソーセージで一斉値上げ帝国データバンク9/30(月) 9:0078件/時,帝国データバンク,10月の食品値上げ2911品目、年内最大の値上げラッシュ　「酒類・飲料」が1年ぶり1千品目超、ハム・ソーセージで一斉値上げ,78,https://news.yahoo.co.jp/articles/7cbb1b51870a84642fbfb5ed0082bc0fd431a119,9/30(月) 9:00
2024-09-30,16:08,business,経済,6「まるで金太郎飴」「金持ちの外国人客ばかり意識してる」…。再開発で東京に「貧しい日本人」を排除する商業施設が増える“残念な現実”東洋経済オンライン9/30(月) 7:3277件/時,東洋経済オンライン,「まるで金太郎飴」「金持ちの外国人客ばかり意識してる」…。再開発で東京に「貧しい日本人」を排除する商業施設が増える“残念な現実”,77,https://news.yahoo.co.jp/articles/a25cbc546df242b70b27a080732995a3d2e666a5,9/30(月) 7:32
2024-09-30,16:08,business,経済,70:42“石破ショック”で株価急反落　一時1900円超安　「金融所得課税」めぐる石破氏の姿勢見極めたい声FNNプライムオンライン（フジテレビ系）9/30(月) 11:5245件/時,FNNプライムオンライン（フジテレビ系）,“石破ショック”で株価急反落　一時1900円超安　「金融所得課税」めぐる石破氏の姿勢見極めたい声,45,https://news.yahoo.co.jp/articles/623fc3375332c8cf907babb5d43f77bb978007ea,9/30(月) 11:52
2024-09-30,16:08,business,経済,8タイヤ交換は「5年ごとがいい」と言われましたが、短くないですか？8年乗って1回も替えたことがないのですが…ファイナンシャルフィールド9/30(月) 13:1138件/時,ファイナンシャルフィールド,タイヤ交換は「5年ごとがいい」と言われましたが、短くないですか？8年乗って1回も替えたことがないのですが…,38,https://news.yahoo.co.jp/articles/b71a338b56969fbabc9255bca437fdb49dbf2e12,9/30(月) 13:11
2024-09-30,16:08,business,経済,9東証、終値は1910円安　〝石破ショック〟総裁選出後初の取引は大幅反落で終える産経新聞9/30(月) 15:1933件/時,産経新聞,東証、終値は1910円安　〝石破ショック〟総裁選出後初の取引は大幅反落で終える,33,https://news.yahoo.co.jp/articles/1658f5eaf7f25fd288737e39177ad0e3ab471e15,9/30(月) 15:19
2024-09-30,16:08,business,経済,10金利上昇、円高、株安…「石破ショック」は一時的なものにとどまる可能性が高い【解説：三井住友DSアセットマネジメント・チーフマーケットストラテジスト】THE GOLD ONLINE（ゴールドオンライン）9/30(月) 14:2733件/時,THE GOLD ONLINE（ゴールドオンライン）,金利上昇、円高、株安…「石破ショック」は一時的なものにとどまる可能性が高い【解説：三井住友DSアセットマネジメント・チーフマーケットストラテジスト】,33,https://news.yahoo.co.jp/articles/d40918a6842bb55e099c90a98749831cf9ca37bc,9/30(月) 14:27
2024-09-30,16:08,business,経済,11ペダル付き原付ついに「都内初の死亡事故です」発生7か月後に警視庁 “見た目も気分も自転車”がアダに？乗りものニュース9/30(月) 9:4233件/時,乗りものニュース,ペダル付き原付ついに「都内初の死亡事故です」発生7か月後に警視庁 “見た目も気分も自転車”がアダに？,33,https://news.yahoo.co.jp/articles/ab985eb9acbbbbdb3cce4b14ddcabe2a627d62fb,9/30(月) 9:42
2024-09-30,16:08,business,経済,12「軽自動車」だから「軽油」と間違える人は本当にいます…油脂間違いで給油したとき車はどうなる？ 対処法をお教えしますAuto Messe Web9/30(月) 15:1032件/時,Auto Messe Web,「軽自動車」だから「軽油」と間違える人は本当にいます…油脂間違いで給油したとき車はどうなる？ 対処法をお教えします,32,https://news.yahoo.co.jp/articles/746b2cccbcb852555ee726aaa9f86ecd0907afa2,9/30(月) 15:10
2024-09-30,16:08,business,経済,13株価が大きく下がってくれることを期待、9月末は日本株の今年最後の買い場になりそうだ東洋経済オンライン9/30(月) 10:3228件/時,東洋経済オンライン,株価が大きく下がってくれることを期待、9月末は日本株の今年最後の買い場になりそうだ,28,https://news.yahoo.co.jp/articles/042642579668cc6e64ae001c0df14a4197cb5f84,9/30(月) 10:32
2024-09-30,16:08,business,経済,14自宅アパートの駐車場に「知らない車」が無断駐車していることが何度かありました。どのように対策すべきでしょうか？ファイナンシャルフィールド9/30(月) 15:2027件/時,ファイナンシャルフィールド,自宅アパートの駐車場に「知らない車」が無断駐車していることが何度かありました。どのように対策すべきでしょうか？,27,https://news.yahoo.co.jp/articles/2c39da62bf2f98ccdfad43fc0562fe6fbfeb655d,9/30(月) 15:20
2024-09-30,16:08,business,経済,15日本は世界に誇るレアな存在だったってマジ!? 「左側通行」の国が少数派すぎる!!ベストカーWeb9/30(月) 11:0025件/時,ベストカーWeb,日本は世界に誇るレアな存在だったってマジ!? 「左側通行」の国が少数派すぎる!!,25,https://news.yahoo.co.jp/articles/4f51fe473f0be151c05e18b08d7cfda52388b0f8,9/30(月) 11:00
2024-09-30,16:08,business,経済,16「キングメーカー争い」に岸田氏“完勝”で麻生氏“完敗”…石破氏が「大逆転勝利」した自民総裁選の舞台裏東洋経済オンライン9/30(月) 10:3224件/時,東洋経済オンライン,「キングメーカー争い」に岸田氏“完勝”で麻生氏“完敗”…石破氏が「大逆転勝利」した自民総裁選の舞台裏,24,https://news.yahoo.co.jp/articles/88d1d686471e7c60ba527dcee4ff6883304103b5,9/30(月) 10:32
2024-09-30,16:08,business,経済,17【速報】日経平均株価が700円以上下げる…石破新総裁誕生で市場が「巻き戻し」かFNNプライムオンライン（フジテレビ系）9/30(月) 9:0024件/時,FNNプライムオンライン（フジテレビ系）,【速報】日経平均株価が700円以上下げる…石破新総裁誕生で市場が「巻き戻し」か,24,https://news.yahoo.co.jp/articles/e04c5520c9cec5568da1acb042756145d7b92af8,9/30(月) 9:00
2024-09-30,16:08,business,経済,18ニトリが「カスハラ対策の方針」を発表　「土下座しろ！」などはNGITmedia ビジネスオンライン9/30(月) 14:3424件/時,ITmedia ビジネスオンライン,ニトリが「カスハラ対策の方針」を発表　「土下座しろ！」などはNG,24,https://news.yahoo.co.jp/articles/ec292891f1a6bb99aaf528e95ca02ee2110bed58,9/30(月) 14:34
2024-09-30,16:08,business,経済,196000万戸もの「売れ残りタワマン」に習近平主席もお手上げ…「EV頼み」でも経済を立て直せない中国政府の大迷走プレジデントオンライン9/30(月) 9:1723件/時,プレジデントオンライン,6000万戸もの「売れ残りタワマン」に習近平主席もお手上げ…「EV頼み」でも経済を立て直せない中国政府の大迷走,23,https://news.yahoo.co.jp/articles/3e5f885e35d991d21e01011ed0ca3013be4f64da,9/30(月) 9:17
2024-09-30,16:08,business,経済,20給食からモヤシが消えた　突然の食材変更　「家計の味方」に試練毎日新聞9/29(日) 19:2222件/時,毎日新聞,給食からモヤシが消えた　突然の食材変更　「家計の味方」に試練,22,https://news.yahoo.co.jp/articles/284dd99fa8e0e018d16f81bf0f2ea3a9713c4b9b,9/29(日) 19:22
2024-09-30,16:08,business,経済,21GUがニューヨークに初の旗艦店　その舞台裏に密着【WBSクロス】テレ東BIZ9/30(月) 12:4921件/時,テレ東BIZ,GUがニューヨークに初の旗艦店　その舞台裏に密着【WBSクロス】,21,https://news.yahoo.co.jp/articles/662a3839c215a128392dd3fef804c1397e206904,9/30(月) 12:49
2024-09-30,16:08,business,経済,22ロシア製兵器 日本を含む「西側の精密部品が未だに使われている！」その6割以上の出所とは乗りものニュース9/30(月) 11:4221件/時,乗りものニュース,ロシア製兵器 日本を含む「西側の精密部品が未だに使われている！」その6割以上の出所とは,21,https://news.yahoo.co.jp/articles/c2b1ecf701fa6dee8adc60d80ccb2625526d3fa2,9/30(月) 11:42
2024-09-30,16:08,business,経済,23小泉進次郎氏が選対委員長起用で迫られる…自民「裏金議員＝非公認」の“踏み絵”日刊ゲンダイDIGITAL9/30(月) 13:5820件/時,日刊ゲンダイDIGITAL,小泉進次郎氏が選対委員長起用で迫られる…自民「裏金議員＝非公認」の“踏み絵”,20,https://news.yahoo.co.jp/articles/ff77b88d0d3042f0cf2e6494594556264e53e4e6,9/30(月) 13:58
2024-09-30,16:08,business,経済,24島しょ防衛で役立つか？「護衛艦による対地攻撃」訓練を海上自衛隊が公開乗りものニュース9/30(月) 12:3220件/時,乗りものニュース,島しょ防衛で役立つか？「護衛艦による対地攻撃」訓練を海上自衛隊が公開,20,https://news.yahoo.co.jp/articles/58b32e7a1f8bd2455e3e08ef6ee66cfd446c70ca,9/30(月) 12:32
2024-09-30,16:08,business,経済,25欧米の賃金なぜ30年で倍増？日本が「低賃金の国」に落ちぶれたのも納得だったダイヤモンド・オンライン9/30(月) 7:0220件/時,ダイヤモンド・オンライン,欧米の賃金なぜ30年で倍増？日本が「低賃金の国」に落ちぶれたのも納得だった,20,https://news.yahoo.co.jp/articles/577ac1c331ed7908789b40c6f42578b911446407,9/30(月) 7:02
2024-09-30,16:08,business,経済,26米海軍の新造空母や潜水艦「一部溶接に欠陥の可能性！」この件の背後にある深刻な問題とは？乗りものニュース9/30(月) 15:1219件/時,乗りものニュース,米海軍の新造空母や潜水艦「一部溶接に欠陥の可能性！」この件の背後にある深刻な問題とは？,19,https://news.yahoo.co.jp/articles/7634ddf61b42a2b5ecd87362c980db100452f6e3,9/30(月) 15:12
2024-09-30,16:08,business,経済,27《“偽装辞任”理事のメール入手》NHK「ラジオ中国人不適切放送」で辞めて1週間で再雇用…職場の人間も驚いたメッセージの全容　肩書はエグゼクティブ・プロデューサーNEWSポストセブン9/30(月) 8:1419件/時,NEWSポストセブン,《“偽装辞任”理事のメール入手》NHK「ラジオ中国人不適切放送」で辞めて1週間で再雇用…職場の人間も驚いたメッセージの全容　肩書はエグゼクティブ・プロデューサー,19,https://news.yahoo.co.jp/articles/94f378a450db37687e8090c695a2ae4047876c7e,9/30(月) 8:14
2024-09-30,16:08,business,経済,28生成ＡＩ市場を実態調査へ、巨大ＩＴ企業の「囲い込み」警戒…公取委方針読売新聞オンライン9/30(月) 5:0119件/時,読売新聞オンライン,生成ＡＩ市場を実態調査へ、巨大ＩＴ企業の「囲い込み」警戒…公取委方針,19,https://news.yahoo.co.jp/articles/70e6b6c528d3504a415a4cbfc29b9443e40a7a06,9/30(月) 5:01
2024-09-30,16:08,business,経済,2930日の東京株式市場、一時1900円超安　石破政権の誕生控え、利上げと課税強化を警戒産経新聞9/30(月) 11:3518件/時,産経新聞,30日の東京株式市場、一時1900円超安　石破政権の誕生控え、利上げと課税強化を警戒,18,https://news.yahoo.co.jp/articles/f4c3aedf1543e821551a2144b18b6ff5f565f07d,9/30(月) 11:35
2024-09-30,16:08,business,経済,30かつての売上高日本一、イトーヨーカドー津田沼店が9月29日で閉店　46年の歴史に幕WWDJAPAN.com9/29(日) 21:3017件/時,WWDJAPAN.com,かつての売上高日本一、イトーヨーカドー津田沼店が9月29日で閉店　46年の歴史に幕,17,https://news.yahoo.co.jp/articles/3528e2d45e2405d3cd88487530098fa9c12fdbe5,9/29(日) 21:30
2024-09-30,16:08,business,経済,31週明け後の『石破ショック』の余波と早期の解散総選挙NRI研究員の時事解説9/30(月) 10:3416件/時,NRI研究員の時事解説,週明け後の『石破ショック』の余波と早期の解散総選挙,16,https://news.yahoo.co.jp/articles/3a37a1fd23c479bd106b2f482e8f9a673785724c,9/30(月) 10:34
2024-09-30,16:08,business,経済,32石破茂氏に捨て駒としての価値を見た自民の冷徹　沈没の危機に瀕した党が繰り出す奥の手が炸裂した東洋経済オンライン9/30(月) 12:0216件/時,東洋経済オンライン,石破茂氏に捨て駒としての価値を見た自民の冷徹　沈没の危機に瀕した党が繰り出す奥の手が炸裂した,16,https://news.yahoo.co.jp/articles/916a70bd16befa5bcdf56543504bfbeebb373de9,9/30(月) 12:02
2024-09-30,16:08,business,経済,33石破総裁、早期利上げに慎重　緊縮経済の懸念、火消しか共同通信9/29(日) 18:4716件/時,共同通信,石破総裁、早期利上げに慎重　緊縮経済の懸念、火消しか,16,https://news.yahoo.co.jp/articles/7959f11eb5fad6d37106f22ab9be2a59721f1efa,9/29(日) 18:47
2024-09-30,16:08,business,経済,34「かなり厳しい」平均給与での生活…月の手取り「34万円」前後の暮らしぶりTHE GOLD ONLINE（ゴールドオンライン）9/30(月) 12:4616件/時,THE GOLD ONLINE（ゴールドオンライン）,「かなり厳しい」平均給与での生活…月の手取り「34万円」前後の暮らしぶり,16,https://news.yahoo.co.jp/articles/769e634c94d2d6ff64605b206345967c34c67fb6,9/30(月) 12:46
2024-09-30,16:08,business,経済,35中国株の”虚しい”急騰…「経済オンチ」の習近平政権が失敗した、不動産バブル崩壊の「後始末」現代ビジネス9/30(月) 7:3515件/時,現代ビジネス,中国株の”虚しい”急騰…「経済オンチ」の習近平政権が失敗した、不動産バブル崩壊の「後始末」,15,https://news.yahoo.co.jp/articles/0dc76265e2ce71acba1305a7ec720d4347f9ce23,9/30(月) 7:35
2024-09-30,16:08,business,経済,36老後の年金は「月8万円」です。少ないですが、老後「アルバイト」をすれば大丈夫ですよね？ 元気なうちは働く予定ですファイナンシャルフィールド9/30(月) 12:1215件/時,ファイナンシャルフィールド,老後の年金は「月8万円」です。少ないですが、老後「アルバイト」をすれば大丈夫ですよね？ 元気なうちは働く予定です,15,https://news.yahoo.co.jp/articles/343e1bb85e63f1a1df8e641f6f98a51ae408a53a,9/30(月) 12:12
2024-09-30,16:08,business,経済,37「頭の回転が速い人」と「遅い人」の決定的な違いとはダイヤモンド・オンライン9/30(月) 6:0215件/時,ダイヤモンド・オンライン,「頭の回転が速い人」と「遅い人」の決定的な違いとは,15,https://news.yahoo.co.jp/articles/e11370364cc3569eeb27b3f9b0714dfdabfb70ab,9/30(月) 6:02
2024-09-30,16:08,business,経済,38「正社員不足」は約半数　関西企業、人手不足が課題共同通信9/30(月) 14:4615件/時,共同通信,「正社員不足」は約半数　関西企業、人手不足が課題,15,https://news.yahoo.co.jp/articles/e36b8cd5d72e98686267a2a0eebb8558de85f387,9/30(月) 14:46
2024-09-30,16:08,business,経済,39「その停め方はアウトです!」歩道にタイヤを乗り上げて駐停車するのは…短時間でもダメな理由月刊自家用車WEB9/29(日) 19:4015件/時,月刊自家用車WEB,「その停め方はアウトです!」歩道にタイヤを乗り上げて駐停車するのは…短時間でもダメな理由,15,https://news.yahoo.co.jp/articles/86e265b7c83d063bf7eb49efa9e62e2136638268,9/29(日) 19:40
2024-09-30,16:08,business,経済,40なんと320万円! もはやガソリン車並み! マツダ6こと[EZ-6]の価格が衝撃的すぎる!ベストカーWeb9/30(月) 15:0014件/時,ベストカーWeb,なんと320万円! もはやガソリン車並み! マツダ6こと[EZ-6]の価格が衝撃的すぎる!,14,https://news.yahoo.co.jp/articles/96e3e24a68222e43a02b53f8871754a9bb5e12a3,9/30(月) 15:00
