scrp_date,scrp_time,genre_en,genre_jp,rank,media_jp,title,comment,link,date_original
2025-09-04,23:07,TTL,総合,1,共同通信,財布内の確認、見直しへ　生活保護申請、三重・鈴鹿,679,https://news.yahoo.co.jp/articles/55ea7a43f1f500d49320fc7665f9874e46de5e09,9/4(木) 16:51
2025-09-04,23:07,TTL,総合,2,SmartFLASH,「遅刻を責める人は能力低い」EXIT・兼近の持論に議論沸騰…ひろゆきも「遅刻容認」コメントの過去,589,https://news.yahoo.co.jp/articles/ab78d282aed7c93755b2f6243a0f28e85ad0c125,9/4(木) 18:20
2025-09-04,23:07,TTL,総合,3,共同通信,共産・田村氏、外国人差別に反対　「危険な潮流を包囲しよう」,493,https://news.yahoo.co.jp/articles/93f170196bd6a2dd2e839e034f19bcb8e1694f01,9/4(木) 21:40
2025-09-04,23:07,TTL,総合,4,読売新聞オンライン,ＪＡＬ飲酒機長、アルコール検査記録を改ざん…飲酒リスク高い「要注意者リスト」に名前,439,https://news.yahoo.co.jp/articles/5569e0669725aee5523a5bd3b5b43883af4ad499,9/4(木) 21:34
2025-09-04,23:07,TTL,総合,5,女性自身,「いつまでキングメーカー気取り」麻生太郎（84）　総裁選前倒しを公然要求も自身の引退求める声が…失言癖で石破首相以上の“嫌われぶり”,411,https://news.yahoo.co.jp/articles/04a1b8121fe8085bfe39dc6b7264f33f3f0923b8,9/4(木) 19:15
2025-09-04,23:07,TTL,総合,6,スポーツ報知,【中日】前夜今季１号の石川昂弥が登録抹消へ　井上一樹監督「脇腹をやっちゃった」,327,https://news.yahoo.co.jp/articles/b3711a89848cf16addc7ba8a31a75d581c17d75f,9/4(木) 22:09
2025-09-04,23:07,TTL,総合,7,レスポンス,24年ぶり復活、新型ホンダ『プレリュード』ついに発売…価格は617万9800円,315,https://news.yahoo.co.jp/articles/c3eeb82460151a448e83cace0b760305b85ace99,9/4(木) 11:00
2025-09-04,23:07,TTL,総合,8,デイリースポーツ,巨人・阿部監督　１２失点大敗を謝罪「こんな雨の中、ファンの人に申し訳ない」野手の増田大も登板準備,308,https://news.yahoo.co.jp/articles/733376eaaf13a4e82e21c3dabd29494012641b4d,9/4(木) 21:48
2025-09-04,23:07,TTL,総合,9,デイリースポーツ,ヤクルト・村上が衝撃の満塁弾！球場どよめく１試合２発でリーグ単独３位に浮上　ここ６戦７本塁打　復帰後３３戦１７本塁打と驚異のハイペース,293,https://news.yahoo.co.jp/articles/759a80132a5cf40eb44625db5627b3fcccda9ad9,9/4(木) 19:30
2025-09-04,23:07,TTL,総合,10,日刊スポーツ,今井絵理子氏への批判にパートナーが反論「今井氏が立案し成立している法律もあります」,247,https://news.yahoo.co.jp/articles/a76b8e85b1bd7a027900f6dc7c766798cc7e569d,9/4(木) 21:15
2025-09-04,23:07,TTL,総合,11,デイリースポーツ,阪神快勝！ついに優勝マジック４　佐藤輝が衝撃の３６号２ラン　７投手の継投で逃げ切り、岩崎は３０セーブ　ＣＳ確定,221,https://news.yahoo.co.jp/articles/9dd6d800a82d62e1b88529418bb29722a2c11dcc,9/4(木) 21:54
2025-09-04,23:07,TTL,総合,12,時事通信,全都道府県で初の1000円超え　39地域で目安上回る　最低賃金,219,https://news.yahoo.co.jp/articles/5f660132111801a336c38494bc79814ff72d7dba,9/4(木) 19:51
2025-09-04,23:07,TTL,総合,13,テレビ朝日系（ANN）,石破総理 経済対策指示へ　“2万円給付”所得制限設ける方向で修正方針,217,https://news.yahoo.co.jp/articles/b02ea3157b20334bf5e9bc33369dba167f99e45a,9/4(木) 17:33
2025-09-04,23:07,TTL,総合,14,ベストカーWeb,【新型プレリュード正式発表】なぜ今の時代に2ドアクーペ? ホンダが2027年から本気出すHV戦略の旗艦＆前奏曲だった,216,https://news.yahoo.co.jp/articles/ab4f58afa793ec1297cf448190622f3edc58a8d2,9/4(木) 16:58
2025-09-04,23:07,TTL,総合,15,TBS NEWS DIG Powered by JNN,【阪神】中日の猛追を振り切りⅯ4！佐藤輝の先制36号2ラン 森下＆近本の追撃適時打など7点も細川に3ラン被弾 中野が8回に好守,207,https://news.yahoo.co.jp/articles/04afde026abe601f1ffe62914ed05604e25d8b14,9/4(木) 21:52
2025-09-04,23:07,TTL,総合,16,デイリースポーツ,オリックスが敵地で赤っ恥１３連敗　連日の大敗でソフトＢに３連敗、“天敵”上沢の前に打線沈黙,205,https://news.yahoo.co.jp/articles/5d936666deb94b0ae225c8d92f78bab8ea58f5e5,9/4(木) 20:46
2025-09-04,23:07,TTL,総合,17,共同通信,首相、週内にも経済対策指示検討　現金給付の所得制限案,202,https://news.yahoo.co.jp/articles/416ce2ccb6b74ae636b2845875605b1924f47fb3,9/3(水) 23:52
2025-09-04,23:07,TTL,総合,18,朝日新聞,川崎ストーカー殺人、神奈川県警が捜査遅れ認め謝罪　約40人処分へ,196,https://news.yahoo.co.jp/articles/739c4d54d3686d521f9cb0d58cd560bf015f56ea,9/4(木) 11:17
2025-09-04,23:07,TTL,総合,19,産経新聞,参政党集会への施設貸し出しに共産党支持者ら抗議　堺市「条例に反せず断る理由ない」,187,https://news.yahoo.co.jp/articles/015ac27deead7b1c260477c7bac54558d14a1e94,9/4(木) 18:52
2025-09-04,23:07,TTL,総合,20,日テレNEWS NNN,【中日】大量7失点から終盤に細川成也の3ランなどで2点差に縮めるも覆せず敗戦　阪神のマジックを“4”に減らす,174,https://news.yahoo.co.jp/articles/90cb0ae960adb9965fcc288b0de8daf6984c4d10,9/4(木) 21:53
2025-09-04,23:07,TTL,総合,21,読売新聞オンライン,自民党四役「ドミノ辞意表明」で窮地の石破首相…後任決めず、事実上の体制維持へ,168,https://news.yahoo.co.jp/articles/3a2a9923a0f36c0df93d4e1a3861bb86cb4fb2cf,9/4(木) 6:31
2025-09-04,23:07,TTL,総合,22,SmartFLASH,石橋貴明「芸能活動休止」で正月『とんねるずのスポーツ王』中止の動き“セクハラ騒動”でコンビ復活ムードに冷水,158,https://news.yahoo.co.jp/articles/6c66cb5889cf9b373bbb1aa79284571372b5bd15,9/4(木) 19:40
2025-09-04,23:07,TTL,総合,23,テレビ朝日系（ANN）,卒塔婆振り回し、供え物を飲む　墓地で迷惑行為の外国人を直撃　謝罪も終始、笑顔,149,https://news.yahoo.co.jp/articles/952082981496f2218a845ef4495b49fcae3342a1,9/4(木) 11:45
2025-09-04,23:07,TTL,総合,24,スポニチアネックス,自民青年局長　石破降ろしの表現に違和感　求めるのは辞任「まだご自身で決断していただけると…」,148,https://news.yahoo.co.jp/articles/832de4a0c11a74d6d94bdc2a755c97c62d7c9b3c,9/4(木) 21:52
2025-09-04,23:07,TTL,総合,25,デイリースポーツ,快勝の日本ハム・新庄監督「あ～すっきりした」アンチにしてやったり　試合前にＳＮＳで異例の呼びかけ「選手のこと言われると寝れないぐらい腹立つ」,145,https://news.yahoo.co.jp/articles/72c99b39418367e2114ec695922cdcfc7555853d,9/4(木) 21:40
2025-09-04,23:07,TTL,総合,26,TBS NEWS DIG Powered by JNN,【広島】涙雨 1点に泣く...降雨コールド完封負け 3位・DeNAに2差 高が1度目の中断、再開直後に桑原に痛打 佐々木が痛恨の牽制死,142,https://news.yahoo.co.jp/articles/402d9e9ecc3e15694fce3a3e10897117258608f1,9/4(木) 21:22
2025-09-04,23:07,TTL,総合,27,デイリー新潮,5キロ7800円も…　新米価格は「昨年の1.5倍から2倍に」　備蓄米には業者からクレームが殺到　「売り切れないのでキャンセル」「店頭陳列はやめた」,140,https://news.yahoo.co.jp/articles/3fc10df877a2f841409378c91ec13c95bbe27e36,9/4(木) 6:06
2025-09-04,23:07,TTL,総合,28,帝国データバンク,「美容室」の倒産、3年連続で増加　過去最多へ 「美容師」不足に直面,140,https://news.yahoo.co.jp/articles/06b06a788556fb01068149c3e9ef985d0d4e70cd,9/4(木) 10:00
2025-09-04,23:07,TTL,総合,29,読売テレビ,【速報】前岸和田市長の永野耕平容疑者を官製談合防止法違反の疑いで逮捕　工事の入札に関する最低制限価格を漏らしたか　大阪地検特捜部,138,https://news.yahoo.co.jp/articles/1d47a0a8534389b7d9ed4b0be8b3650f83f40e9c,9/4(木) 16:26
2025-09-04,23:07,TTL,総合,30,FNNプライムオンライン,“無店舗型性風俗店”で…サービス中の20代女性従業員に対して性行為した疑い　59歳男を逮捕　女性は瞬時のことで同意しない意思示せず…男は容疑を否認,135,https://news.yahoo.co.jp/articles/0adc7156e65e9a6f1a8020a26664677268d998df,9/4(木) 22:03
2025-09-04,23:07,TTL,総合,31,読売新聞オンライン,保育園児倒され前歯２本折る、学童クラブでは唇負傷「足振ったら当たった」…世田谷区で児童虐待相次ぐ,135,https://news.yahoo.co.jp/articles/875d0852b185e07c626d6898238448467e115529,9/4(木) 13:57
2025-09-04,23:07,TTL,総合,32,中日スポーツ,中日、終盤追い上げるも無念…5カードぶり負け越し　１軍復帰後初登板の橋本が7回痛恨4失点,132,https://news.yahoo.co.jp/articles/4e5bc543227c7f83bf1c3d9b4890956d581d517c,9/4(木) 21:52
2025-09-04,23:07,TTL,総合,33,サンケイスポーツ,巨人・阿部慎之助監督、又木鉄平に2軍行き命じる「ちょっとレベル低いんだけどね。プロ野球だからさ」,130,https://news.yahoo.co.jp/articles/6c6ad0aee0d79377ada1b2c1e2ea45107414b8ff,9/4(木) 21:51
2025-09-04,23:07,TTL,総合,34,HTB北海道ニュース,新千歳発羽田行き日本航空機が左側エンジンにトラブル　新千歳空港に引き返し右側エンジンのみで緊急着陸,121,https://news.yahoo.co.jp/articles/f39b3d9de46f6f3c47d86161e74a042e3b4006cc,9/4(木) 12:32
2025-09-04,23:07,TTL,総合,35,産経新聞,八潮の道路陥没「県が管理する下水道の硫化水素によって腐食した下水道管に起因」と結論,119,https://news.yahoo.co.jp/articles/c006701daf08b26e61999ab827354cb32b396ffb,9/4(木) 19:50
2025-09-04,23:07,TTL,総合,36,中日スポーツ,中日・橋本侑樹、再昇格後初登板も一挙4失点　3点ビハインドの7回、猛虎打線にボコボコ,113,https://news.yahoo.co.jp/articles/d980327491e9a22faaba3525da9691fa1aa8d8ab,9/4(木) 21:13
2025-09-04,23:07,TTL,総合,37,TBS NEWS DIG Powered by JNN,【中日】阪神に4カードぶり負け越し...3位と2.5差に 0－7から2点差に猛追も及ばず、細川15号3ランは空砲 涌井は佐藤輝に被弾、橋本4失点,113,https://news.yahoo.co.jp/articles/87df76e33e4c5ff4e1eeb3db79a9bfc3bdcf26dc,9/4(木) 21:52
2025-09-04,23:07,TTL,総合,38,朝日新聞,テレビの国内販売、中国勢が史上初のシェア過半　世界でも躍進の理由,111,https://news.yahoo.co.jp/articles/ec44b9acb5b013e9213bede5fc2ef4c3163eaa39,9/4(木) 7:00
2025-09-04,23:07,TTL,総合,39,Full-Count,燕・村上が2戦連発の豪快16号　直近6戦6発、34試合で16本の異次元ペース…衝撃弾に球場騒然,111,https://news.yahoo.co.jp/articles/40247120dcceb69dbb0dfdb430d9757ba4ce7cb2,9/4(木) 18:10
2025-09-04,23:07,TTL,総合,40,弁護士ドットコムニュース,飲酒運転で時速125キロ、死亡事故起こした少年が持論展開「運転に集中するためスピード出した」,107,https://news.yahoo.co.jp/articles/f97ad3f3bab13daf4aee55ff149e77a6f97f82e4,9/4(木) 11:22
