scrp_date,scrp_time,genre_en,genre_jp,rank,media_jp,title,comment,link,date_original
2025-09-04,09:32,domestic,国内,1,読売新聞オンライン,自民党四役「ドミノ辞意表明」で窮地の石破首相…後任決めず、事実上の体制維持へ,763,https://news.yahoo.co.jp/articles/3a2a9923a0f36c0df93d4e1a3861bb86cb4fb2cf,9/4(木) 6:31
2025-09-04,09:32,domestic,国内,2,デイリー新潮,5キロ7800円も…　新米価格は「昨年の1.5倍から2倍に」　備蓄米には業者からクレームが殺到　「売り切れないのでキャンセル」「店頭陳列はやめた」,353,https://news.yahoo.co.jp/articles/3fc10df877a2f841409378c91ec13c95bbe27e36,9/4(木) 6:06
2025-09-04,09:32,domestic,国内,3,FNNプライムオンライン（フジテレビ系）,公約の2万円給付案は所得制限設ける方向で検討へ　石破首相が今週中に新たな経済対策指示を検討,330,https://news.yahoo.co.jp/articles/4e7f14d2db800536793f07038b896cbdfb9da403,9/4(木) 6:31
2025-09-04,09:32,domestic,国内,4,デイリー新潮,「一発屋に終わらない手はあったのに」　石丸氏「再生の道」退任に永田町の冷ややかな声,190,https://news.yahoo.co.jp/articles/953f24acfe3481bc1d50da3b8424148529a7c12d,9/4(木) 6:01
2025-09-04,09:32,domestic,国内,5,読売新聞オンライン,「氷河期世代」対象の都職員採用試験、倍率５７倍に…募集は２０人,184,https://news.yahoo.co.jp/articles/a7a9c5f7f68dd228073159a608c7d03fea0aa703,9/3(水) 17:34
2025-09-04,09:32,domestic,国内,6,デイリースポーツ,ネット騒然「さすがにヤバ過ぎ」「嫌な予感しかない」鳩山由紀夫元首相、中国の抗日戦勝パレード出席でトレンド騒ぎ　元日テレ青山氏「完全に中国のプロパガンダに」,154,https://news.yahoo.co.jp/articles/6880e09c2ca25e89af0ccca00d5e93d81a6dec4c,9/3(水) 20:09
2025-09-04,09:32,domestic,国内,7,ABEMA TIMES,「潔白」主張の新浪剛史氏 サプリ購入は「時差ボケ対策」 アメリカ購入は「圧倒的に安い」,153,https://news.yahoo.co.jp/articles/f1203609b133edc9d9ba445cc23fb3b2d1e798e8,9/3(水) 16:03
2025-09-04,09:32,domestic,国内,8,デイリー新潮,田久保伊東市長が引きずり下ろされるまでに支払われる給与を試算してみた　12月まで粘れば「冬のボーナス185万円＆退職金270万円」ゲット,145,https://news.yahoo.co.jp/articles/9c9205256d7fa7ac22aaff13ea04dde1aa46a184,9/4(木) 6:10
2025-09-04,09:32,domestic,国内,9,読売新聞オンライン,男児をはね現行犯逮捕の男、３日後には隣県で高校生ひき逃げの疑いで再び逮捕…なぜ運転できたのか,129,https://news.yahoo.co.jp/articles/8c078130f6b0626b70b85749e8bf79c2c3f961ac,9/4(木) 8:24
2025-09-04,09:32,domestic,国内,10,集英社オンライン,〈四役辞任ドミノ〉加速する石破おろしで大ピンチ「ヤケクソ解散」の可能性に擁護派も警戒…党内大混乱「何をしてくるか分からない」,119,https://news.yahoo.co.jp/articles/b74fe3025219deb3a40bb1bede0ce9c3ab9a66e9,9/4(木) 7:01
2025-09-04,09:32,domestic,国内,11,プレジデントオンライン,「ファクトチェック」が参政党の躍進につながったのか…新聞社顧問が参院選で痛感した「メディア不信」の根深さ,118,https://news.yahoo.co.jp/articles/735ab7cd45393029f4cde9f1c3090f1621739935,9/4(木) 7:16
2025-09-04,09:32,domestic,国内,12,FNNプライムオンライン（フジテレビ系）,【解説】自民・麻生最高顧問が総裁選「前倒し要求」を明言　勢いづく“前倒し要求派”カギ握る「3つの塊」,106,https://news.yahoo.co.jp/articles/fa893914732caa36b930459943a07ee2ac07edd1,9/3(水) 16:27
2025-09-04,09:32,domestic,国内,13,日テレNEWS NNN,俳優・清水尋也容疑者“大麻を初めて使ったのは留学先”　同居の20代女も逮捕　家宅捜索の様子明らかに,103,https://news.yahoo.co.jp/articles/6a0e2000aaf9ec00b898f3f43c086e87e8c3ef94,9/4(木) 1:22
2025-09-04,09:32,domestic,国内,14,産経新聞,岩屋毅外相「リーダーとしての最適任者、石破首相以外ない」総裁選の前倒し「必要ない」,91,https://news.yahoo.co.jp/articles/2c6f94a8447c5d44dd3ccdecb5bf156d57693e4c,9/4(木) 7:00
2025-09-04,09:32,domestic,国内,15,FNNプライムオンライン,所得制限設ける方向で公約の2万円給付案を検討へ…石破首相が今週中に新たな経済対策指示を検討　総裁選前倒し議論の8日の決定待たず,82,https://news.yahoo.co.jp/articles/db835255fa713eb199f8d28a41c316743032939d,9/4(木) 7:51
2025-09-04,09:32,domestic,国内,16,テレビ朝日系（ANN）,最低賃金が初の1000円台へ　支援策含め石破総理が近く発表方針,81,https://news.yahoo.co.jp/articles/efaf26d9fb1e2984155649519d7bdb669f2c3cca,9/4(木) 2:45
2025-09-04,09:32,domestic,国内,17,産経新聞,斎藤知事　続く副知事人事１人体制に「しかるべきタイミングで」　　兵庫県知事会見詳報,80,https://news.yahoo.co.jp/articles/ca2285de47caf0ee955b035c20edd7390d6b6599,9/4(木) 7:41
2025-09-04,09:32,domestic,国内,18,文春オンライン,《女児盗撮教員グループ》4人目の逮捕者・石川勝也容疑者(28)保護者が証言「人生の絶頂期の裏で子供たちを……」,79,https://news.yahoo.co.jp/articles/9fd9eebce8c7e7739044065253e62828abaac2e6,9/4(木) 7:12
2025-09-04,09:32,domestic,国内,19,プレジデントオンライン,JAが新米を囲い込み、コメの値段は下がらない…「小泉備蓄米セール」が新米価格にもたらす深刻すぎる代償,77,https://news.yahoo.co.jp/articles/211f739c0e1face93bfdbfc96d6cca6dcded66fc,9/3(水) 17:16
2025-09-04,09:32,domestic,国内,20,J-CASTニュース,「じゃあ、何のために世論調査してるんですか」　田崎史郎氏の石破首相めぐる発言にジャーナリスト怒る,76,https://news.yahoo.co.jp/articles/6c12ad4a3e02a559b79611f550c2d521d60fa20e,9/3(水) 16:30
2025-09-04,09:32,domestic,国内,21,デイリースポーツ,Ｘ大荒れ「すげえメンタルだな」「負けるな」東洋大学歴疑惑の市長　不信任可決も→白鳥ボートのお花畑投稿　１６００超コメ殺到「何を呑気に」「今することは？」「メガソーラ不要！」,73,https://news.yahoo.co.jp/articles/fe842e6fdb3155d66af7b918280237ad60fa2197,9/3(水) 16:48
2025-09-04,09:32,domestic,国内,22,ウェザーマップ,奄美大島の東で台風15号が発生　きょう(木)にも九州南部に接近へ　西〜東日本は大雨のおそれ　土砂災害などに警戒,66,https://news.yahoo.co.jp/articles/3a0c47cce8f8d57b5e83cf9a70faa39d8044f7e6,9/4(木) 5:16
2025-09-04,09:32,domestic,国内,23,共同通信,首相、週内にも経済対策指示検討　現金給付の所得制限案,64,https://news.yahoo.co.jp/articles/416ce2ccb6b74ae636b2845875605b1924f47fb3,9/3(水) 23:52
2025-09-04,09:32,domestic,国内,24,TBS NEWS DIG Powered by JNN,【速報】東京都に「記録的短時間大雨情報」　江東区付近で1時間に約100ミリの猛烈な雨　災害警戒  4日06:38時点,64,https://news.yahoo.co.jp/articles/e3eb8191eae3ab97a9ad0942f94b553f1e21c78c,9/4(木) 6:40
2025-09-04,09:32,domestic,国内,25,ダイヤモンド・オンライン,「大学序列ってくだらないと思います。Fラン大でもすごい人はいるじゃないですか」。大学ヒエラルキーはなぜ生まれるのか,62,https://news.yahoo.co.jp/articles/4a5648a87fddb79cdd5092fb1f11897e93246b0f,9/4(木) 6:10
2025-09-04,09:32,domestic,国内,26,時事通信,大統領令署名で調整へ　赤沢担当相、4日訪米,58,https://news.yahoo.co.jp/articles/e90ace816b01fc7374adf47a45a71d60c7ae5154,9/3(水) 17:07
2025-09-04,09:32,domestic,国内,27,FNNプライムオンライン（フジテレビ系）,【独自】国土交通省がJALに立ち入り監査　64歳機長が滞在先ホテルで500mlビール3本飲酒し計3便に遅れ,54,https://news.yahoo.co.jp/articles/32c76d739eb2f179c8a3a97c774b13fe6f6c3b5e,9/3(水) 12:01
2025-09-04,09:32,domestic,国内,28,TBS NEWS DIG Powered by JNN,“大麻所持は間違いありません” 俳優・清水尋也容疑者（26）を麻薬取締法違反容疑で逮捕　自宅から大麻のような乾燥植物片や巻紙が見つかる　容疑認める,46,https://news.yahoo.co.jp/articles/a8c3241d18f22003b10d7b26dea930e647e02ecd,9/3(水) 10:05
2025-09-04,09:32,domestic,国内,29,ABEMA TIMES,最低賃金 初めて1000円台ヘ 石破総理が近く発表,44,https://news.yahoo.co.jp/articles/919469c8d37281a173e87b21b9ec686d90964a6c,9/4(木) 8:03
2025-09-04,09:32,domestic,国内,30,時事通信,立民・野田氏、孤立深める　「刷新」迫られ、対話路線も暗雲,44,https://news.yahoo.co.jp/articles/26198a4497385a05888f84e6ad710459c2ef7665,9/4(木) 7:03
2025-09-04,09:32,domestic,国内,31,共同通信,芳野友子連合会長、続投で調整　10月任期満了、3期目へ,42,https://news.yahoo.co.jp/articles/d66e3869c2eebeb75ad6dac7bc47fc83fef63e5a,9/3(水) 22:16
2025-09-04,09:32,domestic,国内,32,FNNプライムオンライン,「潔白」を繰り返し主張…サントリーHD会長辞任の新浪剛史氏が会見　逮捕された男からの“郵送”は「想定外」,40,https://news.yahoo.co.jp/articles/c7f60f6b5e32934cc25b52556d1d5692b480c832,9/3(水) 20:54
2025-09-04,09:32,domestic,国内,33,tenki.jp,台風発生へ　4日～5日は西日本～東日本に接近・横断か　東海地方は警報級大雨の恐れ,39,https://news.yahoo.co.jp/articles/54609cd6b1b9f23940435d1044425bb76c72d5e2,9/3(水) 15:22
2025-09-04,09:32,domestic,国内,34,読売新聞オンライン,ヨドバシカメラ、ＰＢ家電の製造業者への支払いを不当に減額…下請法違反で公取委が勧告へ,34,https://news.yahoo.co.jp/articles/7fc7ac1f765b2d92496805d1b061da0b1a9f4864,9/4(木) 5:00
2025-09-04,09:32,domestic,国内,35,デイリー新潮,悠仁さま「成年の祝宴」に愛子さまがご欠席の“複雑な事情”　「あまりにお寂しいことです」,34,https://news.yahoo.co.jp/articles/73aba916bb575af21dff56b981929d8d6c124c03,9/3(水) 11:41
2025-09-04,09:32,domestic,国内,36,文春オンライン,ヘルメットだけで都内のマンションが買えてしまう…宮崎の空を切り裂いた“超高級”ステルス戦闘機「F-35B」の“驚愕のデメリット”とそれでも日本が導入を決断したワケ,34,https://news.yahoo.co.jp/articles/98435831bf60ccf8e29234255a6a2f21d81be068,9/4(木) 6:31
2025-09-04,09:32,domestic,国内,37,朝日新聞,「あいさつしない」部員約10人をバスに乗せず歩かせる　佐久長聖高,33,https://news.yahoo.co.jp/articles/850f2e9e93ffd375a607e0b658f426a37f10f965,9/3(水) 21:41
2025-09-04,09:32,domestic,国内,38,時事通信,首相退陣圧力一段と　揺らぐ政権基盤　「石破降ろし」に勢い〔深層探訪〕,33,https://news.yahoo.co.jp/articles/c4d02d789bfca3670c8f14d07fa8379151df012c,9/4(木) 7:00
2025-09-04,09:32,domestic,国内,39,産経新聞,新浪氏、違法疑いサプリ巡る捜査「私は潔白だと思う」　同友会トップ進退は「会に委ねる」,33,https://news.yahoo.co.jp/articles/bc95022769a8d9c389c680f72bbbe4e39dd94282,9/4(木) 7:00
2025-09-04,09:32,domestic,国内,40,読売新聞オンライン,沖縄米兵の性暴力後絶たず、町長は司令官を制し「基地がある金武町のトップは私」と兵士へ直接講話,32,https://news.yahoo.co.jp/articles/ab21bb33ddaef8471af10873e6e40696a25578d4,9/4(木) 7:47
