scrp_date,scrp_time,genre_en,genre_jp,rank,media_jp,title,comment,link,date_original
2024-10-01,08:09,business,経済,11:30「市場の洗礼を浴びている」日経平均株価が一時2000円急落　石破新総裁の誕生受けTBS NEWS DIG Powered by JNN9/30(月) 9:06211件/時,TBS NEWS DIG Powered by JNN,「市場の洗礼を浴びている」日経平均株価が一時2000円急落　石破新総裁の誕生受け,211,https://news.yahoo.co.jp/articles/cb0410aea70ea08c226e3d561409ef5fc9aa6585,9/30(月) 9:06
2024-10-01,08:09,business,経済,24:35【解説】“石破ショック”？　株価大きく下落…その理由と今後日テレNEWS NNN9/30(月) 19:45157件/時,日テレNEWS NNN,【解説】“石破ショック”？　株価大きく下落…その理由と今後,157,https://news.yahoo.co.jp/articles/3a40ce1460a4756cab08c7c72724ad1aa3783f55,9/30(月) 19:45
2024-10-01,08:09,business,経済,310:06最低賃金アップで値上げに影響も…児童手当は大幅拡充　10月から変わる“お金”いろいろ【Nスタ解説】TBS NEWS DIG Powered by JNN9/30(月) 20:51144件/時,TBS NEWS DIG Powered by JNN,最低賃金アップで値上げに影響も…児童手当は大幅拡充　10月から変わる“お金”いろいろ【Nスタ解説】,144,https://news.yahoo.co.jp/articles/9b33b6e51633759eb96fe15ebfc2df43754496f7,9/30(月) 20:51
2024-10-01,08:09,business,経済,4東証、終値は1910円安　〝石破ショック〟総裁選出後初の取引は大幅反落で終える産経新聞9/30(月) 15:19101件/時,産経新聞,東証、終値は1910円安　〝石破ショック〟総裁選出後初の取引は大幅反落で終える,101,https://news.yahoo.co.jp/articles/1658f5eaf7f25fd288737e39177ad0e3ab471e15,9/30(月) 15:19
2024-10-01,08:09,business,経済,5郵便局窓口「昼休み」導入、11月に計1389局へ拡大　全体の7%朝日新聞デジタル9/30(月) 19:0699件/時,朝日新聞デジタル,郵便局窓口「昼休み」導入、11月に計1389局へ拡大　全体の7%,99,https://news.yahoo.co.jp/articles/de5184128d2e3ec79ce35ef6158836ce7f2c90f6,9/30(月) 19:06
2024-10-01,08:09,business,経済,6ダウ平均終値、１７ドル高の４万２３３０ドル…２営業日連続で過去最高値を更新読売新聞オンライン10/1(火) 5:4192件/時,読売新聞オンライン,ダウ平均終値、１７ドル高の４万２３３０ドル…２営業日連続で過去最高値を更新,92,https://news.yahoo.co.jp/articles/3ccf575fde6bb5b84fbd9304564ac565c9a82c99,10/1(火) 5:41
2024-10-01,08:09,business,経済,710月1日からスタート「新型コロナワクチン」定期接種開始でどうなる？　種類は？値段は？打つべき人は？子どもは？　医療ライターが専門家・メーカーを取材東洋経済オンライン10/1(火) 6:0278件/時,東洋経済オンライン,10月1日からスタート「新型コロナワクチン」定期接種開始でどうなる？　種類は？値段は？打つべき人は？子どもは？　医療ライターが専門家・メーカーを取材,78,https://news.yahoo.co.jp/articles/cfb81108526968a6778214ba47e7c0ea7afd9f4c,10/1(火) 6:02
2024-10-01,08:09,business,経済,8石破ショック！日経平均1910円安は「予告された暴落」だった…いま「新総裁」に求められるもの現代ビジネス10/1(火) 7:0556件/時,現代ビジネス,石破ショック！日経平均1910円安は「予告された暴落」だった…いま「新総裁」に求められるもの,56,https://news.yahoo.co.jp/articles/4f1276d514a4bb69baca29b551cfb68b9d2cd364,10/1(火) 7:05
2024-10-01,08:09,business,経済,9就職氷河期世代の5人に2人は「年金が月10万円未満」に…　「働かなければ食べていけない」これからの高齢者就業のあり方マネーポストWEB10/1(火) 6:5952件/時,マネーポストWEB,就職氷河期世代の5人に2人は「年金が月10万円未満」に…　「働かなければ食べていけない」これからの高齢者就業のあり方,52,https://news.yahoo.co.jp/articles/1ab541fdd68a33860a0eace2bba3f489d0f885b9,10/1(火) 6:59
2024-10-01,08:09,business,経済,101:3910月1日から大手銀行が住宅ローン変動金利引き上げ 住宅販売の現場では駆け込み需要もテレビ朝日系（ANN）9/30(月) 15:5052件/時,テレビ朝日系（ANN）,10月1日から大手銀行が住宅ローン変動金利引き上げ 住宅販売の現場では駆け込み需要も,52,https://news.yahoo.co.jp/articles/f020acb52e709ce423f1ee874e6eb099e69cc53c,9/30(月) 15:50
2024-10-01,08:09,business,経済,11中国海軍の空母が日本近海で艦載機“飛ばしまくり”!?  自衛隊が発着艦 「410回」確認 画像も公開乗りものニュース10/1(火) 6:1244件/時,乗りものニュース,中国海軍の空母が日本近海で艦載機“飛ばしまくり”!?  自衛隊が発着艦 「410回」確認 画像も公開,44,https://news.yahoo.co.jp/articles/8be570bc8abb91175c632ce92d063e9936c3c45a,10/1(火) 6:12
2024-10-01,08:09,business,経済,12スマスロ人気でパチスロ業界「V字回復」はあるのか？　射幸性をカバーするゲーム性と演出で40～50代の“4号機世代”を呼び込むマネーポストWEB9/30(月) 16:1537件/時,マネーポストWEB,スマスロ人気でパチスロ業界「V字回復」はあるのか？　射幸性をカバーするゲーム性と演出で40～50代の“4号機世代”を呼び込む,37,https://news.yahoo.co.jp/articles/ecb0b0b0fe9daad4bd411519c8861bb702cfd232,9/30(月) 16:15
2024-10-01,08:09,business,経済,13ハイブリッド車が「一部の国」でイマイチ普及していない根本理由Merkmal10/1(火) 5:4136件/時,Merkmal,ハイブリッド車が「一部の国」でイマイチ普及していない根本理由,36,https://news.yahoo.co.jp/articles/4802428cc4cd1e401979c3c6fc4ba24914b689c4,10/1(火) 5:41
2024-10-01,08:09,business,経済,14もう中国から逃げ出したい…！「経済オンチ」の習近平政権が加速させる《ヒト・モノ・カネ》の大流出現代ビジネス10/1(火) 7:3033件/時,現代ビジネス,もう中国から逃げ出したい…！「経済オンチ」の習近平政権が加速させる《ヒト・モノ・カネ》の大流出,33,https://news.yahoo.co.jp/articles/d03ed4e3a048a3cbfdcb39f8805bab2d9cb31cce,10/1(火) 7:30
2024-10-01,08:09,business,経済,15もう働きたくない…日本で「おひとりさまFIRE」が止まらないシンプルな理由現代ビジネス10/1(火) 7:0532件/時,現代ビジネス,もう働きたくない…日本で「おひとりさまFIRE」が止まらないシンプルな理由,32,https://news.yahoo.co.jp/articles/4fbb7bb068aedf1144320503c38fdeb859cf846e,10/1(火) 7:05
2024-10-01,08:09,business,経済,16パスポート保有率17％ 「海外行きたいと思わない」Z世代が増加 若者の意識に変化テレビ朝日系（ANN）9/30(月) 13:3232件/時,テレビ朝日系（ANN）,パスポート保有率17％ 「海外行きたいと思わない」Z世代が増加 若者の意識に変化,32,https://news.yahoo.co.jp/articles/f60c2247deaab26fe6686389d5e978aa81ecf8aa,9/30(月) 13:32
2024-10-01,08:09,business,経済,170:42“石破ショック”で株価急反落　一時1900円超安　「金融所得課税」めぐる石破氏の姿勢見極めたい声FNNプライムオンライン（フジテレビ系）9/30(月) 11:5228件/時,FNNプライムオンライン（フジテレビ系）,“石破ショック”で株価急反落　一時1900円超安　「金融所得課税」めぐる石破氏の姿勢見極めたい声,28,https://news.yahoo.co.jp/articles/623fc3375332c8cf907babb5d43f77bb978007ea,9/30(月) 11:52
2024-10-01,08:09,business,経済,1810月の食品値上げ2911品目、年内最大の値上げラッシュ　「酒類・飲料」が1年ぶり1千品目超、ハム・ソーセージで一斉値上げ帝国データバンク9/30(月) 9:0026件/時,帝国データバンク,10月の食品値上げ2911品目、年内最大の値上げラッシュ　「酒類・飲料」が1年ぶり1千品目超、ハム・ソーセージで一斉値上げ,26,https://news.yahoo.co.jp/articles/7cbb1b51870a84642fbfb5ed0082bc0fd431a119,9/30(月) 9:00
2024-10-01,08:09,business,経済,19「お金が貯まらない家」のキッチンには大抵これがある…片付ければ食費が月3万円浮く無駄アイテムプレジデントオンライン9/30(月) 18:1725件/時,プレジデントオンライン,「お金が貯まらない家」のキッチンには大抵これがある…片付ければ食費が月3万円浮く無駄アイテム,25,https://news.yahoo.co.jp/articles/129f7a2f42276455ab4a4c6a21137b6d3d9878ab,9/30(月) 18:17
2024-10-01,08:09,business,経済,20【速報】日経平均株価が700円以上下げる…石破新総裁誕生で市場が「巻き戻し」かFNNプライムオンライン（フジテレビ系）9/30(月) 9:0024件/時,FNNプライムオンライン（フジテレビ系）,【速報】日経平均株価が700円以上下げる…石破新総裁誕生で市場が「巻き戻し」か,24,https://news.yahoo.co.jp/articles/e04c5520c9cec5568da1acb042756145d7b92af8,9/30(月) 9:00
2024-10-01,08:09,business,経済,21新米、店頭に並んでいるけれど…　高価格、いまだ買いづらいコメ毎日新聞10/1(火) 7:3020件/時,毎日新聞,新米、店頭に並んでいるけれど…　高価格、いまだ買いづらいコメ,20,https://news.yahoo.co.jp/articles/3073ad2b53cf19381f577dc89435c4bcd7c28a8b,10/1(火) 7:30
2024-10-01,08:09,business,経済,22労働者のスタンダードは「元気でバリバリ働ける人」……本当にそれでいいの？ITmedia ビジネスオンライン10/1(火) 6:0019件/時,ITmedia ビジネスオンライン,労働者のスタンダードは「元気でバリバリ働ける人」……本当にそれでいいの？,19,https://news.yahoo.co.jp/articles/ce14fc7ca339a30ac7531c4cdb2c2ebad771b05a,10/1(火) 6:00
2024-10-01,08:09,business,経済,2330日の東京株式市場、一時1900円超安　石破政権の誕生控え、利上げと課税強化を警戒産経新聞9/30(月) 11:3517件/時,産経新聞,30日の東京株式市場、一時1900円超安　石破政権の誕生控え、利上げと課税強化を警戒,17,https://news.yahoo.co.jp/articles/f4c3aedf1543e821551a2144b18b6ff5f565f07d,9/30(月) 11:35
2024-10-01,08:09,business,経済,24最近弱ってきたな……じゃなくて元気だったのに突然死！　クルマのバッテリーがいきなりダメになる理由と避けるための対策とはWEB CARTOP10/1(火) 7:1016件/時,WEB CARTOP,最近弱ってきたな……じゃなくて元気だったのに突然死！　クルマのバッテリーがいきなりダメになる理由と避けるための対策とは,16,https://news.yahoo.co.jp/articles/67ee45740b293da195abc01e3cc8d691be82dff1,10/1(火) 7:10
2024-10-01,08:09,business,経済,25ガソリンスタンドで店員から「オイル交換をしませんか？」と勧誘を受けました。自分でやるよりお得なのでしょうか？ファイナンシャルフィールド9/30(月) 19:0215件/時,ファイナンシャルフィールド,ガソリンスタンドで店員から「オイル交換をしませんか？」と勧誘を受けました。自分でやるよりお得なのでしょうか？,15,https://news.yahoo.co.jp/articles/dc54aecb7a16e8d91183282545610951e3e1f537,9/30(月) 19:02
2024-10-01,08:09,business,経済,26【夜職界隈】セクシー女優やキャバ嬢のインフルエンサー化に一抹の不安を覚える人たち　「小学生の娘が憧れて…」と保護者は複雑な心境マネーポストWEB9/30(月) 19:1515件/時,マネーポストWEB,【夜職界隈】セクシー女優やキャバ嬢のインフルエンサー化に一抹の不安を覚える人たち　「小学生の娘が憧れて…」と保護者は複雑な心境,15,https://news.yahoo.co.jp/articles/4b111fb09d46c2ef419b57a61f3214c6516dbc21,9/30(月) 19:15
2024-10-01,08:09,business,経済,27驚異の制動力アップ！ ローター径拡大がもたらす2大メリットとは？～カスタムHOW TO～レスポンス10/1(火) 6:3014件/時,レスポンス,驚異の制動力アップ！ ローター径拡大がもたらす2大メリットとは？～カスタムHOW TO～,14,https://news.yahoo.co.jp/articles/fa2ec41df7f0e47438e95dbdd4a272d443b6c2ee,10/1(火) 6:30
2024-10-01,08:09,business,経済,28楽天Ｇ、カード事業でみずほＦＧと資本業務提携へ　金融子会社の再編は中止ロイター9/30(月) 15:0814件/時,ロイター,楽天Ｇ、カード事業でみずほＦＧと資本業務提携へ　金融子会社の再編は中止,14,https://news.yahoo.co.jp/articles/131556f8ab779aef8926e073c65f60af958a58be,9/30(月) 15:08
2024-10-01,08:09,business,経済,29ハンドル奥に備わる「パドルシフト」使ってない人が多い!? AT車で“わざわざ変速”する必要ある？ 一体いつ使うものなのか？くるまのニュース9/30(月) 14:5014件/時,くるまのニュース,ハンドル奥に備わる「パドルシフト」使ってない人が多い!? AT車で“わざわざ変速”する必要ある？ 一体いつ使うものなのか？,14,https://news.yahoo.co.jp/articles/9fb9b27f8988074823d181c9ef49e04b95947a8c,9/30(月) 14:50
2024-10-01,08:09,business,経済,30非正規雇用が30年で20.3%→37.1%に…増加は1995年の財界リポート「新時代の日本的経営」がきっかけ【自民党と企業献金 蜜月の半世紀】#9日刊ゲンダイDIGITAL10/1(火) 7:0313件/時,日刊ゲンダイDIGITAL,非正規雇用が30年で20.3%→37.1%に…増加は1995年の財界リポート「新時代の日本的経営」がきっかけ【自民党と企業献金 蜜月の半世紀】#9,13,https://news.yahoo.co.jp/articles/863462a469141f5afe8b91b05fcec7bdbcc413aa,10/1(火) 7:03
2024-10-01,08:09,business,経済,31郵便局窓口に昼休み導入、全国１３９０局に大幅増…負担減で１１月から読売新聞オンライン10/1(火) 7:2013件/時,読売新聞オンライン,郵便局窓口に昼休み導入、全国１３９０局に大幅増…負担減で１１月から,13,https://news.yahoo.co.jp/articles/4afdbbed6b39039dc3866fa500e55dcef84bd603,10/1(火) 7:20
2024-10-01,08:09,business,経済,32異次元緩和の出口に待ち受ける「途方もない困難」　植田日銀は「永遠の金融緩和」への圧力に耐えきれるか現代ビジネス10/1(火) 6:0513件/時,現代ビジネス,異次元緩和の出口に待ち受ける「途方もない困難」　植田日銀は「永遠の金融緩和」への圧力に耐えきれるか,13,https://news.yahoo.co.jp/articles/6ab304a8be4105d5c4eea2b456299a581ff69c2f,10/1(火) 6:05
2024-10-01,08:09,business,経済,33日経平均 一時1800円超下落 自民・石破新総裁の経済・財政政策への警戒感が影響かABEMA TIMES9/30(月) 10:1813件/時,ABEMA TIMES,日経平均 一時1800円超下落 自民・石破新総裁の経済・財政政策への警戒感が影響か,13,https://news.yahoo.co.jp/articles/887813afcadb09a9062470ea53acde3d942200d5,9/30(月) 10:18
2024-10-01,08:09,business,経済,34日経平均、終値は1910円下落し3万7919円　下落幅は歴代５位テレ東BIZ9/30(月) 15:0312件/時,テレ東BIZ,日経平均、終値は1910円下落し3万7919円　下落幅は歴代５位,12,https://news.yahoo.co.jp/articles/0b66bc3ce261fe20433b240260a52ca50651c120,9/30(月) 15:03
2024-10-01,08:09,business,経済,35日経平均、3万8000円割れ＝東京株式時事通信9/30(月) 10:0012件/時,時事通信,日経平均、3万8000円割れ＝東京株式,12,https://news.yahoo.co.jp/articles/920025b4a60cf99f8b9b43e2668fead929446f43,9/30(月) 10:00
2024-10-01,08:09,business,経済,36ペダル付き原付ついに「都内初の死亡事故です」発生7か月後に警視庁 “見た目も気分も自転車”がアダに？乗りものニュース9/30(月) 9:4212件/時,乗りものニュース,ペダル付き原付ついに「都内初の死亡事故です」発生7か月後に警視庁 “見た目も気分も自転車”がアダに？,12,https://news.yahoo.co.jp/articles/ab985eb9acbbbbdb3cce4b14ddcabe2a627d62fb,9/30(月) 9:42
2024-10-01,08:09,business,経済,37【速報】日経平均株価が1800円以上下がり3万8000円台割る…石破新総裁誕生で市場が「巻き戻し」FNNプライムオンライン（フジテレビ系）9/30(月) 9:5212件/時,FNNプライムオンライン（フジテレビ系）,【速報】日経平均株価が1800円以上下がり3万8000円台割る…石破新総裁誕生で市場が「巻き戻し」,12,https://news.yahoo.co.jp/articles/ce1f946e16c2c80864cbc325f11d896ce418cd31,9/30(月) 9:52
2024-10-01,08:09,business,経済,38【速報】日経平均株価　一時3万8000円割れテレ東BIZ9/30(月) 9:1211件/時,テレ東BIZ,【速報】日経平均株価　一時3万8000円割れ,11,https://news.yahoo.co.jp/articles/f2dcf178bc3b4df223c6e2306ba7d9851603be92,9/30(月) 9:12
2024-10-01,08:09,business,経済,3930日の東京株式市場、一時1600円超安　〝石破ショック〟の様相呈す産経新聞9/30(月) 9:1511件/時,産経新聞,30日の東京株式市場、一時1600円超安　〝石破ショック〟の様相呈す,11,https://news.yahoo.co.jp/articles/2b1d4e29d37bb6542e3f2b05bd8354c2f66ba730,9/30(月) 9:15
2024-10-01,08:09,business,経済,40島しょ防衛で役立つか？「護衛艦による対地攻撃」訓練を海上自衛隊が公開乗りものニュース9/30(月) 12:3211件/時,乗りものニュース,島しょ防衛で役立つか？「護衛艦による対地攻撃」訓練を海上自衛隊が公開,11,https://news.yahoo.co.jp/articles/58b32e7a1f8bd2455e3e08ef6ee66cfd446c70ca,9/30(月) 12:32
