scrp_date,scrp_time,genre_en,genre_jp,rank,media_jp,title,comment,link,date_original
2024-10-01,10:34,sports,スポーツ,1「安打王」ピート・ローズ氏が83歳で死去と米報道　MLB最多4256安打も野球賭博で89年に永久追放スポニチアネックス10/1(火) 8:40242件/時,スポニチアネックス,「安打王」ピート・ローズ氏が83歳で死去と米報道　MLB最多4256安打も野球賭博で89年に永久追放,242,https://news.yahoo.co.jp/articles/e26ac5262cfa74b47973d9117d605667bf1926be,10/1(火) 8:40
2024-10-01,10:34,sports,スポーツ,2大谷翔平、2年連続HR王＆日本人初の打点王確定　両リーグ獲得は史上4人目Full-Count10/1(火) 8:04207件/時,Full-Count,大谷翔平、2年連続HR王＆日本人初の打点王確定　両リーグ獲得は史上4人目,207,https://news.yahoo.co.jp/articles/de8afad23ab1401ffaef333b5fdfb997513a40ee,10/1(火) 8:04
2024-10-01,10:34,sports,スポーツ,3阪神ファン騒然「佐藤輝明ブチギレ事件」の真相が判明！　原因は「憶測による戦犯扱い」だった！FRIDAY10/1(火) 9:00130件/時,FRIDAY,阪神ファン騒然「佐藤輝明ブチギレ事件」の真相が判明！　原因は「憶測による戦犯扱い」だった！,130,https://news.yahoo.co.jp/articles/55606b69a59276b1d821368103bef6a03f3859b7,10/1(火) 9:00
2024-10-01,10:34,sports,スポーツ,4阪神　加治屋、高浜、岩田、遠藤が戦力構想外　遠藤、ウエスタン最高出塁率と奮闘も１軍出場ならずデイリースポーツ10/1(火) 5:01122件/時,デイリースポーツ,阪神　加治屋、高浜、岩田、遠藤が戦力構想外　遠藤、ウエスタン最高出塁率と奮闘も１軍出場ならず,122,https://news.yahoo.co.jp/articles/dbba470dd6e57258e4cb17ac047a7114298ee3bd,10/1(火) 5:01
2024-10-01,10:34,sports,スポーツ,5寝床は地下の筋トレ室、外出は禁止…白鵬の愛弟子たちが告白「伊勢ヶ濱部屋移籍後の冷遇されっぷり」FRIDAY10/1(火) 7:00101件/時,FRIDAY,寝床は地下の筋トレ室、外出は禁止…白鵬の愛弟子たちが告白「伊勢ヶ濱部屋移籍後の冷遇されっぷり」,101,https://news.yahoo.co.jp/articles/3820f860ed8ef36773a5ce2713d3672cf8cf5f57,10/1(火) 7:00
2024-10-01,10:34,sports,スポーツ,6最強打者は「ジャッジ」　米記者「簡単な選択」…大谷翔平との大きな差“223対190”Full-Count10/1(火) 9:1695件/時,Full-Count,最強打者は「ジャッジ」　米記者「簡単な選択」…大谷翔平との大きな差“223対190”,95,https://news.yahoo.co.jp/articles/41daf46b239291cbd0e2666be2af85d3e9540134,10/1(火) 9:16
2024-10-01,10:34,sports,スポーツ,7ヴィニシウス、ダービーでアトレティコ主将コケに…「俺はCLに2回優勝したがお前は1回も勝ってない。なぜならひどい選手だからだ」GOAL10/1(火) 6:3186件/時,GOAL,ヴィニシウス、ダービーでアトレティコ主将コケに…「俺はCLに2回優勝したがお前は1回も勝ってない。なぜならひどい選手だからだ」,86,https://news.yahoo.co.jp/articles/496d08f9e00181d86295dd9ebeae541da4d4bf75,10/1(火) 6:31
2024-10-01,10:34,sports,スポーツ,8吉田正尚と山本由伸を韓国メディアが酷評「見るまでもなく失敗」「外野手として生産性がない」東スポWEB9/30(月) 16:5667件/時,東スポWEB,吉田正尚と山本由伸を韓国メディアが酷評「見るまでもなく失敗」「外野手として生産性がない」,67,https://news.yahoo.co.jp/articles/4d3c784351c352c73cf09b83e2fbb07fca355c74,9/30(月) 16:56
2024-10-01,10:34,sports,スポーツ,9ピート・ローズ氏が83歳で死去　MLB歴代最多4256安打も野球賭博で永久追放…米報道Full-Count10/1(火) 8:1664件/時,Full-Count,ピート・ローズ氏が83歳で死去　MLB歴代最多4256安打も野球賭博で永久追放…米報道,64,https://news.yahoo.co.jp/articles/557ae0251d8efe6288a7e1ec17d234e184750a08,10/1(火) 8:16
2024-10-01,10:34,sports,スポーツ,10DeNAに復帰した筒香嘉智は年俸3億円分の“投資価値”があるのか　来季以降への期待が膨らむ意外な数字とその存在意義とはVICTORY10/1(火) 7:0455件/時,VICTORY,DeNAに復帰した筒香嘉智は年俸3億円分の“投資価値”があるのか　来季以降への期待が膨らむ意外な数字とその存在意義とは,55,https://news.yahoo.co.jp/articles/8563f097adb7a01ff928b6874c6ba60493987d7d,10/1(火) 7:04
2024-10-01,10:34,sports,スポーツ,11楽天が田中将の出場選手登録を抹消　今季登板わずか１試合　レギュラーシーズンは終了へデイリースポーツ9/30(月) 16:0055件/時,デイリースポーツ,楽天が田中将の出場選手登録を抹消　今季登板わずか１試合　レギュラーシーズンは終了へ,55,https://news.yahoo.co.jp/articles/a29fc05a57afa8f9093fa019abab6fd962ed3cc3,9/30(月) 16:00
2024-10-01,10:34,sports,スポーツ,12中日の“功労者”ビシエドの去就は立浪監督退任でどうなるか　「コーチ兼任」で残留の可能性AERA dot.10/1(火) 7:0250件/時,AERA dot.,中日の“功労者”ビシエドの去就は立浪監督退任でどうなるか　「コーチ兼任」で残留の可能性,50,https://news.yahoo.co.jp/articles/aceb1e1132dda7591fb65446c1c0216047d295d9,10/1(火) 7:02
2024-10-01,10:34,sports,スポーツ,13韓国復帰で32HR＆112打点…阪神で“ダメ助っ人”と言われたロハスJr.が再覚醒できたワケ「日本の投手の方がレベルは上」CoCoKARAnext10/1(火) 7:0048件/時,CoCoKARAnext,韓国復帰で32HR＆112打点…阪神で“ダメ助っ人”と言われたロハスJr.が再覚醒できたワケ「日本の投手の方がレベルは上」,48,https://news.yahoo.co.jp/articles/f789ea2e1d3475fa5f8b618bc6ba3b5b413410fa,10/1(火) 7:00
2024-10-01,10:34,sports,スポーツ,14ドラフト候補・慶大「清原正吾」の“守備”は「プロでも全く問題ない」　通算306本塁打のレジェンド打者が太鼓判　では“長打力”開花の条件は？デイリー新潮10/1(火) 6:1142件/時,デイリー新潮,ドラフト候補・慶大「清原正吾」の“守備”は「プロでも全く問題ない」　通算306本塁打のレジェンド打者が太鼓判　では“長打力”開花の条件は？,42,https://news.yahoo.co.jp/articles/f052b5b27347a1f776cd4981590e360545786041,10/1(火) 6:11
2024-10-01,10:34,sports,スポーツ,15国際大会でエントリーミス　日本バドミントン協会共同通信9/30(月) 20:2040件/時,共同通信,国際大会でエントリーミス　日本バドミントン協会,40,https://news.yahoo.co.jp/articles/4f24fbd47f1b4416b2f7bd4a7f44aee15b0aaa8c,9/30(月) 20:20
2024-10-01,10:34,sports,スポーツ,16ムカついた中日指揮官からの“圧力”　納得いかない起用法…ぶちまけた怒り「ボケー」Full-Count10/1(火) 6:5040件/時,Full-Count,ムカついた中日指揮官からの“圧力”　納得いかない起用法…ぶちまけた怒り「ボケー」,40,https://news.yahoo.co.jp/articles/5b0ccd4d6156fb13c16662738163756575f3d1f6,10/1(火) 6:50
2024-10-01,10:34,sports,スポーツ,17楽天が8回に執念の同点劇も守護神則本が…3年ぶりCS進出は諦めないスポニチアネックス9/30(月) 20:5840件/時,スポニチアネックス,楽天が8回に執念の同点劇も守護神則本が…3年ぶりCS進出は諦めない,40,https://news.yahoo.co.jp/articles/a81b313ea0fd2c4a0c55d363bb75631260425af3,9/30(月) 20:58
2024-10-01,10:34,sports,スポーツ,18中継ぎで連続黒星…失点続きの村上頌樹に五十嵐氏「中継ぎで2試合連続っていうのは精神的にはきつくなってきます」ベースボールキング10/1(火) 6:4037件/時,ベースボールキング,中継ぎで連続黒星…失点続きの村上頌樹に五十嵐氏「中継ぎで2試合連続っていうのは精神的にはきつくなってきます」,37,https://news.yahoo.co.jp/articles/6ae663ae7825f9c607a6e9bd0b435b6266332b2b,10/1(火) 6:40
2024-10-01,10:34,sports,スポーツ,19トヨタまでスポンサー撤退で商業五輪「終わりの始まり」…章男会長「政治色も強くなり」とバッサリ日刊ゲンダイDIGITAL10/1(火) 9:0637件/時,日刊ゲンダイDIGITAL,トヨタまでスポンサー撤退で商業五輪「終わりの始まり」…章男会長「政治色も強くなり」とバッサリ,37,https://news.yahoo.co.jp/articles/de1d94315041133d361e02279595f06200d84a5c,10/1(火) 9:06
2024-10-01,10:34,sports,スポーツ,20立浪監督の”後任”は…？中日の監督候補に挙がる大物（3）阪神の元監督が“急浮上”！？ベースボールチャンネル10/1(火) 7:5036件/時,ベースボールチャンネル,立浪監督の”後任”は…？中日の監督候補に挙がる大物（3）阪神の元監督が“急浮上”！？,36,https://news.yahoo.co.jp/articles/3aeb3eb07d9f1c8c8b4cd0325119766e93462ea0,10/1(火) 7:50
2024-10-01,10:34,sports,スポーツ,21怪物ジャッジ、大谷翔平も届かないボンズ以来の大記録　「MVPだ」「信じられない」米驚愕の7割超THE ANSWER9/30(月) 20:0333件/時,THE ANSWER,怪物ジャッジ、大谷翔平も届かないボンズ以来の大記録　「MVPだ」「信じられない」米驚愕の7割超,33,https://news.yahoo.co.jp/articles/c9a5a762cb282ea3c69b7360c619132e519dc10b,9/30(月) 20:03
2024-10-01,10:34,sports,スポーツ,22またまた大炎上！町田ゼルビア黒田剛監督は日本サッカー界の風雲児か？それともSNSお祭り炎上男か？日刊ゲンダイDIGITAL9/30(月) 17:5032件/時,日刊ゲンダイDIGITAL,またまた大炎上！町田ゼルビア黒田剛監督は日本サッカー界の風雲児か？それともSNSお祭り炎上男か？,32,https://news.yahoo.co.jp/articles/866111e57086443239ebed29952a81fd9d71b369,9/30(月) 17:50
2024-10-01,10:34,sports,スポーツ,23虎党ヒヤリ・・・阪神・森下翔太が左肩付近に死球　一度はベンチに引き揚げるもプレー続行サンケイスポーツ9/30(月) 19:2032件/時,サンケイスポーツ,虎党ヒヤリ・・・阪神・森下翔太が左肩付近に死球　一度はベンチに引き揚げるもプレー続行,32,https://news.yahoo.co.jp/articles/8e73f52ff2084879aa132e438f7f745eab34660d,9/30(月) 19:20
2024-10-01,10:34,sports,スポーツ,24大谷より“ボンズが上”「ステロイドは関係ない」　OBに司会者猛反論「彼は80本打てた」Full-Count9/30(月) 13:3332件/時,Full-Count,大谷より“ボンズが上”「ステロイドは関係ない」　OBに司会者猛反論「彼は80本打てた」,32,https://news.yahoo.co.jp/articles/44c79b07cf5469a8232da417b898fdc63b07886a,9/30(月) 13:33
2024-10-01,10:34,sports,スポーツ,25W杯出場枠が“4.5→8.5”に増加も「アジア最終予選の難しさはさほど変わらない」。識者がそう語る根拠とは？SOCCER DIGEST Web10/1(火) 6:0032件/時,SOCCER DIGEST Web,W杯出場枠が“4.5→8.5”に増加も「アジア最終予選の難しさはさほど変わらない」。識者がそう語る根拠とは？,32,https://news.yahoo.co.jp/articles/4e1da0e566c80bc363435bb4c4d21c5a255b551a,10/1(火) 6:00
2024-10-01,10:34,sports,スポーツ,26日本ハム優良2助っ人が流出危機…新庄監督まさかの「公開残留要請」、オリ&西武が調査か日刊ゲンダイDIGITAL9/30(月) 11:2728件/時,日刊ゲンダイDIGITAL,日本ハム優良2助っ人が流出危機…新庄監督まさかの「公開残留要請」、オリ&西武が調査か,28,https://news.yahoo.co.jp/articles/d6c4701e6a667ac730512ef0f95f7166f6bf62d0,9/30(月) 11:27
2024-10-01,10:34,sports,スポーツ,27ルノーがF1エンジンプログラム終了を正式に発表。アルピーヌは2026年からカスタマーチームにオートスポーツweb10/1(火) 7:1228件/時,オートスポーツweb,ルノーがF1エンジンプログラム終了を正式に発表。アルピーヌは2026年からカスタマーチームに,28,https://news.yahoo.co.jp/articles/ad6ed1a42363475720e3e5369e339744fabcaffb,10/1(火) 7:12
2024-10-01,10:34,sports,スポーツ,28ブレーブス、シーズン最終戦制して7年連続プレーオフ進出　ダイヤモンドバックスは直接対決の差でプレーオフ逸ベースボールキング10/1(火) 8:0928件/時,ベースボールキング,ブレーブス、シーズン最終戦制して7年連続プレーオフ進出　ダイヤモンドバックスは直接対決の差でプレーオフ逸,28,https://news.yahoo.co.jp/articles/0fc4eb6ae491aa0f440a4d5f6f1d702a021d23fd,10/1(火) 8:09
2024-10-01,10:34,sports,スポーツ,29巨人が菊田、小沼ら８選手に戦力外通告　石田ら２選手は自由契約で育成打診へデイリースポーツ9/30(月) 13:0927件/時,デイリースポーツ,巨人が菊田、小沼ら８選手に戦力外通告　石田ら２選手は自由契約で育成打診へ,27,https://news.yahoo.co.jp/articles/f84141b9e63913c85b50a7a70ad580304dd8ca79,9/30(月) 13:09
2024-10-01,10:34,sports,スポーツ,30「リハビリ中の投手がトリプルスリーって…」　大谷翔平.310、54発、49盗塁の異常スタッツに衝撃THE ANSWER10/1(火) 4:4327件/時,THE ANSWER,「リハビリ中の投手がトリプルスリーって…」　大谷翔平.310、54発、49盗塁の異常スタッツに衝撃,27,https://news.yahoo.co.jp/articles/443832dc983e01112078c70be6fe91b48d66624f,10/1(火) 4:43
2024-10-01,10:34,sports,スポーツ,31世界戦略を重視する名門ヤンキースが巨人・岡本和真に熱視線！両者は《相思相愛》との情報も日刊ゲンダイDIGITAL9/30(月) 11:2226件/時,日刊ゲンダイDIGITAL,世界戦略を重視する名門ヤンキースが巨人・岡本和真に熱視線！両者は《相思相愛》との情報も,26,https://news.yahoo.co.jp/articles/9e07e2856033d1a2a9796669804f5eaf1d35c021,9/30(月) 11:22
2024-10-01,10:34,sports,スポーツ,323失点黒星…鈴木彩艶、地元メディアから厳しい評価に。パルマは4戦未勝利「何度も不正確なプレー」GOAL10/1(火) 7:1326件/時,GOAL,3失点黒星…鈴木彩艶、地元メディアから厳しい評価に。パルマは4戦未勝利「何度も不正確なプレー」,26,https://news.yahoo.co.jp/articles/419a894493432ab297bc89d830f0f327ee06604d,10/1(火) 7:13
2024-10-01,10:34,sports,スポーツ,33大谷翔平、たった「1本」足りず逃した快挙…　ルースは103年前に達成、目前だった史上6人目Full-Count9/30(月) 10:5226件/時,Full-Count,大谷翔平、たった「1本」足りず逃した快挙…　ルースは103年前に達成、目前だった史上6人目,26,https://news.yahoo.co.jp/articles/8252a81f9e0b32f8dcda2d2b8e61c821817a036d,9/30(月) 10:52
2024-10-01,10:34,sports,スポーツ,34「可愛すぎる」人気アイドルが衝撃始球式　まさかの“叩きつけ投球”に神宮騒然Full-Count10/1(火) 7:2025件/時,Full-Count,「可愛すぎる」人気アイドルが衝撃始球式　まさかの“叩きつけ投球”に神宮騒然,25,https://news.yahoo.co.jp/articles/430bb032c025af89662a9fbb542f94ad7ee66ffa,10/1(火) 7:20
2024-10-01,10:34,sports,スポーツ,35【30日・DeNAスタメン】宮崎はベンチ オースティン4番 捕手・戸柱5番 神里6番センター 京田7番サード 森敬8番 先発・吉野TBS NEWS DIG Powered by JNN9/30(月) 17:2625件/時,TBS NEWS DIG Powered by JNN,【30日・DeNAスタメン】宮崎はベンチ オースティン4番 捕手・戸柱5番 神里6番センター 京田7番サード 森敬8番 先発・吉野,25,https://news.yahoo.co.jp/articles/2c34c56ad4dc0059c4fb89c818c9ee429a7c1b97,9/30(月) 17:26
2024-10-01,10:34,sports,スポーツ,36大谷翔平の50号ボール巡ってもう１人が提訴でカオスに　外野席での「奪い合い」で損害賠償日刊スポーツ10/1(火) 10:0124件/時,日刊スポーツ,大谷翔平の50号ボール巡ってもう１人が提訴でカオスに　外野席での「奪い合い」で損害賠償,24,https://news.yahoo.co.jp/articles/112e437074d6499e7697daaa2b6288f6a8af67c5,10/1(火) 10:01
2024-10-01,10:34,sports,スポーツ,373位・ロッテと4位・楽天の直接対決！ポランコの一発でロッテが先制！「しっかり振り抜けたわ。パワー！」ベースボールキング9/30(月) 20:0024件/時,ベースボールキング,3位・ロッテと4位・楽天の直接対決！ポランコの一発でロッテが先制！「しっかり振り抜けたわ。パワー！」,24,https://news.yahoo.co.jp/articles/2a80d95cfb1e7829df48a91a8eaed2a715346959,9/30(月) 20:00
2024-10-01,10:34,sports,スポーツ,38【中日】小笠原慎之介、米国大手マネジメント会社と代理人契約締結　メジャー挑戦は「夢」日刊スポーツ10/1(火) 5:0024件/時,日刊スポーツ,【中日】小笠原慎之介、米国大手マネジメント会社と代理人契約締結　メジャー挑戦は「夢」,24,https://news.yahoo.co.jp/articles/3d4199e86c91a8a63e7b62768b9f62887ec02205,10/1(火) 5:00
2024-10-01,10:34,sports,スポーツ,39西武・武内　8回無失点の快投で10勝目！チームでは07年の岸以来、17年ぶりの新人2桁勝利達成スポニチアネックス9/30(月) 20:2424件/時,スポニチアネックス,西武・武内　8回無失点の快投で10勝目！チームでは07年の岸以来、17年ぶりの新人2桁勝利達成,24,https://news.yahoo.co.jp/articles/577a7ecb4ca983e3e9952835ea884223bedc7c11,9/30(月) 20:24
2024-10-01,10:34,sports,スポーツ,40大谷翔平、34歳先輩を走らせた“指令”に米国でも笑撃「ジャッジにはできない」「バレバレだ」THE ANSWER10/1(火) 6:1324件/時,THE ANSWER,大谷翔平、34歳先輩を走らせた“指令”に米国でも笑撃「ジャッジにはできない」「バレバレだ」,24,https://news.yahoo.co.jp/articles/12f01b480d558f7a7dc50900def81815cdb5a524,10/1(火) 6:13
