scrp_date,scrp_time,genre_en,genre_jp,rank,media_jp,title,comment,link,date_original
2024-02-09,03:22,TTL,総合,1,CBCテレビ,電動キックボードでひき逃げした男を逮捕「免許なしで乗れると思っていた」　防犯カメラが捉えた事故の瞬間,553,https://news.yahoo.co.jp/articles/99a2ae895f00793fd9f2ad522856ffddbc830861,2/8(木) 23:09
2024-02-09,03:22,TTL,総合,2,デイリースポーツ,アジア杯ベスト８の森保監督、技術委員会で賛否もサポート継続へ　反町委員長「全く疑いの余地はない」,394,https://news.yahoo.co.jp/articles/3345f495a4407f3a3aa97231820a5a4b2d1408b0,2/8(木) 18:37
2024-02-09,03:22,TTL,総合,3,FNNプライムオンライン（フジテレビ系）,子育て支援金「月500円弱」自民了承も注文相次ぐ　「追加負担はゼロ」国民への丁寧な説明要求,381,https://news.yahoo.co.jp/articles/35506ddacff19887e0729edc73a8642b2b0ed64b,2/8(木) 13:22
2024-02-09,03:22,TTL,総合,4,オリコン,小学館、芦原妃名子さん死去で読者・作家・関係者へコメント　現場編集者が声明「私たちは対策を考え続けます」,352,https://news.yahoo.co.jp/articles/75d70859e4ef1dff8c76a96a52ab36e8a7e99b29,2/8(木) 18:04
2024-02-09,03:22,TTL,総合,5,スポニチアネックス,ドラマ「セクシー田中さん」脚本家・相沢友子氏が追悼「頭が真っ白に」　自身の投稿を反省「深く後悔」,236,https://news.yahoo.co.jp/articles/80b8f30c1f81e13fa6ea7f8803e4d240426c6049,2/8(木) 15:47
2024-02-09,03:22,TTL,総合,6,産経新聞,立民・原口一博氏、露国営メディアで「ウクライナ支援の理由ない」「ロシアが悪はあり得ない」,217,https://news.yahoo.co.jp/articles/09a0cade92299c97915186f5c94383534ef9401d,2/8(木) 12:27
2024-02-09,03:22,TTL,総合,7,日テレNEWS NNN,かんだ犬の「飼い主」を取材…「絶対、逃げ出せない状態だと」　公園で犬に襲われ子ども含む12人ケガ　群馬・伊勢崎市,202,https://news.yahoo.co.jp/articles/4ab1c8d2f17301a0ae96daf161a6f52436de0beb,2/8(木) 5:02
2024-02-09,03:22,TTL,総合,8,共同通信,盛山文科相、署名「記憶ない」　推薦書、選挙後に「全て破棄」,186,https://news.yahoo.co.jp/articles/a0020282b74edfb157d9f88f7ef75f4578831512,2/8(木) 11:47
2024-02-09,03:22,TTL,総合,9,J-CASTニュース,イトーヨーカドー福島、郡山、帯広で相次ぎ閉店　再来年までに33店舗閉鎖、流通アナリストの評価は,178,https://news.yahoo.co.jp/articles/c65aa7f5644da857f4798db6d93f44a27b415bba,2/8(木) 16:39
2024-02-09,03:22,TTL,総合,10,TBS NEWS DIG Powered by JNN,「気に入らない相手を誹謗中傷し、脅迫する習癖が認められる」ガーシ―被告裁判で検察側が懲役4年求刑　被害者の綾野剛さんの意見も読み上げ,164,https://news.yahoo.co.jp/articles/e9e9a71a0cf4cbae1aa1181d332eff2507b209af,2/8(木) 14:25
2024-02-09,03:22,TTL,総合,11,デイリースポーツ,伊藤美誠“リザーブ向いてない”発言に代表監督は爆笑　「無理強いできないが、気が変わるかも」補欠選考は「一番調子いい選手」,133,https://news.yahoo.co.jp/articles/f8d70c43c189ba7cae18261b715e14b8c000908d,2/8(木) 15:24
2024-02-09,03:22,TTL,総合,12,テレビ朝日系（ANN）,総理「1人月500円弱」少子化対策に財源1兆円必要…個人差あり？会社員851円試算も,128,https://news.yahoo.co.jp/articles/cdb5f175d5c16e55772eba787d84382580d45709,2/8(木) 14:03
2024-02-09,03:22,TTL,総合,13,スポーツ報知,「ミヤネ屋」が松本人志報道について解説　週刊文春「１１人目の告発者」元グラビアアイドル新証言で「共通点」を説明,124,https://news.yahoo.co.jp/articles/d46a1b7ee59041e38b4e4d02122f440e4d0cbcb0,2/8(木) 16:02
2024-02-09,03:22,TTL,総合,14,読売テレビ,【速報】原因は黄色ブドウ球菌　恵方巻き集団食中毒で症状は150人に　具材を汚染後常温で長時間保管,121,https://news.yahoo.co.jp/articles/8c7953d0745be495df6e927fbb0b7817f85fe885,2/8(木) 18:00
2024-02-09,03:22,TTL,総合,15,週刊SPA!,やったら即「おじさん」認定される4つの行動。“口喧嘩最強ギャル” みりちゃむが辛口ジャッジ,111,https://news.yahoo.co.jp/articles/a1efeb9d8ea65bd7c2425da9f82a4d3a1a8dd2e1,2/8(木) 8:53
2024-02-09,03:22,TTL,総合,16,ABEMA TIMES,大雪で飲食店予約「ドタキャン」も 年間被害1兆6000億円…法的措置は可能？  「ネガティブな印象がつくので言いにくい」悩む店主、損害防ぐ対策は,111,https://news.yahoo.co.jp/articles/91cf97c0cec8e128546743746c42cfee4f150ee7,2/8(木) 8:25
2024-02-09,03:22,TTL,総合,17,スポーツ報知,ミヤネ屋出演者「さすがの松本さんでもブレるのか…後手後手に」ついに１１人目の告発者「焦っているのでは」,104,https://news.yahoo.co.jp/articles/63aa6b2a9a40928bd69c8c844ba2de14212c30a4,2/8(木) 21:24
2024-02-09,03:22,TTL,総合,18,時事通信,反戦候補の登録認めず　ロシア大統領選で選管,102,https://news.yahoo.co.jp/articles/b25286161e2479ac1eeeba8d2fb4b1209dea5ef1,2/8(木) 18:10
2024-02-09,03:22,TTL,総合,19,スポニチアネックス,「句読点はオバサン構文」にチクリ　俵万智さん、目から鱗の一首　「さすが」「全日本人に読んでほしい」,101,https://news.yahoo.co.jp/articles/9ec82ffd553e912852bd7544b22ab77f116f153f,2/8(木) 10:06
2024-02-09,03:22,TTL,総合,20,スポニチアネックス,パリ落選から3日…伊藤美誠、世界選手権代表の公開練習に参加、笑顔でリスタート　五輪補欠は消極姿勢,99,https://news.yahoo.co.jp/articles/b1d25b69b3d95b13e4eec02975c752a41ab2822e,2/8(木) 9:50
2024-02-09,03:22,TTL,総合,21,TBS NEWS DIG Powered by JNN,【速報】2023年の経常収支　20兆6295億円の黒字,91,https://news.yahoo.co.jp/articles/522301cdbc83ebd9a75f35cd29e619a5851b4aa3,2/8(木) 8:57
2024-02-09,03:22,TTL,総合,22,FNNプライムオンライン（フジテレビ系）,【独自】横田めぐみさん万景峰号で帰国目指していた　拉致被害者・蓮池薫さんが証言　遺骨探す“偽装工作”も,89,https://news.yahoo.co.jp/articles/4bfa965f9ca562174778264643e3e76641bf6ca2,2/8(木) 11:37
2024-02-09,03:22,TTL,総合,23,TBS NEWS DIG Powered by JNN,「セクシー田中さん」作者の訃報に、脚本家・相沢友子さんはSNS発信を「後悔、反省しています」　小学館は「痛恨の極み」,88,https://news.yahoo.co.jp/articles/4851d0388d99581cfacfa0877f51c47b96ef3518,2/8(木) 19:11
2024-02-09,03:22,TTL,総合,24,SmartFLASH,「ミス日本以前として…」再ブレイク中、山田邦子の「ミス日本不倫報道」めぐる“疑問提起”に厳しい声,85,https://news.yahoo.co.jp/articles/6e9956883113edcf46b435ffc4f4bdd576f9f792,2/8(木) 19:52
2024-02-09,03:22,TTL,総合,25,スポーツ報知,「ゴゴスマ」松本人志報道で吉本興業を取材　週刊文春第６弾「１１人目の新証言」「単なる飲み会ではない」を報じる,81,https://news.yahoo.co.jp/articles/13d7fa4a26d839cc4eeadb93a887189e0c20632c,2/8(木) 16:30
2024-02-09,03:22,TTL,総合,26,女性自身,二階元幹事長　野党議員が明かした“3年間で3500万円の書籍代”に「本屋か」「店ごと買ったんか？」とツッコミ続出,80,https://news.yahoo.co.jp/articles/7c8424d7443cc69007103e55762d642f1469000b,2/8(木) 18:25
2024-02-09,03:22,TTL,総合,27,スポーツ報知,メッシ、ゴール阻まれる…香港では欠場、返金騒動　国立では途中出場もスタンドは空席目立つ,78,https://news.yahoo.co.jp/articles/e6d8096e6db5cb43e5163717152f07c07fcfa0bb,2/8(木) 5:30
2024-02-09,03:22,TTL,総合,28,女性自身,ドラマ『セクシー田中さん』脚本家　批判浴びたSNS投稿を謝罪…芦原さんが明かした“脚本トラブル”は「初めて聞くことばかり」,77,https://news.yahoo.co.jp/articles/606199104f6c2e3ae1d9e4cad5f4f5d6e6476b17,2/8(木) 16:31
2024-02-09,03:22,TTL,総合,29,デイリースポーツ,小学館編集者の声明「最後の一文」に賛否「寂しいです。先生」Ｘでは「お涙頂戴」「泣かせようと」「全然響かない」,75,https://news.yahoo.co.jp/articles/753d5818f3e8b2e524b600e41dae53598e80e1c8,2/8(木) 23:38
2024-02-09,03:22,TTL,総合,30,スポニチアネックス,「発信予定なし」から一転…小学館　異例の「編集者一同」声明　「泣いた」「血の通ったコメント」の声,72,https://news.yahoo.co.jp/articles/f11d5bfee3741bd6c741cc73086ed4797bd5ee86,2/8(木) 18:54
2024-02-09,03:22,TTL,総合,31,毎日新聞,バイデン氏、メルケル氏とコール氏言い間違え　「高齢不安」に拍車?,71,https://news.yahoo.co.jp/articles/a1faf29b2d379a9041f99279964c20a55bbfd404,2/8(木) 15:28
2024-02-09,03:22,TTL,総合,32,産経新聞,盛山文科相、推薦書署名「記憶にない」推薦書は「破棄した」　立民「旧統一教会代弁大臣だ」,69,https://news.yahoo.co.jp/articles/e83403c1f5f2025f4e09e1c2194a1d7f75768922,2/8(木) 12:00
2024-02-09,03:22,TTL,総合,33,SmartFLASH,どうした反町隆史！ 『グレイトギフト』主人公に魅力なく、回を重ねるたびに視聴者離れする深刻事態,69,https://news.yahoo.co.jp/articles/524432625191ea2b2bf613eb92fa0250ad2a3e5e,2/8(木) 11:01
2024-02-09,03:22,TTL,総合,34,女性自身,「結婚してる奴、だいたい不倫してる」大物実業家　不倫報道で辞退したミス日本への“熱烈擁護”に「無茶苦茶だな」と視聴者困惑,68,https://news.yahoo.co.jp/articles/eb1c53ba2e3ea91edcb77010dae69d2b4248747d,2/8(木) 18:00
2024-02-09,03:22,TTL,総合,35,デイリースポーツ,「セクシー田中さん」脚本の相沢友子氏「初めて聞く事ばかり」「何を信じればいいのか」反省の弁も　ＳＮＳにコメント,67,https://news.yahoo.co.jp/articles/3119126c52826e5e0066aeb1b4d9d312fa35de1f,2/8(木) 16:12
2024-02-09,03:22,TTL,総合,36,FNNプライムオンライン（フジテレビ系）,「国民舐めとんのか」怒りのメッセージ「月500円は増税ではない」でSNS紛糾…自民党内から苦言,67,https://news.yahoo.co.jp/articles/650a60fca4f8082c76fc19dc1679ebe49fd12679,2/8(木) 15:36
2024-02-09,03:22,TTL,総合,37,日刊スポーツ,青汁王子・三崎優太氏「ガーシーさんが悪なら人をおとしめて儲けてる週刊誌も悪」に賛同相次ぐ,67,https://news.yahoo.co.jp/articles/40a676391ce09e08958cadda54db6aa5dd990bd2,2/8(木) 20:36
2024-02-09,03:22,TTL,総合,38,FNNプライムオンライン（フジテレビ系）,「初めて聞くことばかり」「言葉を失う」セクシー田中さんの脚本家がコメント　作者と日テレ側とのトラブルは初耳と主張,66,https://news.yahoo.co.jp/articles/211242c246f4222ba4b00af86e01ea4793962698,2/8(木) 17:46
2024-02-09,03:22,TTL,総合,39,SmartFLASH,「国民をバカにしている！！」自民・萩生田氏、収支報告書1952万円すべて「不明」訂正を松本総務相が認める答弁で批判殺到,66,https://news.yahoo.co.jp/articles/884c4ac5fbe7e66bea75e2a94d6c599bab1bc26f,2/8(木) 15:46
2024-02-09,03:22,TTL,総合,40,THE ANSWER,ワリエワ、禁止薬物は「祖父のイチゴのデザート」原因か　CAS発表「祖父の主張以外に証拠なし」,66,https://news.yahoo.co.jp/articles/4b2f6073ebf43b1f3425820bbac52b87c842e8f0,2/8(木) 5:48
