scrp_date,scrp_time,genre_en,genre_jp,rank,media_jp,title,comment,link,date_original
2025-10-08,09:32,life,ライフ,1,産経新聞,自民党・高市早苗総裁が22年乗った愛車スープラを展示している奈良の博物館に来場者４倍,87,https://news.yahoo.co.jp/articles/910d57f5e342346d15095d0927a6481c6f5267ce,10/7(火) 17:53
2025-10-08,09:32,life,ライフ,2,FNNプライムオンライン,「とんでもない戦力」の技能実習生　制度廃止で転職自由化へ　都市部への人材流出懸念、地域全体の受け入れ体制が問われる,49,https://news.yahoo.co.jp/articles/c8a37143881a8a8b9fdef998eb282e1b73e7056f,10/8(水) 5:01
2025-10-08,09:32,life,ライフ,3,LASISA,【こんな母親になりたくない】着飾ったママ＆クソダサ服の子ども←「今なら分かる！」子育ての“理想と現実”にSNS共感の嵐,49,https://news.yahoo.co.jp/articles/4bdbe030845b18e8ee9cf6b18283d2c2271dab44,10/8(水) 8:15
2025-10-08,09:32,life,ライフ,4,ハフポスト日本版,車で交差点を左折⇨“逆走”自転車と衝突。静岡県警が“ドラレコ”を公開、事故の一部始終とは,46,https://news.yahoo.co.jp/articles/1c6a7208e080d9d917bdf3ea7a553c9b6d447438,10/8(水) 6:20
2025-10-08,09:32,life,ライフ,5,AERA with Kids＋,運動会を「早退」して英検を受けに行く子も　保護者、教員との間で揺らぐ、令和の「運動会」事情とは,44,https://news.yahoo.co.jp/articles/f58cbb13c973c69da480d9ee53657847fbe1b1f7,10/8(水) 7:01
2025-10-08,09:32,life,ライフ,6,よろず～ニュース,琵琶湖のブラックバスの超効率的な最強駆除!! YouTuberが披露した一石二鳥の捕獲方法が話題,35,https://news.yahoo.co.jp/articles/ca83bf39ac6d5ec329bab1ec381e3d25c575cfe5,10/8(水) 7:50
2025-10-08,09:32,life,ライフ,7,ダイヤモンド教育ラボ,”すべり止め”と”本命”への「入学金の二重払い」に文部科学省が改善要請、突然どうして？,33,https://news.yahoo.co.jp/articles/916ce02a3c31db28971acbd3e38b280a96ae818b,10/8(水) 5:01
2025-10-08,09:32,life,ライフ,8,オリコン,容姿をいじられ、お笑い担当だった高校生→10年後…無整形で“K-POPアイドル”級イケメンに「母に誰かわからないと驚かれました」,33,https://news.yahoo.co.jp/articles/5234eee7c6bb7c67698239a405530712839a94c1,10/8(水) 8:00
2025-10-08,09:32,life,ライフ,9,LASISA,【片親パン 問題】に「二度とそんな名前で呼ぶな」…！　メーカーの知られざる “思い” 知ったSNS、「愛しかない」「今もう無性に食べたい」,32,https://news.yahoo.co.jp/articles/e80f54a49cdec574cae3021cc90ebfa4604985a0,10/7(火) 14:15
2025-10-08,09:32,life,ライフ,10,LASISA,「消費者をカモにしている」　金を払って要らないもの【ランダム商法】の闇…　“高額化” に強まる批判、 推し活のあり方に一石？,24,https://news.yahoo.co.jp/articles/03da3db0ba966c04f7c639abe5390b0bcb8bfbc7,10/8(水) 6:05
2025-10-08,09:32,life,ライフ,11,週刊SPA!,女性の尊厳を踏みにじる“触れない痴漢”が多発…卑劣すぎる実態と被害者の叫び。「触れていないからセーフ」では済まされない,23,https://news.yahoo.co.jp/articles/30fa1c22591492ec4691a8a2741f62e128db1f8c,10/7(火) 15:55
2025-10-08,09:32,life,ライフ,12,まいどなニュース,「このままではいけない…何かを変えたくて」と毎朝4時に起きて10km走った男性　半年でマイナス17kg　心も身体も生まれ変わった日々,20,https://news.yahoo.co.jp/articles/3a23a3ba8689f9f95ba792bfd56ae7af1558b436,10/8(水) 7:16
2025-10-08,09:32,life,ライフ,13,ダイヤモンド教育ラボ,凡才でも受かる難関大学はどこ？　難しいがチャンスのある大学9選,19,https://news.yahoo.co.jp/articles/9ca180e98eb01d422438bee42204f45558d1b096,10/8(水) 8:36
2025-10-08,09:32,life,ライフ,14,女子SPA！,朝の交差点に現れる“交通整備のおじいさん”が怖すぎる「子どもは泣きわめき、私も涙目」→でも、正しいルールは,18,https://news.yahoo.co.jp/articles/0acfb2ec0d4fc9fe8d3f27d33d5fcb4c147a224b,10/8(水) 8:45
2025-10-08,09:32,life,ライフ,15,LASISA,《レス大国》“夫婦の営み” 頻度が悲惨…「してないと犯罪みたいな風潮やめて」社会的なプレッシャーに疲弊する声も,18,https://news.yahoo.co.jp/articles/800ff2c15d8da9947d8883e58d22812d6c34ba37,10/7(火) 21:45
2025-10-08,09:32,life,ライフ,16,THE GOLD ONLINE（ゴールドオンライン）,「頑張っても給料は上がらない」手取り20万円・35歳会社員、“配達と転売”の副業生活に見出した小さな希望,18,https://news.yahoo.co.jp/articles/1adeba08d7339ff45140ce00de97576389740f14,10/7(火) 21:48
2025-10-08,09:32,life,ライフ,17,Hint-Pot,「それって本当なの？」「ロンドンやスペインだったら絶対できない」　外国人が衝撃　日本の治安の良さを感じた瞬間とは,16,https://news.yahoo.co.jp/articles/4625f85d4f5ed565298a5c16777e4ec6e007d0f7,10/8(水) 6:10
2025-10-08,09:32,life,ライフ,18,THE GOLD ONLINE（ゴールドオンライン）,娘の晴れ姿を涙で見つめる夫の隣で…子の結婚式の翌朝に起きた「まさかの大事件」。妻のいないリビングで見つけた「一通の封筒」に夫、絶句,15,https://news.yahoo.co.jp/articles/80e1e78a2ed2702f0819b2542b2bf6f6c1176895,10/8(水) 5:01
2025-10-08,09:32,life,ライフ,19,まいどなニュース,50万以上使った『愛・地球博』→物価高で、我慢していたけど……　3回目でプチッ！と覚醒「万博土産は一期一会」「買わない後悔」,14,https://news.yahoo.co.jp/articles/b215f76e36fa9cc0d55d35502472ee9aee027d59,10/8(水) 7:10
2025-10-08,09:32,life,ライフ,20,ねとらぼ,江口寿史、トークショー中止を発表　SNSで“トレパク指摘”が相次ぎ各企業が声明　「今後一切使用しない」「事実関係を精査」対応に追われる,14,https://news.yahoo.co.jp/articles/a639e38929ea0a4c56a32531df92ba3be44f71fe,10/7(火) 17:39
2025-10-08,09:32,life,ライフ,21,まいどなニュース,「包丁で鍋をかき混ぜ」「ゴミはすべて床に落とす」「レトルトは温めない」…“やらない勇気”が生んだ、主婦たちの合理的ズボラ家事術,14,https://news.yahoo.co.jp/articles/900f25fd6c5d4b872878a9b2fc488fbbb58b5393,10/8(水) 7:35
2025-10-08,09:32,life,ライフ,22,ねとらぼ,クマが生息している都道府県に色を塗ってみたら……　「意外すぎた」まさかの結果に「えっ……本当？」「不思議だ」,13,https://news.yahoo.co.jp/articles/aa85da5073951ea53efa6b2f403e8f6056595e03,10/7(火) 19:30
2025-10-08,09:32,life,ライフ,23,ハフポスト日本版,豆乳パック、古紙回収に出したらダメ⇨「これはマジで知らんかった」「間違えるかも」。ゴミ清掃芸人の投稿が話題,13,https://news.yahoo.co.jp/articles/d73b56bc53e22f9e6a9af7684805d9d5d1265791,10/8(水) 6:30
2025-10-08,09:32,life,ライフ,24,FORZA STYLE,「このあと病院に行った方がいいぞ」ワンナイトにおぼれた24歳OL。男の予言3週間後に見た地獄とは【専門家解説】,12,https://news.yahoo.co.jp/articles/aa7770ec1a38b92168e222333ead8dcf0f861679,10/7(火) 21:01
2025-10-08,09:32,life,ライフ,25,女子SPA！,リアル恋愛を諦めて“ChatGPTの彼”と結婚した40代女性「結婚式も予定しています」周囲の反応は,11,https://news.yahoo.co.jp/articles/f83d954997e34fdd910e87481c6ca8132cc4dfe3,10/8(水) 8:47
2025-10-08,09:32,life,ライフ,26,FNNプライムオンライン,ペットボトル飲料も200円台　「年金だけでは暮らせない」10月値上げラッシュ、飲料・食品3000品目超,11,https://news.yahoo.co.jp/articles/cbba67d2b49739f6ff7accf5023ded15fb14befb,10/7(火) 21:01
2025-10-08,09:32,life,ライフ,27,Hanasone,ほぼ「塾なし」中学受験で難関校へ　ギフテッドと発達障害の“明暗”,11,https://news.yahoo.co.jp/articles/b114319eca58a7af6b60874e9d2cd749a8d26c93,10/8(水) 7:00
2025-10-08,09:32,life,ライフ,28,ENGINE WEB,受注再開はいつ？ホンダ・プレリュードの受注が1か月で約2400台！それでも乗りたいときはどうしたらいいのか,11,https://news.yahoo.co.jp/articles/dc270656055d7e39a5ab44f8d5054b7992b14bd0,10/8(水) 7:10
2025-10-08,09:32,life,ライフ,29,Hint-Pot,キノコに賞味期限の記載がないのはなぜ　実は傷みは早い　やってはいけない保存方法を栄養士が解説,11,https://news.yahoo.co.jp/articles/775a808a6e38ef071fee5b0a1f42b0b9c1c591e3,10/7(火) 13:29
2025-10-08,09:32,life,ライフ,30,オトナンサー,【スキマバイト】「着替え」のため早めに出勤…集合時間から業務開始までの間、「給与なし」ってアリなの？　社労士に聞く,10,https://news.yahoo.co.jp/articles/edb46b1c302a1e7d046a66b87f216048e6db9402,10/8(水) 7:10
2025-10-08,09:32,life,ライフ,31,Pen Online,「まるでシーツ…」メーガン妃の“寝具ドレス”姿に批判殺到。張り切って参加したパリコレで炎上,10,https://news.yahoo.co.jp/articles/fc1582e869604a43234a1754b9b8d72d3910408d,10/7(火) 21:40
2025-10-08,09:32,life,ライフ,32,ENCOUNT,小泉進次郎氏、総裁選“本当の敗因” 「こんなこと言っちゃいけない」プロが呆れたステマ問題の最悪対応,10,https://news.yahoo.co.jp/articles/85a792168141373c7e03440e0248f1492194a556,10/7(火) 17:10
2025-10-08,09:32,life,ライフ,33,プレジデントオンライン,日本の親は夕食作りを頑張りすぎている…「冷凍食品ばかり」の食卓でも幸せを感じるスウェーデン人の日常,9,https://news.yahoo.co.jp/articles/474a9e37453a2b9de98edab8b75ac1d1763c146c,10/7(火) 18:16
2025-10-08,09:32,life,ライフ,34,LIMO,ゴミ箱に入り切らない時はどう捨てればいい？ホテルスタッフの回答に「今後はそうします！」の声も,9,https://news.yahoo.co.jp/articles/562b6a3c86a23fae13088324e06e8ebf4f62d2d7,10/8(水) 6:31
2025-10-08,09:32,life,ライフ,35,毎日新聞,体罰問題のバレー部監督、被害部員の保護者に謝罪　秋田・雄物川高,9,https://news.yahoo.co.jp/articles/d677be911100b1d01bb37de340cbdf8e7586beab,10/7(火) 21:26
2025-10-08,09:32,life,ライフ,36,FNNプライムオンライン,研究者の妻との出会いは名古屋…ノーベル賞決まった阪大・坂口特任教授 “太っ腹”な一面も「夜遅くまで実験していると…」,9,https://news.yahoo.co.jp/articles/3f01b1e32c65760265d06266ea66db28605e62cd,10/8(水) 5:33
2025-10-08,09:32,life,ライフ,37,ねとらぼ,「これ満タンになったら旅行！」→目からウロコの“1000円札貯金”が235万再生「めっちゃいい！」「マネさせてください」,8,https://news.yahoo.co.jp/articles/d88c991044c3f25bd7f7d4f0848968f73d1e5bb2,10/8(水) 8:15
2025-10-08,09:32,life,ライフ,38,オリコン,万博、10・13「閉会式」式次第が公開　出席者・パフォーマンスプログラムなど明らかに【一覧】,8,https://news.yahoo.co.jp/articles/88e0f77c4abc5f0c0e51de8f10b55da83fd599e4,10/7(火) 20:55
2025-10-08,09:32,life,ライフ,39,ダイヤモンド・オンライン,もう“いい人”は卒業！ 精神科医が警告する「面倒な人」に絶対してはいけない対応・ワースト1,8,https://news.yahoo.co.jp/articles/167089673bfe5d8caf98617b2a9603c74a6c1037,10/8(水) 6:55
2025-10-08,09:32,life,ライフ,40,LIMO,大阪・関西万博の大屋根リングと並ぶ「もう一つの主役」　予想外の共演に「すごすぎる！」と驚きの声,7,https://news.yahoo.co.jp/articles/de2dc46183f222476bd03a16098c64f4d707e39d,10/8(水) 5:56
