scrp_date,scrp_time,genre_en,genre_jp,rank,media_jp,title,comment,link,date_original
2025-11-21,00:08,TTL,総合,1,デイリースポーツ,【高市自民】ネット大荒れ「はあ？」「国民にケンカ売ってる」「高市推し冷めた」　国会議員月収５万円ＵＰ検討報道に騒然　反対する吉村代表に「止めてくれ！」　「国民舐めすぎ」「財源は？」「今やる事か」「こっちはお米券」「感覚ズレてる」支持・賛同見つけにくく,780,https://news.yahoo.co.jp/articles/0b8fa81318fc09bdd5e4043ae1e02b5f9d336978,11/20(木) 19:50
2025-11-21,00:08,TTL,総合,2,デイリースポーツ,【高市自民】中国怒らせた高市首相→１週間だんまり、国民に実害も説明なし　中国問題を避けてスルー　官邸ＳＮＳでは「奈良の柿」で一句　応援・賞賛コメ多数,700,https://news.yahoo.co.jp/articles/0c68673fbae498fc9936316f6e33e20495e1fdde,11/20(木) 20:55
2025-11-21,00:08,TTL,総合,3,SmartFLASH,「私は一つの中国を支持」日中で活躍するタレントが次々表明…芸能人生をかけた“踏み絵”の実態とは,515,https://news.yahoo.co.jp/articles/74ab029bdf0070ed1eff8438fa79bc56c2d03db1,11/20(木) 20:11
2025-11-21,00:08,TTL,総合,4,産経新聞,「日本はパンダがいなくなる状況に直面するだろう」　中国メディア、専門家の見方伝える,427,https://news.yahoo.co.jp/articles/b30bda62d45f4c0f760d9948bcaaf3da864a9063,11/20(木) 17:42
2025-11-21,00:08,TTL,総合,5,スポニチアネックス,草間リチャード敬太　Aぇ！group脱退「1年前から心の病」明かす　活動休止中もSTARTO退所せず,403,https://news.yahoo.co.jp/articles/7dc17e2b2e4f8968ff7e279e497e01e68addb885,11/20(木) 18:15
2025-11-21,00:08,TTL,総合,6,スポニチアネックス,小林よしのり氏「戦争前夜」高市首相の台湾有事発言に私見「徴兵制を敷いて支持者を最前線に送って…」,394,https://news.yahoo.co.jp/articles/ab2e8ccc10d41151b6b0da045db1b167864fa419,11/20(木) 16:13
2025-11-21,00:08,TTL,総合,7,読売新聞オンライン,国会議員の歳費、月５万円アップで調整…維新の「身を切る改革」配慮で次の国政選後の方針,349,https://news.yahoo.co.jp/articles/a2a3202200c4a5f8303f10759ca04fb2d824392c,11/20(木) 5:00
2025-11-21,00:08,TTL,総合,8,デイリースポーツ,【高市自民】田崎史郎氏　憤慨中国が次々圧力も→高市政権の内情「日本は切る対抗カードなく、我慢しかない状況」と取材結果　長期防戦「世論どうなるか」　中国のレアアース禁止の強力カード脅威,334,https://news.yahoo.co.jp/articles/9045a67625e8524d69c25910d991c917481a59fb,11/20(木) 18:39
2025-11-21,00:08,TTL,総合,9,デイリースポーツ,【高市自民】中国憤慨の高市発言→質問で引き出した立憲・岡田克也氏　まさか発言だった「なぜ現職総理が慎重答弁をしなかったのか」　世論調査の発言賛同４８・８％に驚く「分かって答えているのか」,331,https://news.yahoo.co.jp/articles/7eb7618edbfd39dbc0cf8c877e9d201b7ae47be2,11/20(木) 22:03
2025-11-21,00:08,TTL,総合,10,毎日新聞,生活保護費減額は一律2.49％に　厚労省、最高裁判決受け改定へ,327,https://news.yahoo.co.jp/articles/c960656af6e02aa293f56e745e8747ae58d82e7d,11/20(木) 20:02
2025-11-21,00:08,TTL,総合,11,産経新聞,ガソリン減税、高校無償化…高市政権、連立合意着々と　宿題は議員定数削減　発足1カ月,310,https://news.yahoo.co.jp/articles/eb46b5667175e979ea3735c5e8f7f1f73289f20c,11/20(木) 20:21
2025-11-21,00:08,TTL,総合,12,日刊スポーツ,鳩山由紀夫元首相、高市首相発言「国益の損失は計り知れない」「急ぎ改めることだ」,307,https://news.yahoo.co.jp/articles/7781187c956912ff193e49fd7412b67a4543ccbc,11/20(木) 12:12
2025-11-21,00:08,TTL,総合,13,日刊スポーツ,「パンダが日本に来るのも難しく」TBS北京支局長語る　日中韓首脳会談でパンダ贈呈計画あった,303,https://news.yahoo.co.jp/articles/73188ca3acc3842e915d079acc0d9a8c4eca06a2,11/20(木) 16:36
2025-11-21,00:08,TTL,総合,14,RKK熊本放送,プードルなど犬100匹が火事で死ぬ　建物から山林に燃え移り約4時間の消火活動・・・住宅1棟と犬舎2棟全焼　熊本県菊池市,291,https://news.yahoo.co.jp/articles/ccfe51a5a1513e8ea08c067eec45c719f9306401,11/20(木) 19:18
2025-11-21,00:08,TTL,総合,15,デイリースポーツ,【高市自民】「報ステ」大越健介キャスター　高市発言「パンダに影響して欲しくない！」終了間際に苦笑　中国怒り日本のパンダがゼロになる可能性と中国報道,270,https://news.yahoo.co.jp/articles/7f5d7bac08d0eaaf8cad7e83ac9324128297b762,11/20(木) 23:27
2025-11-21,00:08,TTL,総合,16,TBS NEWS DIG Powered by JNN,中国外務省「誤った発言 撤回すべき」 中国で日本関連イベント中止相次ぐ　日本料理店も「閑散としてます」 深まる日中の対立,266,https://news.yahoo.co.jp/articles/898dcdf63a70fa5fff2f5d6da03876c0b87c3137,11/20(木) 18:34
2025-11-21,00:08,TTL,総合,17,時事通信,中国、対日圧力強化か　商務省「必要な措置」警告,256,https://news.yahoo.co.jp/articles/7c67067191ff0a8b85554c641aab3d15ae48db32,11/20(木) 21:01
2025-11-21,00:08,TTL,総合,18,テレビ朝日系（ANN）,ホタテ発送も輸入拒否か　日本料理店ではキャンセルも…中国が水産物輸入を事実上停止,244,https://news.yahoo.co.jp/articles/d274914b5f05980bb9230845857b5480c051c96e,11/20(木) 2:36
2025-11-21,00:08,TTL,総合,19,NBS長野放送,中国人に人気の軽井沢で懸念の声　ホテル「2月の春節の予約がどうなるか」　長野県知事「事態の鎮静化を強く期待」　高市総理の「台湾有事」巡る発言受け、中国は国民に渡航自粛を求めるなど反発を強める,231,https://news.yahoo.co.jp/articles/9801bcf0fcc732d1856c41a8a6f4e169320c9fa4,11/20(木) 20:37
2025-11-21,00:08,TTL,総合,20,MBSニュース,「母の信仰を理由に事件を…」山上徹也被告が家族について語る「責任を母が感じるところも」　初の被告人質問で謝罪「生きているべきではなかった」【安倍元総理銃撃事件／１１月２０日の裁判】,227,https://news.yahoo.co.jp/articles/92a1f55d9cbf672a54c32e520d9f470f292a8a68,11/20(木) 18:25
2025-11-21,00:08,TTL,総合,21,デイリースポーツ,【高市自民】中国軍ＳＮＳ　高市首相に怖すぎる地獄絵で警告、火の海の靖国神社「自ら墓穴を掘り、戻れない道へ進む」と　台湾問題は絶対に越えてはならない一線　火遊びは自滅の結末迎える,223,https://news.yahoo.co.jp/articles/f155b39e23c851745a7577c8c09e9fb2d6b51dda,11/20(木) 17:07
2025-11-21,00:08,TTL,総合,22,共同通信,非核三原則見直し「強く抗議」　被団協声明、堅持し法制化要求,220,https://news.yahoo.co.jp/articles/4201b0f453efb0231cc82da2ede5eb02594acb2d,11/20(木) 11:37
2025-11-21,00:08,TTL,総合,23,FRIDAY,退職引き止めサービス『イテクレヤ』…社長が語る「経営者と社員の不満分析」深刻ミスマッチ＆トラブル,209,https://news.yahoo.co.jp/articles/e8f4147354ec7d0693dc2eda5099c6d3082b722a,11/20(木) 17:00
2025-11-21,00:08,TTL,総合,24,共同通信,中国、追加報復を警告,209,https://news.yahoo.co.jp/articles/cc9057b52a9773a3652585ff8e2c623a111a0bd3,11/20(木) 17:40
2025-11-21,00:08,TTL,総合,25,デイリー新潮,コメ最高値で「5キロ5000円」に嘆きの声も…倉庫に“大量の新米”がダブつく業者の懸念はコメ価格“大暴落のXデイ”,197,https://news.yahoo.co.jp/articles/5e78597c6f61b1cd853ec3de76140bf1ca5f0a74,11/20(木) 6:13
2025-11-21,00:08,TTL,総合,26,日刊スポーツ,高市氏に「拍手送っている人の大半は」フジ出演の早大名誉教授「戦争はバカが後押しして始まる」,196,https://news.yahoo.co.jp/articles/03e7ac0bb7509bd792aebe3bd907b7c74b36be94,11/20(木) 9:08
2025-11-21,00:08,TTL,総合,27,読売新聞オンライン,外国人の在留手続き手数料、欧米並みに値上げへ…来年度から更新で３～４万円程度を検討,195,https://news.yahoo.co.jp/articles/624aa7766ffabfe461b2c31d3db756ec809ab719,11/20(木) 15:00
2025-11-21,00:08,TTL,総合,28,RKK熊本放送,93歳男性が女子大学生の自転車にはねられ意識不明　坂を下った先のバス停付近「自転車通行可」の歩道 その通行ルールとは?,184,https://news.yahoo.co.jp/articles/010e4ae81cdf9737f8017ce45af5978c9028bf9f,11/20(木) 11:34
2025-11-21,00:08,TTL,総合,29,テレビ朝日系（ANN）,北京の日本料理店が悲鳴　 日中関係の悪化で「岐路に立たされている」,161,https://news.yahoo.co.jp/articles/1edd267aa9d87317d943d3fc9b3a824400156bd0,11/20(木) 8:05
2025-11-21,00:08,TTL,総合,30,時事通信,パンダ「ゼロ」に現実味　日本への貸与、専門家が見解　中国メディア,155,https://news.yahoo.co.jp/articles/937d655c7af712f91f040b4401db889eb58283ef,11/20(木) 20:32
2025-11-21,00:08,TTL,総合,31,スポニチアネックス,M-1また波乱！オズワルドや最終年ちょんまげラーメン敗退　EXITは7年連続で涙　準決勝30組決定,153,https://news.yahoo.co.jp/articles/f60373bdf7dd2debbbee0ed5f8f5e7eaafaddbdb,11/20(木) 20:30
2025-11-21,00:08,TTL,総合,32,テレビ朝日系（ANN）,インフルエンザにかかりやすい5つのタイプ判明　データで解析「血糖値高め」「睡眠不足」など要注意,150,https://news.yahoo.co.jp/articles/414ad552cc820aac6371be422f013bd8993caf13,11/20(木) 10:00
2025-11-21,00:08,TTL,総合,33,日刊スポーツ,30歳ミュージシャンが檄「黙るな。怒れ。抗議しろ」　高市首相発言で中国公演中止,147,https://news.yahoo.co.jp/articles/3f80ecd09094bc9cbbad0e9b11736ff15a9d981e,11/20(木) 10:12
2025-11-21,00:08,TTL,総合,34,スポニチアネックス,豊昇龍が結びで高安に強烈なダメ押し　粂川審判長が口頭注意「お客さんもケガをする」,146,https://news.yahoo.co.jp/articles/fc26d2db38f9ab97bc456f4b7d3424faa96fde35,11/20(木) 18:26
2025-11-21,00:08,TTL,総合,35,TBS NEWS DIG Powered by JNN,関東など5県でSUVなど51台盗んだか　水戸市の男女3人逮捕　計2億5800万円相当　売った金で覚醒剤購入も　茨城県警,143,https://news.yahoo.co.jp/articles/272f5802ab92e459eb6f4cb86a0135457ea28bfb,11/20(木) 16:07
2025-11-21,00:08,TTL,総合,36,読売新聞オンライン,中国「経済的威圧」強化か、日本産水産物の事実上の輸入停止…台湾有事巡る高市首相答弁の撤回迫る,142,https://news.yahoo.co.jp/articles/358a97cd1ea851e445de9a0a60135951127900d0,11/20(木) 22:21
2025-11-21,00:08,TTL,総合,37,テレビ朝日系（ANN）,中国外務省「二枚舌は許されない」,138,https://news.yahoo.co.jp/articles/99c71214e313ad7f7c283275dec0d36f38cd1016,11/20(木) 19:04
2025-11-21,00:08,TTL,総合,38,女性自身,バービー　高市首相の台湾有事発言めぐるコメントに賛否「“最低限の下調べ”くらいはして」「町の声を普通に代弁しているだけ」,137,https://news.yahoo.co.jp/articles/3781cff0ba2cdac120be1bd9d0899b667378f236,11/20(木) 11:00
2025-11-21,00:08,TTL,総合,39,時事通信,衆院定数法案「削減確実に」　自維幹部、時期・幅を調整へ,130,https://news.yahoo.co.jp/articles/3d378cfb429156fefde2e94e3d65e47b413d0808,11/20(木) 18:16
2025-11-21,00:08,TTL,総合,40,静岡朝日テレビ,高市総理肝入りの経済対策の全容が明らかに　子ども1人あたり2万円を給付する「子育て応援手当」にはおよそ4000億円を計上,127,https://news.yahoo.co.jp/articles/214b7be1b78859429b5d0fc8598c8230a32ea26f,11/20(木) 19:07
