scrp_date,scrp_time,genre_en,genre_jp,rank,media_jp,title,comment,link,date_original
2025-02-26,07:06,TTL,総合,1,FNNプライムオンライン（フジテレビ系）,【速報】自公維3党首が合意文書署名し予算案成立が確実に　教育無償化と社会保険料引き下げなど合意の全容,302,https://news.yahoo.co.jp/articles/a120cbea1ab0f99235b134c55508601245019372,2/25(火) 18:36
2025-02-26,07:06,TTL,総合,2,デイリー新潮,「竹内さんが自殺した動機は分からん」　「立花氏への文書提供」の兵庫県議が耳を疑うような発言,231,https://news.yahoo.co.jp/articles/52fc8bec2b75981167cab843c72e6a571cf60a41,2/26(水) 6:07
2025-02-26,07:06,TTL,総合,3,女性自身,「相続税増税」主張の立憲幹事長がネット討論で突然の涙も…ネットではシラケ声「泣きたいのは国民」,208,https://news.yahoo.co.jp/articles/872814506b5f1e87e3d8a9e5963a38810d43d1d5,2/25(火) 19:35
2025-02-26,07:06,TTL,総合,4,TBS NEWS DIG Powered by JNN,【速報】石破総理「合意事項の実現に向けて最大限努力を尽くす」　自公維が教育無償化などで合意,185,https://news.yahoo.co.jp/articles/7b5e51c79e3e02f7cf40755f2beeabd6889e8593,2/25(火) 19:12
2025-02-26,07:06,TTL,総合,5,日テレNEWS NNN,【速報】維新、来年度予算案に賛成する方針固める,155,https://news.yahoo.co.jp/articles/9b2875ba24f99591fd0674933c5b5d18423b2679,2/25(火) 17:08
2025-02-26,07:06,TTL,総合,6,RKB毎日放送,「過去に類をみない特異な悪質性、有期懲役の上限を下回るような量刑は相当ではない」　20～30代女性従業員らを脅迫し性交を繰り返したペットショップ経営・本多道雄被告（66）に福岡地裁が懲役30年判決,150,https://news.yahoo.co.jp/articles/4d71261ba5c7c2ce9d071ba63dc6500d70124fcf,2/25(火) 15:39
2025-02-26,07:06,TTL,総合,7,千葉日報オンライン,【速報】千葉知事選、N党立花氏「選挙運動は兵庫県で」　千葉での運動は告示日のみと表明　「兵庫の問題に言いたいこと山ほどある」,149,https://news.yahoo.co.jp/articles/e4eb4a2d139aad01c3c24d6fd12953ec769c0ef2,2/25(火) 19:01
2025-02-26,07:06,TTL,総合,8,集英社オンライン,「コメは生産者だけが儲からない」「俺の代で終わり」…会社員としての給料を赤字に補填していた兼業コメ農家の嘆き「近い将来、国産米は金持ちしか食べられなくなる」,140,https://news.yahoo.co.jp/articles/7bacfbef754cda8a8597882967bd562893af8028,2/25(火) 20:09
2025-02-26,07:06,TTL,総合,9,文春オンライン,「外国人を差別するのか」14歳のクルド人少年が煙幕花火で業務妨害…埼玉県民の「クルド人へのイメージ」を低下させた“ある事件”,138,https://news.yahoo.co.jp/articles/a0a6442b1827910a524165447199c22dde4320a6,2/25(火) 11:22
2025-02-26,07:06,TTL,総合,10,スポニチアネックス,「水ダウ」19日放送内容巡り謝罪「深くお詫び」実在する学校名でいじめ題材「架空設定」も学校の抗議受け,134,https://news.yahoo.co.jp/articles/d2b09cb06a5e0af8bfd9251909052b8094ce78c5,2/25(火) 18:10
2025-02-26,07:06,TTL,総合,11,共同通信,原因不明の病気で53人死亡　コンゴ北西部、WHO調査,132,https://news.yahoo.co.jp/articles/ee4a56781950e994f4219de5db9f14569c1e964e,2/25(火) 22:14
2025-02-26,07:06,TTL,総合,12,ITmedia ビジネスオンライン,約170店の大量閉店！　ドミノ・ピザは2位に転落するか？　1位を狙うピザハットとの違い,105,https://news.yahoo.co.jp/articles/fc4fbda643ed538dc030a4fe8291d33266a73422,2/25(火) 12:43
2025-02-26,07:06,TTL,総合,13,SmartFLASH,志村けんベストコント「過激すぎる」内容そのまま再放送に賛否両論…スポンサーなしを逆手に取った説も流布,103,https://news.yahoo.co.jp/articles/a28396dcee57ef83882e4df9328a701219df4038,2/25(火) 15:20
2025-02-26,07:06,TTL,総合,14,読売新聞オンライン,明治の瓶入りコーヒー飲料、３月末で終了…需要低迷で瓶の調達難しく,93,https://news.yahoo.co.jp/articles/be6093c61199844554e81f50503a2b3f8cd3a8a0,2/26(水) 5:00
2025-02-26,07:06,TTL,総合,15,スポニチアネックス,違法じゃないけど…立花孝志氏　千葉県知事選なのに兵庫で選挙活動　情報漏えい問題で持論展開目的か,91,https://news.yahoo.co.jp/articles/86f5365200b3979443adcbde1919decefcbd631f,2/26(水) 5:30
2025-02-26,07:06,TTL,総合,16,AERA dot.,「つば九郎」が特別すぎたからこそ難しい“今後の判断”　稀代のマスコットが残した功績,91,https://news.yahoo.co.jp/articles/4b1c6d26d9600d5980c17795ba87f5990a4fae68,2/25(火) 18:02
2025-02-26,07:06,TTL,総合,17,弁護士ドットコムニュース,AEDめぐる報道「女性助けたら被害届出された」　ABEMAが釈明「10年前の事案」「十分な確認せず放送」,89,https://news.yahoo.co.jp/articles/57a4aa87a086fa9b522cb16e5dff24fbddfdcc74,2/25(火) 15:18
2025-02-26,07:06,TTL,総合,18,産経新聞,マクロン氏がトランプ氏面前で異例の「ファクトチェック」　欧州支援への不満にチクリ,83,https://news.yahoo.co.jp/articles/c850c9ba86c992e48a0b956ea9141a0af5730cee,2/25(火) 11:35
2025-02-26,07:06,TTL,総合,19,集英社オンライン,「文書の内容は事実かわからない」「噂レベルでも知られるべき」斎藤知事応援の“ルール無視”漏洩トリオの仰天主張…隠し録音県議を維新が除名へ〈兵庫県政大混乱は維新に飛び火〉,80,https://news.yahoo.co.jp/articles/e341b671c4b4f0abe6914911be6dbb186d77d0ab,2/25(火) 11:51
2025-02-26,07:06,TTL,総合,20,Yahoo!ニュース オリジナル 特集,代金払えないと性風俗へ──悪質ホストクラブに法規制。それでも効果に疑問の声 #令和の人権,76,https://news.yahoo.co.jp/articles/96cc35f3fa822db47f11ca66c90a1f64849685d8,2/25(火) 18:00
2025-02-26,07:06,TTL,総合,21,共同通信,詐欺拠点で邦人10人逃走か　ミャンマー武装勢力捜索中,75,https://news.yahoo.co.jp/articles/f4db147622aab07fd6a18ff06b5aaa701b0f8891,2/25(火) 22:31
2025-02-26,07:06,TTL,総合,22,THE GOLD ONLINE（ゴールドオンライン）,"悔やんでます…「退職金2,000万円」「年金想定月18万円」の60歳定年サラリーマン、初孫誕生からわずか1年で「バカなじぃじでごめん」と懺悔のワケ",75,https://news.yahoo.co.jp/articles/64f27851e5f78891b7d62bb7bab9c7a7550a1e40,2/26(水) 5:02
2025-02-26,07:06,TTL,総合,23,TBS NEWS DIG Powered by JNN,"Z世代の「飲食店の探し方」で店側に“思わぬメリット”も?「予約が13倍になった」動画とは【THE TIME,】",74,https://news.yahoo.co.jp/articles/329716cab3611c4e637b6672f91330f8ab58737e,2/25(火) 7:02
2025-02-26,07:06,TTL,総合,24,毎日新聞,「侵略」ではなく「紛争」?　ウクライナ巡り米国と欧州の亀裂、深刻に,71,https://news.yahoo.co.jp/articles/7801158d580606599c73fb916423b29bcc5e7966,2/25(火) 21:00
2025-02-26,07:06,TTL,総合,25,読売新聞オンライン,車内に２００リットル近いガソリン…首相官邸前で車に火炎瓶を投げつけた疑いで５０歳男を追送検,62,https://news.yahoo.co.jp/articles/bfe17d8639a230f423d12480fe3bdd106ba5e94f,2/25(火) 11:03
2025-02-26,07:06,TTL,総合,26,時事通信,トランプ氏は国際規範軽視　自民総務会長が批判,60,https://news.yahoo.co.jp/articles/f67d88d4966d68bfc6625c18221814d0c9ea80d5,2/25(火) 22:31
2025-02-26,07:06,TTL,総合,27,スポーツ報知,奥田民生＆吉川晃司、奇跡の新ユニット結成、今年還暦同士が故郷広島に恩返し！第１弾楽曲「ＧＯＬＤ」,59,https://news.yahoo.co.jp/articles/763126b3208515d65ae51ea8df1c9f730fc4cbb3,2/26(水) 0:00
2025-02-26,07:06,TTL,総合,28,Wedge（ウェッジ）,なぜトランプは米国際開発庁（USAID）を目の敵にするのか？援助縮小で世界で起こり得る影響,59,https://news.yahoo.co.jp/articles/1a7d299a49747f2952a0c3cb4cd4e94a1c549c99,2/25(火) 16:03
2025-02-26,07:06,TTL,総合,29,東スポWEB,亀田京之介が涙を浮かべてネリ戦を総括　井上尚弥には脱帽「アイツ、ほんまに強いと思うわ」,58,https://news.yahoo.co.jp/articles/77d1c3167ff94346205f7a8b327fb449358018c1,2/25(火) 21:06
2025-02-26,07:06,TTL,総合,30,Forbes JAPAN,環境団体「グリンピース」が破産の危機、石油大手が450億円求める裁判で,57,https://news.yahoo.co.jp/articles/fbc1a1f33f61e11c6bdb634dc8a661c068e875f2,2/25(火) 15:00
2025-02-26,07:06,TTL,総合,31,TBS NEWS DIG Powered by JNN,滝沢カレンさん　妊娠を発表　「今後の活動につきましては、本人の心身の健康を最優先に、可能な範囲で慎重に続けてまいります。」,55,https://news.yahoo.co.jp/articles/6f9e488810ea62a73b07bb2794cda512aa9dcedb,2/25(火) 17:02
2025-02-26,07:06,TTL,総合,32,読売新聞オンライン,立花孝志氏にデータ提供の県議、最も重い処分を兵庫維新の会が検討…吉村洋文氏「議員辞職するべきだ」,54,https://news.yahoo.co.jp/articles/d1f1841927c80613d6ac3b1c7dff899b92d58008,2/25(火) 21:29
2025-02-26,07:06,TTL,総合,33,日刊スポーツ,N党立花孝志氏が新たに宣言　千葉知事選の選挙運動「全て兵庫県で行います！」２馬力は撤回も,54,https://news.yahoo.co.jp/articles/8b2cf94251cb88d2c6e06ee581800a4323b8b31e,2/25(火) 17:10
2025-02-26,07:06,TTL,総合,34,時事通信,オリエンタルランド、6％賃上げ,53,https://news.yahoo.co.jp/articles/5d9887a658a73382baa579569323006dd56a556d,2/25(火) 16:03
2025-02-26,07:06,TTL,総合,35,FNNプライムオンライン,維新「教育無償化」・「社会保険料引き下げを目標に明記」で「予算案賛成」を了承　党内調整が難航も　国民民主は「103万円の壁」撤廃実現へ「所得制限設けるべきでない」強硬姿勢続ける,53,https://news.yahoo.co.jp/articles/ab746af6dcdf277f9a0e76d99109f762ce5c754b,2/25(火) 20:22
2025-02-26,07:06,TTL,総合,36,東海テレビ,中国人旅行客に転売か…新幹線の乗車券を不正に発券した疑い 中国籍の男2人を再逮捕 組織的に繰り返していたか,52,https://news.yahoo.co.jp/articles/5254656e780a1b270db99deac7cf97ecaa7c14de,2/26(水) 6:06
2025-02-26,07:06,TTL,総合,37,産経新聞,携帯大手、値上げへ虎視眈々　業績好調で批判は必至「火中の栗拾う」　政府の介入に警戒も,51,https://news.yahoo.co.jp/articles/189030ca55fbb447da0e96fb03c96ea15426c911,2/25(火) 19:38
2025-02-26,07:06,TTL,総合,38,MBSニュース,【速報】14年で4万台の放置自転車を不適切撤去　大阪市が調査結果公表し謝罪　規則の7日経ず『故意に撤去の可能性』『防犯登録シール勝手にはがす』「早く撤去してという市民の要望叶えるためだった」,49,https://news.yahoo.co.jp/articles/e7bbacd1ffea1a57390d17cf753064467c6d002c,2/25(火) 14:00
2025-02-26,07:06,TTL,総合,39,神戸新聞NEXT,兵庫県、2人目の副知事人事が難航　文書問題で片山氏辞職、1人体制はや7カ月「火中の栗拾う人いない」,49,https://news.yahoo.co.jp/articles/43ad86d07cccc674ae3f0abbc851200a594e1a85,2/25(火) 20:09
2025-02-26,07:06,TTL,総合,40,中央社フォーカス台湾,台湾、宝くじで約92億円大当たり  史上6番目の高額当選,49,https://news.yahoo.co.jp/articles/8226d33a837109164c82d3d7d0c81c01d2e69902,2/25(火) 16:26
