scrp_date,scrp_time,genre_en,genre_jp,rank,media_jp,title,comment,link,date_original
2024-05-30,15:26,sports,スポーツ,1,デイリースポーツ,今永昇太がまさか大炎上…メジャーワーストの７失点で五回途中ＫＯ　防御率トップからも陥落　中１０日の先発が影響か　初黒星でデビューからの連勝止まる,167,https://news.yahoo.co.jp/articles/c7ca26e9f95227b655f7a8531b8e990f90ab041d,5/30(木) 9:37
2024-05-30,15:26,sports,スポーツ,2,デイリースポーツ,日本ハム・新庄監督　阪神ユニ登場は罰金覚悟、球団幹部にも言わず実行「明日怒られます」ＮＰＢからも“警告”「退場は嫌（笑）」,122,https://news.yahoo.co.jp/articles/b3ad7daf0108dfd389b998d36f4dbeb1961f22c7,5/29(水) 21:45
2024-05-30,15:26,sports,スポーツ,3,FRIDAY,工藤か秋山か、伊東か…？西武・松井稼頭央監督”事実上の解任”で始まる「次期監督探し」意外な期待感,101,https://news.yahoo.co.jp/articles/850ec3fe380a060382bf02953f4567ffd58beabb,5/30(木) 9:00
2024-05-30,15:26,sports,スポーツ,4,東スポWEB,久保建英の凱旋試合　空席目立つ状況にファンタメ息「国立ガラガラじゃねーか」,88,https://news.yahoo.co.jp/articles/bf8e28ee54b759268196c2d6f3eb709a5a091394,5/29(水) 20:06
2024-05-30,15:26,sports,スポーツ,5,デイリースポーツ,衝撃！日本ハム新庄監督が阪神ユニホームで登場！「背番号６３　新庄監督」岡田監督と握手　サプライズにどよめく甲子園　感謝の思い示す,86,https://news.yahoo.co.jp/articles/6b5baa512b37619bbf1f4592d0733e7ae27210fd,5/29(水) 17:59
2024-05-30,15:26,sports,スポーツ,6,ABEMA TIMES,大谷翔平、10戦46打席ぶり14号2ラン　今季自己最長ノーアーチの沈黙破る一発に敵地騒然,86,https://news.yahoo.co.jp/articles/7677cde2b6259cb537fca66f51d53f975e4df35e,5/30(木) 7:58
2024-05-30,15:26,sports,スポーツ,7,TBS NEWS DIG Powered by JNN,サッカーU-23日本代表25人発表　松木玖生、細谷真大ら選出、久保建英は外れる　パリ五輪へ対米戦の国際親善試合に臨む【一覧】,72,https://news.yahoo.co.jp/articles/bcfaab37966293a6deb1115bb3cd524b770df7a1,5/30(木) 14:00
2024-05-30,15:26,sports,スポーツ,8,デイリースポーツ,阪神２軍　井上が降格後初ホームラン　５号３ランで貴重な追加点に　前日も２安打３打点,66,https://news.yahoo.co.jp/articles/fb78ecbe04669c9e68129a62df7d0ceeb09b19fb,5/30(木) 13:59
2024-05-30,15:26,sports,スポーツ,9,Full-Count,巨人・阿部監督「だからセーフティスクイズもやるんだよ」　“投高打低”に漏れた本音,63,https://news.yahoo.co.jp/articles/65716db91644643f6e317f0a4770ff273649c779,5/30(木) 13:34
2024-05-30,15:26,sports,スポーツ,10,DAZN News,マルコ博士、レッドブルの来季シートは「ペレスが第一候補」…角田裕毅については「彼も交渉に参加」契約延長OPがあると明かす｜F1,54,https://news.yahoo.co.jp/articles/3de49875227a11b1abbc944b825a973586efa899,5/30(木) 12:19
2024-05-30,15:26,sports,スポーツ,11,サンケイスポーツ,阪神２軍、井上広大が降格後初の本塁打　左翼スタンドにたたき込む２３日ぶりの一発,49,https://news.yahoo.co.jp/articles/24cf5e0463ffe1883689de33b997176e5d045775,5/30(木) 14:02
2024-05-30,15:26,sports,スポーツ,12,日刊ゲンダイDIGITAL,貧打に喘ぐ阿部巨人…評論家・秦真司氏が危惧する「坂本勇人の衰えと過度な主力依存」,45,https://news.yahoo.co.jp/articles/ee535ee4cf98772dc4ce9dce56ce109f4efec294,5/30(木) 11:20
2024-05-30,15:26,sports,スポーツ,13,東スポWEB,井上尚弥が１２月にサウジでグッドマン戦へ　豪州メディアは億超え〝最低報酬〟伝える,43,https://news.yahoo.co.jp/articles/f0270cb3d703bf3eda71d7e6bab3536ab1936a44,5/30(木) 9:36
2024-05-30,15:26,sports,スポーツ,14,スポーツ報知,【巨人】大城卓三が今季初アーチ「打つことができて素直にうれしい」変化球を右翼席へ…イースタン・ヤクルト戦,40,https://news.yahoo.co.jp/articles/7d73d5369e403b638a1247cf1e88fdd0aa606102,5/30(木) 14:23
2024-05-30,15:26,sports,スポーツ,15,スポニチアネックス,DeNA・牧　電撃復帰！あす31日から1軍合流へ　番長が明言　右太腿裏の軽い肉離れで登録抹消,40,https://news.yahoo.co.jp/articles/14e84a9519b8e5c7054f10facab0885accf36e56,5/30(木) 14:21
2024-05-30,15:26,sports,スポーツ,16,CoCoKARAnext,【阪神】首位広島と1差　「新庄劇場」に大敗を招いた”ミスの連鎖”とは,39,https://news.yahoo.co.jp/articles/7f80f514f14051a2e243e2bc3932c7e9286744d4,5/30(木) 11:31
2024-05-30,15:26,sports,スポーツ,17,THE ANSWER,「時が止まった美女」　48歳女優・内田有紀の始球式にX仰天「これは反則だろ」「48に見えない」,38,https://news.yahoo.co.jp/articles/93c541317be0976bf85a3d15cf70212409794187,5/30(木) 5:49
2024-05-30,15:26,sports,スポーツ,18,スポニチアネックス,巨人が劇的サヨナラ！8投手魂の無失点リレーに応えた　延長12回吉川V打　球団今季最長4時間29分死闘,37,https://news.yahoo.co.jp/articles/cbaca9d4559bccd8bf17263ba9290e24411e0aae,5/29(水) 22:30
2024-05-30,15:26,sports,スポーツ,19,中日スポーツ,『時空が歪んでる』内田有紀48歳の始球式が話題に 「バグってる」「どうしたら、その美貌を保てるの」,36,https://news.yahoo.co.jp/articles/4551da9cac9a9cb24927b0b714e3a56acd3cdb38,5/30(木) 12:30
2024-05-30,15:26,sports,スポーツ,20,日刊ゲンダイDIGITAL,阪神岡田監督が赤っ恥…今季2番目の大観衆前で新庄監督の引き立て役に、試合でもフルボッコ,35,https://news.yahoo.co.jp/articles/702e11ac8880fa34744f0068e968a911f6372ede,5/30(木) 9:06
2024-05-30,15:26,sports,スポーツ,21,TBS NEWS DIG Powered by JNN,【中日】今季7度目の完封負けで連勝ストップ 5割復帰ならず 小笠原が8回117球1失点の力投も援護なく4敗目 打線がわずか4安打,34,https://news.yahoo.co.jp/articles/2bf1d4dc26adda913e82e49d9b6addbd51a1c2ae,5/29(水) 20:38
2024-05-30,15:26,sports,スポーツ,22,日刊ゲンダイDIGITAL,巨人阿部監督を悩ます原前監督の尻拭い…FA組と主力の過渡期でよぎる高橋由伸政権時の再来,32,https://news.yahoo.co.jp/articles/07b72b5fd991a596caf940b0a07cb5523faaa0da,5/30(木) 15:00
2024-05-30,15:26,sports,スポーツ,23,Full-Count,48歳女優の美貌に「時が止まっている」　青ショーパンに神宮大反響「笑顔がたまらん」,31,https://news.yahoo.co.jp/articles/ccd3f71b143d7dc7eda5f0bb392a1eb99db8be45,5/30(木) 7:55
2024-05-30,15:26,sports,スポーツ,24,デイリースポーツ,阪神・岡田監督　拙攻連発の攻撃陣に怒「タッチアップもせーへんしのう」「五回までに追い越せとるやろ」一問一答,30,https://news.yahoo.co.jp/articles/8adbe90aba80f008e83f12ccdd46380aff577a39,5/29(水) 21:40
2024-05-30,15:26,sports,スポーツ,25,THE ANSWER,角田裕毅の“低評価”に「これはジョークか」　不振の同僚より下、海外憤慨「リカルドが何かしたか？」,30,https://news.yahoo.co.jp/articles/e790054d0fbeba0cfe6a2e32ebc8a13ddfb0811e,5/30(木) 9:13
2024-05-30,15:26,sports,スポーツ,26,日刊スポーツ,【日本ハム】新庄監督が阪神ユニ姿！甲子園騒然　岡田監督とメンバー表交換　入団当時の背番号63,30,https://news.yahoo.co.jp/articles/2f4dc787bceda2e9f2f8a2283e9beac8b85a7788,5/29(水) 18:04
2024-05-30,15:26,sports,スポーツ,27,デイリースポーツ,日本ハム　新庄監督「岡田監督、審判のみなさん」へ感謝の思い綴る　記念撮影拒否でもおかしくない中「最高の心のアルバムに」,30,https://news.yahoo.co.jp/articles/5e1ec622a95c0e5c687e5cefb876069b9bb80f85,5/30(木) 7:40
2024-05-30,15:26,sports,スポーツ,28,スポーツ報知,【阪神】大竹耕太郎が６回４失点で降板　日本ハム・万波に６号２ラン被弾,29,https://news.yahoo.co.jp/articles/6786f163833bcf0ff2b2e5579d452fea79f9071f,5/29(水) 20:31
2024-05-30,15:26,sports,スポーツ,29,Full-Count,今永昇太、5回途中7失点でメジャー初黒星　5連勝でストップ…防御率0.84→1.86でトップ陥落,28,https://news.yahoo.co.jp/articles/5e5a3af6a295dc04a88714aeab1651e825793a63,5/30(木) 11:12
2024-05-30,15:26,sports,スポーツ,30,東スポWEB,古橋亨梧　今夏にJリーグ復帰報道「浦和のターゲットになっている」 移籍金20億円超か,28,https://news.yahoo.co.jp/articles/a5b1ea871ef6929e6fce67988b64b18e8ce24280,5/30(木) 9:51
2024-05-30,15:26,sports,スポーツ,31,中日スポーツ,48才・内田有紀、「背番号1000」のユニホームで始球式　約30年ぶりの大役にキュートな笑顔、自己採点は「1000点です！」【ヤクルト】,28,https://news.yahoo.co.jp/articles/2a29c6c9d9e8243c2a32c74e5f46d1cbd9b6a4ab,5/29(水) 20:23
2024-05-30,15:26,sports,スポーツ,32,tennis365.net,大坂なおみ 世界1位に惜敗し涙も「最悪ではない」 女王シフィオンテクに勝利目前から屈し2回戦敗退＜全仏オープン＞,27,https://news.yahoo.co.jp/articles/35912675a91d658aa7422e47b984c49a52c57f06,5/30(木) 5:11
2024-05-30,15:26,sports,スポーツ,33,デイリースポーツ,ＤｅＮＡが今季５度目の完封負け　３併殺打の拙攻、先発ジャクソンは六回途中３失点,27,https://news.yahoo.co.jp/articles/263047d7470b9ae549d06ec49a1d90c59f850ae1,5/29(水) 21:01
2024-05-30,15:26,sports,スポーツ,34,日刊スポーツ,【阪神】29日の日本ハム戦で今季来場者100万人突破　４万2608人が来場24試合目で到達,26,https://news.yahoo.co.jp/articles/69e1572b51e3a6db49f05bf0afaedd5c97149920,5/29(水) 21:06
2024-05-30,15:26,sports,スポーツ,35,東スポWEB,【ＭＬＢ】今永昇太がメジャー初の大炎上　３回までに２被弾＆ワースト７失点,26,https://news.yahoo.co.jp/articles/9caea7db1ace8a5e12dced0737be3a2727593c75,5/30(木) 10:01
2024-05-30,15:26,sports,スポーツ,36,スポーツ報知,今永昇太が米最多の７失点で初黒星「悔しい」「しっかり反省して」　防御率はリーグ２位の１・８６,26,https://news.yahoo.co.jp/articles/196d95a565514c94a6ffb419a0165b155543fa9e,5/30(木) 12:02
2024-05-30,15:26,sports,スポーツ,37,東スポWEB,大谷翔平14号2ランの裏でロバーツ監督ブチギレ「Ｎｏ！」“誤審”にファンも「これは酷い」,26,https://news.yahoo.co.jp/articles/737b1a478685fc507f8377d45877b03ae6cabe11,5/30(木) 10:16
2024-05-30,15:26,sports,スポーツ,38,Full-Count,大谷翔平に被弾した右腕、2時間後にDFA報道　激高し退場→球団に対し問題発言,26,https://news.yahoo.co.jp/articles/406e44d00226589e224241c148623fc12a6b91e4,5/30(木) 10:20
2024-05-30,15:26,sports,スポーツ,39,スポーツ報知,大谷翔平が４５打席連続本塁打なし　３打席目適時打も４打席目まで１安打のみ,25,https://news.yahoo.co.jp/articles/691871cc9089d305c6ea3ea168386e38a3cbc15d,5/30(木) 7:29
2024-05-30,15:26,sports,スポーツ,40,スポーツ報知,【巨人】吉川尚輝が決めた！２１イニングぶり得点で延長１２回サヨナラ勝ち、接戦制し交流戦今季初勝利,25,https://news.yahoo.co.jp/articles/3d18dd4d30dd15897785bbfc51ad3cf06cf1ac35,5/29(水) 22:30
