scrp_date,scrp_time,genre_en,genre_jp,rank,media_jp,title,comment,link,date_original
2024-03-25,11:26,domestic,国内,1,テレ東BIZ,【独自】二階氏　次期総選挙には不出馬の意向,1361,https://news.yahoo.co.jp/articles/cf0bb9065906704fed0a311e46cc9809e82c38e4,3/25(月) 8:31
2024-03-25,11:26,domestic,国内,2,FNNプライムオンライン（フジテレビ系）,【速報】自民・二階氏が次期衆院選の不出馬を表明「政治責任明らかにする」　85歳…歴代最長の幹事長,949,https://news.yahoo.co.jp/articles/1526b894c4a5db5b62a542a7d71b6ed7f933a50d,3/25(月) 10:32
2024-03-25,11:26,domestic,国内,3,日テレNEWS NNN,内閣支持 5か月連続20％台　低迷“泥沼化”【NNN・読売新聞　世論調査】,202,https://news.yahoo.co.jp/articles/1bdd661544758756b87ca8fd27bab99885a68598,3/24(日) 22:00
2024-03-25,11:26,domestic,国内,4,毎日新聞,日立造船社員が過労自殺　初の海外赴任で未経験業務、ミス叱責も,151,https://news.yahoo.co.jp/articles/025a2bffabc2770646ab9a553efb29dfec432e7e,3/25(月) 5:00
2024-03-25,11:26,domestic,国内,5,共同通信,熊本知事に自公推薦木村氏　野党支援新人破り初当選,140,https://news.yahoo.co.jp/articles/32c1c9f2cf28cc939f90bf50b8a278172f55d3a1,3/24(日) 20:01
2024-03-25,11:26,domestic,国内,6,テレビ朝日系（ANN）,下水道にマスクを捨てる人へ　長野・飯山市長が「人間が腐ってきてる」と投稿…賛否,113,https://news.yahoo.co.jp/articles/8a7511add0e8523bbe9aed5e331ff9ea3b728d8b,3/25(月) 10:46
2024-03-25,11:26,domestic,国内,7,SmartFLASH,大谷妻・真美子さんの祖父、本誌に「ニュースで解雇のことやってるでしょ」“新妻旋風”に水を差した男へ言及,111,https://news.yahoo.co.jp/articles/6b6d625eb0927924167a77f8816cdb22672ef721,3/25(月) 6:03
2024-03-25,11:26,domestic,国内,8,日刊スポーツ,元通産大臣の深谷隆司氏、セクシー懇親会に激高「このいなかもの！」「断じて許せない」,99,https://news.yahoo.co.jp/articles/26590e3e471efff37fb76e018731899d46cbacb8,3/25(月) 9:28
2024-03-25,11:26,domestic,国内,9,TBS NEWS DIG Powered by JNN,東京・池袋で路上に倒れていた高齢女性が死亡　ひき逃げ事件として捜査　警視庁,97,https://news.yahoo.co.jp/articles/82ed1d173985ccbb819e46ffdcee0287ac8748c2,3/25(月) 5:14
2024-03-25,11:26,domestic,国内,10,弁護士JPニュース,なぜ災害のたびに「迷惑ボランティア」が“批判”されるのか　日本にはびこる「冷笑主義」の正体,95,https://news.yahoo.co.jp/articles/ba6419dbb16bd01b03de4ae3926f26430c7b0e2b,3/25(月) 10:00
2024-03-25,11:26,domestic,国内,11,デイリー新潮,眞子さんと「2人の時間」を最優先で進める小室圭さんの仕事スタイル,94,https://news.yahoo.co.jp/articles/1e2eff00ab9e06d818261a284308044b5e0122fa,3/25(月) 6:00
2024-03-25,11:26,domestic,国内,12,日刊スポーツ,橋下徹氏、明日会見予定の大谷に「正直に話してほしい」「隠すとか不誠実な対応はぜひやめて」,93,https://news.yahoo.co.jp/articles/3a09f6bed355159b5f30702377174bdd8a4016b2,3/25(月) 10:05
2024-03-25,11:26,domestic,国内,13,SmartFLASH,大谷翔平、“7億円盗人”水原一平氏にベンチ裏で浴びせた罵声…ひた隠しにされてきた「カードゲーム」依存,89,https://news.yahoo.co.jp/articles/38a6653a6de15ff20ab187cf6e2531fddaccbc3e,3/25(月) 6:00
2024-03-25,11:26,domestic,国内,14,TBS NEWS DIG Powered by JNN,「岸田事務所の秘書がとりまとめは間違いない」岸田総理の“パーティー”疑惑　後援会長が新証言【報道特集】,88,https://news.yahoo.co.jp/articles/179d24341112e84a309cf05f1dc9bc8159f0dc6f,3/24(日) 13:02
2024-03-25,11:26,domestic,国内,15,デイリースポーツ,橋下徹氏「法律の世界で隠すのは、違法賭博以上に非難」大谷会見へ「正直に」と呼びかけ,83,https://news.yahoo.co.jp/articles/a71446e8399d105c709b526f195036a34be3342c,3/25(月) 10:30
2024-03-25,11:26,domestic,国内,16,読売新聞オンライン,能登半島地震、途上国からＳＮＳに大量偽情報…Ｘ利用が１日４０００万人の日本向け「インプ狙い」,71,https://news.yahoo.co.jp/articles/ffbaf9d20a183908eae65c861a5c1a60e7c2305e,3/25(月) 5:02
2024-03-25,11:26,domestic,国内,17,週プレNEWS,モーリーの指摘。美しいモデルやタレントが「ルッキズム反対」と主張することには大きな意味がある,61,https://news.yahoo.co.jp/articles/7c7c2bfd5c4d367903e8c1a10d429801dc613dfb,3/25(月) 6:00
2024-03-25,11:26,domestic,国内,18,プレジデントオンライン,川勝知事の「反リニア」を妄信するイエスマン布陣に…全面開通がますます遠のく静岡県の「リニア妨害人事」,59,https://news.yahoo.co.jp/articles/5653e5dba4365ffc35cea0bca80ee039e63b5423,3/25(月) 8:17
2024-03-25,11:26,domestic,国内,19,読売新聞オンライン,てんかんで運転禁止と診断、免許更新で「意識失ったことない」と虚偽申告…高校生ら９人はねる,56,https://news.yahoo.co.jp/articles/b3d33a67e54035dc287e876a186af7fbcbcd76a9,3/25(月) 9:43
2024-03-25,11:26,domestic,国内,20,デイリースポーツ,【サンモニ】関口宏「いっときアベノミクスと騒いでましたが机上の空論だった」安倍政権を厳しく総括「長期政権安定化が狙い」,55,https://news.yahoo.co.jp/articles/909e45a4745bded77bb8c4068ff908debb3d83d2,3/24(日) 18:44
2024-03-25,11:26,domestic,国内,21,現代ビジネス,マイナス金利解除は「完全にタイミングを間違えた」…！政府がこの体たらくで、日銀はやりたい放題になっている,55,https://news.yahoo.co.jp/articles/d64dd8c999e0bfac858f777ff7d8ef5f694b07f8,3/25(月) 6:48
2024-03-25,11:26,domestic,国内,22,女性自身,紀子さま　“胃腸の機能的な不調”はご回復傾向に？消えた秋篠宮さまの“お気遣い”,49,https://news.yahoo.co.jp/articles/a780bf0a0865dfaf1832435fa70bb63a096cc4b1,3/25(月) 6:04
2024-03-25,11:26,domestic,国内,23,デイリースポーツ,大谷翔平は会見で「経緯の詳細は話さないのでは」国際弁護士・清原博氏が私見,45,https://news.yahoo.co.jp/articles/49456e34efd9f196d6da90a29b9ea416384bb743,3/25(月) 9:59
2024-03-25,11:26,domestic,国内,24,読売テレビ,【速報】自民・二階元幹事長が会見 次期衆院選に不出馬表明「国民に深くお詫び」裏金問題で責任とり 「監督責任者である私の責任」後任は「地元の人に任せる」,44,https://news.yahoo.co.jp/articles/906139ae1963eb3eb4690bdc8ae21170429bce0d,3/25(月) 10:28
2024-03-25,11:26,domestic,国内,25,集英社オンライン,＜神戸大サークル乱痴気騒動＞「このクソったれが！」宴会場で小便、廊下には大便、体にトイレットペーパー巻いてゾンビごっこ…それでも大学生サークルを受け入れざるを得ない老舗旅館のせつなすぎる事情,44,https://news.yahoo.co.jp/articles/3481e49ab9bbb09ef4c03718e97b67998328143e,3/24(日) 12:04
2024-03-25,11:26,domestic,国内,26,文春オンライン,「お恥ずかしいことに、指の先はありません」初めてのシノギは「知り合いの女の子を“沈めた”」こと…日本初の女ヤクザ・西村まこ（57）の壮絶人生,38,https://news.yahoo.co.jp/articles/62466ff4af8cd8c02597ce05320bc14a6c328712,3/24(日) 17:27
2024-03-25,11:26,domestic,国内,27,弁護士ドットコムニュース,"職員同士が結婚したら「退職勧奨」、福井県・池田町の""謎ルール""が物議…さすがに違法じゃないの？",38,https://news.yahoo.co.jp/articles/da1ce8247c75d0908c611ccc49cd2f04a3945a58,3/25(月) 10:15
2024-03-25,11:26,domestic,国内,28,毎日新聞,診療看護師、養成を　医師の働き方改革で注目も、認知度低く,34,https://news.yahoo.co.jp/articles/ca67cc239f75dd294859ebfe57da438e6e90280b,3/24(日) 13:15
2024-03-25,11:26,domestic,国内,29,SmartFLASH,「ひっきりなしに携帯に着信が」水原一平氏、周囲が感じていた“異変”と「大谷以上」徹底した秘密主義,34,https://news.yahoo.co.jp/articles/63314538b9ee1f6053c83e8d08d1e58b0cd547a6,3/24(日) 14:33
2024-03-25,11:26,domestic,国内,30,ニュースイッチ,京大が理学・工学部入試に「女性枠」新設、総長が語った狙い,33,https://news.yahoo.co.jp/articles/391e4a729ea883533085cdb420c20dccceee3e95,3/25(月) 10:10
2024-03-25,11:26,domestic,国内,31,共同通信,自民二階氏、次の衆院選不出馬へ　安倍派処分にも影響,33,https://news.yahoo.co.jp/articles/eb92e7bade3e8a28616bc80019227630f2a758c7,3/25(月) 9:05
2024-03-25,11:26,domestic,国内,32,朝日新聞デジタル,開花またずに「桜まつり」、待ちわびる東京都民は早咲きの花に足止め,31,https://news.yahoo.co.jp/articles/d01b1bd8479eb4d1ab1e7c6a388affc858893d8f,3/24(日) 22:00
2024-03-25,11:26,domestic,国内,33,FRIDAY,「ネットでしかイキれないのに気持ち悪いんだよ」…大久保公園の「立ちんぼ嬢」が攻撃的になっている訳,31,https://news.yahoo.co.jp/articles/6791c300117bcee1215978df2b581195309e01e2,3/24(日) 18:00
2024-03-25,11:26,domestic,国内,34,TBS NEWS DIG Powered by JNN,【速報】自民・二階元幹事長「政治責任は全て私にある」　次期衆院選への不出馬表明,29,https://news.yahoo.co.jp/articles/f347a96e0558291e5af3bd29c140b2e8a1076e10,3/25(月) 10:39
2024-03-25,11:26,domestic,国内,35,現代ビジネス,「イッペイは身の危険を感じていた」…！大谷翔平の通訳・水原氏が「命を狙われる可能性」と、その背後にある「巨大犯罪組織」の正体,28,https://news.yahoo.co.jp/articles/6dee2dd7e9d91c26ac82b6e869a5fb598481baf0,3/25(月) 6:33
2024-03-25,11:26,domestic,国内,36,テレ東BIZ,【独自】二階氏、処分を前にきょう会見へ,27,https://news.yahoo.co.jp/articles/2afeb598a480bcfbca53e5d26ed7175e371a77c9,3/25(月) 8:14
2024-03-25,11:26,domestic,国内,37,日刊スポーツ,フジ風間解説委員「発言の信ぴょう性が疑われる」大谷の元通訳水原一平氏の違法ギャンブル問題,26,https://news.yahoo.co.jp/articles/24ea079103579b2fa021a76a8eec6dca2ab06b51,3/25(月) 10:49
2024-03-25,11:26,domestic,国内,38,中日スポーツ,ひろゆき、引っ越し予約とれない３月「アメリカや中国は『10倍の値段なら』で仕事と給料を増やす」と私見,25,https://news.yahoo.co.jp/articles/aacb02cd5ddcaba1b2b75ab0724c15cfe4bd64e9,3/24(日) 20:39
2024-03-25,11:26,domestic,国内,39,FRIDAY,時価2000万円以上！盗難されたスカイライン「奇跡の発見」の陰で目撃者が激怒した「警察の怠慢」,25,https://news.yahoo.co.jp/articles/82538246dc45f077bd2ff2e8653aaab710f569ba,3/24(日) 15:00
2024-03-25,11:26,domestic,国内,40,デイリー新潮,「政権の生殺与奪権を握っている」「麻生さんは岸田さんを見捨てた」　麻生太郎副総裁が政界きっての権力者となった理由とは,24,https://news.yahoo.co.jp/articles/9546333003534c849e7c2754d7463df6f2f1c763,3/25(月) 6:06
