scrp_date,scrp_time,genre_en,genre_jp,rank,media_jp,title,comment,link,date_original
2025-09-21,09:36,world,国際,1,共同通信,英、パレスチナ国家承認を発表へ　21日に首相が、G7で初,418,https://news.yahoo.co.jp/articles/bdde680b1c656b119335fbe794e69a65ec6dcc73,9/21(日) 7:59
2025-09-21,09:36,world,国際,2,NEWSポストセブン,中国でビザ発給停止や資産凍結などの制裁措置を受けた石平・参議院議員の「ひざまずき像」の画像が拡散　南宋時代の宰相・秦檜の懺悔する像を模倣か,68,https://news.yahoo.co.jp/articles/f03ab0b05066e90fbaca412711b47fdb053d8244,9/21(日) 7:15
2025-09-21,09:36,world,国際,3,NEWSポストセブン,「タダで行為できます」騒動の金髪美女インフルエンサー（26）の“過激バスツアー”に批判殺到　大学フェミニスト協会は「企画に参加し、支持する全員に反対」,58,https://news.yahoo.co.jp/articles/e6985656c16a3e0a2928f75658c4794900c9f40b,9/21(日) 7:15
2025-09-21,09:36,world,国際,4,中央日報日本語版,小泉進次郎氏が自民党総裁出馬宣言…「韓国は重要な隣国、シャトル外交継続」,49,https://news.yahoo.co.jp/articles/19905503964323520cd6710b4a7acbc4d61b8b4a,9/21(日) 9:01
2025-09-21,09:36,world,国際,5,BuzzFeed Japan,カーク氏を追悼したトランプ氏、民主党議員の殺害事件をめぐる“ある発言”に失望が広がる「今、ふざけた？」「胸が張り裂けそう」,42,https://news.yahoo.co.jp/articles/15bfb885fe76c352f38cb58c2695f4fb052eaded,9/21(日) 7:05
2025-09-21,09:36,world,国際,6,日テレNEWS NNN,【解説】約9000人の遺体を引き渡し…ロシアがウクライナへ戦死者“大規模返還” その狙いは？,30,https://news.yahoo.co.jp/articles/3a7bd77e7c33d443073b72d4e2a322536a2caa3f,9/20(土) 19:00
2025-09-21,09:36,world,国際,7,ニューズウィーク日本版,プーチンが「後継者」に言及…次世代のロシアを率いるのは誰？ 「条件」を公式の場で明言,24,https://news.yahoo.co.jp/articles/5c921147cbf25614d570be645806def8aa2daef3,9/21(日) 7:50
2025-09-21,09:36,world,国際,8,テレビ朝日系（ANN）,欧州各地の空港にサイバー攻撃　欠航も　ブリュッセル空港やヒースロー空港などで混乱,24,https://news.yahoo.co.jp/articles/3bf1752b0e21ec0fdf630264b55c780741d900b0,9/20(土) 22:06
2025-09-21,09:36,world,国際,9,共同通信,カーク氏追悼会場に武装男　アリゾナ州で式典前、逮捕後保釈,23,https://news.yahoo.co.jp/articles/3f80cfee59364ce59d6ba2b5f6cea405fe6e1c8c,9/21(日) 6:47
2025-09-21,09:36,world,国際,10,日テレNEWS NNN,ロシアで根強い日本人気…観光ビザ求めて大行列　「日本アニメとのコラボ」も,23,https://news.yahoo.co.jp/articles/6ebe9a863e26532d38856e29e61876193dc50a0c,9/20(土) 21:00
2025-09-21,09:36,world,国際,11,共同通信,米との首脳会談後に攻撃46％増　ロシア、トランプ氏姿勢影響か,22,https://news.yahoo.co.jp/articles/8cc82763e353eee151fd5cefdb8426709754705f,9/21(日) 7:28
2025-09-21,09:36,world,国際,12,ニューズウィーク日本版,「移民・難民問題」で追い詰められる欧州…「強制送還の受け入れ」めぐり、タリバン政権と取引も,22,https://news.yahoo.co.jp/articles/8c14ac1e0f800a88a0b17ea7b6dd2e8757e797e5,9/21(日) 7:20
2025-09-21,09:36,world,国際,13,KOREA WAVE,映画館にマルチーズを連れ込み、膝に乗せ鑑賞…韓国・「補助犬でもなく無責任」と批判殺到,21,https://news.yahoo.co.jp/articles/8986005f3a7bbcd58442ab344c2612b5ae7c10f6,9/21(日) 5:12
2025-09-21,09:36,world,国際,14,Forbes JAPAN,プーチンの戦争がついにロシア国内に降りかかる　燃料問題で痛み感じ始めた国民,19,https://news.yahoo.co.jp/articles/79500c9499bbeb07ec08dff6bfb74629f163c610,9/20(土) 10:00
2025-09-21,09:36,world,国際,15,共同通信,反移民デモ、警官隊と衝突　オランダ、政党事務所にも被害,19,https://news.yahoo.co.jp/articles/dc5b10ab21b061be1643f57051e3c4eff106ee0c,9/21(日) 6:29
2025-09-21,09:36,world,国際,16,Forbes JAPAN,ウクライナのドローン猛襲がロシア経済に打撃　現代版「ダビデの投石」、巨人の急所を撃つ,18,https://news.yahoo.co.jp/articles/d859ab7b4fa9592c8e4c6c515ab202422d728005,9/21(日) 9:00
2025-09-21,09:36,world,国際,17,KOREA WAVE,韓国のバス、男性客が公然と「不適切動画」視聴…迷惑行為に非難殺到,16,https://news.yahoo.co.jp/articles/8b235d218c276ccf62eb316bc4fc363fa16a4641,9/21(日) 7:12
2025-09-21,09:36,world,国際,18,ハンギョレ新聞,「核兵器廃絶だけが真の平和…一部が主張する韓国核武装論は軽率」,14,https://news.yahoo.co.jp/articles/c42a5a213d41741a7ee4e588239f5830aa08b994,9/21(日) 8:09
2025-09-21,09:36,world,国際,19,読売新聞オンライン,１２分間も領空侵犯したミグ３１戦闘機、エストニア国営放送「露骨さ目立つ」…トランプ氏も不快感,14,https://news.yahoo.co.jp/articles/7a1e3d4724490fc66b5db586ff994a29c0d2eaa9,9/20(土) 20:00
2025-09-21,09:36,world,国際,20,毎日新聞,トランプ氏「大問題になる可能性」　相次ぐロシアのNATO領空侵犯,14,https://news.yahoo.co.jp/articles/1f01be4125e3679ab29ee3056e6e3234759e2661,9/20(土) 12:23
2025-09-21,09:36,world,国際,21,読売新聞オンライン,ＮＡＴＯとは「戦争状態だ」…領空侵犯に加えプーチン政権高官が相次ぎ威嚇発言、ウクライナ支援に圧力か,14,https://news.yahoo.co.jp/articles/adcd505c3c2ff338bb4e6a1d12e6599b34941a7f,9/20(土) 22:35
2025-09-21,09:36,world,国際,22,共同通信,米ウクライナ首脳会談へ　来週、安全の保証協議,13,https://news.yahoo.co.jp/articles/c5dcf67603c67e23ee85ed9264a6a619cb2c4c9e,9/20(土) 19:43
2025-09-21,09:36,world,国際,23,共同通信,米活動家カーク氏射殺で追悼決議　下院「勇敢な愛国者」,13,https://news.yahoo.co.jp/articles/623a1b8812d12a8d56577f4dc35c4c0484526faa,9/20(土) 10:35
2025-09-21,09:36,world,国際,24,CNN.co.jp,ロシアがウクライナに大規模攻撃、ポーランドは戦闘機を緊急発進,12,https://news.yahoo.co.jp/articles/ba7fe2bfb448a9249adf83495667ba6727a09243,9/21(日) 8:56
2025-09-21,09:36,world,国際,25,47NEWS,ラオス児童買春、少女たちはどこから集められたのか　「選択肢がない」農村の小屋に１５歳、中国人の突撃訪問も,12,https://news.yahoo.co.jp/articles/ee6e19fba0129f902f6182e6079256430086d0a4,9/21(日) 9:02
2025-09-21,09:36,world,国際,26,ハンギョレ新聞,トランプ大統領とカーク氏の写真掲げ…韓国首相の警告無視して続くソウルの反中集会,12,https://news.yahoo.co.jp/articles/c13819ea2e525e6e42aabfe304df7172747abf7a,9/21(日) 7:19
2025-09-21,09:36,world,国際,27,共同通信,「米国の強い制裁に期待」　ウクライナ大統領,11,https://news.yahoo.co.jp/articles/06bafe8f0e9b8693d64b2ed874044236967220d7,9/21(日) 8:17
2025-09-21,09:36,world,国際,28,時事通信,パレスチナ承認、「反ユダヤ」にあらず　イスラエル国民に訴え　仏大統領,11,https://news.yahoo.co.jp/articles/2cde5ad048a85fbee9c2d2aeaa85f3f9c8dfc7bf,9/21(日) 7:05
2025-09-21,09:36,world,国際,29,KOREA WAVE,「管理人です」は嘘だった…韓国・隣人の男が他人の部屋に無断侵入,10,https://news.yahoo.co.jp/articles/2f5ed87ce7f303f855853f93a417ebb1d433639b,9/21(日) 8:12
2025-09-21,09:36,world,国際,30,ハフポスト日本版,クマが買い物客がいる米国の商店に侵入。「こっちへおいで」歩き回る様子を客が撮影,10,https://news.yahoo.co.jp/articles/28bbface491b6804036453393cdd20eec04f1c1a,9/21(日) 8:20
2025-09-21,09:36,world,国際,31,共同通信,中国で再エネ発電が火力上回る　太陽光は10年で30倍増,9,https://news.yahoo.co.jp/articles/2435b5f1d2ec31b1ae7291621bd76a01abf29528,9/20(土) 17:59
2025-09-21,09:36,world,国際,32,TBS NEWS DIG Powered by JNN,高度人材向けビザの手数料10万ドル「新規申請のみが対象」ホワイトハウスが説明を修正　ラトニック商務長官は前日に「毎年支払う必要がある」と発言,9,https://news.yahoo.co.jp/articles/0f46cbc98510ceedaf7f9b39ef6f8e5ece88127d,9/21(日) 6:58
2025-09-21,09:36,world,国際,33,共同通信,タリバン、大学の書籍排除　女性やイラン関連、報道,9,https://news.yahoo.co.jp/articles/c38d97573e85d7944865b66925afe263665abfeb,9/21(日) 5:20
2025-09-21,09:36,world,国際,34,TBS NEWS DIG Powered by JNN,イエメン首都サヌア イスラエル軍の10日の新聞社攻撃で記者ら31人死亡 ジャーナリスト保護委員会発表“報道機関に対する攻撃としては2番目に深刻な被害”,9,https://news.yahoo.co.jp/articles/cd55d34da6f9483587d027f10720852644028c6c,9/21(日) 7:41
2025-09-21,09:36,world,国際,35,ロイター,米高度専門職ビザの新手数料は1回限り、既存ビザは対象外と大統領報道官,8,https://news.yahoo.co.jp/articles/91c31bb1325c5a62c21b7822bfc95ba11637ba06,9/21(日) 8:28
2025-09-21,09:36,world,国際,36,TBS NEWS DIG Powered by JNN,【戦後80年】「ただ御国の為に」叔父はなぜ虐殺を…親族の葛藤「加害の歴史を伝えていかなければ」マレーシアで起きた日本軍による“華僑粛清”,8,https://news.yahoo.co.jp/articles/c8678df54af38b3a88111260afe73ebec73cecc3,9/20(土) 21:01
2025-09-21,09:36,world,国際,37,KOREA WAVE,「水を持ってこい」義父の一言に結婚不安…韓国・家父長的な態度に戸惑う花嫁候補,8,https://news.yahoo.co.jp/articles/fb7f730672ee8642a5789cbc60d481a1d1042051,9/21(日) 6:33
2025-09-21,09:36,world,国際,38,産経新聞,ロシア戦闘機3機が12分領空侵犯、エストニア外相「無礼」東欧で露機の挑発行為相次ぐ,8,https://news.yahoo.co.jp/articles/c0c5767c0c3396702b8f4c33c4ecc63e5bd78ab4,9/20(土) 22:44
2025-09-21,09:36,world,国際,39,共同通信,トランプ大統領ベネズエラに圧力　囚人受け入れなければ代償,8,https://news.yahoo.co.jp/articles/3fcb8fc10167502fcdd3b9bb10492bf992607e2f,9/21(日) 5:36
2025-09-21,09:36,world,国際,40,FNNプライムオンライン,執念の逮捕劇…走行中の逃走車に警察官が“飛びつき”追跡の一部始終　免許取り消し相当のアルコール数値検出　韓国,7,https://news.yahoo.co.jp/articles/88550bcd5ecd03e4cebf3bb5fae5ea9518c487e9,9/21(日) 9:00
