scrp_date,scrp_time,genre_en,genre_jp,rank,media_jp,title,comment,link,date_original
2025-12-03,12:31,domestic,国内,1,FRIDAY,「コメ増産」撤回で減産へ逆戻りの愚策…『おこめ券』4000億円は農水族とJAの「思うツボ」,578,https://news.yahoo.co.jp/articles/1fe2b9cfa06b679e138a0c64f4616814dd48d7f9,12/3(水) 11:00
2025-12-03,12:31,domestic,国内,2,毎日新聞,＜キャンパる＞「学生出産」に目立つ現役学生の慎重姿勢　実例の少なさも影響か,374,https://news.yahoo.co.jp/articles/5d6bdebb025092d6c2ed5c0b226ddcfff2d37be7,12/3(水) 8:00
2025-12-03,12:31,domestic,国内,3,テレビ朝日系（ANN）,自民内からも反発「進め方が乱暴」　定数1割削減法案　与野党で1年以内に結論出ないと自動発効,334,https://news.yahoo.co.jp/articles/4531cd90d4f9bd70efe6a263e937b47d94a03cd5,12/2(火) 20:28
2025-12-03,12:31,domestic,国内,4,集英社オンライン,「石破前首相はそろそろ黙ったほうがいい」理不尽な怒りを中国ではなく高市首相へ向ける倒錯、“鳩山由紀夫化”が止まらない,250,https://news.yahoo.co.jp/articles/ab6946ff938ea2ee241124f07458f44660df41f5,12/3(水) 7:00
2025-12-03,12:31,domestic,国内,5,スポニチアネックス,石破前首相“後ろから鉄砲”批判に反論「みんなが黙るってことで日本はどんな歴史たどりましたか？」,248,https://news.yahoo.co.jp/articles/4688fd98dc7f564dd5b0c00f972f4789e8524562,12/2(火) 21:24
2025-12-03,12:31,domestic,国内,6,テレビ朝日系（ANN）,「琉球は日本ではない」中国紙　木原長官「コメント必要ない」「沖縄は我が国領土」,231,https://news.yahoo.co.jp/articles/fbf5e1d28dafa4f333c9fdacc8422ee02698b8e7,12/2(火) 12:57
2025-12-03,12:31,domestic,国内,7,読売新聞オンライン,旧姓使用を法制化へ、来年の通常国会に法案提出方針…通称使用の高市首相私案を軸に,191,https://news.yahoo.co.jp/articles/1f245e63c25b23bc2f09fbde89497cde3ecb9d72,12/3(水) 5:00
2025-12-03,12:31,domestic,国内,8,産経新聞,立民・蓮舫氏「中国からのインバウンドに依存しない方策を」　金子国交相「多様化進める」,184,https://news.yahoo.co.jp/articles/87e59cfcab8611525ccd2fe0ffaa736327d92d3e,12/3(水) 7:00
2025-12-03,12:31,domestic,国内,9,女性自身,「うぬぼれてやしませんか」へずまりゅう　失礼な行為に“大人の対応”披露も…ネット冷ややか,168,https://news.yahoo.co.jp/articles/a9f7ba135f32b584e4e46bedc740efc6ca0d78f0,12/3(水) 11:35
2025-12-03,12:31,domestic,国内,10,共同通信,ふるさと納税、控除に上限を検討　政府与党、「金持ち優遇」批判で,161,https://news.yahoo.co.jp/articles/8272cd1228d12b59cdae375d10f7fc427fba8850,12/2(火) 19:31
2025-12-03,12:31,domestic,国内,11,デイリースポーツ,中国公演中止のアイドル「悔しい…」無念の思い吐露　日本へ渡航自粛呼びかけ当日に中国文化局から「日本人は許可できない」,149,https://news.yahoo.co.jp/articles/8562ee909a64fc2c72c3d7737fe840b831547c9e,12/3(水) 11:45
2025-12-03,12:31,domestic,国内,12,読売新聞オンライン,ドリフトは「危険運転」、法改正で処罰対象に追加へ…「極めて危険だが規定がない」事態解消,137,https://news.yahoo.co.jp/articles/b5279cac20ba8fdb84e80c3bb783be1df1fd531c,12/3(水) 5:00
2025-12-03,12:31,domestic,国内,13,産経新聞,一部自治体、おこめ券「絶対配らない」反発も…鈴木農水相「負担感少ない方法で進めて」,136,https://news.yahoo.co.jp/articles/b3208a6ee605c58bba50d7817fcd9bf015f3a964,12/3(水) 7:00
2025-12-03,12:31,domestic,国内,14,日テレNEWS NNN,番記者が見た高市首相の働き方の変化　なぜ？増えた「在宅勤務」,128,https://news.yahoo.co.jp/articles/a4ca4a46fad75b3124528f6ba6eb3bcdd9a2202e,12/3(水) 6:44
2025-12-03,12:31,domestic,国内,15,TBS NEWS DIG Powered by JNN,【速報】30代中国籍の男逮捕　元同僚に刃物　東京ディズニーシーのホテルミラコスタ宴会場に侵入・逃走　忘年会を開催していた会社の元従業員,128,https://news.yahoo.co.jp/articles/57f43ccd5a523237c85280f50028cbcff19c2620,12/2(火) 13:38
2025-12-03,12:31,domestic,国内,16,プレジデントオンライン,台湾有事で「10万人の日本人」が人質に…日本の経営者が理解していない中国版「有事法制」の恐ろしい実態,127,https://news.yahoo.co.jp/articles/1449fbf147f68fa818c7411cb9da6a99e855a388,12/3(水) 7:15
2025-12-03,12:31,domestic,国内,17,スポーツ報知,中国で歌唱中断の大槻マキ、ネット上の揶揄や過剰報道に声明「見たくない」「つらい」と嫌悪感,111,https://news.yahoo.co.jp/articles/7d647e80bc1bbb165ab80f408f71aaa753497359,12/3(水) 11:03
2025-12-03,12:31,domestic,国内,18,日刊スポーツ,今井絵理子氏のパートナーの元神戸市議が予告「強大な国家権力と闘うかもしれない」,108,https://news.yahoo.co.jp/articles/72a941d0fbeaa216e5e299c6d685927bb0021e91,12/3(水) 11:38
2025-12-03,12:31,domestic,国内,19,プレジデントオンライン,日本は米国と袂を分かつ覚悟はあるのか…「台湾有事に巻き込まれたくない」と話す人にどうしても伝えたいこと,108,https://news.yahoo.co.jp/articles/62f115204289ec14f6d0c2786cedafe2c2954a5f,12/3(水) 8:15
2025-12-03,12:31,domestic,国内,20,デイリー新潮,「2万円給付は富裕層が得をする形に」「お米券で儲かるのはJA」　高市政権“21兆円経済対策”が「現金給付のほうがマシ」と言われる理由,105,https://news.yahoo.co.jp/articles/df1447cbb1e84fec182f6bea4dd6428390368f18,12/3(水) 12:06
2025-12-03,12:31,domestic,国内,21,FNNプライムオンライン（フジテレビ系）,高市首相「政府党支部が企業から寄付を受けること自体が不適切ではない」　上限超え献金の発覚問われ答弁,104,https://news.yahoo.co.jp/articles/1ad652c0d376e35b90bebf9796828e4b728d62e9,12/3(水) 11:36
2025-12-03,12:31,domestic,国内,22,CBCテレビ,横断歩道を渡っていた6歳女児を車ではねてそのまま逃げた疑い 79歳男を逮捕 「人に衝突したことについては全然気が付かなかった」 愛知・豊橋市,104,https://news.yahoo.co.jp/articles/11c3699a7035d28e2d190b42da2d377e755a85f0,12/3(水) 5:48
2025-12-03,12:31,domestic,国内,23,集英社オンライン,〈ディズニーホテルでの悪夢〉「ぶっ殺すぞ」会社の忘年会で抗議文をまき中華包丁もって乱入…逮捕された中国籍の男（34）は利用企業の元従業員、ホテル利用者からは警備強化を求める声,103,https://news.yahoo.co.jp/articles/1bedb659944f614886a94bcf16a9cb4cf2ad38dd,12/3(水) 11:57
2025-12-03,12:31,domestic,国内,24,日刊スポーツ,鈴木農相肝いりおこめ券支給は「だれの利益になるのか。発行元ですよ」玉川徹氏がピシャリ指摘,94,https://news.yahoo.co.jp/articles/9fea179fec533e602aabe9ba8d5afcac5dcc56ee,12/3(水) 11:25
2025-12-03,12:31,domestic,国内,25,Yahoo!ニュース オリジナル THE PAGE,【ヤフコメで話題】「固定資産税の負担が重すぎる」「住宅ローン減税より固定資産税の見直しを」 - 固定資産税への不満と減税要望が広がる,93,https://news.yahoo.co.jp/articles/cd2497a4968959405762fa2f754ec8345602e7f5,12/3(水) 11:10
2025-12-03,12:31,domestic,国内,26,スポニチアネックス,石破前首相「減税！消費税撤廃！って言った方がウケることは100も万も分かってる。でも…」,92,https://news.yahoo.co.jp/articles/3f8a6e31b938739ae4cece518acfd30de6333200,12/2(火) 20:12
2025-12-03,12:31,domestic,国内,27,日刊スポーツ,玉川徹氏、おこめ券支給を一刀両断「筋の悪い物価対策だ」鈴木農相の方針を「本末転倒」と指摘,87,https://news.yahoo.co.jp/articles/e25e550079998e267b2e54f33b284994c739e9be,12/3(水) 11:05
2025-12-03,12:31,domestic,国内,28,共同通信,和田政宗氏が参政入り　宮城知事選で落選,83,https://news.yahoo.co.jp/articles/3c690c45f76c12288e73c5525e77145ec3db2726,12/2(火) 21:50
2025-12-03,12:31,domestic,国内,29,よろず～ニュース,「申し訳ございませんでした」人気Vtuberが謝罪　「まだ朝7時に通勤してるんですか？―」のポストで大炎上,82,https://news.yahoo.co.jp/articles/860b5c298630c767703710eaf63194bfe44d8380,12/3(水) 7:20
2025-12-03,12:31,domestic,国内,30,毎日新聞,「他の政治家では意味が弱い」　山上被告、安倍元首相に執着,81,https://news.yahoo.co.jp/articles/e91240c522e1cbbac5c2afbea003c93bde6a4ea1,12/2(火) 15:49
2025-12-03,12:31,domestic,国内,31,週刊SPA!,安倍元首相銃撃事件「テロリストの思いを汲み取る報道」が招く危険性。ジャーナリスト石戸諭氏が警鐘,78,https://news.yahoo.co.jp/articles/7c042a489294ab5e02860f927d35de62dad16849,12/3(水) 8:53
2025-12-03,12:31,domestic,国内,32,共同通信,首都高、料金値上げ検討　維持費確保へ、1割増も,76,https://news.yahoo.co.jp/articles/c24ccf44c83661c07164ee857cf4da5902fc19ab,12/2(火) 19:29
2025-12-03,12:31,domestic,国内,33,日刊スポーツ,浜田敬子氏、おこめ券配布の政府方針に異論「バラマキが本当に物価高対策になるのか、の声も」,72,https://news.yahoo.co.jp/articles/678e54c42359e802d1d87b6a8ce05eeb33798c11,12/3(水) 10:42
2025-12-03,12:31,domestic,国内,34,文春オンライン,肛門への性加害をスマホで撮影し…かつて親友だった男性（30）に“おぞましすぎる私的制裁”を加えた男（32）が法廷で口にした「驚きの一言」,72,https://news.yahoo.co.jp/articles/2079d55bccf539ea5bf9f98fb0f57918cff3c9d0,12/3(水) 11:12
2025-12-03,12:31,domestic,国内,35,時事通信,生活保護申請、3カ月ぶり増　厚労省,72,https://news.yahoo.co.jp/articles/91462b8820794f98648dd915fb4baae1f609893a,12/3(水) 11:00
2025-12-03,12:31,domestic,国内,36,文春オンライン,「こんな支払いを認めれば、際限なく買収される」林芳正氏の“公選法違反疑惑”が「きわめて悪質」「捜査を尽くすべき」と断言されてしまうワケ,68,https://news.yahoo.co.jp/articles/f78305bd9e2823cef226d9120c2cf0694b0c7683,12/3(水) 7:12
2025-12-03,12:31,domestic,国内,37,デイリースポーツ,【高市自民】米国飛び越し最前列で中国挑発「こんなモメてる国は日本だけ」立場に気付くべき　モーニングショー猿田弁護士が指摘　玉川徹氏「日本のほうが中国依存してて明らかに不利」,66,https://news.yahoo.co.jp/articles/0f666bbf5e70c8cdb51cc40b1b730d34ad69d541,12/2(火) 15:44
2025-12-03,12:31,domestic,国内,38,スポニチアネックス,橋下徹氏　厚労省の介護“2割負担”試算に「高齢者にはここまで緻密に所得基準を設けるのだから…」,63,https://news.yahoo.co.jp/articles/8cd21ff305b03857c4c4d4942537d90f1033c835,12/3(水) 8:31
2025-12-03,12:31,domestic,国内,39,時事通信,薬価、26年度引き下げへ　実勢価格が4．8％下回る　厚労省,62,https://news.yahoo.co.jp/articles/0a26d4094ded000412f84bd2734d6aaf3f37eb9b,12/3(水) 10:36
2025-12-03,12:31,domestic,国内,40,朝日新聞,水深2mのホテルプールで大学生溺死、監視員なし　8千万円賠償命令,62,https://news.yahoo.co.jp/articles/9692d78b7a38e86d2da9c2ba286e3ca9414adf62,12/2(火) 14:30
