scrp_date,scrp_time,genre_en,genre_jp,rank,media_jp,title,comment,link,date_original
2026-01-20,20:11,world,国際,1,産経新聞,ガザ平和評議会でトランプ氏から高市首相に招待状　参加期間3年超で10億ドル拠出要請か,177,https://news.yahoo.co.jp/articles/c78d4424edaebf6a4ed0d0248118e4ffaef8e889,1/20(火) 17:51
2026-01-20,20:11,world,国際,2,共同通信,金正恩氏、副首相を解任　工場改修で問題「党を愚弄」,63,https://news.yahoo.co.jp/articles/786c2a9245ef7075339ae4ce86cf7c32fa0253c3,1/20(火) 9:55
2026-01-20,20:11,world,国際,3,FNNプライムオンライン（フジテレビ系）,トランプ大統領のSNS投稿が波紋　マクロン大統領からのメッセージを一方的に公開　“グリーンランドにアメリカ国旗”画像も投稿,52,https://news.yahoo.co.jp/articles/467da516c3eaf6f2141e1b6b9028cbdcc3dee595,1/20(火) 16:57
2026-01-20,20:11,world,国際,4,テレビ朝日系（ANN）,中国でイケア大量閉店　消えた爆買い　中国経済が鈍化？GDP成長率“低水準”,51,https://news.yahoo.co.jp/articles/18bfa57070f3e4e252814206d7192c51fcc907ea,1/20(火) 13:09
2026-01-20,20:11,world,国際,5,テレビ朝日系（ANN）,タイでライオンをペットに　子どもが重傷を負う事態　違法輸出も問題に,43,https://news.yahoo.co.jp/articles/dcf4088881825805842c44e56af38a11b0db0241,1/20(火) 17:39
2026-01-20,20:11,world,国際,6,時事通信,仏大統領「理解できない」　トランプ氏がメッセージ公開,41,https://news.yahoo.co.jp/articles/e2de6e17430142b6df780e772dba57fd5f70d124,1/20(火) 17:41
2026-01-20,20:11,world,国際,7,ロイター,トランプ氏「戦争食い止めたのに、ノルウェーは私にノーベル賞を授与しなかった」と書簡,33,https://news.yahoo.co.jp/articles/7348fa77058628ed4debd8dd569bcaa8d3537201,1/20(火) 11:35
2026-01-20,20:11,world,国際,8,中央日報日本語版,73歳のプーチン氏、今年も真冬の氷水に入水,26,https://news.yahoo.co.jp/articles/35c652083434e31879ea7c8992133084e626bb85,1/20(火) 7:34
2026-01-20,20:11,world,国際,9,ロイター,中国、トランプ氏の「平和評議会」から招待状　受諾は明言避ける,25,https://news.yahoo.co.jp/articles/be1eb4a73633b623f0d3ec7afc4f6a0e3d8cc4ff,1/20(火) 16:27
2026-01-20,20:11,world,国際,10,ロイター,マクロスコープ：高市氏、政策実現に意欲　「財政のメルトダウン」警戒の声も,22,https://news.yahoo.co.jp/articles/4371188b897554f46c222097243b7accf1614a26,1/20(火) 17:06
2026-01-20,20:11,world,国際,11,CNN.co.jp,トランプ氏、グリーンランド掌握は「ノーベル平和賞もらえなかったから」　ノルウェー首相宛ての書簡で吐露,18,https://news.yahoo.co.jp/articles/615750b96031cc6627393bb71d39fd92903d7e89,1/20(火) 13:54
2026-01-20,20:11,world,国際,12,TBS NEWS DIG Powered by JNN,トランプ大統領「もう純粋に平和を考える義務を感じない」ノーベル平和賞受賞できずノルウェー首相にメッセージ　グリーンランド領有の必要性も改めて主張,18,https://news.yahoo.co.jp/articles/3d762d739489b5a68c84818c57a6a4f49d6eea5d,1/20(火) 1:42
2026-01-20,20:11,world,国際,13,Wedge（ウェッジ）,トランプがグリーンランド領有を諦めない理由、本当に欲しがっているものは何か？民間企業に任せられない事情,17,https://news.yahoo.co.jp/articles/9edec8f3827674f6bbee5a5ee5e96586748bfe4a,1/20(火) 18:51
2026-01-20,20:11,world,国際,14,テレビ朝日系（ANN）,トランプ大統領「平和のみを考える義務を感じない」ノルウェー首相の対話の求めに対し,17,https://news.yahoo.co.jp/articles/f81b9ed03db3e7f1355b21535e35de831e49fc34,1/20(火) 12:45
2026-01-20,20:11,world,国際,15,産経新聞,トランプ氏、ノーベル平和賞取れないとノルウェー首相に苦情　「もはや平和のみ考えず」,16,https://news.yahoo.co.jp/articles/8785d4a17d79684ccbef8dd7a54863e16a437b10,1/20(火) 7:40
2026-01-20,20:11,world,国際,16,中央日報日本語版,韓国に最も好感を抱いている国は…UAE、エジプト、フィリピンの順,15,https://news.yahoo.co.jp/articles/26e4c2c55a8865dd9da8d2fa5ce0f59379ded293,1/20(火) 14:41
2026-01-20,20:11,world,国際,17,TBS NEWS DIG Powered by JNN,「不法移民の強制送還」を推し進めるトランプ政権　アメリカで市民権を持つ人が取り締まりに…「投票したことを心から後悔」 政権発足から1年,15,https://news.yahoo.co.jp/articles/10577abc388eb122ca640c2a27744e02107dbbd6,1/20(火) 12:26
2026-01-20,20:11,world,国際,18,BBC News,トランプ氏、ノーベル賞受賞しなかったこととグリーンランド領有を結び付け　ノルウェー首相へのメッセージで,15,https://news.yahoo.co.jp/articles/a46b857dd2bc3e65d481f0cb6d1aeb08c6150488,1/20(火) 10:30
2026-01-20,20:11,world,国際,19,TBS NEWS DIG Powered by JNN,中国やロシアなどが南アフリカ沖で「BRICS」初の合同軍事演習実施　「BRICS」軍事連携強化でアメリカをけん制か,14,https://news.yahoo.co.jp/articles/69da023f5626a2bc9e093cd2da3c629e7222b2ce,1/20(火) 19:08
2026-01-20,20:11,world,国際,20,ロイター,トランプ氏、プーチン大統領を「平和評議会」に招待,14,https://news.yahoo.co.jp/articles/be7779b604df16135fd9f224da73e27dd016a92a,1/20(火) 14:15
2026-01-20,20:11,world,国際,21,Forbes JAPAN,トランプがノルウェーに不満表明、「戦争を止めたのにノーベル賞なし」　グリーンランド問題にも結び付け,14,https://news.yahoo.co.jp/articles/50422052ac5b02605eaa147a9b0ef29526f7eda1,1/20(火) 9:00
2026-01-20,20:11,world,国際,22,共同通信,「トランプ氏が歴史に名前刻む」　グリーンランド巡りロシア報道官,13,https://news.yahoo.co.jp/articles/d07cb98d6e06192511e48601708f2d41275cc65d,1/20(火) 19:23
2026-01-20,20:11,world,国際,23,ＡＦＰ＝時事,トランプ氏、フランス産ワインとシャンパンに200%関税警告,13,https://news.yahoo.co.jp/articles/f92cb1a68fe2b91236bc44434a95414d7182a435,1/20(火) 15:37
2026-01-20,20:11,world,国際,24,テレビ朝日系（ANN）,「平和だけ考える義務感じない」トランプ大統領が“不満の書簡”,12,https://news.yahoo.co.jp/articles/59dc202e1942b1da3e2355f0de663a5e3af445a1,1/20(火) 19:36
2026-01-20,20:11,world,国際,25,ＡＦＰ＝時事,ベッカム家に深まる亀裂 長男「和解は望まない」,12,https://news.yahoo.co.jp/articles/fb3a4d4ee5f62a1a2cb8739ec8062aae2ca59491,1/20(火) 11:34
2026-01-20,20:11,world,国際,26,BBC News,【解説】トランプ氏再選に貢献したラティーノ有権者、しかし今では落胆する人も,11,https://news.yahoo.co.jp/articles/c19105d28b5e85cf3c203f03eed758b4eed1b660,1/20(火) 14:24
2026-01-20,20:11,world,国際,27,TBS NEWS DIG Powered by JNN,アフガニスタン首都の中華料理店で爆発 中国人ら7人死亡　「イスラム国」が“中国人標的に自爆テロ”と犯行声明,11,https://news.yahoo.co.jp/articles/b540ecd65acfe063bf6b5ff7a813d020b7243e87,1/20(火) 18:41
2026-01-20,20:11,world,国際,28,日経ビジネス,日本企業が狙われる理由　中国で広がる習政権転覆という「物語」,11,https://news.yahoo.co.jp/articles/60a416bf764b36c6e565660c955fe74fff4aa880,1/20(火) 6:00
2026-01-20,20:11,world,国際,29,TBS NEWS DIG Powered by JNN,中国メディア「早期解散は高市総理の『醜態隠し』と『政治的な賭け』」,11,https://news.yahoo.co.jp/articles/1eae7a752154b893ae45a661ed246f0373d69533,1/20(火) 11:30
2026-01-20,20:11,world,国際,30,KOREA WAVE,韓国・李在明大統領、メローニ伊首相に「ピンクのZフリップ」サプライズ…即席セルフィーで和やかに,10,https://news.yahoo.co.jp/articles/f1640084dbb21186a6adc3584c353167474f6b65,1/20(火) 16:42
2026-01-20,20:11,world,国際,31,日テレNEWS NNN,トランプ大統領　「平和評議会」メンバーにプーチン大統領を招待,10,https://news.yahoo.co.jp/articles/3b67ffec9dfaee5d9d4685623026d78dbb880422,1/20(火) 15:14
2026-01-20,20:11,world,国際,32,BBC News,【解説】 ロシア、グリーンランドめぐる緊張にほくそ笑む　「欧州は完全に途方に暮れている」,10,https://news.yahoo.co.jp/articles/ae2178f5c82508d6eb66dcf9a1b1f7667e17306d,1/20(火) 15:34
2026-01-20,20:11,world,国際,33,ロイター,米財務長官、グリーンランド巡る「ヒステリー」否定　欧州との解決に自信,10,https://news.yahoo.co.jp/articles/a03dd2305a1f72c635c1c4c2e5842e478c736a58,1/20(火) 17:16
2026-01-20,20:11,world,国際,34,日テレNEWS NNN,トランプ大統領、グリーンランド領有に圧力　市民は何を思うのか…現地を緊急取材,9,https://news.yahoo.co.jp/articles/fd8ff45e033b6d6045f6fe5c8ef4900235f674ef,1/20(火) 19:45
2026-01-20,20:11,world,国際,35,TBS NEWS DIG Powered by JNN,入手困難の「ボンボンドロップシール」韓国で日本人が“爆買い” お土産としても人気過熱、争奪戦に,9,https://news.yahoo.co.jp/articles/7750c609c4b011ad6617781e6c3e344efc5a7b16,1/20(火) 19:25
2026-01-20,20:11,world,国際,36,中央日報日本語版,「ホテルに2週間滞在で2000ドル」誘われベトナムに向かった韓国の20代が監禁,9,https://news.yahoo.co.jp/articles/4d4f86fecedc29beb4a78dd1fb554e2d6c6fb71e,1/20(火) 17:10
2026-01-20,20:11,world,国際,37,TBS NEWS DIG Powered by JNN,「アメリカは自分の居場所ではないと感じる」スペインに移住する“トランプ移民”が増加　移住相談5％増　背景に家族や価値観めぐる葛藤,9,https://news.yahoo.co.jp/articles/532e5f6f61511a6d3128f49cc964e72898525e40,1/20(火) 17:00
2026-01-20,20:11,world,国際,38,CNN.co.jp,オーストラリア滞在の19歳カナダ人女性、野生犬の群れに囲まれ遺体で発見,9,https://news.yahoo.co.jp/articles/a01561317abd0a760ce209a80bee01e20413788d,1/20(火) 10:56
2026-01-20,20:11,world,国際,39,日テレNEWS NNN,トランプ大統領　仏大統領とNATO事務総長から来たメッセージ公開,9,https://news.yahoo.co.jp/articles/81c073146b74b2d675595528e95aa6a6a5095f5b,1/20(火) 17:03
2026-01-20,20:11,world,国際,40,ロイター,東欧モルドバ、4年以内に独立国家共同体を脱退へ,9,https://news.yahoo.co.jp/articles/a415f30a6a413602b7a2fc8124e15f44862f03ac,1/20(火) 14:55
