scrp_date,scrp_time,genre_en,genre_jp,rank,media_jp,title,comment,link,date_original
2026-01-20,00:11,business,経済,1,共同通信,プルデンシャル生命、記者会見へ　顧客被害31億円、週内にも,204,https://news.yahoo.co.jp/articles/c85bea00fa5b595230c17d09cbf5e20a4d4f0710,1/19(月) 15:13
2026-01-20,00:11,business,経済,2,テレビ朝日系（ANN）,「40歳以上お断り」「25歳以上限定」　年齢制限の飲食店が続々と,142,https://news.yahoo.co.jp/articles/9a209aa1a5e0741c65ea3065a3d650672cb60ce9,1/19(月) 12:51
2026-01-20,00:11,business,経済,3,時事通信,長期金利急騰、一時2．275％　消費減税警戒、27年ぶり水準,97,https://news.yahoo.co.jp/articles/86fc0d9fa8f558babd5a7b5856902a6c43d0352c,1/19(月) 9:29
2026-01-20,00:11,business,経済,4,プレジデントオンライン,"このままでは日本車も半導体も作れなくなる…日本が誇る基幹産業を""人質""に取った習近平の「最大の切り札」",81,https://news.yahoo.co.jp/articles/e5d6b815579cc841d54286562a4c9fdd3fd54985,1/19(月) 9:15
2026-01-20,00:11,business,経済,5,共同通信,郵便局でコンビニ商品、陳列販売　試験的に関東5県、買い物支援,46,https://news.yahoo.co.jp/articles/4859e4fa914a4680fd15fb6f4f6f42a9b75fb46e,1/19(月) 14:49
2026-01-20,00:11,business,経済,6,J-CASTニュース,「レアアース」中国が止めたら...半導体産業は不安　製造能力や生産計画に影響し「最悪のシナリオ」の恐れも,36,https://news.yahoo.co.jp/articles/c37f994a8d2c96523d075332fc7c3a9c02a24d48,1/19(月) 19:00
2026-01-20,00:11,business,経済,7,プレジデントオンライン,"あえてマクドナルドの真似はしない…「瀕死」のドムドムバーガーを復活させた59歳女性社長の""逆張り戦略""",35,https://news.yahoo.co.jp/articles/5a2eef75e290c1a3e71502bc72c5dc0e2c4acd98,1/19(月) 8:15
2026-01-20,00:11,business,経済,8,東洋経済オンライン,「昇進おめでとう」「ありがとうございます。頑張ります」→1週間後、彼は辞表を出し…「昇進は罰ゲーム」将来有望の30代社員が辞職を決断したワケ,34,https://news.yahoo.co.jp/articles/6be8cd6979e74796be465fedcb50ace0e265ace6,1/19(月) 7:00
2026-01-20,00:11,business,経済,9,読売新聞オンライン,ＥＶ販売、近距離利用多い「軽」で強化…充電インフラ不足の「電欠」不安少なく,31,https://news.yahoo.co.jp/articles/3685f1b51248af2ce67ae09d8e8720ff936a7a4e,1/19(月) 5:00
2026-01-20,00:11,business,経済,10,ファイナンシャルフィールド,隣人にわが家の“空いてる駐車場”を「月5000円で貸して」と言われました。息子は「トラブルになる」とのことですが、知り合いなら大丈夫ですよね？ 善意で貸す際の注意点とは,26,https://news.yahoo.co.jp/articles/0331692d9419ab66ef079d216ad7c2f9abb009f3,1/19(月) 13:30
2026-01-20,00:11,business,経済,11,マネーポストWEB,《資産7億円の桐谷広人さん》現金で1億円を持っている理由、株主優待と配当だけで生活する“ストイックすぎる”理由を明かす,24,https://news.yahoo.co.jp/articles/e1595db91f3cbb0827e062b9a3af30d8b10e2103,1/19(月) 16:15
2026-01-20,00:11,business,経済,12,ITmedia ビジネスオンライン,リコーは「出社」をどう再定義したのか　“集まる意味”を問い直した、これからの働き方,20,https://news.yahoo.co.jp/articles/a17342028f41f2cd869686b953580363ddc32131,1/19(月) 6:10
2026-01-20,00:11,business,経済,13,THE GOLD ONLINE（ゴールドオンライン）,「日本の不動産はバーゲンセール」経営者が夜逃げした“バブルの残骸”を中国勢が次々と買収…石和温泉の4軒に1軒が中国資本、「客の8割が中国人」のホテルも出現,16,https://news.yahoo.co.jp/articles/2a28df1b07e305b4da8d9b1c2eae900526fc2ca4,1/19(月) 13:30
2026-01-20,00:11,business,経済,14,読売新聞オンライン,トランプ関税、日本企業への影響甚大…自動車大手7社の利益は半年で計1・5兆円下げる,16,https://news.yahoo.co.jp/articles/bcef62f912466eec4235720e796f8ea902efd83c,1/19(月) 22:07
2026-01-20,00:11,business,経済,15,Bloomberg,なぜ今解散総選挙に踏み切るか、高市首相が挑む支持率頼みの大勝負,16,https://news.yahoo.co.jp/articles/b0a1da711810a14becc1796cb46891bf5bc9a6cc,1/19(月) 8:31
2026-01-20,00:11,business,経済,16,NRI研究員の時事解説,高市首相が衆院解散を表明：消費税減税を公約に掲げる：円安・債券安が一段と進むリスク,15,https://news.yahoo.co.jp/articles/3d94fadd70e800adcef25d64f2433e371a0e38a3,1/19(月) 20:39
2026-01-20,00:11,business,経済,17,日刊工業新聞電子版,ホンダ・三部敏宏社長「4輪車巻き返し」,14,https://news.yahoo.co.jp/articles/1d2639218fba6a934c7e38e83d95b2c40f21b634,1/19(月) 13:10
2026-01-20,00:11,business,経済,18,MotorFan,凛々しい30アルファードは約半年でカスタマイズ！　ホイールに合わせて全体をブラック＆ゴールドに統一してスタイルアップ,13,https://news.yahoo.co.jp/articles/5a004ace1ba5b58fc397abd151a2c629c78d40ff,1/19(月) 15:05
2026-01-20,00:11,business,経済,19,時事通信,電力需要、2～3割増を想定　脱炭素、再エネと原発不可欠　西山九州電力社長,13,https://news.yahoo.co.jp/articles/95e2946b246c182d4ebc80a4ab82014c9b425537,1/19(月) 7:10
2026-01-20,00:11,business,経済,20,TBS CROSS DIG with Bloomberg,米国より「予測可能」な中国、カナダのカーニー首相が関係改善に動く,12,https://news.yahoo.co.jp/articles/4c93c737ee48cb4020c991da4cdf6b105b239670,1/19(月) 14:32
2026-01-20,00:11,business,経済,21,プレジデントオンライン,ハリウッド映画から「中国人の悪役」が消えた…あのディズニーを屈服させた中国が持つ「14億人市場」の威力,12,https://news.yahoo.co.jp/articles/cff8864e9c12a7fb9fb61a257b7310d43dd483ba,1/19(月) 16:15
2026-01-20,00:11,business,経済,22,TBS NEWS DIG Powered by JNN,東京電力HD 柏崎刈羽原発の20日再稼働を取りやめ　17日に制御棒引き抜き試験で不具合発生 再稼働日程は「未定」,11,https://news.yahoo.co.jp/articles/72140a86a51a57f3a2a285fd53cfcc89675b69ed,1/19(月) 16:38
2026-01-20,00:11,business,経済,23,共同通信,対日輸出管理強化の中国に申し入れへ,11,https://news.yahoo.co.jp/articles/410f44dc4f531ec28aa60ebaab0faef6f5632f52,1/19(月) 13:44
2026-01-20,00:11,business,経済,24,NRI研究員の時事解説,『中道改革連合』の政策綱領策定,11,https://news.yahoo.co.jp/articles/6dc9de643c2c4fc71b320104e4b94d41de58260e,1/19(月) 8:34
2026-01-20,00:11,business,経済,25,まいどなニュース,ロッテ「クーリッシュ」公式Xが謝罪「配慮を欠いた内容」　3Dプリンターで自作した「絞り口」を投稿→批判相次ぐ,11,https://news.yahoo.co.jp/articles/6ed716f6c5264a18dbd3627ffc8d8d43030fa49d,1/19(月) 20:37
2026-01-20,00:11,business,経済,26,みんかぶマガジン,東大理三卒医師「明確な夢がないなら、就活偏差値の高い、まともな大手企業に入ることがキャリアの正解だ」,10,https://news.yahoo.co.jp/articles/41c7a05431cf9ab53eb3755322c6086a1be760ea,1/19(月) 19:10
2026-01-20,00:11,business,経済,27,ロイター,アングル：揺らぐ高市トレード、立公新党で不透明感　情勢巡り一喜一憂も,10,https://news.yahoo.co.jp/articles/503d047919e77af8c7aae47c78e63ad374aec591,1/19(月) 17:25
2026-01-20,00:11,business,経済,28,ファイナンシャルフィールド,息子に「アルファード」を“100万円”で贈与したら、「安すぎると」いう理由で贈与税が発生!? いくらなら税務署に指摘されないでしょうか？「低額譲受」について解説,10,https://news.yahoo.co.jp/articles/4336922afbe79925abab7ddfcd298fb9025206c3,1/19(月) 13:40
2026-01-20,00:11,business,経済,29,TBS NEWS DIG Powered by JNN,日銀「政策金利据え置き」の公算　22日から金融政策決定会合　12月に約30年ぶり水準利上げも円安止まらず　今後の利上げペース議論焦点に,10,https://news.yahoo.co.jp/articles/71627519447a65d47af288bc443875af3f102386,1/19(月) 21:58
2026-01-20,00:11,business,経済,30,THE GOLD ONLINE（ゴールドオンライン）,「正直、迷惑でした」老後の習い事を泣く泣く諦め、老体に鞭打って稼いだ〈孫の塾代〉…年金月10万円の78歳母を絶望させた、嫁の“残酷な本音”【FPが解説】,10,https://news.yahoo.co.jp/articles/ed29e1867a946660b4bbad3bf632aa3d5bd90ec9,1/19(月) 5:00
2026-01-20,00:11,business,経済,31,THE GOLD ONLINE（ゴールドオンライン）,お母さん、助けてください…東京で暮らす18歳娘からの「まさかの電話」。貯金50万円・極限生活の中〈仕送り月5万円〉を工面する53歳母が崩れ落ちたワケ【CFPの助言】,10,https://news.yahoo.co.jp/articles/a03d5581cbadb4836b05bb2d8690bbadbd210b89,1/19(月) 10:00
2026-01-20,00:11,business,経済,32,ファイナンシャルフィールド,家の住宅ローン完済で貯金が「500万円」になった70代夫婦…。ほぼ「年金頼り」の暮らしになるけど大丈夫!? 夫婦の年金収入「月20万円」の場合で試算,10,https://news.yahoo.co.jp/articles/87fc6e5a93e9bdb3ea3ff6e8024494bc48736d17,1/19(月) 17:10
2026-01-20,00:11,business,経済,33,MBSニュース,"【衆議院解散発表】消費税減税「中道改革連合」は食料品""恒久ゼロ""　自民党は""期限付きゼロ""検討　専門家は実現性を疑問視...与野党とも選挙前に掲げ始めたワケは？",9,https://news.yahoo.co.jp/articles/5e0fd6200d10dcdb14539b2ea1908598a9ec5cad,1/19(月) 19:12
2026-01-20,00:11,business,経済,34,時事通信,日経平均、700円超安＝東京株式,9,https://news.yahoo.co.jp/articles/f5fb1ed98afb9e35701c1ff08d2872323a8b6875,1/19(月) 10:00
2026-01-20,00:11,business,経済,35,Bloomberg,GPIF海外運用益を消費減税財源に、毎年兆円単位の円買い-公明・岡本氏,9,https://news.yahoo.co.jp/articles/bd6946d3acb36dfe46dcfdb8f828d0bbeea27889,1/19(月) 16:36
2026-01-20,00:11,business,経済,36,産経新聞,馬渕磨理子さん、長寿社会へ「何もしないことが最大リスク」　大手町で経済フォーラム,9,https://news.yahoo.co.jp/articles/72ada64d821b5151bd559aa26cde07e535eb42ba,1/19(月) 21:13
2026-01-20,00:11,business,経済,37,Bloomberg,全米で反発広がるデータセンター建設、テック大手が住民の懐柔に躍起,8,https://news.yahoo.co.jp/articles/31f2ebe1556ba4a8bae05c28aa456e76fe069833,1/19(月) 22:49
2026-01-20,00:11,business,経済,38,毎日新聞,＜移民と社会＞「排外主義は怖い」　外国人規制強化、コンビニ大手首脳が抱く危機感,8,https://news.yahoo.co.jp/articles/7f878e242a5b8ec1c0be74f47c4bfd598d2ef04f,1/19(月) 10:00
2026-01-20,00:11,business,経済,39,マネーポストWEB,《憧れの「地方暮らし」で移住者が直面する困難》“地域特有のルール”や“濃密な人間観関係”が大きな負担に　光熱費は「東京の2倍」が目安という現実,8,https://news.yahoo.co.jp/articles/f2b3d2d49af8826c03ec05d2c701db02cf5c1254,1/19(月) 15:15
2026-01-20,00:11,business,経済,40,FNNプライムオンライン（フジテレビ系）,長期金利2.270％に…1999年2月以来約27年ぶりの高水準　財政悪化の懸念が市場に広がり金利が上昇,8,https://news.yahoo.co.jp/articles/fab8975b631eef323e92ef3e4eb878b7c7d3afa5,1/19(月) 14:21
