scrp_date,scrp_time,genre_en,genre_jp,rank,media_jp,title,comment,link,date_original
2025-07-31,12:37,business,経済,1,日経ビジネス,「3COINS」企画案ほぼ採用、賞与は半期1000万円も　成長支える自由な風土,194,https://news.yahoo.co.jp/articles/53b64082af6a3fd804867f11941f13e8d1871524,7/31(木) 6:00
2025-07-31,12:37,business,経済,2,THE GOLD ONLINE（ゴールドオンライン）,このままでは日本は破綻する？…“世界最悪レベル”の財政赤字を健全化する戦略とは【東京大学名誉教授が解説】,166,https://news.yahoo.co.jp/articles/6d8780c7be00d18d1dd27c8af3697c0049a0c426,7/31(木) 10:01
2025-07-31,12:37,business,経済,3,FNNプライムオンライン（フジテレビ系）,【速報】日銀が0.5％の政策金利の据え置き決定…追加利上げを見送り　今年度の物価上昇率2.7％見通しに,121,https://news.yahoo.co.jp/articles/07ab6c3ab9a6078b1cdd611365d447cb5d7d634e,7/31(木) 12:01
2025-07-31,12:37,business,経済,4,帝国データバンク,8月の飲食料品値上げ、1010品目　前年比1.5倍の増加,108,https://news.yahoo.co.jp/articles/fc998f21b9bed3052a788b92e358e4366593367e,7/31(木) 9:00
2025-07-31,12:37,business,経済,5,弁護士ドットコムニュース,ジャングリア沖縄、訪日外国人はチケット高め　異例の「二重価格」は差別なのか？ネットで賛否も,104,https://news.yahoo.co.jp/articles/033798677e29f56e9162059397af6c366d4c6e73,7/31(木) 11:25
2025-07-31,12:37,business,経済,6,東洋経済オンライン,【データ検証】「外国人による治安悪化」は本当か？→インバウンドは明確に無関係…だが、労働者の属性次第では犯罪増加も,63,https://news.yahoo.co.jp/articles/75dd88f4a272dd12cead7bcd8f97bab18984d020,7/31(木) 8:01
2025-07-31,12:37,business,経済,7,毎日新聞,猛暑で脚光「アイススラリー」急拡大　企業も注目の熱中症対策,48,https://news.yahoo.co.jp/articles/c5df103561cbaab52bba628c51a8248c15c3654c,7/31(木) 6:36
2025-07-31,12:37,business,経済,8,毎日新聞,あえてネットでなく「保険ショップ」　再び市場規模拡大の理由は,41,https://news.yahoo.co.jp/articles/1dac6c5fe99af47838338533cc2850d4f10883c7,7/31(木) 5:30
2025-07-31,12:37,business,経済,9,プレジデントオンライン,「年会費5万円」払っても損しない…「プレミアムなクレジットカード」を持つ若者がじわじわ増えているワケ,39,https://news.yahoo.co.jp/articles/ab7ac6bf3c6a49f4c579d6b7b2648fe2c6b65e8f,7/31(木) 8:16
2025-07-31,12:37,business,経済,10,ニュースイッチ,山形新幹線「E8系」故障の抜本対策遠く…新車両導入に暗雲、遅れ不可避,37,https://news.yahoo.co.jp/articles/1706ed978cfaff24bcb8e2280dbee9eec97a602c,7/31(木) 11:20
2025-07-31,12:37,business,経済,11,THE GOLD ONLINE（ゴールドオンライン）,本当はもうお金がありません…「夫の遺産1.3億円」「年金17万円」目黒の豪邸で一人暮らす77歳女性の現実。孫の進学祝いは高級ホテルで食事会・無免許なのに高級外車所有、偽りの“上流生活”を続けるワケ【FPが解説】,36,https://news.yahoo.co.jp/articles/5a89a5747da774829d2cb2625d8a1fc63e1a6dcb,7/31(木) 10:31
2025-07-31,12:37,business,経済,12,みんかぶマガジン,“エリート候補者”集めた石丸新党「再生の道」違和感の正体…“SAPIX生まれ東大育ちのチームみらい”は「東大内部生」集団,35,https://news.yahoo.co.jp/articles/2d55b4b7cfd714fe4cef26d9a4bd7f3da137e1f8,7/31(木) 9:10
2025-07-31,12:37,business,経済,13,Merkmal,「メーカーの努力不足」「魅力がないだけ」 アメ車への感情的反発が全く意味ない理由,31,https://news.yahoo.co.jp/articles/7e703e7e5fcb59e9da47ffc4333093be2d2763e0,7/31(木) 11:51
2025-07-31,12:37,business,経済,14,THE GOLD ONLINE（ゴールドオンライン）,"こんな老後になろうとは…〈年金25万円〉〈退職金2,000万円〉〈貯蓄1,500万円〉66歳元会社員「妻とのんびり温泉巡り」のはずが、小さなアパートにポツン。ひとり項垂れる「転落シニア」の悲哀【FPの助言】",27,https://news.yahoo.co.jp/articles/9d320321578a93119e973ad4807afd85cc8d6f44,7/31(木) 10:01
2025-07-31,12:37,business,経済,15,週刊SPA!,話題の「ジャングリア沖縄」、空港からのアクセスが悪くても“人を集められる”納得のワケ,27,https://news.yahoo.co.jp/articles/6ec9378ff15f085fe2214f284d26150a4497becc,7/31(木) 8:54
2025-07-31,12:37,business,経済,16,ファイナンシャルフィールド,「40代後半で年収が頭打ち…」と嘆く夫。年収700万円ですが、定年まで今の年収のままってことはあるのでしょうか？,27,https://news.yahoo.co.jp/articles/ddef1e45f5dca5114a2ad12204f7f00759d6f117,7/31(木) 11:20
2025-07-31,12:37,business,経済,17,日刊工業新聞電子版,ガソリン暫定税率廃止　「車税制」抜本改正の突破口に,27,https://news.yahoo.co.jp/articles/37424aef42c66c1bd0edbafcbebc86a80393cebb,7/31(木) 10:02
2025-07-31,12:37,business,経済,18,読売新聞オンライン,トヨタの上半期販売、過去最高の５５４万台…ＨＶや海外販売好調で６年連続世界首位,27,https://news.yahoo.co.jp/articles/800112e1860dead033f1bd04f3d5bb6560437bef,7/30(水) 13:30
2025-07-31,12:37,business,経済,19,共同通信,韓国の自動車関税は15％と米長官,26,https://news.yahoo.co.jp/articles/c3e5098086394866a7459eaa57244255fc17826d,7/31(木) 8:45
2025-07-31,12:37,business,経済,20,日テレNEWS NNN,8月飲食料品値上げ1000品目超え　通年では2年ぶりに2万品目以上になる見通し,22,https://news.yahoo.co.jp/articles/fcc3ceb5de5b105dc039505f2417ba634c9e031c,7/31(木) 11:27
2025-07-31,12:37,business,経済,21,Merkmal,「神戸の玄関口」が廃墟同然？ 駅直結モールは空き区画「7割」という現実、神戸市は再生ビジョンを描けるか,22,https://news.yahoo.co.jp/articles/811d37c43d8de5eca3c20719f5d72d93af574126,7/31(木) 7:00
2025-07-31,12:37,business,経済,22,TBS NEWS DIG Powered by JNN,日銀金融政策決定会合　政策金利を0.5％に据え置く見通し,21,https://news.yahoo.co.jp/articles/17377df80f038e6c243898ddd4b7a793820ec21c,7/31(木) 11:47
2025-07-31,12:37,business,経済,23,みんかぶマガジン,「日本人ファースト」にかき消されたロスジェネ対策……雨宮処凛「参院選は最後の希望だった」,21,https://news.yahoo.co.jp/articles/452c60da90c1b966151e5263ee6a59723bbf1c4f,7/30(水) 19:10
2025-07-31,12:37,business,経済,24,ロイター,オリエンタルランド、営業益4─6月期として過去最高　新エリア寄与,20,https://news.yahoo.co.jp/articles/b76a79856ceed2b071ca292a147eaa5843469c6b,7/30(水) 16:42
2025-07-31,12:37,business,経済,25,東洋経済オンライン,最新《東大理3》合格者数ランキングに“異変” 超名門の中に地方公立の星「富山中部」、大躍進の理由とは,20,https://news.yahoo.co.jp/articles/3cddef25e6d408ad3455002fa09b60d8deb2582b,7/31(木) 10:31
2025-07-31,12:37,business,経済,26,ベストカーWeb,"こんな曲今絶対できないよ……クルマ人気が絶頂だったから実現した""車名""が曲名に入った歌たち",19,https://news.yahoo.co.jp/articles/9bbbb8bbbf87279f35dd48f7596bd01b6b318bff,7/30(水) 20:00
2025-07-31,12:37,business,経済,27,BUSINESS INSIDER JAPAN,不正会計のAIベンチャー・オルツ、上場廃止が決定。民事再生手続きへ,19,https://news.yahoo.co.jp/articles/ced9fbf5607cb32cab076a642f9c4c8fc35e0502,7/30(水) 17:30
2025-07-31,12:37,business,経済,28,くるまのニュース,「ガソリンが一気に安くなるのサイコー！」 25.1円も？ 11月以降に!? 理由は「ガソリンの暫定税率」廃止！これまでの経緯は？ 今後は？,18,https://news.yahoo.co.jp/articles/5810eefb1216492a4ebaf194d1c49158af9229e7,7/31(木) 9:35
2025-07-31,12:37,business,経済,29,共同通信,韓国の相互関税は15％とトランプ氏,18,https://news.yahoo.co.jp/articles/d2d6a1adce3b0d91ad341e8aa8dba061700fa999,7/31(木) 7:24
2025-07-31,12:37,business,経済,30,TBS NEWS DIG Powered by JNN,来月の電気・都市ガス代は全社値下がり　東電は169円↓　政府補助金の増額で,18,https://news.yahoo.co.jp/articles/87ad255fe53072b1938dc36cbeac5a1bd9f99a05,7/30(水) 15:37
2025-07-31,12:37,business,経済,31,共同通信,トヨタ、11工場停止に拡大,16,https://news.yahoo.co.jp/articles/c978040e2f8cc2e59c1ab0595adc39952e21c56d,7/31(木) 11:05
2025-07-31,12:37,business,経済,32,共同通信,韓国が米管理の投資案件に50兆円拠出,16,https://news.yahoo.co.jp/articles/d2e21cf23b4774e72b8cc01f26b57b100456c9ba,7/31(木) 7:37
2025-07-31,12:37,business,経済,33,ベストカーWeb,クラウンエステートの納期が最長5か月!! 受注停止していない今が購入のチャンス!? ライバル車と比べて突出する部分はあるのか?,16,https://news.yahoo.co.jp/articles/9317809bd4c29b5c2f4156335739c0e32bc310cf,7/31(木) 11:00
2025-07-31,12:37,business,経済,34,共同通信,日鉄、USスチールの取締役任命　過半が米国籍に,15,https://news.yahoo.co.jp/articles/460a5afc869c297d72ed0be521152e6f8c27ffbd,7/31(木) 11:51
2025-07-31,12:37,business,経済,35,テレビ朝日系（ANN）,【カムチャツカ半島沖地震】津波警報・注意報受け　コンビニ大手約850店舗で一時休業,15,https://news.yahoo.co.jp/articles/9353f37f59e778572d29ce7086d84be6ea27c453,7/30(水) 12:50
2025-07-31,12:37,business,経済,36,THE GOLD ONLINE（ゴールドオンライン）,楽園のはずが地獄でした…〈月15万円〉の家賃収入に対しローン返済は〈月40万円〉。海外に移住した日本人富裕層の悲惨な末路,15,https://news.yahoo.co.jp/articles/3d8dc377eb8ea1547aa9dd4407998e4494eb0a27,7/31(木) 10:01
2025-07-31,12:37,business,経済,37,ハフポスト日本版,若年層の7割、育児・家事は「性別関係ない」。子育て中は“離職意向”の上昇も。妻の企業にフリーライドしない職場づくりを,14,https://news.yahoo.co.jp/articles/4c17a272822fca3124262c5753b22580c56d1f8c,7/31(木) 11:02
2025-07-31,12:37,business,経済,38,ITmedia ビジネスオンライン,不正相次ぐ「日本郵政グループ」　社長交代でも全く喜べない深刻な理由,14,https://news.yahoo.co.jp/articles/e011fefa6006c965d556a4d9e743afd664db9f25,7/31(木) 5:45
2025-07-31,12:37,business,経済,39,東洋経済オンライン,映画「火垂るの墓」が配信開始で「え、ジブリ作品だったの!?」との声が続出中？　レンタルビデオ店が消滅しつつある時代に考える“名作の入口”,14,https://news.yahoo.co.jp/articles/39c7e2a099fd77ce9c9cc224915382f1861efe90,7/31(木) 7:31
2025-07-31,12:37,business,経済,40,読売新聞オンライン,「7月に日本で大災害」流言も影響か…6月の九州への外国人入国者数、4か月ぶりに40万人を割り込む,13,https://news.yahoo.co.jp/articles/d92af702154e908aa88669159685dc227d540eae,7/31(木) 11:25
