scrp_date,scrp_time,genre_en,genre_jp,rank,media_jp,title,comment,link,date_original
2025-09-03,19:07,domestic,国内,1,ABEMA TIMES,「潔白」主張の新浪剛史氏 サプリ購入は「時差ボケ対策」 アメリカ購入は「圧倒的に安い」,660,https://news.yahoo.co.jp/articles/f1203609b133edc9d9ba445cc23fb3b2d1e798e8,9/3(水) 16:03
2025-09-03,19:07,domestic,国内,2,FNNプライムオンライン（フジテレビ系）,【解説】自民・麻生最高顧問が総裁選「前倒し要求」を明言　勢いづく“前倒し要求派”カギ握る「3つの塊」,557,https://news.yahoo.co.jp/articles/fa893914732caa36b930459943a07ee2ac07edd1,9/3(水) 16:27
2025-09-03,19:07,domestic,国内,3,読売新聞オンライン,「氷河期世代」対象の都職員採用試験、倍率５７倍に…募集は２０人,456,https://news.yahoo.co.jp/articles/a7a9c5f7f68dd228073159a608c7d03fea0aa703,9/3(水) 17:34
2025-09-03,19:07,domestic,国内,4,J-CASTニュース,「じゃあ、何のために世論調査してるんですか」　田崎史郎氏の石破首相めぐる発言にジャーナリスト怒る,262,https://news.yahoo.co.jp/articles/6c12ad4a3e02a559b79611f550c2d521d60fa20e,9/3(水) 16:30
2025-09-03,19:07,domestic,国内,5,日テレNEWS NNN,【速報】俳優・清水尋也容疑者（26）逮捕　自宅で乾燥大麻所持の容疑 「間違いありません」 麻薬取締法違反の疑い -警視庁,246,https://news.yahoo.co.jp/articles/97708e0090a9b75a6055beddb6be17841a1db196,9/3(水) 6:27
2025-09-03,19:07,domestic,国内,6,デイリー新潮,ねちねちと新聞記者を詰める「石丸氏」は「かっこいい大人」か…かつて支持した識者も「パワハラ上司が部下を追い詰めているような印象」,243,https://news.yahoo.co.jp/articles/a9c98f86888a9bc22cd5fe0d25e0312141acce27,9/3(水) 6:10
2025-09-03,19:07,domestic,国内,7,FNNプライムオンライン（フジテレビ系）,お供え物を飲み、卒塔婆を振り回す…墓地で迷惑行為　オーストラリア人男性が撮影　大使館が注意喚起　山梨・富士河口湖町,234,https://news.yahoo.co.jp/articles/5a28028187956e7fe424573405e203a438a430e5,9/2(火) 19:12
2025-09-03,19:07,domestic,国内,8,プレジデントオンライン,JAが新米を囲い込み、コメの値段は下がらない…「小泉備蓄米セール」が新米価格にもたらす深刻すぎる代償,225,https://news.yahoo.co.jp/articles/211f739c0e1face93bfdbfc96d6cca6dcded66fc,9/3(水) 17:16
2025-09-03,19:07,domestic,国内,9,デイリースポーツ,Ｘ大荒れ「すげえメンタルだな」「負けるな」東洋大学歴疑惑の市長　不信任可決も→白鳥ボートのお花畑投稿　１６００超コメ殺到「何を呑気に」「今することは？」「メガソーラ不要！」,198,https://news.yahoo.co.jp/articles/fe842e6fdb3155d66af7b918280237ad60fa2197,9/3(水) 16:48
2025-09-03,19:07,domestic,国内,10,読売新聞オンライン,進退、揺れ動く首相…石破氏が虚偽説明　読売「退陣」報道を検証,180,https://news.yahoo.co.jp/articles/934dc19e1a4cf8f552023a054c7221e617f49597,9/3(水) 5:02
2025-09-03,19:07,domestic,国内,11,FNNプライムオンライン（フジテレビ系）,【独自】国土交通省がJALに立ち入り監査　64歳機長が滞在先ホテルで500mlビール3本飲酒し計3便に遅れ,164,https://news.yahoo.co.jp/articles/32c76d739eb2f179c8a3a97c774b13fe6f6c3b5e,9/3(水) 12:01
2025-09-03,19:07,domestic,国内,12,TBS NEWS DIG Powered by JNN,日本航空の機長が滞在先のハワイで飲酒　3便に最大18時間の遅れ　「滞在先では禁酒」決めたにもかかわらず…,145,https://news.yahoo.co.jp/articles/abb47f00f0cce665f211596ecf36038663998dff,9/3(水) 1:12
2025-09-03,19:07,domestic,国内,13,朝日新聞,新浪氏、購入サプリは「CBD」　大麻草由来、成分次第では違法に,141,https://news.yahoo.co.jp/articles/22eb1bb74580660a97b9fc945f72f691f96ca2aa,9/2(火) 20:45
2025-09-03,19:07,domestic,国内,14,毎日新聞,麻生氏が総裁選前倒し要求へ　3日の研修会　派閥議員の行動は縛らず,135,https://news.yahoo.co.jp/articles/63b06c6d483ebaf04cd111f983c52d635bb71586,9/2(火) 22:17
2025-09-03,19:07,domestic,国内,15,朝日新聞,不適切点呼で軽貨物車も処分へ、物流に影響か　国交省が日本郵便に,134,https://news.yahoo.co.jp/articles/153ec4a1e4b2b2bde7d79184a3e6b8d0a3f567d5,9/3(水) 0:00
2025-09-03,19:07,domestic,国内,16,TBS NEWS DIG Powered by JNN,“大麻所持は間違いありません” 俳優・清水尋也容疑者（26）を麻薬取締法違反容疑で逮捕　自宅から大麻のような乾燥植物片や巻紙が見つかる　容疑認める,119,https://news.yahoo.co.jp/articles/a8c3241d18f22003b10d7b26dea930e647e02ecd,9/3(水) 10:05
2025-09-03,19:07,domestic,国内,17,集英社オンライン,「石破政権崩壊カウントダウン、始まる」ただの損得勘定と醜悪な権力闘争の果て…国民そっちのけ、自民党は末期症状か,117,https://news.yahoo.co.jp/articles/5ebc3430387e9e021d61fb40143f10c13da7ad98,9/3(水) 17:30
2025-09-03,19:07,domestic,国内,18,時事通信,自民・麻生氏、消費減税に否定的,105,https://news.yahoo.co.jp/articles/3d8868737fcdde26446081883382ad47b05ed13c,9/3(水) 17:56
2025-09-03,19:07,domestic,国内,19,読売新聞オンライン,世界最大級のアダルトサイトでわいせつ行為生配信、容疑の男女４人逮捕…視聴料など１億円超を得たか,104,https://news.yahoo.co.jp/articles/c737f4907cac2c37d70fb9d802eca43de3bf3b07,9/3(水) 5:00
2025-09-03,19:07,domestic,国内,20,tenki.jp,台風発生へ　4日～5日は西日本～東日本に接近・横断か　東海地方は警報級大雨の恐れ,97,https://news.yahoo.co.jp/articles/54609cd6b1b9f23940435d1044425bb76c72d5e2,9/3(水) 15:22
2025-09-03,19:07,domestic,国内,21,日刊スポーツ,石破茂首相、追い詰められ「何をするか分からない状況に」　衆院解散も？　ジャーナリストが指摘,97,https://news.yahoo.co.jp/articles/83df605ff20628172d748006712010779ad596e8,9/3(水) 18:31
2025-09-03,19:07,domestic,国内,22,デイリースポーツ,田崎史郎氏　両院議員総会で評価ガタ落ちした自民大物幹部の名前「ボクは見苦しいなと思った」「自民党内の信頼厚かったが…」,96,https://news.yahoo.co.jp/articles/a8e7482916f68acd7f563482460456fb65a97f43,9/3(水) 14:46
2025-09-03,19:07,domestic,国内,23,FNNプライムオンライン（フジテレビ系）,国民・玉木代表「中国のプロパガンダに利用されかねず遺憾」　鳩山元首相“抗日勝利80年”軍事パレード出席に苦言「インドでさえ日本に配慮して欠席」,93,https://news.yahoo.co.jp/articles/b71de62cde90ad4c89791b07da568fce475aac42,9/3(水) 14:39
2025-09-03,19:07,domestic,国内,24,J-CASTニュース,学歴詐称疑惑で波紋の伊東市長・田久保真紀氏　不信任決議案可決後初めてのX投稿も「平常運転」,90,https://news.yahoo.co.jp/articles/ceaba94369c668432060bca53c4b0ec66466ba2a,9/3(水) 16:15
2025-09-03,19:07,domestic,国内,25,デイリー新潮,悠仁さま「成年の祝宴」に愛子さまがご欠席の“複雑な事情”　「あまりにお寂しいことです」,84,https://news.yahoo.co.jp/articles/73aba916bb575af21dff56b981929d8d6c124c03,9/3(水) 11:41
2025-09-03,19:07,domestic,国内,26,日刊スポーツ,楽しんご、学歴詐称疑惑の伊東市・田久保真紀市長に声援　「なんか頑張って欲しい！」,82,https://news.yahoo.co.jp/articles/e542703bcb3a02f66dee6a60953ceef149926b01,9/3(水) 8:44
2025-09-03,19:07,domestic,国内,27,tenki.jp,都心など関東の平野部で3日21時頃まで非常に激しい雨のおそれ　線状降水帯が発生か,78,https://news.yahoo.co.jp/articles/2f3c42ee10eb99d4248fa8f66b1d84a47443be25,9/3(水) 12:41
2025-09-03,19:07,domestic,国内,28,共同通信,新潟遠征で生徒7キロ歩かせる　長野・佐久長聖高の女子バスケ部,70,https://news.yahoo.co.jp/articles/a82669264e7bf817094313552216fc86cfc4b722,9/3(水) 15:43
2025-09-03,19:07,domestic,国内,29,朝日新聞,16歳男子高校生、帰宅途中にクマに襲われる　岐阜・中津川,68,https://news.yahoo.co.jp/articles/2c22741823b47f07aeae3809a4bfa3d7821510cc,9/2(火) 22:57
2025-09-03,19:07,domestic,国内,30,FNNプライムオンライン（フジテレビ系）,「イライラした」交際相手の赤ちゃん（生後8カ月）顔殴りけがさせた疑いで21歳男逮捕　事件数日後に頭の骨折れ搬送,65,https://news.yahoo.co.jp/articles/f740df3f4c66163f5d27ec64e250bf29c20f5739,9/3(水) 18:10
2025-09-03,19:07,domestic,国内,31,ABCニュース,自民党分裂前に石破総理に「辞職を」の声も　総裁選前倒し要求は実質「反石破名簿」　麻生氏が署名＆党四役辞意で党内は・・・？,61,https://news.yahoo.co.jp/articles/0dd63853d064c2a402c3bbd498a754582d8eb9b5,9/3(水) 17:41
2025-09-03,19:07,domestic,国内,32,TBS NEWS DIG Powered by JNN,麻生氏 総裁選前倒し“賛成”明言「私自身、書面を提出すると決めている」,57,https://news.yahoo.co.jp/articles/0868313e90b11b96f7421f9a17f5077358185db2,9/3(水) 15:14
2025-09-03,19:07,domestic,国内,33,FNNプライムオンライン（フジテレビ系）,【独自】立憲が11日に両院議員総会開催　新たな党役員人事決定へ幹事長には小川氏の留任案や安住・枝野両氏の起用案も浮上,55,https://news.yahoo.co.jp/articles/9c83f0acdc994c9232d8ce10e16fd5b924f669c4,9/3(水) 14:48
2025-09-03,19:07,domestic,国内,34,TBS NEWS DIG Powered by JNN,【独自】俳優の清水尋也容疑者（26）を麻薬取締法違反容疑で逮捕　けさ6時半ごろに自宅から連行される姿も…　警視庁,53,https://news.yahoo.co.jp/articles/0402b56c1210a5f2d4c02c75c6f29b0da552cbad,9/3(水) 6:22
2025-09-03,19:07,domestic,国内,35,AERA DIGITAL,宅配サービスは高い、タクシー移動もつらい……　「運転免許を返納したら生活できない」　高齢者から上がる悲痛な声,53,https://news.yahoo.co.jp/articles/6fe39a25dc49793789c2b22877f1c24033e97e5d,9/3(水) 6:31
2025-09-03,19:07,domestic,国内,36,日テレNEWS NNN,6日の「成年式」前にリハーサル　悠仁さまと秋篠宮ご夫妻が皇居訪問,51,https://news.yahoo.co.jp/articles/74d97d56f2cb151513420fc2ce0213303d00de08,9/3(水) 16:18
2025-09-03,19:07,domestic,国内,37,デイリー新潮,「日本が移民で埋め尽くされる」騒動の意外な真犯人とは？　ナイジェリア政府による”情報操作”の可能性,47,https://news.yahoo.co.jp/articles/2616e27c5933698ff93bf44f53467367b9afaa3f,9/3(水) 11:42
2025-09-03,19:07,domestic,国内,38,東洋経済オンライン,衆院解散は無理筋、総裁選要求の“顔出し実施”は逆効果…　自民党内で動き出した「石破辞めろ」のヤバすぎる奔流,47,https://news.yahoo.co.jp/articles/eeb8547454029d48b1fc9cd1c18b63dd0805a33d,9/3(水) 13:00
2025-09-03,19:07,domestic,国内,39,日テレNEWS NNN,首相の進退は「しかるべき時期に」……どう受け取る？　総裁選で駆け引きか「政局に持ち込むのはよくない」「ガバナンス示す」,47,https://news.yahoo.co.jp/articles/9bd1bdfb9ac1e44bcdadeab691eb0c104e5ae4da,9/3(水) 10:20
2025-09-03,19:07,domestic,国内,40,FNNプライムオンライン（フジテレビ系）,自民・麻生最高顧問が総裁選前倒しを要求する意向を正式表明　「次期衆院選で勝利できる体制を」,46,https://news.yahoo.co.jp/articles/4e672102495ea7a5280c4ececafb669cbf6c271c,9/3(水) 15:57
