scrp_date,scrp_time,genre_en,genre_jp,rank,media_jp,title,comment,link,date_original
2024-01-08,04:14,domestic,国内,1,FNNプライムオンライン（フジテレビ系）,岸田首相「大変遺憾、重く受け止めている」除名の方針を表明　安倍派・池田衆院議員逮捕,261,https://news.yahoo.co.jp/articles/4a2f58da87207ccfdebb4ee2619cefc32181ae68,1/7(日) 15:33
2024-01-08,04:14,domestic,国内,2,時事通信,地元支援者「裏切られた」　池田議員逮捕に憤り　名古屋,224,https://news.yahoo.co.jp/articles/9e58b40fec8befcc6ca10a4f3c937dd2d738ec3b,1/7(日) 18:41
2024-01-08,04:14,domestic,国内,3,FNNプライムオンライン（フジテレビ系）,【速報】池田佳隆衆議院議員と秘書を逮捕　“裏金”4800万円めぐり虚偽記載か　安倍派政治資金事件,224,https://news.yahoo.co.jp/articles/aa54af4ad9edde84f77dfaa4cec4bf270fdaa86b,1/7(日) 12:19
2024-01-08,04:14,domestic,国内,4,SmartFLASH,「スピード感のかけらもない」能登地震5日たってようやく「非常事態宣言」発令で、馳浩知事にあふれる大ブーイング,215,https://news.yahoo.co.jp/articles/99052a95e9a17b7f8a010f88d69be1beaae1ad20,1/7(日) 15:31
2024-01-08,04:14,domestic,国内,5,TBS NEWS DIG Powered by JNN,【速報】池田佳隆衆院議員を自民党から除名　茂木幹事長「大変遺憾」,190,https://news.yahoo.co.jp/articles/acd48626edbc10631de6217dc2d4843ca51e09ea,1/7(日) 13:42
2024-01-08,04:14,domestic,国内,6,毎日新聞,自衛隊派遣、増員が容易でない背景　能登半島地震と熊本地震の差,149,https://news.yahoo.co.jp/articles/8bbf045f0dfb5ad9d81e287b62f2c29fa7756dfd,1/7(日) 12:18
2024-01-08,04:14,domestic,国内,7,日テレNEWS NNN,【独自】自民党・安倍派、池田佳隆衆議院議員をきょうにも逮捕へ　 派閥のパーティー券めぐる政治資金規正法事件　東京地検特捜部,142,https://news.yahoo.co.jp/articles/cf2cf80e629590aa28549a15ad3efffe880b1ef3,1/7(日) 4:37
2024-01-08,04:14,domestic,国内,8,スポニチアネックス,米山隆一氏　航空機のペット問題、“同席検討論”に私見「そう思う人はチャーター機でどうぞ」,138,https://news.yahoo.co.jp/articles/8e344210f95982c2ab98ebf5254f249bc3fe215a,1/7(日) 9:42
2024-01-08,04:14,domestic,国内,9,日刊スポーツ,米山隆一氏がペット機内同乗意見に「チャーター機でどうぞ…緊急時に巻き添えになるのはご免」,112,https://news.yahoo.co.jp/articles/10bc76d89b3ddea2decd4a1e36506c4938ca3528,1/7(日) 11:27
2024-01-08,04:14,domestic,国内,10,中日スポーツ,池田佳隆議員逮捕、元日のテレビ討論で『安倍派議員の逮捕なし』と発言した田崎史郎さんに逆風「どう言い訳を？」と厳しい意見,105,https://news.yahoo.co.jp/articles/a18967ffd8c45d2ce7c866f3249a7cc894ed7a1b,1/7(日) 16:16
2024-01-08,04:14,domestic,国内,11,読売新聞オンライン,能登地方で警報級の大雪おそれ、国道２４９号通行止め…死者１２８人・避難者２・８万人,101,https://news.yahoo.co.jp/articles/8f56b9308119ce4ea9e7c5114eccaeed8d8dd9fb,1/7(日) 20:03
2024-01-08,04:14,domestic,国内,12,デイリースポーツ,山本太郎氏　岸田首相と馳知事に能登半島の交通コントロールを提案　現在の政府・県の対応を「何も解決されない」と批判,97,https://news.yahoo.co.jp/articles/967f0d2004eea4119e440152640bd31e4065c204,1/7(日) 19:35
2024-01-08,04:14,domestic,国内,13,TBS NEWS DIG Powered by JNN,【速報】岸田内閣の支持率27.1%で過去最低更新　不支持率も過去最高　JNN世論調査,95,https://news.yahoo.co.jp/articles/dd3e3d0d320cba9825f2cce25686c2a83ea4de6e,1/7(日) 23:11
2024-01-08,04:14,domestic,国内,14,FRIDAY,「TENGA」を片手に被災地支援？…煉獄コロアキとガッツchが表明した「衝撃の支援内容」に絶句,93,https://news.yahoo.co.jp/articles/6d2f5ce838b1e0eff4400f52df0921069c517db2,1/7(日) 18:00
2024-01-08,04:14,domestic,国内,15,中日スポーツ,東国原英夫、能登半島地震で現地入りが批判のれいわ新選組・山本太郎に「基本悪い人間ではない」も「非常時は、冷静かつ俯瞰で」と諭す,91,https://news.yahoo.co.jp/articles/9a48f6163edbd26062b76bf8811ce5ddd177894b,1/7(日) 20:37
2024-01-08,04:14,domestic,国内,16,共同通信,岸田首相、政治不信の払拭に決意　派閥のルール策定へ議論,87,https://news.yahoo.co.jp/articles/afd201996d3a565de7dc4e38d2b2b4a12e2bfdee,1/7(日) 10:26
2024-01-08,04:14,domestic,国内,17,時事通信,ガソリン不足、暖取れず　珠洲市の孤立集落　能登地震,87,https://news.yahoo.co.jp/articles/afef300f1fdc26c87621fd3dcc7543b7e6f60357,1/7(日) 7:06
2024-01-08,04:14,domestic,国内,18,スポニチアネックス,岸田首相　遅い少ないの声に「決して少ないということはない」被災者支援で予備費から47億4000万円,86,https://news.yahoo.co.jp/articles/cb2cf90f23f628506b71a33561c31c695450b128,1/7(日) 18:20
2024-01-08,04:14,domestic,国内,19,日刊スポーツ,「国会議員が現地に行くのは当然」れいわ櫛渕議員が山本太郎氏能登入りに言及「総理も行くべき」,81,https://news.yahoo.co.jp/articles/8a1f2b21fe27f8f6fc431dd3b5cd4bc7d56c85d5,1/7(日) 12:09
2024-01-08,04:14,domestic,国内,20,スポニチアネックス,東国原英夫氏　れいわ山本太郎代表の被災地入りに「今、何を優先すべきか分からないかな？」行動を批判,75,https://news.yahoo.co.jp/articles/867766a0203a41f41e544d27bdea95e7e08f8301,1/7(日) 8:47
2024-01-08,04:14,domestic,国内,21,FNNプライムオンライン（フジテレビ系）,【速報】岸田首相 能登半島地震を「特定非常災害」に指定,69,https://news.yahoo.co.jp/articles/1d8ffab1376af7815d0afbccb198571ed122d58a,1/7(日) 14:46
2024-01-08,04:14,domestic,国内,22,SmartFLASH,「防災観念がない」川勝知事、9県合同の被災地支援会議を欠席して新年会…静岡豪雨でも自衛隊派遣3日放置の鈍感力,68,https://news.yahoo.co.jp/articles/9b510ef595a4adfdf57019e4a9590c343591f932,1/7(日) 21:01
2024-01-08,04:14,domestic,国内,23,日テレNEWS NNN,紀子さま、「昭和天皇祭御神楽の儀」と8日の公務取りやめ,67,https://news.yahoo.co.jp/articles/6df455e5e0cf1f17b1755934e859bc5ccbf66e6d,1/7(日) 16:00
2024-01-08,04:14,domestic,国内,24,読売新聞オンライン,次男の遺体は損傷激しく、正月に集まった家族・親族７人なお不明…捜索見つめる男性「希望は捨てていない」,65,https://news.yahoo.co.jp/articles/fb5d78ad574b571da3f3ab1eede6f560ff625e66,1/7(日) 14:28
2024-01-08,04:14,domestic,国内,25,毎日新聞,こんなに早く…　揺れから5分　住民が見た珠洲に押し寄せる津波,63,https://news.yahoo.co.jp/articles/139acaf4c550d3a3e7943fc01bbfe3a033aa0daa,1/7(日) 18:22
2024-01-08,04:14,domestic,国内,26,読売新聞オンライン,紀子さま、皇居での宮中祭祀に予定通り出席…今後の行事や儀式は体調見ながら判断,62,https://news.yahoo.co.jp/articles/a5b5c0d9e33986bc2235f555682f97d0b8ce0cc4,1/7(日) 10:45
2024-01-08,04:14,domestic,国内,27,TBS NEWS DIG Powered by JNN,震度6弱観測点の震度計や設置環境に異常なし　石川県志賀町　気象庁が現地調査,58,https://news.yahoo.co.jp/articles/6f7cab851d4aaf671a5bc22a8fba07571d155857,1/7(日) 19:21
2024-01-08,04:14,domestic,国内,28,東洋経済education×ICT,教職員「精神疾患で休職」最多、学校と企業の決定的な違い　「心を病んでいる人」はもっと多い可能性も,57,https://news.yahoo.co.jp/articles/4e3b925495cead72bc80e26c4424906a3e8b6d09,1/7(日) 8:02
2024-01-08,04:14,domestic,国内,29,日本農業新聞,ビニールハウスで避難生活　能登地震、被災者の疲労ピークに,56,https://news.yahoo.co.jp/articles/39ee9d326e5a7368d33969ec3aed01b2fe4bdbcc,1/7(日) 11:20
2024-01-08,04:14,domestic,国内,30,ABEMA TIMES,“一夫多妻のヒモ男” 第1夫人「1人だけを愛し出したら逆に冷めちゃうと思う」 夫の野望は「徳川家斉の“子ども53人”を超えたい」,55,https://news.yahoo.co.jp/articles/66e7ed49c1fe01c33f8f1608bd7927790556ec36,1/7(日) 11:03
2024-01-08,04:14,domestic,国内,31,毎日新聞,石川県の安否不明者は222人に　12人増える　能登半島地震,54,https://news.yahoo.co.jp/articles/d19db71a0058e4009a5221fc377227a7f0f6f31f,1/7(日) 10:40
2024-01-08,04:14,domestic,国内,32,読売新聞オンライン,体調不良の紀子さま、午後の宮中祭祀は欠席…侍医が外出を控えてほしいと進言,53,https://news.yahoo.co.jp/articles/9358179a62a1baa63699542ab6af18ef2e387952,1/7(日) 17:31
2024-01-08,04:14,domestic,国内,33,スポーツ報知,東国原英夫氏、能登半島地震で現地入りの山本太郎氏をチクリ「今、何を優先すべきか分からないかな？」,48,https://news.yahoo.co.jp/articles/0000f4ba8a04d61c72a76a7dc1c845cde5c53475,1/7(日) 16:25
2024-01-08,04:14,domestic,国内,34,読売新聞オンライン,「能登半島沖」「能登地方」震源の地震５００回超に…住民ら避難所で「眠れない日々」,46,https://news.yahoo.co.jp/articles/8c9925359bb003a8d4e8e404d274e45d55b1f436,1/7(日) 9:43
2024-01-08,04:14,domestic,国内,35,スポニチアネックス,米山隆一氏　吉村知事の万博と能登地震“二者択一でない”に「復興に大量の人員・重機・資材を投入…」,46,https://news.yahoo.co.jp/articles/b7d8f68df51e05dd0975b91d3099add52787cc03,1/7(日) 10:06
2024-01-08,04:14,domestic,国内,36,TBS NEWS DIG Powered by JNN,志賀原発前の海面上に油膜　外部への放射能影響なし　北陸電力,42,https://news.yahoo.co.jp/articles/02a42e48ef12b786da7697459f26eaf32139bd81,1/7(日) 20:39
2024-01-08,04:14,domestic,国内,37,FNNプライムオンライン（フジテレビ系）,「近く挙式の予定だった」 知人らが早すぎる死を悼む　羽田空港衝突事故で犠牲の27歳海保通信士,41,https://news.yahoo.co.jp/articles/e4e3e99fb3791c3779bc3eac374cbcf97d33e5b9,1/7(日) 6:46
2024-01-08,04:14,domestic,国内,38,毎日新聞,海保機・副機長も管制指示誤認か　運輸安全委など調査　羽田衝突,40,https://news.yahoo.co.jp/articles/0e3db1004f842dd370cc990d4fc89a1a277e631f,1/7(日) 18:36
2024-01-08,04:14,domestic,国内,39,ハフポスト日本版,「女性として生まれた。でも振袖は着たくない」Xジェンダーが“メンズスーツ”を作り、成人式を開くまで,38,https://news.yahoo.co.jp/articles/4a856b786fdd031265287beb918b59069820ac51,1/7(日) 17:24
2024-01-08,04:14,domestic,国内,40,よろず～ニュース,ヘリで能登訪問の高須克弥院長「飲み食いしない」などボランティアの「最低限のマナー」５項目紹介,38,https://news.yahoo.co.jp/articles/8c61b4185b86e5f70a672176cfb2669a046bfdba,1/7(日) 11:51
