scrp_date,scrp_time,genre_en,genre_jp,rank,media_jp,title,comment,link,date_original
2024-06-27,07:19,TTL,総合,1,毎日新聞,河野太郎氏、自民総裁選出馬に意欲　麻生太郎氏に伝達,534,https://news.yahoo.co.jp/articles/b56f665c211a6a3bd3c1f3828087c554b4491e9b,6/26(水) 22:44
2024-06-27,07:19,TTL,総合,2,TBS NEWS DIG Powered by JNN,【速報】財務省・神田財務官「行き過ぎた動きには必要な対応」市場をけん制　37年半ぶり1ドル＝160円40銭円安水準で,233,https://news.yahoo.co.jp/articles/58b3890c55d31408a30713e6af421e5412baf11d,6/26(水) 22:22
2024-06-27,07:19,TTL,総合,3,夕刊フジ,石丸伸二氏の人気〝ホンモノ〟か　都知事選で台風の目「政策にブレがない」集まる聴衆　ネットで「動員」と指摘も…陣営を直撃！,201,https://news.yahoo.co.jp/articles/ad32f8d502659a0c991e4af1e655ad1179684433,6/26(水) 17:00
2024-06-27,07:19,TTL,総合,4,デイリースポーツ,小池百合子氏に蓮舫氏がパー券質問　曖昧回答に石丸伸二「イエスかノーかで」もはぐらかす「ボロ出ちゃった」「逃げの一手」,184,https://news.yahoo.co.jp/articles/2fba2d3e2ace03e0b2f39e5e6eacbfef74317f79,6/26(水) 22:01
2024-06-27,07:19,TTL,総合,5,TBS NEWS DIG Powered by JNN,【速報】円相場1ドル＝160円39銭　38年ぶりの円安水準更新で為替介入への警戒感高まる,177,https://news.yahoo.co.jp/articles/8e9ec32ee9ac1a7546e4c6377822c6cb6d7b9b3b,6/26(水) 18:37
2024-06-27,07:19,TTL,総合,6,みんかぶマガジン,蓮舫「2位もダメで3位転落の危機」都知事選…石丸猛追「国政の代理戦争など馬鹿げたマネは是非やめてもらいたい」,155,https://news.yahoo.co.jp/articles/a42522e116b85b51f2411d31db6d33b43a0e7af9,6/26(水) 9:10
2024-06-27,07:19,TTL,総合,7,京都新聞,「修学旅行受け入れたら赤字に」京都のホテルや旅館、想定外の物価高に悲鳴,151,https://news.yahoo.co.jp/articles/9a10fd0f6bdc221c588f079db0e7820475374560,6/26(水) 10:32
2024-06-27,07:19,TTL,総合,8,SmartFLASH,「黙って待てない人は来ないで」ラーメン二郎店主の苦言に「客はどこまで神様なのか」論争勃発…現役ジロリアンの見解は,147,https://news.yahoo.co.jp/articles/d7a20a23cdb3a44163f18b001887f6a176609e35,6/26(水) 19:50
2024-06-27,07:19,TTL,総合,9,デイリー新潮,「保険証を廃止すれば事故は増える」　マイナ保険証で死亡トラブルが…河野大臣は厚労省に責任転嫁,139,https://news.yahoo.co.jp/articles/756751a8cab28567b724049bdf665e83a104b35d,6/27(木) 6:07
2024-06-27,07:19,TTL,総合,10,産経新聞,パリ五輪　エアコンなしの「エコ選手村」付き合えない…　日米英など自前調達,134,https://news.yahoo.co.jp/articles/65da59600fa63504c20e03d192bf419a4db0d7cb,6/26(水) 12:56
2024-06-27,07:19,TTL,総合,11,テレビ朝日系（ANN）,【独自】ブックオフ　架空買取などの疑い　一部店舗であすから休業・営業時間変更へ,131,https://news.yahoo.co.jp/articles/cb3dd6746bfd5e277949615ab255fdddc7c8be9e,6/26(水) 17:30
2024-06-27,07:19,TTL,総合,12,琉球新報,ドクターヘリから窓の一部が落下　重さ350グラムと100グラム、名護市上空を飛行中に破損　被害情報なし　沖縄,126,https://news.yahoo.co.jp/articles/b5c32a4bc38de94f7601df4e97fc4eb01b9cf00b,6/27(木) 5:41
2024-06-27,07:19,TTL,総合,13,女性自身,佳子さまら女性皇族をますます「結婚できない」状況に…天皇陛下も“ご苦言”呈された「岸田首相の大失態」,125,https://news.yahoo.co.jp/articles/caf809737672c769bb97cadac4aed6e661a21d8f,6/27(木) 6:00
2024-06-27,07:19,TTL,総合,14,MBSニュース,【独自】電動スーツケース全国初の摘発　中国籍の留学生女性を書類送検「乗って移動できる」が公道走行は不可,121,https://news.yahoo.co.jp/articles/debe51149c8e77dcdc49641e64de9a80fb809301,6/26(水) 11:58
2024-06-27,07:19,TTL,総合,15,FNNプライムオンライン,富士山山頂で3人死亡　山小屋閉鎖、残雪…閉山中の登山の危険性　山梨県側の八合目付近で意識失い死亡したプロクライマーは病死か,112,https://news.yahoo.co.jp/articles/585fda017d73f6230727324acb676195f5ad0e9d,6/26(水) 20:07
2024-06-27,07:19,TTL,総合,16,ＡＴＶ青森テレビ,「捕獲か射殺しないと『人間は怖くないんだ』という遺伝子が残ってしまう」青森・クマによる女性死亡事故　救出に当たったハンターが警鐘　「音を鳴らせばクマが離れる」過信しないで,109,https://news.yahoo.co.jp/articles/244f78d2d01dd98f94aa27f4f6c354a6549b2f7a,6/27(木) 6:02
2024-06-27,07:19,TTL,総合,17,SmartFLASH,「うるせぇ！」キムタクが『Believe』大盛り上がりの打ち上げで怒鳴ったワケ…現場スタッフは“男気”に感心,104,https://news.yahoo.co.jp/articles/2b7efa52df4c929904da4617895256be8e306559,6/26(水) 17:45
2024-06-27,07:19,TTL,総合,18,ベースボールキング,西武は痛恨走塁ミスでサヨナラならずも解説陣からは“気の毒”の声　真中氏「長谷川選手はもうやむを得ない」,92,https://news.yahoo.co.jp/articles/db42b13e02725b0934e96d4b4ec848d5f2436193,6/27(木) 6:20
2024-06-27,07:19,TTL,総合,19,BSS山陰放送,路線バス発車直後に乗客が「降ります」…停止した際に乗客が料金箱で腕を打ちケガ,91,https://news.yahoo.co.jp/articles/4dda87714019f573089229b63cda7861342e3b8b,6/27(木) 6:24
2024-06-27,07:19,TTL,総合,20,テレビ朝日系（ANN）,“大葉”と“しそ”何が違う？同じと思ってる人多いみたいですが…実は「明確な違い」,88,https://news.yahoo.co.jp/articles/71bc9c4be5b21bd519f6baab25f6ae82ad7fe44d,6/26(水) 20:03
2024-06-27,07:19,TTL,総合,21,SmartFLASH,「意味ないものを口にするな」GACKTが食へのこだわり披露も「無駄こそが人生を豊かにする」疑問の声多数,82,https://news.yahoo.co.jp/articles/2080f4bf3f269d986a6705ad12acf289f7e883cb,6/26(水) 18:44
2024-06-27,07:19,TTL,総合,22,朝日新聞デジタル,38年ぶりの円安水準に　一時1ドル160円台、為替介入の警戒再び,77,https://news.yahoo.co.jp/articles/2e24fd1649eb202e550785718665d216865b58f6,6/26(水) 18:55
2024-06-27,07:19,TTL,総合,23,デイリースポーツ,おかもとまりさん「宗教団体設立」を発表「教祖として理念を守り活動頑張ります」,75,https://news.yahoo.co.jp/articles/7e8decc027b7743b4778dd8daa8c177c46b2690b,6/26(水) 15:37
2024-06-27,07:19,TTL,総合,24,文春オンライン,悪びれることなくホテルから銀の食器を何度も……小池百合子都知事、知られざるカイロ時代の素顔,73,https://news.yahoo.co.jp/articles/1f9da07667b7103906f9b12db7a3aa989409383e,6/27(木) 6:12
2024-06-27,07:19,TTL,総合,25,TBS NEWS DIG Powered by JNN,「産後ケアできなくならぬよう」出産費用の保険適用検討会で本格的な議論開始　負担軽減への期待も産科から“不安の声”,72,https://news.yahoo.co.jp/articles/451dd9c2ea7f6acae36e951c86344f28513d616c,6/26(水) 17:25
2024-06-27,07:19,TTL,総合,26,テレビ朝日系（ANN）,【続報】富士山火口付近で3人死亡　行方不明の男性捜索中に　身元の確認急ぐ,72,https://news.yahoo.co.jp/articles/d5fce865990f21b2d2c1e6d13885c02a12bbc7a5,6/26(水) 13:50
2024-06-27,07:19,TTL,総合,27,文春オンライン,小池百合子都知事の実兄が告白70分「妹はカイロでたらいに水張って足突っ込んで勉強していた」「僕は政府転覆のためにモンゴルへ」,71,https://news.yahoo.co.jp/articles/14f37d060047844b29006975e101ac18424a4f0d,6/26(水) 16:12
2024-06-27,07:19,TTL,総合,28,NBS長野放送,【速報】30代の娘が60代の父親を刺す　搬送先で死亡　体に複数の刺し傷　娘を殺人未遂の疑いで逮捕,69,https://news.yahoo.co.jp/articles/cd802a02466cc47db6e47f85795f6adcb6b37da4,6/26(水) 18:51
2024-06-27,07:19,TTL,総合,29,デイリー新潮,「県警批判をしたら仕返しにワナにはめられかけた」　元産経記者の経験した「警察の怖ろしさ」,68,https://news.yahoo.co.jp/articles/6406d2948ee509ec65ea4c2fe96237b0bd8f6918,6/27(木) 6:19
2024-06-27,07:19,TTL,総合,30,オリコン,デーモン閣下、早期のがん手術を公表「寒い季節にならないうちには元気な姿で」「がん検診に行くべし！」【報告全文】,68,https://news.yahoo.co.jp/articles/3e1ce0e2073269e53c4336f7d7f7add5e822116a,6/26(水) 18:09
2024-06-27,07:19,TTL,総合,31,デイリー新潮,「霜降り明星」「四千頭身」「EXIT」…「お笑い第7世代」は“オワコン化”したのか？　現役テレビ局員が明かす「彼らのテレビ露出が減っている本当の理由」,67,https://news.yahoo.co.jp/articles/51a944db1186466f79a427ea6155a5098a7d4d14,6/27(木) 6:10
2024-06-27,07:19,TTL,総合,32,共同通信,意識不明の邦人男性死亡　伊でけんか仲裁、地元紙,66,https://news.yahoo.co.jp/articles/dfeedcb7701bf6291b1fd7f508d509e0989e6f2e,6/26(水) 21:32
2024-06-27,07:19,TTL,総合,33,日刊スポーツ,知事選辞退へずまりゅう怒り「俺を舐めるのも大概にしろよ？俺みたいな大物インフルエンサーと」,66,https://news.yahoo.co.jp/articles/64f9128de48fbe318dccb8caf80dfcd42a3c3513,6/26(水) 14:53
2024-06-27,07:19,TTL,総合,34,スポニチアネックス,石丸伸二氏陣営が“ネット工作”を完全否定「一切関係ない」　動画撮影の依頼が出回り声明,64,https://news.yahoo.co.jp/articles/14c53c6be6dc517e597efeb4174b94d4519c2d62,6/26(水) 14:36
2024-06-27,07:19,TTL,総合,35,中日スポーツ,中日・中田翔、抹消受け「すごく情けない」6月は打率1割、2打点「また一からやっていきたい」,62,https://news.yahoo.co.jp/articles/6a04cf9c11da81e1226a89c60468b09a5478c0f7,6/26(水) 18:00
2024-06-27,07:19,TTL,総合,36,デイリースポーツ,阪神痛恨　サヨナラ機逃す　１死満塁で無得点に甲子園重いため息　森下２つ目の死球から絶好機も,61,https://news.yahoo.co.jp/articles/29369e96f3a23073000dbd0a73cad2c14ec4a054,6/26(水) 20:57
2024-06-27,07:19,TTL,総合,37,スポニチアネックス,巨人が坂本勇人の出場選手登録を抹消　今季初　本人は危機感「リフレッシュとか言っている場合じゃない」,61,https://news.yahoo.co.jp/articles/583cc236a53a46c10038bc54396e2c169447e815,6/26(水) 15:23
2024-06-27,07:19,TTL,総合,38,現代ビジネス,都知事選の政見放送を見て呆然…「NHKvs.NHK党」必死の攻防戦と、ここまで無秩序になった「歴史の必然」,60,https://news.yahoo.co.jp/articles/a305f0eb9f4e3a2272e84265a6f7ce1bbad73e41,6/27(木) 6:05
2024-06-27,07:19,TTL,総合,39,東スポWEB,【阪神】岡田監督が〝サイン無視〟の前川右京に罰金　二塁打放った９回の第４打席の５球目は「待てやん」,59,https://news.yahoo.co.jp/articles/924a2cabe17383b93bc3d79bff7ca7ca9e537bf3,6/27(木) 0:26
2024-06-27,07:19,TTL,総合,40,デイリー新潮,【異常事態】都知事選ポスターに常識や良識の欠片もない人が次々登場するのはなぜか　専門家は「ネットの影響大。β版ビジネスのせい」,58,https://news.yahoo.co.jp/articles/7796289c01804657a279b4306006cfecb4e28ded,6/27(木) 6:01
