scrp_date,scrp_time,genre_en,genre_jp,rank,media_jp,title,comment,link,date_original
2025-09-13,13:08,sports,スポーツ,1,スポニチアネックス,阪神・藤川監督　CS不要論を一蹴！「ファンが熱くなれるものをなくしてどうするんですか」,289,https://news.yahoo.co.jp/articles/44ce7217b03af78ce80417330f49914ee0962a85,9/13(土) 5:15
2025-09-13,13:08,sports,スポーツ,2,THE ANSWER,ロコ・ソラーレ五輪消滅　藤澤五月は涙…3大会連続出場ならず　フォルティウスがタイブレーク勝利【日本代表決定戦】,246,https://news.yahoo.co.jp/articles/3fbb626461a691ca96e2f1c5a4fe94e13bb85d83,9/13(土) 9:41
2025-09-13,13:08,sports,スポーツ,3,Number Web,ソフトバンク電撃移籍で批判されて…上沢直之が明かす“当時の胸中”「厳しい目で見られるのは自覚していた」アメリカで投球フォーム崩壊…復活するまで,164,https://news.yahoo.co.jp/articles/14470289a7403e04eacd8b31ffb6b55fcd4aa2ca,9/13(土) 11:05
2025-09-13,13:08,sports,スポーツ,4,文春オンライン,「CS進出争いどころではない」楽天・三木肇監督（48）に囁かれる“1年限り退任の噂”と後任本命“元メジャーリーガーの実名”とは,160,https://news.yahoo.co.jp/articles/d9f2aa080e067129ba390184f2a3bdba14f4f2cb,9/13(土) 7:12
2025-09-13,13:08,sports,スポーツ,5,文春オンライン,年俸が高いだけで、スターとは呼べない…江本孟紀が「村上宗隆」「坂本勇人」「山川穂高」ら高額プレーヤーに感じる「圧倒的な物足りなさ」,124,https://news.yahoo.co.jp/articles/f5141b9fa5ed5eed1c16c556e71c7c408dfd544f,9/13(土) 11:12
2025-09-13,13:08,sports,スポーツ,6,Number Web,「なぜ建設的な批判をしない？」日本代表アメリカ戦完敗と“OB解説”をブラジル人記者が斬る「170cmナガトモのCBはさすがに無理」,74,https://news.yahoo.co.jp/articles/e9eafee70a3d496ab5185f8f06c8282deafbd235,9/13(土) 11:11
2025-09-13,13:08,sports,スポーツ,7,東スポWEB,【Ｆ１】角田裕毅に選択肢なし　アルピーヌが周冠宇と中国の吉利汽車と交渉中でスポンサー料３０億円？,73,https://news.yahoo.co.jp/articles/0a36f4b879413b85a1bd90f0a7766a24ce36be12,9/13(土) 12:31
2025-09-13,13:08,sports,スポーツ,8,RONSPO,角田裕毅にWショック！来季の移籍先候補だったアルピーヌが19歳のダンに関心を示し、レッドブル重鎮はもう内部昇格を示唆…来季F1に居場所がなくなる懸念,73,https://news.yahoo.co.jp/articles/ae79586d0b73ca871b35525af7d71a3437ffa9aa,9/13(土) 6:00
2025-09-13,13:08,sports,スポーツ,9,CoCoKARAnext,中日5位転落、遠のくCS進出…背景にある「勝負どころの9月の失速」「エースの不振」,70,https://news.yahoo.co.jp/articles/0a514a3af453b9c6d1c7726583c9ed54144133c0,9/13(土) 12:16
2025-09-13,13:08,sports,スポーツ,10,フットボールチャンネル,「日本はあって韓国の名前はない」海外メディアがW杯優勝確率TOP20を発表。韓国メディアはサッカー日本代表の選出に衝撃を隠せず,70,https://news.yahoo.co.jp/articles/50564f56d7239658fe46273e17a7f61a9eba62e4,9/13(土) 8:11
2025-09-13,13:08,sports,スポーツ,11,TBS NEWS DIG Powered by JNN,男子35km競歩、勝木隼人が過酷レース乗り越え銅メダル！日本勢メダル第1号、川野将虎は執念の“完歩”で18位【東京世界陸上】,69,https://news.yahoo.co.jp/articles/e065b5d7e961a86296945e63524185ce89c431e0,9/13(土) 9:59
2025-09-13,13:08,sports,スポーツ,12,デイリー新潮,150億円で「WBC」放送権を獲得…ネトフリが次に狙うのは？　「ドジャース戦などMLB中継が危うい」,69,https://news.yahoo.co.jp/articles/41eba6c61199101685cace023dbd22e90e770fd3,9/13(土) 10:50
2025-09-13,13:08,sports,スポーツ,13,Full-Count,巨人が門脇、中日はブライトを抹消　2軍で打率.300の鵜飼が昇格…13日の公示,62,https://news.yahoo.co.jp/articles/c738743adb7902ef82f704c045e0b6f1d1807de7,9/13(土) 12:06
2025-09-13,13:08,sports,スポーツ,14,中日スポーツ,中日・ブライト健太、登録抹消　代わりに鵜飼航丞が昇格,60,https://news.yahoo.co.jp/articles/5c2f771ba1a068862d9d66fa5ef83aa9d912af10,9/13(土) 12:22
2025-09-13,13:08,sports,スポーツ,15,中日スポーツ,中日・鵜飼航丞、１軍合流 ウエスタンでは７本塁打、打率３割と好調,56,https://news.yahoo.co.jp/articles/b4647ae39c0a3fa856ddfddd61bdaa73324f12df,9/13(土) 11:26
2025-09-13,13:08,sports,スポーツ,16,デイリースポーツ,フォルティウスが決勝へ　宿敵ロコに４年前の雪辱！五輪の夢繫ぐ　吉村が好ショット連発「ロコ・ソラーレさんに成長させてもらった」ＳＣ軽井沢クと決戦,55,https://news.yahoo.co.jp/articles/5aa5b8ffb995f7469bad83d46b2f2844267b1df4,9/13(土) 9:44
2025-09-13,13:08,sports,スポーツ,17,スポーツ報知,山本由伸、５回まで１安打＆７奪三振の快投　初回に失策絡みで失点も…味方の援護なくバーランダーの前に１安打無得点　大谷は２打数ノーヒット,52,https://news.yahoo.co.jp/articles/0d259298742700e70c3cf4ba910160b3c555eaee,9/13(土) 12:35
2025-09-13,13:08,sports,スポーツ,18,TBS NEWS DIG Powered by JNN,【中日】大惨敗で5位転落＆借金ワーストタイ”13”...22度目零敗で2連敗 9安打9残塁 柳4回6失点KO3敗目 暴投、悪送球×2...ミス連発,51,https://news.yahoo.co.jp/articles/c5c9f252bc66b1b151fc7e0f8ea481693a09479f,9/12(金) 21:11
2025-09-13,13:08,sports,スポーツ,19,Full-Count,12球団最強の“.305＆148”…広島25歳が「エグすぎる」　完全覚醒に高まる期待,50,https://news.yahoo.co.jp/articles/5dabd5bc2d9f8fcfd53b172054d75ec635e170bb,9/13(土) 12:30
2025-09-13,13:08,sports,スポーツ,20,デイリースポーツ,巨人　本塁打王４度の最強助っ人が東京ドームに登場！５７歳になった今でも若々しい姿　二岡ヘッドと談笑　いてまえ打線の中軸としても活躍,50,https://news.yahoo.co.jp/articles/7f95820b7f07b71bb5921824c088a6094d20b314,9/13(土) 10:54
2025-09-13,13:08,sports,スポーツ,21,スポニチアネックス,ド軍指揮官　佐々木朗希は救援起用でも受け入れる意向「本人にとっては全く新しい役割で大きな挑戦」,47,https://news.yahoo.co.jp/articles/ffc7619b446a731a53d5ac39006de869363f4ed0,9/13(土) 11:41
2025-09-13,13:08,sports,スポーツ,22,CoCoKARAnext,助っ人移籍最前線　DeNA30歳助っ人左腕は争奪戦必至か　光る1.83、虎キラーぶりも話題　球界屈指の助っ人布陣…「色々、大きく動きそうだな」,46,https://news.yahoo.co.jp/articles/4774ada8323994c880c7848d1d3f98c3b85683e0,9/13(土) 11:33
2025-09-13,13:08,sports,スポーツ,23,THE ANSWER,有森裕子会長、涙の会見「泣かないつもりでしたが…」　あす東京世界陸上が開幕、一言目から声震わせ感激,44,https://news.yahoo.co.jp/articles/983e72325fbcfccd2fd849735b698f2dcb726bc8,9/12(金) 13:30
2025-09-13,13:08,sports,スポーツ,24,日刊スポーツ,シード権喪失危機の渋野日向子が大失速の予選落ち「すごく悔しい。気持ちの問題」今季残り３試合,43,https://news.yahoo.co.jp/articles/978ef2ca1d446d221cde41f38e4bf99450b52918,9/13(土) 11:16
2025-09-13,13:08,sports,スポーツ,25,スポーツ報知,【巨人】ドラフト２位・浦田俊輔が１軍へ合流　イースタン・リーグで２０盗塁で約４か月ぶりに再昇格,43,https://news.yahoo.co.jp/articles/ccf6e3556cfaaa6bfee3d639e5f1e7476602955a,9/13(土) 11:31
2025-09-13,13:08,sports,スポーツ,26,東スポWEB,ＭＬＢ最高給取りのメッツ・ソト　酷評の嵐から称賛へ「素晴らしい働き」「これ以上何を求める」,42,https://news.yahoo.co.jp/articles/1af49d5e7647263597b2a1906fb08388e54eba88,9/13(土) 11:45
2025-09-13,13:08,sports,スポーツ,27,THE ANSWER,井上尚弥＆アフマダリエフが計量一発パス！　異例の一般公開に1500人超集結…決戦ボディに大歓声,41,https://news.yahoo.co.jp/articles/79c884a6d08c4cb4f2d05cd3ec5efa1e471a084c,9/13(土) 12:03
2025-09-13,13:08,sports,スポーツ,28,Full-Count,ド軍戦3時間前…まさかの発表に落胆「ダメなんか」　山本由伸が登板も「またいない」,41,https://news.yahoo.co.jp/articles/616479ac3cce91e815e71c9522426d06fa8d2da0,9/13(土) 8:35
2025-09-13,13:08,sports,スポーツ,29,サンケイスポーツ,阪神・藤川球児監督、CS不要論に「やらなきゃいけない」ときっぱり　ファンが熱くなれるものをなくしてどうする－　巨人・阿部慎之助監督の発言にも「たぎるよね」と燃えた,40,https://news.yahoo.co.jp/articles/15ff2fb14bc259969638b7af68fcf40d92751190,9/13(土) 7:30
2025-09-13,13:08,sports,スポーツ,30,東スポWEB,【カーリング】ロコ・ソラーレが終戦　フォルティウスに敗戦でミラノ五輪への道が消滅,39,https://news.yahoo.co.jp/articles/8592e4579977b617dc0871b788c2798c2663a20a,9/13(土) 10:01
2025-09-13,13:08,sports,スポーツ,31,デイリースポーツ,佐々木朗希、マイナー“追試登板”決定　異例の6度目調整　前回最速161・9キロもふくらはぎに異変　地元紙記者「少なくともあと1試合先発すると監督が言った」,38,https://news.yahoo.co.jp/articles/bc8668ce2c7fd4b5f00652bef521f3ac148246ba,9/13(土) 9:19
2025-09-13,13:08,sports,スポーツ,32,ENCOUNT,【BreakingDown】中年男性がプロ格闘家にいきなりパンチ　ネットドン引き「情緒不安定な危ないオヤジ」,37,https://news.yahoo.co.jp/articles/fb34efb7a353264931dd24cb76916f946c7dbb5e,9/13(土) 11:22
2025-09-13,13:08,sports,スポーツ,33,サンケイスポーツ,巨人・門脇誠が右臀部痛で登録抹消　D2位・浦田俊輔が緊急昇格,36,https://news.yahoo.co.jp/articles/75abfea3bc804a07b469bccffa2822fc31621971,9/13(土) 12:17
2025-09-13,13:08,sports,スポーツ,34,デイリースポーツ,傷心の阪神・才木を支えた言葉　優勝決定日に危険球退場→村上が、近本が、坂本が、対戦相手の大瀬良も,36,https://news.yahoo.co.jp/articles/1bc26f3ce937d1b6fbada98c5b61f91641b2d6df,9/13(土) 8:00
2025-09-13,13:08,sports,スポーツ,35,週刊女性PRIME,長期休養宣言の羽生結弦、「来年の春まで」が意味するものと後輩たちへのメッセージ,35,https://news.yahoo.co.jp/articles/9fe06bdf98b278ae4ead5d74f32b3a89348cb935,9/13(土) 11:01
2025-09-13,13:08,sports,スポーツ,36,スポーツ報知,元大関・御嶽海の母、マルガリータさん死去…息子に投げキス、熱烈な応援姿がテレビで人気,35,https://news.yahoo.co.jp/articles/8652dfcac48fe69f2d9a0bbb9d24d7546445a299,9/13(土) 5:50
2025-09-13,13:08,sports,スポーツ,37,デイリースポーツ,ロコ・ソラーレ、３大会連続五輪逃す　藤沢涙止まらず、吉田知は「さっちゃん、ありがとう」フォルティウスに完敗　神がかり的勝負強さ影潜め,34,https://news.yahoo.co.jp/articles/cf2b289306fcc8c599c9b314fb45bd69c427c3df,9/13(土) 9:42
2025-09-13,13:08,sports,スポーツ,38,中日スポーツ,中日・井上監督「ボロ負けした次の日の試合…」3位DeNAまで5・5ゲーム差、コーチ陣に伝えた言葉,34,https://news.yahoo.co.jp/articles/05333fec780e99edc42a100602f563848e2e8653,9/13(土) 5:45
2025-09-13,13:08,sports,スポーツ,39,スポニチアネックス,珍事！ヤクルト内野手・北村拓己が9回から登板　神宮騒然　1失点も役目果たす　巨人時代以来2度目,34,https://news.yahoo.co.jp/articles/d0142cb64e5ee9d1893ab8386f080eed5c0d33b7,9/12(金) 20:55
2025-09-13,13:08,sports,スポーツ,40,THE ANSWER,男女混合4×400mリレー日本、サプライズ決勝進出！　予選敗退→他国失格で繰り上がり…選手は絶叫＆涙「なんも言えない」【東京世界陸上】,33,https://news.yahoo.co.jp/articles/0d9957e5768c42d6e42459edeeba8e8a880bd0b4,9/13(土) 12:09
